{"link": "https://www.themoviedb.org/tv/78842?language=en", "title": "Forged in Fire: Knife or Death", "resume": "The country's most experienced bladesmiths, martial artists and knife experts slice, stab and chop their way through a blade-shattering gauntlet for a chance at winning a $20,000 grand prize.", "rate": 0, "genre": ["Reality", "Documentary"], "cast": ["Bill Goldberg"], "character": ["Himself - Host"], "site_data": "html Apps Forums Leaderboard Contribute API Support Discover Movies TV Shows Movies Popular Top Rated Upcoming Now Playing TV Shows Popular Top Rated On TV Airing Today People Popular People Can't find a movie or TV show? Login to create it. en Login Sign Up  ID: 78842   Expand Forged in Fire: Knife or Death   (2018) User Score  Play Trailer Overview The country's most experienced bladesmiths, martial artists and knife experts slice, stab and chop their way through a blade-shattering gauntlet for a chance at winning a $20,000 grand prize. Discussions   Reviews Videos   Images   Changes Report Share Discussions General  0 Content Issues  1 Images Backdrops  1 Posters  1 Videos Trailers  1 Teasers  0 Clips  0 Featurettes  0 Opening Credits  0 Top Billed Cast Bill Goldberg Himself - Host Full Cast & Crew Current Season Season 1 2018 | 6 Episodes Season 1 of Forged in Fire: Knife or Death premiered on April 17, 2018. View All Seasons Social Reviews  0 Discussions  1 Subject Status Replies Last Reply There are no discussions for Forged in Fire: Knife or Death. Login to be first! Go to Discussions Media Most Popular Videos  1 Backdrops  1 Posters  1 Recommendations We don't have enough data to suggest any TV shows based on Forged in Fire: Knife or Death. You can help by rating TV shows you've seen. Facts Status  Returning Series Network Certification TV-PG Meaning This program contains material that parents may find unsuitable for younger children. Type  Reality Original Language  English Runtime  43m Homepage   https://www.history.com/shows/forged-in-fire-knife-or-death Genres Reality Documentary Keywords No keywords have been added. Content Score 64 We're so close, yet so far. Top Contributors a 12 ajag1 10 Elizabeth Jennings 1 oldboy3 1 RonKing  View Edit History Popularity Trend  Login to edit  URL By  signing up  for an account on TMDb, you can post directly to Twitter and Facebook. You need to be logged in to continue. Click  here  to login or  here  to sign up.    page_wrap opened in html_head  Join the Community The Basics About TMDb Contact Us Support Forums API Blog Get Involved  Contribution Bible 3rd Party Applications Add New Movie Add New TV Show Community Guidelines Leaderboard Forums Twitter Facebook Legal Terms of Use Privacy Policy Login Sign Up"}