{"link": "https://www.themoviedb.org/tv/62140?language=en", "title": "Luna", "resume": "We don't have an overview translated in English. Help us expand our database by adding one.", "rate": 0, "genre": ["Drama", "Fantasy"], "cast": ["Lydia Velezheva", "Anatoly Kot", "Darya Novoseltseva", "Sergei Strelnikov", "Kseniya Lavrova-Glinka"], "character": ["Ekaterina Panina", "Nikolai Panin", "Anastasia Panina", "Roman Sokolov", "Marina Sokolova"], "site_data": "html Apps Forums Leaderboard Contribute API Support Discover Movies TV Shows Movies Popular Top Rated Upcoming Now Playing TV Shows Popular Top Rated On TV Airing Today People Popular People Can't find a movie or TV show? Login to create it. en Login Sign Up  ID: 62140   Expand Luna   (2015) User Score Overview We don't have an overview translated in English. Help us expand our database by adding one. Featured Crew Nikolay Sarkisov Creator Discussions   Reviews Videos   Images   Changes Report Share Discussions General  0 Content Issues  0 Images Backdrops  1 Posters  1 Videos Trailers  0 Teasers  0 Clips  0 Featurettes  0 Opening Credits  0 Top Billed Cast Lydia Velezheva Ekaterina Panina Anatoly Kot Nikolai Panin Darya Novoseltseva Anastasia Panina Sergei Strelnikov Roman Sokolov Kseniya Lavrova-Glinka Marina Sokolova Full Cast & Crew Last Season Season 1 2015 | 30 Episodes Season 1 of Luna premiered on February  2, 2015. View All Seasons Social Reviews  0 Discussions  0 Media Most Popular Videos  0 Backdrops  1 Posters  1 Recommendations We don't have enough data to suggest any TV shows based on Luna. You can help by rating TV shows you've seen. Facts Original Name  \u041b\u0443\u043d\u0430 Status  Returning Series Network Certification 16+ Meaning Only teens the age of 16 or older can watch. Type  Scripted Original Language  Russian Runtime  48m Homepage   http://ctc.ru/rus/projects/serials/luna/ Genres Drama Fantasy Keywords No keywords have been added. Content Score 86 Almost there... Top Contributors G 42 G_Keeper 18 Elizabeth Jennings 2 mrtextortexel  View Edit History Popularity Trend  Login to edit  URL By  signing up  for an account on TMDb, you can post directly to Twitter and Facebook. You need to be logged in to continue. Click  here  to login or  here  to sign up.    page_wrap opened in html_head  Join the Community The Basics About TMDb Contact Us Support Forums API Blog Get Involved  Contribution Bible 3rd Party Applications Add New Movie Add New TV Show Community Guidelines Leaderboard Forums Twitter Facebook Legal Terms of Use Privacy Policy Login Sign Up"}