{"link": "https://www.themoviedb.org/tv/2601?language=en", "title": "Takin' Over the Asylum", "resume": "A salesman starts to run a hospital radio station inside a facility for people with mental heath needs.", "rate": 80, "genre": ["Comedy", "Drama"], "cast": ["David Tennant", "Angus Macfadyen", "Ken Stott", "Katy Murphy", "Angela Bruce"], "character": ["Campbell", "Fergus", "Eddie", "Francine", "Isabel"], "site_data": "html Apps Forums Leaderboard Contribute API Support Discover Movies TV Shows Movies Popular Top Rated Upcoming Now Playing TV Shows Popular Top Rated On TV Airing Today People Popular People Can't find a movie or TV show? Login to create it. en Login Sign Up  ID: 2601   Expand Takin' Over the Asylum   (1994) User Score Overview A salesman starts to run a hospital radio station inside a facility for people with mental heath needs. Discussions   Reviews Videos   Images   Changes Report Share Discussions General  0 Content Issues  0 Images Backdrops  1 Posters  2 Videos Trailers  0 Teasers  0 Clips  0 Featurettes  0 Opening Credits  0 Top Billed Cast David Tennant Campbell Angus Macfadyen Fergus Ken Stott Eddie Katy Murphy Francine Angela Bruce Isabel Full Cast & Crew Last Season Season 1 1994 | 6 Episodes Season 1 of Takin' Over the Asylum premiered on September 27, 1994. View All Seasons Social Reviews  0 Discussions  0 Media Most Popular Videos  0 Backdrops  1 Posters  2 Recommendations   2010-10-10 Single Father 7.4    2004-11-11 Blackpool 7.8    2005-03-23 Casanova 7.3    2014-10-02 Gracepoint 6.5    2014-09-30 Selfie 6.4    2014-09-26 Transparent 6.7    2014-01-07 Intelligence 6.3  Facts Status  Ended Network Certification  - Type  Miniseries Original Language  English Runtime  50m Homepage   http://www.bbc.co.uk/programmes/b00d8s71 Genres Comedy Drama Keywords scotland radio psychiatric hospital miniseries mental disorders Content Score 86 Almost there... Top Contributors TB 32 TMDb Bot R 10 Rebecca 9 Banana 1 kcdh  View Edit History Popularity Trend  Login to edit  URL By  signing up  for an account on TMDb, you can post directly to Twitter and Facebook. You need to be logged in to continue. Click  here  to login or  here  to sign up.    page_wrap opened in html_head  Join the Community The Basics About TMDb Contact Us Support Forums API Blog Get Involved  Contribution Bible 3rd Party Applications Add New Movie Add New TV Show Community Guidelines Leaderboard Forums Twitter Facebook Legal Terms of Use Privacy Policy Login Sign Up"}