{"link": "https://www.themoviedb.org/tv/61361?language=en", "title": "Les Lascars", "resume": "We don't have an overview translated in English. Help us expand our database by adding one.", "rate": 0, "genre": ["Comedy"], "cast": ["Alexandre Achdjian", "Nassim Si Ahmed", "Issa Doumbia", "Pablo Pauly"], "character": ["Jo", "Malik", "Barkette", "Polo"], "site_data": "html Apps Forums Leaderboard Contribute API Support Discover Movies TV Shows Movies Popular Top Rated Upcoming Now Playing TV Shows Popular Top Rated On TV Airing Today People Popular People Can't find a movie or TV show? Login to create it. en Login Sign Up  ID: 61361   Expand Les Lascars   (2012) User Score Overview We don't have an overview translated in English. Help us expand our database by adding one. Discussions   Reviews Videos   Images   Changes Report Share Discussions General  0 Content Issues  0 Images Backdrops  1 Posters  1 Videos Trailers  0 Teasers  0 Clips  0 Featurettes  0 Opening Credits  0 Top Billed Cast Alexandre Achdjian Jo Nassim Si Ahmed Malik Issa Doumbia Barkette Pablo Pauly Polo Full Cast & Crew Last Season Season 2 2014 | 12 Episodes Season 2 of Les Lascars premiered on April 25, 2014. View All Seasons Social Reviews  0 Discussions  0 Media Most Popular Videos  0 Backdrops  1 Posters  1 Recommendations We don't have enough data to suggest any TV shows based on Les Lascars. You can help by rating TV shows you've seen. Facts Status  Returning Series Network Certification 12 Meaning Not recommended for children under 12. Not allowed air before 10:00 p.m. Some channels and programs are subject to exception. Type  Scripted Original Language  French Runtime  - Homepage   http://www.canalplus.fr/c-series/pid4442-c-lascars.html Genres Comedy Keywords No keywords have been added. Content Score 79 Pump it up! We're close now. Top Contributors M 20 Manu 3 Michael 1 Elizabeth Jennings  View Edit History Popularity Trend  Login to edit  URL By  signing up  for an account on TMDb, you can post directly to Twitter and Facebook. You need to be logged in to continue. Click  here  to login or  here  to sign up.    page_wrap opened in html_head  Join the Community The Basics About TMDb Contact Us Support Forums API Blog Get Involved  Contribution Bible 3rd Party Applications Add New Movie Add New TV Show Community Guidelines Leaderboard Forums Twitter Facebook Legal Terms of Use Privacy Policy Login Sign Up"}