{"link": "https://www.themoviedb.org/tv/41071?language=en", "title": "Praxis B\u00fclowbogen", "resume": "Praxis B\u00fclowbogen is a German television series.", "rate": 0, "genre": ["Drama"], "cast": ["G\u00fcnter Pfitzmann", "Anita Kupsch", "Mareike Carri\u00e8re", "Johanna K\u00f6nig", "Bruno Dietrich"], "character": ["Dr. Peter Brockmann", "Gabi K\u00f6hler", "Dr. Kathrin Brockmann", "Schwester Erika", "Dr. Georg Maerker"], "site_data": "html Apps Forums Leaderboard Contribute API Support Discover Movies TV Shows Movies Popular Top Rated Upcoming Now Playing TV Shows Popular Top Rated On TV Airing Today People Popular People Can't find a movie or TV show? Login to create it. en Login Sign Up  ID: 41071   Expand Praxis B\u00fclowbogen   (1987) User Score Overview Praxis B\u00fclowbogen is a German television series. Featured Crew Ulrich del Mestre Creator Discussions   Reviews Videos   Images   Changes Report Share Discussions General  0 Content Issues  0 Images Backdrops  1 Posters  1 Videos Trailers  0 Teasers  0 Clips  0 Featurettes  0 Opening Credits  0 Top Billed Cast G\u00fcnter Pfitzmann Dr. Peter Brockmann Anita Kupsch Gabi K\u00f6hler Mareike Carri\u00e8re Dr. Kathrin Brockmann Johanna K\u00f6nig Schwester Erika Bruno Dietrich Dr. Georg Maerker Full Cast & Crew Last Season Season 6 1996 | 13 Episodes Season 6 of Praxis B\u00fclowbogen premiered on January  1, 1996. View All Seasons Social Reviews  0 Discussions  0 Media Most Popular Videos  0 Backdrops  1 Posters  1 Recommendations We don't have enough data to suggest any TV shows based on Praxis B\u00fclowbogen. You can help by rating TV shows you've seen. Facts Status  Ended Network Certification  - Type  Scripted Original Language  German Runtime  50m Homepage  - Genres Drama Keywords berlin doctor Content Score 100 Yes! Looking good! Top Contributors S 109 Samara d 8 dangerboy1973  View Edit History Popularity Trend  Login to edit  URL By  signing up  for an account on TMDb, you can post directly to Twitter and Facebook. You need to be logged in to continue. Click  here  to login or  here  to sign up.    page_wrap opened in html_head  Join the Community The Basics About TMDb Contact Us Support Forums API Blog Get Involved  Contribution Bible 3rd Party Applications Add New Movie Add New TV Show Community Guidelines Leaderboard Forums Twitter Facebook Legal Terms of Use Privacy Policy Login Sign Up"}