{"link": "https://www.themoviedb.org/tv/50323?language=en", "title": "Adanal\u0131", "resume": "We don't have an overview translated in English. Help us expand our database by adding one.", "rate": 13, "genre": ["Action", "Adventure", "Crime"], "cast": ["Mehmet Akif Alakurt", "Oktay Kaynarca", "Selin Demiratar", "Serenay Sar\u0131kaya", "Zeynep Koltuk"], "character": ["Maraz Ali", "Adanali", "Idil", "Sofia", "Maria"], "site_data": "html Apps Forums Leaderboard Contribute API Support Discover Movies TV Shows Movies Popular Top Rated Upcoming Now Playing TV Shows Popular Top Rated On TV Airing Today People Popular People Can't find a movie or TV show? Login to create it. en Login Sign Up  ID: 50323   Expand Adanal\u0131   (2008) User Score Overview We don't have an overview translated in English. Help us expand our database by adding one. Featured Crew Tayfun G\u00fcneyer Creator Discussions   Reviews Videos   Images   Changes Report Share Discussions General  0 Content Issues  0 Images Backdrops  1 Posters  1 Videos Trailers  0 Teasers  0 Clips  0 Featurettes  0 Opening Credits  0 Top Billed Cast Mehmet Akif Alakurt Maraz Ali Oktay Kaynarca Adanali Selin Demiratar Idil Serenay Sar\u0131kaya Sofia Zeynep Koltuk Maria Full Cast & Crew Last Season Season 1 2008 | 7 Episodes Season 1 of Adanal\u0131 premiered on November  7, 2008. View All Seasons Social Reviews  0 Discussions  0 Media Most Popular Videos  0 Backdrops  1 Posters  1 Recommendations We don't have enough data to suggest any TV shows based on Adanal\u0131. You can help by rating TV shows you've seen. Facts Status  Ended Network Certification  - Type  Scripted Original Language  Turkish Runtime  90m Homepage   http://www.atv.com.tr/prog,adanali,44514.html Genres Action & Adventure Crime Keywords crime Content Score 86 Almost there... Top Contributors P 37 Pisac b 31 bluwy CM 5 Cherche Moi 1 1 1080pfilmhd  View Edit History Popularity Trend  Login to edit  URL By  signing up  for an account on TMDb, you can post directly to Twitter and Facebook. You need to be logged in to continue. Click  here  to login or  here  to sign up.    page_wrap opened in html_head  Join the Community The Basics About TMDb Contact Us Support Forums API Blog Get Involved  Contribution Bible 3rd Party Applications Add New Movie Add New TV Show Community Guidelines Leaderboard Forums Twitter Facebook Legal Terms of Use Privacy Policy Login Sign Up"}