{"link": "https://www.themoviedb.org/tv/61326?language=en", "title": "Play It Again, Dick", "resume": "Play It Again, Dick is a digital series that follows Ryan Hansen as he tries to get a Dick Casablancas show off the ground.", "rate": 60, "genre": ["Comedy"], "cast": ["Ryan Hansen", "Kyle Gallner", "Kristen Bell", "Enrico Colantoni", "Rose McIver"], "character": ["Dick Casablancas", "Cassidy 'Beaver' Casablancas / Kyle Gallner", "Veronica Mars / Kristen Bell", "Keith Mars / Enrico Colantoni", "Skank with Attitude"], "site_data": "html Apps Forums Leaderboard Contribute API Support Discover Movies TV Shows Movies Popular Top Rated Upcoming Now Playing TV Shows Popular Top Rated On TV Airing Today People Popular People Can't find a movie or TV show? Login to create it. en Login Sign Up  ID: 61326   Expand Play It Again, Dick   (2014) User Score Overview Play It Again, Dick is a digital series that follows Ryan Hansen as he tries to get a Dick Casablancas show off the ground. Featured Crew Rob Thomas Creator Discussions   Reviews Videos   Images   Changes Report Share Discussions General  0 Content Issues  0 Images Backdrops  0 Posters  1 Videos Trailers  0 Teasers  0 Clips  0 Featurettes  0 Opening Credits  0 Top Billed Cast Ryan Hansen Dick Casablancas Kyle Gallner Cassidy 'Beaver' Casablancas / Kyle Gallner Kristen Bell Veronica Mars / Kristen Bell Enrico Colantoni Keith Mars / Enrico Colantoni Rose McIver Skank with Attitude Full Cast & Crew Last Season Season 1 2014 | 8 Episodes Season 1 of Play It Again, Dick premiered on September 16, 2014. View All Seasons Social Reviews  0 Discussions  0 Media Most Popular Videos  0 Backdrops  0 Posters  1 Recommendations We don't have enough data to suggest any TV shows based on Play It Again, Dick. You can help by rating TV shows you've seen. Facts Status  Ended Network Certification  - Type  Scripted Original Language  English Runtime  7m Homepage   http://cwseed.com/shows/play-it-again-dick/ Genres Comedy Keywords No keywords have been added. Content Score 79 Pump it up! We're close now. Top Contributors 12 Elizabeth Jennings 9 Travis Bell R 9 Rebecca 2 whatUwant  View Edit History Popularity Trend  Login to edit  URL By  signing up  for an account on TMDb, you can post directly to Twitter and Facebook. You need to be logged in to continue. Click  here  to login or  here  to sign up.    page_wrap opened in html_head  Join the Community The Basics About TMDb Contact Us Support Forums API Blog Get Involved  Contribution Bible 3rd Party Applications Add New Movie Add New TV Show Community Guidelines Leaderboard Forums Twitter Facebook Legal Terms of Use Privacy Policy Login Sign Up"}