{"link": "https://www.themoviedb.org/tv/21535?language=en", "title": "Rock & Chips", "resume": "Period comedy drama and prequel to Only Fools and Horses, following the exploits of the Trotter family in sixties Peckham.", "rate": 70, "genre": ["Comedy", "Drama"], "cast": ["Nicholas Lyndhurst", "Kellie Bright", "Phil Daniels", "Shaun Dingwall", "James Buckley"], "character": ["Freddie Robdal", "Joan Trotter", "Ted Trotter", "Reg Trotter", "Del Trotter"], "site_data": "html Apps Forums Leaderboard Contribute API Support Discover Movies TV Shows Movies Popular Top Rated Upcoming Now Playing TV Shows Popular Top Rated On TV Airing Today People Popular People Can't find a movie or TV show? Login to create it. en Login Sign Up  ID: 21535   Expand Rock & Chips   (2010) User Score Overview Period comedy drama and prequel to Only Fools and Horses, following the exploits of the Trotter family in sixties Peckham. Featured Crew John Sullivan Creator Discussions   Reviews Videos   Images   Changes Report Share Discussions General  0 Content Issues  0 Images Backdrops  1 Posters  2 Videos Trailers  0 Teasers  0 Clips  0 Featurettes  0 Opening Credits  0 Top Billed Cast Nicholas Lyndhurst Freddie Robdal Kellie Bright Joan Trotter Phil Daniels Ted Trotter Shaun Dingwall Reg Trotter James Buckley Del Trotter Full Cast & Crew Last Season Season 1 2010 | 3 Episodes Season 1 of Rock & Chips premiered on January 24, 2010. View All Seasons Social Reviews  0 Discussions  0 Media Most Popular Videos  0 Backdrops  1 Posters  2 Recommendations We don't have enough data to suggest any TV shows based on Rock & Chips. You can help by rating TV shows you've seen. Facts Status  Ended Network BBC Certification 12 Meaning Films classified 12A and video works classified 12 contain material that is not generally suitable for children aged under 12. Type  Scripted Original Language  English Runtime  60m Homepage   http://www.bbc.co.uk/programmes/b00qgrc7 Genres Comedy Drama Keywords flat prequel council estate 1960s south london british humour Content Score 93 Almost there... Top Contributors m 18 mercman 8 Banana O 7 Ozbourne 2 Jay Webster  View Edit History Popularity Trend  Login to edit  URL By  signing up  for an account on TMDb, you can post directly to Twitter and Facebook. You need to be logged in to continue. Click  here  to login or  here  to sign up.    page_wrap opened in html_head  Join the Community The Basics About TMDb Contact Us Support Forums API Blog Get Involved  Contribution Bible 3rd Party Applications Add New Movie Add New TV Show Community Guidelines Leaderboard Forums Twitter Facebook Legal Terms of Use Privacy Policy Login Sign Up"}