{"link": "https://www.themoviedb.org/tv/21871?language=en", "title": "Slimer! And the Real Ghostbusters", "resume": "We don't have an overview translated in English. Help us expand our database by adding one.", "rate": null, "genre": ["Animation", "Action", "Adventure"], "cast": ["Katie Leigh", "Maurice LaMarche", "Jeff Altman", "Dave Coulier", "Cree Summer"], "site_data": "html Apps Forums Leaderboard Contribute API Support Discover Movies TV Shows Movies Popular Top Rated Upcoming Now Playing TV Shows Popular Top Rated On TV Airing Today People Popular People Can't find a movie or TV show? Login to create it. en Login Sign Up  ID: 21871   Expand Slimer! And the Real Ghostbusters   (1988) User Score Overview We don't have an overview translated in English. Help us expand our database by adding one. Discussions   Reviews Videos   Images   Changes Report Share Discussions General  0 Content Issues  0 Images Backdrops  3 Posters  2 Videos Trailers  0 Teasers  0 Clips  0 Featurettes  0 Opening Credits  1 Top Billed Cast Katie Leigh Maurice LaMarche Jeff Altman Dave Coulier Peter Venkman Cree Summer Chilly Cooper Full Cast & Crew Last Season Season 1 1988 | 33 Episodes Season 1 of Slimer! And the Real Ghostbusters premiered on September 10, 1988. View All Seasons Social Reviews  0 Discussions  0 Media Most Popular Videos  1 Backdrops  3 Posters  2 Recommendations We don't have enough data to suggest any TV shows based on Slimer! And the Real Ghostbusters. You can help by rating TV shows you've seen. Facts Status  Ended Network Certification  - Type  Scripted Original Language  English Runtime  30m Homepage  - Genres Animation Action & Adventure Keywords No keywords have been added. Content Score 86 Almost there... Top Contributors M 2 Migi A 1 AnthonyAtkins232 TB 1 TMDb Bot 1 acekid  View Edit History Popularity Trend  Login to edit  URL By  signing up  for an account on TMDb, you can post directly to Twitter and Facebook. You need to be logged in to continue. Click  here  to login or  here  to sign up.    page_wrap opened in html_head  Join the Community The Basics About TMDb Contact Us Support Forums API Blog Get Involved  Contribution Bible 3rd Party Applications Add New Movie Add New TV Show Community Guidelines Leaderboard Forums Twitter Facebook Legal Terms of Use Privacy Policy Login Sign Up", "character": ["Peter Venkman", "Chilly Cooper"]}