{"link": "https://www.themoviedb.org/tv/73341?language=en", "title": "A General, A Scholar and An Eunuch", "resume": "We don't have an overview translated in English. Help us expand our database by adding one.", "rate": 0, "genre": ["Action", "Adventure", "Comedy", "Drama", "Sci-Fi", "Fantasy"], "cast": ["Edwin Siu", "Raymond Cho", "Matthew Ho", "Kristal Tin", "Grace Wong"], "character": ["Yuen Sung Woon / Wan Dai Gwan", "Joh Gwong Dau / Fung Yat Boh", "Lee Jun Chung / Lee Siu Dung", "Fong Wai Chi / Jackie", "Kwok Sin / Wong Yee San / Sandy"], "site_data": "html Apps Forums Leaderboard Contribute API Support Discover Movies TV Shows Movies Popular Top Rated Upcoming Now Playing TV Shows Popular Top Rated On TV Airing Today People Popular People Can't find a movie or TV show? Login to create it. en Login Sign Up  ID: 73341   Expand A General, A Scholar and An Eunuch   (2017) User Score Overview We don't have an overview translated in English. Help us expand our database by adding one. Discussions   Reviews Videos   Images   Changes Report Share Discussions General  0 Content Issues  0 Images Backdrops  0 Posters  1 Videos Trailers  0 Teasers  0 Clips  0 Featurettes  0 Opening Credits  0 Top Billed Cast Edwin Siu Yuen Sung Woon / Wan Dai Gwan Raymond Cho Joh Gwong Dau / Fung Yat Boh Matthew Ho Lee Jun Chung / Lee Siu Dung Kristal Tin Fong Wai Chi / Jackie Grace Wong Kwok Sin / Wong Yee San / Sandy Full Cast & Crew Last Season Season 1 2017 | 32 Episodes Season 1 of A General, A Scholar and An Eunuch premiered on July 17, 2017. View All Seasons Social Reviews  0 Discussions  0 Media Most Popular Videos  0 Backdrops  0 Posters  1 Recommendations We don't have enough data to suggest any TV shows based on A General, A Scholar and An Eunuch. You can help by rating TV shows you've seen. Facts Original Name  \u8d85\u6642\u7a7a\u7537\u81e3 Status  Returning Series Network Certification  - Type  Scripted Original Language  Cantonese Runtime  60m Homepage   http://programme.tvb.com/drama/ageneralascholarandaeunuch/ Genres Action & Adventure Comedy Drama Sci-Fi & Fantasy Keywords historical fiction Content Score 71 Just a little bit more... Top Contributors 31 daliasued 6 Elizabeth Jennings  View Edit History Popularity Trend  Login to edit  URL By  signing up  for an account on TMDb, you can post directly to Twitter and Facebook. You need to be logged in to continue. Click  here  to login or  here  to sign up.    page_wrap opened in html_head  Join the Community The Basics About TMDb Contact Us Support Forums API Blog Get Involved  Contribution Bible 3rd Party Applications Add New Movie Add New TV Show Community Guidelines Leaderboard Forums Twitter Facebook Legal Terms of Use Privacy Policy Login Sign Up"}