{"link": "https://www.themoviedb.org/tv/60839?language=en", "title": "Broad City", "resume": "Broad City follows two women throughout their daily lives in New York City, making the smallest and mundane events hysterical and disturbing to watch all at the same time.", "rate": 78, "genre": ["Comedy"], "cast": ["Abbi Jacobson", "Ilana Glazer", "Hannibal Buress", "Paul W. Downs", "Arturo Castro"], "character": ["Abbi Abrams", "Ilana Wexler", "Lincoln Rice", "Trey Pucker", "Jaime Castro"], "site_data": "html Apps Forums Leaderboard Contribute API Support Discover Movies TV Shows Movies Popular Top Rated Upcoming Now Playing TV Shows Popular Top Rated On TV Airing Today People Popular People Can't find a movie or TV show? Login to create it. en Login Sign Up  ID: 60839   Expand Broad City   (2014) User Score  Play Trailer Overview Broad City follows two women throughout their daily lives in New York City, making the smallest and mundane events hysterical and disturbing to watch all at the same time. Featured Crew Ilana Glazer Creator Abbi Jacobson Creator Discussions   Reviews Videos   Images   Changes Report Share Discussions General  1 Content Issues  0 Images Backdrops  10 Posters  2 Videos Trailers  1 Teasers  0 Clips  0 Featurettes  0 Opening Credits  0 Top Billed Cast Abbi Jacobson Abbi Abrams Ilana Glazer Ilana Wexler Hannibal Buress Lincoln Rice Paul W. Downs Trey Pucker Arturo Castro Jaime Castro Full Cast & Crew Last Season Season 4 2017 | 10 Episodes Season 4 of Broad City premiered on September 13, 2017. View All Seasons Social Reviews  0 Discussions  1 Subject Status Replies Last Reply t Millie Dresselhaus Open 0 by Halberstram\n      \n     Go to Discussions Media Most Popular Videos  1 Backdrops  10 Posters  2 Recommendations   2009-03-20 Party Down 7.4    2010-06-29 Louie 7.7    2015-03-06 Unbreakable Kimmy Schmidt 7.2    2009-10-29 The League 7.1    2009-04-09 Parks and Recreation 7.9    2014-09-26 Transparent 6.7    2012-04-22 Veep 7.2    2007-08-06 Drunk History 6.6  Facts Status  Returning Series Network Certification  - Type  Scripted Original Language  English Runtime  30m Homepage   http://www.cc.com/shows/broad-city Genres Comedy Keywords new york female friendship cannabis sitcom young adult Content Score 100 Yes! Looking good! Top Contributors 24 Elizabeth Jennings w 16 wheelpoint 9 niqo19 T 8 Tjorvens  View Edit History Popularity Trend  Login to edit  URL By  signing up  for an account on TMDb, you can post directly to Twitter and Facebook. You need to be logged in to continue. Click  here  to login or  here  to sign up.    page_wrap opened in html_head  Join the Community The Basics About TMDb Contact Us Support Forums API Blog Get Involved  Contribution Bible 3rd Party Applications Add New Movie Add New TV Show Community Guidelines Leaderboard Forums Twitter Facebook Legal Terms of Use Privacy Policy Login Sign Up"}