{"link": "https://www.themoviedb.org/tv/70371?language=en", "title": "A Tenkes kapit\u00e1nya", "resume": "We don't have an overview translated in English. Help us expand our database by adding one.", "rate": 60, "genre": ["Action", "Adventure", "Kids"], "cast": ["Ferenc Zenthe", "Gyula Szab\u00f3", "P\u00e9csi Ildik\u00f3", "Marianne Krencsey", "Ungv\u00e1ry L\u00e1szl\u00f3"], "character": ["Eke M\u00e1t\u00e9", "Buga Jakab", "R\u00f3zsa, a cig\u00e1nyl\u00e1ny", "b\u00e1r\u00f3 Eberstein Eckbertn\u00e9 (Am\u00e1lia)", "b\u00e1r\u00f3 Eberstein Eckbert ezredes"], "site_data": "html Apps Forums Leaderboard Contribute API Support Discover Movies TV Shows Movies Popular Top Rated Upcoming Now Playing TV Shows Popular Top Rated On TV Airing Today People Popular People Can't find a movie or TV show? Login to create it. en Login Sign Up  ID: 70371   Expand A Tenkes kapit\u00e1nya   (1964) User Score Overview We don't have an overview translated in English. Help us expand our database by adding one. Discussions   Reviews Videos   Images   Changes Report Share Discussions General  0 Content Issues  0 Images Backdrops  1 Posters  1 Videos Trailers  0 Teasers  0 Clips  0 Featurettes  0 Opening Credits  0 Top Billed Cast Ferenc Zenthe Eke M\u00e1t\u00e9 Gyula Szab\u00f3 Buga Jakab P\u00e9csi Ildik\u00f3 R\u00f3zsa, a cig\u00e1nyl\u00e1ny Marianne Krencsey b\u00e1r\u00f3 Eberstein Eckbertn\u00e9 (Am\u00e1lia) Ungv\u00e1ry L\u00e1szl\u00f3 b\u00e1r\u00f3 Eberstein Eckbert ezredes Full Cast & Crew Last Season Season 1 1964 | 13 Episodes Season 1 of A Tenkes kapit\u00e1nya premiered on January 11, 1964. View All Seasons Social Reviews  0 Discussions  0 Media Most Popular Videos  0 Backdrops  1 Posters  1 Recommendations We don't have enough data to suggest any TV shows based on A Tenkes kapit\u00e1nya. You can help by rating TV shows you've seen. Facts Status  Ended Network Magyar Telev\u00edzi\u00f3 Certification  - Type  Scripted Original Language  Hungarian Runtime  - Homepage  - Genres Action & Adventure Kids Keywords No keywords have been added. Content Score 79 Pump it up! We're close now. Top Contributors a 28 asusar 3 tigriso1  View Edit History Popularity Trend  Login to edit  URL By  signing up  for an account on TMDb, you can post directly to Twitter and Facebook. You need to be logged in to continue. Click  here  to login or  here  to sign up.    page_wrap opened in html_head  Join the Community The Basics About TMDb Contact Us Support Forums API Blog Get Involved  Contribution Bible 3rd Party Applications Add New Movie Add New TV Show Community Guidelines Leaderboard Forums Twitter Facebook Legal Terms of Use Privacy Policy Login Sign Up"}