{"link": "https://www.themoviedb.org/tv/38723?language=en", "title": "The Sinking of the Laconia", "resume": "The true story of the Allied ship Laconia, sunk in WWII by a German U-Boat, which then surfaced against orders to rescue the civilian crew", "rate": 56, "genre": ["Drama", "War", "Politics"], "cast": ["Franka Potente", "Brian Cox", "Andrew Buchan", "Lindsay Duncan", "Nicholas Burns"], "character": ["Hilda Smith, passenger, RMS Laconia", "Captain Sharp, RMS Laconia", "Junior Third Officer Thomas Mortimer, RMS Laconia", "Elisabeth Fullwood,  passenger, RMS Laconia", "Captain Benjamin Coutts, British Army"], "site_data": "html Apps Forums Leaderboard Contribute API Support Discover Movies TV Shows Movies Popular Top Rated Upcoming Now Playing TV Shows Popular Top Rated On TV Airing Today People Popular People Can't find a movie or TV show? Login to create it. en Login Sign Up  ID: 38723   Expand The Sinking of the Laconia   (2011) User Score Overview The true story of the Allied ship Laconia, sunk in WWII by a German U-Boat, which then surfaced against orders to rescue the civilian crew Discussions   Reviews Videos   Images   Changes Report Share Discussions General  0 Content Issues  0 Images Backdrops  8 Posters  15 Videos Trailers  0 Teasers  0 Clips  0 Featurettes  0 Opening Credits  0 Top Billed Cast Franka Potente Hilda Smith, passenger, RMS Laconia Brian Cox Captain Sharp, RMS Laconia Andrew Buchan Junior Third Officer Thomas Mortimer, RMS Laconia Lindsay Duncan Elisabeth Fullwood,  passenger, RMS Laconia Nicholas Burns Captain Benjamin Coutts, British Army Full Cast & Crew Last Season Miniseries 2011 | 2 Episodes Season 1 of The Sinking of the Laconia premiered on January  6, 2011. View All Seasons Social Reviews  0 Discussions  0 Media Most Popular Videos  0 Backdrops  8 Posters  15 Recommendations   2008-07-13 Generation Kill 8.1    2011-04-17 Game of Thrones 8.2  Facts Status  Ended Network Certification 12 Meaning The broadcaster must take the decision about the air time by taking in consideration the impact on young children in the timeframe from 6:00am to 8:00pm. Type  Miniseries Original Language  English Runtime  90m Homepage   http://www.bbc.co.uk/programmes/b00xgjnm Genres Drama War & Politics Keywords war history u boat 1940s u-boot untergang Content Score 86 Almost there... Top Contributors 46 Markxist TB 42 TMDb Bot t 42 tmdb45070722 9 Banana  View Edit History Popularity Trend  Login to edit  URL By  signing up  for an account on TMDb, you can post directly to Twitter and Facebook. You need to be logged in to continue. Click  here  to login or  here  to sign up.    page_wrap opened in html_head  Join the Community The Basics About TMDb Contact Us Support Forums API Blog Get Involved  Contribution Bible 3rd Party Applications Add New Movie Add New TV Show Community Guidelines Leaderboard Forums Twitter Facebook Legal Terms of Use Privacy Policy Login Sign Up"}