{"link": "https://www.themoviedb.org/tv/61671?language=en", "title": "Unbreakable Kimmy Schmidt", "resume": "When a woman is rescued from a doomsday cult and lands in New York City, she must navigate a world she didn\u2019t think even existed anymore.", "rate": 72, "genre": ["Comedy"], "cast": ["Ellie Kemper", "Tituss Burgess", "Jane Krakowski", "Carol Kane"], "character": ["Kimmy Schmidt", "Titus Andromedon", "Jacqueline Voorhees / White", "Lillian Kaushtupper"], "site_data": "html Apps Forums Leaderboard Contribute API Support Discover Movies TV Shows Movies Popular Top Rated Upcoming Now Playing TV Shows Popular Top Rated On TV Airing Today People Popular People Can't find a movie or TV show? Login to create it. en Login Sign Up  ID: 61671   Expand Unbreakable Kimmy Schmidt   (2015) User Score  Play Trailer Overview When a woman is rescued from a doomsday cult and lands in New York City, she must navigate a world she didn\u2019t think even existed anymore. Featured Crew Tina Fey Creator Robert Carlock Creator Discussions   Reviews Videos   Images   Changes Report Share Discussions General  3 Content Issues  0 Images Backdrops  10 Posters  8 Videos Trailers  1 Teasers  0 Clips  0 Featurettes  0 Opening Credits  1 Top Billed Cast Ellie Kemper Kimmy Schmidt Tituss Burgess Titus Andromedon Jane Krakowski Jacqueline Voorhees / White Carol Kane Lillian Kaushtupper Full Cast & Crew Current Season Season 4 2018 | 6 Episodes View All Seasons Social Reviews  0 Discussions  3 Subject Status Replies Last Reply t What's with the bad actors? Open 0 by Halberstram\n      \n     [SPOILERS season 3] Titus is amazing Open 0 by Jana\n      \n     Season 3 Open 2 by  lmao7 Go to Discussions Media Most Popular Videos  2 Backdrops  10 Posters  8 Recommendations   2009-04-09 Parks and Recreation 7.9    2015-11-06 Master of None 8.0    2014-01-22 Broad City 7.6    2003-11-02 Arrested Development 8.2    2015-02-04 Fresh Off the Boat 7.0    2006-10-11 30 Rock 7.1    2009-09-17 Community 7.9    2015-05-08 Grace and Frankie 7.8  Facts Status  Returning Series Network Certification TV-14 Meaning This program contains some material that many parents would find unsuitable for children under 14 years of age. Type  Scripted Original Language  English Runtime  30m Homepage   https://www.netflix.com/title/80025384 Genres Comedy Keywords new york fish out of water new home sitcom Content Score 100 Yes! Looking good! Top Contributors M 66 MissisStoker 56 Elizabeth Jennings VF 26 Vitor Fernandes a 14 adambakir92  View Edit History Popularity Trend  Login to edit  URL By  signing up  for an account on TMDb, you can post directly to Twitter and Facebook. You need to be logged in to continue. Click  here  to login or  here  to sign up.    page_wrap opened in html_head  Join the Community The Basics About TMDb Contact Us Support Forums API Blog Get Involved  Contribution Bible 3rd Party Applications Add New Movie Add New TV Show Community Guidelines Leaderboard Forums Twitter Facebook Legal Terms of Use Privacy Policy Login Sign Up"}