{"link": "https://www.themoviedb.org/tv/66029?language=en", "title": "Boomers", "resume": "Sitcom following the ups and downs of three retired couples living in Thurnemouth, 'Norfolk's only West-facing resort'.", "rate": 67, "genre": ["Comedy"], "cast": ["Philip Jackson", "Alison Steadman", "Russ Abbot", "Stephanie Beacham", "Paula Wilcox"], "character": ["Alan", "Joyce", "John", "Maureen", "Carol"], "site_data": "html Apps Forums Leaderboard Contribute API Support Discover Movies TV Shows Movies Popular Top Rated Upcoming Now Playing TV Shows Popular Top Rated On TV Airing Today People Popular People Can't find a movie or TV show? Login to create it. en Login Sign Up  ID: 66029   Expand Boomers   (2014) User Score Overview Sitcom following the ups and downs of three retired couples living in Thurnemouth, 'Norfolk's only West-facing resort'. Discussions   Reviews Videos   Images   Changes Report Share Discussions General  0 Content Issues  0 Images Backdrops  4 Posters  1 Videos Trailers  0 Teasers  0 Clips  0 Featurettes  0 Opening Credits  0 Top Billed Cast Philip Jackson Alan Alison Steadman Joyce Russ Abbot John Stephanie Beacham Maureen Paula Wilcox Carol Full Cast & Crew Last Season Series 2 2016 | 6 Episodes Season 2 of Boomers premiered on March 25, 2016. View All Seasons Social Reviews  0 Discussions  0 Media Most Popular Videos  0 Backdrops  4 Posters  1 Recommendations We don't have enough data to suggest any TV shows based on Boomers. You can help by rating TV shows you've seen. Facts Status  Returning Series Network Certification  - Type  Scripted Original Language  English Runtime  - Homepage   http://www.bbc.co.uk/programmes/b06v0nv1 Genres Comedy Keywords retired sitcom british humour couples Content Score 86 Almost there... Top Contributors 30 Elizabeth Jennings s 8 stevenjhon847 O 8 Ozbourne 3 kcdh  View Edit History Popularity Trend  Login to edit  URL By  signing up  for an account on TMDb, you can post directly to Twitter and Facebook. You need to be logged in to continue. Click  here  to login or  here  to sign up.    page_wrap opened in html_head  Join the Community The Basics About TMDb Contact Us Support Forums API Blog Get Involved  Contribution Bible 3rd Party Applications Add New Movie Add New TV Show Community Guidelines Leaderboard Forums Twitter Facebook Legal Terms of Use Privacy Policy Login Sign Up"}