{"link": "https://www.themoviedb.org/tv/65341?language=en", "title": "The Eleventh of the Eleventh", "resume": "A show about carnaval in Knorrendonk", "rate": 0, "genre": ["Drama", "Comedy"], "cast": ["Jonas Vermeulen", "Kamil Gruszka", "Jan Decleir", "Frieda Pittoors", "Bruno Vanden Broecke"], "character": ["Joris", "Jefke", "Hubert Geunings", "Marie-Jos\u00e9 Geunings", "Erik"], "site_data": "html Apps Forums Leaderboard Contribute API Support Discover Movies TV Shows Movies Popular Top Rated Upcoming Now Playing TV Shows Popular Top Rated On TV Airing Today People Popular People Can't find a movie or TV show? Login to create it. en Login Sign Up  ID: 65341   Expand The Eleventh of the Eleventh   (2016) User Score  Play Trailer Overview A show about carnaval in Knorrendonk Featured Crew Tom van Dyck Creator Discussions   Reviews Videos   Images   Changes Report Share Discussions General  0 Content Issues  0 Images Backdrops  2 Posters  1 Videos Trailers  1 Teasers  0 Clips  0 Featurettes  0 Opening Credits  0 Top Billed Cast Jonas Vermeulen Joris Kamil Gruszka Jefke Jan Decleir Hubert Geunings Frieda Pittoors Marie-Jos\u00e9 Geunings Bruno Vanden Broecke Erik Full Cast & Crew Last Season Season 1 2016 | 7 Episodes Season 1 of The Eleventh of the Eleventh premiered on January  3, 2016. View All Seasons Social Reviews  0 Discussions  0 Media Most Popular Videos  1 Backdrops  2 Posters  1 Recommendations We don't have enough data to suggest any TV shows based on The Eleventh of the Eleventh. You can help by rating TV shows you've seen. Facts Original Name  Den elfde van den elfde Status  Returning Series Network Certification  - Type  Scripted Original Language  Dutch; Flemish Runtime  45m Homepage  - Genres Drama Comedy Keywords No keywords have been added. Content Score 100 Yes! Looking good! Top Contributors 38 Mathias Van Der Bruggen 4 Maretoh p 2 pipolala TB 1 TMDb Bot  View Edit History Popularity Trend  Login to edit  URL By  signing up  for an account on TMDb, you can post directly to Twitter and Facebook. You need to be logged in to continue. Click  here  to login or  here  to sign up.    page_wrap opened in html_head  Join the Community The Basics About TMDb Contact Us Support Forums API Blog Get Involved  Contribution Bible 3rd Party Applications Add New Movie Add New TV Show Community Guidelines Leaderboard Forums Twitter Facebook Legal Terms of Use Privacy Policy Login Sign Up"}