{"link": "https://www.themoviedb.org/tv/19744?language=en", "title": "Nature's Great Events", "resume": "Documentary series looking at the most dramatic wildlife spectacles on our planet, showing how life responds to natural events which can dramatically transform entire landscapes.", "rate": 84, "genre": ["Documentary"], "cast": ["David Attenborough"], "character": ["Himself - Presenter"], "site_data": "html Apps Forums Leaderboard Contribute API Support Discover Movies TV Shows Movies Popular Top Rated Upcoming Now Playing TV Shows Popular Top Rated On TV Airing Today People Popular People Can't find a movie or TV show? Login to create it. en Login Sign Up  ID: 19744   Expand Nature's Great Events   (2009) User Score Overview Documentary series looking at the most dramatic wildlife spectacles on our planet, showing how life responds to natural events which can dramatically transform entire landscapes. Discussions   Reviews Videos   Images   Changes Report Share Discussions General  0 Content Issues  0 Images Backdrops  26 Posters  12 Videos Trailers  0 Teasers  0 Clips  0 Featurettes  0 Opening Credits  0 Top Billed Cast David Attenborough Himself - Presenter Full Cast & Crew Last Season Season 1 2009 | 6 Episodes Season 1 of Nature's Great Events premiered on February 11, 2009. View All Seasons Social Reviews  0 Discussions  0 Media Most Popular Videos  0 Backdrops  26 Posters  12 Recommendations   1990-10-04 The Trials of Life 9.5    2002-11-20 The Life of Mammals 9.1    2008-02-04 Life in Cold Blood 9.0    1998-10-21 The Life of Birds 9.3    1984-01-19 The Living Planet 9.1    1987-10-03 Friday the 13th 7.7    1993-11-18 Life in the Freezer 9.2    2005-11-23 Life in the Undergrowth 8.4  Facts Status  Ended Network Certification  - Type  Miniseries Original Language  English Runtime  60m, 50m Homepage   http://www.bbc.co.uk/programmes/b00ht655 Genres Documentary Keywords wildlife nature nature documentary natural events Content Score 64 We're so close, yet so far. Top Contributors TB 41 TMDb Bot 40 Elizabeth Jennings r 5 robko22 4 vacdk  View Edit History Popularity Trend  Login to edit  URL By  signing up  for an account on TMDb, you can post directly to Twitter and Facebook. You need to be logged in to continue. Click  here  to login or  here  to sign up.    page_wrap opened in html_head  Join the Community The Basics About TMDb Contact Us Support Forums API Blog Get Involved  Contribution Bible 3rd Party Applications Add New Movie Add New TV Show Community Guidelines Leaderboard Forums Twitter Facebook Legal Terms of Use Privacy Policy Login Sign Up"}