{"link": "https://www.themoviedb.org/tv/78242?language=en", "title": "Le r\u00eave fran\u00e7ais", "resume": "We don't have an overview translated in English. Help us expand our database by adding one.", "rate": null, "genre": ["Drama"], "cast": ["Aude Legastelois", "Jocelyne B\u00e9roard", "Soh\u00e9e Monthieux", "Samuel Etifier", "Xavier-Arnaud de Sinzogan"], "site_data": "html Apps Forums Leaderboard Contribute API Support Discover Movies TV Shows Movies Popular Top Rated Upcoming Now Playing TV Shows Popular Top Rated On TV Airing Today People Popular People Can't find a movie or TV show? Login to create it. en Login Sign Up  ID: 78242   Expand Le r\u00eave fran\u00e7ais   (2018) User Score Overview We don't have an overview translated in English. Help us expand our database by adding one. Discussions   Reviews Videos   Images   Changes Report Share Discussions General  0 Content Issues  0 Images Backdrops  0 Posters  1 Videos Trailers  0 Teasers  0 Clips  0 Featurettes  0 Opening Credits  0 Top Billed Cast Aude Legastelois Charley Le Tallec Jocelyne B\u00e9roard Betty Soh\u00e9e Monthieux Roseline Jean-Baptiste Samuel Etifier No\u00ebl Tr\u00e9sor Xavier-Arnaud de Sinzogan Samuel adolescent Full Cast & Crew Current Season Season 1 2018 | 2 Episodes Season 1 of Le r\u00eave fran\u00e7ais premiered on March 21, 2018. View All Seasons Social Reviews  0 Discussions  0 Media Most Popular Videos  0 Backdrops  0 Posters  1 Recommendations We don't have enough data to suggest any TV shows based on Le r\u00eave fran\u00e7ais. You can help by rating TV shows you've seen. Facts Status  Ended Network Certification  - Type  Scripted Original Language  French Runtime  90m Homepage  - Genres Drama Keywords france black antilles Content Score 64 We're so close, yet so far. Top Contributors m 63 michael47 D 2 Disnel  View Edit History Popularity Trend  Login to edit  URL By  signing up  for an account on TMDb, you can post directly to Twitter and Facebook. You need to be logged in to continue. Click  here  to login or  here  to sign up.    page_wrap opened in html_head  Join the Community The Basics About TMDb Contact Us Support Forums API Blog Get Involved  Contribution Bible 3rd Party Applications Add New Movie Add New TV Show Community Guidelines Leaderboard Forums Twitter Facebook Legal Terms of Use Privacy Policy Login Sign Up", "character": ["Charley Le Tallec", "Betty", "Roseline Jean-Baptiste", "No\u00ebl Tr\u00e9sor", "Samuel adolescent"]}