{"link": "https://www.themoviedb.org/tv/65451?language=en", "title": "Verdammt Verliebt", "resume": "We don't have an overview translated in English. Help us expand our database by adding one.", "rate": 0, "genre": ["Drama"], "cast": ["Laura Maire", "Florian David Fitz", "Saskia Vester", "Stephan Schwartz", "Tatjana Clasing"], "character": ["Jule Th\u00fcroff", "Tom Severin", "Anke Severin", "Martin Severin", "Isabelle Th\u00fcroff"], "site_data": "html Apps Forums Leaderboard Contribute API Support Discover Movies TV Shows Movies Popular Top Rated Upcoming Now Playing TV Shows Popular Top Rated On TV Airing Today People Popular People Can't find a movie or TV show? Login to create it. en Login Sign Up  ID: 65451   Expand Verdammt Verliebt   (2002) User Score Overview We don't have an overview translated in English. Help us expand our database by adding one. Discussions   Reviews Videos   Images   Changes Report Share Discussions General  0 Content Issues  0 Images Backdrops  0 Posters  1 Videos Trailers  0 Teasers  0 Clips  0 Featurettes  0 Opening Credits  0 Top Billed Cast Laura Maire Jule Th\u00fcroff Florian David Fitz Tom Severin Saskia Vester Anke Severin Stephan Schwartz Martin Severin Tatjana Clasing Isabelle Th\u00fcroff Full Cast & Crew Last Season Season 1 2002 | 26 Episodes Season 1 of Verdammt Verliebt premiered on April 23, 2002. View All Seasons Social Reviews  0 Discussions  0 Media Most Popular Videos  0 Backdrops  0 Posters  1 Recommendations We don't have enough data to suggest any TV shows based on Verdammt Verliebt. You can help by rating TV shows you've seen. Facts Status  Ended Network Certification  - Type  Scripted Original Language  German Runtime  45m Homepage  - Genres Drama Keywords No keywords have been added. Content Score 64 We're so close, yet so far. Top Contributors S 19 Samara C 6 CaptainBarnius  View Edit History Popularity Trend  Login to edit  URL By  signing up  for an account on TMDb, you can post directly to Twitter and Facebook. You need to be logged in to continue. Click  here  to login or  here  to sign up.    page_wrap opened in html_head  Join the Community The Basics About TMDb Contact Us Support Forums API Blog Get Involved  Contribution Bible 3rd Party Applications Add New Movie Add New TV Show Community Guidelines Leaderboard Forums Twitter Facebook Legal Terms of Use Privacy Policy Login Sign Up"}