{"link": "https://www.themoviedb.org/tv/76500?language=en", "title": "Sava\u015f\u00e7\u0131", "resume": "We don't have an overview translated in English. Help us expand our database by adding one.", "rate": 100, "genre": ["War", "Politics"], "cast": ["Berk Oktay", "Gaye Turgut Evin", "Alican Albayrak", "U\u011fur Bi\u00e7er", "Bahad\u0131r Vatano\u011flu"], "character": ["Ka\u011fan Bozok", "Murat G\u00fcndo\u011fdu", "Emre Durmu\u015f", "Galip Ayg\u00fcn"], "site_data": "html Apps Forums Leaderboard Contribute API Support Discover Movies TV Shows Movies Popular Top Rated Upcoming Now Playing TV Shows Popular Top Rated On TV Airing Today People Popular People Can't find a movie or TV show? Login to create it. en Login Sign Up  ID: 76500   Expand Sava\u015f\u00e7\u0131   (2017) User Score Overview We don't have an overview translated in English. Help us expand our database by adding one. Featured Crew Volkan Kocat\u00fcrk Creator Eray Ko\u00e7ak Creator Discussions   Reviews Videos   Images   Changes Report Share Discussions General  0 Content Issues  0 Images Backdrops  5 Posters  1 Videos Trailers  0 Teasers  0 Clips  0 Featurettes  0 Opening Credits  0 Top Billed Cast Berk Oktay Ka\u011fan Bozok Gaye Turgut Evin Alican Albayrak Murat G\u00fcndo\u011fdu U\u011fur Bi\u00e7er Emre Durmu\u015f Bahad\u0131r Vatano\u011flu Galip Ayg\u00fcn Full Cast & Crew Last Season Season 2 2017 | 27 Episodes Season 2 of Sava\u015f\u00e7\u0131 premiered on September 13, 2017. View All Seasons Social Reviews  0 Discussions  0 Media Most Popular Videos  0 Backdrops  5 Posters  1 Recommendations We don't have enough data to suggest any TV shows based on Sava\u015f\u00e7\u0131. You can help by rating TV shows you've seen. Facts Status  Returning Series Network Certification  - Type  Reality Original Language  Turkish Runtime  120m Homepage   https://www.fox.com.tr/Savasci/ Genres War & Politics Keywords No keywords have been added. Content Score 93 Almost there... Top Contributors 47 \u0130lkiny 7 moviefars TB 1 TMDb Bot  View Edit History Popularity Trend  Login to edit  URL By  signing up  for an account on TMDb, you can post directly to Twitter and Facebook. You need to be logged in to continue. Click  here  to login or  here  to sign up.    page_wrap opened in html_head  Join the Community The Basics About TMDb Contact Us Support Forums API Blog Get Involved  Contribution Bible 3rd Party Applications Add New Movie Add New TV Show Community Guidelines Leaderboard Forums Twitter Facebook Legal Terms of Use Privacy Policy Login Sign Up"}