{"link": "https://www.themoviedb.org/tv/1562?language=en", "title": "The Bachelorette", "resume": "A single bachelorette dates multiple men over several weeks, narrowing them down to hopefully find her true love.", "rate": 38, "genre": ["Drama", "Reality"], "cast": ["Chris Harrison"], "character": ["Himself - Host"], "site_data": "html Apps Forums Leaderboard Contribute API Support Discover Movies TV Shows Movies Popular Top Rated Upcoming Now Playing TV Shows Popular Top Rated On TV Airing Today People Popular People Can't find a movie or TV show? Login to create it. en Login Sign Up  ID: 1562   Expand The Bachelorette   (2003) User Score  Play Trailer Overview A single bachelorette dates multiple men over several weeks, narrowing them down to hopefully find her true love. Featured Crew Mike Fleiss Creator Discussions   Reviews Videos   Images   Changes Report Share Discussions General  0 Content Issues  0 Images Backdrops  9 Posters  5 Videos Trailers  1 Teasers  0 Clips  0 Featurettes  0 Opening Credits  0 Top Billed Cast Chris Harrison Himself - Host Full Cast & Crew Current Season Season 14 2018 | 6 Episodes View All Seasons Social Reviews  0 Discussions  0 Media Most Popular Videos  1 Backdrops  9 Posters  5 Recommendations   2002-03-25 The Bachelor 5.2    2014-08-04 Bachelor in Paradise 5.5    2012-03-11 Shahs of Sunset 5.3    2007-07-09 Greek 6.3    2003-05-20 America's Next Top Model 4.5    1997-04-20 The Angry Beavers 6.9    2008-01-31 Eli Stone 6.7    1994-04-01 Sister, Sister 5.9  Facts Status  Returning Series Network Certification TV-14 Meaning This program contains some material that many parents would find unsuitable for children under 14 years of age. Type  Reality Original Language  English Runtime  85m Homepage   http://abc.go.com/shows/the-bachelorette Genres Drama Reality Keywords reality competition dating show Content Score 71 Just a little bit more... Top Contributors 65 Elizabeth Jennings M 16 MAthePA 10 Banana S 7 Snackdish  View Edit History Popularity Trend  Login to edit  URL By  signing up  for an account on TMDb, you can post directly to Twitter and Facebook. You need to be logged in to continue. Click  here  to login or  here  to sign up.    page_wrap opened in html_head  Join the Community The Basics About TMDb Contact Us Support Forums API Blog Get Involved  Contribution Bible 3rd Party Applications Add New Movie Add New TV Show Community Guidelines Leaderboard Forums Twitter Facebook Legal Terms of Use Privacy Policy Login Sign Up"}