{"link": "https://www.themoviedb.org/tv/70776?language=en", "title": "Black Belt Kaler Pink", "resume": "Two men who do not like terrorism to be a security guard to a star, Timora Ali. They prefer feminine activities such as cooking, sewing and watching dramas.", "rate": 0, "genre": ["Drama"], "cast": ["Ekin Kamarudin", "Mia Nasir", "Kay Khydir", "Farali Khan", "Aaron Aziz"], "character": ["Farah", "Tasha", "Adam", "Timora", "Ash"], "site_data": "html Apps Forums Leaderboard Contribute API Support Discover Movies TV Shows Movies Popular Top Rated Upcoming Now Playing TV Shows Popular Top Rated On TV Airing Today People Popular People Can't find a movie or TV show? Login to create it. en Login Sign Up  ID: 70776   Expand Black Belt Kaler Pink   (2017) User Score Overview Two men who do not like terrorism to be a security guard to a star, Timora Ali. They prefer feminine activities such as cooking, sewing and watching dramas. Discussions   Reviews Videos   Images   Changes Report Share Discussions General  0 Content Issues  0 Images Backdrops  0 Posters  1 Videos Trailers  0 Teasers  0 Clips  0 Featurettes  0 Opening Credits  0 Top Billed Cast Ekin Kamarudin Farah Mia Nasir Tasha Kay Khydir Adam Farali Khan Timora Aaron Aziz Ash Full Cast & Crew Last Season Season 1 2017 | 23 Episodes Season 1 of Black Belt Kaler Pink premiered on March 15, 2017. View All Seasons Social Reviews  0 Discussions  0 Media Most Popular Videos  0 Backdrops  0 Posters  1 Recommendations We don't have enough data to suggest any TV shows based on Black Belt Kaler Pink. You can help by rating TV shows you've seen. Facts Status  Returning Series Network Astro Warna Certification  - Type  Scripted Original Language  Malay Runtime  44m Homepage  - Genres Drama Keywords No keywords have been added. Content Score 71 Just a little bit more... Top Contributors v 33 vplaytv v 3 vplaytv2 1 CyberTech 1 Elizabeth Jennings  View Edit History Popularity Trend  Login to edit  URL By  signing up  for an account on TMDb, you can post directly to Twitter and Facebook. You need to be logged in to continue. Click  here  to login or  here  to sign up.    page_wrap opened in html_head  Join the Community The Basics About TMDb Contact Us Support Forums API Blog Get Involved  Contribution Bible 3rd Party Applications Add New Movie Add New TV Show Community Guidelines Leaderboard Forums Twitter Facebook Legal Terms of Use Privacy Policy Login Sign Up"}