{"link": "https://www.themoviedb.org/tv/75598?language=en", "title": "COMIC - The Web Series", "resume": "We don't have an overview translated in English. Help us expand our database by adding one.", "rate": 70, "genre": ["Sci-Fi", "Fantasy", "Comedy", "Action", "Adventure"], "cast": ["Francesco Marro"], "character": ["Matt Valenti"], "site_data": "html Apps Forums Leaderboard Contribute API Support Discover Movies TV Shows Movies Popular Top Rated Upcoming Now Playing TV Shows Popular Top Rated On TV Airing Today People Popular People Can't find a movie or TV show? Login to create it. en Login Sign Up  ID: 75598   Expand COMIC - The Web Series   (2017) User Score Overview We don't have an overview translated in English. Help us expand our database by adding one. Featured Crew Mattia Capone Creator Alessandro Garelli Creator Discussions   Reviews Videos   Images   Changes Report Share Discussions General  0 Content Issues  0 Images Backdrops  2 Posters  1 Videos Trailers  0 Teasers  0 Clips  0 Featurettes  0 Opening Credits  0 Top Billed Cast Francesco Marro Matt Valenti Full Cast & Crew Last Season Season 1 2017 | 5 Episodes Season 1 of COMIC - The Web Series premiered on May 17, 2017. View All Seasons Social Reviews  0 Discussions  0 Media Most Popular Videos  0 Backdrops  2 Posters  1 Recommendations We don't have enough data to suggest any TV shows based on COMIC - The Web Series. You can help by rating TV shows you've seen. Facts Status  Returning Series Network Certification  - Type  Scripted Original Language  Italian Runtime  10m Homepage  - Genres Sci-Fi & Fantasy Comedy Action & Adventure Keywords fantasy cartoon comic Content Score 56 We're so close, yet so far. Top Contributors 34 bstarko  View Edit History Popularity Trend  Login to edit  URL By  signing up  for an account on TMDb, you can post directly to Twitter and Facebook. You need to be logged in to continue. Click  here  to login or  here  to sign up.    page_wrap opened in html_head  Join the Community The Basics About TMDb Contact Us Support Forums API Blog Get Involved  Contribution Bible 3rd Party Applications Add New Movie Add New TV Show Community Guidelines Leaderboard Forums Twitter Facebook Legal Terms of Use Privacy Policy Login Sign Up"}