{"link": "https://www.themoviedb.org/tv/1560?language=en", "title": "Floris", "resume": "Floris is a 1969 Dutch television action series, written by Gerard Soeteman starring Rutger Hauer and Jos Bergman and directed by Paul Verhoeven.", "rate": null, "genre": ["Drama"], "cast": ["Rutger Hauer", "Jos Bergman", "Ton Vos", "Hans Culeman", "Jacco van Renesse"], "site_data": "html Apps Forums Leaderboard Contribute API Support Discover Movies TV Shows Movies Popular Top Rated Upcoming Now Playing TV Shows Popular Top Rated On TV Airing Today People Popular People Can't find a movie or TV show? Login to create it. en Login Sign Up  ID: 1560   Expand Floris   (1969) User Score Overview Floris is a 1969 Dutch television action series, written by Gerard Soeteman starring Rutger Hauer and Jos Bergman and directed by Paul Verhoeven. Featured Crew Paul Verhoeven Creator Discussions   Reviews Videos   Images   Changes Report Share Discussions General  0 Content Issues  0 Images Backdrops  2 Posters  2 Videos Trailers  0 Teasers  0 Clips  0 Featurettes  0 Opening Credits  0 Top Billed Cast Rutger Hauer Floris Jos Bergman Sindala Ton Vos Wolter van Oldenstein Hans Culeman Maarten van Rossem Jacco van Renesse Rogier Full Cast & Crew Last Season Season 1 \u2014 | 12 Episodes We don't have an overview translated in English. Help us expand our database by adding one. View All Seasons Social Reviews  0 Discussions  0 Media Most Popular Videos  0 Backdrops  2 Posters  2 Recommendations We don't have enough data to suggest any TV shows based on Floris. You can help by rating TV shows you've seen. Facts Status  Ended Network NTS Certification  - Type  Scripted Original Language  Dutch; Flemish Runtime  30m Homepage  - Genres Drama Keywords No keywords have been added. Content Score 93 Almost there... Top Contributors 10 lmvd t 3 tmdb71778396  View Edit History Popularity Trend  Login to edit  URL By  signing up  for an account on TMDb, you can post directly to Twitter and Facebook. You need to be logged in to continue. Click  here  to login or  here  to sign up.    page_wrap opened in html_head  Join the Community The Basics About TMDb Contact Us Support Forums API Blog Get Involved  Contribution Bible 3rd Party Applications Add New Movie Add New TV Show Community Guidelines Leaderboard Forums Twitter Facebook Legal Terms of Use Privacy Policy Login Sign Up", "character": ["Floris", "Sindala", "Wolter van Oldenstein", "Maarten van Rossem", "Rogier"]}