{"link": "https://www.themoviedb.org/tv/80107?language=en", "title": "The Corridor Crew", "resume": "Corridor Digital is a production studio based on the idea of passion projects, hard work, and creativity.  Watch their struggles and victories as filmmakers, friends, and people.", "rate": 90, "genre": ["Documentary"], "cast": ["Niko Pueringer", "Sam Gorski", "Wren Weichman", "Jake Watson", "Nick Laurant"], "character": ["Himself", "Himself", "Himself", "Himself", "Himself"], "site_data": "html Apps Forums Leaderboard Contribute API Support Discover Movies TV Shows Movies Popular Top Rated Upcoming Now Playing TV Shows Popular Top Rated On TV Airing Today People Popular People Can't find a movie or TV show? Login to create it. en Login Sign Up  ID: 80107   Expand The Corridor Crew   (2016) User Score Overview Corridor Digital is a production studio based on the idea of passion projects, hard work, and creativity.  Watch their struggles and victories as filmmakers, friends, and people. Featured Crew Niko Pueringer Creator Sam Gorski Creator Discussions   Reviews Videos   Images   Changes Report Share Discussions General  0 Content Issues  0 Images Backdrops  1 Posters  1 Videos Trailers  0 Teasers  0 Clips  0 Featurettes  0 Opening Credits  0 Top Billed Cast Niko Pueringer Himself Sam Gorski Himself Wren Weichman Himself Jake Watson Himself Nick Laurant Himself Full Cast & Crew Current Season Season 3 2018 | 53 Episodes View All Seasons Social Reviews  0 Discussions  0 Media Most Popular Videos  0 Backdrops  1 Posters  1 Recommendations We don't have enough data to suggest any TV shows based on The Corridor Crew. You can help by rating TV shows you've seen. Facts Status  Returning Series Network Certification  - Type  Documentary Original Language  English Runtime  12m Homepage   https://www.youtube.com/user/samandniko/ Genres Documentary Keywords No keywords have been added. Content Score 93 Almost there... Top Contributors 58 Jonthemantis  View Edit History Popularity Trend  Login to edit  URL By  signing up  for an account on TMDb, you can post directly to Twitter and Facebook. You need to be logged in to continue. Click  here  to login or  here  to sign up.    page_wrap opened in html_head  Join the Community The Basics About TMDb Contact Us Support Forums API Blog Get Involved  Contribution Bible 3rd Party Applications Add New Movie Add New TV Show Community Guidelines Leaderboard Forums Twitter Facebook Legal Terms of Use Privacy Policy Login Sign Up"}