{"link": "https://www.themoviedb.org/tv/62866?language=en", "title": "The Smoke", "resume": "An experienced fire fighter is badly injured and spends almost a year recovering at home. Now he returns to work, but is he as emotionally and physically sound as he thinks he is?", "rate": 90, "genre": ["Drama"], "cast": ["Martyn Ellis", "Jamie Bamber", "Jodie Whittaker", "David Walmsley", "Rhashan Stone"], "character": ["Big Al", "Kev Allison", "Trish Tooley", "Rob", "Mal Milligan"], "site_data": "html Apps Forums Leaderboard Contribute API Support Discover Movies TV Shows Movies Popular Top Rated Upcoming Now Playing TV Shows Popular Top Rated On TV Airing Today People Popular People Can't find a movie or TV show? Login to create it. en Login Sign Up  ID: 62866   Expand The Smoke   (2014) User Score  Play Trailer Overview An experienced fire fighter is badly injured and spends almost a year recovering at home. Now he returns to work, but is he as emotionally and physically sound as he thinks he is? Featured Crew Lucy Kirkwood Creator Discussions   Reviews Videos   Images   Changes Report Share Discussions General  0 Content Issues  1 Images Backdrops  3 Posters  3 Videos Trailers  1 Teasers  0 Clips  0 Featurettes  0 Opening Credits  0 Top Billed Cast Martyn Ellis Big Al Jamie Bamber Kev Allison Jodie Whittaker Trish Tooley David Walmsley Rob Rhashan Stone Mal Milligan Full Cast & Crew Last Season Season 1 2014 | 8 Episodes Season 1 of The Smoke premiered on February 20, 2014. View All Seasons Social Reviews  0 Discussions  0 Media Most Popular Videos  1 Backdrops  3 Posters  3 Recommendations We don't have enough data to suggest any TV shows based on The Smoke. You can help by rating TV shows you've seen. Facts Status  Cancelled Network Certification 15 Meaning No-one under 15 is allowed to see a 15 film at the cinema or buy/rent a 15 rated video. 15 rated works are not suitable for children under 15 years of age. Type  Scripted Original Language  English Runtime  44m Homepage   http://www.sky.com/tv/show/the-smoke Genres Drama Keywords london england firemen injury fire department Content Score 100 Yes! Looking good! Top Contributors 37 Banana D 2 Dedale 2 Elizabeth Jennings T 1 Torq00  View Edit History Popularity Trend  Login to edit  URL By  signing up  for an account on TMDb, you can post directly to Twitter and Facebook. You need to be logged in to continue. Click  here  to login or  here  to sign up.    page_wrap opened in html_head  Join the Community The Basics About TMDb Contact Us Support Forums API Blog Get Involved  Contribution Bible 3rd Party Applications Add New Movie Add New TV Show Community Guidelines Leaderboard Forums Twitter Facebook Legal Terms of Use Privacy Policy Login Sign Up"}