{"link": "https://www.themoviedb.org/tv/62278?language=en", "title": "Aqu\u00ed Paz y despu\u00e9s Gloria", "resume": "We don't have an overview translated in English. Help us expand our database by adding one.", "rate": 0, "genre": ["Comedy"], "cast": ["Antonio Resines", "Antonio Molero", "M\u00f3nica Estarreado", "Bel\u00e9n Cuesta", "Nazaret Jim\u00e9nez Arag\u00f3n"], "character": ["Francisco \"Paco\" L\u00f3pez / Padre \u00c1ngel L\u00f3pez", "Padre Juli\u00e1n", "Paz", "Teresa \"Tere\"", "Gloria"], "site_data": "html Apps Forums Leaderboard Contribute API Support Discover Movies TV Shows Movies Popular Top Rated Upcoming Now Playing TV Shows Popular Top Rated On TV Airing Today People Popular People Can't find a movie or TV show? Login to create it. en Login Sign Up  ID: 62278   Expand Aqu\u00ed Paz y despu\u00e9s Gloria   (2015) User Score Overview We don't have an overview translated in English. Help us expand our database by adding one. Discussions   Reviews Videos   Images   Changes Report Share Discussions General  0 Content Issues  0 Images Backdrops  8 Posters  3 Videos Trailers  0 Teasers  0 Clips  0 Featurettes  0 Opening Credits  0 Top Billed Cast Antonio Resines Francisco \"Paco\" L\u00f3pez / Padre \u00c1ngel L\u00f3pez Antonio Molero Padre Juli\u00e1n M\u00f3nica Estarreado Paz Bel\u00e9n Cuesta Teresa \"Tere\" Nazaret Jim\u00e9nez Arag\u00f3n Gloria Full Cast & Crew Last Season Season 1 2015 | 8 Episodes Season 1 of Aqu\u00ed Paz y despu\u00e9s Gloria premiered on March 24, 2015. View All Seasons Social Reviews  0 Discussions  0 Media Most Popular Videos  0 Backdrops  8 Posters  3 Recommendations We don't have enough data to suggest any TV shows based on Aqu\u00ed Paz y despu\u00e9s Gloria. You can help by rating TV shows you've seen. Facts Status  Ended Network Certification  - Type  Scripted Original Language  Spanish; Castilian Runtime  70m Homepage   http://www.telecinco.es/aquipazydespuesgloria/ Genres Comedy Keywords false identity priest church religious twins Content Score 86 Almost there... Top Contributors 36 prm96 25 United600 S 5 SerialeOnline2015 z 5 zurman1  View Edit History Popularity Trend  Login to edit  URL By  signing up  for an account on TMDb, you can post directly to Twitter and Facebook. You need to be logged in to continue. Click  here  to login or  here  to sign up.    page_wrap opened in html_head  Join the Community The Basics About TMDb Contact Us Support Forums API Blog Get Involved  Contribution Bible 3rd Party Applications Add New Movie Add New TV Show Community Guidelines Leaderboard Forums Twitter Facebook Legal Terms of Use Privacy Policy Login Sign Up"}