{"link": "https://www.themoviedb.org/tv/66634?language=en", "title": "Wanted", "resume": "One of Korea's top actresses has her son kidnapped. She struggles to carry out a mission on a live reality show following the kidnapper's demands.", "rate": 59, "genre": ["Action", "Adventure", "Crime", "Drama", "Mystery"], "cast": ["Kim Ah-joong", "Ji Hyun-woo", "Uhm Tae-woong", "Park Hae-joon", "Lee Mun-sik"], "character": ["Jung Hye-In", "Cha Seung-In", "Shin Dong-Wook", "Song Jung-Ho", "Choi Joon-Goo"], "site_data": "html Apps Forums Leaderboard Contribute API Support Discover Movies TV Shows Movies Popular Top Rated Upcoming Now Playing TV Shows Popular Top Rated On TV Airing Today People Popular People Can't find a movie or TV show? Login to create it. en Login Sign Up  ID: 66634   Expand Wanted   (2016) User Score Overview One of Korea's top actresses has her son kidnapped. She struggles to carry out a mission on a live reality show following the kidnapper's demands. Discussions   Reviews Videos   Images   Changes Report Share Discussions General  0 Content Issues  0 Images Backdrops  2 Posters  2 Videos Trailers  0 Teasers  0 Clips  0 Featurettes  0 Opening Credits  0 Top Billed Cast Kim Ah-joong Jung Hye-In Ji Hyun-woo Cha Seung-In Uhm Tae-woong Shin Dong-Wook Park Hae-joon Song Jung-Ho Lee Mun-sik Choi Joon-Goo Full Cast & Crew Last Season Season 1 2016 | 16 Episodes Season 1 of Wanted premiered on June 22, 2016. View All Seasons Social Reviews  0 Discussions  0 Media Most Popular Videos  0 Backdrops  2 Posters  2 Recommendations   2016-08-27 Our Gap Soon 9.3    2016-03-05 Marriage Contract 8.2    2016-07-30 Second To Last Love 8.3    2016-04-27 Master: God of Noodles 7.3    2016-09-21 On the Way to the Airport 8.7    2016-05-25 Lucky Romance 7.3    2016-02-24 Please Come Back, Mister 7.0    2016-09-26 Woman with a Suitcase 7.1  Facts Original Name  \uc6d0\ud2f0\ub4dc Status  Ended Network Certification 15 Meaning This rating is for programs that contain material that may be inappropriate for children under 15, and that parental discretion should be used. Examples include most dramas, and talk shows on OTA (over-the-air) TV (KBS, MBC, SBS), and many American TV shows/dramas on Cable TV channels like OCN and OnStyle. The programs that have this rating may include moderate or strong adult themes, language, sexual inference, and violence. As with the TV-MA rating in North America, this rating is commonly applied to live events where the occurrence of inappropriate dialogue is unpredictable. Since 2007, this rating is the most used rating for TV. Type  Scripted Original Language  Korean Runtime  60m Homepage   http://tv.sbs.co.kr/wanted/ Genres Action & Adventure Crime Drama Mystery Keywords investigation Content Score 93 Almost there... Top Contributors M 50 Maria180493 13 daliasued z 10 zurman1 10 Elizabeth Jennings  View Edit History Popularity Trend  Login to edit  URL By  signing up  for an account on TMDb, you can post directly to Twitter and Facebook. You need to be logged in to continue. Click  here  to login or  here  to sign up.    page_wrap opened in html_head  Join the Community The Basics About TMDb Contact Us Support Forums API Blog Get Involved  Contribution Bible 3rd Party Applications Add New Movie Add New TV Show Community Guidelines Leaderboard Forums Twitter Facebook Legal Terms of Use Privacy Policy Login Sign Up"}