{"link": "https://www.themoviedb.org/tv/62524?language=en", "title": "All\u00ed abajo", "resume": "We don't have an overview translated in English. Help us expand our database by adding one.", "rate": 33, "genre": ["Family", "Comedy"], "cast": ["Mar\u00eda Le\u00f3n", "Jon Plazaola", "Mariano Pe\u00f1a", "Alfonso S\u00e1nchez", "Salva Reina"], "character": ["Carmen Almonte Morales", "I\u00f1aki Irazabalbeitia Galarza", "Don Benito Benjumea", "Rober", "Joz\u00e9"], "site_data": "html Apps Forums Leaderboard Contribute API Support Discover Movies TV Shows Movies Popular Top Rated Upcoming Now Playing TV Shows Popular Top Rated On TV Airing Today People Popular People Can't find a movie or TV show? Login to create it. en Login Sign Up  ID: 62524   Expand All\u00ed abajo   (2015) User Score Overview We don't have an overview translated in English. Help us expand our database by adding one. Featured Crew Aitor Gabilondo Creator C\u00e9sar Ben\u00edtez Creator \u00d3scar Terol Creator Discussions   Reviews Videos   Images   Changes Report Share Discussions General  0 Content Issues  0 Images Backdrops  3 Posters  3 Videos Trailers  0 Teasers  0 Clips  0 Featurettes  0 Opening Credits  0 Top Billed Cast Mar\u00eda Le\u00f3n Carmen Almonte Morales Jon Plazaola I\u00f1aki Irazabalbeitia Galarza Mariano Pe\u00f1a Don Benito Benjumea Alfonso S\u00e1nchez Rober Salva Reina Joz\u00e9 Full Cast & Crew Current Season Season 4 2018 | 16 Episodes Season 4 of All\u00ed abajo premiered on April  2, 2018. View All Seasons Social Reviews  0 Discussions  0 Media Most Popular Videos  0 Backdrops  3 Posters  3 Recommendations We don't have enough data to suggest any TV shows based on All\u00ed abajo. You can help by rating TV shows you've seen. Facts Status  Returning Series Network Certification  - Type  Scripted Original Language  Spanish; Castilian Runtime  75m Homepage   http://www.antena3.com/series/alli-abajo/ Genres Family Comedy Keywords No keywords have been added. Content Score 86 Almost there... Top Contributors 33 prm96 JR 21 Johnny Rotring 11 stego77 8 United600  View Edit History Popularity Trend  Login to edit  URL By  signing up  for an account on TMDb, you can post directly to Twitter and Facebook. You need to be logged in to continue. Click  here  to login or  here  to sign up.    page_wrap opened in html_head  Join the Community The Basics About TMDb Contact Us Support Forums API Blog Get Involved  Contribution Bible 3rd Party Applications Add New Movie Add New TV Show Community Guidelines Leaderboard Forums Twitter Facebook Legal Terms of Use Privacy Policy Login Sign Up"}