{"link": "https://www.themoviedb.org/tv/49258?language=en", "title": "Spartacus", "resume": "Spartacus, who was enslaved by the Romans after they murdered his father, leads fellow slaves in an attempt to overthrow the repressive Roman Empire.", "rate": 63, "genre": ["Action", "Adventure", "War", "Politics", "Drama"], "cast": ["Goran Visnjic", "Alan Bates", "Angus Macfadyen", "Rhona Mitra", "Ian McNeice"], "character": ["Spartacus", "Antonius Agrippa", "Marcus Crassus", "Varinia", "Lentulus Batiatus"], "site_data": "html Apps Forums Leaderboard Contribute API Support Discover Movies TV Shows Movies Popular Top Rated Upcoming Now Playing TV Shows Popular Top Rated On TV Airing Today People Popular People Can't find a movie or TV show? Login to create it. en Login Sign Up  ID: 49258   Expand Spartacus   (2004) User Score Overview Spartacus, who was enslaved by the Romans after they murdered his father, leads fellow slaves in an attempt to overthrow the repressive Roman Empire. Discussions   Reviews Videos   Images   Changes Report Share Discussions General  0 Content Issues  0 Images Backdrops  0 Posters  2 Videos Trailers  0 Teasers  0 Clips  0 Featurettes  0 Opening Credits  0 Top Billed Cast Goran Visnjic Spartacus Alan Bates Antonius Agrippa Angus Macfadyen Marcus Crassus Rhona Mitra Varinia Ian McNeice Lentulus Batiatus Full Cast & Crew Last Season Season 1 2004 | 2 Episodes Season 1 of Spartacus premiered on April 18, 2004. View All Seasons Social Reviews  0 Discussions  0 Media Most Popular Videos  0 Backdrops  0 Posters  2 Recommendations We don't have enough data to suggest any TV shows based on Spartacus. You can help by rating TV shows you've seen. Facts Status  Ended Network Certification  - Type  Scripted Original Language  English Runtime  87m Homepage  - Genres Action & Adventure War & Politics Drama Keywords gladiator slavery spartacus Content Score 71 Just a little bit more... Top Contributors 38 Marr \ud83c\uddf3\ud83c\uddf1 s 3 speedycars z 3 zurman1 a 1 apacu  View Edit History Popularity Trend  Login to edit  URL By  signing up  for an account on TMDb, you can post directly to Twitter and Facebook. You need to be logged in to continue. Click  here  to login or  here  to sign up.    page_wrap opened in html_head  Join the Community The Basics About TMDb Contact Us Support Forums API Blog Get Involved  Contribution Bible 3rd Party Applications Add New Movie Add New TV Show Community Guidelines Leaderboard Forums Twitter Facebook Legal Terms of Use Privacy Policy Login Sign Up"}