{"link": "https://www.themoviedb.org/tv/77514?language=en", "title": "American Dynasties: The Kennedys", "resume": "Explore the Kennedy family's rise to power and how personal relationships within the Kennedy dynasty shaped national and global events from the Cold War to the Wall Street crash.", "rate": null, "genre": ["Documentary"], "cast": ["Martin Sheen"], "site_data": "html Apps Forums Leaderboard Contribute API Support Discover Movies TV Shows Movies Popular Top Rated Upcoming Now Playing TV Shows Popular Top Rated On TV Airing Today People Popular People Can't find a movie or TV show? Login to create it. en Login Sign Up  ID: 77514   Expand American Dynasties: The Kennedys   (2018) User Score  Play Trailer Overview Explore the Kennedy family's rise to power and how personal relationships within the Kennedy dynasty shaped national and global events from the Cold War to the Wall Street crash. Discussions   Reviews Videos   Images   Changes Report Share Discussions General  0 Content Issues  0 Images Backdrops  3 Posters  1 Videos Trailers  1 Teasers  0 Clips  0 Featurettes  0 Opening Credits  0 Top Billed Cast Martin Sheen Narrator Full Cast & Crew Current Season Season 1 2018 | 6 Episodes Season 1 of American Dynasties: The Kennedys premiered on March 11, 2018. View All Seasons Social Reviews  0 Discussions  0 Media Most Popular Videos  1 Backdrops  3 Posters  1 Recommendations We don't have enough data to suggest any TV shows based on American Dynasties: The Kennedys. You can help by rating TV shows you've seen. Facts Status  Returning Series Network Certification  - Type  Miniseries Original Language  English Runtime  42m Homepage   https://www.cnn.com/shows/the-kennedys-american-dynasties Genres Documentary Keywords kennedy family american history 20th century Content Score 64 We're so close, yet so far. Top Contributors R 16 Rebecca 15 Elizabeth Jennings a 4 aditia098 TB 1 TMDb Bot  View Edit History Popularity Trend  Login to edit  URL By  signing up  for an account on TMDb, you can post directly to Twitter and Facebook. You need to be logged in to continue. Click  here  to login or  here  to sign up.    page_wrap opened in html_head  Join the Community The Basics About TMDb Contact Us Support Forums API Blog Get Involved  Contribution Bible 3rd Party Applications Add New Movie Add New TV Show Community Guidelines Leaderboard Forums Twitter Facebook Legal Terms of Use Privacy Policy Login Sign Up", "character": ["Narrator"]}