{"link": "https://www.themoviedb.org/tv/9897?language=en", "title": "Coupling", "resume": "Coupling is a 2003 American remake of the British television sitcom of the same title, which aired on NBC.", "rate": null, "genre": ["Comedy"], "cast": ["Colin Ferguson", "Jay Harrington", "Lindsay Price", "Sonya Walger", "Julie Benz"], "site_data": "html Apps Forums Leaderboard Contribute API Support Discover Movies TV Shows Movies Popular Top Rated Upcoming Now Playing TV Shows Popular Top Rated On TV Airing Today People Popular People Can't find a movie or TV show? Login to create it. en Login Sign Up  ID: 9897   Expand Coupling   (2003) User Score Overview Coupling is a 2003 American remake of the British television sitcom of the same title, which aired on NBC. Featured Crew Steven Moffat Creator Discussions   Reviews Videos   Images   Changes Report Share Discussions General  0 Content Issues  0 Images Backdrops  3 Posters  2 Videos Trailers  0 Teasers  0 Clips  0 Featurettes  0 Opening Credits  0 Top Billed Cast Colin Ferguson Jay Harrington Lindsay Price Jane Honda Sonya Walger Julie Benz Amanda Full Cast & Crew Last Season Season 1 2003 | 10 Episodes Season 1 of Coupling premiered on September 25, 2003. View All Seasons Social Reviews  0 Discussions  0 Media Most Popular Videos  0 Backdrops  3 Posters  2 Recommendations We don't have enough data to suggest any TV shows based on Coupling. You can help by rating TV shows you've seen. Facts Status  Ended Network Certification  - Type  Scripted Original Language  English Runtime  30m, 20m Homepage   http://www.bbc.co.uk/comedy/coupling/ Genres Comedy Keywords remake group of friends sitcom Content Score 93 Almost there... Top Contributors 5 Banana s 3 speedycars O 1 Ozbourne J 1 Jenn  View Edit History Popularity Trend  Login to edit  URL By  signing up  for an account on TMDb, you can post directly to Twitter and Facebook. You need to be logged in to continue. Click  here  to login or  here  to sign up.    page_wrap opened in html_head  Join the Community The Basics About TMDb Contact Us Support Forums API Blog Get Involved  Contribution Bible 3rd Party Applications Add New Movie Add New TV Show Community Guidelines Leaderboard Forums Twitter Facebook Legal Terms of Use Privacy Policy Login Sign Up", "character": ["Jane Honda", "Amanda"]}