{"link": "https://www.themoviedb.org/tv/2068?language=en", "title": "Life Begins", "resume": "Life Begins is a British television drama first broadcast on ITV between February 2004 and October 2006, starring Caroline Quentin and Alexander Armstrong, Anne Reid and Frank Finlay.", "rate": null, "genre": ["Drama", "Comedy"], "cast": ["Frank Finlay", "Caroline Quentin", "Danny Webb", "Alexander Armstrong", "Anne Reid"], "site_data": "html Apps Forums Leaderboard Contribute API Support Discover Movies TV Shows Movies Popular Top Rated Upcoming Now Playing TV Shows Popular Top Rated On TV Airing Today People Popular People Can't find a movie or TV show? Login to create it. en Login Sign Up  ID: 2068   Expand Life Begins   (2004) User Score Overview Life Begins is a British television drama first broadcast on ITV between February 2004 and October 2006, starring Caroline Quentin and Alexander Armstrong, Anne Reid and Frank Finlay. Featured Crew Mike Bullen Creator Discussions   Reviews Videos   Images   Changes Report Share Discussions General  0 Content Issues  0 Images Backdrops  0 Posters  2 Videos Trailers  0 Teasers  0 Clips  0 Featurettes  0 Opening Credits  0 Top Billed Cast Frank Finlay Caroline Quentin Maggie Mee Danny Webb Alexander Armstrong Phil Mee Anne Reid Full Cast & Crew Last Season Season 3 2006 | 6 Episodes Season 3 of Life Begins premiered on September  4, 2006. View All Seasons Social Reviews  0 Discussions  0 Media Most Popular Videos  0 Backdrops  0 Posters  2 Recommendations We don't have enough data to suggest any TV shows based on Life Begins. You can help by rating TV shows you've seen. Facts Status  Ended Network Certification  - Type  Scripted Original Language  English Runtime  60m Homepage  - Genres Drama Comedy Keywords No keywords have been added. Content Score 79 Pump it up! We're close now. Top Contributors 4 kcdh TB 2 TMDb Bot  View Edit History Popularity Trend  Login to edit  URL By  signing up  for an account on TMDb, you can post directly to Twitter and Facebook. You need to be logged in to continue. Click  here  to login or  here  to sign up.    page_wrap opened in html_head  Join the Community The Basics About TMDb Contact Us Support Forums API Blog Get Involved  Contribution Bible 3rd Party Applications Add New Movie Add New TV Show Community Guidelines Leaderboard Forums Twitter Facebook Legal Terms of Use Privacy Policy Login Sign Up", "character": ["Maggie Mee", "Phil Mee"]}