{"link": "https://www.themoviedb.org/tv/11634?language=en", "title": "See No Evil: The Moors Murders", "resume": "The dramatisation of one of the most notorious killing sprees in British history.", "rate": null, "genre": ["Drama"], "cast": ["Maxine Peake", "Sean Harris", "Joanne Froggatt", "Matthew McNulty", "George Costigan"], "site_data": "html Apps Forums Leaderboard Contribute API Support Discover Movies TV Shows Movies Popular Top Rated Upcoming Now Playing TV Shows Popular Top Rated On TV Airing Today People Popular People Can't find a movie or TV show? Login to create it. en Login Sign Up  ID: 11634   Expand See No Evil: The Moors Murders   (2006) User Score Overview The dramatisation of one of the most notorious killing sprees in British history. Discussions   Reviews Videos   Images   Changes Report Share Discussions General  0 Content Issues  0 Images Backdrops  2 Posters  2 Videos Trailers  0 Teasers  0 Clips  0 Featurettes  0 Opening Credits  0 Top Billed Cast Maxine Peake Myra Hindley Sean Harris Ian Brady Joanne Froggatt Maureen Smith Matthew McNulty Dave Smith George Costigan DCI Joe Mounsey Full Cast & Crew Last Season Season 1 2006 | 2 Episodes Season 1 of See No Evil: The Moors Murders premiered on May 14, 2006. View All Seasons Social Reviews  0 Discussions  0 Media Most Popular Videos  0 Backdrops  2 Posters  2 Recommendations   2005-03-27 Colditz 6.3  Facts Status  Ended Network Certification  - Type  Miniseries Original Language  English Runtime  90m Homepage  - Genres Drama Keywords No keywords have been added. Content Score 86 Almost there... Top Contributors TB 36 TMDb Bot R 6 Rebecca 4 Keh 3 Banana  View Edit History Popularity Trend  Login to edit  URL By  signing up  for an account on TMDb, you can post directly to Twitter and Facebook. You need to be logged in to continue. Click  here  to login or  here  to sign up.    page_wrap opened in html_head  Join the Community The Basics About TMDb Contact Us Support Forums API Blog Get Involved  Contribution Bible 3rd Party Applications Add New Movie Add New TV Show Community Guidelines Leaderboard Forums Twitter Facebook Legal Terms of Use Privacy Policy Login Sign Up", "character": ["Myra Hindley", "Ian Brady", "Maureen Smith", "Dave Smith", "DCI Joe Mounsey"]}