{"link": "https://www.themoviedb.org/tv/66368?language=en", "title": "Love, Nina", "resume": "Twenty years old and from Leicester, Nina moves to North London in 1982, to care for the two young boys of a working single mother, George, the editor of a London literary review.", "rate": 52, "genre": ["Drama"], "cast": ["Faye Marsay", "Helena Bonham Carter", "Ethan Rouse", "Harry Webster", "Joshua McGuire"], "character": ["Nina", "George", "Joe", "Max", "Nunney"], "site_data": "html Apps Forums Leaderboard Contribute API Support Discover Movies TV Shows Movies Popular Top Rated Upcoming Now Playing TV Shows Popular Top Rated On TV Airing Today People Popular People Can't find a movie or TV show? Login to create it. en Login Sign Up  ID: 66368   Expand Love, Nina   (2016) User Score  Play Trailer Overview Twenty years old and from Leicester, Nina moves to North London in 1982, to care for the two young boys of a working single mother, George, the editor of a London literary review. Discussions   Reviews Videos   Images   Changes Report Share Discussions General  0 Content Issues  0 Images Backdrops  5 Posters  2 Videos Trailers  1 Teasers  0 Clips  0 Featurettes  0 Opening Credits  0 Top Billed Cast Faye Marsay Nina Helena Bonham Carter George Ethan Rouse Joe Harry Webster Max Joshua McGuire Nunney Full Cast & Crew Last Season Mini-Series 2016 | 5 Episodes Season 1 of Love, Nina premiered on May 20, 2016. View All Seasons Social Reviews  0 Discussions  0 Media Most Popular Videos  1 Backdrops  5 Posters  2 Recommendations   2011-08-04 Trollied 6.4  Facts Status  Returning Series Network Certification 12 Meaning Films classified 12A and video works classified 12 contain material that is not generally suitable for children aged under 12. Type  Scripted Original Language  English Runtime  28m Homepage   http://www.bbc.co.uk/programmes/b07cgrjv Genres Drama Keywords london england nanny based on memoir or autobiography single mother 1980s Content Score 93 Almost there... Top Contributors 31 EveDemocracy 24 Elizabeth Jennings 4 Banana e 3 error666  View Edit History Popularity Trend  Login to edit  URL By  signing up  for an account on TMDb, you can post directly to Twitter and Facebook. You need to be logged in to continue. Click  here  to login or  here  to sign up.    page_wrap opened in html_head  Join the Community The Basics About TMDb Contact Us Support Forums API Blog Get Involved  Contribution Bible 3rd Party Applications Add New Movie Add New TV Show Community Guidelines Leaderboard Forums Twitter Facebook Legal Terms of Use Privacy Policy Login Sign Up"}