{"link": "https://www.themoviedb.org/tv/50664?language=en", "title": "Secrets & Lies", "resume": "A man who finds the body of a young boy quickly becomes the prime murder suspect, putting his life and his family at risk.", "rate": 69, "genre": ["Drama", "Mystery"], "cast": ["Martin Henderson", "Anthony Hayes", "Diana Glenn", "Adrienne Pickering", "Philippa Coulthard"], "character": ["Ben Gundelach", "Ian Cornielle", "Christy Gundelach", "Jess Murnane", "Tasha Gundelach"], "site_data": "html Apps Forums Leaderboard Contribute API Support Discover Movies TV Shows Movies Popular Top Rated Upcoming Now Playing TV Shows Popular Top Rated On TV Airing Today People Popular People Can't find a movie or TV show? Login to create it. en Login Sign Up  ID: 50664   Expand Secrets & Lies   (2014) User Score Overview A man who finds the body of a young boy quickly becomes the prime murder suspect, putting his life and his family at risk. Featured Crew Barbie Kligman Creator Discussions   Reviews Videos   Images   Changes Report Share Discussions General  0 Content Issues  0 Images Backdrops  1 Posters  3 Videos Trailers  0 Teasers  0 Clips  0 Featurettes  0 Opening Credits  0 Top Billed Cast Martin Henderson Ben Gundelach Anthony Hayes Ian Cornielle Diana Glenn Christy Gundelach Adrienne Pickering Jess Murnane Philippa Coulthard Tasha Gundelach Full Cast & Crew Last Season The Track 2014 | 6 Episodes Season 1 of Secrets & Lies premiered on March  3, 2014. View All Seasons Social Reviews  0 Discussions  0 Media Most Popular Videos  0 Backdrops  1 Posters  3 Recommendations We don't have enough data to suggest any TV shows based on Secrets & Lies. You can help by rating TV shows you've seen. Facts Status  Ended Network Certification 15 Meaning No-one under 15 is allowed to see a 15 film at the cinema or buy/rent a 15 rated video. 15 rated works are not suitable for children under 15 years of age. Type  Scripted Original Language  English Runtime  43m Homepage  - Genres Drama Mystery Keywords australia murder child murder murder suspect Content Score 100 Yes! Looking good! Top Contributors 15 Steve 12 Elizabeth Jennings 9 Banana 7 Bohdan Shtepan  View Edit History Popularity Trend  Login to edit  URL By  signing up  for an account on TMDb, you can post directly to Twitter and Facebook. You need to be logged in to continue. Click  here  to login or  here  to sign up.    page_wrap opened in html_head  Join the Community The Basics About TMDb Contact Us Support Forums API Blog Get Involved  Contribution Bible 3rd Party Applications Add New Movie Add New TV Show Community Guidelines Leaderboard Forums Twitter Facebook Legal Terms of Use Privacy Policy Login Sign Up"}