{"link": "https://www.themoviedb.org/tv/41158?language=en", "title": "Moselbr\u00fcck", "resume": "Moselbr\u00fcck is a German television series.", "rate": 0, "genre": ["Drama"], "cast": ["Liane Hielscher", "Jocelyne Boisseau", "Hans Putz", "Bernd Seebacher", "Margot Leonard"], "character": ["Hanna Zerfass", "Mich\u00e9le Zerfass", "Ludwig Zerfass", "Martin Zerfass", "Elfriede Zerfass"], "site_data": "html Apps Forums Leaderboard Contribute API Support Discover Movies TV Shows Movies Popular Top Rated Upcoming Now Playing TV Shows Popular Top Rated On TV Airing Today People Popular People Can't find a movie or TV show? Login to create it. en Login Sign Up  ID: 41158   Expand Moselbr\u00fcck   (1987) User Score Overview Moselbr\u00fcck is a German television series. Featured Crew Hans Dieter Schreeb Creator Discussions   Reviews Videos   Images   Changes Report Share Discussions General  0 Content Issues  0 Images Backdrops  0 Posters  1 Videos Trailers  0 Teasers  0 Clips  0 Featurettes  0 Opening Credits  0 Top Billed Cast Liane Hielscher Hanna Zerfass Jocelyne Boisseau Mich\u00e9le Zerfass Hans Putz Ludwig Zerfass Bernd Seebacher Martin Zerfass Margot Leonard Elfriede Zerfass Full Cast & Crew Last Season Season 3 1992 | 10 Episodes Season 3 of Moselbr\u00fcck premiered on December  4, 1992. View All Seasons Social Reviews  0 Discussions  0 Media Most Popular Videos  0 Backdrops  0 Posters  1 Recommendations We don't have enough data to suggest any TV shows based on Moselbr\u00fcck. You can help by rating TV shows you've seen. Facts Status  Ended Network Certification  - Type  Scripted Original Language  German Runtime  50m Homepage  - Genres Drama Keywords No keywords have been added. Content Score 79 Pump it up! We're close now. Top Contributors S 35 Samara L 1 Lemmy_6  View Edit History Popularity Trend  Login to edit  URL By  signing up  for an account on TMDb, you can post directly to Twitter and Facebook. You need to be logged in to continue. Click  here  to login or  here  to sign up.    page_wrap opened in html_head  Join the Community The Basics About TMDb Contact Us Support Forums API Blog Get Involved  Contribution Bible 3rd Party Applications Add New Movie Add New TV Show Community Guidelines Leaderboard Forums Twitter Facebook Legal Terms of Use Privacy Policy Login Sign Up"}