{"link": "https://www.themoviedb.org/tv/12225?language=en", "title": "Peppa Pig", "resume": "Peppa Pig is an energetic piggy who lives with Mummy, Daddy, and little brother George. She loves to jump in mud puddles and make loud snorting noises.", "rate": null, "genre": ["Animation", "Kids"], "cast": ["Lily Snowden-Fine", "Morwenna Banks", "Alice May"], "site_data": "html Apps Forums Leaderboard Contribute API Support Discover Movies TV Shows Movies Popular Top Rated Upcoming Now Playing TV Shows Popular Top Rated On TV Airing Today People Popular People Can't find a movie or TV show? Login to create it. en Login Sign Up  ID: 12225   Expand Peppa Pig   (2004) User Score  Play Trailer Overview Peppa Pig is an energetic piggy who lives with Mummy, Daddy, and little brother George. She loves to jump in mud puddles and make loud snorting noises. Featured Crew Neville Astley Creator Mark Baker Creator Discussions   Reviews Videos   Images   Changes Report Share Discussions General  0 Content Issues  1 Images Backdrops  5 Posters  2 Videos Trailers  1 Teasers  0 Clips  0 Featurettes  0 Opening Credits  0 Top Billed Cast Lily Snowden-Fine Peppa Pig (voice) Morwenna Banks Mummy Pig (voice) Alice May George Pig (voice) Full Cast & Crew Last Season Season 5 2016 | 42 Episodes Season 5 of Peppa Pig premiered on October 24, 2016. View All Seasons Social Reviews  0 Discussions  1 Subject Status Replies Last Reply There are no discussions for Peppa Pig. Login to be first! Go to Discussions Media Most Popular Videos  1 Backdrops  5 Posters  2 Recommendations   2006-03-03 The Wonder Pets 6.3    2005-09-06 Go, Diego, Go! 4.6    2004-10-11 The Backyardigans 7.8    2000-08-13 Dora the Explorer 4.2  Facts Status  Returning Series Network Certification TV-G Meaning Most parents would find this program suitable for all ages. Type  Scripted Original Language  English Runtime  5m Homepage   http://www.channel5.com/show/peppa-pig Genres Animation Kids Keywords kids cartoon pig Content Score 71 Just a little bit more... Top Contributors 15 mgi256 15 Banana 8 Elizabeth Jennings j 7 jeannotmer  View Edit History Popularity Trend  Login to edit  URL By  signing up  for an account on TMDb, you can post directly to Twitter and Facebook. You need to be logged in to continue. Click  here  to login or  here  to sign up.    page_wrap opened in html_head  Join the Community The Basics About TMDb Contact Us Support Forums API Blog Get Involved  Contribution Bible 3rd Party Applications Add New Movie Add New TV Show Community Guidelines Leaderboard Forums Twitter Facebook Legal Terms of Use Privacy Policy Login Sign Up", "character": ["Peppa Pig (voice)", "Mummy Pig (voice)", "George Pig (voice)"]}