{"link": "https://www.themoviedb.org/tv/18260?language=en", "title": "An Age of Kings", "resume": "A linking together of Shakespeare's history plays chronicling the rise and fall of monarchs over the 86 years between Richard II and Richard III.", "rate": 0, "genre": ["Drama"], "cast": ["Terry Scully", "Sean Connery"], "character": ["Henry Percy"], "site_data": "html Apps Forums Leaderboard Contribute API Support Discover Movies TV Shows Movies Popular Top Rated Upcoming Now Playing TV Shows Popular Top Rated On TV Airing Today People Popular People Can't find a movie or TV show? Login to create it. en Login Sign Up  ID: 18260   Expand An Age of Kings   (1960) User Score Overview A linking together of Shakespeare's history plays chronicling the rise and fall of monarchs over the 86 years between Richard II and Richard III. Discussions   Reviews Videos   Images   Changes Report Share Discussions General  0 Content Issues  0 Images Backdrops  0 Posters  1 Videos Trailers  0 Teasers  0 Clips  0 Featurettes  0 Opening Credits  0 Top Billed Cast Terry Scully Sean Connery Henry Percy Full Cast & Crew Last Season Season 1 1960 | 15 Episodes Season 1 of An Age of Kings premiered on April 28, 1960. View All Seasons Social Reviews  0 Discussions  0 Media Most Popular Videos  0 Backdrops  0 Posters  1 Recommendations We don't have enough data to suggest any TV shows based on An Age of Kings. You can help by rating TV shows you've seen. Facts Status  Ended Network Certification  - Type  Scripted Original Language  English Runtime  60m Homepage  - Genres Drama Keywords shakespeare king of england play adaptation british monarchy Content Score 43 There's no 'I' in team... Top Contributors 11 Banana R 2 Rebecca c 2 cosmic-rocket-man 2 Rizor  View Edit History Popularity Trend  Login to edit  URL By  signing up  for an account on TMDb, you can post directly to Twitter and Facebook. You need to be logged in to continue. Click  here  to login or  here  to sign up.    page_wrap opened in html_head  Join the Community The Basics About TMDb Contact Us Support Forums API Blog Get Involved  Contribution Bible 3rd Party Applications Add New Movie Add New TV Show Community Guidelines Leaderboard Forums Twitter Facebook Legal Terms of Use Privacy Policy Login Sign Up"}