{"link": "https://www.themoviedb.org/tv/67132?language=en", "title": "Kevin Can Wait", "resume": "A newly retired police officer looks forward to spending more quality time with his wife and three kids only to discover he faces much tougher challenges at home than he ever did on the streets.", "rate": 51, "genre": ["Comedy"], "cast": ["Kevin James", "Leah Remini", "Ryan Cartwright", "Taylor Spreitler", "Gary Valentine"], "character": ["Kevin Gable", "Vanessa Cellucci", "Chale", "Kendra Gable", "Kyle"], "site_data": "html Apps Forums Leaderboard Contribute API Support Discover Movies TV Shows Movies Popular Top Rated Upcoming Now Playing TV Shows Popular Top Rated On TV Airing Today People Popular People Can't find a movie or TV show? Login to create it. en Login Sign Up  ID: 67132   Expand Kevin Can Wait   (2016) User Score  Play Trailer Overview A newly retired police officer looks forward to spending more quality time with his wife and three kids only to discover he faces much tougher challenges at home than he ever did on the streets. Featured Crew Barton Dean Creator Discussions   Reviews Videos   Images   Changes Report Share Discussions General  10 Content Issues  1 Images Backdrops  11 Posters  10 Videos Trailers  1 Teasers  0 Clips  0 Featurettes  0 Opening Credits  0 Top Billed Cast Kevin James Kevin Gable Leah Remini Vanessa Cellucci Ryan Cartwright Chale Taylor Spreitler Kendra Gable Gary Valentine Kyle Full Cast & Crew Last Season Season 2 2017 | 24 Episodes Season 2 of Kevin Can Wait premiered on September 24, 2017. View All Seasons Social Reviews  0 Discussions  11 Subject Status Replies Last Reply T Cancelled Open 4 by  Jayhn1111 T Thoughts on the Retool? Open 2 by  Jayhn1111 Kevin James Is A Waste Of Organic Material Open 0 by Jetfire59\n      \n     Go to Discussions Media Most Popular Videos  1 Backdrops  11 Posters  10 Recommendations   2016-10-24 Man with a Plan 5.1    2016-03-01 Loosely Exactly Nicole 5.8    2015-02-19 The Odd Couple 5.4    2011-11-30 I Hate My Teenage Daughter 4.5    2018-03-27 Splitting Up Together 5.7    2016-01-07 Angel from Hell 6.1    2016-03-15 Crowded 6.4    2006-09-18 The Class 7.3  Facts Status  Cancelled Network Certification TV-14 Meaning This program contains some material that many parents would find unsuitable for children under 14 years of age. Type  Scripted Original Language  English Runtime  21m Homepage   http://cbs.com/shows/kevin-can-wait Genres Comedy Keywords ex-cop family sitcom Content Score 100 Yes! Looking good! Top Contributors p 38 plumpro 25 Banana 15 Bendik b 15 bugfix  View Edit History Popularity Trend  Login to edit  URL By  signing up  for an account on TMDb, you can post directly to Twitter and Facebook. You need to be logged in to continue. Click  here  to login or  here  to sign up.    page_wrap opened in html_head  Join the Community The Basics About TMDb Contact Us Support Forums API Blog Get Involved  Contribution Bible 3rd Party Applications Add New Movie Add New TV Show Community Guidelines Leaderboard Forums Twitter Facebook Legal Terms of Use Privacy Policy Login Sign Up"}