{"link": "https://www.themoviedb.org/tv/52387?language=en", "title": "Bullet in the Face", "resume": "Following a botched jewel heist, sociopath criminal Gunter Vogler is forced to assume the identity of a cop he shot and work undercover to take down the city\u2019s crime lords.", "rate": 75, "genre": ["Comedy", "Crime"], "cast": ["Max E. Williams", "Eric Roberts", "Neil Napier", "Jessica Steen", "Kate Kelton"], "character": ["Gunter Vogler", "Racken", "Lt. Karl Hagerman", "Eva Braden", "Martine Mahler"], "site_data": "html Apps Forums Leaderboard Contribute API Support Discover Movies TV Shows Movies Popular Top Rated Upcoming Now Playing TV Shows Popular Top Rated On TV Airing Today People Popular People Can't find a movie or TV show? Login to create it. en Login Sign Up  ID: 52387   Expand Bullet in the Face   (2012) User Score Overview Following a botched jewel heist, sociopath criminal Gunter Vogler is forced to assume the identity of a cop he shot and work undercover to take down the city\u2019s crime lords. Featured Crew Alan Spencer Creator Discussions   Reviews Videos   Images   Changes Report Share Discussions General  0 Content Issues  0 Images Backdrops  0 Posters  1 Videos Trailers  0 Teasers  0 Clips  0 Featurettes  0 Opening Credits  0 Top Billed Cast Max E. Williams Gunter Vogler Eric Roberts Racken Neil Napier Lt. Karl Hagerman Jessica Steen Eva Braden Kate Kelton Martine Mahler Full Cast & Crew Last Season Season 1 2012 | 6 Episodes Season 1 of Bullet in the Face premiered on August 16, 2012. View All Seasons Social Reviews  0 Discussions  0 Media Most Popular Videos  0 Backdrops  0 Posters  1 Recommendations   2002-10-04 City of Men 6.5    2011-09-22 Prime Suspect 7.1    2010-09-21 Running Wilde 6.8    2012-08-26 A Touch of Cloth 7.2    1997-01-29 Brass Eye 8.0    2012-05-20 The Eric Andre Show 7.2    2013-09-24 The Wrong Mans 7.6    2001-09-25 Undeclared 7.2  Facts Status  Ended Network Certification  - Type  Scripted Original Language  English Runtime  22m Homepage   http://ifc.com/shows/bullet-in-the-face Genres Comedy Crime Keywords police undercover hitman dark comedy Content Score 79 Pump it up! We're close now. Top Contributors 16 Banana b 10 badass4cyl n 4 nicb19 4 Zlogorek  View Edit History Popularity Trend  Login to edit  URL By  signing up  for an account on TMDb, you can post directly to Twitter and Facebook. You need to be logged in to continue. Click  here  to login or  here  to sign up.    page_wrap opened in html_head  Join the Community The Basics About TMDb Contact Us Support Forums API Blog Get Involved  Contribution Bible 3rd Party Applications Add New Movie Add New TV Show Community Guidelines Leaderboard Forums Twitter Facebook Legal Terms of Use Privacy Policy Login Sign Up"}