{"link": "https://www.themoviedb.org/tv/78231?language=en", "title": "Age of the Living Dead", "resume": "In an America quarantined by the rest of the world, humans and vampires co-exist on opposite coasts thanks to a peace treaty, while each side plots to destroy the other.", "rate": 0, "genre": ["Action", "Adventure", "Sci-Fi", "Fantasy"], "cast": ["Nicola Posener", "Eve Mauro", "Simon Phillips"], "character": ["Yvonne", "Marie", "Gerry"], "site_data": "html Apps Forums Leaderboard Contribute API Support Discover Movies TV Shows Movies Popular Top Rated Upcoming Now Playing TV Shows Popular Top Rated On TV Airing Today People Popular People Can't find a movie or TV show? Login to create it. en Login Sign Up  ID: 78231   Expand Age of the Living Dead   (2018) User Score Overview In an America quarantined by the rest of the world, humans and vampires co-exist on opposite coasts thanks to a peace treaty, while each side plots to destroy the other. Featured Crew Simon Phillips Creator Discussions   Reviews Videos   Images   Changes Report Share Discussions General  0 Content Issues  0 Images Backdrops  0 Posters  1 Videos Trailers  0 Teasers  0 Clips  0 Featurettes  0 Opening Credits  0 Top Billed Cast Nicola Posener Yvonne Eve Mauro Marie Simon Phillips Gerry Full Cast & Crew Next Season Season 1 2018 | 6 Episodes Season 1 of Age of the Living Dead is set to premiere on August  7, 2018. View All Seasons Social Reviews  0 Discussions  0 Media Most Popular Videos  0 Backdrops  0 Posters  1 Facts Status  Returning Series Networks - Certification  - Type  Scripted Original Language  English Runtime  - Homepage  - Genres Action & Adventure Sci-Fi & Fantasy Keywords No keywords have been added. Content Score 50 Still needs a little work. Top Contributors 11 Mikedeth5 T 8 Tiby08 t 1 tcsaba TB 1 TMDb Bot  View Edit History Popularity Trend  Login to edit  URL By  signing up  for an account on TMDb, you can post directly to Twitter and Facebook. You need to be logged in to continue. Click  here  to login or  here  to sign up.    page_wrap opened in html_head  Join the Community The Basics About TMDb Contact Us Support Forums API Blog Get Involved  Contribution Bible 3rd Party Applications Add New Movie Add New TV Show Community Guidelines Leaderboard Forums Twitter Facebook Legal Terms of Use Privacy Policy Login Sign Up"}