{"link": "https://www.themoviedb.org/tv/75658?language=en", "title": "Noah's Ark", "resume": "In the Biblical story from Genesis, God floods the world as Noah rescues his family and the animals in a gigantic ark.", "rate": 38, "genre": ["Action", "Adventure", "Drama"], "cast": ["Mary Steenburgen", "F. Murray Abraham", "Carol Kane", "Mark Bazeley", "James Coburn"], "character": ["Naamah", "Lot", "Sarah", "Shem", "The 'Peddler'"], "site_data": "html Apps Forums Leaderboard Contribute API Support Discover Movies TV Shows Movies Popular Top Rated Upcoming Now Playing TV Shows Popular Top Rated On TV Airing Today People Popular People Can't find a movie or TV show? Login to create it. en Login Sign Up  ID: 75658   Expand Noah's Ark   (1999) User Score  Play Trailer Overview In the Biblical story from Genesis, God floods the world as Noah rescues his family and the animals in a gigantic ark. Discussions   Reviews Videos   Images   Changes Report Share Discussions General  0 Content Issues  0 Images Backdrops  1 Posters  1 Videos Trailers  1 Teasers  0 Clips  0 Featurettes  0 Opening Credits  0 Top Billed Cast Mary Steenburgen Naamah F. Murray Abraham Lot Carol Kane Sarah Mark Bazeley Shem James Coburn The 'Peddler' Full Cast & Crew Last Season Miniseries 1999 | 2 Episodes Season 1 of Noah's Ark premiered on May  4, 1999. View All Seasons Social Reviews  0 Discussions  0 Media Most Popular Videos  1 Backdrops  1 Posters  1 Recommendations   1999-09-26 Jack & Jill 7.2  Facts Status  Ended Network Certification  - Type  Miniseries Original Language  English Runtime  - Homepage  - Genres Action & Adventure Drama Keywords religion miniseries noah noah's ark Content Score 93 Almost there... Top Contributors TB 44 TMDb Bot 24 Banana  View Edit History Popularity Trend  Login to edit  URL By  signing up  for an account on TMDb, you can post directly to Twitter and Facebook. You need to be logged in to continue. Click  here  to login or  here  to sign up.    page_wrap opened in html_head  Join the Community The Basics About TMDb Contact Us Support Forums API Blog Get Involved  Contribution Bible 3rd Party Applications Add New Movie Add New TV Show Community Guidelines Leaderboard Forums Twitter Facebook Legal Terms of Use Privacy Policy Login Sign Up"}