{"link": "https://www.themoviedb.org/tv/62497?language=en", "title": "Just Be Happy", "resume": "It's story of an unknown town named \"station\" in Istanbul including love, neighborhood.", "rate": 70, "genre": ["Family", "Comedy"], "cast": ["Ali Atay", "Asl\u0131 Enver", "Ertan \u0160aban", "\u00d6ner Erkan", "Y\u0131lmaz Gruda"], "character": ["Can", "Zeynep", "Bab\u00fcr", "G\u00fcne\u015f", "Ziya"], "site_data": "html Apps Forums Leaderboard Contribute API Support Discover Movies TV Shows Movies Popular Top Rated Upcoming Now Playing TV Shows Popular Top Rated On TV Airing Today People Popular People Can't find a movie or TV show? Login to create it. en Login Sign Up  ID: 62497   Expand Just Be Happy   (2015) User Score Overview It's story of an unknown town named \"station\" in Istanbul including love, neighborhood. Discussions   Reviews Videos   Images   Changes Report Share Discussions General  0 Content Issues  0 Images Backdrops  1 Posters  1 Videos Trailers  0 Teasers  0 Clips  0 Featurettes  0 Opening Credits  0 Top Billed Cast Ali Atay Can Asl\u0131 Enver Zeynep Ertan \u0160aban Bab\u00fcr \u00d6ner Erkan G\u00fcne\u015f Y\u0131lmaz Gruda Ziya Full Cast & Crew Last Season Season 1 2015 | 5 Episodes Season 1 of Just Be Happy premiered on April 12, 2015. View All Seasons Social Reviews  0 Discussions  0 Media Most Popular Videos  0 Backdrops  1 Posters  1 Recommendations   2015-01-06 Be\u015f Karde\u015f 5.3  Facts Original Name  Mutlu Ol Yeter Status  Returning Series Network Certification  - Type  Scripted Original Language  Turkish Runtime  - Homepage   http://www.atv.com.tr/diziler/mutlu-ol-yeter Genres Family Comedy Keywords No keywords have been added. Content Score 86 Almost there... Top Contributors 35 Mucahid Zeyrek 4 Elizabeth Jennings b 3 bluwy 2 lineker  View Edit History Popularity Trend  Login to edit  URL By  signing up  for an account on TMDb, you can post directly to Twitter and Facebook. You need to be logged in to continue. Click  here  to login or  here  to sign up.    page_wrap opened in html_head  Join the Community The Basics About TMDb Contact Us Support Forums API Blog Get Involved  Contribution Bible 3rd Party Applications Add New Movie Add New TV Show Community Guidelines Leaderboard Forums Twitter Facebook Legal Terms of Use Privacy Policy Login Sign Up"}