{"link": "https://www.themoviedb.org/tv/40875?language=en", "title": "Wie gut, da\u00df es Maria gibt", "resume": "Wie gut, dass es Maria gibt is a German television series.", "rate": 0, "genre": ["Comedy", "Family", "Drama"], "cast": ["Thekla Carola Wied", "Alexander May", "Gunter Berger", "Ursula Diestel", "Helmut Zierl"], "character": ["Schwester Maria", "Dekan Strathmann", "Pastor Siegfried W\u00f6lm", "Eva Hagenk\u00f6tter", "Kaplan K\u00fcmmerling"], "site_data": "html Apps Forums Leaderboard Contribute API Support Discover Movies TV Shows Movies Popular Top Rated Upcoming Now Playing TV Shows Popular Top Rated On TV Airing Today People Popular People Can't find a movie or TV show? Login to create it. en Login Sign Up  ID: 40875   Expand Wie gut, da\u00df es Maria gibt   (1990) User Score Overview Wie gut, dass es Maria gibt is a German television series. Discussions   Reviews Videos   Images   Changes Report Share Discussions General  0 Content Issues  0 Images Backdrops  0 Posters  1 Videos Trailers  0 Teasers  0 Clips  0 Featurettes  0 Opening Credits  0 Top Billed Cast Thekla Carola Wied Schwester Maria Alexander May Dekan Strathmann Gunter Berger Pastor Siegfried W\u00f6lm Ursula Diestel Eva Hagenk\u00f6tter Helmut Zierl Kaplan K\u00fcmmerling Full Cast & Crew Last Season Season 2 1991 | 13 Episodes Season 2 of Wie gut, da\u00df es Maria gibt premiered on September 24, 1991. View All Seasons Social Reviews  0 Discussions  0 Media Most Popular Videos  0 Backdrops  0 Posters  1 Recommendations We don't have enough data to suggest any TV shows based on Wie gut, da\u00df es Maria gibt. You can help by rating TV shows you've seen. Facts Status  Ended Network Certification  - Type  Scripted Original Language  German Runtime  50m Homepage  - Genres Comedy Family Drama Keywords nun priest Content Score 71 Just a little bit more... Top Contributors S 61 Samara D 9 DK6510  View Edit History Popularity Trend  Login to edit  URL By  signing up  for an account on TMDb, you can post directly to Twitter and Facebook. You need to be logged in to continue. Click  here  to login or  here  to sign up.    page_wrap opened in html_head  Join the Community The Basics About TMDb Contact Us Support Forums API Blog Get Involved  Contribution Bible 3rd Party Applications Add New Movie Add New TV Show Community Guidelines Leaderboard Forums Twitter Facebook Legal Terms of Use Privacy Policy Login Sign Up"}