{"link": "https://www.themoviedb.org/tv/17827?language=en", "title": "Anglo Saxon Attitudes", "resume": "We don't have an overview translated in English. Help us expand our database by adding one.", "rate": 0, "genre": ["Drama"], "cast": ["Kate Maberly", "Kate Winslet", "Daniel Craig", "Douglas Hodge", "Elizabeth Spriggs"], "character": ["Young Kay", "Caroline Jenington", "Gilbert Stokesay", "Young Gerald Middleton", "Inge Middleton"], "site_data": "html Apps Forums Leaderboard Contribute API Support Discover Movies TV Shows Movies Popular Top Rated Upcoming Now Playing TV Shows Popular Top Rated On TV Airing Today People Popular People Can't find a movie or TV show? Login to create it. en Login Sign Up  ID: 17827   Expand Anglo Saxon Attitudes   (1992) User Score Overview We don't have an overview translated in English. Help us expand our database by adding one. Discussions   Reviews Videos   Images   Changes Report Share Discussions General  0 Content Issues  0 Images Backdrops  2 Posters  1 Videos Trailers  0 Teasers  0 Clips  0 Featurettes  0 Opening Credits  0 Top Billed Cast Kate Maberly Young Kay Kate Winslet Caroline Jenington Daniel Craig Gilbert Stokesay Douglas Hodge Young Gerald Middleton Elizabeth Spriggs Inge Middleton Full Cast & Crew Last Season Season 1 1992 | 3 Episodes Season 1 of Anglo Saxon Attitudes premiered on May 12, 1992. View All Seasons Social Reviews  0 Discussions  0 Media Most Popular Videos  0 Backdrops  2 Posters  1 Recommendations We don't have enough data to suggest any TV shows based on Anglo Saxon Attitudes. You can help by rating TV shows you've seen. Facts Status  Ended Network Certification  - Type  Scripted Original Language  English Runtime  - Homepage  - Genres Drama Keywords No keywords have been added. Content Score 79 Pump it up! We're close now. Top Contributors 10 kcdh 1 Markxist  View Edit History Popularity Trend  Login to edit  URL By  signing up  for an account on TMDb, you can post directly to Twitter and Facebook. You need to be logged in to continue. Click  here  to login or  here  to sign up.    page_wrap opened in html_head  Join the Community The Basics About TMDb Contact Us Support Forums API Blog Get Involved  Contribution Bible 3rd Party Applications Add New Movie Add New TV Show Community Guidelines Leaderboard Forums Twitter Facebook Legal Terms of Use Privacy Policy Login Sign Up"}