{"link": "https://www.themoviedb.org/tv/45238?language=en", "title": "Stephen Hawking's Grand Design", "resume": "Stephen Hawking draws on 40 years of research to answer some of life's most compelling questions.", "rate": 73, "genre": ["Documentary"], "cast": ["Benedict Cumberbatch", "Stephen Hawking"], "character": ["Himself"], "site_data": "html Apps Forums Leaderboard Contribute API Support Discover Movies TV Shows Movies Popular Top Rated Upcoming Now Playing TV Shows Popular Top Rated On TV Airing Today People Popular People Can't find a movie or TV show? Login to create it. en Login Sign Up  ID: 45238   Expand Stephen Hawking's Grand Design   (2012) User Score  Play Trailer Overview Stephen Hawking draws on 40 years of research to answer some of life's most compelling questions. Discussions   Reviews Videos   Images   Changes Report Share Discussions General  0 Content Issues  0 Images Backdrops  3 Posters  5 Videos Trailers  2 Teasers  0 Clips  0 Featurettes  0 Opening Credits  0 Top Billed Cast Benedict Cumberbatch Stephen Hawking Himself Full Cast & Crew Last Season Season 1 2012 | 3 Episodes Season 1 of Stephen Hawking's Grand Design premiered on September 13, 2012. View All Seasons Social Reviews  0 Discussions  0 Media Most Popular Videos  2 Backdrops  3 Posters  5 Recommendations   2007-05-29 The Universe 8.4    2016-04-03 The Story of God with Morgan Freeman 7.1    1974-09-13 Planet of the Apes 6.9    2009-04-21 Life After People: The Series 7.5    2010-04-25 How the Universe Works 8.0    2010-04-25 Into the Universe with Stephen Hawking 7.6    2009-10-11 Life 8.3    2006-03-05 Planet Earth 8.5  Facts Status  Returning Series Network Certification  - Type  Miniseries Original Language  English Runtime  60m Homepage   http://www.discoveryuk.com/web/stephen-hawkings-grand-design/ Genres Documentary Keywords physics astrophysicist astronomy physics teacher Content Score 64 We're so close, yet so far. Top Contributors 23 Greg E 9 EightNine TB 7 TMDb Bot f 7 fly9902  View Edit History Popularity Trend  Login to edit  URL By  signing up  for an account on TMDb, you can post directly to Twitter and Facebook. You need to be logged in to continue. Click  here  to login or  here  to sign up.    page_wrap opened in html_head  Join the Community The Basics About TMDb Contact Us Support Forums API Blog Get Involved  Contribution Bible 3rd Party Applications Add New Movie Add New TV Show Community Guidelines Leaderboard Forums Twitter Facebook Legal Terms of Use Privacy Policy Login Sign Up"}