{"link": "https://www.themoviedb.org/tv/72043?language=en", "title": "\u82b1\u95f4\u63d0\u58f6\u65b9\u5927\u53a8", "resume": "We don't have an overview translated in English. Help us expand our database by adding one.", "rate": null, "genre": ["Soap", "Comedy", "Mystery"], "cast": ["jiang jia en"], "site_data": "html Apps Forums Leaderboard Contribute API Support Discover Movies TV Shows Movies Popular Top Rated Upcoming Now Playing TV Shows Popular Top Rated On TV Airing Today People Popular People Can't find a movie or TV show? Login to create it. en Login Sign Up  ID: 72043   Expand \u82b1\u95f4\u63d0\u58f6\u65b9\u5927\u53a8   (2017) User Score Overview We don't have an overview translated in English. Help us expand our database by adding one. Discussions   Reviews Videos   Images   Changes Report Share Discussions General  0 Content Issues  0 Images Backdrops  2 Posters  1 Videos Trailers  0 Teasers  0 Clips  0 Featurettes  0 Opening Credits  0 Top Billed Cast jiang jia en \u65b9\u4e00\u52fa Full Cast & Crew Last Season Season 2 2017 | 18 Episodes Season 2 of \u82b1\u95f4\u63d0\u58f6\u65b9\u5927\u53a8 premiered on May 25, 2017. View All Seasons Social Reviews  0 Discussions  0 Media Most Popular Videos  0 Backdrops  2 Posters  1 Recommendations We don't have enough data to suggest any TV shows based on \u82b1\u95f4\u63d0\u58f6\u65b9\u5927\u53a8. You can help by rating TV shows you've seen. Facts Status  Ended Network Certification  - Type  Scripted Original Language  Chinese Runtime  - Homepage  - Genres Soap Comedy Mystery Keywords love Content Score 50 Still needs a little work. Top Contributors 3 26 369915119 TB 4 TMDb Bot x 3 xiaohai  View Edit History Popularity Trend  Login to edit  URL By  signing up  for an account on TMDb, you can post directly to Twitter and Facebook. You need to be logged in to continue. Click  here  to login or  here  to sign up.    page_wrap opened in html_head  Join the Community The Basics About TMDb Contact Us Support Forums API Blog Get Involved  Contribution Bible 3rd Party Applications Add New Movie Add New TV Show Community Guidelines Leaderboard Forums Twitter Facebook Legal Terms of Use Privacy Policy Login Sign Up", "character": ["\u65b9\u4e00\u52fa"]}