{"link": "https://www.themoviedb.org/tv/69677?language=en", "title": "Leave It to Stevie", "resume": "Stevie ends his relationship of 5 years & proceeds to get his groove back as a creepy playa... Despite his kids attempts at being the logical influence.", "rate": null, "genre": ["Reality"], "cast": ["Stevie J"], "site_data": "html Apps Forums Leaderboard Contribute API Support Discover Movies TV Shows Movies Popular Top Rated Upcoming Now Playing TV Shows Popular Top Rated On TV Airing Today People Popular People Can't find a movie or TV show? Login to create it. en Login Sign Up  ID: 69677   Expand Leave It to Stevie   (2016) User Score  Play Trailer Overview Stevie ends his relationship of 5 years & proceeds to get his groove back as a creepy playa... Despite his kids attempts at being the logical influence. Discussions   Reviews Videos   Images   Changes Report Share Discussions General  0 Content Issues  0 Images Backdrops  1 Posters  2 Videos Trailers  1 Teasers  0 Clips  0 Featurettes  0 Opening Credits  0 Top Billed Cast Stevie J Himself Full Cast & Crew Current Season Season 2 2018 | 8 Episodes Season 2 of Leave It to Stevie premiered on March 26, 2018. View All Seasons Social Reviews  0 Discussions  0 Media Most Popular Videos  1 Backdrops  1 Posters  2 Recommendations We don't have enough data to suggest any TV shows based on Leave It to Stevie. You can help by rating TV shows you've seen. Facts Status  Returning Series Network Certification TV-14 Meaning This program contains some material that many parents would find unsuitable for children under 14 years of age. Type  Reality Original Language  English Runtime  22m Homepage   http://vh1.com/shows/leave-it-to-stevie Genres Reality Keywords bachelor spin off Content Score 64 We're so close, yet so far. Top Contributors 33 Banana 5 Elizabeth Jennings b 4 basher 4 oldboy3  View Edit History Popularity Trend  Login to edit  URL By  signing up  for an account on TMDb, you can post directly to Twitter and Facebook. You need to be logged in to continue. Click  here  to login or  here  to sign up.    page_wrap opened in html_head  Join the Community The Basics About TMDb Contact Us Support Forums API Blog Get Involved  Contribution Bible 3rd Party Applications Add New Movie Add New TV Show Community Guidelines Leaderboard Forums Twitter Facebook Legal Terms of Use Privacy Policy Login Sign Up", "character": ["Himself"]}