{"link": "https://www.themoviedb.org/tv/74873?language=en", "title": "Squadra Mobile", "resume": "We don't have an overview translated in English. Help us expand our database by adding one.", "rate": 70, "genre": ["Crime", "Drama"], "cast": ["Giorgio Tirabassi", "Daniele Liotti", "Antonio Catania", "Valeria Bilello", "Marco Rossetti"], "character": ["Roberto Ardenzi", "Claudio Sabatini", "Sandro Vitale", "Isabella D'Amato", "Riccardo Pisi"], "site_data": "html Apps Forums Leaderboard Contribute API Support Discover Movies TV Shows Movies Popular Top Rated Upcoming Now Playing TV Shows Popular Top Rated On TV Airing Today People Popular People Can't find a movie or TV show? Login to create it. en Login Sign Up  ID: 74873   Expand Squadra Mobile   (2015) User Score Overview We don't have an overview translated in English. Help us expand our database by adding one. Featured Crew Pietro Valsecchi Creator Alexis Sweet Creator Discussions   Reviews Videos   Images   Changes Report Share Discussions General  0 Content Issues  0 Images Backdrops  1 Posters  2 Videos Trailers  0 Teasers  0 Clips  0 Featurettes  0 Opening Credits  0 Top Billed Cast Giorgio Tirabassi Roberto Ardenzi Daniele Liotti Claudio Sabatini Antonio Catania Sandro Vitale Valeria Bilello Isabella D'Amato Marco Rossetti Riccardo Pisi Full Cast & Crew Last Season Season 2 2017 | 2 Episodes Season 2 of Squadra Mobile premiered on September 13, 2017. View All Seasons Social Reviews  0 Discussions  0 Media Most Popular Videos  0 Backdrops  1 Posters  2 Recommendations We don't have enough data to suggest any TV shows based on Squadra Mobile. You can help by rating TV shows you've seen. Facts Status  In Production Network Certification  - Type  Miniseries Original Language  Italian Runtime  50m Homepage  - Genres Crime Drama Keywords No keywords have been added. Content Score 86 Almost there... Top Contributors m 51 magico77  View Edit History Popularity Trend  Login to edit  URL By  signing up  for an account on TMDb, you can post directly to Twitter and Facebook. You need to be logged in to continue. Click  here  to login or  here  to sign up.    page_wrap opened in html_head  Join the Community The Basics About TMDb Contact Us Support Forums API Blog Get Involved  Contribution Bible 3rd Party Applications Add New Movie Add New TV Show Community Guidelines Leaderboard Forums Twitter Facebook Legal Terms of Use Privacy Policy Login Sign Up"}