{"link": "https://www.themoviedb.org/tv/41336?language=en", "title": "Schnell ermittelt", "resume": "Schnell ermittelt is an Austrian television series.", "rate": null, "genre": ["Crime"], "cast": ["Ursula Strauss", "Andreas Lust", "Wolf Bachofner", "Katharina Stra\u00dfer", "Morteza Tavakoli"], "site_data": "html Apps Forums Leaderboard Contribute API Support Discover Movies TV Shows Movies Popular Top Rated Upcoming Now Playing TV Shows Popular Top Rated On TV Airing Today People Popular People Can't find a movie or TV show? Login to create it. en Login Sign Up  ID: 41336   Expand Schnell ermittelt   (2009) User Score Overview Schnell ermittelt is an Austrian television series. Featured Crew Eva Spreitzhofer Creator Discussions   Reviews Videos   Images   Changes Report Share Discussions General  0 Content Issues  0 Images Backdrops  1 Posters  1 Videos Trailers  0 Teasers  0 Clips  0 Featurettes  0 Opening Credits  0 Top Billed Cast Ursula Strauss ChefInsp Angelika Schnell Andreas Lust Dr. Stefan Schnell Wolf Bachofner ChefInsp Harald Franitschek Katharina Stra\u00dfer BezInsp Maja Landauer Morteza Tavakoli Kemal \u00d6zt\u00fcrk Full Cast & Crew Last Season Season 5 2017 | 10 Episodes Season 5 of Schnell ermittelt premiered on March 13, 2017. View All Seasons Social Reviews  0 Discussions  0 Media Most Popular Videos  0 Backdrops  1 Posters  1 Recommendations We don't have enough data to suggest any TV shows based on Schnell ermittelt. You can help by rating TV shows you've seen. Facts Status  Returning Series Network Certification  - Type  Scripted Original Language  German Runtime  90m, 45m Homepage  - Genres Crime Keywords No keywords have been added. Content Score 93 Almost there... Top Contributors S 46 Samara 11 sysrmr s 4 schinni w 3 webmaster  View Edit History Popularity Trend  Login to edit  URL By  signing up  for an account on TMDb, you can post directly to Twitter and Facebook. You need to be logged in to continue. Click  here  to login or  here  to sign up.    page_wrap opened in html_head  Join the Community The Basics About TMDb Contact Us Support Forums API Blog Get Involved  Contribution Bible 3rd Party Applications Add New Movie Add New TV Show Community Guidelines Leaderboard Forums Twitter Facebook Legal Terms of Use Privacy Policy Login Sign Up", "character": ["ChefInsp Angelika Schnell", "Dr. Stefan Schnell", "ChefInsp Harald Franitschek", "BezInsp Maja Landauer", "Kemal \u00d6zt\u00fcrk"]}