{"link": "https://www.themoviedb.org/tv/73042?language=en", "title": "Perrengue", "resume": "The series takes place in Rio de Janeiro and portrays the difficulties (perrengues) of the daily lives of P\u00e9rola, Miguel and Cadu, inseparable friends since adolescence.", "rate": null, "genre": ["Drama"], "cast": ["Vin\u00edcius Redd", "Mariana Molina", "Guilherme Dellorto", "Giovana Echeverria", "Christiana Ubach"], "site_data": "html Apps Forums Leaderboard Contribute API Support Discover Movies TV Shows Movies Popular Top Rated Upcoming Now Playing TV Shows Popular Top Rated On TV Airing Today People Popular People Can't find a movie or TV show? Login to create it. en Login Sign Up  ID: 73042   Expand Perrengue   (2017) User Score Overview The series takes place in Rio de Janeiro and portrays the difficulties (perrengues) of the daily lives of P\u00e9rola, Miguel and Cadu, inseparable friends since adolescence. Featured Crew Renata Fraga Creator Tatiana de Lamare Creator Discussions   Reviews Videos   Images   Changes Report Share Discussions General  0 Content Issues  0 Images Backdrops  4 Posters  1 Videos Trailers  0 Teasers  0 Clips  0 Featurettes  0 Opening Credits  0 Top Billed Cast Vin\u00edcius Redd Cadu de Castro Mariana Molina P\u00e9rola Prado Guilherme Dellorto Miguel Assis Giovana Echeverria Carol de Castro Christiana Ubach Let\u00edcia Full Cast & Crew Last Season Season 1 2017 | 1 Episode Season 1 of Perrengue premiered on August 21, 2017. View All Seasons Social Reviews  0 Discussions  0 Media Most Popular Videos  0 Backdrops  4 Posters  1 Recommendations We don't have enough data to suggest any TV shows based on Perrengue. You can help by rating TV shows you've seen. Facts Status  Returning Series Network Certification 16 Meaning Content suitable for viewers over the age of 16. Type  Scripted Original Language  Portuguese Runtime  30m Homepage   http://www.mtv.com.br/programas/150lns/perrengue Genres Drama Keywords No keywords have been added. Content Score 100 Yes! Looking good! Top Contributors 23 Amanda 15 Elizabeth Jennings TB 1 TMDb Bot  View Edit History Popularity Trend  Login to edit  URL By  signing up  for an account on TMDb, you can post directly to Twitter and Facebook. You need to be logged in to continue. Click  here  to login or  here  to sign up.    page_wrap opened in html_head  Join the Community The Basics About TMDb Contact Us Support Forums API Blog Get Involved  Contribution Bible 3rd Party Applications Add New Movie Add New TV Show Community Guidelines Leaderboard Forums Twitter Facebook Legal Terms of Use Privacy Policy Login Sign Up", "character": ["Cadu de Castro", "P\u00e9rola Prado", "Miguel Assis", "Carol de Castro", "Let\u00edcia"]}