{"link": "https://www.themoviedb.org/tv/30283?language=en", "title": "Father Brown", "resume": "Father Brown was a Catholic priest who doubled as an amateur detective in order to solve mysteries.", "rate": 70, "genre": ["Crime", "Drama", "Mystery"], "cast": ["Kenneth More", "Dennis Burgess"], "character": ["Father Brown", "Flambeau"], "site_data": "html Apps Forums Leaderboard Contribute API Support Discover Movies TV Shows Movies Popular Top Rated Upcoming Now Playing TV Shows Popular Top Rated On TV Airing Today People Popular People Can't find a movie or TV show? Login to create it. en Login Sign Up  ID: 30283   Expand Father Brown   (1974) User Score Overview Father Brown was a Catholic priest who doubled as an amateur detective in order to solve mysteries. Discussions   Reviews Videos   Images   Changes Report Share Discussions General  0 Content Issues  0 Images Backdrops  1 Posters  1 Videos Trailers  0 Teasers  0 Clips  0 Featurettes  0 Opening Credits  0 Top Billed Cast Kenneth More Father Brown Dennis Burgess Flambeau Full Cast & Crew Last Season Season 1 1974 | 13 Episodes Season 1 of Father Brown premiered on September 26, 1974. View All Seasons Social Reviews  0 Discussions  0 Media Most Popular Videos  0 Backdrops  1 Posters  1 Recommendations We don't have enough data to suggest any TV shows based on Father Brown. You can help by rating TV shows you've seen. Facts Status  Ended Network Certification  - Type  Scripted Original Language  English Runtime  50m Homepage  - Genres Crime Drama Mystery Keywords amateur detective priest religion united kingdom costume drama Content Score 56 We're so close, yet so far. Top Contributors 28 Elizabeth Jennings e 2 egbertbos z 1 zoroman20083636  View Edit History Popularity Trend  Login to edit  URL By  signing up  for an account on TMDb, you can post directly to Twitter and Facebook. You need to be logged in to continue. Click  here  to login or  here  to sign up.    page_wrap opened in html_head  Join the Community The Basics About TMDb Contact Us Support Forums API Blog Get Involved  Contribution Bible 3rd Party Applications Add New Movie Add New TV Show Community Guidelines Leaderboard Forums Twitter Facebook Legal Terms of Use Privacy Policy Login Sign Up"}