{"link": "https://www.themoviedb.org/tv/3256?language=en", "title": "All the Rivers Run", "resume": "Orphaned after a shipwreck off the Victorian coast of Australia, the spirited Philadelphia Gordon finds both love and adventure aboard a paddle-steamer on the Murray River.", "rate": 62, "genre": ["Drama"], "cast": ["Sigrid Thornton", "John Waters", "Michael Carman", "Roy Baldwin", "Charles Tingwell"], "character": ["Philadelphia 'Delie' Gordon", "Brenton Edwards", "Abby", "Mr Hamilton", "Uncle Charles"], "site_data": "html Apps Forums Leaderboard Contribute API Support Discover Movies TV Shows Movies Popular Top Rated Upcoming Now Playing TV Shows Popular Top Rated On TV Airing Today People Popular People Can't find a movie or TV show? Login to create it. en Login Sign Up  ID: 3256   Expand All the Rivers Run   (1983) User Score Overview Orphaned after a shipwreck off the Victorian coast of Australia, the spirited Philadelphia Gordon finds both love and adventure aboard a paddle-steamer on the Murray River. Discussions   Reviews Videos   Images   Changes Report Share Discussions General  0 Content Issues  1 Images Backdrops  1 Posters  3 Videos Trailers  0 Teasers  0 Clips  0 Featurettes  0 Opening Credits  1 Top Billed Cast Sigrid Thornton Philadelphia 'Delie' Gordon John Waters Brenton Edwards Michael Carman Abby Roy Baldwin Mr Hamilton Charles Tingwell Uncle Charles Full Cast & Crew Last Season Season 1 1983 | 4 Episodes Season 1 of All the Rivers Run premiered on October  3, 1983. View All Seasons Social Reviews  0 Discussions  1 Subject Status Replies Last Reply There are no discussions for All the Rivers Run. Login to be first! Go to Discussions Media Most Popular Videos  1 Backdrops  1 Posters  3 Recommendations We don't have enough data to suggest any TV shows based on All the Rivers Run. You can help by rating TV shows you've seen. Facts Status  Ended Network Certification PG Meaning Parental guidance is recommended for young viewers; PG-rated content may air at any time on digital-only channels, otherwise, it should only be broadcast between 8:30 a.m. and 4:00 p.m. and between 7:00 p.m. and 6:00 a.m. on weekdays, and between 10:00 a.m. and 6:00 a.m. on weekends. Type  Miniseries Original Language  English Runtime  120m Homepage   http://www.crawfords.com.au/libary/series/rivers_run1.shtml Genres Drama Keywords australia based on novel or book miniseries orphan period drama riverboat shipwrecked 19th century Content Score 93 Almost there... Top Contributors 40 Banana 25 sykobanana 6 t0by a 3 asusar  View Edit History Popularity Trend  Login to edit  URL By  signing up  for an account on TMDb, you can post directly to Twitter and Facebook. You need to be logged in to continue. Click  here  to login or  here  to sign up.    page_wrap opened in html_head  Join the Community The Basics About TMDb Contact Us Support Forums API Blog Get Involved  Contribution Bible 3rd Party Applications Add New Movie Add New TV Show Community Guidelines Leaderboard Forums Twitter Facebook Legal Terms of Use Privacy Policy Login Sign Up"}