{"link": "https://www.themoviedb.org/tv/34353?language=en", "title": "Doctor Mateo", "resume": "Doctor Mateo was a Spanish television comedy drama produced by Notro Films for Antena 3. It is an adaptation of the British series Doc Martin, created by Dominic Minghella.", "rate": 60, "genre": ["Comedy"], "cast": ["Gonzalo de Castro", "Natalia Verbeke", "Gorka Otxoa", "Lul\u00fa Palomares", "Mar\u00eda Esteve"], "character": ["Mateo Sancrist\u00f3bal", "Adriana Pozuelo", "Santiago Sagredo", "Carol D\u00edaz", "Elena"], "site_data": "html Apps Forums Leaderboard Contribute API Support Discover Movies TV Shows Movies Popular Top Rated Upcoming Now Playing TV Shows Popular Top Rated On TV Airing Today People Popular People Can't find a movie or TV show? Login to create it. en Login Sign Up  ID: 34353   Expand Doctor Mateo   (2009) User Score Overview Doctor Mateo was a Spanish television comedy drama produced by Notro Films for Antena 3. It is an adaptation of the British series Doc Martin, created by Dominic Minghella. Featured Crew Dominic Minghella Creator Discussions   Reviews Videos   Images   Changes Report Share Discussions General  0 Content Issues  0 Images Backdrops  4 Posters  2 Videos Trailers  0 Teasers  0 Clips  0 Featurettes  0 Opening Credits  0 Top Billed Cast Gonzalo de Castro Mateo Sancrist\u00f3bal Natalia Verbeke Adriana Pozuelo Gorka Otxoa Santiago Sagredo Lul\u00fa Palomares Carol D\u00edaz Mar\u00eda Esteve Elena Full Cast & Crew Last Season Dr mateo season 5 2011 | 12 Episodes Season 5 of Doctor Mateo premiered on April 24, 2011. View All Seasons Social Reviews  0 Discussions  0 Media Most Popular Videos  0 Backdrops  4 Posters  2 Recommendations We don't have enough data to suggest any TV shows based on Doctor Mateo. You can help by rating TV shows you've seen. Facts Status  Ended Networks - Certification  - Type  Scripted Original Language  Spanish; Castilian Runtime  80m, 70m Homepage   http://www.doctormateo.com Genres Comedy Keywords No keywords have been added. Content Score 93 Almost there... Top Contributors 46 prm96 9 radocity 1 Michael 1 FeKuLa  View Edit History Popularity Trend  Login to edit  URL By  signing up  for an account on TMDb, you can post directly to Twitter and Facebook. You need to be logged in to continue. Click  here  to login or  here  to sign up.    page_wrap opened in html_head  Join the Community The Basics About TMDb Contact Us Support Forums API Blog Get Involved  Contribution Bible 3rd Party Applications Add New Movie Add New TV Show Community Guidelines Leaderboard Forums Twitter Facebook Legal Terms of Use Privacy Policy Login Sign Up"}