{"link": "https://www.themoviedb.org/tv/69915?language=en", "title": "Der Bozen Krimi", "resume": "We don't have an overview translated in English. Help us expand our database by adding one.", "rate": 0, "genre": ["Crime"], "cast": ["Chiara Schoras", "Tobias Oertel", "Charleen Deetz", "Lisa Kreuzer", "Gabriel Raab"], "character": ["Sonja Schwarz", "Matteo Zanchetti", "Laura Schwarz", "Katharina Matheiner", "Jonas Kerschbaumer"], "site_data": "html Apps Forums Leaderboard Contribute API Support Discover Movies TV Shows Movies Popular Top Rated Upcoming Now Playing TV Shows Popular Top Rated On TV Airing Today People Popular People Can't find a movie or TV show? Login to create it. en Login Sign Up  ID: 69915   Expand Der Bozen Krimi   (2015) User Score Overview We don't have an overview translated in English. Help us expand our database by adding one. Discussions   Reviews Videos   Images   Changes Report Share Discussions General  0 Content Issues  0 Images Backdrops  1 Posters  1 Videos Trailers  0 Teasers  0 Clips  0 Featurettes  0 Opening Credits  0 Top Billed Cast Chiara Schoras Sonja Schwarz Tobias Oertel Matteo Zanchetti Charleen Deetz Laura Schwarz Lisa Kreuzer Katharina Matheiner Gabriel Raab Jonas Kerschbaumer Full Cast & Crew Last Season Season 1 2015 | 6 Episodes Season 1 of Der Bozen Krimi premiered on January 29, 2015. View All Seasons Social Reviews  0 Discussions  0 Media Most Popular Videos  0 Backdrops  1 Posters  1 Recommendations We don't have enough data to suggest any TV shows based on Der Bozen Krimi. You can help by rating TV shows you've seen. Facts Status  Returning Series Network Certification  - Type  Scripted Original Language  German Runtime  90m Homepage  - Genres Crime Keywords No keywords have been added. Content Score 79 Pump it up! We're close now. Top Contributors S 16 Samara KB 7 Karl-Heinz Brozkowski m 3 mao1109  View Edit History Popularity Trend  Login to edit  URL By  signing up  for an account on TMDb, you can post directly to Twitter and Facebook. You need to be logged in to continue. Click  here  to login or  here  to sign up.    page_wrap opened in html_head  Join the Community The Basics About TMDb Contact Us Support Forums API Blog Get Involved  Contribution Bible 3rd Party Applications Add New Movie Add New TV Show Community Guidelines Leaderboard Forums Twitter Facebook Legal Terms of Use Privacy Policy Login Sign Up"}