{"link": "https://www.themoviedb.org/tv/71077?language=en", "title": "Shh... I Love You", "resume": "Nadia Omar (Elvina Mohamed), a patient myocarditis or inflammation of the heart muscle that has been given a second life after a heart transplant. The donor's identity has been kept secret.", "rate": 0, "genre": ["Drama"], "cast": ["Elvina Mohamad", "Tash Yong", "Aien Zahalan", "Hani Nazrina", "Bella Nazari"], "character": ["Nur Nadia Omar", "Sumayyah", "Diana", "Ain", "Sumaira"], "site_data": "html Apps Forums Leaderboard Contribute API Support Discover Movies TV Shows Movies Popular Top Rated Upcoming Now Playing TV Shows Popular Top Rated On TV Airing Today People Popular People Can't find a movie or TV show? Login to create it. en Login Sign Up  ID: 71077   Expand Shh... I Love You   (2017) User Score Overview Nadia Omar (Elvina Mohamed), a patient myocarditis or inflammation of the heart muscle that has been given a second life after a heart transplant. The donor's identity has been kept secret. Discussions   Reviews Videos   Images   Changes Report Share Discussions General  0 Content Issues  0 Images Backdrops  0 Posters  1 Videos Trailers  0 Teasers  0 Clips  0 Featurettes  0 Opening Credits  0 Top Billed Cast Elvina Mohamad Nur Nadia Omar Tash Yong Sumayyah Aien Zahalan Diana Hani Nazrina Ain Bella Nazari Sumaira Full Cast & Crew Last Season Season 1 2017 | 24 Episodes Season 1 of Shh... I Love You premiered on April  3, 2017. View All Seasons Social Reviews  0 Discussions  0 Media Most Popular Videos  0 Backdrops  0 Posters  1 Recommendations We don't have enough data to suggest any TV shows based on Shh... I Love You. You can help by rating TV shows you've seen. Facts Status  Returning Series Network Certification  - Type  Scripted Original Language  Malay Runtime  44m Homepage  - Genres Drama Keywords No keywords have been added. Content Score 71 Just a little bit more... Top Contributors v 27 vplaytv v 5 vplaytv2 2 CyberTech M 2 Mr_Democracy  View Edit History Popularity Trend  Login to edit  URL By  signing up  for an account on TMDb, you can post directly to Twitter and Facebook. You need to be logged in to continue. Click  here  to login or  here  to sign up.    page_wrap opened in html_head  Join the Community The Basics About TMDb Contact Us Support Forums API Blog Get Involved  Contribution Bible 3rd Party Applications Add New Movie Add New TV Show Community Guidelines Leaderboard Forums Twitter Facebook Legal Terms of Use Privacy Policy Login Sign Up"}