{"link": "https://www.themoviedb.org/tv/68902?language=en", "title": "Real Vikings", "resume": "The history of the Vikings is explored by \"Vikings\" star Clive Standen, who joins experts in Europe to learn how the Vikings successfully invaded England and France.", "rate": 90, "genre": ["Documentary"], "cast": ["Peter Outerbridge"], "character": ["Host"], "site_data": "html Apps Forums Leaderboard Contribute API Support Discover Movies TV Shows Movies Popular Top Rated Upcoming Now Playing TV Shows Popular Top Rated On TV Airing Today People Popular People Can't find a movie or TV show? Login to create it. en Login Sign Up  ID: 68902   Expand Real Vikings   (2016) User Score Overview The history of the Vikings is explored by \"Vikings\" star Clive Standen, who joins experts in Europe to learn how the Vikings successfully invaded England and France. Discussions   Reviews Videos   Images   Changes Report Share Discussions General  0 Content Issues  0 Images Backdrops  2 Posters  2 Videos Trailers  0 Teasers  0 Clips  0 Featurettes  0 Opening Credits  0 Top Billed Cast Peter Outerbridge Host Full Cast & Crew Last Season Season 1 2016 | 4 Episodes Season 1 of Real Vikings premiered on February 12, 2016. View All Seasons Social Reviews  0 Discussions  0 Media Most Popular Videos  0 Backdrops  2 Posters  2 Recommendations We don't have enough data to suggest any TV shows based on Real Vikings. You can help by rating TV shows you've seen. Facts Status  Ended Network Certification  - Type  Miniseries Original Language  English Runtime  44m Homepage   http://www.history.com/shows/real-vikings Genres Documentary Keywords viking history miniseries Content Score 56 We're so close, yet so far. Top Contributors TB 17 TMDb Bot 16 Ly R 6 Rebecca z 4 zurman1  View Edit History Popularity Trend  Login to edit  URL By  signing up  for an account on TMDb, you can post directly to Twitter and Facebook. You need to be logged in to continue. Click  here  to login or  here  to sign up.    page_wrap opened in html_head  Join the Community The Basics About TMDb Contact Us Support Forums API Blog Get Involved  Contribution Bible 3rd Party Applications Add New Movie Add New TV Show Community Guidelines Leaderboard Forums Twitter Facebook Legal Terms of Use Privacy Policy Login Sign Up"}