{"link": "https://www.themoviedb.org/tv/25471?language=en", "title": "Farmen", "resume": "We don't have an overview translated in English. Help us expand our database by adding one.", "rate": 0, "genre": ["Reality"], "cast": ["Gaute Gr\u00f8tta Grav"], "character": ["Himself - Host"], "site_data": "html Apps Forums Leaderboard Contribute API Support Discover Movies TV Shows Movies Popular Top Rated Upcoming Now Playing TV Shows Popular Top Rated On TV Airing Today People Popular People Can't find a movie or TV show? Login to create it. en Login Sign Up  ID: 25471   Expand Farmen   (2001) User Score Overview We don't have an overview translated in English. Help us expand our database by adding one. Discussions   Reviews Videos   Images   Changes Report Share Discussions General  0 Content Issues  0 Images Backdrops  4 Posters  2 Videos Trailers  0 Teasers  0 Clips  0 Featurettes  0 Opening Credits  0 Top Billed Cast Gaute Gr\u00f8tta Grav Himself - Host Full Cast & Crew Last Season Season 9 2013 | 30 Episodes Season 9 of Farmen premiered on October  7, 2013. View All Seasons Social Reviews  0 Discussions  0 Media Most Popular Videos  0 Backdrops  4 Posters  2 Recommendations We don't have enough data to suggest any TV shows based on Farmen. You can help by rating TV shows you've seen. Facts Status  Returning Series Network Certification  - Type  Scripted Original Language  Norwegian Runtime  45m Homepage  - Genres Reality Keywords No keywords have been added. Content Score 50 Still needs a little work. Top Contributors 8 Bendik M 5 Mr_Democracy TB 1 TMDb Bot  View Edit History Popularity Trend  Login to edit  URL By  signing up  for an account on TMDb, you can post directly to Twitter and Facebook. You need to be logged in to continue. Click  here  to login or  here  to sign up.    page_wrap opened in html_head  Join the Community The Basics About TMDb Contact Us Support Forums API Blog Get Involved  Contribution Bible 3rd Party Applications Add New Movie Add New TV Show Community Guidelines Leaderboard Forums Twitter Facebook Legal Terms of Use Privacy Policy Login Sign Up"}