{"link": "https://www.themoviedb.org/tv/63910?language=en", "title": "D-Day", "resume": "When a natural disaster strikes Seoul, a team of medical doctors and emergency personnel struggle to deal with its aftermath.", "rate": 53, "genre": ["Drama", "Romance"], "cast": ["Kim Young-kwang", "Jung So-min", "Ha Seok-jin", "Kim Jung-hwa", "Kim Sang-ho"], "character": ["Lee Hae-sung", "Jung Ddol-mi", "Han Woo-jin", "Eun So-yul", "Choi Il-seop"], "site_data": "html Apps Forums Leaderboard Contribute API Support Discover Movies TV Shows Movies Popular Top Rated Upcoming Now Playing TV Shows Popular Top Rated On TV Airing Today People Popular People Can't find a movie or TV show? Login to create it. en Login Sign Up  ID: 63910   Expand D-Day   (2015) User Score Overview When a natural disaster strikes Seoul, a team of medical doctors and emergency personnel struggle to deal with its aftermath. Discussions   Reviews Videos   Images   Changes Report Share Discussions General  0 Content Issues  0 Images Backdrops  5 Posters  3 Videos Trailers  0 Teasers  0 Clips  0 Featurettes  0 Opening Credits  0 Top Billed Cast Kim Young-kwang Lee Hae-sung Jung So-min Jung Ddol-mi Ha Seok-jin Han Woo-jin Kim Jung-hwa Eun So-yul Kim Sang-ho Choi Il-seop Full Cast & Crew Last Season Season 1 2015 | 20 Episodes Season 1 of D-Day premiered on September 18, 2015. View All Seasons Social Reviews  0 Discussions  0 Media Most Popular Videos  0 Backdrops  5 Posters  3 Recommendations We don't have enough data to suggest any TV shows based on D-Day. You can help by rating TV shows you've seen. Facts Original Name  \ub514 \ub370\uc774 Status  Ended Network Certification  - Type  Scripted Original Language  Korean Runtime  60m Homepage   http://drama.jtbc.joins.com/dday/ Genres Drama Romance Keywords korea Content Score 86 Almost there... Top Contributors M 42 Maria180493 z 20 zurman1 4 part-mozi 3 lareina123  View Edit History Popularity Trend  Login to edit  URL By  signing up  for an account on TMDb, you can post directly to Twitter and Facebook. You need to be logged in to continue. Click  here  to login or  here  to sign up.    page_wrap opened in html_head  Join the Community The Basics About TMDb Contact Us Support Forums API Blog Get Involved  Contribution Bible 3rd Party Applications Add New Movie Add New TV Show Community Guidelines Leaderboard Forums Twitter Facebook Legal Terms of Use Privacy Policy Login Sign Up"}