{"link": "https://www.themoviedb.org/tv/31172?language=en", "title": "The Beautiful Life: TBL", "resume": "The daily lives of young models living together in a models' residence in New York, while struggling to deal with the cutthroat competition and fleeting fame of the fashion world.", "rate": 60, "genre": ["Drama"], "cast": ["Benjamin Hollingsworth", "Sara Paxton", "Mischa Barton", "Ashley Madekwe", "Nico Tortorella"], "character": ["Chris Andrews", "Raina Marinelli", "Sonja Stone", "Marissa Delfina", "Cole Shepherd"], "site_data": "html Apps Forums Leaderboard Contribute API Support Discover Movies TV Shows Movies Popular Top Rated Upcoming Now Playing TV Shows Popular Top Rated On TV Airing Today People Popular People Can't find a movie or TV show? Login to create it. en Login Sign Up  ID: 31172   Expand The Beautiful Life: TBL   (2009) User Score Overview The daily lives of young models living together in a models' residence in New York, while struggling to deal with the cutthroat competition and fleeting fame of the fashion world. Featured Crew Adam Giaudrone Creator Discussions   Reviews Videos   Images   Changes Report Share Discussions General  0 Content Issues  1 Images Backdrops  7 Posters  4 Videos Trailers  0 Teasers  0 Clips  0 Featurettes  0 Opening Credits  0 Top Billed Cast Benjamin Hollingsworth Chris Andrews Sara Paxton Raina Marinelli Mischa Barton Sonja Stone Ashley Madekwe Marissa Delfina Nico Tortorella Cole Shepherd Full Cast & Crew Last Season Season 1 2009 | 5 Episodes Season 1 of The Beautiful Life: TBL premiered on September 16, 2009. View All Seasons Social Reviews  0 Discussions  1 Subject Status Replies Last Reply There are no discussions for The Beautiful Life: TBL. Login to be first! Go to Discussions Media Most Popular Videos  0 Backdrops  7 Posters  4 Recommendations We don't have enough data to suggest any TV shows based on The Beautiful Life: TBL. You can help by rating TV shows you've seen. Facts Status  Cancelled Network Certification TV-14 Meaning This program contains some material that many parents would find unsuitable for children under 14 years of age. Type  Scripted Original Language  English Runtime  42m Homepage  - Genres Drama Keywords new york model fashion model young adult Content Score 93 Almost there... Top Contributors 30 Banana s 3 speedycars R 1 Rebecca 1 janar  View Edit History Popularity Trend  Login to edit  URL By  signing up  for an account on TMDb, you can post directly to Twitter and Facebook. You need to be logged in to continue. Click  here  to login or  here  to sign up.    page_wrap opened in html_head  Join the Community The Basics About TMDb Contact Us Support Forums API Blog Get Involved  Contribution Bible 3rd Party Applications Add New Movie Add New TV Show Community Guidelines Leaderboard Forums Twitter Facebook Legal Terms of Use Privacy Policy Login Sign Up"}