{"link": "https://www.themoviedb.org/tv/69234?language=en", "title": "Le Monde de Jamy", "resume": "We don't have an overview translated in English. Help us expand our database by adding one.", "rate": 0, "genre": ["Documentary"], "cast": ["Myriam Bounafaa", "\u00c9glantine \u00c9m\u00e9y\u00e9", "Jamy Gourmaud"], "character": ["Herself - Presenter"], "site_data": "html Apps Forums Leaderboard Contribute API Support Discover Movies TV Shows Movies Popular Top Rated Upcoming Now Playing TV Shows Popular Top Rated On TV Airing Today People Popular People Can't find a movie or TV show? Login to create it. en Login Sign Up  ID: 69234   Expand Le Monde de Jamy   (2014) User Score Overview We don't have an overview translated in English. Help us expand our database by adding one. Discussions   Reviews Videos   Images   Changes Report Share Discussions General  0 Content Issues  0 Images Backdrops  3 Posters  1 Videos Trailers  0 Teasers  0 Clips  0 Featurettes  0 Opening Credits  0 Top Billed Cast Myriam Bounafaa \u00c9glantine \u00c9m\u00e9y\u00e9 Herself - Presenter Jamy Gourmaud Full Cast & Crew Last Season Season 1 2014 | 15 Episodes Season 1 of Le Monde de Jamy premiered on May  7, 2014. View All Seasons Social Reviews  0 Discussions  0 Media Most Popular Videos  0 Backdrops  3 Posters  1 Recommendations We don't have enough data to suggest any TV shows based on Le Monde de Jamy. You can help by rating TV shows you've seen. Facts Status  Returning Series Network Certification  - Type  Documentary Original Language  French Runtime  110m Homepage   https://www.france.tv/france-3/le-monde-de-jamy/#scroll-saison Genres Documentary Keywords science discovery Content Score 50 Still needs a little work. Top Contributors a 20 archambeaud m 12 michael47  View Edit History Popularity Trend  Login to edit  URL By  signing up  for an account on TMDb, you can post directly to Twitter and Facebook. You need to be logged in to continue. Click  here  to login or  here  to sign up.    page_wrap opened in html_head  Join the Community The Basics About TMDb Contact Us Support Forums API Blog Get Involved  Contribution Bible 3rd Party Applications Add New Movie Add New TV Show Community Guidelines Leaderboard Forums Twitter Facebook Legal Terms of Use Privacy Policy Login Sign Up"}