{"link": "https://www.themoviedb.org/tv/27686?language=en", "title": "Verborgen Gebreken", "resume": "Verborgen Gebreken follows the story of five young people at real estate agency Apollo in Amsterdam. The real estate world is modern, exciting and all about the money.", "rate": 0, "genre": ["Drama"], "cast": ["Ricky Koole", "Jennifer Hoffman", "Frederik Brom", "Egbert Jan Weeber"], "character": ["Noor Rademaker", "Puck Rademaker", "Joep Verboom", "Bram Bakker"], "site_data": "html Apps Forums Leaderboard Contribute API Support Discover Movies TV Shows Movies Popular Top Rated Upcoming Now Playing TV Shows Popular Top Rated On TV Airing Today People Popular People Can't find a movie or TV show? Login to create it. en Login Sign Up  ID: 27686   Expand Verborgen Gebreken   (2009) User Score Overview Verborgen Gebreken follows the story of five young people at real estate agency Apollo in Amsterdam. The real estate world is modern, exciting and all about the money. Featured Crew Mark de Blok Creator Discussions   Reviews Videos   Images   Changes Report Share Discussions General  0 Content Issues  0 Images Backdrops  2 Posters  1 Videos Trailers  0 Teasers  0 Clips  0 Featurettes  0 Opening Credits  0 Top Billed Cast Ricky Koole Noor Rademaker Jennifer Hoffman Puck Rademaker Frederik Brom Joep Verboom Egbert Jan Weeber Bram Bakker Full Cast & Crew Last Season Season 3 2011 | 12 Episodes Season 3 of Verborgen Gebreken premiered on February 21, 2011. View All Seasons Social Reviews  0 Discussions  0 Media Most Popular Videos  0 Backdrops  2 Posters  1 Recommendations We don't have enough data to suggest any TV shows based on Verborgen Gebreken. You can help by rating TV shows you've seen. Facts Status  Ended Network Certification 0 Meaning Can be aired at any time. Type  Scripted Original Language  Dutch; Flemish Runtime  45m Homepage   http://www.net5.nl/programmas/verborgen-gebreken/ Genres Drama Keywords real estate Content Score 93 Almost there... Top Contributors 68 Marr \ud83c\uddf3\ud83c\uddf1  View Edit History Popularity Trend  Login to edit  URL By  signing up  for an account on TMDb, you can post directly to Twitter and Facebook. You need to be logged in to continue. Click  here  to login or  here  to sign up.    page_wrap opened in html_head  Join the Community The Basics About TMDb Contact Us Support Forums API Blog Get Involved  Contribution Bible 3rd Party Applications Add New Movie Add New TV Show Community Guidelines Leaderboard Forums Twitter Facebook Legal Terms of Use Privacy Policy Login Sign Up"}