{"link": "https://www.themoviedb.org/tv/20915?language=en", "title": "Nasty Boys", "resume": "The Nasty Boys is a television action drama series based on the real life Narcotics Officers of the North Las Vegas Police Department.", "rate": 0, "genre": ["Drama"], "cast": ["Benjamin Bratt", "Dennis Franz", "Don Franklin", "Nia Peeples", "James Pax"], "character": ["Eduardo Cruz", "Lt. Stan Krieger", "Alex Wheeler", "Serena Cruz", "Jimmy Kee"], "site_data": "html Apps Forums Leaderboard Contribute API Support Discover Movies TV Shows Movies Popular Top Rated Upcoming Now Playing TV Shows Popular Top Rated On TV Airing Today People Popular People Can't find a movie or TV show? Login to create it. en Login Sign Up  ID: 20915   Expand Nasty Boys   (1989) User Score Overview The Nasty Boys is a television action drama series based on the real life Narcotics Officers of the North Las Vegas Police Department. Featured Crew Dick Wolf Creator Discussions   Reviews Videos   Images   Changes Report Share Discussions General  0 Content Issues  0 Images Backdrops  0 Posters  1 Videos Trailers  0 Teasers  0 Clips  0 Featurettes  0 Opening Credits  0 Top Billed Cast Benjamin Bratt Eduardo Cruz Dennis Franz Lt. Stan Krieger Don Franklin Alex Wheeler Nia Peeples Serena Cruz James Pax Jimmy Kee Full Cast & Crew Last Season Season 1 1989 | 14 Episodes Season 1 of Nasty Boys premiered on September 21, 1989. View All Seasons Social Reviews  0 Discussions  0 Media Most Popular Videos  0 Backdrops  0 Posters  1 Recommendations We don't have enough data to suggest any TV shows based on Nasty Boys. You can help by rating TV shows you've seen. Facts Status  Ended Network Certification  - Type  Scripted Original Language  English Runtime  60m Homepage  - Genres Drama Keywords undercover agent police las vegas narcotics cop Content Score 79 Pump it up! We're close now. Top Contributors 10 Banana s 8 shiff7 1 Steve  View Edit History Popularity Trend  Login to edit  URL By  signing up  for an account on TMDb, you can post directly to Twitter and Facebook. You need to be logged in to continue. Click  here  to login or  here  to sign up.    page_wrap opened in html_head  Join the Community The Basics About TMDb Contact Us Support Forums API Blog Get Involved  Contribution Bible 3rd Party Applications Add New Movie Add New TV Show Community Guidelines Leaderboard Forums Twitter Facebook Legal Terms of Use Privacy Policy Login Sign Up"}