{"link": "https://www.themoviedb.org/tv/72637?language=en", "title": "O11CE", "resume": "We don't have an overview translated in English. Help us expand our database by adding one.", "rate": null, "genre": ["Comedy", "Family"], "cast": ["Mariano Gonz\u00e1lez", "Sebasti\u00e1n Athi\u00e9", "Juan David Penagos", "Luan Brum", "Paulina Vetrano"], "site_data": "html Apps Forums Leaderboard Contribute API Support Discover Movies TV Shows Movies Popular Top Rated Upcoming Now Playing TV Shows Popular Top Rated On TV Airing Today People Popular People Can't find a movie or TV show? Login to create it. en Login Sign Up  ID: 72637   Expand O11CE   (2017) User Score Overview We don't have an overview translated in English. Help us expand our database by adding one. Featured Crew Jorge Edelstein Creator Discussions   Reviews Videos   Images   Changes Report Share Discussions General  0 Content Issues  0 Images Backdrops  2 Posters  2 Videos Trailers  0 Teasers  0 Clips  0 Featurettes  0 Opening Credits  0 Top Billed Cast Mariano Gonz\u00e1lez Gabriel \"Gabo\" Moretti Sebasti\u00e1n Athi\u00e9 Lorenzo Guevara Juan David Penagos Ricardo \"Ricky\" Flores Luan Brum Andr\u00e9 \"Ded\u00e9\" Duarte Paulina Vetrano Zoe Vel\u00e1zquez Full Cast & Crew Last Season Season 1 2017 | 9 Episodes Season 1 of O11CE premiered on March 13, 2017. View All Seasons Social Reviews  0 Discussions  0 Media Most Popular Videos  0 Backdrops  2 Posters  2 Recommendations We don't have enough data to suggest any TV shows based on O11CE. You can help by rating TV shows you've seen. Facts Status  Returning Series Networks Certification  - Type  Scripted Original Language  Spanish; Castilian Runtime  22m Homepage   http://disneyxd.disneylatino.com/once Genres Comedy Family Keywords sport fu\u00dfball football Content Score 86 Almost there... Top Contributors 55 Crhistian L 31 LukasGen t 6 tanoupload 4 Banana  View Edit History Popularity Trend  Login to edit  URL By  signing up  for an account on TMDb, you can post directly to Twitter and Facebook. You need to be logged in to continue. Click  here  to login or  here  to sign up.    page_wrap opened in html_head  Join the Community The Basics About TMDb Contact Us Support Forums API Blog Get Involved  Contribution Bible 3rd Party Applications Add New Movie Add New TV Show Community Guidelines Leaderboard Forums Twitter Facebook Legal Terms of Use Privacy Policy Login Sign Up", "character": ["Gabriel \"Gabo\" Moretti", "Lorenzo Guevara", "Ricardo \"Ricky\" Flores", "Andr\u00e9 \"Ded\u00e9\" Duarte", "Zoe Vel\u00e1zquez"]}