{"link": "https://www.themoviedb.org/tv/65521?language=en", "title": "Here Come The Habibs", "resume": "After winning the lottery, the Habib family move into Sydney's richest suburb to live the Australian dream, but their poshy next door neighbours are not all to happy about it.", "rate": 50, "genre": ["Comedy"], "cast": ["Michael Denkha", "Camilla Ah Kin", "Kat Hoyos", "Tyler De Nawi", "Sam Alhaje"], "character": ["Fou Fou Habib", "Mariam Habib", "Layla Habib", "Elias Habib", "Toufic Habib"], "site_data": "html Apps Forums Leaderboard Contribute API Support Discover Movies TV Shows Movies Popular Top Rated Upcoming Now Playing TV Shows Popular Top Rated On TV Airing Today People Popular People Can't find a movie or TV show? Login to create it. en Login Sign Up  ID: 65521   Expand Here Come The Habibs   (2016) User Score  Play Trailer Overview After winning the lottery, the Habib family move into Sydney's richest suburb to live the Australian dream, but their poshy next door neighbours are not all to happy about it. Featured Crew Ben Davies Creator Phil Lloyd Creator Matt Ryan-Garnsey Creator Tahir Bilgic Creator Rob Shehadie Creator Discussions   Reviews Videos   Images   Changes Report Share Discussions General  0 Content Issues  0 Images Backdrops  1 Posters  2 Videos Trailers  1 Teasers  0 Clips  0 Featurettes  0 Opening Credits  0 Top Billed Cast Michael Denkha Fou Fou Habib Camilla Ah Kin Mariam Habib Kat Hoyos Layla Habib Tyler De Nawi Elias Habib Sam Alhaje Toufic Habib Full Cast & Crew Last Season Season 2 2017 | 8 Episodes Season 2 of Here Come The Habibs premiered on June  5, 2017. View All Seasons Social Reviews  0 Discussions  0 Media Most Popular Videos  1 Backdrops  1 Posters  2 Recommendations We don't have enough data to suggest any TV shows based on Here Come The Habibs. You can help by rating TV shows you've seen. Facts Status  Returning Series Network Certification M Meaning Recommended for mature audiences; M-rated content may only be broadcast between 8:30 p.m. and 5:00 a.m. on any day, and additionally between 12:00 p.m. and 3:00 p.m. on schooldays. Type  Scripted Original Language  English Runtime  30m Homepage   https://www.9now.com.au/here-come-the-habibs Genres Comedy Keywords australia lebanon migration fish out of water sudden wealth winning lottery family of color Content Score 100 Yes! Looking good! Top Contributors 49 Rug 13 Banana 7 Elizabeth Jennings TB 2 TMDb Bot  View Edit History Popularity Trend  Login to edit  URL By  signing up  for an account on TMDb, you can post directly to Twitter and Facebook. You need to be logged in to continue. Click  here  to login or  here  to sign up.    page_wrap opened in html_head  Join the Community The Basics About TMDb Contact Us Support Forums API Blog Get Involved  Contribution Bible 3rd Party Applications Add New Movie Add New TV Show Community Guidelines Leaderboard Forums Twitter Facebook Legal Terms of Use Privacy Policy Login Sign Up"}