{"link": "https://www.themoviedb.org/tv/74555?language=en", "title": "Detective Yugami", "resume": "Yukimasa Yugami is a detective who chases after facts in cases. He will resort to illegal investigations and he uses his unique reasoning powers. His partner is rookie detective Torao Hanyu.", "rate": null, "genre": ["Crime"], "cast": ["Tadanobu Asano", "Ryunosuke Kamiki", "Mizuki Yamamoto", "Izumi Inamori", "Takashi Nishina"], "site_data": "html Apps Forums Leaderboard Contribute API Support Discover Movies TV Shows Movies Popular Top Rated Upcoming Now Playing TV Shows Popular Top Rated On TV Airing Today People Popular People Can't find a movie or TV show? Login to create it. en Login Sign Up  ID: 74555   Expand Detective Yugami   (2017) User Score Overview Yukimasa Yugami is a detective who chases after facts in cases. He will resort to illegal investigations and he uses his unique reasoning powers. His partner is rookie detective Torao Hanyu. Discussions   Reviews Videos   Images   Changes Report Share Discussions General  0 Content Issues  0 Images Backdrops  2 Posters  2 Videos Trailers  0 Teasers  0 Clips  0 Featurettes  0 Opening Credits  0 Top Billed Cast Tadanobu Asano Yukimasa Yugami Ryunosuke Kamiki Torao Hanyu Mizuki Yamamoto Kazumi Hikawa Izumi Inamori Rika Kanno Takashi Nishina Ageo Tataki Full Cast & Crew Current Season Season 1 2017 | 10 Episodes Season 1 of Detective Yugami premiered on October 12, 2017. View All Seasons Social Reviews  0 Discussions  0 Media Most Popular Videos  0 Backdrops  2 Posters  2 Recommendations We don't have enough data to suggest any TV shows based on Detective Yugami. You can help by rating TV shows you've seen. Facts Original Name  \u5211\u4e8b\u3086\u304c\u307f Status  Ended Network Certification  - Type  Scripted Original Language  Japanese Runtime  45m Homepage   http://www.fujitv.co.jp/yugami/ Genres Crime Keywords detective Content Score 86 Almost there... Top Contributors M 38 Maria180493 d 4 daniel1008 3 friend-series.com 3 Elizabeth Jennings  View Edit History Popularity Trend  Login to edit  URL By  signing up  for an account on TMDb, you can post directly to Twitter and Facebook. You need to be logged in to continue. Click  here  to login or  here  to sign up.    page_wrap opened in html_head  Join the Community The Basics About TMDb Contact Us Support Forums API Blog Get Involved  Contribution Bible 3rd Party Applications Add New Movie Add New TV Show Community Guidelines Leaderboard Forums Twitter Facebook Legal Terms of Use Privacy Policy Login Sign Up", "character": ["Yukimasa Yugami", "Torao Hanyu", "Kazumi Hikawa", "Rika Kanno", "Ageo Tataki"]}