{"link": "https://www.themoviedb.org/tv/60716?language=en", "title": "Nero Wolfe", "resume": "Interesting modern actualization made by Italian broadcasting service (RAI) of immortal, well-known characters created by the genial American novelist Rex Stout.", "rate": 80, "genre": ["Mystery", "Crime"], "cast": ["Francesco Pannofino", "Pietro Sermonti", "Giulia Bevilacqua", "Andy Luotto", "Marcello Mazzarella"], "character": ["Nero Wolfe", "Archie Goodwin", "Rosa Petrini", "Nanni Laghi", "Commissario Graziani"], "site_data": "html Apps Forums Leaderboard Contribute API Support Discover Movies TV Shows Movies Popular Top Rated Upcoming Now Playing TV Shows Popular Top Rated On TV Airing Today People Popular People Can't find a movie or TV show? Login to create it. en Login Sign Up  ID: 60716   Expand Nero Wolfe   (2012) User Score Overview Interesting modern actualization made by Italian broadcasting service (RAI) of immortal, well-known characters created by the genial American novelist Rex Stout. Featured Crew Rex Stout Creator Piero Bodrato Creator Grazia Giardiello Creator Roberto Iannone Creator Chiara Laudani Creator Alessandro Sermoneta Creator Discussions   Reviews Videos   Images   Changes Report Share Discussions General  0 Content Issues  0 Images Backdrops  1 Posters  4 Videos Trailers  0 Teasers  0 Clips  0 Featurettes  0 Opening Credits  0 Top Billed Cast Francesco Pannofino Nero Wolfe Pietro Sermonti Archie Goodwin Giulia Bevilacqua Rosa Petrini Andy Luotto Nanni Laghi Marcello Mazzarella Commissario Graziani Full Cast & Crew Last Season Season 1 2012 | 8 Episodes Season 1 of Nero Wolfe premiered on April  5, 2012. View All Seasons Social Reviews  0 Discussions  0 Media Most Popular Videos  0 Backdrops  1 Posters  4 Recommendations We don't have enough data to suggest any TV shows based on Nero Wolfe. You can help by rating TV shows you've seen. Facts Status  Ended Network Certification  - Type  Scripted Original Language  Italian Runtime  100m Homepage   http://www.nerowolfe.rai.it/dl/portali/site/page/Page-49357e7c-3fae-44ab-a5dd-61fd1f6cb144.html?refresh_ce Genres Mystery Crime Keywords detective criminal Content Score 100 Yes! Looking good! Top Contributors t 33 tmdb15589237 29 Uli666 R 23 Raffa76 s 4 speedycars  View Edit History Popularity Trend  Login to edit  URL By  signing up  for an account on TMDb, you can post directly to Twitter and Facebook. You need to be logged in to continue. Click  here  to login or  here  to sign up.    page_wrap opened in html_head  Join the Community The Basics About TMDb Contact Us Support Forums API Blog Get Involved  Contribution Bible 3rd Party Applications Add New Movie Add New TV Show Community Guidelines Leaderboard Forums Twitter Facebook Legal Terms of Use Privacy Policy Login Sign Up"}