{"link": "https://www.themoviedb.org/tv/73015?language=en", "title": "Ill Behaviour", "resume": "Comedy thriller about three friends who embark on a journey that takes them to the extremes of their friendship, crossing every boundary imaginable to save a life.", "rate": 73, "genre": ["Comedy"], "cast": ["Jessica Regan", "Christina Chong", "John Gordon Sinclair", "Chris Geere", "Tom Riley"], "character": ["Tess", "Joel", "Charlie"], "site_data": "html Apps Forums Leaderboard Contribute API Support Discover Movies TV Shows Movies Popular Top Rated Upcoming Now Playing TV Shows Popular Top Rated On TV Airing Today People Popular People Can't find a movie or TV show? Login to create it. en Login Sign Up  ID: 73015   Expand Ill Behaviour   (2017) User Score Overview Comedy thriller about three friends who embark on a journey that takes them to the extremes of their friendship, crossing every boundary imaginable to save a life. Featured Crew Sam Bain Creator Discussions   Reviews Videos   Images   Changes Report Share Discussions General  0 Content Issues  0 Images Backdrops  4 Posters  6 Videos Trailers  0 Teasers  0 Clips  0 Featurettes  0 Opening Credits  0 Top Billed Cast Jessica Regan Tess Christina Chong John Gordon Sinclair Chris Geere Joel Tom Riley Charlie Full Cast & Crew Last Season Season 1 2017 | 3 Episodes Season 1 of Ill Behaviour premiered on July 21, 2017. View All Seasons Social Reviews  0 Discussions  0 Media Most Popular Videos  0 Backdrops  4 Posters  6 Recommendations   2016-04-11 The Detour 7.5  Facts Status  Ended Network Certification  - Type  Miniseries Original Language  English Runtime  60m Homepage   http://www.bbc.co.uk/programmes/p0559gdn Genres Comedy Keywords No keywords have been added. Content Score 93 Almost there... Top Contributors k 20 kyz03 TB 11 TMDb Bot 6 Elizabeth Jennings R 5 Rebecca  View Edit History Popularity Trend  Login to edit  URL By  signing up  for an account on TMDb, you can post directly to Twitter and Facebook. You need to be logged in to continue. Click  here  to login or  here  to sign up.    page_wrap opened in html_head  Join the Community The Basics About TMDb Contact Us Support Forums API Blog Get Involved  Contribution Bible 3rd Party Applications Add New Movie Add New TV Show Community Guidelines Leaderboard Forums Twitter Facebook Legal Terms of Use Privacy Policy Login Sign Up"}