{"link": "https://www.themoviedb.org/tv/75197?language=en", "title": "Love, Lies & Records", "resume": "Registrar Kate Dickinson tries to balance her personal life with the daily dramas of births, deaths and marriages and the impact they have upon her and her staff at the local Registry Office in Leeds.", "rate": 70, "genre": ["Drama"], "cast": ["Ashley Jensen", "Rebecca Front", "Adrian Bower", "Kenny Doughty", "Mandip Gill"], "character": ["Kate Dickenson", "Judy", "Rob", "Rick", "Talia"], "site_data": "html Apps Forums Leaderboard Contribute API Support Discover Movies TV Shows Movies Popular Top Rated Upcoming Now Playing TV Shows Popular Top Rated On TV Airing Today People Popular People Can't find a movie or TV show? Login to create it. en Login Sign Up  ID: 75197   Expand Love, Lies & Records   (2017) User Score  Play Trailer Overview Registrar Kate Dickinson tries to balance her personal life with the daily dramas of births, deaths and marriages and the impact they have upon her and her staff at the local Registry Office in Leeds. Discussions   Reviews Videos   Images   Changes Report Share Discussions General  0 Content Issues  0 Images Backdrops  1 Posters  1 Videos Trailers  1 Teasers  0 Clips  0 Featurettes  0 Opening Credits  0 Top Billed Cast Ashley Jensen Kate Dickenson Rebecca Front Judy Adrian Bower Rob Kenny Doughty Rick Mandip Gill Talia Full Cast & Crew Current Season Series 1 2017 | 6 Episodes Season 1 of Love, Lies & Records premiered on November 16, 2017. View All Seasons Social Reviews  0 Discussions  0 Media Most Popular Videos  1 Backdrops  1 Posters  1 Recommendations We don't have enough data to suggest any TV shows based on Love, Lies & Records. You can help by rating TV shows you've seen. Facts Status  Returning Series Network Certification  - Type  Scripted Original Language  English Runtime  58m Homepage   http://www.bbc.co.uk/programmes/b09gdyzq Genres Drama Keywords leeds registry office Content Score 93 Almost there... Top Contributors 20 Elizabeth Jennings 5 clapton 5 Steve TB 1 TMDb Bot  View Edit History Popularity Trend  Login to edit  URL By  signing up  for an account on TMDb, you can post directly to Twitter and Facebook. You need to be logged in to continue. Click  here  to login or  here  to sign up.    page_wrap opened in html_head  Join the Community The Basics About TMDb Contact Us Support Forums API Blog Get Involved  Contribution Bible 3rd Party Applications Add New Movie Add New TV Show Community Guidelines Leaderboard Forums Twitter Facebook Legal Terms of Use Privacy Policy Login Sign Up"}