{"link": "https://www.themoviedb.org/tv/27771?language=en", "title": "Game, Set, and Match", "resume": "We don't have an overview translated in English. Help us expand our database by adding one.", "rate": 95, "genre": ["Drama"], "cast": ["Ian Holm", "Michael Culver", "Jeremy Child", "Hugh Fraser", "Gail Harrison"], "character": ["Bernard Samson", "Dicky Cruyer", "Henry Tiptree", "Giles Trent", "Tessa Kozinski"], "site_data": "html Apps Forums Leaderboard Contribute API Support Discover Movies TV Shows Movies Popular Top Rated Upcoming Now Playing TV Shows Popular Top Rated On TV Airing Today People Popular People Can't find a movie or TV show? Login to create it. en Login Sign Up  ID: 27771   Expand Game, Set, and Match   (1988) User Score Overview We don't have an overview translated in English. Help us expand our database by adding one. Discussions   Reviews Videos   Images   Changes Report Share Discussions General  0 Content Issues  0 Images Backdrops  1 Posters  1 Videos Trailers  0 Teasers  0 Clips  0 Featurettes  0 Opening Credits  0 Top Billed Cast Ian Holm Bernard Samson Michael Culver Dicky Cruyer Jeremy Child Henry Tiptree Hugh Fraser Giles Trent Gail Harrison Tessa Kozinski Full Cast & Crew Last Season Season 1 1988 | 13 Episodes Season 1 of Game, Set, and Match premiered on October  3, 1988. View All Seasons Social Reviews  0 Discussions  0 Media Most Popular Videos  0 Backdrops  1 Posters  1 Recommendations We don't have enough data to suggest any TV shows based on Game, Set, and Match. You can help by rating TV shows you've seen. Facts Status  Ended Network Certification  - Type  Scripted Original Language  English Runtime  60m Homepage  - Genres Drama Keywords No keywords have been added. Content Score 79 Pump it up! We're close now. Top Contributors S 11 Samara 6 kcdh  View Edit History Popularity Trend  Login to edit  URL By  signing up  for an account on TMDb, you can post directly to Twitter and Facebook. You need to be logged in to continue. Click  here  to login or  here  to sign up.    page_wrap opened in html_head  Join the Community The Basics About TMDb Contact Us Support Forums API Blog Get Involved  Contribution Bible 3rd Party Applications Add New Movie Add New TV Show Community Guidelines Leaderboard Forums Twitter Facebook Legal Terms of Use Privacy Policy Login Sign Up"}