{"link": "https://www.themoviedb.org/tv/70110?language=en", "title": "Urusan Hati Cik Drama Queen", "resume": "We don't have an overview translated in English. Help us expand our database by adding one.", "rate": 0, "genre": ["Drama"], "cast": ["Aiman Hakim Ridza", "Shalma Ainaa", "Adriana Adnan", "Isyariana", "Scha Alyahya"], "character": ["Fadhlan", "Farissa", "Zehra", "Hanissa", "Syazlin"], "site_data": "html Apps Forums Leaderboard Contribute API Support Discover Movies TV Shows Movies Popular Top Rated Upcoming Now Playing TV Shows Popular Top Rated On TV Airing Today People Popular People Can't find a movie or TV show? Login to create it. en Login Sign Up  ID: 70110   Expand Urusan Hati Cik Drama Queen   (2017) User Score Overview We don't have an overview translated in English. Help us expand our database by adding one. Discussions   Reviews Videos   Images   Changes Report Share Discussions General  0 Content Issues  0 Images Backdrops  0 Posters  1 Videos Trailers  0 Teasers  0 Clips  0 Featurettes  0 Opening Credits  0 Top Billed Cast Aiman Hakim Ridza Fadhlan Shalma Ainaa Farissa Adriana Adnan Zehra Isyariana Hanissa Scha Alyahya Syazlin Full Cast & Crew Last Season Season 1 2017 | 16 Episodes Season 1 of Urusan Hati Cik Drama Queen premiered on February  6, 2017. View All Seasons Social Reviews  0 Discussions  0 Media Most Popular Videos  0 Backdrops  0 Posters  1 Recommendations We don't have enough data to suggest any TV shows based on Urusan Hati Cik Drama Queen. You can help by rating TV shows you've seen. Facts Status  Returning Series Network Astro Ria Certification  - Type  Scripted Original Language  Malay Runtime  42m Homepage  - Genres Drama Keywords No keywords have been added. Content Score 64 We're so close, yet so far. Top Contributors v 27 vplaytv 4 Elizabeth Jennings  View Edit History Popularity Trend  Login to edit  URL By  signing up  for an account on TMDb, you can post directly to Twitter and Facebook. You need to be logged in to continue. Click  here  to login or  here  to sign up.    page_wrap opened in html_head  Join the Community The Basics About TMDb Contact Us Support Forums API Blog Get Involved  Contribution Bible 3rd Party Applications Add New Movie Add New TV Show Community Guidelines Leaderboard Forums Twitter Facebook Legal Terms of Use Privacy Policy Login Sign Up"}