{"link": "https://www.themoviedb.org/tv/61098?language=en", "title": "Big History", "resume": "Explores many facets of epic moments in history from the past 13.7 billion years, from a Big History perspective.", "rate": 70, "genre": ["Documentary"], "cast": ["Bryan Cranston"], "character": ["Narrator"], "site_data": "html Apps Forums Leaderboard Contribute API Support Discover Movies TV Shows Movies Popular Top Rated Upcoming Now Playing TV Shows Popular Top Rated On TV Airing Today People Popular People Can't find a movie or TV show? Login to create it. en Login Sign Up  ID: 61098   Expand Big History   (2013) User Score Overview Explores many facets of epic moments in history from the past 13.7 billion years, from a Big History perspective. Discussions   Reviews Videos   Images   Changes Report Share Discussions General  0 Content Issues  0 Images Backdrops  0 Posters  1 Videos Trailers  0 Teasers  0 Clips  0 Featurettes  0 Opening Credits  0 Top Billed Cast Bryan Cranston Narrator Full Cast & Crew Last Season Season 1 2013 | 17 Episodes Season 1 of Big History premiered on November  2, 2013. View All Seasons Social Reviews  0 Discussions  0 Media Most Popular Videos  0 Backdrops  0 Posters  1 Recommendations We don't have enough data to suggest any TV shows based on Big History. You can help by rating TV shows you've seen. Facts Status  Ended Network Certification  - Type  Documentary Original Language  English Runtime  30m Homepage   http://www.history.com/shows/big-history Genres Documentary Keywords history Content Score 50 Still needs a little work. Top Contributors 16 Elizabeth Jennings 8 Banana z 6 zurman1 DM 4 Dan Mance  View Edit History Popularity Trend  Login to edit  URL By  signing up  for an account on TMDb, you can post directly to Twitter and Facebook. You need to be logged in to continue. Click  here  to login or  here  to sign up.    page_wrap opened in html_head  Join the Community The Basics About TMDb Contact Us Support Forums API Blog Get Involved  Contribution Bible 3rd Party Applications Add New Movie Add New TV Show Community Guidelines Leaderboard Forums Twitter Facebook Legal Terms of Use Privacy Policy Login Sign Up"}