{"link": "https://www.themoviedb.org/tv/65838?language=en", "title": "Insert Name Here", "resume": "Comedy panel show about people with the same first name, hosted by Sue Perkins.", "rate": null, "genre": ["Comedy"], "cast": ["Sue Perkins", "Josh Widdicombe", "Richard Osman", "Kate Williams"], "site_data": "html Apps Forums Leaderboard Contribute API Support Discover Movies TV Shows Movies Popular Top Rated Upcoming Now Playing TV Shows Popular Top Rated On TV Airing Today People Popular People Can't find a movie or TV show? Login to create it. en Login Sign Up  ID: 65838   Expand Insert Name Here   (2016) User Score  Play Trailer Overview Comedy panel show about people with the same first name, hosted by Sue Perkins. Discussions   Reviews Videos   Images   Changes Report Share Discussions General  0 Content Issues  0 Images Backdrops  1 Posters  2 Videos Trailers  1 Teasers  0 Clips  0 Featurettes  0 Opening Credits  0 Top Billed Cast Sue Perkins Host Josh Widdicombe Team captain Richard Osman Team captain Kate Williams Series Regular Full Cast & Crew Last Season Season 1 2016 | 6 Episodes Season 1 of Insert Name Here premiered on January  4, 2016. View All Seasons Social Reviews  0 Discussions  0 Media Most Popular Videos  1 Backdrops  1 Posters  2 Recommendations We don't have enough data to suggest any TV shows based on Insert Name Here. You can help by rating TV shows you've seen. Facts Status  Returning Series Network Certification  - Type  Talk Show Original Language  English Runtime  30m Homepage   http://www.bbc.co.uk/programmes/b06vswvf Genres Comedy Keywords game show quiz show panel show Content Score 93 Almost there... Top Contributors S 25 Sandor 6 Elizabeth Jennings 1 tigru89 TB 1 TMDb Bot  View Edit History Popularity Trend  Login to edit  URL By  signing up  for an account on TMDb, you can post directly to Twitter and Facebook. You need to be logged in to continue. Click  here  to login or  here  to sign up.    page_wrap opened in html_head  Join the Community The Basics About TMDb Contact Us Support Forums API Blog Get Involved  Contribution Bible 3rd Party Applications Add New Movie Add New TV Show Community Guidelines Leaderboard Forums Twitter Facebook Legal Terms of Use Privacy Policy Login Sign Up", "character": ["Host", "Team captain", "Team captain", "Series Regular"]}