{"link": "https://www.themoviedb.org/tv/22097?language=en", "title": "Gang Busters", "resume": "Gang Busters is a 30 minute television series, hosted by Chester Morris, that aired on NBC from March 20 to Oct. 23, 1952. The series dramatized FBI cases.", "rate": 0, "genre": ["Crime", "Drama"], "cast": ["Chester Morris"], "character": ["Host"], "site_data": "html Apps Forums Leaderboard Contribute API Support Discover Movies TV Shows Movies Popular Top Rated Upcoming Now Playing TV Shows Popular Top Rated On TV Airing Today People Popular People Can't find a movie or TV show? Login to create it. en Login Sign Up  ID: 22097   Expand Gang Busters   (1952) User Score Overview Gang Busters is a 30 minute television series, hosted by Chester Morris, that aired on NBC from March 20 to Oct. 23, 1952. The series dramatized FBI cases. Featured Crew Phillips Lord Creator Discussions   Reviews Videos   Images   Changes Report Share Discussions General  0 Content Issues  0 Images Backdrops  1 Posters  3 Videos Trailers  0 Teasers  0 Clips  0 Featurettes  0 Opening Credits  0 Top Billed Cast Chester Morris Host Full Cast & Crew Last Season Season 2 1952 | 4 Episodes Season 2 of Gang Busters premiered on September 18, 1952. View All Seasons Social Reviews  0 Discussions  0 Media Most Popular Videos  0 Backdrops  1 Posters  3 Recommendations We don't have enough data to suggest any TV shows based on Gang Busters. You can help by rating TV shows you've seen. Facts Status  Ended Network Certification  - Type  Scripted Original Language  English Runtime  30m Homepage  - Genres Crime Drama Keywords anthology outlaw Content Score 64 We're so close, yet so far. Top Contributors 18 Banana  View Edit History Popularity Trend  Login to edit  URL By  signing up  for an account on TMDb, you can post directly to Twitter and Facebook. You need to be logged in to continue. Click  here  to login or  here  to sign up.    page_wrap opened in html_head  Join the Community The Basics About TMDb Contact Us Support Forums API Blog Get Involved  Contribution Bible 3rd Party Applications Add New Movie Add New TV Show Community Guidelines Leaderboard Forums Twitter Facebook Legal Terms of Use Privacy Policy Login Sign Up"}