{"link": "https://www.themoviedb.org/tv/10607?language=en", "title": "Al TV", "resume": "Al TV is a series of comedy/music video specials created by and starring singer-songwriter \"Weird Al\" Yankovic.", "rate": 10, "genre": ["Comedy"], "cast": ["\"Weird Al\" Yankovic", "Jay Levey"], "character": ["Himself"], "site_data": "html Apps Forums Leaderboard Contribute API Support Discover Movies TV Shows Movies Popular Top Rated Upcoming Now Playing TV Shows Popular Top Rated On TV Airing Today People Popular People Can't find a movie or TV show? Login to create it. en Login Sign Up  ID: 10607   Expand Al TV   (1984) User Score Overview Al TV is a series of comedy/music video specials created by and starring singer-songwriter \"Weird Al\" Yankovic. Discussions   Reviews Videos   Images   Changes Report Share Discussions General  0 Content Issues  0 Images Backdrops  1 Posters  1 Videos Trailers  0 Teasers  0 Clips  0 Featurettes  0 Opening Credits  0 Top Billed Cast \"Weird Al\" Yankovic Himself Jay Levey Full Cast & Crew Last Season Al-tv season 1 1984 | 11 Episodes Season 1 of Al TV premiered on April  1, 1984. View All Seasons Social Reviews  0 Discussions  0 Media Most Popular Videos  0 Backdrops  1 Posters  1 Recommendations We don't have enough data to suggest any TV shows based on Al TV. You can help by rating TV shows you've seen. Facts Status  Ended Network Certification  - Type  Scripted Original Language  English Runtime  240m, 60m Homepage  - Genres Comedy Keywords parody music tv program Content Score 56 We're so close, yet so far. Top Contributors 5 Banana 3 Elizabeth Jennings  View Edit History Popularity Trend  Login to edit  URL By  signing up  for an account on TMDb, you can post directly to Twitter and Facebook. You need to be logged in to continue. Click  here  to login or  here  to sign up.    page_wrap opened in html_head  Join the Community The Basics About TMDb Contact Us Support Forums API Blog Get Involved  Contribution Bible 3rd Party Applications Add New Movie Add New TV Show Community Guidelines Leaderboard Forums Twitter Facebook Legal Terms of Use Privacy Policy Login Sign Up"}