{"link": "https://www.themoviedb.org/tv/11479?language=en", "title": "Banyon", "resume": "The adventures of 1930's Los Angeles private eye Miles Banyon.", "rate": 90, "genre": ["Drama"], "cast": ["Robert Forster", "Joan Blondell", "Richard Jaeckel", "Julie Gregg"], "character": ["Miles C. Banyon", "Peggy Revere", "Lt. Pete McNeil", "Abby Graham"], "site_data": "html Apps Forums Leaderboard Contribute API Support Discover Movies TV Shows Movies Popular Top Rated Upcoming Now Playing TV Shows Popular Top Rated On TV Airing Today People Popular People Can't find a movie or TV show? Login to create it. en Login Sign Up  ID: 11479   Expand Banyon   (1972) User Score Overview The adventures of 1930's Los Angeles private eye Miles Banyon. Discussions   Reviews Videos   Images   Changes Report Share Discussions General  0 Content Issues  0 Images Backdrops  1 Posters  2 Videos Trailers  0 Teasers  0 Clips  0 Featurettes  0 Opening Credits  0 Top Billed Cast Robert Forster Miles C. Banyon Joan Blondell Peggy Revere Richard Jaeckel Lt. Pete McNeil Julie Gregg Abby Graham Full Cast & Crew Last Season Season 1 1972 | 15 Episodes Season 1 of Banyon premiered on September 15, 1972. View All Seasons Social Reviews  0 Discussions  0 Media Most Popular Videos  0 Backdrops  1 Posters  2 Recommendations We don't have enough data to suggest any TV shows based on Banyon. You can help by rating TV shows you've seen. Facts Status  Ended Network Certification  - Type  Scripted Original Language  English Runtime  45m, 60m Homepage  - Genres Drama Keywords private investigator los angeles period drama 1930s Content Score 86 Almost there... Top Contributors 11 Elizabeth Jennings 6 Banana 1 lamontcranston1937  View Edit History Popularity Trend  Login to edit  URL By  signing up  for an account on TMDb, you can post directly to Twitter and Facebook. You need to be logged in to continue. Click  here  to login or  here  to sign up.    page_wrap opened in html_head  Join the Community The Basics About TMDb Contact Us Support Forums API Blog Get Involved  Contribution Bible 3rd Party Applications Add New Movie Add New TV Show Community Guidelines Leaderboard Forums Twitter Facebook Legal Terms of Use Privacy Policy Login Sign Up"}