{"link": "https://www.themoviedb.org/tv/61609?language=en", "title": "From There to Here", "resume": "From There To Here is set in the aftermath of the 1996 Arndale bombing and follows Daniel Cotton, a Manchester family man who is torn between the life he wants and the life he could have.", "rate": null, "genre": ["Drama"], "cast": ["Philip Glenister", "Steven Mackintosh", "Saskia Reeves", "Bernard Hill", "Morven Christie"], "site_data": "html Apps Forums Leaderboard Contribute API Support Discover Movies TV Shows Movies Popular Top Rated Upcoming Now Playing TV Shows Popular Top Rated On TV Airing Today People Popular People Can't find a movie or TV show? Login to create it. en Login Sign Up  ID: 61609   Expand From There to Here   (2014) User Score Overview From There To Here is set in the aftermath of the 1996 Arndale bombing and follows Daniel Cotton, a Manchester family man who is torn between the life he wants and the life he could have. Featured Crew Peter Bowker Creator Discussions   Reviews Videos   Images   Changes Report Share Discussions General  0 Content Issues  1 Images Backdrops  4 Posters  2 Videos Trailers  0 Teasers  0 Clips  0 Featurettes  0 Opening Credits  0 Top Billed Cast Philip Glenister Daniel Steven Mackintosh Robbo Saskia Reeves Claire Bernard Hill Samuel Morven Christie Louise Full Cast & Crew Last Season Season 1 2014 | 3 Episodes Season 1 of From There to Here premiered on May 22, 2014. View All Seasons Social Reviews  0 Discussions  1 Subject Status Replies Last Reply There are no discussions for From There to Here. Login to be first! Go to Discussions Media Most Popular Videos  0 Backdrops  4 Posters  2 Recommendations We don't have enough data to suggest any TV shows based on From There to Here. You can help by rating TV shows you've seen. Facts Status  Ended Network Certification  - Type  Miniseries Original Language  English Runtime  60m Homepage   http://www.bbc.co.uk/programmes/p01y475m Genres Drama Keywords miniseries bombing manchester 1990s Content Score 93 Almost there... Top Contributors TB 25 TMDb Bot 19 Steve 18 Elizabeth Jennings 3 Banana  View Edit History Popularity Trend  Login to edit  URL By  signing up  for an account on TMDb, you can post directly to Twitter and Facebook. You need to be logged in to continue. Click  here  to login or  here  to sign up.    page_wrap opened in html_head  Join the Community The Basics About TMDb Contact Us Support Forums API Blog Get Involved  Contribution Bible 3rd Party Applications Add New Movie Add New TV Show Community Guidelines Leaderboard Forums Twitter Facebook Legal Terms of Use Privacy Policy Login Sign Up", "character": ["Daniel", "Robbo", "Claire", "Samuel", "Louise"]}