{"link": "https://www.themoviedb.org/tv/72793?language=en", "title": "Inside the Factory", "resume": "Gregg Wallace and Cherry Healey get exclusive access to some of the largest factories in Britain to reveal the secrets behind production on an epic scale.", "rate": 0, "genre": ["Documentary"], "cast": ["Cherry Healey", "Gregg Wallace", "Ruth Goodman"], "character": ["Presenter", "Presenter", "Presenter"], "site_data": "html Apps Forums Leaderboard Contribute API Support Discover Movies TV Shows Movies Popular Top Rated Upcoming Now Playing TV Shows Popular Top Rated On TV Airing Today People Popular People Can't find a movie or TV show? Login to create it. en Login Sign Up  ID: 72793   Expand Inside the Factory   (2015) User Score Overview Gregg Wallace and Cherry Healey get exclusive access to some of the largest factories in Britain to reveal the secrets behind production on an epic scale. Discussions   Reviews Videos   Images   Changes Report Share Discussions General  0 Content Issues  0 Images Backdrops  0 Posters  1 Videos Trailers  0 Teasers  0 Clips  0 Featurettes  0 Opening Credits  0 Top Billed Cast Cherry Healey Presenter Gregg Wallace Presenter Ruth Goodman Presenter Full Cast & Crew Last Season Series 3 2017 | 6 Episodes View All Seasons Social Reviews  0 Discussions  0 Media Most Popular Videos  0 Backdrops  0 Posters  1 Recommendations We don't have enough data to suggest any TV shows based on Inside the Factory. You can help by rating TV shows you've seen. Facts Status  Returning Series Network Certification  - Type  Documentary Original Language  English Runtime  55m Homepage   http://www.bbc.co.uk/programmes/b07mddqk Genres Documentary Keywords factory supermarket food production Content Score 43 There's no 'I' in team... Top Contributors A 35 Alexlfm 11 Ash D 2 Daniel  View Edit History Popularity Trend  Login to edit  URL By  signing up  for an account on TMDb, you can post directly to Twitter and Facebook. You need to be logged in to continue. Click  here  to login or  here  to sign up.    page_wrap opened in html_head  Join the Community The Basics About TMDb Contact Us Support Forums API Blog Get Involved  Contribution Bible 3rd Party Applications Add New Movie Add New TV Show Community Guidelines Leaderboard Forums Twitter Facebook Legal Terms of Use Privacy Policy Login Sign Up"}