{"link": "https://www.themoviedb.org/tv/68773?language=en", "title": "Wingman", "resume": "We don't have an overview translated in English. Help us expand our database by adding one.", "rate": 0, "genre": ["Comedy"], "cast": ["Kari Ketonen", "Antti Luusuaniemi"], "character": ["Juhis", "Tommi"], "site_data": "html Apps Forums Leaderboard Contribute API Support Discover Movies TV Shows Movies Popular Top Rated Upcoming Now Playing TV Shows Popular Top Rated On TV Airing Today People Popular People Can't find a movie or TV show? Login to create it. en Login Sign Up  ID: 68773   Expand Wingman   (2016) User Score Overview We don't have an overview translated in English. Help us expand our database by adding one. Featured Crew Lauri Nurkse Creator Discussions   Reviews Videos   Images   Changes Report Share Discussions General  0 Content Issues  0 Images Backdrops  1 Posters  1 Videos Trailers  0 Teasers  0 Clips  0 Featurettes  0 Opening Credits  0 Top Billed Cast Kari Ketonen Juhis Antti Luusuaniemi Tommi Full Cast & Crew Last Season Season 1 2016 | 8 Episodes Season 1 of Wingman premiered on November 11, 2016. View All Seasons Social Reviews  0 Discussions  0 Media Most Popular Videos  0 Backdrops  1 Posters  1 Recommendations We don't have enough data to suggest any TV shows based on Wingman. You can help by rating TV shows you've seen. Facts Original Name  Luottomies Status  Returning Series Network Certification  - Type  Scripted Original Language  Finnish Runtime  10m Homepage  - Genres Comedy Keywords No keywords have been added. Content Score 56 We're so close, yet so far. Top Contributors 28 Petja Touru 3 lineker 2 BryGur Z 1 ZaZam  View Edit History Popularity Trend  Login to edit  URL By  signing up  for an account on TMDb, you can post directly to Twitter and Facebook. You need to be logged in to continue. Click  here  to login or  here  to sign up.    page_wrap opened in html_head  Join the Community The Basics About TMDb Contact Us Support Forums API Blog Get Involved  Contribution Bible 3rd Party Applications Add New Movie Add New TV Show Community Guidelines Leaderboard Forums Twitter Facebook Legal Terms of Use Privacy Policy Login Sign Up"}