{"link": "https://www.themoviedb.org/tv/68671?language=en", "title": "Touching You", "resume": "A man who can see the future and an aspiring makeup artist meet under unique circumstances and start to fall in love.", "rate": 87, "genre": ["Comedy", "Drama"], "cast": ["Ok Taec-yeon", "Song Ha-yoon", "Park Joo-Hyung", "Kim Jong-Moon", "Im Yoon-Jeong"], "character": ["Do Jin Woo", "Jin Hee Young", "Oh Young Dal", "Kang Hyun Seo", "Kwon Mi Sook"], "site_data": "html Apps Forums Leaderboard Contribute API Support Discover Movies TV Shows Movies Popular Top Rated Upcoming Now Playing TV Shows Popular Top Rated On TV Airing Today People Popular People Can't find a movie or TV show? Login to create it. en Login Sign Up  ID: 68671   Expand Touching You   (2016) User Score Overview A man who can see the future and an aspiring makeup artist meet under unique circumstances and start to fall in love. Discussions   Reviews Videos   Images   Changes Report Share Discussions General  0 Content Issues  0 Images Backdrops  0 Posters  1 Videos Trailers  0 Teasers  0 Clips  0 Featurettes  0 Opening Credits  0 Top Billed Cast Ok Taec-yeon Do Jin Woo Song Ha-yoon Jin Hee Young Park Joo-Hyung Oh Young Dal Kim Jong-Moon Kang Hyun Seo Im Yoon-Jeong Kwon Mi Sook Full Cast & Crew Last Season Season 1 2016 | 12 Episodes Season 1 of Touching You premiered on July  4, 2016. View All Seasons Social Reviews  0 Discussions  0 Media Most Popular Videos  0 Backdrops  0 Posters  1 Recommendations We don't have enough data to suggest any TV shows based on Touching You. You can help by rating TV shows you've seen. Facts Original Name  \ub110 \ub9cc\uc9c8\uac70\uc57c Status  Ended Network Certification  - Type  Scripted Original Language  Korean Runtime  15m Homepage  - Genres Comedy Drama Keywords romance korea Content Score 71 Just a little bit more... Top Contributors n 33 nubie M 8 Maria180493 O 5 OperationTonnerre 4 Elizabeth Jennings  View Edit History Popularity Trend  Login to edit  URL By  signing up  for an account on TMDb, you can post directly to Twitter and Facebook. You need to be logged in to continue. Click  here  to login or  here  to sign up.    page_wrap opened in html_head  Join the Community The Basics About TMDb Contact Us Support Forums API Blog Get Involved  Contribution Bible 3rd Party Applications Add New Movie Add New TV Show Community Guidelines Leaderboard Forums Twitter Facebook Legal Terms of Use Privacy Policy Login Sign Up"}