{"link": "https://www.themoviedb.org/tv/76528?language=en", "title": "\u0130simsizler", "resume": "We don't have an overview translated in English. Help us expand our database by adding one.", "rate": 100, "genre": ["War", "Politics"], "cast": ["U\u011fur G\u00fcne\u015f", "Ats\u0131z Karaduman", "\u00c7a\u011fkan \u00c7ulha", "Mert \u00d6cal", "B\u00fclent Alk\u0131\u015f"], "character": ["Fatih Keskin", "Kor Yakup", "Murat G\u00fcrcan", "Tufan Aslan Kalender", "Hasan Bozk\u0131rl\u0131"], "site_data": "html Apps Forums Leaderboard Contribute API Support Discover Movies TV Shows Movies Popular Top Rated Upcoming Now Playing TV Shows Popular Top Rated On TV Airing Today People Popular People Can't find a movie or TV show? Login to create it. en Login Sign Up  ID: 76528   Expand \u0130simsizler   (2017) User Score Overview We don't have an overview translated in English. Help us expand our database by adding one. Discussions   Reviews Videos   Images   Changes Report Share Discussions General  0 Content Issues  0 Images Backdrops  3 Posters  1 Videos Trailers  0 Teasers  0 Clips  0 Featurettes  0 Opening Credits  0 Top Billed Cast U\u011fur G\u00fcne\u015f Fatih Keskin Ats\u0131z Karaduman Kor Yakup \u00c7a\u011fkan \u00c7ulha Murat G\u00fcrcan Mert \u00d6cal Tufan Aslan Kalender B\u00fclent Alk\u0131\u015f Hasan Bozk\u0131rl\u0131 Full Cast & Crew Last Season Season 1 2017 | 13 Episodes Season 1 of \u0130simsizler premiered on March 28, 2017. View All Seasons Social Reviews  0 Discussions  0 Media Most Popular Videos  0 Backdrops  3 Posters  1 Recommendations We don't have enough data to suggest any TV shows based on \u0130simsizler. You can help by rating TV shows you've seen. Facts Status  Ended Network Certification  - Type  Scripted Original Language  Turkish Runtime  - Homepage  - Genres War & Politics Keywords No keywords have been added. Content Score 79 Pump it up! We're close now. Top Contributors 27 \u0130lkiny 5 movie7s 4 lineker  View Edit History Popularity Trend  Login to edit  URL By  signing up  for an account on TMDb, you can post directly to Twitter and Facebook. You need to be logged in to continue. Click  here  to login or  here  to sign up.    page_wrap opened in html_head  Join the Community The Basics About TMDb Contact Us Support Forums API Blog Get Involved  Contribution Bible 3rd Party Applications Add New Movie Add New TV Show Community Guidelines Leaderboard Forums Twitter Facebook Legal Terms of Use Privacy Policy Login Sign Up"}