{"link": "https://www.themoviedb.org/tv/73707?language=en", "title": "Faits divers", "resume": "We don't have an overview translated in English. Help us expand our database by adding one.", "rate": 0, "genre": ["Crime", "Drama"], "cast": ["Isabelle Blais", "Fabien Cloutier", "\u00c9mile Proulx-Cloutier", "Patrick Hivon", "David Boutin"], "character": ["Constance Forest", "Mike Pratt", "Fr\u00e9d\u00e9rick B\u00e9rub\u00e9", "Sylvain Lauzon", "\u00c9ric 'la bottine' Charbonneau"], "site_data": "html Apps Forums Leaderboard Contribute API Support Discover Movies TV Shows Movies Popular Top Rated Upcoming Now Playing TV Shows Popular Top Rated On TV Airing Today People Popular People Can't find a movie or TV show? Login to create it. en Login Sign Up  ID: 73707   Expand Faits divers   (2017) User Score Overview We don't have an overview translated in English. Help us expand our database by adding one. Discussions   Reviews Videos   Images   Changes Report Share Discussions General  0 Content Issues  0 Images Backdrops  1 Posters  2 Videos Trailers  0 Teasers  0 Clips  0 Featurettes  0 Opening Credits  0 Top Billed Cast Isabelle Blais Constance Forest Fabien Cloutier Mike Pratt \u00c9mile Proulx-Cloutier Fr\u00e9d\u00e9rick B\u00e9rub\u00e9 Patrick Hivon Sylvain Lauzon David Boutin \u00c9ric 'la bottine' Charbonneau Full Cast & Crew Last Season Season 1 2017 | 10 Episodes Season 1 of Faits divers premiered on September 11, 2017. View All Seasons Social Reviews  0 Discussions  0 Media Most Popular Videos  0 Backdrops  1 Posters  2 Recommendations We don't have enough data to suggest any TV shows based on Faits divers. You can help by rating TV shows you've seen. Facts Status  Returning Series Network Certification 14+ Meaning Programming intended for viewers ages 14 and older. May contain strong violence and strong profanity, and depictions of sexual activity as long as they are within the context of a story. Type  Scripted Original Language  French Runtime  60m Homepage   http://ici.radio-canada.ca/tele/faits-divers Genres Crime Drama Keywords quebec murder investigation Content Score 79 Pump it up! We're close now. Top Contributors 80 Banana 8 Guipat 5 Lewis j 4 joethebeef  View Edit History Popularity Trend  Login to edit  URL By  signing up  for an account on TMDb, you can post directly to Twitter and Facebook. You need to be logged in to continue. Click  here  to login or  here  to sign up.    page_wrap opened in html_head  Join the Community The Basics About TMDb Contact Us Support Forums API Blog Get Involved  Contribution Bible 3rd Party Applications Add New Movie Add New TV Show Community Guidelines Leaderboard Forums Twitter Facebook Legal Terms of Use Privacy Policy Login Sign Up"}