{"link": "https://www.themoviedb.org/tv/60610?language=en", "title": "Gortimer Gibbon's Life on Normal Street", "resume": "Life is anything but normal for Gortimer and his two best friends, Ranger and Mel, as they navigate Normal Street - an ordinary suburb that has a hint of something magical just beneath the surface.", "rate": 88, "genre": ["Family"], "cast": ["Drew Justice", "Coco Grayson", "David Bloom", "Chandler Kinney"], "character": ["Ranger Bowen", "Abigail Arroyo", "Stanley Zielinski", "Catherine Dillman"], "site_data": "html Apps Forums Leaderboard Contribute API Support Discover Movies TV Shows Movies Popular Top Rated Upcoming Now Playing TV Shows Popular Top Rated On TV Airing Today People Popular People Can't find a movie or TV show? Login to create it. en Login Sign Up  ID: 60610   Expand Gortimer Gibbon's Life on Normal Street   (2014) User Score Overview Life is anything but normal for Gortimer and his two best friends, Ranger and Mel, as they navigate Normal Street - an ordinary suburb that has a hint of something magical just beneath the surface. Featured Crew David Anaxagoras Creator Discussions   Reviews Videos   Images   Changes Report Share Discussions General  1 Content Issues  0 Images Backdrops  0 Posters  1 Videos Trailers  0 Teasers  0 Clips  0 Featurettes  0 Opening Credits  0 Top Billed Cast Drew Justice Ranger Bowen Coco Grayson Abigail Arroyo David Bloom Stanley Zielinski Chandler Kinney Catherine Dillman Full Cast & Crew Last Season Season 2 2015 | 13 Episodes Season 2 of Gortimer Gibbon's Life on Normal Street premiered on October 30, 2015. View All Seasons Social Reviews  0 Discussions  1 Subject Status Replies Last Reply w Mel: Happy Birthday Ashley Boettcher! Open 0 by wonder2wonder\n      \n     Go to Discussions Media Most Popular Videos  0 Backdrops  0 Posters  1 Recommendations We don't have enough data to suggest any TV shows based on Gortimer Gibbon's Life on Normal Street. You can help by rating TV shows you've seen. Facts Status  Returning Series Networks - Certification TV-Y7 Meaning This program is designed for children age 7 and above. Type  Scripted Original Language  English Runtime  30m Homepage   http://www.amazon.com/Pilot-HD/dp/B00I3MPMPA Genres Family Keywords No keywords have been added. Content Score 79 Pump it up! We're close now. Top Contributors EV 18 Ethan Vantage 10 FredG89 5 Vampire Bai M 4 Menneken  View Edit History Popularity Trend  Login to edit  URL By  signing up  for an account on TMDb, you can post directly to Twitter and Facebook. You need to be logged in to continue. Click  here  to login or  here  to sign up.    page_wrap opened in html_head  Join the Community The Basics About TMDb Contact Us Support Forums API Blog Get Involved  Contribution Bible 3rd Party Applications Add New Movie Add New TV Show Community Guidelines Leaderboard Forums Twitter Facebook Legal Terms of Use Privacy Policy Login Sign Up"}