{"link": "https://www.themoviedb.org/tv/73782?language=en", "title": "Tamer We Shawkeya", "resume": "We don't have an overview translated in English. Help us expand our database by adding one.", "rate": null, "genre": ["Drama", "Family", "Comedy"], "cast": ["Ahmed Al Fishawy", "Mai Kassab", "Ragaa Al-Giddawy", "Nedal Al Shafey", "Engy Wegdan"], "site_data": "html Apps Forums Leaderboard Contribute API Support Discover Movies TV Shows Movies Popular Top Rated Upcoming Now Playing TV Shows Popular Top Rated On TV Airing Today People Popular People Can't find a movie or TV show? Login to create it. en Login Sign Up  ID: 73782   Expand Tamer We Shawkeya   (2007) User Score Overview We don't have an overview translated in English. Help us expand our database by adding one. Featured Crew Amro Samir Atef Creator Mohammed Hammad Creator Discussions   Reviews Videos   Images   Changes Report Share Discussions General  0 Content Issues  0 Images Backdrops  1 Posters  1 Videos Trailers  0 Teasers  0 Clips  0 Featurettes  0 Opening Credits  0 Top Billed Cast Ahmed Al Fishawy \u062a\u0627\u0645\u0631 \u0639\u0628\u062f \u0627\u0644\u0631\u062d\u0645\u0646 \u0627\u0644\u0634\u0639\u0631\u0627\u0648\u064a Mai Kassab \u0634\u0648\u0642\u064a\u0629 \u0645\u0631\u0633\u0649 \u0639\u0648\u064a\u0633 Ragaa Al-Giddawy \u0631\u0642\u064a\u0629 \u062d\u0627\u0641\u0638 Nedal Al Shafey \u0633\u064a\u062f \u0645\u0631\u0633\u0649 \u0639\u0648\u064a\u0633 Engy Wegdan \u062f\u0627\u0644\u064a\u0627 \u0639\u0628\u062f \u0627\u0644\u0631\u062d\u0645\u0646 Full Cast & Crew Last Season Season 2 2008 | 29 Episodes Season 2 of Tamer We Shawkeya premiered on September  1, 2008. View All Seasons Social Reviews  0 Discussions  0 Media Most Popular Videos  0 Backdrops  1 Posters  1 Recommendations We don't have enough data to suggest any TV shows based on Tamer We Shawkeya. You can help by rating TV shows you've seen. Facts Original Name  \u062a\u0627\u0645\u0631 \u0648\u0634\u0648\u0642\u064a\u0629 Status  Ended Networks - Certification  - Type  Scripted Original Language  Arabic Runtime  20m Homepage  - Genres Drama Family Comedy Keywords family sitcom Content Score 93 Almost there... Top Contributors E 47 Ezzedin 19 Elizabeth Jennings TB 1 TMDb Bot  View Edit History Popularity Trend  Login to edit  URL By  signing up  for an account on TMDb, you can post directly to Twitter and Facebook. You need to be logged in to continue. Click  here  to login or  here  to sign up.    page_wrap opened in html_head  Join the Community The Basics About TMDb Contact Us Support Forums API Blog Get Involved  Contribution Bible 3rd Party Applications Add New Movie Add New TV Show Community Guidelines Leaderboard Forums Twitter Facebook Legal Terms of Use Privacy Policy Login Sign Up", "character": ["\u062a\u0627\u0645\u0631 \u0639\u0628\u062f \u0627\u0644\u0631\u062d\u0645\u0646 \u0627\u0644\u0634\u0639\u0631\u0627\u0648\u064a", "\u0634\u0648\u0642\u064a\u0629 \u0645\u0631\u0633\u0649 \u0639\u0648\u064a\u0633", "\u0631\u0642\u064a\u0629 \u062d\u0627\u0641\u0638", "\u0633\u064a\u062f \u0645\u0631\u0633\u0649 \u0639\u0648\u064a\u0633", "\u062f\u0627\u0644\u064a\u0627 \u0639\u0628\u062f \u0627\u0644\u0631\u062d\u0645\u0646"]}