{"link": "https://www.themoviedb.org/tv/28066?language=en", "title": "The Sally Lockhart Mysteries", "resume": "The adventures of Sally Lockhart, a feisty young Victorian heroine.", "rate": 30, "genre": ["Drama", "Mystery"], "cast": ["Matt Smith", "Billie Piper", "Jared Harris", "Hayley Atwell", "J. J. Feild"], "character": ["Jim Taylor", "Sally Lockhart", "Axel Bellmann", "Rosa Garland", "Frederick Garland"], "site_data": "html Apps Forums Leaderboard Contribute API Support Discover Movies TV Shows Movies Popular Top Rated Upcoming Now Playing TV Shows Popular Top Rated On TV Airing Today People Popular People Can't find a movie or TV show? Login to create it. en Login Sign Up  ID: 28066   Expand The Sally Lockhart Mysteries   (2006) User Score Overview The adventures of Sally Lockhart, a feisty young Victorian heroine. Discussions   Reviews Videos   Images   Changes Report Share Discussions General  0 Content Issues  0 Images Backdrops  7 Posters  4 Videos Trailers  0 Teasers  0 Clips  0 Featurettes  0 Opening Credits  0 Top Billed Cast Matt Smith Jim Taylor Billie Piper Sally Lockhart Jared Harris Axel Bellmann Hayley Atwell Rosa Garland J. J. Feild Frederick Garland Full Cast & Crew Last Season Season 1 2006 | 2 Episodes Season 1 of The Sally Lockhart Mysteries premiered on December 27, 2006. View All Seasons Social Reviews  0 Discussions  0 Media Most Popular Videos  0 Backdrops  7 Posters  4 Recommendations We don't have enough data to suggest any TV shows based on The Sally Lockhart Mysteries. You can help by rating TV shows you've seen. Facts Status  Ended Network Certification 12 Meaning Films classified 12A and video works classified 12 contain material that is not generally suitable for children aged under 12. Type  Scripted Original Language  English Runtime  120m Homepage   http://bbc.co.uk/programmes/b03qkcn7 Genres Drama Mystery Keywords based on novel or book victorian england Content Score 86 Almost there... Top Contributors 14 Banana L 7 Lurin  View Edit History Popularity Trend  Login to edit  URL By  signing up  for an account on TMDb, you can post directly to Twitter and Facebook. You need to be logged in to continue. Click  here  to login or  here  to sign up.    page_wrap opened in html_head  Join the Community The Basics About TMDb Contact Us Support Forums API Blog Get Involved  Contribution Bible 3rd Party Applications Add New Movie Add New TV Show Community Guidelines Leaderboard Forums Twitter Facebook Legal Terms of Use Privacy Policy Login Sign Up"}