{"link": "https://www.themoviedb.org/tv/10302?language=en", "title": "Emeril", "resume": "Emeril is a shot-lived American sitcom that aired on NBC in 2001. The series stars chef Emeril Lagasse playing himself as the star of a TV cooking show.", "rate": 0, "genre": ["Comedy"], "cast": ["Carrie Preston", "Sherri Shepherd", "Robert Urich", "Emeril Lagasse", "James Lafferty"], "character": ["B.D. Benson", "Melva LeBlanc", "Jerry McKenney", "Emeril Lagasse"], "site_data": "html Apps Forums Leaderboard Contribute API Support Discover Movies TV Shows Movies Popular Top Rated Upcoming Now Playing TV Shows Popular Top Rated On TV Airing Today People Popular People Can't find a movie or TV show? Login to create it. en Login Sign Up  ID: 10302   Expand Emeril   (2001) User Score Overview Emeril is a shot-lived American sitcom that aired on NBC in 2001. The series stars chef Emeril Lagasse playing himself as the star of a TV cooking show. Discussions   Reviews Videos   Images   Changes Report Share Discussions General  0 Content Issues  0 Images Backdrops  0 Posters  1 Videos Trailers  0 Teasers  0 Clips  0 Featurettes  0 Opening Credits  0 Top Billed Cast Carrie Preston B.D. Benson Sherri Shepherd Melva LeBlanc Robert Urich Jerry McKenney Emeril Lagasse Emeril Lagasse James Lafferty Full Cast & Crew Last Season Season 1 2001 | 10 Episodes Season 1 of Emeril premiered on September 25, 2001. View All Seasons Social Reviews  0 Discussions  0 Media Most Popular Videos  0 Backdrops  0 Posters  1 Recommendations We don't have enough data to suggest any TV shows based on Emeril. You can help by rating TV shows you've seen. Facts Status  Ended Network Certification  - Type  Scripted Original Language  English Runtime  30m Homepage  - Genres Comedy Keywords behind the scenes chef fictional reality show sitcom cooking show Content Score 71 Just a little bit more... Top Contributors 12 Banana  View Edit History Popularity Trend  Login to edit  URL By  signing up  for an account on TMDb, you can post directly to Twitter and Facebook. You need to be logged in to continue. Click  here  to login or  here  to sign up.    page_wrap opened in html_head  Join the Community The Basics About TMDb Contact Us Support Forums API Blog Get Involved  Contribution Bible 3rd Party Applications Add New Movie Add New TV Show Community Guidelines Leaderboard Forums Twitter Facebook Legal Terms of Use Privacy Policy Login Sign Up"}