{"link": "https://www.themoviedb.org/tv/1256?language=en", "title": "Bar Bender", "resume": "Bar Bender is a TVB modern drama series broadcast in April 2006.", "rate": 85, "genre": ["Drama"], "cast": ["Sammul Chan", "Leila Tong", "Louisa So", "Shek Sau", "Anne Heung"], "character": ["Lam Ka-Suen"], "site_data": "html Apps Forums Leaderboard Contribute API Support Discover Movies TV Shows Movies Popular Top Rated Upcoming Now Playing TV Shows Popular Top Rated On TV Airing Today People Popular People Can't find a movie or TV show? Login to create it. en Login Sign Up  ID: 1256   Expand Bar Bender   (2006) User Score Overview Bar Bender is a TVB modern drama series broadcast in April 2006. Discussions   Reviews Videos   Images   Changes Report Share Discussions General  0 Content Issues  0 Images Backdrops  1 Posters  1 Videos Trailers  0 Teasers  0 Clips  0 Featurettes  0 Opening Credits  0 Top Billed Cast Sammul Chan Lam Ka-Suen Leila Tong Louisa So Shek Sau Anne Heung Full Cast & Crew Last Season Season 1 2006 | 20 Episodes Season 1 of Bar Bender premiered on April  3, 2006. View All Seasons Social Reviews  0 Discussions  0 Media Most Popular Videos  0 Backdrops  1 Posters  1 Recommendations We don't have enough data to suggest any TV shows based on Bar Bender. You can help by rating TV shows you've seen. Facts Status  Ended Network Certification  - Type  Scripted Original Language  English Runtime  60m Homepage   http://www.tvcity.tvb.com/drama/bar_bender Genres Drama Keywords No keywords have been added. Content Score 86 Almost there... Top Contributors 1 xukemin  View Edit History Popularity Trend  Login to edit  URL By  signing up  for an account on TMDb, you can post directly to Twitter and Facebook. You need to be logged in to continue. Click  here  to login or  here  to sign up.    page_wrap opened in html_head  Join the Community The Basics About TMDb Contact Us Support Forums API Blog Get Involved  Contribution Bible 3rd Party Applications Add New Movie Add New TV Show Community Guidelines Leaderboard Forums Twitter Facebook Legal Terms of Use Privacy Policy Login Sign Up"}