{"link": "https://www.themoviedb.org/tv/60680?language=en", "title": "Manure and Gillyflowers", "resume": "A story about the life of Maximiliane Irene von Quindt based on a classic novel by Christine Bruckner .", "rate": 0, "genre": ["Drama"], "cast": ["Ulrike Bliefert"], "character": ["Maximiliane Irene von Quindt"], "site_data": "html Apps Forums Leaderboard Contribute API Support Discover Movies TV Shows Movies Popular Top Rated Upcoming Now Playing TV Shows Popular Top Rated On TV Airing Today People Popular People Can't find a movie or TV show? Login to create it. en Login Sign Up  ID: 60680   Expand Manure and Gillyflowers   (1978) User Score Overview A story about the life of Maximiliane Irene von Quindt based on a classic novel by Christine Bruckner . Featured Crew Christine Br\u00fcckner Creator Discussions   Reviews Videos   Images   Changes Report Share Discussions General  0 Content Issues  0 Images Backdrops  2 Posters  1 Videos Trailers  0 Teasers  0 Clips  0 Featurettes  0 Opening Credits  0 Top Billed Cast Ulrike Bliefert Maximiliane Irene von Quindt Full Cast & Crew Last Season Season 2 1980 | 19 Episodes Season 2 of Manure and Gillyflowers premiered on January  4, 1980. View All Seasons Social Reviews  0 Discussions  0 Media Most Popular Videos  0 Backdrops  2 Posters  1 Recommendations We don't have enough data to suggest any TV shows based on Manure and Gillyflowers. You can help by rating TV shows you've seen. Facts Original Name  Jauche und Levkojen Status  Ended Network Certification 12 Meaning The broadcaster must take the decision about the air time by taking in consideration the impact on young children in the timeframe from 6:00am to 8:00pm. Type  Scripted Original Language  German Runtime  45m Homepage  - Genres Drama Keywords world war ii nobility Content Score 64 We're so close, yet so far. Top Contributors S 54 Samara 20 dannyvl L 6 Lemmy_6  View Edit History Popularity Trend  Login to edit  URL By  signing up  for an account on TMDb, you can post directly to Twitter and Facebook. You need to be logged in to continue. Click  here  to login or  here  to sign up.    page_wrap opened in html_head  Join the Community The Basics About TMDb Contact Us Support Forums API Blog Get Involved  Contribution Bible 3rd Party Applications Add New Movie Add New TV Show Community Guidelines Leaderboard Forums Twitter Facebook Legal Terms of Use Privacy Policy Login Sign Up"}