{"link": "https://www.themoviedb.org/tv/53559?language=en", "title": "Pure Gold", "resume": "Pure Gold is a story about a pretty girl, drunk, promiscuous and lazy and always puts gold ahead of her son, but it is in the essence of the man that he can still do good always.", "rate": 80, "genre": ["Soap", "Drama"], "cast": ["Nattawut Skidjai", "Woranuch Bhirompakdee", "Jirayu Tangsrisuk", "Chotiros Kaewpinit", "Wiragarn Seneetunti"], "character": ["Sunt", "Lumyong", "Wanchalerm (at age 20)", "Lamyuan", "Lamduan"], "site_data": "html Apps Forums Leaderboard Contribute API Support Discover Movies TV Shows Movies Popular Top Rated Upcoming Now Playing TV Shows Popular Top Rated On TV Airing Today People Popular People Can't find a movie or TV show? Login to create it. en Login Sign Up  ID: 53559   Expand Pure Gold   (2013) User Score Overview Pure Gold is a story about a pretty girl, drunk, promiscuous and lazy and always puts gold ahead of her son, but it is in the essence of the man that he can still do good always. Featured Crew \u0e42\u0e1a\u0e15\u0e31\u0e4b\u0e19 Creator Discussions   Reviews Videos   Images   Changes Report Share Discussions General  0 Content Issues  0 Images Backdrops  4 Posters  2 Videos Trailers  0 Teasers  0 Clips  0 Featurettes  0 Opening Credits  0 Top Billed Cast Nattawut Skidjai Sunt Woranuch Bhirompakdee Lumyong Jirayu Tangsrisuk Wanchalerm (at age 20) Chotiros Kaewpinit Lamyuan Wiragarn Seneetunti Lamduan Full Cast & Crew Last Season Season 1 2013 | 14 Episodes Season 1 of Pure Gold premiered on October  8, 2013. View All Seasons Social Reviews  0 Discussions  0 Media Most Popular Videos  0 Backdrops  4 Posters  2 Recommendations We don't have enough data to suggest any TV shows based on Pure Gold. You can help by rating TV shows you've seen. Facts Original Name  \u0e17\u0e2d\u0e07\u0e40\u0e19\u0e37\u0e49\u0e2d\u0e40\u0e01\u0e49\u0e32 Status  Ended Network Certification PG Meaning Parental guidance is recommended for young viewers; PG-rated content may air at any time on digital-only channels, otherwise, it should only be broadcast between 8:30 a.m. and 4:00 p.m. and between 7:00 p.m. and 6:00 a.m. on weekdays, and between 10:00 a.m. and 6:00 a.m. on weekends. Type  Scripted Original Language  English Runtime  106m Homepage  - Genres Soap Drama Keywords thai lakorn Content Score 93 Almost there... Top Contributors 43 Crip TB 3 TMDb Bot 2 lung_ek 2 Elizabeth Jennings  View Edit History Popularity Trend  Login to edit  URL By  signing up  for an account on TMDb, you can post directly to Twitter and Facebook. You need to be logged in to continue. Click  here  to login or  here  to sign up.    page_wrap opened in html_head  Join the Community The Basics About TMDb Contact Us Support Forums API Blog Get Involved  Contribution Bible 3rd Party Applications Add New Movie Add New TV Show Community Guidelines Leaderboard Forums Twitter Facebook Legal Terms of Use Privacy Policy Login Sign Up"}