{"link": "https://www.themoviedb.org/tv/26068?language=en", "title": "The Rotters' Club", "resume": "Dick Clement and Ian La Frenais' adaptation of Jonathon Coe's novel follow a group of Birmingham teenagers, and their families, through the 1970s.", "rate": null, "genre": ["Drama"], "cast": ["Geoff Breton", "Kevin Doyle", "Rebecca Front", "Alice O'Connell", "Alice Eve"], "site_data": "html Apps Forums Leaderboard Contribute API Support Discover Movies TV Shows Movies Popular Top Rated Upcoming Now Playing TV Shows Popular Top Rated On TV Airing Today People Popular People Can't find a movie or TV show? Login to create it. en Login Sign Up  ID: 26068   Expand The Rotters' Club   (2005) User Score Overview Dick Clement and Ian La Frenais' adaptation of Jonathon Coe's novel follow a group of Birmingham teenagers, and their families, through the 1970s. Discussions   Reviews Videos   Images   Changes Report Share Discussions General  0 Content Issues  0 Images Backdrops  0 Posters  1 Videos Trailers  0 Teasers  0 Clips  0 Featurettes  0 Opening Credits  0 Top Billed Cast Geoff Breton Ben Trotter Kevin Doyle Colin Trotter Rebecca Front Sheila Trotter Alice O'Connell Lois Trotter Alice Eve Cicely Boyd Full Cast & Crew Last Season Season 1 2005 | 3 Episodes Season 1 of The Rotters' Club premiered on January 26, 2005. View All Seasons Social Reviews  0 Discussions  0 Media Most Popular Videos  0 Backdrops  0 Posters  1 Recommendations We don't have enough data to suggest any TV shows based on The Rotters' Club. You can help by rating TV shows you've seen. Facts Status  Ended Network BBC Certification  - Type  Miniseries Original Language  English Runtime  60m Homepage   http://www.bbc.co.uk/drama/therottersclub/ Genres Drama Keywords based on novel or book 1970s miniseries Content Score 71 Just a little bit more... Top Contributors TB 41 TMDb Bot 15 rudely_murray R 8 Rebecca 1 kcdh  View Edit History Popularity Trend  Login to edit  URL By  signing up  for an account on TMDb, you can post directly to Twitter and Facebook. You need to be logged in to continue. Click  here  to login or  here  to sign up.    page_wrap opened in html_head  Join the Community The Basics About TMDb Contact Us Support Forums API Blog Get Involved  Contribution Bible 3rd Party Applications Add New Movie Add New TV Show Community Guidelines Leaderboard Forums Twitter Facebook Legal Terms of Use Privacy Policy Login Sign Up", "character": ["Ben Trotter", "Colin Trotter", "Sheila Trotter", "Lois Trotter", "Cicely Boyd"]}