{"link": "https://www.themoviedb.org/tv/15141?language=en", "title": "The Nutt House", "resume": "The Nutt House is a short-lived situation comedy that aired on NBC as part of its 1989 Fall lineup.", "rate": null, "genre": ["Comedy"], "cast": ["Harvey Korman", "Cloris Leachman", "Brian McNamara", "Molly Hagan", "Gregory Itzin"], "site_data": "html Apps Forums Leaderboard Contribute API Support Discover Movies TV Shows Movies Popular Top Rated Upcoming Now Playing TV Shows Popular Top Rated On TV Airing Today People Popular People Can't find a movie or TV show? Login to create it. en Login Sign Up  ID: 15141   Expand The Nutt House   (1989) User Score Overview The Nutt House is a short-lived situation comedy that aired on NBC as part of its 1989 Fall lineup. Featured Crew Mel Brooks Creator Alan Spencer Creator Discussions   Reviews Videos   Images   Changes Report Share Discussions General  0 Content Issues  0 Images Backdrops  0 Posters  1 Videos Trailers  0 Teasers  0 Clips  0 Featurettes  0 Opening Credits  0 Top Billed Cast Harvey Korman Cloris Leachman Mrs. Frick Brian McNamara Molly Hagan Gregory Itzin Full Cast & Crew Last Season Season 1 1989 | 6 Episodes Season 1 of The Nutt House premiered on September 20, 1989. View All Seasons Social Reviews  0 Discussions  0 Media Most Popular Videos  0 Backdrops  0 Posters  1 Recommendations We don't have enough data to suggest any TV shows based on The Nutt House. You can help by rating TV shows you've seen. Facts Status  Ended Network Certification  - Type  Scripted Original Language  English Runtime  30m, 22m Homepage  - Genres Comedy Keywords hotel new york satire sitcom Content Score 79 Pump it up! We're close now. Top Contributors 7 Banana  View Edit History Popularity Trend  Login to edit  URL By  signing up  for an account on TMDb, you can post directly to Twitter and Facebook. You need to be logged in to continue. Click  here  to login or  here  to sign up.    page_wrap opened in html_head  Join the Community The Basics About TMDb Contact Us Support Forums API Blog Get Involved  Contribution Bible 3rd Party Applications Add New Movie Add New TV Show Community Guidelines Leaderboard Forums Twitter Facebook Legal Terms of Use Privacy Policy Login Sign Up", "character": ["Mrs. Frick"]}