{"link": "https://www.themoviedb.org/tv/41313?language=en", "title": "The Diary of Anne Frank", "resume": "The Diary of Anne Frank is 1987 BBC televised miniseries. It was based on The Diary of a Young Girl by Anne Frank, and it starred Elizabeth Bell, Janet Amsbury, Katharine Schlesinger and Emrys James.", "rate": 80, "genre": ["Drama"], "cast": ["Steven Mackintosh", "Grant Thatcher", "Elizabeth Bell", "Eva Griffiths", "Harry Fielder"], "character": ["Peter Van Daan", "Peter Wessel", "Edith Hollander-Frank", "Lies"], "site_data": "html Apps Forums Leaderboard Contribute API Support Discover Movies TV Shows Movies Popular Top Rated Upcoming Now Playing TV Shows Popular Top Rated On TV Airing Today People Popular People Can't find a movie or TV show? Login to create it. en Login Sign Up  ID: 41313   Expand The Diary of Anne Frank   (1987) User Score Overview The Diary of Anne Frank is 1987 BBC televised miniseries. It was based on The Diary of a Young Girl by Anne Frank, and it starred Elizabeth Bell, Janet Amsbury, Katharine Schlesinger and Emrys James. Discussions   Reviews Videos   Images   Changes Report Share Discussions General  0 Content Issues  0 Images Backdrops  5 Posters  1 Videos Trailers  0 Teasers  0 Clips  0 Featurettes  0 Opening Credits  0 Top Billed Cast Steven Mackintosh Peter Van Daan Grant Thatcher Peter Wessel Elizabeth Bell Edith Hollander-Frank Eva Griffiths Lies Harry Fielder Full Cast & Crew Last Season Season 1 1987 | 4 Episodes Season 1 of The Diary of Anne Frank premiered on January  4, 1987. View All Seasons Social Reviews  0 Discussions  0 Media Most Popular Videos  0 Backdrops  5 Posters  1 Recommendations We don't have enough data to suggest any TV shows based on The Diary of Anne Frank. You can help by rating TV shows you've seen. Facts Status  Ended Network Certification  - Type  Scripted Original Language  English Runtime  - Homepage  - Genres Drama Keywords No keywords have been added. Content Score 86 Almost there... Top Contributors 41 lineker 11 Farkas Tibor 1 Steve  View Edit History Popularity Trend  Login to edit  URL By  signing up  for an account on TMDb, you can post directly to Twitter and Facebook. You need to be logged in to continue. Click  here  to login or  here  to sign up.    page_wrap opened in html_head  Join the Community The Basics About TMDb Contact Us Support Forums API Blog Get Involved  Contribution Bible 3rd Party Applications Add New Movie Add New TV Show Community Guidelines Leaderboard Forums Twitter Facebook Legal Terms of Use Privacy Policy Login Sign Up"}