{"link": "https://www.themoviedb.org/tv/76525?language=en", "title": "Trakehnerblut Gest\u00fct Hochstetten", "resume": "We don't have an overview translated in English. Help us expand our database by adding one.", "rate": 80, "genre": ["Drama", "Family"], "cast": ["Hage Mariam", "Julia Franz Richter", "Christoph Luser", "Laurence Rupp", "Patricia Aulitzky"], "character": ["Paula Novak", "Alexandra Winkler", "Maximilian Hochstetten", "Leander Hochstetten", "Silvia Hochstetten"], "site_data": "html Apps Forums Leaderboard Contribute API Support Discover Movies TV Shows Movies Popular Top Rated Upcoming Now Playing TV Shows Popular Top Rated On TV Airing Today People Popular People Can't find a movie or TV show? Login to create it. en Login Sign Up  ID: 76525   Expand Trakehnerblut Gest\u00fct Hochstetten   (2017) User Score Overview We don't have an overview translated in English. Help us expand our database by adding one. Discussions   Reviews Videos   Images   Changes Report Share Discussions General  0 Content Issues  0 Images Backdrops  5 Posters  2 Videos Trailers  0 Teasers  0 Clips  0 Featurettes  0 Opening Credits  0 Top Billed Cast Hage Mariam Paula Novak Julia Franz Richter Alexandra Winkler Christoph Luser Maximilian Hochstetten Laurence Rupp Leander Hochstetten Patricia Aulitzky Silvia Hochstetten Full Cast & Crew Current Season Season 1 2017 | 8 Episodes Season 1 of Trakehnerblut Gest\u00fct Hochstetten premiered on November  2, 2017. View All Seasons Social Reviews  0 Discussions  0 Media Most Popular Videos  0 Backdrops  5 Posters  2 Recommendations We don't have enough data to suggest any TV shows based on Trakehnerblut Gest\u00fct Hochstetten. You can help by rating TV shows you've seen. Facts Status  Returning Series Network Certification  - Type  Miniseries Original Language  German Runtime  47m Homepage  - Genres Drama Family Keywords horse Content Score 86 Almost there... Top Contributors L 43 Lemmy_6 s 7 schnittwerk TB 3 TMDb Bot  View Edit History Popularity Trend  Login to edit  URL By  signing up  for an account on TMDb, you can post directly to Twitter and Facebook. You need to be logged in to continue. Click  here  to login or  here  to sign up.    page_wrap opened in html_head  Join the Community The Basics About TMDb Contact Us Support Forums API Blog Get Involved  Contribution Bible 3rd Party Applications Add New Movie Add New TV Show Community Guidelines Leaderboard Forums Twitter Facebook Legal Terms of Use Privacy Policy Login Sign Up"}