{"link": "https://www.themoviedb.org/tv/61820?language=en", "title": "Fishing with John", "resume": "Musician John Lurie knows nothing about fishing, but that doesn't stop him from embarking on fishing in exotic locations with friends.", "rate": 62, "genre": ["Comedy", "Documentary"], "cast": ["John Lurie", "Jim Jarmusch", "Robb Webb", "Dennis Hopper", "Willem Dafoe"], "character": ["Himself", "Himself", "Narrator", "Himself", "Himself"], "site_data": "html Apps Forums Leaderboard Contribute API Support Discover Movies TV Shows Movies Popular Top Rated Upcoming Now Playing TV Shows Popular Top Rated On TV Airing Today People Popular People Can't find a movie or TV show? Login to create it. en Login Sign Up  ID: 61820   Expand Fishing with John   (1991) User Score  Play Trailer Overview Musician John Lurie knows nothing about fishing, but that doesn't stop him from embarking on fishing in exotic locations with friends. Discussions   Reviews Videos   Images   Changes Report Share Discussions General  0 Content Issues  0 Images Backdrops  2 Posters  2 Videos Trailers  1 Teasers  0 Clips  0 Featurettes  0 Opening Credits  0 Top Billed Cast John Lurie Himself Jim Jarmusch Himself Robb Webb Narrator Dennis Hopper Himself Willem Dafoe Himself Full Cast & Crew Last Season Miniseries 1991 | 6 Episodes Season 1 of Fishing with John premiered on November 20, 1991. View All Seasons Social Reviews  0 Discussions  0 Media Most Popular Videos  1 Backdrops  2 Posters  2 Recommendations We don't have enough data to suggest any TV shows based on Fishing with John. You can help by rating TV shows you've seen. Facts Status  Ended Network Certification  - Type  Miniseries Original Language  English Runtime  30m Homepage   https://www.criterion.com/films/580-fishing-with-john Genres Comedy Documentary Keywords sport fishing adventure documentary travel jungle Content Score 93 Almost there... Top Contributors TB 20 TMDb Bot 17 Steve 6 Elizabeth Jennings 5 robt  View Edit History Popularity Trend  Login to edit  URL By  signing up  for an account on TMDb, you can post directly to Twitter and Facebook. You need to be logged in to continue. Click  here  to login or  here  to sign up.    page_wrap opened in html_head  Join the Community The Basics About TMDb Contact Us Support Forums API Blog Get Involved  Contribution Bible 3rd Party Applications Add New Movie Add New TV Show Community Guidelines Leaderboard Forums Twitter Facebook Legal Terms of Use Privacy Policy Login Sign Up"}