{"link": "https://www.themoviedb.org/tv/65485?language=en", "title": "Web Therapy", "resume": "Rebecca Miller, a tired therapist judicious therapies and unnecessary childhood regression decides to launch a revolutionary new method: Express online therapy sessions three minutes.", "rate": 0, "genre": ["Comedy"], "cast": ["Eva Hache", "Blanca Portillo", "Carlos Areces", "Gonzalo de Castro", "Quim Guti\u00e9rrez"], "character": ["Rebeca Miller", "Patricia Navas"], "site_data": "html Apps Forums Leaderboard Contribute API Support Discover Movies TV Shows Movies Popular Top Rated Upcoming Now Playing TV Shows Popular Top Rated On TV Airing Today People Popular People Can't find a movie or TV show? Login to create it. en Login Sign Up  ID: 65485   Expand Web Therapy   (2016) User Score Overview Rebecca Miller, a tired therapist judicious therapies and unnecessary childhood regression decides to launch a revolutionary new method: Express online therapy sessions three minutes. Discussions   Reviews Videos   Images   Changes Report Share Discussions General  0 Content Issues  0 Images Backdrops  2 Posters  1 Videos Trailers  0 Teasers  0 Clips  0 Featurettes  0 Opening Credits  0 Top Billed Cast Eva Hache Rebeca Miller Blanca Portillo Patricia Navas Carlos Areces Gonzalo de Castro Quim Guti\u00e9rrez Full Cast & Crew Last Season Season 1 2016 | 16 Episodes Season 1 of Web Therapy premiered on February  2, 2016. View All Seasons Social Reviews  0 Discussions  0 Media Most Popular Videos  0 Backdrops  2 Posters  1 Recommendations We don't have enough data to suggest any TV shows based on Web Therapy. You can help by rating TV shows you've seen. Facts Status  Returning Series Network Certification  - Type  Scripted Original Language  Spanish; Castilian Runtime  30m Homepage   http://www.plus.es/cero/webtherapy Genres Comedy Keywords therapist therapy mental health professional Content Score 86 Almost there... Top Contributors 28 cucuxenxo 13 stego77 7 Banana 4 Elizabeth Jennings  View Edit History Popularity Trend  Login to edit  URL By  signing up  for an account on TMDb, you can post directly to Twitter and Facebook. You need to be logged in to continue. Click  here  to login or  here  to sign up.    page_wrap opened in html_head  Join the Community The Basics About TMDb Contact Us Support Forums API Blog Get Involved  Contribution Bible 3rd Party Applications Add New Movie Add New TV Show Community Guidelines Leaderboard Forums Twitter Facebook Legal Terms of Use Privacy Policy Login Sign Up"}