{"link": "https://www.themoviedb.org/tv/61977?language=en", "title": "The Jump", "resume": "The Jump is a reality series which follows twelve celebrities as they take on some of the most challenging and dangerous winter sports in an effort to become crowned the series champion.", "rate": 0, "genre": ["Reality"], "cast": ["Davina McCall", "Alex Brooker"], "character": ["Herself - Presenter", "Himself - Presenter"], "site_data": "html Apps Forums Leaderboard Contribute API Support Discover Movies TV Shows Movies Popular Top Rated Upcoming Now Playing TV Shows Popular Top Rated On TV Airing Today People Popular People Can't find a movie or TV show? Login to create it. en Login Sign Up  ID: 61977   Expand The Jump   (2014) User Score Overview The Jump is a reality series which follows twelve celebrities as they take on some of the most challenging and dangerous winter sports in an effort to become crowned the series champion. Discussions   Reviews Videos   Images   Changes Report Share Discussions General  0 Content Issues  0 Images Backdrops  2 Posters  1 Videos Trailers  0 Teasers  0 Clips  0 Featurettes  0 Opening Credits  0 Top Billed Cast Davina McCall Herself - Presenter Alex Brooker Himself - Presenter Full Cast & Crew Last Season Season 4 2016 | 6 Episodes Season 4 of The Jump premiered on January 31, 2016. View All Seasons Social Reviews  0 Discussions  0 Media Most Popular Videos  0 Backdrops  2 Posters  1 Recommendations We don't have enough data to suggest any TV shows based on The Jump. You can help by rating TV shows you've seen. Facts Status  Returning Series Network Certification  - Type  Reality Original Language  English Runtime  60m Homepage   http://www.channel4.com/programmes/the-jump Genres Reality Keywords snow skiing winter sport Content Score 56 We're so close, yet so far. Top Contributors 20 Elizabeth Jennings b 4 babibu123 3 mayuumaraga 3 Banana  View Edit History Popularity Trend  Login to edit  URL By  signing up  for an account on TMDb, you can post directly to Twitter and Facebook. You need to be logged in to continue. Click  here  to login or  here  to sign up.    page_wrap opened in html_head  Join the Community The Basics About TMDb Contact Us Support Forums API Blog Get Involved  Contribution Bible 3rd Party Applications Add New Movie Add New TV Show Community Guidelines Leaderboard Forums Twitter Facebook Legal Terms of Use Privacy Policy Login Sign Up"}