{"link": "https://www.themoviedb.org/tv/852?language=en", "title": "Michael Palin: Around the World in 80 Days", "resume": "Michael Palin attempts to copy the exploits of fictional character Phileas Fogg, by trying to travel around the world (without flying) in 80 days.", "rate": null, "genre": ["Documentary"], "cast": ["Michael Palin", "Don Bannerman", "Chris Collins", "Basil Pao", "Terry Gilliam"], "site_data": "html Apps Forums Leaderboard Contribute API Support Discover Movies TV Shows Movies Popular Top Rated Upcoming Now Playing TV Shows Popular Top Rated On TV Airing Today People Popular People Can't find a movie or TV show? Login to create it. en Login Sign Up  ID: 852   Expand Michael Palin: Around the World in 80 Days   (1989) User Score Overview Michael Palin attempts to copy the exploits of fictional character Phileas Fogg, by trying to travel around the world (without flying) in 80 days. Discussions   Reviews Videos   Images   Changes Report Share Discussions General  0 Content Issues  0 Images Backdrops  2 Posters  2 Videos Trailers  0 Teasers  0 Clips  0 Featurettes  0 Opening Credits  0 Top Billed Cast Michael Palin Himself Don Bannerman Himself Chris Collins Himself Basil Pao Himself Terry Gilliam Himself Full Cast & Crew Last Season Miniseries 1989 | 7 Episodes Season 1 of Michael Palin: Around the World in 80 Days premiered on October 11, 1989. View All Seasons Social Reviews  0 Discussions  0 Media Most Popular Videos  0 Backdrops  2 Posters  2 Recommendations   1992-10-21 Pole to Pole 8.3    1997-08-31 Full Circle with Michael Palin 7.3    2004-10-03 Himalaya with Michael Palin 7.9    2002-10-13 Sahara with Michael Palin 6.9    1982-09-20 Smiley's People 7.9    2001-07-09 The Office 8.1    2000-10-15 Curb Your Enthusiasm 8.1    2002-10-20 Top Gear 7.5  Facts Status  Ended Network Certification 0 Meaning Can be aired at any time. Type  Miniseries Original Language  English Runtime  50m Homepage  - Genres Documentary Keywords miniseries travelogue Content Score 86 Almost there... Top Contributors 18 Michael R 11 Rebecca j 3 johnnybravoo s 3 speedycars  View Edit History Popularity Trend  Login to edit  URL By  signing up  for an account on TMDb, you can post directly to Twitter and Facebook. You need to be logged in to continue. Click  here  to login or  here  to sign up.    page_wrap opened in html_head  Join the Community The Basics About TMDb Contact Us Support Forums API Blog Get Involved  Contribution Bible 3rd Party Applications Add New Movie Add New TV Show Community Guidelines Leaderboard Forums Twitter Facebook Legal Terms of Use Privacy Policy Login Sign Up", "character": ["Himself", "Himself", "Himself", "Himself", "Himself"]}