{"link": "https://www.themoviedb.org/tv/15795?language=en", "title": "Wyrd Sisters", "resume": "Animated television adaptation of the book of the same name by Terry Pratchett.", "rate": 62, "genre": ["Animation", "Sci-Fi", "Fantasy", "Comedy", "Action", "Adventure"], "cast": ["Eleanor Bron", "June Whitfield", "Jane Horrocks", "Annette Crosbie", "Les Dennis"], "character": ["Nanny Ogg", "Magrat", "Granny Weatherwax"], "site_data": "html Apps Forums Leaderboard Contribute API Support Discover Movies TV Shows Movies Popular Top Rated Upcoming Now Playing TV Shows Popular Top Rated On TV Airing Today People Popular People Can't find a movie or TV show? Login to create it. en Login Sign Up  ID: 15795   Expand Wyrd Sisters   (1997) User Score  Play Trailer Overview Animated television adaptation of the book of the same name by Terry Pratchett. Featured Crew Terry Pratchett Creator Discussions   Reviews Videos   Images   Changes Report Share Discussions General  0 Content Issues  0 Images Backdrops  5 Posters  6 Videos Trailers  1 Teasers  0 Clips  0 Featurettes  0 Opening Credits  0 Top Billed Cast Eleanor Bron June Whitfield Nanny Ogg Jane Horrocks Magrat Annette Crosbie Granny Weatherwax Les Dennis Full Cast & Crew Last Season Season 1 1997 | 6 Episodes Season 1 of Wyrd Sisters premiered on May 18, 1997. View All Seasons Social Reviews  0 Discussions  0 Media Most Popular Videos  1 Backdrops  5 Posters  6 Recommendations   1990-09-15 Bill & Ted's Excellent Adventures 5.5    1987-01-25 Miss Marple: At Bertram's Hotel 6.7    2009-06-14 Alan Carr: Chatty Man 5.0    2008-03-23 The Colour of Magic 6.5    2012-03-05 Dirk Gently 8.1    2003-09-26 Joan of Arcadia 6.6    1995-09-09 Freakazoid! 7.3  Facts Status  Ended Network Certification  - Type  Miniseries Original Language  English Runtime  140m Homepage  - Genres Animation Sci-Fi & Fantasy Comedy Action & Adventure Keywords witch based on novel or book fantasy world discworld Content Score 100 Yes! Looking good! Top Contributors TB 21 TMDb Bot 14 Banana z 10 zurman1 5 bgta  View Edit History Popularity Trend  Login to edit  URL By  signing up  for an account on TMDb, you can post directly to Twitter and Facebook. You need to be logged in to continue. Click  here  to login or  here  to sign up.    page_wrap opened in html_head  Join the Community The Basics About TMDb Contact Us Support Forums API Blog Get Involved  Contribution Bible 3rd Party Applications Add New Movie Add New TV Show Community Guidelines Leaderboard Forums Twitter Facebook Legal Terms of Use Privacy Policy Login Sign Up"}