{"link": "https://www.themoviedb.org/tv/62501?language=en", "title": "\u00c1ngel o demonio", "resume": "We don't have an overview translated in English. Help us expand our database by adding one.", "rate": 88, "genre": ["Drama"], "cast": ["Aura Garrido", "Jaime Ol\u00edas", "Manu Fullola", "Carla Nieto", "Mar Saura"], "character": ["Valeria", "Dami\u00e1n", "Nathael", "Iris", "Alexia"], "site_data": "html Apps Forums Leaderboard Contribute API Support Discover Movies TV Shows Movies Popular Top Rated Upcoming Now Playing TV Shows Popular Top Rated On TV Airing Today People Popular People Can't find a movie or TV show? Login to create it. en Login Sign Up  ID: 62501   Expand \u00c1ngel o demonio   (2011) User Score Overview We don't have an overview translated in English. Help us expand our database by adding one. Discussions   Reviews Videos   Images   Changes Report Share Discussions General  0 Content Issues  0 Images Backdrops  2 Posters  2 Videos Trailers  0 Teasers  0 Clips  0 Featurettes  0 Opening Credits  0 Top Billed Cast Aura Garrido Valeria Jaime Ol\u00edas Dami\u00e1n Manu Fullola Nathael Carla Nieto Iris Mar Saura Alexia Full Cast & Crew Last Season Season 2 2011 | 9 Episodes Season 2 of \u00c1ngel o demonio premiered on May 17, 2011. View All Seasons Social Reviews  0 Discussions  0 Media Most Popular Videos  0 Backdrops  2 Posters  2 Recommendations We don't have enough data to suggest any TV shows based on \u00c1ngel o demonio. You can help by rating TV shows you've seen. Facts Status  Ended Network Certification  - Type  Scripted Original Language  Spanish; Castilian Runtime  90m Homepage   http://www.telecinco.es/angelodemonio/ Genres Drama Keywords angel hell heaven devil evil impossible love Content Score 79 Pump it up! We're close now. Top Contributors 38 prm96 z 5 zurman1 CM 5 Cherche Moi w 3 webmaster  View Edit History Popularity Trend  Login to edit  URL By  signing up  for an account on TMDb, you can post directly to Twitter and Facebook. You need to be logged in to continue. Click  here  to login or  here  to sign up.    page_wrap opened in html_head  Join the Community The Basics About TMDb Contact Us Support Forums API Blog Get Involved  Contribution Bible 3rd Party Applications Add New Movie Add New TV Show Community Guidelines Leaderboard Forums Twitter Facebook Legal Terms of Use Privacy Policy Login Sign Up"}