{"link": "https://www.themoviedb.org/tv/69431?language=en", "title": "Flukt", "resume": "Leo Ajkic visits Lebanon, Greece and other places along the refugee route to Europe.", "rate": 0, "genre": ["Documentary"], "cast": ["Leo Ajkic"], "character": ["Himself"], "site_data": "html Apps Forums Leaderboard Contribute API Support Discover Movies TV Shows Movies Popular Top Rated Upcoming Now Playing TV Shows Popular Top Rated On TV Airing Today People Popular People Can't find a movie or TV show? Login to create it. en Login Sign Up  ID: 69431   Expand Flukt   (2017) User Score Overview Leo Ajkic visits Lebanon, Greece and other places along the refugee route to Europe. Discussions   Reviews Videos   Images   Changes Report Share Discussions General  0 Content Issues  0 Images Backdrops  4 Posters  1 Videos Trailers  0 Teasers  0 Clips  0 Featurettes  0 Opening Credits  0 Top Billed Cast Leo Ajkic Himself Full Cast & Crew Last Season Season 1 2017 | 5 Episodes Season 1 of Flukt premiered on January  3, 2017. View All Seasons Social Reviews  0 Discussions  0 Media Most Popular Videos  0 Backdrops  4 Posters  1 Recommendations We don't have enough data to suggest any TV shows based on Flukt. You can help by rating TV shows you've seen. Facts Status  Returning Series Network Certification  - Type  Documentary Original Language  Norwegian Runtime  40m Homepage   https://tv.nrk.no/serie/flukt Genres Documentary Keywords No keywords have been added. Content Score 56 We're so close, yet so far. Top Contributors 24 Bendik 4 Eline TV  View Edit History Popularity Trend  Login to edit  URL By  signing up  for an account on TMDb, you can post directly to Twitter and Facebook. You need to be logged in to continue. Click  here  to login or  here  to sign up.    page_wrap opened in html_head  Join the Community The Basics About TMDb Contact Us Support Forums API Blog Get Involved  Contribution Bible 3rd Party Applications Add New Movie Add New TV Show Community Guidelines Leaderboard Forums Twitter Facebook Legal Terms of Use Privacy Policy Login Sign Up"}