{"link": "https://www.themoviedb.org/tv/69755?language=en", "title": "Embeds", "resume": "Five recent college graduates take on media roles in time to follow the presidential campaign.", "rate": null, "genre": ["Comedy"], "cast": ["Allen D. Edge", "Caleb Harris", "Kelsey Asbille", "Chloe Brooks", "Max Ehrich"], "site_data": "html Apps Forums Leaderboard Contribute API Support Discover Movies TV Shows Movies Popular Top Rated Upcoming Now Playing TV Shows Popular Top Rated On TV Airing Today People Popular People Can't find a movie or TV show? Login to create it. en Login Sign Up  ID: 69755   Expand Embeds   (2017) User Score  Play Trailer Overview Five recent college graduates take on media roles in time to follow the presidential campaign. Discussions   Reviews Videos   Images   Changes Report Share Discussions General  0 Content Issues  0 Images Backdrops  3 Posters  1 Videos Trailers  1 Teasers  0 Clips  0 Featurettes  0 Opening Credits  0 Top Billed Cast Allen D. Edge Jay Caleb Harris Miles Dvorak Kelsey Asbille Marissa Chloe Brooks Syd Max Ehrich Quinn Harris Full Cast & Crew Last Season Season 1 2017 | 5 Episodes Season 1 of Embeds premiered on January 10, 2017. View All Seasons Social Reviews  0 Discussions  0 Media Most Popular Videos  1 Backdrops  3 Posters  1 Recommendations We don't have enough data to suggest any TV shows based on Embeds. You can help by rating TV shows you've seen. Facts Status  Returning Series Network Certification  - Type  Scripted Original Language  English Runtime  21m Homepage   https://www.go90.com/content/sub/PUB8e8b3db00bd8b000000001599526d0ab Genres Comedy Keywords No keywords have been added. Content Score 93 Almost there... Top Contributors 13 Elizabeth Jennings t 10 tmdb80496521 g 4 goinsdanielg TB 1 TMDb Bot  View Edit History Popularity Trend  Login to edit  URL By  signing up  for an account on TMDb, you can post directly to Twitter and Facebook. You need to be logged in to continue. Click  here  to login or  here  to sign up.    page_wrap opened in html_head  Join the Community The Basics About TMDb Contact Us Support Forums API Blog Get Involved  Contribution Bible 3rd Party Applications Add New Movie Add New TV Show Community Guidelines Leaderboard Forums Twitter Facebook Legal Terms of Use Privacy Policy Login Sign Up", "character": ["Jay", "Miles Dvorak", "Marissa", "Syd", "Quinn Harris"]}