{"link": "https://www.themoviedb.org/tv/34738?language=en", "title": "Amatsuki", "resume": "Amatsuki is an ongoing manga series by Shinobu Takayama, serialized in Monthly Comic Zero Sum. A 13 episode anime adaptation produced by Studio Deen premiered on April 4, 2008.", "rate": null, "genre": ["Sci-Fi", "Fantasy", "Animation"], "cast": ["Kenji Nojima", "Kenichi Suzumura", "Romi Park", "Jun Fukuyama", "Yuki Matsuoka"], "site_data": "html Apps Forums Leaderboard Contribute API Support Discover Movies TV Shows Movies Popular Top Rated Upcoming Now Playing TV Shows Popular Top Rated On TV Airing Today People Popular People Can't find a movie or TV show? Login to create it. en Login Sign Up  ID: 34738   Expand Amatsuki   (2008) User Score Overview Amatsuki is an ongoing manga series by Shinobu Takayama, serialized in Monthly Comic Zero Sum. A 13 episode anime adaptation produced by Studio Deen premiered on April 4, 2008. Featured Crew Shinobu Takayama Creator Discussions   Reviews Videos   Images   Changes Report Share Discussions General  0 Content Issues  0 Images Backdrops  2 Posters  1 Videos Trailers  0 Teasers  0 Clips  0 Featurettes  0 Opening Credits  0 Top Billed Cast Kenji Nojima Heihachi Kenichi Suzumura Ginshu Romi Park Kuchiha Jun Fukuyama Tokidoki Rikugou Yuki Matsuoka Shinshu Full Cast & Crew Last Season Season 1 2008 | 13 Episodes Season 1 of Amatsuki premiered on April  4, 2008. View All Seasons Social Reviews  0 Discussions  0 Media Most Popular Videos  0 Backdrops  2 Posters  1 Recommendations We don't have enough data to suggest any TV shows based on Amatsuki. You can help by rating TV shows you've seen. Facts Status  Ended Network Certification  - Type  Scripted Original Language  English Runtime  30m Homepage  - Genres Sci-Fi & Fantasy Animation Keywords No keywords have been added. Content Score 93 Almost there... Top Contributors 5 Oriknox m 3 magoozin 2 Sergiojamon  View Edit History Popularity Trend  Login to edit  URL By  signing up  for an account on TMDb, you can post directly to Twitter and Facebook. You need to be logged in to continue. Click  here  to login or  here  to sign up.    page_wrap opened in html_head  Join the Community The Basics About TMDb Contact Us Support Forums API Blog Get Involved  Contribution Bible 3rd Party Applications Add New Movie Add New TV Show Community Guidelines Leaderboard Forums Twitter Facebook Legal Terms of Use Privacy Policy Login Sign Up", "character": ["Heihachi", "Ginshu", "Kuchiha", "Tokidoki Rikugou", "Shinshu"]}