{"link": "https://www.themoviedb.org/tv/73552?language=en", "title": "Heathers", "resume": "A pitch-black comedy anthology set in the present day, as our heroine Veronica Sawyer deals with a very different but equally vicious group of Heathers. Based on the 1988 cult classic film.", "rate": 0, "genre": ["Comedy"], "cast": ["Melanie Field", "Brendan Scannell", "Grace Victoria Cox", "Jasmine Matthews", "James Scully"], "character": ["Heather Chandler", "Heather Duke", "Veronica Sawyer", "Heather McNamara", "J.D. Dean"], "site_data": "html Apps Forums Leaderboard Contribute API Support Discover Movies TV Shows Movies Popular Top Rated Upcoming Now Playing TV Shows Popular Top Rated On TV Airing Today People Popular People Can't find a movie or TV show? Login to create it. en Login Sign Up  ID: 73552   Expand Heathers   (2018) User Score Overview A pitch-black comedy anthology set in the present day, as our heroine Veronica Sawyer deals with a very different but equally vicious group of Heathers. Based on the 1988 cult classic film. Featured Crew Jason A. Micallef Creator Discussions   Reviews Videos   Images   Changes Report Share Discussions General  0 Content Issues  0 Images Backdrops  4 Posters  3 Videos Trailers  0 Teasers  0 Clips  0 Featurettes  0 Opening Credits  0 Top Billed Cast Melanie Field Heather Chandler Brendan Scannell Heather Duke Grace Victoria Cox Veronica Sawyer Jasmine Matthews Heather McNamara James Scully J.D. Dean Full Cast & Crew Current Season Season 1 2018 | 6 Episodes Season 1 of Heathers premiered on March  7, 2018. View All Seasons Social Reviews  0 Discussions  0 Media Most Popular Videos  0 Backdrops  4 Posters  3 Recommendations We don't have enough data to suggest any TV shows based on Heathers. You can help by rating TV shows you've seen. Facts Status  Returning Series Network Certification TV-MA Meaning This program is specifically designed to be viewed by adults and therefore may be unsuitable for children under 17 Type  Scripted Original Language  English Runtime  42m Homepage   http://www.paramountnetwork.com/shows/heathers Genres Comedy Keywords dark comedy Content Score 93 Almost there... Top Contributors 45 Elizabeth Jennings s 3 speedycars w 3 webmaster D 3 Destr0y  View Edit History Popularity Trend  Login to edit  URL By  signing up  for an account on TMDb, you can post directly to Twitter and Facebook. You need to be logged in to continue. Click  here  to login or  here  to sign up.    page_wrap opened in html_head  Join the Community The Basics About TMDb Contact Us Support Forums API Blog Get Involved  Contribution Bible 3rd Party Applications Add New Movie Add New TV Show Community Guidelines Leaderboard Forums Twitter Facebook Legal Terms of Use Privacy Policy Login Sign Up"}