{"link": "https://www.themoviedb.org/tv/71761?language=en", "title": "B\u00e4st i test", "resume": "Swedish version of Taskmaster.", "rate": 0, "genre": ["Comedy"], "cast": ["Babben Larsson", "David Sundin", "Erik Ekstrand", "Ellen Bergstr\u00f6m", "Ola Forssmed"], "character": ["Herself - Host", "Himself - Host", "Himself", "Herself", "Himself"], "site_data": "html Apps Forums Leaderboard Contribute API Support Discover Movies TV Shows Movies Popular Top Rated Upcoming Now Playing TV Shows Popular Top Rated On TV Airing Today People Popular People Can't find a movie or TV show? Login to create it. en Login Sign Up  ID: 71761   Expand B\u00e4st i test   (2017) User Score Overview Swedish version of Taskmaster. Discussions   Reviews Videos   Images   Changes Report Share Discussions General  0 Content Issues  0 Images Backdrops  1 Posters  2 Videos Trailers  0 Teasers  0 Clips  0 Featurettes  0 Opening Credits  0 Top Billed Cast Babben Larsson Herself - Host David Sundin Himself - Host Erik Ekstrand Himself Ellen Bergstr\u00f6m Herself Ola Forssmed Himself Full Cast & Crew Current Season Season 2 2018 | 8 Episodes Season 2 of B\u00e4st i test premiered on March  9, 2018. View All Seasons Social Reviews  0 Discussions  0 Media Most Popular Videos  0 Backdrops  1 Posters  2 Recommendations We don't have enough data to suggest any TV shows based on B\u00e4st i test. You can help by rating TV shows you've seen. Facts Status  Returning Series Network Certification  - Type  Reality Original Language  Swedish Runtime  60m Homepage   https://www.svt.se/bast-i-test/ Genres Comedy Keywords game show Content Score 86 Almost there... Top Contributors 34 BagronkeN 16 filiplundh  View Edit History Popularity Trend  Login to edit  URL By  signing up  for an account on TMDb, you can post directly to Twitter and Facebook. You need to be logged in to continue. Click  here  to login or  here  to sign up.    page_wrap opened in html_head  Join the Community The Basics About TMDb Contact Us Support Forums API Blog Get Involved  Contribution Bible 3rd Party Applications Add New Movie Add New TV Show Community Guidelines Leaderboard Forums Twitter Facebook Legal Terms of Use Privacy Policy Login Sign Up"}