{"link": "https://www.themoviedb.org/tv/65020?language=en", "title": "Bel Ami", "resume": "We don't have an overview translated in English. Help us expand our database by adding one.", "rate": 0, "genre": ["Drama"], "cast": ["Corrado Pani", "Martine Brochard", "Rada Rassimov", "Arnoldo Fo\u00e0", "Caterina Boratto"], "character": ["Georges Duroy", "Clotilde de Marelle", "Madeleine Forestier", "Mr. Walter", "Mrs. Walter"], "site_data": "html Apps Forums Leaderboard Contribute API Support Discover Movies TV Shows Movies Popular Top Rated Upcoming Now Playing TV Shows Popular Top Rated On TV Airing Today People Popular People Can't find a movie or TV show? Login to create it. en Login Sign Up  ID: 65020   Expand Bel Ami   (1979) User Score Overview We don't have an overview translated in English. Help us expand our database by adding one. Discussions   Reviews Videos   Images   Changes Report Share Discussions General  0 Content Issues  0 Images Backdrops  0 Posters  2 Videos Trailers  0 Teasers  0 Clips  0 Featurettes  0 Opening Credits  0 Top Billed Cast Corrado Pani Georges Duroy Martine Brochard Clotilde de Marelle Rada Rassimov Madeleine Forestier Arnoldo Fo\u00e0 Mr. Walter Caterina Boratto Mrs. Walter Full Cast & Crew Last Season Season 1 1979 | 4 Episodes Season 1 of Bel Ami premiered on November 23, 1979. View All Seasons Social Reviews  0 Discussions  0 Media Most Popular Videos  0 Backdrops  0 Posters  2 Recommendations We don't have enough data to suggest any TV shows based on Bel Ami. You can help by rating TV shows you've seen. Facts Status  Ended Networks - Certification  - Type  Scripted Original Language  Italian Runtime  - Homepage  - Genres Drama Keywords based on novel or book romance miniseries Content Score 64 We're so close, yet so far. Top Contributors 25 Marr \ud83c\uddf3\ud83c\uddf1 4 Michael  View Edit History Popularity Trend  Login to edit  URL By  signing up  for an account on TMDb, you can post directly to Twitter and Facebook. You need to be logged in to continue. Click  here  to login or  here  to sign up.    page_wrap opened in html_head  Join the Community The Basics About TMDb Contact Us Support Forums API Blog Get Involved  Contribution Bible 3rd Party Applications Add New Movie Add New TV Show Community Guidelines Leaderboard Forums Twitter Facebook Legal Terms of Use Privacy Policy Login Sign Up"}