{"link": "https://www.themoviedb.org/tv/29650?language=en", "title": "Kane & Abel", "resume": "Kane & Abel is a television miniseries, based on the novel of the same name written by Jeffrey Archer, that aired on CBS in 1985. It stars Peter Strauss as Rosnovski and Sam Neill as Kane.", "rate": 80, "genre": ["Drama"], "cast": ["Sam Neill", "David Dukes", "Peter Strauss", "Fred Gwynne", "Ron Silver"], "character": ["William Lowell Kane", "David Osborne", "Abel Rosnovski", "Davis LeRoy", "Thaddeus Cohen"], "site_data": "html Apps Forums Leaderboard Contribute API Support Discover Movies TV Shows Movies Popular Top Rated Upcoming Now Playing TV Shows Popular Top Rated On TV Airing Today People Popular People Can't find a movie or TV show? Login to create it. en Login Sign Up  ID: 29650   Expand Kane & Abel   (1985) User Score Overview Kane & Abel is a television miniseries, based on the novel of the same name written by Jeffrey Archer, that aired on CBS in 1985. It stars Peter Strauss as Rosnovski and Sam Neill as Kane. Discussions   Reviews Videos   Images   Changes Report Share Discussions General  0 Content Issues  0 Images Backdrops  1 Posters  2 Videos Trailers  0 Teasers  0 Clips  0 Featurettes  0 Opening Credits  0 Top Billed Cast Sam Neill William Lowell Kane David Dukes David Osborne Peter Strauss Abel Rosnovski Fred Gwynne Davis LeRoy Ron Silver Thaddeus Cohen Full Cast & Crew Last Season Miniseries 1985 | 3 Episodes Season 1 of Kane & Abel premiered on November 17, 1985. View All Seasons Social Reviews  0 Discussions  0 Media Most Popular Videos  0 Backdrops  1 Posters  2 Recommendations We don't have enough data to suggest any TV shows based on Kane & Abel. You can help by rating TV shows you've seen. Facts Status  Ended Network Certification  - Type  Miniseries Original Language  English Runtime  90m Homepage  - Genres Drama Keywords new york wall street wealthy miniseries Content Score 86 Almost there... Top Contributors TB 28 TMDb Bot 10 Banana R 4 Rebecca j 3 jaht  View Edit History Popularity Trend  Login to edit  URL By  signing up  for an account on TMDb, you can post directly to Twitter and Facebook. You need to be logged in to continue. Click  here  to login or  here  to sign up.    page_wrap opened in html_head  Join the Community The Basics About TMDb Contact Us Support Forums API Blog Get Involved  Contribution Bible 3rd Party Applications Add New Movie Add New TV Show Community Guidelines Leaderboard Forums Twitter Facebook Legal Terms of Use Privacy Policy Login Sign Up"}