{"link": "https://www.themoviedb.org/tv/19255?language=en", "title": "A Woman Named Jackie", "resume": "A Woman Named Jackie is a 1991 American made for television miniseries chronicling the life of Jacqueline Kennedy Onassis. It was based on C. David Heymann's 1989 book of the same title.", "rate": 0, "genre": ["Drama"], "cast": ["Anna Levine", "Josef Sommer", "Ashley Crow", "Nadia Dajani", "Roma Downey"], "character": ["Jacqueline Bouvier"], "site_data": "html Apps Forums Leaderboard Contribute API Support Discover Movies TV Shows Movies Popular Top Rated Upcoming Now Playing TV Shows Popular Top Rated On TV Airing Today People Popular People Can't find a movie or TV show? Login to create it. en Login Sign Up  ID: 19255   Expand A Woman Named Jackie   (1991) User Score Overview A Woman Named Jackie is a 1991 American made for television miniseries chronicling the life of Jacqueline Kennedy Onassis. It was based on C. David Heymann's 1989 book of the same title. Discussions   Reviews Videos   Images   Changes Report Share Discussions General  0 Content Issues  0 Images Backdrops  0 Posters  4 Videos Trailers  0 Teasers  0 Clips  0 Featurettes  0 Opening Credits  0 Top Billed Cast Anna Levine Josef Sommer Ashley Crow Nadia Dajani Roma Downey Jacqueline Bouvier Full Cast & Crew Last Season Season 1 1991 | 3 Episodes Season 1 of A Woman Named Jackie premiered on October 13, 1991. View All Seasons Social Reviews  0 Discussions  0 Media Most Popular Videos  0 Backdrops  0 Posters  4 Recommendations We don't have enough data to suggest any TV shows based on A Woman Named Jackie. You can help by rating TV shows you've seen. Facts Status  Ended Network Certification  - Type  Miniseries Original Language  English Runtime  82m Homepage  - Genres Drama Keywords first lady miniseries kennedy family Content Score 71 Just a little bit more... Top Contributors a 10 asusar 8 Banana TB 7 TMDb Bot R 3 Rebecca  View Edit History Popularity Trend  Login to edit  URL By  signing up  for an account on TMDb, you can post directly to Twitter and Facebook. You need to be logged in to continue. Click  here  to login or  here  to sign up.    page_wrap opened in html_head  Join the Community The Basics About TMDb Contact Us Support Forums API Blog Get Involved  Contribution Bible 3rd Party Applications Add New Movie Add New TV Show Community Guidelines Leaderboard Forums Twitter Facebook Legal Terms of Use Privacy Policy Login Sign Up"}