{"link": "https://www.themoviedb.org/tv/19835?language=en", "title": "Sea Monsters", "resume": "Zoologist Nigel Marvin travels back in time to visit deadly creatures of the prehistoric oceans.", "rate": 70, "genre": ["Documentary"], "cast": ["Nigel Marven"], "character": ["Himself"], "site_data": "html Apps Forums Leaderboard Contribute API Support Discover Movies TV Shows Movies Popular Top Rated Upcoming Now Playing TV Shows Popular Top Rated On TV Airing Today People Popular People Can't find a movie or TV show? Login to create it. en Login Sign Up  ID: 19835   Expand Sea Monsters   (2003) User Score Overview Zoologist Nigel Marvin travels back in time to visit deadly creatures of the prehistoric oceans. Featured Crew Tim Haines Creator Discussions   Reviews Videos   Images   Changes Report Share Discussions General  0 Content Issues  1 Images Backdrops  6 Posters  5 Videos Trailers  0 Teasers  0 Clips  0 Featurettes  0 Opening Credits  0 Top Billed Cast Nigel Marven Himself Full Cast & Crew Last Season Miniseries 2003 | 3 Episodes Season 1 of Sea Monsters premiered on September  9, 2003. View All Seasons Social Reviews  0 Discussions  1 Subject Status Replies Last Reply There are no discussions for Sea Monsters. Login to be first! Go to Discussions Media Most Popular Videos  0 Backdrops  6 Posters  5 Recommendations   2001-11-15 Walking with Beasts 7.7    1993-01-06 The Animals of Farthing Wood 8.7    1999-10-04 Walking with Dinosaurs 8.0    1998-10-21 The Life of Birds 9.3    1986-05-28 Pingu 6.5    1987-06-17 Once Upon a Time... Life 8.0    2001-03-30 The Fairly OddParents 6.7    1960-09-30 The Flintstones 7.0  Facts Status  Ended Network Certification  - Type  Miniseries Original Language  English Runtime  90m Homepage   http://www.bbc.co.uk/programmes/p008c6n4 Genres Documentary Keywords No keywords have been added. Content Score 64 We're so close, yet so far. Top Contributors TB 22 TMDb Bot 7 Banana h 4 hanyny 1 Elizabeth Jennings  View Edit History Popularity Trend  Login to edit  URL By  signing up  for an account on TMDb, you can post directly to Twitter and Facebook. You need to be logged in to continue. Click  here  to login or  here  to sign up.    page_wrap opened in html_head  Join the Community The Basics About TMDb Contact Us Support Forums API Blog Get Involved  Contribution Bible 3rd Party Applications Add New Movie Add New TV Show Community Guidelines Leaderboard Forums Twitter Facebook Legal Terms of Use Privacy Policy Login Sign Up"}