{"link": "https://www.themoviedb.org/tv/80325?language=en", "title": "Crash Course U.S. Government and Politics", "resume": "Craig Benzine speaks on U.S. Government and Politics.", "rate": 0, "genre": ["Documentary"], "cast": ["Craig Benzine"], "character": ["Host"], "site_data": "html Apps Forums Leaderboard Contribute API Support Discover Movies TV Shows Movies Popular Top Rated Upcoming Now Playing TV Shows Popular Top Rated On TV Airing Today People Popular People Can't find a movie or TV show? Login to create it. en Login Sign Up  ID: 80325   Expand Crash Course U.S. Government and Politics   (2015) User Score Overview Craig Benzine speaks on U.S. Government and Politics. Discussions   Reviews Videos   Images   Changes Report Share Discussions General  0 Content Issues  0 Images Backdrops  1 Posters  1 Videos Trailers  0 Teasers  0 Clips  0 Featurettes  0 Opening Credits  0 Top Billed Cast Craig Benzine Host Full Cast & Crew Last Season Season 1 2015 | 0 Episodes Season 1 of Crash Course U.S. Government and Politics premiered on January 23, 2015. View All Seasons Social Reviews  0 Discussions  0 Media Most Popular Videos  0 Backdrops  1 Posters  1 Recommendations We don't have enough data to suggest any TV shows based on Crash Course U.S. Government and Politics. You can help by rating TV shows you've seen. Facts Status  Ended Network Certification  - Type  Scripted Original Language  English Runtime  10m Homepage  - Genres Documentary Keywords government politics united states Content Score 56 We're so close, yet so far. Top Contributors 22 Gabriel W. Almeida  View Edit History Popularity Trend  Login to edit  URL By  signing up  for an account on TMDb, you can post directly to Twitter and Facebook. You need to be logged in to continue. Click  here  to login or  here  to sign up.    page_wrap opened in html_head  Join the Community The Basics About TMDb Contact Us Support Forums API Blog Get Involved  Contribution Bible 3rd Party Applications Add New Movie Add New TV Show Community Guidelines Leaderboard Forums Twitter Facebook Legal Terms of Use Privacy Policy Login Sign Up"}