{"link": "https://www.themoviedb.org/tv/73055?language=en", "title": "Shingeki no Kyojin: Kuinaki Sentaku", "resume": "We don't have an overview translated in English. Help us expand our database by adding one.", "rate": 58, "genre": ["Sci-Fi", "Fantasy"], "cast": ["Koji Yusa", "Hiroshi Kamiya", "Mariya Ise"], "character": ["Farlan Church", "Levi", "Isabel Magnolia"], "site_data": "html Apps Forums Leaderboard Contribute API Support Discover Movies TV Shows Movies Popular Top Rated Upcoming Now Playing TV Shows Popular Top Rated On TV Airing Today People Popular People Can't find a movie or TV show? Login to create it. en Login Sign Up  ID: 73055   Expand Shingeki no Kyojin: Kuinaki Sentaku   (2014) User Score Overview We don't have an overview translated in English. Help us expand our database by adding one. Featured Crew Hajime Isayama Creator Discussions   Reviews Videos   Images   Changes Report Share Discussions General  0 Content Issues  0 Images Backdrops  2 Posters  1 Videos Trailers  0 Teasers  0 Clips  0 Featurettes  0 Opening Credits  0 Top Billed Cast Koji Yusa Farlan Church Hiroshi Kamiya Levi Mariya Ise Isabel Magnolia Full Cast & Crew Last Season Season 1 2014 | 2 Episodes Season 1 of Shingeki no Kyojin: Kuinaki Sentaku premiered on December  9, 2014. View All Seasons Social Reviews  0 Discussions  0 Media Most Popular Videos  0 Backdrops  2 Posters  1 Recommendations We don't have enough data to suggest any TV shows based on Shingeki no Kyojin: Kuinaki Sentaku. You can help by rating TV shows you've seen. Facts Status  Ended Networks - Certification 16 Meaning Content suitable for viewers over the age of 16. Type  Scripted Original Language  Japanese Runtime  27m Homepage   http://shingeki.tv Genres Sci-Fi & Fantasy Keywords monster anime Content Score 64 We're so close, yet so far. Top Contributors 28 1gordingoxtozo S 6 SolarMaster TB 5 TMDb Bot t 5 tmdb46417706  View Edit History Popularity Trend  Login to edit  URL By  signing up  for an account on TMDb, you can post directly to Twitter and Facebook. You need to be logged in to continue. Click  here  to login or  here  to sign up.    page_wrap opened in html_head  Join the Community The Basics About TMDb Contact Us Support Forums API Blog Get Involved  Contribution Bible 3rd Party Applications Add New Movie Add New TV Show Community Guidelines Leaderboard Forums Twitter Facebook Legal Terms of Use Privacy Policy Login Sign Up"}