{"link": "https://www.themoviedb.org/tv/56045?language=en", "title": "Continuum", "resume": "A beautiful young woman awakens aboard an adrift space ship with no memory of who she is or how she got there and at the mercy of the ship's mysterious computer.", "rate": 67, "genre": ["Science", "Fiction"], "cast": ["Taryn O'Neill", "Melanie Merkosky", "Brad Hawkins"], "character": ["Computer (voice)", "Raegen", "Tipton"], "site_data": "html Apps Forums Leaderboard Contribute API Support Discover Movies TV Shows Movies Popular Top Rated Upcoming Now Playing TV Shows Popular Top Rated On TV Airing Today People Popular People Can't find a movie or TV show? Login to create it. en Login Sign Up  ID: 56045   Expand Continuum   (2012) User Score Overview A beautiful young woman awakens aboard an adrift space ship with no memory of who she is or how she got there and at the mercy of the ship's mysterious computer. Featured Crew Blake Calhoun Creator Discussions   Reviews Videos   Images   Changes Report Share Discussions General  0 Content Issues  2 Images Backdrops  1 Posters  1 Videos Trailers  0 Teasers  0 Clips  0 Featurettes  0 Opening Credits  0 Top Billed Cast Taryn O'Neill Computer (voice) Melanie Merkosky Raegen Brad Hawkins Tipton Full Cast & Crew Last Season Season 2 2013 | 9 Episodes Season 2 of Continuum premiered on August  1, 2013. View All Seasons Social Reviews  0 Discussions  2 Subject Status Replies Last Reply There are no discussions for Continuum. Login to be first! Go to Discussions Media Most Popular Videos  0 Backdrops  1 Posters  1 Recommendations   2009-07-12 Meteor 5.0    2006-11-15 Day Break 7.5    2007-01-21 The Dresden Files 6.7  Facts Status  Ended Network Certification  - Type  Scripted Original Language  English Runtime  5m Homepage   https://www.youtube.com/user/ContinuumTheSeries Genres Science Fiction Keywords spaceship memory loss Content Score 64 We're so close, yet so far. Top Contributors 21 Elizabeth Jennings 5 OzDrDj 3 tulgha 3 Banana  View Edit History Popularity Trend  Login to edit  URL By  signing up  for an account on TMDb, you can post directly to Twitter and Facebook. You need to be logged in to continue. Click  here  to login or  here  to sign up.    page_wrap opened in html_head  Join the Community The Basics About TMDb Contact Us Support Forums API Blog Get Involved  Contribution Bible 3rd Party Applications Add New Movie Add New TV Show Community Guidelines Leaderboard Forums Twitter Facebook Legal Terms of Use Privacy Policy Login Sign Up"}