{"link": "https://www.themoviedb.org/tv/39549?language=en", "title": "Great Expectations", "resume": "Miniseries based on Charles Dickens' novel of the same title.", "rate": 0, "genre": ["Drama"], "cast": ["Jean Simmons", "John Rhys-Davies", "Ray McAnally", "Anthony Calf", "Kim Thomson"], "character": ["Miss Havisham", "Joe Gargery", "Mr. Jaggers", "Pip", "Estella"], "site_data": "html Apps Forums Leaderboard Contribute API Support Discover Movies TV Shows Movies Popular Top Rated Upcoming Now Playing TV Shows Popular Top Rated On TV Airing Today People Popular People Can't find a movie or TV show? Login to create it. en Login Sign Up  ID: 39549   Expand Great Expectations   (1991) User Score Overview Miniseries based on Charles Dickens' novel of the same title. Discussions   Reviews Videos   Images   Changes Report Share Discussions General  0 Content Issues  0 Images Backdrops  0 Posters  1 Videos Trailers  0 Teasers  0 Clips  0 Featurettes  0 Opening Credits  0 Top Billed Cast Jean Simmons Miss Havisham John Rhys-Davies Joe Gargery Ray McAnally Mr. Jaggers Anthony Calf Pip Kim Thomson Estella Full Cast & Crew Last Season Miniseries 1991 | 6 Episodes Season 1 of Great Expectations premiered on June 21, 1991. View All Seasons Social Reviews  0 Discussions  0 Media Most Popular Videos  0 Backdrops  0 Posters  1 Recommendations We don't have enough data to suggest any TV shows based on Great Expectations. You can help by rating TV shows you've seen. Facts Status  Ended Network Certification  - Type  Miniseries Original Language  English Runtime  60m Homepage  - Genres Drama Keywords based on novel or book rags to riches victorian england miniseries charles dickens Content Score 71 Just a little bit more... Top Contributors 20 Elizabeth Jennings TB 11 TMDb Bot 4 Banana R 2 Rebecca  View Edit History Popularity Trend  Login to edit  URL By  signing up  for an account on TMDb, you can post directly to Twitter and Facebook. You need to be logged in to continue. Click  here  to login or  here  to sign up.    page_wrap opened in html_head  Join the Community The Basics About TMDb Contact Us Support Forums API Blog Get Involved  Contribution Bible 3rd Party Applications Add New Movie Add New TV Show Community Guidelines Leaderboard Forums Twitter Facebook Legal Terms of Use Privacy Policy Login Sign Up"}