{"link": "https://www.themoviedb.org/tv/78353?language=en", "title": "Come Home", "resume": "When mother Marie mysteriously leaves the family home, the repercussions are enormous.", "rate": 0, "genre": ["Drama"], "cast": ["Christopher Eccleston", "Paula Malcomson", "Kerri Quinn", "Anthony Boyle", "Lola Petticrew"], "character": ["Greg", "Marie", "Brenna", "Liam", "Laura"], "site_data": "html Apps Forums Leaderboard Contribute API Support Discover Movies TV Shows Movies Popular Top Rated Upcoming Now Playing TV Shows Popular Top Rated On TV Airing Today People Popular People Can't find a movie or TV show? Login to create it. en Login Sign Up  ID: 78353   Expand Come Home   (2018) User Score  Play Trailer Overview When mother Marie mysteriously leaves the family home, the repercussions are enormous. Featured Crew Danny Brocklehurst Creator Discussions   Reviews Videos   Images   Changes Report Share Discussions General  0 Content Issues  0 Images Backdrops  1 Posters  1 Videos Trailers  1 Teasers  0 Clips  0 Featurettes  0 Opening Credits  0 Top Billed Cast Christopher Eccleston Greg Paula Malcomson Marie Kerri Quinn Brenna Anthony Boyle Liam Lola Petticrew Laura Full Cast & Crew Current Season Season 1 2018 | 3 Episodes Season 1 of Come Home premiered on March 27, 2018. View All Seasons Social Reviews  0 Discussions  0 Media Most Popular Videos  1 Backdrops  1 Posters  1 Recommendations We don't have enough data to suggest any TV shows based on Come Home. You can help by rating TV shows you've seen. Facts Status  Returning Series Network Certification  - Type  Scripted Original Language  English Runtime  60m Homepage  - Genres Drama Keywords marriage parenting Content Score 100 Yes! Looking good! Top Contributors 12 Steve D 6 Destr0y c 5 crkvice 2 tatergator  View Edit History Popularity Trend  Login to edit  URL By  signing up  for an account on TMDb, you can post directly to Twitter and Facebook. You need to be logged in to continue. Click  here  to login or  here  to sign up.    page_wrap opened in html_head  Join the Community The Basics About TMDb Contact Us Support Forums API Blog Get Involved  Contribution Bible 3rd Party Applications Add New Movie Add New TV Show Community Guidelines Leaderboard Forums Twitter Facebook Legal Terms of Use Privacy Policy Login Sign Up"}