{"link": "https://www.themoviedb.org/tv/42857?language=en", "title": "Absalons secret", "resume": "The girl Cecilie is interested in Absalons secret because there is an angel that can save her sick sister. It is located in Magasin Du Nord in Copenhagen, Denmark.", "rate": null, "genre": ["Family", "Action", "Adventure", "Drama"], "cast": ["Gustav Hintze", "Sarah Juel Werner", "Eva-Theresa Jermiin Anker", "Ellen Hillings\u00f8", "Henrik Prip"], "site_data": "html Apps Forums Leaderboard Contribute API Support Discover Movies TV Shows Movies Popular Top Rated Upcoming Now Playing TV Shows Popular Top Rated On TV Airing Today People Popular People Can't find a movie or TV show? Login to create it. en Login Sign Up  ID: 42857   Expand Absalons secret   (2006) User Score Overview The girl Cecilie is interested in Absalons secret because there is an angel that can save her sick sister. It is located in Magasin Du Nord in Copenhagen, Denmark. Featured Crew Trine Piil Christensen Creator Discussions   Reviews Videos   Images   Changes Report Share Discussions General  0 Content Issues  0 Images Backdrops  0 Posters  1 Videos Trailers  0 Teasers  0 Clips  0 Featurettes  0 Opening Credits  0 Top Billed Cast Gustav Hintze Hubert Sarah Juel Werner Cecilie Berggren Eva-Theresa Jermiin Anker Ida Berggren Ellen Hillings\u00f8 Benedikte Berggren Henrik Prip Niels Berggren Full Cast & Crew Last Season Season 1 2006 | 24 Episodes Season 1 of Absalons secret premiered on December  1, 2006. View All Seasons Social Reviews  0 Discussions  0 Media Most Popular Videos  0 Backdrops  0 Posters  1 Recommendations We don't have enough data to suggest any TV shows based on Absalons secret. You can help by rating TV shows you've seen. Facts Original Name  Absalons hemmelighed Status  Ended Networks - Certification  - Type  Scripted Original Language  Danish Runtime  - Homepage  - Genres Family Action & Adventure Drama Keywords No keywords have been added. Content Score 79 Pump it up! We're close now. Top Contributors 15 Evaldnet 8 thob9000 1 kcdh  View Edit History Popularity Trend  Login to edit  URL By  signing up  for an account on TMDb, you can post directly to Twitter and Facebook. You need to be logged in to continue. Click  here  to login or  here  to sign up.    page_wrap opened in html_head  Join the Community The Basics About TMDb Contact Us Support Forums API Blog Get Involved  Contribution Bible 3rd Party Applications Add New Movie Add New TV Show Community Guidelines Leaderboard Forums Twitter Facebook Legal Terms of Use Privacy Policy Login Sign Up", "character": ["Hubert", "Cecilie Berggren", "Ida Berggren", "Benedikte Berggren", "Niels Berggren"]}