{"link": "https://www.themoviedb.org/tv/39902?language=en", "title": "Allein gegen die Zeit", "resume": "Allein gegen die Zeit is a German real-time television series, aired since 2009. Broadcast on KI.KA, structurally, it resembles the series 24.", "rate": 0, "genre": ["Sci-Fi", "Fantasy", "Family"], "cast": ["Peter Lohmeyer", "Timon Wloka", "Timmi Trinks", "Janina Fautz", "Ugur Ekeroglu"], "character": ["Professor Brehmer", "Ben Brehmer", "Jonas St\u00fcrmer", "Leonora 'Leo' Largareta", "\u00d6zg\u00fcr '\u00d6zzi' Delikaya"], "site_data": "html Apps Forums Leaderboard Contribute API Support Discover Movies TV Shows Movies Popular Top Rated Upcoming Now Playing TV Shows Popular Top Rated On TV Airing Today People Popular People Can't find a movie or TV show? Login to create it. en Login Sign Up  ID: 39902   Expand Allein gegen die Zeit   (2010) User Score Overview Allein gegen die Zeit is a German real-time television series, aired since 2009. Broadcast on KI.KA, structurally, it resembles the series 24. Discussions   Reviews Videos   Images   Changes Report Share Discussions General  0 Content Issues  0 Images Backdrops  3 Posters  1 Videos Trailers  0 Teasers  0 Clips  0 Featurettes  0 Opening Credits  0 Top Billed Cast Peter Lohmeyer Professor Brehmer Timon Wloka Ben Brehmer Timmi Trinks Jonas St\u00fcrmer Janina Fautz Leonora 'Leo' Largareta Ugur Ekeroglu \u00d6zg\u00fcr '\u00d6zzi' Delikaya Full Cast & Crew Last Season Season 2 2011 | 13 Episodes Season 2 of Allein gegen die Zeit premiered on December 26, 2011. View All Seasons Social Reviews  0 Discussions  0 Media Most Popular Videos  0 Backdrops  3 Posters  1 Recommendations We don't have enough data to suggest any TV shows based on Allein gegen die Zeit. You can help by rating TV shows you've seen. Facts Status  Ended Network Certification  - Type  Scripted Original Language  German Runtime  25m Homepage   http://www.agdz.de/ Genres Sci-Fi & Fantasy Family Keywords No keywords have been added. Content Score 86 Almost there... Top Contributors S 27 Samara V 5 Vivo 2 Elizabeth Jennings  View Edit History Popularity Trend  Login to edit  URL By  signing up  for an account on TMDb, you can post directly to Twitter and Facebook. You need to be logged in to continue. Click  here  to login or  here  to sign up.    page_wrap opened in html_head  Join the Community The Basics About TMDb Contact Us Support Forums API Blog Get Involved  Contribution Bible 3rd Party Applications Add New Movie Add New TV Show Community Guidelines Leaderboard Forums Twitter Facebook Legal Terms of Use Privacy Policy Login Sign Up"}