{"link": "https://www.themoviedb.org/tv/71581?language=en", "title": "\u0427\u0440\u0435\u0437\u0432\u044b\u0447\u0430\u0439\u043d\u0430\u044f \u0441\u0438\u0442\u0443\u0430\u0446\u0438\u044f", "resume": "We don't have an overview translated in English. Help us expand our database by adding one.", "rate": 0, "genre": ["Drama"], "cast": ["\u041f\u0435\u0442\u0440 \u041a\u0438\u0441\u043b\u043e\u0432", "\u041c\u0438\u0445\u0430\u0438\u043b \u041c\u0430\u0440\u0442\u044c\u044f\u043d\u043e\u0432", "\u0410\u043b\u0435\u043a\u0441\u0430\u043d\u0434\u0440 \u0412\u0435\u0440\u0448\u0438\u043d\u0438\u043d", "Aleksandr Korshunov", "\u041d\u0438\u043a\u043e\u043b\u0430\u0439 \u041a\u043e\u0437\u0430\u043a"], "character": ["\u041b\u0435\u0448\u0430 \u0424\u0438\u043b\u0430\u0442\u043e\u0432", "\u0418\u0441\u043a\u0430\u043d\u0434\u0435\u0440 \u0417\u0430\u0440\u0438\u043f\u043e\u0432", "\u041f\u0430\u0448\u0430 \u0413\u043e\u043b\u043e\u0432\u0430\u043d\u043e\u0432", "\u041b\u0438\u0432\u0430\u043d\u043e\u0432", "\u0410\u043d\u0434\u0440\u0435\u0439 \u041a\u043e\u0441\u0442\u044e\u043a"], "site_data": "html Apps Forums Leaderboard Contribute API Support Discover Movies TV Shows Movies Popular Top Rated Upcoming Now Playing TV Shows Popular Top Rated On TV Airing Today People Popular People Can't find a movie or TV show? Login to create it. en Login Sign Up  ID: 71581   Expand \u0427\u0440\u0435\u0437\u0432\u044b\u0447\u0430\u0439\u043d\u0430\u044f \u0441\u0438\u0442\u0443\u0430\u0446\u0438\u044f   (2012) User Score Overview We don't have an overview translated in English. Help us expand our database by adding one. Featured Crew \u0410\u043b\u0435\u043a\u0441\u0430\u043d\u0434\u0440 \u0412\u0430\u0440\u0442\u0430\u043d\u043e\u0432 Creator \u042e\u0440\u0438\u0439 \u0413\u0440\u0435\u0447\u0430\u043d\u044b\u0439 Creator Discussions   Reviews Videos   Images   Changes Report Share Discussions General  0 Content Issues  0 Images Backdrops  1 Posters  2 Videos Trailers  0 Teasers  0 Clips  0 Featurettes  0 Opening Credits  0 Top Billed Cast \u041f\u0435\u0442\u0440 \u041a\u0438\u0441\u043b\u043e\u0432 \u041b\u0435\u0448\u0430 \u0424\u0438\u043b\u0430\u0442\u043e\u0432 \u041c\u0438\u0445\u0430\u0438\u043b \u041c\u0430\u0440\u0442\u044c\u044f\u043d\u043e\u0432 \u0418\u0441\u043a\u0430\u043d\u0434\u0435\u0440 \u0417\u0430\u0440\u0438\u043f\u043e\u0432 \u0410\u043b\u0435\u043a\u0441\u0430\u043d\u0434\u0440 \u0412\u0435\u0440\u0448\u0438\u043d\u0438\u043d \u041f\u0430\u0448\u0430 \u0413\u043e\u043b\u043e\u0432\u0430\u043d\u043e\u0432 Aleksandr Korshunov \u041b\u0438\u0432\u0430\u043d\u043e\u0432 \u041d\u0438\u043a\u043e\u043b\u0430\u0439 \u041a\u043e\u0437\u0430\u043a \u0410\u043d\u0434\u0440\u0435\u0439 \u041a\u043e\u0441\u0442\u044e\u043a Full Cast & Crew Last Season Season 1 2012 | 24 Episodes Season 1 of \u0427\u0440\u0435\u0437\u0432\u044b\u0447\u0430\u0439\u043d\u0430\u044f \u0441\u0438\u0442\u0443\u0430\u0446\u0438\u044f premiered on August 21, 2012. View All Seasons Social Reviews  0 Discussions  0 Media Most Popular Videos  0 Backdrops  1 Posters  2 Recommendations We don't have enough data to suggest any TV shows based on \u0427\u0440\u0435\u0437\u0432\u044b\u0447\u0430\u0439\u043d\u0430\u044f \u0441\u0438\u0442\u0443\u0430\u0446\u0438\u044f. You can help by rating TV shows you've seen. Facts Status  Ended Networks - Certification  - Type  Scripted Original Language  Russian Runtime  46m Homepage  - Genres Drama Keywords No keywords have been added. Content Score 86 Almost there... Top Contributors m 26 maltsev.v.v 4 mrtextortexel  View Edit History Popularity Trend  Login to edit  URL By  signing up  for an account on TMDb, you can post directly to Twitter and Facebook. You need to be logged in to continue. Click  here  to login or  here  to sign up.    page_wrap opened in html_head  Join the Community The Basics About TMDb Contact Us Support Forums API Blog Get Involved  Contribution Bible 3rd Party Applications Add New Movie Add New TV Show Community Guidelines Leaderboard Forums Twitter Facebook Legal Terms of Use Privacy Policy Login Sign Up"}