{"link": "https://www.themoviedb.org/tv/66987?language=en", "title": "Brotherhood: Final Fantasy XV", "resume": "A story set alongside the video game Final Fantasy XV, starring one of its main characters, Noctis, and his friends.", "rate": null, "genre": ["Action", "Adventure", "Animation", "Sci-Fi", "Fantasy"], "cast": ["Makoto Koichi", "Kenta Miyake", "Tatsuhisa Suzuki", "Tetsuya Kakihara", "Mamoru Miyano"], "site_data": "html Apps Forums Leaderboard Contribute API Support Discover Movies TV Shows Movies Popular Top Rated Upcoming Now Playing TV Shows Popular Top Rated On TV Airing Today People Popular People Can't find a movie or TV show? Login to create it. en Login Sign Up  ID: 66987   Expand Brotherhood: Final Fantasy XV   (2016) User Score  Play Trailer Overview A story set alongside the video game Final Fantasy XV, starring one of its main characters, Noctis, and his friends. Featured Crew Akio Ofuji Creator Yuniko Ayana Creator Discussions   Reviews Videos   Images   Changes Report Share Discussions General  0 Content Issues  0 Images Backdrops  2 Posters  1 Videos Trailers  1 Teasers  0 Clips  0 Featurettes  0 Opening Credits  0 Top Billed Cast Makoto Koichi Marilith Kenta Miyake Gladiolus Amicitia Tatsuhisa Suzuki Noctis Lucis Caelum Tetsuya Kakihara Prompto Argentum Mamoru Miyano Ignis Stupeo Scientia Full Cast & Crew Last Season Season 1 2016 | 5 Episodes Season 1 of Brotherhood: Final Fantasy XV premiered on March 30, 2016. View All Seasons Social Reviews  0 Discussions  0 Media Most Popular Videos  1 Backdrops  2 Posters  1 Recommendations   2010-10-31 The Walking Dead 7.3  Facts Status  Ended Networks Certification  - Type  Scripted Original Language  Japanese Runtime  80m Homepage  - Genres Action & Adventure Animation Sci-Fi & Fantasy Keywords based on video game Content Score 100 Yes! Looking good! Top Contributors o 25 onlinemoviestar 8 Arcchiam z 8 zurman1 7 Jack Duiz  View Edit History Popularity Trend  Login to edit  URL By  signing up  for an account on TMDb, you can post directly to Twitter and Facebook. You need to be logged in to continue. Click  here  to login or  here  to sign up.    page_wrap opened in html_head  Join the Community The Basics About TMDb Contact Us Support Forums API Blog Get Involved  Contribution Bible 3rd Party Applications Add New Movie Add New TV Show Community Guidelines Leaderboard Forums Twitter Facebook Legal Terms of Use Privacy Policy Login Sign Up", "character": ["Marilith", "Gladiolus Amicitia", "Noctis Lucis Caelum", "Prompto Argentum", "Ignis Stupeo Scientia"]}