{"link": "https://www.themoviedb.org/tv/65568?language=en", "title": "The Duke of Mount Deer", "resume": "We don't have an overview translated in English. Help us expand our database by adding one.", "rate": 0, "genre": ["Drama", "Action", "History", "Comedy"], "cast": ["Jordan Chan", "Steven Ma", "Cherie Chan", "Noel Leung Siu-bing", "Hilary Tsui"], "character": ["Wai Siu-bo", "Emperor Honhei", "Ah Ngor/Chan Yuanyuan", "Fong Yi"], "site_data": "html Apps Forums Leaderboard Contribute API Support Discover Movies TV Shows Movies Popular Top Rated Upcoming Now Playing TV Shows Popular Top Rated On TV Airing Today People Popular People Can't find a movie or TV show? Login to create it. en Login Sign Up  ID: 65568   Expand The Duke of Mount Deer   (1998) User Score Overview We don't have an overview translated in English. Help us expand our database by adding one. Discussions   Reviews Videos   Images   Changes Report Share Discussions General  0 Content Issues  0 Images Backdrops  1 Posters  1 Videos Trailers  0 Teasers  0 Clips  0 Featurettes  0 Opening Credits  0 Top Billed Cast Jordan Chan Wai Siu-bo Steven Ma Emperor Honhei Cherie Chan Noel Leung Siu-bing Ah Ngor/Chan Yuanyuan Hilary Tsui Fong Yi Full Cast & Crew Last Season Season 1 1998 | 45 Episodes Season 1 of The Duke of Mount Deer premiered on June  1, 1998. View All Seasons Social Reviews  0 Discussions  0 Media Most Popular Videos  0 Backdrops  1 Posters  1 Recommendations We don't have enough data to suggest any TV shows based on The Duke of Mount Deer. You can help by rating TV shows you've seen. Facts Original Name  \u9e7f\u9f0e\u8bb0 Status  Ended Network Certification  - Type  Scripted Original Language  Cantonese Runtime  45m Homepage  - Genres Drama Action History Comedy Keywords No keywords have been added. Content Score 79 Pump it up! We're close now. Top Contributors t 34 taxigps v 7 vking 3 Elizabeth Jennings 2 thirstyhippo  View Edit History Popularity Trend  Login to edit  URL By  signing up  for an account on TMDb, you can post directly to Twitter and Facebook. You need to be logged in to continue. Click  here  to login or  here  to sign up.    page_wrap opened in html_head  Join the Community The Basics About TMDb Contact Us Support Forums API Blog Get Involved  Contribution Bible 3rd Party Applications Add New Movie Add New TV Show Community Guidelines Leaderboard Forums Twitter Facebook Legal Terms of Use Privacy Policy Login Sign Up"}