{"link": "https://www.themoviedb.org/tv/62017?language=en", "title": "The Man in the High Castle", "resume": "Based on Philip K. Dick's award-winning novel, The Man in the High Castle explores what it would be like if the Allied Powers had lost WWII, and Japan and Germany ruled the United States.", "rate": 76, "genre": ["Drama", "Sci-Fi", "Fantasy"], "cast": ["Rufus Sewell", "Luke Kleintank", "Alexa Davalos", "Rupert Evans", "DJ Qualls"], "character": ["John Smith", "Joe Blake", "Juliana Crain", "Frank Frink", "Ed McCarthy"], "site_data": "html Apps Forums Leaderboard Contribute API Support Discover Movies TV Shows Movies Popular Top Rated Upcoming Now Playing TV Shows Popular Top Rated On TV Airing Today People Popular People Can't find a movie or TV show? Login to create it. en Login Sign Up  ID: 62017   Expand The Man in the High Castle   (2015) User Score  Play Trailer Overview Based on Philip K. Dick's award-winning novel, The Man in the High Castle explores what it would be like if the Allied Powers had lost WWII, and Japan and Germany ruled the United States. Featured Crew Ridley Scott Creator Discussions   Reviews Videos   Images   Changes Report Share Discussions General  9 Content Issues  1 Images Backdrops  12 Posters  17 Videos Trailers  2 Teasers  0 Clips  0 Featurettes  1 Opening Credits  0 Top Billed Cast Rufus Sewell John Smith Luke Kleintank Joe Blake Alexa Davalos Juliana Crain Rupert Evans Frank Frink DJ Qualls Ed McCarthy Full Cast & Crew Last Season Season 2 2016 | 10 Episodes Season 2 of The Man in the High Castle premiered on December 16, 2016. View All Seasons Social Reviews  0 Discussions  10 Subject Status Replies Last Reply Waste of a premise! (season 1) Open 2 by  JustinJackFlash H Seasons Open 0 by HuggieBear\n      \n     Sometimes Very Difficult to Follow (Spoilers! Not blacked out!) Open 7 by  CharlesTheBold Go to Discussions Media Most Popular Videos  3 Backdrops  12 Posters  17 Recommendations   2014-08-28 Hand of God 6.8    2015-05-14 Wayward Pines 6.5    2013-01-30 The Americans 7.7    2014-06-01 Halt and Catch Fire 7.7    2013-02-01 House of Cards 8.2    2015-05-27 Mr. Robot 7.8    2015-11-20 Marvel's Jessica Jones 7.6    2016-02-21 The Night Manager 7.7  Facts Status  Returning Series Network Certification TV-MA Meaning This program is specifically designed to be viewed by adults and therefore may be unsuitable for children under 17 Type  Scripted Original Language  English Runtime  60m Homepage   http://www.amazon.com/The-Man-High-Castle/dp/B00RSI5EHQ Genres Drama Sci-Fi & Fantasy Keywords based on novel or book nazi resistance dystopia alternate reality post world war ii alternative history Content Score 100 Yes! Looking good! Top Contributors 71 Elizabeth Jennings 38 Banana s 35 sora_sey m 18 m1nty  View Edit History Popularity Trend  Login to edit  URL By  signing up  for an account on TMDb, you can post directly to Twitter and Facebook. You need to be logged in to continue. Click  here  to login or  here  to sign up.    page_wrap opened in html_head  Join the Community The Basics About TMDb Contact Us Support Forums API Blog Get Involved  Contribution Bible 3rd Party Applications Add New Movie Add New TV Show Community Guidelines Leaderboard Forums Twitter Facebook Legal Terms of Use Privacy Policy Login Sign Up"}