{"link": "https://www.themoviedb.org/tv/12247?language=en", "title": "McClain's Law", "resume": "McClain's Law is an American crime drama television series that aired on NBC during the 1981-1982 season. New episodes ended on March 20, and rebroadcasts continued until August 24, 1982.", "rate": 80, "genre": ["Drama", "Crime"], "cast": ["James Arness", "George DiCenzo", "Carl Franklin", "Markie Post", "Conchata Ferrell"], "character": ["Det. Jim McClain"], "site_data": "html Apps Forums Leaderboard Contribute API Support Discover Movies TV Shows Movies Popular Top Rated Upcoming Now Playing TV Shows Popular Top Rated On TV Airing Today People Popular People Can't find a movie or TV show? Login to create it. en Login Sign Up  ID: 12247   Expand McClain's Law   (1981) User Score Overview McClain's Law is an American crime drama television series that aired on NBC during the 1981-1982 season. New episodes ended on March 20, and rebroadcasts continued until August 24, 1982. Featured Crew Eric Bercovici Creator Discussions   Reviews Videos   Images   Changes Report Share Discussions General  0 Content Issues  0 Images Backdrops  0 Posters  2 Videos Trailers  0 Teasers  0 Clips  0 Featurettes  0 Opening Credits  0 Top Billed Cast James Arness Det. Jim McClain George DiCenzo Carl Franklin Markie Post Conchata Ferrell Full Cast & Crew Last Season Season 1 1981 | 16 Episodes Season 1 of McClain's Law premiered on November 20, 1981. View All Seasons Social Reviews  0 Discussions  0 Media Most Popular Videos  0 Backdrops  0 Posters  2 Recommendations We don't have enough data to suggest any TV shows based on McClain's Law. You can help by rating TV shows you've seen. Facts Status  Ended Network Certification  - Type  Scripted Original Language  English Runtime  60m, 44m Homepage  - Genres Drama Crime Keywords police detective elderly Content Score 79 Pump it up! We're close now. Top Contributors 9 Banana  View Edit History Popularity Trend  Login to edit  URL By  signing up  for an account on TMDb, you can post directly to Twitter and Facebook. You need to be logged in to continue. Click  here  to login or  here  to sign up.    page_wrap opened in html_head  Join the Community The Basics About TMDb Contact Us Support Forums API Blog Get Involved  Contribution Bible 3rd Party Applications Add New Movie Add New TV Show Community Guidelines Leaderboard Forums Twitter Facebook Legal Terms of Use Privacy Policy Login Sign Up"}