{"link": "https://www.themoviedb.org/tv/26312?language=en", "title": "For Love and Honor", "resume": "For Love and Honor is a short-lived American military drama series that aired on NBC from September 23, 1983 to December 27, 1983. The series is inspired by the hit film An Officer and a Gentleman.", "rate": 0, "genre": ["Drama"], "cast": ["Rachel Ticotin", "Gary Grubbs", "Keenen Ivory Wayans", "John Mengatti", "Cliff Potts"], "character": ["Pvt. Duke Johnson"], "site_data": "html Apps Forums Leaderboard Contribute API Support Discover Movies TV Shows Movies Popular Top Rated Upcoming Now Playing TV Shows Popular Top Rated On TV Airing Today People Popular People Can't find a movie or TV show? Login to create it. en Login Sign Up  ID: 26312   Expand For Love and Honor   (1983) User Score Overview For Love and Honor is a short-lived American military drama series that aired on NBC from September 23, 1983 to December 27, 1983. The series is inspired by the hit film An Officer and a Gentleman. Discussions   Reviews Videos   Images   Changes Report Share Discussions General  0 Content Issues  0 Images Backdrops  0 Posters  1 Videos Trailers  0 Teasers  0 Clips  0 Featurettes  0 Opening Credits  0 Top Billed Cast Rachel Ticotin Gary Grubbs Keenen Ivory Wayans Pvt. Duke Johnson John Mengatti Cliff Potts Full Cast & Crew Last Season Season 1 1983 | 13 Episodes Season 1 of For Love and Honor premiered on September 23, 1983. View All Seasons Social Reviews  0 Discussions  0 Media Most Popular Videos  0 Backdrops  0 Posters  1 Recommendations We don't have enough data to suggest any TV shows based on For Love and Honor. You can help by rating TV shows you've seen. Facts Status  Ended Network Certification  - Type  Scripted Original Language  English Runtime  60m Homepage  - Genres Drama Keywords u.s. army military army base Content Score 71 Just a little bit more... Top Contributors 9 Banana 2 Stan Smith  View Edit History Popularity Trend  Login to edit  URL By  signing up  for an account on TMDb, you can post directly to Twitter and Facebook. You need to be logged in to continue. Click  here  to login or  here  to sign up.    page_wrap opened in html_head  Join the Community The Basics About TMDb Contact Us Support Forums API Blog Get Involved  Contribution Bible 3rd Party Applications Add New Movie Add New TV Show Community Guidelines Leaderboard Forums Twitter Facebook Legal Terms of Use Privacy Policy Login Sign Up"}