{"link": "https://www.themoviedb.org/tv/75135?language=en", "title": "Gruen", "resume": "Join host Wil Anderson, stalwarts Todd Sampson and Russel Howcroft and other advertising industry experts to unpick the ways we're all bought and sold.", "rate": 0, "genre": ["Talk"], "cast": ["Wil Anderson", "Russel Howcroft", "Todd Sampson"], "character": ["Himself - Host", "Himself - Panellist", "Himself - Panellist"], "site_data": "html Apps Forums Leaderboard Contribute API Support Discover Movies TV Shows Movies Popular Top Rated Upcoming Now Playing TV Shows Popular Top Rated On TV Airing Today People Popular People Can't find a movie or TV show? Login to create it. en Login Sign Up  ID: 75135   Expand Gruen   (2015) User Score Overview Join host Wil Anderson, stalwarts Todd Sampson and Russel Howcroft and other advertising industry experts to unpick the ways we're all bought and sold. Discussions   Reviews Videos   Images   Changes Report Share Discussions General  0 Content Issues  0 Images Backdrops  2 Posters  5 Videos Trailers  0 Teasers  0 Clips  0 Featurettes  0 Opening Credits  0 Top Billed Cast Wil Anderson Himself - Host Russel Howcroft Himself - Panellist Todd Sampson Himself - Panellist Full Cast & Crew Last Season Season 3 2017 | 10 Episodes Season 3 of Gruen premiered on September 12, 2017. View All Seasons Social Reviews  0 Discussions  0 Media Most Popular Videos  0 Backdrops  2 Posters  5 Recommendations We don't have enough data to suggest any TV shows based on Gruen. You can help by rating TV shows you've seen. Facts Status  Returning Series Network Certification  - Type  Talk Show Original Language  English Runtime  - Homepage   http://abc.net.au/tv/programs/gruen/ Genres Talk Keywords talk show spin off Content Score 56 We're so close, yet so far. Top Contributors 35 Banana  View Edit History Popularity Trend  Login to edit  URL By  signing up  for an account on TMDb, you can post directly to Twitter and Facebook. You need to be logged in to continue. Click  here  to login or  here  to sign up.    page_wrap opened in html_head  Join the Community The Basics About TMDb Contact Us Support Forums API Blog Get Involved  Contribution Bible 3rd Party Applications Add New Movie Add New TV Show Community Guidelines Leaderboard Forums Twitter Facebook Legal Terms of Use Privacy Policy Login Sign Up"}