{"link": "https://www.themoviedb.org/tv/771?language=en", "title": "A Bear's Tail", "resume": "We don't have an overview translated in English. Help us expand our database by adding one.", "rate": 0, "genre": ["Comedy"], "cast": ["Sean Pertwee", "Ozzy Rezat", "Leigh Francis", "Davina McCall", "Patsy Kensit"], "character": ["The Bear", "Dave Ian McCall"], "site_data": "html Apps Forums Leaderboard Contribute API Support Discover Movies TV Shows Movies Popular Top Rated Upcoming Now Playing TV Shows Popular Top Rated On TV Airing Today People Popular People Can't find a movie or TV show? Login to create it. en Login Sign Up  ID: 771   Expand A Bear's Tail   (2005) User Score Overview We don't have an overview translated in English. Help us expand our database by adding one. Featured Crew Leigh Francis Creator Discussions   Reviews Videos   Images   Changes Report Share Discussions General  0 Content Issues  0 Images Backdrops  0 Posters  2 Videos Trailers  0 Teasers  0 Clips  0 Featurettes  0 Opening Credits  0 Top Billed Cast Sean Pertwee Ozzy Rezat Leigh Francis The Bear Davina McCall Dave Ian McCall Patsy Kensit Full Cast & Crew Last Season Season 1 2005 | 6 Episodes Season 1 of A Bear's Tail premiered on July  8, 2005. View All Seasons Social Reviews  0 Discussions  0 Media Most Popular Videos  0 Backdrops  0 Posters  2 Recommendations We don't have enough data to suggest any TV shows based on A Bear's Tail. You can help by rating TV shows you've seen. Facts Status  Ended Network Certification  - Type  Scripted Original Language  English Runtime  30m Homepage  - Genres Comedy Keywords No keywords have been added. Content Score 71 Just a little bit more... Top Contributors No contributors found. Popularity Trend  Login to edit  URL By  signing up  for an account on TMDb, you can post directly to Twitter and Facebook. You need to be logged in to continue. Click  here  to login or  here  to sign up.    page_wrap opened in html_head  Join the Community The Basics About TMDb Contact Us Support Forums API Blog Get Involved  Contribution Bible 3rd Party Applications Add New Movie Add New TV Show Community Guidelines Leaderboard Forums Twitter Facebook Legal Terms of Use Privacy Policy Login Sign Up"}