{"link": "https://www.themoviedb.org/tv/67135?language=en", "title": "The Exorcist", "resume": "Follow the lives of two very different priests tackling one family\u2019s case of terrifying demonic possession.", "rate": 72, "genre": ["Drama", "Mystery"], "cast": ["Alfonso Herrera", "Ben Daniels", "John Cho", "Li Jun Li", "Kurt Egyiawan"], "character": ["Father Tomas Ortega", "Father Marcus Brennan", "Andrew Kim", "Rose Cooper", "Father Bennett"], "site_data": "html Apps Forums Leaderboard Contribute API Support Discover Movies TV Shows Movies Popular Top Rated Upcoming Now Playing TV Shows Popular Top Rated On TV Airing Today People Popular People Can't find a movie or TV show? Login to create it. en Login Sign Up  ID: 67135   Expand The Exorcist   (2016) User Score  Play Trailer Overview Follow the lives of two very different priests tackling one family\u2019s case of terrifying demonic possession. Featured Crew Jeremy Slater Creator Discussions   Reviews Videos   Images   Changes Report Share Discussions General  6 Content Issues  1 Images Backdrops  11 Posters  9 Videos Trailers  1 Teasers  0 Clips  0 Featurettes  0 Opening Credits  0 Top Billed Cast Alfonso Herrera Father Tomas Ortega Ben Daniels Father Marcus Brennan John Cho Andrew Kim Li Jun Li Rose Cooper Kurt Egyiawan Father Bennett Full Cast & Crew Last Season Season 2 2017 | 10 Episodes Season 2 of The Exorcist premiered on September 29, 2017. View All Seasons Social Reviews  0 Discussions  7 Subject Status Replies Last Reply Hope this gets renewed! Open 3 by  stugood This show really hates Catholics Open 0 by Mon-Star\n      \n     c Wait... WHAT??? Open 4 by  tonyismad Go to Discussions Media Most Popular Videos  1 Backdrops  11 Posters  9 Recommendations   2016-06-03 Outcast 7.0    2016-03-07 Damien 6.5    2016-10-11 Channel Zero 6.6    2014-07-13 The Strain 6.6    2016-06-13 BrainDead 7.1    2016-05-22 Preacher 7.4    2013-03-18 Bates Motel 7.6    2016-03-04 Slasher 6.0  Facts Status  Cancelled Network Certification TV-14 Meaning This program contains some material that many parents would find unsuitable for children under 14 years of age. Type  Scripted Original Language  English Runtime  43m Homepage   http://www.fox.com/the-exorcist Genres Drama Mystery Keywords exorcism priest demonic possession Content Score 100 Yes! Looking good! Top Contributors 38 Banana p 29 plumpro 23 Elizabeth Jennings 15 niqo19  View Edit History Popularity Trend  Login to edit  URL By  signing up  for an account on TMDb, you can post directly to Twitter and Facebook. You need to be logged in to continue. Click  here  to login or  here  to sign up.    page_wrap opened in html_head  Join the Community The Basics About TMDb Contact Us Support Forums API Blog Get Involved  Contribution Bible 3rd Party Applications Add New Movie Add New TV Show Community Guidelines Leaderboard Forums Twitter Facebook Legal Terms of Use Privacy Policy Login Sign Up"}