{"link": "https://www.themoviedb.org/tv/8287?language=en", "title": "Occupation", "resume": "A powerful, affecting drama that spans the five years following the invasion of Iraq in 2003. Follow the lives of three soldiers and friends as they deal with the war in Iraq and life back home.", "rate": 0, "genre": ["Drama", "War", "Politics"], "cast": ["James Nesbitt", "Stephen Graham", "Warren Brown", "Lubna Azabal", "Nonso Anozie"], "character": ["Mike Swift", "Danny Ferguson", "Lee Hibbs", "Aliya Nabil", "Erik Lester"], "site_data": "html Apps Forums Leaderboard Contribute API Support Discover Movies TV Shows Movies Popular Top Rated Upcoming Now Playing TV Shows Popular Top Rated On TV Airing Today People Popular People Can't find a movie or TV show? Login to create it. en Login Sign Up  ID: 8287   Expand Occupation   (2009) User Score Overview A powerful, affecting drama that spans the five years following the invasion of Iraq in 2003. Follow the lives of three soldiers and friends as they deal with the war in Iraq and life back home. Discussions   Reviews Videos   Images   Changes Report Share Discussions General  0 Content Issues  0 Images Backdrops  2 Posters  3 Videos Trailers  0 Teasers  0 Clips  0 Featurettes  0 Opening Credits  0 Top Billed Cast James Nesbitt Mike Swift Stephen Graham Danny Ferguson Warren Brown Lee Hibbs Lubna Azabal Aliya Nabil Nonso Anozie Erik Lester Full Cast & Crew Last Season Season 1 2009 | 3 Episodes Season 1 of Occupation premiered on June 16, 2009. View All Seasons Social Reviews  0 Discussions  0 Media Most Popular Videos  0 Backdrops  2 Posters  3 Recommendations We don't have enough data to suggest any TV shows based on Occupation. You can help by rating TV shows you've seen. Facts Status  Ended Network Certification TV-14 Meaning This program contains some material that many parents would find unsuitable for children under 14 years of age. Type  Miniseries Original Language  English Runtime  60m Homepage   http://www.bbc.co.uk/programmes/b00l9sw3 Genres Drama War & Politics Keywords war veteran iraq war veteran iraq war Content Score 86 Almost there... Top Contributors 32 Elizabeth Jennings 4 janar w 3 webmaster p 2 pierrejean75  View Edit History Popularity Trend  Login to edit  URL By  signing up  for an account on TMDb, you can post directly to Twitter and Facebook. You need to be logged in to continue. Click  here  to login or  here  to sign up.    page_wrap opened in html_head  Join the Community The Basics About TMDb Contact Us Support Forums API Blog Get Involved  Contribution Bible 3rd Party Applications Add New Movie Add New TV Show Community Guidelines Leaderboard Forums Twitter Facebook Legal Terms of Use Privacy Policy Login Sign Up"}