{"link": "https://www.themoviedb.org/tv/65189?language=en", "title": "Terapia", "resume": "The show follows M\u00e1rio Magalh\u00e3es, a psychotherapist, through his weekly meetings with his patients, including his appointment with his own therapist.", "rate": 0, "genre": ["Drama"], "cast": ["Catarina Rebelo", "Virg\u00edlio Castelo", "Soraia Chaves", "Nuno Lopes", "Leonor Silveira"], "character": ["Sofia Cruz", "M\u00e1rio Magalh\u00e3es", "Laura Dias", "Alexandre Gomes", "Catarina Magalh\u00e3es"], "site_data": "html Apps Forums Leaderboard Contribute API Support Discover Movies TV Shows Movies Popular Top Rated Upcoming Now Playing TV Shows Popular Top Rated On TV Airing Today People Popular People Can't find a movie or TV show? Login to create it. en Login Sign Up  ID: 65189   Expand Terapia   (2016) User Score Overview The show follows M\u00e1rio Magalh\u00e3es, a psychotherapist, through his weekly meetings with his patients, including his appointment with his own therapist. Featured Crew Hagai Levi Creator Nir Bergman Creator Ori Sivan Creator Discussions   Reviews Videos   Images   Changes Report Share Discussions General  0 Content Issues  0 Images Backdrops  1 Posters  1 Videos Trailers  0 Teasers  0 Clips  0 Featurettes  0 Opening Credits  0 Top Billed Cast Catarina Rebelo Sofia Cruz Virg\u00edlio Castelo M\u00e1rio Magalh\u00e3es Soraia Chaves Laura Dias Nuno Lopes Alexandre Gomes Leonor Silveira Catarina Magalh\u00e3es Full Cast & Crew Last Season Season 1 2016 | 45 Episodes Season 1 of Terapia premiered on January  4, 2016. View All Seasons Social Reviews  0 Discussions  0 Media Most Popular Videos  0 Backdrops  1 Posters  1 Recommendations We don't have enough data to suggest any TV shows based on Terapia. You can help by rating TV shows you've seen. Facts Status  Planned Network Certification  - Type  Scripted Original Language  Portuguese Runtime  30m Homepage  - Genres Drama Keywords No keywords have been added. Content Score 93 Almost there... Top Contributors 26 TheMrKiko 23 jcleto 2 RuiPSOliveira  View Edit History Popularity Trend  Login to edit  URL By  signing up  for an account on TMDb, you can post directly to Twitter and Facebook. You need to be logged in to continue. Click  here  to login or  here  to sign up.    page_wrap opened in html_head  Join the Community The Basics About TMDb Contact Us Support Forums API Blog Get Involved  Contribution Bible 3rd Party Applications Add New Movie Add New TV Show Community Guidelines Leaderboard Forums Twitter Facebook Legal Terms of Use Privacy Policy Login Sign Up"}