{"link": "https://www.themoviedb.org/tv/45860?language=en", "title": "Lupin the Third: The Woman Called Fujiko Mine", "resume": "An anime series based on Monkey Punch's Lupin III manga. It focuses on Fujiko Mine as she undergoes various missions and encounters the rest of the protagonists the first time.", "rate": 87, "genre": ["Action", "Adventure", "Animation", "Comedy", "Drama"], "cast": ["Miyuki Sawashiro", "Kanichi Kurita", "Kouichi Yamadera", "Yuuki Kaji", "Kiyoshi Kobayashi"], "character": ["Fujiko Mine (voice)", "Arsene Lupin III (voice)", "Koichi Zenigata (voice)", "Oscar (voice)", "Daisuke Jigen (voice)"], "site_data": "html Apps Forums Leaderboard Contribute API Support Discover Movies TV Shows Movies Popular Top Rated Upcoming Now Playing TV Shows Popular Top Rated On TV Airing Today People Popular People Can't find a movie or TV show? Login to create it. en Login Sign Up  ID: 45860   Expand Lupin the Third: The Woman Called Fujiko Mine   (2012) User Score Overview An anime series based on Monkey Punch's Lupin III manga. It focuses on Fujiko Mine as she undergoes various missions and encounters the rest of the protagonists the first time. Featured Crew Monkey Punch Creator Discussions   Reviews Videos   Images   Changes Report Share Discussions General  0 Content Issues  2 Images Backdrops  2 Posters  2 Videos Trailers  0 Teasers  0 Clips  0 Featurettes  0 Opening Credits  0 Top Billed Cast Miyuki Sawashiro Fujiko Mine (voice) Kanichi Kurita Arsene Lupin III (voice) Kouichi Yamadera Koichi Zenigata (voice) Yuuki Kaji Oscar (voice) Kiyoshi Kobayashi Daisuke Jigen (voice) Full Cast & Crew Last Season Season 1 2012 | 13 Episodes Season 1 of Lupin the Third: The Woman Called Fujiko Mine premiered on April  4, 2012. View All Seasons Social Reviews  0 Discussions  2 Subject Status Replies Last Reply There are no discussions for Lupin the Third: The Woman Called Fujiko Mine. Login to be first! Go to Discussions Media Most Popular Videos  0 Backdrops  2 Posters  2 Recommendations We don't have enough data to suggest any TV shows based on Lupin the Third: The Woman Called Fujiko Mine. You can help by rating TV shows you've seen. Facts Original Name  LUPIN the Third \uff5e\u5cf0\u4e0d\u4e8c\u5b50\u3068\u3044\u3046\u5973\uff5e Status  Ended Network Certification  - Type  Scripted Original Language  Japanese Runtime  23m Homepage   http://www.ntv.co.jp/fujiko/index.html Genres Action & Adventure Animation Comedy Drama Keywords ecchi Content Score 93 Almost there... Top Contributors 17 Banana 14 Nuno Filipe de Vilhena Santos 8 SWFT CN 6 Carmelo Nicolosi  View Edit History Popularity Trend  Login to edit  URL By  signing up  for an account on TMDb, you can post directly to Twitter and Facebook. You need to be logged in to continue. Click  here  to login or  here  to sign up.    page_wrap opened in html_head  Join the Community The Basics About TMDb Contact Us Support Forums API Blog Get Involved  Contribution Bible 3rd Party Applications Add New Movie Add New TV Show Community Guidelines Leaderboard Forums Twitter Facebook Legal Terms of Use Privacy Policy Login Sign Up"}