{"link": "https://www.themoviedb.org/tv/4535?language=en", "title": "American Chopper", "resume": "Paul Teutul, Sr. and his son Paul Teutul, Jr. manufacture custom chopper-style motorcycles.", "rate": 62, "genre": ["Reality"], "cast": ["Paul Teutul, Jr.", "Paul Teutul, Sr.", "Michael Teutul"], "character": ["Mikey Teutul"], "site_data": "html Apps Forums Leaderboard Contribute API Support Discover Movies TV Shows Movies Popular Top Rated Upcoming Now Playing TV Shows Popular Top Rated On TV Airing Today People Popular People Can't find a movie or TV show? Login to create it. en Login Sign Up  ID: 4535   Expand American Chopper   (2003) User Score  Play Trailer Overview Paul Teutul, Sr. and his son Paul Teutul, Jr. manufacture custom chopper-style motorcycles. Discussions   Reviews Videos   Images   Changes Report Share Discussions General  0 Content Issues  3 Images Backdrops  10 Posters  2 Videos Trailers  1 Teasers  0 Clips  0 Featurettes  0 Opening Credits  0 Top Billed Cast Paul Teutul, Jr. Paul Teutul, Sr. Michael Teutul Mikey Teutul Full Cast & Crew Current Season Season 11 2018 | 6 Episodes View All Seasons Social Reviews  0 Discussions  3 Subject Status Replies Last Reply There are no discussions for American Chopper. Login to be first! Go to Discussions Media Most Popular Videos  1 Backdrops  10 Posters  2 Recommendations   2010-07-11 Drugs, Inc. 8.0    2007-11-01 Gangland 5.7    2003-11-13 Brainiac: Science Abuse 7.1    2005-04-12 Deadliest Catch 6.6    2005-10-28 I Shouldn't Be Alive 6.6    American Gladiators 5.9    2003-03-17 Punk'd 4.2    2003-12-03 Extreme Makeover: Home Edition 4.6  Facts Status  Returning Series Networks Certification  - Type  Reality Original Language  English Runtime  42m Homepage   https://www.discovery.com/tv-shows/american-chopper/ Genres Reality Keywords No keywords have been added. Content Score 64 We're so close, yet so far. Top Contributors g 11 gstock99 10 Banana 10 Elizabeth Jennings w 6 wesmat95  View Edit History Popularity Trend  Login to edit  URL By  signing up  for an account on TMDb, you can post directly to Twitter and Facebook. You need to be logged in to continue. Click  here  to login or  here  to sign up.    page_wrap opened in html_head  Join the Community The Basics About TMDb Contact Us Support Forums API Blog Get Involved  Contribution Bible 3rd Party Applications Add New Movie Add New TV Show Community Guidelines Leaderboard Forums Twitter Facebook Legal Terms of Use Privacy Policy Login Sign Up"}