{"link": "https://www.themoviedb.org/tv/46954?language=en", "title": "Pompidou", "resume": "In an old caravan parked in front of his crumbling estate lives Pompidou - a tubby, pompous, penniless, eccentric, yet lovable aristocrat. He is an elderly oddball who has fallen on hard times.", "rate": 30, "genre": ["Comedy"], "cast": ["Matt Lucas", "Alex MacQueen", "Andy Heath", "Yvonne Stone"], "character": ["Pompidou", "Hove", "Marion", "Actor"], "site_data": "html Apps Forums Leaderboard Contribute API Support Discover Movies TV Shows Movies Popular Top Rated Upcoming Now Playing TV Shows Popular Top Rated On TV Airing Today People Popular People Can't find a movie or TV show? Login to create it. en Login Sign Up  ID: 46954   Expand Pompidou   (2015) User Score Overview In an old caravan parked in front of his crumbling estate lives Pompidou - a tubby, pompous, penniless, eccentric, yet lovable aristocrat. He is an elderly oddball who has fallen on hard times. Featured Crew Matt Lucas Creator Julian Dutton Creator Ashley Blaker Creator Discussions   Reviews Videos   Images   Changes Report Share Discussions General  0 Content Issues  0 Images Backdrops  5 Posters  1 Videos Trailers  0 Teasers  0 Clips  0 Featurettes  0 Opening Credits  0 Top Billed Cast Matt Lucas Pompidou Alex MacQueen Hove Andy Heath Marion Yvonne Stone Actor Full Cast & Crew Last Season Season 1 2015 | 6 Episodes Season 1 of Pompidou premiered on March  1, 2015. View All Seasons Social Reviews  0 Discussions  0 Media Most Popular Videos  0 Backdrops  5 Posters  1 Recommendations We don't have enough data to suggest any TV shows based on Pompidou. You can help by rating TV shows you've seen. Facts Status  Ended Network Certification  - Type  Scripted Original Language  English Runtime  - Homepage   http://www.bbc.co.uk/programmes/b0552zxj Genres Comedy Keywords No keywords have been added. Content Score 93 Almost there... Top Contributors 21 Elizabeth Jennings 4 Maretoh b 3 babibu123  View Edit History Popularity Trend  Login to edit  URL By  signing up  for an account on TMDb, you can post directly to Twitter and Facebook. You need to be logged in to continue. Click  here  to login or  here  to sign up.    page_wrap opened in html_head  Join the Community The Basics About TMDb Contact Us Support Forums API Blog Get Involved  Contribution Bible 3rd Party Applications Add New Movie Add New TV Show Community Guidelines Leaderboard Forums Twitter Facebook Legal Terms of Use Privacy Policy Login Sign Up"}