{"link": "https://www.themoviedb.org/tv/72888?language=en", "title": "Ari Shaffir: Double Negative", "resume": "Wry yet thoughtful, comedian Ari Shaffir brings his edgy humor to two fast-paced stand-up specials about children and adulthood.", "rate": 65, "genre": ["Comedy"], "cast": ["Ari Shaffir"], "character": ["Himself"], "site_data": "html Apps Forums Leaderboard Contribute API Support Discover Movies TV Shows Movies Popular Top Rated Upcoming Now Playing TV Shows Popular Top Rated On TV Airing Today People Popular People Can't find a movie or TV show? Login to create it. en Login Sign Up  ID: 72888   Expand Ari Shaffir: Double Negative   (2017) User Score  Play Trailer Overview Wry yet thoughtful, comedian Ari Shaffir brings his edgy humor to two fast-paced stand-up specials about children and adulthood. Discussions   Reviews Videos   Images   Changes Report Share Discussions General  0 Content Issues  0 Images Backdrops  2 Posters  3 Videos Trailers  1 Teasers  0 Clips  0 Featurettes  0 Opening Credits  0 Top Billed Cast Ari Shaffir Himself Full Cast & Crew Last Season Season 1 2017 | 2 Episodes Season 1 of Ari Shaffir: Double Negative premiered on July 17, 2017. View All Seasons Social Reviews  0 Discussions  0 Media Most Popular Videos  1 Backdrops  2 Posters  3 Recommendations We don't have enough data to suggest any TV shows based on Ari Shaffir: Double Negative. You can help by rating TV shows you've seen. Facts Status  Ended Network Certification  - Type  Miniseries Original Language  English Runtime  - Homepage   https://www.netflix.com/title/80192842 Genres Comedy Keywords stand-up comedy miniseries Content Score 64 We're so close, yet so far. Top Contributors TB 9 TMDb Bot 7 clapton 7 Elizabeth Jennings 6 Banana  View Edit History Popularity Trend  Login to edit  URL By  signing up  for an account on TMDb, you can post directly to Twitter and Facebook. You need to be logged in to continue. Click  here  to login or  here  to sign up.    page_wrap opened in html_head  Join the Community The Basics About TMDb Contact Us Support Forums API Blog Get Involved  Contribution Bible 3rd Party Applications Add New Movie Add New TV Show Community Guidelines Leaderboard Forums Twitter Facebook Legal Terms of Use Privacy Policy Login Sign Up"}