{"link": "https://www.themoviedb.org/tv/71264?language=en", "title": "Bibik Bibikku", "resume": "Romantic comedy drama about Dr. Hanafi family living in the city and the ills of their maids who come from all over the country.", "rate": 0, "genre": ["Comedy", "Drama"], "cast": ["Syafi Danish", "Ungku Ismail Aziz", "Fasha Sandha", "Julia Ziegler", "Bell Ngasri"], "character": ["En Hanafi"], "site_data": "html Apps Forums Leaderboard Contribute API Support Discover Movies TV Shows Movies Popular Top Rated Upcoming Now Playing TV Shows Popular Top Rated On TV Airing Today People Popular People Can't find a movie or TV show? Login to create it. en Login Sign Up  ID: 71264   Expand Bibik Bibikku   (2016) User Score Overview Romantic comedy drama about Dr. Hanafi family living in the city and the ills of their maids who come from all over the country. Discussions   Reviews Videos   Images   Changes Report Share Discussions General  0 Content Issues  0 Images Backdrops  2 Posters  1 Videos Trailers  0 Teasers  0 Clips  0 Featurettes  0 Opening Credits  0 Top Billed Cast Syafi Danish Ungku Ismail Aziz En Hanafi Fasha Sandha Julia Ziegler Bell Ngasri Full Cast & Crew Last Season Season 1 2016 | 1 Episode Season 1 of Bibik Bibikku premiered on June  6, 2016. View All Seasons Social Reviews  0 Discussions  0 Media Most Popular Videos  0 Backdrops  2 Posters  1 Recommendations We don't have enough data to suggest any TV shows based on Bibik Bibikku. You can help by rating TV shows you've seen. Facts Status  Ended Network Certification  - Type  Scripted Original Language  Malay Runtime  - Homepage  - Genres Comedy Drama Keywords No keywords have been added. Content Score 86 Almost there... Top Contributors h 28 hyrol  View Edit History Popularity Trend  Login to edit  URL By  signing up  for an account on TMDb, you can post directly to Twitter and Facebook. You need to be logged in to continue. Click  here  to login or  here  to sign up.    page_wrap opened in html_head  Join the Community The Basics About TMDb Contact Us Support Forums API Blog Get Involved  Contribution Bible 3rd Party Applications Add New Movie Add New TV Show Community Guidelines Leaderboard Forums Twitter Facebook Legal Terms of Use Privacy Policy Login Sign Up"}