{"link": "https://www.themoviedb.org/tv/79339?language=en", "title": "Jeuk", "resume": "We don't have an overview translated in English. Help us expand our database by adding one.", "rate": 0, "genre": ["Comedy", "Family"], "cast": ["Thomas Acda", "Peter Heerschop", "Jelka van Houten", "Rosa Reuten", "Ellen Parren"], "character": ["Thomas", "Peter", "Jelka", "Rosa", "Ellen"], "site_data": "html Apps Forums Leaderboard Contribute API Support Discover Movies TV Shows Movies Popular Top Rated Upcoming Now Playing TV Shows Popular Top Rated On TV Airing Today People Popular People Can't find a movie or TV show? Login to create it. en Login Sign Up  ID: 79339   Expand Jeuk   (2014) User Score Overview We don't have an overview translated in English. Help us expand our database by adding one. Discussions   Reviews Videos   Images   Changes Report Share Discussions General  0 Content Issues  0 Images Backdrops  1 Posters  1 Videos Trailers  0 Teasers  0 Clips  0 Featurettes  0 Opening Credits  0 Top Billed Cast Thomas Acda Thomas Peter Heerschop Peter Jelka van Houten Jelka Rosa Reuten Rosa Ellen Parren Ellen Full Cast & Crew Current Season Season 5 2018 | 10 Episodes Season 5 of Jeuk premiered on March 18, 2018. View All Seasons Social Reviews  0 Discussions  0 Media Most Popular Videos  0 Backdrops  1 Posters  1 Recommendations We don't have enough data to suggest any TV shows based on Jeuk. You can help by rating TV shows you've seen. Facts Status  Returning Series Network Certification 16 Meaning Take care with children under 16. Type  Scripted Original Language  Dutch; Flemish Runtime  25m Homepage   https://programma.bnnvara.nl/jeuk Genres Comedy Family Keywords No keywords have been added. Content Score 79 Pump it up! We're close now. Top Contributors a 31 andre.meulemans  View Edit History Popularity Trend  Login to edit  URL By  signing up  for an account on TMDb, you can post directly to Twitter and Facebook. You need to be logged in to continue. Click  here  to login or  here  to sign up.    page_wrap opened in html_head  Join the Community The Basics About TMDb Contact Us Support Forums API Blog Get Involved  Contribution Bible 3rd Party Applications Add New Movie Add New TV Show Community Guidelines Leaderboard Forums Twitter Facebook Legal Terms of Use Privacy Policy Login Sign Up"}