{"link": "https://www.themoviedb.org/tv/33829?language=en", "title": "Him & Her", "resume": "An acutely observed, forensically honest, warts-and-all look at a working-class couple in their mid-20s.", "rate": 75, "genre": ["Comedy"], "cast": ["Russell Tovey", "Sarah Solemani", "Ralph Brown", "Joe Wilkinson", "Camille Coduri"], "character": ["Steve", "Becky", "Niguel", "Dan"], "site_data": "html Apps Forums Leaderboard Contribute API Support Discover Movies TV Shows Movies Popular Top Rated Upcoming Now Playing TV Shows Popular Top Rated On TV Airing Today People Popular People Can't find a movie or TV show? Login to create it. en Login Sign Up  ID: 33829   Expand Him & Her   (2010) User Score  Play Trailer Overview An acutely observed, forensically honest, warts-and-all look at a working-class couple in their mid-20s. Featured Crew Stefan Golaszewski Creator Discussions   Reviews Videos   Images   Changes Report Share Discussions General  0 Content Issues  0 Images Backdrops  2 Posters  2 Videos Trailers  1 Teasers  0 Clips  0 Featurettes  0 Opening Credits  0 Top Billed Cast Russell Tovey Steve Sarah Solemani Becky Ralph Brown Niguel Joe Wilkinson Dan Camille Coduri Full Cast & Crew Last Season Season 4 - The Wedding 2013 | 5 Episodes Season 4 of Him & Her premiered on November 21, 2013. View All Seasons Social Reviews  0 Discussions  0 Media Most Popular Videos  1 Backdrops  2 Posters  2 Recommendations   2012-02-23 Pramface 7.5    2013-05-12 Family Tree 6.2    2013-08-16 Big School 6.3    2014-08-07 Siblings 5.3    2016-05-09 Upstart Crow 7.4    2012-08-14 Bad Education 7.5    2007-05-13 Gavin & Stacey 7.6    2011-11-10 Life's Too Short 7.1  Facts Status  Ended Network Certification  - Type  Scripted Original Language  English Runtime  30m Homepage   http://www.him-and-her.com/ Genres Comedy Keywords No keywords have been added. Content Score 100 Yes! Looking good! Top Contributors 11 kcdh 7 Rafael Esberard 6 Banana p 2 payne  View Edit History Popularity Trend  Login to edit  URL By  signing up  for an account on TMDb, you can post directly to Twitter and Facebook. You need to be logged in to continue. Click  here  to login or  here  to sign up.    page_wrap opened in html_head  Join the Community The Basics About TMDb Contact Us Support Forums API Blog Get Involved  Contribution Bible 3rd Party Applications Add New Movie Add New TV Show Community Guidelines Leaderboard Forums Twitter Facebook Legal Terms of Use Privacy Policy Login Sign Up"}