{"link": "https://www.themoviedb.org/tv/77321?language=en", "title": "Nothing fixed", "resume": "4 post pubertals are searching there place in life at Berlin", "rate": 0, "genre": ["Comedy"], "cast": ["Marie Rathscheck", "Sebastian Fr\u00e4sdorf", "Josefine Preu\u00df", "Tim Kalkhoff", "Dirk Martens"], "character": ["Jenny Reimann", "Jonas Renner", "Wiebke Busch", "Basti H\u00fclz", "Lennart Heusser"], "site_data": "html Apps Forums Leaderboard Contribute API Support Discover Movies TV Shows Movies Popular Top Rated Upcoming Now Playing TV Shows Popular Top Rated On TV Airing Today People Popular People Can't find a movie or TV show? Login to create it. en Login Sign Up  ID: 77321   Expand Nothing fixed   (2018) User Score Overview 4 post pubertals are searching there place in life at Berlin Discussions   Reviews Videos   Images   Changes Report Share Discussions General  0 Content Issues  0 Images Backdrops  1 Posters  1 Videos Trailers  0 Teasers  0 Clips  0 Featurettes  0 Opening Credits  0 Top Billed Cast Marie Rathscheck Jenny Reimann Sebastian Fr\u00e4sdorf Jonas Renner Josefine Preu\u00df Wiebke Busch Tim Kalkhoff Basti H\u00fclz Dirk Martens Lennart Heusser Full Cast & Crew Current Season Season 1 2018 | 4 Episodes Season 1 of Nothing fixed premiered on February 27, 2018. View All Seasons Social Reviews  0 Discussions  0 Media Most Popular Videos  0 Backdrops  1 Posters  1 Recommendations We don't have enough data to suggest any TV shows based on Nothing fixed. You can help by rating TV shows you've seen. Facts Original Name  Nix Festes Status  Returning Series Networks Certification  - Type  Scripted Original Language  German Runtime  30m Homepage   https://www.zdf.de/serien/nix-festes Genres Comedy Keywords sitcom Content Score 93 Almost there... Top Contributors 33 mojodo o 6 otherMichi S 1 Samara TB 1 TMDb Bot  View Edit History Popularity Trend  Login to edit  URL By  signing up  for an account on TMDb, you can post directly to Twitter and Facebook. You need to be logged in to continue. Click  here  to login or  here  to sign up.    page_wrap opened in html_head  Join the Community The Basics About TMDb Contact Us Support Forums API Blog Get Involved  Contribution Bible 3rd Party Applications Add New Movie Add New TV Show Community Guidelines Leaderboard Forums Twitter Facebook Legal Terms of Use Privacy Policy Login Sign Up"}