{"link": "https://www.themoviedb.org/tv/67537?language=en", "title": "'t Schaep Ahoy", "resume": "Kootje won a cruise on the Rhine and takes Door with him on vacation.", "rate": null, "genre": ["Comedy"], "cast": ["Pierre Bokma", "Loes Luca", "Marc-Marie Huijbregts", "Georgina Verbaan", "Ton Kas"], "site_data": "html Apps Forums Leaderboard Contribute API Support Discover Movies TV Shows Movies Popular Top Rated Upcoming Now Playing TV Shows Popular Top Rated On TV Airing Today People Popular People Can't find a movie or TV show? Login to create it. en Login Sign Up  ID: 67537   Expand 't Schaep Ahoy   (2015) User Score Overview Kootje won a cruise on the Rhine and takes Door with him on vacation. Discussions   Reviews Videos   Images   Changes Report Share Discussions General  0 Content Issues  0 Images Backdrops  1 Posters  1 Videos Trailers  0 Teasers  0 Clips  0 Featurettes  0 Opening Credits  0 Top Billed Cast Pierre Bokma Kootje de Beer Loes Luca Doortje Lef\u00e8vre Marc-Marie Huijbregts Lukas Blijdtschap Georgina Verbaan Lena Braams Ton Kas Arie Balk Full Cast & Crew Last Season Season 1 2015 | 8 Episodes Season 1 of 't Schaep Ahoy premiered on March 14, 2015. View All Seasons Social Reviews  0 Discussions  0 Media Most Popular Videos  0 Backdrops  1 Posters  1 Recommendations We don't have enough data to suggest any TV shows based on 't Schaep Ahoy. You can help by rating TV shows you've seen. Facts Status  Ended Network Certification  - Type  Scripted Original Language  Dutch; Flemish Runtime  40m Homepage  - Genres Comedy Keywords captain heart attack cruise netherlands musical rhine cruise ship Content Score 86 Almost there... Top Contributors v 36 veboli a 5 andre.meulemans  View Edit History Popularity Trend  Login to edit  URL By  signing up  for an account on TMDb, you can post directly to Twitter and Facebook. You need to be logged in to continue. Click  here  to login or  here  to sign up.    page_wrap opened in html_head  Join the Community The Basics About TMDb Contact Us Support Forums API Blog Get Involved  Contribution Bible 3rd Party Applications Add New Movie Add New TV Show Community Guidelines Leaderboard Forums Twitter Facebook Legal Terms of Use Privacy Policy Login Sign Up", "character": ["Kootje de Beer", "Doortje Lef\u00e8vre", "Lukas Blijdtschap", "Lena Braams", "Arie Balk"]}