{"link": "https://www.themoviedb.org/tv/70824?language=en", "title": "La Ni\u00f1a", "resume": "We don't have an overview translated in English. Help us expand our database by adding one.", "rate": 85, "genre": ["Documentary", "Drama", "Action", "Adventure"], "cast": ["Variel Sanchez", "Ana Mar\u00eda Estupi\u00f1\u00e1n", "Sebastian Eslava", "Marcela Benjumea", "Juan Sebasti\u00e1n Arag\u00f3n"], "character": ["Victor Manjarres", "La Ni\u00f1a", "Manuel Monsalve", "Mireya Pinzon", "Coronel Javier Alzate"], "site_data": "html Apps Forums Leaderboard Contribute API Support Discover Movies TV Shows Movies Popular Top Rated Upcoming Now Playing TV Shows Popular Top Rated On TV Airing Today People Popular People Can't find a movie or TV show? Login to create it. en Login Sign Up  ID: 70824   Expand La Ni\u00f1a   (2016) User Score Overview We don't have an overview translated in English. Help us expand our database by adding one. Featured Crew Clara Mar\u00eda Ochoa Creator Discussions   Reviews Videos   Images   Changes Report Share Discussions General  0 Content Issues  0 Images Backdrops  3 Posters  1 Videos Trailers  0 Teasers  0 Clips  0 Featurettes  0 Opening Credits  0 Top Billed Cast Variel Sanchez Victor Manjarres Ana Mar\u00eda Estupi\u00f1\u00e1n La Ni\u00f1a Sebastian Eslava Manuel Monsalve Marcela Benjumea Mireya Pinzon Juan Sebasti\u00e1n Arag\u00f3n Coronel Javier Alzate Full Cast & Crew Last Season Season 1 2016 | 86 Episodes Season 1 of La Ni\u00f1a premiered on April 26, 2016. View All Seasons Social Reviews  0 Discussions  0 Media Most Popular Videos  0 Backdrops  3 Posters  1 Recommendations We don't have enough data to suggest any TV shows based on La Ni\u00f1a. You can help by rating TV shows you've seen. Facts Status  Ended Network Certification  - Type  Scripted Original Language  Spanish; Castilian Runtime  - Homepage  - Genres Documentary Drama Action & Adventure Keywords No keywords have been added. Content Score 86 Almost there... Top Contributors DM 33 Daisy Medina 1 Sebastian Mares  View Edit History Popularity Trend  Login to edit  URL By  signing up  for an account on TMDb, you can post directly to Twitter and Facebook. You need to be logged in to continue. Click  here  to login or  here  to sign up.    page_wrap opened in html_head  Join the Community The Basics About TMDb Contact Us Support Forums API Blog Get Involved  Contribution Bible 3rd Party Applications Add New Movie Add New TV Show Community Guidelines Leaderboard Forums Twitter Facebook Legal Terms of Use Privacy Policy Login Sign Up"}