{"link": "https://www.themoviedb.org/tv/68230?language=en", "title": "Dream the Future", "resume": "What will the future look like? How will new discoveries and research impact our everyday lives in 2050?", "rate": null, "genre": ["Documentary"], "cast": ["Sigourney Weaver"], "site_data": "html Apps Forums Leaderboard Contribute API Support Discover Movies TV Shows Movies Popular Top Rated Upcoming Now Playing TV Shows Popular Top Rated On TV Airing Today People Popular People Can't find a movie or TV show? Login to create it. en Login Sign Up  ID: 68230   Expand Dream the Future   (2016) User Score Overview What will the future look like? How will new discoveries and research impact our everyday lives in 2050? Discussions   Reviews Videos   Images   Changes Report Share Discussions General  0 Content Issues  0 Images Backdrops  2 Posters  2 Videos Trailers  0 Teasers  0 Clips  0 Featurettes  0 Opening Credits  0 Top Billed Cast Sigourney Weaver Narrator Full Cast & Crew Current Season Season 2 2018 | 10 Episodes View All Seasons Social Reviews  0 Discussions  0 Media Most Popular Videos  0 Backdrops  2 Posters  2 Recommendations We don't have enough data to suggest any TV shows based on Dream the Future. You can help by rating TV shows you've seen. Facts Status  Returning Series Networks - Certification  - Type  Scripted Original Language  English Runtime  - Homepage  - Genres Documentary Keywords No keywords have been added. Content Score 56 We're so close, yet so far. Top Contributors t 14 theusedversion m 8 mondauge74 a 5 arcaida T 3 Torrentin  View Edit History Popularity Trend  Login to edit  URL By  signing up  for an account on TMDb, you can post directly to Twitter and Facebook. You need to be logged in to continue. Click  here  to login or  here  to sign up.    page_wrap opened in html_head  Join the Community The Basics About TMDb Contact Us Support Forums API Blog Get Involved  Contribution Bible 3rd Party Applications Add New Movie Add New TV Show Community Guidelines Leaderboard Forums Twitter Facebook Legal Terms of Use Privacy Policy Login Sign Up", "character": ["Narrator"]}