{"link": "https://www.themoviedb.org/tv/43455?language=en", "title": "Moana", "resume": "Moana is a 2009 Italian biographical dramatic miniseries directed by Alfredo Peyretti about the life and death of Italian adult movie star Moana Pozzi.", "rate": 60, "genre": ["Drama"], "cast": ["Violante Placido", "Fausto Paravidino", "Gaetano Amato", "Michele Venitucci", "Giorgia Wurth"], "character": ["Moana", "Riccardo Schicchi", "Pasquale", "Antonio Di Ciesco", "Ilona Staller"], "site_data": "html Apps Forums Leaderboard Contribute API Support Discover Movies TV Shows Movies Popular Top Rated Upcoming Now Playing TV Shows Popular Top Rated On TV Airing Today People Popular People Can't find a movie or TV show? Login to create it. en Login Sign Up  ID: 43455   Expand Moana   (2009) User Score Overview Moana is a 2009 Italian biographical dramatic miniseries directed by Alfredo Peyretti about the life and death of Italian adult movie star Moana Pozzi. Discussions   Reviews Videos   Images   Changes Report Share Discussions General  0 Content Issues  0 Images Backdrops  2 Posters  1 Videos Trailers  0 Teasers  0 Clips  0 Featurettes  0 Opening Credits  0 Top Billed Cast Violante Placido Moana Fausto Paravidino Riccardo Schicchi Gaetano Amato Pasquale Michele Venitucci Antonio Di Ciesco Giorgia Wurth Ilona Staller Full Cast & Crew Last Season Season 1 2009 | 2 Episodes Season 1 of Moana premiered on December  1, 2009. View All Seasons Social Reviews  0 Discussions  0 Media Most Popular Videos  0 Backdrops  2 Posters  1 Recommendations We don't have enough data to suggest any TV shows based on Moana. You can help by rating TV shows you've seen. Facts Status  Ended Network Certification  - Type  Scripted Original Language  Italian Runtime  - Homepage  - Genres Drama Keywords pornography beach sex porn industry porn actress police raid porno filmmaking Content Score 86 Almost there... Top Contributors 57 Sven-Erik Andersen 10 lineker m 6 magico77  View Edit History Popularity Trend  Login to edit  URL By  signing up  for an account on TMDb, you can post directly to Twitter and Facebook. You need to be logged in to continue. Click  here  to login or  here  to sign up.    page_wrap opened in html_head  Join the Community The Basics About TMDb Contact Us Support Forums API Blog Get Involved  Contribution Bible 3rd Party Applications Add New Movie Add New TV Show Community Guidelines Leaderboard Forums Twitter Facebook Legal Terms of Use Privacy Policy Login Sign Up"}