{"link": "https://www.themoviedb.org/tv/76282?language=en", "title": "Vzteklina", "resume": "We don't have an overview translated in English. Help us expand our database by adding one.", "rate": 70, "genre": ["Drama", "Crime", "Mystery"], "cast": ["Kry\u0161tof H\u00e1dek", "Ihor Krotovych", "P\u0159emysl Bure\u0161", "\u0160tefan Capko", "Johana Matou\u0161kov\u00e1"], "character": ["Pavel Rogl", "Paddy Pudil", "Karel Pape\u017e", "Poru\u010d\u00edk Bro\u017e", "Gabriela Bure\u0161ov\u00e1"], "site_data": "html Apps Forums Leaderboard Contribute API Support Discover Movies TV Shows Movies Popular Top Rated Upcoming Now Playing TV Shows Popular Top Rated On TV Airing Today People Popular People Can't find a movie or TV show? Login to create it. en Login Sign Up  ID: 76282   Expand Vzteklina   (2018) User Score Overview We don't have an overview translated in English. Help us expand our database by adding one. Discussions   Reviews Videos   Images   Changes Report Share Discussions General  0 Content Issues  0 Images Backdrops  1 Posters  3 Videos Trailers  0 Teasers  0 Clips  0 Featurettes  0 Opening Credits  0 Top Billed Cast Kry\u0161tof H\u00e1dek Pavel Rogl Ihor Krotovych Paddy Pudil P\u0159emysl Bure\u0161 Karel Pape\u017e \u0160tefan Capko Poru\u010d\u00edk Bro\u017e Johana Matou\u0161kov\u00e1 Gabriela Bure\u0161ov\u00e1 Full Cast & Crew Current Season Season 1 2018 | 6 Episodes Season 1 of Vzteklina premiered on January  1, 2018. View All Seasons Social Reviews  0 Discussions  0 Media Most Popular Videos  0 Backdrops  1 Posters  3 Recommendations We don't have enough data to suggest any TV shows based on Vzteklina. You can help by rating TV shows you've seen. Facts Status  Returning Series Network Certification  - Type  Scripted Original Language  Czech Runtime  57m Homepage   http://www.ceskatelevize.cz/porady/11066789428-vzteklina/ Genres Drama Crime Mystery Keywords crime investigation Content Score 79 Pump it up! We're close now. Top Contributors b 45 baluator S 5 ShareRapid 5 3 5lucina5 m 3 miro22  View Edit History Popularity Trend  Login to edit  URL By  signing up  for an account on TMDb, you can post directly to Twitter and Facebook. You need to be logged in to continue. Click  here  to login or  here  to sign up.    page_wrap opened in html_head  Join the Community The Basics About TMDb Contact Us Support Forums API Blog Get Involved  Contribution Bible 3rd Party Applications Add New Movie Add New TV Show Community Guidelines Leaderboard Forums Twitter Facebook Legal Terms of Use Privacy Policy Login Sign Up"}