{"link": "https://www.themoviedb.org/tv/66630?language=en", "title": "Oppassen!!!", "resume": "Sitcom about two grandfathers taking care of their grandchildren, so their children can focus on their careers.", "rate": 75, "genre": ["Comedy"], "cast": ["Coen Flink", "Ben Hulsman", "Annette Barlo", "Matijs Jansen", "Hans Hoes"], "character": ["Henry Buys", "Willem Bol", "Anna Bol", "Richard \"Rick\" Bol", "Victor Bol"], "site_data": "html Apps Forums Leaderboard Contribute API Support Discover Movies TV Shows Movies Popular Top Rated Upcoming Now Playing TV Shows Popular Top Rated On TV Airing Today People Popular People Can't find a movie or TV show? Login to create it. en Login Sign Up  ID: 66630   Expand Oppassen!!!   (1991) User Score Overview Sitcom about two grandfathers taking care of their grandchildren, so their children can focus on their careers. Discussions   Reviews Videos   Images   Changes Report Share Discussions General  0 Content Issues  0 Images Backdrops  1 Posters  2 Videos Trailers  0 Teasers  0 Clips  0 Featurettes  0 Opening Credits  1 Top Billed Cast Coen Flink Henry Buys Ben Hulsman Willem Bol Annette Barlo Anna Bol Matijs Jansen Richard \"Rick\" Bol Hans Hoes Victor Bol Full Cast & Crew Last Season Season 1 1991 | 13 Episodes Season 1 of Oppassen!!! premiered on March  9, 1991. View All Seasons Social Reviews  0 Discussions  0 Media Most Popular Videos  1 Backdrops  1 Posters  2 Recommendations We don't have enough data to suggest any TV shows based on Oppassen!!!. You can help by rating TV shows you've seen. Facts Status  Ended Networks Certification  - Type  Scripted Original Language  Dutch; Flemish Runtime  20m Homepage   http://biografie.vara.nl/#/programma/11/oppassen Genres Comedy Keywords grandchildren family relationships grandparents sitcom Content Score 93 Almost there... Top Contributors 62 Marr \ud83c\uddf3\ud83c\uddf1 5 Elizabeth Jennings TB 3 TMDb Bot m 1 mis3v  View Edit History Popularity Trend  Login to edit  URL By  signing up  for an account on TMDb, you can post directly to Twitter and Facebook. You need to be logged in to continue. Click  here  to login or  here  to sign up.    page_wrap opened in html_head  Join the Community The Basics About TMDb Contact Us Support Forums API Blog Get Involved  Contribution Bible 3rd Party Applications Add New Movie Add New TV Show Community Guidelines Leaderboard Forums Twitter Facebook Legal Terms of Use Privacy Policy Login Sign Up"}