{"link": "https://www.themoviedb.org/tv/21897?language=en", "title": "Green Green", "resume": "We don't have an overview translated in English. Help us expand our database by adding one.", "rate": 0, "genre": ["Animation", "Comedy"], "cast": ["Hiroshi Kamiya", "Kana Ueda", "Jin Domon", "Sara Nakayama", "Eriko Fujimaki"], "character": ["Socho Hotta"], "site_data": "html Apps Forums Leaderboard Contribute API Support Discover Movies TV Shows Movies Popular Top Rated Upcoming Now Playing TV Shows Popular Top Rated On TV Airing Today People Popular People Can't find a movie or TV show? Login to create it. en Login Sign Up  ID: 21897   Expand Green Green   (2003) User Score Overview We don't have an overview translated in English. Help us expand our database by adding one. Featured Crew Mutou Yuuji Creator Discussions   Reviews Videos   Images   Changes Report Share Discussions General  0 Content Issues  0 Images Backdrops  4 Posters  7 Videos Trailers  0 Teasers  0 Clips  0 Featurettes  0 Opening Credits  0 Top Billed Cast Hiroshi Kamiya Socho Hotta Kana Ueda Jin Domon Sara Nakayama Eriko Fujimaki Full Cast & Crew Last Season Season 1 2003 | 12 Episodes Season 1 of Green Green premiered on July 13, 2003. View All Seasons Social Reviews  0 Discussions  0 Media Most Popular Videos  0 Backdrops  4 Posters  7 Recommendations We don't have enough data to suggest any TV shows based on Green Green. You can help by rating TV shows you've seen. Facts Original Name  \u30b0\u30ea\u30fc\u30f3\u30b0\u30ea\u30fc\u30f3 Status  Ended Network Certification  - Type  Scripted Original Language  Japanese Runtime  25m Homepage   http://www.ponycanyon.co.jp/greengreen/ Genres Animation Comedy Keywords No keywords have been added. Content Score 86 Almost there... Top Contributors 7 seboseboss 7 Sergiojamon 5 Banana m 4 magoozin  View Edit History Popularity Trend  Login to edit  URL By  signing up  for an account on TMDb, you can post directly to Twitter and Facebook. You need to be logged in to continue. Click  here  to login or  here  to sign up.    page_wrap opened in html_head  Join the Community The Basics About TMDb Contact Us Support Forums API Blog Get Involved  Contribution Bible 3rd Party Applications Add New Movie Add New TV Show Community Guidelines Leaderboard Forums Twitter Facebook Legal Terms of Use Privacy Policy Login Sign Up"}