{"link": "https://www.themoviedb.org/tv/64393?language=en", "title": "Donny!", "resume": "A satirical look at media, wealth and modern romance through the eyes of a fictionalized character based on real-life famed ad man, single dad, and TV personality Donny Deutsch.", "rate": 68, "genre": ["Comedy"], "cast": ["Donny Deutsch", "Emily Tarver", "Hailey Giles", "Shannon O'Neill", "Jessica Renee Russell"], "character": ["Donny Deutsch", "Pam", "Jackie", "Stage Manager", "Violet"], "site_data": "html Apps Forums Leaderboard Contribute API Support Discover Movies TV Shows Movies Popular Top Rated Upcoming Now Playing TV Shows Popular Top Rated On TV Airing Today People Popular People Can't find a movie or TV show? Login to create it. en Login Sign Up  ID: 64393   Expand Donny!   (2015) User Score  Play Trailer Overview A satirical look at media, wealth and modern romance through the eyes of a fictionalized character based on real-life famed ad man, single dad, and TV personality Donny Deutsch. Featured Crew Angie Day Creator Donny Deutsch Creator Discussions   Reviews Videos   Images   Changes Report Share Discussions General  0 Content Issues  0 Images Backdrops  2 Posters  1 Videos Trailers  1 Teasers  0 Clips  0 Featurettes  0 Opening Credits  0 Top Billed Cast Donny Deutsch Donny Deutsch Emily Tarver Pam Hailey Giles Jackie Shannon O'Neill Stage Manager Jessica Renee Russell Violet Full Cast & Crew Last Season Season 1 2015 | 6 Episodes Season 1 of Donny! premiered on November 10, 2015. View All Seasons Social Reviews  0 Discussions  0 Media Most Popular Videos  1 Backdrops  2 Posters  1 Recommendations We don't have enough data to suggest any TV shows based on Donny!. You can help by rating TV shows you've seen. Facts Status  Returning Series Network Certification TV-14 Meaning This program contains some material that many parents would find unsuitable for children under 14 years of age. Type  Scripted Original Language  English Runtime  30m Homepage   http://www.usanetwork.com/donny/ Genres Comedy Keywords No keywords have been added. Content Score 100 Yes! Looking good! Top Contributors 16 Bobel z 15 zurman1 9 senckyz z 4 zyck  View Edit History Popularity Trend  Login to edit  URL By  signing up  for an account on TMDb, you can post directly to Twitter and Facebook. You need to be logged in to continue. Click  here  to login or  here  to sign up.    page_wrap opened in html_head  Join the Community The Basics About TMDb Contact Us Support Forums API Blog Get Involved  Contribution Bible 3rd Party Applications Add New Movie Add New TV Show Community Guidelines Leaderboard Forums Twitter Facebook Legal Terms of Use Privacy Policy Login Sign Up"}