{"link": "https://www.themoviedb.org/tv/61793?language=en", "title": "Polic\u00edas, en el coraz\u00f3n de la calle", "resume": "We don't have an overview translated in English. Help us expand our database by adding one.", "rate": 0, "genre": ["Action", "Adventure", "Crime", "Drama"], "cast": ["Adolfo Fern\u00e1ndez", "Josep Maria Pou", "Diego Mart\u00edn", "Laura Pamplona", "Pedro Casablanc"], "character": ["Carlos G\u00e1ndara", "H\u00e9ctor Ferrer", "Jaime Castro", "Marina Blasco", "Arturo Klimov 'El Ruso'"], "site_data": "html Apps Forums Leaderboard Contribute API Support Discover Movies TV Shows Movies Popular Top Rated Upcoming Now Playing TV Shows Popular Top Rated On TV Airing Today People Popular People Can't find a movie or TV show? Login to create it. en Login Sign Up  ID: 61793   Expand Polic\u00edas, en el coraz\u00f3n de la calle   (2000) User Score Overview We don't have an overview translated in English. Help us expand our database by adding one. Featured Crew Chus Vallejo Creator Nacho Cabana Creator Manuel Valdivia Creator Discussions   Reviews Videos   Images   Changes Report Share Discussions General  0 Content Issues  0 Images Backdrops  0 Posters  1 Videos Trailers  0 Teasers  0 Clips  0 Featurettes  0 Opening Credits  0 Top Billed Cast Adolfo Fern\u00e1ndez Carlos G\u00e1ndara Josep Maria Pou H\u00e9ctor Ferrer Diego Mart\u00edn Jaime Castro Laura Pamplona Marina Blasco Pedro Casablanc Arturo Klimov 'El Ruso' Full Cast & Crew Last Season Season 6 2002 | 14 Episodes Season 6 of Polic\u00edas, en el coraz\u00f3n de la calle premiered on September 18, 2002. View All Seasons Social Reviews  0 Discussions  0 Media Most Popular Videos  0 Backdrops  0 Posters  1 Recommendations We don't have enough data to suggest any TV shows based on Polic\u00edas, en el coraz\u00f3n de la calle. You can help by rating TV shows you've seen. Facts Status  Ended Network Certification  - Type  Scripted Original Language  Spanish; Castilian Runtime  60m Homepage  - Genres Action & Adventure Crime Drama Keywords police madrid police station paramedic Content Score 71 Just a little bit more... Top Contributors JR 60 Johnny Rotring CM 12 Cherche Moi N 6 NoemiTalavera l 3 lucybenson  View Edit History Popularity Trend  Login to edit  URL By  signing up  for an account on TMDb, you can post directly to Twitter and Facebook. You need to be logged in to continue. Click  here  to login or  here  to sign up.    page_wrap opened in html_head  Join the Community The Basics About TMDb Contact Us Support Forums API Blog Get Involved  Contribution Bible 3rd Party Applications Add New Movie Add New TV Show Community Guidelines Leaderboard Forums Twitter Facebook Legal Terms of Use Privacy Policy Login Sign Up"}