{"link": "https://www.themoviedb.org/tv/13444?language=en", "title": "Reasonable Doubts", "resume": "Reasonable Doubts is a police drama broadcast in the United States by NBC that ran from 1991 to 1993.", "rate": 70, "genre": ["Drama"], "cast": ["Marlee Matlin", "Mark Harmon", "Nancy Everhard", "John Mese", "Leslie Jordan"], "character": ["Asst. Dist. Atty.Tess Kaufman"], "site_data": "html Apps Forums Leaderboard Contribute API Support Discover Movies TV Shows Movies Popular Top Rated Upcoming Now Playing TV Shows Popular Top Rated On TV Airing Today People Popular People Can't find a movie or TV show? Login to create it. en Login Sign Up  ID: 13444   Expand Reasonable Doubts   (1991) User Score Overview Reasonable Doubts is a police drama broadcast in the United States by NBC that ran from 1991 to 1993. Featured Crew Robert Singer Creator Discussions   Reviews Videos   Images   Changes Report Share Discussions General  0 Content Issues  0 Images Backdrops  0 Posters  2 Videos Trailers  0 Teasers  0 Clips  0 Featurettes  0 Opening Credits  0 Top Billed Cast Marlee Matlin Asst. Dist. Atty.Tess Kaufman Mark Harmon Nancy Everhard John Mese Leslie Jordan Full Cast & Crew Last Season Season 2 1992 | 23 Episodes Season 2 of Reasonable Doubts premiered on September 29, 1992. View All Seasons Social Reviews  0 Discussions  0 Media Most Popular Videos  0 Backdrops  0 Posters  2 Recommendations We don't have enough data to suggest any TV shows based on Reasonable Doubts. You can help by rating TV shows you've seen. Facts Status  Ended Network Certification  - Type  Scripted Original Language  English Runtime  60m Homepage  - Genres Drama Keywords police police detective district attorney deaf disabled Content Score 79 Pump it up! We're close now. Top Contributors 13 Banana  View Edit History Popularity Trend  Login to edit  URL By  signing up  for an account on TMDb, you can post directly to Twitter and Facebook. You need to be logged in to continue. Click  here  to login or  here  to sign up.    page_wrap opened in html_head  Join the Community The Basics About TMDb Contact Us Support Forums API Blog Get Involved  Contribution Bible 3rd Party Applications Add New Movie Add New TV Show Community Guidelines Leaderboard Forums Twitter Facebook Legal Terms of Use Privacy Policy Login Sign Up"}