{"link": "https://www.themoviedb.org/tv/76144?language=en", "title": "Sudamerican Rockers", "resume": "Three teens start a band in the late 1970s, this is the beginning of the famous musical group; Los Prisioneros.", "rate": 80, "genre": ["Comedy", "Drama"], "cast": ["Michael Silva", "Eduardo Fern\u00e1ndez", "Diego Boggioni", "Juana Viale", "Diego Noguera"], "character": ["Jorge Gonzalez", "Miguel Tapia", "Claudio Narea", "Celeste", "Fe\u00f1a"], "site_data": "html Apps Forums Leaderboard Contribute API Support Discover Movies TV Shows Movies Popular Top Rated Upcoming Now Playing TV Shows Popular Top Rated On TV Airing Today People Popular People Can't find a movie or TV show? Login to create it. en Login Sign Up  ID: 76144   Expand Sudamerican Rockers   (2014) User Score Overview Three teens start a band in the late 1970s, this is the beginning of the famous musical group; Los Prisioneros. Featured Crew Jordi Bachs Creator Discussions   Reviews Videos   Images   Changes Report Share Discussions General  0 Content Issues  0 Images Backdrops  2 Posters  1 Videos Trailers  0 Teasers  0 Clips  0 Featurettes  0 Opening Credits  1 Top Billed Cast Michael Silva Jorge Gonzalez Eduardo Fern\u00e1ndez Miguel Tapia Diego Boggioni Claudio Narea Juana Viale Celeste Diego Noguera Fe\u00f1a Full Cast & Crew Last Season Season 2 2014 | 6 Episodes Season 2 of Sudamerican Rockers premiered on November 12, 2014. View All Seasons Social Reviews  0 Discussions  0 Media Most Popular Videos  1 Backdrops  2 Posters  1 Recommendations We don't have enough data to suggest any TV shows based on Sudamerican Rockers. You can help by rating TV shows you've seen. Facts Status  Ended Network Certification TV-MA Meaning This program is specifically designed to be viewed by adults and therefore may be unsuitable for children under 17 Type  Scripted Original Language  Spanish; Castilian Runtime  50m, 55m Homepage   http://www.chilevision.cl/sudamerican_rockers_la_serie/ Genres Comedy Drama Keywords band semi-biographical Content Score 100 Yes! Looking good! Top Contributors 117 Mikedeth5 TB 2 TMDb Bot  View Edit History Popularity Trend  Login to edit  URL By  signing up  for an account on TMDb, you can post directly to Twitter and Facebook. You need to be logged in to continue. Click  here  to login or  here  to sign up.    page_wrap opened in html_head  Join the Community The Basics About TMDb Contact Us Support Forums API Blog Get Involved  Contribution Bible 3rd Party Applications Add New Movie Add New TV Show Community Guidelines Leaderboard Forums Twitter Facebook Legal Terms of Use Privacy Policy Login Sign Up"}