{"link": "https://www.themoviedb.org/tv/73549?language=en", "title": "Odd Squad", "resume": "We don't have an overview translated in English. Help us expand our database by adding one.", "rate": 90, "genre": ["Comedy", "Crime", "Family"], "cast": ["Millie Davis", "Sean Michael Kyer", "Dalila Bela", "Filip Geljo", "Christian Distefano"], "character": ["Ms. O", "Agent Oscar", "Agent Olive", "Agent Otto", "Owen"], "site_data": "html Apps Forums Leaderboard Contribute API Support Discover Movies TV Shows Movies Popular Top Rated Upcoming Now Playing TV Shows Popular Top Rated On TV Airing Today People Popular People Can't find a movie or TV show? Login to create it. en Login Sign Up  ID: 73549   Expand Odd Squad   (2014) User Score  Play Trailer Overview We don't have an overview translated in English. Help us expand our database by adding one. Discussions   Reviews Videos   Images   Changes Report Share Discussions General  0 Content Issues  0 Images Backdrops  0 Posters  1 Videos Trailers  1 Teasers  0 Clips  0 Featurettes  0 Opening Credits  0 Top Billed Cast Millie Davis Ms. O Sean Michael Kyer Agent Oscar Dalila Bela Agent Olive Filip Geljo Agent Otto Christian Distefano Owen Full Cast & Crew Last Season Season 2 2016 | 21 Episodes Season 2 of Odd Squad premiered on June 21, 2016. View All Seasons Social Reviews  0 Discussions  0 Media Most Popular Videos  1 Backdrops  0 Posters  1 Recommendations We don't have enough data to suggest any TV shows based on Odd Squad. You can help by rating TV shows you've seen. Facts Status  Returning Series Networks - Certification  - Type  Scripted Original Language  English Runtime  30m Homepage  - Genres Comedy Crime Family Keywords No keywords have been added. Content Score 71 Just a little bit more... Top Contributors 10 tigru89 g 7 goatkoa 4 clapton 2 DarkMan  View Edit History Popularity Trend  Login to edit  URL By  signing up  for an account on TMDb, you can post directly to Twitter and Facebook. You need to be logged in to continue. Click  here  to login or  here  to sign up.    page_wrap opened in html_head  Join the Community The Basics About TMDb Contact Us Support Forums API Blog Get Involved  Contribution Bible 3rd Party Applications Add New Movie Add New TV Show Community Guidelines Leaderboard Forums Twitter Facebook Legal Terms of Use Privacy Policy Login Sign Up"}