{"link": "https://www.themoviedb.org/tv/65846?language=en", "title": "Babysitter", "resume": "An attractive babysitter, who graduated from a prestigious university, begins to work as a babysitter for 3 children from a wealthy couple. The attractive babysitter begins to change.", "rate": 70, "genre": ["Mystery", "Drama"], "cast": ["Shin Yoon-Joo", "Kim Min-joon", "Jo Yeo-jeong", "Lee Seung-joon", "Yoon Ye Joo"], "character": ["Jang Suk-Ryoo", "Lee Sang-Won", "Chun Eun-Joo"], "site_data": "html Apps Forums Leaderboard Contribute API Support Discover Movies TV Shows Movies Popular Top Rated Upcoming Now Playing TV Shows Popular Top Rated On TV Airing Today People Popular People Can't find a movie or TV show? Login to create it. en Login Sign Up  ID: 65846   Expand Babysitter   (2016) User Score Overview An attractive babysitter, who graduated from a prestigious university, begins to work as a babysitter for 3 children from a wealthy couple. The attractive babysitter begins to change. Discussions   Reviews Videos   Images   Changes Report Share Discussions General  0 Content Issues  0 Images Backdrops  1 Posters  2 Videos Trailers  0 Teasers  0 Clips  0 Featurettes  0 Opening Credits  0 Top Billed Cast Shin Yoon-Joo Jang Suk-Ryoo Kim Min-joon Lee Sang-Won Jo Yeo-jeong Chun Eun-Joo Lee Seung-joon Yoon Ye Joo Full Cast & Crew Last Season Season 1 2016 | 4 Episodes Season 1 of Babysitter premiered on March 14, 2016. View All Seasons Social Reviews  0 Discussions  0 Media Most Popular Videos  0 Backdrops  1 Posters  2 Recommendations We don't have enough data to suggest any TV shows based on Babysitter. You can help by rating TV shows you've seen. Facts Original Name  \ubca0\uc774\ube44\uc2dc\ud130 Status  Ended Network Certification  - Type  Scripted Original Language  Korean Runtime  60m Homepage   http://www.kbs.co.kr/drama/babysitter/index.html Genres Mystery Drama Keywords korea Content Score 86 Almost there... Top Contributors M 31 Maria180493 TB 1 TMDb Bot S 1 SolidSnke  View Edit History Popularity Trend  Login to edit  URL By  signing up  for an account on TMDb, you can post directly to Twitter and Facebook. You need to be logged in to continue. Click  here  to login or  here  to sign up.    page_wrap opened in html_head  Join the Community The Basics About TMDb Contact Us Support Forums API Blog Get Involved  Contribution Bible 3rd Party Applications Add New Movie Add New TV Show Community Guidelines Leaderboard Forums Twitter Facebook Legal Terms of Use Privacy Policy Login Sign Up"}