{"link": "https://www.themoviedb.org/tv/28196?language=en", "title": "The Long Firm", "resume": "The lives of characters who live, love and suffer through their association with the charismatic charms of gangster Harry Starks.", "rate": null, "genre": ["Drama", "Crime"], "cast": ["Mark Strong", "Damien Thomas", "Christopher Simon", "Geoff Bell", "George Costigan"], "site_data": "html Apps Forums Leaderboard Contribute API Support Discover Movies TV Shows Movies Popular Top Rated Upcoming Now Playing TV Shows Popular Top Rated On TV Airing Today People Popular People Can't find a movie or TV show? Login to create it. en Login Sign Up  ID: 28196   Expand The Long Firm   (2004) User Score Overview The lives of characters who live, love and suffer through their association with the charismatic charms of gangster Harry Starks. Discussions   Reviews Videos   Images   Changes Report Share Discussions General  0 Content Issues  0 Images Backdrops  2 Posters  3 Videos Trailers  0 Teasers  0 Clips  0 Featurettes  0 Opening Credits  0 Top Billed Cast Mark Strong Harry Starks Damien Thomas Christopher Simon Eddie Geoff Bell Jock McClusky George Costigan Mooney Full Cast & Crew Last Season Season 1 2004 | 4 Episodes Season 1 of The Long Firm premiered on July  7, 2004. View All Seasons Social Reviews  0 Discussions  0 Media Most Popular Videos  0 Backdrops  2 Posters  3 Recommendations We don't have enough data to suggest any TV shows based on The Long Firm. You can help by rating TV shows you've seen. Facts Status  Ended Network Certification  - Type  Miniseries Original Language  English Runtime  60m Homepage   https://www.bbc.co.uk/programmes/p00t7k7l Genres Drama Crime Keywords london england based on novel or book gangster politician british homosexuality miniseries gay man swinging 60s nightclub owner woman director racketeer 1960s riches to rags Content Score 86 Almost there... Top Contributors TB 37 TMDb Bot 15 Banana R 4 Rebecca 1 Steve  View Edit History Popularity Trend  Login to edit  URL By  signing up  for an account on TMDb, you can post directly to Twitter and Facebook. You need to be logged in to continue. Click  here  to login or  here  to sign up.    page_wrap opened in html_head  Join the Community The Basics About TMDb Contact Us Support Forums API Blog Get Involved  Contribution Bible 3rd Party Applications Add New Movie Add New TV Show Community Guidelines Leaderboard Forums Twitter Facebook Legal Terms of Use Privacy Policy Login Sign Up", "character": ["Harry Starks", "Eddie", "Jock McClusky", "Mooney"]}