{"link": "https://www.themoviedb.org/tv/40880?language=en", "title": "Der Pfundskerl", "resume": "Der Pfundskerl is a German television series.", "rate": 0, "genre": ["Comedy", "Crime"], "cast": ["Ottfried Fischer", "Monica Bleibtreu", "Carol Campbell", "Ferdinand Dux", "Max Volkert Martens"], "character": ["Gottfried Engel", "Frau Kruschke", "Tanja Roloff", "Claas Ackermann", "G\u00fcnther Lesche"], "site_data": "html Apps Forums Leaderboard Contribute API Support Discover Movies TV Shows Movies Popular Top Rated Upcoming Now Playing TV Shows Popular Top Rated On TV Airing Today People Popular People Can't find a movie or TV show? Login to create it. en Login Sign Up  ID: 40880   Expand Der Pfundskerl   (2000) User Score Overview Der Pfundskerl is a German television series. Discussions   Reviews Videos   Images   Changes Report Share Discussions General  0 Content Issues  0 Images Backdrops  0 Posters  1 Videos Trailers  0 Teasers  0 Clips  0 Featurettes  0 Opening Credits  0 Top Billed Cast Ottfried Fischer Gottfried Engel Monica Bleibtreu Frau Kruschke Carol Campbell Tanja Roloff Ferdinand Dux Claas Ackermann Max Volkert Martens G\u00fcnther Lesche Full Cast & Crew Last Season The great guy season 1 2000 | 10 Episodes Season 1 of Der Pfundskerl premiered on April 12, 2000. View All Seasons Social Reviews  0 Discussions  0 Media Most Popular Videos  0 Backdrops  0 Posters  1 Recommendations We don't have enough data to suggest any TV shows based on Der Pfundskerl. You can help by rating TV shows you've seen. Facts Status  Ended Network Certification  - Type  Scripted Original Language  German Runtime  90m Homepage  - Genres Comedy Crime Keywords journalist Content Score 71 Just a little bit more... Top Contributors S 32 Samara k 1 karina_petrova  View Edit History Popularity Trend  Login to edit  URL By  signing up  for an account on TMDb, you can post directly to Twitter and Facebook. You need to be logged in to continue. Click  here  to login or  here  to sign up.    page_wrap opened in html_head  Join the Community The Basics About TMDb Contact Us Support Forums API Blog Get Involved  Contribution Bible 3rd Party Applications Add New Movie Add New TV Show Community Guidelines Leaderboard Forums Twitter Facebook Legal Terms of Use Privacy Policy Login Sign Up"}