{"link": "https://www.themoviedb.org/tv/22253?language=en", "title": "Der kleine Mann", "resume": "We don't have an overview translated in English. Help us expand our database by adding one.", "rate": 60, "genre": ["Comedy"], "cast": ["Bjarne M\u00e4del", "Karoline Eichhorn", "Christina Gro\u00dfe", "Karl Kranzkowski", "Florian Lukas"], "character": ["R\u00fcdiger Bunz", "Lydia", "Silvia Bunz", "Herr Gumprecht", "J\u00fcrgen Wiemers"], "site_data": "html Apps Forums Leaderboard Contribute API Support Discover Movies TV Shows Movies Popular Top Rated Upcoming Now Playing TV Shows Popular Top Rated On TV Airing Today People Popular People Can't find a movie or TV show? Login to create it. en Login Sign Up  ID: 22253   Expand Der kleine Mann   (2009) User Score Overview We don't have an overview translated in English. Help us expand our database by adding one. Featured Crew Ralf Husmann Creator Discussions   Reviews Videos   Images   Changes Report Share Discussions General  0 Content Issues  0 Images Backdrops  1 Posters  2 Videos Trailers  0 Teasers  0 Clips  0 Featurettes  0 Opening Credits  0 Top Billed Cast Bjarne M\u00e4del R\u00fcdiger Bunz Karoline Eichhorn Lydia Christina Gro\u00dfe Silvia Bunz Karl Kranzkowski Herr Gumprecht Florian Lukas J\u00fcrgen Wiemers Full Cast & Crew Last Season Season 1 2009 | 8 Episodes Season 1 of Der kleine Mann premiered on March 24, 2009. View All Seasons Social Reviews  0 Discussions  0 Media Most Popular Videos  0 Backdrops  1 Posters  2 Recommendations We don't have enough data to suggest any TV shows based on Der kleine Mann. You can help by rating TV shows you've seen. Facts Status  Ended Network Certification 12 Meaning The broadcaster must take the decision about the air time by taking in consideration the impact on young children in the timeframe from 6:00am to 8:00pm. Type  Scripted Original Language  German Runtime  30m Homepage  - Genres Comedy Keywords No keywords have been added. Content Score 93 Almost there... Top Contributors 20 Hollul 3 Elizabeth Jennings D 3 DDM2J555 S 3 Samara  View Edit History Popularity Trend  Login to edit  URL By  signing up  for an account on TMDb, you can post directly to Twitter and Facebook. You need to be logged in to continue. Click  here  to login or  here  to sign up.    page_wrap opened in html_head  Join the Community The Basics About TMDb Contact Us Support Forums API Blog Get Involved  Contribution Bible 3rd Party Applications Add New Movie Add New TV Show Community Guidelines Leaderboard Forums Twitter Facebook Legal Terms of Use Privacy Policy Login Sign Up"}