{"link": "https://www.themoviedb.org/tv/67853?language=en", "title": "Regalia: The Three Sacred Stars", "resume": "We don't have an overview translated in English. Help us expand our database by adding one.", "rate": 60, "genre": ["Action", "Adventure", "Animation", "Sci-Fi", "Fantasy"], "cast": ["Kaede Hondo", "Ayane Sakura", "Yurika Kubo", "Yui Ogura", "Asami Seto"], "character": ["Yuinshiel Asteria (voice)", "Magna Alecto / Rena Asteria (voice)", "Sara Kleis (voice)", "Aurea Tisis / Tia Kleis (voice)", "Ingrid Tiesto (voice)"], "site_data": "html Apps Forums Leaderboard Contribute API Support Discover Movies TV Shows Movies Popular Top Rated Upcoming Now Playing TV Shows Popular Top Rated On TV Airing Today People Popular People Can't find a movie or TV show? Login to create it. en Login Sign Up  ID: 67853   Expand Regalia: The Three Sacred Stars   (2016) User Score Overview We don't have an overview translated in English. Help us expand our database by adding one. Featured Crew Tosaka Shin Creator Keigo Koyanagi Creator Discussions   Reviews Videos   Images   Changes Report Share Discussions General  0 Content Issues  0 Images Backdrops  3 Posters  1 Videos Trailers  0 Teasers  0 Clips  0 Featurettes  0 Opening Credits  0 Top Billed Cast Kaede Hondo Yuinshiel Asteria (voice) Ayane Sakura Magna Alecto / Rena Asteria (voice) Yurika Kubo Sara Kleis (voice) Yui Ogura Aurea Tisis / Tia Kleis (voice) Asami Seto Ingrid Tiesto (voice) Full Cast & Crew Last Season Season 1 2016 | 13 Episodes Season 1 of Regalia: The Three Sacred Stars premiered on July  7, 2016. View All Seasons Social Reviews  0 Discussions  0 Media Most Popular Videos  0 Backdrops  3 Posters  1 Recommendations We don't have enough data to suggest any TV shows based on Regalia: The Three Sacred Stars. You can help by rating TV shows you've seen. Facts Original Name  \u30ec\u30ac\u30ea\u30a2: The Three Sacred Stars Status  Ended Networks Certification  - Type  Scripted Original Language  Japanese Runtime  24m Homepage   http://regalia-anime.com/ Genres Action & Adventure Animation Sci-Fi & Fantasy Keywords No keywords have been added. Content Score 86 Almost there... Top Contributors d 39 desert188 J 18 JohnyB0y 6 Elizabeth Jennings m 3 magoozin  View Edit History Popularity Trend  Login to edit  URL By  signing up  for an account on TMDb, you can post directly to Twitter and Facebook. You need to be logged in to continue. Click  here  to login or  here  to sign up.    page_wrap opened in html_head  Join the Community The Basics About TMDb Contact Us Support Forums API Blog Get Involved  Contribution Bible 3rd Party Applications Add New Movie Add New TV Show Community Guidelines Leaderboard Forums Twitter Facebook Legal Terms of Use Privacy Policy Login Sign Up"}