{"link": "https://www.themoviedb.org/tv/68962?language=en", "title": "Pacific Heat", "resume": "They're absent-minded, mildly corrupt and barely competent. Somehow, they're Australia's most elite detective unit.", "rate": 51, "genre": ["Comedy"], "cast": ["Rob Sitch", "Rebecca Massey", "Lucia Mastrantone", "Santo Cilauro", "Tom Gleisner"], "character": ["Grant Sommerville (voice)", "Maddie Riggs (voice)", "Veronica Delane (voice)", "Zac Valentic (voice)", "The Chief (voice)"], "site_data": "html Apps Forums Leaderboard Contribute API Support Discover Movies TV Shows Movies Popular Top Rated Upcoming Now Playing TV Shows Popular Top Rated On TV Airing Today People Popular People Can't find a movie or TV show? Login to create it. en Login Sign Up  ID: 68962   Expand Pacific Heat   (2016) User Score Overview They're absent-minded, mildly corrupt and barely competent. Somehow, they're Australia's most elite detective unit. Featured Crew Santo Cilauro Creator Discussions   Reviews Videos   Images   Changes Report Share Discussions General  0 Content Issues  0 Images Backdrops  3 Posters  1 Videos Trailers  0 Teasers  0 Clips  0 Featurettes  0 Opening Credits  0 Top Billed Cast Rob Sitch Grant Sommerville (voice) Rebecca Massey Maddie Riggs (voice) Lucia Mastrantone Veronica Delane (voice) Santo Cilauro Zac Valentic (voice) Tom Gleisner The Chief (voice) Full Cast & Crew Last Season Season 1 2016 | 13 Episodes Season 1 of Pacific Heat premiered on November 27, 2016. View All Seasons Social Reviews  0 Discussions  0 Media Most Popular Videos  0 Backdrops  3 Posters  1 Recommendations   2015-06-12 Conspiracy 5.7    2012-10-16 The Strange Calls 6.8    2015-04-17 Major Lazer 6.7    2017-08-12 DuckTales 7.2    2010-12-25 Come Fly With Me 6.6    2013-09-17 Dads 4.8  Facts Status  Returning Series Networks The Comedy Channel Certification  - Type  Scripted Original Language  English Runtime  22m Homepage   http://www.thecomedychannel.com.au/shows/pacific-heat/ Genres Comedy Keywords No keywords have been added. Content Score 93 Almost there... Top Contributors 31 Elizabeth Jennings p 11 penyok 3 Zlogorek 1 United600  View Edit History Popularity Trend  Login to edit  URL By  signing up  for an account on TMDb, you can post directly to Twitter and Facebook. You need to be logged in to continue. Click  here  to login or  here  to sign up.    page_wrap opened in html_head  Join the Community The Basics About TMDb Contact Us Support Forums API Blog Get Involved  Contribution Bible 3rd Party Applications Add New Movie Add New TV Show Community Guidelines Leaderboard Forums Twitter Facebook Legal Terms of Use Privacy Policy Login Sign Up"}