{"link": "https://www.themoviedb.org/tv/60143?language=en", "title": "Flaming Rose", "resume": "A cop and a girl with special powers join forces to fight bad guys.", "rate": 55, "genre": ["Soap", "Drama"], "cast": ["Phasut Banyaem", "Sara Legge", "Vorarit Fuangarome", "Nawinda Bertotti", "Rujira Chuaykua"], "character": ["Teratorn", "Saila", "Chutchid", "Orn", "Nasuda"], "site_data": "html Apps Forums Leaderboard Contribute API Support Discover Movies TV Shows Movies Popular Top Rated Upcoming Now Playing TV Shows Popular Top Rated On TV Airing Today People Popular People Can't find a movie or TV show? Login to create it. en Login Sign Up  ID: 60143   Expand Flaming Rose   (2013) User Score  Play Trailer Overview A cop and a girl with special powers join forces to fight bad guys. Featured Crew \u0e14\u0e35\u0e27\u0e31\u0e19\u0e17\u0e35\u0e27\u0e35 Creator Discussions   Reviews Videos   Images   Changes Report Share Discussions General  0 Content Issues  0 Images Backdrops  3 Posters  3 Videos Trailers  1 Teasers  0 Clips  0 Featurettes  0 Opening Credits  0 Top Billed Cast Phasut Banyaem Teratorn Sara Legge Saila Vorarit Fuangarome Chutchid Nawinda Bertotti Orn Rujira Chuaykua Nasuda Full Cast & Crew Last Season Season 1 2013 | 11 Episodes Season 1 of Flaming Rose premiered on July 24, 2013. View All Seasons Social Reviews  0 Discussions  0 Media Most Popular Videos  1 Backdrops  3 Posters  3 Recommendations We don't have enough data to suggest any TV shows based on Flaming Rose. You can help by rating TV shows you've seen. Facts Original Name  Kularb Fai Status  Ended Network Certification PG Meaning Parental guidance is recommended for young viewers; PG-rated content may air at any time on digital-only channels, otherwise, it should only be broadcast between 8:30 a.m. and 4:00 p.m. and between 7:00 p.m. and 6:00 a.m. on weekdays, and between 10:00 a.m. and 6:00 a.m. on weekends. Type  Reality Original Language  English Runtime  96m Homepage  - Genres Soap Drama Keywords thai lakorn Content Score 100 Yes! Looking good! Top Contributors 36 Crip 5 mariilakorn21 z 5 zurman1 TB 2 TMDb Bot  View Edit History Popularity Trend  Login to edit  URL By  signing up  for an account on TMDb, you can post directly to Twitter and Facebook. You need to be logged in to continue. Click  here  to login or  here  to sign up.    page_wrap opened in html_head  Join the Community The Basics About TMDb Contact Us Support Forums API Blog Get Involved  Contribution Bible 3rd Party Applications Add New Movie Add New TV Show Community Guidelines Leaderboard Forums Twitter Facebook Legal Terms of Use Privacy Policy Login Sign Up"}