{"link": "https://www.themoviedb.org/tv/42952?language=en", "title": "Kiniro no Corda", "resume": "We don't have an overview translated in English. Help us expand our database by adding one.", "rate": 0, "genre": ["Animation"], "cast": ["Daisuke Kishio", "Reiko Takagi", "Masakazu Morita", "Jun Fukuyama", "Kishou Taniyama"], "character": ["Azuma Yunoki", "Hino Kahoko", "Kazuki Hihara", "Keiichi Shimizu", "Len Tsukimori"], "site_data": "html Apps Forums Leaderboard Contribute API Support Discover Movies TV Shows Movies Popular Top Rated Upcoming Now Playing TV Shows Popular Top Rated On TV Airing Today People Popular People Can't find a movie or TV show? Login to create it. en Login Sign Up  ID: 42952   Expand Kiniro no Corda   (2006) User Score Overview We don't have an overview translated in English. Help us expand our database by adding one. Featured Crew Yuki Kure Creator Discussions   Reviews Videos   Images   Changes Report Share Discussions General  0 Content Issues  0 Images Backdrops  1 Posters  3 Videos Trailers  0 Teasers  0 Clips  0 Featurettes  0 Opening Credits  0 Top Billed Cast Daisuke Kishio Azuma Yunoki Reiko Takagi Hino Kahoko Masakazu Morita Kazuki Hihara Jun Fukuyama Keiichi Shimizu Kishou Taniyama Len Tsukimori Full Cast & Crew Last Season : secondo passo 2017 | 2 Episodes Season 2 of Kiniro no Corda premiered on March 26, 2017. View All Seasons Social Reviews  0 Discussions  0 Media Most Popular Videos  0 Backdrops  1 Posters  3 Recommendations We don't have enough data to suggest any TV shows based on Kiniro no Corda. You can help by rating TV shows you've seen. Facts Status  Ended Networks - Certification  - Type  Scripted Original Language  Japanese Runtime  25m Homepage   http://www.corda-primopasso.com/ Genres Animation Keywords No keywords have been added. Content Score 86 Almost there... Top Contributors 6 Saki f 1 franfac  View Edit History Popularity Trend  Login to edit  URL By  signing up  for an account on TMDb, you can post directly to Twitter and Facebook. You need to be logged in to continue. Click  here  to login or  here  to sign up.    page_wrap opened in html_head  Join the Community The Basics About TMDb Contact Us Support Forums API Blog Get Involved  Contribution Bible 3rd Party Applications Add New Movie Add New TV Show Community Guidelines Leaderboard Forums Twitter Facebook Legal Terms of Use Privacy Policy Login Sign Up"}