{"link": "https://www.themoviedb.org/tv/65570?language=en", "title": "\u041f\u043e\u0441\u043b\u0435\u0434\u043d\u0438\u0439 \u043c\u0435\u043d\u0442", "resume": "We don't have an overview translated in English. Help us expand our database by adding one.", "rate": 70, "genre": ["Action", "Adventure", "Mystery", "Comedy", "Family"], "cast": ["Yuriy Kutsenko", "Anatoli Rudenko", "Alexander Borisov", "Sergey Udovik", "Nataliya Vdovina"], "character": ["\u0410\u043b\u0435\u043a\u0441\u0435\u0439 \u0414\u0438\u0432\u043e\u0432 (\u043a\u0430\u043f\u0438\u0442\u0430\u043d \u043f\u043e\u043b\u0438\u0446\u0438\u0438)", "\u0410\u043d\u0434\u0440\u0435\u0439 \u0412\u0430\u0441\u0438\u043b\u044c\u0435\u0432 (\u043d\u0430\u043f\u0430\u0440\u043d\u0438\u043a \u0410\u043b\u0435\u043a\u0441\u0435\u044f)", "\u0414\u043c\u0438\u0442\u0440\u0438\u0439 \u041f\u0435\u0442\u0440\u043e\u0432\u0438\u0447 \u041a\u0438\u0440\u0441\u0430\u043d\u043e\u0432 (\u043f\u043e\u043b\u043a\u043e\u0432\u043d\u0438\u043a \u043f\u043e\u043b\u0438\u0446\u0438\u0438)", "\u041d\u0438\u043a\u043e\u043b\u0430\u0439 \u0412\u0438\u043a\u0442\u043e\u0440\u043e\u0432\u0438\u0447 \u0422\u0435\u0440\u0435\u0445\u043e\u0432 (\u0432\u0442\u043e\u0440\u043e\u0439 \u043c\u0443\u0436 \u041b\u0438\u0437\u044b, \u043f\u0430\u0442\u043e\u043b\u043e\u0433\u043e\u0430\u043d\u0430\u0442\u043e\u043c)", "\u041b\u0438\u0437\u0430 \u0422\u0435\u0440\u0435\u0445\u043e\u0432\u0430 (\u0431\u044b\u0432\u0448\u0430\u044f \u0436\u0435\u043d\u0430 \u0410\u043b\u0435\u043a\u0441\u0435\u044f)"], "site_data": "html Apps Forums Leaderboard Contribute API Support Discover Movies TV Shows Movies Popular Top Rated Upcoming Now Playing TV Shows Popular Top Rated On TV Airing Today People Popular People Can't find a movie or TV show? Login to create it. en Login Sign Up  ID: 65570   Expand \u041f\u043e\u0441\u043b\u0435\u0434\u043d\u0438\u0439 \u043c\u0435\u043d\u0442   (2015) User Score Overview We don't have an overview translated in English. Help us expand our database by adding one. Featured Crew Anna Gershovich Creator Eugeny Kukarin Creator Discussions   Reviews Videos   Images   Changes Report Share Discussions General  0 Content Issues  0 Images Backdrops  0 Posters  2 Videos Trailers  0 Teasers  0 Clips  0 Featurettes  0 Opening Credits  0 Top Billed Cast Yuriy Kutsenko \u0410\u043b\u0435\u043a\u0441\u0435\u0439 \u0414\u0438\u0432\u043e\u0432 (\u043a\u0430\u043f\u0438\u0442\u0430\u043d \u043f\u043e\u043b\u0438\u0446\u0438\u0438) Anatoli Rudenko \u0410\u043d\u0434\u0440\u0435\u0439 \u0412\u0430\u0441\u0438\u043b\u044c\u0435\u0432 (\u043d\u0430\u043f\u0430\u0440\u043d\u0438\u043a \u0410\u043b\u0435\u043a\u0441\u0435\u044f) Alexander Borisov \u0414\u043c\u0438\u0442\u0440\u0438\u0439 \u041f\u0435\u0442\u0440\u043e\u0432\u0438\u0447 \u041a\u0438\u0440\u0441\u0430\u043d\u043e\u0432 (\u043f\u043e\u043b\u043a\u043e\u0432\u043d\u0438\u043a \u043f\u043e\u043b\u0438\u0446\u0438\u0438) Sergey Udovik \u041d\u0438\u043a\u043e\u043b\u0430\u0439 \u0412\u0438\u043a\u0442\u043e\u0440\u043e\u0432\u0438\u0447 \u0422\u0435\u0440\u0435\u0445\u043e\u0432 (\u0432\u0442\u043e\u0440\u043e\u0439 \u043c\u0443\u0436 \u041b\u0438\u0437\u044b, \u043f\u0430\u0442\u043e\u043b\u043e\u0433\u043e\u0430\u043d\u0430\u0442\u043e\u043c) Nataliya Vdovina \u041b\u0438\u0437\u0430 \u0422\u0435\u0440\u0435\u0445\u043e\u0432\u0430 (\u0431\u044b\u0432\u0448\u0430\u044f \u0436\u0435\u043d\u0430 \u0410\u043b\u0435\u043a\u0441\u0435\u044f) Full Cast & Crew Last Season Season 2 2017 | 52 Episodes Season 2 of \u041f\u043e\u0441\u043b\u0435\u0434\u043d\u0438\u0439 \u043c\u0435\u043d\u0442 premiered on September  3, 2017. View All Seasons Social Reviews  0 Discussions  0 Media Most Popular Videos  0 Backdrops  0 Posters  2 Recommendations We don't have enough data to suggest any TV shows based on \u041f\u043e\u0441\u043b\u0435\u0434\u043d\u0438\u0439 \u043c\u0435\u043d\u0442. You can help by rating TV shows you've seen. Facts Status  Returning Series Network Certification 16+ Meaning Only teens the age of 16 or older can watch. Type  Scripted Original Language  Russian Runtime  39m Homepage   https://www.5-tv.ru/ment/ Genres Action & Adventure Mystery Comedy Family Keywords detective family the last soviet militiaman in this century Content Score 71 Just a little bit more... Top Contributors n 40 navarro2018 11 Zlogorek 3 mrtextortexel z 1 zoroman2017  View Edit History Popularity Trend  Login to edit  URL By  signing up  for an account on TMDb, you can post directly to Twitter and Facebook. You need to be logged in to continue. Click  here  to login or  here  to sign up.    page_wrap opened in html_head  Join the Community The Basics About TMDb Contact Us Support Forums API Blog Get Involved  Contribution Bible 3rd Party Applications Add New Movie Add New TV Show Community Guidelines Leaderboard Forums Twitter Facebook Legal Terms of Use Privacy Policy Login Sign Up"}