{"link": "https://www.themoviedb.org/tv/40760?language=en", "title": "Die Verbrechen des Professor Capellari", "resume": "Die Verbrechen des Professor Capellari is a German television series.", "rate": 0, "genre": ["Crime"], "cast": ["Friedrich von Thun", "Gilbert von Sohlern", "Sissy H\u00f6fferer", "Liane Forestieri", "Dietrich Siegl"], "character": ["Prof. Viktor Capellari", "Horst Kreulich", "Karola Geissler", "Maria", "Bruno Buchwald"], "site_data": "html Apps Forums Leaderboard Contribute API Support Discover Movies TV Shows Movies Popular Top Rated Upcoming Now Playing TV Shows Popular Top Rated On TV Airing Today People Popular People Can't find a movie or TV show? Login to create it. en Login Sign Up  ID: 40760   Expand Die Verbrechen des Professor Capellari   (1998) User Score Overview Die Verbrechen des Professor Capellari is a German television series. Featured Crew Friedrich von Thun Creator Discussions   Reviews Videos   Images   Changes Report Share Discussions General  0 Content Issues  0 Images Backdrops  1 Posters  1 Videos Trailers  0 Teasers  0 Clips  0 Featurettes  0 Opening Credits  0 Top Billed Cast Friedrich von Thun Prof. Viktor Capellari Gilbert von Sohlern Horst Kreulich Sissy H\u00f6fferer Karola Geissler Liane Forestieri Maria Dietrich Siegl Bruno Buchwald Full Cast & Crew Last Season Season 1 1998 | 17 Episodes Season 1 of Die Verbrechen des Professor Capellari premiered on January  2, 1998. View All Seasons Social Reviews  0 Discussions  0 Media Most Popular Videos  0 Backdrops  1 Posters  1 Recommendations We don't have enough data to suggest any TV shows based on Die Verbrechen des Professor Capellari. You can help by rating TV shows you've seen. Facts Status  Ended Network Certification 12 Meaning The broadcaster must take the decision about the air time by taking in consideration the impact on young children in the timeframe from 6:00am to 8:00pm. Type  Scripted Original Language  German Runtime  90m Homepage  - Genres Crime Keywords private detective capellari Content Score 93 Almost there... Top Contributors S 30 Samara t 26 tmdb45070722 s 8 stklaus 5 3 5lucina5  View Edit History Popularity Trend  Login to edit  URL By  signing up  for an account on TMDb, you can post directly to Twitter and Facebook. You need to be logged in to continue. Click  here  to login or  here  to sign up.    page_wrap opened in html_head  Join the Community The Basics About TMDb Contact Us Support Forums API Blog Get Involved  Contribution Bible 3rd Party Applications Add New Movie Add New TV Show Community Guidelines Leaderboard Forums Twitter Facebook Legal Terms of Use Privacy Policy Login Sign Up"}