{"link": "https://www.themoviedb.org/tv/76149?language=en", "title": "Joseon Beauty Pageant", "resume": "A youthful musical drama about the first beauty pageant in Joseon.", "rate": 0, "genre": ["Comedy", "Drama"], "cast": ["Yeo Chang Gu", "Kim Na Ni", "Jung Tae Ri", "Seo Yi-sook", "Jung Eun-pyo"], "character": ["Kyu Hun", "So Hye", "Kyu Hee", "Lord Kim's wife", "Teacher Dang Hee"], "site_data": "html Apps Forums Leaderboard Contribute API Support Discover Movies TV Shows Movies Popular Top Rated Upcoming Now Playing TV Shows Popular Top Rated On TV Airing Today People Popular People Can't find a movie or TV show? Login to create it. en Login Sign Up  ID: 76149   Expand Joseon Beauty Pageant   (2018) User Score Overview A youthful musical drama about the first beauty pageant in Joseon. Discussions   Reviews Videos   Images   Changes Report Share Discussions General  0 Content Issues  0 Images Backdrops  1 Posters  3 Videos Trailers  0 Teasers  0 Clips  0 Featurettes  0 Opening Credits  0 Top Billed Cast Yeo Chang Gu Kyu Hun Kim Na Ni So Hye Jung Tae Ri Kyu Hee Seo Yi-sook Lord Kim's wife Jung Eun-pyo Teacher Dang Hee Full Cast & Crew Current Season Season 1 2018 | 4 Episodes Season 1 of Joseon Beauty Pageant premiered on January  3, 2018. View All Seasons Social Reviews  0 Discussions  0 Media Most Popular Videos  0 Backdrops  1 Posters  3 Recommendations We don't have enough data to suggest any TV shows based on Joseon Beauty Pageant. You can help by rating TV shows you've seen. Facts Original Name  \uc2dc\ub9ac\uc988 \uc870\uc120\ubbf8\uc778\ubcc4\uc804 Status  Returning Series Network Certification 15 Meaning This rating is for programs that contain material that may be inappropriate for children under 15, and that parental discretion should be used. Examples include most dramas, and talk shows on OTA (over-the-air) TV (KBS, MBC, SBS), and many American TV shows/dramas on Cable TV channels like OCN and OnStyle. The programs that have this rating may include moderate or strong adult themes, language, sexual inference, and violence. As with the TV-MA rating in North America, this rating is commonly applied to live events where the occurrence of inappropriate dialogue is unpredictable. Since 2007, this rating is the most used rating for TV. Type  Scripted Original Language  Korean Runtime  60m Homepage   http://www.kbs.co.kr/drama/chosunmiin7/ Genres Comedy Drama Keywords music history Content Score 86 Almost there... Top Contributors 17 Lumina_B l 17 lala07 M 11 Maria180493 2 Chelsea  View Edit History Popularity Trend  Login to edit  URL By  signing up  for an account on TMDb, you can post directly to Twitter and Facebook. You need to be logged in to continue. Click  here  to login or  here  to sign up.    page_wrap opened in html_head  Join the Community The Basics About TMDb Contact Us Support Forums API Blog Get Involved  Contribution Bible 3rd Party Applications Add New Movie Add New TV Show Community Guidelines Leaderboard Forums Twitter Facebook Legal Terms of Use Privacy Policy Login Sign Up"}