{"link": "https://www.themoviedb.org/tv/79513?language=en", "title": "In Search Of", "resume": "Inspired by the iconic 1970s\u2019 franchise, this series examines unexplained phenomena from all over the world.", "rate": 0, "genre": ["Documentary"], "cast": ["Zachary Quinto"], "character": ["Himself"], "site_data": "html Apps Forums Leaderboard Contribute API Support Discover Movies TV Shows Movies Popular Top Rated Upcoming Now Playing TV Shows Popular Top Rated On TV Airing Today People Popular People Can't find a movie or TV show? Login to create it. en Login Sign Up  ID: 79513   Expand In Search Of   (2018) User Score Overview Inspired by the iconic 1970s\u2019 franchise, this series examines unexplained phenomena from all over the world. Discussions   Reviews Videos   Images   Changes Report Share Discussions General  0 Content Issues  0 Images Backdrops  1 Posters  1 Videos Trailers  0 Teasers  0 Clips  0 Featurettes  0 Opening Credits  0 Top Billed Cast Zachary Quinto Himself Full Cast & Crew Next Season Season 1 2018 | 1 Episode Season 1 of In Search Of is set to premiere on July 20, 2018. View All Seasons Social Reviews  0 Discussions  0 Media Most Popular Videos  0 Backdrops  1 Posters  1 Facts Status  In Production Network Certification  - Type  Documentary Original Language  English Runtime  42m Homepage   https://www.history.com/shows/in-search-of Genres Documentary Keywords ufo Content Score 56 We're so close, yet so far. Top Contributors 17 amian123 R 8 Rebecca 6 Elizabeth Jennings  View Edit History Popularity Trend  Login to edit  URL By  signing up  for an account on TMDb, you can post directly to Twitter and Facebook. You need to be logged in to continue. Click  here  to login or  here  to sign up.    page_wrap opened in html_head  Join the Community The Basics About TMDb Contact Us Support Forums API Blog Get Involved  Contribution Bible 3rd Party Applications Add New Movie Add New TV Show Community Guidelines Leaderboard Forums Twitter Facebook Legal Terms of Use Privacy Policy Login Sign Up"}