{"link": "https://www.themoviedb.org/tv/71533?language=en", "title": "Clocking Out", "resume": "A science fiction blockbuster in which special agents struggle with a weird species that has taken over Korea.", "rate": 0, "genre": ["Action", "Adventure", "Mystery", "Sci-Fi", "Fantasy"], "cast": ["Kim Sang-joong", "Kim Kang-woo", "Joo Won", "Park Choong-seon", "Kwon Eun-soo"], "character": ["Park Jeong Bong", "Kim Hyo Chan", "Seo Ki Woong", "President", "Support team"], "site_data": "html Apps Forums Leaderboard Contribute API Support Discover Movies TV Shows Movies Popular Top Rated Upcoming Now Playing TV Shows Popular Top Rated On TV Airing Today People Popular People Can't find a movie or TV show? Login to create it. en Login Sign Up  ID: 71533   Expand Clocking Out   (2016) User Score Overview A science fiction blockbuster in which special agents struggle with a weird species that has taken over Korea. Discussions   Reviews Videos   Images   Changes Report Share Discussions General  0 Content Issues  0 Images Backdrops  0 Posters  1 Videos Trailers  0 Teasers  0 Clips  0 Featurettes  0 Opening Credits  0 Top Billed Cast Kim Sang-joong Park Jeong Bong Kim Kang-woo Kim Hyo Chan Joo Won Seo Ki Woong Park Choong-seon President Kwon Eun-soo Support team Full Cast & Crew Last Season Season 1 2016 | 4 Episodes Season 1 of Clocking Out premiered on October 21, 2016. View All Seasons Social Reviews  0 Discussions  0 Media Most Popular Videos  0 Backdrops  0 Posters  1 Recommendations We don't have enough data to suggest any TV shows based on Clocking Out. You can help by rating TV shows you've seen. Facts Original Name  \ud2b9\uadfc Status  Ended Network Certification  - Type  Scripted Original Language  Korean Runtime  10m Homepage  - Genres Action & Adventure Mystery Sci-Fi & Fantasy Keywords alien Content Score 71 Just a little bit more... Top Contributors W 23 WonderfulError d 3 daphie TB 2 TMDb Bot  View Edit History Popularity Trend  Login to edit  URL By  signing up  for an account on TMDb, you can post directly to Twitter and Facebook. You need to be logged in to continue. Click  here  to login or  here  to sign up.    page_wrap opened in html_head  Join the Community The Basics About TMDb Contact Us Support Forums API Blog Get Involved  Contribution Bible 3rd Party Applications Add New Movie Add New TV Show Community Guidelines Leaderboard Forums Twitter Facebook Legal Terms of Use Privacy Policy Login Sign Up"}