{"link": "https://www.themoviedb.org/tv/65160?language=en", "title": "Summer Days", "resume": "The series tells the story of Dana, Dafi, Elinor, and Tamar ,four good friends.", "rate": 100, "genre": ["Drama"], "cast": ["Lihi Kornowski", "Noel Berkovitch", "Gaya Gur Arie", "Carmel Lotan", "Michaela Elkin"], "character": ["Tamar Golan", "Dana", "Elinor", "Dafi", "Karine Kramer"], "site_data": "html Apps Forums Leaderboard Contribute API Support Discover Movies TV Shows Movies Popular Top Rated Upcoming Now Playing TV Shows Popular Top Rated On TV Airing Today People Popular People Can't find a movie or TV show? Login to create it. en Login Sign Up  ID: 65160   Expand Summer Days   (2012) User Score Overview The series tells the story of Dana, Dafi, Elinor, and Tamar ,four good friends. Featured Crew Michal Cooper Keren Creator Discussions   Reviews Videos   Images   Changes Report Share Discussions General  0 Content Issues  0 Images Backdrops  2 Posters  1 Videos Trailers  0 Teasers  0 Clips  0 Featurettes  0 Opening Credits  0 Top Billed Cast Lihi Kornowski Tamar Golan Noel Berkovitch Dana Gaya Gur Arie Elinor Carmel Lotan Dafi Michaela Elkin Karine Kramer Full Cast & Crew Last Season Season 2 2013 | 2 Episodes Season 2 of Summer Days premiered on August 18, 2013. View All Seasons Social Reviews  0 Discussions  0 Media Most Popular Videos  0 Backdrops  2 Posters  1 Recommendations We don't have enough data to suggest any TV shows based on Summer Days. You can help by rating TV shows you've seen. Facts Original Name  \u05d9\u05d5\u05de\u05e0\u05d9 \u05d4\u05d7\u05d5\u05e4\u05e9 \u05d4\u05d2\u05d3\u05d5\u05dc Status  Ended Network Certification  - Type  Scripted Original Language  Hebrew Runtime  25m Homepage   http://vod.walla.co.il/tvshow/2855962/yomaney-hahofesh/season-1 Genres Drama Keywords No keywords have been added. Content Score 93 Almost there... Top Contributors m 61 mikey641 23 Elizabeth Jennings z 9 zurman1 2 Banana  View Edit History Popularity Trend  Login to edit  URL By  signing up  for an account on TMDb, you can post directly to Twitter and Facebook. You need to be logged in to continue. Click  here  to login or  here  to sign up.    page_wrap opened in html_head  Join the Community The Basics About TMDb Contact Us Support Forums API Blog Get Involved  Contribution Bible 3rd Party Applications Add New Movie Add New TV Show Community Guidelines Leaderboard Forums Twitter Facebook Legal Terms of Use Privacy Policy Login Sign Up"}