{"link": "https://www.themoviedb.org/tv/69434?language=en", "title": "Lego Star Wars: The Complete Saga", "resume": "LEGO Star Wars is a series of TV Movies telling stories from the Star Wars universe using the distinctive characters from the world of LEGO and the animation style of the LEGO Star Wars computer games. Starting in 2005; the first film \"Revenge of the Brick\" was created to coincide with the theatrical release of Star Wars: Episode III: Revenge of the Sith.", "rate": 100, "genre": ["Animation", "Action", "Adventure"], "cast": ["Eric Bauza", "Anthony Daniels", "Matt Sloan", "Michael Daingerfield", "Julie Dolan"], "character": ["Luke Skywalker", "C-3PO", "Darth Vader", "Han Solo", "Leia"], "site_data": "html Apps Forums Leaderboard Contribute API Support Discover Movies TV Shows Movies Popular Top Rated Upcoming Now Playing TV Shows Popular Top Rated On TV Airing Today People Popular People Can't find a movie or TV show? Login to create it. en Login Sign Up  ID: 69434   Expand Lego Star Wars: The Complete Saga   (2014) User Score Overview LEGO Star Wars is a series of TV Movies telling stories from the Star Wars universe using the distinctive characters from the world of LEGO and the animation style of the LEGO Star Wars computer games. Starting in 2005; the first film \"Revenge of the Brick\" was created to coincide with the theatrical release of Star Wars: Episode III: Revenge of the Sith. Featured Crew Bill Motz Creator Bob Roth Creator Carrie Beck Creator Discussions   Reviews Videos   Images   Changes Report Share Discussions General  0 Content Issues  0 Images Backdrops  1 Posters  2 Videos Trailers  0 Teasers  0 Clips  0 Featurettes  0 Opening Credits  0 Top Billed Cast Eric Bauza Luke Skywalker Anthony Daniels C-3PO Matt Sloan Darth Vader Michael Daingerfield Han Solo Julie Dolan Leia Full Cast & Crew Last Season Season 5 2016 | 3 Episodes Season 5 of Lego Star Wars: The Complete Saga premiered on August  5, 2016. View All Seasons Social Reviews  0 Discussions  0 Media Most Popular Videos  0 Backdrops  1 Posters  2 Recommendations We don't have enough data to suggest any TV shows based on Lego Star Wars: The Complete Saga. You can help by rating TV shows you've seen. Facts Original Name  Lego Star Wars - The Complete Saga Status  Returning Series Networks Certification 6 Meaning Can be aired at any time. Type  Scripted Original Language  English Runtime  22m Homepage   https://www.lego.com/nl-nl/themes/star-wars Genres Animation Action & Adventure Keywords space opera darth vader lego luke skywalker Content Score 100 Yes! Looking good! Top Contributors a 50 a_e_thomas S 41 Sander S 10 Sithlord82 TB 3 TMDb Bot  View Edit History Popularity Trend  Login to edit  URL By  signing up  for an account on TMDb, you can post directly to Twitter and Facebook. You need to be logged in to continue. Click  here  to login or  here  to sign up.    page_wrap opened in html_head  Join the Community The Basics About TMDb Contact Us Support Forums API Blog Get Involved  Contribution Bible 3rd Party Applications Add New Movie Add New TV Show Community Guidelines Leaderboard Forums Twitter Facebook Legal Terms of Use Privacy Policy Login Sign Up"}