{"link": "https://www.themoviedb.org/tv/46013?language=en", "title": "\u0413\u043b\u0443\u0445\u0430\u0440\u044c", "resume": "We don't have an overview translated in English. Help us expand our database by adding one.", "rate": 60, "genre": ["Drama", "Comedy", "Action", "Adventure"], "cast": ["Maksim Averin", "Denis Rozhkov", "Maria Boltneva", "Viktoriya Tarasova", "Vladimir Feklenko"], "character": ["Sergei Glukharev", "Denis Antoshin", "Nastya Klimenko", "Irina Sergeevna Zimina", "Kolya Tarasov"], "site_data": "html Apps Forums Leaderboard Contribute API Support Discover Movies TV Shows Movies Popular Top Rated Upcoming Now Playing TV Shows Popular Top Rated On TV Airing Today People Popular People Can't find a movie or TV show? Login to create it. en Login Sign Up  ID: 46013   Expand \u0413\u043b\u0443\u0445\u0430\u0440\u044c   (2008) User Score Overview We don't have an overview translated in English. Help us expand our database by adding one. Featured Crew \u0418\u043b\u044c\u044f \u041a\u0443\u043b\u0438\u043a\u043e\u0432 Creator Discussions   Reviews Videos   Images   Changes Report Share Discussions General  0 Content Issues  0 Images Backdrops  14 Posters  5 Videos Trailers  0 Teasers  0 Clips  0 Featurettes  0 Opening Credits  0 Top Billed Cast Maksim Averin Sergei Glukharev Denis Rozhkov Denis Antoshin Maria Boltneva Nastya Klimenko Viktoriya Tarasova Irina Sergeevna Zimina Vladimir Feklenko Kolya Tarasov Full Cast & Crew Last Season Season 1 2008 | 1 Episode Season 1 of \u0413\u043b\u0443\u0445\u0430\u0440\u044c premiered on November 24, 2008. View All Seasons Social Reviews  0 Discussions  0 Media Most Popular Videos  0 Backdrops  14 Posters  5 Recommendations We don't have enough data to suggest any TV shows based on \u0413\u043b\u0443\u0445\u0430\u0440\u044c. You can help by rating TV shows you've seen. Facts Status  Ended Networks - Certification  - Type  Scripted Original Language  Russian Runtime  45m Homepage  - Genres Drama Comedy Action & Adventure Keywords No keywords have been added. Content Score 86 Almost there... Top Contributors R 13 Rebecca k 5 krys4d c 3 coho s 3 speedycars  View Edit History Popularity Trend  Login to edit  URL By  signing up  for an account on TMDb, you can post directly to Twitter and Facebook. You need to be logged in to continue. Click  here  to login or  here  to sign up.    page_wrap opened in html_head  Join the Community The Basics About TMDb Contact Us Support Forums API Blog Get Involved  Contribution Bible 3rd Party Applications Add New Movie Add New TV Show Community Guidelines Leaderboard Forums Twitter Facebook Legal Terms of Use Privacy Policy Login Sign Up"}