{"link": "https://www.themoviedb.org/tv/3796?language=en", "title": "Trailer Park Boys", "resume": "Follow the booze-fueled misadventures of three longtime pals and petty serial criminals who run scams from their Nova Scotia trailer park.", "rate": 78, "genre": ["Comedy"], "cast": ["Robb Wells", "John Paul Tremblay", "Mike Smith", "John Dunsworth", "Patrick Roach"], "character": ["Ricky", "Julian", "Bubbles", "Jim Lahey", "Randy"], "site_data": "html Apps Forums Leaderboard Contribute API Support Discover Movies TV Shows Movies Popular Top Rated Upcoming Now Playing TV Shows Popular Top Rated On TV Airing Today People Popular People Can't find a movie or TV show? Login to create it. en Login Sign Up  ID: 3796   Expand Trailer Park Boys   (2001) User Score  Play Trailer Overview Follow the booze-fueled misadventures of three longtime pals and petty serial criminals who run scams from their Nova Scotia trailer park. Featured Crew Mike Clattenburg Creator Discussions   Reviews Videos   Images   Changes Report Share Discussions General  1 Content Issues  0 Images Backdrops  6 Posters  3 Videos Trailers  1 Teasers  0 Clips  0 Featurettes  0 Opening Credits  0 Top Billed Cast Robb Wells Ricky John Paul Tremblay Julian Mike Smith Bubbles John Dunsworth Jim Lahey Patrick Roach Randy Full Cast & Crew Current Season Season 12 2018 | 10 Episodes Season 12 of Trailer Park Boys premiered on March 30, 2018. View All Seasons Social Reviews  0 Discussions  1 Subject Status Replies Last Reply What do you miss the most in the new Netflix seasons? Open 2 by  Strannger18 Go to Discussions Media Most Popular Videos  1 Backdrops  6 Posters  3 Recommendations   2009-02-15 Eastbound & Down 7.4    2011-04-06 Workaholics 6.9    2015-12-18 F is for Family 6.8    1999-01-10 The PJs 7.4    2005-07-21 Extras 7.8    2009-03-20 Party Down 7.4    2011-02-08 Traffic Light 7.2    2009-09-20 Bored to Death 7.4  Facts Status  Returning Series Networks Certification TV-MA Meaning This program is specifically designed to be viewed by adults and therefore may be unsuitable for children under 17 Type  Scripted Original Language  English Runtime  22m, 30m Homepage   http://www.trailerparkboys.com Genres Comedy Keywords trailer park white trash dark comedy mockumentary marijuana sitcom Content Score 100 Yes! Looking good! Top Contributors 16 CouchTater e 12 eyealar 5 Elizabeth Jennings Z 4 Zeepnu  View Edit History Popularity Trend  Login to edit  URL By  signing up  for an account on TMDb, you can post directly to Twitter and Facebook. You need to be logged in to continue. Click  here  to login or  here  to sign up.    page_wrap opened in html_head  Join the Community The Basics About TMDb Contact Us Support Forums API Blog Get Involved  Contribution Bible 3rd Party Applications Add New Movie Add New TV Show Community Guidelines Leaderboard Forums Twitter Facebook Legal Terms of Use Privacy Policy Login Sign Up"}