{"link": "https://www.themoviedb.org/tv/11286?language=en", "title": "Bright Promise", "resume": "Bright Promise is an American daytime soap opera that ran on NBC from September 29, 1969 to March 31, 1972. It aired weekdays at 3:30 PM Eastern/2:30 PM Central.", "rate": null, "genre": ["Soap"], "cast": ["Sherry Alberoni", "Lesley Woods", "Anthony Geary", "Tod Andrews", "David Lewis"], "site_data": "html Apps Forums Leaderboard Contribute API Support Discover Movies TV Shows Movies Popular Top Rated Upcoming Now Playing TV Shows Popular Top Rated On TV Airing Today People Popular People Can't find a movie or TV show? Login to create it. en Login Sign Up  ID: 11286   Expand Bright Promise   (1969) User Score Overview Bright Promise is an American daytime soap opera that ran on NBC from September 29, 1969 to March 31, 1972. It aired weekdays at 3:30 PM Eastern/2:30 PM Central. Discussions   Reviews Videos   Images   Changes Report Share Discussions General  0 Content Issues  0 Images Backdrops  0 Posters  1 Videos Trailers  0 Teasers  0 Clips  0 Featurettes  0 Opening Credits  0 Top Billed Cast Sherry Alberoni Jody Harper Lesley Woods Isabel Jones Anthony Geary David Lockhart Tod Andrews Henry Pierce David Lewis Henry Pierce Full Cast & Crew Last Season Season 3 \u2014 | 1 Episode We don't have an overview translated in English. Help us expand our database by adding one. View All Seasons Social Reviews  0 Discussions  0 Media Most Popular Videos  0 Backdrops  0 Posters  1 Recommendations We don't have enough data to suggest any TV shows based on Bright Promise. You can help by rating TV shows you've seen. Facts Status  Ended Network Certification  - Type  Scripted Original Language  English Runtime  30m Homepage  - Genres Soap Keywords college soap opera Content Score 71 Just a little bit more... Top Contributors 19 Banana  View Edit History Popularity Trend  Login to edit  URL By  signing up  for an account on TMDb, you can post directly to Twitter and Facebook. You need to be logged in to continue. Click  here  to login or  here  to sign up.    page_wrap opened in html_head  Join the Community The Basics About TMDb Contact Us Support Forums API Blog Get Involved  Contribution Bible 3rd Party Applications Add New Movie Add New TV Show Community Guidelines Leaderboard Forums Twitter Facebook Legal Terms of Use Privacy Policy Login Sign Up", "character": ["Jody Harper", "Isabel Jones", "David Lockhart", "Henry Pierce", "Henry Pierce"]}