{"link": "https://www.themoviedb.org/tv/49488?language=en", "title": "Beni B\u00f6yle Sev", "resume": "We don't have an overview translated in English. Help us expand our database by adding one.", "rate": 0, "genre": ["Family", "Drama"], "cast": ["Alper Sald\u0131ran", "Zeynep \u00c7amc\u0131", "Burcu Alt\u0131n", "Mert Turak", "G\u00fcven K\u0131ra\u00e7"], "character": ["\u00d6mer Karatepe", "Ay\u015fem Keskin Karatepe", "Reyhan Aksu", "Nezih Ye\u015fildere", "Nail Keskin"], "site_data": "html Apps Forums Leaderboard Contribute API Support Discover Movies TV Shows Movies Popular Top Rated Upcoming Now Playing TV Shows Popular Top Rated On TV Airing Today People Popular People Can't find a movie or TV show? Login to create it. en Login Sign Up  ID: 49488   Expand Beni B\u00f6yle Sev   (2013) User Score Overview We don't have an overview translated in English. Help us expand our database by adding one. Discussions   Reviews Videos   Images   Changes Report Share Discussions General  0 Content Issues  0 Images Backdrops  1 Posters  1 Videos Trailers  0 Teasers  0 Clips  0 Featurettes  0 Opening Credits  0 Top Billed Cast Alper Sald\u0131ran \u00d6mer Karatepe Zeynep \u00c7amc\u0131 Ay\u015fem Keskin Karatepe Burcu Alt\u0131n Reyhan Aksu Mert Turak Nezih Ye\u015fildere G\u00fcven K\u0131ra\u00e7 Nail Keskin Full Cast & Crew Last Season Season 3 \u2014 | 26 Episodes We don't have an overview translated in English. Help us expand our database by adding one. View All Seasons Social Reviews  0 Discussions  0 Media Most Popular Videos  0 Backdrops  1 Posters  1 Recommendations We don't have enough data to suggest any TV shows based on Beni B\u00f6yle Sev. You can help by rating TV shows you've seen. Facts Status  Ended Network Certification  - Type  Scripted Original Language  Turkish Runtime  90m Homepage   http://www.beniboylesev.tv Genres Family Drama Keywords No keywords have been added. Content Score 79 Pump it up! We're close now. Top Contributors 77 purplelammashta TB 2 TMDb Bot 1 Amanda  View Edit History Popularity Trend  Login to edit  URL By  signing up  for an account on TMDb, you can post directly to Twitter and Facebook. You need to be logged in to continue. Click  here  to login or  here  to sign up.    page_wrap opened in html_head  Join the Community The Basics About TMDb Contact Us Support Forums API Blog Get Involved  Contribution Bible 3rd Party Applications Add New Movie Add New TV Show Community Guidelines Leaderboard Forums Twitter Facebook Legal Terms of Use Privacy Policy Login Sign Up"}