{"link": "https://www.themoviedb.org/tv/37314?language=en", "title": "Doctor Kkaeng", "resume": "We don't have an overview translated in English. Help us expand our database by adding one.", "rate": 75, "genre": ["Drama"], "cast": ["Ha Seok-jin", "Yang Dong-geun", "Han Ga-in", "Lee Jong-hyuk"], "character": ["Seok Hee-jung"], "site_data": "html Apps Forums Leaderboard Contribute API Support Discover Movies TV Shows Movies Popular Top Rated Upcoming Now Playing TV Shows Popular Top Rated On TV Airing Today People Popular People Can't find a movie or TV show? Login to create it. en Login Sign Up  ID: 37314   Expand Doctor Kkaeng   (2006) User Score Overview We don't have an overview translated in English. Help us expand our database by adding one. Discussions   Reviews Videos   Images   Changes Report Share Discussions General  0 Content Issues  0 Images Backdrops  1 Posters  2 Videos Trailers  0 Teasers  0 Clips  0 Featurettes  0 Opening Credits  0 Top Billed Cast Ha Seok-jin Yang Dong-geun Han Ga-in Lee Jong-hyuk Seok Hee-jung Full Cast & Crew Last Season Season 1 \u2014 | 16 Episodes We don't have an overview translated in English. Help us expand our database by adding one. View All Seasons Social Reviews  0 Discussions  0 Media Most Popular Videos  0 Backdrops  1 Posters  2 Recommendations We don't have enough data to suggest any TV shows based on Doctor Kkaeng. You can help by rating TV shows you've seen. Facts Original Name  \ub2e5\ud130\uae7d Status  Ended Network Certification  - Type  Scripted Original Language  Korean Runtime  - Homepage   http://www.imbc.com/broad/tv/drama/drkkang/ Genres Drama Keywords No keywords have been added. Content Score 79 Pump it up! We're close now. Top Contributors N 18 Nightowl.Kr t 5 tmdb983464 t 3 tmdb38202327 1 Elizabeth Jennings  View Edit History Popularity Trend  Login to edit  URL By  signing up  for an account on TMDb, you can post directly to Twitter and Facebook. You need to be logged in to continue. Click  here  to login or  here  to sign up.    page_wrap opened in html_head  Join the Community The Basics About TMDb Contact Us Support Forums API Blog Get Involved  Contribution Bible 3rd Party Applications Add New Movie Add New TV Show Community Guidelines Leaderboard Forums Twitter Facebook Legal Terms of Use Privacy Policy Login Sign Up"}