{"link": "https://www.themoviedb.org/tv/77574?language=en", "title": "Kanats\u0131z Ku\u015flar", "resume": "We don't have an overview translated in English. Help us expand our database by adding one.", "rate": 0, "genre": ["Drama"], "cast": ["Deniz Bol\u0131\u015f\u0131k", "Fatih Al", "Servet Pandur", "Ahmet Varl\u0131", "\u00dcmit \u0130brahim Kantarc\u0131lar"], "character": ["Nefise", "Muzaffer", "Azime", "Ahmet", "Onur"], "site_data": "html Apps Forums Leaderboard Contribute API Support Discover Movies TV Shows Movies Popular Top Rated Upcoming Now Playing TV Shows Popular Top Rated On TV Airing Today People Popular People Can't find a movie or TV show? Login to create it. en Login Sign Up  ID: 77574   Expand Kanats\u0131z Ku\u015flar   (2017) User Score Overview We don't have an overview translated in English. Help us expand our database by adding one. Featured Crew Kemal Uzun Creator Serkan \u0130pek\u00f6ren Creator Adnan G\u00fcler Creator Discussions   Reviews Videos   Images   Changes Report Share Discussions General  0 Content Issues  0 Images Backdrops  1 Posters  1 Videos Trailers  0 Teasers  0 Clips  0 Featurettes  0 Opening Credits  0 Top Billed Cast Deniz Bol\u0131\u015f\u0131k Nefise Fatih Al Muzaffer Servet Pandur Azime Ahmet Varl\u0131 Ahmet \u00dcmit \u0130brahim Kantarc\u0131lar Onur Full Cast & Crew Last Season Season 1 2017 | 36 Episodes Season 1 of Kanats\u0131z Ku\u015flar premiered on June 15, 2017. View All Seasons Social Reviews  0 Discussions  0 Media Most Popular Videos  0 Backdrops  1 Posters  1 Recommendations We don't have enough data to suggest any TV shows based on Kanats\u0131z Ku\u015flar. You can help by rating TV shows you've seen. Facts Status  Returning Series Network Certification  - Type  Scripted Original Language  Turkish Runtime  140m Homepage  - Genres Drama Keywords No keywords have been added. Content Score 86 Almost there... Top Contributors 34 moviefars 5 Elizabeth Jennings  View Edit History Popularity Trend  Login to edit  URL By  signing up  for an account on TMDb, you can post directly to Twitter and Facebook. You need to be logged in to continue. Click  here  to login or  here  to sign up.    page_wrap opened in html_head  Join the Community The Basics About TMDb Contact Us Support Forums API Blog Get Involved  Contribution Bible 3rd Party Applications Add New Movie Add New TV Show Community Guidelines Leaderboard Forums Twitter Facebook Legal Terms of Use Privacy Policy Login Sign Up"}