{"link": "https://www.themoviedb.org/tv/6143?language=en", "title": "Quatermass and the Pit", "resume": "A team of scientists search for the origin and purpose of a mysterious capsule found on a building site.", "rate": null, "genre": ["Drama"], "cast": ["Andr\u00e9 Morell", "Cec Linder", "John Stratton", "Christine Finn", "Anthony Bushell"], "site_data": "html Apps Forums Leaderboard Contribute API Support Discover Movies TV Shows Movies Popular Top Rated Upcoming Now Playing TV Shows Popular Top Rated On TV Airing Today People Popular People Can't find a movie or TV show? Login to create it. en Login Sign Up  ID: 6143   Expand Quatermass and the Pit   (1958) User Score Overview A team of scientists search for the origin and purpose of a mysterious capsule found on a building site. Featured Crew Nigel Kneale Creator Discussions   Reviews Videos   Images   Changes Report Share Discussions General  0 Content Issues  0 Images Backdrops  2 Posters  3 Videos Trailers  0 Teasers  0 Clips  0 Featurettes  0 Opening Credits  0 Top Billed Cast Andr\u00e9 Morell Professor Bernard Quatermass Cec Linder Dr. Matthew Roney John Stratton Captain Potter Christine Finn Barbara Judd Anthony Bushell Colonel James Breen Full Cast & Crew Last Season Miniseries 1958 | 6 Episodes Season 1 of Quatermass and the Pit premiered on December 22, 1958. View All Seasons Social Reviews  0 Discussions  0 Media Most Popular Videos  0 Backdrops  2 Posters  3 Recommendations We don't have enough data to suggest any TV shows based on Quatermass and the Pit. You can help by rating TV shows you've seen. Facts Status  Ended Network Certification  - Type  Miniseries Original Language  English Runtime  30m Homepage   http://www.bbc.co.uk/programmes/p00trhv3 Genres Drama Keywords miniseries quatermass Content Score 93 Almost there... Top Contributors TB 14 TMDb Bot R 12 Rebecca i 3 icievici  View Edit History Popularity Trend  Login to edit  URL By  signing up  for an account on TMDb, you can post directly to Twitter and Facebook. You need to be logged in to continue. Click  here  to login or  here  to sign up.    page_wrap opened in html_head  Join the Community The Basics About TMDb Contact Us Support Forums API Blog Get Involved  Contribution Bible 3rd Party Applications Add New Movie Add New TV Show Community Guidelines Leaderboard Forums Twitter Facebook Legal Terms of Use Privacy Policy Login Sign Up", "character": ["Professor Bernard Quatermass", "Dr. Matthew Roney", "Captain Potter", "Barbara Judd", "Colonel James Breen"]}