{"link": "https://www.themoviedb.org/tv/19237?language=en", "title": "Transformers: The Headmasters", "resume": "Following on The Return of Optimus Prime (and in place of The Rebirth), The Headmasters is the first Japanese-exclusive Transformers franchise.", "rate": 67, "genre": ["Animation", "Science", "Fiction"], "cast": ["Ikuya Sawaki", "Tomiko Suzuki", "Hideyuki Hori", "Ry\u014dichi Tanaka", "Masato Hirano"], "character": ["Fortress Maximus", "Daniel Witwicky", "Chromedome", "Brainstorm", "Hardhead"], "site_data": "html Apps Forums Leaderboard Contribute API Support Discover Movies TV Shows Movies Popular Top Rated Upcoming Now Playing TV Shows Popular Top Rated On TV Airing Today People Popular People Can't find a movie or TV show? Login to create it. en Login Sign Up  ID: 19237   Expand Transformers: The Headmasters   (1987) User Score Overview Following on The Return of Optimus Prime (and in place of The Rebirth), The Headmasters is the first Japanese-exclusive Transformers franchise. Discussions   Reviews Videos   Images   Changes Report Share Discussions General  0 Content Issues  0 Images Backdrops  3 Posters  4 Videos Trailers  0 Teasers  0 Clips  0 Featurettes  0 Opening Credits  0 Top Billed Cast Ikuya Sawaki Fortress Maximus Tomiko Suzuki Daniel Witwicky Hideyuki Hori Chromedome Ry\u014dichi Tanaka Brainstorm Masato Hirano Hardhead Full Cast & Crew Last Season Season 1 1987 | 35 Episodes Season 1 of Transformers: The Headmasters premiered on July  2, 1987. View All Seasons Social Reviews  0 Discussions  0 Media Most Popular Videos  0 Backdrops  3 Posters  4 Recommendations We don't have enough data to suggest any TV shows based on Transformers: The Headmasters. You can help by rating TV shows you've seen. Facts Original Name  \u30c8\u30e9\u30f3\u30b9\u30d5\u30a9\u30fc\u30de\u30fc \u30b6\u2605\u30d8\u30c3\u30c9\u30de\u30b9\u30bf\u30fc\u30ba Status  Ended Network Certification  - Type  Scripted Original Language  Japanese Runtime  - Homepage  - Genres Animation Science Fiction Keywords No keywords have been added. Content Score 86 Almost there... Top Contributors 28 betsumei s 3 sheva_vitali 2 Travis Bell TB 2 TMDb Bot  View Edit History Popularity Trend  Login to edit  URL By  signing up  for an account on TMDb, you can post directly to Twitter and Facebook. You need to be logged in to continue. Click  here  to login or  here  to sign up.    page_wrap opened in html_head  Join the Community The Basics About TMDb Contact Us Support Forums API Blog Get Involved  Contribution Bible 3rd Party Applications Add New Movie Add New TV Show Community Guidelines Leaderboard Forums Twitter Facebook Legal Terms of Use Privacy Policy Login Sign Up"}