{"link": "https://www.themoviedb.org/tv/62404?language=en", "title": "The Next Step", "resume": "Follow the lives of an elite group of young dancers who train at The Next Step Studio.", "rate": 40, "genre": ["Family", "Drama"], "cast": ["Victoria Baldeserra", "Brittany Raymond"], "character": ["Michelle", "Riley"], "site_data": "html Apps Forums Leaderboard Contribute API Support Discover Movies TV Shows Movies Popular Top Rated Upcoming Now Playing TV Shows Popular Top Rated On TV Airing Today People Popular People Can't find a movie or TV show? Login to create it. en Login Sign Up  ID: 62404   Expand The Next Step   (2013) User Score  Play Trailer Overview Follow the lives of an elite group of young dancers who train at The Next Step Studio. Featured Crew Frank Van Keeken Creator Discussions   Reviews Videos   Images   Changes Report Share Discussions General  3 Content Issues  0 Images Backdrops  1 Posters  1 Videos Trailers  1 Teasers  0 Clips  0 Featurettes  0 Opening Credits  0 Top Billed Cast Victoria Baldeserra Michelle Brittany Raymond Riley Full Cast & Crew Last Season Season 5 2017 | 5 Episodes Season 5 of The Next Step premiered on May 28, 2017. View All Seasons Social Reviews  0 Discussions  3 Subject Status Replies Last Reply w Amy: Happy Birthday Shelby Bain! Open 0 by wonder2wonder\n      \n     w Michelle: Happy Birthday Victoria Baldesarra! Open 0 by wonder2wonder\n      \n     w Noah: Happy Birthday Myles Erlick! Open 0 by wonder2wonder\n      \n     Go to Discussions Media Most Popular Videos  1 Backdrops  1 Posters  1 Recommendations   2007-09-24 The Big Bang Theory 6.8  Facts Status  Returning Series Network Certification  - Type  Scripted Original Language  English Runtime  45m Homepage   https://family.ca/shows/the-next-step/ Genres Family Drama Keywords dance dancer sport mockumentary teen drama Content Score 71 Just a little bit more... Top Contributors 57 Banana 25 Elizabeth Jennings m 7 mario J 4 JoshieRawr  View Edit History Popularity Trend  Login to edit  URL By  signing up  for an account on TMDb, you can post directly to Twitter and Facebook. You need to be logged in to continue. Click  here  to login or  here  to sign up.    page_wrap opened in html_head  Join the Community The Basics About TMDb Contact Us Support Forums API Blog Get Involved  Contribution Bible 3rd Party Applications Add New Movie Add New TV Show Community Guidelines Leaderboard Forums Twitter Facebook Legal Terms of Use Privacy Policy Login Sign Up"}