{"link": "https://www.themoviedb.org/tv/76211?language=en", "title": "eLegal", "resume": "We don't have an overview translated in English. Help us expand our database by adding one.", "rate": 0, "genre": ["Crime", "Mystery"], "cast": ["Olivia Harkay", "Adrien Letartre", "Rapha\u00eblle Lubansu"], "character": ["Valentine Dh\u00e9naut", "Th\u00e9o Jacobs", "Fran Gerrits"], "site_data": "html Apps Forums Leaderboard Contribute API Support Discover Movies TV Shows Movies Popular Top Rated Upcoming Now Playing TV Shows Popular Top Rated On TV Airing Today People Popular People Can't find a movie or TV show? Login to create it. en Login Sign Up  ID: 76211   Expand eLegal   (2018) User Score Overview We don't have an overview translated in English. Help us expand our database by adding one. Featured Crew Alain Brunard Creator Discussions   Reviews Videos   Images   Changes Report Share Discussions General  0 Content Issues  0 Images Backdrops  1 Posters  2 Videos Trailers  0 Teasers  0 Clips  0 Featurettes  0 Opening Credits  0 Top Billed Cast Olivia Harkay Valentine Dh\u00e9naut Adrien Letartre Th\u00e9o Jacobs Rapha\u00eblle Lubansu Fran Gerrits Full Cast & Crew Current Season Season 1 2018 | 10 Episodes Season 1 of eLegal premiered on January 13, 2018. View All Seasons Social Reviews  0 Discussions  0 Media Most Popular Videos  0 Backdrops  1 Posters  2 Recommendations We don't have enough data to suggest any TV shows based on eLegal. You can help by rating TV shows you've seen. Facts Status  Returning Series Network Certification  - Type  Scripted Original Language  French Runtime  55m Homepage   https://www.rtbf.be/tv/emission/detail_e-legal?emissionId=12337 Genres Crime Mystery Keywords internet cybercrime Content Score 64 We're so close, yet so far. Top Contributors 36 scorpio686 1 Maretoh  View Edit History Popularity Trend  Login to edit  URL By  signing up  for an account on TMDb, you can post directly to Twitter and Facebook. You need to be logged in to continue. Click  here  to login or  here  to sign up.    page_wrap opened in html_head  Join the Community The Basics About TMDb Contact Us Support Forums API Blog Get Involved  Contribution Bible 3rd Party Applications Add New Movie Add New TV Show Community Guidelines Leaderboard Forums Twitter Facebook Legal Terms of Use Privacy Policy Login Sign Up"}