{"link": "https://www.themoviedb.org/tv/40684?language=en", "title": "Die rote Zora und ihre Bande", "resume": "Die rote Zora und ihre Bande is a German television series.", "rate": 83, "genre": ["Action", "Adventure", "Family"], "cast": ["Lidija Kovacevic"], "character": ["Zora"], "site_data": "html Apps Forums Leaderboard Contribute API Support Discover Movies TV Shows Movies Popular Top Rated Upcoming Now Playing TV Shows Popular Top Rated On TV Airing Today People Popular People Can't find a movie or TV show? Login to create it. en Login Sign Up  ID: 40684   Expand Die rote Zora und ihre Bande   (1980) User Score Overview Die rote Zora und ihre Bande is a German television series. Discussions   Reviews Videos   Images   Changes Report Share Discussions General  0 Content Issues  0 Images Backdrops  1 Posters  2 Videos Trailers  0 Teasers  0 Clips  0 Featurettes  0 Opening Credits  0 Top Billed Cast Lidija Kovacevic Zora Full Cast & Crew Last Season Season 1 1980 | 13 Episodes Season 1 of Die rote Zora und ihre Bande premiered on January  1, 1980. View All Seasons Social Reviews  0 Discussions  0 Media Most Popular Videos  0 Backdrops  1 Posters  2 Recommendations We don't have enough data to suggest any TV shows based on Die rote Zora und ihre Bande. You can help by rating TV shows you've seen. Facts Status  Ended Network Certification  - Type  Scripted Original Language  Serbo-Croatian Runtime  30m Homepage  - Genres Action & Adventure Family Keywords No keywords have been added. Content Score 56 We're so close, yet so far. Top Contributors S 14 Samara d 7 denis  View Edit History Popularity Trend  Login to edit  URL By  signing up  for an account on TMDb, you can post directly to Twitter and Facebook. You need to be logged in to continue. Click  here  to login or  here  to sign up.    page_wrap opened in html_head  Join the Community The Basics About TMDb Contact Us Support Forums API Blog Get Involved  Contribution Bible 3rd Party Applications Add New Movie Add New TV Show Community Guidelines Leaderboard Forums Twitter Facebook Legal Terms of Use Privacy Policy Login Sign Up"}