{"link": "https://www.themoviedb.org/tv/78580?language=en", "title": "Signal", "resume": "Two detectives communicate through a walkie-talkie to solve a cold case. One detective exists in the present day and the other detective exists 15 years in the past.", "rate": 0, "genre": ["Crime"], "cast": ["Kentaro Sakaguchi", "Kazuki Kitamura", "Michiko Kichise", "Yuichi Kimura", "Tetsuhiro Ikeda"], "character": ["Kento Saegusa", "Takeshi Ooyama", "Misaki Sakurai", "Tsutomu Yamada", "Shinya Kojima"], "site_data": "html Apps Forums Leaderboard Contribute API Support Discover Movies TV Shows Movies Popular Top Rated Upcoming Now Playing TV Shows Popular Top Rated On TV Airing Today People Popular People Can't find a movie or TV show? Login to create it. en Login Sign Up  ID: 78580   Expand Signal   (2018) User Score Overview Two detectives communicate through a walkie-talkie to solve a cold case. One detective exists in the present day and the other detective exists 15 years in the past. Discussions   Reviews Videos   Images   Changes Report Share Discussions General  0 Content Issues  0 Images Backdrops  1 Posters  1 Videos Trailers  0 Teasers  0 Clips  0 Featurettes  0 Opening Credits  0 Top Billed Cast Kentaro Sakaguchi Kento Saegusa Kazuki Kitamura Takeshi Ooyama Michiko Kichise Misaki Sakurai Yuichi Kimura Tsutomu Yamada Tetsuhiro Ikeda Shinya Kojima Full Cast & Crew Current Season Season 1 2018 | 5 Episodes Season 1 of Signal premiered on April 10, 2018. View All Seasons Social Reviews  0 Discussions  0 Media Most Popular Videos  0 Backdrops  1 Posters  1 Recommendations We don't have enough data to suggest any TV shows based on Signal. You can help by rating TV shows you've seen. Facts Original Name  \u30b7\u30b0\u30ca\u30eb \u9577\u671f\u672a\u89e3\u6c7a\u4e8b\u4ef6\u635c\u67fb\u73ed Status  Returning Series Networks Certification  - Type  Scripted Original Language  Japanese Runtime  54m Homepage   https://www.ktv.jp/signal/ Genres Crime Keywords remake Content Score 86 Almost there... Top Contributors M 27 Maria180493 R 1 RJ_F13 1 kronix  View Edit History Popularity Trend  Login to edit  URL By  signing up  for an account on TMDb, you can post directly to Twitter and Facebook. You need to be logged in to continue. Click  here  to login or  here  to sign up.    page_wrap opened in html_head  Join the Community The Basics About TMDb Contact Us Support Forums API Blog Get Involved  Contribution Bible 3rd Party Applications Add New Movie Add New TV Show Community Guidelines Leaderboard Forums Twitter Facebook Legal Terms of Use Privacy Policy Login Sign Up"}