{"link": "https://www.themoviedb.org/tv/70951?language=en", "title": "Folkevalgt", "resume": "What happens when the mayor of the small town, Hitra, is given a seat at the Norwegian Parliament?", "rate": null, "genre": ["Comedy"], "cast": ["John Brungot", "Mads Ousdal", "Erland Bakker", "Caroline Glomnes Johansen"], "site_data": "html Apps Forums Leaderboard Contribute API Support Discover Movies TV Shows Movies Popular Top Rated Upcoming Now Playing TV Shows Popular Top Rated On TV Airing Today People Popular People Can't find a movie or TV show? Login to create it. en Login Sign Up  ID: 70951   Expand Folkevalgt   (2017) User Score Overview What happens when the mayor of the small town, Hitra, is given a seat at the Norwegian Parliament? Discussions   Reviews Videos   Images   Changes Report Share Discussions General  0 Content Issues  0 Images Backdrops  5 Posters  1 Videos Trailers  0 Teasers  0 Clips  0 Featurettes  0 Opening Credits  0 Top Billed Cast John Brungot Roy Myren Talseth Mads Ousdal Jan Ivar Holt Erland Bakker Sverre Lie Caroline Glomnes Johansen Kathrine Grieg Full Cast & Crew Last Season Season 1 2017 | 8 Episodes Season 1 of Folkevalgt premiered on March 30, 2017. View All Seasons Social Reviews  0 Discussions  0 Media Most Popular Videos  0 Backdrops  5 Posters  1 Recommendations We don't have enough data to suggest any TV shows based on Folkevalgt. You can help by rating TV shows you've seen. Facts Status  Returning Series Network Certification  - Type  Scripted Original Language  Norwegian Runtime  22m Homepage   https://sumo.tv2.no/programmer/serier/folkevalgt/ Genres Comedy Keywords politics politician Content Score 86 Almost there... Top Contributors 50 Bendik  View Edit History Popularity Trend  Login to edit  URL By  signing up  for an account on TMDb, you can post directly to Twitter and Facebook. You need to be logged in to continue. Click  here  to login or  here  to sign up.    page_wrap opened in html_head  Join the Community The Basics About TMDb Contact Us Support Forums API Blog Get Involved  Contribution Bible 3rd Party Applications Add New Movie Add New TV Show Community Guidelines Leaderboard Forums Twitter Facebook Legal Terms of Use Privacy Policy Login Sign Up", "character": ["Roy Myren Talseth", "Jan Ivar Holt", "Sverre Lie", "Kathrine Grieg"]}