{"link": "https://www.themoviedb.org/tv/48455?language=en", "title": "101st Marriage Proposal", "resume": "We don't have an overview translated in English. Help us expand our database by adding one.", "rate": null, "genre": ["Drama"], "cast": ["Atsuko Asano", "Tetsuya Takeda", "Yosuke Eguchi", "Ritsuko Tanaka", "Yuriko Ishida"], "site_data": "html Apps Forums Leaderboard Contribute API Support Discover Movies TV Shows Movies Popular Top Rated Upcoming Now Playing TV Shows Popular Top Rated On TV Airing Today People Popular People Can't find a movie or TV show? Login to create it. en Login Sign Up  ID: 48455   Expand 101st Marriage Proposal   (1991) User Score Overview We don't have an overview translated in English. Help us expand our database by adding one. Discussions   Reviews Videos   Images   Changes Report Share Discussions General  0 Content Issues  0 Images Backdrops  5 Posters  1 Videos Trailers  0 Teasers  0 Clips  0 Featurettes  0 Opening Credits  0 Top Billed Cast Atsuko Asano Yabuki Kaoru Tetsuya Takeda Hoshino Tatsurou Yosuke Eguchi Hoshino Junpei Ritsuko Tanaka Yabuki Chie Yuriko Ishida Okamura Ryoko Full Cast & Crew Last Season Season 01 1991 | 12 Episodes Season 1 of 101st Marriage Proposal premiered on June 30, 1991. View All Seasons Social Reviews  0 Discussions  0 Media Most Popular Videos  0 Backdrops  5 Posters  1 Recommendations We don't have enough data to suggest any TV shows based on 101st Marriage Proposal. You can help by rating TV shows you've seen. Facts Original Name  101\u56de\u76ee\u306e\u30d7\u30ed\u30dd\u30fc\u30ba Status  Ended Network Certification  - Type  Scripted Original Language  Japanese Runtime  50m Homepage  - Genres Drama Keywords japanese marriage romance Content Score 79 Pump it up! We're close now. Top Contributors A 30 Aka75 17 thirstyhippo t 15 taxigps TB 2 TMDb Bot  View Edit History Popularity Trend  Login to edit  URL By  signing up  for an account on TMDb, you can post directly to Twitter and Facebook. You need to be logged in to continue. Click  here  to login or  here  to sign up.    page_wrap opened in html_head  Join the Community The Basics About TMDb Contact Us Support Forums API Blog Get Involved  Contribution Bible 3rd Party Applications Add New Movie Add New TV Show Community Guidelines Leaderboard Forums Twitter Facebook Legal Terms of Use Privacy Policy Login Sign Up", "character": ["Yabuki Kaoru", "Hoshino Tatsurou", "Hoshino Junpei", "Yabuki Chie", "Okamura Ryoko"]}