{"link": "https://www.themoviedb.org/tv/73212?language=en", "title": "Empire of the Tsars: Romanov Russia with Lucy Worsley", "resume": "Lucy Worsley travels to Russia to tell the extraordinary story of the dynasty that ruled the country for more than three centuries - the Romanovs.", "rate": null, "genre": ["Documentary"], "cast": ["Lucy Worsley"], "site_data": "html Apps Forums Leaderboard Contribute API Support Discover Movies TV Shows Movies Popular Top Rated Upcoming Now Playing TV Shows Popular Top Rated On TV Airing Today People Popular People Can't find a movie or TV show? Login to create it. en Login Sign Up  ID: 73212   Expand Empire of the Tsars: Romanov Russia with Lucy Worsley   (2016) User Score Overview Lucy Worsley travels to Russia to tell the extraordinary story of the dynasty that ruled the country for more than three centuries - the Romanovs. Discussions   Reviews Videos   Images   Changes Report Share Discussions General  0 Content Issues  0 Images Backdrops  3 Posters  1 Videos Trailers  0 Teasers  0 Clips  0 Featurettes  0 Opening Credits  0 Top Billed Cast Lucy Worsley Herself - Presenter Full Cast & Crew Last Season Season 1 2016 | 3 Episodes Season 1 of Empire of the Tsars: Romanov Russia with Lucy Worsley premiered on January 10, 2016. View All Seasons Social Reviews  0 Discussions  0 Media Most Popular Videos  0 Backdrops  3 Posters  1 Recommendations We don't have enough data to suggest any TV shows based on Empire of the Tsars: Romanov Russia with Lucy Worsley. You can help by rating TV shows you've seen. Facts Status  Ended Network Certification  - Type  Miniseries Original Language  English Runtime  60m Homepage   http://www.bbc.co.uk/programmes/b06vmlcg Genres Documentary Keywords war russia god historical moscow tsar machine age abuse of power romanov Content Score 56 We're so close, yet so far. Top Contributors 20 david8s95 A 14 Alexlfm v 12 veboli 11 Elizabeth Jennings  View Edit History Popularity Trend  Login to edit  URL By  signing up  for an account on TMDb, you can post directly to Twitter and Facebook. You need to be logged in to continue. Click  here  to login or  here  to sign up.    page_wrap opened in html_head  Join the Community The Basics About TMDb Contact Us Support Forums API Blog Get Involved  Contribution Bible 3rd Party Applications Add New Movie Add New TV Show Community Guidelines Leaderboard Forums Twitter Facebook Legal Terms of Use Privacy Policy Login Sign Up", "character": ["Herself - Presenter"]}