{"link": "https://www.themoviedb.org/tv/75317?language=en", "title": "Sadan vuoden talo", "resume": "Man and a dream about building a house that will last at least 100 years.", "rate": null, "genre": ["Reality"], "cast": ["Esa Dahl", "Erik Dahl", "Jukka Koivula", "Jarmo M\u00e4kinen", "Elina Ristmeri"], "site_data": "html Apps Forums Leaderboard Contribute API Support Discover Movies TV Shows Movies Popular Top Rated Upcoming Now Playing TV Shows Popular Top Rated On TV Airing Today People Popular People Can't find a movie or TV show? Login to create it. en Login Sign Up  ID: 75317   Expand Sadan vuoden talo   (2017) User Score Overview Man and a dream about building a house that will last at least 100 years. Discussions   Reviews Videos   Images   Changes Report Share Discussions General  0 Content Issues  0 Images Backdrops  1 Posters  1 Videos Trailers  0 Teasers  0 Clips  0 Featurettes  0 Opening Credits  0 Top Billed Cast Esa Dahl Himself Erik Dahl Himself Jukka Koivula Himself Jarmo M\u00e4kinen Himself Elina Ristmeri Herself Full Cast & Crew Current Season Season 1 2017 | 10 Episodes Season 1 of Sadan vuoden talo premiered on October 19, 2017. View All Seasons Social Reviews  0 Discussions  0 Media Most Popular Videos  0 Backdrops  1 Posters  1 Recommendations We don't have enough data to suggest any TV shows based on Sadan vuoden talo. You can help by rating TV shows you've seen. Facts Status  Ended Network Certification  - Type  Reality Original Language  Finnish Runtime  27m Homepage   https://yle.fi/aihe/sadan-vuoden-talo Genres Reality Keywords lifestyle construction site building construction worker Content Score 86 Almost there... Top Contributors 24 BryGur w 21 willo123 8 Elizabeth Jennings  View Edit History Popularity Trend  Login to edit  URL By  signing up  for an account on TMDb, you can post directly to Twitter and Facebook. You need to be logged in to continue. Click  here  to login or  here  to sign up.    page_wrap opened in html_head  Join the Community The Basics About TMDb Contact Us Support Forums API Blog Get Involved  Contribution Bible 3rd Party Applications Add New Movie Add New TV Show Community Guidelines Leaderboard Forums Twitter Facebook Legal Terms of Use Privacy Policy Login Sign Up", "character": ["Himself", "Himself", "Himself", "Himself", "Herself"]}