{"link": "https://www.themoviedb.org/tv/70428?language=en", "title": "Sworn to Secrecy: Secrets of War", "resume": "Secrets are divulged and stories of espionage, conspiracy, murder, sabotage and greed are uncovered.", "rate": 0, "genre": ["War", "Politics", "Documentary"], "cast": ["Charlton Heston"], "character": ["Narrator (voice)"], "site_data": "html Apps Forums Leaderboard Contribute API Support Discover Movies TV Shows Movies Popular Top Rated Upcoming Now Playing TV Shows Popular Top Rated On TV Airing Today People Popular People Can't find a movie or TV show? Login to create it. en Login Sign Up  ID: 70428   Expand Sworn to Secrecy: Secrets of War   (1998) User Score Overview Secrets are divulged and stories of espionage, conspiracy, murder, sabotage and greed are uncovered. Discussions   Reviews Videos   Images   Changes Report Share Discussions General  0 Content Issues  0 Images Backdrops  0 Posters  1 Videos Trailers  0 Teasers  0 Clips  0 Featurettes  0 Opening Credits  0 Top Billed Cast Charlton Heston Narrator (voice) Full Cast & Crew Last Season Espionage 1998 | 10 Episodes View All Seasons Social Reviews  0 Discussions  0 Media Most Popular Videos  0 Backdrops  0 Posters  1 Recommendations We don't have enough data to suggest any TV shows based on Sworn to Secrecy: Secrets of War. You can help by rating TV shows you've seen. Facts Status  Ended Network Certification  - Type  Documentary Original Language  English Runtime  60m Homepage  - Genres War & Politics Documentary Keywords vietnam war gulf war world war i spy cold war world war ii third reich Content Score 43 There's no 'I' in team... Top Contributors 59 Marr \ud83c\uddf3\ud83c\uddf1 TB 2 TMDb Bot  View Edit History Popularity Trend  Login to edit  URL By  signing up  for an account on TMDb, you can post directly to Twitter and Facebook. You need to be logged in to continue. Click  here  to login or  here  to sign up.    page_wrap opened in html_head  Join the Community The Basics About TMDb Contact Us Support Forums API Blog Get Involved  Contribution Bible 3rd Party Applications Add New Movie Add New TV Show Community Guidelines Leaderboard Forums Twitter Facebook Legal Terms of Use Privacy Policy Login Sign Up"}