{"link": "https://www.themoviedb.org/tv/60780?language=en", "title": "Four in a Bed", "resume": "Four pairs of B&B owners from across Britain take it in turns as hosts to decide which of their establishments provides the best value for money.", "rate": 70, "genre": ["Reality"], "cast": ["Mike Adams"], "character": ["Himself - Narrator"], "site_data": "html Apps Forums Leaderboard Contribute API Support Discover Movies TV Shows Movies Popular Top Rated Upcoming Now Playing TV Shows Popular Top Rated On TV Airing Today People Popular People Can't find a movie or TV show? Login to create it. en Login Sign Up  ID: 60780   Expand Four in a Bed   (2010) User Score Overview Four pairs of B&B owners from across Britain take it in turns as hosts to decide which of their establishments provides the best value for money. Discussions   Reviews Videos   Images   Changes Report Share Discussions General  0 Content Issues  0 Images Backdrops  1 Posters  1 Videos Trailers  0 Teasers  0 Clips  0 Featurettes  0 Opening Credits  0 Top Billed Cast Mike Adams Himself - Narrator Full Cast & Crew Last Season Season 11 2016 | 2 Episodes Season 8 of Four in a Bed premiered on October  3, 2016. View All Seasons Social Reviews  0 Discussions  0 Media Most Popular Videos  0 Backdrops  1 Posters  1 Recommendations We don't have enough data to suggest any TV shows based on Four in a Bed. You can help by rating TV shows you've seen. Facts Status  Returning Series Network Certification  - Type  Reality Original Language  English Runtime  30m Homepage   http://www.channel4.com/programmes/four-in-a-bed Genres Reality Keywords bed and breakfast place Content Score 56 We're so close, yet so far. Top Contributors 31 Elizabeth Jennings A 2 Aukland 2 mojodo 1 Banana  View Edit History Popularity Trend  Login to edit  URL By  signing up  for an account on TMDb, you can post directly to Twitter and Facebook. You need to be logged in to continue. Click  here  to login or  here  to sign up.    page_wrap opened in html_head  Join the Community The Basics About TMDb Contact Us Support Forums API Blog Get Involved  Contribution Bible 3rd Party Applications Add New Movie Add New TV Show Community Guidelines Leaderboard Forums Twitter Facebook Legal Terms of Use Privacy Policy Login Sign Up"}