{"link": "https://www.themoviedb.org/tv/70672?language=en", "title": "Knowing Bros", "resume": "Male celebs play make-believe as high schoolers, welcoming star transfer students every week and engaging in battles of witty humor and slapstick.", "rate": 80, "genre": ["Reality"], "cast": ["Kang Ho-dong", "Lee Soo-geun", "Kim Hee-chul", "Seo Jang-hoon", "Kim Young-cheol"], "character": ["Oldest Brother, Bat", "Ace", "Psycho, TV Mania, Mr. Kim Stop It", "Ssamja's Father, Fact Bomber", "D.a.n.g Boss"], "site_data": "html Apps Forums Leaderboard Contribute API Support Discover Movies TV Shows Movies Popular Top Rated Upcoming Now Playing TV Shows Popular Top Rated On TV Airing Today People Popular People Can't find a movie or TV show? Login to create it. en Login Sign Up  ID: 70672   Expand Knowing Bros   (2015) User Score Overview Male celebs play make-believe as high schoolers, welcoming star transfer students every week and engaging in battles of witty humor and slapstick. Discussions   Reviews Videos   Images   Changes Report Share Discussions General  0 Content Issues  1 Images Backdrops  3 Posters  2 Videos Trailers  0 Teasers  0 Clips  0 Featurettes  0 Opening Credits  0 Top Billed Cast Kang Ho-dong Oldest Brother, Bat Lee Soo-geun Ace Kim Hee-chul Psycho, TV Mania, Mr. Kim Stop It Seo Jang-hoon Ssamja's Father, Fact Bomber Kim Young-cheol D.a.n.g Boss Full Cast & Crew Last Season Season 1 2015 | 128 Episodes Season 1 of Knowing Bros premiered on December  5, 2015. View All Seasons Social Reviews  0 Discussions  1 Subject Status Replies Last Reply There are no discussions for Knowing Bros. Login to be first! Go to Discussions Media Most Popular Videos  0 Backdrops  3 Posters  2 Recommendations We don't have enough data to suggest any TV shows based on Knowing Bros. You can help by rating TV shows you've seen. Facts Original Name  \uc544\ub294 \ud615\ub2d8 Status  Returning Series Network Certification 15 Meaning This rating is for programs that contain material that may be inappropriate for children under 15, and that parental discretion should be used. Examples include most dramas, and talk shows on OTA (over-the-air) TV (KBS, MBC, SBS), and many American TV shows/dramas on Cable TV channels like OCN and OnStyle. The programs that have this rating may include moderate or strong adult themes, language, sexual inference, and violence. As with the TV-MA rating in North America, this rating is commonly applied to live events where the occurrence of inappropriate dialogue is unpredictable. Since 2007, this rating is the most used rating for TV. Type  Reality Original Language  Korean Runtime  70m Homepage   http://enter.jtbc.joins.com/jtbcbros Genres Reality Keywords No keywords have been added. Content Score 86 Almost there... Top Contributors a 30 azh-idfl W 26 Wassup789 4 adamsp09 4 Elizabeth Jennings  View Edit History Popularity Trend  Login to edit  URL By  signing up  for an account on TMDb, you can post directly to Twitter and Facebook. You need to be logged in to continue. Click  here  to login or  here  to sign up.    page_wrap opened in html_head  Join the Community The Basics About TMDb Contact Us Support Forums API Blog Get Involved  Contribution Bible 3rd Party Applications Add New Movie Add New TV Show Community Guidelines Leaderboard Forums Twitter Facebook Legal Terms of Use Privacy Policy Login Sign Up"}