{"link": "https://www.themoviedb.org/tv/77647?language=en", "title": "Polda", "resume": "We don't have an overview translated in English. Help us expand our database by adding one.", "rate": 60, "genre": ["Crime", "Comedy"], "cast": ["David Mat\u00e1sek", "Igor Orozovi\u010d", "Ond\u0159ej Pavelka", "Ji\u0159\u00ed Vyor\u00e1lek", "Jana Koles\u00e1rov\u00e1"], "character": ["poru\u010d\u00edk Michal B\u0159\u00edza", "poru\u010d\u00edk Andrej K\u0159\u00ed\u017e", "major Martin Fi\u0161er", "MUDr. Richard Mr\u00e1z", "Mgr. T\u00e1\u0148a Ho\u0161kov\u00e1"], "site_data": "html Apps Forums Leaderboard Contribute API Support Discover Movies TV Shows Movies Popular Top Rated Upcoming Now Playing TV Shows Popular Top Rated On TV Airing Today People Popular People Can't find a movie or TV show? Login to create it. en Login Sign Up  ID: 77647   Expand Polda   (2016) User Score Overview We don't have an overview translated in English. Help us expand our database by adding one. Discussions   Reviews Videos   Images   Changes Report Share Discussions General  0 Content Issues  0 Images Backdrops  1 Posters  1 Videos Trailers  0 Teasers  0 Clips  0 Featurettes  0 Opening Credits  0 Top Billed Cast David Mat\u00e1sek poru\u010d\u00edk Michal B\u0159\u00edza Igor Orozovi\u010d poru\u010d\u00edk Andrej K\u0159\u00ed\u017e Ond\u0159ej Pavelka major Martin Fi\u0161er Ji\u0159\u00ed Vyor\u00e1lek MUDr. Richard Mr\u00e1z Jana Koles\u00e1rov\u00e1 Mgr. T\u00e1\u0148a Ho\u0161kov\u00e1 Full Cast & Crew Current Season Season 3 2018 | 8 Episodes Season 3 of Polda premiered on February  3, 2018. View All Seasons Social Reviews  0 Discussions  0 Media Most Popular Videos  0 Backdrops  1 Posters  1 Recommendations We don't have enough data to suggest any TV shows based on Polda. You can help by rating TV shows you've seen. Facts Status  Returning Series Network Certification  - Type  Scripted Original Language  Czech Runtime  55m Homepage   https://prima.iprima.cz/porady/polda Genres Crime Comedy Keywords No keywords have been added. Content Score 79 Pump it up! We're close now. Top Contributors 32 mara.pavelka D 3 Dave-Dave 5 1 5lucina5  View Edit History Popularity Trend  Login to edit  URL By  signing up  for an account on TMDb, you can post directly to Twitter and Facebook. You need to be logged in to continue. Click  here  to login or  here  to sign up.    page_wrap opened in html_head  Join the Community The Basics About TMDb Contact Us Support Forums API Blog Get Involved  Contribution Bible 3rd Party Applications Add New Movie Add New TV Show Community Guidelines Leaderboard Forums Twitter Facebook Legal Terms of Use Privacy Policy Login Sign Up"}