{"link": "https://www.themoviedb.org/tv/71142?language=en", "title": "\u0412\u0440\u0435\u043c\u0435\u043d\u043d\u043e \u043d\u0435\u0434\u043e\u0441\u0442\u0443\u043f\u0435\u043d", "resume": "We don't have an overview translated in English. Help us expand our database by adding one.", "rate": 0, "genre": ["Comedy"], "cast": ["Sergei Bezrukov", "Dmitriy Dyuzhev", "Valeriya Lanskaya", "Irina Bezrukova"], "character": ["barmaid"], "site_data": "html Apps Forums Leaderboard Contribute API Support Discover Movies TV Shows Movies Popular Top Rated Upcoming Now Playing TV Shows Popular Top Rated On TV Airing Today People Popular People Can't find a movie or TV show? Login to create it. en Login Sign Up  ID: 71142   Expand \u0412\u0440\u0435\u043c\u0435\u043d\u043d\u043e \u043d\u0435\u0434\u043e\u0441\u0442\u0443\u043f\u0435\u043d   (2015) User Score Overview We don't have an overview translated in English. Help us expand our database by adding one. Featured Crew Andrey Kivinov Creator Discussions   Reviews Videos   Images   Changes Report Share Discussions General  0 Content Issues  0 Images Backdrops  0 Posters  1 Videos Trailers  0 Teasers  0 Clips  0 Featurettes  0 Opening Credits  0 Top Billed Cast Sergei Bezrukov Dmitriy Dyuzhev Valeriya Lanskaya Irina Bezrukova barmaid Full Cast & Crew Last Season Season 1 2015 | 8 Episodes Season 1 of \u0412\u0440\u0435\u043c\u0435\u043d\u043d\u043e \u043d\u0435\u0434\u043e\u0441\u0442\u0443\u043f\u0435\u043d premiered on December 31, 2015. View All Seasons Social Reviews  0 Discussions  0 Media Most Popular Videos  0 Backdrops  0 Posters  1 Recommendations We don't have enough data to suggest any TV shows based on \u0412\u0440\u0435\u043c\u0435\u043d\u043d\u043e \u043d\u0435\u0434\u043e\u0441\u0442\u0443\u043f\u0435\u043d. You can help by rating TV shows you've seen. Facts Status  Ended Network Certification  - Type  Scripted Original Language  Russian Runtime  - Homepage  - Genres Comedy Keywords No keywords have been added. Content Score 71 Just a little bit more... Top Contributors e 24 evgeny1978 z 2 zoroman2017 TB 2 TMDb Bot 1 mrtextortexel  View Edit History Popularity Trend  Login to edit  URL By  signing up  for an account on TMDb, you can post directly to Twitter and Facebook. You need to be logged in to continue. Click  here  to login or  here  to sign up.    page_wrap opened in html_head  Join the Community The Basics About TMDb Contact Us Support Forums API Blog Get Involved  Contribution Bible 3rd Party Applications Add New Movie Add New TV Show Community Guidelines Leaderboard Forums Twitter Facebook Legal Terms of Use Privacy Policy Login Sign Up"}