{"link": "https://www.themoviedb.org/tv/17842?language=en", "title": "In the Beginning", "resume": "In the Beginning is a 2-part biblical television miniseries directed by Kevin Connor. It stars Martin Landau and Jacqueline Bisset and it premiered on NBC on November 12, 2000.", "rate": 67, "genre": ["Drama"], "cast": ["Frederick Weller", "Alan Bates", "Steven Berkoff", "Amanda Donohoe", "Christopher Lee"], "character": ["Jacob", "Jethro", "Potiphar", "Zuleika", "Rameses I"], "site_data": "html Apps Forums Leaderboard Contribute API Support Discover Movies TV Shows Movies Popular Top Rated Upcoming Now Playing TV Shows Popular Top Rated On TV Airing Today People Popular People Can't find a movie or TV show? Login to create it. en Login Sign Up  ID: 17842   Expand In the Beginning   (2000) User Score Overview In the Beginning is a 2-part biblical television miniseries directed by Kevin Connor. It stars Martin Landau and Jacqueline Bisset and it premiered on NBC on November 12, 2000. Discussions   Reviews Videos   Images   Changes Report Share Discussions General  0 Content Issues  0 Images Backdrops  2 Posters  5 Videos Trailers  0 Teasers  0 Clips  0 Featurettes  0 Opening Credits  0 Top Billed Cast Frederick Weller Jacob Alan Bates Jethro Steven Berkoff Potiphar Amanda Donohoe Zuleika Christopher Lee Rameses I Full Cast & Crew Last Season Season 1 2000 | 2 Episodes Season 1 of In the Beginning premiered on November 12, 2000. View All Seasons Social Reviews  0 Discussions  0 Media Most Popular Videos  0 Backdrops  2 Posters  5 Recommendations We don't have enough data to suggest any TV shows based on In the Beginning. You can help by rating TV shows you've seen. Facts Status  Ended Network Certification  - Type  Scripted Original Language  English Runtime  189m Homepage  - Genres Drama Keywords moses bible religion miniseries ancient egypt based on bible Content Score 86 Almost there... Top Contributors TB 54 TMDb Bot 26 Banana x 5 xmodder z 4 zurman1  View Edit History Popularity Trend  Login to edit  URL By  signing up  for an account on TMDb, you can post directly to Twitter and Facebook. You need to be logged in to continue. Click  here  to login or  here  to sign up.    page_wrap opened in html_head  Join the Community The Basics About TMDb Contact Us Support Forums API Blog Get Involved  Contribution Bible 3rd Party Applications Add New Movie Add New TV Show Community Guidelines Leaderboard Forums Twitter Facebook Legal Terms of Use Privacy Policy Login Sign Up"}