{"link": "https://www.themoviedb.org/tv/68478?language=en", "title": "Great Planes", "resume": "We don't have an overview translated in English. Help us expand our database by adding one.", "rate": 0, "genre": ["Documentary"], "cast": ["Paul Moga"], "character": ["Presenter - Himself"], "site_data": "html Apps Forums Leaderboard Contribute API Support Discover Movies TV Shows Movies Popular Top Rated Upcoming Now Playing TV Shows Popular Top Rated On TV Airing Today People Popular People Can't find a movie or TV show? Login to create it. en Login Sign Up  ID: 68478   Expand Great Planes   (2008) User Score Overview We don't have an overview translated in English. Help us expand our database by adding one. Discussions   Reviews Videos   Images   Changes Report Share Discussions General  0 Content Issues  0 Images Backdrops  3 Posters  1 Videos Trailers  0 Teasers  0 Clips  0 Featurettes  0 Opening Credits  0 Top Billed Cast Paul Moga Presenter - Himself Full Cast & Crew Last Season Season 2 2009 | 8 Episodes Season 2 of Great Planes premiered on July 10, 2009. View All Seasons Social Reviews  0 Discussions  0 Media Most Popular Videos  0 Backdrops  3 Posters  1 Recommendations We don't have enough data to suggest any TV shows based on Great Planes. You can help by rating TV shows you've seen. Facts Status  Ended Networks Certification  - Type  Documentary Original Language  English Runtime  - Homepage  - Genres Documentary Keywords airplane history aviation aircraft Content Score 50 Still needs a little work. Top Contributors 23 Aty 7 Elizabeth Jennings AF 4 Adam Flores FR 1 Frank Robby  View Edit History Popularity Trend  Login to edit  URL By  signing up  for an account on TMDb, you can post directly to Twitter and Facebook. You need to be logged in to continue. Click  here  to login or  here  to sign up.    page_wrap opened in html_head  Join the Community The Basics About TMDb Contact Us Support Forums API Blog Get Involved  Contribution Bible 3rd Party Applications Add New Movie Add New TV Show Community Guidelines Leaderboard Forums Twitter Facebook Legal Terms of Use Privacy Policy Login Sign Up"}