{"link": "https://www.themoviedb.org/tv/78145?language=en", "title": "HIStory2: Boundary Crossing", "resume": "We don't have an overview translated in English. Help us expand our database by adding one.", "rate": 0, "genre": ["Drama", "Kids"], "cast": ["Zack lu", "Shao-Hsun Fan", "Po-Yu Shih", "Meng-Lin Yang", "Meng-Lin Yang"], "character": ["Qiu Zi Xuan", "Xia Yu Hao", "Wang Zhen Wu", "Wang Zhen Wen", "Qiu Zi Xuan"], "site_data": "html Apps Forums Leaderboard Contribute API Support Discover Movies TV Shows Movies Popular Top Rated Upcoming Now Playing TV Shows Popular Top Rated On TV Airing Today People Popular People Can't find a movie or TV show? Login to create it. en Login Sign Up  ID: 78145   Expand HIStory2: Boundary Crossing   (2018) User Score Overview We don't have an overview translated in English. Help us expand our database by adding one. Discussions   Reviews Videos   Images   Changes Report Share Discussions General  0 Content Issues  0 Images Backdrops  0 Posters  2 Videos Trailers  0 Teasers  0 Clips  0 Featurettes  0 Opening Credits  0 Top Billed Cast Zack lu Qiu Zi Xuan Shao-Hsun Fan Xia Yu Hao Po-Yu Shih Wang Zhen Wu Meng-Lin Yang Wang Zhen Wen Meng-Lin Yang Qiu Zi Xuan Full Cast & Crew Current Season Season 1 2018 | 8 Episodes Season 1 of HIStory2: Boundary Crossing premiered on March  5, 2018. View All Seasons Social Reviews  0 Discussions  0 Media Most Popular Videos  0 Backdrops  0 Posters  2 Recommendations We don't have enough data to suggest any TV shows based on HIStory2: Boundary Crossing. You can help by rating TV shows you've seen. Facts Status  Returning Series Network CHOCO TV Certification  - Type  Scripted Original Language  Spanish; Castilian Runtime  - Homepage  - Genres Drama Kids Keywords gay escolar deporte Content Score 64 We're so close, yet so far. Top Contributors c 18 camus5896 y 6 yewenlong1984  View Edit History Popularity Trend  Login to edit  URL By  signing up  for an account on TMDb, you can post directly to Twitter and Facebook. You need to be logged in to continue. Click  here  to login or  here  to sign up.    page_wrap opened in html_head  Join the Community The Basics About TMDb Contact Us Support Forums API Blog Get Involved  Contribution Bible 3rd Party Applications Add New Movie Add New TV Show Community Guidelines Leaderboard Forums Twitter Facebook Legal Terms of Use Privacy Policy Login Sign Up"}