{"link": "https://www.themoviedb.org/tv/50111?language=en", "title": "The Best Divorce", "resume": "We don't have an overview translated in English. Help us expand our database by adding one.", "rate": null, "genre": ["Comedy", "Drama"], "cast": ["Eita", "Machiko Ono", "Yoko Maki", "Go Ayano", "Kaoru Yachigusa"], "site_data": "html Apps Forums Leaderboard Contribute API Support Discover Movies TV Shows Movies Popular Top Rated Upcoming Now Playing TV Shows Popular Top Rated On TV Airing Today People Popular People Can't find a movie or TV show? Login to create it. en Login Sign Up  ID: 50111   Expand The Best Divorce   (2013) User Score Overview We don't have an overview translated in English. Help us expand our database by adding one. Discussions   Reviews Videos   Images   Changes Report Share Discussions General  0 Content Issues  0 Images Backdrops  0 Posters  1 Videos Trailers  0 Teasers  0 Clips  0 Featurettes  0 Opening Credits  0 Top Billed Cast Eita Mitsuo Hamasaki Machiko Ono Yuka Hamasaki Yoko Maki Akari Uehara Go Ayano Ryo Uehara Kaoru Yachigusa Aiko Hamasaki Full Cast & Crew Last Season Season 1 2013 | 11 Episodes Season 1 of The Best Divorce premiered on January 10, 2013. View All Seasons Social Reviews  0 Discussions  0 Media Most Popular Videos  0 Backdrops  0 Posters  1 Recommendations We don't have enough data to suggest any TV shows based on The Best Divorce. You can help by rating TV shows you've seen. Facts Original Name  \u6700\u9ad8\u306e\u96e2\u5a5a Status  Ended Network Certification  - Type  Scripted Original Language  Japanese Runtime  45m Homepage   http://www.fujitv.co.jp/saikouno_rikon/index.html Genres Comedy Drama Keywords family relationships romance Content Score 64 We're so close, yet so far. Top Contributors o 40 okaime 3 fmsonic A 3 Aka75 s 2 suitepee  View Edit History Popularity Trend  Login to edit  URL By  signing up  for an account on TMDb, you can post directly to Twitter and Facebook. You need to be logged in to continue. Click  here  to login or  here  to sign up.    page_wrap opened in html_head  Join the Community The Basics About TMDb Contact Us Support Forums API Blog Get Involved  Contribution Bible 3rd Party Applications Add New Movie Add New TV Show Community Guidelines Leaderboard Forums Twitter Facebook Legal Terms of Use Privacy Policy Login Sign Up", "character": ["Mitsuo Hamasaki", "Yuka Hamasaki", "Akari Uehara", "Ryo Uehara", "Aiko Hamasaki"]}