{"link": "https://www.themoviedb.org/tv/76469?language=en", "title": "Miss Marple: Sleeping Murder", "resume": "When a young bride moves into a country manor, long repressed childhood memories of witnessing a murder come to the surface.", "rate": 70, "genre": ["Drama", "Crime"], "cast": ["Geraldine Alexander", "John Moulder-Brown", "Frederick Treves", "Jean Anderson", "Terrence Hardiman"], "character": ["Gwenda Reed", "Giles Reed", "Doctor James Kennedy", "Mrs. Fane", "Walter Fane"], "site_data": "html Apps Forums Leaderboard Contribute API Support Discover Movies TV Shows Movies Popular Top Rated Upcoming Now Playing TV Shows Popular Top Rated On TV Airing Today People Popular People Can't find a movie or TV show? Login to create it. en Login Sign Up  ID: 76469   Expand Miss Marple: Sleeping Murder   (1987) User Score Overview When a young bride moves into a country manor, long repressed childhood memories of witnessing a murder come to the surface. Featured Crew Agatha Christie Creator Discussions   Reviews Videos   Images   Changes Report Share Discussions General  0 Content Issues  0 Images Backdrops  7 Posters  5 Videos Trailers  0 Teasers  0 Clips  0 Featurettes  0 Opening Credits  0 Top Billed Cast Geraldine Alexander Gwenda Reed John Moulder-Brown Giles Reed Frederick Treves Doctor James Kennedy Jean Anderson Mrs. Fane Terrence Hardiman Walter Fane Full Cast & Crew Last Season Miniseries 1987 | 2 Episodes Season 1 of Miss Marple: Sleeping Murder premiered on January 11, 1987. View All Seasons Social Reviews  0 Discussions  0 Media Most Popular Videos  0 Backdrops  7 Posters  5 Recommendations   1987-01-25 Miss Marple: At Bertram's Hotel 6.7    1985-02-21 Miss Marple: The Moving Finger 7.7    1987-02-08 Miss Marple: Nemesis 7.5    1985-03-07 Miss Marple: A Pocketful of Rye 6.8    1984-12-26 Miss Marple: The Body in the Library 6.7    2007-05-26 Pandemic 4.4    2005-01-01 Hercules 5.3    2009-01-25 The Last Templar 5.0  Facts Status  Ended Network Certification  - Type  Miniseries Original Language  English Runtime  55m Homepage   http://www.bbc.co.uk/programmes/p04hqvhq Genres Drama Crime Keywords based on novel or book detective amateur detective suspense miniseries Content Score 93 Almost there... Top Contributors TB 52 TMDb Bot 20 Banana z 9 zoroman1975  View Edit History Popularity Trend  Login to edit  URL By  signing up  for an account on TMDb, you can post directly to Twitter and Facebook. You need to be logged in to continue. Click  here  to login or  here  to sign up.    page_wrap opened in html_head  Join the Community The Basics About TMDb Contact Us Support Forums API Blog Get Involved  Contribution Bible 3rd Party Applications Add New Movie Add New TV Show Community Guidelines Leaderboard Forums Twitter Facebook Legal Terms of Use Privacy Policy Login Sign Up"}