{"link": "https://www.themoviedb.org/tv/19166?language=en", "title": "Rapport till himlen", "resume": "Rapport till himlen is a 1994 Swedish mini series directed by Ulf Malmros and starring Johan Widerberg and Lina Englund.", "rate": null, "genre": ["Drama"], "cast": ["Johan Widerberg", "Lina Englund", "Stellan Skarsg\u00e5rd", "Kjell Bergqvist", "Thomas Hellberg"], "site_data": "html Apps Forums Leaderboard Contribute API Support Discover Movies TV Shows Movies Popular Top Rated Upcoming Now Playing TV Shows Popular Top Rated On TV Airing Today People Popular People Can't find a movie or TV show? Login to create it. en Login Sign Up  ID: 19166   Expand Rapport till himlen   (1994) User Score Overview Rapport till himlen is a 1994 Swedish mini series directed by Ulf Malmros and starring Johan Widerberg and Lina Englund. Discussions   Reviews Videos   Images   Changes Report Share Discussions General  0 Content Issues  0 Images Backdrops  1 Posters  1 Videos Trailers  0 Teasers  0 Clips  0 Featurettes  0 Opening Credits  0 Top Billed Cast Johan Widerberg Victor Lina Englund Anna Stellan Skarsg\u00e5rd Gary Kjell Bergqvist Allan Thomas Hellberg Polischefen Full Cast & Crew Last Season Season 1 1994 | 4 Episodes Season 1 of Rapport till himlen premiered on September 20, 1994. View All Seasons Social Reviews  0 Discussions  0 Media Most Popular Videos  0 Backdrops  1 Posters  1 Recommendations We don't have enough data to suggest any TV shows based on Rapport till himlen. You can help by rating TV shows you've seen. Facts Status  Ended Network Certification  - Type  Miniseries Original Language  Swedish Runtime  58m Homepage  - Genres Drama Keywords No keywords have been added. Content Score 86 Almost there... Top Contributors 21 clawfinger VA 12 Viktor Andersson TB 2 TMDb Bot  View Edit History Popularity Trend  Login to edit  URL By  signing up  for an account on TMDb, you can post directly to Twitter and Facebook. You need to be logged in to continue. Click  here  to login or  here  to sign up.    page_wrap opened in html_head  Join the Community The Basics About TMDb Contact Us Support Forums API Blog Get Involved  Contribution Bible 3rd Party Applications Add New Movie Add New TV Show Community Guidelines Leaderboard Forums Twitter Facebook Legal Terms of Use Privacy Policy Login Sign Up", "character": ["Victor", "Anna", "Gary", "Allan", "Polischefen"]}