{"link": "https://www.themoviedb.org/tv/74925?language=en", "title": "Aldo Moro - Il Presidente", "resume": "We don't have an overview translated in English. Help us expand our database by adding one.", "rate": 0, "genre": ["Drama"], "cast": ["Michele Placido", "Marco Foschi", "Libero De Rienzo", "Donatella Finocchiaro", "Valentina Carnelutti"], "character": ["Aldo Moro", "Mario Moretti", "Valerio Morucci", "Adriana Faranda", "Barbara Balzerani"], "site_data": "html Apps Forums Leaderboard Contribute API Support Discover Movies TV Shows Movies Popular Top Rated Upcoming Now Playing TV Shows Popular Top Rated On TV Airing Today People Popular People Can't find a movie or TV show? Login to create it. en Login Sign Up  ID: 74925   Expand Aldo Moro - Il Presidente   (2008) User Score Overview We don't have an overview translated in English. Help us expand our database by adding one. Featured Crew Gianluca Maria Tavarelli Creator Discussions   Reviews Videos   Images   Changes Report Share Discussions General  0 Content Issues  0 Images Backdrops  1 Posters  1 Videos Trailers  0 Teasers  0 Clips  0 Featurettes  0 Opening Credits  0 Top Billed Cast Michele Placido Aldo Moro Marco Foschi Mario Moretti Libero De Rienzo Valerio Morucci Donatella Finocchiaro Adriana Faranda Valentina Carnelutti Barbara Balzerani Full Cast & Crew Last Season Season 1 2008 | 2 Episodes Season 1 of Aldo Moro - Il Presidente premiered on May  9, 2008. View All Seasons Social Reviews  0 Discussions  0 Media Most Popular Videos  0 Backdrops  1 Posters  1 Recommendations We don't have enough data to suggest any TV shows based on Aldo Moro - Il Presidente. You can help by rating TV shows you've seen. Facts Status  Returning Series Network Certification  - Type  Miniseries Original Language  Italian Runtime  90m Homepage  - Genres Drama Keywords No keywords have been added. Content Score 86 Almost there... Top Contributors m 46 magico77  View Edit History Popularity Trend  Login to edit  URL By  signing up  for an account on TMDb, you can post directly to Twitter and Facebook. You need to be logged in to continue. Click  here  to login or  here  to sign up.    page_wrap opened in html_head  Join the Community The Basics About TMDb Contact Us Support Forums API Blog Get Involved  Contribution Bible 3rd Party Applications Add New Movie Add New TV Show Community Guidelines Leaderboard Forums Twitter Facebook Legal Terms of Use Privacy Policy Login Sign Up"}