{"link": "https://www.themoviedb.org/tv/72049?language=en", "title": "\u0643\u0641\u0631 \u062f\u0644\u0647\u0627\u0628", "resume": "In a village called Kafr Delhab that is cursed by the soul of a recently murdered girl, a doctor, who's new to the village, tries to uncover the truth behind the murder to lift the curse.", "rate": 70, "genre": ["Crime", "Drama", "Mystery"], "cast": ["Youssef El Sherif", "Mohamed Reyad"], "character": ["Physician Saad", "Bahaa El-Din Katkhoda"], "site_data": "html Apps Forums Leaderboard Contribute API Support Discover Movies TV Shows Movies Popular Top Rated Upcoming Now Playing TV Shows Popular Top Rated On TV Airing Today People Popular People Can't find a movie or TV show? Login to create it. en Login Sign Up  ID: 72049   Expand \u0643\u0641\u0631 \u062f\u0644\u0647\u0627\u0628   (2017) User Score Overview In a village called Kafr Delhab that is cursed by the soul of a recently murdered girl, a doctor, who's new to the village, tries to uncover the truth behind the murder to lift the curse. Featured Crew Youssef El Sherif Creator Discussions   Reviews Videos   Images   Changes Report Share Discussions General  0 Content Issues  0 Images Backdrops  1 Posters  2 Videos Trailers  0 Teasers  0 Clips  0 Featurettes  0 Opening Credits  0 Top Billed Cast Youssef El Sherif Physician Saad Mohamed Reyad Bahaa El-Din Katkhoda Full Cast & Crew Last Season Season 1 2017 | 30 Episodes Season 1 of \u0643\u0641\u0631 \u062f\u0644\u0647\u0627\u0628 premiered on May 27, 2017. View All Seasons Social Reviews  0 Discussions  0 Media Most Popular Videos  0 Backdrops  1 Posters  2 Recommendations We don't have enough data to suggest any TV shows based on \u0643\u0641\u0631 \u062f\u0644\u0647\u0627\u0628. You can help by rating TV shows you've seen. Facts Status  Ended Network ON E Certification  - Type  Scripted Original Language  Arabic Runtime  45m Homepage  - Genres Crime Drama Mystery Keywords No keywords have been added. Content Score 71 Just a little bit more... Top Contributors 35 Elnemsawy 27 Elizabeth Jennings E 19 Elnemsawy99 8 janar  View Edit History Popularity Trend  Login to edit  URL By  signing up  for an account on TMDb, you can post directly to Twitter and Facebook. You need to be logged in to continue. Click  here  to login or  here  to sign up.    page_wrap opened in html_head  Join the Community The Basics About TMDb Contact Us Support Forums API Blog Get Involved  Contribution Bible 3rd Party Applications Add New Movie Add New TV Show Community Guidelines Leaderboard Forums Twitter Facebook Legal Terms of Use Privacy Policy Login Sign Up"}