{"link": "https://www.themoviedb.org/tv/69506?language=en", "title": "Elsword: El Lady", "resume": "We don't have an overview translated in English. Help us expand our database by adding one.", "rate": 70, "genre": ["Action", "Adventure", "Animation", "Comedy", "Sci-Fi", "Fantasy"], "cast": ["Yoon Yuh Jin", "Bak Seong Tae", "Jeong Mi Sok", "Woo Jeong Shin", "Jung Hye-won"], "character": ["Elesis (Grand Master)", "Raven (Reckless Fist)", "Rena (Grand Archer)", "Eve (Code: Empress)", "Aisha (Elemental Master)"], "site_data": "html Apps Forums Leaderboard Contribute API Support Discover Movies TV Shows Movies Popular Top Rated Upcoming Now Playing TV Shows Popular Top Rated On TV Airing Today People Popular People Can't find a movie or TV show? Login to create it. en Login Sign Up  ID: 69506   Expand Elsword: El Lady   (2016) User Score Overview We don't have an overview translated in English. Help us expand our database by adding one. Discussions   Reviews Videos   Images   Changes Report Share Discussions General  0 Content Issues  0 Images Backdrops  3 Posters  1 Videos Trailers  0 Teasers  0 Clips  0 Featurettes  0 Opening Credits  0 Top Billed Cast Yoon Yuh Jin Elesis (Grand Master) Bak Seong Tae Raven (Reckless Fist) Jeong Mi Sok Rena (Grand Archer) Woo Jeong Shin Eve (Code: Empress) Jung Hye-won Aisha (Elemental Master) Full Cast & Crew Last Season Season 1 2016 | 12 Episodes Season 1 of Elsword: El Lady premiered on December 13, 2016. View All Seasons Social Reviews  0 Discussions  0 Media Most Popular Videos  0 Backdrops  3 Posters  1 Recommendations We don't have enough data to suggest any TV shows based on Elsword: El Lady. You can help by rating TV shows you've seen. Facts Original Name  \uc5d8\uc18c\ub4dc \uc5d8\uc758 \uc5ec\uc778 Status  Returning Series Networks - Certification  - Type  Scripted Original Language  Korean Runtime  11m Homepage   https://elwiki.net/w/Elsword:_El_Lady Genres Action & Adventure Animation Comedy Sci-Fi & Fantasy Keywords No keywords have been added. Content Score 79 Pump it up! We're close now. Top Contributors 24 seboseboss 12 Jenazad 5 sp1ti m 3 magoozin  View Edit History Popularity Trend  Login to edit  URL By  signing up  for an account on TMDb, you can post directly to Twitter and Facebook. You need to be logged in to continue. Click  here  to login or  here  to sign up.    page_wrap opened in html_head  Join the Community The Basics About TMDb Contact Us Support Forums API Blog Get Involved  Contribution Bible 3rd Party Applications Add New Movie Add New TV Show Community Guidelines Leaderboard Forums Twitter Facebook Legal Terms of Use Privacy Policy Login Sign Up"}