{"link": "https://www.themoviedb.org/tv/67726?language=en", "title": "Beyond", "resume": "Holden wakes up from a coma after 12 years and discovers new abilities that propel him into the middle of a dangerous conspiracy.", "rate": 56, "genre": ["Drama", "Sci-Fi", "Fantasy"], "cast": ["Burkely Duffield", "Dilan Gwyn", "Jonathan Whitesell", "Eden Brolin", "Jeff Pierre"], "character": ["Holden Matthews", "Willa", "Luke Matthews", "Charlie", "Jeff McArdle"], "site_data": "html Apps Forums Leaderboard Contribute API Support Discover Movies TV Shows Movies Popular Top Rated Upcoming Now Playing TV Shows Popular Top Rated On TV Airing Today People Popular People Can't find a movie or TV show? Login to create it. en Login Sign Up  ID: 67726   Expand Beyond   (2017) User Score  Play Trailer Overview Holden wakes up from a coma after 12 years and discovers new abilities that propel him into the middle of a dangerous conspiracy. Featured Crew Adam Nussdorf Creator Discussions   Reviews Videos   Images   Changes Report Share Discussions General  2 Content Issues  0 Images Backdrops  11 Posters  10 Videos Trailers  1 Teasers  0 Clips  0 Featurettes  0 Opening Credits  0 Top Billed Cast Burkely Duffield Holden Matthews Dilan Gwyn Willa Jonathan Whitesell Luke Matthews Eden Brolin Charlie Jeff Pierre Jeff McArdle Full Cast & Crew Current Season Season 2 2018 | 10 Episodes View All Seasons Social Reviews  0 Discussions  2 Subject Status Replies Last Reply S1e10 spoilers. The bridge Open 4 by  Innovator w Luke: Happy Birthday Jonathan Whitesell! Open 0 by wonder2wonder\n      \n     Go to Discussions Media Most Popular Videos  1 Backdrops  11 Posters  10 Recommendations   2016-11-30 Incorporated 6.1    2016-03-07 Damien 6.5    2013-03-03 Red Widow 4.9    2016-01-22 Stan Lee's Lucky Man 7.3    2016-03-04 Slasher 6.0    2017-07-24 Somewhere Between 5.9    2015-11-11 The Frankenstein Chronicles 6.9    2009-06-22 Make It or Break It 6.6  Facts Status  Cancelled Network Certification TV-14 Meaning This program contains some material that many parents would find unsuitable for children under 14 years of age. Type  Scripted Original Language  English Runtime  43m Homepage   http://freeform.go.com/shows/beyond Genres Drama Sci-Fi & Fantasy Keywords superhuman young adult waking from coma Content Score 100 Yes! Looking good! Top Contributors 76 Banana 15 Elizabeth Jennings 12 movietvhub r 8 robko22  View Edit History Popularity Trend  Login to edit  URL By  signing up  for an account on TMDb, you can post directly to Twitter and Facebook. You need to be logged in to continue. Click  here  to login or  here  to sign up.    page_wrap opened in html_head  Join the Community The Basics About TMDb Contact Us Support Forums API Blog Get Involved  Contribution Bible 3rd Party Applications Add New Movie Add New TV Show Community Guidelines Leaderboard Forums Twitter Facebook Legal Terms of Use Privacy Policy Login Sign Up"}