{"link": "https://www.themoviedb.org/tv/48275?language=en", "title": "Krew z krwi", "resume": "We don't have an overview translated in English. Help us expand our database by adding one.", "rate": null, "genre": ["Action", "Adventure", "Crime"], "cast": ["Agata Kulesza", "Mariusz Bonaszewski", "Szymon Bobrowski", "Izabela Kuna", "Maciej Musia\u0142"], "site_data": "html Apps Forums Leaderboard Contribute API Support Discover Movies TV Shows Movies Popular Top Rated Upcoming Now Playing TV Shows Popular Top Rated On TV Airing Today People Popular People Can't find a movie or TV show? Login to create it. en Login Sign Up  ID: 48275   Expand Krew z krwi   (2012) User Score Overview We don't have an overview translated in English. Help us expand our database by adding one. Featured Crew Kasia Adamik Creator Robert Wichrowski Creator Leszek Dawid Creator Xawery \u017bu\u0142awski Creator Discussions   Reviews Videos   Images   Changes Report Share Discussions General  0 Content Issues  0 Images Backdrops  0 Posters  1 Videos Trailers  0 Teasers  0 Clips  0 Featurettes  0 Opening Credits  0 Top Billed Cast Agata Kulesza Carmen Rota-Majewska Mariusz Bonaszewski Luther Szymon Bobrowski Bronek Izabela Kuna Sandra Koz\u0142owska Maciej Musia\u0142 Franek Majewski Full Cast & Crew Last Season Season 2 2015 | 10 Episodes Season 2 of Krew z krwi premiered on April 12, 2015. View All Seasons Social Reviews  0 Discussions  0 Media Most Popular Videos  0 Backdrops  0 Posters  1 Recommendations We don't have enough data to suggest any TV shows based on Krew z krwi. You can help by rating TV shows you've seen. Facts Status  Ended Network Certification  - Type  Scripted Original Language  Polish Runtime  49m Homepage  - Genres Action & Adventure Crime Keywords mafia Content Score 71 Just a little bit more... Top Contributors 58 auu B 1 BONOGRZES  View Edit History Popularity Trend  Login to edit  URL By  signing up  for an account on TMDb, you can post directly to Twitter and Facebook. You need to be logged in to continue. Click  here  to login or  here  to sign up.    page_wrap opened in html_head  Join the Community The Basics About TMDb Contact Us Support Forums API Blog Get Involved  Contribution Bible 3rd Party Applications Add New Movie Add New TV Show Community Guidelines Leaderboard Forums Twitter Facebook Legal Terms of Use Privacy Policy Login Sign Up", "character": ["Carmen Rota-Majewska", "Luther", "Bronek", "Sandra Koz\u0142owska", "Franek Majewski"]}