{"link": "https://www.themoviedb.org/tv/64144?language=en", "title": "Come On! Therapy for the Undecided", "resume": "We don't have an overview translated in English. Help us expand our database by adding one.", "rate": 70, "genre": ["Comedy"], "cast": ["Ole Fischer", "Victoria Trauttmansdorff", "Thomas Niehaus", "Marlene Morreis", "Lisa Hagmeister"], "character": ["Jens", "Susann", "Oliver", "Anette L\u00fctjen", "Jana"], "site_data": "html Apps Forums Leaderboard Contribute API Support Discover Movies TV Shows Movies Popular Top Rated Upcoming Now Playing TV Shows Popular Top Rated On TV Airing Today People Popular People Can't find a movie or TV show? Login to create it. en Login Sign Up  ID: 64144   Expand Come On! Therapy for the Undecided   (2015) User Score Overview We don't have an overview translated in English. Help us expand our database by adding one. Discussions   Reviews Videos   Images   Changes Report Share Discussions General  0 Content Issues  0 Images Backdrops  0 Posters  1 Videos Trailers  0 Teasers  0 Clips  0 Featurettes  0 Opening Credits  0 Top Billed Cast Ole Fischer Jens Victoria Trauttmansdorff Susann Thomas Niehaus Oliver Marlene Morreis Anette L\u00fctjen Lisa Hagmeister Jana Full Cast & Crew Last Season Season 1 2015 | 4 Episodes Season 1 of Come On! Therapy for the Undecided premiered on November  5, 2015. View All Seasons Social Reviews  0 Discussions  0 Media Most Popular Videos  0 Backdrops  0 Posters  1 Recommendations We don't have enough data to suggest any TV shows based on Come On! Therapy for the Undecided. You can help by rating TV shows you've seen. Facts Original Name  Komm schon! Status  Ended Network Certification  - Type  Scripted Original Language  German Runtime  - Homepage  - Genres Comedy Keywords No keywords have been added. Content Score 64 We're so close, yet so far. Top Contributors S 13 Samara C 5 CaptainBarnius 4 voglerr MP 1 Mr. Peanutbutter  View Edit History Popularity Trend  Login to edit  URL By  signing up  for an account on TMDb, you can post directly to Twitter and Facebook. You need to be logged in to continue. Click  here  to login or  here  to sign up.    page_wrap opened in html_head  Join the Community The Basics About TMDb Contact Us Support Forums API Blog Get Involved  Contribution Bible 3rd Party Applications Add New Movie Add New TV Show Community Guidelines Leaderboard Forums Twitter Facebook Legal Terms of Use Privacy Policy Login Sign Up"}