{"link": "https://www.themoviedb.org/tv/73750?language=en", "title": "Bibliotekstjuven", "resume": "A librarian at the National Library in Stockholm gets access to extremely valuable and rare books. He steals and sell a large number of these to a book curator in Amsterdam.", "rate": 0, "genre": ["Drama"], "cast": ["Gustaf Skarsg\u00e5rd", "Gunilla R\u00f6\u00f6r", "Reuben Sallmander", "Liv Mj\u00f6nes", "Maria Kulle"], "character": ["John", "Lisbet", "Tom Goldman", "Pia", "Karin"], "site_data": "html Apps Forums Leaderboard Contribute API Support Discover Movies TV Shows Movies Popular Top Rated Upcoming Now Playing TV Shows Popular Top Rated On TV Airing Today People Popular People Can't find a movie or TV show? Login to create it. en Login Sign Up  ID: 73750   Expand Bibliotekstjuven   (2011) User Score Overview A librarian at the National Library in Stockholm gets access to extremely valuable and rare books. He steals and sell a large number of these to a book curator in Amsterdam. Discussions   Reviews Videos   Images   Changes Report Share Discussions General  0 Content Issues  0 Images Backdrops  2 Posters  2 Videos Trailers  0 Teasers  0 Clips  0 Featurettes  0 Opening Credits  0 Top Billed Cast Gustaf Skarsg\u00e5rd John Gunilla R\u00f6\u00f6r Lisbet Reuben Sallmander Tom Goldman Liv Mj\u00f6nes Pia Maria Kulle Karin Full Cast & Crew Last Season Season 1 2011 | 3 Episodes Season 1 of Bibliotekstjuven premiered on January 12, 2011. View All Seasons Social Reviews  0 Discussions  0 Media Most Popular Videos  0 Backdrops  2 Posters  2 Recommendations We don't have enough data to suggest any TV shows based on Bibliotekstjuven. You can help by rating TV shows you've seen. Facts Status  Ended Network Certification  - Type  Miniseries Original Language  Swedish Runtime  60m Homepage  - Genres Drama Keywords library miniseries theft Content Score 86 Almost there... Top Contributors VA 69 Viktor Andersson R 5 Rebecca TB 4 TMDb Bot  View Edit History Popularity Trend  Login to edit  URL By  signing up  for an account on TMDb, you can post directly to Twitter and Facebook. You need to be logged in to continue. Click  here  to login or  here  to sign up.    page_wrap opened in html_head  Join the Community The Basics About TMDb Contact Us Support Forums API Blog Get Involved  Contribution Bible 3rd Party Applications Add New Movie Add New TV Show Community Guidelines Leaderboard Forums Twitter Facebook Legal Terms of Use Privacy Policy Login Sign Up"}