{"link": "https://www.themoviedb.org/tv/65968?language=en", "title": "Strategist Kanbe", "resume": "We don't have an overview translated in English. Help us expand our database by adding one.", "rate": 100, "genre": ["Drama", "War", "Politics"], "cast": ["Junichi Okada", "Yosuke Eguchi", "Miki Nakatani", "Kirato Wakayama", "Hitomi Kuroki"], "character": ["Kanbee Kuroda", "Nobunaga Oda", "Teru", "Kanbee Kuroda (young)", "One"], "site_data": "html Apps Forums Leaderboard Contribute API Support Discover Movies TV Shows Movies Popular Top Rated Upcoming Now Playing TV Shows Popular Top Rated On TV Airing Today People Popular People Can't find a movie or TV show? Login to create it. en Login Sign Up  ID: 65968   Expand Strategist Kanbe   (2014) User Score Overview We don't have an overview translated in English. Help us expand our database by adding one. Discussions   Reviews Videos   Images   Changes Report Share Discussions General  0 Content Issues  1 Images Backdrops  2 Posters  2 Videos Trailers  0 Teasers  0 Clips  0 Featurettes  0 Opening Credits  0 Top Billed Cast Junichi Okada Kanbee Kuroda Yosuke Eguchi Nobunaga Oda Miki Nakatani Teru Kirato Wakayama Kanbee Kuroda (young) Hitomi Kuroki One Full Cast & Crew Last Season Season 1 2014 | 50 Episodes Season 1 of Strategist Kanbe premiered on January  5, 2014. View All Seasons Social Reviews  0 Discussions  1 Subject Status Replies Last Reply There are no discussions for Strategist Kanbe. Login to be first! Go to Discussions Media Most Popular Videos  0 Backdrops  2 Posters  2 Recommendations We don't have enough data to suggest any TV shows based on Strategist Kanbe. You can help by rating TV shows you've seen. Facts Original Name  \u8ecd\u5e2b\u5b98\u5175\u885b Status  Ended Network Certification  - Type  Scripted Original Language  Japanese Runtime  - Homepage  - Genres Drama War & Politics Keywords warring states period Content Score 79 Pump it up! We're close now. Top Contributors k 47 ktoswang 20 thirstyhippo 15 Elizabeth Jennings 1 lineker  View Edit History Popularity Trend  Login to edit  URL By  signing up  for an account on TMDb, you can post directly to Twitter and Facebook. You need to be logged in to continue. Click  here  to login or  here  to sign up.    page_wrap opened in html_head  Join the Community The Basics About TMDb Contact Us Support Forums API Blog Get Involved  Contribution Bible 3rd Party Applications Add New Movie Add New TV Show Community Guidelines Leaderboard Forums Twitter Facebook Legal Terms of Use Privacy Policy Login Sign Up"}