{"link": "https://www.themoviedb.org/tv/9864?language=en", "title": "Father, Dear Father", "resume": "Patrick Glover is a divorced thriller novelist attempting to raise and keep the peace between his two teenage daughters.", "rate": 0, "genre": ["Comedy"], "cast": ["Patrick Cargill", "Dawn Addams", "Natasha Pyne", "Noel Dyson", "Jeremy Child"], "character": ["Patrick Glover", "Georgie Thompson", "Anna Glover", "Nanny", "Timothy Tanner"], "site_data": "html Apps Forums Leaderboard Contribute API Support Discover Movies TV Shows Movies Popular Top Rated Upcoming Now Playing TV Shows Popular Top Rated On TV Airing Today People Popular People Can't find a movie or TV show? Login to create it. en Login Sign Up  ID: 9864   Expand Father, Dear Father   (1968) User Score Overview Patrick Glover is a divorced thriller novelist attempting to raise and keep the peace between his two teenage daughters. Discussions   Reviews Videos   Images   Changes Report Share Discussions General  0 Content Issues  0 Images Backdrops  0 Posters  2 Videos Trailers  0 Teasers  0 Clips  0 Featurettes  0 Opening Credits  0 Top Billed Cast Patrick Cargill Patrick Glover Dawn Addams Georgie Thompson Natasha Pyne Anna Glover Noel Dyson Nanny Jeremy Child Timothy Tanner Full Cast & Crew Last Season Season 7 1973 | 6 Episodes Season 7 of Father, Dear Father premiered on January  2, 1973. View All Seasons Social Reviews  0 Discussions  0 Media Most Popular Videos  0 Backdrops  0 Posters  2 Recommendations We don't have enough data to suggest any TV shows based on Father, Dear Father. You can help by rating TV shows you've seen. Facts Status  Ended Network Certification  - Type  Scripted Original Language  English Runtime  30m Homepage  - Genres Comedy Keywords daughter london england family single father novelist sitcom british humour Content Score 71 Just a little bit more... Top Contributors 52 Banana O 4 Ozbourne TB 2 TMDb Bot S 2 Samara  View Edit History Popularity Trend  Login to edit  URL By  signing up  for an account on TMDb, you can post directly to Twitter and Facebook. You need to be logged in to continue. Click  here  to login or  here  to sign up.    page_wrap opened in html_head  Join the Community The Basics About TMDb Contact Us Support Forums API Blog Get Involved  Contribution Bible 3rd Party Applications Add New Movie Add New TV Show Community Guidelines Leaderboard Forums Twitter Facebook Legal Terms of Use Privacy Policy Login Sign Up"}