{"link": "https://www.themoviedb.org/tv/67594?language=en", "title": "Mes petits malheurs", "resume": "We don't have an overview translated in English. Help us expand our database by adding one.", "rate": 80, "genre": ["Comedy"], "cast": ["Catherine Proulx-Lemay", "Jean-Michel Anctil", "Rose-Marie Perreault", "Luka Limoges", "Antoine Marchand-Gagnon"], "character": ["Nicole Dub\u00e9", "Claude Dub\u00e9", "Myriam Dub\u00e9", "Sylvain Dub\u00e9", "Jeffy Dub\u00e9"], "site_data": "html Apps Forums Leaderboard Contribute API Support Discover Movies TV Shows Movies Popular Top Rated Upcoming Now Playing TV Shows Popular Top Rated On TV Airing Today People Popular People Can't find a movie or TV show? Login to create it. en Login Sign Up  ID: 67594   Expand Mes petits malheurs   (2016) User Score Overview We don't have an overview translated in English. Help us expand our database by adding one. Featured Crew Jean-Fran\u00e7ois L\u00e9ger Creator Discussions   Reviews Videos   Images   Changes Report Share Discussions General  0 Content Issues  0 Images Backdrops  4 Posters  1 Videos Trailers  0 Teasers  0 Clips  0 Featurettes  0 Opening Credits  0 Top Billed Cast Catherine Proulx-Lemay Nicole Dub\u00e9 Jean-Michel Anctil Claude Dub\u00e9 Rose-Marie Perreault Myriam Dub\u00e9 Luka Limoges Sylvain Dub\u00e9 Antoine Marchand-Gagnon Jeffy Dub\u00e9 Full Cast & Crew Last Season Season 1 2016 | 13 Episodes Season 1 of Mes petits malheurs premiered on September 12, 2016. View All Seasons Social Reviews  0 Discussions  0 Media Most Popular Videos  0 Backdrops  4 Posters  1 Recommendations We don't have enough data to suggest any TV shows based on Mes petits malheurs. You can help by rating TV shows you've seen. Facts Status  Cancelled Network Certification G Meaning Suitable for general audiences. Programming suitable for the entire family with mild violence, and mild profanity and/or censored language. Type  Scripted Original Language  French Runtime  21m Homepage   http://ici.radio-canada.ca/tele/mes-petits-malheurs Genres Comedy Keywords retro summer teenager 1980s Content Score 86 Almost there... Top Contributors 53 Banana 4 Elizabeth Jennings 3 itsanogo  View Edit History Popularity Trend  Login to edit  URL By  signing up  for an account on TMDb, you can post directly to Twitter and Facebook. You need to be logged in to continue. Click  here  to login or  here  to sign up.    page_wrap opened in html_head  Join the Community The Basics About TMDb Contact Us Support Forums API Blog Get Involved  Contribution Bible 3rd Party Applications Add New Movie Add New TV Show Community Guidelines Leaderboard Forums Twitter Facebook Legal Terms of Use Privacy Policy Login Sign Up"}