{"link": "https://www.themoviedb.org/tv/36288?language=en", "title": "The Story of Science: Power, Proof and Passion", "resume": "Michael Mosley takes an informative and ambitious journey exploring how the evolution of scientific understanding is intimately interwoven with society's historical path", "rate": null, "genre": ["Documentary"], "cast": ["Michael Mosley"], "site_data": "html Apps Forums Leaderboard Contribute API Support Discover Movies TV Shows Movies Popular Top Rated Upcoming Now Playing TV Shows Popular Top Rated On TV Airing Today People Popular People Can't find a movie or TV show? Login to create it. en Login Sign Up  ID: 36288   Expand The Story of Science: Power, Proof and Passion   (2010) User Score Overview Michael Mosley takes an informative and ambitious journey exploring how the evolution of scientific understanding is intimately interwoven with society's historical path Discussions   Reviews Videos   Images   Changes Report Share Discussions General  0 Content Issues  0 Images Backdrops  3 Posters  4 Videos Trailers  0 Teasers  0 Clips  0 Featurettes  0 Opening Credits  0 Top Billed Cast Michael Mosley Himself - Presenter Full Cast & Crew Last Season Season 1 2010 | 6 Episodes Season 1 of The Story of Science: Power, Proof and Passion premiered on April 26, 2010. View All Seasons Social Reviews  0 Discussions  0 Media Most Popular Videos  0 Backdrops  3 Posters  4 Recommendations We don't have enough data to suggest any TV shows based on The Story of Science: Power, Proof and Passion. You can help by rating TV shows you've seen. Facts Status  Ended Network Certification  - Type  Miniseries Original Language  English Runtime  60m Homepage   http://www.bbc.co.uk/programmes/b00s9mms Genres Documentary Keywords history science creation Content Score 56 We're so close, yet so far. Top Contributors A 15 Alexlfm 12 Aty 12 Banana 7 Fludogenerator  View Edit History Popularity Trend  Login to edit  URL By  signing up  for an account on TMDb, you can post directly to Twitter and Facebook. You need to be logged in to continue. Click  here  to login or  here  to sign up.    page_wrap opened in html_head  Join the Community The Basics About TMDb Contact Us Support Forums API Blog Get Involved  Contribution Bible 3rd Party Applications Add New Movie Add New TV Show Community Guidelines Leaderboard Forums Twitter Facebook Legal Terms of Use Privacy Policy Login Sign Up", "character": ["Himself - Presenter"]}