{"link": "https://www.themoviedb.org/tv/79951?language=en", "title": "\u041e\u0444\u0438\u0446\u0435\u0440\u044b 2", "resume": "We don't have an overview translated in English. Help us expand our database by adding one.", "rate": 100, "genre": ["Action", "Adventure", "War", "Politics", "Drama"], "cast": ["Aleksey Makarov", "Sergey Gorobchenko", "Yekaterina Vulichenko", "Igor Savochkin", "Daniil Spivakovskiy"], "character": ["\u0415\u0433\u043e\u0440 \u041e\u0441\u043e\u0440\u0433\u0438\u043d (\u043c\u0430\u0439\u043e\u0440)", "\u0410\u043b\u0435\u043a\u0441\u0430\u043d\u0434\u0440 \u0413\u0430\u0439\u0434\u0430\u043c\u0430\u043a (\u043c\u0430\u0439\u043e\u0440)", "\u0415\u0432\u0433\u0435\u043d\u0438\u044f", "\u0421\u044f\u0432\u0430", "\u0414\u0438\u0442\u0440\u0438\u0445 \u0428\u0442\u0430\u043b\u044c\u043c\u0430\u043d"], "site_data": "html Apps Forums Leaderboard Contribute API Support Discover Movies TV Shows Movies Popular Top Rated Upcoming Now Playing TV Shows Popular Top Rated On TV Airing Today People Popular People Can't find a movie or TV show? Login to create it. en Login Sign Up  ID: 79951   Expand \u041e\u0444\u0438\u0446\u0435\u0440\u044b 2   (2009) User Score Overview We don't have an overview translated in English. Help us expand our database by adding one. Featured Crew Leonid Porokhnya Creator Zinoviy Royzman Creator Discussions   Reviews Videos   Images   Changes Report Share Discussions General  0 Content Issues  0 Images Backdrops  3 Posters  1 Videos Trailers  0 Teasers  0 Clips  0 Featurettes  0 Opening Credits  0 Top Billed Cast Aleksey Makarov \u0415\u0433\u043e\u0440 \u041e\u0441\u043e\u0440\u0433\u0438\u043d (\u043c\u0430\u0439\u043e\u0440) Sergey Gorobchenko \u0410\u043b\u0435\u043a\u0441\u0430\u043d\u0434\u0440 \u0413\u0430\u0439\u0434\u0430\u043c\u0430\u043a (\u043c\u0430\u0439\u043e\u0440) Yekaterina Vulichenko \u0415\u0432\u0433\u0435\u043d\u0438\u044f Igor Savochkin \u0421\u044f\u0432\u0430 Daniil Spivakovskiy \u0414\u0438\u0442\u0440\u0438\u0445 \u0428\u0442\u0430\u043b\u044c\u043c\u0430\u043d Full Cast & Crew Last Season Season 1 2009 | 8 Episodes Season 1 of \u041e\u0444\u0438\u0446\u0435\u0440\u044b 2 premiered on February 25, 2009. View All Seasons Social Reviews  0 Discussions  0 Media Most Popular Videos  0 Backdrops  3 Posters  1 Recommendations We don't have enough data to suggest any TV shows based on \u041e\u0444\u0438\u0446\u0435\u0440\u044b 2. You can help by rating TV shows you've seen. Facts Status  Ended Networks Certification 16+ Meaning Only teens the age of 16 or older can watch. Type  Miniseries Original Language  Russian Runtime  - Homepage  - Genres Action & Adventure War & Politics Drama Keywords war afghanistan Content Score 93 Almost there... Top Contributors n 73 navarro2018 3 Elizabeth Jennings  View Edit History Popularity Trend  Login to edit  URL By  signing up  for an account on TMDb, you can post directly to Twitter and Facebook. You need to be logged in to continue. Click  here  to login or  here  to sign up.    page_wrap opened in html_head  Join the Community The Basics About TMDb Contact Us Support Forums API Blog Get Involved  Contribution Bible 3rd Party Applications Add New Movie Add New TV Show Community Guidelines Leaderboard Forums Twitter Facebook Legal Terms of Use Privacy Policy Login Sign Up"}