{"link": "https://www.themoviedb.org/tv/73878?language=en", "title": "\u0423\u0431\u043e\u0439\u043d\u0430\u044f \u0441\u0438\u043b\u0430", "resume": "We don't have an overview translated in English. Help us expand our database by adding one.", "rate": 80, "genre": ["Action", "Adventure", "Mystery", "Comedy", "Crime", "Family"], "cast": ["Konstantin Khabenskiy", "Andrey Fedortsov", "Sergey Koshonin", "Georgiy Shtil", "Olga Kalmykova"], "character": ["Igor Plakhov", "Vasiliy Rogov", "Maks Verigin", "\u0424\u0451\u0434\u043e\u0440 \u0418\u043b\u044c\u0438\u0447 \u0442\u0435\u0441\u0442\u044c \u0420\u043e\u0433\u043e\u0432\u0430", "\u0422\u0435\u0449\u0430 \u0412\u0430\u0441\u0438 \u0420\u043e\u0433\u043e\u0432\u0430"], "site_data": "html Apps Forums Leaderboard Contribute API Support Discover Movies TV Shows Movies Popular Top Rated Upcoming Now Playing TV Shows Popular Top Rated On TV Airing Today People Popular People Can't find a movie or TV show? Login to create it. en Login Sign Up  ID: 73878   Expand \u0423\u0431\u043e\u0439\u043d\u0430\u044f \u0441\u0438\u043b\u0430   (2000) User Score Overview We don't have an overview translated in English. Help us expand our database by adding one. Featured Crew Oleg Dudincev Creator Andrey Kivinov Creator Discussions   Reviews Videos   Images   Changes Report Share Discussions General  0 Content Issues  0 Images Backdrops  4 Posters  1 Videos Trailers  0 Teasers  0 Clips  0 Featurettes  0 Opening Credits  0 Top Billed Cast Konstantin Khabenskiy Igor Plakhov Andrey Fedortsov Vasiliy Rogov Sergey Koshonin Maks Verigin Georgiy Shtil \u0424\u0451\u0434\u043e\u0440 \u0418\u043b\u044c\u0438\u0447 \u0442\u0435\u0441\u0442\u044c \u0420\u043e\u0433\u043e\u0432\u0430 Olga Kalmykova \u0422\u0435\u0449\u0430 \u0412\u0430\u0441\u0438 \u0420\u043e\u0433\u043e\u0432\u0430 Full Cast & Crew Last Season Season 6 2005 | 12 Episodes Season 6 of \u0423\u0431\u043e\u0439\u043d\u0430\u044f \u0441\u0438\u043b\u0430 premiered on September 26, 2005. View All Seasons Social Reviews  0 Discussions  0 Media Most Popular Videos  0 Backdrops  4 Posters  1 Recommendations We don't have enough data to suggest any TV shows based on \u0423\u0431\u043e\u0439\u043d\u0430\u044f \u0441\u0438\u043b\u0430. You can help by rating TV shows you've seen. Facts Status  Ended Network Certification 12+ Meaning Only kids the age of 12 or older can watch. Type  Scripted Original Language  Russian Runtime  50m Homepage  - Genres Action & Adventure Mystery Comedy Crime Family Keywords detective family Content Score 93 Almost there... Top Contributors z 75 zoroman2017 TB 4 TMDb Bot 4 Banana  View Edit History Popularity Trend  Login to edit  URL By  signing up  for an account on TMDb, you can post directly to Twitter and Facebook. You need to be logged in to continue. Click  here  to login or  here  to sign up.    page_wrap opened in html_head  Join the Community The Basics About TMDb Contact Us Support Forums API Blog Get Involved  Contribution Bible 3rd Party Applications Add New Movie Add New TV Show Community Guidelines Leaderboard Forums Twitter Facebook Legal Terms of Use Privacy Policy Login Sign Up"}