{"link": "https://www.themoviedb.org/tv/64664?language=en", "title": "Hidden Kingdoms", "resume": "Immerse yourself in the lives of extraordinary characters that stand a few inches tall. From chipmunks to mice, be entertained and spellbound by the creatures that call the Hidden Kingdoms home.", "rate": 85, "genre": ["Documentary"], "cast": ["Stephen Fry"], "character": ["Narrator"], "site_data": "html Apps Forums Leaderboard Contribute API Support Discover Movies TV Shows Movies Popular Top Rated Upcoming Now Playing TV Shows Popular Top Rated On TV Airing Today People Popular People Can't find a movie or TV show? Login to create it. en Login Sign Up  ID: 64664   Expand Hidden Kingdoms   (2014) User Score Overview Immerse yourself in the lives of extraordinary characters that stand a few inches tall. From chipmunks to mice, be entertained and spellbound by the creatures that call the Hidden Kingdoms home. Discussions   Reviews Videos   Images   Changes Report Share Discussions General  0 Content Issues  0 Images Backdrops  3 Posters  1 Videos Trailers  0 Teasers  0 Clips  0 Featurettes  0 Opening Credits  0 Top Billed Cast Stephen Fry Narrator Full Cast & Crew Last Season Miniseries 2014 | 3 Episodes Season 1 of Hidden Kingdoms premiered on January 16, 2014. View All Seasons Social Reviews  0 Discussions  0 Media Most Popular Videos  0 Backdrops  3 Posters  1 Recommendations We don't have enough data to suggest any TV shows based on Hidden Kingdoms. You can help by rating TV shows you've seen. Facts Status  Ended Network Certification  - Type  Miniseries Original Language  English Runtime  50m Homepage   http://www.bbc.co.uk/programmes/p01nppg8 Genres Documentary Keywords wildlife miniseries nature nature documentary Content Score 56 We're so close, yet so far. Top Contributors 28 Elizabeth Jennings f 11 fengyu m 4 morrison 4 Diworl  View Edit History Popularity Trend  Login to edit  URL By  signing up  for an account on TMDb, you can post directly to Twitter and Facebook. You need to be logged in to continue. Click  here  to login or  here  to sign up.    page_wrap opened in html_head  Join the Community The Basics About TMDb Contact Us Support Forums API Blog Get Involved  Contribution Bible 3rd Party Applications Add New Movie Add New TV Show Community Guidelines Leaderboard Forums Twitter Facebook Legal Terms of Use Privacy Policy Login Sign Up"}