{"link": "https://www.themoviedb.org/tv/4397?language=en", "title": "V.I.P.", "resume": "V.I.P. is an American action/comedy-drama series starring Pamela Anderson. Created by J. F. Lawton, the series aired in syndication for four seasons from 1998 to 2002.", "rate": null, "genre": ["Action", "Adventure", "Comedy"], "cast": ["Shaun Baker", "Molly Culver", "Natalie Raitano", "Pamela Anderson", "Dustin Nguyen"], "site_data": "html Apps Forums Leaderboard Contribute API Support Discover Movies TV Shows Movies Popular Top Rated Upcoming Now Playing TV Shows Popular Top Rated On TV Airing Today People Popular People Can't find a movie or TV show? Login to create it. en Login Sign Up  ID: 4397   Expand V.I.P.   (1998) User Score Overview V.I.P. is an American action/comedy-drama series starring Pamela Anderson. Created by J. F. Lawton, the series aired in syndication for four seasons from 1998 to 2002. Featured Crew J. F. Lawton Creator Discussions   Reviews Videos   Images   Changes Report Share Discussions General  0 Content Issues  0 Images Backdrops  5 Posters  2 Videos Trailers  0 Teasers  0 Clips  0 Featurettes  0 Opening Credits  0 Top Billed Cast Shaun Baker Molly Culver Natalie Raitano Pamela Anderson Vallery Irons Dustin Nguyen Full Cast & Crew Last Season Season 4 2001 | 22 Episodes Season 4 of V.I.P. premiered on September 22, 2001. View All Seasons Social Reviews  0 Discussions  0 Media Most Popular Videos  0 Backdrops  5 Posters  2 Recommendations   1997-09-01 Extreme Ghostbusters 6.0    2003-06-26 Stripperella 6.9    2000-07-24 Mysterious Ways 6.3    1990-09-08 The Tom & Jerry Kids Show 6.0    1994-03-05 Weird Science 6.3    1995-03-22 Sliders 7.0    1995-03-26 The Outer Limits 8.0  Facts Status  Ended Networks - Certification  - Type  Scripted Original Language  English Runtime  60m Homepage  - Genres Action & Adventure Comedy Keywords bodyguard Content Score 93 Almost there... Top Contributors 5 Banana a 3 asusar 3 niqo19 s 3 speedycars  View Edit History Popularity Trend  Login to edit  URL By  signing up  for an account on TMDb, you can post directly to Twitter and Facebook. You need to be logged in to continue. Click  here  to login or  here  to sign up.    page_wrap opened in html_head  Join the Community The Basics About TMDb Contact Us Support Forums API Blog Get Involved  Contribution Bible 3rd Party Applications Add New Movie Add New TV Show Community Guidelines Leaderboard Forums Twitter Facebook Legal Terms of Use Privacy Policy Login Sign Up", "character": ["Vallery Irons"]}