{"link": "https://www.themoviedb.org/tv/65982?language=en", "title": "Blockbustaz", "resume": "We don't have an overview translated in English. Help us expand our database by adding one.", "rate": null, "genre": ["Comedy"], "cast": ["Eko Fresh", "Joyce Ilg", "Sascha Reimann", "Martina Eitner-Acheampong", "Aykut Kayac\u0131k"], "site_data": "html Apps Forums Leaderboard Contribute API Support Discover Movies TV Shows Movies Popular Top Rated Upcoming Now Playing TV Shows Popular Top Rated On TV Airing Today People Popular People Can't find a movie or TV show? Login to create it. en Login Sign Up  ID: 65982   Expand Blockbustaz   (2016) User Score Overview We don't have an overview translated in English. Help us expand our database by adding one. Featured Crew Jan Markus Linhof Creator Discussions   Reviews Videos   Images   Changes Report Share Discussions General  0 Content Issues  0 Images Backdrops  0 Posters  1 Videos Trailers  0 Teasers  0 Clips  0 Featurettes  0 Opening Credits  0 Top Billed Cast Eko Fresh Sol Joyce Ilg Jessica Sascha Reimann Hardy Martina Eitner-Acheampong Madita Berger Aykut Kayac\u0131k Herr Bulut Full Cast & Crew Current Season Season 2 2018 | 12 Episodes Season 2 of Blockbustaz premiered on March 27, 2018. View All Seasons Social Reviews  0 Discussions  0 Media Most Popular Videos  0 Backdrops  0 Posters  1 Recommendations We don't have enough data to suggest any TV shows based on Blockbustaz. You can help by rating TV shows you've seen. Facts Status  Returning Series Network Certification  - Type  Scripted Original Language  German Runtime  30m Homepage   http://www.blockbustaz.de Genres Comedy Keywords hip-hop sitcom Content Score 79 Pump it up! We're close now. Top Contributors 27 Lynsch J 24 JohnBordello 18 Hollul S 10 Samara  View Edit History Popularity Trend  Login to edit  URL By  signing up  for an account on TMDb, you can post directly to Twitter and Facebook. You need to be logged in to continue. Click  here  to login or  here  to sign up.    page_wrap opened in html_head  Join the Community The Basics About TMDb Contact Us Support Forums API Blog Get Involved  Contribution Bible 3rd Party Applications Add New Movie Add New TV Show Community Guidelines Leaderboard Forums Twitter Facebook Legal Terms of Use Privacy Policy Login Sign Up", "character": ["Sol", "Jessica", "Hardy", "Madita Berger", "Herr Bulut"]}