{"link": "https://www.themoviedb.org/tv/41001?language=en", "title": "Landarzt Dr. Brock", "resume": "Landarzt Dr. Brock is a German television series.", "rate": 0, "genre": ["Drama", "Family"], "cast": ["Rudolf Prack", "Erna Sellmer", "Gerda-Maria J\u00fcrgens", "Gardy Granass", "Kurt Gro\u00dfkurth"], "character": ["Dr. Peter Brock", "Helene Klausen", "Frau Maiers", "Dr. Erika Wallner", "Hermann Stahl"], "site_data": "html Apps Forums Leaderboard Contribute API Support Discover Movies TV Shows Movies Popular Top Rated Upcoming Now Playing TV Shows Popular Top Rated On TV Airing Today People Popular People Can't find a movie or TV show? Login to create it. en Login Sign Up  ID: 41001   Expand Landarzt Dr. Brock   (1967) User Score Overview Landarzt Dr. Brock is a German television series. Discussions   Reviews Videos   Images   Changes Report Share Discussions General  0 Content Issues  0 Images Backdrops  0 Posters  1 Videos Trailers  0 Teasers  0 Clips  0 Featurettes  0 Opening Credits  0 Top Billed Cast Rudolf Prack Dr. Peter Brock Erna Sellmer Helene Klausen Gerda-Maria J\u00fcrgens Frau Maiers Gardy Granass Dr. Erika Wallner Kurt Gro\u00dfkurth Hermann Stahl Full Cast & Crew Last Season Season 1 1967 | 26 Episodes Season 1 of Landarzt Dr. Brock premiered on August  5, 1967. View All Seasons Social Reviews  0 Discussions  0 Media Most Popular Videos  0 Backdrops  0 Posters  1 Recommendations We don't have enough data to suggest any TV shows based on Landarzt Dr. Brock. You can help by rating TV shows you've seen. Facts Status  Ended Network Certification  - Type  Scripted Original Language  German Runtime  25m Homepage  - Genres Drama Family Keywords No keywords have been added. Content Score 71 Just a little bit more... Top Contributors S 23 Samara l 2 lonestarr102  View Edit History Popularity Trend  Login to edit  URL By  signing up  for an account on TMDb, you can post directly to Twitter and Facebook. You need to be logged in to continue. Click  here  to login or  here  to sign up.    page_wrap opened in html_head  Join the Community The Basics About TMDb Contact Us Support Forums API Blog Get Involved  Contribution Bible 3rd Party Applications Add New Movie Add New TV Show Community Guidelines Leaderboard Forums Twitter Facebook Legal Terms of Use Privacy Policy Login Sign Up"}