{"link": "https://www.themoviedb.org/tv/43127?language=en", "title": "Aim High", "resume": "A web series centered around a high school student with a double life as a teenage spy.", "rate": 0, "genre": ["Action", "Adventure", "Comedy"], "cast": ["Jackson Rathbone", "Aimee Teegarden", "Natalie Dreyfuss"], "character": ["Nick Green", "Amanda Miles", "Dakota"], "site_data": "html Apps Forums Leaderboard Contribute API Support Discover Movies TV Shows Movies Popular Top Rated Upcoming Now Playing TV Shows Popular Top Rated On TV Airing Today People Popular People Can't find a movie or TV show? Login to create it. en Login Sign Up  ID: 43127   Expand Aim High   (2011) User Score Overview A web series centered around a high school student with a double life as a teenage spy. Discussions   Reviews Videos   Images   Changes Report Share Discussions General  0 Content Issues  0 Images Backdrops  0 Posters  1 Videos Trailers  0 Teasers  0 Clips  0 Featurettes  0 Opening Credits  0 Top Billed Cast Jackson Rathbone Nick Green Aimee Teegarden Amanda Miles Natalie Dreyfuss Dakota Full Cast & Crew Last Season Season 2 2013 | 10 Episodes View All Seasons Social Reviews  0 Discussions  0 Media Most Popular Videos  0 Backdrops  0 Posters  1 Recommendations We don't have enough data to suggest any TV shows based on Aim High. You can help by rating TV shows you've seen. Facts Status  Ended Networks - Certification  - Type  Scripted Original Language  English Runtime  - Homepage   https://www.facebook.com/AimHighSeries Genres Action & Adventure Comedy Keywords high school teenager teen spy Content Score 43 There's no 'I' in team... Top Contributors 17 Banana 5 Elizabeth Jennings s 2 speedycars  View Edit History Popularity Trend  Login to edit  URL By  signing up  for an account on TMDb, you can post directly to Twitter and Facebook. You need to be logged in to continue. Click  here  to login or  here  to sign up.    page_wrap opened in html_head  Join the Community The Basics About TMDb Contact Us Support Forums API Blog Get Involved  Contribution Bible 3rd Party Applications Add New Movie Add New TV Show Community Guidelines Leaderboard Forums Twitter Facebook Legal Terms of Use Privacy Policy Login Sign Up"}