{"link": "https://www.themoviedb.org/tv/70574?language=en", "title": "Truckers", "resume": "Truckers is a British drama television series that first broadcast on BBC One on 10 October 2013. The series is about Britain through the lives of truck drivers working in Nottingham.", "rate": 80, "genre": ["Comedy", "Drama"], "cast": ["Stephen Tompkinson", "Harry Treadaway", "Ashley Walters", "Sian Breckin", "John Dagleish"], "character": ["Malachi Davies", "Glenn Davies", "Steve Warley", "Wendy Newman", "Martin Banks"], "site_data": "html Apps Forums Leaderboard Contribute API Support Discover Movies TV Shows Movies Popular Top Rated Upcoming Now Playing TV Shows Popular Top Rated On TV Airing Today People Popular People Can't find a movie or TV show? Login to create it. en Login Sign Up  ID: 70574   Expand Truckers   (2013) User Score Overview Truckers is a British drama television series that first broadcast on BBC One on 10 October 2013. The series is about Britain through the lives of truck drivers working in Nottingham. Featured Crew William Ivory Creator Discussions   Reviews Videos   Images   Changes Report Share Discussions General  0 Content Issues  0 Images Backdrops  0 Posters  1 Videos Trailers  0 Teasers  0 Clips  0 Featurettes  0 Opening Credits  0 Top Billed Cast Stephen Tompkinson Malachi Davies Harry Treadaway Glenn Davies Ashley Walters Steve Warley Sian Breckin Wendy Newman John Dagleish Martin Banks Full Cast & Crew Last Season Season 1 2013 | 5 Episodes Season 1 of Truckers premiered on October 10, 2013. View All Seasons Social Reviews  0 Discussions  0 Media Most Popular Videos  0 Backdrops  0 Posters  1 Recommendations We don't have enough data to suggest any TV shows based on Truckers. You can help by rating TV shows you've seen. Facts Status  Returning Series Network Certification  - Type  Scripted Original Language  English Runtime  - Homepage  - Genres Comedy Drama Keywords No keywords have been added. Content Score 79 Pump it up! We're close now. Top Contributors 32 Markxist TB 2 TMDb Bot  View Edit History Popularity Trend  Login to edit  URL By  signing up  for an account on TMDb, you can post directly to Twitter and Facebook. You need to be logged in to continue. Click  here  to login or  here  to sign up.    page_wrap opened in html_head  Join the Community The Basics About TMDb Contact Us Support Forums API Blog Get Involved  Contribution Bible 3rd Party Applications Add New Movie Add New TV Show Community Guidelines Leaderboard Forums Twitter Facebook Legal Terms of Use Privacy Policy Login Sign Up"}