{"link": "https://www.themoviedb.org/tv/16946?language=en", "title": "Life", "resume": "David Attenborough looks at the extraordinary ends to which animals and plants go in order to survive. Featuring epic spectacles, amazing TV firsts and examples of new wildlife behaviour.", "rate": 83, "genre": ["Documentary"], "cast": ["David Attenborough"], "character": ["Himself - Narrator"], "site_data": "html Apps Forums Leaderboard Contribute API Support Discover Movies TV Shows Movies Popular Top Rated Upcoming Now Playing TV Shows Popular Top Rated On TV Airing Today People Popular People Can't find a movie or TV show? Login to create it. en Login Sign Up  ID: 16946   Expand Life   (2009) User Score  Play Trailer Overview David Attenborough looks at the extraordinary ends to which animals and plants go in order to survive. Featuring epic spectacles, amazing TV firsts and examples of new wildlife behaviour. Discussions   Reviews Videos   Images   Changes Report Share Discussions General  0 Content Issues  1 Images Backdrops  8 Posters  20 Videos Trailers  2 Teasers  0 Clips  0 Featurettes  0 Opening Credits  0 Top Billed Cast David Attenborough Himself - Narrator Full Cast & Crew Last Season Season 1 2009 | 10 Episodes Season 1 of Life premiered on October 11, 2009. View All Seasons Social Reviews  0 Discussions  1 Subject Status Replies Last Reply There are no discussions for Life. Login to be first! Go to Discussions Media Most Popular Videos  2 Backdrops  8 Posters  20 Recommendations   2001-09-12 The Blue Planet 8.4    2006-03-05 Planet Earth 8.5    2011-10-26 Frozen Planet 8.3    2011-01-13 Human Planet 8.2    2013-01-02 Africa 8.2    2005-11-23 Life in the Undergrowth 8.4    2001-07-09 The Office 8.1    2002-11-20 The Life of Mammals 9.1  Facts Status  Ended Network Certification  - Type  Miniseries Original Language  English Runtime  30m, 50m, 60m Homepage   http://www.bbc.co.uk/programmes/b00lbpcy Genres Documentary Keywords biology animal species plant wildlife miniseries ecology animal nature evolution science natural selection life Content Score 64 We're so close, yet so far. Top Contributors TB 31 TMDb Bot 30 Elizabeth Jennings 10 waaw 8 Kyuhwan Kim  View Edit History Popularity Trend  Login to edit  URL By  signing up  for an account on TMDb, you can post directly to Twitter and Facebook. You need to be logged in to continue. Click  here  to login or  here  to sign up.    page_wrap opened in html_head  Join the Community The Basics About TMDb Contact Us Support Forums API Blog Get Involved  Contribution Bible 3rd Party Applications Add New Movie Add New TV Show Community Guidelines Leaderboard Forums Twitter Facebook Legal Terms of Use Privacy Policy Login Sign Up"}