{"link": "https://www.themoviedb.org/tv/69395?language=en", "title": "Legend of Lu Zhen", "resume": "We don't have an overview translated in English. Help us expand our database by adding one.", "rate": 0, "genre": ["Action", "Adventure", "Drama"], "cast": ["Jiang Kai Tong", "Zhao Liying", "Chen Xiao", "Madina Memet", "Lin Wang"], "character": ["Yu Qiao", "Lu Zhen", "Gao Zhan", "Dou Mei Er", "Madam Zhao"], "site_data": "html Apps Forums Leaderboard Contribute API Support Discover Movies TV Shows Movies Popular Top Rated Upcoming Now Playing TV Shows Popular Top Rated On TV Airing Today People Popular People Can't find a movie or TV show? Login to create it. en Login Sign Up  ID: 69395   Expand Legend of Lu Zhen   (2013) User Score Overview We don't have an overview translated in English. Help us expand our database by adding one. Discussions   Reviews Videos   Images   Changes Report Share Discussions General  0 Content Issues  0 Images Backdrops  3 Posters  1 Videos Trailers  0 Teasers  0 Clips  0 Featurettes  0 Opening Credits  0 Top Billed Cast Jiang Kai Tong Yu Qiao Zhao Liying Lu Zhen Chen Xiao Gao Zhan Madina Memet Dou Mei Er Lin Wang Madam Zhao Full Cast & Crew Last Season Season 1 2013 | 59 Episodes Season 1 of Legend of Lu Zhen premiered on May  3, 2013. View All Seasons Social Reviews  0 Discussions  0 Media Most Popular Videos  0 Backdrops  3 Posters  1 Recommendations We don't have enough data to suggest any TV shows based on Legend of Lu Zhen. You can help by rating TV shows you've seen. Facts Original Name  \u9646\u8d1e\u4f20\u5947 Status  Ended Network Hunan Television Certification  - Type  Scripted Original Language  Chinese Runtime  - Homepage   http://www.hunantv.com/v/2013/lzcq/ Genres Action & Adventure Drama Keywords romance historical fiction Content Score 79 Pump it up! We're close now. Top Contributors t 25 tmdb983464 21 MundoAsian z 4 zurman1 TB 2 TMDb Bot  View Edit History Popularity Trend  Login to edit  URL By  signing up  for an account on TMDb, you can post directly to Twitter and Facebook. You need to be logged in to continue. Click  here  to login or  here  to sign up.    page_wrap opened in html_head  Join the Community The Basics About TMDb Contact Us Support Forums API Blog Get Involved  Contribution Bible 3rd Party Applications Add New Movie Add New TV Show Community Guidelines Leaderboard Forums Twitter Facebook Legal Terms of Use Privacy Policy Login Sign Up"}