{"link": "https://www.themoviedb.org/tv/80520?language=en", "title": "Vuelo IL 8714", "resume": "We don't have an overview translated in English. Help us expand our database by adding one.", "rate": 0, "genre": ["Drama"], "cast": ["Carmelo G\u00f3mez", "Emma Su\u00e1rez", "Fernando Cayo", "Asier Etxeandia", "Marian \u00c1lvarez"], "character": ["Javier Torres", "Olga", "Mart\u00edn", "Emilio", "Victoria"], "site_data": "html Apps Forums Leaderboard Contribute API Support Discover Movies TV Shows Movies Popular Top Rated Upcoming Now Playing TV Shows Popular Top Rated On TV Airing Today People Popular People Can't find a movie or TV show? Login to create it. en Login Sign Up  ID: 80520   Expand Vuelo IL 8714   (2010) User Score Overview We don't have an overview translated in English. Help us expand our database by adding one. Discussions   Reviews Videos   Images   Changes Report Share Discussions General  0 Content Issues  0 Images Backdrops  0 Posters  1 Videos Trailers  0 Teasers  0 Clips  0 Featurettes  0 Opening Credits  0 Top Billed Cast Carmelo G\u00f3mez Javier Torres Emma Su\u00e1rez Olga Fernando Cayo Mart\u00edn Asier Etxeandia Emilio Marian \u00c1lvarez Victoria Full Cast & Crew Last Season Season 1 2010 | 2 Episodes Season 1 of Vuelo IL 8714 premiered on September  1, 2010. View All Seasons Social Reviews  0 Discussions  0 Media Most Popular Videos  0 Backdrops  0 Posters  1 Recommendations We don't have enough data to suggest any TV shows based on Vuelo IL 8714. You can help by rating TV shows you've seen. Facts Status  Ended Network Certification  - Type  Miniseries Original Language  Spanish; Castilian Runtime  66m, 68m Homepage  - Genres Drama Keywords investigation based on a true story airplane crash Content Score 64 We're so close, yet so far. Top Contributors 50 United600  View Edit History Popularity Trend  Login to edit  URL By  signing up  for an account on TMDb, you can post directly to Twitter and Facebook. You need to be logged in to continue. Click  here  to login or  here  to sign up.    page_wrap opened in html_head  Join the Community The Basics About TMDb Contact Us Support Forums API Blog Get Involved  Contribution Bible 3rd Party Applications Add New Movie Add New TV Show Community Guidelines Leaderboard Forums Twitter Facebook Legal Terms of Use Privacy Policy Login Sign Up"}