{"link": "https://www.themoviedb.org/tv/75487?language=en", "title": "Hard Quiz", "resume": "Host Tom Gleeson sets out to find Australia's hardest quiz champion, pitting four contestants against each other in a battle of attrition.", "rate": 0, "genre": ["Comedy"], "cast": ["Tom Gleeson"], "character": ["Himself - Presenter"], "site_data": "html Apps Forums Leaderboard Contribute API Support Discover Movies TV Shows Movies Popular Top Rated Upcoming Now Playing TV Shows Popular Top Rated On TV Airing Today People Popular People Can't find a movie or TV show? Login to create it. en Login Sign Up  ID: 75487   Expand Hard Quiz   (2016) User Score  Play Trailer Overview Host Tom Gleeson sets out to find Australia's hardest quiz champion, pitting four contestants against each other in a battle of attrition. Discussions   Reviews Videos   Images   Changes Report Share Discussions General  0 Content Issues  0 Images Backdrops  3 Posters  1 Videos Trailers  1 Teasers  0 Clips  0 Featurettes  0 Opening Credits  0 Top Billed Cast Tom Gleeson Himself - Presenter Full Cast & Crew Current Season Season 3 2018 | 9 Episodes Season 3 of Hard Quiz premiered on February 21, 2018. View All Seasons Social Reviews  0 Discussions  0 Media Most Popular Videos  1 Backdrops  3 Posters  1 Recommendations We don't have enough data to suggest any TV shows based on Hard Quiz. You can help by rating TV shows you've seen. Facts Status  Returning Series Network Certification  - Type  Scripted Original Language  English Runtime  30m Homepage  - Genres Comedy Keywords game show Content Score 64 We're so close, yet so far. Top Contributors 41 United600 TB 3 TMDb Bot 2 tigru89  View Edit History Popularity Trend  Login to edit  URL By  signing up  for an account on TMDb, you can post directly to Twitter and Facebook. You need to be logged in to continue. Click  here  to login or  here  to sign up.    page_wrap opened in html_head  Join the Community The Basics About TMDb Contact Us Support Forums API Blog Get Involved  Contribution Bible 3rd Party Applications Add New Movie Add New TV Show Community Guidelines Leaderboard Forums Twitter Facebook Legal Terms of Use Privacy Policy Login Sign Up"}