{"link": "https://www.themoviedb.org/tv/65591?language=en", "title": "Strippers", "resume": "Strippers is a documentary series that takes a look at strip clubs which have doubled over the last 10 years with more and more young British women are turning to lap dancing to try and make a living.", "rate": null, "genre": ["Documentary", "Reality"], "cast": ["Lucy Briers"], "site_data": "html Apps Forums Leaderboard Contribute API Support Discover Movies TV Shows Movies Popular Top Rated Upcoming Now Playing TV Shows Popular Top Rated On TV Airing Today People Popular People Can't find a movie or TV show? Login to create it. en Login Sign Up  ID: 65591   Expand Strippers   (2014) User Score Overview Strippers is a documentary series that takes a look at strip clubs which have doubled over the last 10 years with more and more young British women are turning to lap dancing to try and make a living. Discussions   Reviews Videos   Images   Changes Report Share Discussions General  0 Content Issues  0 Images Backdrops  1 Posters  2 Videos Trailers  0 Teasers  0 Clips  0 Featurettes  0 Opening Credits  0 Top Billed Cast Lucy Briers Narrator Full Cast & Crew Last Season Season 1 2014 | 3 Episodes View All Seasons Social Reviews  0 Discussions  0 Media Most Popular Videos  0 Backdrops  1 Posters  2 Recommendations We don't have enough data to suggest any TV shows based on Strippers. You can help by rating TV shows you've seen. Facts Status  Ended Network Certification  - Type  Documentary Original Language  English Runtime  47m Homepage   http://www.channel4.com/programmes/strippers/episode-guide Genres Documentary Reality Keywords dance stripper strip club lap dance strip tease nude dance Content Score 56 We're so close, yet so far. Top Contributors C 84 Cataloguer 7 lineker TB 1 TMDb Bot  View Edit History Popularity Trend  Login to edit  URL By  signing up  for an account on TMDb, you can post directly to Twitter and Facebook. You need to be logged in to continue. Click  here  to login or  here  to sign up.    page_wrap opened in html_head  Join the Community The Basics About TMDb Contact Us Support Forums API Blog Get Involved  Contribution Bible 3rd Party Applications Add New Movie Add New TV Show Community Guidelines Leaderboard Forums Twitter Facebook Legal Terms of Use Privacy Policy Login Sign Up", "character": ["Narrator"]}