{"link": "https://www.themoviedb.org/tv/56427?language=en", "title": "Cyborg 009", "resume": "We don't have an overview translated in English. Help us expand our database by adding one.", "rate": 0, "genre": ["Action", "Adventure", "Sci-Fi", "Fantasy", "Animation", "Drama"], "cast": ["J\u014dji Yanami", "Hiroko Suzuki", "Machiko Soga", "Fuyumi Shiraishi", "Katsuji Mori"], "character": ["Professor Gilmore", "Francois Alnul", "Great Briten", "Ivan Whiskey", "Joe Shimamura"], "site_data": "html Apps Forums Leaderboard Contribute API Support Discover Movies TV Shows Movies Popular Top Rated Upcoming Now Playing TV Shows Popular Top Rated On TV Airing Today People Popular People Can't find a movie or TV show? Login to create it. en Login Sign Up  ID: 56427   Expand Cyborg 009   (1968) User Score Overview We don't have an overview translated in English. Help us expand our database by adding one. Featured Crew Shotaro Ishinomori Creator Discussions   Reviews Videos   Images   Changes Report Share Discussions General  0 Content Issues  0 Images Backdrops  3 Posters  1 Videos Trailers  0 Teasers  0 Clips  0 Featurettes  0 Opening Credits  0 Top Billed Cast J\u014dji Yanami Professor Gilmore Hiroko Suzuki Francois Alnul Machiko Soga Great Briten Fuyumi Shiraishi Ivan Whiskey Katsuji Mori Joe Shimamura Full Cast & Crew Last Season Season 1 2001 | 26 Episodes Season 1 of Cyborg 009 premiered on October 14, 2001. View All Seasons Social Reviews  0 Discussions  0 Media Most Popular Videos  0 Backdrops  3 Posters  1 Recommendations We don't have enough data to suggest any TV shows based on Cyborg 009. You can help by rating TV shows you've seen. Facts Status  Ended Network Certification  - Type  Scripted Original Language  English Runtime  30m Homepage  - Genres Action & Adventure Sci-Fi & Fantasy Animation Drama Keywords No keywords have been added. Content Score 86 Almost there... Top Contributors N 5 NightwingSK 2 SkullCollector b 1 boudiou_62  View Edit History Popularity Trend  Login to edit  URL By  signing up  for an account on TMDb, you can post directly to Twitter and Facebook. You need to be logged in to continue. Click  here  to login or  here  to sign up.    page_wrap opened in html_head  Join the Community The Basics About TMDb Contact Us Support Forums API Blog Get Involved  Contribution Bible 3rd Party Applications Add New Movie Add New TV Show Community Guidelines Leaderboard Forums Twitter Facebook Legal Terms of Use Privacy Policy Login Sign Up"}