{"link": "https://www.themoviedb.org/tv/80270?language=en", "title": "Reaksiyon", "resume": "The enemy of Turkey lives mostly within the borders of Turkey. A group of people who are willing to sacrifice themselves for eliminating Turkey's interior and outer enemies.", "rate": 90, "genre": ["Action", "Adventure"], "cast": ["Ibrahim Celikkol", "\u0130smail Demirci", "Erdal Besik\u00e7ioglu", "Yurdaer Okur", "Kevork Malikyan"], "character": ["O\u011fuz Ayaz", "Tekin Ulubatl\u0131", "Yavuz Aslan", "G\u00fcrkan Erman", "\u00d6ktem \u00c7etiner"], "site_data": "html Apps Forums Leaderboard Contribute API Support Discover Movies TV Shows Movies Popular Top Rated Upcoming Now Playing TV Shows Popular Top Rated On TV Airing Today People Popular People Can't find a movie or TV show? Login to create it. en Login Sign Up  ID: 80270   Expand Reaksiyon   (2014) User Score Overview The enemy of Turkey lives mostly within the borders of Turkey. A group of people who are willing to sacrifice themselves for eliminating Turkey's interior and outer enemies. Featured Crew Ozan Aksungur Creator Emre \u00d6zd\u00fcr Creator Discussions   Reviews Videos   Images   Changes Report Share Discussions General  0 Content Issues  0 Images Backdrops  0 Posters  1 Videos Trailers  0 Teasers  0 Clips  0 Featurettes  0 Opening Credits  0 Top Billed Cast Ibrahim Celikkol O\u011fuz Ayaz \u0130smail Demirci Tekin Ulubatl\u0131 Erdal Besik\u00e7ioglu Yavuz Aslan Yurdaer Okur G\u00fcrkan Erman Kevork Malikyan \u00d6ktem \u00c7etiner Full Cast & Crew Last Season Season 1 2014 | 0 Episodes Season 1 of Reaksiyon premiered on September 15, 2014. View All Seasons Social Reviews  0 Discussions  0 Media Most Popular Videos  0 Backdrops  0 Posters  1 Recommendations We don't have enough data to suggest any TV shows based on Reaksiyon. You can help by rating TV shows you've seen. Facts Status  Returning Series Network Certification  - Type  Scripted Original Language  Turkish Runtime  - Homepage  - Genres Action & Adventure Keywords No keywords have been added. Content Score 86 Almost there... Top Contributors z 18 zerox 9 Elizabeth Jennings  View Edit History Popularity Trend  Login to edit  URL By  signing up  for an account on TMDb, you can post directly to Twitter and Facebook. You need to be logged in to continue. Click  here  to login or  here  to sign up.    page_wrap opened in html_head  Join the Community The Basics About TMDb Contact Us Support Forums API Blog Get Involved  Contribution Bible 3rd Party Applications Add New Movie Add New TV Show Community Guidelines Leaderboard Forums Twitter Facebook Legal Terms of Use Privacy Policy Login Sign Up"}