{"link": "https://www.themoviedb.org/tv/62457?language=en", "title": "\u0627\u0644\u0639\u064a\u0627\u062f\u0629", "resume": "We don't have an overview translated in English. Help us expand our database by adding one.", "rate": 90, "genre": ["Family", "Comedy"], "cast": ["Edward", "Basma", "Khaled Sarhan", "Soliman Eid"], "character": ["\u0635\u0644\u0627\u062d", "\u0647\u062f\u0649", "\u0643\u0627\u0645\u0644", "\u0628\u0643\u0631\u064a"], "site_data": "html Apps Forums Leaderboard Contribute API Support Discover Movies TV Shows Movies Popular Top Rated Upcoming Now Playing TV Shows Popular Top Rated On TV Airing Today People Popular People Can't find a movie or TV show? Login to create it. en Login Sign Up  ID: 62457   Expand \u0627\u0644\u0639\u064a\u0627\u062f\u0629   (2008) User Score Overview We don't have an overview translated in English. Help us expand our database by adding one. Featured Crew \u0645\u0627\u062c\u062f \u0645\u062c\u062f\u064a Creator Discussions   Reviews Videos   Images   Changes Report Share Discussions General  0 Content Issues  0 Images Backdrops  2 Posters  1 Videos Trailers  0 Teasers  0 Clips  0 Featurettes  0 Opening Credits  0 Top Billed Cast Edward \u0635\u0644\u0627\u062d Basma \u0647\u062f\u0649 Khaled Sarhan \u0643\u0627\u0645\u0644 Soliman Eid \u0628\u0643\u0631\u064a Full Cast & Crew Last Season Season 2 2009 | 30 Episodes Season 2 of \u0627\u0644\u0639\u064a\u0627\u062f\u0629 premiered on August 22, 2009. View All Seasons Social Reviews  0 Discussions  0 Media Most Popular Videos  0 Backdrops  2 Posters  1 Recommendations We don't have enough data to suggest any TV shows based on \u0627\u0644\u0639\u064a\u0627\u062f\u0629. You can help by rating TV shows you've seen. Facts Status  Ended Networks - Certification  - Type  Scripted Original Language  Arabic Runtime  30m Homepage  - Genres Family Comedy Keywords family sitcom arabic Content Score 93 Almost there... Top Contributors E 34 Ezzedin 1 Banana TB 1 TMDb Bot 1 Drek  View Edit History Popularity Trend  Login to edit  URL By  signing up  for an account on TMDb, you can post directly to Twitter and Facebook. You need to be logged in to continue. Click  here  to login or  here  to sign up.    page_wrap opened in html_head  Join the Community The Basics About TMDb Contact Us Support Forums API Blog Get Involved  Contribution Bible 3rd Party Applications Add New Movie Add New TV Show Community Guidelines Leaderboard Forums Twitter Facebook Legal Terms of Use Privacy Policy Login Sign Up"}