{"link": "https://www.themoviedb.org/tv/76537?language=en", "title": "Stralsund", "resume": "We don't have an overview translated in English. Help us expand our database by adding one.", "rate": 0, "genre": ["Drama", "Crime"], "cast": ["Katharina Wackernagel", "Alexander Held", "Andreas Schr\u00f6ders", "Michael Rotschopf", "Wotan Wilke M\u00f6hring"], "character": ["Nina Petersen", "Karl Hidde", "Stein", "Gregor Meyer", "Benjamin Lietz"], "site_data": "html Apps Forums Leaderboard Contribute API Support Discover Movies TV Shows Movies Popular Top Rated Upcoming Now Playing TV Shows Popular Top Rated On TV Airing Today People Popular People Can't find a movie or TV show? Login to create it. en Login Sign Up  ID: 76537   Expand Stralsund   (2009) User Score Overview We don't have an overview translated in English. Help us expand our database by adding one. Discussions   Reviews Videos   Images   Changes Report Share Discussions General  0 Content Issues  0 Images Backdrops  1 Posters  1 Videos Trailers  0 Teasers  0 Clips  0 Featurettes  0 Opening Credits  0 Top Billed Cast Katharina Wackernagel Nina Petersen Alexander Held Karl Hidde Andreas Schr\u00f6ders Stein Michael Rotschopf Gregor Meyer Wotan Wilke M\u00f6hring Benjamin Lietz Full Cast & Crew Last Season Season 1 2009 | 12 Episodes Season 1 of Stralsund premiered on March 30, 2009. View All Seasons Social Reviews  0 Discussions  0 Media Most Popular Videos  0 Backdrops  1 Posters  1 Recommendations We don't have enough data to suggest any TV shows based on Stralsund. You can help by rating TV shows you've seen. Facts Status  Returning Series Network Certification 12 Meaning The broadcaster must take the decision about the air time by taking in consideration the impact on young children in the timeframe from 6:00am to 8:00pm. Type  Scripted Original Language  German Runtime  90m Homepage  - Genres Drama Crime Keywords No keywords have been added. Content Score 79 Pump it up! We're close now. Top Contributors 17 awenny L 8 Lemmy_6 S 1 Shady12 S 1 Samara  View Edit History Popularity Trend  Login to edit  URL By  signing up  for an account on TMDb, you can post directly to Twitter and Facebook. You need to be logged in to continue. Click  here  to login or  here  to sign up.    page_wrap opened in html_head  Join the Community The Basics About TMDb Contact Us Support Forums API Blog Get Involved  Contribution Bible 3rd Party Applications Add New Movie Add New TV Show Community Guidelines Leaderboard Forums Twitter Facebook Legal Terms of Use Privacy Policy Login Sign Up"}