{"link": "https://www.themoviedb.org/tv/52227?language=en", "title": "Rouge Br\u00e9sil", "resume": "We don't have an overview translated in English. Help us expand our database by adding one.", "rate": 0, "genre": ["Drama"], "cast": ["Th\u00e9o Frilet", "Juliette Lamboley", "Stellan Skarsg\u00e5rd", "Sagamore St\u00e9venin", "Joaquim de Almeida"], "character": ["Just", "Colombe", "Villegagnon", "Gonzague", "Jo\u00e3o da Silva"], "site_data": "html Apps Forums Leaderboard Contribute API Support Discover Movies TV Shows Movies Popular Top Rated Upcoming Now Playing TV Shows Popular Top Rated On TV Airing Today People Popular People Can't find a movie or TV show? Login to create it. en Login Sign Up  ID: 52227   Expand Rouge Br\u00e9sil   (2013) User Score Overview We don't have an overview translated in English. Help us expand our database by adding one. Discussions   Reviews Videos   Images   Changes Report Share Discussions General  0 Content Issues  0 Images Backdrops  0 Posters  1 Videos Trailers  0 Teasers  0 Clips  0 Featurettes  0 Opening Credits  0 Top Billed Cast Th\u00e9o Frilet Just Juliette Lamboley Colombe Stellan Skarsg\u00e5rd Villegagnon Sagamore St\u00e9venin Gonzague Joaquim de Almeida Jo\u00e3o da Silva Full Cast & Crew Last Season Saison 1 2013 | 2 Episodes Season 1 of Rouge Br\u00e9sil premiered on January 22, 2013. View All Seasons Social Reviews  0 Discussions  0 Media Most Popular Videos  0 Backdrops  0 Posters  1 Recommendations We don't have enough data to suggest any TV shows based on Rouge Br\u00e9sil. You can help by rating TV shows you've seen. Facts Status  Ended Networks - Certification  - Type  Miniseries Original Language  English Runtime  90m Homepage  - Genres Drama Keywords based on novel or book brazil miniseries french colonialism historical drama 16th century Content Score 64 We're so close, yet so far. Top Contributors 23 Banana f 4 filipejpdias 3 SkullCollector p 2 pgranado  View Edit History Popularity Trend  Login to edit  URL By  signing up  for an account on TMDb, you can post directly to Twitter and Facebook. You need to be logged in to continue. Click  here  to login or  here  to sign up.    page_wrap opened in html_head  Join the Community The Basics About TMDb Contact Us Support Forums API Blog Get Involved  Contribution Bible 3rd Party Applications Add New Movie Add New TV Show Community Guidelines Leaderboard Forums Twitter Facebook Legal Terms of Use Privacy Policy Login Sign Up"}