{"link": "https://www.themoviedb.org/tv/72741?language=en", "title": "Deceptions", "resume": "We don't have an overview translated in English. Help us expand our database by adding one.", "rate": 0, "genre": ["Drama"], "cast": ["Stefanie Powers", "Barry Bostwick", "Jeremy Brett", "James Faulkner", "Sam Wanamaker"], "character": ["Sabrina Longworth / Stephanie Roberts", "Grant Roberts", "Bryan Foxworth", "Richard Blackwell", "Jim Nolan"], "site_data": "html Apps Forums Leaderboard Contribute API Support Discover Movies TV Shows Movies Popular Top Rated Upcoming Now Playing TV Shows Popular Top Rated On TV Airing Today People Popular People Can't find a movie or TV show? Login to create it. en Login Sign Up  ID: 72741   Expand Deceptions   (1985) User Score Overview We don't have an overview translated in English. Help us expand our database by adding one. Discussions   Reviews Videos   Images   Changes Report Share Discussions General  0 Content Issues  0 Images Backdrops  0 Posters  1 Videos Trailers  0 Teasers  0 Clips  0 Featurettes  0 Opening Credits  0 Top Billed Cast Stefanie Powers Sabrina Longworth / Stephanie Roberts Barry Bostwick Grant Roberts Jeremy Brett Bryan Foxworth James Faulkner Richard Blackwell Sam Wanamaker Jim Nolan Full Cast & Crew Last Season Season 1 1985 | 1 Episode Season 1 of Deceptions premiered on May 26, 1985. View All Seasons Social Reviews  0 Discussions  0 Media Most Popular Videos  0 Backdrops  0 Posters  1 Recommendations We don't have enough data to suggest any TV shows based on Deceptions. You can help by rating TV shows you've seen. Facts Status  Ended Networks - Certification  - Type  Miniseries Original Language  Spanish; Castilian Runtime  181m Homepage  - Genres Drama Keywords romance miniseries Content Score 64 We're so close, yet so far. Top Contributors i 21 ismax935 t 9 tmdb62905833 3 lineker s 3 speedycars  View Edit History Popularity Trend  Login to edit  URL By  signing up  for an account on TMDb, you can post directly to Twitter and Facebook. You need to be logged in to continue. Click  here  to login or  here  to sign up.    page_wrap opened in html_head  Join the Community The Basics About TMDb Contact Us Support Forums API Blog Get Involved  Contribution Bible 3rd Party Applications Add New Movie Add New TV Show Community Guidelines Leaderboard Forums Twitter Facebook Legal Terms of Use Privacy Policy Login Sign Up"}