{"link": "https://www.themoviedb.org/tv/62613?language=en", "title": "BuenAgente", "resume": "We don't have an overview translated in English. Help us expand our database by adding one.", "rate": 0, "genre": ["Comedy"], "cast": ["Antonio Molero", "Malena Alterio", "Arturo Valls", "Carmen Ruiz", "Patricia Montero"], "character": ["Sebas", "Lola", "Agus", "Olivia", "Ana"], "site_data": "html Apps Forums Leaderboard Contribute API Support Discover Movies TV Shows Movies Popular Top Rated Upcoming Now Playing TV Shows Popular Top Rated On TV Airing Today People Popular People Can't find a movie or TV show? Login to create it. en Login Sign Up  ID: 62613   Expand BuenAgente   (2011) User Score Overview We don't have an overview translated in English. Help us expand our database by adding one. Featured Crew Daniel \u00c9cija Creator Mario Montero Creator Arantxa Cuesta Creator Txemi Parra Creator Discussions   Reviews Videos   Images   Changes Report Share Discussions General  0 Content Issues  0 Images Backdrops  5 Posters  1 Videos Trailers  0 Teasers  0 Clips  0 Featurettes  0 Opening Credits  0 Top Billed Cast Antonio Molero Sebas Malena Alterio Lola Arturo Valls Agus Carmen Ruiz Olivia Patricia Montero Ana Full Cast & Crew Last Season Season 2 2011 | 6 Episodes Season 2 of BuenAgente premiered on October 28, 2011. View All Seasons Social Reviews  0 Discussions  0 Media Most Popular Videos  0 Backdrops  5 Posters  1 Recommendations We don't have enough data to suggest any TV shows based on BuenAgente. You can help by rating TV shows you've seen. Facts Status  Ended Network Certification  - Type  Scripted Original Language  Spanish; Castilian Runtime  55m Homepage   http://www.lasexta.com/series/buena-gente/ Genres Comedy Keywords No keywords have been added. Content Score 86 Almost there... Top Contributors 35 prm96 28 United600 z 10 zurman1 1 Elizabeth Jennings  View Edit History Popularity Trend  Login to edit  URL By  signing up  for an account on TMDb, you can post directly to Twitter and Facebook. You need to be logged in to continue. Click  here  to login or  here  to sign up.    page_wrap opened in html_head  Join the Community The Basics About TMDb Contact Us Support Forums API Blog Get Involved  Contribution Bible 3rd Party Applications Add New Movie Add New TV Show Community Guidelines Leaderboard Forums Twitter Facebook Legal Terms of Use Privacy Policy Login Sign Up"}