{"link": "https://www.themoviedb.org/tv/67721?language=en", "title": "Al\u017ebetin dvor", "resume": "We don't have an overview translated in English. Help us expand our database by adding one.", "rate": 0, "genre": ["Drama"], "cast": ["Jana Zvar\u00edkov\u00e1", "Hana Gregorov\u00e1", "Radoslav Brzobohat\u00fd", "Vlado M\u00fcller", "Michal Do\u010dolomansk\u00fd"], "character": ["Alzbeta Fabici rod. Castiglionne", "Terka Belickova", "Mathias Fabici", "Tadeas Ruttkay", "Jonas Benicky"], "site_data": "html Apps Forums Leaderboard Contribute API Support Discover Movies TV Shows Movies Popular Top Rated Upcoming Now Playing TV Shows Popular Top Rated On TV Airing Today People Popular People Can't find a movie or TV show? Login to create it. en Login Sign Up  ID: 67721   Expand Al\u017ebetin dvor   (1986) User Score Overview We don't have an overview translated in English. Help us expand our database by adding one. Featured Crew Hana Zelinova Creator Discussions   Reviews Videos   Images   Changes Report Share Discussions General  0 Content Issues  0 Images Backdrops  0 Posters  1 Videos Trailers  0 Teasers  0 Clips  0 Featurettes  0 Opening Credits  0 Top Billed Cast Jana Zvar\u00edkov\u00e1 Alzbeta Fabici rod. Castiglionne Hana Gregorov\u00e1 Terka Belickova Radoslav Brzobohat\u00fd Mathias Fabici Vlado M\u00fcller Tadeas Ruttkay Michal Do\u010dolomansk\u00fd Jonas Benicky Full Cast & Crew Last Season Season 1 1986 | 6 Episodes Season 1 of Al\u017ebetin dvor premiered on January  1, 1986. View All Seasons Social Reviews  0 Discussions  0 Media Most Popular Videos  0 Backdrops  0 Posters  1 Recommendations We don't have enough data to suggest any TV shows based on Al\u017ebetin dvor. You can help by rating TV shows you've seen. Facts Status  Ended Network Slovensk\u00e1 telev\u00edzia Certification  - Type  Scripted Original Language  Slovak Runtime  80m Homepage  - Genres Drama Keywords No keywords have been added. Content Score 71 Just a little bit more... Top Contributors S 28 Sidh r 15 robko22  View Edit History Popularity Trend  Login to edit  URL By  signing up  for an account on TMDb, you can post directly to Twitter and Facebook. You need to be logged in to continue. Click  here  to login or  here  to sign up.    page_wrap opened in html_head  Join the Community The Basics About TMDb Contact Us Support Forums API Blog Get Involved  Contribution Bible 3rd Party Applications Add New Movie Add New TV Show Community Guidelines Leaderboard Forums Twitter Facebook Legal Terms of Use Privacy Policy Login Sign Up"}