{"link": "https://www.themoviedb.org/tv/22939?language=en", "title": "MGM: When the Lion Roars", "resume": "Surveys the history of Metro-Goldwyn-Mayer Studios from its creation and rise in the 1920's, its pinnacle in the 30's and 40's to it's decline in the 1950's.", "rate": 90, "genre": ["Documentary"], "cast": ["Patrick Stewart", "Stanley Donen", "Helen Hayes", "Esther Williams", "Freddie Bartholomew"], "character": ["Himself - Narrator"], "site_data": "html Apps Forums Leaderboard Contribute API Support Discover Movies TV Shows Movies Popular Top Rated Upcoming Now Playing TV Shows Popular Top Rated On TV Airing Today People Popular People Can't find a movie or TV show? Login to create it. en Login Sign Up  ID: 22939   Expand MGM: When the Lion Roars   (1992) User Score Overview Surveys the history of Metro-Goldwyn-Mayer Studios from its creation and rise in the 1920's, its pinnacle in the 30's and 40's to it's decline in the 1950's. Discussions   Reviews Videos   Images   Changes Report Share Discussions General  0 Content Issues  0 Images Backdrops  2 Posters  3 Videos Trailers  0 Teasers  0 Clips  0 Featurettes  0 Opening Credits  0 Top Billed Cast Patrick Stewart Himself - Narrator Stanley Donen Helen Hayes Esther Williams Freddie Bartholomew Full Cast & Crew Last Season Miniseries 1992 | 3 Episodes Season 1 of MGM: When the Lion Roars premiered on March 22, 1992. View All Seasons Social Reviews  0 Discussions  0 Media Most Popular Videos  0 Backdrops  2 Posters  3 Recommendations We don't have enough data to suggest any TV shows based on MGM: When the Lion Roars. You can help by rating TV shows you've seen. Facts Status  Ended Network Certification  - Type  Miniseries Original Language  English Runtime  360m Homepage  - Genres Documentary Keywords movie business miniseries hollywood Content Score 86 Almost there... Top Contributors TB 11 TMDb Bot R 6 Rebecca 5 Banana  View Edit History Popularity Trend  Login to edit  URL By  signing up  for an account on TMDb, you can post directly to Twitter and Facebook. You need to be logged in to continue. Click  here  to login or  here  to sign up.    page_wrap opened in html_head  Join the Community The Basics About TMDb Contact Us Support Forums API Blog Get Involved  Contribution Bible 3rd Party Applications Add New Movie Add New TV Show Community Guidelines Leaderboard Forums Twitter Facebook Legal Terms of Use Privacy Policy Login Sign Up"}