{"link": "https://www.themoviedb.org/tv/63275?language=en", "title": "Was It Something I Said?", "resume": "Was It Something I Said? is a British comedy panel show broadcast on Channel 4, presented by David Mitchell and featuring team captains Richard Ayoade and Micky Flanagan.", "rate": 76, "genre": ["Comedy"], "cast": ["David Mitchell", "Richard Ayoade", "Micky Flanagan"], "character": ["Himself (host)", "Himself (captain)", "Himself (captain)"], "site_data": "html Apps Forums Leaderboard Contribute API Support Discover Movies TV Shows Movies Popular Top Rated Upcoming Now Playing TV Shows Popular Top Rated On TV Airing Today People Popular People Can't find a movie or TV show? Login to create it. en Login Sign Up  ID: 63275   Expand Was It Something I Said?   (2013) User Score Overview Was It Something I Said? is a British comedy panel show broadcast on Channel 4, presented by David Mitchell and featuring team captains Richard Ayoade and Micky Flanagan. Discussions   Reviews Videos   Images   Changes Report Share Discussions General  0 Content Issues  0 Images Backdrops  0 Posters  1 Videos Trailers  0 Teasers  0 Clips  0 Featurettes  0 Opening Credits  0 Top Billed Cast David Mitchell Himself (host) Richard Ayoade Himself (captain) Micky Flanagan Himself (captain) Full Cast & Crew Last Season Series 1 2013 | 8 Episodes Season 1 of Was It Something I Said? premiered on October  6, 2013. View All Seasons Social Reviews  0 Discussions  0 Media Most Popular Videos  0 Backdrops  0 Posters  1 Recommendations   2007-06-16 Would I Lie to You? 7.8    2013-04-12 8 Out of 10 Cats Does Countdown 7.3    1996-11-12 Never Mind the Buzzcocks 7.5    2009-03-18 Better Off Ted 7.7    1989-01-13 A Bit of Fry and Laurie 8.0    2010-01-11 Blue Mountain State 7.0  Facts Status  Ended Network Certification  - Type  Scripted Original Language  English Runtime  24m Homepage   http://somethingisaid.channel4.com/ Genres Comedy Keywords literature quotation panel show Content Score 43 There's no 'I' in team... Top Contributors 21 DBD 2 RobotoRaccoon  View Edit History Popularity Trend  Login to edit  URL By  signing up  for an account on TMDb, you can post directly to Twitter and Facebook. You need to be logged in to continue. Click  here  to login or  here  to sign up.    page_wrap opened in html_head  Join the Community The Basics About TMDb Contact Us Support Forums API Blog Get Involved  Contribution Bible 3rd Party Applications Add New Movie Add New TV Show Community Guidelines Leaderboard Forums Twitter Facebook Legal Terms of Use Privacy Policy Login Sign Up"}