{"link": "https://www.themoviedb.org/tv/67432?language=en", "title": "Love Catharsis", "resume": "Mia Kurihara works in the public relations department of a company. She falls in love with Kairi Miyoshi. He is the vice president of the company, but he is also married.", "rate": null, "genre": ["Drama"], "cast": ["Emi Takei", "Hideaki Takizawa", "Aoi Nakamura", "Erena Mizusawa", "Reina Triendl"], "site_data": "html Apps Forums Leaderboard Contribute API Support Discover Movies TV Shows Movies Popular Top Rated Upcoming Now Playing TV Shows Popular Top Rated On TV Airing Today People Popular People Can't find a movie or TV show? Login to create it. en Login Sign Up  ID: 67432   Expand Love Catharsis   (2016) User Score Overview Mia Kurihara works in the public relations department of a company. She falls in love with Kairi Miyoshi. He is the vice president of the company, but he is also married. Discussions   Reviews Videos   Images   Changes Report Share Discussions General  0 Content Issues  0 Images Backdrops  1 Posters  2 Videos Trailers  0 Teasers  0 Clips  0 Featurettes  0 Opening Credits  0 Top Billed Cast Emi Takei Mia Kurihara Hideaki Takizawa Kairi Miyoshi Aoi Nakamura Aya Miyazawa Erena Mizusawa Akari Masaki Reina Triendl Chiaki Miyama Full Cast & Crew Last Season Season 1 2016 | 10 Episodes Season 1 of Love Catharsis premiered on July 12, 2016. View All Seasons Social Reviews  0 Discussions  0 Media Most Popular Videos  0 Backdrops  1 Posters  2 Recommendations We don't have enough data to suggest any TV shows based on Love Catharsis. You can help by rating TV shows you've seen. Facts Original Name  \u305b\u3044\u305b\u3044\u3059\u308b\u307b\u3069\u3001\u611b\u3057\u3066\u308b Status  Ended Network Certification  - Type  Scripted Original Language  Japanese Runtime  50m Homepage   http://www.tbs.co.jp/seiseisuruhodo_love/ Genres Drama Keywords japan romance Content Score 86 Almost there... Top Contributors M 33 Maria180493 s 9 ssdrtran  View Edit History Popularity Trend  Login to edit  URL By  signing up  for an account on TMDb, you can post directly to Twitter and Facebook. You need to be logged in to continue. Click  here  to login or  here  to sign up.    page_wrap opened in html_head  Join the Community The Basics About TMDb Contact Us Support Forums API Blog Get Involved  Contribution Bible 3rd Party Applications Add New Movie Add New TV Show Community Guidelines Leaderboard Forums Twitter Facebook Legal Terms of Use Privacy Policy Login Sign Up", "character": ["Mia Kurihara", "Kairi Miyoshi", "Aya Miyazawa", "Akari Masaki", "Chiaki Miyama"]}