{"link": "https://www.themoviedb.org/tv/40922?language=en", "title": "My Friend Winnetou", "resume": "Mein Freund Winnetou is a German television series.", "rate": 0, "genre": ["Western"], "cast": ["Pierre Brice", "Siegfried Rauch", "Eric Do", "Ralf Wolter", "Arthur Brauss"], "character": ["Winnetou", "Old Shatterhand", "Tashunko", "Sam Hawkins", "Lt. Robert Merril"], "site_data": "html Apps Forums Leaderboard Contribute API Support Discover Movies TV Shows Movies Popular Top Rated Upcoming Now Playing TV Shows Popular Top Rated On TV Airing Today People Popular People Can't find a movie or TV show? Login to create it. en Login Sign Up  ID: 40922   Expand My Friend Winnetou   (1980) User Score Overview Mein Freund Winnetou is a German television series. Featured Crew Pierre Brice Creator Discussions   Reviews Videos   Images   Changes Report Share Discussions General  0 Content Issues  0 Images Backdrops  0 Posters  1 Videos Trailers  0 Teasers  0 Clips  0 Featurettes  0 Opening Credits  0 Top Billed Cast Pierre Brice Winnetou Siegfried Rauch Old Shatterhand Eric Do Tashunko Ralf Wolter Sam Hawkins Arthur Brauss Lt. Robert Merril Full Cast & Crew Last Season Season 1 1980 | 14 Episodes Season 1 of My Friend Winnetou premiered on May  2, 1980. View All Seasons Social Reviews  0 Discussions  0 Media Most Popular Videos  0 Backdrops  0 Posters  1 Recommendations We don't have enough data to suggest any TV shows based on My Friend Winnetou. You can help by rating TV shows you've seen. Facts Original Name  Winnetou le Mescal\u00e9ro Status  Ended Networks Certification  - Type  Scripted Original Language  German Runtime  - Homepage  - Genres Western Keywords mexico apache native american wild west Content Score 79 Pump it up! We're close now. Top Contributors W 21 Widered m 10 movienator 9 Will Barks S 3 Samara  View Edit History Popularity Trend  Login to edit  URL By  signing up  for an account on TMDb, you can post directly to Twitter and Facebook. You need to be logged in to continue. Click  here  to login or  here  to sign up.    page_wrap opened in html_head  Join the Community The Basics About TMDb Contact Us Support Forums API Blog Get Involved  Contribution Bible 3rd Party Applications Add New Movie Add New TV Show Community Guidelines Leaderboard Forums Twitter Facebook Legal Terms of Use Privacy Policy Login Sign Up"}