{"link": "https://www.themoviedb.org/tv/73459?language=en", "title": "Initial D: Fourth Stage - Project D", "resume": "Takumi Fujiwara continues his undefeated racing streak, touring the mountain passes of Japan with rival driver Keisuke Takahashi as a part of ex-racer Ryosuke Takahashi's racing team: \"Project D\".", "rate": 100, "genre": ["Animation"], "cast": ["Shin'ichirou Miki", "Takehito Koyasu", "Tomokazu Seki"], "character": ["Takumi Fujiawa", "Takahashi Ryousuke", "Takahashi Keisuke"], "site_data": "html Apps Forums Leaderboard Contribute API Support Discover Movies TV Shows Movies Popular Top Rated Upcoming Now Playing TV Shows Popular Top Rated On TV Airing Today People Popular People Can't find a movie or TV show? Login to create it. en Login Sign Up  ID: 73459   Expand Initial D: Fourth Stage - Project D   (2004) User Score  Play Trailer Overview Takumi Fujiwara continues his undefeated racing streak, touring the mountain passes of Japan with rival driver Keisuke Takahashi as a part of ex-racer Ryosuke Takahashi's racing team: \"Project D\". Discussions   Reviews Videos   Images   Changes Report Share Discussions General  0 Content Issues  0 Images Backdrops  0 Posters  1 Videos Trailers  2 Teasers  0 Clips  0 Featurettes  0 Opening Credits  0 Top Billed Cast Shin'ichirou Miki Takumi Fujiawa Takehito Koyasu Takahashi Ryousuke Tomokazu Seki Takahashi Keisuke Full Cast & Crew Last Season Season 1 2004 | 24 Episodes Season 1 of Initial D: Fourth Stage - Project D premiered on April 16, 2004. View All Seasons Social Reviews  0 Discussions  0 Media Most Popular Videos  2 Backdrops  0 Posters  1 Recommendations We don't have enough data to suggest any TV shows based on Initial D: Fourth Stage - Project D. You can help by rating TV shows you've seen. Facts Status  Returning Series Networks - Certification  - Type  Scripted Original Language  Japanese Runtime  27m Homepage  - Genres Animation Keywords sport racing cars Content Score 50 Still needs a little work. Top Contributors l 26 loopcat TB 4 TMDb Bot 1 tigru89  View Edit History Popularity Trend  Login to edit  URL By  signing up  for an account on TMDb, you can post directly to Twitter and Facebook. You need to be logged in to continue. Click  here  to login or  here  to sign up.    page_wrap opened in html_head  Join the Community The Basics About TMDb Contact Us Support Forums API Blog Get Involved  Contribution Bible 3rd Party Applications Add New Movie Add New TV Show Community Guidelines Leaderboard Forums Twitter Facebook Legal Terms of Use Privacy Policy Login Sign Up"}