{"link": "https://www.themoviedb.org/tv/71711?language=en", "title": "Ask the Doctor", "resume": "An innovative, fun, and exploratory factual series that addresses the state of the nation's health, the latest in medical treatments and the future of healthcare as we know it.", "rate": 0, "genre": ["Documentary"], "cast": ["Shalin Naik", "Renee Lim", "Sandro Demaio"], "character": ["Himself", "Herself", "Himself"], "site_data": "html Apps Forums Leaderboard Contribute API Support Discover Movies TV Shows Movies Popular Top Rated Upcoming Now Playing TV Shows Popular Top Rated On TV Airing Today People Popular People Can't find a movie or TV show? Login to create it. en Login Sign Up  ID: 71711   Expand Ask the Doctor   (2017) User Score  Play Trailer Overview An innovative, fun, and exploratory factual series that addresses the state of the nation's health, the latest in medical treatments and the future of healthcare as we know it. Discussions   Reviews Videos   Images   Changes Report Share Discussions General  0 Content Issues  0 Images Backdrops  1 Posters  2 Videos Trailers  1 Teasers  0 Clips  1 Featurettes  0 Opening Credits  0 Top Billed Cast Shalin Naik Himself Renee Lim Herself Sandro Demaio Himself Full Cast & Crew Last Season Series 1 2017 | 12 Episodes Season 1 of Ask the Doctor premiered on May 16, 2017. View All Seasons Social Reviews  0 Discussions  0 Media Most Popular Videos  2 Backdrops  1 Posters  2 Recommendations We don't have enough data to suggest any TV shows based on Ask the Doctor. You can help by rating TV shows you've seen. Facts Status  Returning Series Network Certification PG Meaning Parental guidance is recommended for young viewers; PG-rated content may air at any time on digital-only channels, otherwise, it should only be broadcast between 8:30 a.m. and 4:00 p.m. and between 7:00 p.m. and 6:00 a.m. on weekdays, and between 10:00 a.m. and 6:00 a.m. on weekends. Type  Documentary Original Language  English Runtime  30m Homepage   http://www.abc.net.au/tv/programs/ask-the-doctor/ Genres Documentary Keywords No keywords have been added. Content Score 64 We're so close, yet so far. Top Contributors 35 United600 TB 5 TMDb Bot 4 Elizabeth Jennings  View Edit History Popularity Trend  Login to edit  URL By  signing up  for an account on TMDb, you can post directly to Twitter and Facebook. You need to be logged in to continue. Click  here  to login or  here  to sign up.    page_wrap opened in html_head  Join the Community The Basics About TMDb Contact Us Support Forums API Blog Get Involved  Contribution Bible 3rd Party Applications Add New Movie Add New TV Show Community Guidelines Leaderboard Forums Twitter Facebook Legal Terms of Use Privacy Policy Login Sign Up"}