{"link": "https://www.themoviedb.org/tv/61741?language=en", "title": "Secrets and Lies", "resume": "Detective Andrea Cornell is a tough, thorough Homicide Detective who leaves no stone unturned. Her unwavering dedication to her job makes her the most formidable opponent - or a highly valuable ally.", "rate": 71, "genre": ["Drama", "Crime"], "cast": ["Juliette Lewis", "Michael Ealy", "Terry O'Quinn", "Charlie Barnett", "Mekia Cox"], "character": ["Det. Andrea Cornell", "Eric Warner", "John Warner", "Patrick Warner", "Amanda Warner"], "site_data": "html Apps Forums Leaderboard Contribute API Support Discover Movies TV Shows Movies Popular Top Rated Upcoming Now Playing TV Shows Popular Top Rated On TV Airing Today People Popular People Can't find a movie or TV show? Login to create it. en Login Sign Up  ID: 61741   Expand Secrets and Lies   (2015) User Score  Play Trailer Overview Detective Andrea Cornell is a tough, thorough Homicide Detective who leaves no stone unturned. Her unwavering dedication to her job makes her the most formidable opponent - or a highly valuable ally. Featured Crew Barbie Kligman Creator Discussions   Reviews Videos   Images   Changes Report Share Discussions General  1 Content Issues  0 Images Backdrops  11 Posters  4 Videos Trailers  1 Teasers  0 Clips  0 Featurettes  0 Opening Credits  0 Top Billed Cast Juliette Lewis Det. Andrea Cornell Michael Ealy Eric Warner Terry O'Quinn John Warner Charlie Barnett Patrick Warner Mekia Cox Amanda Warner Full Cast & Crew Last Season Season 2 2016 | 10 Episodes View All Seasons Social Reviews  0 Discussions  1 Subject Status Replies Last Reply ABC cancelled S&L so no season 3 Open 1 by  TheBayHarborButcher Go to Discussions Media Most Popular Videos  1 Backdrops  11 Posters  4 Recommendations   2016-04-11 Hunters 4.9    2015-10-27 Wicked City 5.4    2012-03-04 GCB 5.3    2015-08-25 Public Morals 7.5    2015-01-11 Togetherness 6.0    2016-01-07 Shades of Blue 6.2    2016-09-22 Notorious 5.8    2014-08-28 Hand of God 6.8  Facts Status  Cancelled Network Certification TV-14 Meaning This program contains some material that many parents would find unsuitable for children under 14 years of age. Type  Scripted Original Language  English Runtime  45m Homepage   http://abc.go.com/shows/secrets-and-lies Genres Drama Crime Keywords murder child murder murder mystery murder suspect Content Score 100 Yes! Looking good! Top Contributors 60 Elizabeth Jennings 31 Banana 23 SuperMario AK 22 Avshalom Kor  View Edit History Popularity Trend  Login to edit  URL By  signing up  for an account on TMDb, you can post directly to Twitter and Facebook. You need to be logged in to continue. Click  here  to login or  here  to sign up.    page_wrap opened in html_head  Join the Community The Basics About TMDb Contact Us Support Forums API Blog Get Involved  Contribution Bible 3rd Party Applications Add New Movie Add New TV Show Community Guidelines Leaderboard Forums Twitter Facebook Legal Terms of Use Privacy Policy Login Sign Up"}