{"link": "https://www.themoviedb.org/tv/46542?language=en", "title": "Yellow Boots", "resume": "\"Yellow Boots\" is a drama about the revenge of a woman who lost everything after being framed for a crime.", "rate": 0, "genre": ["Drama"], "cast": ["Jung Chan", "Lee Yoo-ri", "Kim Soo-hyeon"], "character": ["Seol Yeon-hwa", "Choi Yoo-ra (young)"], "site_data": "html Apps Forums Leaderboard Contribute API Support Discover Movies TV Shows Movies Popular Top Rated Upcoming Now Playing TV Shows Popular Top Rated On TV Airing Today People Popular People Can't find a movie or TV show? Login to create it. en Login Sign Up  ID: 46542   Expand Yellow Boots   (2012) User Score Overview \"Yellow Boots\" is a drama about the revenge of a woman who lost everything after being framed for a crime. Discussions   Reviews Videos   Images   Changes Report Share Discussions General  0 Content Issues  0 Images Backdrops  1 Posters  1 Videos Trailers  0 Teasers  0 Clips  0 Featurettes  0 Opening Credits  0 Top Billed Cast Jung Chan Lee Yoo-ri Seol Yeon-hwa Kim Soo-hyeon Choi Yoo-ra (young) Full Cast & Crew Last Season Season 1 2012 | 52 Episodes Season 1 of Yellow Boots premiered on February 27, 2012. View All Seasons Social Reviews  0 Discussions  0 Media Most Popular Videos  0 Backdrops  1 Posters  1 Recommendations We don't have enough data to suggest any TV shows based on Yellow Boots. You can help by rating TV shows you've seen. Facts Original Name  \ub178\ub780 \ubcf5\uc218\ucd08 Status  Ended Network Certification  - Type  Scripted Original Language  Korean Runtime  35m Homepage   http://tvnrevenge.interest.me/ Genres Drama Keywords No keywords have been added. Content Score 64 We're so close, yet so far. Top Contributors M 20 Maria180493 z 5 zurman1 e 4 ellexin 4 lareina123  View Edit History Popularity Trend  Login to edit  URL By  signing up  for an account on TMDb, you can post directly to Twitter and Facebook. You need to be logged in to continue. Click  here  to login or  here  to sign up.    page_wrap opened in html_head  Join the Community The Basics About TMDb Contact Us Support Forums API Blog Get Involved  Contribution Bible 3rd Party Applications Add New Movie Add New TV Show Community Guidelines Leaderboard Forums Twitter Facebook Legal Terms of Use Privacy Policy Login Sign Up"}