{"link": "https://www.themoviedb.org/tv/75430?language=en", "title": "\u00c1zsia Expressz", "resume": "We don't have an overview translated in English. Help us expand our database by adding one.", "rate": 100, "genre": ["Reality"], "cast": ["Kriszti\u00e1n Berki", "Katinka Cseke", "No\u00e9mi Ga\u00e1l", "Edina Kulcs\u00e1r", "Rebeka K\u00e1rp\u00e1ti"], "character": ["Kriszti\u00e1n Berki", "Katinka Cseke", "No\u00e9mi Ga\u00e1l", "Edina Kulcs\u00e1r", "Rebeka K\u00e1rp\u00e1ti"], "site_data": "html Apps Forums Leaderboard Contribute API Support Discover Movies TV Shows Movies Popular Top Rated Upcoming Now Playing TV Shows Popular Top Rated On TV Airing Today People Popular People Can't find a movie or TV show? Login to create it. en Login Sign Up  ID: 75430   Expand \u00c1zsia Expressz   (2017) User Score Overview We don't have an overview translated in English. Help us expand our database by adding one. Discussions   Reviews Videos   Images   Changes Report Share Discussions General  0 Content Issues  0 Images Backdrops  0 Posters  1 Videos Trailers  0 Teasers  0 Clips  0 Featurettes  0 Opening Credits  0 Top Billed Cast Kriszti\u00e1n Berki Kriszti\u00e1n Berki Katinka Cseke Katinka Cseke No\u00e9mi Ga\u00e1l No\u00e9mi Ga\u00e1l Edina Kulcs\u00e1r Edina Kulcs\u00e1r Rebeka K\u00e1rp\u00e1ti Rebeka K\u00e1rp\u00e1ti Full Cast & Crew Current Season Season 1 2017 | 0 Episodes Season 1 of \u00c1zsia Expressz premiered on November  7, 2017. View All Seasons Social Reviews  0 Discussions  0 Media Most Popular Videos  0 Backdrops  0 Posters  1 Recommendations We don't have enough data to suggest any TV shows based on \u00c1zsia Expressz. You can help by rating TV shows you've seen. Facts Status  Returning Series Network Certification 12 Meaning translation missing: en-US.certifications.tv_series.HU.4.meaning Type  Reality Original Language  Hungarian Runtime  - Homepage  - Genres Reality Keywords asia Content Score 71 Just a little bit more... Top Contributors 50 Shifty992 TB 2 TMDb Bot 1 Elizabeth Jennings  View Edit History Popularity Trend  Login to edit  URL By  signing up  for an account on TMDb, you can post directly to Twitter and Facebook. You need to be logged in to continue. Click  here  to login or  here  to sign up.    page_wrap opened in html_head  Join the Community The Basics About TMDb Contact Us Support Forums API Blog Get Involved  Contribution Bible 3rd Party Applications Add New Movie Add New TV Show Community Guidelines Leaderboard Forums Twitter Facebook Legal Terms of Use Privacy Policy Login Sign Up"}