{"link": "https://www.themoviedb.org/tv/44926?language=en", "title": "Yukan Club", "resume": "We don't have an overview translated in English. Help us expand our database by adding one.", "rate": 65, "genre": ["Comedy"], "cast": ["Jin Akanishi", "Yu Yokoyama", "Junnosuke Taguchi", "Minami", "Yuu Kashii"], "character": ["Miroku Shochikubai", "Seishiro Kikumasamune", "Bidou Granmarie", "Yuri Kenbishi", "Noriko Hakushika"], "site_data": "html Apps Forums Leaderboard Contribute API Support Discover Movies TV Shows Movies Popular Top Rated Upcoming Now Playing TV Shows Popular Top Rated On TV Airing Today People Popular People Can't find a movie or TV show? Login to create it. en Login Sign Up  ID: 44926   Expand Yukan Club   (2007) User Score Overview We don't have an overview translated in English. Help us expand our database by adding one. Discussions   Reviews Videos   Images   Changes Report Share Discussions General  0 Content Issues  0 Images Backdrops  1 Posters  2 Videos Trailers  0 Teasers  0 Clips  0 Featurettes  0 Opening Credits  0 Top Billed Cast Jin Akanishi Miroku Shochikubai Yu Yokoyama Seishiro Kikumasamune Junnosuke Taguchi Bidou Granmarie Minami Yuri Kenbishi Yuu Kashii Noriko Hakushika Full Cast & Crew Last Season Season 1 2007 | 10 Episodes Season 1 of Yukan Club premiered on October 16, 2007. View All Seasons Social Reviews  0 Discussions  0 Media Most Popular Videos  0 Backdrops  1 Posters  2 Recommendations We don't have enough data to suggest any TV shows based on Yukan Club. You can help by rating TV shows you've seen. Facts Original Name  \u6709\u9591\u5036\u697d\u90e8 Status  Ended Networks - Certification  - Type  Scripted Original Language  Japanese Runtime  54m Homepage  - Genres Comedy Keywords No keywords have been added. Content Score 79 Pump it up! We're close now. Top Contributors a 16 alicea o 5 okaime 3 thirstyhippo 1 Wendy  View Edit History Popularity Trend  Login to edit  URL By  signing up  for an account on TMDb, you can post directly to Twitter and Facebook. You need to be logged in to continue. Click  here  to login or  here  to sign up.    page_wrap opened in html_head  Join the Community The Basics About TMDb Contact Us Support Forums API Blog Get Involved  Contribution Bible 3rd Party Applications Add New Movie Add New TV Show Community Guidelines Leaderboard Forums Twitter Facebook Legal Terms of Use Privacy Policy Login Sign Up"}