{"link": "https://www.themoviedb.org/tv/62369?language=en", "title": "Mikagura Gakuen Kumikyoku", "resume": "We don't have an overview translated in English. Help us expand our database by adding one.", "rate": 60, "genre": ["Animation"], "cast": ["Yoshitsugu Matsuoka", "Natsuki Hanae", "Ari Ozawa", "Juri Kimura", "Ai Kakuma"], "character": ["Bimii", "Yuuto Akama", "Otone Fujishiro", "Eruna Ichinomiya", "Asuhi Imizu"], "site_data": "html Apps Forums Leaderboard Contribute API Support Discover Movies TV Shows Movies Popular Top Rated Upcoming Now Playing TV Shows Popular Top Rated On TV Airing Today People Popular People Can't find a movie or TV show? Login to create it. en Login Sign Up  ID: 62369   Expand Mikagura Gakuen Kumikyoku   (2015) User Score Overview We don't have an overview translated in English. Help us expand our database by adding one. Discussions   Reviews Videos   Images   Changes Report Share Discussions General  0 Content Issues  0 Images Backdrops  1 Posters  1 Videos Trailers  0 Teasers  0 Clips  0 Featurettes  0 Opening Credits  0 Top Billed Cast Yoshitsugu Matsuoka Bimii Natsuki Hanae Yuuto Akama Ari Ozawa Otone Fujishiro Juri Kimura Eruna Ichinomiya Ai Kakuma Asuhi Imizu Full Cast & Crew Last Season Season 1 2015 | 12 Episodes Season 1 of Mikagura Gakuen Kumikyoku premiered on April  6, 2015. View All Seasons Social Reviews  0 Discussions  0 Media Most Popular Videos  0 Backdrops  1 Posters  1 Recommendations We don't have enough data to suggest any TV shows based on Mikagura Gakuen Kumikyoku. You can help by rating TV shows you've seen. Facts Original Name  \u30df\u30ab\u30b0\u30e9\u5b66\u5712\u7d44\u66f2 Status  Ended Network Certification  - Type  Scripted Original Language  Japanese Runtime  25m Homepage  - Genres Animation Keywords No keywords have been added. Content Score 79 Pump it up! We're close now. Top Contributors 30 Aitor1995 z 5 zurman1 m 4 magoozin 3 sp1ti  View Edit History Popularity Trend  Login to edit  URL By  signing up  for an account on TMDb, you can post directly to Twitter and Facebook. You need to be logged in to continue. Click  here  to login or  here  to sign up.    page_wrap opened in html_head  Join the Community The Basics About TMDb Contact Us Support Forums API Blog Get Involved  Contribution Bible 3rd Party Applications Add New Movie Add New TV Show Community Guidelines Leaderboard Forums Twitter Facebook Legal Terms of Use Privacy Policy Login Sign Up"}