{"link": "https://www.themoviedb.org/tv/67258?language=en", "title": "Des Christoffel von Grimmelshausen abenteuerlicher Simplizissimus", "resume": "We don't have an overview translated in English. Help us expand our database by adding one.", "rate": 0, "genre": ["Action", "Adventure"], "cast": ["Heinz Weiss", "G\u00fcnter Strack", "Max Grie\u00dfer", "Friedrich G. Beckhaus", "G\u00fcnter Mack"], "character": ["Zullewitz", "Springinsfeld", "Bedienter Hans", "Feldprediger", "Larsson"], "site_data": "html Apps Forums Leaderboard Contribute API Support Discover Movies TV Shows Movies Popular Top Rated Upcoming Now Playing TV Shows Popular Top Rated On TV Airing Today People Popular People Can't find a movie or TV show? Login to create it. en Login Sign Up  ID: 67258   Expand Des Christoffel von Grimmelshausen abenteuerlicher Simplizissimus   (1975) User Score Overview We don't have an overview translated in English. Help us expand our database by adding one. Discussions   Reviews Videos   Images   Changes Report Share Discussions General  0 Content Issues  0 Images Backdrops  3 Posters  2 Videos Trailers  0 Teasers  0 Clips  0 Featurettes  0 Opening Credits  0 Top Billed Cast Heinz Weiss Zullewitz G\u00fcnter Strack Springinsfeld Max Grie\u00dfer Bedienter Hans Friedrich G. Beckhaus Feldprediger G\u00fcnter Mack Larsson Full Cast & Crew Last Season Season 1 1975 | 4 Episodes Season 1 of Des Christoffel von Grimmelshausen abenteuerlicher Simplizissimus premiered on November 19, 1975. View All Seasons Social Reviews  0 Discussions  0 Media Most Popular Videos  0 Backdrops  3 Posters  2 Recommendations We don't have enough data to suggest any TV shows based on Des Christoffel von Grimmelshausen abenteuerlicher Simplizissimus. You can help by rating TV shows you've seen. Facts Status  Ended Network Certification  - Type  Miniseries Original Language  German Runtime  90m Homepage  - Genres Action & Adventure Keywords miniseries Content Score 79 Pump it up! We're close now. Top Contributors L 31 Lemmy_6 R 9 Rebecca TB 8 TMDb Bot  View Edit History Popularity Trend  Login to edit  URL By  signing up  for an account on TMDb, you can post directly to Twitter and Facebook. You need to be logged in to continue. Click  here  to login or  here  to sign up.    page_wrap opened in html_head  Join the Community The Basics About TMDb Contact Us Support Forums API Blog Get Involved  Contribution Bible 3rd Party Applications Add New Movie Add New TV Show Community Guidelines Leaderboard Forums Twitter Facebook Legal Terms of Use Privacy Policy Login Sign Up"}