{"link": "https://www.themoviedb.org/tv/71209?language=en", "title": "Great News", "resume": "A New Jersey mom puts her relationship with her daughter to the test when she lands an internship at the same TV station where her daughter works.", "rate": 65, "genre": ["Comedy"], "cast": ["Briga Heelan", "Andrea Martin", "John Michael Higgins", "Adam Campbell", "Nicole Richie"], "character": ["Katie", "Carol", "Chuck", "Greg", "Portia"], "site_data": "html Apps Forums Leaderboard Contribute API Support Discover Movies TV Shows Movies Popular Top Rated Upcoming Now Playing TV Shows Popular Top Rated On TV Airing Today People Popular People Can't find a movie or TV show? Login to create it. en Login Sign Up  ID: 71209   Expand Great News   (2017) User Score  Play Trailer Overview A New Jersey mom puts her relationship with her daughter to the test when she lands an internship at the same TV station where her daughter works. Featured Crew Tracey Wigfield Creator Discussions   Reviews Videos   Images   Changes Report Share Discussions General  0 Content Issues  0 Images Backdrops  6 Posters  4 Videos Trailers  1 Teasers  0 Clips  0 Featurettes  0 Opening Credits  0 Top Billed Cast Briga Heelan Katie Andrea Martin Carol John Michael Higgins Chuck Adam Campbell Greg Nicole Richie Portia Full Cast & Crew Last Season Season 2 2017 | 13 Episodes Season 2 of Great News premiered on September 28, 2017. View All Seasons Social Reviews  0 Discussions  0 Media Most Popular Videos  1 Backdrops  6 Posters  4 Recommendations   1991-09-15 Eerie, Indiana 7.6    1987-09-12 Fraggle Rock: The Animated Series 8.1    2018-03-07 Life Sentence 5.2    2010-09-21 Running Wilde 6.8    2016-01-03 Cooper Barrett's Guide to Surviving Life 5.1    2017-10-01 Ghosted 6.2    2016-09-22 Easy 5.3    2016-03-15 Crowded 6.4  Facts Status  Cancelled Network Certification TV-PG Meaning This program contains material that parents may find unsuitable for younger children. Type  Scripted Original Language  English Runtime  22m Homepage   http://www.nbc.com/great-news Genres Comedy Keywords television tv news sitcom workplace comedy Content Score 100 Yes! Looking good! Top Contributors 36 Bendik 22 Banana 17 Elizabeth Jennings 12 Gabriel W. Almeida  View Edit History Popularity Trend  Login to edit  URL By  signing up  for an account on TMDb, you can post directly to Twitter and Facebook. You need to be logged in to continue. Click  here  to login or  here  to sign up.    page_wrap opened in html_head  Join the Community The Basics About TMDb Contact Us Support Forums API Blog Get Involved  Contribution Bible 3rd Party Applications Add New Movie Add New TV Show Community Guidelines Leaderboard Forums Twitter Facebook Legal Terms of Use Privacy Policy Login Sign Up"}