{"link": "https://www.themoviedb.org/tv/75392?language=en", "title": "My Coffee Prince", "resume": "We don't have an overview translated in English. Help us expand our database by adding one.", "rate": 0, "genre": ["Comedy", "Drama"], "cast": ["Fattah Amin", "Janna Nick", "Fahrin Ahmad", "Diana Danielle", "Zain Hamid"], "character": ["Raikal", "Dani", "Amri", "Maryam", "En. Syukri"], "site_data": "html Apps Forums Leaderboard Contribute API Support Discover Movies TV Shows Movies Popular Top Rated Upcoming Now Playing TV Shows Popular Top Rated On TV Airing Today People Popular People Can't find a movie or TV show? Login to create it. en Login Sign Up  ID: 75392   Expand My Coffee Prince   (2017) User Score Overview We don't have an overview translated in English. Help us expand our database by adding one. Discussions   Reviews Videos   Images   Changes Report Share Discussions General  0 Content Issues  0 Images Backdrops  1 Posters  1 Videos Trailers  0 Teasers  0 Clips  0 Featurettes  0 Opening Credits  0 Top Billed Cast Fattah Amin Raikal Janna Nick Dani Fahrin Ahmad Amri Diana Danielle Maryam Zain Hamid En. Syukri Full Cast & Crew Current Season Season 1 2017 | 28 Episodes Season 1 of My Coffee Prince premiered on November 27, 2017. View All Seasons Social Reviews  0 Discussions  0 Media Most Popular Videos  0 Backdrops  1 Posters  1 Recommendations We don't have enough data to suggest any TV shows based on My Coffee Prince. You can help by rating TV shows you've seen. Facts Status  Returning Series Network Astro Ria Certification  - Type  Scripted Original Language  Malay Runtime  - Homepage  - Genres Comedy Drama Keywords coffee shop malaysia remake gender disguise Content Score 79 Pump it up! We're close now. Top Contributors v 35 vplaytv2 15 love.warrior  View Edit History Popularity Trend  Login to edit  URL By  signing up  for an account on TMDb, you can post directly to Twitter and Facebook. You need to be logged in to continue. Click  here  to login or  here  to sign up.    page_wrap opened in html_head  Join the Community The Basics About TMDb Contact Us Support Forums API Blog Get Involved  Contribution Bible 3rd Party Applications Add New Movie Add New TV Show Community Guidelines Leaderboard Forums Twitter Facebook Legal Terms of Use Privacy Policy Login Sign Up"}