{"link": "https://www.themoviedb.org/tv/71374?language=en", "title": "Finn Zehender", "resume": "We don't have an overview translated in English. Help us expand our database by adding one.", "rate": null, "genre": ["Crime"], "cast": ["Hinnerk Sch\u00f6nemann", "Thomas Thieme", "Katja Danowski", "Daniela Schulz"], "site_data": "html Apps Forums Leaderboard Contribute API Support Discover Movies TV Shows Movies Popular Top Rated Upcoming Now Playing TV Shows Popular Top Rated On TV Airing Today People Popular People Can't find a movie or TV show? Login to create it. en Login Sign Up  ID: 71374   Expand Finn Zehender   (2011) User Score Overview We don't have an overview translated in English. Help us expand our database by adding one. Featured Crew Holger Karsten Schmidt Creator Discussions   Reviews Videos   Images   Changes Report Share Discussions General  0 Content Issues  0 Images Backdrops  1 Posters  2 Videos Trailers  0 Teasers  0 Clips  0 Featurettes  0 Opening Credits  0 Top Billed Cast Hinnerk Sch\u00f6nemann Finn Zehender Thomas Thieme Gerhard M\u00fchlfellner Katja Danowski Agnes Sonntag Daniela Schulz Anna Wippermann Full Cast & Crew Last Season Season 1 2011 | 4 Episodes Season 1 of Finn Zehender premiered on February 21, 2011. View All Seasons Social Reviews  0 Discussions  0 Media Most Popular Videos  0 Backdrops  1 Posters  2 Recommendations We don't have enough data to suggest any TV shows based on Finn Zehender. You can help by rating TV shows you've seen. Facts Status  Returning Series Network Certification 12 Meaning The broadcaster must take the decision about the air time by taking in consideration the impact on young children in the timeframe from 6:00am to 8:00pm. Type  Scripted Original Language  German Runtime  90m Homepage  - Genres Crime Keywords corruption dorf mord Content Score 86 Almost there... Top Contributors S 17 Samara t 16 tmdb45070722 TB 2 TMDb Bot  View Edit History Popularity Trend  Login to edit  URL By  signing up  for an account on TMDb, you can post directly to Twitter and Facebook. You need to be logged in to continue. Click  here  to login or  here  to sign up.    page_wrap opened in html_head  Join the Community The Basics About TMDb Contact Us Support Forums API Blog Get Involved  Contribution Bible 3rd Party Applications Add New Movie Add New TV Show Community Guidelines Leaderboard Forums Twitter Facebook Legal Terms of Use Privacy Policy Login Sign Up", "character": ["Finn Zehender", "Gerhard M\u00fchlfellner", "Agnes Sonntag", "Anna Wippermann"]}