{"link": "https://www.themoviedb.org/tv/5791?language=en", "title": "Come to Papa", "resume": "Come to Papa is an American sitcom that aired from June 3 until June 24, 2004.", "rate": 0, "genre": ["Comedy"], "cast": ["Steve Carell", "John Salley", "Jennifer Aspen", "Rob Benedict", "Tom Papa"], "character": ["Blevin"], "site_data": "html Apps Forums Leaderboard Contribute API Support Discover Movies TV Shows Movies Popular Top Rated Upcoming Now Playing TV Shows Popular Top Rated On TV Airing Today People Popular People Can't find a movie or TV show? Login to create it. en Login Sign Up  ID: 5791   Expand Come to Papa   (2004) User Score Overview Come to Papa is an American sitcom that aired from June 3 until June 24, 2004. Discussions   Reviews Videos   Images   Changes Report Share Discussions General  0 Content Issues  0 Images Backdrops  0 Posters  1 Videos Trailers  0 Teasers  0 Clips  0 Featurettes  0 Opening Credits  0 Top Billed Cast Steve Carell Blevin John Salley Jennifer Aspen Rob Benedict Tom Papa Full Cast & Crew Last Season Season 1 2004 | 4 Episodes Season 1 of Come to Papa premiered on June  3, 2004. View All Seasons Social Reviews  0 Discussions  0 Media Most Popular Videos  0 Backdrops  0 Posters  1 Recommendations We don't have enough data to suggest any TV shows based on Come to Papa. You can help by rating TV shows you've seen. Facts Status  Ended Network Certification  - Type  Scripted Original Language  English Runtime  30m Homepage  - Genres Comedy Keywords new jersey aspiring writer sitcom Content Score 71 Just a little bit more... Top Contributors 7 Banana  View Edit History Popularity Trend  Login to edit  URL By  signing up  for an account on TMDb, you can post directly to Twitter and Facebook. You need to be logged in to continue. Click  here  to login or  here  to sign up.    page_wrap opened in html_head  Join the Community The Basics About TMDb Contact Us Support Forums API Blog Get Involved  Contribution Bible 3rd Party Applications Add New Movie Add New TV Show Community Guidelines Leaderboard Forums Twitter Facebook Legal Terms of Use Privacy Policy Login Sign Up"}