{"link": "https://www.themoviedb.org/tv/41463?language=en", "title": "Super Snoops", "resume": "Super Snoops is an TVB modern drama series set in the 1960s.", "rate": 0, "genre": ["Comedy"], "cast": ["Johnson Lee", "Toby Leung", "Liza Wang", "Wong Cho-lam"], "character": ["Kung Chak-Lam"], "site_data": "html Apps Forums Leaderboard Contribute API Support Discover Movies TV Shows Movies Popular Top Rated Upcoming Now Playing TV Shows Popular Top Rated On TV Airing Today People Popular People Can't find a movie or TV show? Login to create it. en Login Sign Up  ID: 41463   Expand Super Snoops   (2011) User Score Overview Super Snoops is an TVB modern drama series set in the 1960s. Discussions   Reviews Videos   Images   Changes Report Share Discussions General  0 Content Issues  0 Images Backdrops  3 Posters  2 Videos Trailers  0 Teasers  0 Clips  0 Featurettes  0 Opening Credits  0 Top Billed Cast Johnson Lee Toby Leung Liza Wang Wong Cho-lam Kung Chak-Lam Full Cast & Crew Last Season Season 1 2011 | 19 Episodes Season 1 of Super Snoops premiered on October  3, 2011. View All Seasons Social Reviews  0 Discussions  0 Media Most Popular Videos  0 Backdrops  3 Posters  2 Recommendations We don't have enough data to suggest any TV shows based on Super Snoops. You can help by rating TV shows you've seen. Facts Original Name  \u8343\u52a0\u798f\u797f\u58fd\u63a2\u6848 Status  Ended Network Certification  - Type  Scripted Original Language  Chinese Runtime  - Homepage  - Genres Comedy Keywords No keywords have been added. Content Score 86 Almost there... Top Contributors A 5 Aka75  View Edit History Popularity Trend  Login to edit  URL By  signing up  for an account on TMDb, you can post directly to Twitter and Facebook. You need to be logged in to continue. Click  here  to login or  here  to sign up.    page_wrap opened in html_head  Join the Community The Basics About TMDb Contact Us Support Forums API Blog Get Involved  Contribution Bible 3rd Party Applications Add New Movie Add New TV Show Community Guidelines Leaderboard Forums Twitter Facebook Legal Terms of Use Privacy Policy Login Sign Up"}