{"link": "https://www.themoviedb.org/tv/72030?language=en", "title": "Philosophy: A Guide to Happiness", "resume": "Alain de Botton's psychobabble-free self-help course for the philosophically minded.", "rate": 80, "genre": ["Documentary"], "cast": ["Alain de Botton"], "character": ["Himself"], "site_data": "html Apps Forums Leaderboard Contribute API Support Discover Movies TV Shows Movies Popular Top Rated Upcoming Now Playing TV Shows Popular Top Rated On TV Airing Today People Popular People Can't find a movie or TV show? Login to create it. en Login Sign Up  ID: 72030   Expand Philosophy: A Guide to Happiness   (2000) User Score Overview Alain de Botton's psychobabble-free self-help course for the philosophically minded. Discussions   Reviews Videos   Images   Changes Report Share Discussions General  0 Content Issues  0 Images Backdrops  0 Posters  1 Videos Trailers  0 Teasers  0 Clips  0 Featurettes  0 Opening Credits  0 Top Billed Cast Alain de Botton Himself Full Cast & Crew Last Season Season 1 2000 | 6 Episodes Season 1 of Philosophy: A Guide to Happiness premiered on March 26, 2000. View All Seasons Social Reviews  0 Discussions  0 Media Most Popular Videos  0 Backdrops  0 Posters  1 Recommendations We don't have enough data to suggest any TV shows based on Philosophy: A Guide to Happiness. You can help by rating TV shows you've seen. Facts Status  Ended Network Certification L Meaning Content is suitable for all audiences. Type  Documentary Original Language  English Runtime  24m Homepage   http://channel4.com/programmes/philosophy-a-guide-to-happiness Genres Documentary Keywords philosophy happiness self-help Content Score 43 There's no 'I' in team... Top Contributors 18 Banana NS 15 Norte Serra  View Edit History Popularity Trend  Login to edit  URL By  signing up  for an account on TMDb, you can post directly to Twitter and Facebook. You need to be logged in to continue. Click  here  to login or  here  to sign up.    page_wrap opened in html_head  Join the Community The Basics About TMDb Contact Us Support Forums API Blog Get Involved  Contribution Bible 3rd Party Applications Add New Movie Add New TV Show Community Guidelines Leaderboard Forums Twitter Facebook Legal Terms of Use Privacy Policy Login Sign Up"}