{"link": "https://www.themoviedb.org/tv/74419?language=en", "title": "Geminus", "resume": "Italian miniseries.", "rate": 0, "genre": ["Drama"], "cast": ["Ugo Fangareggi", "Elisabetta Wu", "Valeria Sabel", "Philippe Hersent", "Katia Christine"], "character": ["Padre Lennon", "La Giapponese", "La direttrice del museo", "Mr. Turner", "La Vikinga"], "site_data": "html Apps Forums Leaderboard Contribute API Support Discover Movies TV Shows Movies Popular Top Rated Upcoming Now Playing TV Shows Popular Top Rated On TV Airing Today People Popular People Can't find a movie or TV show? Login to create it. en Login Sign Up  ID: 74419   Expand Geminus   (1969) User Score Overview Italian miniseries. Discussions   Reviews Videos   Images   Changes Report Share Discussions General  0 Content Issues  0 Images Backdrops  0 Posters  1 Videos Trailers  0 Teasers  0 Clips  0 Featurettes  0 Opening Credits  0 Top Billed Cast Ugo Fangareggi Padre Lennon Elisabetta Wu La Giapponese Valeria Sabel La direttrice del museo Philippe Hersent Mr. Turner Katia Christine La Vikinga Full Cast & Crew Last Season Miniseries 1969 | 6 Episodes Season 1 of Geminus premiered on August 14, 1969. View All Seasons Social Reviews  0 Discussions  0 Media Most Popular Videos  0 Backdrops  0 Posters  1 Recommendations We don't have enough data to suggest any TV shows based on Geminus. You can help by rating TV shows you've seen. Facts Status  Ended Network Certification  - Type  Miniseries Original Language  Italian Runtime  - Homepage  - Genres Drama Keywords miniseries Content Score 71 Just a little bit more... Top Contributors 25 Banana TB 13 TMDb Bot  View Edit History Popularity Trend  Login to edit  URL By  signing up  for an account on TMDb, you can post directly to Twitter and Facebook. You need to be logged in to continue. Click  here  to login or  here  to sign up.    page_wrap opened in html_head  Join the Community The Basics About TMDb Contact Us Support Forums API Blog Get Involved  Contribution Bible 3rd Party Applications Add New Movie Add New TV Show Community Guidelines Leaderboard Forums Twitter Facebook Legal Terms of Use Privacy Policy Login Sign Up"}