{"link": "https://www.themoviedb.org/tv/69490?language=en", "title": "Der Seewolf", "resume": "We don't have an overview translated in English. Help us expand our database by adding one.", "rate": null, "genre": ["Action", "Adventure"], "cast": ["Raimund Harmstorf", "Edward Meeks", "Beatrice Cardon", "Emmerich Sch\u00e4ffer", "Dieter Schidor"], "site_data": "html Apps Forums Leaderboard Contribute API Support Discover Movies TV Shows Movies Popular Top Rated Upcoming Now Playing TV Shows Popular Top Rated On TV Airing Today People Popular People Can't find a movie or TV show? Login to create it. en Login Sign Up  ID: 69490   Expand Der Seewolf   (1971) User Score Overview We don't have an overview translated in English. Help us expand our database by adding one. Featured Crew Jack London Creator Discussions   Reviews Videos   Images   Changes Report Share Discussions General  0 Content Issues  0 Images Backdrops  3 Posters  3 Videos Trailers  0 Teasers  0 Clips  0 Featurettes  0 Opening Credits  0 Top Billed Cast Raimund Harmstorf Wolf Larsen Edward Meeks Humphrey van Weyden Beatrice Cardon Maud Brewster Emmerich Sch\u00e4ffer Schiffskoch Thomas Mugridge Dieter Schidor Wolf Larsen als junger Mann Full Cast & Crew Last Season Season 1 1971 | 4 Episodes Season 1 of Der Seewolf premiered on December  5, 1971. View All Seasons Social Reviews  0 Discussions  0 Media Most Popular Videos  0 Backdrops  3 Posters  3 Recommendations   1973-01-15 Ein Herz und eine Seele 6.8    1966-01-01 Die Schatzinsel 7.9  Facts Status  Ended Network Certification 12 Meaning The broadcaster must take the decision about the air time by taking in consideration the impact on young children in the timeframe from 6:00am to 8:00pm. Type  Scripted Original Language  German Runtime  361m Homepage  - Genres Action & Adventure Keywords ship adventure miniseries violence Content Score 93 Almost there... Top Contributors W 44 Waldkatze TB 19 TMDb Bot f 4 flimmerix s 2 stesme  View Edit History Popularity Trend  Login to edit  URL By  signing up  for an account on TMDb, you can post directly to Twitter and Facebook. You need to be logged in to continue. Click  here  to login or  here  to sign up.    page_wrap opened in html_head  Join the Community The Basics About TMDb Contact Us Support Forums API Blog Get Involved  Contribution Bible 3rd Party Applications Add New Movie Add New TV Show Community Guidelines Leaderboard Forums Twitter Facebook Legal Terms of Use Privacy Policy Login Sign Up", "character": ["Wolf Larsen", "Humphrey van Weyden", "Maud Brewster", "Schiffskoch Thomas Mugridge", "Wolf Larsen als junger Mann"]}