{"link": "https://www.themoviedb.org/tv/67155?language=en", "title": "Hillary", "resume": "The life of the legendary mountaineer Sir Edmund Hillary, from his lonely childhood, to the man he became - Hillary the climber - a man that conquered Mt Everest, a man loved by a nation.", "rate": 25, "genre": ["Drama"], "cast": ["Andrew Munro", "Dean O'Gorman"], "character": ["Sir Edmund Hillary", "George Lowe"], "site_data": "html Apps Forums Leaderboard Contribute API Support Discover Movies TV Shows Movies Popular Top Rated Upcoming Now Playing TV Shows Popular Top Rated On TV Airing Today People Popular People Can't find a movie or TV show? Login to create it. en Login Sign Up  ID: 67155   Expand Hillary   (2016) User Score Overview The life of the legendary mountaineer Sir Edmund Hillary, from his lonely childhood, to the man he became - Hillary the climber - a man that conquered Mt Everest, a man loved by a nation. Featured Crew Tom Scott Creator Greg McGee Creator Discussions   Reviews Videos   Images   Changes Report Share Discussions General  0 Content Issues  0 Images Backdrops  5 Posters  2 Videos Trailers  0 Teasers  0 Clips  0 Featurettes  0 Opening Credits  0 Top Billed Cast Andrew Munro Sir Edmund Hillary Dean O'Gorman George Lowe Full Cast & Crew Last Season Season 1 2016 | 6 Episodes Season 1 of Hillary premiered on August 21, 2016. View All Seasons Social Reviews  0 Discussions  0 Media Most Popular Videos  0 Backdrops  5 Posters  2 Recommendations We don't have enough data to suggest any TV shows based on Hillary. You can help by rating TV shows you've seen. Facts Status  Returning Series Network Certification  - Type  Scripted Original Language  English Runtime  - Homepage  - Genres Drama Keywords new zealand mountaineer mount everest Content Score 64 We're so close, yet so far. Top Contributors p 36 plumpro 3 Elizabeth Jennings  View Edit History Popularity Trend  Login to edit  URL By  signing up  for an account on TMDb, you can post directly to Twitter and Facebook. You need to be logged in to continue. Click  here  to login or  here  to sign up.    page_wrap opened in html_head  Join the Community The Basics About TMDb Contact Us Support Forums API Blog Get Involved  Contribution Bible 3rd Party Applications Add New Movie Add New TV Show Community Guidelines Leaderboard Forums Twitter Facebook Legal Terms of Use Privacy Policy Login Sign Up"}