{"link": "https://www.themoviedb.org/tv/50035?language=en", "title": "Clarence", "resume": "The adventures of a young boy named Clarence, who is optimistic about everything, and his two best friends Jeff and Sumo.", "rate": 74, "genre": ["Animation", "Comedy"], "cast": ["Spencer Rothbell", "Tom Kenny", "Sean Giambrone", "Roger Craig Smith"], "character": ["Clarence Wendle (voice)", "Ryan 'Sumo' Sumouski (voice)", "Jeff Randell (voice)", "Belson (voice)"], "site_data": "html Apps Forums Leaderboard Contribute API Support Discover Movies TV Shows Movies Popular Top Rated Upcoming Now Playing TV Shows Popular Top Rated On TV Airing Today People Popular People Can't find a movie or TV show? Login to create it. en Login Sign Up  ID: 50035   Expand Clarence   (2014) User Score  Play Trailer Overview The adventures of a young boy named Clarence, who is optimistic about everything, and his two best friends Jeff and Sumo. Featured Crew Skyler Page Creator Discussions   Reviews Videos   Images   Changes Report Share Discussions General  0 Content Issues  0 Images Backdrops  2 Posters  3 Videos Trailers  1 Teasers  0 Clips  0 Featurettes  0 Opening Credits  0 Top Billed Cast Spencer Rothbell Clarence Wendle (voice) Tom Kenny Ryan 'Sumo' Sumouski (voice) Sean Giambrone Jeff Randell (voice) Roger Craig Smith Belson (voice) Full Cast & Crew Last Season Original Air Date Original Air Date DVD (DVD) Shorts (Digital) Season 3 2017 | 40 Episodes Season 3 of Clarence premiered on February 10, 2017. View All Seasons Social Reviews  0 Discussions  0 Media Most Popular Videos  1 Backdrops  2 Posters  3 Recommendations   2015-08-24 We Bare Bears 7.2    2011-05-03 The Amazing World of Gumball 7.7    2001-09-01 Medabots 7.0    2013-09-02 Uncle Grandpa 4.3    2008-06-05 The Marvelous Misadventures of Flapjack 5.9    2012-07-15 Black Dynamite 7.2    2013-09-13 Wander Over Yonder 8.1    2014-08-07 Black Jesus 5.4  Facts Status  Cancelled Network Certification TV-PG Meaning This program contains material that parents may find unsuitable for younger children. Type  Scripted Original Language  English Runtime  11m, 23m Homepage  - Genres Animation Comedy Keywords overweight male friendship kids Content Score 100 Yes! Looking good! Top Contributors 43 shefryrandel 25 Mikedeth5 14 Elizabeth Jennings 13 Banana  View Edit History Popularity Trend  Login to edit  URL By  signing up  for an account on TMDb, you can post directly to Twitter and Facebook. You need to be logged in to continue. Click  here  to login or  here  to sign up.    page_wrap opened in html_head  Join the Community The Basics About TMDb Contact Us Support Forums API Blog Get Involved  Contribution Bible 3rd Party Applications Add New Movie Add New TV Show Community Guidelines Leaderboard Forums Twitter Facebook Legal Terms of Use Privacy Policy Login Sign Up"}