{"link": "https://www.themoviedb.org/tv/67230?language=en", "title": "Silvana Sin Lana", "resume": "A high society woman loses everything and has to move with her three daughters, and her mom to a middle-class neighborhood.", "rate": 39, "genre": ["Drama", "Soap"], "cast": ["Maritza Rodr\u00edguez", "Carlos Ponce", "Marimar Vega", "Adriana Barraza", "Ricardo Abarca"], "character": ["Silvana \"Chivis\"", "Manuel Gallardo", "Stella P\u00e9rez", "Trini", "Vicente Gallardo"], "site_data": "html Apps Forums Leaderboard Contribute API Support Discover Movies TV Shows Movies Popular Top Rated Upcoming Now Playing TV Shows Popular Top Rated On TV Airing Today People Popular People Can't find a movie or TV show? Login to create it. en Login Sign Up  ID: 67230   Expand Silvana Sin Lana   (2016) User Score Overview A high society woman loses everything and has to move with her three daughters, and her mom to a middle-class neighborhood. Discussions   Reviews Videos   Images   Changes Report Share Discussions General  0 Content Issues  0 Images Backdrops  2 Posters  1 Videos Trailers  0 Teasers  0 Clips  0 Featurettes  0 Opening Credits  0 Top Billed Cast Maritza Rodr\u00edguez Silvana \"Chivis\" Carlos Ponce Manuel Gallardo Marimar Vega Stella P\u00e9rez Adriana Barraza Trini Ricardo Abarca Vicente Gallardo Full Cast & Crew Last Season Season 1 2016 | 121 Episodes Season 1 of Silvana Sin Lana premiered on July 19, 2016. View All Seasons Social Reviews  0 Discussions  0 Media Most Popular Videos  0 Backdrops  2 Posters  1 Recommendations We don't have enough data to suggest any TV shows based on Silvana Sin Lana. You can help by rating TV shows you've seen. Facts Status  In Production Network Certification TV-14 Meaning This program contains some material that many parents would find unsuitable for children under 14 years of age. Type  Scripted Original Language  Spanish; Castilian Runtime  45m Homepage   http://www.telemundo.com/novelas/silvana-sin-lana Genres Drama Soap Keywords telenovela Content Score 86 Almost there... Top Contributors 19 lareina123 d 17 denim 17 Marr \ud83c\uddf3\ud83c\uddf1 z 12 zurman1  View Edit History Popularity Trend  Login to edit  URL By  signing up  for an account on TMDb, you can post directly to Twitter and Facebook. You need to be logged in to continue. Click  here  to login or  here  to sign up.    page_wrap opened in html_head  Join the Community The Basics About TMDb Contact Us Support Forums API Blog Get Involved  Contribution Bible 3rd Party Applications Add New Movie Add New TV Show Community Guidelines Leaderboard Forums Twitter Facebook Legal Terms of Use Privacy Policy Login Sign Up"}