{"link": "https://www.themoviedb.org/tv/55488?language=en", "title": "Heiter bis t\u00f6dlich - Fuchs und Gans", "resume": "We don't have an overview translated in English. Help us expand our database by adding one.", "rate": null, "genre": ["Crime"], "cast": ["Mira Bartuschek", "Peter Bongartz", "Tobias van Dieken", "Marcus Morlinghaus", "Jockel Tschiersch"], "site_data": "html Apps Forums Leaderboard Contribute API Support Discover Movies TV Shows Movies Popular Top Rated Upcoming Now Playing TV Shows Popular Top Rated On TV Airing Today People Popular People Can't find a movie or TV show? Login to create it. en Login Sign Up  ID: 55488   Expand Heiter bis t\u00f6dlich - Fuchs und Gans   (2012) User Score Overview We don't have an overview translated in English. Help us expand our database by adding one. Discussions   Reviews Videos   Images   Changes Report Share Discussions General  0 Content Issues  0 Images Backdrops  0 Posters  1 Videos Trailers  0 Teasers  0 Clips  0 Featurettes  0 Opening Credits  0 Top Billed Cast Mira Bartuschek Emily Gans Peter Bongartz Kommissar i. R. Urban Fuchs Tobias van Dieken Kommissar Stefan Fuchs Marcus Morlinghaus Ebsi Eisele Jockel Tschiersch Siegfried Wenz Full Cast & Crew Last Season Season 1 2012 | 16 Episodes Season 1 of Heiter bis t\u00f6dlich - Fuchs und Gans premiered on September 20, 2012. View All Seasons Social Reviews  0 Discussions  0 Media Most Popular Videos  0 Backdrops  0 Posters  1 Recommendations We don't have enough data to suggest any TV shows based on Heiter bis t\u00f6dlich - Fuchs und Gans. You can help by rating TV shows you've seen. Facts Status  Ended Network Certification  - Type  Scripted Original Language  German Runtime  45m Homepage   l Genres Crime Keywords private detective kommissar Content Score 64 We're so close, yet so far. Top Contributors S 25 Samara L 2 Lemmy_6  View Edit History Popularity Trend  Login to edit  URL By  signing up  for an account on TMDb, you can post directly to Twitter and Facebook. You need to be logged in to continue. Click  here  to login or  here  to sign up.    page_wrap opened in html_head  Join the Community The Basics About TMDb Contact Us Support Forums API Blog Get Involved  Contribution Bible 3rd Party Applications Add New Movie Add New TV Show Community Guidelines Leaderboard Forums Twitter Facebook Legal Terms of Use Privacy Policy Login Sign Up", "character": ["Emily Gans", "Kommissar i. R. Urban Fuchs", "Kommissar Stefan Fuchs", "Ebsi Eisele", "Siegfried Wenz"]}