{"link": "https://www.themoviedb.org/tv/2786?language=en", "title": "Sons of Thunder", "resume": "Sons of Thunder is a television show that ran from March to April 1999 on CBS. It was a spin-off of Walker, Texas Ranger.", "rate": 0, "genre": ["Drama"], "cast": ["Marco Sanchez", "James Wlcek", "Alan Autry", "Chuck Norris"], "character": ["Carlos Sandoval", "Trent Malloy", "Marion 'Butch' McMann", "Ranger Cordell Walker"], "site_data": "html Apps Forums Leaderboard Contribute API Support Discover Movies TV Shows Movies Popular Top Rated Upcoming Now Playing TV Shows Popular Top Rated On TV Airing Today People Popular People Can't find a movie or TV show? Login to create it. en Login Sign Up  ID: 2786   Expand Sons of Thunder   (1998) User Score Overview Sons of Thunder is a television show that ran from March to April 1999 on CBS. It was a spin-off of Walker, Texas Ranger. Featured Crew Aaron Norris Creator Chuck Norris Creator Discussions   Reviews Videos   Images   Changes Report Share Discussions General  0 Content Issues  0 Images Backdrops  0 Posters  1 Videos Trailers  0 Teasers  0 Clips  0 Featurettes  0 Opening Credits  0 Top Billed Cast Marco Sanchez Carlos Sandoval James Wlcek Trent Malloy Alan Autry Marion 'Butch' McMann Chuck Norris Ranger Cordell Walker Full Cast & Crew Last Season Season 1 1999 | 6 Episodes Season 1 of Sons of Thunder premiered on March  6, 1999. View All Seasons Social Reviews  0 Discussions  0 Media Most Popular Videos  0 Backdrops  0 Posters  1 Recommendations We don't have enough data to suggest any TV shows based on Sons of Thunder. You can help by rating TV shows you've seen. Facts Status  Ended Network Certification  - Type  Scripted Original Language  English Runtime  60m Homepage  - Genres Drama Keywords texas private investigator spin off Content Score 79 Pump it up! We're close now. Top Contributors 10 Banana Z 2 Zenoviy y 1 yuen13 1 Joe Carson  View Edit History Popularity Trend  Login to edit  URL By  signing up  for an account on TMDb, you can post directly to Twitter and Facebook. You need to be logged in to continue. Click  here  to login or  here  to sign up.    page_wrap opened in html_head  Join the Community The Basics About TMDb Contact Us Support Forums API Blog Get Involved  Contribution Bible 3rd Party Applications Add New Movie Add New TV Show Community Guidelines Leaderboard Forums Twitter Facebook Legal Terms of Use Privacy Policy Login Sign Up"}