{"link": "https://www.themoviedb.org/tv/34212?language=en", "title": "Otogi-Juushi Akazukin", "resume": "Otogi-J\u016bshi Akazukin is an anime OVA as well as an anime television series.", "rate": 0, "genre": ["Sci-Fi", "Fantasy", "Comedy", "Animation", "Action", "Adventure"], "cast": ["Rie Kugimiya", "Miyuki Sawashiro", "Motoko Kumai", "Yukari Tamura", "Kanako Tateno"], "character": ["Ringo Kinoshita", "Ibarahime", "Souta", "Akazukin", "Shirayuki Hime"], "site_data": "html Apps Forums Leaderboard Contribute API Support Discover Movies TV Shows Movies Popular Top Rated Upcoming Now Playing TV Shows Popular Top Rated On TV Airing Today People Popular People Can't find a movie or TV show? Login to create it. en Login Sign Up  ID: 34212   Expand Otogi-Juushi Akazukin   (2006) User Score Overview Otogi-J\u016bshi Akazukin is an anime OVA as well as an anime television series. Discussions   Reviews Videos   Images   Changes Report Share Discussions General  0 Content Issues  0 Images Backdrops  1 Posters  1 Videos Trailers  0 Teasers  0 Clips  0 Featurettes  0 Opening Credits  0 Top Billed Cast Rie Kugimiya Ringo Kinoshita Miyuki Sawashiro Ibarahime Motoko Kumai Souta Yukari Tamura Akazukin Kanako Tateno Shirayuki Hime Full Cast & Crew Last Season Otogi-jushi akazukin season 1 2006 | 39 Episodes Season 1 of Otogi-Juushi Akazukin premiered on July  1, 2006. View All Seasons Social Reviews  0 Discussions  0 Media Most Popular Videos  0 Backdrops  1 Posters  1 Recommendations We don't have enough data to suggest any TV shows based on Otogi-Juushi Akazukin. You can help by rating TV shows you've seen. Facts Status  Ended Networks - Certification  - Type  Scripted Original Language  Japanese Runtime  30m Homepage   http://akazukin.konami.jp/ Genres Sci-Fi & Fantasy Comedy Animation Action & Adventure Keywords No keywords have been added. Content Score 86 Almost there... Top Contributors e 2 eps11  View Edit History Popularity Trend  Login to edit  URL By  signing up  for an account on TMDb, you can post directly to Twitter and Facebook. You need to be logged in to continue. Click  here  to login or  here  to sign up.    page_wrap opened in html_head  Join the Community The Basics About TMDb Contact Us Support Forums API Blog Get Involved  Contribution Bible 3rd Party Applications Add New Movie Add New TV Show Community Guidelines Leaderboard Forums Twitter Facebook Legal Terms of Use Privacy Policy Login Sign Up"}