{"link": "https://www.themoviedb.org/tv/78970?language=en", "title": "aiseki MOGOL GIRL", "resume": "A variety of male guest voice actors banter with Fuyumi and Haruko, two colorful stop-motion mascot characters made out of pipe cleaners, at a table in the Mongol Cafe.", "rate": 0, "genre": ["Animation", "Comedy"], "cast": ["Ryo Kato", "Natsuko Hara"], "character": ["Fuyumi (voice)", "Haruko (voice)"], "site_data": "html Apps Forums Leaderboard Contribute API Support Discover Movies TV Shows Movies Popular Top Rated Upcoming Now Playing TV Shows Popular Top Rated On TV Airing Today People Popular People Can't find a movie or TV show? Login to create it. en Login Sign Up  ID: 78970   Expand aiseki MOGOL GIRL   (2017) User Score Overview A variety of male guest voice actors banter with Fuyumi and Haruko, two colorful stop-motion mascot characters made out of pipe cleaners, at a table in the Mongol Cafe. Discussions   Reviews Videos   Images   Changes Report Share Discussions General  0 Content Issues  0 Images Backdrops  0 Posters  3 Videos Trailers  0 Teasers  0 Clips  0 Featurettes  0 Opening Credits  0 Top Billed Cast Ryo Kato Fuyumi (voice) Natsuko Hara Haruko (voice) Full Cast & Crew Last Season Season 1 2017 | 12 Episodes Season 1 of aiseki MOGOL GIRL premiered on October  3, 2017. View All Seasons Social Reviews  0 Discussions  0 Media Most Popular Videos  0 Backdrops  0 Posters  3 Recommendations We don't have enough data to suggest any TV shows based on aiseki MOGOL GIRL. You can help by rating TV shows you've seen. Facts Status  Ended Network Certification  - Type  Scripted Original Language  Japanese Runtime  5m Homepage   http://mogol-girl.com Genres Animation Comedy Keywords stop motion short episodes Content Score 43 There's no 'I' in team... Top Contributors 38 Marr \ud83c\uddf3\ud83c\uddf1  View Edit History Popularity Trend  Login to edit  URL By  signing up  for an account on TMDb, you can post directly to Twitter and Facebook. You need to be logged in to continue. Click  here  to login or  here  to sign up.    page_wrap opened in html_head  Join the Community The Basics About TMDb Contact Us Support Forums API Blog Get Involved  Contribution Bible 3rd Party Applications Add New Movie Add New TV Show Community Guidelines Leaderboard Forums Twitter Facebook Legal Terms of Use Privacy Policy Login Sign Up"}