{"link": "https://www.themoviedb.org/tv/38693?language=en", "title": "LEGO Ninjago: Masters of Spinjitzu", "resume": "When the fate of their world, Ninjago, is challenged by great threats, it's up to the ninja: Kai, Jay, Cole, Zane, Lloyd and Nya to save the world.", "rate": 58, "genre": ["Action", "Adventure", "Animation", "Comedy", "Family", "Sci-Fi", "Fantasy"], "cast": ["Brent Miller", "Paul Dobson", "Michael Adamthwaite", "Vincent Tong", "Kirby Morrow"], "character": ["Zane", "Sensei Wu", "Jay Walker", "Kai", "Cole"], "site_data": "html Apps Forums Leaderboard Contribute API Support Discover Movies TV Shows Movies Popular Top Rated Upcoming Now Playing TV Shows Popular Top Rated On TV Airing Today People Popular People Can't find a movie or TV show? Login to create it. en Login Sign Up  ID: 38693   Expand LEGO Ninjago: Masters of Spinjitzu   (2012) User Score  Play Trailer Overview When the fate of their world, Ninjago, is challenged by great threats, it's up to the ninja: Kai, Jay, Cole, Zane, Lloyd and Nya to save the world. Featured Crew Michael Hegner Creator Tommy Andreasen Creator Discussions   Reviews Videos   Images   Changes Report Share Discussions General  0 Content Issues  1 Images Backdrops  14 Posters  4 Videos Trailers  1 Teasers  0 Clips  0 Featurettes  0 Opening Credits  0 Top Billed Cast Brent Miller Zane Paul Dobson Sensei Wu Michael Adamthwaite Jay Walker Vincent Tong Kai Kirby Morrow Cole Full Cast & Crew Current Season Sons of Garmadon 2018 | 10 Episodes View All Seasons Social Reviews  0 Discussions  1 Subject Status Replies Last Reply There are no discussions for LEGO Ninjago: Masters of Spinjitzu. Login to be first! Go to Discussions Media Most Popular Videos  1 Backdrops  14 Posters  4 Recommendations   2017-09-20 Tiempos de guerra 7.0    2015-09-08 Apaches 7.3    2016-12-08 The Cuba Libre Story 7.7    2016-07-05 Fangbone! 6.7    2014-04-20 Filthy Riches 6.7    2013-12-24 Turbo FAST 4.7    2007-05-17 Embarrassing Bodies 6.8    2017-01-30 Bonus Family 8.5  Facts Status  Returning Series Network Certification TV-Y7 Meaning This program is designed for children age 7 and above. Type  Scripted Original Language  English Runtime  22m Homepage   https://www.lego.com/ninjago/videos Genres Action & Adventure Animation Comedy Family Sci-Fi & Fantasy Keywords ninja based on toy lego Content Score 100 Yes! Looking good! Top Contributors S 40 Sander G 26 Grentel 21 Elizabeth Jennings 19 Baloralys  View Edit History Popularity Trend  Login to edit  URL By  signing up  for an account on TMDb, you can post directly to Twitter and Facebook. You need to be logged in to continue. Click  here  to login or  here  to sign up.    page_wrap opened in html_head  Join the Community The Basics About TMDb Contact Us Support Forums API Blog Get Involved  Contribution Bible 3rd Party Applications Add New Movie Add New TV Show Community Guidelines Leaderboard Forums Twitter Facebook Legal Terms of Use Privacy Policy Login Sign Up"}