{"link": "https://www.themoviedb.org/tv/75244?language=en", "title": "Dil Sambhal Jaa Zara", "resume": "Ahana, a young girl navigating her life in urban India, gets caught in a web of relationships when she meets Anant, a middle-aged man.", "rate": 0, "genre": ["Drama"], "cast": ["Sanjay Kapoor", "Smriti Kalra"], "character": ["Anant Mathur", "Ahana Mathur"], "site_data": "html Apps Forums Leaderboard Contribute API Support Discover Movies TV Shows Movies Popular Top Rated Upcoming Now Playing TV Shows Popular Top Rated On TV Airing Today People Popular People Can't find a movie or TV show? Login to create it. en Login Sign Up  ID: 75244   Expand Dil Sambhal Jaa Zara   (2017) User Score Overview Ahana, a young girl navigating her life in urban India, gets caught in a web of relationships when she meets Anant, a middle-aged man. Discussions   Reviews Videos   Images   Changes Report Share Discussions General  0 Content Issues  0 Images Backdrops  1 Posters  2 Videos Trailers  0 Teasers  0 Clips  0 Featurettes  0 Opening Credits  0 Top Billed Cast Sanjay Kapoor Anant Mathur Smriti Kalra Ahana Mathur Full Cast & Crew Current Season Season 2017 2017 | 10 Episodes Season 1 of Dil Sambhal Jaa Zara premiered on November 27, 2017. View All Seasons Social Reviews  0 Discussions  0 Media Most Popular Videos  0 Backdrops  1 Posters  2 Recommendations We don't have enough data to suggest any TV shows based on Dil Sambhal Jaa Zara. You can help by rating TV shows you've seen. Facts Status  Returning Series Networks - Certification  - Type  Scripted Original Language  English Runtime  - Homepage  - Genres Drama Keywords No keywords have been added. Content Score 56 We're so close, yet so far. Top Contributors t 7 thesomali 4 marishhmall m 1 movieskickk  View Edit History Popularity Trend  Login to edit  URL By  signing up  for an account on TMDb, you can post directly to Twitter and Facebook. You need to be logged in to continue. Click  here  to login or  here  to sign up.    page_wrap opened in html_head  Join the Community The Basics About TMDb Contact Us Support Forums API Blog Get Involved  Contribution Bible 3rd Party Applications Add New Movie Add New TV Show Community Guidelines Leaderboard Forums Twitter Facebook Legal Terms of Use Privacy Policy Login Sign Up"}