{"link": "https://www.themoviedb.org/tv/30548?language=en", "title": "Nutcracker: Money, Madness & Murder", "resume": "A sociopathic socialite plots her father's murder.", "rate": 80, "genre": ["Mystery", "Drama"], "cast": ["Lee Remick", "John Glover", "Tate Donovan", "Elizabeth Wilson", "Jonathan Frakes"], "character": ["Frances Schreuder", "Richard Behrens", "Marc", "Berenice Bradshaw", "Rosen"], "site_data": "html Apps Forums Leaderboard Contribute API Support Discover Movies TV Shows Movies Popular Top Rated Upcoming Now Playing TV Shows Popular Top Rated On TV Airing Today People Popular People Can't find a movie or TV show? Login to create it. en Login Sign Up  ID: 30548   Expand Nutcracker: Money, Madness & Murder   (1987) User Score  Play Trailer Overview A sociopathic socialite plots her father's murder. Discussions   Reviews Videos   Images   Changes Report Share Discussions General  0 Content Issues  0 Images Backdrops  0 Posters  1 Videos Trailers  1 Teasers  0 Clips  0 Featurettes  0 Opening Credits  0 Top Billed Cast Lee Remick Frances Schreuder John Glover Richard Behrens Tate Donovan Marc Elizabeth Wilson Berenice Bradshaw Jonathan Frakes Rosen Full Cast & Crew Last Season Miniseries 1987 | 3 Episodes Season 1 of Nutcracker: Money, Madness & Murder premiered on March 22, 1987. View All Seasons Social Reviews  0 Discussions  0 Media Most Popular Videos  1 Backdrops  0 Posters  1 Recommendations We don't have enough data to suggest any TV shows based on Nutcracker: Money, Madness & Murder. You can help by rating TV shows you've seen. Facts Status  Ended Network Certification  - Type  Miniseries Original Language  English Runtime  120m Homepage  - Genres Mystery Drama Keywords based on novel or book miniseries true crime socialite Content Score 79 Pump it up! We're close now. Top Contributors TB 22 TMDb Bot R 14 Rebecca  View Edit History Popularity Trend  Login to edit  URL By  signing up  for an account on TMDb, you can post directly to Twitter and Facebook. You need to be logged in to continue. Click  here  to login or  here  to sign up.    page_wrap opened in html_head  Join the Community The Basics About TMDb Contact Us Support Forums API Blog Get Involved  Contribution Bible 3rd Party Applications Add New Movie Add New TV Show Community Guidelines Leaderboard Forums Twitter Facebook Legal Terms of Use Privacy Policy Login Sign Up"}