{"link": "https://www.themoviedb.org/tv/63441?language=en", "title": "I Dare You to Leave", "resume": "A heartbreaking story in which power, obsession, and desire will tragically mark the love between Paulina and Adri\u00e1n who will fight for their love against all odds, even if it takes their life.", "rate": 90, "genre": ["Drama"], "cast": ["Camila Sodi", "Osvaldo Benavides", "Leticia Calder\u00f3n", "Arturo Peniche", "Alejandra Barros"], "character": ["Paulina Murat / Valentina Murat", "Adri\u00e1n Olmedo", "In\u00e9s Murat", "Gonzalo Murat", "Julieta Olmedo"], "site_data": "html Apps Forums Leaderboard Contribute API Support Discover Movies TV Shows Movies Popular Top Rated Upcoming Now Playing TV Shows Popular Top Rated On TV Airing Today People Popular People Can't find a movie or TV show? Login to create it. en Login Sign Up  ID: 63441   Expand I Dare You to Leave   (2015) User Score Overview A heartbreaking story in which power, obsession, and desire will tragically mark the love between Paulina and Adri\u00e1n who will fight for their love against all odds, even if it takes their life.  Featured Crew Eric Vonn Creator Discussions   Reviews Videos   Images   Changes Report Share Discussions General  0 Content Issues  0 Images Backdrops  1 Posters  1 Videos Trailers  0 Teasers  0 Clips  0 Featurettes  0 Opening Credits  0 Top Billed Cast Camila Sodi Paulina Murat / Valentina Murat Osvaldo Benavides Adri\u00e1n Olmedo Leticia Calder\u00f3n In\u00e9s Murat Arturo Peniche Gonzalo Murat Alejandra Barros Julieta Olmedo Full Cast & Crew Last Season Season 1 2015 | 6 Episodes Season 1 of I Dare You to Leave premiered on July 27, 2015. View All Seasons Social Reviews  0 Discussions  0 Media Most Popular Videos  0 Backdrops  1 Posters  1 Recommendations We don't have enough data to suggest any TV shows based on I Dare You to Leave. You can help by rating TV shows you've seen. Facts Original Name  A que no me dejas Status  Returning Series Network Certification  - Type  Scripted Original Language  English Runtime  45m Homepage  - Genres Drama Keywords telenovela Content Score 100 Yes! Looking good! Top Contributors s 31 shiff7 z 5 zurman1 wg 5 willian guillermo andrade charcape CM 4 Cherche Moi  View Edit History Popularity Trend  Login to edit  URL By  signing up  for an account on TMDb, you can post directly to Twitter and Facebook. You need to be logged in to continue. Click  here  to login or  here  to sign up.    page_wrap opened in html_head  Join the Community The Basics About TMDb Contact Us Support Forums API Blog Get Involved  Contribution Bible 3rd Party Applications Add New Movie Add New TV Show Community Guidelines Leaderboard Forums Twitter Facebook Legal Terms of Use Privacy Policy Login Sign Up"}