{"link": "https://www.themoviedb.org/tv/76708?language=en", "title": "Les Bracelets rouges", "resume": "We don't have an overview translated in English. Help us expand our database by adding one.", "rate": 70, "genre": ["Drama"], "cast": ["Diouc Koma", "Micha\u00ebl Youn", "Lionel Abelanski", "Isabelle G\u00e9linas", "Guy Lecluyse"], "character": ["Lucien", "Gilbert", "Dr. Catalan", "Dr. Sora", "Patrick"], "site_data": "html Apps Forums Leaderboard Contribute API Support Discover Movies TV Shows Movies Popular Top Rated Upcoming Now Playing TV Shows Popular Top Rated On TV Airing Today People Popular People Can't find a movie or TV show? Login to create it. en Login Sign Up  ID: 76708   Expand Les Bracelets rouges   (2018) User Score Overview We don't have an overview translated in English. Help us expand our database by adding one. Discussions   Reviews Videos   Images   Changes Report Share Discussions General  0 Content Issues  0 Images Backdrops  12 Posters  2 Videos Trailers  0 Teasers  0 Clips  0 Featurettes  0 Opening Credits  0 Top Billed Cast Diouc Koma Lucien Micha\u00ebl Youn Gilbert Lionel Abelanski Dr. Catalan Isabelle G\u00e9linas Dr. Sora Guy Lecluyse Patrick Full Cast & Crew Current Season Season 1 2018 | 6 Episodes Season 1 of Les Bracelets rouges premiered on February  5, 2018. View All Seasons Social Reviews  0 Discussions  0 Media Most Popular Videos  0 Backdrops  12 Posters  2 Recommendations We don't have enough data to suggest any TV shows based on Les Bracelets rouges. You can help by rating TV shows you've seen. Facts Status  Returning Series Network Certification  - Type  Scripted Original Language  French Runtime  52m Homepage  - Genres Drama Keywords No keywords have been added. Content Score 86 Almost there... Top Contributors 55 scorpio686 D 2 Destr0y TB 1 TMDb Bot a 1 annibalk  View Edit History Popularity Trend  Login to edit  URL By  signing up  for an account on TMDb, you can post directly to Twitter and Facebook. You need to be logged in to continue. Click  here  to login or  here  to sign up.    page_wrap opened in html_head  Join the Community The Basics About TMDb Contact Us Support Forums API Blog Get Involved  Contribution Bible 3rd Party Applications Add New Movie Add New TV Show Community Guidelines Leaderboard Forums Twitter Facebook Legal Terms of Use Privacy Policy Login Sign Up"}