{"link": "https://www.themoviedb.org/tv/74265?language=en", "title": "Cruel Doubt", "resume": "A college student and two friends are accused of murdering one's stepfather and injuring his mother whom refuses to believe her son had anything to do with the attack.", "rate": null, "genre": ["Crime", "Drama"], "cast": ["Blythe Danner", "Matt McGrath", "Denis Arndt", "Adam Baldwin", "Dennis Farina"], "site_data": "html Apps Forums Leaderboard Contribute API Support Discover Movies TV Shows Movies Popular Top Rated Upcoming Now Playing TV Shows Popular Top Rated On TV Airing Today People Popular People Can't find a movie or TV show? Login to create it. en Login Sign Up  ID: 74265   Expand Cruel Doubt   (1992) User Score Overview A college student and two friends are accused of murdering one's stepfather and injuring his mother whom refuses to believe her son had anything to do with the attack. Discussions   Reviews Videos   Images   Changes Report Share Discussions General  0 Content Issues  0 Images Backdrops  0 Posters  1 Videos Trailers  0 Teasers  0 Clips  0 Featurettes  0 Opening Credits  0 Top Billed Cast Blythe Danner Bonnie Von Stein Matt McGrath Chris Pritchard Denis Arndt Leith Von Stein Adam Baldwin Det. John Taylor Dennis Farina Tom Brereton Full Cast & Crew Last Season Miniseries 1992 | 2 Episodes Season 1 of Cruel Doubt premiered on May 16, 1992. View All Seasons Social Reviews  0 Discussions  0 Media Most Popular Videos  0 Backdrops  0 Posters  1 Recommendations We don't have enough data to suggest any TV shows based on Cruel Doubt. You can help by rating TV shows you've seen. Facts Status  Ended Network Certification  - Type  Miniseries Original Language  English Runtime  120m Homepage  - Genres Crime Drama Keywords murder miniseries true crime Content Score 71 Just a little bit more... Top Contributors 33 Banana TB 12 TMDb Bot  View Edit History Popularity Trend  Login to edit  URL By  signing up  for an account on TMDb, you can post directly to Twitter and Facebook. You need to be logged in to continue. Click  here  to login or  here  to sign up.    page_wrap opened in html_head  Join the Community The Basics About TMDb Contact Us Support Forums API Blog Get Involved  Contribution Bible 3rd Party Applications Add New Movie Add New TV Show Community Guidelines Leaderboard Forums Twitter Facebook Legal Terms of Use Privacy Policy Login Sign Up", "character": ["Bonnie Von Stein", "Chris Pritchard", "Leith Von Stein", "Det. John Taylor", "Tom Brereton"]}