{"link": "https://www.themoviedb.org/tv/39775?language=en", "title": "Fantasy Island", "resume": "Fantasy Island is the title of two separate but related American television series, both originally airing on the ABC television network.", "rate": null, "genre": ["Sci-Fi", "Fantasy", "Drama"], "cast": ["Ricardo Montalban"], "site_data": "html Apps Forums Leaderboard Contribute API Support Discover Movies TV Shows Movies Popular Top Rated Upcoming Now Playing TV Shows Popular Top Rated On TV Airing Today People Popular People Can't find a movie or TV show? Login to create it. en Login Sign Up  ID: 39775   Expand Fantasy Island   (1977) User Score Overview Fantasy Island is the title of two separate but related American television series, both originally airing on the ABC television network. Featured Crew Gene Levitt Creator Discussions   Reviews Videos   Images   Changes Report Share Discussions General  1 Content Issues  0 Images Backdrops  5 Posters  4 Videos Trailers  0 Teasers  0 Clips  0 Featurettes  0 Opening Credits  0 Top Billed Cast Ricardo Montalban Mr. Roarke Full Cast & Crew Last Season Season 7 1983 | 22 Episodes Season 7 of Fantasy Island premiered on October  8, 1983. View All Seasons Social Reviews  0 Discussions  1 Subject Status Replies Last Reply smiles  everlyone Open 0 by manfromatlantis\n      \n     Go to Discussions Media Most Popular Videos  0 Backdrops  5 Posters  4 Recommendations   1974-01-18 The Six Million Dollar Man 6.6    1977-09-15 CHiPs 6.1    1976-01-14 The Bionic Woman 6.2    1976-01-27 Laverne & Shirley 6.7    1978-11-03 Diff'rent Strokes 5.7    1977-09-24 The Love Boat 5.8    1981-11-24 Simon & Simon 6.6    1966-09-08 Tarzan 5.5  Facts Status  Ended Network Certification  - Type  Scripted Original Language  English Runtime  - Homepage  - Genres Sci-Fi & Fantasy Drama Keywords No keywords have been added. Content Score 64 We're so close, yet so far. Top Contributors 260 lineker 5 Elizabeth Jennings d 3 denis 3 yannkallander  View Edit History Popularity Trend  Login to edit  URL By  signing up  for an account on TMDb, you can post directly to Twitter and Facebook. You need to be logged in to continue. Click  here  to login or  here  to sign up.    page_wrap opened in html_head  Join the Community The Basics About TMDb Contact Us Support Forums API Blog Get Involved  Contribution Bible 3rd Party Applications Add New Movie Add New TV Show Community Guidelines Leaderboard Forums Twitter Facebook Legal Terms of Use Privacy Policy Login Sign Up", "character": ["Mr. Roarke"]}