{"link": "https://www.themoviedb.org/tv/65477?language=en", "title": "Tu mourras moins b\u00eate", "resume": "We don't have an overview translated in English. Help us expand our database by adding one.", "rate": 0, "genre": ["Documentary", "Animation"], "cast": ["Fran\u00e7ois Morel", "J\u00e9r\u00f4me Pauwels"], "character": ["Professeur Moustache", "Nathana\u00ebl"], "site_data": "html Apps Forums Leaderboard Contribute API Support Discover Movies TV Shows Movies Popular Top Rated Upcoming Now Playing TV Shows Popular Top Rated On TV Airing Today People Popular People Can't find a movie or TV show? Login to create it. en Login Sign Up  ID: 65477   Expand Tu mourras moins b\u00eate   (2015) User Score Overview We don't have an overview translated in English. Help us expand our database by adding one. Featured Crew Marion Montaigne Creator Discussions   Reviews Videos   Images   Changes Report Share Discussions General  0 Content Issues  0 Images Backdrops  1 Posters  1 Videos Trailers  0 Teasers  0 Clips  0 Featurettes  0 Opening Credits  0 Top Billed Cast Fran\u00e7ois Morel Professeur Moustache J\u00e9r\u00f4me Pauwels Nathana\u00ebl Full Cast & Crew Last Season Season 2 2017 | 40 Episodes Season 2 of Tu mourras moins b\u00eate premiered on September  4, 2017. View All Seasons Social Reviews  0 Discussions  0 Media Most Popular Videos  0 Backdrops  1 Posters  1 Recommendations We don't have enough data to suggest any TV shows based on Tu mourras moins b\u00eate. You can help by rating TV shows you've seen. Facts Status  Returning Series Networks - Certification  - Type  Scripted Original Language  French Runtime  - Homepage  - Genres Documentary Animation Keywords No keywords have been added. Content Score 56 We're so close, yet so far. Top Contributors M 16 Manu S 3 Samara  View Edit History Popularity Trend  Login to edit  URL By  signing up  for an account on TMDb, you can post directly to Twitter and Facebook. You need to be logged in to continue. Click  here  to login or  here  to sign up.    page_wrap opened in html_head  Join the Community The Basics About TMDb Contact Us Support Forums API Blog Get Involved  Contribution Bible 3rd Party Applications Add New Movie Add New TV Show Community Guidelines Leaderboard Forums Twitter Facebook Legal Terms of Use Privacy Policy Login Sign Up"}