{"link": "https://www.themoviedb.org/tv/76807?language=en", "title": "Alija", "resume": "We don't have an overview translated in English. Help us expand our database by adding one.", "rate": 0, "genre": ["Action", "Adventure"], "cast": ["Burak Poyraz", "Yurdaer Okur", "G\u00f6rkem Yeltan"], "character": ["Young Alija Izetbegovi\u0107", "Alija Izetbegovi\u0107", "Halida Izetbegovi\u0107"], "site_data": "html Apps Forums Leaderboard Contribute API Support Discover Movies TV Shows Movies Popular Top Rated Upcoming Now Playing TV Shows Popular Top Rated On TV Airing Today People Popular People Can't find a movie or TV show? Login to create it. en Login Sign Up  ID: 76807   Expand Alija   (2018) User Score Overview We don't have an overview translated in English. Help us expand our database by adding one. Discussions   Reviews Videos   Images   Changes Report Share Discussions General  0 Content Issues  0 Images Backdrops  1 Posters  1 Videos Trailers  0 Teasers  0 Clips  0 Featurettes  0 Opening Credits  0 Top Billed Cast Burak Poyraz Young Alija Izetbegovi\u0107 Yurdaer Okur Alija Izetbegovi\u0107 G\u00f6rkem Yeltan Halida Izetbegovi\u0107 Full Cast & Crew Current Season Season 1 2018 | 3 Episodes Season 1 of Alija premiered on January 30, 2018. View All Seasons Social Reviews  0 Discussions  0 Media Most Popular Videos  0 Backdrops  1 Posters  1 Recommendations We don't have enough data to suggest any TV shows based on Alija. You can help by rating TV shows you've seen. Facts Status  Returning Series Network Certification  - Type  Scripted Original Language  Turkish Runtime  105m Homepage   http://alija.tv/ Genres Action & Adventure Keywords No keywords have been added. Content Score 50 Still needs a little work. Top Contributors 21 saifo1999 4 Elizabeth Jennings 2 Banana  View Edit History Popularity Trend  Login to edit  URL By  signing up  for an account on TMDb, you can post directly to Twitter and Facebook. You need to be logged in to continue. Click  here  to login or  here  to sign up.    page_wrap opened in html_head  Join the Community The Basics About TMDb Contact Us Support Forums API Blog Get Involved  Contribution Bible 3rd Party Applications Add New Movie Add New TV Show Community Guidelines Leaderboard Forums Twitter Facebook Legal Terms of Use Privacy Policy Login Sign Up"}