{"link": "https://www.themoviedb.org/tv/17228?language=en", "title": "In a Child's Name", "resume": "A true story about a woman who fights her brother-in-law's parents for custody of her deceased sister's baby upon learning that her brother-in-law murdered her sister.", "rate": 70, "genre": ["Drama"], "cast": ["Valerie Bertinelli", "Michael Ontkean", "Timothy Carhart", "David Huddleston", "John Karlen"], "character": ["Angela Cimarelli", "Kenneth Taylor", "Lt. Robert Fausak", "Zach Taylor", "Joe Silvano"], "site_data": "html Apps Forums Leaderboard Contribute API Support Discover Movies TV Shows Movies Popular Top Rated Upcoming Now Playing TV Shows Popular Top Rated On TV Airing Today People Popular People Can't find a movie or TV show? Login to create it. en Login Sign Up  ID: 17228   Expand In a Child's Name   (1991) User Score Overview A true story about a woman who fights her brother-in-law's parents for custody of her deceased sister's baby upon learning that her brother-in-law murdered her sister. Discussions   Reviews Videos   Images   Changes Report Share Discussions General  0 Content Issues  0 Images Backdrops  0 Posters  1 Videos Trailers  0 Teasers  0 Clips  0 Featurettes  0 Opening Credits  0 Top Billed Cast Valerie Bertinelli Angela Cimarelli Michael Ontkean Kenneth Taylor Timothy Carhart Lt. Robert Fausak David Huddleston Zach Taylor John Karlen Joe Silvano Full Cast & Crew Last Season Miniseries 1991 | 2 Episodes Season 1 of In a Child's Name premiered on November 16, 1991. View All Seasons Social Reviews  0 Discussions  0 Media Most Popular Videos  0 Backdrops  0 Posters  1 Recommendations We don't have enough data to suggest any TV shows based on In a Child's Name. You can help by rating TV shows you've seen. Facts Status  Ended Network Certification  - Type  Miniseries Original Language  English Runtime  120m Homepage  - Genres Drama Keywords biography miniseries Content Score 71 Just a little bit more... Top Contributors R 17 Rebecca TB 15 TMDb Bot  View Edit History Popularity Trend  Login to edit  URL By  signing up  for an account on TMDb, you can post directly to Twitter and Facebook. You need to be logged in to continue. Click  here  to login or  here  to sign up.    page_wrap opened in html_head  Join the Community The Basics About TMDb Contact Us Support Forums API Blog Get Involved  Contribution Bible 3rd Party Applications Add New Movie Add New TV Show Community Guidelines Leaderboard Forums Twitter Facebook Legal Terms of Use Privacy Policy Login Sign Up"}