{"link": "https://www.themoviedb.org/tv/80038?language=en", "title": "Na vod\u011b", "resume": "We don't have an overview translated in English. Help us expand our database by adding one.", "rate": 0, "genre": ["Comedy"], "cast": ["Luk\u00e1\u0161 Langmajer", "Tom\u00e1\u0161 Klus", "Veronika Kuba\u0159ov\u00e1", "Lud\u011bk Sobota", "Luk\u00e1\u0161 Pavl\u00e1sek"], "character": ["Hugo Kar\u00e1sek", "Jan Dlouh\u00fd", "Hani\u010dka", "\u010cestm\u00edr Dubsk\u00fd", "Stanislav"], "site_data": "html Apps Forums Leaderboard Contribute API Support Discover Movies TV Shows Movies Popular Top Rated Upcoming Now Playing TV Shows Popular Top Rated On TV Airing Today People Popular People Can't find a movie or TV show? Login to create it. en Login Sign Up  ID: 80038   Expand Na vod\u011b   (2016) User Score Overview We don't have an overview translated in English. Help us expand our database by adding one. Discussions   Reviews Videos   Images   Changes Report Share Discussions General  0 Content Issues  0 Images Backdrops  1 Posters  2 Videos Trailers  0 Teasers  0 Clips  0 Featurettes  0 Opening Credits  0 Top Billed Cast Luk\u00e1\u0161 Langmajer Hugo Kar\u00e1sek Tom\u00e1\u0161 Klus Jan Dlouh\u00fd Veronika Kuba\u0159ov\u00e1 Hani\u010dka Lud\u011bk Sobota \u010cestm\u00edr Dubsk\u00fd Luk\u00e1\u0161 Pavl\u00e1sek Stanislav Full Cast & Crew Last Season Season 1 2016 | 13 Episodes Season 1 of Na vod\u011b premiered on February  7, 2016. View All Seasons Social Reviews  0 Discussions  0 Media Most Popular Videos  0 Backdrops  1 Posters  2 Recommendations We don't have enough data to suggest any TV shows based on Na vod\u011b. You can help by rating TV shows you've seen. Facts Status  Ended Network Certification  - Type  Scripted Original Language  Czech Runtime  45m Homepage   http://voyo.nova.cz/serialy/49162-na-vode Genres Comedy Keywords No keywords have been added. Content Score 86 Almost there... Top Contributors 5 35 5lucina5 5 Elizabeth Jennings  View Edit History Popularity Trend  Login to edit  URL By  signing up  for an account on TMDb, you can post directly to Twitter and Facebook. You need to be logged in to continue. Click  here  to login or  here  to sign up.    page_wrap opened in html_head  Join the Community The Basics About TMDb Contact Us Support Forums API Blog Get Involved  Contribution Bible 3rd Party Applications Add New Movie Add New TV Show Community Guidelines Leaderboard Forums Twitter Facebook Legal Terms of Use Privacy Policy Login Sign Up"}