{"link": "https://www.themoviedb.org/tv/74834?language=en", "title": "Les Recrues d'infanterie", "resume": "We don't have an overview translated in English. Help us expand our database by adding one.", "rate": 0, "genre": ["Documentary", "Reality"], "cast": ["David Boutin"], "character": ["Himself - Narrator"], "site_data": "html Apps Forums Leaderboard Contribute API Support Discover Movies TV Shows Movies Popular Top Rated Upcoming Now Playing TV Shows Popular Top Rated On TV Airing Today People Popular People Can't find a movie or TV show? Login to create it. en Login Sign Up  ID: 74834   Expand Les Recrues d'infanterie   (2017) User Score Overview We don't have an overview translated in English. Help us expand our database by adding one. Discussions   Reviews Videos   Images   Changes Report Share Discussions General  0 Content Issues  0 Images Backdrops  0 Posters  1 Videos Trailers  0 Teasers  0 Clips  0 Featurettes  0 Opening Credits  0 Top Billed Cast David Boutin Himself - Narrator Full Cast & Crew Current Season Season 1 2017 | 8 Episodes Season 1 of Les Recrues d'infanterie premiered on October 31, 2017. View All Seasons Social Reviews  0 Discussions  0 Media Most Popular Videos  0 Backdrops  0 Posters  1 Recommendations We don't have enough data to suggest any TV shows based on Les Recrues d'infanterie. You can help by rating TV shows you've seen. Facts Status  Returning Series Network Certification C8 Meaning Suitable for children ages 8+. Low level violence and fantasy horror is allowed. No foul language is allowed, but occasional \"socially offensive and discriminatory\" language is allowed if in the context of the story. No sexual content of any level allowed. Type  Documentary Original Language  French Runtime  30m Homepage   http://www.ztele.com/emissions/recrues-infanterie/emission Genres Documentary Reality Keywords No keywords have been added. Content Score 43 There's no 'I' in team... Top Contributors 18 Guipat a 4 arcaida M 4 MarcusCorvin TB 2 TMDb Bot  View Edit History Popularity Trend  Login to edit  URL By  signing up  for an account on TMDb, you can post directly to Twitter and Facebook. You need to be logged in to continue. Click  here  to login or  here  to sign up.    page_wrap opened in html_head  Join the Community The Basics About TMDb Contact Us Support Forums API Blog Get Involved  Contribution Bible 3rd Party Applications Add New Movie Add New TV Show Community Guidelines Leaderboard Forums Twitter Facebook Legal Terms of Use Privacy Policy Login Sign Up"}