{"link": "https://www.themoviedb.org/tv/77487?language=en", "title": "Classic Mary Berry", "resume": "Mary Berry has finessed many perennial dishes down to the last crumb. Here she shares savoury secrets", "rate": 0, "genre": ["Reality"], "cast": ["Mary Berry"], "character": ["herself"], "site_data": "html Apps Forums Leaderboard Contribute API Support Discover Movies TV Shows Movies Popular Top Rated Upcoming Now Playing TV Shows Popular Top Rated On TV Airing Today People Popular People Can't find a movie or TV show? Login to create it. en Login Sign Up  ID: 77487   Expand Classic Mary Berry   (2018) User Score  Play Trailer Overview Mary Berry has finessed many perennial dishes down to the last crumb. Here she shares savoury secrets Discussions   Reviews Videos   Images   Changes Report Share Discussions General  0 Content Issues  0 Images Backdrops  0 Posters  1 Videos Trailers  1 Teasers  0 Clips  0 Featurettes  0 Opening Credits  0 Top Billed Cast Mary Berry herself Full Cast & Crew Current Season Season 1 2018 | 0 Episodes Season 1 of Classic Mary Berry premiered on February 26, 2018. View All Seasons Social Reviews  0 Discussions  0 Media Most Popular Videos  1 Backdrops  0 Posters  1 Recommendations We don't have enough data to suggest any TV shows based on Classic Mary Berry. You can help by rating TV shows you've seen. Facts Status  Returning Series Network Certification  - Type  Scripted Original Language  English Runtime  30m Homepage   http://www.bbc.co.uk/programmes/b09tysvz Genres Reality Keywords cooking Content Score 50 Still needs a little work. Top Contributors R 7 Rebecca 7 Steve 5 tigru89 TB 1 TMDb Bot  View Edit History Popularity Trend  Login to edit  URL By  signing up  for an account on TMDb, you can post directly to Twitter and Facebook. You need to be logged in to continue. Click  here  to login or  here  to sign up.    page_wrap opened in html_head  Join the Community The Basics About TMDb Contact Us Support Forums API Blog Get Involved  Contribution Bible 3rd Party Applications Add New Movie Add New TV Show Community Guidelines Leaderboard Forums Twitter Facebook Legal Terms of Use Privacy Policy Login Sign Up"}