{"link": "https://www.themoviedb.org/tv/74248?language=en", "title": "Tod im Internat", "resume": "We don't have an overview translated in English. Help us expand our database by adding one.", "rate": 70, "genre": ["Crime"], "cast": ["Nadja Uhl", "Hanno Koffler", "Joachim Kr\u00f3l", "Martin Feifel", "Oliver Stokowski"], "character": ["Isabell Moosbach / Karla Parker", "Julian Sellinger", "Herbert Wichert", "Volker Jens", "Frank Baumschulte"], "site_data": "html Apps Forums Leaderboard Contribute API Support Discover Movies TV Shows Movies Popular Top Rated Upcoming Now Playing TV Shows Popular Top Rated On TV Airing Today People Popular People Can't find a movie or TV show? Login to create it. en Login Sign Up  ID: 74248   Expand Tod im Internat   (2017) User Score Overview We don't have an overview translated in English. Help us expand our database by adding one. Featured Crew Frauke Hunfeld Creator Discussions   Reviews Videos   Images   Changes Report Share Discussions General  0 Content Issues  0 Images Backdrops  4 Posters  1 Videos Trailers  0 Teasers  0 Clips  0 Featurettes  0 Opening Credits  0 Top Billed Cast Nadja Uhl Isabell Moosbach / Karla Parker Hanno Koffler Julian Sellinger Joachim Kr\u00f3l Herbert Wichert Martin Feifel Volker Jens Oliver Stokowski Frank Baumschulte Full Cast & Crew Current Season Season 1 2017 | 2 Episodes Season 1 of Tod im Internat premiered on October  9, 2017. View All Seasons Social Reviews  0 Discussions  0 Media Most Popular Videos  0 Backdrops  4 Posters  1 Recommendations We don't have enough data to suggest any TV shows based on Tod im Internat. You can help by rating TV shows you've seen. Facts Status  Ended Network Certification 12 Meaning The broadcaster must take the decision about the air time by taking in consideration the impact on young children in the timeframe from 6:00am to 8:00pm. Type  Miniseries Original Language  German Runtime  105m Homepage   https://swisscows.ch/lr?IG=C144A0B360B44C30977CEBD89CB9EEB4&CID=167F22E8C62C6AE7050429E6C78A6BD6&rd=1&h=OLr0Z28WPDLhtxseZwc73Cl1NneAhaIIa1YOUUVHGu8&v=1&r=https%3a%2f%2fwww.zdf.de%2ffilme%2ftod-im-internat%2ftod-im-internat-104.html Genres Crime Keywords undercover undercover cop miniseries mord ddr internat lehrer mordermittlung startbahn west Content Score 86 Almost there... Top Contributors t 56 tmdb45070722 w 3 webmaster TB 2 TMDb Bot  View Edit History Popularity Trend  Login to edit  URL By  signing up  for an account on TMDb, you can post directly to Twitter and Facebook. You need to be logged in to continue. Click  here  to login or  here  to sign up.    page_wrap opened in html_head  Join the Community The Basics About TMDb Contact Us Support Forums API Blog Get Involved  Contribution Bible 3rd Party Applications Add New Movie Add New TV Show Community Guidelines Leaderboard Forums Twitter Facebook Legal Terms of Use Privacy Policy Login Sign Up"}