{"link": "https://www.themoviedb.org/tv/27747?language=en", "title": "The Dudesons", "resume": "The Dudesons is a reality series following four Finnish friends as they dare each other to perform stupid stunts and crazy antics.", "rate": null, "genre": ["Documentary", "Comedy"], "cast": ["Jukka Hild\u00e9n", "Jarppi Lepp\u00e4l\u00e4", "Jarno Laasala", "Hannu-Pekka Parviainen"], "site_data": "html Apps Forums Leaderboard Contribute API Support Discover Movies TV Shows Movies Popular Top Rated Upcoming Now Playing TV Shows Popular Top Rated On TV Airing Today People Popular People Can't find a movie or TV show? Login to create it. en Login Sign Up  ID: 27747   Expand The Dudesons   (2006) User Score Overview The Dudesons is a reality series following four Finnish friends as they dare each other to perform stupid stunts and crazy antics. Discussions   Reviews Videos   Images   Changes Report Share Discussions General  0 Content Issues  0 Images Backdrops  1 Posters  1 Videos Trailers  0 Teasers  0 Clips  0 Featurettes  0 Opening Credits  0 Top Billed Cast Jukka Hild\u00e9n Himself Jarppi Lepp\u00e4l\u00e4 Himself Jarno Laasala Himself Hannu-Pekka Parviainen Himself Full Cast & Crew Last Season Season 4 2010 | 8 Episodes Season 4 of The Dudesons premiered on January 15, 2010. View All Seasons Social Reviews  0 Discussions  0 Media Most Popular Videos  0 Backdrops  1 Posters  1 Recommendations   2000-05-31 Survivor 6.3  Facts Status  Returning Series Network Certification  - Type  Scripted Original Language  English Runtime  30m Homepage  - Genres Documentary Comedy Keywords stunt Content Score 86 Almost there... Top Contributors 10 Banana 6 HomegrownHero  View Edit History Popularity Trend  Login to edit  URL By  signing up  for an account on TMDb, you can post directly to Twitter and Facebook. You need to be logged in to continue. Click  here  to login or  here  to sign up.    page_wrap opened in html_head  Join the Community The Basics About TMDb Contact Us Support Forums API Blog Get Involved  Contribution Bible 3rd Party Applications Add New Movie Add New TV Show Community Guidelines Leaderboard Forums Twitter Facebook Legal Terms of Use Privacy Policy Login Sign Up", "character": ["Himself", "Himself", "Himself", "Himself"]}