{"link": "https://www.themoviedb.org/tv/49159?language=en", "title": "Kay\u0131p \u015eehir", "resume": "We don't have an overview translated in English. Help us expand our database by adding one.", "rate": 80, "genre": ["Family", "Drama"], "cast": ["G\u00f6k\u00e7e Bahad\u0131r", "Nik Xhelilaj", "Ilker Kaleli", "Nazan Kesal", "U\u011fur Polat"], "character": ["Aysel", "Kadir Topta\u015f", "\u0130rfan Topta\u015f", "Meryem  Topta\u015f", "Ethem"], "site_data": "html Apps Forums Leaderboard Contribute API Support Discover Movies TV Shows Movies Popular Top Rated Upcoming Now Playing TV Shows Popular Top Rated On TV Airing Today People Popular People Can't find a movie or TV show? Login to create it. en Login Sign Up  ID: 49159   Expand Kay\u0131p \u015eehir   (2012) User Score Overview We don't have an overview translated in English. Help us expand our database by adding one. Featured Crew Tomris Giritlio\u011flu Creator Discussions   Reviews Videos   Images   Changes Report Share Discussions General  0 Content Issues  0 Images Backdrops  0 Posters  1 Videos Trailers  0 Teasers  0 Clips  0 Featurettes  0 Opening Credits  0 Top Billed Cast G\u00f6k\u00e7e Bahad\u0131r Aysel Nik Xhelilaj Kadir Topta\u015f Ilker Kaleli \u0130rfan Topta\u015f Nazan Kesal Meryem  Topta\u015f U\u011fur Polat Ethem Full Cast & Crew Last Season Season 1 2012 | 26 Episodes Season 1 of Kay\u0131p \u015eehir premiered on September 14, 2012. View All Seasons Social Reviews  0 Discussions  0 Media Most Popular Videos  0 Backdrops  0 Posters  1 Recommendations We don't have enough data to suggest any TV shows based on Kay\u0131p \u015eehir. You can help by rating TV shows you've seen. Facts Status  Ended Network Certification  - Type  Scripted Original Language  English Runtime  90m Homepage   https://www.kanald.com.tr/kayipsehir/ Genres Family Drama Keywords No keywords have been added. Content Score 71 Just a little bit more... Top Contributors 46 purplelammashta  View Edit History Popularity Trend  Login to edit  URL By  signing up  for an account on TMDb, you can post directly to Twitter and Facebook. You need to be logged in to continue. Click  here  to login or  here  to sign up.    page_wrap opened in html_head  Join the Community The Basics About TMDb Contact Us Support Forums API Blog Get Involved  Contribution Bible 3rd Party Applications Add New Movie Add New TV Show Community Guidelines Leaderboard Forums Twitter Facebook Legal Terms of Use Privacy Policy Login Sign Up"}