{"link": "https://www.themoviedb.org/tv/50541?language=en", "title": "Hayat Bazen Tatl\u0131d\u0131r", "resume": "We don't have an overview translated in English. Help us expand our database by adding one.", "rate": 40, "genre": ["Family", "Drama", "Comedy"], "cast": ["Birce Akalay", "Ufuk \u00d6zkan", "Kanbolat G\u00f6rkem Arslan", "Simay Barlas", "An\u0131l Tetik"], "character": ["Hayat \u00d6\u011fretmen", "\u015eerif Alkan", "Cerrah Bey", "G\u00f6zde", "Koray"], "site_data": "html Apps Forums Leaderboard Contribute API Support Discover Movies TV Shows Movies Popular Top Rated Upcoming Now Playing TV Shows Popular Top Rated On TV Airing Today People Popular People Can't find a movie or TV show? Login to create it. en Login Sign Up  ID: 50541   Expand Hayat Bazen Tatl\u0131d\u0131r   (2016) User Score Overview We don't have an overview translated in English. Help us expand our database by adding one. Featured Crew Gani M\u00fcjde Creator Discussions   Reviews Videos   Images   Changes Report Share Discussions General  0 Content Issues  0 Images Backdrops  0 Posters  1 Videos Trailers  0 Teasers  0 Clips  0 Featurettes  0 Opening Credits  0 Top Billed Cast Birce Akalay Hayat \u00d6\u011fretmen Ufuk \u00d6zkan \u015eerif Alkan Kanbolat G\u00f6rkem Arslan Cerrah Bey Simay Barlas G\u00f6zde An\u0131l Tetik Koray Full Cast & Crew Last Season Season 1 2016 | 26 Episodes Season 1 of Hayat Bazen Tatl\u0131d\u0131r premiered on October 16, 2016. View All Seasons Social Reviews  0 Discussions  0 Media Most Popular Videos  0 Backdrops  0 Posters  1 Recommendations We don't have enough data to suggest any TV shows based on Hayat Bazen Tatl\u0131d\u0131r. You can help by rating TV shows you've seen. Facts Status  Ended Network Certification  - Type  Scripted Original Language  Turkish Runtime  120m Homepage   https://www.startv.com.tr/video/arsiv/dizi/hayat-bazen-tatlidir Genres Family Drama Comedy Keywords No keywords have been added. Content Score 71 Just a little bit more... Top Contributors 47 purplelammashta 1 Elizabeth Jennings  View Edit History Popularity Trend  Login to edit  URL By  signing up  for an account on TMDb, you can post directly to Twitter and Facebook. You need to be logged in to continue. Click  here  to login or  here  to sign up.    page_wrap opened in html_head  Join the Community The Basics About TMDb Contact Us Support Forums API Blog Get Involved  Contribution Bible 3rd Party Applications Add New Movie Add New TV Show Community Guidelines Leaderboard Forums Twitter Facebook Legal Terms of Use Privacy Policy Login Sign Up"}