{"link": "https://www.themoviedb.org/tv/71714?language=en", "title": "The Brave", "resume": "The complex world of our bravest military heroes who make personal sacrifices while executing the most challenging and dangerous missions behind enemy lines.", "rate": 65, "genre": ["Drama"], "cast": ["Mike Vogel", "Natacha Karam", "Noah Mills", "Hadi Tabbal", "Anne Heche"], "character": ["Adam Dalton", "Jasmine \"Jaz\" Khan", "Joseph \"McG\" McGuire", "Amir Al-Raisani", "Patricia Campbell"], "site_data": "html Apps Forums Leaderboard Contribute API Support Discover Movies TV Shows Movies Popular Top Rated Upcoming Now Playing TV Shows Popular Top Rated On TV Airing Today People Popular People Can't find a movie or TV show? Login to create it. en Login Sign Up  ID: 71714   Expand The Brave   (2017) User Score  Play Trailer Overview The complex world of our bravest military heroes who make personal sacrifices while executing the most challenging and dangerous missions behind enemy lines. Featured Crew Dean Georgaris Creator Discussions   Reviews Videos   Images   Changes Report Share Discussions General  2 Content Issues  0 Images Backdrops  5 Posters  2 Videos Trailers  1 Teasers  0 Clips  0 Featurettes  0 Opening Credits  0 Top Billed Cast Mike Vogel Adam Dalton Natacha Karam Jasmine \"Jaz\" Khan Noah Mills Joseph \"McG\" McGuire Hadi Tabbal Amir Al-Raisani Anne Heche Patricia Campbell Full Cast & Crew Last Season Season 1 2017 | 13 Episodes Season 1 of The Brave premiered on September 25, 2017. View All Seasons Social Reviews  1 Discussions  2 A review by dshacky90  6.0 Written by  dshacky90  on March  3, 2018 For most \"Special Forces\" shows out there these days this one is one of the better ones.  The characters are all the right age for the military positions they are in and they actually speak Arabic. Read All Reviews Media Most Popular Videos  1 Backdrops  5 Posters  2 Recommendations   2017-09-27 SEAL Team 6.6    2017-10-09 Valor 6.3    2017-10-01 Ten Days in the Valley 6.0    2017-10-21 Gunpowder 6.8    2017-10-01 Wisdom of the Crowd 7.1    2017-10-02 The Gifted 7.0    2017-10-01 Ghosted 6.2    2017-11-07 The Long Road Home 7.3  Facts Status  Cancelled Network Certification TV-14 Meaning This program contains some material that many parents would find unsuitable for children under 14 years of age. Type  Scripted Original Language  English Runtime  43m Homepage   http://www.nbc.com/the-brave Genres Drama Keywords military service u.s. military military drama Content Score 100 Yes! Looking good! Top Contributors 36 Warpath 22 Banana 19 Elizabeth Jennings 14 Gabriel W. Almeida  View Edit History Popularity Trend  Login to edit  URL By  signing up  for an account on TMDb, you can post directly to Twitter and Facebook. You need to be logged in to continue. Click  here  to login or  here  to sign up.    page_wrap opened in html_head  Join the Community The Basics About TMDb Contact Us Support Forums API Blog Get Involved  Contribution Bible 3rd Party Applications Add New Movie Add New TV Show Community Guidelines Leaderboard Forums Twitter Facebook Legal Terms of Use Privacy Policy Login Sign Up"}