{"link": "https://www.themoviedb.org/tv/73602?language=en", "title": "Greenhouse Academy", "resume": "When teen siblings Hayley and Alex enter an elite boarding school, they find rivalry, romance and a mystery related to the recent loss of their mom.", "rate": 85, "genre": ["Drama"], "cast": ["Aviv Buchler", "Ariel Mortman", "Finn Roberts", "Christopher O'Neal", "Dallas Hart"], "character": ["Emma Geller", "Hayley Woods", "Alex Woods", "Daniel Hayward", "Leo Cruz"], "site_data": "html Apps Forums Leaderboard Contribute API Support Discover Movies TV Shows Movies Popular Top Rated Upcoming Now Playing TV Shows Popular Top Rated On TV Airing Today People Popular People Can't find a movie or TV show? Login to create it. en Login Sign Up  ID: 73602   Expand Greenhouse Academy   (2017) User Score  Play Trailer Overview When teen siblings Hayley and Alex enter an elite boarding school, they find rivalry, romance and a mystery related to the recent loss of their mom. Featured Crew Giora Chamizer Creator Discussions   Reviews Videos   Images   Changes Report Share Discussions General  0 Content Issues  0 Images Backdrops  2 Posters  1 Videos Trailers  1 Teasers  0 Clips  0 Featurettes  0 Opening Credits  0 Top Billed Cast Aviv Buchler Emma Geller Ariel Mortman Hayley Woods Finn Roberts Alex Woods Christopher O'Neal Daniel Hayward Dallas Hart Leo Cruz Full Cast & Crew Current Season Season 2 2018 | 12 Episodes Season 2 of Greenhouse Academy premiered on February 14, 2018. View All Seasons Social Reviews  0 Discussions  0 Media Most Popular Videos  1 Backdrops  2 Posters  1 Recommendations We don't have enough data to suggest any TV shows based on Greenhouse Academy. You can help by rating TV shows you've seen. Facts Status  Returning Series Network Certification TV-PG Meaning This program contains material that parents may find unsuitable for younger children. Type  Scripted Original Language  English Runtime  30m Homepage   https://www.netflix.com/title/80095435 Genres Drama Keywords california nasa intellectual mystery school astronaut sibling teen drama Content Score 100 Yes! Looking good! Top Contributors 38 Elizabeth Jennings 18 Medianoche 7 tittiagoo j 5 jd1048576  View Edit History Popularity Trend  Login to edit  URL By  signing up  for an account on TMDb, you can post directly to Twitter and Facebook. You need to be logged in to continue. Click  here  to login or  here  to sign up.    page_wrap opened in html_head  Join the Community The Basics About TMDb Contact Us Support Forums API Blog Get Involved  Contribution Bible 3rd Party Applications Add New Movie Add New TV Show Community Guidelines Leaderboard Forums Twitter Facebook Legal Terms of Use Privacy Policy Login Sign Up"}