{"link": "https://www.themoviedb.org/tv/2394?language=en", "title": "This Old House", "resume": "TV's original home-improvement show, following one whole-house renovation over several episodes.", "rate": 48, "genre": ["Documentary"], "cast": ["Steve Thomas Rooney"], "character": ["Host"], "site_data": "html Apps Forums Leaderboard Contribute API Support Discover Movies TV Shows Movies Popular Top Rated Upcoming Now Playing TV Shows Popular Top Rated On TV Airing Today People Popular People Can't find a movie or TV show? Login to create it. en Login Sign Up  ID: 2394   Expand This Old House   (1979) User Score  Play Trailer Overview TV's original home-improvement show, following one whole-house renovation over several episodes. Featured Crew Russell Morash Creator Discussions   Reviews Videos   Images   Changes Report Share Discussions General  0 Content Issues  1 Images Backdrops  2 Posters  3 Videos Trailers  1 Teasers  0 Clips  0 Featurettes  0 Opening Credits  0 Top Billed Cast Steve Thomas Rooney Host Full Cast & Crew Current Season Season 39 2017 | 26 Episodes Season 39 of This Old House premiered on October  5, 2017. View All Seasons Social Reviews  0 Discussions  1 Subject Status Replies Last Reply There are no discussions for This Old House. Login to be first! Go to Discussions Media Most Popular Videos  1 Backdrops  2 Posters  3 Recommendations   1965-09-01 Gidget 5.2    1970-09-17 The Flip Wilson Show 3.7    1968-09-23 Here's Lucy 5.8    1965-09-15 The Big Valley 3.5    1979-09-30 To the Manor Born 7.1    1965-09-16 The Dean Martin Show 4.2    1962-10-01 The Lucy Show 7.0    1972-09-12 Maude 4.9  Facts Status  Returning Series Network Certification  - Type  Documentary Original Language  English Runtime  30m, 60m Homepage   http://www.pbs.org/show/old-house/ Genres Documentary Keywords home renovation home improvement Content Score 71 Just a little bit more... Top Contributors S 22 Snackdish 15 Elizabeth Jennings TB 14 TMDb Bot 6 Banana  View Edit History Popularity Trend  Login to edit  URL By  signing up  for an account on TMDb, you can post directly to Twitter and Facebook. You need to be logged in to continue. Click  here  to login or  here  to sign up.    page_wrap opened in html_head  Join the Community The Basics About TMDb Contact Us Support Forums API Blog Get Involved  Contribution Bible 3rd Party Applications Add New Movie Add New TV Show Community Guidelines Leaderboard Forums Twitter Facebook Legal Terms of Use Privacy Policy Login Sign Up"}