{"link": "https://www.themoviedb.org/tv/23453?language=en", "title": "Peter and Paul", "resume": "Peter and Paul assume leadership of the Church as they struggle against violent opposition to the teachings of Christ and their own personal conflicts.", "rate": null, "genre": ["Drama", "Family"], "cast": ["Eddie Albert", "Jon Finch", "Raymond Burr", "Jos\u00e9 Ferrer", "John Rhys-Davies"], "site_data": "html Apps Forums Leaderboard Contribute API Support Discover Movies TV Shows Movies Popular Top Rated Upcoming Now Playing TV Shows Popular Top Rated On TV Airing Today People Popular People Can't find a movie or TV show? Login to create it. en Login Sign Up  ID: 23453   Expand Peter and Paul   (1981) User Score Overview Peter and Paul assume leadership of the Church as they struggle against violent opposition to the teachings of Christ and their own personal conflicts. Discussions   Reviews Videos   Images   Changes Report Share Discussions General  0 Content Issues  0 Images Backdrops  0 Posters  2 Videos Trailers  0 Teasers  0 Clips  0 Featurettes  0 Opening Credits  0 Top Billed Cast Eddie Albert Festus Jon Finch Luke Raymond Burr Herod Agrippa I Jos\u00e9 Ferrer Gamaliel John Rhys-Davies Silas Full Cast & Crew Last Season Original Air Date Original Air Date Peter and Paul Part 1 (Absolute) Peter and Paul Part 2 (Absolute) Miniseries 1981 | 2 Episodes Season 1 of Peter and Paul premiered on April 12, 1981. View All Seasons Social Reviews  0 Discussions  0 Media Most Popular Videos  0 Backdrops  0 Posters  2 Recommendations We don't have enough data to suggest any TV shows based on Peter and Paul. You can help by rating TV shows you've seen. Facts Status  Ended Network Certification TV-PG Meaning This program contains material that parents may find unsuitable for younger children. Type  Miniseries Original Language  English Runtime  120m Homepage  - Genres Drama Family Keywords biography christian miniseries Content Score 71 Just a little bit more... Top Contributors R 19 Rebecca TB 14 TMDb Bot 6 bjmcconnel  View Edit History Popularity Trend  Login to edit  URL By  signing up  for an account on TMDb, you can post directly to Twitter and Facebook. You need to be logged in to continue. Click  here  to login or  here  to sign up.    page_wrap opened in html_head  Join the Community The Basics About TMDb Contact Us Support Forums API Blog Get Involved  Contribution Bible 3rd Party Applications Add New Movie Add New TV Show Community Guidelines Leaderboard Forums Twitter Facebook Legal Terms of Use Privacy Policy Login Sign Up", "character": ["Festus", "Luke", "Herod Agrippa I", "Gamaliel", "Silas"]}