{"link": "https://www.themoviedb.org/tv/64129?language=en", "title": "Sketch History", "resume": "We don't have an overview translated in English. Help us expand our database by adding one.", "rate": 100, "genre": ["Comedy"], "cast": ["Max Giermann", "Matthias Matschke", "Antoine Monot Jr.", "Valerie Niehaus", "Isabell Polak"], "character": ["Various", "Various", "Various", "Various", "Various"], "site_data": "html Apps Forums Leaderboard Contribute API Support Discover Movies TV Shows Movies Popular Top Rated Upcoming Now Playing TV Shows Popular Top Rated On TV Airing Today People Popular People Can't find a movie or TV show? Login to create it. en Login Sign Up  ID: 64129   Expand Sketch History   (2015) User Score Overview We don't have an overview translated in English. Help us expand our database by adding one. Discussions   Reviews Videos   Images   Changes Report Share Discussions General  0 Content Issues  0 Images Backdrops  2 Posters  1 Videos Trailers  0 Teasers  0 Clips  0 Featurettes  0 Opening Credits  0 Top Billed Cast Max Giermann Various Matthias Matschke Various Antoine Monot Jr. Various Valerie Niehaus Various Isabell Polak Various Full Cast & Crew Last Season Season 2 2016 | 8 Episodes Season 2 of Sketch History premiered on December  2, 2016. View All Seasons Social Reviews  0 Discussions  0 Media Most Popular Videos  0 Backdrops  2 Posters  1 Recommendations We don't have enough data to suggest any TV shows based on Sketch History. You can help by rating TV shows you've seen. Facts Status  Returning Series Network Certification  - Type  Scripted Original Language  German Runtime  24m Homepage   https://www.zdf.de/comedy/sketch-history Genres Comedy Keywords history sketch comedy Content Score 86 Almost there... Top Contributors p 36 phreelance S 19 Sebastian 17 Marr \ud83c\uddf3\ud83c\uddf1 S 6 Samara  View Edit History Popularity Trend  Login to edit  URL By  signing up  for an account on TMDb, you can post directly to Twitter and Facebook. You need to be logged in to continue. Click  here  to login or  here  to sign up.    page_wrap opened in html_head  Join the Community The Basics About TMDb Contact Us Support Forums API Blog Get Involved  Contribution Bible 3rd Party Applications Add New Movie Add New TV Show Community Guidelines Leaderboard Forums Twitter Facebook Legal Terms of Use Privacy Policy Login Sign Up"}