{"link": "https://www.themoviedb.org/tv/42178?language=en", "title": "The Caf\u00e9", "resume": "The Caf\u00e9 is a British sitcom written by and starring Ralf Little and Michelle Terry broadcast by Sky1.", "rate": null, "genre": ["Comedy"], "cast": ["Michelle Terry", "Ellie Haddington", "June Watson", "Ralf Little", "David Troughton"], "site_data": "html Apps Forums Leaderboard Contribute API Support Discover Movies TV Shows Movies Popular Top Rated Upcoming Now Playing TV Shows Popular Top Rated On TV Airing Today People Popular People Can't find a movie or TV show? Login to create it. en Login Sign Up  ID: 42178   Expand The Caf\u00e9   (2011) User Score Overview The Caf\u00e9 is a British sitcom written by and starring Ralf Little and Michelle Terry broadcast by Sky1. Discussions   Reviews Videos   Images   Changes Report Share Discussions General  0 Content Issues  0 Images Backdrops  1 Posters  1 Videos Trailers  0 Teasers  0 Clips  0 Featurettes  0 Opening Credits  0 Top Billed Cast Michelle Terry Sarah Porter Ellie Haddington Carol Porter June Watson Mary Ellis Ralf Little Richard Dickens David Troughton Stan Astill Full Cast & Crew Last Season Season 2 2013 | 7 Episodes Season 2 of The Caf\u00e9 premiered on July 24, 2013. View All Seasons Social Reviews  0 Discussions  0 Media Most Popular Videos  0 Backdrops  1 Posters  1 Recommendations We don't have enough data to suggest any TV shows based on The Caf\u00e9. You can help by rating TV shows you've seen. Facts Status  Ended Network Certification  - Type  Scripted Original Language  English Runtime  - Homepage  - Genres Comedy Keywords No keywords have been added. Content Score 86 Almost there... Top Contributors H 25 HelloCharlie 1 bigyellowbird  View Edit History Popularity Trend  Login to edit  URL By  signing up  for an account on TMDb, you can post directly to Twitter and Facebook. You need to be logged in to continue. Click  here  to login or  here  to sign up.    page_wrap opened in html_head  Join the Community The Basics About TMDb Contact Us Support Forums API Blog Get Involved  Contribution Bible 3rd Party Applications Add New Movie Add New TV Show Community Guidelines Leaderboard Forums Twitter Facebook Legal Terms of Use Privacy Policy Login Sign Up", "character": ["Sarah Porter", "Carol Porter", "Mary Ellis", "Richard Dickens", "Stan Astill"]}