{"link": "https://www.themoviedb.org/tv/77450?language=en", "title": "Patrice Lemieux 24/7", "resume": "We don't have an overview translated in English. Help us expand our database by adding one.", "rate": 70, "genre": ["Comedy"], "cast": ["Daniel Savoie", "Patrice Robitaille"], "character": ["Patrice Lemieux", "Rich Goyette"], "site_data": "html Apps Forums Leaderboard Contribute API Support Discover Movies TV Shows Movies Popular Top Rated Upcoming Now Playing TV Shows Popular Top Rated On TV Airing Today People Popular People Can't find a movie or TV show? Login to create it. en Login Sign Up  ID: 77450   Expand Patrice Lemieux 24/7   (2015) User Score Overview We don't have an overview translated in English. Help us expand our database by adding one. Discussions   Reviews Videos   Images   Changes Report Share Discussions General  0 Content Issues  0 Images Backdrops  0 Posters  1 Videos Trailers  0 Teasers  0 Clips  0 Featurettes  0 Opening Credits  0 Top Billed Cast Daniel Savoie Patrice Lemieux Patrice Robitaille Rich Goyette Full Cast & Crew Last Season Season 2 2016 | 10 Episodes Season 2 of Patrice Lemieux 24/7 premiered on January 12, 2016. View All Seasons Social Reviews  0 Discussions  0 Media Most Popular Videos  0 Backdrops  0 Posters  1 Recommendations We don't have enough data to suggest any TV shows based on Patrice Lemieux 24/7. You can help by rating TV shows you've seen. Facts Status  Ended Networks Certification  - Type  Scripted Original Language  French Runtime  - Homepage  - Genres Comedy Keywords hockey player Content Score 36 There's no 'I' in team... Top Contributors ES 20 Erik Spyder TB 2 TMDb Bot  View Edit History Popularity Trend  Login to edit  URL By  signing up  for an account on TMDb, you can post directly to Twitter and Facebook. You need to be logged in to continue. Click  here  to login or  here  to sign up.    page_wrap opened in html_head  Join the Community The Basics About TMDb Contact Us Support Forums API Blog Get Involved  Contribution Bible 3rd Party Applications Add New Movie Add New TV Show Community Guidelines Leaderboard Forums Twitter Facebook Legal Terms of Use Privacy Policy Login Sign Up"}