{"link": "https://www.themoviedb.org/tv/3475?language=en", "title": "The L Word", "resume": "A group of lesbian friends struggle with romance and careers in Los Angeles.", "rate": 68, "genre": ["Drama"], "cast": ["Pam Grier", "Leisha Hailey", "Marlee Matlin", "Katherine Moennig", "Rachel Shelley"], "character": ["Kit Porter", "Alice Pieszecki", "Jodi Lerner", "Shane McCutcheon", "Helena Peabody"], "site_data": "html Apps Forums Leaderboard Contribute API Support Discover Movies TV Shows Movies Popular Top Rated Upcoming Now Playing TV Shows Popular Top Rated On TV Airing Today People Popular People Can't find a movie or TV show? Login to create it. en Login Sign Up  ID: 3475   Expand The L Word   (2004) User Score Overview A group of lesbian friends struggle with romance and careers in Los Angeles. Featured Crew Ilene Chaiken Creator Discussions   Reviews Videos   Images   Changes Report Share Discussions General  0 Content Issues  0 Images Backdrops  34 Posters  9 Videos Trailers  0 Teasers  0 Clips  0 Featurettes  0 Opening Credits  0 Top Billed Cast Pam Grier Kit Porter Leisha Hailey Alice Pieszecki Marlee Matlin Jodi Lerner Katherine Moennig Shane McCutcheon Rachel Shelley Helena Peabody Full Cast & Crew Last Season Season 6 2009 | 8 Episodes Season 6 of The L Word premiered on January 18, 2009. View All Seasons Social Reviews  0 Discussions  0 Media Most Popular Videos  0 Backdrops  34 Posters  9 Recommendations   2010-10-12 Lip Service 6.6    2005-06-07 Sugar Rush 7.8    2011-07-27 The Code 6.7    2016-10-12 Nurses Who Kill 7.3    2015-06-12 Conspiracy 5.7    2009-10-14 Alaska State Troopers 7.7    2015-08-25 Fried 6.0    2017-11-05 SMILF 6.7  Facts Status  Cancelled Network Certification 16 Meaning Can be aired only from 10:00pm Uhr to 6:00am. Type  Scripted Original Language  English Runtime  50m Homepage   http://www.sho.com/the-l-word Genres Drama Keywords female friendship lesbian relationship lesbian los angeles lgbt bisexual woman Content Score 100 Yes! Looking good! Top Contributors P 57 Pupsal86 26 Banana 23 Elizabeth Jennings 7 lineker  View Edit History Popularity Trend  Login to edit  URL By  signing up  for an account on TMDb, you can post directly to Twitter and Facebook. You need to be logged in to continue. Click  here  to login or  here  to sign up.    page_wrap opened in html_head  Join the Community The Basics About TMDb Contact Us Support Forums API Blog Get Involved  Contribution Bible 3rd Party Applications Add New Movie Add New TV Show Community Guidelines Leaderboard Forums Twitter Facebook Legal Terms of Use Privacy Policy Login Sign Up"}