{"link": "https://www.themoviedb.org/tv/55715?language=en", "title": "Lantern City", "resume": "We don't have an overview translated in English. Help us expand our database by adding one.", "rate": 80, "genre": ["Sci-Fi", "Fantasy"], "cast": ["John Rhys-Davies", "Raphael Sbarge", "Mira Furlan"], "character": ["Desmond Wilhorn", "Kendal Kornick", "Martha Grey"], "site_data": "html Apps Forums Leaderboard Contribute API Support Discover Movies TV Shows Movies Popular Top Rated Upcoming Now Playing TV Shows Popular Top Rated On TV Airing Today People Popular People Can't find a movie or TV show? Login to create it. en Login Sign Up  ID: 55715   Expand Lantern City   (2016) User Score Overview We don't have an overview translated in English. Help us expand our database by adding one. Featured Crew Bruce Boxleitner Creator Discussions   Reviews Videos   Images   Changes Report Share Discussions General  0 Content Issues  0 Images Backdrops  1 Posters  1 Videos Trailers  0 Teasers  0 Clips  0 Featurettes  0 Opening Credits  0 Top Billed Cast John Rhys-Davies Desmond Wilhorn Raphael Sbarge Kendal Kornick Mira Furlan Martha Grey Full Cast & Crew  Create Episode Social Reviews  0 Discussions  0 Media Most Popular Videos  0 Backdrops  1 Posters  1 Recommendations We don't have enough data to suggest any TV shows based on Lantern City. You can help by rating TV shows you've seen. Facts Status  Returning Series Network Certification TV-PG Meaning This program contains material that parents may find unsuitable for younger children. Type  Scripted Original Language  English Runtime  43m Homepage   http://lanterncitytv.com/ Genres Sci-Fi & Fantasy Keywords steampunk Content Score 64 We're so close, yet so far. Top Contributors B 22 BOB 1 Elizabeth Jennings  View Edit History Popularity Trend  Login to edit  URL By  signing up  for an account on TMDb, you can post directly to Twitter and Facebook. You need to be logged in to continue. Click  here  to login or  here  to sign up.    page_wrap opened in html_head  Join the Community The Basics About TMDb Contact Us Support Forums API Blog Get Involved  Contribution Bible 3rd Party Applications Add New Movie Add New TV Show Community Guidelines Leaderboard Forums Twitter Facebook Legal Terms of Use Privacy Policy Login Sign Up"}