{"link": "https://www.themoviedb.org/tv/73537?language=en", "title": "Jul i Blodfjell", "resume": "A family gathering doesn't go as planned, as one by one is being killed by a mysterious murderer.", "rate": 0, "genre": ["Crime", "Comedy"], "cast": ["Trond Fausa Aurv\u00e5g", "Ine Jansen", "Atle Antonsen", "Kevin V\u00e5genes", "Lene Kongsvik Johansen"], "character": ["Svein Soot", "Nanna Soot", "Toffen Soot", "Siri Soot / Rune Soot / Putti", "Liv Soot"], "site_data": "html Apps Forums Leaderboard Contribute API Support Discover Movies TV Shows Movies Popular Top Rated Upcoming Now Playing TV Shows Popular Top Rated On TV Airing Today People Popular People Can't find a movie or TV show? Login to create it. en Login Sign Up  ID: 73537   Expand Jul i Blodfjell   (2017) User Score Overview A family gathering doesn't go as planned, as one by one is being killed by a mysterious murderer. Featured Crew Kjetil Indregard Creator Christopher Pahle Creator Martin Zimmer Creator Discussions   Reviews Videos   Images   Changes Report Share Discussions General  0 Content Issues  0 Images Backdrops  1 Posters  4 Videos Trailers  0 Teasers  0 Clips  0 Featurettes  0 Opening Credits  0 Top Billed Cast Trond Fausa Aurv\u00e5g Svein Soot Ine Jansen Nanna Soot Atle Antonsen Toffen Soot Kevin V\u00e5genes Siri Soot / Rune Soot / Putti Lene Kongsvik Johansen Liv Soot Full Cast & Crew Current Season Season 1 2017 | 24 Episodes Season 1 of Jul i Blodfjell premiered on December  1, 2017. View All Seasons Social Reviews  0 Discussions  0 Media Most Popular Videos  0 Backdrops  1 Posters  4 Recommendations We don't have enough data to suggest any TV shows based on Jul i Blodfjell. You can help by rating TV shows you've seen. Facts Status  Ended Network Certification TV-PG Meaning This program contains material that parents may find unsuitable for younger children. Type  Scripted Original Language  Norwegian Runtime  12m Homepage  - Genres Crime Comedy Keywords whodunit nordic christmas calendar Content Score 100 Yes! Looking good! Top Contributors 61 Bendik M 18 Mr_Democracy 13 d00ziie S 3 SergeiAK  View Edit History Popularity Trend  Login to edit  URL By  signing up  for an account on TMDb, you can post directly to Twitter and Facebook. You need to be logged in to continue. Click  here  to login or  here  to sign up.    page_wrap opened in html_head  Join the Community The Basics About TMDb Contact Us Support Forums API Blog Get Involved  Contribution Bible 3rd Party Applications Add New Movie Add New TV Show Community Guidelines Leaderboard Forums Twitter Facebook Legal Terms of Use Privacy Policy Login Sign Up"}