{"link": "https://www.themoviedb.org/tv/74385?language=en", "title": "Sofia Flux og det magiske h\u00f8reapparatet", "resume": "We don't have an overview translated in English. Help us expand our database by adding one.", "rate": 0, "genre": ["Kids", "Mystery"], "cast": ["Hedvig Skogli Olsen", "Nils Petter Morland", "Leonard Valestrand Eike", "Jorunn Kjellsby", "Andreas Cappelen"], "character": ["Iben", "Albert"], "site_data": "html Apps Forums Leaderboard Contribute API Support Discover Movies TV Shows Movies Popular Top Rated Upcoming Now Playing TV Shows Popular Top Rated On TV Airing Today People Popular People Can't find a movie or TV show? Login to create it. en Login Sign Up  ID: 74385   Expand Sofia Flux og det magiske h\u00f8reapparatet   (2014) User Score Overview We don't have an overview translated in English. Help us expand our database by adding one. Discussions   Reviews Videos   Images   Changes Report Share Discussions General  0 Content Issues  0 Images Backdrops  2 Posters  1 Videos Trailers  0 Teasers  0 Clips  0 Featurettes  0 Opening Credits  0 Top Billed Cast Hedvig Skogli Olsen Iben Nils Petter Morland Leonard Valestrand Eike Albert Jorunn Kjellsby Andreas Cappelen Full Cast & Crew Last Season Season 1 2014 | 7 Episodes Season 1 of Sofia Flux og det magiske h\u00f8reapparatet premiered on October 19, 2014. View All Seasons Social Reviews  0 Discussions  0 Media Most Popular Videos  0 Backdrops  2 Posters  1 Recommendations We don't have enough data to suggest any TV shows based on Sofia Flux og det magiske h\u00f8reapparatet. You can help by rating TV shows you've seen. Facts Status  Ended Networks Certification 0 Meaning Can be aired at any time. Type  Scripted Original Language  Norwegian Runtime  - Homepage  - Genres Kids Mystery Keywords magic Content Score 79 Pump it up! We're close now. Top Contributors t 36 tmdb45070722 5 Elizabeth Jennings  View Edit History Popularity Trend  Login to edit  URL By  signing up  for an account on TMDb, you can post directly to Twitter and Facebook. You need to be logged in to continue. Click  here  to login or  here  to sign up.    page_wrap opened in html_head  Join the Community The Basics About TMDb Contact Us Support Forums API Blog Get Involved  Contribution Bible 3rd Party Applications Add New Movie Add New TV Show Community Guidelines Leaderboard Forums Twitter Facebook Legal Terms of Use Privacy Policy Login Sign Up"}