{"link": "https://www.themoviedb.org/tv/61535?language=en", "title": "Are You The One?", "resume": "In the most ambitious dating experiment ever attempted, a group of gorgeous single women and guys are put through an extensive and scientific matchmaking process to find their Perfect Match.", "rate": 46, "genre": ["Reality"], "cast": ["Terrence Jenkins", "Audrey Diaz", "Diandra Delgado", "Alexis Eddy", "Geles Rodriguez"], "character": ["Host", "Audrey Diaz", "Diandra Delgado", "Alexis Eddy", "Geles Rodriguez"], "site_data": "html Apps Forums Leaderboard Contribute API Support Discover Movies TV Shows Movies Popular Top Rated Upcoming Now Playing TV Shows Popular Top Rated On TV Airing Today People Popular People Can't find a movie or TV show? Login to create it. en Login Sign Up  ID: 61535   Expand Are You The One?   (2014) User Score Overview In the most ambitious dating experiment ever attempted, a group of gorgeous single women and guys are put through an extensive and scientific matchmaking process to find their Perfect Match. Discussions   Reviews Videos   Images   Changes Report Share Discussions General  2 Content Issues  0 Images Backdrops  6 Posters  2 Videos Trailers  0 Teasers  0 Clips  0 Featurettes  0 Opening Credits  0 Top Billed Cast Terrence Jenkins Host Audrey Diaz Audrey Diaz Diandra Delgado Diandra Delgado Alexis Eddy Alexis Eddy Geles Rodriguez Geles Rodriguez Full Cast & Crew Last Season Season 6 2017 | 14 Episodes View All Seasons Social Reviews  0 Discussions  2 Subject Status Replies Last Reply What is your favorite season? Open 0 by nyxeus\n      \n     I can't believe how stupid the Season 5 cast was... Open 0 by nyxeus\n      \n     Go to Discussions Media Most Popular Videos  0 Backdrops  6 Posters  2 Recommendations   1998-06-01 The Challenge 7.9    2003-05-20 America's Next Top Model 4.5    2000-05-31 Survivor 6.3    2000-07-05 Big Brother 4.4    2014-03-19 The 100 6.4  Facts Status  Returning Series Network Certification TV-14 Meaning This program contains some material that many parents would find unsuitable for children under 14 years of age. Type  Reality Original Language  English Runtime  60m Homepage   http://www.mtv.com/shows/are_you_the_one Genres Reality Keywords dating show Content Score 86 Almost there... Top Contributors 31 Elizabeth Jennings 29 Amanda g 7 gallagher 7 Banana  View Edit History Popularity Trend  Login to edit  URL By  signing up  for an account on TMDb, you can post directly to Twitter and Facebook. You need to be logged in to continue. Click  here  to login or  here  to sign up.    page_wrap opened in html_head  Join the Community The Basics About TMDb Contact Us Support Forums API Blog Get Involved  Contribution Bible 3rd Party Applications Add New Movie Add New TV Show Community Guidelines Leaderboard Forums Twitter Facebook Legal Terms of Use Privacy Policy Login Sign Up"}