{"link": "https://www.themoviedb.org/tv/53050?language=en", "title": "L\u00e4ngtans bl\u00e5a blomma", "resume": "Betty, who dreams of love, refuses to put up with the rules and conventions of the time.", "rate": null, "genre": ["Drama"], "cast": ["Eva R\u00f6se", "Reuben Sallmander", "Marika Lagercrantz", "Hans Alfredson", "Bibi Andersson"], "site_data": "html Apps Forums Leaderboard Contribute API Support Discover Movies TV Shows Movies Popular Top Rated Upcoming Now Playing TV Shows Popular Top Rated On TV Airing Today People Popular People Can't find a movie or TV show? Login to create it. en Login Sign Up  ID: 53050   Expand L\u00e4ngtans bl\u00e5a blomma   (1998) User Score Overview Betty, who dreams of love, refuses to put up with the rules and conventions of the time. Discussions   Reviews Videos   Images   Changes Report Share Discussions General  0 Content Issues  0 Images Backdrops  0 Posters  1 Videos Trailers  0 Teasers  0 Clips  0 Featurettes  0 Opening Credits  0 Top Billed Cast Eva R\u00f6se Beata 'Betty' Tollman Reuben Sallmander Claes Ekencrona Marika Lagercrantz Ulrika Marelius Hans Alfredson Uncle Sch\u00f6ndorff Bibi Andersson Mrs. Tidr\u00e9n Full Cast & Crew Last Season Season 1 1998 | 4 Episodes Season 1 of L\u00e4ngtans bl\u00e5a blomma premiered on October 12, 1998. View All Seasons Social Reviews  0 Discussions  0 Media Most Popular Videos  0 Backdrops  0 Posters  1 Recommendations We don't have enough data to suggest any TV shows based on L\u00e4ngtans bl\u00e5a blomma. You can help by rating TV shows you've seen. Facts Status  Ended Networks - Certification  - Type  Miniseries Original Language  English Runtime  220m Homepage  - Genres Drama Keywords based on novel or book forbidden love costume drama Content Score 71 Just a little bit more... Top Contributors n 33 nicovicen CM 4 Cherche Moi VA 3 Viktor Andersson  View Edit History Popularity Trend  Login to edit  URL By  signing up  for an account on TMDb, you can post directly to Twitter and Facebook. You need to be logged in to continue. Click  here  to login or  here  to sign up.    page_wrap opened in html_head  Join the Community The Basics About TMDb Contact Us Support Forums API Blog Get Involved  Contribution Bible 3rd Party Applications Add New Movie Add New TV Show Community Guidelines Leaderboard Forums Twitter Facebook Legal Terms of Use Privacy Policy Login Sign Up", "character": ["Beata 'Betty' Tollman", "Claes Ekencrona", "Ulrika Marelius", "Uncle Sch\u00f6ndorff", "Mrs. Tidr\u00e9n"]}