{"link": "https://www.themoviedb.org/tv/72625?language=en", "title": "Seven Deadly Sins", "resume": "A sheriff uncovers dark secrets when the daughter of her lover becomes a murder suspect. Based on the novels by Robin Wasserman.", "rate": 53, "genre": ["Drama"], "cast": ["Kirsten Zien", "Dreama Walker", "Jared Keeso", "Rachel Melvin", "Ty Olsson"], "character": ["Miranda Stevens", "Harper Grace", "Adam Morgan", "Kaia Sellars", "Hank Grace"], "site_data": "html Apps Forums Leaderboard Contribute API Support Discover Movies TV Shows Movies Popular Top Rated Upcoming Now Playing TV Shows Popular Top Rated On TV Airing Today People Popular People Can't find a movie or TV show? Login to create it. en Login Sign Up  ID: 72625   Expand Seven Deadly Sins   (2010) User Score Overview A sheriff uncovers dark secrets when the daughter of her lover becomes a murder suspect. Based on the novels by Robin Wasserman. Discussions   Reviews Videos   Images   Changes Report Share Discussions General  0 Content Issues  0 Images Backdrops  0 Posters  2 Videos Trailers  0 Teasers  0 Clips  0 Featurettes  0 Opening Credits  0 Top Billed Cast Kirsten Zien Miranda Stevens Dreama Walker Harper Grace Jared Keeso Adam Morgan Rachel Melvin Kaia Sellars Ty Olsson Hank Grace Full Cast & Crew Last Season Miniseries 2010 | 2 Episodes Season 1 of Seven Deadly Sins premiered on May 23, 2010. View All Seasons Social Reviews  0 Discussions  0 Media Most Popular Videos  0 Backdrops  0 Posters  2 Recommendations We don't have enough data to suggest any TV shows based on Seven Deadly Sins. You can help by rating TV shows you've seen. Facts Status  Ended Network Certification  - Type  Miniseries Original Language  English Runtime  120m Homepage  - Genres Drama Keywords miniseries Content Score 79 Pump it up! We're close now. Top Contributors i 17 ismax935 t 11 tmdb59661364 11 Elizabeth Jennings TB 8 TMDb Bot  View Edit History Popularity Trend  Login to edit  URL By  signing up  for an account on TMDb, you can post directly to Twitter and Facebook. You need to be logged in to continue. Click  here  to login or  here  to sign up.    page_wrap opened in html_head  Join the Community The Basics About TMDb Contact Us Support Forums API Blog Get Involved  Contribution Bible 3rd Party Applications Add New Movie Add New TV Show Community Guidelines Leaderboard Forums Twitter Facebook Legal Terms of Use Privacy Policy Login Sign Up"}