{"link": "https://www.themoviedb.org/tv/79370?language=en", "title": "UFO Seekers", "resume": "A couple search for ufo's", "rate": 100, "genre": ["Documentary"], "cast": ["Tracey Sue", "Tim Doyle"], "character": ["Herself", "Himself"], "site_data": "html Apps Forums Leaderboard Contribute API Support Discover Movies TV Shows Movies Popular Top Rated Upcoming Now Playing TV Shows Popular Top Rated On TV Airing Today People Popular People Can't find a movie or TV show? Login to create it. en Login Sign Up  ID: 79370   Expand UFO Seekers   (2016) User Score Overview A couple search for ufo's Discussions   Reviews Videos   Images   Changes Report Share Discussions General  0 Content Issues  0 Images Backdrops  0 Posters  1 Videos Trailers  0 Teasers  1 Clips  0 Featurettes  0 Opening Credits  0 Top Billed Cast Tracey Sue Herself Tim Doyle Himself Full Cast & Crew Last Season Season 2 \u2014 | 1 Episode We don't have an overview translated in English. Help us expand our database by adding one. View All Seasons Social Reviews  0 Discussions  0 Media Most Popular Videos  1 Backdrops  0 Posters  1 Recommendations We don't have enough data to suggest any TV shows based on UFO Seekers. You can help by rating TV shows you've seen. Facts Status  Returning Series Network Certification  - Type  Scripted Original Language  English Runtime  - Homepage   http://ufoseekers.com Genres Documentary Keywords ufo area 51 Content Score 50 Still needs a little work. Top Contributors 18 amian123  View Edit History Popularity Trend  Login to edit  URL By  signing up  for an account on TMDb, you can post directly to Twitter and Facebook. You need to be logged in to continue. Click  here  to login or  here  to sign up.    page_wrap opened in html_head  Join the Community The Basics About TMDb Contact Us Support Forums API Blog Get Involved  Contribution Bible 3rd Party Applications Add New Movie Add New TV Show Community Guidelines Leaderboard Forums Twitter Facebook Legal Terms of Use Privacy Policy Login Sign Up"}