{"link": "https://www.themoviedb.org/tv/35460?language=en", "title": "Cobra the Animation: Time Drive", "resume": "Lady has disappeared so Cobra must dive into her past to save her. This is the story of who Lady used to be and how she got that metal body.", "rate": 85, "genre": ["Action", "Adventure", "Animation", "Sci-Fi", "Fantasy"], "cast": ["Nachi Nozawa", "Yoshiko Sakakibara", "Maaya Sakamoto", "Mayumi Yamaguchi"], "character": ["Cobra", "Armaroid Lady", "Secret", "Black Bone"], "site_data": "html Apps Forums Leaderboard Contribute API Support Discover Movies TV Shows Movies Popular Top Rated Upcoming Now Playing TV Shows Popular Top Rated On TV Airing Today People Popular People Can't find a movie or TV show? Login to create it. en Login Sign Up  ID: 35460   Expand Cobra the Animation: Time Drive   (2010) User Score Overview Lady has disappeared so Cobra must dive into her past to save her. This is the story of who Lady used to be and how she got that metal body. Featured Crew Buichi Terasawa Creator Discussions   Reviews Videos   Images   Changes Report Share Discussions General  0 Content Issues  0 Images Backdrops  3 Posters  1 Videos Trailers  0 Teasers  0 Clips  0 Featurettes  0 Opening Credits  0 Top Billed Cast Nachi Nozawa Cobra Yoshiko Sakakibara Armaroid Lady Maaya Sakamoto Secret Mayumi Yamaguchi Black Bone Full Cast & Crew Last Season Season 1 2010 | 13 Episodes Season 1 of Cobra the Animation: Time Drive premiered on January  2, 2010. View All Seasons Social Reviews  0 Discussions  0 Media Most Popular Videos  0 Backdrops  3 Posters  1 Recommendations We don't have enough data to suggest any TV shows based on Cobra the Animation: Time Drive. You can help by rating TV shows you've seen. Facts Original Name  COBRA THE ANIMATION \u30bf\u30a4\u30e0\u30fb\u30c9\u30e9\u30a4\u30d6 Status  Ended Network Certification  - Type  Scripted Original Language  Japanese Runtime  24m Homepage  - Genres Action & Adventure Animation Sci-Fi & Fantasy Keywords No keywords have been added. Content Score 93 Almost there... Top Contributors 29 kappa-papa 10 Elizabeth Jennings 8 guitsou 8 Jenazad  View Edit History Popularity Trend  Login to edit  URL By  signing up  for an account on TMDb, you can post directly to Twitter and Facebook. You need to be logged in to continue. Click  here  to login or  here  to sign up.    page_wrap opened in html_head  Join the Community The Basics About TMDb Contact Us Support Forums API Blog Get Involved  Contribution Bible 3rd Party Applications Add New Movie Add New TV Show Community Guidelines Leaderboard Forums Twitter Facebook Legal Terms of Use Privacy Policy Login Sign Up"}