{"link": "https://www.themoviedb.org/tv/5973?language=en", "title": "Robert Kennedy & His Times", "resume": "Robert Kennedy & His Times is a 1985 American television miniseries directed by Marvin J. Chomsky. The miniseries was released in three parts and depicts the life of Robert F. Kennedy.", "rate": 60, "genre": ["Drama"], "cast": ["Mitchell Ryan", "Joe Pantoliano", "Jeffrey Tambor", "Jack Warden", "River Phoenix"], "character": ["Robert McNamara", "Roy Cohn", "Pierre Salinger", "Joseph Kennedy Sr.", "Robert Kennedy Jr."], "site_data": "html Apps Forums Leaderboard Contribute API Support Discover Movies TV Shows Movies Popular Top Rated Upcoming Now Playing TV Shows Popular Top Rated On TV Airing Today People Popular People Can't find a movie or TV show? Login to create it. en Login Sign Up  ID: 5973   Expand Robert Kennedy & His Times   (1985) User Score Overview Robert Kennedy & His Times is a 1985 American television miniseries directed by Marvin J. Chomsky. The miniseries was released in three parts and depicts the life of Robert F. Kennedy. Discussions   Reviews Videos   Images   Changes Report Share Discussions General  0 Content Issues  0 Images Backdrops  0 Posters  1 Videos Trailers  0 Teasers  0 Clips  0 Featurettes  0 Opening Credits  0 Top Billed Cast Mitchell Ryan Robert McNamara Joe Pantoliano Roy Cohn Jeffrey Tambor Pierre Salinger Jack Warden Joseph Kennedy Sr. River Phoenix Robert Kennedy Jr. Full Cast & Crew Last Season Season 1 1985 | 3 Episodes Season 1 of Robert Kennedy & His Times premiered on January 27, 1985. View All Seasons Social Reviews  0 Discussions  0 Media Most Popular Videos  0 Backdrops  0 Posters  1 Recommendations We don't have enough data to suggest any TV shows based on Robert Kennedy & His Times. You can help by rating TV shows you've seen. Facts Status  Ended Network Certification  - Type  Scripted Original Language  English Runtime  420m Homepage  - Genres Drama Keywords politics miniseries kennedy family usa politics Content Score 71 Just a little bit more... Top Contributors 13 Banana TB 12 TMDb Bot  View Edit History Popularity Trend  Login to edit  URL By  signing up  for an account on TMDb, you can post directly to Twitter and Facebook. You need to be logged in to continue. Click  here  to login or  here  to sign up.    page_wrap opened in html_head  Join the Community The Basics About TMDb Contact Us Support Forums API Blog Get Involved  Contribution Bible 3rd Party Applications Add New Movie Add New TV Show Community Guidelines Leaderboard Forums Twitter Facebook Legal Terms of Use Privacy Policy Login Sign Up"}