{"link": "https://www.themoviedb.org/tv/63230?language=en", "title": "Prvn\u00ed republika", "resume": "We don't have an overview translated in English. Help us expand our database by adding one.", "rate": null, "genre": ["Drama", "Family"], "cast": ["J\u00e1n Kolen\u00edk", "Mark\u00e9ta Pl\u00e1nkov\u00e1-\u010castvaj", "Ji\u0159\u00ed Vyor\u00e1lek", "Jan Vlas\u00e1k", "Robert Urban"], "site_data": "html Apps Forums Leaderboard Contribute API Support Discover Movies TV Shows Movies Popular Top Rated Upcoming Now Playing TV Shows Popular Top Rated On TV Airing Today People Popular People Can't find a movie or TV show? Login to create it. en Login Sign Up  ID: 63230   Expand Prvn\u00ed republika   (2014) User Score Overview We don't have an overview translated in English. Help us expand our database by adding one. Discussions   Reviews Videos   Images   Changes Report Share Discussions General  0 Content Issues  0 Images Backdrops  1 Posters  1 Videos Trailers  0 Teasers  0 Clips  0 Featurettes  0 Opening Credits  0 Top Billed Cast J\u00e1n Kolen\u00edk Vladim\u00edr Valenta Mark\u00e9ta Pl\u00e1nkov\u00e1-\u010castvaj Kl\u00e1ra Valentov\u00e1 Ji\u0159\u00ed Vyor\u00e1lek Jaroslav Valenta Jan Vlas\u00e1k Alois Valenta Robert Urban Fredy Valenta Full Cast & Crew Last Season Season 2 2017 | 13 Episodes Season 2 of Prvn\u00ed republika premiered on September  8, 2017. View All Seasons Social Reviews  0 Discussions  0 Media Most Popular Videos  0 Backdrops  1 Posters  1 Recommendations We don't have enough data to suggest any TV shows based on Prvn\u00ed republika. You can help by rating TV shows you've seen. Facts Status  Returning Series Network Certification  - Type  Scripted Original Language  Czech Runtime  50m Homepage  - Genres Drama Family Keywords No keywords have been added. Content Score 79 Pump it up! We're close now. Top Contributors b 22 brkulin p 4 porubcovalaura 5 3 5lucina5 2 Elizabeth Jennings  View Edit History Popularity Trend  Login to edit  URL By  signing up  for an account on TMDb, you can post directly to Twitter and Facebook. You need to be logged in to continue. Click  here  to login or  here  to sign up.    page_wrap opened in html_head  Join the Community The Basics About TMDb Contact Us Support Forums API Blog Get Involved  Contribution Bible 3rd Party Applications Add New Movie Add New TV Show Community Guidelines Leaderboard Forums Twitter Facebook Legal Terms of Use Privacy Policy Login Sign Up", "character": ["Vladim\u00edr Valenta", "Kl\u00e1ra Valentov\u00e1", "Jaroslav Valenta", "Alois Valenta", "Fredy Valenta"]}