{"link": "https://www.themoviedb.org/tv/77652?language=en", "title": "Crown of the Kings", "resume": "Follows the story of Casimir III the Great, the last king of Poland from the Piast Dynasty. In the background: love, intrigue and difficult relationships between the members of the royal family.", "rate": 0, "genre": ["Drama"], "cast": ["Mateusz Kr\u00f3l", "Marta Bry\u0142a", "Wies\u0142aw W\u00f3jcik", "Jakub Maz", "Halina \u0141abonarska"], "character": ["Kazmierz Wielki", "Aldona Anna Giedymin\u00f3wna", "W\u0142adys\u0142aw \u0141okietek", "Kiejstut Giedyminowicz", "Jadwiga Boles\u0142aw\u00f3wna"], "site_data": "html Apps Forums Leaderboard Contribute API Support Discover Movies TV Shows Movies Popular Top Rated Upcoming Now Playing TV Shows Popular Top Rated On TV Airing Today People Popular People Can't find a movie or TV show? Login to create it. en Login Sign Up  ID: 77652   Expand Crown of the Kings   (2018) User Score  Play Trailer Overview Follows the story of Casimir III the Great, the last king of Poland from the Piast Dynasty. In the background: love, intrigue and difficult relationships between the members of the royal family. Discussions   Reviews Videos   Images   Changes Report Share Discussions General  0 Content Issues  0 Images Backdrops  1 Posters  1 Videos Trailers  1 Teasers  0 Clips  0 Featurettes  0 Opening Credits  0 Top Billed Cast Mateusz Kr\u00f3l Kazmierz Wielki Marta Bry\u0142a Aldona Anna Giedymin\u00f3wna Wies\u0142aw W\u00f3jcik W\u0142adys\u0142aw \u0141okietek Jakub Maz Kiejstut Giedyminowicz Halina \u0141abonarska Jadwiga Boles\u0142aw\u00f3wna Full Cast & Crew Current Season Season 1 2018 | 2 Episodes Season 1 of Crown of the Kings premiered on January  1, 2018. View All Seasons Social Reviews  0 Discussions  0 Media Most Popular Videos  1 Backdrops  1 Posters  1 Recommendations We don't have enough data to suggest any TV shows based on Crown of the Kings. You can help by rating TV shows you've seen. Facts Original Name  Korona Kr\u00f3l\u00f3w Status  Returning Series Network Certification  - Type  Scripted Original Language  Polish Runtime  25m Homepage   https://vod.tvp.pl/website/korona-krolow,34807622 Genres Drama Keywords No keywords have been added. Content Score 93 Almost there... Top Contributors j 32 janniepodam 2 Banana 1 lifely TB 1 TMDb Bot  View Edit History Popularity Trend  Login to edit  URL By  signing up  for an account on TMDb, you can post directly to Twitter and Facebook. You need to be logged in to continue. Click  here  to login or  here  to sign up.    page_wrap opened in html_head  Join the Community The Basics About TMDb Contact Us Support Forums API Blog Get Involved  Contribution Bible 3rd Party Applications Add New Movie Add New TV Show Community Guidelines Leaderboard Forums Twitter Facebook Legal Terms of Use Privacy Policy Login Sign Up"}