{"link": "https://www.themoviedb.org/tv/69929?language=en", "title": "The Universe\u2019s Star", "resume": "It\u2019s about a love story between a gifted singer-songwriter Woo Joo (Soo Ho) and Byul (Ji Woo), a 19 years old student who turned into a grim reaper after dying from an accident.", "rate": 85, "genre": ["Drama", "Comedy"], "cast": ["Soo-Ho", "Ji-Woo", "Na Hae-ryung", "Shin Hyun-Soo", "Yoon Jin-Sol"], "character": ["Woo-Joo", "Byul", "Yeon So-Ri", "Koo Se-Joo", "Gakshi"], "site_data": "html Apps Forums Leaderboard Contribute API Support Discover Movies TV Shows Movies Popular Top Rated Upcoming Now Playing TV Shows Popular Top Rated On TV Airing Today People Popular People Can't find a movie or TV show? Login to create it. en Login Sign Up  ID: 69929   Expand The Universe\u2019s Star   (2017) User Score Overview It\u2019s about a love story between a gifted singer-songwriter Woo Joo (Soo Ho) and Byul (Ji Woo), a 19 years old student who turned into a grim reaper after dying from an accident. Discussions   Reviews Videos   Images   Changes Report Share Discussions General  0 Content Issues  0 Images Backdrops  1 Posters  2 Videos Trailers  0 Teasers  0 Clips  0 Featurettes  0 Opening Credits  0 Top Billed Cast Soo-Ho Woo-Joo Ji-Woo Byul Na Hae-ryung Yeon So-Ri Shin Hyun-Soo Koo Se-Joo Yoon Jin-Sol Gakshi Full Cast & Crew Last Season Season 1 2017 | 6 Episodes Season 1 of The Universe\u2019s Star premiered on January 26, 2017. View All Seasons Social Reviews  0 Discussions  0 Media Most Popular Videos  0 Backdrops  1 Posters  2 Recommendations We don't have enough data to suggest any TV shows based on The Universe\u2019s Star. You can help by rating TV shows you've seen. Facts Status  Planned Networks - Certification  - Type  Scripted Original Language  Korean Runtime  - Homepage  - Genres Drama Comedy Keywords No keywords have been added. Content Score 93 Almost there... Top Contributors 11 mp4soju 5 camil2312 V 4 Violsa c 4 creativo  View Edit History Popularity Trend  Login to edit  URL By  signing up  for an account on TMDb, you can post directly to Twitter and Facebook. You need to be logged in to continue. Click  here  to login or  here  to sign up.    page_wrap opened in html_head  Join the Community The Basics About TMDb Contact Us Support Forums API Blog Get Involved  Contribution Bible 3rd Party Applications Add New Movie Add New TV Show Community Guidelines Leaderboard Forums Twitter Facebook Legal Terms of Use Privacy Policy Login Sign Up"}