{"link": "https://www.themoviedb.org/tv/72441?language=en", "title": "\u0414\u043e\u044f\u0440\u043a\u0430 \u0438\u0437 \u0425\u0430\u0446\u0430\u043f\u0435\u0442\u043e\u0432\u043a\u0438", "resume": "We don't have an overview translated in English. Help us expand our database by adding one.", "rate": 0, "genre": ["Drama", "Family"], "cast": ["Evgeniya Osipova", "Natalya Kalatay", "Tatyana Nazarova", "Vladimir Sterzhakov"], "character": ["Katya", "Dasha Bulychova", "Dmitry's mother", "Dmitry's father"], "site_data": "html Apps Forums Leaderboard Contribute API Support Discover Movies TV Shows Movies Popular Top Rated Upcoming Now Playing TV Shows Popular Top Rated On TV Airing Today People Popular People Can't find a movie or TV show? Login to create it. en Login Sign Up  ID: 72441   Expand \u0414\u043e\u044f\u0440\u043a\u0430 \u0438\u0437 \u0425\u0430\u0446\u0430\u043f\u0435\u0442\u043e\u0432\u043a\u0438   (2006) User Score Overview We don't have an overview translated in English. Help us expand our database by adding one. Featured Crew Tatyana Gnedash Creator Discussions   Reviews Videos   Images   Changes Report Share Discussions General  0 Content Issues  0 Images Backdrops  0 Posters  1 Videos Trailers  0 Teasers  0 Clips  0 Featurettes  0 Opening Credits  0 Top Billed Cast Evgeniya Osipova Katya Natalya Kalatay Dasha Bulychova Tatyana Nazarova Dmitry's mother Vladimir Sterzhakov Dmitry's father Full Cast & Crew Last Season Season 3 2011 | 16 Episodes Season 3 of \u0414\u043e\u044f\u0440\u043a\u0430 \u0438\u0437 \u0425\u0430\u0446\u0430\u043f\u0435\u0442\u043e\u0432\u043a\u0438 premiered on July 25, 2011. View All Seasons Social Reviews  0 Discussions  0 Media Most Popular Videos  0 Backdrops  0 Posters  1 Recommendations We don't have enough data to suggest any TV shows based on \u0414\u043e\u044f\u0440\u043a\u0430 \u0438\u0437 \u0425\u0430\u0446\u0430\u043f\u0435\u0442\u043e\u0432\u043a\u0438. You can help by rating TV shows you've seen. Facts Status  Ended Networks - Certification 12+ Meaning Only kids the age of 12 or older can watch. Type  Scripted Original Language  Russian Runtime  176m Homepage  - Genres Drama Family Keywords No keywords have been added. Content Score 71 Just a little bit more... Top Contributors 63 StrannikM  View Edit History Popularity Trend  Login to edit  URL By  signing up  for an account on TMDb, you can post directly to Twitter and Facebook. You need to be logged in to continue. Click  here  to login or  here  to sign up.    page_wrap opened in html_head  Join the Community The Basics About TMDb Contact Us Support Forums API Blog Get Involved  Contribution Bible 3rd Party Applications Add New Movie Add New TV Show Community Guidelines Leaderboard Forums Twitter Facebook Legal Terms of Use Privacy Policy Login Sign Up"}