{"link": "https://www.themoviedb.org/tv/79732?language=en", "title": "She-Ra and the Princesses of Power", "resume": "In this reboot of the '80s series, a magic sword transforms an orphan girl into warrior She-Ra, who unites a rebellion to fight against evil.", "rate": 0, "genre": ["Animation", "Kids"], "cast": ["Aimee Carrero", "Karen Fukuhara", "AJ Michalka", "Marcus Scribner", "Reshma Shetty"], "character": ["Adora / She-Ra (voice)", "Glimmer (voice)", "Catra (voice)", "Bow (voice)", "Angella (voice)"], "site_data": "html Apps Forums Leaderboard Contribute API Support Discover Movies TV Shows Movies Popular Top Rated Upcoming Now Playing TV Shows Popular Top Rated On TV Airing Today People Popular People Can't find a movie or TV show? Login to create it. en Login Sign Up  ID: 79732   Expand She-Ra and the Princesses of Power   (2018) User Score Overview In this reboot of the '80s series, a magic sword transforms an orphan girl into warrior She-Ra, who unites a rebellion to fight against evil. Discussions   Reviews Videos   Images   Changes Report Share Discussions General  0 Content Issues  0 Images Backdrops  2 Posters  1 Videos Trailers  0 Teasers  0 Clips  0 Featurettes  0 Opening Credits  0 Top Billed Cast Aimee Carrero Adora / She-Ra (voice) Karen Fukuhara Glimmer (voice) AJ Michalka Catra (voice) Marcus Scribner Bow (voice) Reshma Shetty Angella (voice) Full Cast & Crew  Create Episode Social Reviews  0 Discussions  0 Media Most Popular Videos  0 Backdrops  2 Posters  1 Facts Status  In Production Network Certification TV-Y7 Meaning This program is designed for children age 7 and above. Type  Scripted Original Language  English Runtime  - Homepage   https://www.netflix.com/title/80179762 Genres Animation Kids Keywords No keywords have been added. Content Score 86 Almost there... Top Contributors 32 Elizabeth Jennings  View Edit History Popularity Trend  Login to edit  URL By  signing up  for an account on TMDb, you can post directly to Twitter and Facebook. You need to be logged in to continue. Click  here  to login or  here  to sign up.    page_wrap opened in html_head  Join the Community The Basics About TMDb Contact Us Support Forums API Blog Get Involved  Contribution Bible 3rd Party Applications Add New Movie Add New TV Show Community Guidelines Leaderboard Forums Twitter Facebook Legal Terms of Use Privacy Policy Login Sign Up"}