{"link": "https://www.themoviedb.org/tv/5325?language=en", "title": "Army Wives", "resume": "Army Wives is an American drama series that follows the lives of four army wives, one army husband, and their families.", "rate": 59, "genre": ["Drama"], "cast": ["Brian McNamara", "Sterling K. Brown", "Catherine Bell", "Sally Pressman", "Wendy Davis"], "character": ["Michael Holden", "Roland Burton", "Denise Sherwood", "Roxy LeBlanc", "Joan Burton"], "site_data": "html Apps Forums Leaderboard Contribute API Support Discover Movies TV Shows Movies Popular Top Rated Upcoming Now Playing TV Shows Popular Top Rated On TV Airing Today People Popular People Can't find a movie or TV show? Login to create it. en Login Sign Up  ID: 5325   Expand Army Wives   (2007) User Score  Play Trailer Overview Army Wives is an American drama series that follows the lives of four army wives, one army husband, and their families. Featured Crew Katherine Fugate Creator Discussions   Reviews Videos   Images   Changes Report Share Discussions General  0 Content Issues  19 Images Backdrops  16 Posters  14 Videos Trailers  1 Teasers  0 Clips  0 Featurettes  0 Opening Credits  0 Top Billed Cast Brian McNamara Michael Holden Sterling K. Brown Roland Burton Catherine Bell Denise Sherwood Sally Pressman Roxy LeBlanc Wendy Davis Joan Burton Full Cast & Crew Last Season Season 7 2013 | 13 Episodes Season 7 of Army Wives premiered on March 10, 2013. View All Seasons Social Reviews  0 Discussions  7 Subject Status Replies Last Reply There are no discussions for Army Wives. Login to be first! Go to Discussions Media Most Popular Videos  1 Backdrops  16 Posters  14 Recommendations   1974-09-07 Land of the Lost 6.9  Facts Status  Ended Network Certification  - Type  Scripted Original Language  English Runtime  60m Homepage   http://www.mylifetime.com/shows/army-wives Genres Drama Keywords No keywords have been added. Content Score 100 Yes! Looking good! Top Contributors 33 Travis Bell 15 rantamplan 10 niqo19 s 3 speedycars  View Edit History Popularity Trend  Login to edit  URL By  signing up  for an account on TMDb, you can post directly to Twitter and Facebook. You need to be logged in to continue. Click  here  to login or  here  to sign up.    page_wrap opened in html_head  Join the Community The Basics About TMDb Contact Us Support Forums API Blog Get Involved  Contribution Bible 3rd Party Applications Add New Movie Add New TV Show Community Guidelines Leaderboard Forums Twitter Facebook Legal Terms of Use Privacy Policy Login Sign Up"}