{"link": "https://www.themoviedb.org/tv/61845?language=en", "title": "He and His Sons", "resume": "We don't have an overview translated in English. Help us expand our database by adding one.", "rate": 0, "genre": ["Family", "Drama"], "cast": ["Zhang Guoli", "Ren\u00e9 Liu"], "character": ["\u7f57\u5efa\u519b", "\u6c5f\u6b23"], "site_data": "html Apps Forums Leaderboard Contribute API Support Discover Movies TV Shows Movies Popular Top Rated Upcoming Now Playing TV Shows Popular Top Rated On TV Airing Today People Popular People Can't find a movie or TV show? Login to create it. en Login Sign Up  ID: 61845   Expand He and His Sons   (2014) User Score Overview We don't have an overview translated in English. Help us expand our database by adding one. Featured Crew Zhang Guoli Creator Ren\u00e9 Liu Creator Discussions   Reviews Videos   Images   Changes Report Share Discussions General  0 Content Issues  0 Images Backdrops  1 Posters  1 Videos Trailers  0 Teasers  0 Clips  0 Featurettes  0 Opening Credits  0 Top Billed Cast Zhang Guoli \u7f57\u5efa\u519b Ren\u00e9 Liu \u6c5f\u6b23 Full Cast & Crew Last Season Season 1 2014 | 35 Episodes Season 1 of He and His Sons premiered on October 13, 2014. View All Seasons Social Reviews  0 Discussions  0 Media Most Popular Videos  0 Backdrops  1 Posters  1 Recommendations We don't have enough data to suggest any TV shows based on He and His Sons. You can help by rating TV shows you've seen. Facts Original Name  \u534a\u8def\u7236\u5b50 Status  Ended Networks - Certification  - Type  Scripted Original Language  Chinese Runtime  - Homepage  - Genres Family Drama Keywords No keywords have been added. Content Score 56 We're so close, yet so far. Top Contributors l 20 liuruizhi614 z 3 zurman1 3 Elizabeth Jennings m 2 mario  View Edit History Popularity Trend  Login to edit  URL By  signing up  for an account on TMDb, you can post directly to Twitter and Facebook. You need to be logged in to continue. Click  here  to login or  here  to sign up.    page_wrap opened in html_head  Join the Community The Basics About TMDb Contact Us Support Forums API Blog Get Involved  Contribution Bible 3rd Party Applications Add New Movie Add New TV Show Community Guidelines Leaderboard Forums Twitter Facebook Legal Terms of Use Privacy Policy Login Sign Up"}