{"link": "https://www.themoviedb.org/tv/33217?language=en", "title": "Young Justice", "resume": "Teenage superheroes strive to prove themselves as members of the Justice League.", "rate": null, "genre": ["Action", "Adventure", "Animation"], "cast": ["Danica McKellar", "Jesse McCartney", "Jason Spisak", "Khary Payton", "Nolan North"], "site_data": "html Apps Forums Leaderboard Contribute API Support Discover Movies TV Shows Movies Popular Top Rated Upcoming Now Playing TV Shows Popular Top Rated On TV Airing Today People Popular People Can't find a movie or TV show? Login to create it. en Login Sign Up  ID: 33217   Expand Young Justice   (2010) User Score  Play Trailer Overview Teenage superheroes strive to prove themselves as members of the Justice League. Featured Crew Greg Weisman Creator Brandon Vietti Creator Discussions   Reviews Videos   Images   Changes Report Share Discussions General  0 Content Issues  0 Images Backdrops  11 Posters  10 Videos Trailers  1 Teasers  0 Clips  0 Featurettes  0 Opening Credits  0 Top Billed Cast Danica McKellar M'gaan M'orzz / Miss Martian (voice) Jesse McCartney Dick Grayson / Robin / Nightwing (voice) Jason Spisak Wally West / Kid Flash (voice) Khary Payton Kaldur'ahm / Aqualad (voice) Nolan North Conner Kent / Superboy (voice) Full Cast & Crew Last Season Season 2 2012 | 20 Episodes View All Seasons Social Reviews  0 Discussions  0 Media Most Popular Videos  1 Backdrops  11 Posters  10 Recommendations   2011-11-11 Green Lantern: The Animated Series 7.2    2008-03-08 The Spectacular Spider-Man 7.4    2001-11-17 Justice League 8.2    2003-07-19 Teen Titans 7.6    1999-01-10 Batman Beyond 7.8    2012-04-01 Marvel's Ultimate Spider-Man 6.6    2010-09-22 The Avengers: Earth's Mightiest Heroes 7.5    2009-01-23 Wolverine and the X-Men 7.0  Facts Status  Returning Series Networks Certification TV-PG Meaning This program contains material that parents may find unsuitable for younger children. Type  Scripted Original Language  English Runtime  22m Homepage   http://www.cartoonnetwork.com/tv_shows/youngjustice/index.html Genres Action & Adventure Animation Keywords dc comics superhero based on comic superhero team teen superhero Content Score 100 Yes! Looking good! Top Contributors R 29 Rebecca b 8 blaked 7 Andr\u00e9 Gama 7 Maikkoum  View Edit History Popularity Trend  Login to edit  URL By  signing up  for an account on TMDb, you can post directly to Twitter and Facebook. You need to be logged in to continue. Click  here  to login or  here  to sign up.    page_wrap opened in html_head  Join the Community The Basics About TMDb Contact Us Support Forums API Blog Get Involved  Contribution Bible 3rd Party Applications Add New Movie Add New TV Show Community Guidelines Leaderboard Forums Twitter Facebook Legal Terms of Use Privacy Policy Login Sign Up", "character": ["M'gaan M'orzz / Miss Martian (voice)", "Dick Grayson / Robin / Nightwing (voice)", "Wally West / Kid Flash (voice)", "Kaldur'ahm / Aqualad (voice)", "Conner Kent / Superboy (voice)"]}