{"link": "https://www.themoviedb.org/tv/68051?language=en", "title": "Pregau", "resume": "A policeman gets into a spiral of events, in which assault, extortion and murder are proven means.", "rate": 73, "genre": ["Drama", "Crime"], "cast": ["Maximilian Br\u00fcckner", "Ursula Strauss", "Antonia Jung", "Wolfgang B\u00f6ck", "Karl Fischer"], "character": ["Hannes Bucher", "Maria Bucher", "Sandra Bucher", "Johann Hartmann", "Elias Hartmann"], "site_data": "html Apps Forums Leaderboard Contribute API Support Discover Movies TV Shows Movies Popular Top Rated Upcoming Now Playing TV Shows Popular Top Rated On TV Airing Today People Popular People Can't find a movie or TV show? Login to create it. en Login Sign Up  ID: 68051   Expand Pregau   (2016) User Score Overview A policeman gets into a spiral of events, in which assault, extortion and murder are proven means. Featured Crew Nils Willbrandt Creator Discussions   Reviews Videos   Images   Changes Report Share Discussions General  0 Content Issues  1 Images Backdrops  16 Posters  3 Videos Trailers  0 Teasers  0 Clips  0 Featurettes  0 Opening Credits  0 Top Billed Cast Maximilian Br\u00fcckner Hannes Bucher Ursula Strauss Maria Bucher Antonia Jung Sandra Bucher Wolfgang B\u00f6ck Johann Hartmann Karl Fischer Elias Hartmann Full Cast & Crew Last Season Miniseries 2016 | 4 Episodes Season 1 of Pregau premiered on September 26, 2016. View All Seasons Social Reviews  0 Discussions  1 Subject Status Replies Last Reply There are no discussions for Pregau. Login to be first! Go to Discussions Media Most Popular Videos  0 Backdrops  16 Posters  3 Recommendations We don't have enough data to suggest any TV shows based on Pregau. You can help by rating TV shows you've seen. Facts Original Name  Pregau \u2013 Kein Weg zur\u00fcck Status  Ended Network Certification  - Type  Miniseries Original Language  German Runtime  90m Homepage   http://monafilm.tv/movie/pregau Genres Drama Crime Keywords miniseries Content Score 100 Yes! Looking good! Top Contributors md 59 movie dino S 42 Samara R 14 Rebecca S 10 SSSchnorcher  View Edit History Popularity Trend  Login to edit  URL By  signing up  for an account on TMDb, you can post directly to Twitter and Facebook. You need to be logged in to continue. Click  here  to login or  here  to sign up.    page_wrap opened in html_head  Join the Community The Basics About TMDb Contact Us Support Forums API Blog Get Involved  Contribution Bible 3rd Party Applications Add New Movie Add New TV Show Community Guidelines Leaderboard Forums Twitter Facebook Legal Terms of Use Privacy Policy Login Sign Up"}