{"link": "https://www.themoviedb.org/tv/75678?language=en", "title": "\u0412\u043e\u0435\u0432\u043e\u0434\u0430", "resume": "We don't have an overview translated in English. Help us expand our database by adding one.", "rate": 0, "genre": ["Drama"], "cast": ["Zornitsa Sophia", "Valeri Yordanov", "Goran Gunchev", "Dimitar Trokanov", "Dimitar Selenski"], "character": ["Rumena", "Stoyan", "Amit Aga", "Georgi Bayraktarya", "Traycho"], "site_data": "html Apps Forums Leaderboard Contribute API Support Discover Movies TV Shows Movies Popular Top Rated Upcoming Now Playing TV Shows Popular Top Rated On TV Airing Today People Popular People Can't find a movie or TV show? Login to create it. en Login Sign Up  ID: 75678   Expand \u0412\u043e\u0435\u0432\u043e\u0434\u0430   (2017) User Score Overview We don't have an overview translated in English. Help us expand our database by adding one. Featured Crew Zornitsa Sophia Creator Nikolay Haitov Creator Discussions   Reviews Videos   Images   Changes Report Share Discussions General  0 Content Issues  0 Images Backdrops  0 Posters  1 Videos Trailers  0 Teasers  0 Clips  0 Featurettes  0 Opening Credits  0 Top Billed Cast Zornitsa Sophia Rumena Valeri Yordanov Stoyan Goran Gunchev Amit Aga Dimitar Trokanov Georgi Bayraktarya Dimitar Selenski Traycho Full Cast & Crew Current Season Season 1 2017 | 3 Episodes Season 1 of \u0412\u043e\u0435\u0432\u043e\u0434\u0430 premiered on December 12, 2017. View All Seasons Social Reviews  0 Discussions  0 Media Most Popular Videos  0 Backdrops  0 Posters  1 Recommendations We don't have enough data to suggest any TV shows based on \u0412\u043e\u0435\u0432\u043e\u0434\u0430. You can help by rating TV shows you've seen. Facts Status  Ended Network Certification  - Type  Scripted Original Language  Bulgarian Runtime  40m Homepage  - Genres Drama Keywords 19th century Content Score 79 Pump it up! We're close now. Top Contributors s 45 speedycars TB 1 TMDb Bot  View Edit History Popularity Trend  Login to edit  URL By  signing up  for an account on TMDb, you can post directly to Twitter and Facebook. You need to be logged in to continue. Click  here  to login or  here  to sign up.    page_wrap opened in html_head  Join the Community The Basics About TMDb Contact Us Support Forums API Blog Get Involved  Contribution Bible 3rd Party Applications Add New Movie Add New TV Show Community Guidelines Leaderboard Forums Twitter Facebook Legal Terms of Use Privacy Policy Login Sign Up"}