{"link": "https://www.themoviedb.org/tv/71802?language=en", "title": "Semestr", "resume": "We don't have an overview translated in English. Help us expand our database by adding one.", "rate": 0, "genre": ["Comedy", "Drama"], "cast": ["Jan Hofman", "Anna Linhartov\u00e1", "Eva Josef\u00edkov\u00e1", "Jan Cina"], "character": ["Dami\u00e1n Kadlec", "Am\u00e1lie N\u011bme\u010dkov\u00e1", "Pavl\u00edna St\u00e1rkov\u00e1", "\u0160imon \u0160pa\u010dek"], "site_data": "html Apps Forums Leaderboard Contribute API Support Discover Movies TV Shows Movies Popular Top Rated Upcoming Now Playing TV Shows Popular Top Rated On TV Airing Today People Popular People Can't find a movie or TV show? Login to create it. en Login Sign Up  ID: 71802   Expand Semestr   (2016) User Score Overview We don't have an overview translated in English. Help us expand our database by adding one. Featured Crew Adam Sedl\u00e1k Creator Adam Sedl\u00e1k Creator Ond\u0159ej Kop\u0159iva Creator Discussions   Reviews Videos   Images   Changes Report Share Discussions General  0 Content Issues  0 Images Backdrops  0 Posters  2 Videos Trailers  0 Teasers  0 Clips  0 Featurettes  0 Opening Credits  0 Top Billed Cast Jan Hofman Dami\u00e1n Kadlec Anna Linhartov\u00e1 Am\u00e1lie N\u011bme\u010dkov\u00e1 Eva Josef\u00edkov\u00e1 Pavl\u00edna St\u00e1rkov\u00e1 Jan Cina \u0160imon \u0160pa\u010dek Full Cast & Crew Last Season Season 1 2016 | 6 Episodes Season 1 of Semestr premiered on November  1, 2016. View All Seasons Social Reviews  0 Discussions  0 Media Most Popular Videos  0 Backdrops  0 Posters  2 Recommendations We don't have enough data to suggest any TV shows based on Semestr. You can help by rating TV shows you've seen. Facts Status  Ended Network Certification  - Type  Scripted Original Language  Czech Runtime  - Homepage   https://www.stream.cz/porady/semestr Genres Comedy Drama Keywords No keywords have been added. Content Score 71 Just a little bit more... Top Contributors W 31 Wiruss 4 Elizabeth Jennings E 2 ErOoRek  View Edit History Popularity Trend  Login to edit  URL By  signing up  for an account on TMDb, you can post directly to Twitter and Facebook. You need to be logged in to continue. Click  here  to login or  here  to sign up.    page_wrap opened in html_head  Join the Community The Basics About TMDb Contact Us Support Forums API Blog Get Involved  Contribution Bible 3rd Party Applications Add New Movie Add New TV Show Community Guidelines Leaderboard Forums Twitter Facebook Legal Terms of Use Privacy Policy Login Sign Up"}