{"link": "https://www.themoviedb.org/tv/78956?language=en", "title": "Secret Sister", "resume": "Celebrities become an Unnie (older sister) for a day to a younger celebrity spending 24 hours together, sharing one bed and one blanket.", "rate": 0, "genre": ["Reality"], "cast": ["Yeri", "Kim Tae-yeon", "Han Chae-young"], "character": ["Herself", "Herself", "Herself"], "site_data": "html Apps Forums Leaderboard Contribute API Support Discover Movies TV Shows Movies Popular Top Rated Upcoming Now Playing TV Shows Popular Top Rated On TV Airing Today People Popular People Can't find a movie or TV show? Login to create it. en Login Sign Up  ID: 78956   Expand Secret Sister   (2018) User Score Overview Celebrities become an Unnie (older sister) for a day to a younger celebrity spending 24 hours together, sharing one bed and one blanket. Discussions   Reviews Videos   Images   Changes Report Share Discussions General  0 Content Issues  0 Images Backdrops  0 Posters  1 Videos Trailers  0 Teasers  0 Clips  0 Featurettes  0 Opening Credits  0 Top Billed Cast Yeri Herself Kim Tae-yeon Herself Han Chae-young Herself Full Cast & Crew Current Season Season 1 2018 | 0 Episodes Season 1 of Secret Sister premiered on April 21, 2018. View All Seasons Social Reviews  0 Discussions  0 Media Most Popular Videos  0 Backdrops  0 Posters  1 Recommendations We don't have enough data to suggest any TV shows based on Secret Sister. You can help by rating TV shows you've seen. Facts Original Name  \ube44\ubc00\uc5b8\ub2c8 Status  Returning Series Network Certification ALL Meaning This rating is for programming that is appropriate for all ages. This program usually involves programs designed for children or families. Type  Scripted Original Language  Korean Runtime  35m Homepage   http://tv.jtbc.joins.com/secretsister Genres Reality Keywords No keywords have been added. Content Score 43 There's no 'I' in team... Top Contributors 20 Lumina_B 1 Elizabeth Jennings  View Edit History Popularity Trend  Login to edit  URL By  signing up  for an account on TMDb, you can post directly to Twitter and Facebook. You need to be logged in to continue. Click  here  to login or  here  to sign up.    page_wrap opened in html_head  Join the Community The Basics About TMDb Contact Us Support Forums API Blog Get Involved  Contribution Bible 3rd Party Applications Add New Movie Add New TV Show Community Guidelines Leaderboard Forums Twitter Facebook Legal Terms of Use Privacy Policy Login Sign Up"}