{"link": "https://www.themoviedb.org/tv/74048?language=en", "title": "Des grives aux loups", "resume": "We don't have an overview translated in English. Help us expand our database by adding one.", "rate": 0, "genre": ["Drama"], "cast": ["Maurice Barrier", "Carole Brenner", "Pierre Nougaro", "Germaine Delbat", "Bruno Devold\u00e8re"], "character": ["Jean-\u00c9douard Vialhe", "Mauricette Vialhe, adulte", "\u00c9douard Vialhe", "L\u00e9onie Vialhe", "Pierre-\u00c9douard Vialhe"], "site_data": "html Apps Forums Leaderboard Contribute API Support Discover Movies TV Shows Movies Popular Top Rated Upcoming Now Playing TV Shows Popular Top Rated On TV Airing Today People Popular People Can't find a movie or TV show? Login to create it. en Login Sign Up  ID: 74048   Expand Des grives aux loups   (1984) User Score Overview We don't have an overview translated in English. Help us expand our database by adding one. Featured Crew Philippe Monnier Creator Discussions   Reviews Videos   Images   Changes Report Share Discussions General  0 Content Issues  4 Images Backdrops  1 Posters  1 Videos Trailers  0 Teasers  0 Clips  0 Featurettes  0 Opening Credits  0 Top Billed Cast Maurice Barrier Jean-\u00c9douard Vialhe Carole Brenner Mauricette Vialhe, adulte Pierre Nougaro \u00c9douard Vialhe Germaine Delbat L\u00e9onie Vialhe Bruno Devold\u00e8re Pierre-\u00c9douard Vialhe Full Cast & Crew Last Season Season 1 1984 | 2 Episodes Season 1 of Des grives aux loups premiered on October  5, 1984. View All Seasons Social Reviews  0 Discussions  4 Subject Status Replies Last Reply There are no discussions for Des grives aux loups. Login to be first! Go to Discussions Media Most Popular Videos  0 Backdrops  1 Posters  1 Recommendations We don't have enough data to suggest any TV shows based on Des grives aux loups. You can help by rating TV shows you've seen. Facts Status  Ended Network Certification  - Type  Miniseries Original Language  French Runtime  310m Homepage  - Genres Drama Keywords france terroir correze Content Score 93 Almost there... Top Contributors L 63 LeGardienDuCinema 12 Elizabeth Jennings C 1 ClaudeH  View Edit History Popularity Trend  Login to edit  URL By  signing up  for an account on TMDb, you can post directly to Twitter and Facebook. You need to be logged in to continue. Click  here  to login or  here  to sign up.    page_wrap opened in html_head  Join the Community The Basics About TMDb Contact Us Support Forums API Blog Get Involved  Contribution Bible 3rd Party Applications Add New Movie Add New TV Show Community Guidelines Leaderboard Forums Twitter Facebook Legal Terms of Use Privacy Policy Login Sign Up"}