{"link": "https://www.themoviedb.org/tv/59717?language=en", "title": "Comedians in Cars Getting Coffee", "resume": "Jerry takes his comedy pals out for coffee in a selection of his classic automobiles. Larry David sums it up best when he says, 'You've finally made a show about nothing.'", "rate": 72, "genre": ["Comedy"], "cast": ["Jerry Seinfeld"], "character": ["Himself - Host"], "site_data": "html Apps Forums Leaderboard Contribute API Support Discover Movies TV Shows Movies Popular Top Rated Upcoming Now Playing TV Shows Popular Top Rated On TV Airing Today People Popular People Can't find a movie or TV show? Login to create it. en Login Sign Up  ID: 59717   Expand Comedians in Cars Getting Coffee   (2012) User Score  Play Trailer Overview Jerry takes his comedy pals out for coffee in a selection of his classic automobiles. Larry David sums it up best when he says, 'You've finally made a show about nothing.' Featured Crew Jerry Seinfeld Creator Discussions   Reviews Videos   Images   Changes Report Share Discussions General  0 Content Issues  0 Images Backdrops  1 Posters  5 Videos Trailers  1 Teasers  0 Clips  0 Featurettes  0 Opening Credits  0 Top Billed Cast Jerry Seinfeld Himself - Host Full Cast & Crew Last Season Original Air Date Original Air Date Netflix Collections (Digital) Season 9 2017 | 6 Episodes View All Seasons Social Reviews  0 Discussions  0 Media Most Popular Videos  1 Backdrops  1 Posters  5 Recommendations   2015-02-20 Richie Rich 3.0    2011-02-08 Traffic Light 7.2    2015-06-12 Conspiracy 5.7    2015-06-18 Hoff the Record 6.0    2015-12-01 Real Rob 5.8    2017-01-01 Beau S\u00e9jour 7.9    2009-02-11 Important Things with Demetri Martin 6.6    1991-09-30 The Jerry Springer Show 3.1  Facts Status  Returning Series Networks Certification  - Type  Scripted Original Language  English Runtime  23m, 17m, 10m, 20m, 16m Homepage   http://comediansincarsgettingcoffee.com/ Genres Comedy Keywords coffee comedian car Content Score 71 Just a little bit more... Top Contributors 65 Elizabeth Jennings 19 Carlos 12 Travis Bell 6 Wouter  View Edit History Popularity Trend  Login to edit  URL By  signing up  for an account on TMDb, you can post directly to Twitter and Facebook. You need to be logged in to continue. Click  here  to login or  here  to sign up.    page_wrap opened in html_head  Join the Community The Basics About TMDb Contact Us Support Forums API Blog Get Involved  Contribution Bible 3rd Party Applications Add New Movie Add New TV Show Community Guidelines Leaderboard Forums Twitter Facebook Legal Terms of Use Privacy Policy Login Sign Up"}