{"link": "https://www.themoviedb.org/tv/69524?language=en", "title": "Big Fan", "resume": "Celebrities face off with three of their biggest admirers to see who knows the most about them in this game show based on the \"Jimmy Kimmel Live\" segment \"Who Knows...?\"", "rate": 0, "genre": ["Talk"], "cast": ["Andy Richter"], "character": ["Himself - Host"], "site_data": "html Apps Forums Leaderboard Contribute API Support Discover Movies TV Shows Movies Popular Top Rated Upcoming Now Playing TV Shows Popular Top Rated On TV Airing Today People Popular People Can't find a movie or TV show? Login to create it. en Login Sign Up  ID: 69524   Expand Big Fan   (2017) User Score Overview Celebrities face off with three of their biggest admirers to see who knows the most about them in this game show based on the \"Jimmy Kimmel Live\" segment \"Who Knows...?\" Discussions   Reviews Videos   Images   Changes Report Share Discussions General  0 Content Issues  0 Images Backdrops  1 Posters  1 Videos Trailers  0 Teasers  0 Clips  0 Featurettes  0 Opening Credits  0 Top Billed Cast Andy Richter Himself - Host Full Cast & Crew Last Season Season 1 2017 | 4 Episodes Season 1 of Big Fan premiered on January  9, 2017. View All Seasons Social Reviews  0 Discussions  0 Media Most Popular Videos  0 Backdrops  1 Posters  1 Recommendations We don't have enough data to suggest any TV shows based on Big Fan. You can help by rating TV shows you've seen. Facts Status  Returning Series Network Certification  - Type  Talk Show Original Language  English Runtime  22m Homepage   http://abc.go.com/shows/big-fan Genres Talk Keywords No keywords have been added. Content Score 56 We're so close, yet so far. Top Contributors 16 Elizabeth Jennings g 5 goinsdanielg j 2 jackson980  View Edit History Popularity Trend  Login to edit  URL By  signing up  for an account on TMDb, you can post directly to Twitter and Facebook. You need to be logged in to continue. Click  here  to login or  here  to sign up.    page_wrap opened in html_head  Join the Community The Basics About TMDb Contact Us Support Forums API Blog Get Involved  Contribution Bible 3rd Party Applications Add New Movie Add New TV Show Community Guidelines Leaderboard Forums Twitter Facebook Legal Terms of Use Privacy Policy Login Sign Up"}