{"link": "https://www.themoviedb.org/tv/15915?language=en", "title": "Fathers and Sons", "resume": "Fathers and Sons is a TVB modern drama series broadcast in August 2007.", "rate": 0, "genre": ["Drama"], "cast": ["Yoyo Mung", "Bobby Au-Yeung", "Tavia Yeung", "Halina Tam"], "character": ["Man Tin Chi"], "site_data": "html Apps Forums Leaderboard Contribute API Support Discover Movies TV Shows Movies Popular Top Rated Upcoming Now Playing TV Shows Popular Top Rated On TV Airing Today People Popular People Can't find a movie or TV show? Login to create it. en Login Sign Up  ID: 15915   Expand Fathers and Sons   (2007) User Score Overview Fathers and Sons is a TVB modern drama series broadcast in August 2007. Discussions   Reviews Videos   Images   Changes Report Share Discussions General  0 Content Issues  0 Images Backdrops  1 Posters  1 Videos Trailers  0 Teasers  0 Clips  0 Featurettes  0 Opening Credits  0 Top Billed Cast Yoyo Mung Bobby Au-Yeung Man Tin Chi Tavia Yeung Halina Tam Full Cast & Crew  Create Episode Social Reviews  0 Discussions  0 Media Most Popular Videos  0 Backdrops  1 Posters  1 Recommendations We don't have enough data to suggest any TV shows based on Fathers and Sons. You can help by rating TV shows you've seen. Facts Status  Ended Network Certification  - Type  Scripted Original Language  English Runtime  45m Homepage   http://tvcity.tvb.com/drama/fathers_and_sons Genres Drama Keywords No keywords have been added. Content Score 86 Almost there... Top Contributors No contributors found. Popularity Trend  Login to edit  URL By  signing up  for an account on TMDb, you can post directly to Twitter and Facebook. You need to be logged in to continue. Click  here  to login or  here  to sign up.    page_wrap opened in html_head  Join the Community The Basics About TMDb Contact Us Support Forums API Blog Get Involved  Contribution Bible 3rd Party Applications Add New Movie Add New TV Show Community Guidelines Leaderboard Forums Twitter Facebook Legal Terms of Use Privacy Policy Login Sign Up"}