{"link": "https://www.themoviedb.org/tv/14328?language=en", "title": "Dick Powell's Zane Grey Theater", "resume": "Dick Powell's Zane Grey Theatre, sometimes simply called Zane Grey Theatre, is an American Western anthology series which ran on CBS from 1956 to 1961.", "rate": 80, "genre": ["Western", "Drama"], "cast": ["Dick Powell"], "character": ["Himself - Host"], "site_data": "html Apps Forums Leaderboard Contribute API Support Discover Movies TV Shows Movies Popular Top Rated Upcoming Now Playing TV Shows Popular Top Rated On TV Airing Today People Popular People Can't find a movie or TV show? Login to create it. en Login Sign Up  ID: 14328   Expand Dick Powell's Zane Grey Theater   (1956) User Score Overview Dick Powell's Zane Grey Theatre, sometimes simply called Zane Grey Theatre, is an American Western anthology series which ran on CBS from 1956 to 1961. Discussions   Reviews Videos   Images   Changes Report Share Discussions General  0 Content Issues  0 Images Backdrops  2 Posters  1 Videos Trailers  0 Teasers  0 Clips  0 Featurettes  0 Opening Credits  1 Top Billed Cast Dick Powell Himself - Host Full Cast & Crew Last Season Season 5 1960 | 30 Episodes Season 5 of Dick Powell's Zane Grey Theater premiered on October  6, 1960. View All Seasons Social Reviews  0 Discussions  0 Media Most Popular Videos  1 Backdrops  2 Posters  1 Recommendations We don't have enough data to suggest any TV shows based on Dick Powell's Zane Grey Theater. You can help by rating TV shows you've seen. Facts Status  Ended Network Certification  - Type  Scripted Original Language  English Runtime  30m Homepage  - Genres Western Drama Keywords anthology Content Score 64 We're so close, yet so far. Top Contributors 11 Banana 6 Steve S 2 Samara 2 Zlogorek  View Edit History Popularity Trend  Login to edit  URL By  signing up  for an account on TMDb, you can post directly to Twitter and Facebook. You need to be logged in to continue. Click  here  to login or  here  to sign up.    page_wrap opened in html_head  Join the Community The Basics About TMDb Contact Us Support Forums API Blog Get Involved  Contribution Bible 3rd Party Applications Add New Movie Add New TV Show Community Guidelines Leaderboard Forums Twitter Facebook Legal Terms of Use Privacy Policy Login Sign Up"}