{"link": "https://www.themoviedb.org/tv/65436?language=en", "title": "The Rams", "resume": "Follows the ups and downs of a college football team.", "rate": null, "genre": ["Drama"], "cast": ["Sacha Charles", "Karl Walcott", "Karl Farah", "Genevi\u00e8ve Rochette", "Philippe Durocher"], "site_data": "html Apps Forums Leaderboard Contribute API Support Discover Movies TV Shows Movies Popular Top Rated Upcoming Now Playing TV Shows Popular Top Rated On TV Airing Today People Popular People Can't find a movie or TV show? Login to create it. en Login Sign Up  ID: 65436   Expand The Rams   (2013) User Score Overview Follows the ups and downs of a college football team. Discussions   Reviews Videos   Images   Changes Report Share Discussions General  0 Content Issues  0 Images Backdrops  1 Posters  1 Videos Trailers  0 Teasers  0 Clips  0 Featurettes  0 Opening Credits  0 Top Billed Cast Sacha Charles Joseph Celestin Karl Walcott Hakim Karl Farah Chuck Genevi\u00e8ve Rochette H\u00e9l\u00e8ne Philippe Durocher Tremblay Full Cast & Crew Last Season Season 1 2013 | 10 Episodes Season 1 of The Rams premiered on March 13, 2013. View All Seasons Social Reviews  0 Discussions  0 Media Most Popular Videos  0 Backdrops  1 Posters  1 Recommendations We don't have enough data to suggest any TV shows based on The Rams. You can help by rating TV shows you've seen. Facts Original Name  Les B\u00e9liers Status  Returning Series Network Certification C8 Meaning Suitable for children ages 8+. Low level violence and fantasy horror is allowed. No foul language is allowed, but occasional \"socially offensive and discriminatory\" language is allowed if in the context of the story. No sexual content of any level allowed. Type  Scripted Original Language  French Runtime  15m, 10m Homepage   http://ici.tou.tv/les-beliers Genres Drama Keywords sport american football quebec american football team young adult Content Score 86 Almost there... Top Contributors 47 Banana  View Edit History Popularity Trend  Login to edit  URL By  signing up  for an account on TMDb, you can post directly to Twitter and Facebook. You need to be logged in to continue. Click  here  to login or  here  to sign up.    page_wrap opened in html_head  Join the Community The Basics About TMDb Contact Us Support Forums API Blog Get Involved  Contribution Bible 3rd Party Applications Add New Movie Add New TV Show Community Guidelines Leaderboard Forums Twitter Facebook Legal Terms of Use Privacy Policy Login Sign Up", "character": ["Joseph Celestin", "Hakim", "Chuck", "H\u00e9l\u00e8ne", "Tremblay"]}