{"link": "https://www.themoviedb.org/tv/78464?language=en", "title": "DOREIKU The Animation", "resume": "24 people enter a survival game. Each has a device called an SCM (slave control method), which can make their opponent into their slave. Each person has their own reason for participating in the game.", "rate": 55, "genre": ["Animation", "Crime", "Drama"], "cast": ["Suzuki Ryouta", "Hayakawa Saki", "Hibiku Yamamura", "Sayaka Senbongi", "Hikaru Midorikawa"], "character": ["Oota Yuuga (Voice)", "Chiyoda Maria (Voice)", "Arakawa Eia (Voice)", "Katsushika Juria (Voice)", "Shinjuku Seiya (Voice)"], "site_data": "html Apps Forums Leaderboard Contribute API Support Discover Movies TV Shows Movies Popular Top Rated Upcoming Now Playing TV Shows Popular Top Rated On TV Airing Today People Popular People Can't find a movie or TV show? Login to create it. en Login Sign Up  ID: 78464   Expand DOREIKU The Animation   (2018) User Score Overview 24 people enter a survival game. Each has a device called an SCM (slave control method), which can make their opponent into their slave. Each person has their own reason for participating in the game. Featured Crew Ryouichi Kuraya Creator Discussions   Reviews Videos   Images   Changes Report Share Discussions General  0 Content Issues  0 Images Backdrops  1 Posters  1 Videos Trailers  0 Teasers  0 Clips  0 Featurettes  0 Opening Credits  0 Top Billed Cast Suzuki Ryouta Oota Yuuga (Voice) Hayakawa Saki Chiyoda Maria (Voice) Hibiku Yamamura Arakawa Eia (Voice) Sayaka Senbongi Katsushika Juria (Voice) Hikaru Midorikawa Shinjuku Seiya (Voice) Full Cast & Crew Current Season Season 1 2018 | 12 Episodes Season 1 of DOREIKU The Animation premiered on April 12, 2018. View All Seasons Social Reviews  0 Discussions  0 Media Most Popular Videos  0 Backdrops  1 Posters  1 Recommendations We don't have enough data to suggest any TV shows based on DOREIKU The Animation. You can help by rating TV shows you've seen. Facts Original Name  \u5974\u96b7\u533a The Animation Status  Returning Series Networks - Certification  - Type  Scripted Original Language  Japanese Runtime  25m Homepage   http://doreiku-anime.com/ Genres Animation Crime Drama Keywords based on manga psychological Content Score 93 Almost there... Top Contributors 27 neonime 14 sp1ti 10 jmf2k 6 Despair-Paradise  View Edit History Popularity Trend  Login to edit  URL By  signing up  for an account on TMDb, you can post directly to Twitter and Facebook. You need to be logged in to continue. Click  here  to login or  here  to sign up.    page_wrap opened in html_head  Join the Community The Basics About TMDb Contact Us Support Forums API Blog Get Involved  Contribution Bible 3rd Party Applications Add New Movie Add New TV Show Community Guidelines Leaderboard Forums Twitter Facebook Legal Terms of Use Privacy Policy Login Sign Up"}