{"link": "https://www.themoviedb.org/tv/2506?language=en", "title": "Wings", "resume": "Brothers Brian and Joe Hackett attempt to run an airline on the New England island of Nantucket while surrounded by their various wacky friends and employees.", "rate": 68, "genre": ["Comedy", "Drama"], "cast": ["Tim Daly", "Steven Weber", "Crystal Bernard", "David Schramm", "Rebecca Schull"], "character": ["Joe Montgomery Hackett", "Brian Michael Hackett", "Helen Chappel Hackett", "Roy Biggins", "Fay Evelyn Schlob Dumbly DeVay Cochran"], "site_data": "html Apps Forums Leaderboard Contribute API Support Discover Movies TV Shows Movies Popular Top Rated Upcoming Now Playing TV Shows Popular Top Rated On TV Airing Today People Popular People Can't find a movie or TV show? Login to create it. en Login Sign Up  ID: 2506   Expand Wings   (1990) User Score Overview Brothers Brian and Joe Hackett attempt to run an airline on the New England island of Nantucket while surrounded by their various wacky friends and employees. Featured Crew David Lee Creator Peter Casey Creator David Angell Creator Discussions   Reviews Videos   Images   Changes Report Share Discussions General  5 Content Issues  0 Images Backdrops  2 Posters  2 Videos Trailers  0 Teasers  0 Clips  0 Featurettes  0 Opening Credits  0 Top Billed Cast Tim Daly Joe Montgomery Hackett Steven Weber Brian Michael Hackett Crystal Bernard Helen Chappel Hackett David Schramm Roy Biggins Rebecca Schull Fay Evelyn Schlob Dumbly DeVay Cochran Full Cast & Crew Last Season Season 8 1996 | 24 Episodes Season 8 of Wings premiered on September 18, 1996. View All Seasons Social Reviews  0 Discussions  5 Subject Status Replies Last Reply w Brian Hackett: Happy Birthday Steven Weber! Open 0 by wonder2wonder\n      \n     w Joe Hackett: Happy Birthday Tim Daly! Open 0 by wonder2wonder\n      \n     w Fay: Happy Birthday Rebecca Schull! Open 0 by wonder2wonder\n      \n     Go to Discussions Media Most Popular Videos  0 Backdrops  2 Posters  2 Recommendations   1995-09-13 The Drew Carey Show 6.4    1995-03-21 NewsRadio 7.3    1964-09-26 Gilligan's Island 6.6    1984-01-04 Night Court 6.9    1978-09-12 Taxi 7.2    1960-10-03 The Andy Griffith Show 7.4    1988-11-14 Murphy Brown 6.5    1969-09-26 The Brady Bunch 6.5  Facts Status  Ended Network Certification  - Type  Scripted Original Language  English Runtime  30m Homepage  - Genres Comedy Drama Keywords sibling relationship airport pilot sitcom Content Score 93 Almost there... Top Contributors 53 United600 18 lineker 12 Elizabeth Jennings 12 Banana  View Edit History Popularity Trend  Login to edit  URL By  signing up  for an account on TMDb, you can post directly to Twitter and Facebook. You need to be logged in to continue. Click  here  to login or  here  to sign up.    page_wrap opened in html_head  Join the Community The Basics About TMDb Contact Us Support Forums API Blog Get Involved  Contribution Bible 3rd Party Applications Add New Movie Add New TV Show Community Guidelines Leaderboard Forums Twitter Facebook Legal Terms of Use Privacy Policy Login Sign Up"}