{"link": "https://www.themoviedb.org/tv/73909?language=en", "title": "Le national d'impro 2017", "resume": "We don't have an overview translated in English. Help us expand our database by adding one.", "rate": 0, "genre": ["Family"], "cast": ["Fran\u00e7ois-\u00c9tienne Par\u00e9", "Christian Vanasse"], "character": ["Animateur", "Animateur"], "site_data": "html Apps Forums Leaderboard Contribute API Support Discover Movies TV Shows Movies Popular Top Rated Upcoming Now Playing TV Shows Popular Top Rated On TV Airing Today People Popular People Can't find a movie or TV show? Login to create it. en Login Sign Up  ID: 73909   Expand Le national d'impro 2017   (2017) User Score Overview We don't have an overview translated in English. Help us expand our database by adding one. Discussions   Reviews Videos   Images   Changes Report Share Discussions General  0 Content Issues  0 Images Backdrops  0 Posters  1 Videos Trailers  0 Teasers  0 Clips  0 Featurettes  0 Opening Credits  0 Top Billed Cast Fran\u00e7ois-\u00c9tienne Par\u00e9 Animateur Christian Vanasse Animateur Full Cast & Crew Last Season Season 1 2017 | 10 Episodes Season 1 of Le national d'impro 2017 premiered on September 12, 2017. View All Seasons Social Reviews  0 Discussions  0 Media Most Popular Videos  0 Backdrops  0 Posters  1 Recommendations We don't have enough data to suggest any TV shows based on Le national d'impro 2017. You can help by rating TV shows you've seen. Facts Status  In Production Network Certification  - Type  Scripted Original Language  French Runtime  60m Homepage  - Genres Family Keywords No keywords have been added. Content Score 36 There's no 'I' in team... Top Contributors j 19 joethebeef 2 kingkong25 1 Elizabeth Jennings  View Edit History Popularity Trend  Login to edit  URL By  signing up  for an account on TMDb, you can post directly to Twitter and Facebook. You need to be logged in to continue. Click  here  to login or  here  to sign up.    page_wrap opened in html_head  Join the Community The Basics About TMDb Contact Us Support Forums API Blog Get Involved  Contribution Bible 3rd Party Applications Add New Movie Add New TV Show Community Guidelines Leaderboard Forums Twitter Facebook Legal Terms of Use Privacy Policy Login Sign Up"}