{"link": "https://www.themoviedb.org/tv/45840?language=en", "title": "Future Diary - Another: World", "resume": "We don't have an overview translated in English. Help us expand our database by adding one.", "rate": 70, "genre": ["Action", "Adventure", "Animation", "Sci-Fi", "Fantasy"], "cast": ["Ayame Gouriki", "Masaki Okada", "Kanata Hongo", "Mayuko Fukuda"], "character": ["Yoshino Furusaki", "Arata Hoshino", "Rui Moriguchi", "Haruna Okie"], "site_data": "html Apps Forums Leaderboard Contribute API Support Discover Movies TV Shows Movies Popular Top Rated Upcoming Now Playing TV Shows Popular Top Rated On TV Airing Today People Popular People Can't find a movie or TV show? Login to create it. en Login Sign Up  ID: 45840   Expand Future Diary - Another: World    (2012) User Score Overview We don't have an overview translated in English. Help us expand our database by adding one. Discussions   Reviews Videos   Images   Changes Report Share Discussions General  0 Content Issues  0 Images Backdrops  0 Posters  2 Videos Trailers  0 Teasers  0 Clips  0 Featurettes  0 Opening Credits  0 Top Billed Cast Ayame Gouriki Yoshino Furusaki Masaki Okada Arata Hoshino Kanata Hongo Rui Moriguchi Mayuko Fukuda Haruna Okie Full Cast & Crew Last Season Season 01 2012 | 11 Episodes Season 1 of Future Diary - Another: World  premiered on April 21, 2012. View All Seasons Social Reviews  0 Discussions  0 Media Most Popular Videos  0 Backdrops  0 Posters  2 Recommendations We don't have enough data to suggest any TV shows based on Future Diary - Another: World . You can help by rating TV shows you've seen. Facts Original Name  \u672a\u6765\u65e5\u8a18-ANOTHER\uff1aWORLD- Status  Ended Networks - Certification  - Type  Scripted Original Language  Japanese Runtime  35m Homepage  - Genres Action & Adventure Animation Sci-Fi & Fantasy Keywords based on manga Content Score 64 We're so close, yet so far. Top Contributors A 14 Aka75 7 inframundo10 B 6 Bonsai s 5 speedycars  View Edit History Popularity Trend  Login to edit  URL By  signing up  for an account on TMDb, you can post directly to Twitter and Facebook. You need to be logged in to continue. Click  here  to login or  here  to sign up.    page_wrap opened in html_head  Join the Community The Basics About TMDb Contact Us Support Forums API Blog Get Involved  Contribution Bible 3rd Party Applications Add New Movie Add New TV Show Community Guidelines Leaderboard Forums Twitter Facebook Legal Terms of Use Privacy Policy Login Sign Up"}