{"link": "https://www.themoviedb.org/tv/2595?language=en", "title": "Knots Landing", "resume": "The domestic adventures, misdeeds and everyday interactions of five families living on a cul-de-sac in a small California community.", "rate": null, "genre": ["Drama", "Soap"], "cast": ["Donna Mills", "Ted Shackelford", "Nicollette Sheridan", "Joan Van Ark", "Kevin Dobson"], "site_data": "html Apps Forums Leaderboard Contribute API Support Discover Movies TV Shows Movies Popular Top Rated Upcoming Now Playing TV Shows Popular Top Rated On TV Airing Today People Popular People Can't find a movie or TV show? Login to create it. en Login Sign Up  ID: 2595   Expand Knots Landing   (1979) User Score Overview The domestic adventures, misdeeds and everyday interactions of five families living on a cul-de-sac in a small California community. Featured Crew Michael Filerman Creator David Jacobs Creator Discussions   Reviews Videos   Images   Changes Report Share Discussions General  2 Content Issues  0 Images Backdrops  3 Posters  3 Videos Trailers  0 Teasers  0 Clips  0 Featurettes  0 Opening Credits  0 Top Billed Cast Donna Mills Ted Shackelford Nicollette Sheridan Paige Matheson Joan Van Ark Valene Ewing Kevin Dobson M. Patrick McKenzie Full Cast & Crew Last Season Season 14 1992 | 20 Episodes Season 14 of Knots Landing premiered on October 29, 1992. View All Seasons Social Reviews  0 Discussions  2 Subject Status Replies Last Reply w Paige: Happy Birthday Nicollette Sheridan! Open 0 by wonder2wonder\n      \n     w Karen: Happy Birthday Michele Lee! Open 0 by wonder2wonder\n      \n     Go to Discussions Media Most Popular Videos  0 Backdrops  3 Posters  3 Recommendations   1973-01-28 Barnaby Jones 8.0    1968-01-09 It Takes a Thief 7.4    1983-09-06 Taggart 7.7    1978-04-02 Dallas 6.1    1979-09-22 Hart to Hart 6.5    1971-09-17 McMillan & Wife 7.2    1981-01-12 Dynasty 6.0    2001-10-05 Reba 5.7  Facts Status  Ended Network Certification  - Type  Scripted Original Language  English Runtime  44m, 60m Homepage  - Genres Drama Soap Keywords los angeles spin off soap opera Content Score 93 Almost there... Top Contributors 10 Banana BA 5 Barbara Ann O'Leary 3 lineker 3 Zlogorek  View Edit History Popularity Trend  Login to edit  URL By  signing up  for an account on TMDb, you can post directly to Twitter and Facebook. You need to be logged in to continue. Click  here  to login or  here  to sign up.    page_wrap opened in html_head  Join the Community The Basics About TMDb Contact Us Support Forums API Blog Get Involved  Contribution Bible 3rd Party Applications Add New Movie Add New TV Show Community Guidelines Leaderboard Forums Twitter Facebook Legal Terms of Use Privacy Policy Login Sign Up", "character": ["Paige Matheson", "Valene Ewing", "M. Patrick McKenzie"]}