{"link": "https://www.themoviedb.org/tv/74660?language=en", "title": "Stiletto Vendetta", "resume": "Three girls in high school made a prank on the fourth girl and caused her to be expelled from the high school with her teacher. After 20 years they got together in a high society environment.", "rate": 80, "genre": ["Drama", "Mystery", "Soap"], "cast": ["G\u00f6k\u00e7e Bahad\u0131r", "Aslihan Gurbuz", "Bade \u0130\u015fcil", "T\u00fclin \u00d6zen", "Mert F\u0131rat"], "character": ["Oya Toks\u00f6z", "Merve Benal Aksak", "Pelin Tarhan Kaner", "Arzu K\u00fc\u00e7\u00fckata (Kaymaz)", "Serhan Aksak"], "site_data": "html Apps Forums Leaderboard Contribute API Support Discover Movies TV Shows Movies Popular Top Rated Upcoming Now Playing TV Shows Popular Top Rated On TV Airing Today People Popular People Can't find a movie or TV show? Login to create it. en Login Sign Up  ID: 74660   Expand Stiletto Vendetta   (2017) User Score  Play Trailer Overview Three girls in high school made a prank on the fourth girl and caused her to be expelled from the high school with her teacher. After 20 years they got together in a high society environment. Featured Crew Meri\u00e7 Acemi Creator Kerem Catay Creator Discussions   Reviews Videos   Images   Changes Report Share Discussions General  0 Content Issues  0 Images Backdrops  3 Posters  1 Videos Trailers  1 Teasers  0 Clips  0 Featurettes  0 Opening Credits  0 Top Billed Cast G\u00f6k\u00e7e Bahad\u0131r Oya Toks\u00f6z Aslihan Gurbuz Merve Benal Aksak Bade \u0130\u015fcil Pelin Tarhan Kaner T\u00fclin \u00d6zen Arzu K\u00fc\u00e7\u00fckata (Kaymaz) Mert F\u0131rat Serhan Aksak Full Cast & Crew Current Season Season 1 2017 | 32 Episodes Season 1 of Stiletto Vendetta premiered on October 24, 2017. View All Seasons Social Reviews  0 Discussions  0 Media Most Popular Videos  1 Backdrops  3 Posters  1 Recommendations We don't have enough data to suggest any TV shows based on Stiletto Vendetta. You can help by rating TV shows you've seen. Facts Original Name  Ufak Tefek Cinayetler Status  Returning Series Network Certification  - Type  Scripted Original Language  Turkish Runtime  120m Homepage   https://www.startv.com.tr/dizi/ufak-tefek-cinayetler/ Genres Drama Mystery Soap Keywords No keywords have been added. Content Score 100 Yes! Looking good! Top Contributors 148 purplelammashta s 5 sandaramick m 3 michl TB 3 TMDb Bot  View Edit History Popularity Trend  Login to edit  URL By  signing up  for an account on TMDb, you can post directly to Twitter and Facebook. You need to be logged in to continue. Click  here  to login or  here  to sign up.    page_wrap opened in html_head  Join the Community The Basics About TMDb Contact Us Support Forums API Blog Get Involved  Contribution Bible 3rd Party Applications Add New Movie Add New TV Show Community Guidelines Leaderboard Forums Twitter Facebook Legal Terms of Use Privacy Policy Login Sign Up"}