{"link": "https://www.themoviedb.org/tv/6039?language=en", "title": "Traffic Cops", "resume": "Cameras follow the officers of the Road Policing Units and Road Crime Teams of several UK law enforcement departments.", "rate": 0, "genre": ["Documentary"], "cast": ["Jamie Theakston"], "character": ["Himself"], "site_data": "html Apps Forums Leaderboard Contribute API Support Discover Movies TV Shows Movies Popular Top Rated Upcoming Now Playing TV Shows Popular Top Rated On TV Airing Today People Popular People Can't find a movie or TV show? Login to create it. en Login Sign Up  ID: 6039   Expand Traffic Cops   (2003) User Score Overview Cameras follow the officers of the Road Policing Units and Road Crime Teams of several UK law enforcement departments. Discussions   Reviews Videos   Images   Changes Report Share Discussions General  0 Content Issues  0 Images Backdrops  5 Posters  1 Videos Trailers  0 Teasers  0 Clips  0 Featurettes  0 Opening Credits  0 Top Billed Cast Jamie Theakston Himself Full Cast & Crew Current Season On the Edge 2018 | 3 Episodes Season 17 of Traffic Cops premiered on May 29, 2018. View All Seasons Social Reviews  0 Discussions  0 Media Most Popular Videos  0 Backdrops  5 Posters  1 Recommendations We don't have enough data to suggest any TV shows based on Traffic Cops. You can help by rating TV shows you've seen. Facts Status  Returning Series Networks Certification  - Type  Reality Original Language  English Runtime  60m Homepage   http://www.channel5.com/show/traffic-cops/ Genres Documentary Keywords No keywords have been added. Content Score 56 We're so close, yet so far. Top Contributors 20 Marr \ud83c\uddf3\ud83c\uddf1 19 Ash 3 Banana  View Edit History Popularity Trend  Login to edit  URL By  signing up  for an account on TMDb, you can post directly to Twitter and Facebook. You need to be logged in to continue. Click  here  to login or  here  to sign up.    page_wrap opened in html_head  Join the Community The Basics About TMDb Contact Us Support Forums API Blog Get Involved  Contribution Bible 3rd Party Applications Add New Movie Add New TV Show Community Guidelines Leaderboard Forums Twitter Facebook Legal Terms of Use Privacy Policy Login Sign Up"}