{"link": "https://www.themoviedb.org/tv/75214?language=en", "title": "Violet Evergarden", "resume": "The war is over, and Violet Evergarden needs a job. Scarred and emotionless, she takes a job as a letter writer to understand herself and her past.", "rate": null, "genre": ["Animation", "Drama", "Sci-Fi", "Fantasy"], "cast": ["Naoya Nosaka", "Daisuke Yokota", "Ryou Miyamoto", "Shouko Yuzuki", "Takayuki Miyamoto"], "site_data": "html Apps Forums Leaderboard Contribute API Support Discover Movies TV Shows Movies Popular Top Rated Upcoming Now Playing TV Shows Popular Top Rated On TV Airing Today People Popular People Can't find a movie or TV show? Login to create it. en Login Sign Up  ID: 75214   Expand Violet Evergarden   (2018) User Score  Play Trailer Overview The war is over, and Violet Evergarden needs a job. Scarred and emotionless, she takes a job as a letter writer to understand herself and her past. Featured Crew Kana Akatsuki Creator Discussions   Reviews Videos   Images   Changes Report Share Discussions General  0 Content Issues  3 Images Backdrops  5 Posters  3 Videos Trailers  1 Teasers  0 Clips  0 Featurettes  0 Opening Credits  0 Top Billed Cast Naoya Nosaka Oliver Daisuke Yokota Kyle Zoenig Ryou Miyamoto bar owner Shouko Yuzuki Bluebell Junoa Takayuki Miyamoto Iris's uncle Full Cast & Crew Current Season Season 1 2018 | 13 Episodes View All Seasons Social Reviews  0 Discussions  3 Subject Status Replies Last Reply There are no discussions for Violet Evergarden. Login to be first! Go to Discussions Media Most Popular Videos  1 Backdrops  5 Posters  3 Recommendations   2014-10-05 The Seven Deadly Sins 7.9    2016-04-03 My Hero Academia 8.0    2014-07-03 Tokyo Ghoul 7.2  Facts Original Name  \u30f4\u30a1\u30a4\u30aa\u30ec\u30c3\u30c8\u30fb\u30a8\u30f4\u30a1\u30fc\u30ac\u30fc\u30c7\u30f3 Status  Ended Network Certification TV-PG Meaning This program contains material that parents may find unsuitable for younger children. Type  Scripted Original Language  Japanese Runtime  25m Homepage   http://violet-evergarden.jp/ Genres Animation Drama Sci-Fi & Fantasy Keywords based on light novel anime Content Score 100 Yes! Looking good! Top Contributors 39 Sergiojamon 34 Fabricio Angelo 23 sp1ti s 4 sheva_vitali  View Edit History Popularity Trend  Login to edit  URL By  signing up  for an account on TMDb, you can post directly to Twitter and Facebook. You need to be logged in to continue. Click  here  to login or  here  to sign up.    page_wrap opened in html_head  Join the Community The Basics About TMDb Contact Us Support Forums API Blog Get Involved  Contribution Bible 3rd Party Applications Add New Movie Add New TV Show Community Guidelines Leaderboard Forums Twitter Facebook Legal Terms of Use Privacy Policy Login Sign Up", "character": ["Oliver", "Kyle Zoenig", "bar owner", "Bluebell Junoa", "Iris's uncle"]}