{"link": "https://www.themoviedb.org/tv/31941?language=en", "title": "Blue Mountain State", "resume": "Three incoming freshmen attending Midwestern college football powerhouse Blue Mountain State must quickly adapt to college life and juggle football, girls, classes and nonstop hazing.", "rate": 71, "genre": ["Comedy"], "cast": ["Darin Brooks", "Alan Ritchson", "Frankie Shaw", "Chris Romano", "Ed Marinaro"], "character": ["Alex Moran", "Thad Castle", "Mary Jo Cacciatore", "Sammy Cacciatore", "Coach Marty Daniels"], "site_data": "html Apps Forums Leaderboard Contribute API Support Discover Movies TV Shows Movies Popular Top Rated Upcoming Now Playing TV Shows Popular Top Rated On TV Airing Today People Popular People Can't find a movie or TV show? Login to create it. en Login Sign Up  ID: 31941   Expand Blue Mountain State   (2010) User Score  Play Trailer Overview Three incoming freshmen attending Midwestern college football powerhouse Blue Mountain State must quickly adapt to college life and juggle football, girls, classes and nonstop hazing. Featured Crew Chris Romano Creator Eric Falconer Creator Discussions   Reviews Videos   Images   Changes Report Share Discussions General  0 Content Issues  0 Images Backdrops  10 Posters  8 Videos Trailers  1 Teasers  0 Clips  0 Featurettes  0 Opening Credits  0 Top Billed Cast Darin Brooks Alex Moran Alan Ritchson Thad Castle Frankie Shaw Mary Jo Cacciatore Chris Romano Sammy Cacciatore Ed Marinaro Coach Marty Daniels Full Cast & Crew Last Season Season 3 2011 | 13 Episodes View All Seasons Social Reviews  0 Discussions  0 Media Most Popular Videos  1 Backdrops  10 Posters  8 Recommendations   2010-06-06 The Hard Times of RJ Berger 7.0    2011-08-05 Friends with Benefits 6.1    2011-02-07 The Chicago Code 7.3    2015-09-12 Goldie & Bear 5.4    2015-06-12 Conspiracy 5.7    2015-01-10 My Sunshine 7.4    2011-03-06 Breakout Kings 6.1    2009-09-28 Ezel 8.2  Facts Status  Ended Network Certification TV-MA Meaning This program is specifically designed to be viewed by adults and therefore may be unsuitable for children under 17 Type  Scripted Original Language  English Runtime  22m Homepage   http://www.spike.com/show/34560/ Genres Comedy Keywords sport american football college young adult Content Score 100 Yes! Looking good! Top Contributors 36 United600 13 Banana b 6 bugfix AK 6 Avshalom Kor  View Edit History Popularity Trend  Login to edit  URL By  signing up  for an account on TMDb, you can post directly to Twitter and Facebook. You need to be logged in to continue. Click  here  to login or  here  to sign up.    page_wrap opened in html_head  Join the Community The Basics About TMDb Contact Us Support Forums API Blog Get Involved  Contribution Bible 3rd Party Applications Add New Movie Add New TV Show Community Guidelines Leaderboard Forums Twitter Facebook Legal Terms of Use Privacy Policy Login Sign Up"}