{"link": "https://www.themoviedb.org/tv/79106?language=en", "title": "L'empire Frankz", "resume": "We don't have an overview translated in English. Help us expand our database by adding one.", "rate": 100, "genre": ["Action", "Adventure", "Comedy"], "cast": ["Andy Warsen", "Lina Fort", "Adrien Elbert", "Mike Dison"], "character": ["Charles Frankz", "Julie Frankz", "Mar\u00e9chal Jouisok", "Colonel Sophia"], "site_data": "html Apps Forums Leaderboard Contribute API Support Discover Movies TV Shows Movies Popular Top Rated Upcoming Now Playing TV Shows Popular Top Rated On TV Airing Today People Popular People Can't find a movie or TV show? Login to create it. en Login Sign Up  ID: 79106   Expand L'empire Frankz   (2009) User Score Overview We don't have an overview translated in English. Help us expand our database by adding one. Featured Crew Hanz Von Baden Creator Dimitri Olypik Creator Discussions   Reviews Videos   Images   Changes Report Share Discussions General  0 Content Issues  0 Images Backdrops  1 Posters  1 Videos Trailers  0 Teasers  0 Clips  0 Featurettes  0 Opening Credits  0 Top Billed Cast Andy Warsen Charles Frankz Lina Fort Julie Frankz Adrien Elbert Mar\u00e9chal Jouisok Mike Dison Colonel Sophia Full Cast & Crew Last Season Season 8 2016 | 6 Episodes Season 8 of L'empire Frankz premiered on June 20, 2016. View All Seasons Social Reviews  0 Discussions  0 Media Most Popular Videos  0 Backdrops  1 Posters  1 Recommendations We don't have enough data to suggest any TV shows based on L'empire Frankz. You can help by rating TV shows you've seen. Facts Status  Returning Series Network TS1 Certification NR Meaning No rating information. Type  Scripted Original Language  French Runtime  - Homepage  - Genres Action & Adventure Comedy Keywords No keywords have been added. Content Score 86 Almost there... Top Contributors C 61 Cin\u00e9man 2 Elizabeth Jennings TB 1 TMDb Bot  View Edit History Popularity Trend  Login to edit  URL By  signing up  for an account on TMDb, you can post directly to Twitter and Facebook. You need to be logged in to continue. Click  here  to login or  here  to sign up.    page_wrap opened in html_head  Join the Community The Basics About TMDb Contact Us Support Forums API Blog Get Involved  Contribution Bible 3rd Party Applications Add New Movie Add New TV Show Community Guidelines Leaderboard Forums Twitter Facebook Legal Terms of Use Privacy Policy Login Sign Up"}