{"link": "https://www.themoviedb.org/tv/58578?language=en", "title": "Total Divas", "resume": "An inside look of the lives of seven WWE Divas from their work within WWE to their personal lives.", "rate": null, "genre": ["Reality"], "cast": ["Brianna Danielson", "Nicole Garcia-Colace", "Natalie Neidhart", "Trinity Fatu", "Maryse Ouellet"], "site_data": "html Apps Forums Leaderboard Contribute API Support Discover Movies TV Shows Movies Popular Top Rated Upcoming Now Playing TV Shows Popular Top Rated On TV Airing Today People Popular People Can't find a movie or TV show? Login to create it. en Login Sign Up  ID: 58578   Expand Total Divas   (2013) User Score  Play Trailer Overview An inside look of the lives of seven WWE Divas from their work within WWE to their personal lives. Discussions   Reviews Videos   Images   Changes Report Share Discussions General  0 Content Issues  0 Images Backdrops  6 Posters  5 Videos Trailers  1 Teasers  0 Clips  0 Featurettes  0 Opening Credits  0 Top Billed Cast Brianna Danielson Herself (as Brie Bella) Nicole Garcia-Colace Herself (as Nikki Bella) Natalie Neidhart Herself (as Natalya) Trinity Fatu Herself Maryse Ouellet Herself Full Cast & Crew Current Season Season 7 2017 | 12 Episodes View All Seasons Social Reviews  0 Discussions  0 Media Most Popular Videos  1 Backdrops  6 Posters  5 Recommendations   1999-04-29 WWE SmackDown Live 7.2  Facts Status  Returning Series Networks Certification TV-14 Meaning This program contains some material that many parents would find unsuitable for children under 14 years of age. Type  Reality Original Language  English Runtime  60m Homepage   http://www.eonline.com/shows/total_divas Genres Reality Keywords twin sister behind the scenes female protagonist ensemble cast female wrestling pro wrestling Content Score 93 Almost there... Top Contributors J 102 Jenn 59 Elizabeth Jennings TB 18 TMDb Bot 13 Rug  View Edit History Popularity Trend  Login to edit  URL By  signing up  for an account on TMDb, you can post directly to Twitter and Facebook. You need to be logged in to continue. Click  here  to login or  here  to sign up.    page_wrap opened in html_head  Join the Community The Basics About TMDb Contact Us Support Forums API Blog Get Involved  Contribution Bible 3rd Party Applications Add New Movie Add New TV Show Community Guidelines Leaderboard Forums Twitter Facebook Legal Terms of Use Privacy Policy Login Sign Up", "character": ["Herself (as Brie Bella)", "Herself (as Nikki Bella)", "Herself (as Natalya)", "Herself", "Herself"]}