{"link": "https://www.themoviedb.org/tv/77606?language=en", "title": "The Boss Baby: Back in Business", "resume": "With a little help from his brother and accomplice, Tim, Boss Baby tries to balance family life with his job at Baby Corp headquarters.", "rate": 64, "genre": ["Animation", "Action", "Adventure", "Comedy"], "cast": ["JP Karliak", "Miles Bakshi", "Eric Bell Jr.", "Jake Green", "Hope Levy"], "character": ["Boss Baby (voice)", "Tim Templeton (voice)", "Triplets (voice)", "Bootsy Calico (voice)", "Janice Templeton (voice)"], "site_data": "html Apps Forums Leaderboard Contribute API Support Discover Movies TV Shows Movies Popular Top Rated Upcoming Now Playing TV Shows Popular Top Rated On TV Airing Today People Popular People Can't find a movie or TV show? Login to create it. en Login Sign Up  ID: 77606   Expand The Boss Baby: Back in Business   (2018) User Score  Play Trailer Overview With a little help from his brother and accomplice, Tim, Boss Baby tries to balance family life with his job at Baby Corp headquarters. Featured Crew Brandon Sawyer Creator Discussions   Reviews Videos   Images   Changes Report Share Discussions General  0 Content Issues  0 Images Backdrops  1 Posters  2 Videos Trailers  1 Teasers  0 Clips  0 Featurettes  0 Opening Credits  0 Top Billed Cast JP Karliak Boss Baby (voice) Miles Bakshi Tim Templeton (voice) Eric Bell Jr. Triplets (voice) Jake Green Bootsy Calico (voice) Hope Levy Janice Templeton (voice) Full Cast & Crew Current Season Season 1 2018 | 13 Episodes Season 1 of The Boss Baby: Back in Business premiered on April  6, 2018. View All Seasons Social Reviews  0 Discussions  0 Media Most Popular Videos  1 Backdrops  1 Posters  2 Recommendations We don't have enough data to suggest any TV shows based on The Boss Baby: Back in Business. You can help by rating TV shows you've seen. Facts Status  Returning Series Network Certification TV-Y7 Meaning This program is designed for children age 7 and above. Type  Scripted Original Language  English Runtime  24m Homepage   https://www.netflix.com/us/title/80178943 Genres Animation Action & Adventure Comedy Keywords baby Content Score 100 Yes! Looking good! Top Contributors 46 Mikedeth5 9 Elizabeth Jennings M 9 MokoNoTora 6 Baloralys  View Edit History Popularity Trend  Login to edit  URL By  signing up  for an account on TMDb, you can post directly to Twitter and Facebook. You need to be logged in to continue. Click  here  to login or  here  to sign up.    page_wrap opened in html_head  Join the Community The Basics About TMDb Contact Us Support Forums API Blog Get Involved  Contribution Bible 3rd Party Applications Add New Movie Add New TV Show Community Guidelines Leaderboard Forums Twitter Facebook Legal Terms of Use Privacy Policy Login Sign Up"}