{"link": "https://www.themoviedb.org/tv/72755?language=en", "title": "Absentia", "resume": "A missing FBI agent reappears six years after being declared dead.", "rate": 74, "genre": ["Crime", "Drama", "Mystery"], "cast": ["Stana Katic", "Angel Bonnani", "Borislava Stratieva", "Patrick Heusinger", "Christopher Colquhoun"], "character": ["Emily Byrne", "Tommy Gibbs", "Violet", "Nick Durand", "Agent Crown"], "site_data": "html Apps Forums Leaderboard Contribute API Support Discover Movies TV Shows Movies Popular Top Rated Upcoming Now Playing TV Shows Popular Top Rated On TV Airing Today People Popular People Can't find a movie or TV show? Login to create it. en Login Sign Up  ID: 72755   Expand Absentia   (2017) User Score  Play Trailer Overview A missing FBI agent reappears six years after being declared dead. Featured Crew Matthew Cirulnick Creator Gaia Violo Creator Discussions   Reviews Videos   Images   Changes Report Share Discussions General  1 Content Issues  0 Images Backdrops  6 Posters  5 Videos Trailers  1 Teasers  2 Clips  0 Featurettes  0 Opening Credits  0 Top Billed Cast Stana Katic Emily Byrne Angel Bonnani Tommy Gibbs Borislava Stratieva Violet Patrick Heusinger Nick Durand Christopher Colquhoun Agent Crown Full Cast & Crew Last Season Season 1 2017 | 10 Episodes Season 1 of Absentia premiered on September 25, 2017. View All Seasons Social Reviews  1 Discussions  1 A review by Girl lost in seriation  4.0 Written by  Girl lost in seriation  on June  3, 2018 Absentia  follows Emily Byrne, an FBI agent who, after disappearing and being declared dead, reappears six years later and without memories. The attempt to reconnect with her son and her husband who has remarried, are in the middle of the investigation in the past of Emily and a dangerous serial killer. Absentia  is also the  Stana Katic  ( Castle ) project for Amazon. While the series takes an interesting and strong premise as a basis, it only holds on the interpretations, accurate and correct, of the novel casting. The incessant attempt to maintain a dark atmosphere through silence...  read the rest. Read All Reviews Media Most Popular Videos  3 Backdrops  6 Posters  5 Recommendations   2018-01-06 Hard Sun 7.4    2017-09-11 Liar 6.8    2017-06-15 Riviera 5.4    2016-10-19 Chance 7.3    2017-10-01 Ten Days in the Valley 6.0    2017-08-09 Mr. Mercedes 7.1    2016-09-25 Nobel 8.5    2017-01-25 Cardinal 6.9  Facts Status  Returning Series Network Certification  - Type  Scripted Original Language  English Runtime  44m Homepage   https://www.absentia.tv/ Genres Crime Drama Mystery Keywords fbi agent missing person Content Score 100 Yes! Looking good! Top Contributors 55 Elizabeth Jennings t 24 tmdb42368388 20 colonelgrant v 14 vinil2004c@gmail.com  View Edit History Popularity Trend  Login to edit  URL By  signing up  for an account on TMDb, you can post directly to Twitter and Facebook. You need to be logged in to continue. Click  here  to login or  here  to sign up.    page_wrap opened in html_head  Join the Community The Basics About TMDb Contact Us Support Forums API Blog Get Involved  Contribution Bible 3rd Party Applications Add New Movie Add New TV Show Community Guidelines Leaderboard Forums Twitter Facebook Legal Terms of Use Privacy Policy Login Sign Up"}