{"link": "https://www.themoviedb.org/tv/29602?language=en", "title": "Major", "resume": "We don't have an overview translated in English. Help us expand our database by adding one.", "rate": 0, "genre": ["Animation"], "cast": ["Showtaro Morikubo", "Masakazu Morita", "Noriko Hidaka", "Junko Noda", "Fuyuka Ono"], "character": ["Gor\u014d Shigeno (voice)", "Toshiya Sato (voice)", "Chiaki Honda (voice)", "Momoko Hoshino (voice)", "Toshiya Sato (voice)"], "site_data": "html Apps Forums Leaderboard Contribute API Support Discover Movies TV Shows Movies Popular Top Rated Upcoming Now Playing TV Shows Popular Top Rated On TV Airing Today People Popular People Can't find a movie or TV show? Login to create it. en Login Sign Up  ID: 29602   Expand Major   (2004) User Score Overview We don't have an overview translated in English. Help us expand our database by adding one. Featured Crew Mitsuda Takuya Creator Discussions   Reviews Videos   Images   Changes Report Share Discussions General  0 Content Issues  0 Images Backdrops  3 Posters  3 Videos Trailers  0 Teasers  0 Clips  0 Featurettes  0 Opening Credits  0 Top Billed Cast Showtaro Morikubo Gor\u014d Shigeno (voice) Masakazu Morita Toshiya Sato (voice) Noriko Hidaka Chiaki Honda (voice) Junko Noda Momoko Hoshino (voice) Fuyuka Ono Toshiya Sato (voice) Full Cast & Crew Last Season Season 6 2010 | 25 Episodes Season 6 of Major premiered on April  3, 2010. View All Seasons Social Reviews  0 Discussions  0 Media Most Popular Videos  0 Backdrops  3 Posters  3 Recommendations We don't have enough data to suggest any TV shows based on Major. You can help by rating TV shows you've seen. Facts Original Name  \u30e1\u30b8\u30e3\u30fc Status  Ended Network Certification  - Type  Scripted Original Language  Japanese Runtime  25m Homepage   http://www9.nhk.or.jp/anime/major/ Genres Animation Keywords baseball based on manga Content Score 86 Almost there... Top Contributors 170 United600 QS 6 Quick Share 4 seboseboss 3 rtker  View Edit History Popularity Trend  Login to edit  URL By  signing up  for an account on TMDb, you can post directly to Twitter and Facebook. You need to be logged in to continue. Click  here  to login or  here  to sign up.    page_wrap opened in html_head  Join the Community The Basics About TMDb Contact Us Support Forums API Blog Get Involved  Contribution Bible 3rd Party Applications Add New Movie Add New TV Show Community Guidelines Leaderboard Forums Twitter Facebook Legal Terms of Use Privacy Policy Login Sign Up"}