{"link": "https://www.themoviedb.org/tv/4396?language=en", "title": "Northern Exposure", "resume": "After receiving a scholarship from the state, a recent Columbia University medical school graduate is required to set up his practice in an eccentric Alaskan town.", "rate": 81, "genre": ["Comedy", "Drama"], "cast": ["Rob Morrow", "Janine Turner", "Barry Corbin", "John Cullum", "Darren E. Burrows"], "character": ["Joel Fleischman", "Maggie O'Connell", "Maurice Minnifield", "Holling Vincoeur", "Ed Chigliak"], "site_data": "html Apps Forums Leaderboard Contribute API Support Discover Movies TV Shows Movies Popular Top Rated Upcoming Now Playing TV Shows Popular Top Rated On TV Airing Today People Popular People Can't find a movie or TV show? Login to create it. en Login Sign Up  ID: 4396   Expand Northern Exposure   (1990) User Score Overview After receiving a scholarship from the state, a recent Columbia University medical school graduate is required to set up his practice in an eccentric Alaskan town. Featured Crew Joshua Brand Creator John Falsey Creator Discussions   Reviews Videos   Images   Changes Report Share Discussions General  2 Content Issues  0 Images Backdrops  6 Posters  5 Videos Trailers  0 Teasers  0 Clips  0 Featurettes  0 Opening Credits  0 Top Billed Cast Rob Morrow Joel Fleischman Janine Turner Maggie O'Connell Barry Corbin Maurice Minnifield John Cullum Holling Vincoeur Darren E. Burrows Ed Chigliak Full Cast & Crew Last Season Season 6 1994 | 23 Episodes View All Seasons Social Reviews  0 Discussions  2 Subject Status Replies Last Reply PE \"Old Tree\" finale Open 3 by  Invidia PE \"Dr. Fleischman, call on line one\" Open 3 by  Invidia Go to Discussions Media Most Popular Videos  0 Backdrops  6 Posters  5 Recommendations   1995-09-13 The Drew Carey Show 6.4    1998-09-29 Felicity 6.5    1990-04-19 Wings 6.7    1997-03-04 Just Shoot Me! 6.4    1990-04-15 In Living Color 7.5    1982-09-25 Silver Spoons 5.1    1984-09-20 The Cosby Show 6.8    1976-01-27 Laverne & Shirley 6.7  Facts Status  Ended Network Certification M Meaning Recommended for mature audiences; M-rated content may only be broadcast between 8:30 p.m. and 5:00 a.m. on any day, and additionally between 12:00 p.m. and 3:00 p.m. on schooldays. Type  Scripted Original Language  English Runtime  45m Homepage  - Genres Comedy Drama Keywords small town native american alaska general practitioner (gp) simpler life Content Score 93 Almost there... Top Contributors 122 United600 17 Elizabeth Jennings 17 Banana 9 efeka  View Edit History Popularity Trend  Login to edit  URL By  signing up  for an account on TMDb, you can post directly to Twitter and Facebook. You need to be logged in to continue. Click  here  to login or  here  to sign up.    page_wrap opened in html_head  Join the Community The Basics About TMDb Contact Us Support Forums API Blog Get Involved  Contribution Bible 3rd Party Applications Add New Movie Add New TV Show Community Guidelines Leaderboard Forums Twitter Facebook Legal Terms of Use Privacy Policy Login Sign Up"}