{"link": "https://www.themoviedb.org/tv/68349?language=en", "title": "Weightlifting Fairy Kim Bok-Joo", "resume": "A spunky female weightlifter and free-spirited male swimmer meet on campus, only to find out their pasts may be intertwined.", "rate": 89, "genre": ["Comedy"], "cast": ["Lee Sung-kyung", "Nam Joo-hyuk", "Kyung Soo-jin", "Lee Jae-yoon", "Cho Hye-jung"], "character": ["Kim Bok Joo", "Jung Joon Hyung", "Song Shi Ho", "Jung Jae Yi", "Jung Nan Hee"], "site_data": "html Apps Forums Leaderboard Contribute API Support Discover Movies TV Shows Movies Popular Top Rated Upcoming Now Playing TV Shows Popular Top Rated On TV Airing Today People Popular People Can't find a movie or TV show? Login to create it. en Login Sign Up  ID: 68349   Expand Weightlifting Fairy Kim Bok-Joo   (2016) User Score  Play Trailer Overview A spunky female weightlifter and free-spirited male swimmer meet on campus, only to find out their pasts may be intertwined. Discussions   Reviews Videos   Images   Changes Report Share Discussions General  0 Content Issues  0 Images Backdrops  6 Posters  4 Videos Trailers  1 Teasers  0 Clips  0 Featurettes  0 Opening Credits  0 Top Billed Cast Lee Sung-kyung Kim Bok Joo Nam Joo-hyuk Jung Joon Hyung Kyung Soo-jin Song Shi Ho Lee Jae-yoon Jung Jae Yi Cho Hye-jung Jung Nan Hee Full Cast & Crew Last Season Season 1 2016 | 16 Episodes View All Seasons Social Reviews  0 Discussions  0 Media Most Popular Videos  1 Backdrops  6 Posters  4 Recommendations   2016-01-04 Cheese in the Trap 7.0    2015-05-15 The Producers 7.3    2015-06-08 High Society 8.3    2016-11-16 Oh My Geum Bi 8.7    2016-09-23 The K2 5.1    2016-07-11 Bring It On, Ghost 6.9    2017-04-17 My Secret Romance 7.6    2016-08-12 Cinderella and Four Knights 5.8  Facts Original Name  \uc5ed\ub3c4\uc694\uc815 \uae40\ubcf5\uc8fc Status  Ended Network Certification 15 Meaning This rating is for programs that contain material that may be inappropriate for children under 15, and that parental discretion should be used. Examples include most dramas, and talk shows on OTA (over-the-air) TV (KBS, MBC, SBS), and many American TV shows/dramas on Cable TV channels like OCN and OnStyle. The programs that have this rating may include moderate or strong adult themes, language, sexual inference, and violence. As with the TV-MA rating in North America, this rating is commonly applied to live events where the occurrence of inappropriate dialogue is unpredictable. Since 2007, this rating is the most used rating for TV. Type  Scripted Original Language  Korean Runtime  60m Homepage   http://www.imbc.com/broad/tv/drama/bokjoo/ Genres Comedy Keywords sport college romance korea Content Score 93 Almost there... Top Contributors s 35 sheva_vitali M 32 Maria180493 10 rychoi 6 Animexla  View Edit History Popularity Trend  Login to edit  URL By  signing up  for an account on TMDb, you can post directly to Twitter and Facebook. You need to be logged in to continue. Click  here  to login or  here  to sign up.    page_wrap opened in html_head  Join the Community The Basics About TMDb Contact Us Support Forums API Blog Get Involved  Contribution Bible 3rd Party Applications Add New Movie Add New TV Show Community Guidelines Leaderboard Forums Twitter Facebook Legal Terms of Use Privacy Policy Login Sign Up"}