{"link": "https://www.themoviedb.org/tv/68018?language=en", "title": "The Blacklist: Redemption", "resume": "Covert operative Tom Keen joins forces with Susan \"Scottie\" Hargrave, the brilliant and cunning chief of a covert mercenary organization that solves problems that are too dangerous for the government.", "rate": 66, "genre": ["Crime", "Drama"], "cast": ["Ryan Eggold", "Famke Janssen", "Edi Gathegi", "Tawny Cypress", "Adrian Martinez"], "character": ["Tom Keen / Jacob Phelps / Christopher Hargrave", "Susan \"Scottie\" Hargrave", "Matias Solomon", "Nez Rowan", "Dumont"], "site_data": "html Apps Forums Leaderboard Contribute API Support Discover Movies TV Shows Movies Popular Top Rated Upcoming Now Playing TV Shows Popular Top Rated On TV Airing Today People Popular People Can't find a movie or TV show? Login to create it. en Login Sign Up  ID: 68018   Expand The Blacklist: Redemption   (2017) User Score Overview Covert operative Tom Keen joins forces with Susan \"Scottie\" Hargrave, the brilliant and cunning chief of a covert mercenary organization that solves problems that are too dangerous for the government. Featured Crew Jon Bokenkamp Creator John Eisendrath Creator Discussions   Reviews Videos   Images   Changes Report Share Discussions General  9 Content Issues  0 Images Backdrops  12 Posters  6 Videos Trailers  0 Teasers  0 Clips  0 Featurettes  0 Opening Credits  0 Top Billed Cast Ryan Eggold Tom Keen / Jacob Phelps / Christopher Hargrave Famke Janssen Susan \"Scottie\" Hargrave Edi Gathegi Matias Solomon Tawny Cypress Nez Rowan Adrian Martinez Dumont Full Cast & Crew Last Season Season 1 2017 | 8 Episodes Season 1 of The Blacklist: Redemption premiered on February 23, 2017. View All Seasons Social Reviews  0 Discussions  9 Subject Status Replies Last Reply Backdoor Finale Open 0 by RodimusConvoy\n      \n     Cancelled! :'( Open 1 by  GForce59 I so love the banter between Keen and Solomon Open 1 by  Momsacorn Go to Discussions Media Most Popular Videos  0 Backdrops  12 Posters  6 Recommendations   2016-10-31 Stan Against Evil 6.7    2018-06-04 Dietland 8.0    2008-02-07 Lipstick Jungle 4.7    2016-01-03 Cooper Barrett's Guide to Surviving Life 5.1    2016-11-30 Incorporated 6.1    2017-02-07 Imposters 7.6    2013-09-23 The Blacklist 7.0    2018-03-13 Rise 6.8  Facts Status  Cancelled Network Certification  - Type  Scripted Original Language  English Runtime  42m Homepage   http://www.nbc.com/the-blacklist-redemption Genres Crime Drama Keywords mercenary thriller spin off Content Score 93 Almost there... Top Contributors p 29 paf69 28 Banana z 15 zurman1 b 10 brkulin  View Edit History Popularity Trend  Login to edit  URL By  signing up  for an account on TMDb, you can post directly to Twitter and Facebook. You need to be logged in to continue. Click  here  to login or  here  to sign up.    page_wrap opened in html_head  Join the Community The Basics About TMDb Contact Us Support Forums API Blog Get Involved  Contribution Bible 3rd Party Applications Add New Movie Add New TV Show Community Guidelines Leaderboard Forums Twitter Facebook Legal Terms of Use Privacy Policy Login Sign Up"}