{"link": "https://www.themoviedb.org/tv/61828?language=en", "title": "Detectorists", "resume": "The lives of two eccentric metal detectorists, who spend their days plodding along ploughed tracks and open fields, hoping to disturb the tedium by unearthing the fortune of a lifetime.", "rate": 86, "genre": ["Comedy"], "cast": ["Mackenzie Crook", "Toby Jones", "Rachael Stirling", "Gerard Horan", "Divian Ladwa"], "character": ["Andy", "Lance", "Becky", "Terry", "Hugh"], "site_data": "html Apps Forums Leaderboard Contribute API Support Discover Movies TV Shows Movies Popular Top Rated Upcoming Now Playing TV Shows Popular Top Rated On TV Airing Today People Popular People Can't find a movie or TV show? Login to create it. en Login Sign Up  ID: 61828   Expand Detectorists   (2014) User Score  Play Trailer Overview The lives of two eccentric metal detectorists, who spend their days plodding along ploughed tracks and open fields, hoping to disturb the tedium by unearthing the fortune of a lifetime. Featured Crew Mackenzie Crook Creator Discussions   Reviews Videos   Images   Changes Report Share Discussions General  0 Content Issues  1 Images Backdrops  9 Posters  5 Videos Trailers  1 Teasers  0 Clips  0 Featurettes  0 Opening Credits  0 Top Billed Cast Mackenzie Crook Andy Toby Jones Lance Rachael Stirling Becky Gerard Horan Terry Divian Ladwa Hugh Full Cast & Crew Current Season Series 3 2017 | 6 Episodes View All Seasons Social Reviews  0 Discussions  1 Subject Status Replies Last Reply There are no discussions for Detectorists. Login to be first! Go to Discussions Media Most Popular Videos  1 Backdrops  9 Posters  5 Recommendations   2015-12-24 Dawn of the Croods 6.6    2011-02-08 Traffic Light 7.2    2014-04-28 Heartless 5.9    2015-08-20 Documentary Now! 7.5    2015-12-01 Real Rob 5.8    2015-06-18 Hoff the Record 6.0    2017-01-01 Beau S\u00e9jour 7.9    2015-04-29 Peter Kay's Car Share 7.5  Facts Status  Ended Network Certification TV-14 Meaning This program contains some material that many parents would find unsuitable for children under 14 years of age. Type  Scripted Original Language  English Runtime  30m Homepage   http://www.bbc.co.uk/programmes/b06l51nr Genres Comedy Keywords england metal detector eccentric sitcom british humour treasure hunter Content Score 100 Yes! Looking good! Top Contributors 63 Elizabeth Jennings 23 Steve 14 EveDemocracy O 8 Ozbourne  View Edit History Popularity Trend  Login to edit  URL By  signing up  for an account on TMDb, you can post directly to Twitter and Facebook. You need to be logged in to continue. Click  here  to login or  here  to sign up.    page_wrap opened in html_head  Join the Community The Basics About TMDb Contact Us Support Forums API Blog Get Involved  Contribution Bible 3rd Party Applications Add New Movie Add New TV Show Community Guidelines Leaderboard Forums Twitter Facebook Legal Terms of Use Privacy Policy Login Sign Up"}