{"link": "https://www.themoviedb.org/tv/65150?language=en", "title": "Vice Principals", "resume": "The story of a high school and the people who almost run it, the vice principals.", "rate": 68, "genre": ["Comedy"], "cast": ["Walton Goggins", "Danny McBride", "Kimberly Hebert Gregory", "Georgia King", "Busy Philipps"], "character": ["Lee Russell", "Neal Gamby", "Dr. Belinda Brown", "Amanda Snodgrass", "Gale Liptrapp"], "site_data": "html Apps Forums Leaderboard Contribute API Support Discover Movies TV Shows Movies Popular Top Rated Upcoming Now Playing TV Shows Popular Top Rated On TV Airing Today People Popular People Can't find a movie or TV show? Login to create it. en Login Sign Up  ID: 65150   Expand Vice Principals   (2016) User Score Overview The story of a high school and the people who almost run it, the vice principals. Featured Crew Danny McBride Creator Jody Hill Creator Discussions   Reviews Videos   Images   Changes Report Share Discussions General  1 Content Issues  0 Images Backdrops  3 Posters  10 Videos Trailers  0 Teasers  1 Clips  0 Featurettes  0 Opening Credits  0 Top Billed Cast Walton Goggins Lee Russell Danny McBride Neal Gamby Kimberly Hebert Gregory Dr. Belinda Brown Georgia King Amanda Snodgrass Busy Philipps Gale Liptrapp Full Cast & Crew Last Season Season 2 2017 | 9 Episodes Season 2 of Vice Principals premiered on September 17, 2017. View All Seasons Social Reviews  0 Discussions  1 Subject Status Replies Last Reply S Still no word on when Season 2 airs? Open 4 by  bwbphile Go to Discussions Media Most Popular Videos  1 Backdrops  3 Posters  10 Recommendations   2015-06-21 The Brink 6.9    2009-02-15 Eastbound & Down 7.4    2014-06-21 Almost Royal 6.5    2016-01-21 Baskets 7.2    2010-09-19 Behzat \u00c7.: Bir Ankara Polisiyesi 7.2    2008-02-17 The Last Enemy 6.8    1998-08-19 Upright Citizens Brigade 8.0    2010-03-17 Ugly Americans 6.9  Facts Status  Ended Network Certification TV-MA Meaning This program is specifically designed to be viewed by adults and therefore may be unsuitable for children under 17 Type  Miniseries Original Language  English Runtime  32m Homepage   http://www.hbo.com/vice-principals Genres Comedy Keywords high school dark comedy alcoholism underage drinking vice principal Content Score 100 Yes! Looking good! Top Contributors 42 jsncnly 38 lineker 37 Elizabeth Jennings 34 Warpath  View Edit History Popularity Trend  Login to edit  URL By  signing up  for an account on TMDb, you can post directly to Twitter and Facebook. You need to be logged in to continue. Click  here  to login or  here  to sign up.    page_wrap opened in html_head  Join the Community The Basics About TMDb Contact Us Support Forums API Blog Get Involved  Contribution Bible 3rd Party Applications Add New Movie Add New TV Show Community Guidelines Leaderboard Forums Twitter Facebook Legal Terms of Use Privacy Policy Login Sign Up"}