{"link": "https://www.themoviedb.org/tv/71815?language=en", "title": "Wisdom of the Crowd", "resume": "A tech innovator creates a cutting-edge crowd-sourcing hub to solve his own daughter's murder, as well as revolutionizing crime solving in San Francisco.", "rate": null, "genre": ["Crime", "Drama"], "cast": ["Jeremy Piven", "Natalia Tena", "Richard T. Jones", "Monica Potter", "Blake Lee"], "site_data": "html Apps Forums Leaderboard Contribute API Support Discover Movies TV Shows Movies Popular Top Rated Upcoming Now Playing TV Shows Popular Top Rated On TV Airing Today People Popular People Can't find a movie or TV show? Login to create it. en Login Sign Up  ID: 71815   Expand Wisdom of the Crowd   (2017) User Score  Play Trailer Overview A tech innovator creates a cutting-edge crowd-sourcing hub to solve his own daughter's murder, as well as revolutionizing crime solving in San Francisco. Featured Crew Ted Humphrey Creator Discussions   Reviews Videos   Images   Changes Report Share Discussions General  1 Content Issues  1 Images Backdrops  3 Posters  3 Videos Trailers  1 Teasers  0 Clips  0 Featurettes  0 Opening Credits  0 Top Billed Cast Jeremy Piven Jeffrey Tanner Natalia Tena Sarah Richard T. Jones Detective Cavanaugh Monica Potter Alex Blake Lee Josh Novak Full Cast & Crew Last Season Season 1 2017 | 13 Episodes Season 1 of Wisdom of the Crowd premiered on September 30, 2017. View All Seasons Social Reviews  0 Discussions  2 Subject Status Replies Last Reply Alex finally getting called out (Spoilers) Open 0 by Heidi\n      \n     Go to Discussions Media Most Popular Videos  1 Backdrops  3 Posters  3 Recommendations   2017-09-25 The Brave 6.6    2017-10-01 Ghosted 6.2    2017-09-27 SEAL Team 6.6    2016-10-10 Freakish 5.8    2016-10-31 Stan Against Evil 6.7    2017-11-02 S.W.A.T. 6.6    2017-09-26 Law & Order True Crime 5.8    2017-10-09 Valor 6.3  Facts Status  Cancelled Network Certification TV-14 Meaning This program contains some material that many parents would find unsuitable for children under 14 years of age. Type  Scripted Original Language  English Runtime  43m Homepage   http://www.cbs.com/shows/wisdom-of-the-crowd/ Genres Crime Drama Keywords technology investigation murder innovation criminal consultant information technology Content Score 100 Yes! Looking good! Top Contributors 41 Warpath 39 Banana 13 Nero Kosonen 7 Elizabeth Jennings  View Edit History Popularity Trend  Login to edit  URL By  signing up  for an account on TMDb, you can post directly to Twitter and Facebook. You need to be logged in to continue. Click  here  to login or  here  to sign up.    page_wrap opened in html_head  Join the Community The Basics About TMDb Contact Us Support Forums API Blog Get Involved  Contribution Bible 3rd Party Applications Add New Movie Add New TV Show Community Guidelines Leaderboard Forums Twitter Facebook Legal Terms of Use Privacy Policy Login Sign Up", "character": ["Jeffrey Tanner", "Sarah", "Detective Cavanaugh", "Alex", "Josh Novak"]}