{"link": "https://www.themoviedb.org/tv/73175?language=en", "title": "The State", "resume": "The experiences of four British men and women who leave their lives behind to join ISIS in Syria.", "rate": null, "genre": ["Drama"], "cast": ["Sam Otto", "Ryan McKen", "Ony Uhiara", "Shavani Seth", "Ali Suliman"], "site_data": "html Apps Forums Leaderboard Contribute API Support Discover Movies TV Shows Movies Popular Top Rated Upcoming Now Playing TV Shows Popular Top Rated On TV Airing Today People Popular People Can't find a movie or TV show? Login to create it. en Login Sign Up  ID: 73175   Expand The State   (2017) User Score  Play Trailer Overview The experiences of four British men and women who leave their lives behind to join ISIS in Syria. Featured Crew Peter Kosminsky Creator Discussions   Reviews Videos   Images   Changes Report Share Discussions General  0 Content Issues  0 Images Backdrops  7 Posters  3 Videos Trailers  2 Teasers  0 Clips  0 Featurettes  0 Opening Credits  0 Top Billed Cast Sam Otto Jalal Ryan McKen Ziyad Ony Uhiara Shakira Shavani Seth Ushna Ali Suliman Abu Omar Full Cast & Crew Last Season Season 1 2017 | 4 Episodes Season 1 of The State premiered on August 20, 2017. View All Seasons Social Reviews  0 Discussions  0 Media Most Popular Videos  2 Backdrops  7 Posters  3 Recommendations We don't have enough data to suggest any TV shows based on The State. You can help by rating TV shows you've seen. Facts Status  Ended Networks Certification 12 Meaning The broadcaster must take the decision about the air time by taking in consideration the impact on young children in the timeframe from 6:00am to 8:00pm. Type  Miniseries Original Language  English Runtime  50m Homepage   http://www.channel4.com/programmes/the-state Genres Drama Keywords terrorism syria islamic state isis Content Score 100 Yes! Looking good! Top Contributors p 25 plumpro 17 Elizabeth Jennings w 15 woogoldsgreat 7 Goffred0  View Edit History Popularity Trend  Login to edit  URL By  signing up  for an account on TMDb, you can post directly to Twitter and Facebook. You need to be logged in to continue. Click  here  to login or  here  to sign up.    page_wrap opened in html_head  Join the Community The Basics About TMDb Contact Us Support Forums API Blog Get Involved  Contribution Bible 3rd Party Applications Add New Movie Add New TV Show Community Guidelines Leaderboard Forums Twitter Facebook Legal Terms of Use Privacy Policy Login Sign Up", "character": ["Jalal", "Ziyad", "Shakira", "Ushna", "Abu Omar"]}