{"link": "https://www.themoviedb.org/tv/50628?language=en", "title": "Intelligence", "resume": "A drama centered on a high-tech intelligence operative who is enhanced with a super-computer microchip in his brain, and the director of the elite government cyber-security agency who supports him.", "rate": null, "genre": ["Action", "Adventure", "Sci-Fi", "Fantasy"], "cast": ["Josh Holloway", "Meghan Ory", "John Billingsley", "P. J. Byrne", "Michael Rady"], "site_data": "html Apps Forums Leaderboard Contribute API Support Discover Movies TV Shows Movies Popular Top Rated Upcoming Now Playing TV Shows Popular Top Rated On TV Airing Today People Popular People Can't find a movie or TV show? Login to create it. en Login Sign Up  ID: 50628   Expand Intelligence   (2014) User Score Overview A drama centered on a high-tech intelligence operative who is enhanced with a super-computer microchip in his brain, and the director of the elite government cyber-security agency who supports him. Featured Crew Michael Seitzman Creator Discussions   Reviews Videos   Images   Changes Report Share Discussions General  0 Content Issues  0 Images Backdrops  2 Posters  4 Videos Trailers  0 Teasers  0 Clips  0 Featurettes  0 Opening Credits  0 Top Billed Cast Josh Holloway Gabriel Black Meghan Ory Riley O'Neil John Billingsley Dr. William Crispin P. J. Byrne Nelson Michael Rady Chris Jameson Full Cast & Crew Last Season Season 1 2014 | 13 Episodes Season 1 of Intelligence premiered on January  7, 2014. View All Seasons Social Reviews  0 Discussions  0 Media Most Popular Videos  0 Backdrops  2 Posters  4 Recommendations   2013-10-09 The Tomorrow People 6.6    2013-11-17 Almost Human 7.0    2014-03-10 Believe 6.3    2011-09-20 Unforgettable 6.1    2008-12-07 Leverage 7.2    2012-07-09 Perception 6.7    2009-07-07 Warehouse 13 7.2    2011-07-11 Alphas 6.5  Facts Status  Ended Network Certification TV-14 Meaning This program contains some material that many parents would find unsuitable for children under 14 years of age. Type  Scripted Original Language  English Runtime  45m Homepage   http://www.cbs.com/shows/intelligence Genres Action & Adventure Sci-Fi & Fantasy Keywords intelligence agent intelligence officer cybersecurity computer in brain Content Score 100 Yes! Looking good! Top Contributors 140 seawolf 13 Elizabeth Jennings f 8 furkan-guven0115 6 Banana  View Edit History Popularity Trend  Login to edit  URL By  signing up  for an account on TMDb, you can post directly to Twitter and Facebook. You need to be logged in to continue. Click  here  to login or  here  to sign up.    page_wrap opened in html_head  Join the Community The Basics About TMDb Contact Us Support Forums API Blog Get Involved  Contribution Bible 3rd Party Applications Add New Movie Add New TV Show Community Guidelines Leaderboard Forums Twitter Facebook Legal Terms of Use Privacy Policy Login Sign Up", "character": ["Gabriel Black", "Riley O'Neil", "Dr. William Crispin", "Nelson", "Chris Jameson"]}