{"link": "https://www.themoviedb.org/tv/61431?language=en", "title": "Les petits meurtres d'Agatha Christie", "resume": "We don't have an overview translated in English. Help us expand our database by adding one.", "rate": 83, "genre": ["Crime", "Mystery"], "cast": ["Antoine Dul\u00e9ry", "Marius Colucci", "Samuel Labarthe", "Blandine Bellavoir", "Elodie Frenck"], "character": ["Commissaire Larosi\u00e8re", "Emile Lampion", "Swan Laurence", "Alice Avril", "Marl\u00e8ne"], "site_data": "html Apps Forums Leaderboard Contribute API Support Discover Movies TV Shows Movies Popular Top Rated Upcoming Now Playing TV Shows Popular Top Rated On TV Airing Today People Popular People Can't find a movie or TV show? Login to create it. en Login Sign Up  ID: 61431   Expand Les petits meurtres d'Agatha Christie   (2009) User Score Overview We don't have an overview translated in English. Help us expand our database by adding one. Featured Crew Agatha Christie Creator Sylvie Simon Creator Thierry Debroux Creator Discussions   Reviews Videos   Images   Changes Report Share Discussions General  0 Content Issues  0 Images Backdrops  3 Posters  3 Videos Trailers  0 Teasers  0 Clips  0 Featurettes  0 Opening Credits  0 Top Billed Cast Antoine Dul\u00e9ry Commissaire Larosi\u00e8re Marius Colucci Emile Lampion Samuel Labarthe Swan Laurence Blandine Bellavoir Alice Avril Elodie Frenck Marl\u00e8ne Full Cast & Crew Last Season Season 2 2013 | 23 Episodes Season 2 of Les petits meurtres d'Agatha Christie premiered on March 29, 2013. View All Seasons Social Reviews  0 Discussions  0 Media Most Popular Videos  0 Backdrops  3 Posters  3 Recommendations   2010-07-25 Sherlock 8.3  Facts Status  Returning Series Network Certification C8 Meaning Suitable for children ages 8+. Low level violence and fantasy horror is allowed. No foul language is allowed, but occasional \"socially offensive and discriminatory\" language is allowed if in the context of the story. No sexual content of any level allowed. Type  Scripted Original Language  French Runtime  90m Homepage   https://www.mondofox.it/little-murders-by-agatha-christie/ Genres Crime Mystery Keywords based on novel or book period drama murder investigation murder mystery Content Score 86 Almost there... Top Contributors z 61 zoroman2017 t 50 tmdb18595655 F 27 Frigor M 25 Manu  View Edit History Popularity Trend  Login to edit  URL By  signing up  for an account on TMDb, you can post directly to Twitter and Facebook. You need to be logged in to continue. Click  here  to login or  here  to sign up.    page_wrap opened in html_head  Join the Community The Basics About TMDb Contact Us Support Forums API Blog Get Involved  Contribution Bible 3rd Party Applications Add New Movie Add New TV Show Community Guidelines Leaderboard Forums Twitter Facebook Legal Terms of Use Privacy Policy Login Sign Up"}