{"link": "https://www.themoviedb.org/tv/19566?language=en", "title": "Frank Herbert's Dune", "resume": "Frank Herbert's Dune is a three-part miniseries written and directed by John Harrison and based on Frank Herbert's 1965 novel Dune.", "rate": 68, "genre": ["Sci-Fi", "Fantasy", "Drama"], "cast": ["William Hurt", "Matt Keeslar", "Saskia Reeves", "P.H. Moriarty", "Ian McNeice"], "character": ["Duke Leto Atreides", "Feyd-Rautha Harkonnen", "Lady Jessica Atreides", "Gurney Halleck", "Baron Vladimir Harkonnen"], "site_data": "html Apps Forums Leaderboard Contribute API Support Discover Movies TV Shows Movies Popular Top Rated Upcoming Now Playing TV Shows Popular Top Rated On TV Airing Today People Popular People Can't find a movie or TV show? Login to create it. en Login Sign Up  ID: 19566   Expand Frank Herbert's Dune   (2000) User Score  Play Trailer Overview Frank Herbert's Dune is a three-part miniseries written and directed by John Harrison and based on Frank Herbert's 1965 novel Dune. Featured Crew John Harrison Creator Discussions   Reviews Videos   Images   Changes Report Share Discussions General  0 Content Issues  0 Images Backdrops  6 Posters  5 Videos Trailers  1 Teasers  0 Clips  0 Featurettes  0 Opening Credits  0 Top Billed Cast William Hurt Duke Leto Atreides Matt Keeslar Feyd-Rautha Harkonnen Saskia Reeves Lady Jessica Atreides P.H. Moriarty Gurney Halleck Ian McNeice Baron Vladimir Harkonnen Full Cast & Crew Last Season Season 1 2000 | 3 Episodes Season 1 of Frank Herbert's Dune premiered on December  3, 2000. View All Seasons Social Reviews  0 Discussions  0 Media Most Popular Videos  1 Backdrops  6 Posters  5 Recommendations   2003-03-16 Frank Herbert's Children of Dune 6.8    2003-12-08 Battlestar Galactica 8.3    2008-05-26 The Andromeda Strain 6.3    2006-12-11 The Lost Room 7.7    1981-09-10 The Day of the Triffids 6.7    2008-01-13 Terminator: The Sarah Connor Chronicles 7.3    2009-02-13 Dollhouse 7.2    2009-07-07 Warehouse 13 7.2  Facts Status  Ended Network Certification  - Type  Miniseries Original Language  English Runtime  360m Homepage   http://www.scifi.com/dune_2k/ Genres Sci-Fi & Fantasy Drama Keywords future war imperator prophecy faith world religion telepathy rebel sandstorm insurgence spice alien planet miniseries director giant worm Content Score 100 Yes! Looking good! Top Contributors TB 61 TMDb Bot m 57 mertvec 27 lineker 23 Banana  View Edit History Popularity Trend  Login to edit  URL By  signing up  for an account on TMDb, you can post directly to Twitter and Facebook. You need to be logged in to continue. Click  here  to login or  here  to sign up.    page_wrap opened in html_head  Join the Community The Basics About TMDb Contact Us Support Forums API Blog Get Involved  Contribution Bible 3rd Party Applications Add New Movie Add New TV Show Community Guidelines Leaderboard Forums Twitter Facebook Legal Terms of Use Privacy Policy Login Sign Up"}