{"link": "https://www.themoviedb.org/tv/79948?language=en", "title": "The Hollow", "resume": "Three teens join forces to find a way home after waking up in a strange realm filled with magic portals, perplexing puzzles and vicious beasts.", "rate": 93, "genre": ["Animation", "Kids", "Drama"], "cast": ["Ashleigh Ball", "Connor Parnall", "Adrian Petriw", "Alex Barima", "Diana Kaarina"], "character": ["Mira (voice)", "Kai (voice)", "Adam (voice)", "Reeve (voice)", "Vanessa (voice)"], "site_data": "html Apps Forums Leaderboard Contribute API Support Discover Movies TV Shows Movies Popular Top Rated Upcoming Now Playing TV Shows Popular Top Rated On TV Airing Today People Popular People Can't find a movie or TV show? Login to create it. en Login Sign Up  ID: 79948   Expand The Hollow   (2018) User Score  Play Trailer Overview Three teens join forces to find a way home after waking up in a strange realm filled with magic portals, perplexing puzzles and vicious beasts. Featured Crew Vito Viscomi Creator Josh Mepham Creator Kathy A. Rocchio Creator Greg Sullivan Creator Discussions   Reviews Videos   Images   Changes Report Share Discussions General  0 Content Issues  1 Images Backdrops  2 Posters  2 Videos Trailers  1 Teasers  0 Clips  0 Featurettes  0 Opening Credits  0 Top Billed Cast Ashleigh Ball Mira (voice) Connor Parnall Kai (voice) Adrian Petriw Adam (voice) Alex Barima Reeve (voice) Diana Kaarina Vanessa (voice) Full Cast & Crew Current Season Season 1 2018 | 10 Episodes Season 1 of The Hollow premiered on June  8, 2018. View All Seasons Social Reviews  0 Discussions  1 Subject Status Replies Last Reply There are no discussions for The Hollow. Login to be first! Go to Discussions Media Most Popular Videos  1 Backdrops  2 Posters  2 Recommendations We don't have enough data to suggest any TV shows based on The Hollow. You can help by rating TV shows you've seen. Facts Status  Returning Series Network Certification TV-Y7 Meaning This program is designed for children age 7 and above. Type  Scripted Original Language  English Runtime  25m Homepage   https://www.netflix.com/title/80147919 Genres Animation Kids Drama Keywords No keywords have been added. Content Score 100 Yes! Looking good! Top Contributors m 16 markus83 Y 15 YJ R 14 Rebecca 5 dhanny  View Edit History Popularity Trend  Login to edit  URL By  signing up  for an account on TMDb, you can post directly to Twitter and Facebook. You need to be logged in to continue. Click  here  to login or  here  to sign up.    page_wrap opened in html_head  Join the Community The Basics About TMDb Contact Us Support Forums API Blog Get Involved  Contribution Bible 3rd Party Applications Add New Movie Add New TV Show Community Guidelines Leaderboard Forums Twitter Facebook Legal Terms of Use Privacy Policy Login Sign Up"}