{"link": "https://www.themoviedb.org/tv/73126?language=en", "title": "American Vandal", "resume": "A true-crime satire that explores the aftermath of a costly high school prank that left twenty-seven faculty cars vandalized with phallic images.", "rate": 78, "genre": ["Comedy", "Crime"], "cast": ["Jimmy Tatro", "Tyler Alvarez", "Eduardo Franco", "Gabriela Fresquez", "Camille Hyde"], "character": ["Dylan Maxwell", "Peter Maldonado", "Spencer Diaz", "Sophia Gutierrez", "Gabi Granger"], "site_data": "html Apps Forums Leaderboard Contribute API Support Discover Movies TV Shows Movies Popular Top Rated Upcoming Now Playing TV Shows Popular Top Rated On TV Airing Today People Popular People Can't find a movie or TV show? Login to create it. en Login Sign Up  ID: 73126   Expand American Vandal   (2017) User Score  Play Trailer Overview A true-crime satire that explores the aftermath of a costly high school prank that left twenty-seven faculty cars vandalized with phallic images. Featured Crew Dan Perrault Creator Tony Yacenda Creator Discussions   Reviews Videos   Images   Changes Report Share Discussions General  2 Content Issues  0 Images Backdrops  2 Posters  3 Videos Trailers  1 Teasers  0 Clips  0 Featurettes  0 Opening Credits  0 Top Billed Cast Jimmy Tatro Dylan Maxwell Tyler Alvarez Peter Maldonado Eduardo Franco Spencer Diaz Gabriela Fresquez Sophia Gutierrez Camille Hyde Gabi Granger Full Cast & Crew Last Season Season 1 2017 | 8 Episodes Season 1 of American Vandal premiered on September 15, 2017. View All Seasons Social Reviews  0 Discussions  2 Subject Status Replies Last Reply The ending of this surprised me (spoilers) Open 1 by  cswood Great new series by Netflix Open 5 by  Melanie Go to Discussions Media Most Popular Videos  1 Backdrops  2 Posters  3 Recommendations   2016-01-11 Crashing 7.2    2016-11-15 Brown Nation 7.3    2011-08-05 Friends with Benefits 6.1    2012-10-29 Can We Get Married? 7.3    2018-05-11 Evil Genius 8.3    2015-11-06 Master of None 8.0    2017-10-24 The End of the F***ing World 7.9    2017-05-19 The Keepers 7.6  Facts Status  Ended Network Certification TV-MA Meaning This program is specifically designed to be viewed by adults and therefore may be unsuitable for children under 17 Type  Miniseries Original Language  English Runtime  35m Homepage   https://www.netflix.com/title/80117545 Genres Comedy Crime Keywords graffiti vandalism mockumentary Content Score 100 Yes! Looking good! Top Contributors 41 Elizabeth Jennings L 5 Lilou56 5 Lewis e 4 emailofjj  View Edit History Popularity Trend  Login to edit  URL By  signing up  for an account on TMDb, you can post directly to Twitter and Facebook. You need to be logged in to continue. Click  here  to login or  here  to sign up.    page_wrap opened in html_head  Join the Community The Basics About TMDb Contact Us Support Forums API Blog Get Involved  Contribution Bible 3rd Party Applications Add New Movie Add New TV Show Community Guidelines Leaderboard Forums Twitter Facebook Legal Terms of Use Privacy Policy Login Sign Up"}