{"link": "https://www.themoviedb.org/tv/1831?language=en", "title": "Grand Designs", "resume": "British television series which features unusual and often elaborate architectural homebuilding projects.", "rate": 73, "genre": ["Documentary"], "cast": ["Kevin McCloud"], "character": ["Host"], "site_data": "html Apps Forums Leaderboard Contribute API Support Discover Movies TV Shows Movies Popular Top Rated Upcoming Now Playing TV Shows Popular Top Rated On TV Airing Today People Popular People Can't find a movie or TV show? Login to create it. en Login Sign Up  ID: 1831   Expand Grand Designs   (1999) User Score  Play Trailer Overview British television series which features unusual and often elaborate architectural homebuilding projects. Discussions   Reviews Videos   Images   Changes Report Share Discussions General  1 Content Issues  0 Images Backdrops  8 Posters  4 Videos Trailers  1 Teasers  0 Clips  0 Featurettes  0 Opening Credits  0 Top Billed Cast Kevin McCloud Host Full Cast & Crew Last Season Season 18 2017 | 9 Episodes Season 18 of Grand Designs premiered on September  6, 2017. View All Seasons Social Reviews  0 Discussions  1 Subject Status Replies Last Reply A Huf Haus, nein or mine!? Open 0 by Remington Steele\n      \n     Go to Discussions Media Most Popular Videos  1 Backdrops  8 Posters  4 Recommendations   2009-02-25 Burnistoun 7.8    2009-11-18 Ice Pilots NWT 7.0    2002-09-06 Still Game 8.6    1999-01-13 Chewin' the Fat 8.2    2013-10-26 Verliefd op Ibiza 6.0  Facts Status  Returning Series Network Certification TV-PG Meaning This program contains material that parents may find unsuitable for younger children. Type  Documentary Original Language  English Runtime  60m Homepage   http://www.channel4.com/4homes/ontv/grand-designs/index.html Genres Documentary Keywords house architecture Content Score 64 We're so close, yet so far. Top Contributors o 28 obishiro 11 Banana 9 BryGur a 8 aggastyan  View Edit History Popularity Trend  Login to edit  URL By  signing up  for an account on TMDb, you can post directly to Twitter and Facebook. You need to be logged in to continue. Click  here  to login or  here  to sign up.    page_wrap opened in html_head  Join the Community The Basics About TMDb Contact Us Support Forums API Blog Get Involved  Contribution Bible 3rd Party Applications Add New Movie Add New TV Show Community Guidelines Leaderboard Forums Twitter Facebook Legal Terms of Use Privacy Policy Login Sign Up"}