{"link": "https://www.themoviedb.org/tv/63913?language=en", "title": "Doctor Foster", "resume": "A woman suspects her husband of having an affair. After following several lines of enquiries far more unravels including a streak of violence below the surface.", "rate": 72, "genre": ["Drama"], "cast": ["Suranne Jones", "Bertie Carvel", "Clare-Hope Ashitey", "Isabelle Estelle Corbusier", "Jodie Comer"], "character": ["Dr Gemma Foster", "Simon Foster", "Carly", "Kiki Farren", "Kate Parks"], "site_data": "html Apps Forums Leaderboard Contribute API Support Discover Movies TV Shows Movies Popular Top Rated Upcoming Now Playing TV Shows Popular Top Rated On TV Airing Today People Popular People Can't find a movie or TV show? Login to create it. en Login Sign Up  ID: 63913   Expand Doctor Foster   (2015) User Score  Play Trailer Overview A woman suspects her husband of having an affair. After following several lines of enquiries far more unravels including a streak of violence below the surface. Featured Crew Mike Bartlett Creator Discussions   Reviews Videos   Images   Changes Report Share Discussions General  0 Content Issues  2 Images Backdrops  3 Posters  2 Videos Trailers  1 Teasers  0 Clips  0 Featurettes  0 Opening Credits  0 Top Billed Cast Suranne Jones Dr Gemma Foster Bertie Carvel Simon Foster Clare-Hope Ashitey Carly Isabelle Estelle Corbusier Kiki Farren Jodie Comer Kate Parks Full Cast & Crew Last Season Season 2 2017 | 5 Episodes View All Seasons Social Reviews  0 Discussions  2 Subject Status Replies Last Reply There are no discussions for Doctor Foster. Login to be first! Go to Discussions Media Most Popular Videos  1 Backdrops  3 Posters  2 Recommendations   2015-12-24 Dawn of the Croods 6.6    2015-09-08 Apaches 7.3    2016-12-08 The Cuba Libre Story 7.7    2017-09-20 Tiempos de guerra 7.0    2011-02-08 Traffic Light 7.2    2016-07-05 Fangbone! 6.7    2015-04-26 HAPPYish 6.9    2014-04-28 Heartless 5.9  Facts Status  In Production Network Certification  - Type  Scripted Original Language  English Runtime  60m Homepage   http://www.bbc.co.uk/programmes/b094m5t9 Genres Drama Keywords infidelity extramarital affair Content Score 100 Yes! Looking good! Top Contributors 25 Elizabeth Jennings 21 CouchTater 8 EveDemocracy z 8 zurman1  View Edit History Popularity Trend  Login to edit  URL By  signing up  for an account on TMDb, you can post directly to Twitter and Facebook. You need to be logged in to continue. Click  here  to login or  here  to sign up.    page_wrap opened in html_head  Join the Community The Basics About TMDb Contact Us Support Forums API Blog Get Involved  Contribution Bible 3rd Party Applications Add New Movie Add New TV Show Community Guidelines Leaderboard Forums Twitter Facebook Legal Terms of Use Privacy Policy Login Sign Up"}