{"link": "https://www.themoviedb.org/tv/76246?language=en", "title": "Hot Streets", "resume": "An FBI agent, his partner, his niece and her cowardly dog investigate supernatural phenomena.", "rate": 100, "genre": ["Animation", "Comedy"], "cast": ["Scott Chernoff", "Chelsea Kane", "Randall Park", "J.D. Ryznar", "Justin Roiland"], "character": ["Agent Donald French (voice)", "Jen Sanders (voice)", "Donovan Kim (voice)", "Agent Mark Branski (voice)", "Chubbie Webbers (voice)"], "site_data": "html Apps Forums Leaderboard Contribute API Support Discover Movies TV Shows Movies Popular Top Rated Upcoming Now Playing TV Shows Popular Top Rated On TV Airing Today People Popular People Can't find a movie or TV show? Login to create it. en Login Sign Up  ID: 76246   Expand Hot Streets   (2018) User Score  Play Trailer Overview An FBI agent, his partner, his niece and her cowardly dog investigate supernatural phenomena. Discussions   Reviews Videos   Images   Changes Report Share Discussions General  0 Content Issues  0 Images Backdrops  1 Posters  1 Videos Trailers  1 Teasers  0 Clips  0 Featurettes  0 Opening Credits  0 Top Billed Cast Scott Chernoff Agent Donald French (voice) Chelsea Kane Jen Sanders (voice) Randall Park Donovan Kim (voice) J.D. Ryznar Agent Mark Branski (voice) Justin Roiland Chubbie Webbers (voice) Full Cast & Crew Current Season Season 1 2018 | 9 Episodes Season 1 of Hot Streets premiered on January 15, 2018. View All Seasons Social Reviews  0 Discussions  0 Media Most Popular Videos  1 Backdrops  1 Posters  1 Recommendations We don't have enough data to suggest any TV shows based on Hot Streets. You can help by rating TV shows you've seen. Facts Status  Returning Series Network Certification  - Type  Scripted Original Language  English Runtime  11m Homepage  - Genres Animation Comedy Keywords animation Content Score 93 Almost there... Top Contributors 11 tigru89 9 Elizabeth Jennings 8 dhanny c 5 coltongsmith  View Edit History Popularity Trend  Login to edit  URL By  signing up  for an account on TMDb, you can post directly to Twitter and Facebook. You need to be logged in to continue. Click  here  to login or  here  to sign up.    page_wrap opened in html_head  Join the Community The Basics About TMDb Contact Us Support Forums API Blog Get Involved  Contribution Bible 3rd Party Applications Add New Movie Add New TV Show Community Guidelines Leaderboard Forums Twitter Facebook Legal Terms of Use Privacy Policy Login Sign Up"}