{"link": "https://www.themoviedb.org/tv/60793?language=en", "title": "Selfie", "resume": "After being the subject of an embarrassing viral video, a self-involved 20-something enlists the help of a marketing expert to revamp her image in the real world.", "rate": 65, "genre": ["Comedy"], "cast": ["Karen Gillan", "John Cho", "David Harewood", "Allyn Rachel", "Da'Vine Joy Randolph"], "character": ["Eliza Dooley", "Henry Higgs", "Sam Saperstein", "Bryn", "Charmonique Whitaker"], "site_data": "html Apps Forums Leaderboard Contribute API Support Discover Movies TV Shows Movies Popular Top Rated Upcoming Now Playing TV Shows Popular Top Rated On TV Airing Today People Popular People Can't find a movie or TV show? Login to create it. en Login Sign Up  ID: 60793   Expand Selfie   (2014) User Score Overview After being the subject of an embarrassing viral video, a self-involved 20-something enlists the help of a marketing expert to revamp her image in the real world. Featured Crew Emily Kapnek Creator Discussions   Reviews Videos   Images   Changes Report Share Discussions General  0 Content Issues  2 Images Backdrops  7 Posters  2 Videos Trailers  0 Teasers  0 Clips  0 Featurettes  0 Opening Credits  0 Top Billed Cast Karen Gillan Eliza Dooley John Cho Henry Higgs David Harewood Sam Saperstein Allyn Rachel Bryn Da'Vine Joy Randolph Charmonique Whitaker Full Cast & Crew Last Season Original Air Date Original Air Date Production Order (Production) Season 1 2014 | 13 Episodes Season 1 of Selfie premiered on September 30, 2014. View All Seasons Social Reviews  0 Discussions  1 Subject Status Replies Last Reply There are no discussions for Selfie. Login to be first! Go to Discussions Media Most Popular Videos  0 Backdrops  7 Posters  2 Recommendations   2012-09-11 The New Normal 5.2    2014-10-02 A to Z 5.7    2012-09-25 The Mindy Project 5.6    2011-09-29 How to Be a Gentleman 5.3    2011-10-17 Threesome 6.3    2010-10-12 Lip Service 6.6    2016-05-26 Neil Gaiman's Likely Stories 5.8    2010-06-28 Huge 5.5  Facts Status  Cancelled Network Certification TV-14 Meaning This program contains some material that many parents would find unsuitable for children under 14 years of age. Type  Scripted Original Language  English Runtime  22m Homepage   http://abc.go.com/shows/selfie Genres Comedy Keywords marketing unlikely lovers social media workplace comedy workplace romance life teacher Content Score 93 Almost there... Top Contributors 33 Elizabeth Jennings 19 benf45 14 Banana g 6 gallagher  View Edit History Popularity Trend  Login to edit  URL By  signing up  for an account on TMDb, you can post directly to Twitter and Facebook. You need to be logged in to continue. Click  here  to login or  here  to sign up.    page_wrap opened in html_head  Join the Community The Basics About TMDb Contact Us Support Forums API Blog Get Involved  Contribution Bible 3rd Party Applications Add New Movie Add New TV Show Community Guidelines Leaderboard Forums Twitter Facebook Legal Terms of Use Privacy Policy Login Sign Up"}