{"link": "https://www.themoviedb.org/tv/13189?language=en", "title": "Chelsea Lately", "resume": "Comedian Chelsea Handler spoofs celebrities, TV, movies, news, while dishing out her personal views on current events with the help of a rotating panel of comedians.", "rate": 43, "genre": ["Comedy"], "cast": ["Chelsea Handler"], "character": ["Herself - Host"], "site_data": "html Apps Forums Leaderboard Contribute API Support Discover Movies TV Shows Movies Popular Top Rated Upcoming Now Playing TV Shows Popular Top Rated On TV Airing Today People Popular People Can't find a movie or TV show? Login to create it. en Login Sign Up  ID: 13189   Expand Chelsea Lately   (2007) User Score Overview Comedian Chelsea Handler spoofs celebrities, TV, movies, news, while dishing out her personal views on current events with the help of a rotating panel of comedians. Discussions   Reviews Videos   Images   Changes Report Share Discussions General  0 Content Issues  0 Images Backdrops  2 Posters  1 Videos Trailers  0 Teasers  0 Clips  0 Featurettes  0 Opening Credits  0 Top Billed Cast Chelsea Handler Herself - Host Full Cast & Crew Last Season Season 8 2014 | 123 Episodes Season 8 of Chelsea Lately premiered on January  1, 2014. View All Seasons Social Reviews  0 Discussions  0 Media Most Popular Videos  0 Backdrops  2 Posters  1 Recommendations   2009-08-16 Kourtney and Khlo\u00e9 Take Miami 1.0    2011-04-10 Khloe & Lamar 1.0    2011-01-23 Kourtney and Kim Take New York 1.0    2012-08-08 Here Comes Honey Boo Boo 1.9    2013-04-30 Inside Amy Schumer 5.4  Facts Status  Returning Series Network Certification  - Type  Talk Show Original Language  English Runtime  30m Homepage   http://www.eonline.com/on/shows/chelsea/index.jsp Genres Comedy Keywords talk show Content Score 56 We're so close, yet so far. Top Contributors 9 Elizabeth Jennings z 4 zurman1 2 SWFT jp 1 juan perez  View Edit History Popularity Trend  Login to edit  URL By  signing up  for an account on TMDb, you can post directly to Twitter and Facebook. You need to be logged in to continue. Click  here  to login or  here  to sign up.    page_wrap opened in html_head  Join the Community The Basics About TMDb Contact Us Support Forums API Blog Get Involved  Contribution Bible 3rd Party Applications Add New Movie Add New TV Show Community Guidelines Leaderboard Forums Twitter Facebook Legal Terms of Use Privacy Policy Login Sign Up"}