{"link": "https://www.themoviedb.org/tv/60809?language=en", "title": "Der Bulle von T\u00f6lz", "resume": "We don't have an overview translated in English. Help us expand our database by adding one.", "rate": 100, "genre": ["Crime"], "cast": ["Ottfried Fischer", "Ruth Drexel", "Katerina Jacob", "Udo Thomer", "Michael Lerchenberg"], "character": ["Hauptkommissar Benno Berghammer", "Resi Berghammer", "Hauptkommissarin Sabrina Lorenz", "Polizeihauptmeister Anton Pfeiffer", "Pr\u00e4lat Hinter"], "site_data": "html Apps Forums Leaderboard Contribute API Support Discover Movies TV Shows Movies Popular Top Rated Upcoming Now Playing TV Shows Popular Top Rated On TV Airing Today People Popular People Can't find a movie or TV show? Login to create it. en Login Sign Up  ID: 60809   Expand Der Bulle von T\u00f6lz   (1996) User Score Overview We don't have an overview translated in English. Help us expand our database by adding one. Featured Crew Claus Peter Hant Creator Ernst von Theumer jr Creator Discussions   Reviews Videos   Images   Changes Report Share Discussions General  0 Content Issues  0 Images Backdrops  3 Posters  1 Videos Trailers  0 Teasers  0 Clips  0 Featurettes  0 Opening Credits  0 Top Billed Cast Ottfried Fischer Hauptkommissar Benno Berghammer Ruth Drexel Resi Berghammer Katerina Jacob Hauptkommissarin Sabrina Lorenz Udo Thomer Polizeihauptmeister Anton Pfeiffer Michael Lerchenberg Pr\u00e4lat Hinter Full Cast & Crew Last Season Season 1 1996 | 69 Episodes Season 1 of Der Bulle von T\u00f6lz premiered on January 14, 1996. View All Seasons Social Reviews  0 Discussions  0 Media Most Popular Videos  0 Backdrops  3 Posters  1 Recommendations We don't have enough data to suggest any TV shows based on Der Bulle von T\u00f6lz. You can help by rating TV shows you've seen. Facts Status  Ended Networks Certification  - Type  Scripted Original Language  German Runtime  90m Homepage   http://www.derbullevontoelz.de/ Genres Crime Keywords police bavaria Content Score 93 Almost there... Top Contributors S 52 Samara m 24 miro22 T 9 Tigrecito 6 workspace99  View Edit History Popularity Trend  Login to edit  URL By  signing up  for an account on TMDb, you can post directly to Twitter and Facebook. You need to be logged in to continue. Click  here  to login or  here  to sign up.    page_wrap opened in html_head  Join the Community The Basics About TMDb Contact Us Support Forums API Blog Get Involved  Contribution Bible 3rd Party Applications Add New Movie Add New TV Show Community Guidelines Leaderboard Forums Twitter Facebook Legal Terms of Use Privacy Policy Login Sign Up"}