{"link": "https://www.themoviedb.org/tv/78805?language=en", "title": "The Ice Cream Show", "resume": "Join Isaac Lappert as he crisscrosses the United States to discover the country's best ice cream.", "rate": 0, "genre": ["Documentary"], "cast": ["Isaac Lappert"], "character": ["Himself - Host"], "site_data": "html Apps Forums Leaderboard Contribute API Support Discover Movies TV Shows Movies Popular Top Rated Upcoming Now Playing TV Shows Popular Top Rated On TV Airing Today People Popular People Can't find a movie or TV show? Login to create it. en Login Sign Up  ID: 78805   Expand The Ice Cream Show   (2018) User Score Overview Join Isaac Lappert as he crisscrosses the United States to discover the country's best ice cream. Discussions   Reviews Videos   Images   Changes Report Share Discussions General  0 Content Issues  0 Images Backdrops  1 Posters  1 Videos Trailers  0 Teasers  0 Clips  0 Featurettes  0 Opening Credits  0 Top Billed Cast Isaac Lappert Himself - Host Full Cast & Crew Current Season Season 1 2018 | 10 Episodes Season 1 of The Ice Cream Show premiered on April 24, 2018. View All Seasons Social Reviews  0 Discussions  0 Media Most Popular Videos  0 Backdrops  1 Posters  1 Recommendations We don't have enough data to suggest any TV shows based on The Ice Cream Show. You can help by rating TV shows you've seen. Facts Status  Returning Series Network Certification TV-14 Meaning This program contains some material that many parents would find unsuitable for children under 14 years of age. Type  Documentary Original Language  English Runtime  22m Homepage   https://www.viceland.com/en_us/show/the-ice-cream-show Genres Documentary Keywords ice cream Content Score 56 We're so close, yet so far. Top Contributors 22 Elizabeth Jennings  View Edit History Popularity Trend  Login to edit  URL By  signing up  for an account on TMDb, you can post directly to Twitter and Facebook. You need to be logged in to continue. Click  here  to login or  here  to sign up.    page_wrap opened in html_head  Join the Community The Basics About TMDb Contact Us Support Forums API Blog Get Involved  Contribution Bible 3rd Party Applications Add New Movie Add New TV Show Community Guidelines Leaderboard Forums Twitter Facebook Legal Terms of Use Privacy Policy Login Sign Up"}