{"link": "https://www.themoviedb.org/tv/2429?language=en", "title": "Aaahh!!! Real Monsters", "resume": "Three young monsters \u2014 Ickis, Oblina and Krumm \u2014 attends an institute for monsters under a city dump and learn to frighten humans.", "rate": 67, "genre": ["Animation", "Comedy", "Family", "Sci-Fi", "Fantasy"], "cast": ["Gregg Berger", "Charlie Adler", "Christine Cavanaugh", "Jim Belushi", "Kath Soucie"], "character": ["The Gromble (voice)", "Ickis (voice)", "Oblina (voice)"], "site_data": "html Apps Forums Leaderboard Contribute API Support Discover Movies TV Shows Movies Popular Top Rated Upcoming Now Playing TV Shows Popular Top Rated On TV Airing Today People Popular People Can't find a movie or TV show? Login to create it. en Login Sign Up  ID: 2429   Expand Aaahh!!! Real Monsters   (1994) User Score Overview Three young monsters \u2014 Ickis, Oblina and Krumm \u2014 attends an institute for monsters under a city dump and learn to frighten humans. Featured Crew G\u00e1bor Csup\u00f3 Creator Arlene Klasky Creator Peter Gaffney Creator Discussions   Reviews Videos   Images   Changes Report Share Discussions General  6 Content Issues  2 Images Backdrops  2 Posters  4 Videos Trailers  0 Teasers  0 Clips  0 Featurettes  0 Opening Credits  0 Top Billed Cast Gregg Berger The Gromble (voice) Charlie Adler Ickis (voice) Christine Cavanaugh Oblina (voice) Jim Belushi Kath Soucie Full Cast & Crew Last Season Season 4 1997 | 26 Episodes Season 4 of Aaahh!!! Real Monsters premiered on September 12, 1997. View All Seasons Social Reviews  0 Discussions  8 Subject Status Replies Last Reply S The final scare Open 0 by Strannger18\n      \n     S A friend indeed Open 0 by Strannger18\n      \n     S Monsters contribution through history Open 0 by Strannger18\n      \n     Go to Discussions Media Most Popular Videos  0 Backdrops  2 Posters  4 Recommendations   1993-09-18 Rocko's Modern Life 7.7    1991-08-11 The Ren & Stimpy Show 7.2    1998-03-01 CatDog 6.4    1998-09-01 The Wild Thornberrys 6.0    1991-08-11 Rugrats 7.1    1997-04-20 The Angry Beavers 6.9    1991-08-11 Doug 7.0    1996-10-07 Hey Arnold! 6.8  Facts Status  Ended Network Certification TV-Y Meaning This program is designed to be appropriate for all children. Type  Scripted Original Language  English Runtime  11m Homepage   http://www.cooltoons2.com/realmonsters/ Genres Animation Comedy Family Sci-Fi & Fantasy Keywords monster school Content Score 93 Almost there... Top Contributors 53 Elizabeth Jennings L 37 Leah b 15 bugmenot2 5 Banana  View Edit History Popularity Trend  Login to edit  URL By  signing up  for an account on TMDb, you can post directly to Twitter and Facebook. You need to be logged in to continue. Click  here  to login or  here  to sign up.    page_wrap opened in html_head  Join the Community The Basics About TMDb Contact Us Support Forums API Blog Get Involved  Contribution Bible 3rd Party Applications Add New Movie Add New TV Show Community Guidelines Leaderboard Forums Twitter Facebook Legal Terms of Use Privacy Policy Login Sign Up"}