{"link": "https://www.themoviedb.org/tv/41349?language=en", "title": "Vienna Crime Squad", "resume": "SOKO Donau is an Austrian television series.", "rate": 0, "genre": ["Crime"], "cast": ["Lilian Klebow", "Dietrich Siegl", "Helmut Bohatsch", "Gregor Seberg", "Stefan J\u00fcrgens"], "character": ["Revierinspektorin Penny Lanz", "Oberst Otto Dirnberger", "Franz Wohlfahrt", "Oberstleutnant Helmuth Nowak", "Major Carl Ribarski"], "site_data": "html Apps Forums Leaderboard Contribute API Support Discover Movies TV Shows Movies Popular Top Rated Upcoming Now Playing TV Shows Popular Top Rated On TV Airing Today People Popular People Can't find a movie or TV show? Login to create it. en Login Sign Up  ID: 41349   Expand Vienna Crime Squad   (2005) User Score Overview SOKO Donau is an Austrian television series. Discussions   Reviews Videos   Images   Changes Report Share Discussions General  0 Content Issues  0 Images Backdrops  1 Posters  1 Videos Trailers  0 Teasers  0 Clips  0 Featurettes  0 Opening Credits  0 Top Billed Cast Lilian Klebow Revierinspektorin Penny Lanz Dietrich Siegl Oberst Otto Dirnberger Helmut Bohatsch Franz Wohlfahrt Gregor Seberg Oberstleutnant Helmuth Nowak Stefan J\u00fcrgens Major Carl Ribarski Full Cast & Crew Current Season Season 13 2017 | 10 Episodes Season 13 of Vienna Crime Squad premiered on November  7, 2017. View All Seasons Social Reviews  0 Discussions  0 Media Most Popular Videos  0 Backdrops  1 Posters  1 Recommendations We don't have enough data to suggest any TV shows based on Vienna Crime Squad. You can help by rating TV shows you've seen. Facts Original Name  SOKO Donau Status  Returning Series Networks Certification  - Type  Scripted Original Language  German Runtime  45m Homepage  - Genres Crime Keywords No keywords have been added. Content Score 86 Almost there... Top Contributors S 104 Samara 15 Elizabeth Jennings KB 4 Karl-Heinz Brozkowski s 3 speedycars  View Edit History Popularity Trend  Login to edit  URL By  signing up  for an account on TMDb, you can post directly to Twitter and Facebook. You need to be logged in to continue. Click  here  to login or  here  to sign up.    page_wrap opened in html_head  Join the Community The Basics About TMDb Contact Us Support Forums API Blog Get Involved  Contribution Bible 3rd Party Applications Add New Movie Add New TV Show Community Guidelines Leaderboard Forums Twitter Facebook Legal Terms of Use Privacy Policy Login Sign Up"}