{"link": "https://www.themoviedb.org/tv/71733?language=en", "title": "SMILF", "resume": "A raw and honest comedic look at a single, 20-something from Southie whose desires for relationships, sex, and a career collide with the realities of young, single motherhood.", "rate": 67, "genre": ["Comedy", "Drama"], "cast": ["Frankie Shaw", "Miguel Gomez", "Samara Weaving", "Alexandra  Mary Reimer", "Anna Reimer"], "character": ["Bridgette Bird", "Rafi", "Nelson Rose Taylor", "Larry", "Larry"], "site_data": "html Apps Forums Leaderboard Contribute API Support Discover Movies TV Shows Movies Popular Top Rated Upcoming Now Playing TV Shows Popular Top Rated On TV Airing Today People Popular People Can't find a movie or TV show? Login to create it. en Login Sign Up  ID: 71733   Expand SMILF   (2017) User Score  Play Trailer Overview A raw and honest comedic look at a single, 20-something from Southie whose desires for relationships, sex, and a career collide with the realities of young, single motherhood. Featured Crew Frankie Shaw Creator Discussions   Reviews Videos   Images   Changes Report Share Discussions General  3 Content Issues  0 Images Backdrops  6 Posters  5 Videos Trailers  1 Teasers  0 Clips  0 Featurettes  0 Opening Credits  0 Top Billed Cast Frankie Shaw Bridgette Bird Miguel Gomez Rafi Samara Weaving Nelson Rose Taylor Alexandra  Mary Reimer Larry Anna Reimer Larry Full Cast & Crew Current Season Season 1 2017 | 8 Episodes Season 1 of SMILF premiered on November  5, 2017. View All Seasons Social Reviews  0 Discussions  3 Subject Status Replies Last Reply a This show is terrible Open 1 by  SassyBeach j Her banging random guys without protection... Open 0 by jorgito2001\n      \n     Can naked breasts and a lot of female mastubating save this show? Open 2 by  jorgito2001 Go to Discussions Media Most Popular Videos  1 Backdrops  6 Posters  5 Recommendations   2016-06-07 Agatha Raisin 6.3    2017-04-05 Brockmire 7.2    2016-10-09 Divorce 6.1    2016-09-05 Mary + Jane 6.1    2017-01-25 Mary Kills People 7.5    2016-05-12 Submission 5.4    2017-02-02 Superior Donuts 6.5    2017-04-08 The Son 6.7  Facts Status  Returning Series Network Certification TV-MA Meaning This program is specifically designed to be viewed by adults and therefore may be unsuitable for children under 17 Type  Scripted Original Language  English Runtime  30m Homepage   http://www.sho.com/smilf Genres Comedy Drama Keywords single mother twenty something southie Content Score 100 Yes! Looking good! Top Contributors 60 Elizabeth Jennings AK 5 Avshalom Kor TB 5 TMDb Bot s 5 speedycars  View Edit History Popularity Trend  Login to edit  URL By  signing up  for an account on TMDb, you can post directly to Twitter and Facebook. You need to be logged in to continue. Click  here  to login or  here  to sign up.    page_wrap opened in html_head  Join the Community The Basics About TMDb Contact Us Support Forums API Blog Get Involved  Contribution Bible 3rd Party Applications Add New Movie Add New TV Show Community Guidelines Leaderboard Forums Twitter Facebook Legal Terms of Use Privacy Policy Login Sign Up"}