{"link": "https://www.themoviedb.org/tv/22634?language=en", "title": "Shakugan no Shana", "resume": "We don't have an overview translated in English. Help us expand our database by adding one.", "rate": 76, "genre": ["Action", "Adventure", "Animation", "Drama"], "cast": ["Satoshi Hino", "Rie Kugimiya", "Masashi Ebara", "Hitomi Nabatame", "Mitsuo Iwata"], "character": ["Sakai Y\u016bji", "Shana", "Alastor", "Margery Daw", "Marcocias"], "site_data": "html Apps Forums Leaderboard Contribute API Support Discover Movies TV Shows Movies Popular Top Rated Upcoming Now Playing TV Shows Popular Top Rated On TV Airing Today People Popular People Can't find a movie or TV show? Login to create it. en Login Sign Up  ID: 22634   Expand Shakugan no Shana   (2005) User Score Overview We don't have an overview translated in English. Help us expand our database by adding one. Featured Crew Takashi Watanabe Creator Discussions   Reviews Videos   Images   Changes Report Share Discussions General  0 Content Issues  1 Images Backdrops  5 Posters  4 Videos Trailers  0 Teasers  0 Clips  0 Featurettes  0 Opening Credits  0 Top Billed Cast Satoshi Hino Sakai Y\u016bji Rie Kugimiya Shana Masashi Ebara Alastor Hitomi Nabatame Margery Daw Mitsuo Iwata Marcocias Full Cast & Crew Last Season Shakugan no Shana Final 2011 | 24 Episodes View All Seasons Social Reviews  0 Discussions  1 Subject Status Replies Last Reply There are no discussions for Shakugan no Shana. Login to be first! Go to Discussions Media Most Popular Videos  0 Backdrops  5 Posters  4 Recommendations   2012-10-12 Robotics;Notes 4.7    2013-09-09 Tokyo Ravens 5.8    2012-10-07 Magi 7.5    2012-04-05 Sankarea: Undying Love 7.0    2007-04-13 Stigma of the Wind 8.1    2015-04-05 Plastic Memories 6.8    2015-10-03 K-Project 6.3    2016-07-10 Tales of Zestiria the X 7.7  Facts Original Name  \u707c\u773c\u306e\u30b7\u30e3\u30ca Status  Ended Networks Certification  - Type  Scripted Original Language  Japanese Runtime  25m Homepage   http://www.shakugan.com/ Genres Action & Adventure Animation Drama Keywords anime shakuga shana Content Score 93 Almost there... Top Contributors 41 Tarulia 33 OniiChan 9 Aitor1995 6 Jenazad  View Edit History Popularity Trend  Login to edit  URL By  signing up  for an account on TMDb, you can post directly to Twitter and Facebook. You need to be logged in to continue. Click  here  to login or  here  to sign up.    page_wrap opened in html_head  Join the Community The Basics About TMDb Contact Us Support Forums API Blog Get Involved  Contribution Bible 3rd Party Applications Add New Movie Add New TV Show Community Guidelines Leaderboard Forums Twitter Facebook Legal Terms of Use Privacy Policy Login Sign Up"}