{"link": "https://www.themoviedb.org/tv/45938?language=en", "title": "Rich Man, Poor Woman", "resume": "We don't have an overview translated in English. Help us expand our database by adding one.", "rate": 78, "genre": ["Drama"], "cast": ["Shun Oguri", "Arata Iura", "Satomi Ishihara", "Saki Aibu", "Yosuke Asari"], "character": ["Toru Hyuga", "Kosuke Asahina", "Chihiro Sawaki", "Yoko Asahina", "Yasuoka"], "site_data": "html Apps Forums Leaderboard Contribute API Support Discover Movies TV Shows Movies Popular Top Rated Upcoming Now Playing TV Shows Popular Top Rated On TV Airing Today People Popular People Can't find a movie or TV show? Login to create it. en Login Sign Up  ID: 45938   Expand Rich Man, Poor Woman   (2012) User Score Overview We don't have an overview translated in English. Help us expand our database by adding one. Featured Crew Masaki Nishiura Creator Discussions   Reviews Videos   Images   Changes Report Share Discussions General  1 Content Issues  0 Images Backdrops  1 Posters  3 Videos Trailers  0 Teasers  0 Clips  0 Featurettes  0 Opening Credits  0 Top Billed Cast Shun Oguri Toru Hyuga Arata Iura Kosuke Asahina Satomi Ishihara Chihiro Sawaki Saki Aibu Yoko Asahina Yosuke Asari Yasuoka Full Cast & Crew Last Season Season 1 2012 | 11 Episodes Season 1 of Rich Man, Poor Woman premiered on July  9, 2012. View All Seasons Social Reviews  0 Discussions  1 Subject Status Replies Last Reply Excellent Drama! Open 0 by kenjisan\n      \n     Go to Discussions Media Most Popular Videos  0 Backdrops  1 Posters  3 Recommendations   2009-10-19 Tokyo Dogs 8.5    1998-07-07 GTO: Great Teacher Onizuka 8.8    2007-04-01 The Tudors 7.5    2002-06-02 The Wire 8.4    2011-10-02 Homeland 7.3    2004-09-22 Lost 7.8    2013-03-03 Vikings 7.5    2016-10-02 Westworld 8.1  Facts Original Name  \u30ea\u30c3\u30c1\u30de\u30f3\u3001\u30d7\u30a2\u30a6\u30fc\u30de\u30f3 Status  Returning Series Network Certification  - Type  Scripted Original Language  Japanese Runtime  54m Homepage  - Genres Drama Keywords No keywords have been added. Content Score 86 Almost there... Top Contributors 15 BrerFox C 6 Chintaran m 3 michl 3 shadowfurious  View Edit History Popularity Trend  Login to edit  URL By  signing up  for an account on TMDb, you can post directly to Twitter and Facebook. You need to be logged in to continue. Click  here  to login or  here  to sign up.    page_wrap opened in html_head  Join the Community The Basics About TMDb Contact Us Support Forums API Blog Get Involved  Contribution Bible 3rd Party Applications Add New Movie Add New TV Show Community Guidelines Leaderboard Forums Twitter Facebook Legal Terms of Use Privacy Policy Login Sign Up"}