{"link": "https://www.themoviedb.org/tv/60715?language=en", "title": "Bref", "resume": "We don't have an overview translated in English. Help us expand our database by adding one.", "rate": null, "genre": ["Comedy"], "cast": ["Kyan Khojandi", "Kheiron", "Keyvan Khojandi", "Marina Pastor", "Baptiste Lecaplain"], "site_data": "html Apps Forums Leaderboard Contribute API Support Discover Movies TV Shows Movies Popular Top Rated Upcoming Now Playing TV Shows Popular Top Rated On TV Airing Today People Popular People Can't find a movie or TV show? Login to create it. en Login Sign Up  ID: 60715   Expand Bref   (2011) User Score Overview We don't have an overview translated in English. Help us expand our database by adding one. Featured Crew Kyan Khojandi Creator Discussions   Reviews Videos   Images   Changes Report Share Discussions General  0 Content Issues  0 Images Backdrops  1 Posters  1 Videos Trailers  0 Teasers  0 Clips  0 Featurettes  0 Opening Credits  0 Top Billed Cast Kyan Khojandi Je Kheiron Kheiron Keyvan Khojandi Le fr\u00e8re Marina Pastor La m\u00e8re Baptiste Lecaplain Baptiste Full Cast & Crew Last Season Season 1 2011 | 82 Episodes Season 1 of Bref premiered on August 29, 2011. View All Seasons Social Reviews  0 Discussions  0 Media Most Popular Videos  0 Backdrops  1 Posters  1 Recommendations   2002-10-27 Cam\u00e9ra Caf\u00e9 6.8    2009-04-27 The Visitor from the Future 8.5    2005-01-03 Kaamelott 8.0    1999-10-11 A Guy, a Girl 6.0    2008-06-03 Sc\u00e8nes de m\u00e9nages 6.2    1991-10-02 The Adventures of Tintin 7.8    2007-06-09 Ergo Proxy 7.3    2004-04-06 Monster 7.7  Facts Status  Ended Network Certification  - Type  Scripted Original Language  French Runtime  2m Homepage  - Genres Comedy Keywords No keywords have been added. Content Score 86 Almost there... Top Contributors M 29 Manu R 6 Rebecca 5 kinoute 5 lineker  View Edit History Popularity Trend  Login to edit  URL By  signing up  for an account on TMDb, you can post directly to Twitter and Facebook. You need to be logged in to continue. Click  here  to login or  here  to sign up.    page_wrap opened in html_head  Join the Community The Basics About TMDb Contact Us Support Forums API Blog Get Involved  Contribution Bible 3rd Party Applications Add New Movie Add New TV Show Community Guidelines Leaderboard Forums Twitter Facebook Legal Terms of Use Privacy Policy Login Sign Up", "character": ["Je", "Kheiron", "Le fr\u00e8re", "La m\u00e8re", "Baptiste"]}