{"link": "https://www.themoviedb.org/tv/79352?language=en", "title": "Sacred Games", "resume": "A link in their pasts leads an honest cop to a fugitive gang boss, whose cryptic warning spurs the officer on a quest to save Mumbai from cataclysm.", "rate": null, "genre": ["Drama"], "cast": ["Saif Ali Khan", "Nawazuddin Siddiqui", "Radhika Apte", "Anupriya Goenka"], "site_data": "html Apps Forums Leaderboard Contribute API Support Discover Movies TV Shows Movies Popular Top Rated Upcoming Now Playing TV Shows Popular Top Rated On TV Airing Today People Popular People Can't find a movie or TV show? Login to create it. en Login Sign Up  ID: 79352   Expand Sacred Games   (2018) User Score  Play Trailer Overview A link in their pasts leads an honest cop to a fugitive gang boss, whose cryptic warning spurs the officer on a quest to save Mumbai from cataclysm. Discussions   Reviews Videos   Images   Changes Report Share Discussions General  0 Content Issues  0 Images Backdrops  3 Posters  3 Videos Trailers  1 Teasers  2 Clips  0 Featurettes  0 Opening Credits  0 Top Billed Cast Saif Ali Khan Sartaj Singh Nawazuddin Siddiqui Gaitonde Radhika Apte Anjali Mathur Anupriya Goenka Megha Full Cast & Crew Current Season Season 1 2018 | 8 Episodes Season 1 of Sacred Games is set to premiere on July  6, 2018. View All Seasons Social Reviews  0 Discussions  0 Media Most Popular Videos  3 Backdrops  3 Posters  3 Facts Status  Returning Series Network Certification TV-MA Meaning This program is specifically designed to be viewed by adults and therefore may be unsuitable for children under 17 Type  Scripted Original Language  Hindi Runtime  - Homepage   https://www.netflix.com/title/80115328 Genres Drama Keywords No keywords have been added. Content Score 93 Almost there... Top Contributors 32 Elizabeth Jennings D 4 David1886 O 4 OnNeVitQue2FoisJB 3 Alessandro  View Edit History Popularity Trend  Login to edit  URL By  signing up  for an account on TMDb, you can post directly to Twitter and Facebook. You need to be logged in to continue. Click  here  to login or  here  to sign up.    page_wrap opened in html_head  Join the Community The Basics About TMDb Contact Us Support Forums API Blog Get Involved  Contribution Bible 3rd Party Applications Add New Movie Add New TV Show Community Guidelines Leaderboard Forums Twitter Facebook Legal Terms of Use Privacy Policy Login Sign Up", "character": ["Sartaj Singh", "Gaitonde", "Anjali Mathur", "Megha"]}