{"link": "https://www.themoviedb.org/tv/40905?language=en", "title": "SOKO Stuttgart", "resume": "SOKO Stuttgart is a German television series.", "rate": 80, "genre": ["Crime"], "cast": ["Peter Ketnath", "Benjamin Strecker", "Astrid M. F\u00fcnderich", "Karl Kranzkowski", "Mike Zaka Sommerfeldt"], "character": ["Kriminalhauptkommissar Joachim 'Jo' Stoll", "Rico Sander", "Erste Kriminalhauptkommissarin Martina Seiffert", "Michael Kaiser", "Jan Arnaud"], "site_data": "html Apps Forums Leaderboard Contribute API Support Discover Movies TV Shows Movies Popular Top Rated Upcoming Now Playing TV Shows Popular Top Rated On TV Airing Today People Popular People Can't find a movie or TV show? Login to create it. en Login Sign Up  ID: 40905   Expand SOKO Stuttgart   (2009) User Score Overview SOKO Stuttgart is a German television series. Discussions   Reviews Videos   Images   Changes Report Share Discussions General  0 Content Issues  0 Images Backdrops  1 Posters  1 Videos Trailers  0 Teasers  0 Clips  0 Featurettes  0 Opening Credits  0 Top Billed Cast Peter Ketnath Kriminalhauptkommissar Joachim 'Jo' Stoll Benjamin Strecker Rico Sander Astrid M. F\u00fcnderich Erste Kriminalhauptkommissarin Martina Seiffert Karl Kranzkowski Michael Kaiser Mike Zaka Sommerfeldt Jan Arnaud Full Cast & Crew Last Season Season 9 2017 | 24 Episodes Season 9 of SOKO Stuttgart premiered on September 14, 2017. View All Seasons Social Reviews  0 Discussions  0 Media Most Popular Videos  0 Backdrops  1 Posters  1 Recommendations We don't have enough data to suggest any TV shows based on SOKO Stuttgart. You can help by rating TV shows you've seen. Facts Status  Returning Series Network Certification N-7 Meaning Intended for viewers from 7 years old. Type  Scripted Original Language  German Runtime  45m Homepage  - Genres Crime Keywords No keywords have been added. Content Score 86 Almost there... Top Contributors S 57 Samara 4 tigriso1 4 Geruch L 2 Lehmden  View Edit History Popularity Trend  Login to edit  URL By  signing up  for an account on TMDb, you can post directly to Twitter and Facebook. You need to be logged in to continue. Click  here  to login or  here  to sign up.    page_wrap opened in html_head  Join the Community The Basics About TMDb Contact Us Support Forums API Blog Get Involved  Contribution Bible 3rd Party Applications Add New Movie Add New TV Show Community Guidelines Leaderboard Forums Twitter Facebook Legal Terms of Use Privacy Policy Login Sign Up"}