{"link": "https://www.themoviedb.org/tv/64593?language=en", "title": "Beowulf: Return to the Shieldlands", "resume": "Beowulf, a hero of the Geats, comes to the aid of Hrothgar, the king of the Danes, whose mead hall in Heorot has been under attack by a monster known as Grendel.", "rate": 51, "genre": ["Action", "Adventure", "Drama", "Sci-Fi", "Fantasy"], "cast": ["Kieran Bew", "William Hurt", "Joanne Whalley", "Ed Speleers", "David Ajala"], "character": ["Beowulf", "Hrothgar", "Rheda", "Slean", "Rate"], "site_data": "html Apps Forums Leaderboard Contribute API Support Discover Movies TV Shows Movies Popular Top Rated Upcoming Now Playing TV Shows Popular Top Rated On TV Airing Today People Popular People Can't find a movie or TV show? Login to create it. en Login Sign Up  ID: 64593   Expand Beowulf: Return to the Shieldlands   (2016) User Score Overview Beowulf, a hero of the Geats, comes to the aid of Hrothgar, the king of the Danes, whose mead hall in Heorot has been under attack by a monster known as Grendel. Featured Crew James Dormer Creator Tim Haines Creator Katie Newman Creator Discussions   Reviews Videos   Images   Changes Report Share Discussions General  0 Content Issues  0 Images Backdrops  5 Posters  7 Videos Trailers  0 Teasers  1 Clips  0 Featurettes  0 Opening Credits  0 Top Billed Cast Kieran Bew Beowulf William Hurt Hrothgar Joanne Whalley Rheda Ed Speleers Slean David Ajala Rate Full Cast & Crew Last Season Season 1 2016 | 12 Episodes Season 1 of Beowulf: Return to the Shieldlands premiered on January  3, 2016. View All Seasons Social Reviews  0 Discussions  0 Media Most Popular Videos  1 Backdrops  5 Posters  7 Recommendations   2007-10-12 Women's Murder Club 6.8    2013-09-22 By Any Means 7.0    2015-01-21 Wolf Hall 7.8    2016-11-15 Good Behavior 6.9    2016-03-07 Damien 6.5    2016-02-14 Vinyl 7.2    2012-11-26 The Returned 7.3    2006-01-09 Life on Mars 8.0  Facts Status  Ended Network Certification  - Type  Scripted Original Language  English Runtime  45m Homepage   http://www.itv.com/hub/beowulf-return-to-the-shieldlands Genres Action & Adventure Drama Sci-Fi & Fantasy Keywords fantasy world classic literature Content Score 100 Yes! Looking good! Top Contributors 80 Elizabeth Jennings CM 11 Cherche Moi 10 Imzadi w 10 webmaster  View Edit History Popularity Trend  Login to edit  URL By  signing up  for an account on TMDb, you can post directly to Twitter and Facebook. You need to be logged in to continue. Click  here  to login or  here  to sign up.    page_wrap opened in html_head  Join the Community The Basics About TMDb Contact Us Support Forums API Blog Get Involved  Contribution Bible 3rd Party Applications Add New Movie Add New TV Show Community Guidelines Leaderboard Forums Twitter Facebook Legal Terms of Use Privacy Policy Login Sign Up"}