{"link": "https://www.themoviedb.org/tv/71771?language=en", "title": "Me, Myself & I", "resume": "A comedy examines one man's life over a 50-year span. It explores three distinct periods in his life - as a 14-year-old in 1991, a 40-year-old in present day and a 65-year-old in 2042.", "rate": 77, "genre": ["Comedy"], "cast": ["Bobby Moynihan", "John Larroquette", "Jack Dylan Grazer", "Kelen Coleman", "Jaleel White"], "character": ["Mid-Life Alex", "Older Alex", "Young Alex", "Adult Abby", "Darryl"], "site_data": "html Apps Forums Leaderboard Contribute API Support Discover Movies TV Shows Movies Popular Top Rated Upcoming Now Playing TV Shows Popular Top Rated On TV Airing Today People Popular People Can't find a movie or TV show? Login to create it. en Login Sign Up  ID: 71771   Expand Me, Myself & I   (2017) User Score  Play Trailer Overview A comedy examines one man's life over a 50-year span. It explores three distinct periods in his life - as a 14-year-old in 1991, a 40-year-old in present day and a 65-year-old in 2042. Featured Crew Dan Kopelman Creator Discussions   Reviews Videos   Images   Changes Report Share Discussions General  3 Content Issues  0 Images Backdrops  2 Posters  2 Videos Trailers  2 Teasers  0 Clips  0 Featurettes  0 Opening Credits  0 Top Billed Cast Bobby Moynihan Mid-Life Alex John Larroquette Older Alex Jack Dylan Grazer Young Alex Kelen Coleman Adult Abby Jaleel White Darryl Full Cast & Crew Last Season Season 1 2017 | 7 Episodes Season 1 of Me, Myself & I premiered on September 25, 2017. View All Seasons Social Reviews  0 Discussions  3 Subject Status Replies Last Reply MY It usually takes three or four episodes before I decide if I like a show or not. Open 5 by  Mrs. Y T Looks like the most Promising Fall Comedy Open 2 by  ScorpionQ2 c now this is a comedy Open 2 by  ScorpionQ2 Go to Discussions Media Most Popular Videos  2 Backdrops  2 Posters  2 Recommendations   2016-09-21 Speechless 7.5    2017-10-02 The Gifted 7.0    2017-09-10 The Orville 7.2    2016-09-20 This Is Us 8.1  Facts Status  Returning Series Network Certification TV-PG Meaning This program contains material that parents may find unsuitable for younger children. Type  Scripted Original Language  English Runtime  22m Homepage   http://www.cbs.com/shows/me-myself-and-i/ Genres Comedy Keywords No keywords have been added. Content Score 100 Yes! Looking good! Top Contributors 32 Warpath 18 Banana 11 Elizabeth Jennings 10 Gabriel W. Almeida  View Edit History Popularity Trend  Login to edit  URL By  signing up  for an account on TMDb, you can post directly to Twitter and Facebook. You need to be logged in to continue. Click  here  to login or  here  to sign up.    page_wrap opened in html_head  Join the Community The Basics About TMDb Contact Us Support Forums API Blog Get Involved  Contribution Bible 3rd Party Applications Add New Movie Add New TV Show Community Guidelines Leaderboard Forums Twitter Facebook Legal Terms of Use Privacy Policy Login Sign Up"}