{"link": "https://www.themoviedb.org/tv/34105?language=en", "title": "Golden Boy", "resume": "Kintaro Oe is a twenty five year old boy who left Tokyo University and now lives a simple life, traveling by bicycle to learn everything he can about the world.", "rate": null, "genre": ["Animation", "Comedy"], "cast": ["Mitsuo Iwata", "Gor\u014d Naya", "Hiromi Tsuru", "Yuuko Minaguchi", "Yuri Shiratori"], "site_data": "html Apps Forums Leaderboard Contribute API Support Discover Movies TV Shows Movies Popular Top Rated Upcoming Now Playing TV Shows Popular Top Rated On TV Airing Today People Popular People Can't find a movie or TV show? Login to create it. en Login Sign Up  ID: 34105   Expand Golden Boy   (1995) User Score  Play Trailer Overview Kintaro Oe is a twenty five year old boy who left Tokyo University and now lives a simple life, traveling by bicycle to learn everything he can about the world. Featured Crew Tatsuya Egawa Creator Discussions   Reviews Videos   Images   Changes Report Share Discussions General  0 Content Issues  1 Images Backdrops  6 Posters  5 Videos Trailers  1 Teasers  0 Clips  0 Featurettes  0 Opening Credits  0 Top Billed Cast Mitsuo Iwata Kintaro Oe (voice) Gor\u014d Naya Narrator (voice) Hiromi Tsuru Madame President (voice) Yuuko Minaguchi Naoko Katsuda (voice) Yuri Shiratori Noriko (voice) Full Cast & Crew Last Season Season 1 1995 | 6 Episodes View All Seasons Social Reviews  0 Discussions  1 Subject Status Replies Last Reply There are no discussions for Golden Boy. Login to be first! Go to Discussions Media Most Popular Videos  1 Backdrops  6 Posters  5 Recommendations   2000-04-19 Love Hina 7.2    2001-07-04 Shaman King 5.2    2004-06-12 Samurai 7 6.6    2012-10-04 BTOOOM! 6.3  Facts Original Name  \u3055\u3059\u3089\u3044\u306e\u304a\u52c9\u5f37\u91ce\u90ce- Status  Ended Networks - Certification TV-14 Meaning This program contains some material that many parents would find unsuitable for children under 14 years of age. Type  Scripted Original Language  Japanese Runtime  28m Homepage  - Genres Animation Comedy Keywords nudity bike sex comedy studying journey ecchi anime Content Score 100 Yes! Looking good! Top Contributors 38 midnightmark 17 J. J 15 JorOmy M 13 Migi  View Edit History Popularity Trend  Login to edit  URL By  signing up  for an account on TMDb, you can post directly to Twitter and Facebook. You need to be logged in to continue. Click  here  to login or  here  to sign up.    page_wrap opened in html_head  Join the Community The Basics About TMDb Contact Us Support Forums API Blog Get Involved  Contribution Bible 3rd Party Applications Add New Movie Add New TV Show Community Guidelines Leaderboard Forums Twitter Facebook Legal Terms of Use Privacy Policy Login Sign Up", "character": ["Kintaro Oe (voice)", "Narrator (voice)", "Madame President (voice)", "Naoko Katsuda (voice)", "Noriko (voice)"]}