{"link": "https://www.themoviedb.org/tv/38148?language=en", "title": "Beck", "resume": "Beck follows the Swedish police officer Martin Beck and his partner Gunvald Larson investigating various crimes.", "rate": 66, "genre": ["Drama", "Mystery"], "cast": ["Peter Haber", "Mikael Persbrandt", "Ingvar Hirdwall"], "character": ["Martin Beck", "Gunvald Larsson", "Grannen"], "site_data": "html Apps Forums Leaderboard Contribute API Support Discover Movies TV Shows Movies Popular Top Rated Upcoming Now Playing TV Shows Popular Top Rated On TV Airing Today People Popular People Can't find a movie or TV show? Login to create it. en Login Sign Up  ID: 38148   Expand Beck   (1997) User Score  Play Trailer Overview Beck follows the Swedish police officer Martin Beck and his partner Gunvald Larson investigating various crimes. Discussions   Reviews Videos   Images   Changes Report Share Discussions General  0 Content Issues  0 Images Backdrops  1 Posters  1 Videos Trailers  1 Teasers  0 Clips  0 Featurettes  0 Opening Credits  0 Top Billed Cast Peter Haber Martin Beck Mikael Persbrandt Gunvald Larsson Ingvar Hirdwall Grannen Full Cast & Crew Current Season Season 7 2018 | 4 Episodes Season 7 of Beck premiered on January  1, 2018. View All Seasons Social Reviews  0 Discussions  0 Media Most Popular Videos  1 Backdrops  1 Posters  1 Recommendations   2005-01-14 Wallander 6.2    Wedlock 5.6  Facts Status  Returning Series Network Certification  - Type  Scripted Original Language  Swedish Runtime  90m Homepage  - Genres Drama Mystery Keywords based on novel or book sweden police detective crime investigation Content Score 64 We're so close, yet so far. Top Contributors 13 Steve 12 Banana i 8 igam AB 6 Andreas Boozon  View Edit History Popularity Trend  Login to edit  URL By  signing up  for an account on TMDb, you can post directly to Twitter and Facebook. You need to be logged in to continue. Click  here  to login or  here  to sign up.    page_wrap opened in html_head  Join the Community The Basics About TMDb Contact Us Support Forums API Blog Get Involved  Contribution Bible 3rd Party Applications Add New Movie Add New TV Show Community Guidelines Leaderboard Forums Twitter Facebook Legal Terms of Use Privacy Policy Login Sign Up"}