{"link": "https://www.themoviedb.org/tv/65748?language=en", "title": "Roadies", "resume": "An insider's look at the reckless, romantic, funny, and often poignant lives of a committed group of \"roadies,\" who live for music and the de facto family they've formed along the way.", "rate": 57, "genre": ["Comedy", "Drama"], "cast": ["Carla Gugino", "Luke Wilson", "Imogen Poots", "Rafe Spall", "Keisha Castle-Hughes"], "character": ["Shelli Anderson", "Bill Hanson", "Kelly Ann Mason", "Reg Whitehead", "Donna Mancini"], "site_data": "html Apps Forums Leaderboard Contribute API Support Discover Movies TV Shows Movies Popular Top Rated Upcoming Now Playing TV Shows Popular Top Rated On TV Airing Today People Popular People Can't find a movie or TV show? Login to create it. en Login Sign Up  ID: 65748   Expand Roadies   (2016) User Score Overview An insider's look at the reckless, romantic, funny, and often poignant lives of a committed group of \"roadies,\" who live for music and the de facto family they've formed along the way. Featured Crew Cameron Crowe Creator Discussions   Reviews Videos   Images   Changes Report Share Discussions General  1 Content Issues  0 Images Backdrops  6 Posters  5 Videos Trailers  0 Teasers  0 Clips  0 Featurettes  0 Opening Credits  0 Top Billed Cast Carla Gugino Shelli Anderson Luke Wilson Bill Hanson Imogen Poots Kelly Ann Mason Rafe Spall Reg Whitehead Keisha Castle-Hughes Donna Mancini Full Cast & Crew Last Season Season 1 2016 | 10 Episodes View All Seasons Social Reviews  0 Discussions  1 Subject Status Replies Last Reply c Anyone else liked this show? Open 0 by cpheonix\n      \n     Go to Discussions Media Most Popular Videos  0 Backdrops  6 Posters  5 Recommendations   2015-02-12 The Slap 5.8    2014-08-28 Red Oaks 7.6    2012-01-08 The Firm 4.9    2011-06-01 Franklin & Bash 7.1    2015-01-11 Togetherness 6.0    2016-09-08 Better Things 6.7    2016-06-05 Feed the Beast 6.2    2016-02-28 Thirteen 6.9  Facts Status  Ended Network Certification TV-MA Meaning This program is specifically designed to be viewed by adults and therefore may be unsuitable for children under 17 Type  Scripted Original Language  English Runtime  60m Homepage   http://www.sho.com/roadies Genres Comedy Drama Keywords friends roadie music tour Content Score 93 Almost there... Top Contributors 67 Elizabeth Jennings x 4 x3pt g 4 gonegirl 3 felectronika  View Edit History Popularity Trend  Login to edit  URL By  signing up  for an account on TMDb, you can post directly to Twitter and Facebook. You need to be logged in to continue. Click  here  to login or  here  to sign up.    page_wrap opened in html_head  Join the Community The Basics About TMDb Contact Us Support Forums API Blog Get Involved  Contribution Bible 3rd Party Applications Add New Movie Add New TV Show Community Guidelines Leaderboard Forums Twitter Facebook Legal Terms of Use Privacy Policy Login Sign Up"}