{"link": "https://www.themoviedb.org/tv/77947?language=en", "title": "Harrow", "resume": "When a dark secret from this past threatens to be exposed, unorthodox and brilliant medical examiner, Doctor Daniel Harrow, must use all his forensic skills to keep it buried forever.", "rate": 67, "genre": ["Drama"], "cast": ["Ioan Gruffudd", "Mirrah Foulkes", "Remy Hii", "Anna Lise Phillips", "Damien Garvey"], "character": ["Dr. Daniel Harrow", "Soroya Dass", "Simon Van Reyk", "Stephanie Tolson", "Bryan Nichols"], "site_data": "html Apps Forums Leaderboard Contribute API Support Discover Movies TV Shows Movies Popular Top Rated Upcoming Now Playing TV Shows Popular Top Rated On TV Airing Today People Popular People Can't find a movie or TV show? Login to create it. en Login Sign Up  ID: 77947   Expand Harrow   (2018) User Score  Play Trailer Overview When a dark secret from this past threatens to be exposed, unorthodox and brilliant medical examiner, Doctor Daniel Harrow, must use all his forensic skills to keep it buried forever. Discussions   Reviews Videos   Images   Changes Report Share Discussions General  1 Content Issues  0 Images Backdrops  1 Posters  1 Videos Trailers  1 Teasers  0 Clips  0 Featurettes  0 Opening Credits  0 Top Billed Cast Ioan Gruffudd Dr. Daniel Harrow Mirrah Foulkes Soroya Dass Remy Hii Simon Van Reyk Anna Lise Phillips Stephanie Tolson Damien Garvey Bryan Nichols Full Cast & Crew Current Season Season 1 2018 | 10 Episodes Season 1 of Harrow premiered on March  9, 2018. View All Seasons Social Reviews  0 Discussions  1 Subject Status Replies Last Reply So is this a Dexter type show? Open 1 by  lonegunman Go to Discussions Media Most Popular Videos  1 Backdrops  1 Posters  1 Recommendations   2018-01-03 9-1-1 6.7  Facts Status  Returning Series Network Certification M Meaning Recommended for mature audiences; M-rated content may only be broadcast between 8:30 p.m. and 5:00 a.m. on any day, and additionally between 12:00 p.m. and 3:00 p.m. on schooldays. Type  Scripted Original Language  English Runtime  43m Homepage   http://www.abc.net.au/tv/programs/harrow/ Genres Drama Keywords No keywords have been added. Content Score 93 Almost there... Top Contributors 18 Elizabeth Jennings z 11 zeil b 9 budhi017 m 4 misfit_noel  View Edit History Popularity Trend  Login to edit  URL By  signing up  for an account on TMDb, you can post directly to Twitter and Facebook. You need to be logged in to continue. Click  here  to login or  here  to sign up.    page_wrap opened in html_head  Join the Community The Basics About TMDb Contact Us Support Forums API Blog Get Involved  Contribution Bible 3rd Party Applications Add New Movie Add New TV Show Community Guidelines Leaderboard Forums Twitter Facebook Legal Terms of Use Privacy Policy Login Sign Up"}