{"link": "https://www.themoviedb.org/tv/70440?language=en", "title": "Tunnel", "resume": "A police detective from 1986 travels in time to the present to save his daughter.", "rate": 70, "genre": ["Crime", "Mystery"], "cast": ["Choi Jin-hyuk", "Yoon Hyun-min", "Lee Yoo-young", "Kang Ki-young", "Cha Hak-Yeon"], "character": ["Park Gwang-Ho", "Kim Sun-Jae", "Shin Jae-Yi", "Song Min-Ha", "Park Gwang-Ho"], "site_data": "html Apps Forums Leaderboard Contribute API Support Discover Movies TV Shows Movies Popular Top Rated Upcoming Now Playing TV Shows Popular Top Rated On TV Airing Today People Popular People Can't find a movie or TV show? Login to create it. en Login Sign Up  ID: 70440   Expand Tunnel   (2017) User Score Overview A police detective from 1986 travels in time to the present to save his daughter. Discussions   Reviews Videos   Images   Changes Report Share Discussions General  0 Content Issues  0 Images Backdrops  2 Posters  2 Videos Trailers  0 Teasers  0 Clips  0 Featurettes  0 Opening Credits  0 Top Billed Cast Choi Jin-hyuk Park Gwang-Ho Yoon Hyun-min Kim Sun-Jae Lee Yoo-young Shin Jae-Yi Kang Ki-young Song Min-Ha Cha Hak-Yeon Park Gwang-Ho Full Cast & Crew Last Season Season 1 2017 | 17 Episodes Season 1 of Tunnel premiered on March 25, 2017. View All Seasons Social Reviews  0 Discussions  0 Media Most Popular Videos  0 Backdrops  2 Posters  2 Recommendations   2017-03-20 The Liar and His Lover 8.3    2017-11-11 Money Flower 8.0    2017-10-11 Mad Dog 8.0    2017-12-11 Just Between Lovers 7.2    2012-05-30 Ghost 8.0    2017-01-14 Voice 6.9    2017-10-09 Witch's Court 9.3    2017-03-15 Radiant Office 6.9  Facts Original Name  \ud130\ub110 Status  Ended Network Certification  - Type  Scripted Original Language  Korean Runtime  60m Homepage   http://program.tving.com/ocn/tunnel Genres Crime Mystery Keywords detective time travel korea Content Score 86 Almost there... Top Contributors M 36 Maria180493 V 12 Violsa l 6 llluqiang g 5 gits  View Edit History Popularity Trend  Login to edit  URL By  signing up  for an account on TMDb, you can post directly to Twitter and Facebook. You need to be logged in to continue. Click  here  to login or  here  to sign up.    page_wrap opened in html_head  Join the Community The Basics About TMDb Contact Us Support Forums API Blog Get Involved  Contribution Bible 3rd Party Applications Add New Movie Add New TV Show Community Guidelines Leaderboard Forums Twitter Facebook Legal Terms of Use Privacy Policy Login Sign Up"}