{"link": "https://www.themoviedb.org/tv/74630?language=en", "title": "Howards End", "resume": "The social and class divisions in early 20th century England through the intersection of three families - the wealthy Wilcoxes, the gentle and idealistic Schlegels and the lower-middle class Basts.", "rate": 79, "genre": ["Drama"], "cast": ["Hayley Atwell", "Matthew Macfadyen", "Julia Ormond", "Tracey Ullman", "Philippa Coulthard"], "character": ["Margaret Schlegel", "Henry Wilcox", "Mrs. Wilcox", "Aunt Juley Mund", "Helen Schlegel"], "site_data": "html Apps Forums Leaderboard Contribute API Support Discover Movies TV Shows Movies Popular Top Rated Upcoming Now Playing TV Shows Popular Top Rated On TV Airing Today People Popular People Can't find a movie or TV show? Login to create it. en Login Sign Up  ID: 74630   Expand Howards End   (2017) User Score  Play Trailer Overview The social and class divisions in early 20th century England through the intersection of three families - the wealthy Wilcoxes, the gentle and idealistic Schlegels and the lower-middle class Basts. Featured Crew Hettie MacDonald Creator Discussions   Reviews Videos   Images   Changes Report Share Discussions General  1 Content Issues  0 Images Backdrops  6 Posters  3 Videos Trailers  1 Teasers  0 Clips  0 Featurettes  0 Opening Credits  0 Top Billed Cast Hayley Atwell Margaret Schlegel Matthew Macfadyen Henry Wilcox Julia Ormond Mrs. Wilcox Tracey Ullman Aunt Juley Mund Philippa Coulthard Helen Schlegel Full Cast & Crew Current Season Season 1 2017 | 4 Episodes Season 1 of Howards End premiered on November 12, 2017. View All Seasons Social Reviews  0 Discussions  1 Subject Status Replies Last Reply SB Doesn't engage me. Open 0 by Strange Bedfellows\n      \n     Go to Discussions Media Most Popular Videos  1 Backdrops  6 Posters  3 Recommendations We don't have enough data to suggest any TV shows based on Howards End. You can help by rating TV shows you've seen. Facts Status  Returning Series Networks Certification  - Type  Miniseries Original Language  English Runtime  55m Homepage   http://www.bbc.co.uk/programmes/b09g9nr8 Genres Drama Keywords miniseries class differences period drama costume drama edwardian england Content Score 100 Yes! Looking good! Top Contributors 48 Elizabeth Jennings TB 24 TMDb Bot 8 EveDemocracy s 3 speedycars  View Edit History Popularity Trend  Login to edit  URL By  signing up  for an account on TMDb, you can post directly to Twitter and Facebook. You need to be logged in to continue. Click  here  to login or  here  to sign up.    page_wrap opened in html_head  Join the Community The Basics About TMDb Contact Us Support Forums API Blog Get Involved  Contribution Bible 3rd Party Applications Add New Movie Add New TV Show Community Guidelines Leaderboard Forums Twitter Facebook Legal Terms of Use Privacy Policy Login Sign Up"}