{"link": "https://www.themoviedb.org/tv/64830?language=en", "title": "Die H\u00f6hle der L\u00f6wen", "resume": "We don't have an overview translated in English. Help us expand our database by adding one.", "rate": 97, "genre": ["Reality"], "cast": ["Judith Williams", "Frank Thelen", "Ralf D\u00fcmmel", "Carsten Maschmeyer", "Ermias Habtu"], "character": ["Judith Williams", "Frank Thelen", "Ralf D\u00fcmmel", "Carsten Maschmeyer", "Moderator"], "site_data": "html Apps Forums Leaderboard Contribute API Support Discover Movies TV Shows Movies Popular Top Rated Upcoming Now Playing TV Shows Popular Top Rated On TV Airing Today People Popular People Can't find a movie or TV show? Login to create it. en Login Sign Up  ID: 64830   Expand Die H\u00f6hle der L\u00f6wen   (2014) User Score Overview We don't have an overview translated in English. Help us expand our database by adding one. Discussions   Reviews Videos   Images   Changes Report Share Discussions General  0 Content Issues  0 Images Backdrops  6 Posters  2 Videos Trailers  0 Teasers  0 Clips  0 Featurettes  0 Opening Credits  0 Top Billed Cast Judith Williams Judith Williams Frank Thelen Frank Thelen Ralf D\u00fcmmel Ralf D\u00fcmmel Carsten Maschmeyer Carsten Maschmeyer Ermias Habtu Moderator Full Cast & Crew Last Season Season 4 2017 | 12 Episodes Season 4 of Die H\u00f6hle der L\u00f6wen premiered on September  5, 2017. View All Seasons Social Reviews  0 Discussions  0 Media Most Popular Videos  0 Backdrops  6 Posters  2 Recommendations We don't have enough data to suggest any TV shows based on Die H\u00f6hle der L\u00f6wen. You can help by rating TV shows you've seen. Facts Status  Returning Series Network Certification 0 Meaning Can be aired at any time. Type  Reality Original Language  German Runtime  120m Homepage   http://www.vox.de/cms/sendungen/die-hoehle-der-loewen.html Genres Reality Keywords investor show unternehmensgr\u00fcnder unterhaltungsshow erfinder investoren Content Score 86 Almost there... Top Contributors 82 archiv P 3 PiqueWique TB 3 TMDb Bot R 3 Rebecca  View Edit History Popularity Trend  Login to edit  URL By  signing up  for an account on TMDb, you can post directly to Twitter and Facebook. You need to be logged in to continue. Click  here  to login or  here  to sign up.    page_wrap opened in html_head  Join the Community The Basics About TMDb Contact Us Support Forums API Blog Get Involved  Contribution Bible 3rd Party Applications Add New Movie Add New TV Show Community Guidelines Leaderboard Forums Twitter Facebook Legal Terms of Use Privacy Policy Login Sign Up"}