{"link": "https://www.themoviedb.org/tv/29354?language=en", "title": "Heidi", "resume": "We don't have an overview translated in English. Help us expand our database by adding one.", "rate": 0, "genre": ["Family"], "cast": ["Katharina B\u00f6hm", "Brigitte Horney", "Katia Polletin", "Sonja Sutter", "Henry van Lyck"], "character": ["Clara", "Grossmuttter", "Heidi", "Fraulein Rottenmeier", "Sebastian"], "site_data": "html Apps Forums Leaderboard Contribute API Support Discover Movies TV Shows Movies Popular Top Rated Upcoming Now Playing TV Shows Popular Top Rated On TV Airing Today People Popular People Can't find a movie or TV show? Login to create it. en Login Sign Up  ID: 29354   Expand Heidi   (1978) User Score Overview We don't have an overview translated in English. Help us expand our database by adding one. Discussions   Reviews Videos   Images   Changes Report Share Discussions General  0 Content Issues  2 Images Backdrops  0 Posters  1 Videos Trailers  0 Teasers  0 Clips  0 Featurettes  0 Opening Credits  0 Top Billed Cast Katharina B\u00f6hm Clara Brigitte Horney Grossmuttter Katia Polletin Heidi Sonja Sutter Fraulein Rottenmeier Henry van Lyck Sebastian Full Cast & Crew Last Season Season 1 1978 | 26 Episodes Season 1 of Heidi premiered on January  8, 1978. View All Seasons Social Reviews  0 Discussions  2 Subject Status Replies Last Reply There are no discussions for Heidi. Login to be first! Go to Discussions Media Most Popular Videos  0 Backdrops  0 Posters  1 Recommendations We don't have enough data to suggest any TV shows based on Heidi. You can help by rating TV shows you've seen. Facts Status  Ended Network Certification  - Type  Scripted Original Language  German Runtime  30m Homepage  - Genres Family Keywords No keywords have been added. Content Score 64 We're so close, yet so far. Top Contributors S 18 Samara 5 yannkallander 1 lol32lol g 1 gpdl67  View Edit History Popularity Trend  Login to edit  URL By  signing up  for an account on TMDb, you can post directly to Twitter and Facebook. You need to be logged in to continue. Click  here  to login or  here  to sign up.    page_wrap opened in html_head  Join the Community The Basics About TMDb Contact Us Support Forums API Blog Get Involved  Contribution Bible 3rd Party Applications Add New Movie Add New TV Show Community Guidelines Leaderboard Forums Twitter Facebook Legal Terms of Use Privacy Policy Login Sign Up"}