{"link": "https://www.themoviedb.org/tv/1691?language=en", "title": "Studio 60 on the Sunset Strip", "resume": "A behind-the-scenes look at a fictional sketch-comedy TV show.", "rate": 75, "genre": ["Drama", "Comedy"], "cast": ["Matthew Perry", "Amanda Peet", "Bradley Whitford", "Steven Weber", "D. L. Hughley"], "character": ["Matt Albie", "Jordan McDeere", "Danny Tripp", "Jack Rudolph", "Simon Stiles"], "site_data": "html Apps Forums Leaderboard Contribute API Support Discover Movies TV Shows Movies Popular Top Rated Upcoming Now Playing TV Shows Popular Top Rated On TV Airing Today People Popular People Can't find a movie or TV show? Login to create it. en Login Sign Up  ID: 1691   Expand Studio 60 on the Sunset Strip   (2006) User Score  Play Trailer Overview A behind-the-scenes look at a fictional sketch-comedy TV show. Featured Crew Aaron Sorkin Creator Discussions   Reviews Videos   Images   Changes Report Share Discussions General  1 Content Issues  0 Images Backdrops  5 Posters  4 Videos Trailers  1 Teasers  0 Clips  0 Featurettes  0 Opening Credits  0 Top Billed Cast Matthew Perry Matt Albie Amanda Peet Jordan McDeere Bradley Whitford Danny Tripp Steven Weber Jack Rudolph D. L. Hughley Simon Stiles Full Cast & Crew Last Season Season 1 2006 | 22 Episodes Season 1 of Studio 60 on the Sunset Strip premiered on September 18, 2006. View All Seasons Social Reviews  0 Discussions  1 Subject Status Replies Last Reply Unpopular opinion Open 0 by MirrorMask\n      \n     Go to Discussions Media Most Popular Videos  1 Backdrops  5 Posters  4 Recommendations   2013-10-23 Ambassadors 7.0    2011-02-09 Mr. Sunshine 6.4    1999-06-15 The Man Show 5.9    2013-09-26 The Crazy Ones 5.8    2000-03-30 Da Ali G Show 6.8    1999-01-10 The PJs 7.4    2001-07-12 Night Visions 6.6    1974-09-13 Chico and the Man 6.2  Facts Status  Ended Network Certification 12 Meaning Films classified 12A and video works classified 12 contain material that is not generally suitable for children aged under 12. Type  Scripted Original Language  English Runtime  42m, 60m, 43m Homepage   http://web.archive.org/web/20071013102207/http://nbc.com/Studio_60_on_the_Sunset_Strip Genres Drama Comedy Keywords television behind the scenes tv studio Content Score 100 Yes! Looking good! Top Contributors 16 United600 z 6 zurman1 5 Elizabeth Jennings a 5 afogutu  View Edit History Popularity Trend  Login to edit  URL By  signing up  for an account on TMDb, you can post directly to Twitter and Facebook. You need to be logged in to continue. Click  here  to login or  here  to sign up.    page_wrap opened in html_head  Join the Community The Basics About TMDb Contact Us Support Forums API Blog Get Involved  Contribution Bible 3rd Party Applications Add New Movie Add New TV Show Community Guidelines Leaderboard Forums Twitter Facebook Legal Terms of Use Privacy Policy Login Sign Up"}