{"link": "https://www.themoviedb.org/tv/64758?language=en", "title": "Sunday with Lubach", "resume": "Sunday with Lubach is a satirical television program of the VPRO network that is presented by Arjen Lubach.", "rate": null, "genre": ["News", "Comedy"], "cast": ["Arjen Lubach", "Tex de Wit"], "site_data": "html Apps Forums Leaderboard Contribute API Support Discover Movies TV Shows Movies Popular Top Rated Upcoming Now Playing TV Shows Popular Top Rated On TV Airing Today People Popular People Can't find a movie or TV show? Login to create it. en Login Sign Up  ID: 64758   Expand Sunday with Lubach   (2014) User Score Overview Sunday with Lubach is a satirical television program of the VPRO network that is presented by Arjen Lubach. Discussions   Reviews Videos   Images   Changes Report Share Discussions General  0 Content Issues  0 Images Backdrops  1 Posters  2 Videos Trailers  0 Teasers  0 Clips  0 Featurettes  0 Opening Credits  0 Top Billed Cast Arjen Lubach Arjen Lubach Tex de Wit Tex de Wit Full Cast & Crew Current Season Season 8 2018 | 8 Episodes Season 8 of Sunday with Lubach premiered on January 28, 2018. View All Seasons Social Reviews  0 Discussions  0 Media Most Popular Videos  0 Backdrops  1 Posters  2 Recommendations We don't have enough data to suggest any TV shows based on Sunday with Lubach. You can help by rating TV shows you've seen. Facts Original Name  Zondag met Lubach Status  Returning Series Network Certification AL Meaning Not harmful / All Ages. Type  Talk Show Original Language  Dutch; Flemish Runtime  30m Homepage   http://www.vpro.nl/zondag-met-lubach.html Genres News Comedy Keywords netherlands political satire Content Score 64 We're so close, yet so far. Top Contributors v 26 veboli R 23 RunMovieDB 2 sissing Z 2 Zedfrigg  View Edit History Popularity Trend  Login to edit  URL By  signing up  for an account on TMDb, you can post directly to Twitter and Facebook. You need to be logged in to continue. Click  here  to login or  here  to sign up.    page_wrap opened in html_head  Join the Community The Basics About TMDb Contact Us Support Forums API Blog Get Involved  Contribution Bible 3rd Party Applications Add New Movie Add New TV Show Community Guidelines Leaderboard Forums Twitter Facebook Legal Terms of Use Privacy Policy Login Sign Up", "character": ["Arjen Lubach", "Tex de Wit"]}