{"link": "https://www.themoviedb.org/tv/63645?language=en", "title": "Agent X", "resume": "Hidden from the view of the public - and even from the President - there is a top secret agent who is trained and ready to serve, deployed only at the careful discretion of the Vice President.", "rate": 47, "genre": ["Drama", "Action"], "cast": ["Sharon Stone", "Jeff Hephner", "John Shea", "Carolyn Stotesbery"], "character": ["Vicepresident Natalie Maccabee", "Agent X", "President Eckhart", "Pamela Richardson"], "site_data": "html Apps Forums Leaderboard Contribute API Support Discover Movies TV Shows Movies Popular Top Rated Upcoming Now Playing TV Shows Popular Top Rated On TV Airing Today People Popular People Can't find a movie or TV show? Login to create it. en Login Sign Up  ID: 63645   Expand Agent X   (2015) User Score  Play Trailer Overview Hidden from the view of the public - and even from the President - there is a top secret agent who is trained and ready to serve, deployed only at the careful discretion of the Vice President. Featured Crew W. Blake Herron Creator Discussions   Reviews Videos   Images   Changes Report Share Discussions General  0 Content Issues  0 Images Backdrops  2 Posters  1 Videos Trailers  1 Teasers  0 Clips  0 Featurettes  0 Opening Credits  0 Top Billed Cast Sharon Stone Vicepresident Natalie Maccabee Jeff Hephner Agent X John Shea President Eckhart Carolyn Stotesbery Pamela Richardson Full Cast & Crew Last Season Season 1 2015 | 10 Episodes Season 1 of Agent X premiered on November  8, 2015. View All Seasons Social Reviews  0 Discussions  0 Media Most Popular Videos  1 Backdrops  2 Posters  1 Recommendations   2016-03-15 Crowded 6.4    2014-07-17 Satisfaction 5.0    2016-09-22 Notorious 5.8    2018-01-03 grown-ish 7.8    2015-06-02 Stitchers 6.3    2015-11-27 South of Hell 5.9    2016-10-03 Conviction 6.3    2016-09-11 Son of Zorn 5.6  Facts Status  Cancelled Network Certification  - Type  Scripted Original Language  English Runtime  45m Homepage   http://www.tntdrama.com/shows/agent-x.html Genres Drama Action Keywords secret agent vice president Content Score 100 Yes! Looking good! Top Contributors 30 Elizabeth Jennings TB 9 TMDb Bot K 5 Kanashii 5 SuperMario  View Edit History Popularity Trend  Login to edit  URL By  signing up  for an account on TMDb, you can post directly to Twitter and Facebook. You need to be logged in to continue. Click  here  to login or  here  to sign up.    page_wrap opened in html_head  Join the Community The Basics About TMDb Contact Us Support Forums API Blog Get Involved  Contribution Bible 3rd Party Applications Add New Movie Add New TV Show Community Guidelines Leaderboard Forums Twitter Facebook Legal Terms of Use Privacy Policy Login Sign Up"}