{"link": "https://www.themoviedb.org/tv/42763?language=en", "title": "Project Runway All Stars", "resume": "The MVPs from past seasons of Project Runway compete for a second chance at runway gold.", "rate": 75, "genre": ["Reality"], "cast": ["Alyssa Milano", "Isaac Mizrahi", "Georgina Chapman", "Anne Fulenwider"], "character": ["Herself - Host", "Himself - Judge", "Herself - Judge", "Herself - Mentor"], "site_data": "html Apps Forums Leaderboard Contribute API Support Discover Movies TV Shows Movies Popular Top Rated Upcoming Now Playing TV Shows Popular Top Rated On TV Airing Today People Popular People Can't find a movie or TV show? Login to create it. en Login Sign Up  ID: 42763   Expand Project Runway All Stars   (2012) User Score Overview The MVPs from past seasons of Project Runway compete for a second chance at runway gold. Discussions   Reviews Videos   Images   Changes Report Share Discussions General  1 Content Issues  0 Images Backdrops  3 Posters  2 Videos Trailers  0 Teasers  0 Clips  0 Featurettes  0 Opening Credits  0 Top Billed Cast Alyssa Milano Herself - Host Isaac Mizrahi Himself - Judge Georgina Chapman Herself - Judge Anne Fulenwider Herself - Mentor Full Cast & Crew Current Season Season 6 2018 | 13 Episodes View All Seasons Social Reviews  0 Discussions  1 Subject Status Replies Last Reply Ready, Set, and Pick ... Open 98 by  Poetist Go to Discussions Media Most Popular Videos  0 Backdrops  3 Posters  2 Recommendations   2004-12-01 Project Runway 5.0    1971-09-17 McMillan & Wife 7.2    2003-05-20 America's Next Top Model 4.5    1970-09-24 The Odd Couple 7.1    1977-01-14 Fantasy Island 6.5    1965-09-15 Green Acres 6.9    1976-01-14 The Bionic Woman 6.2    1976-10-03 Quincy, M.E. 7.0  Facts Status  Returning Series Network Certification TV-PG Meaning This program contains material that parents may find unsuitable for younger children. Type  Reality Original Language  English Runtime  42m Homepage   https://www.mylifetime.com/shows/project-runway-all-stars Genres Reality Keywords fashion reality competition Content Score 86 Almost there... Top Contributors 26 Elizabeth Jennings n 7 neil1269 b 6 basher 4 oldboy3  View Edit History Popularity Trend  Login to edit  URL By  signing up  for an account on TMDb, you can post directly to Twitter and Facebook. You need to be logged in to continue. Click  here  to login or  here  to sign up.    page_wrap opened in html_head  Join the Community The Basics About TMDb Contact Us Support Forums API Blog Get Involved  Contribution Bible 3rd Party Applications Add New Movie Add New TV Show Community Guidelines Leaderboard Forums Twitter Facebook Legal Terms of Use Privacy Policy Login Sign Up"}