{"link": "https://www.themoviedb.org/tv/20790?language=en", "title": "Matrioshki", "resume": "Young women from Lithuania and Russia are taken to Belgium by a gang involved in the sex trade to work as sex slaves.", "rate": 73, "genre": ["Crime", "Drama"], "cast": ["Axel Daeseleire", "Evgeniya Khirivskaya", "\u017demyna A\u0161montait\u0117", "Marc van Eeghem", "Veerle de Jonghe"], "character": ["Jan Verplancke", "Kalinka", "Daria", "Marc Camps", "Esther van de Walle"], "site_data": "html Apps Forums Leaderboard Contribute API Support Discover Movies TV Shows Movies Popular Top Rated Upcoming Now Playing TV Shows Popular Top Rated On TV Airing Today People Popular People Can't find a movie or TV show? Login to create it. en Login Sign Up  ID: 20790   Expand Matrioshki   (2005) User Score Overview Young women from Lithuania and Russia are taken to Belgium by a gang involved in the sex trade to work as sex slaves. Featured Crew Guy Goossens Creator Mark Punt Creator Discussions   Reviews Videos   Images   Changes Report Share Discussions General  0 Content Issues  0 Images Backdrops  4 Posters  1 Videos Trailers  0 Teasers  0 Clips  0 Featurettes  0 Opening Credits  0 Top Billed Cast Axel Daeseleire Jan Verplancke Evgeniya Khirivskaya Kalinka \u017demyna A\u0161montait\u0117 Daria Marc van Eeghem Marc Camps Veerle de Jonghe Esther van de Walle Full Cast & Crew Last Season Season 2 2008 | 10 Episodes View All Seasons Social Reviews  0 Discussions  0 Media Most Popular Videos  0 Backdrops  4 Posters  1 Recommendations We don't have enough data to suggest any TV shows based on Matrioshki. You can help by rating TV shows you've seen. Facts Original Name  Matroesjka's Status  Ended Network Certification 16 Meaning Take care with children under 16. Type  Scripted Original Language  Dutch; Flemish Runtime  50m Homepage  - Genres Crime Drama Keywords organized crime sex trafficking sex slavery Content Score 93 Almost there... Top Contributors 78 Marr \ud83c\uddf3\ud83c\uddf1 36 EveDemocracy 9 Banana k 6 kapitanrum  View Edit History Popularity Trend  Login to edit  URL By  signing up  for an account on TMDb, you can post directly to Twitter and Facebook. You need to be logged in to continue. Click  here  to login or  here  to sign up.    page_wrap opened in html_head  Join the Community The Basics About TMDb Contact Us Support Forums API Blog Get Involved  Contribution Bible 3rd Party Applications Add New Movie Add New TV Show Community Guidelines Leaderboard Forums Twitter Facebook Legal Terms of Use Privacy Policy Login Sign Up"}