{"link": "https://www.themoviedb.org/tv/75540?language=en", "title": "Seven Seconds", "resume": "Tensions run high between African American citizens and Caucasian cops in Jersey City when a teenage African American boy is critically injured by a cop.", "rate": 81, "genre": ["Crime", "Drama", "News", "War", "Politics"], "cast": ["Clare-Hope Ashitey", "Regina King", "Beau Knapp", "Michael Mosley", "David Lyons"], "character": ["KJ Harper", "Latrice Butler", "Peter Jablonski", "Joe 'Fish' Rinaldi", "Mike Diangelo"], "site_data": "html Apps Forums Leaderboard Contribute API Support Discover Movies TV Shows Movies Popular Top Rated Upcoming Now Playing TV Shows Popular Top Rated On TV Airing Today People Popular People Can't find a movie or TV show? Login to create it. en Login Sign Up  ID: 75540   Expand Seven Seconds   (2018) User Score  Play Trailer Overview Tensions run high between African American citizens and Caucasian cops in Jersey City when a teenage African American boy is critically injured by a cop. Featured Crew Veena Sud Creator Discussions   Reviews Videos   Images   Changes Report Share Discussions General  1 Content Issues  0 Images Backdrops  1 Posters  2 Videos Trailers  1 Teasers  0 Clips  0 Featurettes  0 Opening Credits  0 Top Billed Cast Clare-Hope Ashitey KJ Harper Regina King Latrice Butler Beau Knapp Peter Jablonski Michael Mosley Joe 'Fish' Rinaldi David Lyons Mike Diangelo Full Cast & Crew Current Season Season 1 2018 | 10 Episodes View All Seasons Social Reviews  0 Discussions  1 Subject Status Replies Last Reply What did you think? Open 0 by Terrie\n      \n     Go to Discussions Media Most Popular Videos  1 Backdrops  1 Posters  2 Recommendations   2018-05-10 Safe 7.1    2018-05-04 The Rain 6.1    2018-02-11 Here and Now 7.7    2018-01-22 The Alienist 7.1    2017-11-07 Damnation 7.2    2017-06-30 Gypsy 6.0    2018-01-06 Hard Sun 7.4    2015-11-08 Flesh and Bone 7.0  Facts Status  Ended Network Certification 19 Meaning This rating is for programs that are intended for adults only. 19-rated programming cannot air during the hours of 7:00AM to 9:00AM, and 1:00PM to 10:00PM. Programmes that receive this rating will almost certainly have adult themes, sexual situations, frequent use of strong language and disturbing scenes of violence. Type  Scripted Original Language  English Runtime  55m Homepage   https://www.netflix.com/title/80117555 Genres Crime Drama News War & Politics Keywords No keywords have been added. Content Score 100 Yes! Looking good! Top Contributors 14 Elizabeth Jennings 13 dhanny 13 outlawblues R 10 Rebecca  View Edit History Popularity Trend  Login to edit  URL By  signing up  for an account on TMDb, you can post directly to Twitter and Facebook. You need to be logged in to continue. Click  here  to login or  here  to sign up.    page_wrap opened in html_head  Join the Community The Basics About TMDb Contact Us Support Forums API Blog Get Involved  Contribution Bible 3rd Party Applications Add New Movie Add New TV Show Community Guidelines Leaderboard Forums Twitter Facebook Legal Terms of Use Privacy Policy Login Sign Up"}