{"link": "https://www.themoviedb.org/tv/61729?language=en", "title": "Sons of Liberty", "resume": "A radical group of young men band together in secrecy to change the course of history and make America a nation.", "rate": null, "genre": ["Drama"], "cast": ["Ben Barnes", "Rafe Spall", "Henry Thomas", "Michael Raymond-James", "Ryan Eggold"], "site_data": "html Apps Forums Leaderboard Contribute API Support Discover Movies TV Shows Movies Popular Top Rated Upcoming Now Playing TV Shows Popular Top Rated On TV Airing Today People Popular People Can't find a movie or TV show? Login to create it. en Login Sign Up  ID: 61729   Expand Sons of Liberty   (2015) User Score  Play Trailer Overview A radical group of young men band together in secrecy to change the course of history and make America a nation. Discussions   Reviews Videos   Images   Changes Report Share Discussions General  0 Content Issues  0 Images Backdrops  6 Posters  4 Videos Trailers  1 Teasers  0 Clips  0 Featurettes  0 Opening Credits  1 Top Billed Cast Ben Barnes Sam Adams Rafe Spall John Hancock Henry Thomas John Adams Michael Raymond-James Paul Revere Ryan Eggold Joseph Warren Full Cast & Crew Last Season Season 1 2015 | 3 Episodes View All Seasons Social Reviews  0 Discussions  0 Media Most Popular Videos  2 Backdrops  6 Posters  4 Recommendations   2010-06-22 Memphis Beat 6.0    2013-08-11 Cutthroat Kitchen 5.4    2015-09-15 The Bastard Executioner 5.5    2015-03-20 Bloodline 7.5    2011-06-24 The Borgias 7.5    2015-07-19 Tut 7.0    2015-03-09 The Returned 7.1    2014-08-08 The Knick 7.5  Facts Status  Ended Network Certification TV-14 Meaning This program contains some material that many parents would find unsuitable for children under 14 years of age. Type  Miniseries Original Language  English Runtime  86m Homepage   http://www.history.com/shows/sons-of-liberty Genres Drama Keywords miniseries 18th century american revolution historical drama founding fathers Content Score 93 Almost there... Top Contributors 47 Elizabeth Jennings TB 27 TMDb Bot 8 Banana z 5 zurman1  View Edit History Popularity Trend  Login to edit  URL By  signing up  for an account on TMDb, you can post directly to Twitter and Facebook. You need to be logged in to continue. Click  here  to login or  here  to sign up.    page_wrap opened in html_head  Join the Community The Basics About TMDb Contact Us Support Forums API Blog Get Involved  Contribution Bible 3rd Party Applications Add New Movie Add New TV Show Community Guidelines Leaderboard Forums Twitter Facebook Legal Terms of Use Privacy Policy Login Sign Up", "character": ["Sam Adams", "John Hancock", "John Adams", "Paul Revere", "Joseph Warren"]}