{"link": "https://www.themoviedb.org/tv/64339?language=en", "title": "Chewing Gum", "resume": "The life of Tracey, a religious, Beyonc\u00e9-obsessed 22-year-old  living in an estate in Tower Hamlets, and the mishaps of her neighbourhood, friends and family. Oh, and obvs her boyfriend!", "rate": null, "genre": ["Comedy"], "cast": ["Michaela Coel", "Danielle Walters", "Robert Lonsdale", "Susan Wokoma", "Shola Adewusi"], "site_data": "html Apps Forums Leaderboard Contribute API Support Discover Movies TV Shows Movies Popular Top Rated Upcoming Now Playing TV Shows Popular Top Rated On TV Airing Today People Popular People Can't find a movie or TV show? Login to create it. en Login Sign Up  ID: 64339   Expand Chewing Gum   (2015) User Score  Play Trailer Overview The life of Tracey, a religious, Beyonc\u00e9-obsessed 22-year-old  living in an estate in Tower Hamlets, and the mishaps of her neighbourhood, friends and family. Oh, and obvs her boyfriend! Featured Crew Michaela Coel Creator Discussions   Reviews Videos   Images   Changes Report Share Discussions General  2 Content Issues  0 Images Backdrops  2 Posters  2 Videos Trailers  1 Teasers  0 Clips  0 Featurettes  0 Opening Credits  0 Top Billed Cast Michaela Coel Tracey Gordon Danielle Walters Candice Robert Lonsdale Connor Jones Susan Wokoma Cynthia Gordon Shola Adewusi Joy Gordon Full Cast & Crew Last Season Season 2 2017 | 6 Episodes Season 2 of Chewing Gum premiered on January 12, 2017. View All Seasons Social Reviews  0 Discussions  2 Subject Status Replies Last Reply Ash - Series 2 Episode 2 Open 1 by  MirrorMask Series 2? Open 4 by  lmao7 Go to Discussions Media Most Popular Videos  1 Backdrops  2 Posters  2 Recommendations   2015-12-01 Real Rob 5.8    2010-06-28 Huge 5.5    2017-05-05 Spirit: Riding Free 6.3    2015-06-12 Conspiracy 5.7    2012-11-01 Redfern Now 8.0    2011-02-08 Traffic Light 7.2    2016-01-11 Crashing 7.2    2016-05-20 Lady Dynamite 5.9  Facts Status  Returning Series Network Certification  - Type  Scripted Original Language  English Runtime  30m Homepage   http://www.channel4.com/programmes/chewing-gum Genres Comedy Keywords london england christianity christian british comedy sitcom east end of london young adult british humour Content Score 100 Yes! Looking good! Top Contributors 45 Elizabeth Jennings g 11 gonegirl 4 roimidas 3 Forrest73  View Edit History Popularity Trend  Login to edit  URL By  signing up  for an account on TMDb, you can post directly to Twitter and Facebook. You need to be logged in to continue. Click  here  to login or  here  to sign up.    page_wrap opened in html_head  Join the Community The Basics About TMDb Contact Us Support Forums API Blog Get Involved  Contribution Bible 3rd Party Applications Add New Movie Add New TV Show Community Guidelines Leaderboard Forums Twitter Facebook Legal Terms of Use Privacy Policy Login Sign Up", "character": ["Tracey Gordon", "Candice", "Connor Jones", "Cynthia Gordon", "Joy Gordon"]}