{"link": "https://www.themoviedb.org/tv/65264?language=en", "title": "Los ricos no piden permiso", "resume": "We don't have an overview translated in English. Help us expand our database by adding one.", "rate": 85, "genre": ["Drama", "Soap"], "cast": ["Agustina Cherri", "Alberto Ajaka", "Luciano Castro", "Araceli Gonz\u00e1lez", "Gonzalo Heredia"], "character": ["Elena", "Negro", "Rafael", "Julia Monterrey", "Agust\u00edn Villalba"], "site_data": "html Apps Forums Leaderboard Contribute API Support Discover Movies TV Shows Movies Popular Top Rated Upcoming Now Playing TV Shows Popular Top Rated On TV Airing Today People Popular People Can't find a movie or TV show? Login to create it. en Login Sign Up  ID: 65264   Expand Los ricos no piden permiso   (2016) User Score Overview We don't have an overview translated in English. Help us expand our database by adding one. Featured Crew Adri\u00e1n Suar Creator Discussions   Reviews Videos   Images   Changes Report Share Discussions General  0 Content Issues  0 Images Backdrops  4 Posters  2 Videos Trailers  0 Teasers  0 Clips  0 Featurettes  0 Opening Credits  0 Top Billed Cast Agustina Cherri Elena Alberto Ajaka Negro Luciano Castro Rafael Araceli Gonz\u00e1lez Julia Monterrey Gonzalo Heredia Agust\u00edn Villalba Full Cast & Crew Last Season Season 1 2016 | 225 Episodes Season 1 of Los ricos no piden permiso premiered on January 11, 2016. View All Seasons Social Reviews  0 Discussions  0 Media Most Popular Videos  0 Backdrops  4 Posters  2 Recommendations We don't have enough data to suggest any TV shows based on Los ricos no piden permiso. You can help by rating TV shows you've seen. Facts Status  Ended Network Certification TV-PG Meaning This program contains material that parents may find unsuitable for younger children. Type  Scripted Original Language  Spanish; Castilian Runtime  60m Homepage   https://www.eltrecetv.com.ar/los-ricos-no-piden-permiso Genres Drama Soap Keywords telenovela Content Score 93 Almost there... Top Contributors 274 tvcinemax z 10 zurman1 8 Elizabeth Jennings R 5 Rebecca  View Edit History Popularity Trend  Login to edit  URL By  signing up  for an account on TMDb, you can post directly to Twitter and Facebook. You need to be logged in to continue. Click  here  to login or  here  to sign up.    page_wrap opened in html_head  Join the Community The Basics About TMDb Contact Us Support Forums API Blog Get Involved  Contribution Bible 3rd Party Applications Add New Movie Add New TV Show Community Guidelines Leaderboard Forums Twitter Facebook Legal Terms of Use Privacy Policy Login Sign Up"}