{"link": "https://www.themoviedb.org/tv/87?language=en", "title": "The Secret Life of Us", "resume": "The Secret Life of Us is an Australian television drama series about the lives of 20-30 somethings living in the early 2000s.", "rate": 50, "genre": ["Drama"], "cast": ["Deborah Mailman", "David Tredinnick", "Michael Dorman", "Anna Torv", "Stephen Curry"], "character": ["Kelly Lewis", "Simon Trader", "Christian Hayden", "Nikki Martel", "Stuart Woodcock"], "site_data": "html Apps Forums Leaderboard Contribute API Support Discover Movies TV Shows Movies Popular Top Rated Upcoming Now Playing TV Shows Popular Top Rated On TV Airing Today People Popular People Can't find a movie or TV show? Login to create it. en Login Sign Up  ID: 87   Expand The Secret Life of Us   (2001) User Score Overview The Secret Life of Us is an Australian television drama series about the lives of 20-30 somethings living in the early 2000s. Discussions   Reviews Videos   Images   Changes Report Share Discussions General  0 Content Issues  0 Images Backdrops  0 Posters  2 Videos Trailers  0 Teasers  0 Clips  0 Featurettes  0 Opening Credits  0 Top Billed Cast Deborah Mailman Kelly Lewis David Tredinnick Simon Trader Michael Dorman Christian Hayden Anna Torv Nikki Martel Stephen Curry Stuart Woodcock Full Cast & Crew Last Season Season 4 2004 | 16 Episodes Season 4 of The Secret Life of Us premiered on February 18, 2004. View All Seasons Social Reviews  0 Discussions  0 Media Most Popular Videos  0 Backdrops  0 Posters  2 Recommendations We don't have enough data to suggest any TV shows based on The Secret Life of Us. You can help by rating TV shows you've seen. Facts Status  Ended Network Certification  - Type  Scripted Original Language  English Runtime  60m Homepage  - Genres Drama Keywords No keywords have been added. Content Score 71 Just a little bit more... Top Contributors 67 lineker 5 sykobanana 1 rudely_murray 1 Rug  View Edit History Popularity Trend  Login to edit  URL By  signing up  for an account on TMDb, you can post directly to Twitter and Facebook. You need to be logged in to continue. Click  here  to login or  here  to sign up.    page_wrap opened in html_head  Join the Community The Basics About TMDb Contact Us Support Forums API Blog Get Involved  Contribution Bible 3rd Party Applications Add New Movie Add New TV Show Community Guidelines Leaderboard Forums Twitter Facebook Legal Terms of Use Privacy Policy Login Sign Up"}