{"link": "https://www.themoviedb.org/tv/353?language=en", "title": "Stark Raving Mad", "resume": "Stark Raving Mad is an American sitcom that aired from on NBC from 1999 to 2000. The series stars Tony Shalhoub and Neil Patrick Harris.", "rate": 85, "genre": ["Comedy"], "cast": ["Tony Shalhoub", "Eddie McClintock", "Heather Dubrow", "Neil Patrick Harris"], "character": ["Henry McNeeley"], "site_data": "html Apps Forums Leaderboard Contribute API Support Discover Movies TV Shows Movies Popular Top Rated Upcoming Now Playing TV Shows Popular Top Rated On TV Airing Today People Popular People Can't find a movie or TV show? Login to create it. en Login Sign Up  ID: 353   Expand Stark Raving Mad   (1999) User Score Overview Stark Raving Mad is an American sitcom that aired from on NBC from 1999 to 2000. The series stars Tony Shalhoub and Neil Patrick Harris. Featured Crew Steven Levitan Creator Discussions   Reviews Videos   Images   Changes Report Share Discussions General  0 Content Issues  0 Images Backdrops  4 Posters  1 Videos Trailers  0 Teasers  0 Clips  0 Featurettes  0 Opening Credits  0 Top Billed Cast Tony Shalhoub Eddie McClintock Heather Dubrow Neil Patrick Harris Henry McNeeley Full Cast & Crew Last Season season 1 1999 | 22 Episodes Season 1 of Stark Raving Mad premiered on September 23, 1999. View All Seasons Social Reviews  0 Discussions  0 Media Most Popular Videos  0 Backdrops  4 Posters  1 Recommendations We don't have enough data to suggest any TV shows based on Stark Raving Mad. You can help by rating TV shows you've seen. Facts Status  Ended Network Certification  - Type  Scripted Original Language  English Runtime  30m, 23m Homepage  - Genres Comedy Keywords writer editor sitcom Content Score 93 Almost there... Top Contributors 9 Banana s 3 speedycars S 2 Samara  View Edit History Popularity Trend  Login to edit  URL By  signing up  for an account on TMDb, you can post directly to Twitter and Facebook. You need to be logged in to continue. Click  here  to login or  here  to sign up.    page_wrap opened in html_head  Join the Community The Basics About TMDb Contact Us Support Forums API Blog Get Involved  Contribution Bible 3rd Party Applications Add New Movie Add New TV Show Community Guidelines Leaderboard Forums Twitter Facebook Legal Terms of Use Privacy Policy Login Sign Up"}