{"link": "https://www.themoviedb.org/tv/46806?language=en", "title": "30 Vies", "resume": "Inspiring journey into a high school class \u2013  every challenge faced, every life lesson learned \u2013 seen through the eyes of the teachers.", "rate": 65, "genre": ["Drama"], "cast": ["Denise Bouchard", "Julie Perreault"], "character": ["Jean-Fran\u00e7ois Mailloux", "Isabelle Cousineau"], "site_data": "html Apps Forums Leaderboard Contribute API Support Discover Movies TV Shows Movies Popular Top Rated Upcoming Now Playing TV Shows Popular Top Rated On TV Airing Today People Popular People Can't find a movie or TV show? Login to create it. en Login Sign Up  ID: 46806   Expand 30 Vies   (2011) User Score Overview Inspiring journey into a high school class \u2013  every challenge faced, every life lesson learned \u2013 seen through the eyes of the teachers. Discussions   Reviews Videos   Images   Changes Report Share Discussions General  0 Content Issues  0 Images Backdrops  3 Posters  2 Videos Trailers  0 Teasers  0 Clips  0 Featurettes  0 Opening Credits  0 Top Billed Cast Denise Bouchard Jean-Fran\u00e7ois Mailloux Julie Perreault Isabelle Cousineau Full Cast & Crew Last Season Season 4 2013 | 120 Episodes Season 4 of 30 Vies premiered on September  9, 2013. View All Seasons Social Reviews  0 Discussions  0 Media Most Popular Videos  0 Backdrops  3 Posters  2 Recommendations We don't have enough data to suggest any TV shows based on 30 Vies. You can help by rating TV shows you've seen. Facts Status  Ended Network Certification  - Type  Scripted Original Language  French Runtime  22m Homepage   http://30vies.radio-canada.ca/ Genres Drama Keywords high school quebec teacher high school teacher t\u00e9l\u00e9roman Content Score 56 We're so close, yet so far. Top Contributors 105 Banana x 11 xNRJx 1 Elizabeth Jennings  View Edit History Popularity Trend  Login to edit  URL By  signing up  for an account on TMDb, you can post directly to Twitter and Facebook. You need to be logged in to continue. Click  here  to login or  here  to sign up.    page_wrap opened in html_head  Join the Community The Basics About TMDb Contact Us Support Forums API Blog Get Involved  Contribution Bible 3rd Party Applications Add New Movie Add New TV Show Community Guidelines Leaderboard Forums Twitter Facebook Legal Terms of Use Privacy Policy Login Sign Up"}