{"link": "https://www.themoviedb.org/tv/31500?language=en", "title": "Miranda", "resume": "Socially inept Miranda always gets into awkward situations; working in her joke shop with best friend Stevie, being hounded by her pushy mother, and especially when she's around her crush Gary.", "rate": null, "genre": ["Comedy"], "cast": ["Tom Ellis", "Miranda Hart"], "site_data": "html Apps Forums Leaderboard Contribute API Support Discover Movies TV Shows Movies Popular Top Rated Upcoming Now Playing TV Shows Popular Top Rated On TV Airing Today People Popular People Can't find a movie or TV show? Login to create it. en Login Sign Up  ID: 31500   Expand Miranda   (2009) User Score Overview Socially inept Miranda always gets into awkward situations; working in her joke shop with best friend Stevie, being hounded by her pushy mother, and especially when she's around her crush Gary. Featured Crew Miranda Hart Creator Discussions   Reviews Videos   Images   Changes Report Share Discussions General  0 Content Issues  0 Images Backdrops  4 Posters  6 Videos Trailers  0 Teasers  0 Clips  0 Featurettes  0 Opening Credits  0 Top Billed Cast Tom Ellis Gary Preston Miranda Hart Miranda Hart Full Cast & Crew Last Season Series 4 2014 | 2 Episodes View All Seasons Social Reviews  0 Discussions  0 Media Most Popular Videos  0 Backdrops  4 Posters  6 Recommendations   2007-08-27 Outnumbered 7.2    2007-05-13 Gavin & Stacey 7.6    1999-01-08 Gimme Gimme Gimme 7.0    1994-11-10 The Vicar of Dibley 7.3    2013-08-16 Big School 6.3    2010-06-28 Huge 5.5    2012-02-20 The Bleak Old Shop of Stuff 6.7    2005-01-11 Ideal 7.9  Facts Status  Ended Network Certification 15 Meaning No-one under 15 is allowed to see a 15 film at the cinema or buy/rent a 15 rated video. 15 rated works are not suitable for children under 15 years of age. Type  Scripted Original Language  English Runtime  30m Homepage   http://www.bbc.co.uk/programmes/b00nzytf Genres Comedy Keywords female protagonist british comedy sitcom british humour Content Score 64 We're so close, yet so far. Top Contributors 12 MrSwift 12 spaceship broken 10 Elizabeth Jennings 5 Banana  View Edit History Popularity Trend  Login to edit  URL By  signing up  for an account on TMDb, you can post directly to Twitter and Facebook. You need to be logged in to continue. Click  here  to login or  here  to sign up.    page_wrap opened in html_head  Join the Community The Basics About TMDb Contact Us Support Forums API Blog Get Involved  Contribution Bible 3rd Party Applications Add New Movie Add New TV Show Community Guidelines Leaderboard Forums Twitter Facebook Legal Terms of Use Privacy Policy Login Sign Up", "character": ["Gary Preston", "Miranda Hart"]}