{"link": "https://www.themoviedb.org/tv/69974?language=en", "title": "Whisper", "resume": "Shin Young-Joo is a female detective with charisma and Lee Dong-Joon is a righteous judge. They uncover corruption at the nation's biggest law firm Taebaek.", "rate": null, "genre": ["Crime", "Drama"], "cast": ["Lee Bo-young", "Lee Sang-yoon", "Kwon Yul", "Park Se-young", "Yoon Joo-hee"], "site_data": "html Apps Forums Leaderboard Contribute API Support Discover Movies TV Shows Movies Popular Top Rated Upcoming Now Playing TV Shows Popular Top Rated On TV Airing Today People Popular People Can't find a movie or TV show? Login to create it. en Login Sign Up  ID: 69974   Expand Whisper   (2017) User Score Overview Shin Young-Joo is a female detective with charisma and Lee Dong-Joon is a righteous judge. They uncover corruption at the nation's biggest law firm Taebaek. Discussions   Reviews Videos   Images   Changes Report Share Discussions General  0 Content Issues  0 Images Backdrops  1 Posters  3 Videos Trailers  0 Teasers  0 Clips  0 Featurettes  0 Opening Credits  0 Top Billed Cast Lee Bo-young Shin Young-Joo Lee Sang-yoon Lee Dong-Joon Kwon Yul Kang Jung-Il Park Se-young Choi Soo-Yeon Yoon Joo-hee Hwang Bo-Yeon Full Cast & Crew Last Season Season 1 2017 | 17 Episodes Season 1 of Whisper premiered on March 27, 2017. View All Seasons Social Reviews  0 Discussions  0 Media Most Popular Videos  0 Backdrops  1 Posters  3 Recommendations   2017-01-16 Introverted Boss 8.7    2017-01-25 Chief Kim 7.5  Facts Original Name  \uadd3\uc18d\ub9d0 Status  Ended Network Certification  - Type  Scripted Original Language  Korean Runtime  60m Homepage   http://program.sbs.co.kr/builder/programMainList.do?pgm_id=22000010259 Genres Crime Drama Keywords korea Content Score 86 Almost there... Top Contributors M 59 Maria180493 l 7 longwoo s 4 sheva_vitali 4 andermairena  View Edit History Popularity Trend  Login to edit  URL By  signing up  for an account on TMDb, you can post directly to Twitter and Facebook. You need to be logged in to continue. Click  here  to login or  here  to sign up.    page_wrap opened in html_head  Join the Community The Basics About TMDb Contact Us Support Forums API Blog Get Involved  Contribution Bible 3rd Party Applications Add New Movie Add New TV Show Community Guidelines Leaderboard Forums Twitter Facebook Legal Terms of Use Privacy Policy Login Sign Up", "character": ["Shin Young-Joo", "Lee Dong-Joon", "Kang Jung-Il", "Choi Soo-Yeon", "Hwang Bo-Yeon"]}