{"link": "https://www.themoviedb.org/tv/72462?language=en", "title": "Free Rein", "resume": "A 15-year-old from LA spends the summer at her mom's childhood home on an island off the coast of England, where she bonds with a mysterious horse.", "rate": null, "genre": ["Family", "Kids", "Drama"], "cast": ["Jaylen Barron", "Manpreet Bambra", "Carla Woodcock", "Freddy Carter", "Kerry Ingram"], "site_data": "html Apps Forums Leaderboard Contribute API Support Discover Movies TV Shows Movies Popular Top Rated Upcoming Now Playing TV Shows Popular Top Rated On TV Airing Today People Popular People Can't find a movie or TV show? Login to create it. en Login Sign Up  ID: 72462   Expand Free Rein   (2017) User Score Overview A 15-year-old from LA spends the summer at her mom's childhood home on an island off the coast of England, where she bonds with a mysterious horse. Featured Crew Vicki Lutas Creator Anna McCleery Creator Kirstie Falkous Creator Discussions   Reviews Videos   Images   Changes Report Share Discussions General  1 Content Issues  0 Images Backdrops  3 Posters  1 Videos Trailers  0 Teasers  0 Clips  0 Featurettes  0 Opening Credits  0 Top Billed Cast Jaylen Barron Zoe Manpreet Bambra Jade Carla Woodcock Susie Freddy Carter Pin Kerry Ingram Becky Full Cast & Crew Last Season Season 1 2017 | 10 Episodes Season 1 of Free Rein premiered on June 22, 2017. View All Seasons Social Reviews  0 Discussions  1 Subject Status Replies Last Reply w Zoe: Happy Birthday Jaylen Barron! Open 0 by wonder2wonder\n      \n     Go to Discussions Media Most Popular Videos  0 Backdrops  3 Posters  1 Recommendations We don't have enough data to suggest any TV shows based on Free Rein. You can help by rating TV shows you've seen. Facts Status  Returning Series Network Certification L Meaning Content is suitable for all audiences. Type  Scripted Original Language  English Runtime  26m Homepage   https://www.netflix.com/title/80134695 Genres Family Kids Drama Keywords No keywords have been added. Content Score 93 Almost there... Top Contributors l 27 lexura 8 0x3199 8 Mervan MP 7 Mr. Peanutbutter  View Edit History Popularity Trend  Login to edit  URL By  signing up  for an account on TMDb, you can post directly to Twitter and Facebook. You need to be logged in to continue. Click  here  to login or  here  to sign up.    page_wrap opened in html_head  Join the Community The Basics About TMDb Contact Us Support Forums API Blog Get Involved  Contribution Bible 3rd Party Applications Add New Movie Add New TV Show Community Guidelines Leaderboard Forums Twitter Facebook Legal Terms of Use Privacy Policy Login Sign Up", "character": ["Zoe", "Jade", "Susie", "Pin", "Becky"]}