{"link": "https://www.themoviedb.org/tv/66499?language=en", "title": "What Happens to My Family", "resume": "A na\u00efve young woman goes to Istanbul to meet the now-grown boy who jokingly promised to marry her in 11 years after she saved his life as a child.", "rate": 70, "genre": ["Comedy", "Drama", "Family"], "cast": ["\u00d6zg\u00fcn Karaman", "Tolga Pancaroglu", "Settar Tanri\u00f6gen", "Ertun\u00e7 Tuncer", "T\u00fclay Bursa"], "character": ["Emrecan", "Egemen", "Salih", "R\u00fczgar", "Nermin"], "site_data": "html Apps Forums Leaderboard Contribute API Support Discover Movies TV Shows Movies Popular Top Rated Upcoming Now Playing TV Shows Popular Top Rated On TV Airing Today People Popular People Can't find a movie or TV show? Login to create it. en Login Sign Up  ID: 66499   Expand What Happens to My Family   (2015) User Score Overview A na\u00efve young woman goes to Istanbul to meet the now-grown boy who jokingly promised to marry her in 11 years after she saved his life as a child. Featured Crew Faruk Bayhan Creator Discussions   Reviews Videos   Images   Changes Report Share Discussions General  0 Content Issues  0 Images Backdrops  14 Posters  3 Videos Trailers  0 Teasers  0 Clips  0 Featurettes  0 Opening Credits  0 Top Billed Cast \u00d6zg\u00fcn Karaman Emrecan Tolga Pancaroglu Egemen Settar Tanri\u00f6gen Salih Ertun\u00e7 Tuncer R\u00fczgar T\u00fclay Bursa Nermin Full Cast & Crew Last Season Season 1 2015 | 41 Episodes Season 1 of What Happens to My Family premiered on August  2, 2015. View All Seasons Social Reviews  0 Discussions  0 Media Most Popular Videos  0 Backdrops  14 Posters  3 Recommendations We don't have enough data to suggest any TV shows based on What Happens to My Family. You can help by rating TV shows you've seen. Facts Original Name  Baba Can'd\u0131r Status  Returning Series Network Certification  - Type  Scripted Original Language  Turkish Runtime  120m Homepage   http://www.trt1.com.tr/diziler/baba-candir Genres Comedy Drama Family Keywords No keywords have been added. Content Score 100 Yes! Looking good! Top Contributors 75 cobain 8 lineker MP 3 Mr. Peanutbutter 2 Banana  View Edit History Popularity Trend  Login to edit  URL By  signing up  for an account on TMDb, you can post directly to Twitter and Facebook. You need to be logged in to continue. Click  here  to login or  here  to sign up.    page_wrap opened in html_head  Join the Community The Basics About TMDb Contact Us Support Forums API Blog Get Involved  Contribution Bible 3rd Party Applications Add New Movie Add New TV Show Community Guidelines Leaderboard Forums Twitter Facebook Legal Terms of Use Privacy Policy Login Sign Up"}