{"link": "https://www.themoviedb.org/tv/70528?language=en", "title": "Chicago Typewriter", "resume": "Writers that lived under Japanese rule in the 1930's are reincarnated into a bestselling writer who is in a slump, a mysterious ghostwriter and an anti-fan of the bestselling writer.", "rate": 74, "genre": ["Sci-Fi", "Fantasy"], "cast": ["Yoo Ah-in", "Im Soo-jung", "Ko Kyoung-pyo", "Kwak Si-yang", "Jo Woo-jin"], "character": ["Han Se-Joo", "Jeon Seol", "Yoo Jin-O", "Baek Tae-Min", "Gal Ji-Seok"], "site_data": "html Apps Forums Leaderboard Contribute API Support Discover Movies TV Shows Movies Popular Top Rated Upcoming Now Playing TV Shows Popular Top Rated On TV Airing Today People Popular People Can't find a movie or TV show? Login to create it. en Login Sign Up  ID: 70528   Expand Chicago Typewriter   (2017) User Score Overview Writers that lived under Japanese rule in the 1930's are reincarnated into a bestselling writer who is in a slump, a mysterious ghostwriter and an anti-fan of the bestselling writer. Discussions   Reviews Videos   Images   Changes Report Share Discussions General  0 Content Issues  0 Images Backdrops  10 Posters  5 Videos Trailers  0 Teasers  0 Clips  0 Featurettes  0 Opening Credits  0 Top Billed Cast Yoo Ah-in Han Se-Joo Im Soo-jung Jeon Seol Ko Kyoung-pyo Yoo Jin-O Kwak Si-yang Baek Tae-Min Jo Woo-jin Gal Ji-Seok Full Cast & Crew Last Season Season 1 2017 | 16 Episodes Season 1 of Chicago Typewriter premiered on April  7, 2017. View All Seasons Social Reviews  0 Discussions  0 Media Most Popular Videos  0 Backdrops  10 Posters  5 Recommendations   2017-01-16 Introverted Boss 8.7    2017-01-25 Chief Kim 7.5    2017-10-11 Mad Dog 8.0    2017-11-11 Money Flower 8.0    2017-10-09 Witch's Court 9.3    2017-03-27 Whisper 6.8    2017-09-27 While You Were Sleeping 9.0    2017-03-15 Radiant Office 6.9  Facts Original Name  \uc2dc\uce74\uace0 \ud0c0\uc790\uae30 Status  Ended Network Certification  - Type  Scripted Original Language  Korean Runtime  60m Homepage   http://program.tving.com/tvn/chicagotypewriter/ Genres Sci-Fi & Fantasy Keywords fantasy reincarnation romance korea Content Score 86 Almost there... Top Contributors M 55 Maria180493 K 15 Kevin.Wood 6 lelouchvib 4 andermairena  View Edit History Popularity Trend  Login to edit  URL By  signing up  for an account on TMDb, you can post directly to Twitter and Facebook. You need to be logged in to continue. Click  here  to login or  here  to sign up.    page_wrap opened in html_head  Join the Community The Basics About TMDb Contact Us Support Forums API Blog Get Involved  Contribution Bible 3rd Party Applications Add New Movie Add New TV Show Community Guidelines Leaderboard Forums Twitter Facebook Legal Terms of Use Privacy Policy Login Sign Up"}