{"link": "https://www.themoviedb.org/tv/54357?language=en", "title": "1864", "resume": "When Germany and Prussia declare war on Denmark, two brothers are called to serve in the bloodiest battle in Denmark's history.", "rate": null, "genre": ["Drama", "War", "Politics"], "cast": ["Jakob Oftebro", "Pilou Asb\u00e6k", "Marie Tourell S\u00f8derberg", "Jens S\u00e6tter-Lassen", "Eva Josefikova"], "site_data": "html Apps Forums Leaderboard Contribute API Support Discover Movies TV Shows Movies Popular Top Rated Upcoming Now Playing TV Shows Popular Top Rated On TV Airing Today People Popular People Can't find a movie or TV show? Login to create it. en Login Sign Up  ID: 54357   Expand 1864   (2014) User Score  Play Trailer Overview When Germany and Prussia declare war on Denmark, two brothers are called to serve in the bloodiest battle in Denmark's history. Featured Crew Ole Bornedal Creator Discussions   Reviews Videos   Images   Changes Report Share Discussions General  0 Content Issues  1 Images Backdrops  2 Posters  5 Videos Trailers  1 Teasers  0 Clips  0 Featurettes  0 Opening Credits  0 Top Billed Cast Jakob Oftebro Laust Jensen Pilou Asb\u00e6k Didrich Marie Tourell S\u00f8derberg Inge Juel Jens S\u00e6tter-Lassen Peter Jensen Eva Josefikova Sofia Full Cast & Crew Last Season Season 1 2014 | 8 Episodes Season 1 of 1864 premiered on October 12, 2014. View All Seasons Social Reviews  0 Discussions  1 Subject Status Replies Last Reply There are no discussions for 1864. Login to be first! Go to Discussions Media Most Popular Videos  1 Backdrops  2 Posters  5 Recommendations   2012-01-22 Real Humans 7.7    1980-09-15 Shogun 7.2    2004-07-11 The 4400 6.9    1996-09-19 The Pretender 7.3    2012-07-09 Perception 6.7    2005-01-03 Medium 6.4    2002-12-02 Taken 7.4    2013-04-22 Rectify 7.6  Facts Status  Ended Network Certification 15 Meaning No-one under 15 is allowed to see a 15 film at the cinema or buy/rent a 15 rated video. 15 rated works are not suitable for children under 15 years of age. Type  Miniseries Original Language  Danish Runtime  60m Homepage   https://www.dr.dk/tv/se/1864 Genres Drama War & Politics Keywords war denmark austria prussia nordic noir 19th century Content Score 100 Yes! Looking good! Top Contributors TB 31 TMDb Bot R 22 Rebecca Y 16 Yaut a 7 afogutu  View Edit History Popularity Trend  Login to edit  URL By  signing up  for an account on TMDb, you can post directly to Twitter and Facebook. You need to be logged in to continue. Click  here  to login or  here  to sign up.    page_wrap opened in html_head  Join the Community The Basics About TMDb Contact Us Support Forums API Blog Get Involved  Contribution Bible 3rd Party Applications Add New Movie Add New TV Show Community Guidelines Leaderboard Forums Twitter Facebook Legal Terms of Use Privacy Policy Login Sign Up", "character": ["Laust Jensen", "Didrich", "Inge Juel", "Peter Jensen", "Sofia"]}