{"link": "https://www.themoviedb.org/tv/70164?language=en", "title": "Arman Pohjant\u00e4hden alla", "resume": "Arman Pohjant\u00e4hden alla is a Finnish document series about Finland and Finnishness.", "rate": 70, "genre": ["Reality", "Documentary"], "cast": ["Arman Alizad"], "character": ["himself"], "site_data": "html Apps Forums Leaderboard Contribute API Support Discover Movies TV Shows Movies Popular Top Rated Upcoming Now Playing TV Shows Popular Top Rated On TV Airing Today People Popular People Can't find a movie or TV show? Login to create it. en Login Sign Up  ID: 70164   Expand Arman Pohjant\u00e4hden alla   (2016) User Score Overview Arman Pohjant\u00e4hden alla is a Finnish document series about Finland and Finnishness. Discussions   Reviews Videos   Images   Changes Report Share Discussions General  0 Content Issues  1 Images Backdrops  1 Posters  1 Videos Trailers  0 Teasers  0 Clips  0 Featurettes  0 Opening Credits  0 Top Billed Cast Arman Alizad himself Full Cast & Crew Current Season Season 3 2018 | 10 Episodes Season 3 of Arman Pohjant\u00e4hden alla premiered on April 10, 2018. View All Seasons Social Reviews  0 Discussions  1 Subject Status Replies Last Reply There are no discussions for Arman Pohjant\u00e4hden alla. Login to be first! Go to Discussions Media Most Popular Videos  0 Backdrops  1 Posters  1 Recommendations We don't have enough data to suggest any TV shows based on Arman Pohjant\u00e4hden alla. You can help by rating TV shows you've seen. Facts Status  Returning Series Network Certification  - Type  Scripted Original Language  Finnish Runtime  43m Homepage   http://www.nelonen.fi/ohjelmat/arman-pohjantahden-alla Genres Reality Documentary Keywords army homelessness crime motorcycle gang justice drugs and addiction finland elderly nutrition asylum seekers Content Score 56 We're so close, yet so far. Top Contributors 43 BryGur c 2 chrisup 2 Banana  View Edit History Popularity Trend  Login to edit  URL By  signing up  for an account on TMDb, you can post directly to Twitter and Facebook. You need to be logged in to continue. Click  here  to login or  here  to sign up.    page_wrap opened in html_head  Join the Community The Basics About TMDb Contact Us Support Forums API Blog Get Involved  Contribution Bible 3rd Party Applications Add New Movie Add New TV Show Community Guidelines Leaderboard Forums Twitter Facebook Legal Terms of Use Privacy Policy Login Sign Up"}