{"link": "https://www.themoviedb.org/tv/80353?language=en", "title": "Hollywood Love Story", "resume": "Paris Hilton presents a series of cautionary tales about the lives of young people trying to make it in Los Angeles.", "rate": null, "genre": ["Documentary"], "cast": ["Paris Hilton"], "site_data": "html Apps Forums Leaderboard Contribute API Support Discover Movies TV Shows Movies Popular Top Rated Upcoming Now Playing TV Shows Popular Top Rated On TV Airing Today People Popular People Can't find a movie or TV show? Login to create it. en Login Sign Up  ID: 80353   Expand Hollywood Love Story   (2018) User Score  Play Trailer Overview Paris Hilton presents a series of cautionary tales about the lives of young people trying to make it in Los Angeles. Discussions   Reviews Videos   Images   Changes Report Share Discussions General  0 Content Issues  0 Images Backdrops  2 Posters  1 Videos Trailers  1 Teasers  0 Clips  0 Featurettes  0 Opening Credits  0 Top Billed Cast Paris Hilton Herself Full Cast & Crew Next Season Season 1 2018 | 2 Episodes Season 1 of Hollywood Love Story is set to premiere on July 11, 2018. View All Seasons Social Reviews  0 Discussions  0 Media Most Popular Videos  1 Backdrops  2 Posters  1 Facts Status  Returning Series Network Certification TV-14 Meaning This program contains some material that many parents would find unsuitable for children under 14 years of age. Type  Documentary Original Language  English Runtime  22m Homepage   https://www.viceland.com/en_us/show/hollywood-love-story Genres Documentary Keywords No keywords have been added. Content Score 64 We're so close, yet so far. Top Contributors 23 Elizabeth Jennings  View Edit History Popularity Trend  Login to edit  URL By  signing up  for an account on TMDb, you can post directly to Twitter and Facebook. You need to be logged in to continue. Click  here  to login or  here  to sign up.    page_wrap opened in html_head  Join the Community The Basics About TMDb Contact Us Support Forums API Blog Get Involved  Contribution Bible 3rd Party Applications Add New Movie Add New TV Show Community Guidelines Leaderboard Forums Twitter Facebook Legal Terms of Use Privacy Policy Login Sign Up", "character": ["Herself"]}