{"link": "https://www.themoviedb.org/tv/61516?language=en", "title": "Karde\u015f Pay\u0131", "resume": "The show is about two brothers and a sister. The two brothers have a plumbing company and they are trying to invent something that would make the world a better place.", "rate": 98, "genre": ["Family", "Drama", "Comedy"], "cast": ["Ahmet Kural", "Murat Cemcir", "Seda Bakan", "Emrah Kaman", "Ayhan Ta\u015f"], "character": ["Metin \u00d6zdemir", "Ali \u00d6zdemir", "Feyza \u00d6zdemir", "Emrah"], "site_data": "html Apps Forums Leaderboard Contribute API Support Discover Movies TV Shows Movies Popular Top Rated Upcoming Now Playing TV Shows Popular Top Rated On TV Airing Today People Popular People Can't find a movie or TV show? Login to create it. en Login Sign Up  ID: 61516   Expand Karde\u015f Pay\u0131   (2014) User Score Overview The show is about two brothers and a sister. The two brothers have a plumbing company and they are trying to invent something that would make the world a better place. Featured Crew Sel\u00e7uk Aydemir Creator Discussions   Reviews Videos   Images   Changes Report Share Discussions General  0 Content Issues  0 Images Backdrops  2 Posters  3 Videos Trailers  0 Teasers  0 Clips  0 Featurettes  0 Opening Credits  0 Top Billed Cast Ahmet Kural Metin \u00d6zdemir Murat Cemcir Ali \u00d6zdemir Seda Bakan Feyza \u00d6zdemir Emrah Kaman Emrah Ayhan Ta\u015f Full Cast & Crew Last Season Season 2 2015 | 13 Episodes Season 2 of Karde\u015f Pay\u0131 premiered on January 29, 2015. View All Seasons Social Reviews  0 Discussions  0 Media Most Popular Videos  0 Backdrops  2 Posters  3 Recommendations   \u0130\u015fler G\u00fc\u00e7ler 7.2    2011-02-09 Leyla ile Mecnun 8.1    2005-09-19 How I Met Your Mother 7.4    2004-09-22 Lost 7.8    2015-05-27 Mr. Robot 7.8    2008-01-19 Breaking Bad 8.3    2012-10-10 Arrow 6.0  Facts Status  Ended Networks Certification  - Type  Scripted Original Language  Turkish Runtime  60m Homepage  - Genres Family Drama Comedy Keywords invention Content Score 93 Almost there... Top Contributors 14 3sogi 12 Erhan 8 mfteam 3 Mucahid Zeyrek  View Edit History Popularity Trend  Login to edit  URL By  signing up  for an account on TMDb, you can post directly to Twitter and Facebook. You need to be logged in to continue. Click  here  to login or  here  to sign up.    page_wrap opened in html_head  Join the Community The Basics About TMDb Contact Us Support Forums API Blog Get Involved  Contribution Bible 3rd Party Applications Add New Movie Add New TV Show Community Guidelines Leaderboard Forums Twitter Facebook Legal Terms of Use Privacy Policy Login Sign Up"}