{"link": "https://www.themoviedb.org/tv/73099?language=en", "title": "Man in an Orange Shirt", "resume": "A love story in two films charts the very different challenges to happiness for Michael and Thomas in the aftermath of World War 2, and to Adam and Steve in the present day.", "rate": 83, "genre": ["Drama"], "cast": ["Oliver Jackson-Cohen", "James McArdle", "Joanna Vanderham", "Vanessa Redgrave", "Frances de la Tour"], "character": ["Michael Berryman", "Thomas March", "Flora Talbot Berryman", "Flora Berryman", "Mrs. March"], "site_data": "html Apps Forums Leaderboard Contribute API Support Discover Movies TV Shows Movies Popular Top Rated Upcoming Now Playing TV Shows Popular Top Rated On TV Airing Today People Popular People Can't find a movie or TV show? Login to create it. en Login Sign Up  ID: 73099   Expand Man in an Orange Shirt   (2017) User Score  Play Trailer Overview A love story in two films charts the very different challenges to happiness for Michael and Thomas in the aftermath of World War 2, and to Adam and Steve in the present day. Featured Crew Patrick Gale Creator Discussions   Reviews Videos   Images   Changes Report Share Discussions General  1 Content Issues  0 Images Backdrops  10 Posters  5 Videos Trailers  1 Teasers  0 Clips  0 Featurettes  0 Opening Credits  0 Top Billed Cast Oliver Jackson-Cohen Michael Berryman James McArdle Thomas March Joanna Vanderham Flora Talbot Berryman Vanessa Redgrave Flora Berryman Frances de la Tour Mrs. March Full Cast & Crew Last Season Season 1 2017 | 2 Episodes Season 1 of Man in an Orange Shirt premiered on July 31, 2017. View All Seasons Social Reviews  0 Discussions  1 Subject Status Replies Last Reply Excellent casting of the Michael, Adam & both Flora roles Open 0 by genplant29\n      \n     Go to Discussions Media Most Popular Videos  1 Backdrops  10 Posters  5 Recommendations   1981-10-12 Brideshead Revisited 7.8  Facts Status  Ended Network Certification 15 Meaning No-one under 15 is allowed to see a 15 film at the cinema or buy/rent a 15 rated video. 15 rated works are not suitable for children under 15 years of age. Type  Miniseries Original Language  English Runtime  60m Homepage   http://www.bbc.co.uk/programmes/p057xts3 Genres Drama Keywords wife husband relationship grandparent grandchild relationship world war ii painting love gay relationship miniseries cottage lgbt generation love letters Content Score 100 Yes! Looking good! Top Contributors 37 Elizabeth Jennings TB 31 TMDb Bot k 20 kyz03 z 14 zecakeh  View Edit History Popularity Trend  Login to edit  URL By  signing up  for an account on TMDb, you can post directly to Twitter and Facebook. You need to be logged in to continue. Click  here  to login or  here  to sign up.    page_wrap opened in html_head  Join the Community The Basics About TMDb Contact Us Support Forums API Blog Get Involved  Contribution Bible 3rd Party Applications Add New Movie Add New TV Show Community Guidelines Leaderboard Forums Twitter Facebook Legal Terms of Use Privacy Policy Login Sign Up"}