{"link": "https://www.themoviedb.org/tv/29082?language=en", "title": "De Wereld Draait Door", "resume": "Talkshow hosted by Matthijs van Nieuwkerk containing a mixture of news, information, television bloopers and general entertainment.", "rate": 53, "genre": ["Talk"], "cast": ["Matthijs van Nieuwkerk"], "character": ["Himself - Host"], "site_data": "html Apps Forums Leaderboard Contribute API Support Discover Movies TV Shows Movies Popular Top Rated Upcoming Now Playing TV Shows Popular Top Rated On TV Airing Today People Popular People Can't find a movie or TV show? Login to create it. en Login Sign Up  ID: 29082   Expand De Wereld Draait Door   (2005) User Score Overview Talkshow hosted by Matthijs van Nieuwkerk containing a mixture of news, information, television bloopers and general entertainment. Discussions   Reviews Videos   Images   Changes Report Share Discussions General  0 Content Issues  0 Images Backdrops  1 Posters  1 Videos Trailers  0 Teasers  0 Clips  0 Featurettes  0 Opening Credits  0 Top Billed Cast Matthijs van Nieuwkerk Himself - Host Full Cast & Crew Last Season Season 13 2017 | 91 Episodes Season 13 of De Wereld Draait Door premiered on January  9, 2017. View All Seasons Social Reviews  0 Discussions  0 Media Most Popular Videos  0 Backdrops  1 Posters  1 Recommendations We don't have enough data to suggest any TV shows based on De Wereld Draait Door. You can help by rating TV shows you've seen. Facts Status  Returning Series Networks Certification  - Type  Talk Show Original Language  Dutch; Flemish Runtime  50m Homepage   https://dewerelddraaitdoor.bnnvara.nl Genres Talk Keywords live show Content Score 56 We're so close, yet so far. Top Contributors 38 Marr \ud83c\uddf3\ud83c\uddf1 22 mariixxx B 4 BLNDR1 3 BudsieBuds  View Edit History Popularity Trend  Login to edit  URL By  signing up  for an account on TMDb, you can post directly to Twitter and Facebook. You need to be logged in to continue. Click  here  to login or  here  to sign up.    page_wrap opened in html_head  Join the Community The Basics About TMDb Contact Us Support Forums API Blog Get Involved  Contribution Bible 3rd Party Applications Add New Movie Add New TV Show Community Guidelines Leaderboard Forums Twitter Facebook Legal Terms of Use Privacy Policy Login Sign Up"}