{"link": "https://www.themoviedb.org/tv/66604?language=en", "title": "New Blood", "resume": "Two junior investigators come together against a new breed of criminal, the uber rich and powerful corporations, individuals and governments who hide behind legitimate facades.", "rate": 65, "genre": ["Crime", "Mystery"], "cast": ["Ben Tavassoli", "Mark Strepan", "Anna Chancellor", "Mark Addy", "Ariyon Bakare"], "character": ["Rash Sayyad", "Stefan Kowolski", "Eleanor Davies", "DS Sands", "Marcus Johnson"], "site_data": "html Apps Forums Leaderboard Contribute API Support Discover Movies TV Shows Movies Popular Top Rated Upcoming Now Playing TV Shows Popular Top Rated On TV Airing Today People Popular People Can't find a movie or TV show? Login to create it. en Login Sign Up  ID: 66604   Expand New Blood   (2016) User Score Overview Two junior investigators come together against a new breed of criminal, the uber rich and powerful corporations, individuals and governments who hide behind legitimate facades. Featured Crew Anthony Horowitz Creator Discussions   Reviews Videos   Images   Changes Report Share Discussions General  0 Content Issues  0 Images Backdrops  4 Posters  3 Videos Trailers  0 Teasers  0 Clips  0 Featurettes  0 Opening Credits  0 Top Billed Cast Ben Tavassoli Rash Sayyad Mark Strepan Stefan Kowolski Anna Chancellor Eleanor Davies Mark Addy DS Sands Ariyon Bakare Marcus Johnson Full Cast & Crew Last Season Season 1 2016 | 7 Episodes Season 1 of New Blood premiered on June  9, 2016. View All Seasons Social Reviews  0 Discussions  0 Media Most Popular Videos  0 Backdrops  4 Posters  3 Recommendations   2001-09-24 Murphy's Law 6.8    2014-10-06 Grantchester 7.3    2013-10-29 The Escape Artist 7.0    2011-06-05 Case Histories 8.2    2016-09-30 The Level 6.5    2011-05-29 Scott & Bailey 7.5    1996-02-21 Silent Witness 7.4    2012-06-26 Line of Duty 8.0  Facts Status  Returning Series Network Certification 16 Meaning Can be aired only from 10:00pm Uhr to 6:00am. Type  Scripted Original Language  English Runtime  60m Homepage   http://www.bbc.co.uk/programmes/p03vfqsq Genres Crime Mystery Keywords london england corruption investigation Content Score 93 Almost there... Top Contributors 33 EveDemocracy 14 Elizabeth Jennings 10 Banana 8 Ben0211  View Edit History Popularity Trend  Login to edit  URL By  signing up  for an account on TMDb, you can post directly to Twitter and Facebook. You need to be logged in to continue. Click  here  to login or  here  to sign up.    page_wrap opened in html_head  Join the Community The Basics About TMDb Contact Us Support Forums API Blog Get Involved  Contribution Bible 3rd Party Applications Add New Movie Add New TV Show Community Guidelines Leaderboard Forums Twitter Facebook Legal Terms of Use Privacy Policy Login Sign Up"}