{"link": "https://www.themoviedb.org/tv/66329?language=en", "title": "Doctors", "resume": "When Hye-Jung was young, her life was difficult. She was good at fighting, but also studied well. Overcoming her tough situation, she is now a doctor.", "rate": null, "genre": ["Drama"], "cast": ["Kim Rae-Won", "Park Shin-hye", "Yoon Kyun-sang", "Lee Sung-kyung", "Kim Min-seok"], "site_data": "html Apps Forums Leaderboard Contribute API Support Discover Movies TV Shows Movies Popular Top Rated Upcoming Now Playing TV Shows Popular Top Rated On TV Airing Today People Popular People Can't find a movie or TV show? Login to create it. en Login Sign Up  ID: 66329   Expand Doctors   (2016) User Score  Play Trailer Overview When Hye-Jung was young, her life was difficult. She was good at fighting, but also studied well. Overcoming her tough situation, she is now a doctor. Discussions   Reviews Videos   Images   Changes Report Share Discussions General  0 Content Issues  0 Images Backdrops  3 Posters  4 Videos Trailers  3 Teasers  0 Clips  0 Featurettes  0 Opening Credits  0 Top Billed Cast Kim Rae-Won Hong Ji-hong Park Shin-hye Yoo Hye-jeong Yoon Kyun-sang Jung Yoon-do Lee Sung-kyung Jin Seo-woo Kim Min-seok Choi Kang-sik Full Cast & Crew Last Season Season 1 2016 | 20 Episodes Season 1 of Doctors premiered on June 20, 2016. View All Seasons Social Reviews  0 Discussions  0 Media Most Popular Videos  3 Backdrops  3 Posters  4 Recommendations   2016-08-27 Our Gap Soon 9.3    2016-09-21 On the Way to the Airport 8.7    2016-09-26 Woman with a Suitcase 7.1    2016-11-16 Oh My Geum Bi 8.7    2016-03-28 Monster 7.9    2017-01-23 Defendant 7.1    2016-09-21 Shopping King Louie 6.7    2016-08-27 Blow Breeze 6.6  Facts Original Name  \ub2e5\ud130\uc2a4 Status  Ended Network Certification  - Type  Scripted Original Language  Korean Runtime  60m Homepage   http://program.sbs.co.kr/builder/programMainList.do?pgm_id=22000009527 Genres Drama Keywords romance korea medical drama Content Score 93 Almost there... Top Contributors M 61 Maria180493 14 nyedotcom n 6 namsan TB 6 TMDb Bot  View Edit History Popularity Trend  Login to edit  URL By  signing up  for an account on TMDb, you can post directly to Twitter and Facebook. You need to be logged in to continue. Click  here  to login or  here  to sign up.    page_wrap opened in html_head  Join the Community The Basics About TMDb Contact Us Support Forums API Blog Get Involved  Contribution Bible 3rd Party Applications Add New Movie Add New TV Show Community Guidelines Leaderboard Forums Twitter Facebook Legal Terms of Use Privacy Policy Login Sign Up", "character": ["Hong Ji-hong", "Yoo Hye-jeong", "Jung Yoon-do", "Jin Seo-woo", "Choi Kang-sik"]}