{"link": "https://www.themoviedb.org/tv/67169?language=en", "title": "The Collection", "resume": "A gripping family drama and entrepreneurial fable, set in a post-war Paris fashion house. It exposes the grit behind the glamour of a rising business, spearheaded by two clashing brothers.", "rate": null, "genre": ["Drama"], "cast": ["Richard Coyle", "Tom Riley", "Frances de la Tour", "Mamie Gummer", "Jenna Thiam"], "site_data": "html Apps Forums Leaderboard Contribute API Support Discover Movies TV Shows Movies Popular Top Rated Upcoming Now Playing TV Shows Popular Top Rated On TV Airing Today People Popular People Can't find a movie or TV show? Login to create it. en Login Sign Up  ID: 67169   Expand The Collection   (2016) User Score  Play Trailer Overview A gripping family drama and entrepreneurial fable, set in a post-war Paris fashion house. It exposes the grit behind the glamour of a rising business, spearheaded by two clashing brothers. Featured Crew Oliver Goldstick Creator Discussions   Reviews Videos   Images   Changes Report Share Discussions General  0 Content Issues  0 Images Backdrops  5 Posters  2 Videos Trailers  1 Teasers  0 Clips  0 Featurettes  0 Opening Credits  0 Top Billed Cast Richard Coyle Paul Sabine Tom Riley Claude Sabine Frances de la Tour Yvette Sabine Mamie Gummer Helen Sabine Jenna Thiam Nina Full Cast & Crew Last Season Season 1 2016 | 8 Episodes Season 1 of The Collection premiered on September  2, 2016. View All Seasons Social Reviews  0 Discussions  0 Media Most Popular Videos  1 Backdrops  5 Posters  2 Recommendations   2010-06-08 Pretty Little Liars 6.2  Facts Status  Returning Series Network Certification TV-MA Meaning This program is specifically designed to be viewed by adults and therefore may be unsuitable for children under 17 Type  Scripted Original Language  English Runtime  60m Homepage   https://www.amazon.co.uk/dp/B01IAH1Z58 Genres Drama Keywords france paris fashion designer period drama fashion post war post world war ii costume drama 1940s Content Score 100 Yes! Looking good! Top Contributors 32 Elizabeth Jennings 23 Hevinalle z 9 zurman1 8 david8s95  View Edit History Popularity Trend  Login to edit  URL By  signing up  for an account on TMDb, you can post directly to Twitter and Facebook. You need to be logged in to continue. Click  here  to login or  here  to sign up.    page_wrap opened in html_head  Join the Community The Basics About TMDb Contact Us Support Forums API Blog Get Involved  Contribution Bible 3rd Party Applications Add New Movie Add New TV Show Community Guidelines Leaderboard Forums Twitter Facebook Legal Terms of Use Privacy Policy Login Sign Up", "character": ["Paul Sabine", "Claude Sabine", "Yvette Sabine", "Helen Sabine", "Nina"]}