{"link": "https://www.themoviedb.org/tv/32755?language=en", "title": "The Chicago Code", "resume": "The series follows officers of the Chicago Police Department as they fight crime on the streets and try to expose political corruption within the city.", "rate": 73, "genre": ["Crime", "Drama"], "cast": ["Jennifer Beals", "Billy Lush", "Delroy Lindo", "Todd Williams", "Jason Clarke"], "character": ["Teresa Colvin", "Liam Hennessey", "Alderman Ronin Gibbons", "Isaac Joiner", "Jarek Wysocki"], "site_data": "html Apps Forums Leaderboard Contribute API Support Discover Movies TV Shows Movies Popular Top Rated Upcoming Now Playing TV Shows Popular Top Rated On TV Airing Today People Popular People Can't find a movie or TV show? Login to create it. en Login Sign Up  ID: 32755   Expand The Chicago Code   (2011) User Score  Play Trailer Overview The series follows officers of the Chicago Police Department as they fight crime on the streets and try to expose political corruption within the city.  Featured Crew Shawn Ryan Creator Discussions   Reviews Videos   Images   Changes Report Share Discussions General  0 Content Issues  0 Images Backdrops  8 Posters  5 Videos Trailers  1 Teasers  0 Clips  0 Featurettes  0 Opening Credits  0 Top Billed Cast Jennifer Beals Teresa Colvin Billy Lush Liam Hennessey Delroy Lindo Alderman Ronin Gibbons Todd Williams Isaac Joiner Jason Clarke Jarek Wysocki Full Cast & Crew Last Season Season 1 2011 | 13 Episodes Season 1 of The Chicago Code premiered on February  7, 2011. View All Seasons Social Reviews  0 Discussions  0 Media Most Popular Videos  1 Backdrops  8 Posters  5 Recommendations   2011-08-05 Friends with Benefits 6.1    2016-11-27 Pacific Heat 5.1    2016-03-15 Crowded 6.4    2014-01-10 Enlisted 6.2    2011-09-22 Prime Suspect 7.1    2010-07-11 The Glades 6.3    2011-01-20 Fairly Legal 5.8    2005-12-10 Painkiller Jane 6.0  Facts Status  Cancelled Network Certification TV-14 Meaning This program contains some material that many parents would find unsuitable for children under 14 years of age. Type  Scripted Original Language  English Runtime  43m Homepage  - Genres Crime Drama Keywords chicago corruption police political corruption Content Score 100 Yes! Looking good! Top Contributors 13 Banana 10 Mitsarinho 7 seawolf z 6 zurman1  View Edit History Popularity Trend  Login to edit  URL By  signing up  for an account on TMDb, you can post directly to Twitter and Facebook. You need to be logged in to continue. Click  here  to login or  here  to sign up.    page_wrap opened in html_head  Join the Community The Basics About TMDb Contact Us Support Forums API Blog Get Involved  Contribution Bible 3rd Party Applications Add New Movie Add New TV Show Community Guidelines Leaderboard Forums Twitter Facebook Legal Terms of Use Privacy Policy Login Sign Up"}