{"link": "https://www.themoviedb.org/tv/31867?language=en", "title": "The Green Hornet", "resume": "The Green Hornet is a television series on the ABC US television network that aired for the 1966\u20131967 TV season starring Van Williams as the Green Hornet/Britt Reid and Bruce Lee as Kato.", "rate": null, "genre": ["Action", "Adventure"], "cast": ["Van Williams", "Bruce Lee", "Wende Wagner", "Lloyd Gough", "Walter Brooke"], "site_data": "html Apps Forums Leaderboard Contribute API Support Discover Movies TV Shows Movies Popular Top Rated Upcoming Now Playing TV Shows Popular Top Rated On TV Airing Today People Popular People Can't find a movie or TV show? Login to create it. en Login Sign Up  ID: 31867   Expand The Green Hornet   (1966) User Score Overview The Green Hornet is a television series on the ABC US television network that aired for the 1966\u20131967 TV season starring Van Williams as the Green Hornet/Britt Reid and Bruce Lee as Kato. Featured Crew Fran Striker Creator George W. Trendle Creator Discussions   Reviews Videos   Images   Changes Report Share Discussions General  1 Content Issues  1 Images Backdrops  3 Posters  5 Videos Trailers  0 Teasers  0 Clips  0 Featurettes  0 Opening Credits  0 Top Billed Cast Van Williams Britt Reid / The Green Hornet Bruce Lee Kato Wende Wagner Leonore \"Casey\" Case Lloyd Gough Michael Axford Walter Brooke Frank P. Scanlon Full Cast & Crew Last Season Season 1 1966 | 26 Episodes Season 1 of The Green Hornet premiered on September  9, 1966. View All Seasons Social Reviews  0 Discussions  2 Subject Status Replies Last Reply Bruce Lee wasn't the right Kato Open 0 by intothenightalone\n      \n     Go to Discussions Media Most Popular Videos  0 Backdrops  3 Posters  5 Recommendations   1965-02-20 Sherlock Holmes 7.1    1992-12-06 A Touch of Frost 7.9    1973-02-15 Some Mothers Do 'Ave 'Em 7.8    1979-08-24 The Facts of Life 5.8    1964-09-26 Gilligan's Island 6.6    1984-01-22 Airwolf 6.6  Facts Status  Ended Network Certification  - Type  Scripted Original Language  English Runtime  - Homepage  - Genres Action & Adventure Keywords No keywords have been added. Content Score 93 Almost there... Top Contributors 12 Renato c 6 chispy NS 5 Norte Serra z 4 zurman1  View Edit History Popularity Trend  Login to edit  URL By  signing up  for an account on TMDb, you can post directly to Twitter and Facebook. You need to be logged in to continue. Click  here  to login or  here  to sign up.    page_wrap opened in html_head  Join the Community The Basics About TMDb Contact Us Support Forums API Blog Get Involved  Contribution Bible 3rd Party Applications Add New Movie Add New TV Show Community Guidelines Leaderboard Forums Twitter Facebook Legal Terms of Use Privacy Policy Login Sign Up", "character": ["Britt Reid / The Green Hornet", "Kato", "Leonore \"Casey\" Case", "Michael Axford", "Frank P. Scanlon"]}