{"link": "https://www.themoviedb.org/tv/15129?language=en", "title": "Lost in Austen", "resume": "Modern Amanda enters through a portal in her bathroom, to join the Bennet family and affect events disastrously.", "rate": 72, "genre": ["Drama"], "cast": ["Gemma Arterton", "Pippa Haywood", "Morven Christie", "Perdita Weeks", "Ruby Bentall"], "character": ["Elizabeth Bennet", "Frankie", "Jane Bennet", "Lydia Bennet", "Mary Bennet"], "site_data": "html Apps Forums Leaderboard Contribute API Support Discover Movies TV Shows Movies Popular Top Rated Upcoming Now Playing TV Shows Popular Top Rated On TV Airing Today People Popular People Can't find a movie or TV show? Login to create it. en Login Sign Up  ID: 15129   Expand Lost in Austen   (2008) User Score Overview Modern Amanda enters through a portal in her bathroom, to join the Bennet family and affect events disastrously. Discussions   Reviews Videos   Images   Changes Report Share Discussions General  1 Content Issues  0 Images Backdrops  11 Posters  7 Videos Trailers  0 Teasers  0 Clips  0 Featurettes  0 Opening Credits  0 Top Billed Cast Gemma Arterton Elizabeth Bennet Pippa Haywood Frankie Morven Christie Jane Bennet Perdita Weeks Lydia Bennet Ruby Bentall Mary Bennet Full Cast & Crew Last Season Miniseries 2008 | 4 Episodes View All Seasons Social Reviews  0 Discussions  1 Subject Status Replies Last Reply Go to your favorite version and talk about it. Open 3 by  lantzn Go to Discussions Media Most Popular Videos  0 Backdrops  11 Posters  7 Recommendations   2009-10-04 Emma 7.7    2008-01-01 Sense and Sensibility 7.7    2013-12-26 Death Comes to Pemberley 6.8    2008-09-14 Tess of the D'Urbervilles 7.4    2006-09-24 Jane Eyre 7.5    1999-11-28 Wives and Daughters 7.3    2004-04-18 He Knew He Was Right 6.6    1996-11-17 The Tenant of Wildfell Hall 7.3  Facts Status  Ended Network Certification  - Type  Miniseries Original Language  English Runtime  60m, 45m Homepage   http://www.itv.com/Drama/perioddrama/LostInAusten/default.html Genres Drama Keywords miniseries Content Score 86 Almost there... Top Contributors TB 28 TMDb Bot 9 Steve x 6 xPR A 6 Ammit  View Edit History Popularity Trend  Login to edit  URL By  signing up  for an account on TMDb, you can post directly to Twitter and Facebook. You need to be logged in to continue. Click  here  to login or  here  to sign up.    page_wrap opened in html_head  Join the Community The Basics About TMDb Contact Us Support Forums API Blog Get Involved  Contribution Bible 3rd Party Applications Add New Movie Add New TV Show Community Guidelines Leaderboard Forums Twitter Facebook Legal Terms of Use Privacy Policy Login Sign Up"}