{"link": "https://www.themoviedb.org/tv/61932?language=en", "title": "Cucumber", "resume": "Original drama series from Russell T Davies exploring the passions and pitfalls of 21st century gay life, beginning with the most disastrous date night in history.", "rate": 78, "genre": ["Comedy", "Drama"], "cast": ["Vincent Franklin", "Cyril Nri", "Ceallach Spellman", "Hannah John-Kamen", "Julie Hesmondhalgh"], "character": ["Henry Best", "Lance Sullivan", "Adam Whitaker", "Violet", "Cleo Whitaker"], "site_data": "html Apps Forums Leaderboard Contribute API Support Discover Movies TV Shows Movies Popular Top Rated Upcoming Now Playing TV Shows Popular Top Rated On TV Airing Today People Popular People Can't find a movie or TV show? Login to create it. en Login Sign Up  ID: 61932   Expand Cucumber   (2015) User Score Overview Original drama series from Russell T Davies exploring the passions and pitfalls of 21st century gay life, beginning with the most disastrous date night in history. Featured Crew Russell T. Davies Creator Discussions   Reviews Videos   Images   Changes Report Share Discussions General  0 Content Issues  0 Images Backdrops  2 Posters  4 Videos Trailers  0 Teasers  0 Clips  0 Featurettes  0 Opening Credits  0 Top Billed Cast Vincent Franklin Henry Best Cyril Nri Lance Sullivan Ceallach Spellman Adam Whitaker Hannah John-Kamen Violet Julie Hesmondhalgh Cleo Whitaker Full Cast & Crew Last Season Season 1 2015 | 8 Episodes Season 1 of Cucumber premiered on January 22, 2015. View All Seasons Social Reviews  0 Discussions  0 Media Most Popular Videos  0 Backdrops  2 Posters  4 Recommendations   2015-01-22 Banana 7.8    2016-03-02 The Real O'Neals 7.7    2015-01-22 Backstrom 6.4    2015-01-13 Schitt's Creek 6.8    2015-02-04 Fresh Off the Boat 7.0  Facts Status  Ended Network Certification 16 Meaning Can be aired only from 10:00pm Uhr to 6:00am. Type  Scripted Original Language  English Runtime  50m Homepage   http://www.channel4.com/programmes/cucumber Genres Comedy Drama Keywords gay self-discovery lgbt middle age manchester Content Score 93 Almost there... Top Contributors 20 Elizabeth Jennings S 11 Sebastian 10 rudely_murray 8 Nero Kosonen  View Edit History Popularity Trend  Login to edit  URL By  signing up  for an account on TMDb, you can post directly to Twitter and Facebook. You need to be logged in to continue. Click  here  to login or  here  to sign up.    page_wrap opened in html_head  Join the Community The Basics About TMDb Contact Us Support Forums API Blog Get Involved  Contribution Bible 3rd Party Applications Add New Movie Add New TV Show Community Guidelines Leaderboard Forums Twitter Facebook Legal Terms of Use Privacy Policy Login Sign Up"}