{"link": "https://www.themoviedb.org/tv/6855?language=en", "title": "Auf Achse", "resume": "Auf Achse was a German television series on the ARD channel. The series ran from 1977 until 1996 and 86 episodes were produced altogether.", "rate": 65, "genre": ["Action", "Adventure"], "cast": ["Manfred Krug", "Monica Bleibtreu", "R\u00fcdiger Kirschstein", "Armin Rohde", "Franz Buchrieser"], "character": ["Franz Meersdonk", "Sylvia Mittermann", "G\u00fcnther Willers", "Kaschinski", "Max Kottan"], "site_data": "html Apps Forums Leaderboard Contribute API Support Discover Movies TV Shows Movies Popular Top Rated Upcoming Now Playing TV Shows Popular Top Rated On TV Airing Today People Popular People Can't find a movie or TV show? Login to create it. en Login Sign Up  ID: 6855   Expand Auf Achse   (1980) User Score Overview Auf Achse was a German television series on the ARD channel. The series ran from 1977 until 1996 and 86 episodes were produced altogether. Discussions   Reviews Videos   Images   Changes Report Share Discussions General  0 Content Issues  0 Images Backdrops  2 Posters  2 Videos Trailers  0 Teasers  0 Clips  0 Featurettes  0 Opening Credits  0 Top Billed Cast Manfred Krug Franz Meersdonk Monica Bleibtreu Sylvia Mittermann R\u00fcdiger Kirschstein G\u00fcnther Willers Armin Rohde Kaschinski Franz Buchrieser Max Kottan Full Cast & Crew Last Season Season 6 1996 | 13 Episodes Season 6 of Auf Achse premiered on January  2, 1996. View All Seasons Social Reviews  0 Discussions  0 Media Most Popular Videos  0 Backdrops  2 Posters  2 Recommendations We don't have enough data to suggest any TV shows based on Auf Achse. You can help by rating TV shows you've seen. Facts Status  Ended Network Certification 12 Meaning The broadcaster must take the decision about the air time by taking in consideration the impact on young children in the timeframe from 6:00am to 8:00pm. Type  Scripted Original Language  German Runtime  50m Homepage  - Genres Action & Adventure Keywords truck driver trucker transport Content Score 93 Almost there... Top Contributors S 45 Samara S 16 SunHomeMovie 3 Banana TB 1 TMDb Bot  View Edit History Popularity Trend  Login to edit  URL By  signing up  for an account on TMDb, you can post directly to Twitter and Facebook. You need to be logged in to continue. Click  here  to login or  here  to sign up.    page_wrap opened in html_head  Join the Community The Basics About TMDb Contact Us Support Forums API Blog Get Involved  Contribution Bible 3rd Party Applications Add New Movie Add New TV Show Community Guidelines Leaderboard Forums Twitter Facebook Legal Terms of Use Privacy Policy Login Sign Up"}