{"link": "https://www.themoviedb.org/tv/19531?language=en", "title": "Salem's Lot", "resume": "A dark terror has come to the picture-perfect town of Jerusalem's Lot, and it's up to a writer with a haunted past to uncover the horror that has taken over the town.", "rate": 56, "genre": ["Drama"], "cast": ["Robert Mammone", "Dan Byrd", "Christopher Morris", "Rob Lowe", "Andre Braugher"], "character": ["Dr. James Cody", "Mark Petrie", "Mike Ryerson", "Ben Mears", "Matt Burke"], "site_data": "html Apps Forums Leaderboard Contribute API Support Discover Movies TV Shows Movies Popular Top Rated Upcoming Now Playing TV Shows Popular Top Rated On TV Airing Today People Popular People Can't find a movie or TV show? Login to create it. en Login Sign Up  ID: 19531   Expand Salem's Lot   (2004) User Score  Play Trailer Overview A dark terror has come to the picture-perfect town of Jerusalem's Lot, and it's up to a writer with a haunted past to uncover the horror that has taken over the town. Discussions   Reviews Videos   Images   Changes Report Share Discussions General  1 Content Issues  0 Images Backdrops  5 Posters  8 Videos Trailers  1 Teasers  0 Clips  0 Featurettes  0 Opening Credits  0 Top Billed Cast Robert Mammone Dr. James Cody Dan Byrd Mark Petrie Christopher Morris Mike Ryerson Rob Lowe Ben Mears Andre Braugher Matt Burke Full Cast & Crew Last Season Miniseries 2004 | 2 Episodes View All Seasons Social Reviews  0 Discussions  1 Subject Status Replies Last Reply S Who was flying around the house? Open 0 by Strannger18\n      \n     Go to Discussions Media Most Popular Videos  1 Backdrops  5 Posters  8 Recommendations   1999-02-14 Storm of the Century 6.8    1993-05-09 The Tommyknockers 5.1    1997-04-27 The Shining 6.0    1979-11-17 Salem's Lot 6.4    2002-01-27 Rose Red 6.6    1995-05-14 The Langoliers 5.9    1994-05-08 The Stand 6.8    1982-09-22 Family Ties 7.0  Facts Status  Ended Network Certification TV-14 Meaning This program contains some material that many parents would find unsuitable for children under 14 years of age. Type  Miniseries Original Language  English Runtime  120m Homepage   http://www.tnt.tv/title/?oid=540988 Genres Drama Keywords based on novel or book vampire priest miniseries hospital Content Score 93 Almost there... Top Contributors TB 60 TMDb Bot 36 Banana g 2 gpd67 1 barrakus_1  View Edit History Popularity Trend  Login to edit  URL By  signing up  for an account on TMDb, you can post directly to Twitter and Facebook. You need to be logged in to continue. Click  here  to login or  here  to sign up.    page_wrap opened in html_head  Join the Community The Basics About TMDb Contact Us Support Forums API Blog Get Involved  Contribution Bible 3rd Party Applications Add New Movie Add New TV Show Community Guidelines Leaderboard Forums Twitter Facebook Legal Terms of Use Privacy Policy Login Sign Up"}