{"link": "https://www.themoviedb.org/tv/4951?language=en", "title": "Brideshead Revisited", "resume": "Charles Ryder, an agnostic man, gets involved with different members of the Flytes, a Catholic family of aristocrats, over the course of several years between the two world wars.", "rate": null, "genre": ["Drama"], "cast": ["Jeremy Irons", "Anthony Andrews", "Diana Quick", "Claire Bloom", "Phoebe Nicholls"], "site_data": "html Apps Forums Leaderboard Contribute API Support Discover Movies TV Shows Movies Popular Top Rated Upcoming Now Playing TV Shows Popular Top Rated On TV Airing Today People Popular People Can't find a movie or TV show? Login to create it. en Login Sign Up  ID: 4951   Expand Brideshead Revisited   (1981) User Score Overview Charles Ryder, an agnostic man, gets involved with different members of the Flytes, a Catholic family of aristocrats, over the course of several years between the two world wars. Discussions   Reviews Videos   Images   Changes Report Share Discussions General  3 Content Issues  1 Images Backdrops  2 Posters  6 Videos Trailers  0 Teasers  0 Clips  0 Featurettes  0 Opening Credits  0 Top Billed Cast Jeremy Irons Charles Ryder Anthony Andrews Lord Sebastian Flyte Diana Quick Lady Julia Flyte Claire Bloom Teresa Flyte, Lady Marchmain Phoebe Nicholls Lady Cordelia Flyte Full Cast & Crew Last Season Season 1 1981 | 11 Episodes Season 1 of Brideshead Revisited premiered on October 12, 1981. View All Seasons Social Reviews  0 Discussions  4 Subject Status Replies Last Reply Anyone else here have the score soundtrack album and still play it? Open 0 by genplant29\n      \n     Easily one of the all-time greatest and best t.v. miniseries Open 0 by genplant29\n      \n     Who's your favourite character(s)? Open 0 by genplant29\n      \n     Go to Discussions Media Most Popular Videos  0 Backdrops  2 Posters  6 Recommendations   1971-02-17 Elizabeth R 8.8    2014-03-19 W1A 7.6    1984-02-26 Spitting Image 7.8    2005-02-16 The Apprentice 5.2    1990-01-10 Oranges Are Not the Only Fruit 7.6    1978-10-01 Centennial 7.7    1979-09-10 Tinker Tailor Soldier Spy 7.7    1987-03-09 French & Saunders 7.4  Facts Status  Ended Network Certification 15 Meaning No-one under 15 is allowed to see a 15 film at the cinema or buy/rent a 15 rated video. 15 rated works are not suitable for children under 15 years of age. Type  Miniseries Original Language  English Runtime  60m Homepage  - Genres Drama Keywords friendship venice world war ii fountain artist religious conversion love miniseries mistress period drama alcoholic catholicism husband wife estrangement marital separation catholic guilt 1920s 1940s aristocracy 1930s aristocrats Content Score 86 Almost there... Top Contributors 87 genplant29 65 midnightmark TB 6 TMDb Bot O 5 Ozbourne  View Edit History Popularity Trend  Login to edit  URL By  signing up  for an account on TMDb, you can post directly to Twitter and Facebook. You need to be logged in to continue. Click  here  to login or  here  to sign up.    page_wrap opened in html_head  Join the Community The Basics About TMDb Contact Us Support Forums API Blog Get Involved  Contribution Bible 3rd Party Applications Add New Movie Add New TV Show Community Guidelines Leaderboard Forums Twitter Facebook Legal Terms of Use Privacy Policy Login Sign Up", "character": ["Charles Ryder", "Lord Sebastian Flyte", "Lady Julia Flyte", "Teresa Flyte, Lady Marchmain", "Lady Cordelia Flyte"]}