{"link": "https://www.themoviedb.org/tv/36409?language=en", "title": "24 Hour Emergency Ward", "resume": "We don't have an overview translated in English. Help us expand our database by adding one.", "rate": 100, "genre": ["Drama"], "cast": ["Yasuko Matsuyuki", "Kotomi Ky\u00f4no", "Tetta Sugimoto", "Shun Oguri", "Hideaki Ito"], "character": ["Kazuya Kono"], "site_data": "html Apps Forums Leaderboard Contribute API Support Discover Movies TV Shows Movies Popular Top Rated Upcoming Now Playing TV Shows Popular Top Rated On TV Airing Today People Popular People Can't find a movie or TV show? Login to create it. en Login Sign Up  ID: 36409   Expand 24 Hour Emergency Ward   (1999) User Score Overview We don't have an overview translated in English. Help us expand our database by adding one. Discussions   Reviews Videos   Images   Changes Report Share Discussions General  0 Content Issues  0 Images Backdrops  2 Posters  2 Videos Trailers  0 Teasers  0 Clips  0 Featurettes  0 Opening Credits  0 Top Billed Cast Yasuko Matsuyuki Kotomi Ky\u00f4no Tetta Sugimoto Shun Oguri Kazuya Kono Hideaki Ito Full Cast & Crew Last Season Season 3 2005 | 12 Episodes Season 3 of 24 Hour Emergency Ward premiered on January 11, 2005. View All Seasons Social Reviews  0 Discussions  0 Media Most Popular Videos  0 Backdrops  2 Posters  2 Recommendations We don't have enough data to suggest any TV shows based on 24 Hour Emergency Ward. You can help by rating TV shows you've seen. Facts Original Name  \u6551\u547d\u75c5\u68df24\u6642 Status  Returning Series Network Certification  - Type  Scripted Original Language  Japanese Runtime  54m Homepage  - Genres Drama Keywords No keywords have been added. Content Score 79 Pump it up! We're close now. Top Contributors A 21 Aka75  View Edit History Popularity Trend  Login to edit  URL By  signing up  for an account on TMDb, you can post directly to Twitter and Facebook. You need to be logged in to continue. Click  here  to login or  here  to sign up.    page_wrap opened in html_head  Join the Community The Basics About TMDb Contact Us Support Forums API Blog Get Involved  Contribution Bible 3rd Party Applications Add New Movie Add New TV Show Community Guidelines Leaderboard Forums Twitter Facebook Legal Terms of Use Privacy Policy Login Sign Up"}