{"link": "https://www.themoviedb.org/tv/32727?language=en", "title": "Luck", "resume": "A drama set in the world of horse racing focusing on lives of owners, jockeys, trainers and gamblers who are all tied to the same horse track.", "rate": 78, "genre": ["Drama"], "cast": ["Dustin Hoffman", "Michael Gambon", "Jason Gedrick", "Ian Hart", "Richard Kind"], "character": ["Chester Bernstein", "Michael"], "site_data": "html Apps Forums Leaderboard Contribute API Support Discover Movies TV Shows Movies Popular Top Rated Upcoming Now Playing TV Shows Popular Top Rated On TV Airing Today People Popular People Can't find a movie or TV show? Login to create it. en Login Sign Up  ID: 32727   Expand Luck   (2012) User Score Overview A drama set in the world of horse racing focusing on lives of owners, jockeys, trainers and gamblers who are all tied to the same horse track. Featured Crew David Milch Creator Discussions   Reviews Videos   Images   Changes Report Share Discussions General  1 Content Issues  0 Images Backdrops  6 Posters  3 Videos Trailers  0 Teasers  0 Clips  0 Featurettes  0 Opening Credits  0 Top Billed Cast Dustin Hoffman Chester Bernstein Michael Gambon Michael Jason Gedrick Ian Hart Richard Kind Full Cast & Crew Last Season Season 1 2012 | 9 Episodes Season 1 of Luck premiered on January 29, 2012. View All Seasons Social Reviews  0 Discussions  1 Subject Status Replies Last Reply M What means these? Open 0 by Mekratrig\n      \n     Go to Discussions Media Most Popular Videos  0 Backdrops  6 Posters  3 Recommendations   1983-09-05 Reilly, Ace of Spies 6.8    2007-06-10 John from Cincinnati 7.3    2008-09-28 The Life & Times of Tim 7.6    2008-01-28 In Treatment 7.7    2006-07-09 Brotherhood 7.4    2013-09-29 Hello Ladies 6.7    2010-04-11 Treme 8.1    2012-03-21 Bent 6.5  Facts Status  Ended Network Certification TV-MA Meaning This program is specifically designed to be viewed by adults and therefore may be unsuitable for children under 17 Type  Scripted Original Language  English Runtime  60m Homepage   http://www.hbo.com/luck Genres Drama Keywords gambling jockey horse racing luck horse trainer Content Score 93 Almost there... Top Contributors 18 Elizabeth Jennings z 4 zurman1 s 4 speedycars D 3 David1886  View Edit History Popularity Trend  Login to edit  URL By  signing up  for an account on TMDb, you can post directly to Twitter and Facebook. You need to be logged in to continue. Click  here  to login or  here  to sign up.    page_wrap opened in html_head  Join the Community The Basics About TMDb Contact Us Support Forums API Blog Get Involved  Contribution Bible 3rd Party Applications Add New Movie Add New TV Show Community Guidelines Leaderboard Forums Twitter Facebook Legal Terms of Use Privacy Policy Login Sign Up"}