{"link": "https://www.themoviedb.org/tv/76138?language=en", "title": "The Seven Heavenly Virtues", "resume": "We don't have an overview translated in English. Help us expand our database by adding one.", "rate": null, "genre": ["Animation", "Sci-Fi", "Fantasy"], "cast": ["Yumi Uchiyama", "Ari Ozawa", "Asami Seto", "Nitta Hiyori", "Lynn"], "site_data": "html Apps Forums Leaderboard Contribute API Support Discover Movies TV Shows Movies Popular Top Rated Upcoming Now Playing TV Shows Popular Top Rated On TV Airing Today People Popular People Can't find a movie or TV show? Login to create it. en Login Sign Up  ID: 76138   Expand The Seven Heavenly Virtues   (2018) User Score Overview We don't have an overview translated in English. Help us expand our database by adding one. Featured Crew Shinji Ishihara Creator Discussions   Reviews Videos   Images   Changes Report Share Discussions General  0 Content Issues  2 Images Backdrops  1 Posters  1 Videos Trailers  0 Teasers  0 Clips  0 Featurettes  0 Opening Credits  0 Top Billed Cast Yumi Uchiyama Michael Ari Ozawa Metatron Asami Seto Uriel Nitta Hiyori Gabriel Lynn Raphael Full Cast & Crew Current Season Season 1 2018 | 10 Episodes Season 1 of The Seven Heavenly Virtues premiered on January 27, 2018. View All Seasons Social Reviews  0 Discussions  2 Subject Status Replies Last Reply There are no discussions for The Seven Heavenly Virtues. Login to be first! Go to Discussions Media Most Popular Videos  0 Backdrops  1 Posters  1 Recommendations We don't have enough data to suggest any TV shows based on The Seven Heavenly Virtues. You can help by rating TV shows you've seen. Facts Original Name  \u4e03\u3064\u306e\u7f8e\u5fb3 THE SEVEN HEAVENLY VIRTUES Status  Ended Network Certification  - Type  Scripted Original Language  Japanese Runtime  5m Homepage   http://7-virtues.net/anime/ Genres Animation Sci-Fi & Fantasy Keywords spin off ecchi Content Score 86 Almost there... Top Contributors 21 Sergiojamon 11 sp1ti 9 Despair-Paradise 6 binho  View Edit History Popularity Trend  Login to edit  URL By  signing up  for an account on TMDb, you can post directly to Twitter and Facebook. You need to be logged in to continue. Click  here  to login or  here  to sign up.    page_wrap opened in html_head  Join the Community The Basics About TMDb Contact Us Support Forums API Blog Get Involved  Contribution Bible 3rd Party Applications Add New Movie Add New TV Show Community Guidelines Leaderboard Forums Twitter Facebook Legal Terms of Use Privacy Policy Login Sign Up", "character": ["Michael", "Metatron", "Uriel", "Gabriel", "Raphael"]}