{"link": "https://www.themoviedb.org/tv/396?language=en", "title": "The District", "resume": "The District is a television police drama which aired on CBS from October 7, 2000 to May 1, 2004. The show followed the work and personal life of the chief of Washington, D.C.'s Police Department.", "rate": 93, "genre": ["Drama"], "cast": ["Craig T. Nelson", "Roger Aaron Brown", "Sean Patrick Thomas", "Jonathan LaPaglia", "Elizabeth Marvel"], "character": ["Chief Jack Mannion", "Deputy Chief Joe Noland", "Det. Temple Page", "Off. Nancy Parras"], "site_data": "html Apps Forums Leaderboard Contribute API Support Discover Movies TV Shows Movies Popular Top Rated Upcoming Now Playing TV Shows Popular Top Rated On TV Airing Today People Popular People Can't find a movie or TV show? Login to create it. en Login Sign Up  ID: 396   Expand The District   (2000) User Score Overview The District is a television police drama which aired on CBS from October 7, 2000 to May 1, 2004. The show followed the work and personal life of the chief of Washington, D.C.'s Police Department. Featured Crew Terry George Creator Discussions   Reviews Videos   Images   Changes Report Share Discussions General  0 Content Issues  0 Images Backdrops  5 Posters  1 Videos Trailers  0 Teasers  0 Clips  0 Featurettes  0 Opening Credits  0 Top Billed Cast Craig T. Nelson Chief Jack Mannion Roger Aaron Brown Deputy Chief Joe Noland Sean Patrick Thomas Det. Temple Page Jonathan LaPaglia Elizabeth Marvel Off. Nancy Parras Full Cast & Crew Last Season Season 4 2003 | 22 Episodes Season 4 of The District premiered on September 27, 2003. View All Seasons Social Reviews  0 Discussions  0 Media Most Popular Videos  0 Backdrops  5 Posters  1 Recommendations We don't have enough data to suggest any TV shows based on The District. You can help by rating TV shows you've seen. Facts Status  Ended Network Certification TV-PG Meaning This program contains material that parents may find unsuitable for younger children. Type  Scripted Original Language  English Runtime  60m, 44m Homepage  - Genres Drama Keywords washington d.c. police police detective Content Score 93 Almost there... Top Contributors 14 Ted Fraraccio 11 Banana TB 4 TMDb Bot 3 Julien Lefebvre  View Edit History Popularity Trend  Login to edit  URL By  signing up  for an account on TMDb, you can post directly to Twitter and Facebook. You need to be logged in to continue. Click  here  to login or  here  to sign up.    page_wrap opened in html_head  Join the Community The Basics About TMDb Contact Us Support Forums API Blog Get Involved  Contribution Bible 3rd Party Applications Add New Movie Add New TV Show Community Guidelines Leaderboard Forums Twitter Facebook Legal Terms of Use Privacy Policy Login Sign Up"}