{"link": "https://www.themoviedb.org/tv/57284?language=en", "title": "Betas", "resume": "In Silicon Valley, the right algorithm can make you a king. And these four friends think they've finally cracked the code.", "rate": 63, "genre": ["Comedy"], "cast": ["Joe Dinicol", "Karan Soni", "Charlie Saxton", "Jon Daly", "Maya Erskine"], "character": ["Trey", "Nash", "Mitchell", "Hobbes", "Mikki"], "site_data": "html Apps Forums Leaderboard Contribute API Support Discover Movies TV Shows Movies Popular Top Rated Upcoming Now Playing TV Shows Popular Top Rated On TV Airing Today People Popular People Can't find a movie or TV show? Login to create it. en Login Sign Up  ID: 57284   Expand Betas   (2013) User Score  Play Trailer Overview In Silicon Valley, the right algorithm can make you a king. And these four friends think they've finally cracked the code. Featured Crew Josh Stoddard Creator Evan Endicott Creator Discussions   Reviews Videos   Images   Changes Report Share Discussions General  0 Content Issues  0 Images Backdrops  3 Posters  3 Videos Trailers  1 Teasers  0 Clips  0 Featurettes  0 Opening Credits  0 Top Billed Cast Joe Dinicol Trey Karan Soni Nash Charlie Saxton Mitchell Jon Daly Hobbes Maya Erskine Mikki Full Cast & Crew Last Season Season 1 2013 | 11 Episodes Season 1 of Betas premiered on April 19, 2013. View All Seasons Social Reviews  0 Discussions  0 Media Most Popular Videos  1 Backdrops  3 Posters  3 Recommendations   2010-09-21 Running Wilde 6.8    2013-07-21 Axe Cop 5.5    2010-09-08 Terriers 8.1    2010-02-14 How to Make It in America 7.6    2009-09-20 Bored to Death 7.4    2003-08-05 The O.C. 6.9    2013-09-29 Masters of Sex 6.6    2005-08-07 Weeds 7.1  Facts Status  Cancelled Network Certification 16 Meaning Can be aired only from 10:00pm Uhr to 6:00am. Type  Scripted Original Language  English Runtime  27m Homepage  - Genres Comedy Keywords silicon valley social network Content Score 100 Yes! Looking good! Top Contributors 27 Razze z 10 zurman1 w 6 willo123 A 3 Asset  View Edit History Popularity Trend  Login to edit  URL By  signing up  for an account on TMDb, you can post directly to Twitter and Facebook. You need to be logged in to continue. Click  here  to login or  here  to sign up.    page_wrap opened in html_head  Join the Community The Basics About TMDb Contact Us Support Forums API Blog Get Involved  Contribution Bible 3rd Party Applications Add New Movie Add New TV Show Community Guidelines Leaderboard Forums Twitter Facebook Legal Terms of Use Privacy Policy Login Sign Up"}