{"link": "https://www.themoviedb.org/tv/63809?language=en", "title": "Camera Caf\u00e9", "resume": "We don't have an overview translated in English. Help us expand our database by adding one.", "rate": 70, "genre": ["Comedy"], "cast": ["Luca Bizzarri", "Paolo Kessisoglu", "Renato Liprandi", "Paolo Bufalino", "Riccardo Magherini"], "character": ["Luca Nervi", "Paolo Bitta", "Augusto De Marinis", "Andrea Pellegrino", "Vittorio Ubbiali"], "site_data": "html Apps Forums Leaderboard Contribute API Support Discover Movies TV Shows Movies Popular Top Rated Upcoming Now Playing TV Shows Popular Top Rated On TV Airing Today People Popular People Can't find a movie or TV show? Login to create it. en Login Sign Up  ID: 63809   Expand Camera Caf\u00e9   (2003) User Score Overview We don't have an overview translated in English. Help us expand our database by adding one. Featured Crew Alain Kappauf Creator Yvan Le Bolloc'h Creator Bruno Solo Creator Discussions   Reviews Videos   Images   Changes Report Share Discussions General  0 Content Issues  0 Images Backdrops  2 Posters  3 Videos Trailers  0 Teasers  0 Clips  0 Featurettes  0 Opening Credits  0 Top Billed Cast Luca Bizzarri Luca Nervi Paolo Kessisoglu Paolo Bitta Renato Liprandi Augusto De Marinis Paolo Bufalino Andrea Pellegrino Riccardo Magherini Vittorio Ubbiali Full Cast & Crew Last Season Season 5 2011 | 13 Episodes Season 5 of Camera Caf\u00e9 premiered on December 13, 2011. View All Seasons Social Reviews  0 Discussions  0 Media Most Popular Videos  0 Backdrops  2 Posters  3 Recommendations We don't have enough data to suggest any TV shows based on Camera Caf\u00e9. You can help by rating TV shows you've seen. Facts Status  Returning Series Network Certification  - Type  Scripted Original Language  Italian Runtime  10m, 5m Homepage   http://www.cameracafe.mediaset.it/ Genres Comedy Keywords sitcom Content Score 86 Almost there... Top Contributors V 44 Visualizzatore C 20 Cataloguer 6 Forrest73 5 BigMad  View Edit History Popularity Trend  Login to edit  URL By  signing up  for an account on TMDb, you can post directly to Twitter and Facebook. You need to be logged in to continue. Click  here  to login or  here  to sign up.    page_wrap opened in html_head  Join the Community The Basics About TMDb Contact Us Support Forums API Blog Get Involved  Contribution Bible 3rd Party Applications Add New Movie Add New TV Show Community Guidelines Leaderboard Forums Twitter Facebook Legal Terms of Use Privacy Policy Login Sign Up"}