{"link": "https://www.themoviedb.org/tv/60719?language=en", "title": "Alpha House", "resume": "Four Republican senators share the same D.C. house rental, and face re-election battles, looming indictments, and parties -- all with a sense of humor.", "rate": 73, "genre": ["Comedy", "Drama"], "cast": ["John Goodman", "Clark Johnson", "Matt Malloy", "Mark Consuelos", "Julie White"], "character": ["Senator Gil John Biggs", "Senator Robert Bettencourt", "Senator Louis Laffer", "Senator Andy Guzman", "Maddie Biggs"], "site_data": "html Apps Forums Leaderboard Contribute API Support Discover Movies TV Shows Movies Popular Top Rated Upcoming Now Playing TV Shows Popular Top Rated On TV Airing Today People Popular People Can't find a movie or TV show? Login to create it. en Login Sign Up  ID: 60719   Expand Alpha House   (2013) User Score  Play Trailer Overview Four Republican senators share the same D.C. house rental, and face re-election battles, looming indictments, and parties -- all with a sense of humor. Featured Crew Garry Trudeau Creator Discussions   Reviews Videos   Images   Changes Report Share Discussions General  0 Content Issues  0 Images Backdrops  4 Posters  3 Videos Trailers  1 Teasers  0 Clips  0 Featurettes  0 Opening Credits  0 Top Billed Cast John Goodman Senator Gil John Biggs Clark Johnson Senator Robert Bettencourt Matt Malloy Senator Louis Laffer Mark Consuelos Senator Andy Guzman Julie White Maddie Biggs Full Cast & Crew Last Season Season 2 2014 | 10 Episodes View All Seasons Social Reviews  0 Discussions  0 Media Most Popular Videos  1 Backdrops  4 Posters  3 Recommendations   2015-09-30 Marley's Ghosts 7.0    2014-03-21 Welcome to Sweden 6.3    2015-01-13 Cockroaches 6.0    2015-03-25 Big Time in Hollywood, Fl 5.7    2015-06-08 Odd Mom Out 6.7    2013-07-09 Drunk History 7.2    2013-08-05 Quick Draw 6.3    2015-06-10 The Interceptor 5.7  Facts Status  Cancelled Network Certification TV-MA Meaning This program is specifically designed to be viewed by adults and therefore may be unsuitable for children under 17 Type  Scripted Original Language  English Runtime  30m Homepage   http://www.amazon.com/gp/product/B00CDBTVM2 Genres Comedy Drama Keywords washington d.c. politics senator politician satire political satire u.s. senator Content Score 100 Yes! Looking good! Top Contributors 84 Elizabeth Jennings 7 Banana z 6 zurman1 T 5 Tim  View Edit History Popularity Trend  Login to edit  URL By  signing up  for an account on TMDb, you can post directly to Twitter and Facebook. You need to be logged in to continue. Click  here  to login or  here  to sign up.    page_wrap opened in html_head  Join the Community The Basics About TMDb Contact Us Support Forums API Blog Get Involved  Contribution Bible 3rd Party Applications Add New Movie Add New TV Show Community Guidelines Leaderboard Forums Twitter Facebook Legal Terms of Use Privacy Policy Login Sign Up"}