{"link": "https://www.themoviedb.org/tv/61057?language=en", "title": "Madam Dun", "resume": "Madame Dun drama is a romantic comedy about a celebrity hero and the people that worship her.", "rate": null, "genre": ["Soap", "Drama"], "cast": ["Nutthawuth Maurer", "Chermarn Boonyasak", "Chartayodom Hiranyatithi", "Witaya Wasukraipaisarn", "Esther Supreeleela"], "site_data": "html Apps Forums Leaderboard Contribute API Support Discover Movies TV Shows Movies Popular Top Rated Upcoming Now Playing TV Shows Popular Top Rated On TV Airing Today People Popular People Can't find a movie or TV show? Login to create it. en Login Sign Up  ID: 61057   Expand Madam Dun   (2013) User Score  Play Trailer Overview Madame Dun drama is a romantic comedy about a celebrity hero and the people that worship her. Featured Crew Channel 3 Creator Discussions   Reviews Videos   Images   Changes Report Share Discussions General  0 Content Issues  0 Images Backdrops  7 Posters  1 Videos Trailers  1 Teasers  0 Clips  0 Featurettes  0 Opening Credits  0 Top Billed Cast Nutthawuth Maurer Neks Chermarn Boonyasak Madam Phussi Chartayodom Hiranyatithi Jae Mieng Witaya Wasukraipaisarn Tin Esther Supreeleela Patty Full Cast & Crew Last Season Season 1 2013 | 13 Episodes Season 1 of Madam Dun premiered on December 26, 2013. View All Seasons Social Reviews  0 Discussions  0 Media Most Popular Videos  1 Backdrops  7 Posters  1 Recommendations We don't have enough data to suggest any TV shows based on Madam Dun. You can help by rating TV shows you've seen. Facts Original Name  Madame Dun Status  Returning Series Network Certification PG Meaning Parental guidance is recommended for young viewers; PG-rated content may air at any time on digital-only channels, otherwise, it should only be broadcast between 8:30 a.m. and 4:00 p.m. and between 7:00 p.m. and 6:00 a.m. on weekdays, and between 10:00 a.m. and 6:00 a.m. on weekends. Type  Scripted Original Language  English Runtime  98m Homepage   http://www.broadcastthai.com/web/index.php?&id=91&movie=%C1%D2%B4%D2%C1%B4%D1%B9 Genres Soap Drama Keywords thai lakorn Content Score 100 Yes! Looking good! Top Contributors 46 Crip 9 Elizabeth Jennings 4 mariilakorn21 TB 2 TMDb Bot  View Edit History Popularity Trend  Login to edit  URL By  signing up  for an account on TMDb, you can post directly to Twitter and Facebook. You need to be logged in to continue. Click  here  to login or  here  to sign up.    page_wrap opened in html_head  Join the Community The Basics About TMDb Contact Us Support Forums API Blog Get Involved  Contribution Bible 3rd Party Applications Add New Movie Add New TV Show Community Guidelines Leaderboard Forums Twitter Facebook Legal Terms of Use Privacy Policy Login Sign Up", "character": ["Neks", "Madam Phussi", "Jae Mieng", "Tin", "Patty"]}