{"link": "https://www.themoviedb.org/tv/75114?language=en", "title": "The Hunt for the Zodiac Killer", "resume": "A look at the hunt for California's Zodiac Killer, who murdered at least five people in the San Francisco Bay Area in the late 1960s and early '70s.", "rate": 35, "genre": ["Documentary", "Crime", "Reality"], "cast": ["Sal LaBarbera", "Craig P. Bauer", "Michael Butterfield", "Ryan Garlick", "Kevin Knight"], "character": ["Himself - Lead Investigator", "Himself - Code Team", "Himself - Consultant", "Himself - Code Team", "Himself - Code Team"], "site_data": "html Apps Forums Leaderboard Contribute API Support Discover Movies TV Shows Movies Popular Top Rated Upcoming Now Playing TV Shows Popular Top Rated On TV Airing Today People Popular People Can't find a movie or TV show? Login to create it. en Login Sign Up  ID: 75114   Expand The Hunt for the Zodiac Killer   (2017) User Score  Play Trailer Overview A look at the hunt for California's Zodiac Killer, who murdered at least five people in the San Francisco Bay Area in the late 1960s and early '70s. Featured Crew Jeff Daniels Creator Discussions   Reviews Videos   Images   Changes Report Share Discussions General  0 Content Issues  0 Images Backdrops  2 Posters  1 Videos Trailers  1 Teasers  0 Clips  0 Featurettes  1 Opening Credits  0 Top Billed Cast Sal LaBarbera Himself - Lead Investigator Craig P. Bauer Himself - Code Team Michael Butterfield Himself - Consultant Ryan Garlick Himself - Code Team Kevin Knight Himself - Code Team Full Cast & Crew Current Season Season 1 2017 | 5 Episodes Season 1 of The Hunt for the Zodiac Killer premiered on November 14, 2017. View All Seasons Social Reviews  0 Discussions  0 Media Most Popular Videos  2 Backdrops  2 Posters  1 Recommendations We don't have enough data to suggest any TV shows based on The Hunt for the Zodiac Killer. You can help by rating TV shows you've seen. Facts Status  Ended Network Certification TV-14 Meaning This program contains some material that many parents would find unsuitable for children under 14 years of age. Type  Miniseries Original Language  English Runtime  50m Homepage   http://www.history.com/shows/the-hunt-for-the-zodiac-killer Genres Documentary Crime Reality Keywords california san francisco killing investigation shooting historian history murder language attack serial killer crime scene crime investigator stabbing killer historic figure cryptologist zodiac unsolved unsolved crime infamous zodiac killer cryptology z340 Content Score 100 Yes! Looking good! Top Contributors 114 Ibuddy66 12 Elizabeth Jennings D 6 Derek.Jo.Lee88 TB 5 TMDb Bot  View Edit History Popularity Trend  Login to edit  URL By  signing up  for an account on TMDb, you can post directly to Twitter and Facebook. You need to be logged in to continue. Click  here  to login or  here  to sign up.    page_wrap opened in html_head  Join the Community The Basics About TMDb Contact Us Support Forums API Blog Get Involved  Contribution Bible 3rd Party Applications Add New Movie Add New TV Show Community Guidelines Leaderboard Forums Twitter Facebook Legal Terms of Use Privacy Policy Login Sign Up"}