{"link": "https://www.themoviedb.org/tv/62113?language=en", "title": "Shahs of Sunset", "resume": "Follow a group of affluent young Persian-American friends who juggle their flamboyant, fast-paced L.A. lifestyles with the demands of their families and traditions.", "rate": 53, "genre": ["Reality"], "cast": ["Asa Soltan Rahmati", "Golnesa \"GG\" Gharachedaghi", "Mercedes \"MJ\" Javid", "Mike Shouhed", "Reza Farahan"], "character": ["Herself", "Herself", "Herself", "Himself", "Himself"], "site_data": "html Apps Forums Leaderboard Contribute API Support Discover Movies TV Shows Movies Popular Top Rated Upcoming Now Playing TV Shows Popular Top Rated On TV Airing Today People Popular People Can't find a movie or TV show? Login to create it. en Login Sign Up  ID: 62113   Expand Shahs of Sunset   (2012) User Score  Play Trailer Overview Follow a group of affluent young Persian-American friends who juggle their flamboyant, fast-paced L.A. lifestyles with the demands of their families and traditions. Discussions   Reviews Videos   Images   Changes Report Share Discussions General  0 Content Issues  0 Images Backdrops  2 Posters  2 Videos Trailers  1 Teasers  0 Clips  0 Featurettes  0 Opening Credits  0 Top Billed Cast Asa Soltan Rahmati Herself Golnesa \"GG\" Gharachedaghi Herself Mercedes \"MJ\" Javid Herself Mike Shouhed Himself Reza Farahan Himself Full Cast & Crew Last Season Season 6 2017 | 13 Episodes Season 6 of Shahs of Sunset premiered on July 16, 2017. View All Seasons Social Reviews  0 Discussions  0 Media Most Popular Videos  1 Backdrops  2 Posters  2 Recommendations   2014-12-02 Late Night with Seth Meyers 5.6    2009-03-02 Late Night with Jimmy Fallon 6.0  Facts Status  Returning Series Network Certification TV-14 Meaning This program contains some material that many parents would find unsuitable for children under 14 years of age. Type  Reality Original Language  English Runtime  43m Homepage   http://www.bravotv.com/shahs-of-sunset Genres Reality Keywords beverly hills family of color iranian american Content Score 93 Almost there... Top Contributors 34 Elizabeth Jennings 12 Michael 9 Banana b 8 babibu123  View Edit History Popularity Trend  Login to edit  URL By  signing up  for an account on TMDb, you can post directly to Twitter and Facebook. You need to be logged in to continue. Click  here  to login or  here  to sign up.    page_wrap opened in html_head  Join the Community The Basics About TMDb Contact Us Support Forums API Blog Get Involved  Contribution Bible 3rd Party Applications Add New Movie Add New TV Show Community Guidelines Leaderboard Forums Twitter Facebook Legal Terms of Use Privacy Policy Login Sign Up"}