{"link": "https://www.themoviedb.org/tv/73625?language=en", "title": "Nothing Gold Can Stay", "resume": "We don't have an overview translated in English. Help us expand our database by adding one.", "rate": 100, "genre": ["Drama"], "cast": ["Sun Li", "Chen Xiao", "Peter Ho", "Myolie Wu", "Yu Haoming"], "character": ["Zhou Ying", "Shen Xingyi", "Wu Pin", "Hu Yongmei", "Du Mingli"], "site_data": "html Apps Forums Leaderboard Contribute API Support Discover Movies TV Shows Movies Popular Top Rated Upcoming Now Playing TV Shows Popular Top Rated On TV Airing Today People Popular People Can't find a movie or TV show? Login to create it. en Login Sign Up  ID: 73625   Expand Nothing Gold Can Stay   (2017) User Score Overview We don't have an overview translated in English. Help us expand our database by adding one. Discussions   Reviews Videos   Images   Changes Report Share Discussions General  0 Content Issues  0 Images Backdrops  4 Posters  3 Videos Trailers  0 Teasers  0 Clips  0 Featurettes  0 Opening Credits  0 Top Billed Cast Sun Li Zhou Ying Chen Xiao Shen Xingyi Peter Ho Wu Pin Myolie Wu Hu Yongmei Yu Haoming Du Mingli Full Cast & Crew Last Season Season 1 2017 | 74 Episodes Season 1 of Nothing Gold Can Stay premiered on August 30, 2017. View All Seasons Social Reviews  0 Discussions  0 Media Most Popular Videos  0 Backdrops  4 Posters  3 Recommendations We don't have enough data to suggest any TV shows based on Nothing Gold Can Stay. You can help by rating TV shows you've seen. Facts Original Name  \u90a3\u5e74\u82b1\u5f00\u6708\u6b63\u5706 Status  Ended Networks - Certification  - Type  Scripted Original Language  Chinese Runtime  45m Homepage  - Genres Drama Keywords No keywords have been added. Content Score 86 Almost there... Top Contributors 64 \u5600\u3002\u8001\u53f8\u673a 31 secret2301 M 25 Maria180493 d 7 divyanka  View Edit History Popularity Trend  Login to edit  URL By  signing up  for an account on TMDb, you can post directly to Twitter and Facebook. You need to be logged in to continue. Click  here  to login or  here  to sign up.    page_wrap opened in html_head  Join the Community The Basics About TMDb Contact Us Support Forums API Blog Get Involved  Contribution Bible 3rd Party Applications Add New Movie Add New TV Show Community Guidelines Leaderboard Forums Twitter Facebook Legal Terms of Use Privacy Policy Login Sign Up"}