{"link": "https://www.themoviedb.org/tv/9693?language=en", "title": "The Civil War", "resume": "A comprehensive and definitive history of the American Civil War.", "rate": 89, "genre": ["Documentary"], "cast": ["Sam Waterston", "Morgan Freeman", "Jason Robards", "Shelby Foote", "Garrison Keillor"], "character": ["Abraham Lincoln", "Frederick Douglass", "Ulysses S. Grant", "Walt Whitman"], "site_data": "html Apps Forums Leaderboard Contribute API Support Discover Movies TV Shows Movies Popular Top Rated Upcoming Now Playing TV Shows Popular Top Rated On TV Airing Today People Popular People Can't find a movie or TV show? Login to create it. en Login Sign Up  ID: 9693   Expand The Civil War   (1990) User Score Overview A comprehensive and definitive history of the American Civil War. Discussions   Reviews Videos   Images   Changes Report Share Discussions General  0 Content Issues  1 Images Backdrops  7 Posters  7 Videos Trailers  0 Teasers  0 Clips  0 Featurettes  0 Opening Credits  0 Top Billed Cast Sam Waterston Abraham Lincoln Morgan Freeman Frederick Douglass Jason Robards Ulysses S. Grant Shelby Foote Garrison Keillor Walt Whitman Full Cast & Crew Last Season Season 1 1990 | 9 Episodes View All Seasons Social Reviews  0 Discussions  1 Subject Status Replies Last Reply There are no discussions for The Civil War. Login to be first! Go to Discussions Media Most Popular Videos  0 Backdrops  7 Posters  7 Recommendations   1922-09-10 Our Gang 7.6    2001-01-09 Jazz 6.6    2014-10-05 Mulaney 2.4    2008-03-05 The War 8.1    1993-09-18 Sonic the Hedgehog 5.3    1981-05-16 SCTV Network 90 8.1  Facts Status  Ended Network Certification TV-14 Meaning This program contains some material that many parents would find unsuitable for children under 14 years of age. Type  Miniseries Original Language  English Runtime  680m Homepage   http://www.pbs.org/civilwar/ Genres Documentary Keywords slavery history miniseries american civil war robert e lee Content Score 86 Almost there... Top Contributors TB 31 TMDb Bot R 16 Rebecca n 8 nemo93 S 5 Samara  View Edit History Popularity Trend  Login to edit  URL By  signing up  for an account on TMDb, you can post directly to Twitter and Facebook. You need to be logged in to continue. Click  here  to login or  here  to sign up.    page_wrap opened in html_head  Join the Community The Basics About TMDb Contact Us Support Forums API Blog Get Involved  Contribution Bible 3rd Party Applications Add New Movie Add New TV Show Community Guidelines Leaderboard Forums Twitter Facebook Legal Terms of Use Privacy Policy Login Sign Up"}