{"link": "https://www.themoviedb.org/tv/74939?language=en", "title": "Erased", "resume": "After finding his mom killed, Satoru's time-traveling ability takes him back 18 years for a chance to prevent her death and those of three classmates.", "rate": 82, "genre": ["Crime", "Drama"], "cast": ["Yuki Furukawa", "Mio Yuki", "Rinka Kakihara", "Reo Uchikawa", "Noriko Eguchi"], "character": ["Satoru Fujinuma", "Airi Katagiri", "Kayo Hinazuki", "Satoru Fujinuma (young)", "Akemi Hinazuki"], "site_data": "html Apps Forums Leaderboard Contribute API Support Discover Movies TV Shows Movies Popular Top Rated Upcoming Now Playing TV Shows Popular Top Rated On TV Airing Today People Popular People Can't find a movie or TV show? Login to create it. en Login Sign Up  ID: 74939   Expand Erased   (2017) User Score  Play Trailer Overview After finding his mom killed, Satoru's time-traveling ability takes him back 18 years for a chance to prevent her death and those of three classmates. Discussions   Reviews Videos   Images   Changes Report Share Discussions General  0 Content Issues  0 Images Backdrops  2 Posters  5 Videos Trailers  1 Teasers  0 Clips  0 Featurettes  0 Opening Credits  0 Top Billed Cast Yuki Furukawa Satoru Fujinuma Mio Yuki Airi Katagiri Rinka Kakihara Kayo Hinazuki Reo Uchikawa Satoru Fujinuma (young) Noriko Eguchi Akemi Hinazuki Full Cast & Crew Current Season Season 1 2017 | 12 Episodes Season 1 of Erased premiered on December 15, 2017. View All Seasons Social Reviews  0 Discussions  0 Media Most Popular Videos  1 Backdrops  2 Posters  5 Recommendations   2017-08-16 The Many Faces of Ito 7.0  Facts Original Name  \u50d5\u3060\u3051\u304c\u3044\u306a\u3044\u8857 Status  Returning Series Network Certification TV-14 Meaning This program contains some material that many parents would find unsuitable for children under 14 years of age. Type  Scripted Original Language  Japanese Runtime  28m Homepage   https://www.netflix.com/title/80173711 Genres Crime Drama Keywords time travel thriller Content Score 93 Almost there... Top Contributors M 35 Maria180493 34 Elizabeth Jennings AK 3 Avshalom Kor E 2 Edytor  View Edit History Popularity Trend  Login to edit  URL By  signing up  for an account on TMDb, you can post directly to Twitter and Facebook. You need to be logged in to continue. Click  here  to login or  here  to sign up.    page_wrap opened in html_head  Join the Community The Basics About TMDb Contact Us Support Forums API Blog Get Involved  Contribution Bible 3rd Party Applications Add New Movie Add New TV Show Community Guidelines Leaderboard Forums Twitter Facebook Legal Terms of Use Privacy Policy Login Sign Up"}