{"link": "https://www.themoviedb.org/tv/37337?language=en", "title": "Pitbull", "resume": "We don't have an overview translated in English. Help us expand our database by adding one.", "rate": 90, "genre": ["Drama", "Action", "Adventure"], "cast": ["Marcin Doroci\u0144ski", "Andrzej Grabowski", "Pawel Kr\u00f3likowski", "Janusz Gajos", "Rafa\u0142 Mohr"], "character": ["S\u0142awomir \"Despero\" Desperski", "Jacek \"Gebels\" Goc", "Igor Ros\u0142o\u0144", "Zbigniew \"Benek\" Chyb", "Krzysztof  \"Nielat\" Magiera"], "site_data": "html Apps Forums Leaderboard Contribute API Support Discover Movies TV Shows Movies Popular Top Rated Upcoming Now Playing TV Shows Popular Top Rated On TV Airing Today People Popular People Can't find a movie or TV show? Login to create it. en Login Sign Up  ID: 37337   Expand Pitbull   (2005) User Score Overview We don't have an overview translated in English. Help us expand our database by adding one. Featured Crew Patryk Vega Creator Discussions   Reviews Videos   Images   Changes Report Share Discussions General  0 Content Issues  1 Images Backdrops  2 Posters  3 Videos Trailers  0 Teasers  0 Clips  0 Featurettes  0 Opening Credits  0 Top Billed Cast Marcin Doroci\u0144ski S\u0142awomir \"Despero\" Desperski Andrzej Grabowski Jacek \"Gebels\" Goc Pawel Kr\u00f3likowski Igor Ros\u0142o\u0144 Janusz Gajos Zbigniew \"Benek\" Chyb Rafa\u0142 Mohr Krzysztof  \"Nielat\" Magiera Full Cast & Crew Last Season Season 3 2008 | 14 Episodes Season 3 of Pitbull premiered on March  9, 2008. View All Seasons Social Reviews  0 Discussions  0 Media Most Popular Videos  0 Backdrops  2 Posters  3 Recommendations We don't have enough data to suggest any TV shows based on Pitbull. You can help by rating TV shows you've seen. Facts Status  Ended Network Certification  - Type  Scripted Original Language  Polish Runtime  45m Homepage   http://pitbull.tvp.pl/ Genres Drama Action & Adventure Keywords No keywords have been added. Content Score 86 Almost there... Top Contributors t 35 tmdb50018442 P 27 Paju L 2 Lysy500 n 1 nowosolna  View Edit History Popularity Trend  Login to edit  URL By  signing up  for an account on TMDb, you can post directly to Twitter and Facebook. You need to be logged in to continue. Click  here  to login or  here  to sign up.    page_wrap opened in html_head  Join the Community The Basics About TMDb Contact Us Support Forums API Blog Get Involved  Contribution Bible 3rd Party Applications Add New Movie Add New TV Show Community Guidelines Leaderboard Forums Twitter Facebook Legal Terms of Use Privacy Policy Login Sign Up"}