{"link": "https://www.themoviedb.org/tv/70514?language=en", "title": "The Replacement", "resume": "A woman who goes on maternity leave becomes increasingly paranoid about the motives of the person covering for her.", "rate": 71, "genre": ["Drama"], "cast": ["Neve McIntosh", "Navin Chowdhry", "Kim Allan", "Gilly Gilchrist", "Siobhan Redmond"], "character": ["Kay Gillies", "Keiran", "Lucy", "Vernon", "Beth"], "site_data": "html Apps Forums Leaderboard Contribute API Support Discover Movies TV Shows Movies Popular Top Rated Upcoming Now Playing TV Shows Popular Top Rated On TV Airing Today People Popular People Can't find a movie or TV show? Login to create it. en Login Sign Up  ID: 70514   Expand The Replacement   (2017) User Score  Play Trailer Overview A woman who goes on maternity leave becomes increasingly paranoid about the motives of the person covering for her. Featured Crew Joe Ahearne Creator Discussions   Reviews Videos   Images   Changes Report Share Discussions General  1 Content Issues  0 Images Backdrops  6 Posters  4 Videos Trailers  1 Teasers  0 Clips  0 Featurettes  0 Opening Credits  0 Top Billed Cast Neve McIntosh Kay Gillies Navin Chowdhry Keiran Kim Allan Lucy Gilly Gilchrist Vernon Siobhan Redmond Beth Full Cast & Crew Last Season Season 1 2017 | 3 Episodes Season 1 of The Replacement premiered on February 28, 2017. View All Seasons Social Reviews  0 Discussions  1 Subject Status Replies Last Reply p can someone explain the finale to me? Open 2 by  Cat Rinel Go to Discussions Media Most Popular Videos  1 Backdrops  6 Posters  4 Recommendations We don't have enough data to suggest any TV shows based on The Replacement. You can help by rating TV shows you've seen. Facts Status  Ended Network Certification  - Type  Miniseries Original Language  English Runtime  60m Homepage   http://www.bbc.co.uk/programmes/b08h622q Genres Drama Keywords thriller miniseries Content Score 100 Yes! Looking good! Top Contributors 21 szab TB 19 TMDb Bot 17 Elizabeth Jennings 4 roimidas  View Edit History Popularity Trend  Login to edit  URL By  signing up  for an account on TMDb, you can post directly to Twitter and Facebook. You need to be logged in to continue. Click  here  to login or  here  to sign up.    page_wrap opened in html_head  Join the Community The Basics About TMDb Contact Us Support Forums API Blog Get Involved  Contribution Bible 3rd Party Applications Add New Movie Add New TV Show Community Guidelines Leaderboard Forums Twitter Facebook Legal Terms of Use Privacy Policy Login Sign Up"}