{"link": "https://www.themoviedb.org/tv/34165?language=en", "title": "Knight Hunters", "resume": "Four assassins, members of a group called Wei\u00df, work out of a flower shop called Kitty in the House.", "rate": 0, "genre": ["Animation", "Drama", "Action", "Adventure", "Comedy", "Drama"], "cast": ["Shin'ichirou Miki", "Tomokazu Seki", "Hikaru Midorikawa", "Takehito Koyasu", "Hiro Yuuki"], "character": ["Youji Kudou", "Ken Hidaka", "Schuldig", "Ran Fujimiya", "Omi Tsukiyono"], "site_data": "html Apps Forums Leaderboard Contribute API Support Discover Movies TV Shows Movies Popular Top Rated Upcoming Now Playing TV Shows Popular Top Rated On TV Airing Today People Popular People Can't find a movie or TV show? Login to create it. en Login Sign Up  ID: 34165   Expand Knight Hunters   (1998) User Score Overview Four assassins, members of a group called Wei\u00df, work out of a flower shop called Kitty in the House. Discussions   Reviews Videos   Images   Changes Report Share Discussions General  0 Content Issues  1 Images Backdrops  2 Posters  2 Videos Trailers  0 Teasers  0 Clips  0 Featurettes  0 Opening Credits  0 Top Billed Cast Shin'ichirou Miki Youji Kudou Tomokazu Seki Ken Hidaka Hikaru Midorikawa Schuldig Takehito Koyasu Ran Fujimiya Hiro Yuuki Omi Tsukiyono Full Cast & Crew Last Season Original Air Date Original Air Date Comprehensive Order (Absolute) Knight Hunters Eternity 2002 | 13 Episodes View All Seasons Social Reviews  0 Discussions  1 Subject Status Replies Last Reply There are no discussions for Knight Hunters. Login to be first! Go to Discussions Media Most Popular Videos  0 Backdrops  2 Posters  2 Recommendations We don't have enough data to suggest any TV shows based on Knight Hunters. You can help by rating TV shows you've seen. Facts Original Name  \u30f4\u30a1\u30a4\u30b9\u30af\u30ed\u30a4\u30c4 Status  Ended Network Certification  - Type  Scripted Original Language  Japanese Runtime  30m Homepage  - Genres Animation Drama Action & Adventure Comedy Drama Keywords No keywords have been added. Content Score 86 Almost there... Top Contributors 20 Banana 17 BrerFox 7 sp1ti 7 Irresponsibletyler  View Edit History Popularity Trend  Login to edit  URL By  signing up  for an account on TMDb, you can post directly to Twitter and Facebook. You need to be logged in to continue. Click  here  to login or  here  to sign up.    page_wrap opened in html_head  Join the Community The Basics About TMDb Contact Us Support Forums API Blog Get Involved  Contribution Bible 3rd Party Applications Add New Movie Add New TV Show Community Guidelines Leaderboard Forums Twitter Facebook Legal Terms of Use Privacy Policy Login Sign Up"}