{"link": "https://www.themoviedb.org/tv/3040?language=en", "title": "WWE Tough Enough", "resume": "WWE Tough Enough is a professional wrestling reality television program produced by WWE where in participants undergo professional wrestling training and compete for a contract with WWE.", "rate": 90, "genre": ["Reality"], "cast": ["Booker Huffman", "Chris Jericho", "Hulk Hogan", "Bryan Danielson", "Saraya-Jade Bevis"], "character": ["Booker T", "Daniel Bryan", "Paige"], "site_data": "html Apps Forums Leaderboard Contribute API Support Discover Movies TV Shows Movies Popular Top Rated Upcoming Now Playing TV Shows Popular Top Rated On TV Airing Today People Popular People Can't find a movie or TV show? Login to create it. en Login Sign Up  ID: 3040   Expand WWE Tough Enough   (2001) User Score Overview WWE Tough Enough is a professional wrestling reality television program produced by WWE where in participants undergo professional wrestling training and compete for a contract with WWE. Featured Crew Vince McMahon Creator Discussions   Reviews Videos   Images   Changes Report Share Discussions General  0 Content Issues  0 Images Backdrops  2 Posters  1 Videos Trailers  0 Teasers  0 Clips  0 Featurettes  0 Opening Credits  0 Top Billed Cast Booker Huffman Booker T Chris Jericho Hulk Hogan Bryan Danielson Daniel Bryan Saraya-Jade Bevis Paige Full Cast & Crew Last Season Season 6 2015 | 10 Episodes Season 6 of WWE Tough Enough premiered on June 23, 2015. View All Seasons Social Reviews  0 Discussions  0 Media Most Popular Videos  0 Backdrops  2 Posters  1 Recommendations We don't have enough data to suggest any TV shows based on WWE Tough Enough. You can help by rating TV shows you've seen. Facts Status  Ended Network Certification  - Type  Reality Original Language  English Runtime  42m Homepage  - Genres Reality Keywords training camp sport competition Content Score 93 Almost there... Top Contributors J 156 Jenn z 10 zurman1 9 Elizabeth Jennings M 3 Meng3267  View Edit History Popularity Trend  Login to edit  URL By  signing up  for an account on TMDb, you can post directly to Twitter and Facebook. You need to be logged in to continue. Click  here  to login or  here  to sign up.    page_wrap opened in html_head  Join the Community The Basics About TMDb Contact Us Support Forums API Blog Get Involved  Contribution Bible 3rd Party Applications Add New Movie Add New TV Show Community Guidelines Leaderboard Forums Twitter Facebook Legal Terms of Use Privacy Policy Login Sign Up"}