{"link": "https://www.themoviedb.org/tv/71883?language=en", "title": "Perd\u00f3name Se\u00f1or", "resume": "We don't have an overview translated in English. Help us expand our database by adding one.", "rate": null, "genre": ["Drama"], "cast": ["Paz Vega", "Stany Coppet", "Jes\u00fas Castro", "Estefan\u00eda de los Santos", "Jos\u00e9 Manuel Seda"], "site_data": "html Apps Forums Leaderboard Contribute API Support Discover Movies TV Shows Movies Popular Top Rated Upcoming Now Playing TV Shows Popular Top Rated On TV Airing Today People Popular People Can't find a movie or TV show? Login to create it. en Login Sign Up  ID: 71883   Expand Perd\u00f3name Se\u00f1or   (2017) User Score Overview We don't have an overview translated in English. Help us expand our database by adding one. Featured Crew Frank Ariza Creator Discussions   Reviews Videos   Images   Changes Report Share Discussions General  0 Content Issues  0 Images Backdrops  3 Posters  2 Videos Trailers  0 Teasers  0 Clips  0 Featurettes  0 Opening Credits  0 Top Billed Cast Paz Vega Luc\u00eda Medina Stany Coppet Bruno Lachambre Jes\u00fas Castro Rafael \"Rafa\" Medina Estefan\u00eda de los Santos Antonia Jos\u00e9 Manuel Seda Ram\u00f3n Men\u00e9ndez Full Cast & Crew Last Season Season 1 2017 | 8 Episodes Season 1 of Perd\u00f3name Se\u00f1or premiered on May 24, 2017. View All Seasons Social Reviews  0 Discussions  0 Media Most Popular Videos  0 Backdrops  3 Posters  2 Recommendations We don't have enough data to suggest any TV shows based on Perd\u00f3name Se\u00f1or. You can help by rating TV shows you've seen. Facts Status  Returning Series Network Certification  - Type  Scripted Original Language  Spanish; Castilian Runtime  - Homepage   http://www.telecinco.es/perdonamesenor/ Genres Drama Keywords No keywords have been added. Content Score 86 Almost there... Top Contributors 25 United600 14 Elizabeth Jennings 10 dariorufi jp 4 juan perez  View Edit History Popularity Trend  Login to edit  URL By  signing up  for an account on TMDb, you can post directly to Twitter and Facebook. You need to be logged in to continue. Click  here  to login or  here  to sign up.    page_wrap opened in html_head  Join the Community The Basics About TMDb Contact Us Support Forums API Blog Get Involved  Contribution Bible 3rd Party Applications Add New Movie Add New TV Show Community Guidelines Leaderboard Forums Twitter Facebook Legal Terms of Use Privacy Policy Login Sign Up", "character": ["Luc\u00eda Medina", "Bruno Lachambre", "Rafael \"Rafa\" Medina", "Antonia", "Ram\u00f3n Men\u00e9ndez"]}