{"link": "https://www.themoviedb.org/tv/72879?language=en", "title": "Demain nous Appartient", "resume": "We don't have an overview translated in English. Help us expand our database by adding one.", "rate": 40, "genre": ["Crime"], "cast": ["Cl\u00e9ment Remiens", "Ingrid Chauvin", "Charlotte Valandrey", "Alexandre Brasseur", "Lorie Pester"], "character": ["Maxime", "Chlo\u00e9", "Laurence", "Alex", "Lucie"], "site_data": "html Apps Forums Leaderboard Contribute API Support Discover Movies TV Shows Movies Popular Top Rated Upcoming Now Playing TV Shows Popular Top Rated On TV Airing Today People Popular People Can't find a movie or TV show? Login to create it. en Login Sign Up  ID: 72879   Expand Demain nous Appartient   (2017) User Score Overview We don't have an overview translated in English. Help us expand our database by adding one. Featured Crew Nicolas Durand-Zouky Creator Fr\u00e9d\u00e9ric Chansel Creator Laure de Colbert Creator Eline Le Fur Creator Fabienne Lesieur Creator Discussions   Reviews Videos   Images   Changes Report Share Discussions General  0 Content Issues  0 Images Backdrops  2 Posters  2 Videos Trailers  0 Teasers  0 Clips  0 Featurettes  0 Opening Credits  0 Top Billed Cast Cl\u00e9ment Remiens Maxime Ingrid Chauvin Chlo\u00e9 Charlotte Valandrey Laurence Alexandre Brasseur Alex Lorie Pester Lucie Full Cast & Crew Last Season Season 1 2017 | 33 Episodes Season 1 of Demain nous Appartient premiered on July  3, 2017. View All Seasons Social Reviews  0 Discussions  0 Media Most Popular Videos  0 Backdrops  2 Posters  2 Recommendations We don't have enough data to suggest any TV shows based on Demain nous Appartient. You can help by rating TV shows you've seen. Facts Status  Returning Series Network Certification  - Type  Scripted Original Language  French Runtime  25m Homepage  - Genres Crime Keywords thriller police officer Content Score 86 Almost there... Top Contributors r 30 rodsera D 15 Destr0y c 6 coyotte06 5 sp1ti  View Edit History Popularity Trend  Login to edit  URL By  signing up  for an account on TMDb, you can post directly to Twitter and Facebook. You need to be logged in to continue. Click  here  to login or  here  to sign up.    page_wrap opened in html_head  Join the Community The Basics About TMDb Contact Us Support Forums API Blog Get Involved  Contribution Bible 3rd Party Applications Add New Movie Add New TV Show Community Guidelines Leaderboard Forums Twitter Facebook Legal Terms of Use Privacy Policy Login Sign Up"}