{"link": "https://www.themoviedb.org/tv/349?language=en", "title": "Point Pleasant", "resume": "A series of supernatural events begins in a small coastal New Jersey town after the arrival of a mysterious teenage girl, who apparently has the ability to influence the people and events around her.", "rate": 69, "genre": ["Mystery"], "cast": ["Elisabeth Harnois", "Sam Page", "Cameron Richardson", "Aubrey Dollar", "Grant Show"], "character": ["Christina Nickson", "Jesse Parker", "Paula Hargrove", "Judy Kramer", "Lucas Boyd"], "site_data": "html Apps Forums Leaderboard Contribute API Support Discover Movies TV Shows Movies Popular Top Rated Upcoming Now Playing TV Shows Popular Top Rated On TV Airing Today People Popular People Can't find a movie or TV show? Login to create it. en Login Sign Up  ID: 349   Expand Point Pleasant   (2005) User Score  Play Trailer Overview A series of supernatural events begins in a small coastal New Jersey town after the arrival of a mysterious teenage girl, who apparently has the ability to influence the people and events around her. Featured Crew Marti Noxon Creator Discussions   Reviews Videos   Images   Changes Report Share Discussions General  1 Content Issues  0 Images Backdrops  8 Posters  3 Videos Trailers  1 Teasers  0 Clips  0 Featurettes  0 Opening Credits  0 Top Billed Cast Elisabeth Harnois Christina Nickson Sam Page Jesse Parker Cameron Richardson Paula Hargrove Aubrey Dollar Judy Kramer Grant Show Lucas Boyd Full Cast & Crew Last Season Season 1 2005 | 13 Episodes Season 1 of Point Pleasant premiered on January 19, 2005. View All Seasons Social Reviews  0 Discussions  1 Subject Status Replies Last Reply Fox did it again! Open 0 by MirrorMask\n      \n     Go to Discussions Media Most Popular Videos  1 Backdrops  8 Posters  3 Recommendations   1997-05-09 Jonathan Creek 7.7    2006-09-28 Ugly Betty 5.5  Facts Status  Cancelled Network Certification  - Type  Scripted Original Language  English Runtime  60m Homepage  - Genres Mystery Keywords new jersey dark heroine supernatural teen Content Score 100 Yes! Looking good! Top Contributors L 16 LightningW 9 Banana R 8 Rebecca z 8 zurman1  View Edit History Popularity Trend  Login to edit  URL By  signing up  for an account on TMDb, you can post directly to Twitter and Facebook. You need to be logged in to continue. Click  here  to login or  here  to sign up.    page_wrap opened in html_head  Join the Community The Basics About TMDb Contact Us Support Forums API Blog Get Involved  Contribution Bible 3rd Party Applications Add New Movie Add New TV Show Community Guidelines Leaderboard Forums Twitter Facebook Legal Terms of Use Privacy Policy Login Sign Up"}