{"link": "https://www.themoviedb.org/tv/34850?language=en", "title": "The Parents", "resume": "Life of a family of five: father, mother and their three boys.", "rate": 65, "genre": ["Comedy"], "cast": ["Anne Dorval", "Rapha\u00ebl Grenier-Beno\u00eet", "Louis-Philippe Beauchamp", "Daniel Bri\u00e8re", "Joey Scarpellino"], "character": ["Natalie Rivard", "Olivier Parent", "Zakharie Parent", "Louis-Paul Parent", "Thomas Parent"], "site_data": "html Apps Forums Leaderboard Contribute API Support Discover Movies TV Shows Movies Popular Top Rated Upcoming Now Playing TV Shows Popular Top Rated On TV Airing Today People Popular People Can't find a movie or TV show? Login to create it. en Login Sign Up  ID: 34850   Expand The Parents   (2008) User Score Overview Life of a family of five: father, mother and their three boys. Featured Crew Jacques Davidts Creator Discussions   Reviews Videos   Images   Changes Report Share Discussions General  0 Content Issues  0 Images Backdrops  7 Posters  2 Videos Trailers  0 Teasers  0 Clips  0 Featurettes  0 Opening Credits  0 Top Billed Cast Anne Dorval Natalie Rivard Rapha\u00ebl Grenier-Beno\u00eet Olivier Parent Louis-Philippe Beauchamp Zakharie Parent Daniel Bri\u00e8re Louis-Paul Parent Joey Scarpellino Thomas Parent Full Cast & Crew Last Season Season 8 2015 | 24 Episodes Season 8 of The Parents premiered on September  7, 2015. View All Seasons Social Reviews  0 Discussions  0 Media Most Popular Videos  0 Backdrops  7 Posters  2 Recommendations We don't have enough data to suggest any TV shows based on The Parents. You can help by rating TV shows you've seen. Facts Original Name  Les Parent Status  Ended Network Certification PG Meaning Parental guidance. Moderate violence and moderate profanity is allowed, as is brief nudity and sexual references if important to the context of the story. Type  Scripted Original Language  French Runtime  23m Homepage   http://lesparent.radio-canada.ca Genres Comedy Keywords sibling relationship quebec teenager family Content Score 93 Almost there... Top Contributors 46 Banana x 4 xNRJx 3 Lewis t 3 tms1987  View Edit History Popularity Trend  Login to edit  URL By  signing up  for an account on TMDb, you can post directly to Twitter and Facebook. You need to be logged in to continue. Click  here  to login or  here  to sign up.    page_wrap opened in html_head  Join the Community The Basics About TMDb Contact Us Support Forums API Blog Get Involved  Contribution Bible 3rd Party Applications Add New Movie Add New TV Show Community Guidelines Leaderboard Forums Twitter Facebook Legal Terms of Use Privacy Policy Login Sign Up"}