{"link": "https://www.themoviedb.org/tv/61299?language=en", "title": "Chasing Shadows", "resume": "Chasing Shadows' follows a team of special operatives who are tracking down serial killers.", "rate": 75, "genre": ["Crime", "Drama"], "cast": ["Alex Kingston", "Noel Clarke", "Reece Shearsmith"], "character": ["Ruth Hattersley", "DCI Carl Pryor", "DS Sean Stone"], "site_data": "html Apps Forums Leaderboard Contribute API Support Discover Movies TV Shows Movies Popular Top Rated Upcoming Now Playing TV Shows Popular Top Rated On TV Airing Today People Popular People Can't find a movie or TV show? Login to create it. en Login Sign Up  ID: 61299   Expand Chasing Shadows   (2014) User Score  Play Trailer Overview Chasing Shadows' follows a team of special operatives who are tracking down serial killers. Discussions   Reviews Videos   Images   Changes Report Share Discussions General  0 Content Issues  0 Images Backdrops  1 Posters  2 Videos Trailers  1 Teasers  0 Clips  0 Featurettes  0 Opening Credits  0 Top Billed Cast Alex Kingston Ruth Hattersley Noel Clarke DCI Carl Pryor Reece Shearsmith DS Sean Stone Full Cast & Crew Last Season Season 1 2014 | 4 Episodes Season 1 of Chasing Shadows premiered on September  4, 2014. View All Seasons Social Reviews  0 Discussions  0 Media Most Popular Videos  1 Backdrops  1 Posters  2 Recommendations   2011-06-06 Injustice 7.3    2006-01-01 In Justice 6.8    2014-09-28 The Brokenwood Mysteries 7.6    2011-09-13 The Body Farm 6.2    2013-09-05 The Guilty 7.0    2010-07-12 The Silence 6.8    2004-07-19 The Grid 7.0    2011-01-13 Kidnap and Ransom 7.6  Facts Status  Ended Network Certification 15 Meaning No-one under 15 is allowed to see a 15 film at the cinema or buy/rent a 15 rated video. 15 rated works are not suitable for children under 15 years of age. Type  Miniseries Original Language  English Runtime  60m Homepage   https://www.itv.com/itvplayer/chasing-shadows Genres Crime Drama Keywords england serial killer miniseries missing person criminal investigation Content Score 64 We're so close, yet so far. Top Contributors 17 Elizabeth Jennings 15 Steve 14 Banana CM 7 Cherche Moi  View Edit History Popularity Trend  Login to edit  URL By  signing up  for an account on TMDb, you can post directly to Twitter and Facebook. You need to be logged in to continue. Click  here  to login or  here  to sign up.    page_wrap opened in html_head  Join the Community The Basics About TMDb Contact Us Support Forums API Blog Get Involved  Contribution Bible 3rd Party Applications Add New Movie Add New TV Show Community Guidelines Leaderboard Forums Twitter Facebook Legal Terms of Use Privacy Policy Login Sign Up"}