{"link": "https://www.themoviedb.org/tv/78841?language=en", "title": "Taskmaster", "resume": "Reggie Watts hosts a game show like no other, where contestants compete in a series of incredibly taxing and strange challenges under his harsh judgment.", "rate": 0, "genre": ["Comedy"], "cast": ["Reggie Watts", "Alex Horne", "Kate Berlant", "Dillon Francis", "Ron Funches"], "character": ["Himself - Taskmaster", "Himself - Taskmaster's Assistant", "Herself", "Himself", "Himself"], "site_data": "html Apps Forums Leaderboard Contribute API Support Discover Movies TV Shows Movies Popular Top Rated Upcoming Now Playing TV Shows Popular Top Rated On TV Airing Today People Popular People Can't find a movie or TV show? Login to create it. en Login Sign Up  ID: 78841   Expand Taskmaster   (2018) User Score Overview Reggie Watts hosts a game show like no other, where contestants compete in a series of incredibly taxing and strange challenges under his harsh judgment. Featured Crew Alex Horne Creator Discussions   Reviews Videos   Images   Changes Report Share Discussions General  0 Content Issues  0 Images Backdrops  2 Posters  1 Videos Trailers  0 Teasers  0 Clips  0 Featurettes  0 Opening Credits  0 Top Billed Cast Reggie Watts Himself - Taskmaster Alex Horne Himself - Taskmaster's Assistant Kate Berlant Herself Dillon Francis Himself Ron Funches Himself Full Cast & Crew Current Season Season 1 2018 | 8 Episodes Season 1 of Taskmaster premiered on April 27, 2018. View All Seasons Social Reviews  0 Discussions  0 Media Most Popular Videos  0 Backdrops  2 Posters  1 Recommendations We don't have enough data to suggest any TV shows based on Taskmaster. You can help by rating TV shows you've seen. Facts Status  Returning Series Network Certification  - Type  Reality Original Language  English Runtime  30m Homepage   http://www.cc.com/shows/taskmaster Genres Comedy Keywords game show Content Score 93 Almost there... Top Contributors s 19 speller2 12 Elizabeth Jennings 10 BagronkeN A 1 Arius11  View Edit History Popularity Trend  Login to edit  URL By  signing up  for an account on TMDb, you can post directly to Twitter and Facebook. You need to be logged in to continue. Click  here  to login or  here  to sign up.    page_wrap opened in html_head  Join the Community The Basics About TMDb Contact Us Support Forums API Blog Get Involved  Contribution Bible 3rd Party Applications Add New Movie Add New TV Show Community Guidelines Leaderboard Forums Twitter Facebook Legal Terms of Use Privacy Policy Login Sign Up"}