{"link": "https://www.themoviedb.org/tv/76182?language=en", "title": "Nesten voksen", "resume": "We don't have an overview translated in English. Help us expand our database by adding one.", "rate": 10, "genre": ["Comedy"], "cast": ["Jenny Skavlan", "Nils J\u00f8rgen Kaalstad", "Hans Olav Brenner", "Kjersti Tveter\u00e5s", "Renate Reinsve"], "character": ["Camilla", "Thomas", "Truls", "Ida", "Siri"], "site_data": "html Apps Forums Leaderboard Contribute API Support Discover Movies TV Shows Movies Popular Top Rated Upcoming Now Playing TV Shows Popular Top Rated On TV Airing Today People Popular People Can't find a movie or TV show? Login to create it. en Login Sign Up  ID: 76182   Expand Nesten voksen   (2018) User Score Overview We don't have an overview translated in English. Help us expand our database by adding one. Discussions   Reviews Videos   Images   Changes Report Share Discussions General  0 Content Issues  1 Images Backdrops  2 Posters  1 Videos Trailers  0 Teasers  0 Clips  0 Featurettes  0 Opening Credits  0 Top Billed Cast Jenny Skavlan Camilla Nils J\u00f8rgen Kaalstad Thomas Hans Olav Brenner Truls Kjersti Tveter\u00e5s Ida Renate Reinsve Siri Full Cast & Crew Current Season Season 1 2018 | 8 Episodes Season 1 of Nesten voksen premiered on January  6, 2018. View All Seasons Social Reviews  0 Discussions  1 Subject Status Replies Last Reply There are no discussions for Nesten voksen. Login to be first! Go to Discussions Media Most Popular Videos  0 Backdrops  2 Posters  1 Recommendations We don't have enough data to suggest any TV shows based on Nesten voksen. You can help by rating TV shows you've seen. Facts Status  Cancelled Network Certification  - Type  Scripted Original Language  Norwegian Runtime  30m Homepage  - Genres Comedy Keywords No keywords have been added. Content Score 79 Pump it up! We're close now. Top Contributors 32 Bendik 4 Elizabeth Jennings 1 janar  View Edit History Popularity Trend  Login to edit  URL By  signing up  for an account on TMDb, you can post directly to Twitter and Facebook. You need to be logged in to continue. Click  here  to login or  here  to sign up.    page_wrap opened in html_head  Join the Community The Basics About TMDb Contact Us Support Forums API Blog Get Involved  Contribution Bible 3rd Party Applications Add New Movie Add New TV Show Community Guidelines Leaderboard Forums Twitter Facebook Legal Terms of Use Privacy Policy Login Sign Up"}