{"link": "https://www.themoviedb.org/tv/61874?language=en", "title": "Quirke", "resume": "A chief pathologist in the Dublin city morgue investigates sudden death victims in the 1950s.", "rate": 59, "genre": ["Mystery", "Drama"], "cast": ["Gabriel Byrne", "Nick Dunning", "Brian Gleeson", "Aisling Franciosi", "Stanley Townsend"], "character": ["Quirke", "Malachy Griffin", "Sinclair", "Phoebe Griffin", "Inspector Hackett"], "site_data": "html Apps Forums Leaderboard Contribute API Support Discover Movies TV Shows Movies Popular Top Rated Upcoming Now Playing TV Shows Popular Top Rated On TV Airing Today People Popular People Can't find a movie or TV show? Login to create it. en Login Sign Up  ID: 61874   Expand Quirke   (2014) User Score  Play Trailer Overview A chief pathologist in the Dublin city morgue investigates sudden death victims in the 1950s. Discussions   Reviews Videos   Images   Changes Report Share Discussions General  0 Content Issues  0 Images Backdrops  4 Posters  4 Videos Trailers  1 Teasers  0 Clips  0 Featurettes  0 Opening Credits  0 Top Billed Cast Gabriel Byrne Quirke Nick Dunning Malachy Griffin Brian Gleeson Sinclair Aisling Franciosi Phoebe Griffin Stanley Townsend Inspector Hackett Full Cast & Crew Last Season Season 1 2014 | 3 Episodes Season 1 of Quirke premiered on February 16, 2014. View All Seasons Social Reviews  0 Discussions  0 Media Most Popular Videos  1 Backdrops  4 Posters  4 Recommendations   2015-11-24 Capital 7.5    2014-04-06 TURN: Washington's Spies 7.4  Facts Status  Ended Networks Certification  - Type  Miniseries Original Language  English Runtime  90m Homepage   http://www.bbc.co.uk/programmes/p01437n8 Genres Mystery Drama Keywords dublin morgue period drama pathologist 1950s Content Score 93 Almost there... Top Contributors TB 28 TMDb Bot 21 Steve 19 Elizabeth Jennings md 7 movie dino  View Edit History Popularity Trend  Login to edit  URL By  signing up  for an account on TMDb, you can post directly to Twitter and Facebook. You need to be logged in to continue. Click  here  to login or  here  to sign up.    page_wrap opened in html_head  Join the Community The Basics About TMDb Contact Us Support Forums API Blog Get Involved  Contribution Bible 3rd Party Applications Add New Movie Add New TV Show Community Guidelines Leaderboard Forums Twitter Facebook Legal Terms of Use Privacy Policy Login Sign Up"}