{"link": "https://www.themoviedb.org/tv/60591?language=en", "title": "Rendez-vous in an Unknown Land", "resume": "We don't have an overview translated in English. Help us expand our database by adding one.", "rate": 0, "genre": ["Documentary"], "cast": ["Fr\u00e9d\u00e9ric Lopez"], "character": ["Fr\u00e9d\u00e9ric Lopez / Narrator"], "site_data": "html Apps Forums Leaderboard Contribute API Support Discover Movies TV Shows Movies Popular Top Rated Upcoming Now Playing TV Shows Popular Top Rated On TV Airing Today People Popular People Can't find a movie or TV show? Login to create it. en Login Sign Up  ID: 60591   Expand Rendez-vous in an Unknown Land   (2004) User Score Overview We don't have an overview translated in English. Help us expand our database by adding one. Discussions   Reviews Videos   Images   Changes Report Share Discussions General  0 Content Issues  0 Images Backdrops  1 Posters  1 Videos Trailers  0 Teasers  0 Clips  0 Featurettes  0 Opening Credits  0 Top Billed Cast Fr\u00e9d\u00e9ric Lopez Fr\u00e9d\u00e9ric Lopez / Narrator Full Cast & Crew Last Season Season 1 2004 | 25 Episodes Season 1 of Rendez-vous in an Unknown Land premiered on December 26, 2004. View All Seasons Social Reviews  0 Discussions  0 Media Most Popular Videos  0 Backdrops  1 Posters  1 Recommendations We don't have enough data to suggest any TV shows based on Rendez-vous in an Unknown Land. You can help by rating TV shows you've seen. Facts Original Name  Rendez-vous en terre inconnue Status  Returning Series Networks Certification  - Type  Documentary Original Language  French Runtime  90m Homepage  - Genres Documentary Keywords discovery Content Score 50 Still needs a little work. Top Contributors e 29 eMerzh 20 waaw b 1 beuss46 c 1 costaquebrada-htpc  View Edit History Popularity Trend  Login to edit  URL By  signing up  for an account on TMDb, you can post directly to Twitter and Facebook. You need to be logged in to continue. Click  here  to login or  here  to sign up.    page_wrap opened in html_head  Join the Community The Basics About TMDb Contact Us Support Forums API Blog Get Involved  Contribution Bible 3rd Party Applications Add New Movie Add New TV Show Community Guidelines Leaderboard Forums Twitter Facebook Legal Terms of Use Privacy Policy Login Sign Up"}