{"link": "https://www.themoviedb.org/tv/8016?language=en", "title": "Crash", "resume": "Crash is an American television drama series that tells the story of how the lives of how several very diverse Southern Californians intersect.", "rate": 60, "genre": ["Drama"], "cast": ["Eric Roberts", "Linda Park", "Dana Ashbrook", "Jocko Sims", "Ross McCall"], "character": ["Seth Blanchard", "Maggie", "Jimmy", "Anthony Adams", "Kenny Battaglia"], "site_data": "html Apps Forums Leaderboard Contribute API Support Discover Movies TV Shows Movies Popular Top Rated Upcoming Now Playing TV Shows Popular Top Rated On TV Airing Today People Popular People Can't find a movie or TV show? Login to create it. en Login Sign Up  ID: 8016   Expand Crash   (2008) User Score Overview Crash is an American television drama series that tells the story of how the lives of how several very diverse Southern Californians intersect. Discussions   Reviews Videos   Images   Changes Report Share Discussions General  0 Content Issues  0 Images Backdrops  5 Posters  2 Videos Trailers  0 Teasers  0 Clips  0 Featurettes  0 Opening Credits  0 Top Billed Cast Eric Roberts Seth Blanchard Linda Park Maggie Dana Ashbrook Jimmy Jocko Sims Anthony Adams Ross McCall Kenny Battaglia Full Cast & Crew Last Season Season 2 2009 | 13 Episodes Season 2 of Crash premiered on September 18, 2009. View All Seasons Social Reviews  0 Discussions  0 Media Most Popular Videos  0 Backdrops  5 Posters  2 Recommendations We don't have enough data to suggest any TV shows based on Crash. You can help by rating TV shows you've seen. Facts Status  Ended Network Certification TV-MA Meaning This program is specifically designed to be viewed by adults and therefore may be unsuitable for children under 17 Type  Scripted Original Language  English Runtime  43m Homepage  - Genres Drama Keywords racism los angeles based on movie Content Score 86 Almost there... Top Contributors 38 Banana z 5 zurman1 b 5 bugfix w 3 webmaster  View Edit History Popularity Trend  Login to edit  URL By  signing up  for an account on TMDb, you can post directly to Twitter and Facebook. You need to be logged in to continue. Click  here  to login or  here  to sign up.    page_wrap opened in html_head  Join the Community The Basics About TMDb Contact Us Support Forums API Blog Get Involved  Contribution Bible 3rd Party Applications Add New Movie Add New TV Show Community Guidelines Leaderboard Forums Twitter Facebook Legal Terms of Use Privacy Policy Login Sign Up"}