{"link": "https://www.themoviedb.org/tv/14544?language=en", "title": "Koffee with Karan", "resume": "Koffee with Karan [sic] is a talk show on STAR World India, based in Mumbai hosted by film producer and director Karan Johar.", "rate": 73, "genre": ["Talk"], "cast": ["Karan Johar"], "character": ["Host"], "site_data": "html Apps Forums Leaderboard Contribute API Support Discover Movies TV Shows Movies Popular Top Rated Upcoming Now Playing TV Shows Popular Top Rated On TV Airing Today People Popular People Can't find a movie or TV show? Login to create it. en Login Sign Up  ID: 14544   Expand Koffee with Karan   (2004) User Score Overview Koffee with Karan [sic] is a talk show on STAR World India, based in Mumbai hosted by film producer and director Karan Johar. Featured Crew Karan Johar Creator Discussions   Reviews Videos   Images   Changes Report Share Discussions General  0 Content Issues  0 Images Backdrops  3 Posters  1 Videos Trailers  0 Teasers  0 Clips  0 Featurettes  0 Opening Credits  0 Top Billed Cast Karan Johar Host Full Cast & Crew Last Season Season 3 2010 | 22 Episodes Season 3 of Koffee with Karan premiered on November  7, 2010. View All Seasons Social Reviews  0 Discussions  0 Media Most Popular Videos  0 Backdrops  3 Posters  1 Recommendations   2000-07-03 Kaun Banega Crorepati 8.0    2007-04-01 The Tudors 7.5    2010-01-22 Spartacus 7.8    1994-09-22 Friends 7.8  Facts Status  Ended Network Certification  - Type  Scripted Original Language  Hindi Runtime  60m Homepage   http://starworld.indya.com/specials/kwk2/index.html Genres Talk Keywords talk show Content Score 64 We're so close, yet so far. Top Contributors 10 Capa 3 Zlogorek p 2 priti23nov 1 t0by  View Edit History Popularity Trend  Login to edit  URL By  signing up  for an account on TMDb, you can post directly to Twitter and Facebook. You need to be logged in to continue. Click  here  to login or  here  to sign up.    page_wrap opened in html_head  Join the Community The Basics About TMDb Contact Us Support Forums API Blog Get Involved  Contribution Bible 3rd Party Applications Add New Movie Add New TV Show Community Guidelines Leaderboard Forums Twitter Facebook Legal Terms of Use Privacy Policy Login Sign Up"}