{"link": "https://www.themoviedb.org/tv/49525?language=en", "title": "Blue", "resume": "We don't have an overview translated in English. Help us expand our database by adding one.", "rate": null, "genre": ["Drama"], "cast": ["Julia Stiles", "Uriah Shelton"], "site_data": "html Apps Forums Leaderboard Contribute API Support Discover Movies TV Shows Movies Popular Top Rated Upcoming Now Playing TV Shows Popular Top Rated On TV Airing Today People Popular People Can't find a movie or TV show? Login to create it. en Login Sign Up  ID: 49525   Expand Blue   (2012) User Score Overview We don't have an overview translated in English. Help us expand our database by adding one. Featured Crew Rodrigo Garc\u00eda Creator Discussions   Reviews Videos   Images   Changes Report Share Discussions General  0 Content Issues  0 Images Backdrops  0 Posters  1 Videos Trailers  0 Teasers  0 Clips  0 Featurettes  0 Opening Credits  0 Top Billed Cast Julia Stiles Blue Uriah Shelton Josh Full Cast & Crew Last Season Season 3 2014 | 4 Episodes Season 3 of Blue premiered on March 28, 2014. View All Seasons Social Reviews  0 Discussions  0 Media Most Popular Videos  0 Backdrops  0 Posters  1 Recommendations We don't have enough data to suggest any TV shows based on Blue. You can help by rating TV shows you've seen. Facts Status  Ended Networks - Certification  - Type  Scripted Original Language  English Runtime  - Homepage   http://www.watchwigs.com/blue Genres Drama Keywords No keywords have been added. Content Score 43 There's no 'I' in team... Top Contributors 3 16 38956 2 1stShepherd 1 CouchTater r 1 rui1965  View Edit History Popularity Trend  Login to edit  URL By  signing up  for an account on TMDb, you can post directly to Twitter and Facebook. You need to be logged in to continue. Click  here  to login or  here  to sign up.    page_wrap opened in html_head  Join the Community The Basics About TMDb Contact Us Support Forums API Blog Get Involved  Contribution Bible 3rd Party Applications Add New Movie Add New TV Show Community Guidelines Leaderboard Forums Twitter Facebook Legal Terms of Use Privacy Policy Login Sign Up", "character": ["Blue", "Josh"]}