{"link": "https://www.themoviedb.org/tv/62756?language=en", "title": "V\u00edctor Ros", "resume": "We don't have an overview translated in English. Help us expand our database by adding one.", "rate": 60, "genre": ["Drama", "Mystery"], "cast": ["Carles Francino", "Tom\u00e1s del Estal", "Paco Tous", "Edu Soto", "Juan Fern\u00e1ndez"], "character": ["V\u00edctor Ros", "Luis Bl\u00e1zquez", "Marcos Giralda", "Le\u00f3n Cavestany", "Horacio Buend\u00eda"], "site_data": "html Apps Forums Leaderboard Contribute API Support Discover Movies TV Shows Movies Popular Top Rated Upcoming Now Playing TV Shows Popular Top Rated On TV Airing Today People Popular People Can't find a movie or TV show? Login to create it. en Login Sign Up  ID: 62756   Expand V\u00edctor Ros   (2015) User Score Overview We don't have an overview translated in English. Help us expand our database by adding one. Featured Crew Javier Olivares Creator Discussions   Reviews Videos   Images   Changes Report Share Discussions General  0 Content Issues  0 Images Backdrops  7 Posters  1 Videos Trailers  0 Teasers  0 Clips  0 Featurettes  0 Opening Credits  0 Top Billed Cast Carles Francino V\u00edctor Ros Tom\u00e1s del Estal Luis Bl\u00e1zquez Paco Tous Marcos Giralda Edu Soto Le\u00f3n Cavestany Juan Fern\u00e1ndez Horacio Buend\u00eda Full Cast & Crew Last Season Season 2 2016 | 8 Episodes Season 2 of V\u00edctor Ros premiered on November  3, 2016. View All Seasons Social Reviews  0 Discussions  0 Media Most Popular Videos  0 Backdrops  7 Posters  1 Recommendations We don't have enough data to suggest any TV shows based on V\u00edctor Ros. You can help by rating TV shows you've seen. Facts Status  Returning Series Network Certification  - Type  Scripted Original Language  Spanish; Castilian Runtime  70m Homepage   http://www.rtve.es/television/victor-ros/ Genres Drama Mystery Keywords spain based on novel or book history crime police detective 19th century Content Score 86 Almost there... Top Contributors 46 prm96 18 United600 15 Banana 7 stego77  View Edit History Popularity Trend  Login to edit  URL By  signing up  for an account on TMDb, you can post directly to Twitter and Facebook. You need to be logged in to continue. Click  here  to login or  here  to sign up.    page_wrap opened in html_head  Join the Community The Basics About TMDb Contact Us Support Forums API Blog Get Involved  Contribution Bible 3rd Party Applications Add New Movie Add New TV Show Community Guidelines Leaderboard Forums Twitter Facebook Legal Terms of Use Privacy Policy Login Sign Up"}