{"link": "https://www.themoviedb.org/tv/69937?language=en", "title": "Danmark har talent", "resume": "We don't have an overview translated in English. Help us expand our database by adding one.", "rate": 90, "genre": ["Family", "Reality"], "cast": ["Felix Schmidt", "Christopher L\u00e6ss\u00f8", "Peter Fr\u00f6din", "Jarl Friis-Mikkelsen", "Cecilie Lassen"], "character": ["V\u00e6rt", "V\u00e6rt", "Dommer", "Dommer", "Dommer"], "site_data": "html Apps Forums Leaderboard Contribute API Support Discover Movies TV Shows Movies Popular Top Rated Upcoming Now Playing TV Shows Popular Top Rated On TV Airing Today People Popular People Can't find a movie or TV show? Login to create it. en Login Sign Up  ID: 69937   Expand Danmark har talent   (2015) User Score Overview We don't have an overview translated in English. Help us expand our database by adding one. Discussions   Reviews Videos   Images   Changes Report Share Discussions General  0 Content Issues  0 Images Backdrops  4 Posters  1 Videos Trailers  0 Teasers  0 Clips  0 Featurettes  0 Opening Credits  0 Top Billed Cast Felix Schmidt V\u00e6rt Christopher L\u00e6ss\u00f8 V\u00e6rt Peter Fr\u00f6din Dommer Jarl Friis-Mikkelsen Dommer Cecilie Lassen Dommer Full Cast & Crew Current Season Season 4 2018 | 12 Episodes Season 4 of Danmark har talent premiered on January 20, 2018. View All Seasons Social Reviews  0 Discussions  0 Media Most Popular Videos  0 Backdrops  4 Posters  1 Recommendations We don't have enough data to suggest any TV shows based on Danmark har talent. You can help by rating TV shows you've seen. Facts Status  Returning Series Network Certification  - Type  Reality Original Language  Danish Runtime  60m Homepage   http://tv.tv2.dk/danmark-har-talent Genres Family Reality Keywords No keywords have been added. Content Score 86 Almost there... Top Contributors 53 Mads 2 Banana TB 2 TMDb Bot 1 Kecla  View Edit History Popularity Trend  Login to edit  URL By  signing up  for an account on TMDb, you can post directly to Twitter and Facebook. You need to be logged in to continue. Click  here  to login or  here  to sign up.    page_wrap opened in html_head  Join the Community The Basics About TMDb Contact Us Support Forums API Blog Get Involved  Contribution Bible 3rd Party Applications Add New Movie Add New TV Show Community Guidelines Leaderboard Forums Twitter Facebook Legal Terms of Use Privacy Policy Login Sign Up"}