{"link": "https://www.themoviedb.org/tv/2215?language=en", "title": "Monarch of the Glen", "resume": "Archie MacDonald, a young restaurateur is called back to his childhood home of Glenbogle where he is told he is the new Laird of Glenbogle.", "rate": 71, "genre": ["Drama", "Comedy"], "cast": ["Alastair Mackenzie", "Richard Briers", "Dawn Steele", "Alexander Morton", "Susan Hampshire"], "character": ["Archie MacDonald", "Golly Mackenzie"], "site_data": "html Apps Forums Leaderboard Contribute API Support Discover Movies TV Shows Movies Popular Top Rated Upcoming Now Playing TV Shows Popular Top Rated On TV Airing Today People Popular People Can't find a movie or TV show? Login to create it. en Login Sign Up  ID: 2215   Expand Monarch of the Glen   (2000) User Score Overview Archie MacDonald, a young restaurateur is called back to his childhood home of Glenbogle where he is told he is the new Laird of Glenbogle. Featured Crew Michael Chaplin Creator Discussions   Reviews Videos   Images   Changes Report Share Discussions General  0 Content Issues  0 Images Backdrops  3 Posters  3 Videos Trailers  0 Teasers  0 Clips  0 Featurettes  0 Opening Credits  0 Top Billed Cast Alastair Mackenzie Archie MacDonald Richard Briers Dawn Steele Alexander Morton Golly Mackenzie Susan Hampshire Full Cast & Crew Last Season Season 7 2005 | 6 Episodes Season 7 of Monarch of the Glen premiered on September 18, 2005. View All Seasons Social Reviews  0 Discussions  0 Media Most Popular Videos  0 Backdrops  3 Posters  3 Recommendations   1996-02-11 Ballykissangel 6.2    1990-10-29 Keeping Up Appearances 7.4  Facts Status  Ended Network Certification  - Type  Scripted Original Language  English Runtime  60m Homepage   https://www.bbc.co.uk/programmes/p00tky0j Genres Drama Comedy Keywords No keywords have been added. Content Score 93 Almost there... Top Contributors 4 kcdh 3 Elizabeth Jennings R 3 Rebecca B 1 BWYoda  View Edit History Popularity Trend  Login to edit  URL By  signing up  for an account on TMDb, you can post directly to Twitter and Facebook. You need to be logged in to continue. Click  here  to login or  here  to sign up.    page_wrap opened in html_head  Join the Community The Basics About TMDb Contact Us Support Forums API Blog Get Involved  Contribution Bible 3rd Party Applications Add New Movie Add New TV Show Community Guidelines Leaderboard Forums Twitter Facebook Legal Terms of Use Privacy Policy Login Sign Up"}