{"link": "https://www.themoviedb.org/tv/62139?language=en", "title": "First Human Gatorus", "resume": "A comedy about the wacky adventures of Giatrus and his tribe of the first human beings on the planet.", "rate": 0, "genre": ["Animation", "Comedy"], "cast": ["Y\u00fbko Maruyama", "Keiko Hanagata", "Kazuya Tatekabe", "Rihoko Yoshida", "Kaneta Kimotsuki"], "character": ["Gon", "Mam", "Dotechin", "Piko", "Dad"], "site_data": "html Apps Forums Leaderboard Contribute API Support Discover Movies TV Shows Movies Popular Top Rated Upcoming Now Playing TV Shows Popular Top Rated On TV Airing Today People Popular People Can't find a movie or TV show? Login to create it. en Login Sign Up  ID: 62139   Expand First Human Gatorus   (1974) User Score Overview A comedy about the wacky adventures of Giatrus and his tribe of the first human beings on the planet.  Featured Crew Shunji Sonoyama Creator Discussions   Reviews Videos   Images   Changes Report Share Discussions General  0 Content Issues  0 Images Backdrops  0 Posters  1 Videos Trailers  0 Teasers  0 Clips  0 Featurettes  0 Opening Credits  0 Top Billed Cast Y\u00fbko Maruyama Gon Keiko Hanagata Mam Kazuya Tatekabe Dotechin Rihoko Yoshida Piko Kaneta Kimotsuki Dad Full Cast & Crew Last Season Season 1 1974 | 134 Episodes Season 1 of First Human Gatorus premiered on October  5, 1974. View All Seasons Social Reviews  0 Discussions  0 Media Most Popular Videos  0 Backdrops  0 Posters  1 Recommendations We don't have enough data to suggest any TV shows based on First Human Gatorus. You can help by rating TV shows you've seen. Facts Original Name  \u306f\u3058\u3081\u4eba\u9593\u30ae\u30e3\u30fc\u30c8\u30eb\u30ba Status  Returning Series Network Certification  - Type  Scripted Original Language  Japanese Runtime  30m Homepage  - Genres Animation Comedy Keywords No keywords have been added. Content Score 86 Almost there... Top Contributors 23 kappa-papa 13 Elizabeth Jennings 5 BlackDelivery 2 Wong  View Edit History Popularity Trend  Login to edit  URL By  signing up  for an account on TMDb, you can post directly to Twitter and Facebook. You need to be logged in to continue. Click  here  to login or  here  to sign up.    page_wrap opened in html_head  Join the Community The Basics About TMDb Contact Us Support Forums API Blog Get Involved  Contribution Bible 3rd Party Applications Add New Movie Add New TV Show Community Guidelines Leaderboard Forums Twitter Facebook Legal Terms of Use Privacy Policy Login Sign Up"}