{"link": "https://www.themoviedb.org/tv/67744?language=en", "title": "Mindhunter", "resume": "An agent in the FBI's Elite Serial Crime Unit develops profiling techniques as he pursues notorious serial killers and rapists.", "rate": 74, "genre": ["Drama", "Crime"], "cast": ["Jonathan Groff", "Holt McCallany", "Hannah Gross", "Sonny Valicenti", "Anna Torv"], "character": ["Holden Ford", "Bill Tench", "Debbie Mitford", "ADT Serviceman", "Wendy Carr"], "site_data": "html Apps Forums Leaderboard Contribute API Support Discover Movies TV Shows Movies Popular Top Rated Upcoming Now Playing TV Shows Popular Top Rated On TV Airing Today People Popular People Can't find a movie or TV show? Login to create it. en Login Sign Up  ID: 67744   Expand Mindhunter   (2017) User Score  Play Trailer Overview An agent in the FBI's Elite Serial Crime Unit develops profiling techniques as he pursues notorious serial killers and rapists. Featured Crew Joe Penhall Creator Discussions   Reviews Videos   Images   Changes Report Share Discussions General  5 Content Issues  2 Images Backdrops  5 Posters  11 Videos Trailers  1 Teasers  0 Clips  0 Featurettes  0 Opening Credits  0 Top Billed Cast Jonathan Groff Holden Ford Holt McCallany Bill Tench Hannah Gross Debbie Mitford Sonny Valicenti ADT Serviceman Anna Torv Wendy Carr Full Cast & Crew Current Season Season 1 2017 | 10 Episodes Season 1 of Mindhunter premiered on October 13, 2017. View All Seasons Social Reviews  0 Discussions  7 Subject Status Replies Last Reply The relationship Open 1 by  Anna Best series I've seen in a long time. Open 13 by  J J the tape new agent was listening to Open 0 by J\n      \n     Go to Discussions Media Most Popular Videos  1 Backdrops  5 Posters  11 Recommendations   2017-07-21 Ozark 8.0    2017-12-01 Dark 7.9    2017-11-17 Marvel's The Punisher 8.0    2016-07-15 Stranger Things 8.4    2017-08-01 Manhunt: Unabomber 7.8    2017-08-18 Marvel's The Defenders 7.1    2011-12-04 Black Mirror 8.2    2017-03-17 Marvel's Iron Fist 6.1  Facts Status  Returning Series Network Certification TV-MA Meaning This program is specifically designed to be viewed by adults and therefore may be unsuitable for children under 17 Type  Scripted Original Language  English Runtime  60m Homepage   https://www.netflix.com/title/80114855 Genres Drama Crime Keywords psychopath 1970s fbi psychology thriller serial killer murderer rapist police investigation Content Score 100 Yes! Looking good! Top Contributors 62 Elizabeth Jennings c 23 ctchim TB 20 TMDb Bot t 18 tmdb48730457  View Edit History Popularity Trend  Login to edit  URL By  signing up  for an account on TMDb, you can post directly to Twitter and Facebook. You need to be logged in to continue. Click  here  to login or  here  to sign up.    page_wrap opened in html_head  Join the Community The Basics About TMDb Contact Us Support Forums API Blog Get Involved  Contribution Bible 3rd Party Applications Add New Movie Add New TV Show Community Guidelines Leaderboard Forums Twitter Facebook Legal Terms of Use Privacy Policy Login Sign Up"}