{"link": "https://www.themoviedb.org/tv/77304?language=en", "title": "8th Day", "resume": "We don't have an overview translated in English. Help us expand our database by adding one.", "rate": 70, "genre": ["Drama", "Mystery"], "cast": ["Burcu Biricik", "Musa Uzunlar", "Bu\u011fra G\u00fclsoy", "Cem Davran", "Ceyda D\u00fcvenci"], "character": ["Bahar"], "site_data": "html Apps Forums Leaderboard Contribute API Support Discover Movies TV Shows Movies Popular Top Rated Upcoming Now Playing TV Shows Popular Top Rated On TV Airing Today People Popular People Can't find a movie or TV show? Login to create it. en Login Sign Up  ID: 77304   Expand 8th Day   (2018) User Score Overview We don't have an overview translated in English. Help us expand our database by adding one. Featured Crew Kerem Catay Creator Discussions   Reviews Videos   Images   Changes Report Share Discussions General  0 Content Issues  0 Images Backdrops  1 Posters  1 Videos Trailers  0 Teasers  0 Clips  0 Featurettes  0 Opening Credits  0 Top Billed Cast Burcu Biricik Bahar Musa Uzunlar Bu\u011fra G\u00fclsoy Cem Davran Ceyda D\u00fcvenci Full Cast & Crew Current Season Season 1 2018 | 6 Episodes Season 1 of 8th Day premiered on March 19, 2018. View All Seasons Social Reviews  0 Discussions  0 Media Most Popular Videos  0 Backdrops  1 Posters  1 Recommendations We don't have enough data to suggest any TV shows based on 8th Day. You can help by rating TV shows you've seen. Facts Original Name  8. G\u00fcn Status  Returning Series Networks Certification  - Type  Scripted Original Language  Turkish Runtime  110m Homepage   http://ayyapim.com/diziler/index.html?page=1 Genres Drama Mystery Keywords No keywords have been added. Content Score 93 Almost there... Top Contributors 44 purplelammashta 5 sinefil 5 Elizabeth Jennings TB 1 TMDb Bot  View Edit History Popularity Trend  Login to edit  URL By  signing up  for an account on TMDb, you can post directly to Twitter and Facebook. You need to be logged in to continue. Click  here  to login or  here  to sign up.    page_wrap opened in html_head  Join the Community The Basics About TMDb Contact Us Support Forums API Blog Get Involved  Contribution Bible 3rd Party Applications Add New Movie Add New TV Show Community Guidelines Leaderboard Forums Twitter Facebook Legal Terms of Use Privacy Policy Login Sign Up"}