{"link": "https://www.themoviedb.org/tv/62579?language=en", "title": "Jet Lag", "resume": "We don't have an overview translated in English. Help us expand our database by adding one.", "rate": 0, "genre": ["Comedy"], "cast": ["Carme Pla", "Marta P\u00e9rez", "\u00c0gata Roca", "M\u00edriam Iscla", "Mamen Duch"], "character": ["S\u00edlvia", "Esther", "Mariona", "Diana", "Carla"], "site_data": "html Apps Forums Leaderboard Contribute API Support Discover Movies TV Shows Movies Popular Top Rated Upcoming Now Playing TV Shows Popular Top Rated On TV Airing Today People Popular People Can't find a movie or TV show? Login to create it. en Login Sign Up  ID: 62579   Expand Jet Lag   (2001) User Score Overview We don't have an overview translated in English. Help us expand our database by adding one. Featured Crew T de teatre Creator Cesc Gay Creator Discussions   Reviews Videos   Images   Changes Report Share Discussions General  0 Content Issues  0 Images Backdrops  0 Posters  1 Videos Trailers  0 Teasers  0 Clips  0 Featurettes  0 Opening Credits  0 Top Billed Cast Carme Pla S\u00edlvia Marta P\u00e9rez Esther \u00c0gata Roca Mariona M\u00edriam Iscla Diana Mamen Duch Carla Full Cast & Crew Last Season Season 6 2006 | 16 Episodes Season 6 of Jet Lag premiered on February 19, 2006. View All Seasons Social Reviews  0 Discussions  0 Media Most Popular Videos  0 Backdrops  0 Posters  1 Recommendations We don't have enough data to suggest any TV shows based on Jet Lag. You can help by rating TV shows you've seen. Facts Status  Ended Network Certification  - Type  Scripted Original Language  Catalan; Valencian Runtime  32m, 30m, 31m Homepage   http://www.ccma.cat/tv3/alacarta/jet-lag/fitxa-programa/145862884/ Genres Comedy Keywords stewardess roommate apartment group of friends flight attendant Content Score 71 Just a little bit more... Top Contributors 47 prm96 TB 4 TMDb Bot 4 Elizabeth Jennings 1 United600  View Edit History Popularity Trend  Login to edit  URL By  signing up  for an account on TMDb, you can post directly to Twitter and Facebook. You need to be logged in to continue. Click  here  to login or  here  to sign up.    page_wrap opened in html_head  Join the Community The Basics About TMDb Contact Us Support Forums API Blog Get Involved  Contribution Bible 3rd Party Applications Add New Movie Add New TV Show Community Guidelines Leaderboard Forums Twitter Facebook Legal Terms of Use Privacy Policy Login Sign Up"}