{"link": "https://www.themoviedb.org/tv/69382?language=en", "title": "Sv\u011bt pod hlavou", "resume": "We don't have an overview translated in English. Help us expand our database by adding one.", "rate": 90, "genre": ["Drama", "Mystery"], "cast": ["V\u00e1clav Neu\u017eil", "Ivan Trojan", "Judit B\u00e1rdos", "Jan Buda\u0159", "V\u00e1clav Kopta"], "character": ["Filip Marvan", "npor. Martin Plach\u00fd", "Krist\u00fdna \u010c\u00e1slavov\u00e1", "npor. Klement Krat\u011bna", "mjr. Alois \u0160palek"], "site_data": "html Apps Forums Leaderboard Contribute API Support Discover Movies TV Shows Movies Popular Top Rated Upcoming Now Playing TV Shows Popular Top Rated On TV Airing Today People Popular People Can't find a movie or TV show? Login to create it. en Login Sign Up  ID: 69382   Expand Sv\u011bt pod hlavou   (2017) User Score Overview We don't have an overview translated in English. Help us expand our database by adding one. Discussions   Reviews Videos   Images   Changes Report Share Discussions General  0 Content Issues  0 Images Backdrops  13 Posters  1 Videos Trailers  0 Teasers  0 Clips  0 Featurettes  0 Opening Credits  0 Top Billed Cast V\u00e1clav Neu\u017eil Filip Marvan Ivan Trojan npor. Martin Plach\u00fd Judit B\u00e1rdos Krist\u00fdna \u010c\u00e1slavov\u00e1 Jan Buda\u0159 npor. Klement Krat\u011bna V\u00e1clav Kopta mjr. Alois \u0160palek Full Cast & Crew Last Season Season 1 2017 | 10 Episodes Season 1 of Sv\u011bt pod hlavou premiered on January  2, 2017. View All Seasons Social Reviews  0 Discussions  0 Media Most Popular Videos  0 Backdrops  13 Posters  1 Recommendations We don't have enough data to suggest any TV shows based on Sv\u011bt pod hlavou. You can help by rating TV shows you've seen. Facts Status  Returning Series Networks Certification 18 Meaning Content exclusively for adults. Type  Scripted Original Language  Czech Runtime  55m Homepage   http://www.ceskatelevize.cz/porady/10817389461-svet-pod-hlavou/ Genres Drama Mystery Keywords police time travel czechoslovakia communism Content Score 79 Pump it up! We're close now. Top Contributors 48 CzechMira 15 AyACZE 6 Elizabeth Jennings 2 mihulik  View Edit History Popularity Trend  Login to edit  URL By  signing up  for an account on TMDb, you can post directly to Twitter and Facebook. You need to be logged in to continue. Click  here  to login or  here  to sign up.    page_wrap opened in html_head  Join the Community The Basics About TMDb Contact Us Support Forums API Blog Get Involved  Contribution Bible 3rd Party Applications Add New Movie Add New TV Show Community Guidelines Leaderboard Forums Twitter Facebook Legal Terms of Use Privacy Policy Login Sign Up"}