{"link": "https://www.themoviedb.org/tv/70513?language=en", "title": "Salvation", "resume": "An MIT grad student and a tech superstar bring a low-level Pentagon official a staggering discovery that an asteroid is just six months away from colliding with Earth.", "rate": 65, "genre": ["Drama", "Sci-Fi", "Fantasy"], "cast": ["Santiago Cabrera", "Jennifer Finnigan", "Charlie Rowe", "Jacqueline Byers", "Ian Anthony Dale"], "character": ["Darius Tanz", "Grace Barrows", "Liam Cole", "Jillian Hayes", "Harris Anders"], "site_data": "html Apps Forums Leaderboard Contribute API Support Discover Movies TV Shows Movies Popular Top Rated Upcoming Now Playing TV Shows Popular Top Rated On TV Airing Today People Popular People Can't find a movie or TV show? Login to create it. en Login Sign Up  ID: 70513   Expand Salvation   (2017) User Score  Play Trailer Overview An MIT grad student and a tech superstar bring a low-level Pentagon official a staggering discovery that an asteroid is just six months away from colliding with Earth. Featured Crew Matt JL Wheeler Creator Elizabeth Kruger Creator Craig Shapiro Creator Discussions   Reviews Videos   Images   Changes Report Share Discussions General  12 Content Issues  0 Images Backdrops  5 Posters  4 Videos Trailers  2 Teasers  0 Clips  0 Featurettes  0 Opening Credits  0 Top Billed Cast Santiago Cabrera Darius Tanz Jennifer Finnigan Grace Barrows Charlie Rowe Liam Cole Jacqueline Byers Jillian Hayes Ian Anthony Dale Harris Anders Full Cast & Crew Current Season Season 2 2018 | 2 Episodes View All Seasons Social Reviews  0 Discussions  12 Subject Status Replies Last Reply I still enjoyed it but... Open 4 by  Knixon T This show is terrible. Open 5 by  Patrick E. Abe jr Why do the \"Bad Guys\" want to screw up the mission?  Suicidal? Open 1 by  Je_suis_le_vampire_Lestat Go to Discussions Media Most Popular Videos  2 Backdrops  5 Posters  4 Recommendations   2017-10-02 The Gifted 7.0    2016-10-03 Timeless 7.0    2017-09-25 The Brave 6.6    2017-10-01 Ten Days in the Valley 6.0    2017-10-01 Ghosted 6.2    2016-09-27 Aftermath 6.1    2017-11-21 Marvel's Runaways 7.3    2016-09-23 Van Helsing 5.6  Facts Status  Returning Series Network Certification TV-14 Meaning This program contains some material that many parents would find unsuitable for children under 14 years of age. Type  Scripted Original Language  English Runtime  45m, 43m Homepage   http://www.cbs.com/shows/salvation/ Genres Drama Sci-Fi & Fantasy Keywords asteroid end of the world conspiracy apocalypse Content Score 100 Yes! Looking good! Top Contributors 35 Warpath 32 Banana VA 18 Viktor Andersson 12 Elizabeth Jennings  View Edit History Popularity Trend  Login to edit  URL By  signing up  for an account on TMDb, you can post directly to Twitter and Facebook. You need to be logged in to continue. Click  here  to login or  here  to sign up.    page_wrap opened in html_head  Join the Community The Basics About TMDb Contact Us Support Forums API Blog Get Involved  Contribution Bible 3rd Party Applications Add New Movie Add New TV Show Community Guidelines Leaderboard Forums Twitter Facebook Legal Terms of Use Privacy Policy Login Sign Up"}