{"link": "https://www.themoviedb.org/tv/58703?language=en", "title": "David Attenborough's Natural Curiosities", "resume": "Sir David shines the spotlight on some of nature\u2019s evolutionary anomalies and reveals how these curious animals continue to baffle and fascinate.", "rate": 68, "genre": ["Documentary"], "cast": ["David Attenborough"], "character": ["Himself - Presenter"], "site_data": "html Apps Forums Leaderboard Contribute API Support Discover Movies TV Shows Movies Popular Top Rated Upcoming Now Playing TV Shows Popular Top Rated On TV Airing Today People Popular People Can't find a movie or TV show? Login to create it. en Login Sign Up  ID: 58703   Expand David Attenborough's Natural Curiosities   (2013) User Score  Play Trailer Overview Sir David shines the spotlight on some of nature\u2019s evolutionary anomalies and reveals how these curious animals continue to baffle and fascinate. Featured Crew David Attenborough Creator Discussions   Reviews Videos   Images   Changes Report Share Discussions General  0 Content Issues  0 Images Backdrops  3 Posters  1 Videos Trailers  1 Teasers  0 Clips  0 Featurettes  0 Opening Credits  0 Top Billed Cast David Attenborough Himself - Presenter Full Cast & Crew Last Season Season 4 2017 | 6 Episodes Season 4 of David Attenborough's Natural Curiosities premiered on June 11, 2017. View All Seasons Social Reviews  0 Discussions  0 Media Most Popular Videos  1 Backdrops  3 Posters  1 Recommendations   2016-03-21 72 Dangerous Places to Live 6.0  Facts Status  Returning Series Networks Certification  - Type  Documentary Original Language  English Runtime  30m Homepage   http://watch.uktv.co.uk/shows/david-attenboroughs-natural-curiosities/ Genres Documentary Keywords nature evolution Content Score 71 Just a little bit more... Top Contributors 24 Elizabeth Jennings E 6 Eric d 5 domdom a 4 asusar  View Edit History Popularity Trend  Login to edit  URL By  signing up  for an account on TMDb, you can post directly to Twitter and Facebook. You need to be logged in to continue. Click  here  to login or  here  to sign up.    page_wrap opened in html_head  Join the Community The Basics About TMDb Contact Us Support Forums API Blog Get Involved  Contribution Bible 3rd Party Applications Add New Movie Add New TV Show Community Guidelines Leaderboard Forums Twitter Facebook Legal Terms of Use Privacy Policy Login Sign Up"}