{"link": "https://www.themoviedb.org/tv/34594?language=en", "title": "Enlightened", "resume": "Enlightened follows the story of Amy, a self-destructive executive, who, after a very public breakdown and a subsequent philosophical awakening in rehabilitation, tries to get her life back together.", "rate": null, "genre": ["Comedy", "Drama"], "cast": ["Laura Dern", "Mike White", "Luke Wilson", "Timm Sharp", "Diane Ladd"], "site_data": "html Apps Forums Leaderboard Contribute API Support Discover Movies TV Shows Movies Popular Top Rated Upcoming Now Playing TV Shows Popular Top Rated On TV Airing Today People Popular People Can't find a movie or TV show? Login to create it. en Login Sign Up  ID: 34594   Expand Enlightened   (2011) User Score  Play Trailer Overview Enlightened follows the story of Amy, a self-destructive executive, who, after a very public breakdown and a subsequent philosophical awakening in rehabilitation, tries to get her life back together. Featured Crew Mike White Creator Laura Dern Creator Discussions   Reviews Videos   Images   Changes Report Share Discussions General  0 Content Issues  2 Images Backdrops  5 Posters  7 Videos Trailers  1 Teasers  0 Clips  0 Featurettes  0 Opening Credits  0 Top Billed Cast Laura Dern Amy Jellicoe Mike White Tyler Luke Wilson Levi Callow Timm Sharp Dougie Daniels Diane Ladd Helen Jellicoe Full Cast & Crew Last Season Season 2 2013 | 8 Episodes Season 2 of Enlightened premiered on January 13, 2013. View All Seasons Social Reviews  0 Discussions  2 Subject Status Replies Last Reply There are no discussions for Enlightened. Login to be first! Go to Discussions Media Most Popular Videos  1 Backdrops  5 Posters  7 Recommendations   1996-09-20 Clueless 5.4    2010-02-14 How to Make It in America 7.6    2006-03-12 Big Love 7.6    2005-06-05 The Comeback 7.6    2009-06-08 Nurse Jackie 7.2    2015-10-27 Wicked City 5.4    2009-01-18 United States of Tara 7.3    2010-04-11 Treme 8.1  Facts Status  Cancelled Network Certification  - Type  Scripted Original Language  English Runtime  - Homepage   http://www.hbo.com/enlightened Genres Comedy Drama Keywords depression self-destruction mental disorders Content Score 100 Yes! Looking good! Top Contributors 20 dbowman 14 Elizabeth Jennings 12 Banana R 8 Rebecca  View Edit History Popularity Trend  Login to edit  URL By  signing up  for an account on TMDb, you can post directly to Twitter and Facebook. You need to be logged in to continue. Click  here  to login or  here  to sign up.    page_wrap opened in html_head  Join the Community The Basics About TMDb Contact Us Support Forums API Blog Get Involved  Contribution Bible 3rd Party Applications Add New Movie Add New TV Show Community Guidelines Leaderboard Forums Twitter Facebook Legal Terms of Use Privacy Policy Login Sign Up", "character": ["Amy Jellicoe", "Tyler", "Levi Callow", "Dougie Daniels", "Helen Jellicoe"]}