{"link": "https://www.themoviedb.org/tv/62461?language=en", "title": "Ex-Girlfriend Club", "resume": "A popular webtoon writer writes about his ex-girlfriends. While his webtoon is being made into a movie, he meets a female film producer.", "rate": null, "genre": ["Comedy", "Romance"], "cast": ["Byun Yo-han", "Song Ji-hyo", "Lee Yoon-ji", "Ryu Hwa-Young", "Do Sang-woo"], "site_data": "html Apps Forums Leaderboard Contribute API Support Discover Movies TV Shows Movies Popular Top Rated Upcoming Now Playing TV Shows Popular Top Rated On TV Airing Today People Popular People Can't find a movie or TV show? Login to create it. en Login Sign Up  ID: 62461   Expand Ex-Girlfriend Club   (2015) User Score Overview A popular webtoon writer writes about his ex-girlfriends. While his webtoon is being made into a movie, he meets a female film producer. Discussions   Reviews Videos   Images   Changes Report Share Discussions General  0 Content Issues  0 Images Backdrops  3 Posters  4 Videos Trailers  0 Teasers  0 Clips  0 Featurettes  0 Opening Credits  0 Top Billed Cast Byun Yo-han Bang Myung-soo Song Ji-hyo Kim Soo-jin Lee Yoon-ji Jang Hwa-young Ryu Hwa-Young Rara Do Sang-woo Jo Gun Full Cast & Crew Last Season Season 1 2015 | 12 Episodes Season 1 of Ex-Girlfriend Club premiered on May  8, 2015. View All Seasons Social Reviews  0 Discussions  0 Media Most Popular Videos  0 Backdrops  3 Posters  4 Recommendations   2016-11-04 Entourage 9.0    2014-02-09 Cheo Yong 7.4  Facts Original Name  \uad6c\uc5ec\uce5c\ud074\ub7fd Status  Ended Network Certification  - Type  Scripted Original Language  Korean Runtime  60m Homepage   http://program.interest.me/tvn/exgirlclub Genres Comedy Romance Keywords korea Content Score 86 Almost there... Top Contributors M 42 Maria180493 z 10 zurman1 3 lareina123 V 3 Violsa  View Edit History Popularity Trend  Login to edit  URL By  signing up  for an account on TMDb, you can post directly to Twitter and Facebook. You need to be logged in to continue. Click  here  to login or  here  to sign up.    page_wrap opened in html_head  Join the Community The Basics About TMDb Contact Us Support Forums API Blog Get Involved  Contribution Bible 3rd Party Applications Add New Movie Add New TV Show Community Guidelines Leaderboard Forums Twitter Facebook Legal Terms of Use Privacy Policy Login Sign Up", "character": ["Bang Myung-soo", "Kim Soo-jin", "Jang Hwa-young", "Rara", "Jo Gun"]}