{"link": "https://www.themoviedb.org/tv/17562?language=en", "title": "Rob Dyrdek's Fantasy Factory", "resume": "A crew of people come up with new things to do every week. One day, they may work on a business franchise. Another day, they might go and make someone ride a bull, or shoot burritos at people.", "rate": 83, "genre": ["Reality", "Comedy"], "cast": ["Chris Pfaff", "Rob Dyrdek", "Scott Pfaff", "Chelsea Chanel Dudley", "Christopher Boykin"], "character": ["Chris \"Drama\" Pfaff", "Himself", "Scott \"Big Cat\" Pfaff", "Chanel West Coast", "Big Black"], "site_data": "html Apps Forums Leaderboard Contribute API Support Discover Movies TV Shows Movies Popular Top Rated Upcoming Now Playing TV Shows Popular Top Rated On TV Airing Today People Popular People Can't find a movie or TV show? Login to create it. en Login Sign Up  ID: 17562   Expand Rob Dyrdek's Fantasy Factory   (2009) User Score Overview A crew of people come up with new things to do every week. One day, they may work on a business franchise. Another day, they might go and make someone ride a bull, or shoot burritos at people. Featured Crew Rob Dyrdek Creator Jeff Tremaine Creator Discussions   Reviews Videos   Images   Changes Report Share Discussions General  0 Content Issues  0 Images Backdrops  3 Posters  1 Videos Trailers  0 Teasers  0 Clips  0 Featurettes  0 Opening Credits  0 Top Billed Cast Chris Pfaff Chris \"Drama\" Pfaff Rob Dyrdek Himself Scott Pfaff Scott \"Big Cat\" Pfaff Chelsea Chanel Dudley Chanel West Coast Christopher Boykin Big Black Full Cast & Crew Last Season Season 7 2015 | 2 Episodes View All Seasons Social Reviews  0 Discussions  0 Media Most Popular Videos  0 Backdrops  3 Posters  1 Recommendations   2006-03-05 Numb3rs 6.5  Facts Status  Ended Network Certification  - Type  Reality Original Language  English Runtime  30m Homepage   http://www.mtv.com/shows/fantasy_factory/season_2/series.jhtml Genres Reality Comedy Keywords skateboarding Content Score 93 Almost there... Top Contributors 18 sxecash 8 Banana 2 Elizabeth Jennings 2 HomegrownHero  View Edit History Popularity Trend  Login to edit  URL By  signing up  for an account on TMDb, you can post directly to Twitter and Facebook. You need to be logged in to continue. Click  here  to login or  here  to sign up.    page_wrap opened in html_head  Join the Community The Basics About TMDb Contact Us Support Forums API Blog Get Involved  Contribution Bible 3rd Party Applications Add New Movie Add New TV Show Community Guidelines Leaderboard Forums Twitter Facebook Legal Terms of Use Privacy Policy Login Sign Up"}