{"link": "https://www.themoviedb.org/tv/78734?language=en", "title": "Amo", "resume": "Despite the Philippine government's crackdown on narcotics, high schooler Joseph expands his drug running while his cop uncle profits from corruption.", "rate": 50, "genre": ["Crime", "Drama"], "cast": ["Rhea Jai Fernandez", "Derek Ramsay", "Vince Rillon", "Allen Dizon", "Felix Roco"], "character": ["Cristina/Pilar", "Rodrigo Macaraeg", "Joseph Molina", "Camilo Molina", "Bino Campos"], "site_data": "html Apps Forums Leaderboard Contribute API Support Discover Movies TV Shows Movies Popular Top Rated Upcoming Now Playing TV Shows Popular Top Rated On TV Airing Today People Popular People Can't find a movie or TV show? Login to create it. en Login Sign Up  ID: 78734   Expand Amo   (2018) User Score  Play Trailer Overview Despite the Philippine government's crackdown on narcotics, high schooler Joseph expands his drug running while his cop uncle profits from corruption. Discussions   Reviews Videos   Images   Changes Report Share Discussions General  0 Content Issues  0 Images Backdrops  3 Posters  2 Videos Trailers  1 Teasers  0 Clips  0 Featurettes  0 Opening Credits  0 Top Billed Cast Rhea Jai Fernandez Cristina/Pilar Derek Ramsay Rodrigo Macaraeg Vince Rillon Joseph Molina Allen Dizon Camilo Molina Felix Roco Bino Campos Full Cast & Crew Current Season Season 1 2018 | 13 Episodes Season 1 of Amo premiered on April 10, 2018. View All Seasons Social Reviews  0 Discussions  0 Media Most Popular Videos  1 Backdrops  3 Posters  2 Recommendations We don't have enough data to suggest any TV shows based on Amo. You can help by rating TV shows you've seen. Facts Status  Returning Series Networks Kapatid TV5 Certification  - Type  Scripted Original Language  Tagalog Runtime  25m Homepage   https://www.netflix.com/title/80218962 Genres Crime Drama Keywords philippines corrupt agent narcotics Content Score 93 Almost there... Top Contributors E 19 Edytor G 15 Gon\u00e7alo MP 5 Mr. Peanutbutter  View Edit History Popularity Trend  Login to edit  URL By  signing up  for an account on TMDb, you can post directly to Twitter and Facebook. You need to be logged in to continue. Click  here  to login or  here  to sign up.    page_wrap opened in html_head  Join the Community The Basics About TMDb Contact Us Support Forums API Blog Get Involved  Contribution Bible 3rd Party Applications Add New Movie Add New TV Show Community Guidelines Leaderboard Forums Twitter Facebook Legal Terms of Use Privacy Policy Login Sign Up"}