{"link": "https://www.themoviedb.org/tv/63361?language=en", "title": "Bibi Blocksberg", "resume": "We don't have an overview translated in English. Help us expand our database by adding one.", "rate": 60, "genre": ["Animation"], "cast": ["Susanna Bonas\u00e9wicz"], "character": ["Bibi Blocksberg (Stimme)"], "site_data": "html Apps Forums Leaderboard Contribute API Support Discover Movies TV Shows Movies Popular Top Rated Upcoming Now Playing TV Shows Popular Top Rated On TV Airing Today People Popular People Can't find a movie or TV show? Login to create it. en Login Sign Up  ID: 63361   Expand Bibi Blocksberg   (1994) User Score Overview We don't have an overview translated in English. Help us expand our database by adding one. Discussions   Reviews Videos   Images   Changes Report Share Discussions General  0 Content Issues  0 Images Backdrops  1 Posters  1 Videos Trailers  0 Teasers  0 Clips  0 Featurettes  0 Opening Credits  0 Top Billed Cast Susanna Bonas\u00e9wicz Bibi Blocksberg (Stimme) Full Cast & Crew Last Season Season 4 2012 | 13 Episodes Season 4 of Bibi Blocksberg premiered on August 26, 2012. View All Seasons Social Reviews  0 Discussions  0 Media Most Popular Videos  0 Backdrops  1 Posters  1 Recommendations We don't have enough data to suggest any TV shows based on Bibi Blocksberg. You can help by rating TV shows you've seen. Facts Status  Ended Network Certification  - Type  Scripted Original Language  German Runtime  25m Homepage   http://www.bibiblocksberg.de/ Genres Animation Keywords No keywords have been added. Content Score 50 Still needs a little work. Top Contributors S 14 Samara R 13 Raabi2208 S 2 Sling2009  View Edit History Popularity Trend  Login to edit  URL By  signing up  for an account on TMDb, you can post directly to Twitter and Facebook. You need to be logged in to continue. Click  here  to login or  here  to sign up.    page_wrap opened in html_head  Join the Community The Basics About TMDb Contact Us Support Forums API Blog Get Involved  Contribution Bible 3rd Party Applications Add New Movie Add New TV Show Community Guidelines Leaderboard Forums Twitter Facebook Legal Terms of Use Privacy Policy Login Sign Up"}