{"link": "https://www.themoviedb.org/tv/67596?language=en", "title": "L\u2019imposteur", "resume": "We don't have an overview translated in English. Help us expand our database by adding one.", "rate": 48, "genre": ["Drama"], "cast": ["Marc-Andr\u00e9 Grondin", "Sophie Desmarais", "Guillaume Cyr", "\u00c9milie Bibeau", "Francine Ruel"], "character": ["Philippe", "Ga\u00efa", "\u00c9ric", "Marie-Pier", "Louise"], "site_data": "html Apps Forums Leaderboard Contribute API Support Discover Movies TV Shows Movies Popular Top Rated Upcoming Now Playing TV Shows Popular Top Rated On TV Airing Today People Popular People Can't find a movie or TV show? Login to create it. en Login Sign Up  ID: 67596   Expand L\u2019imposteur   (2016) User Score Overview We don't have an overview translated in English. Help us expand our database by adding one. Discussions   Reviews Videos   Images   Changes Report Share Discussions General  0 Content Issues  0 Images Backdrops  0 Posters  1 Videos Trailers  0 Teasers  0 Clips  0 Featurettes  0 Opening Credits  0 Top Billed Cast Marc-Andr\u00e9 Grondin Philippe Sophie Desmarais Ga\u00efa Guillaume Cyr \u00c9ric \u00c9milie Bibeau Marie-Pier Francine Ruel Louise Full Cast & Crew Last Season Season 2 2017 | 10 Episodes Season 2 of L\u2019imposteur premiered on September 10, 2017. View All Seasons Social Reviews  0 Discussions  0 Media Most Popular Videos  0 Backdrops  0 Posters  1 Recommendations We don't have enough data to suggest any TV shows based on L\u2019imposteur. You can help by rating TV shows you've seen. Facts Status  Ended Network Certification C8 Meaning Suitable for children ages 8+. Low level violence and fantasy horror is allowed. No foul language is allowed, but occasional \"socially offensive and discriminatory\" language is allowed if in the context of the story. No sexual content of any level allowed. Type  Scripted Original Language  French Runtime  47m Homepage   http://imposteur.ca Genres Drama Keywords impostor ex-con Content Score 64 We're so close, yet so far. Top Contributors 52 Banana 7 Guipat B 5 BelDave69 2 Lewis  View Edit History Popularity Trend  Login to edit  URL By  signing up  for an account on TMDb, you can post directly to Twitter and Facebook. You need to be logged in to continue. Click  here  to login or  here  to sign up.    page_wrap opened in html_head  Join the Community The Basics About TMDb Contact Us Support Forums API Blog Get Involved  Contribution Bible 3rd Party Applications Add New Movie Add New TV Show Community Guidelines Leaderboard Forums Twitter Facebook Legal Terms of Use Privacy Policy Login Sign Up"}