{"link": "https://www.themoviedb.org/tv/76661?language=en", "title": "Mehmet\u00e7ik K\u00fbtulam\u00e2re", "resume": "The legendary story of Mehmet and his friends in the Ottoman state.", "rate": 97, "genre": ["Action", "Adventure"], "cast": ["\u0130smail Ege \u015ea\u015fmaz", "Emre Ba\u015fer", "Bahad\u0131r Benjamin Bing\u00f6l", "Bahattin Do\u011fan", "U\u011fur Karabulut"], "character": ["Mehmet", "Cabir", "Niyazi"], "site_data": "html Apps Forums Leaderboard Contribute API Support Discover Movies TV Shows Movies Popular Top Rated Upcoming Now Playing TV Shows Popular Top Rated On TV Airing Today People Popular People Can't find a movie or TV show? Login to create it. en Login Sign Up  ID: 76661   Expand Mehmet\u00e7ik K\u00fbtulam\u00e2re   (2018) User Score  Play Trailer Overview The legendary story of Mehmet and his friends in the Ottoman state. Featured Crew Mehmet Bozda\u011f Creator Discussions   Reviews Videos   Images   Changes Report Share Discussions General  0 Content Issues  0 Images Backdrops  4 Posters  2 Videos Trailers  1 Teasers  0 Clips  0 Featurettes  0 Opening Credits  0 Top Billed Cast \u0130smail Ege \u015ea\u015fmaz Mehmet Emre Ba\u015fer Bahad\u0131r Benjamin Bing\u00f6l Cabir Bahattin Do\u011fan U\u011fur Karabulut Niyazi Full Cast & Crew Current Season Season 1 2018 | 19 Episodes Season 1 of Mehmet\u00e7ik K\u00fbtulam\u00e2re premiered on January 18, 2018. View All Seasons Social Reviews  0 Discussions  0 Media Most Popular Videos  1 Backdrops  4 Posters  2 Recommendations We don't have enough data to suggest any TV shows based on Mehmet\u00e7ik K\u00fbtulam\u00e2re. You can help by rating TV shows you've seen. Facts Status  Returning Series Network Certification  - Type  Scripted Original Language  Turkish Runtime  150m Homepage   http://mehmetcikdizisi.com Genres Action & Adventure Keywords No keywords have been added. Content Score 100 Yes! Looking good! Top Contributors 92 saifo1999 8 moviefars 7 Elizabeth Jennings TB 1 TMDb Bot  View Edit History Popularity Trend  Login to edit  URL By  signing up  for an account on TMDb, you can post directly to Twitter and Facebook. You need to be logged in to continue. Click  here  to login or  here  to sign up.    page_wrap opened in html_head  Join the Community The Basics About TMDb Contact Us Support Forums API Blog Get Involved  Contribution Bible 3rd Party Applications Add New Movie Add New TV Show Community Guidelines Leaderboard Forums Twitter Facebook Legal Terms of Use Privacy Policy Login Sign Up"}