{"link": "https://www.themoviedb.org/tv/65806?language=en", "title": "Monster", "resume": "The story of a man who fights against greed, and experiences every hardship and adversity known to man in order to make something of himself and find love.", "rate": 79, "genre": ["Drama"], "cast": ["Kang Ji-hwan", "Sung Yu-ri", "Park Ki-Woong", "Claudia Kim", "Lee Gi-kwang"], "character": ["Lee Kook-Chul / Kang Ki-Tan", "Oh Soo-Yeon", "Do Gun-Woo", "Yoo Sung-Ae", "Lee Kook-Chul / Kang Ki-Tan (young)"], "site_data": "html Apps Forums Leaderboard Contribute API Support Discover Movies TV Shows Movies Popular Top Rated Upcoming Now Playing TV Shows Popular Top Rated On TV Airing Today People Popular People Can't find a movie or TV show? Login to create it. en Login Sign Up  ID: 65806   Expand Monster   (2016) User Score Overview The story of a man who fights against greed, and experiences every hardship and adversity known to man in order to make something of himself and find love. Featured Crew \uc774\uc8fc\ud658 Creator Discussions   Reviews Videos   Images   Changes Report Share Discussions General  0 Content Issues  0 Images Backdrops  3 Posters  2 Videos Trailers  0 Teasers  0 Clips  0 Featurettes  0 Opening Credits  0 Top Billed Cast Kang Ji-hwan Lee Kook-Chul / Kang Ki-Tan Sung Yu-ri Oh Soo-Yeon Park Ki-Woong Do Gun-Woo Claudia Kim Yoo Sung-Ae Lee Gi-kwang Lee Kook-Chul / Kang Ki-Tan (young) Full Cast & Crew Last Season Season 1 2016 | 50 Episodes Season 1 of Monster premiered on March 28, 2016. View All Seasons Social Reviews  0 Discussions  0 Media Most Popular Videos  0 Backdrops  3 Posters  2 Recommendations   2016-08-24 Jealousy Incarnate 7.4    2016-06-20 Doctors 5.8    2016-07-06 Uncontrollably Fond 5.8    2016-07-11 Bring It On, Ghost 6.9    2016-07-20 W: Two Worlds 7.8    2016-08-22 Love in the Moonlight 6.5  Facts Original Name  \ubaac\uc2a4\ud130 Status  Ended Network Certification 15 Meaning This rating is for programs that contain material that may be inappropriate for children under 15, and that parental discretion should be used. Examples include most dramas, and talk shows on OTA (over-the-air) TV (KBS, MBC, SBS), and many American TV shows/dramas on Cable TV channels like OCN and OnStyle. The programs that have this rating may include moderate or strong adult themes, language, sexual inference, and violence. As with the TV-MA rating in North America, this rating is commonly applied to live events where the occurrence of inappropriate dialogue is unpredictable. Since 2007, this rating is the most used rating for TV. Type  Scripted Original Language  Korean Runtime  60m Homepage   http://www.imbc.com/broad/tv/drama/monster/index.html Genres Drama Keywords korea Content Score 93 Almost there... Top Contributors M 53 Maria180493 k 5 kusungkyu z 5 zurman1 4 Farkas Tibor  View Edit History Popularity Trend  Login to edit  URL By  signing up  for an account on TMDb, you can post directly to Twitter and Facebook. You need to be logged in to continue. Click  here  to login or  here  to sign up.    page_wrap opened in html_head  Join the Community The Basics About TMDb Contact Us Support Forums API Blog Get Involved  Contribution Bible 3rd Party Applications Add New Movie Add New TV Show Community Guidelines Leaderboard Forums Twitter Facebook Legal Terms of Use Privacy Policy Login Sign Up"}