{"link": "https://www.themoviedb.org/tv/71440?language=en", "title": "Vade Retro", "resume": "We don't have an overview translated in English. Help us expand our database by adding one.", "rate": 0, "genre": ["Comedy"], "cast": ["Monica Iozzi", "Tony Ramos", "Maria Lu\u00edsa Mendon\u00e7a", "Maria Casadevall", "Juliano Cazarr\u00e9"], "character": ["Celeste", "Abel Zebu", "Lucy", "Lilith", "Davi"], "site_data": "html Apps Forums Leaderboard Contribute API Support Discover Movies TV Shows Movies Popular Top Rated Upcoming Now Playing TV Shows Popular Top Rated On TV Airing Today People Popular People Can't find a movie or TV show? Login to create it. en Login Sign Up  ID: 71440   Expand Vade Retro   (2017) User Score Overview We don't have an overview translated in English. Help us expand our database by adding one. Featured Crew Alexandre Machado Creator Fernanda Young Creator Discussions   Reviews Videos   Images   Changes Report Share Discussions General  0 Content Issues  0 Images Backdrops  1 Posters  1 Videos Trailers  0 Teasers  0 Clips  0 Featurettes  0 Opening Credits  0 Top Billed Cast Monica Iozzi Celeste Tony Ramos Abel Zebu Maria Lu\u00edsa Mendon\u00e7a Lucy Maria Casadevall Lilith Juliano Cazarr\u00e9 Davi Full Cast & Crew Last Season Season 1 2017 | 1 Episode Season 1 of Vade Retro premiered on April 20, 2017. View All Seasons Social Reviews  0 Discussions  0 Media Most Popular Videos  0 Backdrops  1 Posters  1 Recommendations We don't have enough data to suggest any TV shows based on Vade Retro. You can help by rating TV shows you've seen. Facts Status  Returning Series Network Certification 14 Meaning Content suitable for viewers over the age of 14. Type  Scripted Original Language  Portuguese Runtime  35m Homepage   http://gshow.globo.com/series/vade-retro/ Genres Comedy Keywords No keywords have been added. Content Score 93 Almost there... Top Contributors 31 lhalegria TB 2 TMDb Bot 1 macawlu  View Edit History Popularity Trend  Login to edit  URL By  signing up  for an account on TMDb, you can post directly to Twitter and Facebook. You need to be logged in to continue. Click  here  to login or  here  to sign up.    page_wrap opened in html_head  Join the Community The Basics About TMDb Contact Us Support Forums API Blog Get Involved  Contribution Bible 3rd Party Applications Add New Movie Add New TV Show Community Guidelines Leaderboard Forums Twitter Facebook Legal Terms of Use Privacy Policy Login Sign Up"}