{"link": "https://www.themoviedb.org/tv/71437?language=en", "title": "T@gged", "resume": "t@gged is a modern day thriller that explores the terrifying risks of social media in a world of anonymity.", "rate": 70, "genre": ["Drama"], "cast": ["Lulu Antariksa", "Lia Marie Johnson", "Katelyn Nacon", "Nick Fink", "Danielle Savre"], "character": ["Rowan", "Hailey", "Elisia", "Jake", "Ms. Dawson"], "site_data": "html Apps Forums Leaderboard Contribute API Support Discover Movies TV Shows Movies Popular Top Rated Upcoming Now Playing TV Shows Popular Top Rated On TV Airing Today People Popular People Can't find a movie or TV show? Login to create it. en Login Sign Up  ID: 71437   Expand T@gged   (2016) User Score  Play Trailer Overview t@gged is a modern day thriller that explores the terrifying risks of social media in a world of anonymity. Discussions   Reviews Videos   Images   Changes Report Share Discussions General  0 Content Issues  0 Images Backdrops  2 Posters  2 Videos Trailers  2 Teasers  0 Clips  0 Featurettes  0 Opening Credits  0 Top Billed Cast Lulu Antariksa Rowan Lia Marie Johnson Hailey Katelyn Nacon Elisia Nick Fink Jake Danielle Savre Ms. Dawson Full Cast & Crew Last Season Season 2 2017 | 12 Episodes Season 2 of T@gged premiered on May  9, 2017. View All Seasons Social Reviews  0 Discussions  0 Media Most Popular Videos  2 Backdrops  2 Posters  2 Recommendations We don't have enough data to suggest any TV shows based on T@gged. You can help by rating TV shows you've seen. Facts Status  Returning Series Network Certification TV-14 Meaning This program contains some material that many parents would find unsuitable for children under 14 years of age. Type  Scripted Original Language  English Runtime  23m Homepage   https://www.go90.com/shows/tagged Genres Drama Keywords thriller teenager Content Score 93 Almost there... Top Contributors 12 Molocow 12 Rafael Esberard 7 joeynotjoe s 5 speedycars  View Edit History Popularity Trend  Login to edit  URL By  signing up  for an account on TMDb, you can post directly to Twitter and Facebook. You need to be logged in to continue. Click  here  to login or  here  to sign up.    page_wrap opened in html_head  Join the Community The Basics About TMDb Contact Us Support Forums API Blog Get Involved  Contribution Bible 3rd Party Applications Add New Movie Add New TV Show Community Guidelines Leaderboard Forums Twitter Facebook Legal Terms of Use Privacy Policy Login Sign Up"}