{"link": "https://www.themoviedb.org/tv/77026?language=en", "title": "Sen Anlat Karadeniz", "resume": "We don't have an overview translated in English. Help us expand our database by adding one.", "rate": null, "genre": ["Family", "Action", "Adventure", "Reality"], "cast": ["\u00d6yk\u00fc G\u00fcrman", "\u00d6zg\u00fcr Biber", "Faruk Acar", "Faruk Acar", "\u0130rem Helvac\u0131o\u011flu"], "site_data": "html Apps Forums Leaderboard Contribute API Support Discover Movies TV Shows Movies Popular Top Rated Upcoming Now Playing TV Shows Popular Top Rated On TV Airing Today People Popular People Can't find a movie or TV show? Login to create it. en Login Sign Up  ID: 77026   Expand Sen Anlat Karadeniz   (2018) User Score Overview We don't have an overview translated in English. Help us expand our database by adding one. Featured Crew Emre Kabaku\u015fak Creator Osman S\u0131nav Creator Yusuf \u00d6mer S\u0131nav Creator Discussions   Reviews Videos   Images   Changes Report Share Discussions General  0 Content Issues  0 Images Backdrops  1 Posters  2 Videos Trailers  0 Teasers  0 Clips  0 Featurettes  0 Opening Credits  0 Top Billed Cast \u00d6yk\u00fc G\u00fcrman Asiye Kaleli \u00d6zg\u00fcr Biber B\u00fclent Faruk Acar Necip Faruk Acar \u0130rem Helvac\u0131o\u011flu Nefes Zorlu Full Cast & Crew Current Season Season 1 2018 | 15 Episodes Season 1 of Sen Anlat Karadeniz premiered on January 24, 2018. View All Seasons Social Reviews  0 Discussions  0 Media Most Popular Videos  0 Backdrops  1 Posters  2 Recommendations We don't have enough data to suggest any TV shows based on Sen Anlat Karadeniz. You can help by rating TV shows you've seen. Facts Status  Returning Series Network Certification  - Type  Scripted Original Language  Turkish Runtime  - Homepage  - Genres Family Action & Adventure Reality Keywords sen anlat karadeniz rize trabzon Content Score 86 Almost there... Top Contributors 19 moviefars 15 \u0130lkiny 7 tago1987 4 Elizabeth Jennings  View Edit History Popularity Trend  Login to edit  URL By  signing up  for an account on TMDb, you can post directly to Twitter and Facebook. You need to be logged in to continue. Click  here  to login or  here  to sign up.    page_wrap opened in html_head  Join the Community The Basics About TMDb Contact Us Support Forums API Blog Get Involved  Contribution Bible 3rd Party Applications Add New Movie Add New TV Show Community Guidelines Leaderboard Forums Twitter Facebook Legal Terms of Use Privacy Policy Login Sign Up", "character": ["Asiye Kaleli", "B\u00fclent", "Necip", "Nefes Zorlu"]}