{"link": "https://www.themoviedb.org/tv/70573?language=en", "title": "GLOW", "resume": "In 1980s LA, a crew of misfits reinvent themselves as the Gorgeous Ladies of Wrestling.", "rate": 76, "genre": ["Comedy", "Drama"], "cast": ["Alison Brie", "Betty Gilpin", "Marc Maron", "Britt Baron", "Kimmy Gatewood"], "character": ["Ruth Wilder", "Debbie Eagan", "Sam Sylvia", "Justine Biagi", "Stacey Beswick"], "site_data": "html Apps Forums Leaderboard Contribute API Support Discover Movies TV Shows Movies Popular Top Rated Upcoming Now Playing TV Shows Popular Top Rated On TV Airing Today People Popular People Can't find a movie or TV show? Login to create it. en Login Sign Up  ID: 70573   Expand GLOW   (2017) User Score  Play Trailer Overview In 1980s LA, a crew of misfits reinvent themselves as the Gorgeous Ladies of Wrestling. Featured Crew Liz Flahive Creator Carly Mensch Creator Discussions   Reviews Videos   Images   Changes Report Share Discussions General  2 Content Issues  0 Images Backdrops  7 Posters  7 Videos Trailers  1 Teasers  0 Clips  0 Featurettes  1 Opening Credits  1 Top Billed Cast Alison Brie Ruth Wilder Betty Gilpin Debbie Eagan Marc Maron Sam Sylvia Britt Baron Justine Biagi Kimmy Gatewood Stacey Beswick Full Cast & Crew Current Season Season 2 2018 | 10 Episodes View All Seasons Social Reviews  1 Discussions  2 C A review by CourtneyM17  9.0 Written by  CourtneyM17  on August  2, 2017 This show has a great mix of comedy and drama. The actors are great and the characters are dynamic and very good! It's very easy to binge watch and I can't wait for more! Read All Reviews Media Most Popular Videos  3 Backdrops  7 Posters  7 Recommendations   2016-11-15 Brown Nation 7.3    2015-05-08 Grace and Frankie 7.8    2015-06-12 Conspiracy 5.7    2009-07-08 Getting On 6.7    2017-11-05 SMILF 6.7    2014-10-05 Mulaney 2.4    2015-12-01 Real Rob 5.8    2017-12-22 The Toys That Made Us 7.5  Facts Status  Returning Series Network Certification TV-MA Meaning This program is specifically designed to be viewed by adults and therefore may be unsuitable for children under 17 Type  Scripted Original Language  English Runtime  35m, 30m Homepage   https://www.netflix.com/title/80114988 Genres Comedy Drama Keywords women wrestling 1980s Content Score 100 Yes! Looking good! Top Contributors 32 Elizabeth Jennings 24 Bendik 12 joeynotjoe Y 12 YJ  View Edit History Popularity Trend  Login to edit  URL By  signing up  for an account on TMDb, you can post directly to Twitter and Facebook. You need to be logged in to continue. Click  here  to login or  here  to sign up.    page_wrap opened in html_head  Join the Community The Basics About TMDb Contact Us Support Forums API Blog Get Involved  Contribution Bible 3rd Party Applications Add New Movie Add New TV Show Community Guidelines Leaderboard Forums Twitter Facebook Legal Terms of Use Privacy Policy Login Sign Up"}