{"link": "https://www.themoviedb.org/tv/3909?language=en", "title": "Ninja Turtles: The Next Mutation", "resume": "Everyone's favorite teenage mutants are back in live action to fight crime with help from a new ninja turtle -- a female named Venus De Milo.", "rate": 39, "genre": ["Sci-Fi", "Fantasy", "Action", "Adventure"], "cast": ["Kirby Morrow", "Matt Hill", "Jason Gray-Stanford", "Michael Dobson", "Lalainia Lindbjerg"], "character": ["Michelangelo (voice)", "Raphael (voice)", "Donatello (voice)", "Leonardo (voice)", "Venus de Milo (voice)"], "site_data": "html Apps Forums Leaderboard Contribute API Support Discover Movies TV Shows Movies Popular Top Rated Upcoming Now Playing TV Shows Popular Top Rated On TV Airing Today People Popular People Can't find a movie or TV show? Login to create it. en Login Sign Up  ID: 3909   Expand Ninja Turtles: The Next Mutation   (1997) User Score Overview Everyone's favorite teenage mutants are back in live action to fight crime with help from a new ninja turtle -- a female named Venus De Milo. Featured Crew Haim Saban Creator Kevin Eastman Creator Peter Laird Creator Discussions   Reviews Videos   Images   Changes Report Share Discussions General  0 Content Issues  1 Images Backdrops  2 Posters  1 Videos Trailers  0 Teasers  0 Clips  0 Featurettes  0 Opening Credits  0 Top Billed Cast Kirby Morrow Michelangelo (voice) Matt Hill Raphael (voice) Jason Gray-Stanford Donatello (voice) Michael Dobson Leonardo (voice) Lalainia Lindbjerg Venus de Milo (voice) Full Cast & Crew Last Season Season 1 1997 | 26 Episodes Season 1 of Ninja Turtles: The Next Mutation premiered on September 11, 1997. View All Seasons Social Reviews  0 Discussions  1 Subject Status Replies Last Reply There are no discussions for Ninja Turtles: The Next Mutation. Login to be first! Go to Discussions Media Most Popular Videos  0 Backdrops  2 Posters  1 Recommendations   2015-06-12 Conspiracy 5.7    2015-09-28 Danger Mouse 7.4    2009-02-25 Burnistoun 7.8    1999-01-13 Chewin' the Fat 8.2    2012-10-16 The Strange Calls 6.8    2016-11-15 Brown Nation 7.3  Facts Status  Cancelled Network Certification  - Type  Scripted Original Language  English Runtime  25m, 30m Homepage  - Genres Sci-Fi & Fantasy Action & Adventure Keywords superhero based on comic Content Score 93 Almost there... Top Contributors 33 Banana d 7 denis i 4 ilan n 3 nagano3193  View Edit History Popularity Trend  Login to edit  URL By  signing up  for an account on TMDb, you can post directly to Twitter and Facebook. You need to be logged in to continue. Click  here  to login or  here  to sign up.    page_wrap opened in html_head  Join the Community The Basics About TMDb Contact Us Support Forums API Blog Get Involved  Contribution Bible 3rd Party Applications Add New Movie Add New TV Show Community Guidelines Leaderboard Forums Twitter Facebook Legal Terms of Use Privacy Policy Login Sign Up"}