{"link": "https://www.themoviedb.org/tv/74851?language=en", "title": "Beyond Stranger Things", "resume": "Secrets from the \"Stranger Things 2\" universe are revealed as cast and guests discuss the latest episodes with host Jim Rash. Caution: spoilers ahead!", "rate": 73, "genre": ["Talk"], "cast": ["Jim Rash"], "character": ["Himself - Host"], "site_data": "html Apps Forums Leaderboard Contribute API Support Discover Movies TV Shows Movies Popular Top Rated Upcoming Now Playing TV Shows Popular Top Rated On TV Airing Today People Popular People Can't find a movie or TV show? Login to create it. en Login Sign Up  ID: 74851   Expand Beyond Stranger Things   (2017) User Score Overview Secrets from the \"Stranger Things 2\" universe are revealed as cast and guests discuss the latest episodes with host Jim Rash. Caution: spoilers ahead! Discussions   Reviews Videos   Images   Changes Report Share Discussions General  0 Content Issues  0 Images Backdrops  1 Posters  1 Videos Trailers  0 Teasers  0 Clips  0 Featurettes  0 Opening Credits  0 Top Billed Cast Jim Rash Himself - Host Full Cast & Crew Current Season Season 1 2017 | 7 Episodes Season 1 of Beyond Stranger Things premiered on October 27, 2017. View All Seasons Social Reviews  0 Discussions  0 Media Most Popular Videos  0 Backdrops  1 Posters  1 Recommendations   2011-08-05 Friends with Benefits 6.1    2013-12-02 Rick and Morty 8.6    2016-07-15 Stranger Things 8.4  Facts Status  Returning Series Network Certification TV-14 Meaning This program contains some material that many parents would find unsuitable for children under 14 years of age. Type  Talk Show Original Language  English Runtime  21m Homepage   https://www.netflix.com/fr/title/80197912 Genres Talk Keywords No keywords have been added. Content Score 56 We're so close, yet so far. Top Contributors 13 tstraus13 9 paterjm b 7 billys1983 5 Elizabeth Jennings  View Edit History Popularity Trend  Login to edit  URL By  signing up  for an account on TMDb, you can post directly to Twitter and Facebook. You need to be logged in to continue. Click  here  to login or  here  to sign up.    page_wrap opened in html_head  Join the Community The Basics About TMDb Contact Us Support Forums API Blog Get Involved  Contribution Bible 3rd Party Applications Add New Movie Add New TV Show Community Guidelines Leaderboard Forums Twitter Facebook Legal Terms of Use Privacy Policy Login Sign Up"}