{"link": "https://www.themoviedb.org/tv/65808?language=en", "title": "Tror du jag ljuger?", "resume": "We don't have an overview translated in English. Help us expand our database by adding one.", "rate": 50, "genre": ["Comedy"], "cast": ["Anna Mannheimer", "Johan Glans", "Fredrik Lindstr\u00f6m"], "character": ["Herself - Host", "Himself - Team Captain", "Himself - Team Captain"], "site_data": "html Apps Forums Leaderboard Contribute API Support Discover Movies TV Shows Movies Popular Top Rated Upcoming Now Playing TV Shows Popular Top Rated On TV Airing Today People Popular People Can't find a movie or TV show? Login to create it. en Login Sign Up  ID: 65808   Expand Tror du jag ljuger?   (2016) User Score Overview We don't have an overview translated in English. Help us expand our database by adding one. Discussions   Reviews Videos   Images   Changes Report Share Discussions General  0 Content Issues  0 Images Backdrops  3 Posters  1 Videos Trailers  0 Teasers  0 Clips  0 Featurettes  0 Opening Credits  0 Top Billed Cast Anna Mannheimer Herself - Host Johan Glans Himself - Team Captain Fredrik Lindstr\u00f6m Himself - Team Captain Full Cast & Crew Current Season Season 3 2018 | 10 Episodes Season 3 of Tror du jag ljuger? premiered on March 17, 2018. View All Seasons Social Reviews  0 Discussions  0 Media Most Popular Videos  0 Backdrops  3 Posters  1 Recommendations We don't have enough data to suggest any TV shows based on Tror du jag ljuger?. You can help by rating TV shows you've seen. Facts Status  Returning Series Network Certification  - Type  Scripted Original Language  Swedish Runtime  28m Homepage   http://www.svt.se/tror-du-jag-ljuger/ Genres Comedy Keywords No keywords have been added. Content Score 50 Still needs a little work. Top Contributors i 16 irafaz 13 BagronkeN 4 Elizabeth Jennings TB 2 TMDb Bot  View Edit History Popularity Trend  Login to edit  URL By  signing up  for an account on TMDb, you can post directly to Twitter and Facebook. You need to be logged in to continue. Click  here  to login or  here  to sign up.    page_wrap opened in html_head  Join the Community The Basics About TMDb Contact Us Support Forums API Blog Get Involved  Contribution Bible 3rd Party Applications Add New Movie Add New TV Show Community Guidelines Leaderboard Forums Twitter Facebook Legal Terms of Use Privacy Policy Login Sign Up"}