{"link": "https://www.themoviedb.org/tv/74801?language=en", "title": "Pap\u00e1 a Toda Madre", "resume": "We don't have an overview translated in English. Help us expand our database by adding one.", "rate": null, "genre": ["Comedy"], "cast": ["Ver\u00f3nica Montes", "Ana La Salvia", "Sebasti\u00e1n Rulli", "Maite Perroni", "Mark Tacher"], "site_data": "html Apps Forums Leaderboard Contribute API Support Discover Movies TV Shows Movies Popular Top Rated Upcoming Now Playing TV Shows Popular Top Rated On TV Airing Today People Popular People Can't find a movie or TV show? Login to create it. en Login Sign Up  ID: 74801   Expand Pap\u00e1 a Toda Madre   (2017) User Score Overview We don't have an overview translated in English. Help us expand our database by adding one. Featured Crew Montserrat G\u00f3mez Garc\u00eda Creator Pedro Armando Rodr\u00edguez Creator Discussions   Reviews Videos   Images   Changes Report Share Discussions General  0 Content Issues  0 Images Backdrops  0 Posters  1 Videos Trailers  0 Teasers  0 Clips  0 Featurettes  0 Opening Credits  0 Top Billed Cast Ver\u00f3nica Montes Chiquinquir\u00e1 Braun \"Kika\" Ana La Salvia Dulce Goyeneche Castilla de Turrubiates Sebasti\u00e1n Rulli Mauricio L\u00f3pez-Garza Silvetti Maite Perroni Ren\u00e9e S\u00e1nchez Moreno Mark Tacher Fabi\u00e1n Carvajal Murillo Full Cast & Crew Current Season Season 1 2017 | 5 Episodes Season 1 of Pap\u00e1 a Toda Madre premiered on October 23, 2017. View All Seasons Social Reviews  0 Discussions  0 Media Most Popular Videos  0 Backdrops  0 Posters  1 Recommendations We don't have enough data to suggest any TV shows based on Pap\u00e1 a Toda Madre. You can help by rating TV shows you've seen. Facts Status  Returning Series Network Certification  - Type  Scripted Original Language  Spanish; Castilian Runtime  41m Homepage   http://www.lasestrellas.tv/telenovelas/papa-a-toda-madre/ Genres Comedy Keywords No keywords have been added. Content Score 71 Just a little bit more... Top Contributors 29 onlineclasicosd  View Edit History Popularity Trend  Login to edit  URL By  signing up  for an account on TMDb, you can post directly to Twitter and Facebook. You need to be logged in to continue. Click  here  to login or  here  to sign up.    page_wrap opened in html_head  Join the Community The Basics About TMDb Contact Us Support Forums API Blog Get Involved  Contribution Bible 3rd Party Applications Add New Movie Add New TV Show Community Guidelines Leaderboard Forums Twitter Facebook Legal Terms of Use Privacy Policy Login Sign Up", "character": ["Chiquinquir\u00e1 Braun \"Kika\"", "Dulce Goyeneche Castilla de Turrubiates", "Mauricio L\u00f3pez-Garza Silvetti", "Ren\u00e9e S\u00e1nchez Moreno", "Fabi\u00e1n Carvajal Murillo"]}