{"link": "https://www.themoviedb.org/tv/69137?language=en", "title": "Julie's Greenroom", "resume": "Ms. Julie teaches performing arts workshops with the help of her assistant Gus at their Wellspring Center for the Performing Arts.", "rate": 78, "genre": ["Family", "Kids"], "cast": ["Julie Andrews", "Giullian Yao Gioiello", "Frankie Cordero", "Jennifer Barnhart", "Tyler Bunch"], "character": ["Ms. Julie", "Gus", "Spike (voice)", "Riley (voice)", "Hugo (voice)"], "site_data": "html Apps Forums Leaderboard Contribute API Support Discover Movies TV Shows Movies Popular Top Rated Upcoming Now Playing TV Shows Popular Top Rated On TV Airing Today People Popular People Can't find a movie or TV show? Login to create it. en Login Sign Up  ID: 69137   Expand Julie's Greenroom   (2017) User Score Overview Ms. Julie teaches performing arts workshops with the help of her assistant Gus at their Wellspring Center for the Performing Arts. Featured Crew Judy Rothman Rof\u00e9 Creator Julie Andrews Creator Emma Walton Hamilton Creator Discussions   Reviews Videos   Images   Changes Report Share Discussions General  0 Content Issues  0 Images Backdrops  1 Posters  2 Videos Trailers  0 Teasers  0 Clips  0 Featurettes  0 Opening Credits  0 Top Billed Cast Julie Andrews Ms. Julie Giullian Yao Gioiello Gus Frankie Cordero Spike (voice) Jennifer Barnhart Riley (voice) Tyler Bunch Hugo (voice) Full Cast & Crew Last Season Season 1 2017 | 13 Episodes Season 1 of Julie's Greenroom premiered on March 17, 2017. View All Seasons Social Reviews  0 Discussions  0 Media Most Popular Videos  0 Backdrops  1 Posters  2 Recommendations   2013-10-26 Verliefd op Ibiza 6.0    2011-03-01 Mr. Young 7.2  Facts Status  Returning Series Network Certification  - Type  Scripted Original Language  English Runtime  - Homepage   https://www.netflix.com/title/80113090 Genres Family Kids Keywords puppets Content Score 93 Almost there... Top Contributors 34 Elizabeth Jennings T 4 Ticktock MP 1 Mr. Peanutbutter  View Edit History Popularity Trend  Login to edit  URL By  signing up  for an account on TMDb, you can post directly to Twitter and Facebook. You need to be logged in to continue. Click  here  to login or  here  to sign up.    page_wrap opened in html_head  Join the Community The Basics About TMDb Contact Us Support Forums API Blog Get Involved  Contribution Bible 3rd Party Applications Add New Movie Add New TV Show Community Guidelines Leaderboard Forums Twitter Facebook Legal Terms of Use Privacy Policy Login Sign Up"}