{"link": "https://www.themoviedb.org/tv/66582?language=en", "title": "El hombre de tu vida", "resume": "We don't have an overview translated in English. Help us expand our database by adding one.", "rate": 0, "genre": ["Comedy"], "cast": ["Jos\u00e9 Mota", "Malena Alterio", "Norma Ru\u00edz", "Paco Tous", "\u00cd\u00f1igo Navares"], "character": ["Hugo", "Gloria", "Silvia", "Padre Francisco", "Chema"], "site_data": "html Apps Forums Leaderboard Contribute API Support Discover Movies TV Shows Movies Popular Top Rated Upcoming Now Playing TV Shows Popular Top Rated On TV Airing Today People Popular People Can't find a movie or TV show? Login to create it. en Login Sign Up  ID: 66582   Expand El hombre de tu vida   (2016) User Score Overview We don't have an overview translated in English. Help us expand our database by adding one. Featured Crew Marcela Guerty Creator Juan Jos\u00e9 Campanella Creator Discussions   Reviews Videos   Images   Changes Report Share Discussions General  0 Content Issues  1 Images Backdrops  3 Posters  1 Videos Trailers  0 Teasers  0 Clips  0 Featurettes  0 Opening Credits  0 Top Billed Cast Jos\u00e9 Mota Hugo Malena Alterio Gloria Norma Ru\u00edz Silvia Paco Tous Padre Francisco \u00cd\u00f1igo Navares Chema Full Cast & Crew Last Season Season 1 2016 | 8 Episodes Season 1 of El hombre de tu vida premiered on May 26, 2016. View All Seasons Social Reviews  0 Discussions  1 Subject Status Replies Last Reply There are no discussions for El hombre de tu vida. Login to be first! Go to Discussions Media Most Popular Videos  0 Backdrops  3 Posters  1 Recommendations We don't have enough data to suggest any TV shows based on El hombre de tu vida. You can help by rating TV shows you've seen. Facts Status  Ended Network Certification  - Type  Scripted Original Language  Spanish; Castilian Runtime  60m Homepage   http://www.rtve.es/television/el-hombre-de-tu-vida/ Genres Comedy Keywords romance Content Score 93 Almost there... Top Contributors 45 United600 z 8 zurman1 2 stego77 p 2 pepecine  View Edit History Popularity Trend  Login to edit  URL By  signing up  for an account on TMDb, you can post directly to Twitter and Facebook. You need to be logged in to continue. Click  here  to login or  here  to sign up.    page_wrap opened in html_head  Join the Community The Basics About TMDb Contact Us Support Forums API Blog Get Involved  Contribution Bible 3rd Party Applications Add New Movie Add New TV Show Community Guidelines Leaderboard Forums Twitter Facebook Legal Terms of Use Privacy Policy Login Sign Up"}