{"link": "https://www.themoviedb.org/tv/36581?language=en", "title": "Shiki", "resume": "We don't have an overview translated in English. Help us expand our database by adding one.", "rate": null, "genre": ["Animation", "Drama", "Sci-Fi", "Fantasy"], "cast": ["Nobuhiko Okamoto", "Wataru Takagi", "Gackt Camui", "Nozomi Sasaki", "Haruka Tomatsu"], "site_data": "html Apps Forums Leaderboard Contribute API Support Discover Movies TV Shows Movies Popular Top Rated Upcoming Now Playing TV Shows Popular Top Rated On TV Airing Today People Popular People Can't find a movie or TV show? Login to create it. en Login Sign Up  ID: 36581   Expand Shiki   (2010) User Score Overview We don't have an overview translated in English. Help us expand our database by adding one. Discussions   Reviews Videos   Images   Changes Report Share Discussions General  0 Content Issues  0 Images Backdrops  6 Posters  7 Videos Trailers  0 Teasers  0 Clips  0 Featurettes  0 Opening Credits  0 Top Billed Cast Nobuhiko Okamoto Wataru Takagi Gackt Camui Nozomi Sasaki Haruka Tomatsu Megumi Shimizu Full Cast & Crew Last Season Season 1 2010 | 22 Episodes Season 1 of Shiki premiered on July  8, 2010. View All Seasons Social Reviews  0 Discussions  0 Media Most Popular Videos  0 Backdrops  6 Posters  7 Recommendations   2013-09-09 Tokyo Ravens 5.8    2012-04-05 Sankarea: Undying Love 7.0    2012-04-10 Jormungand 7.4    2015-04-05 Plastic Memories 6.8    2011-04-14 Aria the Scarlet Ammo 6.4    2013-10-02 Beyond the Boundary 7.0    2017-01-13 Scum's Wish 7.7    2013-04-05 My Teen Romantic Comedy SNAFU 7.4  Facts Original Name  \u5c4d\u9b3c Status  Ended Network Certification  - Type  Scripted Original Language  Japanese Runtime  25m Homepage   http://www.okiagari.net/ Genres Animation Drama Sci-Fi & Fantasy Keywords anime Content Score 79 Pump it up! We're close now. Top Contributors 13 CrewMdk p 9 psy4trik 7 fmsonic 6 Sergiojamon  View Edit History Popularity Trend  Login to edit  URL By  signing up  for an account on TMDb, you can post directly to Twitter and Facebook. You need to be logged in to continue. Click  here  to login or  here  to sign up.    page_wrap opened in html_head  Join the Community The Basics About TMDb Contact Us Support Forums API Blog Get Involved  Contribution Bible 3rd Party Applications Add New Movie Add New TV Show Community Guidelines Leaderboard Forums Twitter Facebook Legal Terms of Use Privacy Policy Login Sign Up", "character": ["Megumi Shimizu"]}