{"link": "https://www.themoviedb.org/tv/12050?language=en", "title": "Astro Boy", "resume": "We don't have an overview translated in English. Help us expand our database by adding one.", "rate": null, "genre": ["Animation", "Action", "Adventure"], "cast": ["Makoto Tsumura", "Miki Maruyama", "Kazuo Kumakura", "Hisashi Katsuta", "Shinya Owada"], "site_data": "html Apps Forums Leaderboard Contribute API Support Discover Movies TV Shows Movies Popular Top Rated Upcoming Now Playing TV Shows Popular Top Rated On TV Airing Today People Popular People Can't find a movie or TV show? Login to create it. en Login Sign Up  ID: 12050   Expand Astro Boy   (2003) User Score Overview We don't have an overview translated in English. Help us expand our database by adding one. Featured Crew Osamu Tezuka Creator Discussions   Reviews Videos   Images   Changes Report Share Discussions General  0 Content Issues  0 Images Backdrops  6 Posters  4 Videos Trailers  0 Teasers  0 Clips  0 Featurettes  0 Opening Credits  0 Top Billed Cast Makoto Tsumura Atom (voice) Miki Maruyama Uranium (voice) Kazuo Kumakura Higeoyaji (voice) Hisashi Katsuta Professor Ochanomizu (voice) Shinya Owada Nagamiya Tenma (voice) Full Cast & Crew Last Season Astro Boy 2003 | 50 Episodes Season 1 of Astro Boy premiered on April  6, 2003. View All Seasons Social Reviews  0 Discussions  0 Media Most Popular Videos  0 Backdrops  6 Posters  4 Recommendations We don't have enough data to suggest any TV shows based on Astro Boy. You can help by rating TV shows you've seen. Facts Original Name  \u30a2\u30b9\u30c8\u30ed\u30dc\u30fc\u30a4\u30fb\u9244\u8155\u30a2\u30c8\u30e0 Status  Ended Networks Certification  - Type  Scripted Original Language  Japanese Runtime  - Homepage  - Genres Animation Action & Adventure Keywords No keywords have been added. Content Score 86 Almost there... Top Contributors t 42 tmdb983464 U 6 Uilio 5 BrerFox 3 Terence Haejin Lee  View Edit History Popularity Trend  Login to edit  URL By  signing up  for an account on TMDb, you can post directly to Twitter and Facebook. You need to be logged in to continue. Click  here  to login or  here  to sign up.    page_wrap opened in html_head  Join the Community The Basics About TMDb Contact Us Support Forums API Blog Get Involved  Contribution Bible 3rd Party Applications Add New Movie Add New TV Show Community Guidelines Leaderboard Forums Twitter Facebook Legal Terms of Use Privacy Policy Login Sign Up", "character": ["Atom (voice)", "Uranium (voice)", "Higeoyaji (voice)", "Professor Ochanomizu (voice)", "Nagamiya Tenma (voice)"]}