{"link": "https://www.themoviedb.org/tv/62112?language=en", "title": "The Next Generation: Patlabor", "resume": "In a world where giant robots are built and used for labor, a special police force of robots is created to handle crimes relating to these machines.", "rate": 0, "genre": ["Action", "Comedy", "Science", "Fiction"], "cast": ["Erina Mano", "Toshio Kakei", "Seiji Fukushi", "Rina Ohta"], "character": ["Akira Izumino", "Keji Gotouda", "Yuuma Shiobara", "Kaasha"], "site_data": "html Apps Forums Leaderboard Contribute API Support Discover Movies TV Shows Movies Popular Top Rated Upcoming Now Playing TV Shows Popular Top Rated On TV Airing Today People Popular People Can't find a movie or TV show? Login to create it. en Login Sign Up  ID: 62112   Expand The Next Generation: Patlabor   (2014) User Score Overview In a world where giant robots are built and used for labor, a special police force of robots is created to handle crimes relating to these machines. Featured Crew Mamoru Oshii Creator Discussions   Reviews Videos   Images   Changes Report Share Discussions General  0 Content Issues  1 Images Backdrops  3 Posters  4 Videos Trailers  0 Teasers  0 Clips  0 Featurettes  0 Opening Credits  0 Top Billed Cast Erina Mano Akira Izumino Toshio Kakei Keji Gotouda Seiji Fukushi Yuuma Shiobara Rina Ohta Kaasha Full Cast & Crew Last Season Original Air Date Original Air Date Parts (Original Air Date) Season 1 2014 | 13 Episodes Season 1 of The Next Generation: Patlabor premiered on March  7, 2014. View All Seasons Social Reviews  0 Discussions  1 Subject Status Replies Last Reply There are no discussions for The Next Generation: Patlabor. Login to be first! Go to Discussions Media Most Popular Videos  0 Backdrops  3 Posters  4 Recommendations We don't have enough data to suggest any TV shows based on The Next Generation: Patlabor. You can help by rating TV shows you've seen. Facts Original Name  THE NEXT GENERATION -\u30d1\u30c8\u30ec\u30a4\u30d0\u30fc- Status  Ended Network Certification  - Type  Scripted Original Language  Japanese Runtime  - Homepage  - Genres Action Comedy Science Fiction Keywords No keywords have been added. Content Score 93 Almost there... Top Contributors 25 kappa-papa 19 Banana 6 Elizabeth Jennings 6 salivum  View Edit History Popularity Trend  Login to edit  URL By  signing up  for an account on TMDb, you can post directly to Twitter and Facebook. You need to be logged in to continue. Click  here  to login or  here  to sign up.    page_wrap opened in html_head  Join the Community The Basics About TMDb Contact Us Support Forums API Blog Get Involved  Contribution Bible 3rd Party Applications Add New Movie Add New TV Show Community Guidelines Leaderboard Forums Twitter Facebook Legal Terms of Use Privacy Policy Login Sign Up"}