{"link": "https://www.themoviedb.org/tv/40446?language=en", "title": "Bella Block", "resume": "Bella Block is a long-running German detective television series starring Hannelore Hoger, first broadcast in 1994 on ZDF. In 2010 the 30th series was produced.", "rate": 0, "genre": ["Drama", "Crime"], "cast": ["Hannelore Hoger", "Rudolf Kowalski", "Devid Striesow", "Hansj\u00fcrgen H\u00fcrrig", "Samuel Finzi"], "character": ["Bella Block", "Simon Abendroth", "Jan Martensen", "Oberstaatsanwalt Mehlhorn", "Dr.S\u00f6mms"], "site_data": "html Apps Forums Leaderboard Contribute API Support Discover Movies TV Shows Movies Popular Top Rated Upcoming Now Playing TV Shows Popular Top Rated On TV Airing Today People Popular People Can't find a movie or TV show? Login to create it. en Login Sign Up  ID: 40446   Expand Bella Block   (1994) User Score Overview Bella Block is a long-running German detective television series starring Hannelore Hoger, first broadcast in 1994 on ZDF. In 2010 the 30th series was produced. Featured Crew Doris Gercke Creator Discussions   Reviews Videos   Images   Changes Report Share Discussions General  0 Content Issues  0 Images Backdrops  2 Posters  1 Videos Trailers  0 Teasers  0 Clips  0 Featurettes  0 Opening Credits  0 Top Billed Cast Hannelore Hoger Bella Block Rudolf Kowalski Simon Abendroth Devid Striesow Jan Martensen Hansj\u00fcrgen H\u00fcrrig Oberstaatsanwalt Mehlhorn Samuel Finzi Dr.S\u00f6mms Full Cast & Crew Last Season Season 1 1994 | 36 Episodes Season 1 of Bella Block premiered on March 26, 1994. View All Seasons Social Reviews  0 Discussions  0 Media Most Popular Videos  0 Backdrops  2 Posters  1 Recommendations We don't have enough data to suggest any TV shows based on Bella Block. You can help by rating TV shows you've seen. Facts Status  Returning Series Network Certification  - Type  Scripted Original Language  German Runtime  90m Homepage   http://bellablock.zdf.de/bella-block/bella-block-6019762.html Genres Drama Crime Keywords female detective Content Score 93 Almost there... Top Contributors S 27 Samara TB 1 TMDb Bot  View Edit History Popularity Trend  Login to edit  URL By  signing up  for an account on TMDb, you can post directly to Twitter and Facebook. You need to be logged in to continue. Click  here  to login or  here  to sign up.    page_wrap opened in html_head  Join the Community The Basics About TMDb Contact Us Support Forums API Blog Get Involved  Contribution Bible 3rd Party Applications Add New Movie Add New TV Show Community Guidelines Leaderboard Forums Twitter Facebook Legal Terms of Use Privacy Policy Login Sign Up"}