{"link": "https://www.themoviedb.org/tv/77283?language=en", "title": "Live", "resume": "The police officers at South Korea's busiest patrol division toil day and night as keepers of law and peace -- but the reality is far from orderly.", "rate": 66, "genre": ["Drama"], "cast": ["Jung Yu-mi", "Lee Kwang-Soo", "Bae Seong-woo", "Bae Jong-ok", "Sung Dong-il"], "character": ["Han Jung-O", "Yeom Sang-Soo", "Oh Yang-Chon", "An Jang-Mi", "Ki Han-Sol"], "site_data": "html Apps Forums Leaderboard Contribute API Support Discover Movies TV Shows Movies Popular Top Rated Upcoming Now Playing TV Shows Popular Top Rated On TV Airing Today People Popular People Can't find a movie or TV show? Login to create it. en Login Sign Up  ID: 77283   Expand Live   (2018) User Score Overview The police officers at South Korea's busiest patrol division toil day and night as keepers of law and peace -- but the reality is far from orderly. Discussions   Reviews Videos   Images   Changes Report Share Discussions General  0 Content Issues  0 Images Backdrops  3 Posters  7 Videos Trailers  0 Teasers  0 Clips  0 Featurettes  0 Opening Credits  0 Top Billed Cast Jung Yu-mi Han Jung-O Lee Kwang-Soo Yeom Sang-Soo Bae Seong-woo Oh Yang-Chon Bae Jong-ok An Jang-Mi Sung Dong-il Ki Han-Sol Full Cast & Crew Current Season Season 1 2018 | 18 Episodes Season 1 of Live premiered on March 10, 2018. View All Seasons Social Reviews  0 Discussions  0 Media Most Popular Videos  0 Backdrops  3 Posters  7 Recommendations We don't have enough data to suggest any TV shows based on Live. You can help by rating TV shows you've seen. Facts Original Name  \ub77c\uc774\ube0c Status  Ended Network Certification 15 Meaning This rating is for programs that contain material that may be inappropriate for children under 15, and that parental discretion should be used. Examples include most dramas, and talk shows on OTA (over-the-air) TV (KBS, MBC, SBS), and many American TV shows/dramas on Cable TV channels like OCN and OnStyle. The programs that have this rating may include moderate or strong adult themes, language, sexual inference, and violence. As with the TV-MA rating in North America, this rating is commonly applied to live events where the occurrence of inappropriate dialogue is unpredictable. Since 2007, this rating is the most used rating for TV. Type  Scripted Original Language  Korean Runtime  60m Homepage   http://program.tving.com/tvn/tvnlive/ Genres Drama Keywords police officer Content Score 86 Almost there... Top Contributors M 43 Maria180493 21 Kyuhwan Kim 12 Monago 2 adamsp09  View Edit History Popularity Trend  Login to edit  URL By  signing up  for an account on TMDb, you can post directly to Twitter and Facebook. You need to be logged in to continue. Click  here  to login or  here  to sign up.    page_wrap opened in html_head  Join the Community The Basics About TMDb Contact Us Support Forums API Blog Get Involved  Contribution Bible 3rd Party Applications Add New Movie Add New TV Show Community Guidelines Leaderboard Forums Twitter Facebook Legal Terms of Use Privacy Policy Login Sign Up"}