{"link": "https://www.themoviedb.org/tv/62149?language=en", "title": "\u0422\u0430\u0439\u043d\u044b\u0439 \u0433\u043e\u0440\u043e\u0434", "resume": "We don't have an overview translated in English. Help us expand our database by adding one.", "rate": 0, "genre": ["Fantasy"], "cast": ["Pavel Priluchnyy", "Igor Jijikine", "Elena Tashaeva", "Aleksandra Florinskaya", "Aleksandr Mokhov"], "character": ["\u0410\u0440\u0442\u0435\u043c \u0413\u043e\u043b\u043e\u0432\u0438\u043d", "\u041a\u043e\u0440\u0442\u0435\u0441", "Yana Mannerheim", "Queen Vseslava", "Kornilov"], "site_data": "html Apps Forums Leaderboard Contribute API Support Discover Movies TV Shows Movies Popular Top Rated Upcoming Now Playing TV Shows Popular Top Rated On TV Airing Today People Popular People Can't find a movie or TV show? Login to create it. en Login Sign Up  ID: 62149   Expand \u0422\u0430\u0439\u043d\u044b\u0439 \u0433\u043e\u0440\u043e\u0434   (2014) User Score Overview We don't have an overview translated in English. Help us expand our database by adding one. Featured Crew Aleksandr Mokhov Creator Discussions   Reviews Videos   Images   Changes Report Share Discussions General  0 Content Issues  0 Images Backdrops  2 Posters  1 Videos Trailers  0 Teasers  0 Clips  0 Featurettes  0 Opening Credits  0 Top Billed Cast Pavel Priluchnyy \u0410\u0440\u0442\u0435\u043c \u0413\u043e\u043b\u043e\u0432\u0438\u043d Igor Jijikine \u041a\u043e\u0440\u0442\u0435\u0441 Elena Tashaeva Yana Mannerheim Aleksandra Florinskaya Queen Vseslava Aleksandr Mokhov Kornilov Full Cast & Crew Last Season Season 2 2014 | 8 Episodes Season 2 of \u0422\u0430\u0439\u043d\u044b\u0439 \u0433\u043e\u0440\u043e\u0434 premiered on September 28, 2014. View All Seasons Social Reviews  0 Discussions  0 Media Most Popular Videos  0 Backdrops  2 Posters  1 Recommendations We don't have enough data to suggest any TV shows based on \u0422\u0430\u0439\u043d\u044b\u0439 \u0433\u043e\u0440\u043e\u0434. You can help by rating TV shows you've seen. Facts Status  Returning Series Network Certification 16+ Meaning Only teens the age of 16 or older can watch. Type  Scripted Original Language  Russian Runtime  47m Homepage  - Genres Fantasy Keywords No keywords have been added. Content Score 86 Almost there... Top Contributors G 53 G_Keeper 13 Elizabeth Jennings 3 janar z 1 zoroman2017  View Edit History Popularity Trend  Login to edit  URL By  signing up  for an account on TMDb, you can post directly to Twitter and Facebook. You need to be logged in to continue. Click  here  to login or  here  to sign up.    page_wrap opened in html_head  Join the Community The Basics About TMDb Contact Us Support Forums API Blog Get Involved  Contribution Bible 3rd Party Applications Add New Movie Add New TV Show Community Guidelines Leaderboard Forums Twitter Facebook Legal Terms of Use Privacy Policy Login Sign Up"}