{"link": "https://www.themoviedb.org/tv/48891?language=en", "title": "Brooklyn Nine-Nine", "resume": "A single-camera ensemble comedy following the lives of an eclectic group of detectives in a New York precinct, including one slacker who is forced to shape up when he gets a new boss.", "rate": 76, "genre": ["Comedy", "Crime"], "cast": ["Andy Samberg", "Andre Braugher", "Terry Crews", "Melissa Fumero", "Chelsea Peretti"], "character": ["Jake Peralta", "Captain Ray Holt", "Terry Jeffords", "Amy Santiago", "Gina Linetti"], "site_data": "html Apps Forums Leaderboard Contribute API Support Discover Movies TV Shows Movies Popular Top Rated Upcoming Now Playing TV Shows Popular Top Rated On TV Airing Today People Popular People Can't find a movie or TV show? Login to create it. en Login Sign Up  ID: 48891   Expand Brooklyn Nine-Nine   (2013) User Score  Play Trailer Overview A single-camera ensemble comedy following the lives of an eclectic group of detectives in a New York precinct, including one slacker who is forced to shape up when he gets a new boss. Featured Crew Daniel J. Goor Creator Michael Schur Creator Discussions   Reviews Videos   Images   Changes Report Share Discussions General  6 Content Issues  2 Images Backdrops  23 Posters  19 Videos Trailers  1 Teasers  0 Clips  0 Featurettes  0 Opening Credits  0 Top Billed Cast Andy Samberg Jake Peralta Andre Braugher Captain Ray Holt Terry Crews Terry Jeffords Melissa Fumero Amy Santiago Chelsea Peretti Gina Linetti Full Cast & Crew Last Season Original Air Date Original Air Date Production Order (Production) Season 5 2017 | 22 Episodes Season 5 of Brooklyn Nine-Nine premiered on September 25, 2017. View All Seasons Social Reviews  0 Discussions  8 Subject Status Replies Last Reply m I'm suppose to hate Gina right? Open 1 by  cswood w Amy: Happy Birthday Melissa Fumero! Open 0 by wonder2wonder\n      \n     w Jake: Happy Birthday Andy Samberg! Open 0 by wonder2wonder\n      \n     Go to Discussions Media Most Popular Videos  1 Backdrops  23 Posters  19 Recommendations   2009-09-17 Community 7.9    2009-04-09 Parks and Recreation 7.9    2001-10-02 Scrubs 7.7    2011-09-20 New Girl 6.5    2003-11-02 Arrested Development 8.2    2009-10-23 White Collar 7.7    2005-09-19 How I Met Your Mother 7.4    2009-09-23 Modern Family 7.3  Facts Status  Returning Series Networks Certification TV-14 Meaning This program contains some material that many parents would find unsuitable for children under 14 years of age. Type  Scripted Original Language  English Runtime  21m Homepage   http://www.fox.com/brooklyn-nine-nine/ Genres Comedy Crime Keywords new york police brooklyn new york city police precinct sitcom workplace comedy Content Score 100 Yes! Looking good! Top Contributors 110 Elizabeth Jennings 74 Banana 58 dbowman TB 17 TMDb Bot  View Edit History Popularity Trend  Login to edit  URL By  signing up  for an account on TMDb, you can post directly to Twitter and Facebook. You need to be logged in to continue. Click  here  to login or  here  to sign up.    page_wrap opened in html_head  Join the Community The Basics About TMDb Contact Us Support Forums API Blog Get Involved  Contribution Bible 3rd Party Applications Add New Movie Add New TV Show Community Guidelines Leaderboard Forums Twitter Facebook Legal Terms of Use Privacy Policy Login Sign Up"}