{"link": "https://www.themoviedb.org/tv/2441?language=en", "title": "Tonight", "resume": "Compelling current affairs stories that get to the heart of what matters most to viewers.", "rate": 0, "genre": ["News"], "cast": ["Jonathan Maitland"], "character": ["Himself"], "site_data": "html Apps Forums Leaderboard Contribute API Support Discover Movies TV Shows Movies Popular Top Rated Upcoming Now Playing TV Shows Popular Top Rated On TV Airing Today People Popular People Can't find a movie or TV show? Login to create it. en Login Sign Up  ID: 2441   Expand Tonight   (1999) User Score  Play Trailer Overview Compelling current affairs stories that get to the heart of what matters most to viewers. Discussions   Reviews Videos   Images   Changes Report Share Discussions General  0 Content Issues  0 Images Backdrops  1 Posters  1 Videos Trailers  1 Teasers  0 Clips  0 Featurettes  0 Opening Credits  0 Top Billed Cast Jonathan Maitland Himself Full Cast & Crew Last Season Season 20 \u2014 | 1 Episode We don't have an overview translated in English. Help us expand our database by adding one. View All Seasons Social Reviews  0 Discussions  0 Media Most Popular Videos  1 Backdrops  1 Posters  1 Recommendations We don't have enough data to suggest any TV shows based on Tonight. You can help by rating TV shows you've seen. Facts Status  Returning Series Network Certification  - Type  Documentary Original Language  English Runtime  30m Homepage   http://www.itv.com/tonight Genres News Keywords current affairs Content Score 64 We're so close, yet so far. Top Contributors 8 amian123 2 Elizabeth Jennings W 1 WaLLY  View Edit History Popularity Trend  Login to edit  URL By  signing up  for an account on TMDb, you can post directly to Twitter and Facebook. You need to be logged in to continue. Click  here  to login or  here  to sign up.    page_wrap opened in html_head  Join the Community The Basics About TMDb Contact Us Support Forums API Blog Get Involved  Contribution Bible 3rd Party Applications Add New Movie Add New TV Show Community Guidelines Leaderboard Forums Twitter Facebook Legal Terms of Use Privacy Policy Login Sign Up"}