{"link": "https://www.themoviedb.org/tv/69908?language=en", "title": "Ruby Ruby Love", "resume": "Lee Ruby, a young woman who suffers from sociophobia, comes across a magical ring that helps her grow into a jewelry designer.", "rate": 50, "genre": ["Comedy"], "cast": ["Seohyun", "Lee Yi-kyung", "Z.Hera"], "character": ["Lee Ruby", "Na Ji-seok", "Yoo Bi-joo"], "site_data": "html Apps Forums Leaderboard Contribute API Support Discover Movies TV Shows Movies Popular Top Rated Upcoming Now Playing TV Shows Popular Top Rated On TV Airing Today People Popular People Can't find a movie or TV show? Login to create it. en Login Sign Up  ID: 69908   Expand Ruby Ruby Love   (2017) User Score Overview Lee Ruby, a young woman who suffers from sociophobia, comes across a magical ring that helps her grow into a jewelry designer. Discussions   Reviews Videos   Images   Changes Report Share Discussions General  0 Content Issues  0 Images Backdrops  2 Posters  2 Videos Trailers  0 Teasers  0 Clips  0 Featurettes  0 Opening Credits  0 Top Billed Cast Seohyun Lee Ruby Lee Yi-kyung Na Ji-seok Z.Hera Yoo Bi-joo Full Cast & Crew Last Season Season 1 2017 | 5 Episodes Season 1 of Ruby Ruby Love premiered on January 18, 2017. View All Seasons Social Reviews  0 Discussions  0 Media Most Popular Videos  0 Backdrops  2 Posters  2 Recommendations We don't have enough data to suggest any TV shows based on Ruby Ruby Love. You can help by rating TV shows you've seen. Facts Original Name  \ub8e8\ube44\ub8e8\ube44\ub7fd Status  Ended Networks OnStyle Certification  - Type  Scripted Original Language  Korean Runtime  13m Homepage   http://tv.naver.com/cjenm.LubyLubyLove/ Genres Comedy Keywords romance korea web series Content Score 56 We're so close, yet so far. Top Contributors s 33 sheva_vitali M 19 Maria180493 TB 2 TMDb Bot  View Edit History Popularity Trend  Login to edit  URL By  signing up  for an account on TMDb, you can post directly to Twitter and Facebook. You need to be logged in to continue. Click  here  to login or  here  to sign up.    page_wrap opened in html_head  Join the Community The Basics About TMDb Contact Us Support Forums API Blog Get Involved  Contribution Bible 3rd Party Applications Add New Movie Add New TV Show Community Guidelines Leaderboard Forums Twitter Facebook Legal Terms of Use Privacy Policy Login Sign Up"}