{"link": "https://www.themoviedb.org/tv/15117?language=en", "title": "Life on Earth", "resume": "The story of life, from the first primitive cells to the plants and animals that now live around us.", "rate": 93, "genre": ["Documentary"], "cast": ["David Attenborough"], "character": ["Narrator"], "site_data": "html Apps Forums Leaderboard Contribute API Support Discover Movies TV Shows Movies Popular Top Rated Upcoming Now Playing TV Shows Popular Top Rated On TV Airing Today People Popular People Can't find a movie or TV show? Login to create it. en Login Sign Up  ID: 15117   Expand Life on Earth   (1979) User Score  Play Trailer Overview The story of life, from the first primitive cells to the plants and animals that now live around us. Featured Crew David Attenborough Creator Discussions   Reviews Videos   Images   Changes Report Share Discussions General  0 Content Issues  0 Images Backdrops  3 Posters  2 Videos Trailers  1 Teasers  0 Clips  0 Featurettes  0 Opening Credits  0 Top Billed Cast David Attenborough Narrator Full Cast & Crew Last Season Season 1 1979 | 13 Episodes Season 1 of Life on Earth premiered on January 15, 1979. View All Seasons Social Reviews  0 Discussions  0 Media Most Popular Videos  1 Backdrops  3 Posters  2 Recommendations   1990-10-04 The Trials of Life 9.5    1998-10-21 The Life of Birds 9.3    1984-01-19 The Living Planet 9.1    2000-11-15 State of the Planet 8.0    2002-11-20 The Life of Mammals 9.1    1993-11-18 Life in the Freezer 9.2    2005-11-23 Life in the Undergrowth 8.4    2011-02-09 Madagascar 8.8  Facts Status  Ended Network Certification  - Type  Documentary Original Language  English Runtime  55m Homepage   http://www.bbc.co.uk/programmes/b01qjcmb Genres Documentary Keywords biology earth natural history ecology animal nature evolution science natural selection life nature documentary Content Score 71 Just a little bit more... Top Contributors 27 Fludogenerator TB 8 TMDb Bot 5 Aty 4 Banana  View Edit History Popularity Trend  Login to edit  URL By  signing up  for an account on TMDb, you can post directly to Twitter and Facebook. You need to be logged in to continue. Click  here  to login or  here  to sign up.    page_wrap opened in html_head  Join the Community The Basics About TMDb Contact Us Support Forums API Blog Get Involved  Contribution Bible 3rd Party Applications Add New Movie Add New TV Show Community Guidelines Leaderboard Forums Twitter Facebook Legal Terms of Use Privacy Policy Login Sign Up"}