{"link": "https://www.themoviedb.org/tv/78159?language=en", "title": "The Teacher", "resume": "This series shows a school community's everyday life filled with drama and comedy. The episodes treat public and social issues like teenagers' rivalization or the search of identity.", "rate": 0, "genre": ["Comedy", "Drama"], "cast": ["Nagy Ervin", "Ubrankovics J\u00falia", "Anger Zsolt", "\u00d6tv\u00f6s Andr\u00e1s", "Ferenc Elek"], "character": ["Vasv\u00e1rdi Szil\u00e1rd", "N\u00f3gr\u00e1di Klaudia", "R\u00e1cz igazgat\u00f3", "Ritter", "Szeverin"], "site_data": "html Apps Forums Leaderboard Contribute API Support Discover Movies TV Shows Movies Popular Top Rated Upcoming Now Playing TV Shows Popular Top Rated On TV Airing Today People Popular People Can't find a movie or TV show? Login to create it. en Login Sign Up  ID: 78159   Expand The Teacher   (2018) User Score Overview This series shows a school community's everyday life filled with drama and comedy. The episodes treat public and social issues like teenagers' rivalization or the search of identity. Discussions   Reviews Videos   Images   Changes Report Share Discussions General  0 Content Issues  0 Images Backdrops  3 Posters  1 Videos Trailers  0 Teasers  0 Clips  0 Featurettes  0 Opening Credits  0 Top Billed Cast Nagy Ervin Vasv\u00e1rdi Szil\u00e1rd Ubrankovics J\u00falia N\u00f3gr\u00e1di Klaudia Anger Zsolt R\u00e1cz igazgat\u00f3 \u00d6tv\u00f6s Andr\u00e1s Ritter Ferenc Elek Szeverin Full Cast & Crew Current Season Season 1 2018 | 8 Episodes Season 1 of The Teacher premiered on March 31, 2018. View All Seasons Social Reviews  0 Discussions  0 Media Most Popular Videos  0 Backdrops  3 Posters  1 Recommendations We don't have enough data to suggest any TV shows based on The Teacher. You can help by rating TV shows you've seen. Facts Original Name  A Tan\u00e1r Status  Returning Series Network Certification 12 Meaning translation missing: en-US.certifications.tv_series.HU.4.meaning Type  Scripted Original Language  Hungarian Runtime  45m Homepage   http://www.rtl.hu/atanar Genres Comedy Drama Keywords school social life Content Score 86 Almost there... Top Contributors r 38 roli342 24 kbogesz e 4 erpy 4 Elizabeth Jennings  View Edit History Popularity Trend  Login to edit  URL By  signing up  for an account on TMDb, you can post directly to Twitter and Facebook. You need to be logged in to continue. Click  here  to login or  here  to sign up.    page_wrap opened in html_head  Join the Community The Basics About TMDb Contact Us Support Forums API Blog Get Involved  Contribution Bible 3rd Party Applications Add New Movie Add New TV Show Community Guidelines Leaderboard Forums Twitter Facebook Legal Terms of Use Privacy Policy Login Sign Up"}