{"link": "https://www.themoviedb.org/tv/40165?language=en", "title": "Frankenstein", "resume": "Adaption of Mary Shelley's novel about a scientist who brings life to a creature fashioned from corpses and various body parts.", "rate": 61, "genre": ["Drama", "Sci-Fi", "Fantasy"], "cast": ["Alec Newman", "William Hurt", "Julie Delpy", "Donald Sutherland", "Nicole Lewis"], "character": ["Victor Frankenstein", "Professor Waldman", "Caroline Frankenstein", "Captain Walton", "Elizabeth Frankenstein"], "site_data": "html Apps Forums Leaderboard Contribute API Support Discover Movies TV Shows Movies Popular Top Rated Upcoming Now Playing TV Shows Popular Top Rated On TV Airing Today People Popular People Can't find a movie or TV show? Login to create it. en Login Sign Up  ID: 40165   Expand Frankenstein   (2004) User Score  Play Trailer Overview Adaption of Mary Shelley's novel about a scientist who brings life to a creature fashioned from corpses and various body parts. Discussions   Reviews Videos   Images   Changes Report Share Discussions General  0 Content Issues  1 Images Backdrops  2 Posters  4 Videos Trailers  1 Teasers  0 Clips  0 Featurettes  0 Opening Credits  0 Top Billed Cast Alec Newman Victor Frankenstein William Hurt Professor Waldman Julie Delpy Caroline Frankenstein Donald Sutherland Captain Walton Nicole Lewis Elizabeth Frankenstein Full Cast & Crew Last Season Miniseries 2004 | 2 Episodes Season 1 of Frankenstein premiered on October  5, 2004. View All Seasons Social Reviews  0 Discussions  1 Subject Status Replies Last Reply There are no discussions for Frankenstein. Login to be first! Go to Discussions Media Most Popular Videos  1 Backdrops  2 Posters  4 Recommendations   1998-05-18 Creature 4.2    1999-09-14 Journey to the Center of the Earth 4.7    2001-03-11 The Lost Empire 4.3    2000-04-30 Arabian Nights 6.8    A Christmas Carol 7.5    2004-06-13 King Solomon's Mines 5.0  Facts Status  Ended Network Certification M Meaning Recommended for mature audiences; M-rated content may only be broadcast between 8:30 p.m. and 5:00 a.m. on any day, and additionally between 12:00 p.m. and 3:00 p.m. on schooldays. Type  Miniseries Original Language  English Runtime  102m Homepage  - Genres Drama Sci-Fi & Fantasy Keywords monster based on novel or book frankenstein miniseries Content Score 93 Almost there... Top Contributors TB 66 TMDb Bot 22 Ted Fraraccio R 11 Rebecca CM 9 Cherche Moi  View Edit History Popularity Trend  Login to edit  URL By  signing up  for an account on TMDb, you can post directly to Twitter and Facebook. You need to be logged in to continue. Click  here  to login or  here  to sign up.    page_wrap opened in html_head  Join the Community The Basics About TMDb Contact Us Support Forums API Blog Get Involved  Contribution Bible 3rd Party Applications Add New Movie Add New TV Show Community Guidelines Leaderboard Forums Twitter Facebook Legal Terms of Use Privacy Policy Login Sign Up"}