{"link": "https://www.themoviedb.org/tv/41249?language=en", "title": "Schwarz Rot Gold", "resume": "Schwarz-Rot-Gold is a German television series.", "rate": 95, "genre": ["Crime"], "cast": ["Uwe Friedrichsen", "Edgar Bessen", "George Meyer-Goll", "Siegfried Kernen", "D\u00e9nes T\u00f6rzs"], "character": ["Zollamtsrat Zaluskowski", "Globig", "Max Doellke", "Siggi Hobel", "Staatsanwalt"], "site_data": "html Apps Forums Leaderboard Contribute API Support Discover Movies TV Shows Movies Popular Top Rated Upcoming Now Playing TV Shows Popular Top Rated On TV Airing Today People Popular People Can't find a movie or TV show? Login to create it. en Login Sign Up  ID: 41249   Expand Schwarz Rot Gold   (1982) User Score Overview Schwarz-Rot-Gold is a German television series. Featured Crew Dieter Meichsner Creator Discussions   Reviews Videos   Images   Changes Report Share Discussions General  0 Content Issues  0 Images Backdrops  3 Posters  1 Videos Trailers  0 Teasers  0 Clips  0 Featurettes  0 Opening Credits  0 Top Billed Cast Uwe Friedrichsen Zollamtsrat Zaluskowski Edgar Bessen Globig George Meyer-Goll Max Doellke Siegfried Kernen Siggi Hobel D\u00e9nes T\u00f6rzs Staatsanwalt Full Cast & Crew Last Season Season 3 1993 | 6 Episodes Season 3 of Schwarz Rot Gold premiered on February 14, 1993. View All Seasons Social Reviews  0 Discussions  0 Media Most Popular Videos  0 Backdrops  3 Posters  1 Recommendations We don't have enough data to suggest any TV shows based on Schwarz Rot Gold. You can help by rating TV shows you've seen. Facts Status  Ended Network Certification 6 Meaning Can be aired at any time. Type  Scripted Original Language  German Runtime  90m Homepage  - Genres Crime Keywords No keywords have been added. Content Score 93 Almost there... Top Contributors S 33 SunHomeMovie S 29 Samara J 3 Jensus TB 2 TMDb Bot  View Edit History Popularity Trend  Login to edit  URL By  signing up  for an account on TMDb, you can post directly to Twitter and Facebook. You need to be logged in to continue. Click  here  to login or  here  to sign up.    page_wrap opened in html_head  Join the Community The Basics About TMDb Contact Us Support Forums API Blog Get Involved  Contribution Bible 3rd Party Applications Add New Movie Add New TV Show Community Guidelines Leaderboard Forums Twitter Facebook Legal Terms of Use Privacy Policy Login Sign Up"}