{"link": "https://www.themoviedb.org/tv/66676?language=en", "title": "Queen of the South", "resume": "Teresa flees Mexico after her drug-runner boyfriend is murdered. Settling in Dallas, she looks to become the country's reigning drug smuggler and to avenge her lover's murder.", "rate": 68, "genre": ["Crime"], "cast": ["Alice Braga", "Justina Machado"], "character": ["Teresa Mendoza", "Brenda"], "site_data": "html Apps Forums Leaderboard Contribute API Support Discover Movies TV Shows Movies Popular Top Rated Upcoming Now Playing TV Shows Popular Top Rated On TV Airing Today People Popular People Can't find a movie or TV show? Login to create it. en Login Sign Up  ID: 66676   Expand Queen of the South   (2016) User Score  Play Trailer Overview Teresa flees Mexico after her drug-runner boyfriend is murdered. Settling in Dallas, she looks to become the country's reigning drug smuggler and to avenge her lover's murder. Featured Crew M.A. Fortin Creator Joshua John Miller Creator Discussions   Reviews Videos   Images   Changes Report Share Discussions General  2 Content Issues  0 Images Backdrops  8 Posters  4 Videos Trailers  1 Teasers  0 Clips  0 Featurettes  0 Opening Credits  0 Top Billed Cast Alice Braga Teresa Mendoza Justina Machado Brenda Full Cast & Crew Current Season Season 3 2018 | 2 Episodes View All Seasons Social Reviews  0 Discussions  3 Subject Status Replies Last Reply Renewed for season 3 Open 0 by Taylorfirst1\n      \n     Don't understand why I continue to watch this show. Open 2 by  Taylorfirst1 Go to Discussions Media Most Popular Videos  1 Backdrops  8 Posters  4 Recommendations   2015-06-01 American Genius 7.0    2013-07-20 Cedar Cove 6.7    2014-01-07 Being Mary Jane 7.7    2017-01-10 The Frozen Dead 6.6    2016-03-02 Hap and Leonard 7.3    2014-04-06 TURN: Washington's Spies 7.4    2013-08-11 Low Winter Sun 6.4    2016-10-16 Berlin Station 7.4  Facts Status  Returning Series Network Certification TV-14 Meaning This program contains some material that many parents would find unsuitable for children under 14 years of age. Type  Scripted Original Language  English Runtime  42m Homepage   http://www.usanetwork.com/queenofthesouth Genres Crime Keywords drug cartel drugs cartel Content Score 71 Just a little bit more... Top Contributors 27 Elizabeth Jennings 19 charlieaus p 10 plumpro 8 Bogdan Mateescu  View Edit History Popularity Trend  Login to edit  URL By  signing up  for an account on TMDb, you can post directly to Twitter and Facebook. You need to be logged in to continue. Click  here  to login or  here  to sign up.    page_wrap opened in html_head  Join the Community The Basics About TMDb Contact Us Support Forums API Blog Get Involved  Contribution Bible 3rd Party Applications Add New Movie Add New TV Show Community Guidelines Leaderboard Forums Twitter Facebook Legal Terms of Use Privacy Policy Login Sign Up"}