{"link": "https://www.themoviedb.org/tv/69289?language=en", "title": "Kirakira\u2606Precure A La Mode", "resume": "We don't have an overview translated in English. Help us expand our database by adding one.", "rate": 35, "genre": ["Animation", "Sci-Fi", "Fantasy"], "cast": ["Saki Fujita", "Tomo Muranaka", "Nanako Mori", "Karen Miyama", "Inori Minase"], "character": ["Yukari Kotozume", "Aoi Tategami", "Akira Kenjou", "Ichika Usami", "Ciel Kirahoshi"], "site_data": "html Apps Forums Leaderboard Contribute API Support Discover Movies TV Shows Movies Popular Top Rated Upcoming Now Playing TV Shows Popular Top Rated On TV Airing Today People Popular People Can't find a movie or TV show? Login to create it. en Login Sign Up  ID: 69289   Expand Kirakira\u2606Precure A La Mode   (2017) User Score Overview We don't have an overview translated in English. Help us expand our database by adding one. Featured Crew Yukio Kaizawa Creator Discussions   Reviews Videos   Images   Changes Report Share Discussions General  0 Content Issues  0 Images Backdrops  1 Posters  1 Videos Trailers  0 Teasers  0 Clips  0 Featurettes  0 Opening Credits  0 Top Billed Cast Saki Fujita Yukari Kotozume Tomo Muranaka Aoi Tategami Nanako Mori Akira Kenjou Karen Miyama Ichika Usami Inori Minase Ciel Kirahoshi Full Cast & Crew Last Season Season 1 2017 | 12 Episodes Season 1 of Kirakira\u2606Precure A La Mode premiered on January  5, 2017. View All Seasons Social Reviews  0 Discussions  0 Media Most Popular Videos  0 Backdrops  1 Posters  1 Recommendations We don't have enough data to suggest any TV shows based on Kirakira\u2606Precure A La Mode. You can help by rating TV shows you've seen. Facts Status  Returning Series Networks - Certification  - Type  Scripted Original Language  Japanese Runtime  25m Homepage   http://www.toei-anim.co.jp/tv/precure_alamode/ Genres Animation Sci-Fi & Fantasy Keywords precure anime Content Score 93 Almost there... Top Contributors 20 4GodSake 13 sp1ti S 8 Starfinder 6 Despair-Paradise  View Edit History Popularity Trend  Login to edit  URL By  signing up  for an account on TMDb, you can post directly to Twitter and Facebook. You need to be logged in to continue. Click  here  to login or  here  to sign up.    page_wrap opened in html_head  Join the Community The Basics About TMDb Contact Us Support Forums API Blog Get Involved  Contribution Bible 3rd Party Applications Add New Movie Add New TV Show Community Guidelines Leaderboard Forums Twitter Facebook Legal Terms of Use Privacy Policy Login Sign Up"}