{"link": "https://www.themoviedb.org/tv/76331?language=en", "title": "Succession", "resume": "The lives of the Roy family as they contemplate their future once their aging father begins to step back from the media and entertainment conglomerate they control.", "rate": 50, "genre": ["Drama"], "cast": ["Brian Cox", "Jeremy Strong", "Kieran Culkin", "Sarah Snook", "Nicholas Braun"], "character": ["Logan Roy", "Kendall Roy", "Roman Roy", "Siobhan 'Shiv' Roy", "Greg"], "site_data": "html Apps Forums Leaderboard Contribute API Support Discover Movies TV Shows Movies Popular Top Rated Upcoming Now Playing TV Shows Popular Top Rated On TV Airing Today People Popular People Can't find a movie or TV show? Login to create it. en Login Sign Up  ID: 76331   Expand Succession   (2018) User Score  Play Trailer Overview The lives of the Roy family as they contemplate their future once their aging father begins to step back from the media and entertainment conglomerate they control. Featured Crew Jesse Armstrong Creator Discussions   Reviews Videos   Images   Changes Report Share Discussions General  0 Content Issues  0 Images Backdrops  3 Posters  3 Videos Trailers  1 Teasers  1 Clips  0 Featurettes  0 Opening Credits  0 Top Billed Cast Brian Cox Logan Roy Jeremy Strong Kendall Roy Kieran Culkin Roman Roy Sarah Snook Siobhan 'Shiv' Roy Nicholas Braun Greg Full Cast & Crew Current Season Season 1 2018 | 10 Episodes Season 1 of Succession premiered on June  3, 2018. View All Seasons Social Reviews  0 Discussions  0 Media Most Popular Videos  2 Backdrops  3 Posters  3 Recommendations   2016-10-09 Divorce 6.1    2015-03-08 Poldark 7.9  Facts Status  Returning Series Network Certification TV-MA Meaning This program is specifically designed to be viewed by adults and therefore may be unsuitable for children under 17 Type  Scripted Original Language  English Runtime  65m Homepage   https://www.hbo.com/succession Genres Drama Keywords No keywords have been added. Content Score 100 Yes! Looking good! Top Contributors 52 Elizabeth Jennings s 5 sylvain006 k 3 kaspey s 3 speedycars  View Edit History Popularity Trend  Login to edit  URL By  signing up  for an account on TMDb, you can post directly to Twitter and Facebook. You need to be logged in to continue. Click  here  to login or  here  to sign up.    page_wrap opened in html_head  Join the Community The Basics About TMDb Contact Us Support Forums API Blog Get Involved  Contribution Bible 3rd Party Applications Add New Movie Add New TV Show Community Guidelines Leaderboard Forums Twitter Facebook Legal Terms of Use Privacy Policy Login Sign Up"}