{"link": "https://www.themoviedb.org/tv/10463?language=en", "title": "Dave's World", "resume": "Dave's World is an American sitcom that aired on CBS from 1993 to 1997. The series is based on the writing of Miami Herald columnist Dave Barry.", "rate": 70, "genre": ["Comedy"], "cast": ["Patrick Warburton", "Harry Anderson", "Meshach Taylor", "Delane Matthews", "Shadoe Stevens"], "character": ["Eric", "Dave Barry", "Shel Baylor", "Beth Barry", "Kenny Beckett"], "site_data": "html Apps Forums Leaderboard Contribute API Support Discover Movies TV Shows Movies Popular Top Rated Upcoming Now Playing TV Shows Popular Top Rated On TV Airing Today People Popular People Can't find a movie or TV show? Login to create it. en Login Sign Up  ID: 10463   Expand Dave's World   (1993) User Score Overview Dave's World is an American sitcom that aired on CBS from 1993 to 1997. The series is based on the writing of Miami Herald columnist Dave Barry. Featured Crew Fred Barron Creator Discussions   Reviews Videos   Images   Changes Report Share Discussions General  0 Content Issues  0 Images Backdrops  0 Posters  1 Videos Trailers  0 Teasers  0 Clips  0 Featurettes  0 Opening Credits  0 Top Billed Cast Patrick Warburton Eric Harry Anderson Dave Barry Meshach Taylor Shel Baylor Delane Matthews Beth Barry Shadoe Stevens Kenny Beckett Full Cast & Crew Last Season Season 4 1996 | 24 Episodes Season 4 of Dave's World premiered on September 13, 1996. View All Seasons Social Reviews  0 Discussions  0 Media Most Popular Videos  0 Backdrops  0 Posters  1 Recommendations We don't have enough data to suggest any TV shows based on Dave's World. You can help by rating TV shows you've seen. Facts Status  Ended Network Certification  - Type  Scripted Original Language  English Runtime  30m Homepage  - Genres Comedy Keywords miami suburb family sitcom newspaper columnist Content Score 79 Pump it up! We're close now. Top Contributors 20 Banana 2 Zlogorek S 2 Samara  View Edit History Popularity Trend  Login to edit  URL By  signing up  for an account on TMDb, you can post directly to Twitter and Facebook. You need to be logged in to continue. Click  here  to login or  here  to sign up.    page_wrap opened in html_head  Join the Community The Basics About TMDb Contact Us Support Forums API Blog Get Involved  Contribution Bible 3rd Party Applications Add New Movie Add New TV Show Community Guidelines Leaderboard Forums Twitter Facebook Legal Terms of Use Privacy Policy Login Sign Up"}