{"link": "https://www.themoviedb.org/tv/59634?language=en", "title": "Great Continental Railway Journeys", "resume": "Michael Portillo travels on the great train routes of Europe, as he retraces the journeys featured in George Bradshaw's 1913 Continental Railway Guide.", "rate": 95, "genre": ["Documentary"], "cast": ["Michael Portillo"], "character": ["Himself"], "site_data": "html Apps Forums Leaderboard Contribute API Support Discover Movies TV Shows Movies Popular Top Rated Upcoming Now Playing TV Shows Popular Top Rated On TV Airing Today People Popular People Can't find a movie or TV show? Login to create it. en Login Sign Up  ID: 59634   Expand Great Continental Railway Journeys   (2012) User Score Overview Michael Portillo travels on the great train routes of Europe, as he retraces the journeys featured in George Bradshaw's 1913 Continental Railway Guide. Discussions   Reviews Videos   Images   Changes Report Share Discussions General  0 Content Issues  0 Images Backdrops  0 Posters  1 Videos Trailers  0 Teasers  0 Clips  0 Featurettes  0 Opening Credits  0 Top Billed Cast Michael Portillo Himself Full Cast & Crew Last Season Season 5 2016 | 6 Episodes Season 5 of Great Continental Railway Journeys premiered on September 20, 2016. View All Seasons Social Reviews  0 Discussions  0 Media Most Popular Videos  0 Backdrops  0 Posters  1 Recommendations We don't have enough data to suggest any TV shows based on Great Continental Railway Journeys. You can help by rating TV shows you've seen. Facts Status  Returning Series Network Certification  - Type  Documentary Original Language  English Runtime  60m Homepage   http://bbc.co.uk/programmes/b01rdqn7 Genres Documentary Keywords europe travel railway Content Score 43 There's no 'I' in team... Top Contributors 14 Banana j 9 jesus.higuera A 6 Aukland a 6 ausley  View Edit History Popularity Trend  Login to edit  URL By  signing up  for an account on TMDb, you can post directly to Twitter and Facebook. You need to be logged in to continue. Click  here  to login or  here  to sign up.    page_wrap opened in html_head  Join the Community The Basics About TMDb Contact Us Support Forums API Blog Get Involved  Contribution Bible 3rd Party Applications Add New Movie Add New TV Show Community Guidelines Leaderboard Forums Twitter Facebook Legal Terms of Use Privacy Policy Login Sign Up"}