{"link": "https://www.themoviedb.org/tv/71753?language=en", "title": "The Challenge: Champs vs. Pros", "resume": "A special event spun off from MTV's long-running reality game show, The Challenge. In the six-week event, ten Challenge greats will compete against ten professional athletes.", "rate": 70, "genre": ["Reality"], "cast": ["Victor Cruz", "Phillip Jack Brooks"], "character": ["Himself - Host"], "site_data": "html Apps Forums Leaderboard Contribute API Support Discover Movies TV Shows Movies Popular Top Rated Upcoming Now Playing TV Shows Popular Top Rated On TV Airing Today People Popular People Can't find a movie or TV show? Login to create it. en Login Sign Up  ID: 71753   Expand The Challenge: Champs vs. Pros   (2017) User Score Overview A special event spun off from MTV's long-running reality game show, The Challenge. In the six-week event, ten Challenge greats will compete against ten professional athletes. Discussions   Reviews Videos   Images   Changes Report Share Discussions General  1 Content Issues  0 Images Backdrops  3 Posters  1 Videos Trailers  0 Teasers  0 Clips  1 Featurettes  0 Opening Credits  0 Top Billed Cast Victor Cruz Himself - Host Phillip Jack Brooks Full Cast & Crew Last Season Season 1 2017 | 6 Episodes Season 1 of The Challenge: Champs vs. Pros premiered on May 15, 2017. View All Seasons Social Reviews  0 Discussions  1 Subject Status Replies Last Reply I LoLo....what a piece of work Open 0 by I'matwork\n      \n     Go to Discussions Media Most Popular Videos  1 Backdrops  3 Posters  1 Recommendations We don't have enough data to suggest any TV shows based on The Challenge: Champs vs. Pros. You can help by rating TV shows you've seen. Facts Status  Ended Network Certification  - Type  Miniseries Original Language  English Runtime  60m Homepage   http://www.mtv.com/shows/champs-vs-pros Genres Reality Keywords game show challenge spin off reality competition Content Score 64 We're so close, yet so far. Top Contributors 33 Sall 28 Elizabeth Jennings 11 Banana e 6 eristamelberg  View Edit History Popularity Trend  Login to edit  URL By  signing up  for an account on TMDb, you can post directly to Twitter and Facebook. You need to be logged in to continue. Click  here  to login or  here  to sign up.    page_wrap opened in html_head  Join the Community The Basics About TMDb Contact Us Support Forums API Blog Get Involved  Contribution Bible 3rd Party Applications Add New Movie Add New TV Show Community Guidelines Leaderboard Forums Twitter Facebook Legal Terms of Use Privacy Policy Login Sign Up"}