{"link": "https://www.themoviedb.org/tv/75966?language=en", "title": "All Night", "resume": "An overnight, lock-in graduation party in which a group of new grads will do whatever it takes to make their remaining high school dreams come true.", "rate": null, "genre": ["Comedy"], "cast": ["Ty Doran", "Jenn McAllister", "Brec Bassinger", "Eva Gutowski", "Tetona Jackson"], "site_data": "html Apps Forums Leaderboard Contribute API Support Discover Movies TV Shows Movies Popular Top Rated Upcoming Now Playing TV Shows Popular Top Rated On TV Airing Today People Popular People Can't find a movie or TV show? Login to create it. en Login Sign Up  ID: 75966   Expand All Night   (2018) User Score  Play Trailer Overview An overnight, lock-in graduation party in which a group of new grads will do whatever it takes to make their remaining high school dreams come true. Featured Crew Jason Ubaldi Creator Discussions   Reviews Videos   Images   Changes Report Share Discussions General  0 Content Issues  0 Images Backdrops  5 Posters  3 Videos Trailers  1 Teasers  0 Clips  0 Featurettes  0 Opening Credits  0 Top Billed Cast Ty Doran Bryce Jenn McAllister Deanna Hoffman Brec Bassinger Roni Sweetzer / Roni Eva Gutowski Lyssee Tetona Jackson Cassie Fulner Full Cast & Crew Current Season Season 1 2018 | 10 Episodes Season 1 of All Night premiered on May 11, 2018. View All Seasons Social Reviews  0 Discussions  0 Media Most Popular Videos  1 Backdrops  5 Posters  3 Recommendations We don't have enough data to suggest any TV shows based on All Night. You can help by rating TV shows you've seen. Facts Status  In Production Network Certification  - Type  Scripted Original Language  English Runtime  22m Homepage  - Genres Comedy Keywords No keywords have been added. Content Score 100 Yes! Looking good! Top Contributors 22 DarkMan 6 movietvhub 4 tupelihd TB 2 TMDb Bot  View Edit History Popularity Trend  Login to edit  URL By  signing up  for an account on TMDb, you can post directly to Twitter and Facebook. You need to be logged in to continue. Click  here  to login or  here  to sign up.    page_wrap opened in html_head  Join the Community The Basics About TMDb Contact Us Support Forums API Blog Get Involved  Contribution Bible 3rd Party Applications Add New Movie Add New TV Show Community Guidelines Leaderboard Forums Twitter Facebook Legal Terms of Use Privacy Policy Login Sign Up", "character": ["Bryce", "Deanna Hoffman", "Roni Sweetzer / Roni", "Lyssee", "Cassie Fulner"]}