{"link": "https://www.themoviedb.org/tv/62786?language=en", "title": "La fuga", "resume": "We don't have an overview translated in English. Help us expand our database by adding one.", "rate": 90, "genre": ["Action", "Adventure", "Drama"], "cast": ["Mar\u00eda Valverde", "Aitor Luna", "Asier Etxeandia", "Marian \u00c1lvarez", "Patxi Freytez"], "character": ["Anna Serra", "Daniel Ochoa", "Miguel Reverte", "Doctora Marta Romero", "\u00c1lvaro Vidal"], "site_data": "html Apps Forums Leaderboard Contribute API Support Discover Movies TV Shows Movies Popular Top Rated Upcoming Now Playing TV Shows Popular Top Rated On TV Airing Today People Popular People Can't find a movie or TV show? Login to create it. en Login Sign Up  ID: 62786   Expand La fuga   (2012) User Score Overview We don't have an overview translated in English. Help us expand our database by adding one. Featured Crew Nacho Faerna Creator Discussions   Reviews Videos   Images   Changes Report Share Discussions General  0 Content Issues  0 Images Backdrops  4 Posters  1 Videos Trailers  0 Teasers  0 Clips  0 Featurettes  0 Opening Credits  0 Top Billed Cast Mar\u00eda Valverde Anna Serra Aitor Luna Daniel Ochoa Asier Etxeandia Miguel Reverte Marian \u00c1lvarez Doctora Marta Romero Patxi Freytez \u00c1lvaro Vidal Full Cast & Crew Last Season Season 1 2012 | 12 Episodes Season 1 of La fuga premiered on January 11, 2012. View All Seasons Social Reviews  0 Discussions  0 Media Most Popular Videos  0 Backdrops  4 Posters  1 Recommendations We don't have enough data to suggest any TV shows based on La fuga. You can help by rating TV shows you've seen. Facts Status  Ended Network Certification  - Type  Scripted Original Language  Spanish; Castilian Runtime  90m Homepage   http://www.telecinco.es/lafuga/ Genres Action & Adventure Drama Keywords No keywords have been added. Content Score 86 Almost there... Top Contributors 27 prm96 6 United600 z 5 zurman1 w 3 webmaster  View Edit History Popularity Trend  Login to edit  URL By  signing up  for an account on TMDb, you can post directly to Twitter and Facebook. You need to be logged in to continue. Click  here  to login or  here  to sign up.    page_wrap opened in html_head  Join the Community The Basics About TMDb Contact Us Support Forums API Blog Get Involved  Contribution Bible 3rd Party Applications Add New Movie Add New TV Show Community Guidelines Leaderboard Forums Twitter Facebook Legal Terms of Use Privacy Policy Login Sign Up"}