{"link": "https://www.themoviedb.org/tv/30149?language=en", "title": "Van Speijk", "resume": "We don't have an overview translated in English. Help us expand our database by adding one.", "rate": null, "genre": ["Crime"], "cast": ["Tygo Gernandt", "Johnny de Mol", "Peter Faber", "Cahit \u00d6lmez", "Loes Haverkort"], "site_data": "html Apps Forums Leaderboard Contribute API Support Discover Movies TV Shows Movies Popular Top Rated Upcoming Now Playing TV Shows Popular Top Rated On TV Airing Today People Popular People Can't find a movie or TV show? Login to create it. en Login Sign Up  ID: 30149   Expand Van Speijk   (2006) User Score Overview We don't have an overview translated in English. Help us expand our database by adding one. Discussions   Reviews Videos   Images   Changes Report Share Discussions General  0 Content Issues  1 Images Backdrops  0 Posters  1 Videos Trailers  0 Teasers  0 Clips  0 Featurettes  0 Opening Credits  0 Top Billed Cast Tygo Gernandt Sylvester Daals Johnny de Mol Jeroen van Veen Peter Faber Evert Beukering Cahit \u00d6lmez Altan Uslu Loes Haverkort Tina Zonderland Full Cast & Crew Last Season Season 2 2007 | 13 Episodes Season 2 of Van Speijk premiered on January 11, 2007. View All Seasons Social Reviews  0 Discussions  1 Subject Status Replies Last Reply There are no discussions for Van Speijk. Login to be first! Go to Discussions Media Most Popular Videos  0 Backdrops  0 Posters  1 Recommendations We don't have enough data to suggest any TV shows based on Van Speijk. You can help by rating TV shows you've seen. Facts Status  Ended Network Talpa Certification 12 Meaning Take care with children under 12. Type  Scripted Original Language  Dutch; Flemish Runtime  50m Homepage  - Genres Crime Keywords No keywords have been added. Content Score 64 We're so close, yet so far. Top Contributors 7 50 7Bee-NL 1 Marr \ud83c\uddf3\ud83c\uddf1  View Edit History Popularity Trend  Login to edit  URL By  signing up  for an account on TMDb, you can post directly to Twitter and Facebook. You need to be logged in to continue. Click  here  to login or  here  to sign up.    page_wrap opened in html_head  Join the Community The Basics About TMDb Contact Us Support Forums API Blog Get Involved  Contribution Bible 3rd Party Applications Add New Movie Add New TV Show Community Guidelines Leaderboard Forums Twitter Facebook Legal Terms of Use Privacy Policy Login Sign Up", "character": ["Sylvester Daals", "Jeroen van Veen", "Evert Beukering", "Altan Uslu", "Tina Zonderland"]}