{"link": "https://www.themoviedb.org/tv/7096?language=en", "title": "The Last Enemy", "resume": "Stephen Ezard's search for the truth about the death of his brother Michael catapults him into an international conspiracy and a passionate love affair.", "rate": 68, "genre": ["Mystery", "Drama"], "cast": ["Max Beesley", "James Lance", "Geraldine James", "Paul Higgins", "Robert Carlyle"], "character": ["Michael Ezard", "Bryan Holland", "Barbara Turney", "Professor Lawrence Cooper", "David Russell"], "site_data": "html Apps Forums Leaderboard Contribute API Support Discover Movies TV Shows Movies Popular Top Rated Upcoming Now Playing TV Shows Popular Top Rated On TV Airing Today People Popular People Can't find a movie or TV show? Login to create it. en Login Sign Up  ID: 7096   Expand The Last Enemy   (2008) User Score Overview Stephen Ezard's search for the truth about the death of his brother Michael catapults him into an international conspiracy and a passionate love affair. Featured Crew Peter Berry Creator Discussions   Reviews Videos   Images   Changes Report Share Discussions General  0 Content Issues  1 Images Backdrops  3 Posters  3 Videos Trailers  0 Teasers  0 Clips  0 Featurettes  0 Opening Credits  0 Top Billed Cast Max Beesley Michael Ezard James Lance Bryan Holland Geraldine James Barbara Turney Paul Higgins Professor Lawrence Cooper Robert Carlyle David Russell Full Cast & Crew Last Season Miniseries 2008 | 5 Episodes Season 1 of The Last Enemy premiered on February 16, 2008. View All Seasons Social Reviews  0 Discussions  1 Subject Status Replies Last Reply There are no discussions for The Last Enemy. Login to be first! Go to Discussions Media Most Popular Videos  0 Backdrops  3 Posters  3 Recommendations   2003-06-29 Fortysomething 7.4  Facts Status  Ended Network Certification  - Type  Miniseries Original Language  English Runtime  60m Homepage   http://www.bbc.co.uk/programmes/b00937z6 Genres Mystery Drama Keywords london england technology conspiracy terrorism Content Score 93 Almost there... Top Contributors 35 Banana 8 colonelgrant TB 7 TMDb Bot 5 Elizabeth Jennings  View Edit History Popularity Trend  Login to edit  URL By  signing up  for an account on TMDb, you can post directly to Twitter and Facebook. You need to be logged in to continue. Click  here  to login or  here  to sign up.    page_wrap opened in html_head  Join the Community The Basics About TMDb Contact Us Support Forums API Blog Get Involved  Contribution Bible 3rd Party Applications Add New Movie Add New TV Show Community Guidelines Leaderboard Forums Twitter Facebook Legal Terms of Use Privacy Policy Login Sign Up"}