{"link": "https://www.themoviedb.org/tv/59941?language=en", "title": "The Tonight Show Starring Jimmy Fallon", "resume": "After Jay Leno's second retirement from the program, Jimmy Fallon stepped in as his permanent replacement. After 42 years in Los Angeles the program was brought back to New York.", "rate": 62, "genre": ["Comedy", "Talk"], "cast": ["Jimmy Fallon", "Steve Higgins", "The Roots", "Tariq Trotter", "Ahmir-Khalib Thompson"], "character": ["Himself - Host", "Himself - Announcer", "Themselves - House Band", "Himself - The Roots: MC (as Tariq)", "Himself - The Roots: Drums (as Questlove)"], "site_data": "html Apps Forums Leaderboard Contribute API Support Discover Movies TV Shows Movies Popular Top Rated Upcoming Now Playing TV Shows Popular Top Rated On TV Airing Today People Popular People Can't find a movie or TV show? Login to create it. en Login Sign Up  ID: 59941   Expand The Tonight Show Starring Jimmy Fallon   (2014) User Score Overview After Jay Leno's second retirement from the program, Jimmy Fallon stepped in as his permanent replacement. After 42 years in Los Angeles the program was brought back to New York. Featured Crew Sylvester Weaver Creator Discussions   Reviews Videos   Images   Changes Report Share Discussions General  1 Content Issues  0 Images Backdrops  2 Posters  1 Videos Trailers  0 Teasers  0 Clips  2 Featurettes  0 Opening Credits  0 Top Billed Cast Jimmy Fallon Himself - Host Steve Higgins Himself - Announcer The Roots Themselves - House Band Tariq Trotter Himself - The Roots: MC (as Tariq) Ahmir-Khalib Thompson Himself - The Roots: Drums (as Questlove) Full Cast & Crew Last Season Season 4 2017 | 50 Episodes Season 4 of The Tonight Show Starring Jimmy Fallon premiered on January 10, 2017. View All Seasons Social Reviews  0 Discussions  1 Subject Status Replies Last Reply w Happy Birthday Jimmy Fallon! Open 0 by wonder2wonder\n      \n     Go to Discussions Media Most Popular Videos  2 Backdrops  2 Posters  1 Recommendations   2003-01-26 Jimmy Kimmel Live! 6.0    2009-03-02 Late Night with Jimmy Fallon 6.0    2014-12-02 Late Night with Seth Meyers 5.6    2010-11-08 Conan 7.4    1993-09-13 Late Night with Conan O'Brien 7.3    2009-06-01 The Tonight Show with Conan O'Brien 7.8    2015-09-08 The Late Show with Stephen Colbert 6.4    1982-02-01 Late Night with David Letterman 7.2  Facts Status  Returning Series Network Certification TV-14 Meaning This program contains some material that many parents would find unsuitable for children under 14 years of age. Type  Talk Show Original Language  English Runtime  45m Homepage   http://www.nbc.com/the-tonight-show Genres Comedy Talk Keywords new york talk show games celebrity audience Content Score 100 Yes! Looking good! Top Contributors 85 SWFT TB 75 TMDb Bot 14 WatchFilmi 10 AbrarAAwan4  View Edit History Popularity Trend  Login to edit  URL By  signing up  for an account on TMDb, you can post directly to Twitter and Facebook. You need to be logged in to continue. Click  here  to login or  here  to sign up.    page_wrap opened in html_head  Join the Community The Basics About TMDb Contact Us Support Forums API Blog Get Involved  Contribution Bible 3rd Party Applications Add New Movie Add New TV Show Community Guidelines Leaderboard Forums Twitter Facebook Legal Terms of Use Privacy Policy Login Sign Up"}