{"link": "https://www.themoviedb.org/tv/66437?language=en", "title": "The Windsors", "resume": "Comedy soap opera re-imagining the lives of the British Royal Family as you have never seen them before.", "rate": null, "genre": ["Comedy"], "cast": ["Harry Enfield", "Haydn Gwynne", "Hugh Skinner", "Richard Goulding", "Morgana Robinson"], "site_data": "html Apps Forums Leaderboard Contribute API Support Discover Movies TV Shows Movies Popular Top Rated Upcoming Now Playing TV Shows Popular Top Rated On TV Airing Today People Popular People Can't find a movie or TV show? Login to create it. en Login Sign Up  ID: 66437   Expand The Windsors   (2016) User Score  Play Trailer Overview Comedy soap opera re-imagining the lives of the British Royal Family as you have never seen them before. Featured Crew Bert Tyler-Moore Creator George Jeffrie Creator Discussions   Reviews Videos   Images   Changes Report Share Discussions General  0 Content Issues  0 Images Backdrops  3 Posters  1 Videos Trailers  1 Teasers  0 Clips  0 Featurettes  0 Opening Credits  0 Top Billed Cast Harry Enfield Prince Charles Haydn Gwynne Camilla, Duchess of Cornwall Hugh Skinner Prince \"Wills\" William Richard Goulding Prince Harry Morgana Robinson Pippa Full Cast & Crew Last Season Season 2 2017 | 6 Episodes Season 2 of The Windsors premiered on July  5, 2017. View All Seasons Social Reviews  0 Discussions  0 Media Most Popular Videos  1 Backdrops  3 Posters  1 Recommendations   2014-10-04 The Pinkertons 6.9  Facts Status  Returning Series Network Certification 12A Meaning Films classified 12A and video works classified 12 contain material that is not generally suitable for children aged under 12. 12A requires an adult to accompany any child under 12 seeing a 12A film at the cinema. Type  Scripted Original Language  English Runtime  30m Homepage   http://www.channel4.com/programmes/the-windsors Genres Comedy Keywords reality spoof satire royal family parody british humour Content Score 100 Yes! Looking good! Top Contributors m 46 masqueraid z 15 zurman1 11 celtfan 9 Elizabeth Jennings  View Edit History Popularity Trend  Login to edit  URL By  signing up  for an account on TMDb, you can post directly to Twitter and Facebook. You need to be logged in to continue. Click  here  to login or  here  to sign up.    page_wrap opened in html_head  Join the Community The Basics About TMDb Contact Us Support Forums API Blog Get Involved  Contribution Bible 3rd Party Applications Add New Movie Add New TV Show Community Guidelines Leaderboard Forums Twitter Facebook Legal Terms of Use Privacy Policy Login Sign Up", "character": ["Prince Charles", "Camilla, Duchess of Cornwall", "Prince \"Wills\" William", "Prince Harry", "Pippa"]}