{"link": "https://www.themoviedb.org/tv/77117?language=en", "title": "Maestros de la costura", "resume": "Talent show of sewing, fashion and design, to find the best Spanish amateur dressmaker. Only 12 lucky people, among the more than 10,000 registered casting will fight to make their dream come true.", "rate": 70, "genre": ["Reality"], "cast": ["Raquel S\u00e1nchez Silva"], "character": ["Herself - Host"], "site_data": "html Apps Forums Leaderboard Contribute API Support Discover Movies TV Shows Movies Popular Top Rated Upcoming Now Playing TV Shows Popular Top Rated On TV Airing Today People Popular People Can't find a movie or TV show? Login to create it. en Login Sign Up  ID: 77117   Expand Maestros de la costura   (2018) User Score Overview Talent show of sewing, fashion and design, to find the best Spanish amateur dressmaker. Only 12 lucky people, among the more than 10,000 registered casting will fight to make their dream come true. Discussions   Reviews Videos   Images   Changes Report Share Discussions General  0 Content Issues  1 Images Backdrops  1 Posters  1 Videos Trailers  0 Teasers  0 Clips  0 Featurettes  0 Opening Credits  0 Top Billed Cast Raquel S\u00e1nchez Silva Herself - Host Full Cast & Crew Current Season Season 1 2018 | 10 Episodes Season 1 of Maestros de la costura premiered on February 12, 2018. View All Seasons Social Reviews  0 Discussions  1 Subject Status Replies Last Reply There are no discussions for Maestros de la costura. Login to be first! Go to Discussions Media Most Popular Videos  0 Backdrops  1 Posters  1 Recommendations We don't have enough data to suggest any TV shows based on Maestros de la costura. You can help by rating TV shows you've seen. Facts Status  Returning Series Network Certification  - Type  Reality Original Language  Spanish; Castilian Runtime  - Homepage   http://www.rtve.es/television/maestros-costura/ Genres Reality Keywords dressmaker fashion sewing Content Score 56 We're so close, yet so far. Top Contributors 16 davidsc99 8 Banana 8 Elizabeth Jennings l 4 luy  View Edit History Popularity Trend  Login to edit  URL By  signing up  for an account on TMDb, you can post directly to Twitter and Facebook. You need to be logged in to continue. Click  here  to login or  here  to sign up.    page_wrap opened in html_head  Join the Community The Basics About TMDb Contact Us Support Forums API Blog Get Involved  Contribution Bible 3rd Party Applications Add New Movie Add New TV Show Community Guidelines Leaderboard Forums Twitter Facebook Legal Terms of Use Privacy Policy Login Sign Up"}