{"link": "https://www.themoviedb.org/tv/76721?language=en", "title": "Wanna Be the Strongest in the World", "resume": "We don't have an overview translated in English. Help us expand our database by adding one.", "rate": null, "genre": ["Action", "Adventure", "Animation", "Comedy"], "cast": ["Ayana Taketatsu", "Kana Asumi", "Kyouko Narumi", "Haruka Tomatsu", "Suzuko Mimori"], "site_data": "html Apps Forums Leaderboard Contribute API Support Discover Movies TV Shows Movies Popular Top Rated Upcoming Now Playing TV Shows Popular Top Rated On TV Airing Today People Popular People Can't find a movie or TV show? Login to create it. en Login Sign Up  ID: 76721   Expand Wanna Be the Strongest in the World   (2013) User Score Overview We don't have an overview translated in English. Help us expand our database by adding one. Featured Crew Rion Kujo Creator Kazuho Hyoudou Creator Discussions   Reviews Videos   Images   Changes Report Share Discussions General  0 Content Issues  0 Images Backdrops  1 Posters  1 Videos Trailers  0 Teasers  0 Clips  0 Featurettes  0 Opening Credits  0 Top Billed Cast Ayana Taketatsu Sakura Hagiwara Kana Asumi Elena Miyazawa Kyouko Narumi Misaki Toyoda Haruka Tomatsu Rio Kazama Suzuko Mimori Chinatsu Suzumoto Full Cast & Crew Last Season Season 1 2013 | 12 Episodes Season 1 of Wanna Be the Strongest in the World premiered on October  6, 2013. View All Seasons Social Reviews  0 Discussions  0 Media Most Popular Videos  0 Backdrops  1 Posters  1 Recommendations We don't have enough data to suggest any TV shows based on Wanna Be the Strongest in the World. You can help by rating TV shows you've seen. Facts Original Name  \u4e16\u754c\u3067\u3044\u3061\u3070\u3093\u5f37\u304f\u306a\u308a\u305f\u3044\uff01 Status  Ended Networks - Certification 16 Meaning Can be aired only from 10:00pm Uhr to 6:00am. Type  Scripted Original Language  Japanese Runtime  23m Homepage   http://www.sekatsuyo.com/ Genres Action & Adventure Animation Comedy Keywords No keywords have been added. Content Score 86 Almost there... Top Contributors 35 kappa-papa 14 sp1ti c 7 coffinbearer  View Edit History Popularity Trend  Login to edit  URL By  signing up  for an account on TMDb, you can post directly to Twitter and Facebook. You need to be logged in to continue. Click  here  to login or  here  to sign up.    page_wrap opened in html_head  Join the Community The Basics About TMDb Contact Us Support Forums API Blog Get Involved  Contribution Bible 3rd Party Applications Add New Movie Add New TV Show Community Guidelines Leaderboard Forums Twitter Facebook Legal Terms of Use Privacy Policy Login Sign Up", "character": ["Sakura Hagiwara", "Elena Miyazawa", "Misaki Toyoda", "Rio Kazama", "Chinatsu Suzumoto"]}