{"link": "https://www.themoviedb.org/tv/76277?language=en", "title": "Kiri", "resume": "A drama dealing with the abduction and murder of a young black girl, soon to be adopted by her white foster family, and the trail of lies, blame, guilt and notoriety which follow.", "rate": 67, "genre": ["Drama", "Crime"], "cast": ["Sarah Lancashire", "Lucian Msamati", "Paapa Essiedu", "Steven Mackintosh", "Lia Williams"], "character": ["Miriam Grayson", "Tobi Akindele", "Nate Akindele", "Jim Warner", "Alice Warner"], "site_data": "html Apps Forums Leaderboard Contribute API Support Discover Movies TV Shows Movies Popular Top Rated Upcoming Now Playing TV Shows Popular Top Rated On TV Airing Today People Popular People Can't find a movie or TV show? Login to create it. en Login Sign Up  ID: 76277   Expand Kiri   (2018) User Score  Play Trailer Overview A drama dealing with the abduction and murder of a young black girl, soon to be adopted by her white foster family, and the trail of lies, blame, guilt and notoriety which follow. Featured Crew Jack Thorne Creator Discussions   Reviews Videos   Images   Changes Report Share Discussions General  0 Content Issues  0 Images Backdrops  5 Posters  2 Videos Trailers  1 Teasers  0 Clips  0 Featurettes  0 Opening Credits  0 Top Billed Cast Sarah Lancashire Miriam Grayson Lucian Msamati Tobi Akindele Paapa Essiedu Nate Akindele Steven Mackintosh Jim Warner Lia Williams Alice Warner Full Cast & Crew Current Season Season 1 2018 | 4 Episodes Season 1 of Kiri premiered on January 10, 2018. View All Seasons Social Reviews  0 Discussions  0 Media Most Popular Videos  1 Backdrops  5 Posters  2 Recommendations We don't have enough data to suggest any TV shows based on Kiri. You can help by rating TV shows you've seen. Facts Status  Ended Network Certification  - Type  Miniseries Original Language  English Runtime  45m Homepage   http://www.channel4.com/programmes/kiri Genres Drama Crime Keywords mysery Content Score 100 Yes! Looking good! Top Contributors 36 tatergator 17 Elizabeth Jennings 10 Markxist 6 Steve  View Edit History Popularity Trend  Login to edit  URL By  signing up  for an account on TMDb, you can post directly to Twitter and Facebook. You need to be logged in to continue. Click  here  to login or  here  to sign up.    page_wrap opened in html_head  Join the Community The Basics About TMDb Contact Us Support Forums API Blog Get Involved  Contribution Bible 3rd Party Applications Add New Movie Add New TV Show Community Guidelines Leaderboard Forums Twitter Facebook Legal Terms of Use Privacy Policy Login Sign Up"}