{"link": "https://www.themoviedb.org/tv/40238?language=en", "title": "Vietnam", "resume": "The Goddard family is about to be torn apart by the arrival of Australian conscription during the Vietnam War.", "rate": 0, "genre": ["War", "Politics", "Drama"], "cast": ["Barry Otto", "Nicole Kidman", "Nicholas Eadie", "Veronica Lang", "John Polson"], "character": ["Douglas Goddard", "Megan Goddard", "Phil Goddard", "Evelyn Goddard", "Serge"], "site_data": "html Apps Forums Leaderboard Contribute API Support Discover Movies TV Shows Movies Popular Top Rated Upcoming Now Playing TV Shows Popular Top Rated On TV Airing Today People Popular People Can't find a movie or TV show? Login to create it. en Login Sign Up  ID: 40238   Expand Vietnam   (1987) User Score Overview The Goddard family is about to be torn apart by the arrival of Australian conscription during the Vietnam War. Discussions   Reviews Videos   Images   Changes Report Share Discussions General  0 Content Issues  0 Images Backdrops  0 Posters  1 Videos Trailers  0 Teasers  0 Clips  0 Featurettes  0 Opening Credits  0 Top Billed Cast Barry Otto Douglas Goddard Nicole Kidman Megan Goddard Nicholas Eadie Phil Goddard Veronica Lang Evelyn Goddard John Polson Serge Full Cast & Crew Last Season Season 1 1987 | 10 Episodes Season 1 of Vietnam premiered on February 22, 1987. View All Seasons Social Reviews  0 Discussions  0 Media Most Popular Videos  0 Backdrops  0 Posters  1 Recommendations We don't have enough data to suggest any TV shows based on Vietnam. You can help by rating TV shows you've seen. Facts Status  Ended Network Certification  - Type  Miniseries Original Language  English Runtime  45m Homepage  - Genres War & Politics Drama Keywords australia vietnam war miniseries historical drama 1960s Content Score 71 Just a little bit more... Top Contributors 37 Banana 1 Stan Smith  View Edit History Popularity Trend  Login to edit  URL By  signing up  for an account on TMDb, you can post directly to Twitter and Facebook. You need to be logged in to continue. Click  here  to login or  here  to sign up.    page_wrap opened in html_head  Join the Community The Basics About TMDb Contact Us Support Forums API Blog Get Involved  Contribution Bible 3rd Party Applications Add New Movie Add New TV Show Community Guidelines Leaderboard Forums Twitter Facebook Legal Terms of Use Privacy Policy Login Sign Up"}