{"link": "https://www.themoviedb.org/tv/42456?language=en", "title": "Navarro", "resume": "Out of the norm police officer Navarro and his team investigate the most troubling, serious and heart rendering cases in the city of Paris.", "rate": 100, "genre": ["Crime", "Mystery"], "cast": ["Roger Hanin", "Maurice Vaudaux", "Emmanuelle Boidron", "Jacques Martial", "Catherine All\u00e9gret"], "character": ["Commissaire Navarro", "Waltz", "Yolande", "Bain-Marie", "Ginou"], "site_data": "html Apps Forums Leaderboard Contribute API Support Discover Movies TV Shows Movies Popular Top Rated Upcoming Now Playing TV Shows Popular Top Rated On TV Airing Today People Popular People Can't find a movie or TV show? Login to create it. en Login Sign Up  ID: 42456   Expand Navarro   (1989) User Score Overview Out of the norm police officer Navarro and his team investigate the most troubling, serious and heart rendering cases in the city of Paris. Featured Crew Tito Topin Creator Pierre Grimblat Creator Discussions   Reviews Videos   Images   Changes Report Share Discussions General  0 Content Issues  0 Images Backdrops  1 Posters  3 Videos Trailers  0 Teasers  0 Clips  0 Featurettes  0 Opening Credits  0 Top Billed Cast Roger Hanin Commissaire Navarro Maurice Vaudaux Waltz Emmanuelle Boidron Yolande Jacques Martial Bain-Marie Catherine All\u00e9gret Ginou Full Cast & Crew Last Season Season 19 2007 | 4 Episodes Season 19 of Navarro premiered on February  1, 2007. View All Seasons Social Reviews  0 Discussions  0 Media Most Popular Videos  0 Backdrops  1 Posters  3 Recommendations We don't have enough data to suggest any TV shows based on Navarro. You can help by rating TV shows you've seen. Facts Status  Ended Network Certification 16+ Meaning Only teens the age of 16 or older can watch. Type  Scripted Original Language  French Runtime  90m Homepage  - Genres Crime Mystery Keywords paris police Content Score 100 Yes! Looking good! Top Contributors n 50 navarro2018 M 48 MissisStoker z 47 zoroman1975 25 Banana  View Edit History Popularity Trend  Login to edit  URL By  signing up  for an account on TMDb, you can post directly to Twitter and Facebook. You need to be logged in to continue. Click  here  to login or  here  to sign up.    page_wrap opened in html_head  Join the Community The Basics About TMDb Contact Us Support Forums API Blog Get Involved  Contribution Bible 3rd Party Applications Add New Movie Add New TV Show Community Guidelines Leaderboard Forums Twitter Facebook Legal Terms of Use Privacy Policy Login Sign Up"}