{"link": "https://www.themoviedb.org/tv/62644?language=en", "title": "The Producers", "resume": "The drama is set in the backstage world of broadcasting industry. The story revolves around the dynamic work and life of people who work in entertainment division of television network.", "rate": null, "genre": ["Comedy"], "cast": ["Cha Tae-hyun", "Gong Hyo-jin", "Kim Soo-Hyun", "IU", "Im Ye-jin"], "site_data": "html Apps Forums Leaderboard Contribute API Support Discover Movies TV Shows Movies Popular Top Rated Upcoming Now Playing TV Shows Popular Top Rated On TV Airing Today People Popular People Can't find a movie or TV show? Login to create it. en Login Sign Up  ID: 62644   Expand The Producers   (2015) User Score  Play Trailer Overview The drama is set in the backstage world of broadcasting industry. The story revolves around the dynamic work and life of people who work in entertainment division of television network. Discussions   Reviews Videos   Images   Changes Report Share Discussions General  0 Content Issues  0 Images Backdrops  1 Posters  7 Videos Trailers  1 Teasers  0 Clips  0 Featurettes  0 Opening Credits  0 Top Billed Cast Cha Tae-hyun Ra Joon-mo Gong Hyo-jin Tak Ye-ji Kim Soo-Hyun Baek Seung-chan IU Cindy Im Ye-jin Park Bong-soon Full Cast & Crew Last Season Season 1 2015 | 13 Episodes Season 1 of The Producers premiered on May 15, 2015. View All Seasons Social Reviews  0 Discussions  0 Media Most Popular Videos  1 Backdrops  1 Posters  7 Recommendations   2013-12-09 The Prime Minister and I 7.1    2014-07-23 It's Okay, That's Love 9.3    2017-04-17 My Secret Romance 7.6    2014-02-09 Cheo Yong 7.4    2016-11-16 Weightlifting Fairy Kim Bok-Joo 8.9    2009-01-05 Boys Over Flowers 7.8    2016-07-11 Bring It On, Ghost 6.9    2016-02-24 Descendants of the Sun 6.5  Facts Original Name  \ud504\ub85c\ub4c0\uc0ac Status  Ended Network Certification  - Type  Scripted Original Language  Korean Runtime  80m Homepage   http://www.kbs.co.kr/drama/produca/ Genres Comedy Keywords korea Content Score 93 Almost there... Top Contributors M 59 Maria180493 d 10 daphie s 5 sheva_vitali t 4 tmdb38202327  View Edit History Popularity Trend  Login to edit  URL By  signing up  for an account on TMDb, you can post directly to Twitter and Facebook. You need to be logged in to continue. Click  here  to login or  here  to sign up.    page_wrap opened in html_head  Join the Community The Basics About TMDb Contact Us Support Forums API Blog Get Involved  Contribution Bible 3rd Party Applications Add New Movie Add New TV Show Community Guidelines Leaderboard Forums Twitter Facebook Legal Terms of Use Privacy Policy Login Sign Up", "character": ["Ra Joon-mo", "Tak Ye-ji", "Baek Seung-chan", "Cindy", "Park Bong-soon"]}