{"link": "https://www.themoviedb.org/tv/8783?language=en", "title": "Fashion Police", "resume": "Weekly news and talk about the latest red carpet and every day fashion trends of Hollywood celebrities.", "rate": null, "genre": ["Talk", "Comedy"], "cast": ["Joan Rivers"], "site_data": "html Apps Forums Leaderboard Contribute API Support Discover Movies TV Shows Movies Popular Top Rated Upcoming Now Playing TV Shows Popular Top Rated On TV Airing Today People Popular People Can't find a movie or TV show? Login to create it. en Login Sign Up  ID: 8783   Expand Fashion Police User Score Overview Weekly news and talk about the latest red carpet and every day fashion trends of Hollywood celebrities. Discussions   Reviews Videos   Images   Changes Report Share Discussions General  0 Content Issues  0 Images Backdrops  2 Posters  3 Videos Trailers  0 Teasers  0 Clips  0 Featurettes  0 Opening Credits  0 Top Billed Cast Joan Rivers Host Full Cast & Crew Last Season Season 16 2017 | 7 Episodes Season 16 of Fashion Police premiered on January  9, 2017. View All Seasons Social Reviews  0 Discussions  0 Media Most Popular Videos  0 Backdrops  2 Posters  3 Facts Status  Returning Series Network Certification  - Type  Talk Show Original Language  English Runtime  30m, 25m, 60m Homepage   http://www.eonline.com/shows/fashion_police Genres Talk Comedy Keywords fashion Content Score 50 Still needs a little work. Top Contributors 12 Banana 7 Elizabeth Jennings m 4 mamake j 2 jess21  View Edit History Popularity Trend  Login to edit  URL By  signing up  for an account on TMDb, you can post directly to Twitter and Facebook. You need to be logged in to continue. Click  here  to login or  here  to sign up.    page_wrap opened in html_head  Join the Community The Basics About TMDb Contact Us Support Forums API Blog Get Involved  Contribution Bible 3rd Party Applications Add New Movie Add New TV Show Community Guidelines Leaderboard Forums Twitter Facebook Legal Terms of Use Privacy Policy Login Sign Up", "character": ["Host"]}