{"link": "https://www.themoviedb.org/tv/67234?language=en", "title": "La vie, la vie", "resume": "The joys and trials of five funny, intelligent and sexy young adults bound by the sacred ties of friendship.", "rate": 0, "genre": ["Drama"], "cast": ["Patrick Labb\u00e9", "Julie McClemens ", "Vincent Graton", "Normand Daneau", "Macha Limonchik"], "character": ["Simon", "Marie", "Jacques", "Vincent", "Claire"], "site_data": "html Apps Forums Leaderboard Contribute API Support Discover Movies TV Shows Movies Popular Top Rated Upcoming Now Playing TV Shows Popular Top Rated On TV Airing Today People Popular People Can't find a movie or TV show? Login to create it. en Login Sign Up  ID: 67234   Expand La vie, la vie   (2001) User Score Overview The joys and trials of five funny, intelligent and sexy young adults bound by the sacred ties of friendship. Discussions   Reviews Videos   Images   Changes Report Share Discussions General  0 Content Issues  0 Images Backdrops  1 Posters  1 Videos Trailers  0 Teasers  0 Clips  0 Featurettes  0 Opening Credits  0 Top Billed Cast Patrick Labb\u00e9 Simon Julie McClemens  Marie Vincent Graton Jacques Normand Daneau Vincent Macha Limonchik Claire Full Cast & Crew Last Season Season 3 2002 | 13 Episodes Season 3 of La vie, la vie premiered on January 21, 2002. View All Seasons Social Reviews  0 Discussions  0 Media Most Popular Videos  0 Backdrops  1 Posters  1 Recommendations We don't have enough data to suggest any TV shows based on La vie, la vie. You can help by rating TV shows you've seen. Facts Status  Ended Network Certification G Meaning Suitable for general audiences. Programming suitable for the entire family with mild violence, and mild profanity and/or censored language. Type  Scripted Original Language  French Runtime  23m Homepage  - Genres Drama Keywords friendship quebec thirty something Content Score 86 Almost there... Top Contributors 39 Banana  View Edit History Popularity Trend  Login to edit  URL By  signing up  for an account on TMDb, you can post directly to Twitter and Facebook. You need to be logged in to continue. Click  here  to login or  here  to sign up.    page_wrap opened in html_head  Join the Community The Basics About TMDb Contact Us Support Forums API Blog Get Involved  Contribution Bible 3rd Party Applications Add New Movie Add New TV Show Community Guidelines Leaderboard Forums Twitter Facebook Legal Terms of Use Privacy Policy Login Sign Up"}