{"link": "https://www.themoviedb.org/tv/44194?language=en", "title": "Deception", "resume": "A detective goes undercover to investigate the murder of her best friend.", "rate": 51, "genre": ["Soap", "Mystery", "Drama"], "cast": ["Laz Alonso", "Marin Hinkle", "Victor Garber", "Tate Donovan", "Meagan Good"], "character": ["Will Moreno", "Samantha Bowers", "Robert Bowers", "Edward Bowers", "Joanna Locasto"], "site_data": "html Apps Forums Leaderboard Contribute API Support Discover Movies TV Shows Movies Popular Top Rated Upcoming Now Playing TV Shows Popular Top Rated On TV Airing Today People Popular People Can't find a movie or TV show? Login to create it. en Login Sign Up  ID: 44194   Expand Deception   (2013) User Score  Play Trailer Overview A detective goes undercover to investigate the murder of her best friend. Featured Crew Liz Heldens Creator Discussions   Reviews Videos   Images   Changes Report Share Discussions General  2 Content Issues  0 Images Backdrops  2 Posters  3 Videos Trailers  1 Teasers  0 Clips  0 Featurettes  0 Opening Credits  0 Top Billed Cast Laz Alonso Will Moreno Marin Hinkle Samantha Bowers Victor Garber Robert Bowers Tate Donovan Edward Bowers Meagan Good Joanna Locasto Full Cast & Crew Last Season Season 1 2013 | 11 Episodes Season 1 of Deception premiered on January  7, 2013. View All Seasons Social Reviews  0 Discussions  2 Subject Status Replies Last Reply S Joanna's mom has always been single? Open 1 by  Lloyd w Joanna: Happy Birthday Meagan Good! Open 0 by wonder2wonder\n      \n     Go to Discussions Media Most Popular Videos  1 Backdrops  2 Posters  3 Recommendations   2014-07-20 The Lottery 4.9    2012-10-11 Copper 6.0    2014-06-09 Murder in the First 5.0    2015-01-27 Stalker 5.8  Facts Status  Cancelled Network Certification  - Type  Scripted Original Language  English Runtime  43m Homepage   http://www.nbc.com/deception/ Genres Soap Mystery Drama Keywords undercover loss of loved one wealthy police detective female detective murder investigation Content Score 100 Yes! Looking good! Top Contributors 16 Banana z 4 zurman1 R 4 Rebecca a 3 asusar  View Edit History Popularity Trend  Login to edit  URL By  signing up  for an account on TMDb, you can post directly to Twitter and Facebook. You need to be logged in to continue. Click  here  to login or  here  to sign up.    page_wrap opened in html_head  Join the Community The Basics About TMDb Contact Us Support Forums API Blog Get Involved  Contribution Bible 3rd Party Applications Add New Movie Add New TV Show Community Guidelines Leaderboard Forums Twitter Facebook Legal Terms of Use Privacy Policy Login Sign Up"}