{"link": "https://www.themoviedb.org/tv/76783?language=en", "title": "Cennetin G\u00f6zya\u015flar\u0131", "resume": "We don't have an overview translated in English. Help us expand our database by adding one.", "rate": 0, "genre": ["Drama"], "cast": ["Esra Ronabar", "Zehra Y\u0131lmaz", "Oktay \u00c7ubuk", "Ebru Nil Ayd\u0131n", "Ebru Destan"], "character": ["Arzu Soyer", "Melisa Soyer", "\u00d6mer G\u00fcrsu", "Sema Soyer", "\u00d6zlem Ar\u0131soy"], "site_data": "html Apps Forums Leaderboard Contribute API Support Discover Movies TV Shows Movies Popular Top Rated Upcoming Now Playing TV Shows Popular Top Rated On TV Airing Today People Popular People Can't find a movie or TV show? Login to create it. en Login Sign Up  ID: 76783   Expand Cennetin G\u00f6zya\u015flar\u0131   (2017) User Score Overview We don't have an overview translated in English. Help us expand our database by adding one. Discussions   Reviews Videos   Images   Changes Report Share Discussions General  0 Content Issues  0 Images Backdrops  1 Posters  1 Videos Trailers  0 Teasers  0 Clips  0 Featurettes  0 Opening Credits  0 Top Billed Cast Esra Ronabar Arzu Soyer Zehra Y\u0131lmaz Melisa Soyer Oktay \u00c7ubuk \u00d6mer G\u00fcrsu Ebru Nil Ayd\u0131n Sema Soyer Ebru Destan \u00d6zlem Ar\u0131soy Full Cast & Crew Last Season Season 1 2017 | 23 Episodes Season 1 of Cennetin G\u00f6zya\u015flar\u0131 premiered on September 24, 2017. View All Seasons Social Reviews  0 Discussions  0 Media Most Popular Videos  0 Backdrops  1 Posters  1 Recommendations We don't have enough data to suggest any TV shows based on Cennetin G\u00f6zya\u015flar\u0131. You can help by rating TV shows you've seen. Facts Status  Returning Series Network Certification  - Type  Scripted Original Language  Turkish Runtime  120m Homepage   http://www.surecfilm.com.tr/cennetin-gozyaslari Genres Drama Keywords No keywords have been added. Content Score 79 Pump it up! We're close now. Top Contributors 12 Gorke07 9 moviefars a 8 alicannklc  View Edit History Popularity Trend  Login to edit  URL By  signing up  for an account on TMDb, you can post directly to Twitter and Facebook. You need to be logged in to continue. Click  here  to login or  here  to sign up.    page_wrap opened in html_head  Join the Community The Basics About TMDb Contact Us Support Forums API Blog Get Involved  Contribution Bible 3rd Party Applications Add New Movie Add New TV Show Community Guidelines Leaderboard Forums Twitter Facebook Legal Terms of Use Privacy Policy Login Sign Up"}