{"link": "https://www.themoviedb.org/tv/67386?language=en", "title": "Blaise", "resume": "We don't have an overview translated in English. Help us expand our database by adding one.", "rate": 17, "genre": ["Animation", "Comedy"], "cast": ["Jacques Gamblin", "L\u00e9a Drucker", "Lyn Thibault"], "character": ["Jacques (voice)", "Carole (voice)", "Blaise (voice)"], "site_data": "html Apps Forums Leaderboard Contribute API Support Discover Movies TV Shows Movies Popular Top Rated Upcoming Now Playing TV Shows Popular Top Rated On TV Airing Today People Popular People Can't find a movie or TV show? Login to create it. en Login Sign Up  ID: 67386   Expand Blaise   (2016) User Score Overview We don't have an overview translated in English. Help us expand our database by adding one. Featured Crew Dimitri Planchon Creator Discussions   Reviews Videos   Images   Changes Report Share Discussions General  0 Content Issues  0 Images Backdrops  0 Posters  1 Videos Trailers  0 Teasers  0 Clips  0 Featurettes  0 Opening Credits  0 Top Billed Cast Jacques Gamblin Jacques (voice) L\u00e9a Drucker Carole (voice) Lyn Thibault Blaise (voice) Full Cast & Crew Last Season Season 1 2016 | 30 Episodes Season 1 of Blaise premiered on August 29, 2016. View All Seasons Social Reviews  0 Discussions  0 Media Most Popular Videos  0 Backdrops  0 Posters  1 Recommendations We don't have enough data to suggest any TV shows based on Blaise. You can help by rating TV shows you've seen. Facts Status  Returning Series Network Certification  - Type  Scripted Original Language  French Runtime  3m Homepage   http://creative.arte.tv/fr/series/blaise Genres Animation Comedy Keywords black humor based on comic family short Content Score 43 There's no 'I' in team... Top Contributors 29 Simon V. 13 Banana m 1 mitati 1 reiru312  View Edit History Popularity Trend  Login to edit  URL By  signing up  for an account on TMDb, you can post directly to Twitter and Facebook. You need to be logged in to continue. Click  here  to login or  here  to sign up.    page_wrap opened in html_head  Join the Community The Basics About TMDb Contact Us Support Forums API Blog Get Involved  Contribution Bible 3rd Party Applications Add New Movie Add New TV Show Community Guidelines Leaderboard Forums Twitter Facebook Legal Terms of Use Privacy Policy Login Sign Up"}