{"link": "https://www.themoviedb.org/tv/46347?language=en", "title": "The Town", "resume": "Following a family tragedy, 30-year-old Mark Nicholas returns to the town where he grew up. After ten years away, coming home is harder than Mark could ever have imagined.", "rate": 65, "genre": ["Drama"], "cast": ["Andrew Scott", "Kelly Adams", "Aisling Bea", "Martin Clunes", "Jon Foster"], "character": ["Mark Nicholas", "Lucy", "Carly", "Len Robson", "Karl"], "site_data": "html Apps Forums Leaderboard Contribute API Support Discover Movies TV Shows Movies Popular Top Rated Upcoming Now Playing TV Shows Popular Top Rated On TV Airing Today People Popular People Can't find a movie or TV show? Login to create it. en Login Sign Up  ID: 46347   Expand The Town   (2012) User Score Overview Following a family tragedy, 30-year-old Mark Nicholas returns to the town where he grew up. After ten years away, coming home is harder than Mark could ever have imagined. Featured Crew Mike Bartlett Creator Discussions   Reviews Videos   Images   Changes Report Share Discussions General  0 Content Issues  0 Images Backdrops  3 Posters  7 Videos Trailers  0 Teasers  0 Clips  0 Featurettes  0 Opening Credits  0 Top Billed Cast Andrew Scott Mark Nicholas Kelly Adams Lucy Aisling Bea Carly Martin Clunes Len Robson Jon Foster Karl Full Cast & Crew Last Season Season 1 2012 | 3 Episodes Season 1 of The Town premiered on December  5, 2012. View All Seasons Social Reviews  0 Discussions  0 Media Most Popular Videos  0 Backdrops  3 Posters  7 Recommendations We don't have enough data to suggest any TV shows based on The Town. You can help by rating TV shows you've seen. Facts Status  Ended Network Certification  - Type  Miniseries Original Language  English Runtime  60m Homepage  - Genres Drama Keywords miniseries hometown Content Score 93 Almost there... Top Contributors 34 Elizabeth Jennings TB 17 TMDb Bot 5 Banana z 4 zurman1  View Edit History Popularity Trend  Login to edit  URL By  signing up  for an account on TMDb, you can post directly to Twitter and Facebook. You need to be logged in to continue. Click  here  to login or  here  to sign up.    page_wrap opened in html_head  Join the Community The Basics About TMDb Contact Us Support Forums API Blog Get Involved  Contribution Bible 3rd Party Applications Add New Movie Add New TV Show Community Guidelines Leaderboard Forums Twitter Facebook Legal Terms of Use Privacy Policy Login Sign Up"}