{"link": "https://www.themoviedb.org/tv/76960?language=en", "title": "Hold the Sunset", "resume": "Edith's dreams of retirement to the sun with her long-term suitor Phil are shattered when her 50-year-old son Roger arrives home, seeking to recapture his boyhood happiness.", "rate": 60, "genre": ["Comedy"], "cast": ["Alison Steadman", "John Cleese", "Jason Watkins", "Rosie Cavaliero", "Peter Egan"], "character": ["Edith", "Phil", "Roger", "Wendy", "Mr. Dugdale"], "site_data": "html Apps Forums Leaderboard Contribute API Support Discover Movies TV Shows Movies Popular Top Rated Upcoming Now Playing TV Shows Popular Top Rated On TV Airing Today People Popular People Can't find a movie or TV show? Login to create it. en Login Sign Up  ID: 76960   Expand Hold the Sunset   (2018) User Score  Play Trailer Overview Edith's dreams of retirement to the sun with her long-term suitor Phil are shattered when her 50-year-old son Roger arrives home, seeking to recapture his boyhood happiness. Discussions   Reviews Videos   Images   Changes Report Share Discussions General  0 Content Issues  0 Images Backdrops  3 Posters  3 Videos Trailers  1 Teasers  0 Clips  0 Featurettes  0 Opening Credits  0 Top Billed Cast Alison Steadman Edith John Cleese Phil Jason Watkins Roger Rosie Cavaliero Wendy Peter Egan Mr. Dugdale Full Cast & Crew Current Season Season 1 2018 | 6 Episodes Season 1 of Hold the Sunset premiered on February 17, 2018. View All Seasons Social Reviews  0 Discussions  0 Media Most Popular Videos  1 Backdrops  3 Posters  3 Recommendations We don't have enough data to suggest any TV shows based on Hold the Sunset. You can help by rating TV shows you've seen. Facts Status  Returning Series Network Certification PG Meaning PG stands for Parental Guidance. This means a film is suitable for general viewing, but some scenes may be unsuitable for young children. A PG film should not unsettle a child aged around eight or older. Type  Scripted Original Language  English Runtime  29m Homepage   http://www.bbc.co.uk/programmes/b09sz9mr Genres Comedy Keywords mother son surreal retirement couple sitcom british humour Content Score 93 Almost there... Top Contributors 37 Elizabeth Jennings 9 actors O 5 Ozbourne s 4 speedycars  View Edit History Popularity Trend  Login to edit  URL By  signing up  for an account on TMDb, you can post directly to Twitter and Facebook. You need to be logged in to continue. Click  here  to login or  here  to sign up.    page_wrap opened in html_head  Join the Community The Basics About TMDb Contact Us Support Forums API Blog Get Involved  Contribution Bible 3rd Party Applications Add New Movie Add New TV Show Community Guidelines Leaderboard Forums Twitter Facebook Legal Terms of Use Privacy Policy Login Sign Up"}