{"link": "https://www.themoviedb.org/tv/496?language=en", "title": "Family Ties", "resume": "Former 1960s flower children Steven and Elyse Keaton raise their conservative son Alex, daughters Mallory and Jennifer, and later, youngest child Andrew.", "rate": 72, "genre": ["Comedy"], "cast": ["Meredith Baxter", "Michael Gross", "Justine Bateman", "Brian Bonsall", "Tina Yothers"], "character": ["Elyse Keaton", "Steven Keaton", "Mallory Keaton", "Andy Keaton", "Jennifer Keaton"], "site_data": "html Apps Forums Leaderboard Contribute API Support Discover Movies TV Shows Movies Popular Top Rated Upcoming Now Playing TV Shows Popular Top Rated On TV Airing Today People Popular People Can't find a movie or TV show? Login to create it. en Login Sign Up  ID: 496   Expand Family Ties   (1982) User Score Overview Former 1960s flower children Steven and Elyse Keaton raise their conservative son Alex, daughters Mallory and Jennifer, and later, youngest child Andrew. Featured Crew Gary David Goldberg Creator Discussions   Reviews Videos   Images   Changes Report Share Discussions General  2 Content Issues  0 Images Backdrops  3 Posters  3 Videos Trailers  0 Teasers  0 Clips  0 Featurettes  0 Opening Credits  0 Top Billed Cast Meredith Baxter Elyse Keaton Michael Gross Steven Keaton Justine Bateman Mallory Keaton Brian Bonsall Andy Keaton Tina Yothers Jennifer Keaton Full Cast & Crew Last Season Season 7 1988 | 26 Episodes Season 7 of Family Ties premiered on October 30, 1988. View All Seasons Social Reviews  0 Discussions  2 Subject Status Replies Last Reply S Uncle Ned Open 0 by Strannger18\n      \n     S My name is Alex two parter Open 0 by Strannger18\n      \n     Go to Discussions Media Most Popular Videos  0 Backdrops  3 Posters  3 Recommendations   1984-09-20 Who's the Boss? 6.4    1985-09-24 Growing Pains 6.1    1984-09-20 The Cosby Show 6.8    1986-03-25 Perfect Strangers 6.6    1977-09-24 The Love Boat 5.8    1991-09-17 Home Improvement 7.0    1978-11-03 Diff'rent Strokes 5.7    1974-01-15 Happy Days 7.3  Facts Status  Ended Network Certification  - Type  Scripted Original Language  English Runtime  30m, 22m, 24m Homepage  - Genres Comedy Keywords conservatism republican family democrat sexual liberation sitcom liberalism Content Score 93 Almost there... Top Contributors 14 Banana 12 Elizabeth Jennings r 4 rpovas 4 karak  View Edit History Popularity Trend  Login to edit  URL By  signing up  for an account on TMDb, you can post directly to Twitter and Facebook. You need to be logged in to continue. Click  here  to login or  here  to sign up.    page_wrap opened in html_head  Join the Community The Basics About TMDb Contact Us Support Forums API Blog Get Involved  Contribution Bible 3rd Party Applications Add New Movie Add New TV Show Community Guidelines Leaderboard Forums Twitter Facebook Legal Terms of Use Privacy Policy Login Sign Up"}