{"link": "https://www.themoviedb.org/tv/70977?language=en", "title": "Nestor Burma", "resume": "We don't have an overview translated in English. Help us expand our database by adding one.", "rate": 0, "genre": ["Drama", "Mystery"], "cast": ["Cerise", "Fanny Gilles", "Juliette Junot", "Guy Marchand", "Pierre Tornade"], "character": ["Solange", "Marion", "Amandine", "Nestor Burma", "Commissaire Faroux"], "site_data": "html Apps Forums Leaderboard Contribute API Support Discover Movies TV Shows Movies Popular Top Rated Upcoming Now Playing TV Shows Popular Top Rated On TV Airing Today People Popular People Can't find a movie or TV show? Login to create it. en Login Sign Up  ID: 70977   Expand Nestor Burma   (1991) User Score Overview We don't have an overview translated in English. Help us expand our database by adding one. Featured Crew Eric Assous Creator Pascal Bancou Creator Christian Bouveron Creator Lionel Cherki Creator Cl\u00e9ment Delage Creator Alexandra Deman Creator Dominique Golfier Creator Victor Ha\u00efm Creator Henri Helman Creator David-Andr\u00e9 Lang Creator Benjamin Legrand Creator Michel Lengliney Creator L\u00e9o Malet Creator Daniel Riche Creator Christian Rullier Creator Alain Schwartzstein Creator Pierre Uytterhoeven Creator Christian Watton Creator Discussions   Reviews Videos   Images   Changes Report Share Discussions General  0 Content Issues  0 Images Backdrops  0 Posters  1 Videos Trailers  0 Teasers  0 Clips  0 Featurettes  0 Opening Credits  0 Top Billed Cast Cerise Solange Fanny Gilles Marion Juliette Junot Amandine Guy Marchand Nestor Burma Pierre Tornade Commissaire Faroux Full Cast & Crew Last Season Season 8 2003 | 3 Episodes Season 8 of Nestor Burma premiered on January 17, 2003. View All Seasons Social Reviews  0 Discussions  0 Media Most Popular Videos  0 Backdrops  0 Posters  1 Recommendations We don't have enough data to suggest any TV shows based on Nestor Burma. You can help by rating TV shows you've seen. Facts Status  Ended Networks Certification 12+ Meaning Only kids the age of 12 or older can watch. Type  Scripted Original Language  French Runtime  - Homepage   http://www.nestor-burma.com/index.html Genres Drama Mystery Keywords detective noir thriller criminal Content Score 71 Just a little bit more... Top Contributors z 194 zahodum  View Edit History Popularity Trend  Login to edit  URL By  signing up  for an account on TMDb, you can post directly to Twitter and Facebook. You need to be logged in to continue. Click  here  to login or  here  to sign up.    page_wrap opened in html_head  Join the Community The Basics About TMDb Contact Us Support Forums API Blog Get Involved  Contribution Bible 3rd Party Applications Add New Movie Add New TV Show Community Guidelines Leaderboard Forums Twitter Facebook Legal Terms of Use Privacy Policy Login Sign Up"}