{"link": "https://www.themoviedb.org/tv/60694?language=en", "title": "Last Week Tonight with John Oliver", "resume": "A half-hour satirical look at the week in news, politics and current events.", "rate": 80, "genre": ["Talk", "Comedy"], "cast": ["John Oliver", "David Kaye"], "character": ["Himself - Host", "Narrator"], "site_data": "html Apps Forums Leaderboard Contribute API Support Discover Movies TV Shows Movies Popular Top Rated Upcoming Now Playing TV Shows Popular Top Rated On TV Airing Today People Popular People Can't find a movie or TV show? Login to create it. en Login Sign Up  ID: 60694   Expand Last Week Tonight with John Oliver   (2014) User Score  Play Trailer Overview A half-hour satirical look at the week in news, politics and current events. Featured Crew John Oliver Creator Discussions   Reviews Videos   Images   Changes Report Share Discussions General  2 Content Issues  0 Images Backdrops  12 Posters  7 Videos Trailers  1 Teasers  0 Clips  0 Featurettes  0 Opening Credits  0 Top Billed Cast John Oliver Himself - Host David Kaye Narrator Full Cast & Crew Current Season Season 5 2018 | 17 Episodes Season 5 of Last Week Tonight with John Oliver premiered on February 18, 2018. View All Seasons Social Reviews  0 Discussions  2 Subject Status Replies Last Reply I'm done with this show Open 2 by  Froberg Excellent programme Open 3 by  mst3m1 Go to Discussions Media Most Popular Videos  1 Backdrops  12 Posters  7 Recommendations   1996-07-22 The Daily Show with Trevor Noah 6.7    2005-10-17 The Colbert Report 7.0    2009-09-17 Community 7.9    2003-11-02 Arrested Development 8.2    2012-06-24 The Newsroom 7.8    2005-08-04 It's Always Sunny in Philadelphia 8.2    2003-02-21 Real Time with Bill Maher 6.3    2009-09-16 Archer 7.9  Facts Status  Returning Series Network Certification TV-MA Meaning This program is specifically designed to be viewed by adults and therefore may be unsuitable for children under 17 Type  News Original Language  English Runtime  30m Homepage   http://www.hbo.com/last-week-tonight-with-john-oliver Genres Talk Comedy Keywords news broadcast political satire world politics Content Score 71 Just a little bit more... Top Contributors 86 Elizabeth Jennings 45 lmvd TB 19 TMDb Bot 11 Nero Kosonen  View Edit History Popularity Trend  Login to edit  URL By  signing up  for an account on TMDb, you can post directly to Twitter and Facebook. You need to be logged in to continue. Click  here  to login or  here  to sign up.    page_wrap opened in html_head  Join the Community The Basics About TMDb Contact Us Support Forums API Blog Get Involved  Contribution Bible 3rd Party Applications Add New Movie Add New TV Show Community Guidelines Leaderboard Forums Twitter Facebook Legal Terms of Use Privacy Policy Login Sign Up"}