{"link": "https://www.themoviedb.org/tv/36126?language=en", "title": "Al salir de clase", "resume": "We don't have an overview translated in English. Help us expand our database by adding one.", "rate": 0, "genre": ["Drama", "Comedy"], "cast": ["Sergio Villoldo", "Alex Cueva", "Carola Baleztena", "Patricia Fig\u00f3n", "Nela Arag\u00f3n"], "character": ["Alex Chac\u00f3n", "Jorge Dur\u00e1n Costa", "Luc\u00eda Marti", "Eva Agusti", "Camino Ru\u00edz"], "site_data": "html Apps Forums Leaderboard Contribute API Support Discover Movies TV Shows Movies Popular Top Rated Upcoming Now Playing TV Shows Popular Top Rated On TV Airing Today People Popular People Can't find a movie or TV show? Login to create it. en Login Sign Up  ID: 36126   Expand Al salir de clase   (1997) User Score Overview We don't have an overview translated in English. Help us expand our database by adding one. Discussions   Reviews Videos   Images   Changes Report Share Discussions General  0 Content Issues  0 Images Backdrops  1 Posters  1 Videos Trailers  0 Teasers  0 Clips  0 Featurettes  0 Opening Credits  0 Top Billed Cast Sergio Villoldo Alex Chac\u00f3n Alex Cueva Jorge Dur\u00e1n Costa Carola Baleztena Luc\u00eda Marti Patricia Fig\u00f3n Eva Agusti Nela Arag\u00f3n Camino Ru\u00edz Full Cast & Crew Last Season Season 3 2000 | 1 Episode Season 3 of Al salir de clase premiered on September  1, 2000. View All Seasons Social Reviews  0 Discussions  0 Media Most Popular Videos  0 Backdrops  1 Posters  1 Recommendations We don't have enough data to suggest any TV shows based on Al salir de clase. You can help by rating TV shows you've seen. Facts Status  Ended Networks - Certification  - Type  Scripted Original Language  Spanish; Castilian Runtime  35m Homepage   http://www.mitele.es/series-online/al-salir-de-clase/ Genres Drama Comedy Keywords young adult asdc entretenimiento Content Score 79 Pump it up! We're close now. Top Contributors O 199 Onofrete a 25 aballester 9 prm96 N 5 NoemiTalavera  View Edit History Popularity Trend  Login to edit  URL By  signing up  for an account on TMDb, you can post directly to Twitter and Facebook. You need to be logged in to continue. Click  here  to login or  here  to sign up.    page_wrap opened in html_head  Join the Community The Basics About TMDb Contact Us Support Forums API Blog Get Involved  Contribution Bible 3rd Party Applications Add New Movie Add New TV Show Community Guidelines Leaderboard Forums Twitter Facebook Legal Terms of Use Privacy Policy Login Sign Up"}