{"link": "https://www.themoviedb.org/tv/55664?language=en", "title": "Hotel Adlon", "resume": "A three-part German mini-series about the luxury hotel in Berlin.", "rate": null, "genre": ["Drama"], "cast": ["Rosemarie Fendel", "Amy Mu\u00dful", "Ken Duken", "Burghart Klau\u00dfner", "Johann von B\u00fclow"], "site_data": "html Apps Forums Leaderboard Contribute API Support Discover Movies TV Shows Movies Popular Top Rated Upcoming Now Playing TV Shows Popular Top Rated On TV Airing Today People Popular People Can't find a movie or TV show? Login to create it. en Login Sign Up  ID: 55664   Expand Hotel Adlon   (2013) User Score  Play Trailer Overview A three-part German mini-series about the luxury hotel in Berlin. Featured Crew Oliver Berben Creator Discussions   Reviews Videos   Images   Changes Report Share Discussions General  0 Content Issues  1 Images Backdrops  7 Posters  4 Videos Trailers  1 Teasers  0 Clips  0 Featurettes  0 Opening Credits  0 Top Billed Cast Rosemarie Fendel Sonja Schadt (93) Amy Mu\u00dful Pagenm\u00e4dchen Ken Duken Julian Zimmermann Burghart Klau\u00dfner Lorenz Adlon Johann von B\u00fclow Sebastian von Tennen Full Cast & Crew Last Season Season 1 2013 | 3 Episodes Season 1 of Hotel Adlon premiered on January  6, 2013. View All Seasons Social Reviews  0 Discussions  1 Subject Status Replies Last Reply There are no discussions for Hotel Adlon. Login to be first! Go to Discussions Media Most Popular Videos  1 Backdrops  7 Posters  4 Recommendations We don't have enough data to suggest any TV shows based on Hotel Adlon. You can help by rating TV shows you've seen. Facts Original Name  Das Adlon. Eine Familiensaga Status  Ended Network Certification 12 Meaning The broadcaster must take the decision about the air time by taking in consideration the impact on young children in the timeframe from 6:00am to 8:00pm. Type  Miniseries Original Language  German Runtime  - Homepage  - Genres Drama Keywords hotel berlin world war i world war ii german adlon Content Score 100 Yes! Looking good! Top Contributors TB 36 TMDb Bot S 36 Synoxion 14 Banana S 6 Samara  View Edit History Popularity Trend  Login to edit  URL By  signing up  for an account on TMDb, you can post directly to Twitter and Facebook. You need to be logged in to continue. Click  here  to login or  here  to sign up.    page_wrap opened in html_head  Join the Community The Basics About TMDb Contact Us Support Forums API Blog Get Involved  Contribution Bible 3rd Party Applications Add New Movie Add New TV Show Community Guidelines Leaderboard Forums Twitter Facebook Legal Terms of Use Privacy Policy Login Sign Up", "character": ["Sonja Schadt (93)", "Pagenm\u00e4dchen", "Julian Zimmermann", "Lorenz Adlon", "Sebastian von Tennen"]}