{"link": "https://www.themoviedb.org/tv/69220?language=en", "title": "Blue Hour", "resume": "We don't have an overview translated in English. Help us expand our database by adding one.", "rate": 0, "genre": ["Drama"], "cast": ["C\u00e9line Bonnier", "Beno\u00eet Gouin"], "character": ["Anne-Sophie Moran", "Bernard Boudrias"], "site_data": "html Apps Forums Leaderboard Contribute API Support Discover Movies TV Shows Movies Popular Top Rated Upcoming Now Playing TV Shows Popular Top Rated On TV Airing Today People Popular People Can't find a movie or TV show? Login to create it. en Login Sign Up  ID: 69220   Expand Blue Hour   (2017) User Score Overview We don't have an overview translated in English. Help us expand our database by adding one. Featured Crew Anne Boyer Creator Michel D'Astous Creator Discussions   Reviews Videos   Images   Changes Report Share Discussions General  0 Content Issues  0 Images Backdrops  2 Posters  3 Videos Trailers  0 Teasers  0 Clips  0 Featurettes  0 Opening Credits  0 Top Billed Cast C\u00e9line Bonnier Anne-Sophie Moran Beno\u00eet Gouin Bernard Boudrias Full Cast & Crew Last Season Season 2 2017 | 24 Episodes Season 2 of Blue Hour premiered on September 11, 2017. View All Seasons Social Reviews  0 Discussions  0 Media Most Popular Videos  0 Backdrops  2 Posters  3 Recommendations We don't have enough data to suggest any TV shows based on Blue Hour. You can help by rating TV shows you've seen. Facts Original Name  L\u2019heure bleue Status  Returning Series Network Certification C8 Meaning Suitable for children ages 8+. Low level violence and fantasy horror is allowed. No foul language is allowed, but occasional \"socially offensive and discriminatory\" language is allowed if in the context of the story. No sexual content of any level allowed. Type  Scripted Original Language  French Runtime  43m Homepage   http://tva.canoe.ca/emissions/l-heure-bleue Genres Drama Keywords quebec family tragedy grieving parents Content Score 56 We're so close, yet so far. Top Contributors 54 Banana t 7 tmdb62726470 z 1 zerox 1 Russ007  View Edit History Popularity Trend  Login to edit  URL By  signing up  for an account on TMDb, you can post directly to Twitter and Facebook. You need to be logged in to continue. Click  here  to login or  here  to sign up.    page_wrap opened in html_head  Join the Community The Basics About TMDb Contact Us Support Forums API Blog Get Involved  Contribution Bible 3rd Party Applications Add New Movie Add New TV Show Community Guidelines Leaderboard Forums Twitter Facebook Legal Terms of Use Privacy Policy Login Sign Up"}