{"link": "https://www.themoviedb.org/tv/71814?language=en", "title": "American Boyband", "resume": "Kevin Abstract wants to be a pop star. Along with his self-proclaimed boy band \u201cBrockhampton\u201d he is on a mission to translate his faithful online following into real world success.", "rate": 30, "genre": ["Reality"], "cast": ["Kevin Abstract"], "character": ["Himself"], "site_data": "html Apps Forums Leaderboard Contribute API Support Discover Movies TV Shows Movies Popular Top Rated Upcoming Now Playing TV Shows Popular Top Rated On TV Airing Today People Popular People Can't find a movie or TV show? Login to create it. en Login Sign Up  ID: 71814   Expand American Boyband   (2017) User Score  Play Trailer Overview Kevin Abstract wants to be a pop star. Along with his self-proclaimed boy band \u201cBrockhampton\u201d he is on a mission to translate his faithful online following into real world success. Discussions   Reviews Videos   Images   Changes Report Share Discussions General  0 Content Issues  0 Images Backdrops  2 Posters  2 Videos Trailers  1 Teasers  0 Clips  0 Featurettes  0 Opening Credits  0 Top Billed Cast Kevin Abstract Himself Full Cast & Crew Last Season Season 1 2017 | 8 Episodes Season 1 of American Boyband premiered on June  8, 2017. View All Seasons Social Reviews  0 Discussions  0 Media Most Popular Videos  1 Backdrops  2 Posters  2 Recommendations We don't have enough data to suggest any TV shows based on American Boyband. You can help by rating TV shows you've seen. Facts Status  Returning Series Network Certification TV-14 Meaning This program contains some material that many parents would find unsuitable for children under 14 years of age. Type  Reality Original Language  English Runtime  22m Homepage   https://www.viceland.com/en_us/show/american-boyband Genres Reality Keywords No keywords have been added. Content Score 64 We're so close, yet so far. Top Contributors 31 Elizabeth Jennings TB 1 TMDb Bot 1 tigru89  View Edit History Popularity Trend  Login to edit  URL By  signing up  for an account on TMDb, you can post directly to Twitter and Facebook. You need to be logged in to continue. Click  here  to login or  here  to sign up.    page_wrap opened in html_head  Join the Community The Basics About TMDb Contact Us Support Forums API Blog Get Involved  Contribution Bible 3rd Party Applications Add New Movie Add New TV Show Community Guidelines Leaderboard Forums Twitter Facebook Legal Terms of Use Privacy Policy Login Sign Up"}