{"link": "https://www.themoviedb.org/tv/57210?language=en", "title": "Nachtschicht", "resume": "We don't have an overview translated in English. Help us expand our database by adding one.", "rate": 90, "genre": ["Crime"], "cast": ["Armin Rohde", "Minh-Khai Phan-Thi", "Barbara Auer", "Pierre Semmler", "Ken Duken"], "character": ["Erich Bo Erichsen", "Mimi Hu", "Lisa Brenner", "Walter J\u00fclich", "Teddy Schrader"], "site_data": "html Apps Forums Leaderboard Contribute API Support Discover Movies TV Shows Movies Popular Top Rated Upcoming Now Playing TV Shows Popular Top Rated On TV Airing Today People Popular People Can't find a movie or TV show? Login to create it. en Login Sign Up  ID: 57210   Expand Nachtschicht   (2003) User Score Overview We don't have an overview translated in English. Help us expand our database by adding one. Discussions   Reviews Videos   Images   Changes Report Share Discussions General  0 Content Issues  0 Images Backdrops  0 Posters  1 Videos Trailers  0 Teasers  0 Clips  0 Featurettes  0 Opening Credits  0 Top Billed Cast Armin Rohde Erich Bo Erichsen Minh-Khai Phan-Thi Mimi Hu Barbara Auer Lisa Brenner Pierre Semmler Walter J\u00fclich Ken Duken Teddy Schrader Full Cast & Crew Last Season Season 1 2003 | 13 Episodes Season 1 of Nachtschicht premiered on March 24, 2003. View All Seasons Social Reviews  0 Discussions  0 Media Most Popular Videos  0 Backdrops  0 Posters  1 Recommendations We don't have enough data to suggest any TV shows based on Nachtschicht. You can help by rating TV shows you've seen. Facts Status  Ended Network Certification  - Type  Scripted Original Language  German Runtime  90m Homepage  - Genres Crime Keywords No keywords have been added. Content Score 64 We're so close, yet so far. Top Contributors S 23 Samara CM 4 Cherche Moi jw 4 je we i 1 inception  View Edit History Popularity Trend  Login to edit  URL By  signing up  for an account on TMDb, you can post directly to Twitter and Facebook. You need to be logged in to continue. Click  here  to login or  here  to sign up.    page_wrap opened in html_head  Join the Community The Basics About TMDb Contact Us Support Forums API Blog Get Involved  Contribution Bible 3rd Party Applications Add New Movie Add New TV Show Community Guidelines Leaderboard Forums Twitter Facebook Legal Terms of Use Privacy Policy Login Sign Up"}