{"link": "https://www.themoviedb.org/tv/6727?language=en", "title": "Nikki", "resume": "Nikki White pursues her dream of being a Las Vegas showgirl, while her husband, Dwight, tries to break into professional wrestling.", "rate": 70, "genre": ["Comedy"], "cast": ["Nikki Cox", "Nick von Esmarch", "Toby Huss", "Susan Egan", "Christine Estabrook"], "character": ["Nikki White", "Dwight White", "Jupiter", "Mary", "Marion"], "site_data": "html Apps Forums Leaderboard Contribute API Support Discover Movies TV Shows Movies Popular Top Rated Upcoming Now Playing TV Shows Popular Top Rated On TV Airing Today People Popular People Can't find a movie or TV show? Login to create it. en Login Sign Up  ID: 6727   Expand Nikki   (2000) User Score Overview Nikki White pursues her dream of being a Las Vegas showgirl, while her husband, Dwight, tries to break into professional wrestling. Featured Crew Bruce Helford Creator Discussions   Reviews Videos   Images   Changes Report Share Discussions General  0 Content Issues  0 Images Backdrops  7 Posters  4 Videos Trailers  0 Teasers  0 Clips  0 Featurettes  0 Opening Credits  0 Top Billed Cast Nikki Cox Nikki White Nick von Esmarch Dwight White Toby Huss Jupiter Susan Egan Mary Christine Estabrook Marion Full Cast & Crew Last Season Season 2 2001 | 19 Episodes Season 2 of Nikki premiered on October 14, 2001. View All Seasons Social Reviews  0 Discussions  0 Media Most Popular Videos  0 Backdrops  7 Posters  4 Recommendations We don't have enough data to suggest any TV shows based on Nikki. You can help by rating TV shows you've seen. Facts Status  Ended Network Certification  - Type  Scripted Original Language  English Runtime  30m Homepage  - Genres Comedy Keywords las vegas sitcom Content Score 93 Almost there... Top Contributors 13 Banana TB 2 TMDb Bot w 2 waterhorse 1 Vampire Bai  View Edit History Popularity Trend  Login to edit  URL By  signing up  for an account on TMDb, you can post directly to Twitter and Facebook. You need to be logged in to continue. Click  here  to login or  here  to sign up.    page_wrap opened in html_head  Join the Community The Basics About TMDb Contact Us Support Forums API Blog Get Involved  Contribution Bible 3rd Party Applications Add New Movie Add New TV Show Community Guidelines Leaderboard Forums Twitter Facebook Legal Terms of Use Privacy Policy Login Sign Up"}