{"link": "https://www.themoviedb.org/tv/13872?language=en", "title": "Fall of Eagles", "resume": "British drama about the collapse of three great European dynasties - the Romanovs, the Habsburgs and the Hohenzollerns.", "rate": 73, "genre": ["Drama"], "cast": ["Charles Kay", "Gayle Hunnicutt", "Michael Bates"], "character": ["Tsar Nicholas II", "Tsarina Alexandra", "Von Ludendorff"], "site_data": "html Apps Forums Leaderboard Contribute API Support Discover Movies TV Shows Movies Popular Top Rated Upcoming Now Playing TV Shows Popular Top Rated On TV Airing Today People Popular People Can't find a movie or TV show? Login to create it. en Login Sign Up  ID: 13872   Expand Fall of Eagles   (1974) User Score Overview British drama about the collapse of three great European dynasties - the Romanovs, the Habsburgs and the Hohenzollerns. Discussions   Reviews Videos   Images   Changes Report Share Discussions General  0 Content Issues  0 Images Backdrops  1 Posters  3 Videos Trailers  0 Teasers  0 Clips  0 Featurettes  0 Opening Credits  0 Top Billed Cast Charles Kay Tsar Nicholas II Gayle Hunnicutt Tsarina Alexandra Michael Bates Von Ludendorff Full Cast & Crew Last Season Season 1 1974 | 13 Episodes Season 1 of Fall of Eagles premiered on March 15, 1974. View All Seasons Social Reviews  0 Discussions  0 Media Most Popular Videos  0 Backdrops  1 Posters  3 Recommendations We don't have enough data to suggest any TV shows based on Fall of Eagles. You can help by rating TV shows you've seen. Facts Status  Ended Network Certification  - Type  Miniseries Original Language  English Runtime  50m Homepage   http://www.bbc.co.uk/programmes/b007x4y4 Genres Drama Keywords royal family royalty miniseries austria-hungary 19th century Content Score 56 We're so close, yet so far. Top Contributors R 15 Rebecca TB 1 TMDb Bot  View Edit History Popularity Trend  Login to edit  URL By  signing up  for an account on TMDb, you can post directly to Twitter and Facebook. You need to be logged in to continue. Click  here  to login or  here  to sign up.    page_wrap opened in html_head  Join the Community The Basics About TMDb Contact Us Support Forums API Blog Get Involved  Contribution Bible 3rd Party Applications Add New Movie Add New TV Show Community Guidelines Leaderboard Forums Twitter Facebook Legal Terms of Use Privacy Policy Login Sign Up"}