{"link": "https://www.themoviedb.org/tv/79830?language=en", "title": "\u05e2\u05dc \u05d4\u05e1\u05e4\u05e7\u05d8\u05e8\u05d5\u05dd", "resume": "We don't have an overview translated in English. Help us expand our database by adding one.", "rate": 0, "genre": ["Drama", "Comedy"], "cast": ["Ben Yosipovich", "Avi Dangur", "Naomi Levov", "Niv Majar"], "character": ["Amit", "Erez", "Zohar", "Ron"], "site_data": "html Apps Forums Leaderboard Contribute API Support Discover Movies TV Shows Movies Popular Top Rated Upcoming Now Playing TV Shows Popular Top Rated On TV Airing Today People Popular People Can't find a movie or TV show? Login to create it. en Login Sign Up  ID: 79830   Expand \u05e2\u05dc \u05d4\u05e1\u05e4\u05e7\u05d8\u05e8\u05d5\u05dd   (2018) User Score Overview We don't have an overview translated in English. Help us expand our database by adding one. Discussions   Reviews Videos   Images   Changes Report Share Discussions General  0 Content Issues  0 Images Backdrops  1 Posters  1 Videos Trailers  0 Teasers  0 Clips  0 Featurettes  0 Opening Credits  0 Top Billed Cast Ben Yosipovich Amit Avi Dangur Erez Naomi Levov Zohar Niv Majar Ron Full Cast & Crew Current Season Season 1 2018 | 10 Episodes Season 1 of \u05e2\u05dc \u05d4\u05e1\u05e4\u05e7\u05d8\u05e8\u05d5\u05dd premiered on May 22, 2018. View All Seasons Social Reviews  0 Discussions  0 Media Most Popular Videos  0 Backdrops  1 Posters  1 Recommendations We don't have enough data to suggest any TV shows based on \u05e2\u05dc \u05d4\u05e1\u05e4\u05e7\u05d8\u05e8\u05d5\u05dd. You can help by rating TV shows you've seen. Facts Status  Returning Series Network Certification  - Type  Scripted Original Language  Hebrew Runtime  - Homepage  - Genres Drama Comedy Keywords No keywords have been added. Content Score 79 Pump it up! We're close now. Top Contributors AK 23 Avshalom Kor g 3 guyly  View Edit History Popularity Trend  Login to edit  URL By  signing up  for an account on TMDb, you can post directly to Twitter and Facebook. You need to be logged in to continue. Click  here  to login or  here  to sign up.    page_wrap opened in html_head  Join the Community The Basics About TMDb Contact Us Support Forums API Blog Get Involved  Contribution Bible 3rd Party Applications Add New Movie Add New TV Show Community Guidelines Leaderboard Forums Twitter Facebook Legal Terms of Use Privacy Policy Login Sign Up"}