{"link": "https://www.themoviedb.org/tv/66074?language=en", "title": "Nick Knatterton", "resume": "We don't have an overview translated in English. Help us expand our database by adding one.", "rate": null, "genre": ["Animation"], "cast": ["Christian Marschall", "Hans J\u00fcrgen Diedrich"], "site_data": "html Apps Forums Leaderboard Contribute API Support Discover Movies TV Shows Movies Popular Top Rated Upcoming Now Playing TV Shows Popular Top Rated On TV Airing Today People Popular People Can't find a movie or TV show? Login to create it. en Login Sign Up  ID: 66074   Expand Nick Knatterton   (1978) User Score Overview We don't have an overview translated in English. Help us expand our database by adding one. Featured Crew Manfred Schmidt Creator Discussions   Reviews Videos   Images   Changes Report Share Discussions General  0 Content Issues  0 Images Backdrops  3 Posters  2 Videos Trailers  0 Teasers  0 Clips  0 Featurettes  0 Opening Credits  0 Top Billed Cast Christian Marschall Sprecher / Erz\u00e4hler Hans J\u00fcrgen Diedrich Nick Knatterton (Sprecher) Full Cast & Crew Last Season Season 1 1978 | 15 Episodes Season 1 of Nick Knatterton premiered on April 17, 1978. View All Seasons Social Reviews  0 Discussions  0 Media Most Popular Videos  0 Backdrops  3 Posters  2 Recommendations We don't have enough data to suggest any TV shows based on Nick Knatterton. You can help by rating TV shows you've seen. Facts Status  Ended Network Certification 0 Meaning Can be aired at any time. Type  Scripted Original Language  German Runtime  - Homepage  - Genres Animation Keywords private detective Content Score 56 We're so close, yet so far. Top Contributors 29 SuperMario 8 BryGur 6 Elizabeth Jennings  View Edit History Popularity Trend  Login to edit  URL By  signing up  for an account on TMDb, you can post directly to Twitter and Facebook. You need to be logged in to continue. Click  here  to login or  here  to sign up.    page_wrap opened in html_head  Join the Community The Basics About TMDb Contact Us Support Forums API Blog Get Involved  Contribution Bible 3rd Party Applications Add New Movie Add New TV Show Community Guidelines Leaderboard Forums Twitter Facebook Legal Terms of Use Privacy Policy Login Sign Up", "character": ["Sprecher / Erz\u00e4hler", "Nick Knatterton (Sprecher)"]}