{"link": "https://www.themoviedb.org/tv/73265?language=en", "title": "Yo Soy Franky", "resume": "We don't have an overview translated in English. Help us expand our database by adding one.", "rate": 80, "genre": ["Drama", "Family"], "cast": ["Maria Jos\u00e9 Pescador", "Mart\u00edn Barba", "Mar\u00eda Gabriela de Far\u00eda", "Danielle Arciniegas"], "character": ["Clara Andrade", "Christian Montero", "Franky Andrade", "Tamara Franco"], "site_data": "html Apps Forums Leaderboard Contribute API Support Discover Movies TV Shows Movies Popular Top Rated Upcoming Now Playing TV Shows Popular Top Rated On TV Airing Today People Popular People Can't find a movie or TV show? Login to create it. en Login Sign Up  ID: 73265   Expand Yo Soy Franky   (2015) User Score Overview We don't have an overview translated in English. Help us expand our database by adding one. Featured Crew Marcela Citterio Creator Discussions   Reviews Videos   Images   Changes Report Share Discussions General  0 Content Issues  0 Images Backdrops  1 Posters  1 Videos Trailers  0 Teasers  0 Clips  0 Featurettes  0 Opening Credits  0 Top Billed Cast Maria Jos\u00e9 Pescador Clara Andrade Mart\u00edn Barba Christian Montero Mar\u00eda Gabriela de Far\u00eda Franky Andrade Danielle Arciniegas Tamara Franco Full Cast & Crew Last Season Season 1 2015 | 50 Episodes Season 1 of Yo Soy Franky premiered on September 28, 2015. View All Seasons Social Reviews  0 Discussions  0 Media Most Popular Videos  0 Backdrops  1 Posters  1 Recommendations We don't have enough data to suggest any TV shows based on Yo Soy Franky. You can help by rating TV shows you've seen. Facts Status  Returning Series Network Certification  - Type  Scripted Original Language  Portuguese Runtime  - Homepage  - Genres Drama Family Keywords eu sou franky Content Score 86 Almost there... Top Contributors v 30 vt70000 6 Amanda 2 lineker 2 Banana  View Edit History Popularity Trend  Login to edit  URL By  signing up  for an account on TMDb, you can post directly to Twitter and Facebook. You need to be logged in to continue. Click  here  to login or  here  to sign up.    page_wrap opened in html_head  Join the Community The Basics About TMDb Contact Us Support Forums API Blog Get Involved  Contribution Bible 3rd Party Applications Add New Movie Add New TV Show Community Guidelines Leaderboard Forums Twitter Facebook Legal Terms of Use Privacy Policy Login Sign Up"}