{"link": "https://www.themoviedb.org/tv/4912?language=en", "title": "The Closer", "resume": "The Closer was an American television situation comedy that aired on CBS for 10 episodes in 1998. The show starred Tom Selleck as a successful advertising agency executive.", "rate": null, "genre": ["Comedy"], "cast": ["Suzy Nakamura", "Tom Selleck", "Ed Asner", "Penelope Ann Miller", "David Krumholtz"], "site_data": "html Apps Forums Leaderboard Contribute API Support Discover Movies TV Shows Movies Popular Top Rated Upcoming Now Playing TV Shows Popular Top Rated On TV Airing Today People Popular People Can't find a movie or TV show? Login to create it. en Login Sign Up  ID: 4912   Expand The Closer   (1998) User Score Overview The Closer was an American television situation comedy that aired on CBS for 10 episodes in 1998. The show starred Tom Selleck as a successful advertising agency executive. Featured Crew Ed Decter Creator Discussions   Reviews Videos   Images   Changes Report Share Discussions General  0 Content Issues  0 Images Backdrops  0 Posters  1 Videos Trailers  0 Teasers  0 Clips  0 Featurettes  0 Opening Credits  0 Top Billed Cast Suzy Nakamura Tom Selleck Jack McLaren Ed Asner Penelope Ann Miller David Krumholtz Full Cast & Crew Last Season Season 1 1998 | 10 Episodes Season 1 of The Closer premiered on February 23, 1998. View All Seasons Social Reviews  0 Discussions  0 Media Most Popular Videos  0 Backdrops  0 Posters  1 Recommendations We don't have enough data to suggest any TV shows based on The Closer. You can help by rating TV shows you've seen. Facts Status  Ended Network Certification  - Type  Scripted Original Language  English Runtime  30m Homepage  - Genres Comedy Keywords advertising advertising agency sitcom Content Score 79 Pump it up! We're close now. Top Contributors 10 Banana 3 Medianoche  View Edit History Popularity Trend  Login to edit  URL By  signing up  for an account on TMDb, you can post directly to Twitter and Facebook. You need to be logged in to continue. Click  here  to login or  here  to sign up.    page_wrap opened in html_head  Join the Community The Basics About TMDb Contact Us Support Forums API Blog Get Involved  Contribution Bible 3rd Party Applications Add New Movie Add New TV Show Community Guidelines Leaderboard Forums Twitter Facebook Legal Terms of Use Privacy Policy Login Sign Up", "character": ["Jack McLaren"]}