{"link": "https://www.themoviedb.org/tv/46234?language=en", "title": "Legal High", "resume": "A lawyer with a big personality works with an straightlaced recent law graduate on various law cases in Japan.", "rate": 94, "genre": ["Comedy", "Drama"], "cast": ["Masato Sakai", "Yui Aragaki", "Ryoko Hirosue", "Katsuhisa Namase", "Eiko Koike"], "character": ["Kensuke Komikado", "Machiko Mayuzumi", "Toshiko Beppu", "Choichiro Miki", "Miki's Secretary"], "site_data": "html Apps Forums Leaderboard Contribute API Support Discover Movies TV Shows Movies Popular Top Rated Upcoming Now Playing TV Shows Popular Top Rated On TV Airing Today People Popular People Can't find a movie or TV show? Login to create it. en Login Sign Up  ID: 46234   Expand Legal High   (2012) User Score Overview A lawyer with a big personality works with an straightlaced recent law graduate on various law cases in Japan. Featured Crew Hideki Inada Creator Discussions   Reviews Videos   Images   Changes Report Share Discussions General  0 Content Issues  0 Images Backdrops  1 Posters  1 Videos Trailers  0 Teasers  0 Clips  0 Featurettes  0 Opening Credits  0 Top Billed Cast Masato Sakai Kensuke Komikado Yui Aragaki Machiko Mayuzumi Ryoko Hirosue Toshiko Beppu Katsuhisa Namase Choichiro Miki Eiko Koike Miki's Secretary Full Cast & Crew Last Season Season 2 2013 | 10 Episodes View All Seasons Social Reviews  0 Discussions  0 Media Most Popular Videos  0 Backdrops  1 Posters  1 Recommendations   2006-07-08 My Boss My Hero 7.3    1994-09-22 Friends 7.8  Facts Original Name  \u30ea\u30fc\u30ac\u30eb\u30cf\u30a4 Status  Ended Network Certification  - Type  Scripted Original Language  Japanese Runtime  45m Homepage  - Genres Comedy Drama Keywords No keywords have been added. Content Score 93 Almost there... Top Contributors 23 Wendy t 9 taxigps A 8 Aka75 7 dalgos  View Edit History Popularity Trend  Login to edit  URL By  signing up  for an account on TMDb, you can post directly to Twitter and Facebook. You need to be logged in to continue. Click  here  to login or  here  to sign up.    page_wrap opened in html_head  Join the Community The Basics About TMDb Contact Us Support Forums API Blog Get Involved  Contribution Bible 3rd Party Applications Add New Movie Add New TV Show Community Guidelines Leaderboard Forums Twitter Facebook Legal Terms of Use Privacy Policy Login Sign Up"}