{"link": "https://www.themoviedb.org/tv/61412?language=en", "title": "House of Fools", "resume": "Surreal sitcom with Vic Reeves and Bob Mortimer. A series of anarchic affairs featuring the uninvited lodgers and guests that cause chaos and disruption in their home.", "rate": 85, "genre": ["Comedy"], "cast": ["Bob Mortimer", "Vic Reeves", "Morgana Robinson", "Daniel Renton Skinner", "Daniel Simonsen"], "character": ["Bob", "Vic", "Julie", "Bosh", "Erik"], "site_data": "html Apps Forums Leaderboard Contribute API Support Discover Movies TV Shows Movies Popular Top Rated Upcoming Now Playing TV Shows Popular Top Rated On TV Airing Today People Popular People Can't find a movie or TV show? Login to create it. en Login Sign Up  ID: 61412   Expand House of Fools   (2014) User Score Overview Surreal sitcom with Vic Reeves and Bob Mortimer. A series of anarchic affairs featuring the uninvited lodgers and guests that cause chaos and disruption in their home. Discussions   Reviews Videos   Images   Changes Report Share Discussions General  0 Content Issues  0 Images Backdrops  4 Posters  2 Videos Trailers  0 Teasers  0 Clips  0 Featurettes  0 Opening Credits  0 Top Billed Cast Bob Mortimer Bob Vic Reeves Vic Morgana Robinson Julie Daniel Renton Skinner Bosh Daniel Simonsen Erik Full Cast & Crew Last Season Series 2 2015 | 6 Episodes Season 2 of House of Fools premiered on February 16, 2015. View All Seasons Social Reviews  0 Discussions  0 Media Most Popular Videos  0 Backdrops  4 Posters  2 Recommendations We don't have enough data to suggest any TV shows based on House of Fools. You can help by rating TV shows you've seen. Facts Status  Ended Network Certification  - Type  Scripted Original Language  English Runtime  30m Homepage   http://www.bbc.co.uk/programmes/b03qdr90 Genres Comedy Keywords surreal sitcom british humour british sitcom Content Score 86 Almost there... Top Contributors 25 Elizabeth Jennings 22 celtfan 5 kuzronk 5 Banana  View Edit History Popularity Trend  Login to edit  URL By  signing up  for an account on TMDb, you can post directly to Twitter and Facebook. You need to be logged in to continue. Click  here  to login or  here  to sign up.    page_wrap opened in html_head  Join the Community The Basics About TMDb Contact Us Support Forums API Blog Get Involved  Contribution Bible 3rd Party Applications Add New Movie Add New TV Show Community Guidelines Leaderboard Forums Twitter Facebook Legal Terms of Use Privacy Policy Login Sign Up"}