{"link": "https://www.themoviedb.org/tv/76224?language=en", "title": "Playmate Playback", "resume": "Magazine covers, parties, exclusive photo-shoots, behind-the-scenes confessions and more. Meet the latest Playmates of Playboy like never before.", "rate": 100, "genre": ["Documentary", "Reality"], "cast": ["Amanda Cerny", "Raquel Pomplun", "Kennedy Summers"], "character": ["Herself - Host", "Herself - Host", "Herself - Host"], "site_data": "html Apps Forums Leaderboard Contribute API Support Discover Movies TV Shows Movies Popular Top Rated Upcoming Now Playing TV Shows Popular Top Rated On TV Airing Today People Popular People Can't find a movie or TV show? Login to create it. en Login Sign Up  ID: 76224   Expand Playmate Playback   (2015) User Score Overview Magazine covers, parties, exclusive photo-shoots, behind-the-scenes confessions and more. Meet the latest Playmates of Playboy like never before. Discussions   Reviews Videos   Images   Changes Report Share Discussions General  0 Content Issues  0 Images Backdrops  30 Posters  10 Videos Trailers  0 Teasers  0 Clips  0 Featurettes  4 Opening Credits  0 Top Billed Cast Amanda Cerny Herself - Host Raquel Pomplun Herself - Host Kennedy Summers Herself - Host Full Cast & Crew Last Season Season 2 2016 | 4 Episodes Season 2 of Playmate Playback premiered on December  8, 2016. View All Seasons Social Reviews  0 Discussions  0 Media Most Popular Videos  4 Backdrops  30 Posters  10 Recommendations We don't have enough data to suggest any TV shows based on Playmate Playback. You can help by rating TV shows you've seen. Facts Status  Ended Network Certification TV-MA Meaning This program is specifically designed to be viewed by adults and therefore may be unsuitable for children under 17 Type  Reality Original Language  English Runtime  30m Homepage   http://www.playboy.tv/shows/videos/39741/playmate-playback Genres Documentary Reality Keywords glamour playmates Content Score 64 We're so close, yet so far. Top Contributors t 157 tmdb79519466 TB 4 TMDb Bot 4 Elizabeth Jennings 2 janar  View Edit History Popularity Trend  Login to edit  URL By  signing up  for an account on TMDb, you can post directly to Twitter and Facebook. You need to be logged in to continue. Click  here  to login or  here  to sign up.    page_wrap opened in html_head  Join the Community The Basics About TMDb Contact Us Support Forums API Blog Get Involved  Contribution Bible 3rd Party Applications Add New Movie Add New TV Show Community Guidelines Leaderboard Forums Twitter Facebook Legal Terms of Use Privacy Policy Login Sign Up"}