{"link": "https://www.themoviedb.org/tv/68876?language=en", "title": "Youth Over Flowers", "resume": "Youth Over Flowers is a South Korean travel-reality show which premiered on tvN in 2014.", "rate": 80, "genre": ["Reality"], "cast": ["Kim Jin Woo", "Lee Seung-hoon", "Song Min-ho", "Kang Seung-yoon"], "character": ["Himself", "Himself", "Himself", "Himself"], "site_data": "html Apps Forums Leaderboard Contribute API Support Discover Movies TV Shows Movies Popular Top Rated Upcoming Now Playing TV Shows Popular Top Rated On TV Airing Today People Popular People Can't find a movie or TV show? Login to create it. en Login Sign Up  ID: 68876   Expand Youth Over Flowers   (2014) User Score Overview Youth Over Flowers is a South Korean travel-reality show which premiered on tvN in 2014. Featured Crew Choi Jae-Young Creator Shin Hyo-Jung Creator Lee Woo-Jung Creator Na Young-seok Creator Discussions   Reviews Videos   Images   Changes Report Share Discussions General  0 Content Issues  0 Images Backdrops  0 Posters  1 Videos Trailers  0 Teasers  0 Clips  0 Featurettes  0 Opening Credits  0 Top Billed Cast Kim Jin Woo Himself Lee Seung-hoon Himself Song Min-ho Himself Kang Seung-yoon Himself Full Cast & Crew Current Season Winner 2017 | 4 Episodes View All Seasons Social Reviews  0 Discussions  0 Media Most Popular Videos  0 Backdrops  0 Posters  1 Recommendations We don't have enough data to suggest any TV shows based on Youth Over Flowers. You can help by rating TV shows you've seen. Facts Original Name  \uaf43\ubcf4\ub2e4 \uccad\ucd98 Status  Returning Series Network Certification 15 Meaning This rating is for programs that contain material that may be inappropriate for children under 15, and that parental discretion should be used. Examples include most dramas, and talk shows on OTA (over-the-air) TV (KBS, MBC, SBS), and many American TV shows/dramas on Cable TV channels like OCN and OnStyle. The programs that have this rating may include moderate or strong adult themes, language, sexual inference, and violence. As with the TV-MA rating in North America, this rating is commonly applied to live events where the occurrence of inappropriate dialogue is unpredictable. Since 2007, this rating is the most used rating for TV. Type  Reality Original Language  Korean Runtime  90m Homepage   http://program.interest.me/tvn/floweryoungboy Genres Reality Keywords adventure slice of life travel Content Score 79 Pump it up! We're close now. Top Contributors c 56 cpena SS 18 Syahir Syazwan Abdul Rahman 8 lunatine R 3 RJ_F13  View Edit History Popularity Trend  Login to edit  URL By  signing up  for an account on TMDb, you can post directly to Twitter and Facebook. You need to be logged in to continue. Click  here  to login or  here  to sign up.    page_wrap opened in html_head  Join the Community The Basics About TMDb Contact Us Support Forums API Blog Get Involved  Contribution Bible 3rd Party Applications Add New Movie Add New TV Show Community Guidelines Leaderboard Forums Twitter Facebook Legal Terms of Use Privacy Policy Login Sign Up"}