{"link": "https://www.themoviedb.org/tv/67073?language=en", "title": "Brief Encounters", "resume": "In the early 1980s the lives of four ordinary women, their husbands, mothers, families and community are turned around when they become Ann Summers party plan saleswomen.", "rate": 75, "genre": ["Drama"], "cast": ["Penelope Wilton", "Sophie Rundle", "Angela Griffin", "Sharon Rooney", "Karl Davies"], "character": ["Pauline", "Steph", "Nita", "Dawn", "Terry"], "site_data": "html Apps Forums Leaderboard Contribute API Support Discover Movies TV Shows Movies Popular Top Rated Upcoming Now Playing TV Shows Popular Top Rated On TV Airing Today People Popular People Can't find a movie or TV show? Login to create it. en Login Sign Up  ID: 67073   Expand Brief Encounters   (2016) User Score  Play Trailer Overview In the early 1980s the lives of four ordinary women, their husbands, mothers, families and community are turned around when they become Ann Summers party plan saleswomen. Featured Crew Oriane Messina Creator Fay Rusling Creator Discussions   Reviews Videos   Images   Changes Report Share Discussions General  0 Content Issues  0 Images Backdrops  4 Posters  1 Videos Trailers  1 Teasers  0 Clips  0 Featurettes  0 Opening Credits  0 Top Billed Cast Penelope Wilton Pauline Sophie Rundle Steph Angela Griffin Nita Sharon Rooney Dawn Karl Davies Terry Full Cast & Crew Last Season Season 1 2016 | 6 Episodes Season 1 of Brief Encounters premiered on July  4, 2016. View All Seasons Social Reviews  0 Discussions  0 Media Most Popular Videos  1 Backdrops  4 Posters  1 Recommendations   2011-05-02 Case Sensitive 5.4    2016-06-08 Power Monkeys 7.0    2015-06-30 Not Safe for Work 7.3    2006-01-01 In Justice 6.8    2013-02-27 Lightfields 7.5    2016-04-25 Flowers 6.7    2010-07-12 The Silence 6.8    2013-09-05 The Guilty 7.0  Facts Status  Returning Series Network Certification  - Type  Scripted Original Language  English Runtime  60m Homepage  - Genres Drama Keywords sibling relationship saleswoman 1980s Content Score 100 Yes! Looking good! Top Contributors 42 Elizabeth Jennings 3 Banana s 3 swinkworld TB 3 TMDb Bot  View Edit History Popularity Trend  Login to edit  URL By  signing up  for an account on TMDb, you can post directly to Twitter and Facebook. You need to be logged in to continue. Click  here  to login or  here  to sign up.    page_wrap opened in html_head  Join the Community The Basics About TMDb Contact Us Support Forums API Blog Get Involved  Contribution Bible 3rd Party Applications Add New Movie Add New TV Show Community Guidelines Leaderboard Forums Twitter Facebook Legal Terms of Use Privacy Policy Login Sign Up"}