{"link": "https://www.themoviedb.org/tv/72746?language=en", "title": "Caught", "resume": "David Slaney escapes from jail and attempts to hook up with his partner for one last deal, while evading the detective on his trail. Based on the novel by Lisa Moore.", "rate": 0, "genre": ["Crime", "Drama"], "cast": ["Allan Hawco", "Paul Gross", "Tori Anderson", "Eric Johnson"], "character": ["David Slaney", "Roy Patterson", "Ada", "Brian Hearn"], "site_data": "html Apps Forums Leaderboard Contribute API Support Discover Movies TV Shows Movies Popular Top Rated Upcoming Now Playing TV Shows Popular Top Rated On TV Airing Today People Popular People Can't find a movie or TV show? Login to create it. en Login Sign Up  ID: 72746   Expand Caught   (2018) User Score  Play Trailer Overview David Slaney escapes from jail and attempts to hook up with his partner for one last deal, while evading the detective on his trail. Based on the novel by Lisa Moore. Discussions   Reviews Videos   Images   Changes Report Share Discussions General  0 Content Issues  0 Images Backdrops  1 Posters  5 Videos Trailers  1 Teasers  0 Clips  0 Featurettes  0 Opening Credits  0 Top Billed Cast Allan Hawco David Slaney Paul Gross Roy Patterson Tori Anderson Ada Eric Johnson Brian Hearn Full Cast & Crew Current Season Season 1 2018 | 5 Episodes Season 1 of Caught premiered on February 26, 2018. View All Seasons Social Reviews  0 Discussions  0 Media Most Popular Videos  1 Backdrops  1 Posters  5 Recommendations We don't have enough data to suggest any TV shows based on Caught. You can help by rating TV shows you've seen. Facts Status  Returning Series Network Certification  - Type  Scripted Original Language  English Runtime  42m Homepage   http://www.cbc.ca/caught/ Genres Crime Drama Keywords based on novel or book one last job escaped prisoner Content Score 93 Almost there... Top Contributors t 28 tmdb42368388 25 Elizabeth Jennings 3 tatergator s 3 speedycars  View Edit History Popularity Trend  Login to edit  URL By  signing up  for an account on TMDb, you can post directly to Twitter and Facebook. You need to be logged in to continue. Click  here  to login or  here  to sign up.    page_wrap opened in html_head  Join the Community The Basics About TMDb Contact Us Support Forums API Blog Get Involved  Contribution Bible 3rd Party Applications Add New Movie Add New TV Show Community Guidelines Leaderboard Forums Twitter Facebook Legal Terms of Use Privacy Policy Login Sign Up"}