{"link": "https://www.themoviedb.org/tv/69501?language=en", "title": "Bing", "resume": "We don't have an overview translated in English. Help us expand our database by adding one.", "rate": 0, "genre": ["Kids", "Animation"], "cast": ["Elliot Kerley", "Mark Rylance", "Eve Bentley", "Shai Portnoy"], "character": ["Bing (voice)", "Flopp (voice)", "Sula (voide)", "Pando (voice)"], "site_data": "html Apps Forums Leaderboard Contribute API Support Discover Movies TV Shows Movies Popular Top Rated Upcoming Now Playing TV Shows Popular Top Rated On TV Airing Today People Popular People Can't find a movie or TV show? Login to create it. en Login Sign Up  ID: 69501   Expand Bing   (2014) User Score Overview We don't have an overview translated in English. Help us expand our database by adding one. Discussions   Reviews Videos   Images   Changes Report Share Discussions General  0 Content Issues  0 Images Backdrops  2 Posters  1 Videos Trailers  0 Teasers  0 Clips  0 Featurettes  0 Opening Credits  0 Top Billed Cast Elliot Kerley Bing (voice) Mark Rylance Flopp (voice) Eve Bentley Sula (voide) Shai Portnoy Pando (voice) Full Cast & Crew Last Season Season 1 2014 | 78 Episodes Season 1 of Bing premiered on June  9, 2014. View All Seasons Social Reviews  0 Discussions  0 Media Most Popular Videos  0 Backdrops  2 Posters  1 Recommendations We don't have enough data to suggest any TV shows based on Bing. You can help by rating TV shows you've seen. Facts Status  Returning Series Network Certification U Meaning The U symbol stands for Universal. A U film should be suitable for audiences aged four years and over. Type  Scripted Original Language  English Runtime  - Homepage  - Genres Kids Animation Keywords talking animal animation children computer animation kids Content Score 79 Pump it up! We're close now. Top Contributors 18 Kris Ekman 17 Chimpanzee 3 mojodo  View Edit History Popularity Trend  Login to edit  URL By  signing up  for an account on TMDb, you can post directly to Twitter and Facebook. You need to be logged in to continue. Click  here  to login or  here  to sign up.    page_wrap opened in html_head  Join the Community The Basics About TMDb Contact Us Support Forums API Blog Get Involved  Contribution Bible 3rd Party Applications Add New Movie Add New TV Show Community Guidelines Leaderboard Forums Twitter Facebook Legal Terms of Use Privacy Policy Login Sign Up"}