{"link": "https://www.themoviedb.org/tv/66871?language=en", "title": "SIX", "resume": "Action drama series inspired by the real missions of Navy SEAL Team Six.", "rate": 71, "genre": ["War", "Politics", "Drama", "Crime", "Action", "Adventure"], "cast": ["Olivia Munn", "Barry Sloane", "Dominic Adams", "Kyle Schmid", "Juan Pablo Raba"], "character": ["Gina Cline", "Joe 'Bear' Graves", "Michael Nasry", "Alex Caulder", "Ricky 'Buddha' Ortiz"], "site_data": "html Apps Forums Leaderboard Contribute API Support Discover Movies TV Shows Movies Popular Top Rated Upcoming Now Playing TV Shows Popular Top Rated On TV Airing Today People Popular People Can't find a movie or TV show? Login to create it. en Login Sign Up  ID: 66871   Expand SIX   (2017) User Score  Play Trailer Overview Action drama series inspired by the real missions of Navy SEAL Team Six. Featured Crew William Broyles Jr. Creator David Broyles Creator Discussions   Reviews Videos   Images   Changes Report Share Discussions General  4 Content Issues  0 Images Backdrops  6 Posters  5 Videos Trailers  1 Teasers  0 Clips  0 Featurettes  0 Opening Credits  0 Top Billed Cast Olivia Munn Gina Cline Barry Sloane Joe 'Bear' Graves Dominic Adams Michael Nasry Kyle Schmid Alex Caulder Juan Pablo Raba Ricky 'Buddha' Ortiz Full Cast & Crew Current Season Season 2 2018 | 6 Episodes View All Seasons Social Reviews  0 Discussions  5 Subject Status Replies Last Reply b Olivia Munn Open 1 by  OddRob b Does anyone Open 1 by  bwbphile t Holy cow that ending Open 4 by  SrEd8r Go to Discussions Media Most Popular Videos  1 Backdrops  6 Posters  5 Recommendations   2016-01-07 Shades of Blue 6.2    2018-02-11 Here and Now 7.7    2017-10-01 Ten Days in the Valley 6.0    2017-02-06 APB 5.9    2013-04-03 Rogue 7.1    2017-02-02 Training Day 6.2    2017-04-08 The Son 6.7    2017-09-27 SEAL Team 6.6  Facts Status  Returning Series Network Certification TV-MA Meaning This program is specifically designed to be viewed by adults and therefore may be unsuitable for children under 17 Type  Scripted Original Language  English Runtime  45m Homepage   http://www.history.com/shows/six Genres War & Politics Drama Crime Action & Adventure Keywords navy kidnapping terrorism special forces veteran military boko haram seals Content Score 100 Yes! Looking good! Top Contributors p 43 plumpro 33 d2dyno 26 Elizabeth Jennings W 20 WaLLY  View Edit History Popularity Trend  Login to edit  URL By  signing up  for an account on TMDb, you can post directly to Twitter and Facebook. You need to be logged in to continue. Click  here  to login or  here  to sign up.    page_wrap opened in html_head  Join the Community The Basics About TMDb Contact Us Support Forums API Blog Get Involved  Contribution Bible 3rd Party Applications Add New Movie Add New TV Show Community Guidelines Leaderboard Forums Twitter Facebook Legal Terms of Use Privacy Policy Login Sign Up"}