{"link": "https://www.themoviedb.org/tv/40791?language=en", "title": "Sechserpack", "resume": "Sechserpack is a German television comedy sketch show that was first shown on Sat.1 between 2003 and 2009.", "rate": null, "genre": ["Comedy"], "cast": ["Hanno Friedrich", "Thomas Maximilian Held", "Shirin Soraya", "Emily Wood", "Nina Vorbrodt"], "site_data": "html Apps Forums Leaderboard Contribute API Support Discover Movies TV Shows Movies Popular Top Rated Upcoming Now Playing TV Shows Popular Top Rated On TV Airing Today People Popular People Can't find a movie or TV show? Login to create it. en Login Sign Up  ID: 40791   Expand Sechserpack   (2003) User Score Overview Sechserpack is a German television comedy sketch show that was first shown on Sat.1 between 2003 and 2009. Discussions   Reviews Videos   Images   Changes Report Share Discussions General  0 Content Issues  0 Images Backdrops  2 Posters  1 Videos Trailers  0 Teasers  0 Clips  0 Featurettes  0 Opening Credits  0 Top Billed Cast Hanno Friedrich Various Characters Thomas Maximilian Held Various Characters Shirin Soraya Various Characters Emily Wood Various Characters Nina Vorbrodt Various Characters Full Cast & Crew Last Season Season 7 2009 | 12 Episodes Season 7 of Sechserpack premiered on September  4, 2009. View All Seasons Social Reviews  0 Discussions  0 Media Most Popular Videos  0 Backdrops  2 Posters  1 Recommendations We don't have enough data to suggest any TV shows based on Sechserpack. You can help by rating TV shows you've seen. Facts Status  Ended Network Certification  - Type  Scripted Original Language  German Runtime  25m Homepage  - Genres Comedy Keywords No keywords have been added. Content Score 86 Almost there... Top Contributors S 17 Samara w 15 waRhawK  View Edit History Popularity Trend  Login to edit  URL By  signing up  for an account on TMDb, you can post directly to Twitter and Facebook. You need to be logged in to continue. Click  here  to login or  here  to sign up.    page_wrap opened in html_head  Join the Community The Basics About TMDb Contact Us Support Forums API Blog Get Involved  Contribution Bible 3rd Party Applications Add New Movie Add New TV Show Community Guidelines Leaderboard Forums Twitter Facebook Legal Terms of Use Privacy Policy Login Sign Up", "character": ["Various Characters", "Various Characters", "Various Characters", "Various Characters", "Various Characters"]}