{"link": "https://www.themoviedb.org/tv/77505?language=en", "title": "Emergency", "resume": "An unprecedented behind-the-scenes access to two of Canada\u2019s busiest hospital emergency rooms.", "rate": 0, "genre": ["Documentary", "Reality", "Drama"], "cast": ["Jann Arden"], "character": ["Herself - Narrator"], "site_data": "html Apps Forums Leaderboard Contribute API Support Discover Movies TV Shows Movies Popular Top Rated Upcoming Now Playing TV Shows Popular Top Rated On TV Airing Today People Popular People Can't find a movie or TV show? Login to create it. en Login Sign Up  ID: 77505   Expand Emergency   (2015) User Score Overview An unprecedented behind-the-scenes access to two of Canada\u2019s busiest hospital emergency rooms. Discussions   Reviews Videos   Images   Changes Report Share Discussions General  1 Content Issues  0 Images Backdrops  0 Posters  1 Videos Trailers  0 Teasers  0 Clips  0 Featurettes  0 Opening Credits  0 Top Billed Cast Jann Arden Herself - Narrator Full Cast & Crew Last Season Season 1 2015 | 14 Episodes View All Seasons Social Reviews  0 Discussions  1 Subject Status Replies Last Reply Editing Notice Open 0 by ibuddy66\n      \n     Go to Discussions Media Most Popular Videos  0 Backdrops  0 Posters  1 Recommendations We don't have enough data to suggest any TV shows based on Emergency. You can help by rating TV shows you've seen. Facts Status  Ended Network Certification TV-14 Meaning This program contains some material that many parents would find unsuitable for children under 14 years of age. Type  Reality Original Language  English Runtime  22m Homepage   http://www.slice.ca/emergency/ Genres Documentary Reality Drama Keywords canada nurse hospital doctor patient emergency doctor injury hospital room emergency room medical drama british columbia emergency services emergency medicine emergency department Content Score 43 There's no 'I' in team... Top Contributors 63 Ibuddy66 27 Banana TB 2 TMDb Bot  View Edit History Popularity Trend  Login to edit  URL By  signing up  for an account on TMDb, you can post directly to Twitter and Facebook. You need to be logged in to continue. Click  here  to login or  here  to sign up.    page_wrap opened in html_head  Join the Community The Basics About TMDb Contact Us Support Forums API Blog Get Involved  Contribution Bible 3rd Party Applications Add New Movie Add New TV Show Community Guidelines Leaderboard Forums Twitter Facebook Legal Terms of Use Privacy Policy Login Sign Up"}