{"link": "https://www.themoviedb.org/tv/43884?language=en", "title": "Dating Rules from My Future Self", "resume": "A girl gets romantic advice from herself ten years in the future via text message.", "rate": 70, "genre": ["Comedy"], "cast": ["Candice King", "Leah Rachel", "Lindsey Kraft", "Toby Meuli"], "character": ["Chloe Cunningham", "Olivia Gold", "Tara Reed", "Scott Cunningham"], "site_data": "html Apps Forums Leaderboard Contribute API Support Discover Movies TV Shows Movies Popular Top Rated Upcoming Now Playing TV Shows Popular Top Rated On TV Airing Today People Popular People Can't find a movie or TV show? Login to create it. en Login Sign Up  ID: 43884   Expand Dating Rules from My Future Self   (2012) User Score Overview A girl gets romantic advice from herself ten years in the future via text message. Discussions   Reviews Videos   Images   Changes Report Share Discussions General  0 Content Issues  0 Images Backdrops  5 Posters  2 Videos Trailers  0 Teasers  0 Clips  0 Featurettes  0 Opening Credits  0 Top Billed Cast Candice King Chloe Cunningham Leah Rachel Olivia Gold Lindsey Kraft Tara Reed Toby Meuli Scott Cunningham Full Cast & Crew Last Season Season 2 2012 | 6 Episodes View All Seasons Social Reviews  0 Discussions  0 Media Most Popular Videos  0 Backdrops  5 Posters  2 Recommendations We don't have enough data to suggest any TV shows based on Dating Rules from My Future Self. You can help by rating TV shows you've seen. Facts Status  Returning Series Network Certification  - Type  Scripted Original Language  English Runtime  10m Homepage   http://alloyentertainment.com/shows/dating-rules-from-my-future-self/ Genres Comedy Keywords dating Content Score 86 Almost there... Top Contributors 21 Banana 11 Elizabeth Jennings s 3 speedycars R 2 Rebecca  View Edit History Popularity Trend  Login to edit  URL By  signing up  for an account on TMDb, you can post directly to Twitter and Facebook. You need to be logged in to continue. Click  here  to login or  here  to sign up.    page_wrap opened in html_head  Join the Community The Basics About TMDb Contact Us Support Forums API Blog Get Involved  Contribution Bible 3rd Party Applications Add New Movie Add New TV Show Community Guidelines Leaderboard Forums Twitter Facebook Legal Terms of Use Privacy Policy Login Sign Up"}