{"link": "https://www.themoviedb.org/tv/26234?language=en", "title": "Percy Stuart", "resume": "We don't have an overview translated in English. Help us expand our database by adding one.", "rate": null, "genre": ["Crime"], "cast": ["Claus Wilcke", "Horst Keitel", "Robert Meyn", "Kurt Beeken", "Ulrich Beiger"], "site_data": "html Apps Forums Leaderboard Contribute API Support Discover Movies TV Shows Movies Popular Top Rated Upcoming Now Playing TV Shows Popular Top Rated On TV Airing Today People Popular People Can't find a movie or TV show? Login to create it. en Login Sign Up  ID: 26234   Expand Percy Stuart   (1969) User Score Overview We don't have an overview translated in English. Help us expand our database by adding one. Discussions   Reviews Videos   Images   Changes Report Share Discussions General  0 Content Issues  0 Images Backdrops  2 Posters  2 Videos Trailers  0 Teasers  0 Clips  0 Featurettes  0 Opening Credits  0 Top Billed Cast Claus Wilcke Percy Stuart Horst Keitel Reginald Prewster Robert Meyn Sir John Cleveland Kurt Beeken Mr. Fitzgerald Ulrich Beiger Colonel Snyder Full Cast & Crew Last Season Season 4 1971 | 13 Episodes Season 4 of Percy Stuart premiered on October 20, 1971. View All Seasons Social Reviews  0 Discussions  0 Media Most Popular Videos  0 Backdrops  2 Posters  2 Recommendations We don't have enough data to suggest any TV shows based on Percy Stuart. You can help by rating TV shows you've seen. Facts Status  Ended Network Certification  - Type  Scripted Original Language  German Runtime  25m Homepage  - Genres Crime Keywords No keywords have been added. Content Score 79 Pump it up! We're close now. Top Contributors S 37 Samara 10 Elizabeth Jennings  View Edit History Popularity Trend  Login to edit  URL By  signing up  for an account on TMDb, you can post directly to Twitter and Facebook. You need to be logged in to continue. Click  here  to login or  here  to sign up.    page_wrap opened in html_head  Join the Community The Basics About TMDb Contact Us Support Forums API Blog Get Involved  Contribution Bible 3rd Party Applications Add New Movie Add New TV Show Community Guidelines Leaderboard Forums Twitter Facebook Legal Terms of Use Privacy Policy Login Sign Up", "character": ["Percy Stuart", "Reginald Prewster", "Sir John Cleveland", "Mr. Fitzgerald", "Colonel Snyder"]}