{"link": "https://www.themoviedb.org/tv/45246?language=en", "title": "Krempoli - A Place For Wild Children", "resume": "A funny story about the group of children from Munich who are trying to build a Luna-park.", "rate": null, "genre": ["Family", "Action", "Adventure"], "cast": ["Petra Auzinger", "G\u00fcnther Broda", "Harald Fendt", "Michael Fischer", "Joachim Kraje"], "site_data": "html Apps Forums Leaderboard Contribute API Support Discover Movies TV Shows Movies Popular Top Rated Upcoming Now Playing TV Shows Popular Top Rated On TV Airing Today People Popular People Can't find a movie or TV show? Login to create it. en Login Sign Up  ID: 45246   Expand Krempoli - A Place For Wild Children   (1975) User Score Overview A funny story about the group of children from Munich who are trying to build a Luna-park. Featured Crew Michael Verhoeven Creator Discussions   Reviews Videos   Images   Changes Report Share Discussions General  0 Content Issues  0 Images Backdrops  1 Posters  1 Videos Trailers  0 Teasers  0 Clips  0 Featurettes  0 Opening Credits  0 Top Billed Cast Petra Auzinger Stefanie G\u00fcnther Broda J\u00fcrgen Harald Fendt Joe Michael Fischer Wolfgang Joachim Kraje Dieter Full Cast & Crew Last Season Season 1 1975 | 10 Episodes View All Seasons Social Reviews  0 Discussions  0 Media Most Popular Videos  0 Backdrops  1 Posters  1 Recommendations We don't have enough data to suggest any TV shows based on Krempoli - A Place For Wild Children. You can help by rating TV shows you've seen. Facts Original Name  Krempoli - Ein Platz f\u00fcr wilde Kinder Status  Ended Network Certification 6 Meaning Can be aired at any time. Type  Scripted Original Language  German Runtime  50m Homepage  - Genres Family Action & Adventure Keywords No keywords have been added. Content Score 93 Almost there... Top Contributors 29 dannyvl S 3 Samara  View Edit History Popularity Trend  Login to edit  URL By  signing up  for an account on TMDb, you can post directly to Twitter and Facebook. You need to be logged in to continue. Click  here  to login or  here  to sign up.    page_wrap opened in html_head  Join the Community The Basics About TMDb Contact Us Support Forums API Blog Get Involved  Contribution Bible 3rd Party Applications Add New Movie Add New TV Show Community Guidelines Leaderboard Forums Twitter Facebook Legal Terms of Use Privacy Policy Login Sign Up", "character": ["Stefanie", "J\u00fcrgen", "Joe", "Wolfgang", "Dieter"]}