{"link": "https://www.themoviedb.org/tv/5217?language=en", "title": "Chicago Story", "resume": "Chicago Story is an NBC drama that aired in the spring of 1982.", "rate": null, "genre": ["Drama"], "cast": ["Daniel Hugh Kelly", "Dennis Franz", "Maud Adams", "John Mahoney", "Craig T. Nelson"], "site_data": "html Apps Forums Leaderboard Contribute API Support Discover Movies TV Shows Movies Popular Top Rated Upcoming Now Playing TV Shows Popular Top Rated On TV Airing Today People Popular People Can't find a movie or TV show? Login to create it. en Login Sign Up  ID: 5217   Expand Chicago Story   (1982) User Score Overview Chicago Story is an NBC drama that aired in the spring of 1982. Discussions   Reviews Videos   Images   Changes Report Share Discussions General  0 Content Issues  0 Images Backdrops  0 Posters  1 Videos Trailers  0 Teasers  0 Clips  0 Featurettes  0 Opening Credits  0 Top Billed Cast Daniel Hugh Kelly Det. Frank Wajorski Dennis Franz Maud Adams John Mahoney Craig T. Nelson Kenneth A. Dutton Full Cast & Crew Last Season Season 1 1982 | 10 Episodes Season 1 of Chicago Story premiered on March  6, 1982. View All Seasons Social Reviews  0 Discussions  0 Media Most Popular Videos  0 Backdrops  0 Posters  1 Recommendations We don't have enough data to suggest any TV shows based on Chicago Story. You can help by rating TV shows you've seen. Facts Status  Ended Network Certification  - Type  Scripted Original Language  English Runtime  90m Homepage  - Genres Drama Keywords chicago police lawyer doctor Content Score 71 Just a little bit more... Top Contributors 7 Banana  View Edit History Popularity Trend  Login to edit  URL By  signing up  for an account on TMDb, you can post directly to Twitter and Facebook. You need to be logged in to continue. Click  here  to login or  here  to sign up.    page_wrap opened in html_head  Join the Community The Basics About TMDb Contact Us Support Forums API Blog Get Involved  Contribution Bible 3rd Party Applications Add New Movie Add New TV Show Community Guidelines Leaderboard Forums Twitter Facebook Legal Terms of Use Privacy Policy Login Sign Up", "character": ["Det. Frank Wajorski", "Kenneth A. Dutton"]}