{"link": "https://www.themoviedb.org/tv/65805?language=en", "title": "Doctor Thorne", "resume": "The story of the penniless Mary Thorne, who grows up with her rich aunt/cousins at Greshamsbury Park estate.", "rate": 63, "genre": ["Drama"], "cast": ["Stefanie Martini", "Harry Richardson", "Tom Hollander", "Rebecca Front", "Richard McCabe"], "character": ["Mary Thorne", "Frank Gresham", "Doctor Thorne", "Lady Arabella Gresham", "Frank Gresham Snr"], "site_data": "html Apps Forums Leaderboard Contribute API Support Discover Movies TV Shows Movies Popular Top Rated Upcoming Now Playing TV Shows Popular Top Rated On TV Airing Today People Popular People Can't find a movie or TV show? Login to create it. en Login Sign Up  ID: 65805   Expand Doctor Thorne   (2016) User Score Overview The story of the penniless Mary Thorne, who grows up with her rich aunt/cousins at Greshamsbury Park estate. Featured Crew Julian Fellowes Creator Discussions   Reviews Videos   Images   Changes Report Share Discussions General  0 Content Issues  0 Images Backdrops  2 Posters  3 Videos Trailers  0 Teasers  0 Clips  0 Featurettes  0 Opening Credits  0 Top Billed Cast Stefanie Martini Mary Thorne Harry Richardson Frank Gresham Tom Hollander Doctor Thorne Rebecca Front Lady Arabella Gresham Richard McCabe Frank Gresham Snr Full Cast & Crew Last Season Miniseries 2016 | 3 Episodes Season 1 of Doctor Thorne premiered on March  6, 2016. View All Seasons Social Reviews  0 Discussions  0 Media Most Popular Videos  0 Backdrops  2 Posters  3 Recommendations   2016-06-07 Agatha Raisin 6.3    2012-09-25 The Paradise 6.8    2008-01-01 Sense and Sensibility 7.7    2007-07-24 Damages 7.2  Facts Status  Ended Network Certification 12 Meaning Films classified 12A and video works classified 12 contain material that is not generally suitable for children aged under 12. Type  Scripted Original Language  English Runtime  45m Homepage   http://www.itv.com/drama/doctor-thorne Genres Drama Keywords family drama crime period drama costume drama Content Score 93 Almost there... Top Contributors 22 Elizabeth Jennings z 16 zyck 10 midnightmark k 8 kodyod  View Edit History Popularity Trend  Login to edit  URL By  signing up  for an account on TMDb, you can post directly to Twitter and Facebook. You need to be logged in to continue. Click  here  to login or  here  to sign up.    page_wrap opened in html_head  Join the Community The Basics About TMDb Contact Us Support Forums API Blog Get Involved  Contribution Bible 3rd Party Applications Add New Movie Add New TV Show Community Guidelines Leaderboard Forums Twitter Facebook Legal Terms of Use Privacy Policy Login Sign Up"}