{"link": "https://www.themoviedb.org/tv/72694?language=en", "title": "Geography Now", "resume": "Documentary series profiling every single country of the world done alphabetically, so be patient if you are waiting for one that's down the road.", "rate": null, "genre": ["Documentary"], "cast": ["Paul Barbato"], "site_data": "html Apps Forums Leaderboard Contribute API Support Discover Movies TV Shows Movies Popular Top Rated Upcoming Now Playing TV Shows Popular Top Rated On TV Airing Today People Popular People Can't find a movie or TV show? Login to create it. en Login Sign Up  ID: 72694   Expand Geography Now User Score  Play Trailer Overview Documentary series profiling every single country of the world done alphabetically, so be patient if you are waiting for one that's down the road. Featured Crew Paul Barbato Creator Discussions   Reviews Videos   Images   Changes Report Share Discussions General  0 Content Issues  0 Images Backdrops  1 Posters  1 Videos Trailers  2 Teasers  0 Clips  0 Featurettes  0 Opening Credits  0 Top Billed Cast Paul Barbato Host Full Cast & Crew Last Season Season 2017 \u2014 | 3 Episodes We don't have an overview translated in English. Help us expand our database by adding one. View All Seasons Social Reviews  0 Discussions  0 Media Most Popular Videos  2 Backdrops  1 Posters  1 Facts Status  Returning Series Network Certification  - Type  Scripted Original Language  English Runtime  10m Homepage   https://www.youtube.com/channel/UCmmPgObSUPw1HL2lq6H4ffA Genres Documentary Keywords education united nations geography Content Score 64 We're so close, yet so far. Top Contributors 37 Gabriel W. Almeida 3 Elizabeth Jennings  View Edit History Popularity Trend  Login to edit  URL By  signing up  for an account on TMDb, you can post directly to Twitter and Facebook. You need to be logged in to continue. Click  here  to login or  here  to sign up.    page_wrap opened in html_head  Join the Community The Basics About TMDb Contact Us Support Forums API Blog Get Involved  Contribution Bible 3rd Party Applications Add New Movie Add New TV Show Community Guidelines Leaderboard Forums Twitter Facebook Legal Terms of Use Privacy Policy Login Sign Up", "character": ["Host"]}