{"link": "https://www.themoviedb.org/tv/62208?language=en", "title": "Code of a Killer", "resume": "Based on the extraordinary true story of Alec Jeffreys' discovery of DNA fingerprinting and its first use by Detective Chief Superintendent David Baker in catching a double murderer.", "rate": 70, "genre": ["Drama"], "cast": ["David Threlfall", "John Simm", "Andrew Tiernan", "Hannah Walters", "Ged Simmons"], "character": ["DCS David Baker", "Alec Jeffreys", "DS Geoff Taylor", "Kath Eastwood", "Eddie Eastwood"], "site_data": "html Apps Forums Leaderboard Contribute API Support Discover Movies TV Shows Movies Popular Top Rated Upcoming Now Playing TV Shows Popular Top Rated On TV Airing Today People Popular People Can't find a movie or TV show? Login to create it. en Login Sign Up  ID: 62208   Expand Code of a Killer   (2015) User Score Overview Based on the extraordinary true story of Alec Jeffreys' discovery of DNA fingerprinting and its first use by Detective Chief Superintendent David Baker in catching a double murderer. Discussions   Reviews Videos   Images   Changes Report Share Discussions General  0 Content Issues  0 Images Backdrops  2 Posters  2 Videos Trailers  0 Teasers  0 Clips  0 Featurettes  0 Opening Credits  0 Top Billed Cast David Threlfall DCS David Baker John Simm Alec Jeffreys Andrew Tiernan DS Geoff Taylor Hannah Walters Kath Eastwood Ged Simmons Eddie Eastwood Full Cast & Crew Last Season Season 1 2015 | 2 Episodes Season 1 of Code of a Killer premiered on April  6, 2015. View All Seasons Social Reviews  0 Discussions  0 Media Most Popular Videos  0 Backdrops  2 Posters  2 Recommendations   2010-07-12 The Silence 6.8    2004-07-19 The Grid 7.0    2013-09-05 The Guilty 7.0    2016-06-08 Power Monkeys 7.0    2011-06-06 Injustice 7.3    2011-10-14 Spy 7.6    2015-06-30 Not Safe for Work 7.3    2006-01-01 In Justice 6.8  Facts Status  Ended Network Certification  - Type  Miniseries Original Language  English Runtime  90m Homepage   https://www.itv.com/itvplayer/code-of-a-killer Genres Drama Keywords dna miniseries homicide detective dna testing 1980s Content Score 86 Almost there... Top Contributors TB 22 TMDb Bot 15 Elizabeth Jennings t 13 tmdb48730457 7 Steve  View Edit History Popularity Trend  Login to edit  URL By  signing up  for an account on TMDb, you can post directly to Twitter and Facebook. You need to be logged in to continue. Click  here  to login or  here  to sign up.    page_wrap opened in html_head  Join the Community The Basics About TMDb Contact Us Support Forums API Blog Get Involved  Contribution Bible 3rd Party Applications Add New Movie Add New TV Show Community Guidelines Leaderboard Forums Twitter Facebook Legal Terms of Use Privacy Policy Login Sign Up"}