{"link": "https://www.themoviedb.org/tv/76532?language=en", "title": "G\u00fclizar", "resume": "We don't have an overview translated in English. Help us expand our database by adding one.", "rate": null, "genre": ["Drama"], "cast": ["Farah Zeynep Abdullah", "Berk Cankat", "Ebru C\u00fcnd\u00fcbeyo\u011flu", "\u015eerif Sezer", "Berkay Ate\u015f"], "site_data": "html Apps Forums Leaderboard Contribute API Support Discover Movies TV Shows Movies Popular Top Rated Upcoming Now Playing TV Shows Popular Top Rated On TV Airing Today People Popular People Can't find a movie or TV show? Login to create it. en Login Sign Up  ID: 76532   Expand G\u00fclizar   (2018) User Score Overview We don't have an overview translated in English. Help us expand our database by adding one. Featured Crew \u00c7a\u011fan Irmak Creator Discussions   Reviews Videos   Images   Changes Report Share Discussions General  0 Content Issues  0 Images Backdrops  1 Posters  1 Videos Trailers  0 Teasers  0 Clips  0 Featurettes  0 Opening Credits  0 Top Billed Cast Farah Zeynep Abdullah G\u00fclizar Berk Cankat Murat Ebru C\u00fcnd\u00fcbeyo\u011flu Suzan \u015eerif Sezer Hayriye Berkay Ate\u015f Fettah Full Cast & Crew Current Season Season 1 2018 | 9 Episodes Season 1 of G\u00fclizar premiered on January 20, 2018. View All Seasons Social Reviews  0 Discussions  0 Media Most Popular Videos  0 Backdrops  1 Posters  1 Recommendations We don't have enough data to suggest any TV shows based on G\u00fclizar. You can help by rating TV shows you've seen. Facts Status  Returning Series Network Certification  - Type  Scripted Original Language  Turkish Runtime  120m Homepage  - Genres Drama Keywords No keywords have been added. Content Score 86 Almost there... Top Contributors 18 moviefars 8 \u0130lkiny 3 purplelammashta 1 hankan35  View Edit History Popularity Trend  Login to edit  URL By  signing up  for an account on TMDb, you can post directly to Twitter and Facebook. You need to be logged in to continue. Click  here  to login or  here  to sign up.    page_wrap opened in html_head  Join the Community The Basics About TMDb Contact Us Support Forums API Blog Get Involved  Contribution Bible 3rd Party Applications Add New Movie Add New TV Show Community Guidelines Leaderboard Forums Twitter Facebook Legal Terms of Use Privacy Policy Login Sign Up", "character": ["G\u00fclizar", "Murat", "Suzan", "Hayriye", "Fettah"]}