{"link": "https://www.themoviedb.org/tv/42244?language=en", "title": "QB VII", "resume": "A physician sues a novelist for publishing statements implicating the doctor in Nazi war crimes.", "rate": 85, "genre": ["Drama"], "cast": ["Robert Stephens", "Ben Gazzara", "Anthony Hopkins", "Leslie Caron", "Lee Remick"], "character": ["Robert Highsmith", "Abe Cady", "Adam Kelno", "Angela Kelno", "Lady Margaret"], "site_data": "html Apps Forums Leaderboard Contribute API Support Discover Movies TV Shows Movies Popular Top Rated Upcoming Now Playing TV Shows Popular Top Rated On TV Airing Today People Popular People Can't find a movie or TV show? Login to create it. en Login Sign Up  ID: 42244   Expand QB VII   (1974) User Score Overview A physician sues a novelist for publishing statements implicating the doctor in Nazi war crimes. Featured Crew Leon Uris Creator Discussions   Reviews Videos   Images   Changes Report Share Discussions General  0 Content Issues  0 Images Backdrops  0 Posters  2 Videos Trailers  0 Teasers  0 Clips  0 Featurettes  0 Opening Credits  0 Top Billed Cast Robert Stephens Robert Highsmith Ben Gazzara Abe Cady Anthony Hopkins Adam Kelno Leslie Caron Angela Kelno Lee Remick Lady Margaret Full Cast & Crew Last Season Season 1 1974 | 2 Episodes Season 1 of QB VII premiered on April 29, 1974. View All Seasons Social Reviews  0 Discussions  0 Media Most Popular Videos  0 Backdrops  0 Posters  2 Recommendations We don't have enough data to suggest any TV shows based on QB VII. You can help by rating TV shows you've seen. Facts Status  Ended Network Certification  - Type  Miniseries Original Language  English Runtime  360m, 390m Homepage  - Genres Drama Keywords No keywords have been added. Content Score 79 Pump it up! We're close now. Top Contributors TB 18 TMDb Bot R 2 Rebecca z 1 zelenya  View Edit History Popularity Trend  Login to edit  URL By  signing up  for an account on TMDb, you can post directly to Twitter and Facebook. You need to be logged in to continue. Click  here  to login or  here  to sign up.    page_wrap opened in html_head  Join the Community The Basics About TMDb Contact Us Support Forums API Blog Get Involved  Contribution Bible 3rd Party Applications Add New Movie Add New TV Show Community Guidelines Leaderboard Forums Twitter Facebook Legal Terms of Use Privacy Policy Login Sign Up"}