{"link": "https://www.themoviedb.org/tv/75404?language=en", "title": "El accidente", "resume": "We don't have an overview translated in English. Help us expand our database by adding one.", "rate": 75, "genre": ["Drama"], "cast": ["Eusebio Poncela", "Inma Cuesta", "Quim Guti\u00e9rrez", "Berta V\u00e1zquez", "Alain Hern\u00e1ndez"], "character": ["Jo\u00e2o Ferreira", "Lucia", "Jose Espada", "Maria", "Juan Espada"], "site_data": "html Apps Forums Leaderboard Contribute API Support Discover Movies TV Shows Movies Popular Top Rated Upcoming Now Playing TV Shows Popular Top Rated On TV Airing Today People Popular People Can't find a movie or TV show? Login to create it. en Login Sign Up  ID: 75404   Expand El accidente   (2017) User Score Overview We don't have an overview translated in English. Help us expand our database by adding one. Discussions   Reviews Videos   Images   Changes Report Share Discussions General  0 Content Issues  0 Images Backdrops  3 Posters  2 Videos Trailers  0 Teasers  0 Clips  0 Featurettes  0 Opening Credits  0 Top Billed Cast Eusebio Poncela Jo\u00e2o Ferreira Inma Cuesta Lucia Quim Guti\u00e9rrez Jose Espada Berta V\u00e1zquez Maria Alain Hern\u00e1ndez Juan Espada Full Cast & Crew Current Season Season 1 2017 | 13 Episodes Season 1 of El accidente premiered on November 28, 2017. View All Seasons Social Reviews  0 Discussions  0 Media Most Popular Videos  0 Backdrops  3 Posters  2 Recommendations We don't have enough data to suggest any TV shows based on El accidente. You can help by rating TV shows you've seen. Facts Status  In Production Networks - Certification  - Type  Scripted Original Language  Spanish; Castilian Runtime  70m Homepage   http://www.telecinco.es/elaccidente/ Genres Drama Keywords No keywords have been added. Content Score 86 Almost there... Top Contributors jp 17 juan perez z 11 zerox 10 dhanny 8 Fiuncho  View Edit History Popularity Trend  Login to edit  URL By  signing up  for an account on TMDb, you can post directly to Twitter and Facebook. You need to be logged in to continue. Click  here  to login or  here  to sign up.    page_wrap opened in html_head  Join the Community The Basics About TMDb Contact Us Support Forums API Blog Get Involved  Contribution Bible 3rd Party Applications Add New Movie Add New TV Show Community Guidelines Leaderboard Forums Twitter Facebook Legal Terms of Use Privacy Policy Login Sign Up"}