{"link": "https://www.themoviedb.org/tv/66211?language=en", "title": "To Be Continued", "resume": "This web-drama is about a boy group who fall to the past just a day before their debut and getting back in time with the help of a girl.", "rate": 0, "genre": ["Drama", "Comedy"], "cast": ["Kim Sae-ron", "Cha Eun-woo", "Moonbin", "MJ", "JinJin"], "character": ["Jung Ah-rin", "himself", "himself", "himself", "himself"], "site_data": "html Apps Forums Leaderboard Contribute API Support Discover Movies TV Shows Movies Popular Top Rated Upcoming Now Playing TV Shows Popular Top Rated On TV Airing Today People Popular People Can't find a movie or TV show? Login to create it. en Login Sign Up  ID: 66211   Expand To Be Continued   (2015) User Score Overview This web-drama is about a boy group who fall to the past just a day before their debut and getting back in time with the help of a girl. Featured Crew Kang Ki Hwa Creator Discussions   Reviews Videos   Images   Changes Report Share Discussions General  0 Content Issues  0 Images Backdrops  1 Posters  1 Videos Trailers  0 Teasers  0 Clips  0 Featurettes  0 Opening Credits  0 Top Billed Cast Kim Sae-ron Jung Ah-rin Cha Eun-woo himself Moonbin himself MJ himself JinJin himself Full Cast & Crew Last Season Season 1 2015 | 12 Episodes Season 1 of To Be Continued premiered on August 18, 2015. View All Seasons Social Reviews  0 Discussions  0 Media Most Popular Videos  0 Backdrops  1 Posters  1 Recommendations We don't have enough data to suggest any TV shows based on To Be Continued. You can help by rating TV shows you've seen. Facts Original Name  \ud22c \ube44 \ucee8\ud2f0\ub274\ub4dc Status  Ended Networks Certification  - Type  Scripted Original Language  Korean Runtime  15m Homepage   http://www.mbcplus.com/continued Genres Drama Comedy Keywords musical korea Content Score 93 Almost there... Top Contributors t 35 tmdb38202327 z 15 zurman1 7 Chelsea s 3 sheva_vitali  View Edit History Popularity Trend  Login to edit  URL By  signing up  for an account on TMDb, you can post directly to Twitter and Facebook. You need to be logged in to continue. Click  here  to login or  here  to sign up.    page_wrap opened in html_head  Join the Community The Basics About TMDb Contact Us Support Forums API Blog Get Involved  Contribution Bible 3rd Party Applications Add New Movie Add New TV Show Community Guidelines Leaderboard Forums Twitter Facebook Legal Terms of Use Privacy Policy Login Sign Up"}