{"link": "https://www.themoviedb.org/tv/4586?language=en", "title": "Gilmore Girls", "resume": "Set in the charming town of Stars Hollow, Connecticut, the series follows the captivating lives of Lorelai and Rory Gilmore, a mother/daughter pair who have a relationship most people only dream of.", "rate": 75, "genre": ["Comedy", "Drama"], "cast": ["Lauren Graham", "Alexis Bledel", "Edward Herrmann", "Kelly Bishop", "Scott Patterson"], "character": ["Lorelai Gilmore", "Rory Gilmore", "Richard Gilmore", "Emily Gilmore", "Luke Danes"], "site_data": "html Apps Forums Leaderboard Contribute API Support Discover Movies TV Shows Movies Popular Top Rated Upcoming Now Playing TV Shows Popular Top Rated On TV Airing Today People Popular People Can't find a movie or TV show? Login to create it. en Login Sign Up  ID: 4586   Expand Gilmore Girls   (2000) User Score Overview Set in the charming town of Stars Hollow, Connecticut, the series follows the captivating lives of Lorelai and Rory Gilmore, a mother/daughter pair who have a relationship most people only dream of. Featured Crew Amy Sherman-Palladino Creator Discussions   Reviews Videos   Images   Changes Report Share Discussions General  16 Content Issues  2 Images Backdrops  30 Posters  19 Videos Trailers  0 Teasers  0 Clips  0 Featurettes  0 Opening Credits  0 Top Billed Cast Lauren Graham Lorelai Gilmore Alexis Bledel Rory Gilmore Edward Herrmann Richard Gilmore Kelly Bishop Emily Gilmore Scott Patterson Luke Danes Full Cast & Crew Last Season Season 7 2006 | 22 Episodes Season 7 of Gilmore Girls premiered on September 26, 2006. View All Seasons Social Reviews  0 Discussions  17 Subject Status Replies Last Reply w Rory: Happy Birthday Alexis Bledel! Open 0 by wonder2wonder\n      \n     w Luke: Happy Birthday Scott Patterson! Open 0 by wonder2wonder\n      \n     A GENERAL OVER VIEW  of the Gilmore Girls Love Lives Open 0 by Invidia\n      \n     Go to Discussions Media Most Popular Videos  0 Backdrops  30 Posters  19 Recommendations   2016-11-25 Gilmore Girls: A Year in the Life 7.4    2007-09-19 Gossip Girl 6.3    1998-01-20 Dawson's Creek 6.0    1998-10-07 Charmed 6.7    1999-10-05 Angel 7.6    1998-06-06 Sex and the City 5.5    1996-09-27 Sabrina, the Teenage Witch 6.3    2004-10-03 Desperate Housewives 6.6  Facts Status  Cancelled Networks Certification TV-14 Meaning This program contains some material that many parents would find unsuitable for children under 14 years of age. Type  Scripted Original Language  English Runtime  44m Homepage   http://www2.warnerbros.com/gilmoregirls/ Genres Comedy Drama Keywords high school small town grandparent grandchild relationship coffee private school ambition middle class love female protagonist dating teenager single mother mother daughter relationship Content Score 93 Almost there... Top Contributors 104 minusha97 71 Banana A 62 Antiq 32 lineker  View Edit History Popularity Trend  Login to edit  URL By  signing up  for an account on TMDb, you can post directly to Twitter and Facebook. You need to be logged in to continue. Click  here  to login or  here  to sign up.    page_wrap opened in html_head  Join the Community The Basics About TMDb Contact Us Support Forums API Blog Get Involved  Contribution Bible 3rd Party Applications Add New Movie Add New TV Show Community Guidelines Leaderboard Forums Twitter Facebook Legal Terms of Use Privacy Policy Login Sign Up"}