{"link": "https://www.themoviedb.org/tv/69949?language=en", "title": "A mi kis falunk", "resume": "We don't have an overview translated in English. Help us expand our database by adding one.", "rate": 73, "genre": ["Family", "Comedy"], "cast": ["Csaba Debreczeny", "Imre Csuja", "Rozi Lovas", "Tam\u00e1s Lengyel", "Gergely B\u00e1nki"], "character": ["Szifon", "Polg\u00e1rmester", "Erika", "Gyuri", "Laci"], "site_data": "html Apps Forums Leaderboard Contribute API Support Discover Movies TV Shows Movies Popular Top Rated Upcoming Now Playing TV Shows Popular Top Rated On TV Airing Today People Popular People Can't find a movie or TV show? Login to create it. en Login Sign Up  ID: 69949   Expand A mi kis falunk   (2017) User Score Overview We don't have an overview translated in English. Help us expand our database by adding one. Discussions   Reviews Videos   Images   Changes Report Share Discussions General  0 Content Issues  0 Images Backdrops  3 Posters  3 Videos Trailers  0 Teasers  0 Clips  0 Featurettes  0 Opening Credits  0 Top Billed Cast Csaba Debreczeny Szifon Imre Csuja Polg\u00e1rmester Rozi Lovas Erika Tam\u00e1s Lengyel Gyuri Gergely B\u00e1nki Laci Full Cast & Crew Current Season Season 2 2018 | 8 Episodes Season 2 of A mi kis falunk premiered on February  3, 2018. View All Seasons Social Reviews  0 Discussions  0 Media Most Popular Videos  0 Backdrops  3 Posters  3 Recommendations We don't have enough data to suggest any TV shows based on A mi kis falunk. You can help by rating TV shows you've seen. Facts Status  Returning Series Network Certification 12 Meaning translation missing: en-US.certifications.tv_series.HU.4.meaning Type  Scripted Original Language  Hungarian Runtime  45m Homepage   http://rtl.hu/rtlklub/amikisfalunk Genres Family Comedy Keywords No keywords have been added. Content Score 79 Pump it up! We're close now. Top Contributors a 20 asusar 13 wickdj l 7 laszlo.bohacs@icloud.com r 7 roli342  View Edit History Popularity Trend  Login to edit  URL By  signing up  for an account on TMDb, you can post directly to Twitter and Facebook. You need to be logged in to continue. Click  here  to login or  here  to sign up.    page_wrap opened in html_head  Join the Community The Basics About TMDb Contact Us Support Forums API Blog Get Involved  Contribution Bible 3rd Party Applications Add New Movie Add New TV Show Community Guidelines Leaderboard Forums Twitter Facebook Legal Terms of Use Privacy Policy Login Sign Up"}