{"link": "https://www.themoviedb.org/tv/70871?language=en", "title": "B\u00e9liveau", "resume": "Jean B\u00e9liveau was gentleman, a businessman, a captain, a star, a husband, a father, and one of the greatest hockey players of his time.", "rate": null, "genre": ["Drama"], "cast": ["Pierre-Yves Cardinal", "Madeleine P\u00e9loquin"], "site_data": "html Apps Forums Leaderboard Contribute API Support Discover Movies TV Shows Movies Popular Top Rated Upcoming Now Playing TV Shows Popular Top Rated On TV Airing Today People Popular People Can't find a movie or TV show? Login to create it. en Login Sign Up  ID: 70871   Expand B\u00e9liveau   (2017) User Score Overview Jean B\u00e9liveau was gentleman, a businessman, a captain, a star, a husband, a father, and one of the greatest hockey players of his time. Discussions   Reviews Videos   Images   Changes Report Share Discussions General  0 Content Issues  0 Images Backdrops  3 Posters  1 Videos Trailers  0 Teasers  0 Clips  0 Featurettes  0 Opening Credits  0 Top Billed Cast Pierre-Yves Cardinal Jean B\u00e9liveau Madeleine P\u00e9loquin \u00c9lise B\u00e9liveau Full Cast & Crew Last Season Season 1 2017 | 5 Episodes Season 1 of B\u00e9liveau premiered on March 22, 2017. View All Seasons Social Reviews  0 Discussions  0 Media Most Popular Videos  0 Backdrops  3 Posters  1 Recommendations We don't have enough data to suggest any TV shows based on B\u00e9liveau. You can help by rating TV shows you've seen. Facts Status  Returning Series Network Certification G Meaning Suitable for general audiences. Programming suitable for the entire family with mild violence, and mild profanity and/or censored language. Type  Scripted Original Language  French Runtime  46m Homepage   http://historiatv.com/emissions/beliveau Genres Drama Keywords quebec ice hockey hockey player period drama montreal canadiens Content Score 64 We're so close, yet so far. Top Contributors 37 Banana a 4 arcaida 3 remimasse 3 roimidas  View Edit History Popularity Trend  Login to edit  URL By  signing up  for an account on TMDb, you can post directly to Twitter and Facebook. You need to be logged in to continue. Click  here  to login or  here  to sign up.    page_wrap opened in html_head  Join the Community The Basics About TMDb Contact Us Support Forums API Blog Get Involved  Contribution Bible 3rd Party Applications Add New Movie Add New TV Show Community Guidelines Leaderboard Forums Twitter Facebook Legal Terms of Use Privacy Policy Login Sign Up", "character": ["Jean B\u00e9liveau", "\u00c9lise B\u00e9liveau"]}