{"link": "https://www.themoviedb.org/tv/44804?language=en", "title": "Five Fingers", "resume": "Five Fingers is a 2012 weekend series from Seoul Broadcasting System starring Joo Ji-hoon as a pianist who wreaks revenge on the family that tried to destroy his dreams.", "rate": 80, "genre": ["Drama", "Music", "Romance"], "cast": ["Ju Ji-hoon", "Ji Chang-wook", "Chae Shi-ra", "Jin Se-yeon", "Na Moon-hee"], "character": ["Yoo Ji-ho", "Yoo In-ha", "Chae Yeong-rang", "Hong Da-mi", "Min Ban-wol"], "site_data": "html Apps Forums Leaderboard Contribute API Support Discover Movies TV Shows Movies Popular Top Rated Upcoming Now Playing TV Shows Popular Top Rated On TV Airing Today People Popular People Can't find a movie or TV show? Login to create it. en Login Sign Up  ID: 44804   Expand Five Fingers   (2012) User Score Overview Five Fingers is a 2012 weekend series from Seoul Broadcasting System starring Joo Ji-hoon as a pianist who wreaks revenge on the family that tried to destroy his dreams. Discussions   Reviews Videos   Images   Changes Report Share Discussions General  0 Content Issues  0 Images Backdrops  4 Posters  4 Videos Trailers  0 Teasers  0 Clips  0 Featurettes  0 Opening Credits  0 Top Billed Cast Ju Ji-hoon Yoo Ji-ho Ji Chang-wook Yoo In-ha Chae Shi-ra Chae Yeong-rang Jin Se-yeon Hong Da-mi Na Moon-hee Min Ban-wol Full Cast & Crew Last Season Season 1 2012 | 30 Episodes Season 1 of Five Fingers premiered on August 18, 2012. View All Seasons Social Reviews  0 Discussions  0 Media Most Popular Videos  0 Backdrops  4 Posters  4 Recommendations We don't have enough data to suggest any TV shows based on Five Fingers. You can help by rating TV shows you've seen. Facts Original Name  \ub2e4\uc12f\uc190\uac00\ub77d Status  Ended Network Certification  - Type  Scripted Original Language  Korean Runtime  65m Homepage   http://wizard2.sbs.co.kr/5fingers/index.html Genres Drama Music Romance Keywords korea Content Score 86 Almost there... Top Contributors M 22 Maria180493 z 10 zurman1 6 sansalayne t 4 tmdb38202327  View Edit History Popularity Trend  Login to edit  URL By  signing up  for an account on TMDb, you can post directly to Twitter and Facebook. You need to be logged in to continue. Click  here  to login or  here  to sign up.    page_wrap opened in html_head  Join the Community The Basics About TMDb Contact Us Support Forums API Blog Get Involved  Contribution Bible 3rd Party Applications Add New Movie Add New TV Show Community Guidelines Leaderboard Forums Twitter Facebook Legal Terms of Use Privacy Policy Login Sign Up"}