{"link": "https://www.themoviedb.org/tv/3750?language=en", "title": "Nip/Tuck", "resume": "Hotshot plastic surgeons Dr. Sean McNamara and Dr. Christian Troy experience full-blown midlife crises as they confront career, family and romance problems.", "rate": null, "genre": ["Drama"], "cast": ["Dylan Walsh", "Julian McMahon", "Joely Richardson", "John Hensley", "Roma Maffia"], "site_data": "html Apps Forums Leaderboard Contribute API Support Discover Movies TV Shows Movies Popular Top Rated Upcoming Now Playing TV Shows Popular Top Rated On TV Airing Today People Popular People Can't find a movie or TV show? Login to create it. en Login Sign Up  ID: 3750   Expand Nip/Tuck   (2003) User Score Overview Hotshot plastic surgeons Dr. Sean McNamara and Dr. Christian Troy experience full-blown midlife crises as they confront career, family and romance problems. Featured Crew Ryan Murphy Creator Discussions   Reviews Videos   Images   Changes Report Share Discussions General  1 Content Issues  5 Images Backdrops  39 Posters  14 Videos Trailers  0 Teasers  0 Clips  0 Featurettes  0 Opening Credits  0 Top Billed Cast Dylan Walsh Sean McNamara Julian McMahon Christian Troy Joely Richardson Julia McNamara John Hensley Matt McNamara Roma Maffia Liz Cruz Full Cast & Crew Last Season Season 7 2010 | 9 Episodes Season 7 of Nip/Tuck premiered on January  6, 2010. View All Seasons Social Reviews  0 Discussions  6 Subject Status Replies Last Reply w Dr. Christian Troy: Happy Birthday Julian McMahon! Open 0 by wonder2wonder\n      \n     Go to Discussions Media Most Popular Videos  0 Backdrops  39 Posters  14 Recommendations   1994-09-19 ER 6.9    2006-03-05 Numb3rs 6.5    2002-09-23 CSI: Miami 5.8    2004-07-21 Rescue Me 7.6    2006-03-12 Big Love 7.6    2005-08-07 Weeds 7.1    1998-06-06 Sex and the City 5.5    2001-06-03 Six Feet Under 8.2  Facts Status  Ended Network Certification TV-MA Meaning This program is specifically designed to be viewed by adults and therefore may be unsuitable for children under 17 Type  Scripted Original Language  English Runtime  40m Homepage   http://www.fxnetworks.com/shows/originals/niptuck_s5/ Genres Drama Keywords miami plastic surgery womanizer plastic surgeon narcissism Content Score 93 Almost there... Top Contributors N 74 Naudar 60 Banana g 22 gismo33 11 Travis Bell  View Edit History Popularity Trend  Login to edit  URL By  signing up  for an account on TMDb, you can post directly to Twitter and Facebook. You need to be logged in to continue. Click  here  to login or  here  to sign up.    page_wrap opened in html_head  Join the Community The Basics About TMDb Contact Us Support Forums API Blog Get Involved  Contribution Bible 3rd Party Applications Add New Movie Add New TV Show Community Guidelines Leaderboard Forums Twitter Facebook Legal Terms of Use Privacy Policy Login Sign Up", "character": ["Sean McNamara", "Christian Troy", "Julia McNamara", "Matt McNamara", "Liz Cruz"]}