{"link": "https://www.themoviedb.org/tv/80044?language=en", "title": "Buzzfeed Unsolved - Supernatural", "resume": "Ryan Bergara (a believer in the supernatural) and Shane Madej (a skeptic) travel to alleged haunted locations to investigate paranormal activity.", "rate": 60, "genre": ["Documentary", "Mystery"], "cast": ["Shane Madej", "Ryan Bergara"], "character": ["Himself", "Himself"], "site_data": "html Apps Forums Leaderboard Contribute API Support Discover Movies TV Shows Movies Popular Top Rated Upcoming Now Playing TV Shows Popular Top Rated On TV Airing Today People Popular People Can't find a movie or TV show? Login to create it. en Login Sign Up  ID: 80044   Expand Buzzfeed Unsolved - Supernatural   (2016) User Score Overview Ryan Bergara (a believer in the supernatural) and Shane Madej (a skeptic) travel to alleged haunted locations to investigate paranormal activity. Discussions   Reviews Videos   Images   Changes Report Share Discussions General  0 Content Issues  0 Images Backdrops  1 Posters  2 Videos Trailers  0 Teasers  0 Clips  0 Featurettes  0 Opening Credits  0 Top Billed Cast Shane Madej Himself Ryan Bergara Himself Full Cast & Crew Current Season Season 4 2018 | 7 Episodes Season 4 of Buzzfeed Unsolved - Supernatural premiered on April 20, 2018. View All Seasons Social Reviews  0 Discussions  0 Media Most Popular Videos  0 Backdrops  1 Posters  2 Recommendations We don't have enough data to suggest any TV shows based on Buzzfeed Unsolved - Supernatural. You can help by rating TV shows you've seen. Facts Status  Returning Series Network Certification  - Type  Documentary Original Language  English Runtime  30m Homepage   https://www.youtube.com/playlist?list=PLVAvUrL_VQiPTU9gU_8n71tHIEOdHut-o Genres Documentary Mystery Keywords No keywords have been added. Content Score 56 We're so close, yet so far. Top Contributors 21 Girl lost in seriation 8 Elizabeth Jennings R 2 Rebecca 2 Banana  View Edit History Popularity Trend  Login to edit  URL By  signing up  for an account on TMDb, you can post directly to Twitter and Facebook. You need to be logged in to continue. Click  here  to login or  here  to sign up.    page_wrap opened in html_head  Join the Community The Basics About TMDb Contact Us Support Forums API Blog Get Involved  Contribution Bible 3rd Party Applications Add New Movie Add New TV Show Community Guidelines Leaderboard Forums Twitter Facebook Legal Terms of Use Privacy Policy Login Sign Up"}