{"link": "https://www.themoviedb.org/tv/9548?language=en", "title": "The Ant and the Aardvark", "resume": "The Ant and the Aardvark is a series of 17 theatrical short cartoons produced at DePatie-Freleng Enterprises and released by United Artists from 1969 to 1971.", "rate": 75, "genre": ["Animation", "Comedy"], "cast": ["John Byner"], "character": ["Aardvark (voice)"], "site_data": "html Apps Forums Leaderboard Contribute API Support Discover Movies TV Shows Movies Popular Top Rated Upcoming Now Playing TV Shows Popular Top Rated On TV Airing Today People Popular People Can't find a movie or TV show? Login to create it. en Login Sign Up  ID: 9548   Expand The Ant and the Aardvark   (1969) User Score Overview The Ant and the Aardvark is a series of 17 theatrical short cartoons produced at DePatie-Freleng Enterprises and released by United Artists from 1969 to 1971. Discussions   Reviews Videos   Images   Changes Report Share Discussions General  0 Content Issues  0 Images Backdrops  2 Posters  2 Videos Trailers  0 Teasers  0 Clips  0 Featurettes  0 Opening Credits  0 Top Billed Cast John Byner Aardvark (voice) Full Cast & Crew Last Season Season 1 1969 | 17 Episodes View All Seasons Social Reviews  0 Discussions  0 Media Most Popular Videos  0 Backdrops  2 Posters  2 Recommendations We don't have enough data to suggest any TV shows based on The Ant and the Aardvark. You can help by rating TV shows you've seen. Facts Status  Ended Network Certification  - Type  Scripted Original Language  English Runtime  30m Homepage  - Genres Animation Comedy Keywords insect ant aardvark anteater Content Score 56 We're so close, yet so far. Top Contributors g 36 gregbl P 17 Prototyp206 15 Banana m 4 magoozin  View Edit History Popularity Trend  Login to edit  URL By  signing up  for an account on TMDb, you can post directly to Twitter and Facebook. You need to be logged in to continue. Click  here  to login or  here  to sign up.    page_wrap opened in html_head  Join the Community The Basics About TMDb Contact Us Support Forums API Blog Get Involved  Contribution Bible 3rd Party Applications Add New Movie Add New TV Show Community Guidelines Leaderboard Forums Twitter Facebook Legal Terms of Use Privacy Policy Login Sign Up"}