{"link": "https://www.themoviedb.org/tv/62898?language=en", "title": "Der Lack ist ab", "resume": "We don't have an overview translated in English. Help us expand our database by adding one.", "rate": 0, "genre": ["Comedy"], "cast": ["Ben Becker", "Silke Bodenbender", "Kai Wiesinger", "Anja Kling", "Bettina Zimmermann"], "character": ["Andi", "Vicky", "Tom", "Ulla", "Hanna"], "site_data": "html Apps Forums Leaderboard Contribute API Support Discover Movies TV Shows Movies Popular Top Rated Upcoming Now Playing TV Shows Popular Top Rated On TV Airing Today People Popular People Can't find a movie or TV show? Login to create it. en Login Sign Up  ID: 62898   Expand Der Lack ist ab   (2015) User Score Overview We don't have an overview translated in English. Help us expand our database by adding one. Discussions   Reviews Videos   Images   Changes Report Share Discussions General  0 Content Issues  0 Images Backdrops  0 Posters  2 Videos Trailers  0 Teasers  0 Clips  0 Featurettes  0 Opening Credits  0 Top Billed Cast Ben Becker Andi Silke Bodenbender Vicky Kai Wiesinger Tom Anja Kling Ulla Bettina Zimmermann Hanna Full Cast & Crew Last Season Season 1 2015 | 10 Episodes Season 1 of Der Lack ist ab premiered on April 22, 2015. View All Seasons Social Reviews  0 Discussions  0 Media Most Popular Videos  0 Backdrops  0 Posters  2 Recommendations We don't have enough data to suggest any TV shows based on Der Lack ist ab. You can help by rating TV shows you've seen. Facts Status  Ended Network Certification  - Type  Scripted Original Language  German Runtime  15m Homepage  - Genres Comedy Keywords No keywords have been added. Content Score 64 We're so close, yet so far. Top Contributors S 18 Samara t 7 trendspoke m 5 mrkapital 2 Elizabeth Jennings  View Edit History Popularity Trend  Login to edit  URL By  signing up  for an account on TMDb, you can post directly to Twitter and Facebook. You need to be logged in to continue. Click  here  to login or  here  to sign up.    page_wrap opened in html_head  Join the Community The Basics About TMDb Contact Us Support Forums API Blog Get Involved  Contribution Bible 3rd Party Applications Add New Movie Add New TV Show Community Guidelines Leaderboard Forums Twitter Facebook Legal Terms of Use Privacy Policy Login Sign Up"}