{"link": "https://www.themoviedb.org/tv/62302?language=en", "title": "Los Simuladores", "resume": "We don't have an overview translated in English. Help us expand our database by adding one.", "rate": null, "genre": ["Action", "Adventure", "Comedy"], "cast": ["Alejandro Calva", "Rub\u00e9n Zamora", "Arath de la Torre", "Tony Dalton"], "site_data": "html Apps Forums Leaderboard Contribute API Support Discover Movies TV Shows Movies Popular Top Rated Upcoming Now Playing TV Shows Popular Top Rated On TV Airing Today People Popular People Can't find a movie or TV show? Login to create it. en Login Sign Up  ID: 62302   Expand Los Simuladores   (2008) User Score Overview We don't have an overview translated in English. Help us expand our database by adding one. Featured Crew Dami\u00e1n Szifr\u00f3n Creator Discussions   Reviews Videos   Images   Changes Report Share Discussions General  0 Content Issues  0 Images Backdrops  0 Posters  2 Videos Trailers  0 Teasers  0 Clips  0 Featurettes  0 Opening Credits  0 Top Billed Cast Alejandro Calva L\u00f3pez Rub\u00e9n Zamora Medina Arath de la Torre Vargas Tony Dalton Santos Full Cast & Crew Last Season Season 2 2009 | 18 Episodes Season 2 of Los Simuladores premiered on July 17, 2009. View All Seasons Social Reviews  0 Discussions  0 Media Most Popular Videos  0 Backdrops  0 Posters  2 Recommendations We don't have enough data to suggest any TV shows based on Los Simuladores. You can help by rating TV shows you've seen. Facts Status  Ended Network Certification  - Type  Scripted Original Language  Spanish; Castilian Runtime  - Homepage   http://www2.esmas.com/entretenimiento/programastv/los-simuladores/ Genres Action & Adventure Comedy Keywords No keywords have been added. Content Score 71 Just a little bit more... Top Contributors 25 jferruzca CM 6 Cherche Moi  View Edit History Popularity Trend  Login to edit  URL By  signing up  for an account on TMDb, you can post directly to Twitter and Facebook. You need to be logged in to continue. Click  here  to login or  here  to sign up.    page_wrap opened in html_head  Join the Community The Basics About TMDb Contact Us Support Forums API Blog Get Involved  Contribution Bible 3rd Party Applications Add New Movie Add New TV Show Community Guidelines Leaderboard Forums Twitter Facebook Legal Terms of Use Privacy Policy Login Sign Up", "character": ["L\u00f3pez", "Medina", "Vargas", "Santos"]}