{"link": "https://www.themoviedb.org/tv/7812?language=en", "title": "Anna und die Liebe", "resume": "Anna und die Liebe is the eleventh Telenovela made in Germany. It has aired since August 25, 2008 on German channel Sat.1 and Austrian Channel ORF 1.", "rate": 50, "genre": ["Drama"], "cast": ["Jeanette Biedermann", "Franziska Matthus", "Roy Peter Link", "Lars L\u00f6llmann", "Heike Jonca"], "character": ["Anna Polauke", "Natascha Broda", "Jonas Broda", "Gerrit Broda", "Susanne Polauke"], "site_data": "html Apps Forums Leaderboard Contribute API Support Discover Movies TV Shows Movies Popular Top Rated Upcoming Now Playing TV Shows Popular Top Rated On TV Airing Today People Popular People Can't find a movie or TV show? Login to create it. en Login Sign Up  ID: 7812   Expand Anna und die Liebe   (2008) User Score Overview Anna und die Liebe is the eleventh Telenovela made in Germany. It has aired since August 25, 2008 on German channel Sat.1 and Austrian Channel ORF 1. Discussions   Reviews Videos   Images   Changes Report Share Discussions General  0 Content Issues  0 Images Backdrops  3 Posters  1 Videos Trailers  0 Teasers  0 Clips  0 Featurettes  0 Opening Credits  0 Top Billed Cast Jeanette Biedermann Anna Polauke Franziska Matthus Natascha Broda Roy Peter Link Jonas Broda Lars L\u00f6llmann Gerrit Broda Heike Jonca Susanne Polauke Full Cast & Crew Last Season Season 2 2009 | 116 Episodes Season 2 of Anna und die Liebe premiered on November 16, 2009. View All Seasons Social Reviews  0 Discussions  0 Media Most Popular Videos  0 Backdrops  3 Posters  1 Recommendations We don't have enough data to suggest any TV shows based on Anna und die Liebe. You can help by rating TV shows you've seen. Facts Status  Ended Network Certification  - Type  Scripted Original Language  German Runtime  30m Homepage   http://www.annaunddieliebe.de/ Genres Drama Keywords No keywords have been added. Content Score 86 Almost there... Top Contributors 12 Simon S 12 Samara a 9 asusar g 1 gizibeciel  View Edit History Popularity Trend  Login to edit  URL By  signing up  for an account on TMDb, you can post directly to Twitter and Facebook. You need to be logged in to continue. Click  here  to login or  here  to sign up.    page_wrap opened in html_head  Join the Community The Basics About TMDb Contact Us Support Forums API Blog Get Involved  Contribution Bible 3rd Party Applications Add New Movie Add New TV Show Community Guidelines Leaderboard Forums Twitter Facebook Legal Terms of Use Privacy Policy Login Sign Up"}