{"link": "https://www.themoviedb.org/tv/74280?language=en", "title": "Hey Duggee", "resume": "Animated preschool series about a clubhouse that is run by a big dog called Duggee.", "rate": 0, "genre": ["Animation"], "cast": ["Alexander Armstrong"], "character": ["Narrator"], "site_data": "html Apps Forums Leaderboard Contribute API Support Discover Movies TV Shows Movies Popular Top Rated Upcoming Now Playing TV Shows Popular Top Rated On TV Airing Today People Popular People Can't find a movie or TV show? Login to create it. en Login Sign Up  ID: 74280   Expand Hey Duggee   (2015) User Score Overview Animated preschool series about a clubhouse that is run by a big dog called Duggee. Featured Crew Grant Orchard Creator Discussions   Reviews Videos   Images   Changes Report Share Discussions General  0 Content Issues  0 Images Backdrops  1 Posters  1 Videos Trailers  0 Teasers  0 Clips  0 Featurettes  0 Opening Credits  0 Top Billed Cast Alexander Armstrong Narrator Full Cast & Crew Last Season Season 2 2016 | 47 Episodes Season 2 of Hey Duggee premiered on September 26, 2016. View All Seasons Social Reviews  0 Discussions  0 Media Most Popular Videos  0 Backdrops  1 Posters  1 Recommendations We don't have enough data to suggest any TV shows based on Hey Duggee. You can help by rating TV shows you've seen. Facts Status  Returning Series Network Certification  - Type  Scripted Original Language  English Runtime  7m Homepage   https://www.bbc.co.uk/cbeebies/shows/hey-duggee Genres Animation Keywords No keywords have been added. Content Score 64 We're so close, yet so far. Top Contributors z 19 zombieboy 10 Elizabeth Jennings 5 T19 r 4 ryanbeaton  View Edit History Popularity Trend  Login to edit  URL By  signing up  for an account on TMDb, you can post directly to Twitter and Facebook. You need to be logged in to continue. Click  here  to login or  here  to sign up.    page_wrap opened in html_head  Join the Community The Basics About TMDb Contact Us Support Forums API Blog Get Involved  Contribution Bible 3rd Party Applications Add New Movie Add New TV Show Community Guidelines Leaderboard Forums Twitter Facebook Legal Terms of Use Privacy Policy Login Sign Up"}