{"link": "https://www.themoviedb.org/tv/74209?language=en", "title": "Zarah: Wilde Jahre", "resume": "We don't have an overview translated in English. Help us expand our database by adding one.", "rate": 0, "genre": ["Drama"], "cast": ["Claudia Eisinger", "Torben Liebrecht", "Svenja Jung", "Uwe Preuss", "Ole Puppe"], "character": ["Zarah Wolf", "Hans-Peter Kerckow", "Jenny Olsen", "Frederik Olsen", "Georg Hartwig"], "site_data": "html Apps Forums Leaderboard Contribute API Support Discover Movies TV Shows Movies Popular Top Rated Upcoming Now Playing TV Shows Popular Top Rated On TV Airing Today People Popular People Can't find a movie or TV show? Login to create it. en Login Sign Up  ID: 74209   Expand Zarah: Wilde Jahre   (2017) User Score Overview We don't have an overview translated in English. Help us expand our database by adding one. Featured Crew Jan Kromschr\u00f6der Creator Discussions   Reviews Videos   Images   Changes Report Share Discussions General  0 Content Issues  0 Images Backdrops  3 Posters  1 Videos Trailers  0 Teasers  0 Clips  0 Featurettes  0 Opening Credits  0 Top Billed Cast Claudia Eisinger Zarah Wolf Torben Liebrecht Hans-Peter Kerckow Svenja Jung Jenny Olsen Uwe Preuss Frederik Olsen Ole Puppe Georg Hartwig Full Cast & Crew Last Season Season 1 2017 | 6 Episodes Season 1 of Zarah: Wilde Jahre premiered on September  7, 2017. View All Seasons Social Reviews  0 Discussions  0 Media Most Popular Videos  0 Backdrops  3 Posters  1 Recommendations We don't have enough data to suggest any TV shows based on Zarah: Wilde Jahre. You can help by rating TV shows you've seen. Facts Status  Ended Networks Certification  - Type  Miniseries Original Language  German Runtime  45m Homepage   https://www.zdf.de/serien/zarah-wilde-jahre Genres Drama Keywords journalist 1970s feminism press miniseries Content Score 86 Almost there... Top Contributors t 58 tmdb45070722 TB 6 TMDb Bot S 1 Samara  View Edit History Popularity Trend  Login to edit  URL By  signing up  for an account on TMDb, you can post directly to Twitter and Facebook. You need to be logged in to continue. Click  here  to login or  here  to sign up.    page_wrap opened in html_head  Join the Community The Basics About TMDb Contact Us Support Forums API Blog Get Involved  Contribution Bible 3rd Party Applications Add New Movie Add New TV Show Community Guidelines Leaderboard Forums Twitter Facebook Legal Terms of Use Privacy Policy Login Sign Up"}