{"link": "https://www.themoviedb.org/tv/5900?language=en", "title": "The Starter Wife", "resume": "The events of one woman's life following her divorce after years of marriage to a Hollywood studio executive. Based on the best-selling novel by Gigi Levangie Grazer.", "rate": null, "genre": ["Comedy", "Drama"], "cast": ["Judy Davis", "Debra Messing", "Chris Diamantopoulos", "Danielle Nicolet", "Joe Mantegna"], "site_data": "html Apps Forums Leaderboard Contribute API Support Discover Movies TV Shows Movies Popular Top Rated Upcoming Now Playing TV Shows Popular Top Rated On TV Airing Today People Popular People Can't find a movie or TV show? Login to create it. en Login Sign Up  ID: 5900   Expand The Starter Wife   (2007) User Score Overview The events of one woman's life following her divorce after years of marriage to a Hollywood studio executive. Based on the best-selling novel by Gigi Levangie Grazer. Featured Crew Sara Parriott Creator Josann McGibbon Creator Discussions   Reviews Videos   Images   Changes Report Share Discussions General  0 Content Issues  0 Images Backdrops  3 Posters  2 Videos Trailers  0 Teasers  0 Clips  0 Featurettes  0 Opening Credits  0 Top Billed Cast Judy Davis Joan McAllister Debra Messing Molly Kagan Chris Diamantopoulos Danielle Nicolet Joe Mantegna Full Cast & Crew Last Season Season 2 2008 | 10 Episodes Season 2 of The Starter Wife premiered on October 10, 2008. View All Seasons Social Reviews  0 Discussions  0 Media Most Popular Videos  0 Backdrops  3 Posters  2 Recommendations We don't have enough data to suggest any TV shows based on The Starter Wife. You can help by rating TV shows you've seen. Facts Status  Ended Network Certification  - Type  Scripted Original Language  English Runtime  60m Homepage   http://www.usanetwork.com/series/starterwife/ Genres Comedy Drama Keywords No keywords have been added. Content Score 93 Almost there... Top Contributors 9 Elizabeth Jennings i 4 ismax935 4 Banana 3 Zlogorek  View Edit History Popularity Trend  Login to edit  URL By  signing up  for an account on TMDb, you can post directly to Twitter and Facebook. You need to be logged in to continue. Click  here  to login or  here  to sign up.    page_wrap opened in html_head  Join the Community The Basics About TMDb Contact Us Support Forums API Blog Get Involved  Contribution Bible 3rd Party Applications Add New Movie Add New TV Show Community Guidelines Leaderboard Forums Twitter Facebook Legal Terms of Use Privacy Policy Login Sign Up", "character": ["Joan McAllister", "Molly Kagan"]}