{"link": "https://www.themoviedb.org/tv/68005?language=en", "title": "Yosuga no Sora", "resume": "We don't have an overview translated in English. Help us expand our database by adding one.", "rate": 64, "genre": ["Animation", "Drama"], "cast": ["Sakata, Kayo", "Minegishi, Yukari", "Hiro Shimono", "Ryouko Ono", "Yuka Inokuchi"], "character": ["Amatsume, Akira", "Kuranaga, Kozue", "Kasugano, Haruka", "Migiwa, Kazuha", "Inokuchi, Yuka"], "site_data": "html Apps Forums Leaderboard Contribute API Support Discover Movies TV Shows Movies Popular Top Rated Upcoming Now Playing TV Shows Popular Top Rated On TV Airing Today People Popular People Can't find a movie or TV show? Login to create it. en Login Sign Up  ID: 68005   Expand Yosuga no Sora   (2010) User Score Overview We don't have an overview translated in English. Help us expand our database by adding one. Featured Crew Takeo Takahashi Creator Discussions   Reviews Videos   Images   Changes Report Share Discussions General  0 Content Issues  0 Images Backdrops  3 Posters  5 Videos Trailers  0 Teasers  0 Clips  0 Featurettes  0 Opening Credits  0 Top Billed Cast Sakata, Kayo Amatsume, Akira Minegishi, Yukari Kuranaga, Kozue Hiro Shimono Kasugano, Haruka Ryouko Ono Migiwa, Kazuha Yuka Inokuchi Inokuchi, Yuka Full Cast & Crew Last Season Season 1 2010 | 12 Episodes Season 1 of Yosuga no Sora premiered on October  4, 2010. View All Seasons Social Reviews  0 Discussions  0 Media Most Popular Videos  0 Backdrops  3 Posters  5 Recommendations   2014-07-03 Tokyo Ghoul 7.2    2004-10-05 Bleach 7.5    1997-10-07 Berserk 8.1    2015-10-04 One-Punch Man 8.2  Facts Original Name  \u30e8\u30b9\u30ac\u30ce\u30bd\u30e9 Status  Ended Network Certification  - Type  Scripted Original Language  Japanese Runtime  24m Homepage   http://king-cr.jp/special/yosuganosora/ Genres Animation Drama Keywords harem ecchi romantic Content Score 93 Almost there... Top Contributors d 25 divyanka 18 Greg z 12 zahodum 8 Jenazad  View Edit History Popularity Trend  Login to edit  URL By  signing up  for an account on TMDb, you can post directly to Twitter and Facebook. You need to be logged in to continue. Click  here  to login or  here  to sign up.    page_wrap opened in html_head  Join the Community The Basics About TMDb Contact Us Support Forums API Blog Get Involved  Contribution Bible 3rd Party Applications Add New Movie Add New TV Show Community Guidelines Leaderboard Forums Twitter Facebook Legal Terms of Use Privacy Policy Login Sign Up"}