{"link": "https://www.themoviedb.org/tv/11787?language=en", "title": "Raven", "resume": "Raven is an American TV series that originally aired on CBS in 1992-1993. This hour-long action drama featured martial arts, adventure, humor, mystery and secret societies.", "rate": null, "genre": ["Action", "Adventure"], "cast": ["Jeffrey Meek", "Lee Majors", "Elizabeth Berkley", "Marcia Cross", "Felicity Huffman"], "site_data": "html Apps Forums Leaderboard Contribute API Support Discover Movies TV Shows Movies Popular Top Rated Upcoming Now Playing TV Shows Popular Top Rated On TV Airing Today People Popular People Can't find a movie or TV show? Login to create it. en Login Sign Up  ID: 11787   Expand Raven   (1992) User Score Overview Raven is an American TV series that originally aired on CBS in 1992-1993. This hour-long action drama featured martial arts, adventure, humor, mystery and secret societies. Featured Crew Frank Lupo Creator Discussions   Reviews Videos   Images   Changes Report Share Discussions General  0 Content Issues  0 Images Backdrops  1 Posters  2 Videos Trailers  0 Teasers  0 Clips  0 Featurettes  0 Opening Credits  0 Top Billed Cast Jeffrey Meek Jonathan Raven Lee Majors Herman Jablonski Elizabeth Berkley Deborah Marcia Cross Carla Dellatory Felicity Huffman Sharon Prior Full Cast & Crew Last Season Season 2 1993 | 13 Episodes Season 2 of Raven premiered on January  2, 1993. View All Seasons Social Reviews  0 Discussions  0 Media Most Popular Videos  0 Backdrops  1 Posters  2 Recommendations We don't have enough data to suggest any TV shows based on Raven. You can help by rating TV shows you've seen. Facts Status  Ended Network Certification  - Type  Scripted Original Language  English Runtime  60m Homepage  - Genres Action & Adventure Keywords martial arts hawaii ninja private investigator ex special forces Content Score 93 Almost there... Top Contributors 15 Banana d 7 denis 2 \u0415\u0432\u0433\u0435\u043d\u0438\u0439 1 Elizabeth Jennings  View Edit History Popularity Trend  Login to edit  URL By  signing up  for an account on TMDb, you can post directly to Twitter and Facebook. You need to be logged in to continue. Click  here  to login or  here  to sign up.    page_wrap opened in html_head  Join the Community The Basics About TMDb Contact Us Support Forums API Blog Get Involved  Contribution Bible 3rd Party Applications Add New Movie Add New TV Show Community Guidelines Leaderboard Forums Twitter Facebook Legal Terms of Use Privacy Policy Login Sign Up", "character": ["Jonathan Raven", "Herman Jablonski", "Deborah", "Carla Dellatory", "Sharon Prior"]}