{"link": "https://www.themoviedb.org/tv/74605?language=en", "title": "Sleepers", "resume": "We don't have an overview translated in English. Help us expand our database by adding one.", "rate": 78, "genre": ["Mystery", "War", "Politics"], "cast": ["Igor Petrenko", "Natalya Rogozhkina", "Dmitri Ulyanov", "Yuri Belyayev", "Alexander Rapoport"], "character": ["\u0410\u043d\u0434\u0440\u0435\u0439 \u0420\u043e\u0434\u0438\u043e\u043d\u043e\u0432", "\u041a\u0438\u0440\u0430 \u0416\u0443\u0440\u0430\u0432\u043b\u0435\u0432\u0430", "\u0418\u0432\u0430\u043d \u0416\u0443\u0440\u0430\u0432\u043b\u0435\u0432", "\u0410\u043b\u0435\u043a\u0441\u0430\u043d\u0434\u0440 \u0418\u043b\u044c\u0438\u0447 \u041d\u0435\u0444\u0435\u0434\u043e\u0432", "\u041f\u043e\u043b \u0411\u0440\u044d\u0434\u0444\u0438\u043b\u0434"], "site_data": "html Apps Forums Leaderboard Contribute API Support Discover Movies TV Shows Movies Popular Top Rated Upcoming Now Playing TV Shows Popular Top Rated On TV Airing Today People Popular People Can't find a movie or TV show? Login to create it. en Login Sign Up  ID: 74605   Expand Sleepers   (2017) User Score Overview We don't have an overview translated in English. Help us expand our database by adding one. Featured Crew \u0421\u0435\u0440\u0433\u0435\u0439 \u041c\u0438\u043d\u0430\u0435\u0432 Creator Discussions   Reviews Videos   Images   Changes Report Share Discussions General  0 Content Issues  0 Images Backdrops  4 Posters  3 Videos Trailers  0 Teasers  0 Clips  0 Featurettes  0 Opening Credits  0 Top Billed Cast Igor Petrenko \u0410\u043d\u0434\u0440\u0435\u0439 \u0420\u043e\u0434\u0438\u043e\u043d\u043e\u0432 Natalya Rogozhkina \u041a\u0438\u0440\u0430 \u0416\u0443\u0440\u0430\u0432\u043b\u0435\u0432\u0430 Dmitri Ulyanov \u0418\u0432\u0430\u043d \u0416\u0443\u0440\u0430\u0432\u043b\u0435\u0432 Yuri Belyayev \u0410\u043b\u0435\u043a\u0441\u0430\u043d\u0434\u0440 \u0418\u043b\u044c\u0438\u0447 \u041d\u0435\u0444\u0435\u0434\u043e\u0432 Alexander Rapoport \u041f\u043e\u043b \u0411\u0440\u044d\u0434\u0444\u0438\u043b\u0434 Full Cast & Crew Current Season Original Air Date Original Air Date \u041f\u0435\u0440\u0432\u044b\u0439 \u043a\u0430\u043d\u0430\u043b (\u0420\u043e\u0441\u0441\u0438\u044f) (TV) Season 2 2018 | 4 Episodes Season 2 of Sleepers premiered on March  5, 2018. View All Seasons Social Reviews  0 Discussions  0 Media Most Popular Videos  0 Backdrops  4 Posters  3 Recommendations We don't have enough data to suggest any TV shows based on Sleepers. You can help by rating TV shows you've seen. Facts Original Name  \u0421\u043f\u044f\u0449\u0438\u0435 Status  Ended Network Certification 16+ Meaning Only teens the age of 16 or older can watch. Type  Scripted Original Language  Russian Runtime  55m Homepage   https://kino.1tv.ru/serials/spyashchie Genres Mystery War & Politics Keywords spy political detective fsb Content Score 86 Almost there... Top Contributors n 72 navarro2018 l 38 lestor v 4 vking S 3 ShareRapid  View Edit History Popularity Trend  Login to edit  URL By  signing up  for an account on TMDb, you can post directly to Twitter and Facebook. You need to be logged in to continue. Click  here  to login or  here  to sign up.    page_wrap opened in html_head  Join the Community The Basics About TMDb Contact Us Support Forums API Blog Get Involved  Contribution Bible 3rd Party Applications Add New Movie Add New TV Show Community Guidelines Leaderboard Forums Twitter Facebook Legal Terms of Use Privacy Policy Login Sign Up"}