{"link": "https://www.themoviedb.org/tv/2835?language=en", "title": "Gardening Australia", "resume": "Gardening Australia provides practical, realistic and credible horticultural and gardening advice, inspiring and entertaining Australian gardeners around the nation.", "rate": 0, "genre": ["Documentary"], "cast": ["Costa Georgiadis"], "character": ["Himself - Host"], "site_data": "html Apps Forums Leaderboard Contribute API Support Discover Movies TV Shows Movies Popular Top Rated Upcoming Now Playing TV Shows Popular Top Rated On TV Airing Today People Popular People Can't find a movie or TV show? Login to create it. en Login Sign Up  ID: 2835   Expand Gardening Australia   (2005) User Score  Play Trailer Overview Gardening Australia provides practical, realistic and credible horticultural and gardening advice, inspiring and entertaining Australian gardeners around the nation. Discussions   Reviews Videos   Images   Changes Report Share Discussions General  0 Content Issues  0 Images Backdrops  9 Posters  1 Videos Trailers  1 Teasers  0 Clips  0 Featurettes  0 Opening Credits  0 Top Billed Cast Costa Georgiadis Himself - Host Full Cast & Crew Current Season Series 29 2018 | 18 Episodes Season 29 of Gardening Australia premiered on January 26, 2018. View All Seasons Social Reviews  0 Discussions  0 Media Most Popular Videos  1 Backdrops  9 Posters  1 Recommendations We don't have enough data to suggest any TV shows based on Gardening Australia. You can help by rating TV shows you've seen. Facts Status  Returning Series Network Certification G Meaning For general exhibition; all ages are permitted to watch programming with this rating. Type  Scripted Original Language  English Runtime  30m, 60m Homepage   http://www.abc.net.au/gardening Genres Documentary Keywords lifestyle gardening Content Score 64 We're so close, yet so far. Top Contributors 43 United600 TB 3 TMDb Bot a 2 apung21 2 tigru89  View Edit History Popularity Trend  Login to edit  URL By  signing up  for an account on TMDb, you can post directly to Twitter and Facebook. You need to be logged in to continue. Click  here  to login or  here  to sign up.    page_wrap opened in html_head  Join the Community The Basics About TMDb Contact Us Support Forums API Blog Get Involved  Contribution Bible 3rd Party Applications Add New Movie Add New TV Show Community Guidelines Leaderboard Forums Twitter Facebook Legal Terms of Use Privacy Policy Login Sign Up"}