{"link": "https://www.themoviedb.org/tv/44856?language=en", "title": "Wentworth", "resume": "Bea Smith is locked up while awaiting trial for the attempted murder of her husband and must learn how life works in prison. A modern adaptation and sequel of the iconic Prisoner series.", "rate": 79, "genre": ["Drama", "Crime"], "cast": ["Nicole da Silva", "Kate Atkinson", "Celia Ireland", "Robbie Magasiva", "Libby Tanner"], "character": ["Franky Doyle", "Vera Bennett", "Liz Birdsworth", "Will Jackson", "Bridget Westfall"], "site_data": "html Apps Forums Leaderboard Contribute API Support Discover Movies TV Shows Movies Popular Top Rated Upcoming Now Playing TV Shows Popular Top Rated On TV Airing Today People Popular People Can't find a movie or TV show? Login to create it. en Login Sign Up  ID: 44856   Expand Wentworth   (2013) User Score  Play Trailer Overview Bea Smith is locked up while awaiting trial for the attempted murder of her husband and must learn how life works in prison. A modern adaptation and sequel of the iconic Prisoner series. Featured Crew Lara Radulovich Creator Reg Watson Creator Discussions   Reviews Videos   Images   Changes Report Share Discussions General  1 Content Issues  0 Images Backdrops  11 Posters  6 Videos Trailers  2 Teasers  0 Clips  0 Featurettes  0 Opening Credits  0 Top Billed Cast Nicole da Silva Franky Doyle Kate Atkinson Vera Bennett Celia Ireland Liz Birdsworth Robbie Magasiva Will Jackson Libby Tanner Bridget Westfall Full Cast & Crew Current Season Season 6 2018 | 3 Episodes Season 6 of Wentworth premiered on June 19, 2018. View All Seasons Social Reviews  0 Discussions  1 Subject Status Replies Last Reply Season 5 Discussions with spoilers Open 0 by rtms77\n      \n     Go to Discussions Media Most Popular Videos  2 Backdrops  11 Posters  6 Recommendations   2014-10-06 Strange Empire 6.2    2016-05-11 Killer Women with Piers Morgan 7.5    2016-10-12 Nurses Who Kill 7.3    2009-10-14 Alaska State Troopers 7.7    2015-04-05 The Lizzie Borden Chronicles 6.2    2015-07-31 Cold Justice: Sex Crimes 5.5    2015-03-16 Spotless 7.3    2014-12-02 Girlfriends' Guide to Divorce 5.1  Facts Status  Returning Series Network Certification 19 Meaning This rating is for programs that are intended for adults only. 19-rated programming cannot air during the hours of 7:00AM to 9:00AM, and 1:00PM to 10:00PM. Programmes that receive this rating will almost certainly have adult themes, sexual situations, frequent use of strong language and disturbing scenes of violence. Type  Scripted Original Language  English Runtime  45m Homepage   http://www.showcasechannel.com.au/shows/wentworth/ Genres Drama Crime Keywords prison crime women in prison Content Score 100 Yes! Looking good! Top Contributors c 73 courtneysmith86 31 Fludogenerator 20 Elizabeth Jennings k 19 khedron  View Edit History Popularity Trend  Login to edit  URL By  signing up  for an account on TMDb, you can post directly to Twitter and Facebook. You need to be logged in to continue. Click  here  to login or  here  to sign up.    page_wrap opened in html_head  Join the Community The Basics About TMDb Contact Us Support Forums API Blog Get Involved  Contribution Bible 3rd Party Applications Add New Movie Add New TV Show Community Guidelines Leaderboard Forums Twitter Facebook Legal Terms of Use Privacy Policy Login Sign Up"}