{"link": "https://www.themoviedb.org/tv/40980?language=en", "title": "Das Duo", "resume": "Das Duo is a German television series.", "rate": 0, "genre": ["Crime"], "cast": ["Charlotte Schwab", "Peter Prager", "Lisa Martinek", "Ann-Kathrin Kramer", "Bernhard Piesk"], "character": ["Marion Ahrens", "Viktor Ahrens", "Clara Hertz", "Lizzy Kr\u00fcger", "Frank D\u00fcblin"], "site_data": "html Apps Forums Leaderboard Contribute API Support Discover Movies TV Shows Movies Popular Top Rated Upcoming Now Playing TV Shows Popular Top Rated On TV Airing Today People Popular People Can't find a movie or TV show? Login to create it. en Login Sign Up  ID: 40980   Expand Das Duo   (2002) User Score Overview Das Duo is a German television series. Discussions   Reviews Videos   Images   Changes Report Share Discussions General  0 Content Issues  0 Images Backdrops  1 Posters  1 Videos Trailers  0 Teasers  0 Clips  0 Featurettes  0 Opening Credits  0 Top Billed Cast Charlotte Schwab Marion Ahrens Peter Prager Viktor Ahrens Lisa Martinek Clara Hertz Ann-Kathrin Kramer Lizzy Kr\u00fcger Bernhard Piesk Frank D\u00fcblin Full Cast & Crew Last Season Season 1 2002 | 24 Episodes Season 1 of Das Duo premiered on March 16, 2002. View All Seasons Social Reviews  0 Discussions  0 Media Most Popular Videos  0 Backdrops  1 Posters  1 Recommendations We don't have enough data to suggest any TV shows based on Das Duo. You can help by rating TV shows you've seen. Facts Status  Ended Network Certification 16 Meaning Can be aired only from 10:00pm Uhr to 6:00am. Type  Scripted Original Language  German Runtime  90m Homepage  - Genres Crime Keywords No keywords have been added. Content Score 93 Almost there... Top Contributors E 37 Erohwold S 29 Samara TB 4 TMDb Bot  View Edit History Popularity Trend  Login to edit  URL By  signing up  for an account on TMDb, you can post directly to Twitter and Facebook. You need to be logged in to continue. Click  here  to login or  here  to sign up.    page_wrap opened in html_head  Join the Community The Basics About TMDb Contact Us Support Forums API Blog Get Involved  Contribution Bible 3rd Party Applications Add New Movie Add New TV Show Community Guidelines Leaderboard Forums Twitter Facebook Legal Terms of Use Privacy Policy Login Sign Up"}