{"link": "https://www.themoviedb.org/tv/68809?language=en", "title": "\u7231\u60c5\u516c\u5bd3", "resume": "We don't have an overview translated in English. Help us expand our database by adding one.", "rate": 90, "genre": ["Comedy"], "cast": ["Lou YIxiao", "Chen He", "Wang Chuanjun", "Sun Yizhou"], "character": ["\u80e1\u4e00\u83f2", "\u66fe\u5c0f\u8d24", "\u5173\u8c37\u795e\u5947", "\u5415\u5b50\u4e54"], "site_data": "html Apps Forums Leaderboard Contribute API Support Discover Movies TV Shows Movies Popular Top Rated Upcoming Now Playing TV Shows Popular Top Rated On TV Airing Today People Popular People Can't find a movie or TV show? Login to create it. en Login Sign Up  ID: 68809   Expand \u7231\u60c5\u516c\u5bd3   (2009) User Score Overview We don't have an overview translated in English. Help us expand our database by adding one. Featured Crew \u6c6a\u8fdc Creator \u97e6\u6b63 Creator Discussions   Reviews Videos   Images   Changes Report Share Discussions General  0 Content Issues  0 Images Backdrops  1 Posters  2 Videos Trailers  0 Teasers  0 Clips  0 Featurettes  0 Opening Credits  0 Top Billed Cast Lou YIxiao \u80e1\u4e00\u83f2 Chen He \u66fe\u5c0f\u8d24 Wang Chuanjun \u5173\u8c37\u795e\u5947 Sun Yizhou \u5415\u5b50\u4e54 Full Cast & Crew Last Season Season 4 2014 | 24 Episodes Season 4 of \u7231\u60c5\u516c\u5bd3 premiered on January 17, 2014. View All Seasons Social Reviews  0 Discussions  0 Media Most Popular Videos  0 Backdrops  1 Posters  2 Recommendations We don't have enough data to suggest any TV shows based on \u7231\u60c5\u516c\u5bd3. You can help by rating TV shows you've seen. Facts Status  Ended Networks JiangXi TV Certification  - Type  Scripted Original Language  Chinese Runtime  45m Homepage  - Genres Comedy Keywords No keywords have been added. Content Score 86 Almost there... Top Contributors 35 newlifes02 s 15 sajking S 9 Sakya0608 G 7 Giaten  View Edit History Popularity Trend  Login to edit  URL By  signing up  for an account on TMDb, you can post directly to Twitter and Facebook. You need to be logged in to continue. Click  here  to login or  here  to sign up.    page_wrap opened in html_head  Join the Community The Basics About TMDb Contact Us Support Forums API Blog Get Involved  Contribution Bible 3rd Party Applications Add New Movie Add New TV Show Community Guidelines Leaderboard Forums Twitter Facebook Legal Terms of Use Privacy Policy Login Sign Up"}