{"link": "https://www.themoviedb.org/tv/40765?language=en", "title": "Hallo Robbie!", "resume": "Hallo Robbie! is a German television series.", "rate": 0, "genre": ["Family"], "cast": ["Marion Kracht", "Karsten Speck", "Karina Kraushaar", "Till Demtr\u00f8der", "Tim Braeutigam"], "character": ["Frauke Marten", "Dr. Jens Lennart", "Carla Dux", "Uwe Marten", "Kai Marten"], "site_data": "html Apps Forums Leaderboard Contribute API Support Discover Movies TV Shows Movies Popular Top Rated Upcoming Now Playing TV Shows Popular Top Rated On TV Airing Today People Popular People Can't find a movie or TV show? Login to create it. en Login Sign Up  ID: 40765   Expand Hallo Robbie!   (2001) User Score Overview Hallo Robbie! is a German television series. Featured Crew Markus Brunnemann Creator Discussions   Reviews Videos   Images   Changes Report Share Discussions General  0 Content Issues  0 Images Backdrops  1 Posters  1 Videos Trailers  0 Teasers  0 Clips  0 Featurettes  0 Opening Credits  0 Top Billed Cast Marion Kracht Frauke Marten Karsten Speck Dr. Jens Lennart Karina Kraushaar Carla Dux Till Demtr\u00f8der Uwe Marten Tim Braeutigam Kai Marten Full Cast & Crew Last Season Season 8 2008 | 10 Episodes Season 8 of Hallo Robbie! premiered on November 15, 2008. View All Seasons Social Reviews  0 Discussions  0 Media Most Popular Videos  0 Backdrops  1 Posters  1 Recommendations We don't have enough data to suggest any TV shows based on Hallo Robbie!. You can help by rating TV shows you've seen. Facts Status  Ended Network Certification 6 Meaning Can be aired at any time. Type  Scripted Original Language  German Runtime  45m Homepage  - Genres Family Keywords ocean family animal Content Score 93 Almost there... Top Contributors S 79 Samara n 10 nnwrz 2 rtentser  View Edit History Popularity Trend  Login to edit  URL By  signing up  for an account on TMDb, you can post directly to Twitter and Facebook. You need to be logged in to continue. Click  here  to login or  here  to sign up.    page_wrap opened in html_head  Join the Community The Basics About TMDb Contact Us Support Forums API Blog Get Involved  Contribution Bible 3rd Party Applications Add New Movie Add New TV Show Community Guidelines Leaderboard Forums Twitter Facebook Legal Terms of Use Privacy Policy Login Sign Up"}