{"link": "https://www.themoviedb.org/tv/73696?language=en", "title": "Det mest f\u00f6rbjudna", "resume": "We don't have an overview translated in English. Help us expand our database by adding one.", "rate": 0, "genre": ["Drama"], "cast": ["Cilla Thorell", "Magnus Krepper", "Anna Bjelkerud", "Mira Mitchell", "Elmira Arikan"], "character": ["Kerstin Thorvall", "Malte 51 \u00e5r", "Hilma", "Tilde", "Journalist / Reporter Karolina Sarabi"], "site_data": "html Apps Forums Leaderboard Contribute API Support Discover Movies TV Shows Movies Popular Top Rated Upcoming Now Playing TV Shows Popular Top Rated On TV Airing Today People Popular People Can't find a movie or TV show? Login to create it. en Login Sign Up  ID: 73696   Expand Det mest f\u00f6rbjudna   (2016) User Score Overview We don't have an overview translated in English. Help us expand our database by adding one. Discussions   Reviews Videos   Images   Changes Report Share Discussions General  0 Content Issues  0 Images Backdrops  0 Posters  1 Videos Trailers  0 Teasers  0 Clips  0 Featurettes  0 Opening Credits  0 Top Billed Cast Cilla Thorell Kerstin Thorvall Magnus Krepper Malte 51 \u00e5r Anna Bjelkerud Hilma Mira Mitchell Tilde Elmira Arikan Journalist / Reporter Karolina Sarabi Full Cast & Crew Last Season Season 1 2016 | 3 Episodes Season 1 of Det mest f\u00f6rbjudna premiered on March 25, 2016. View All Seasons Social Reviews  0 Discussions  0 Media Most Popular Videos  0 Backdrops  0 Posters  1 Recommendations We don't have enough data to suggest any TV shows based on Det mest f\u00f6rbjudna. You can help by rating TV shows you've seen. Facts Status  Ended Network Certification  - Type  Miniseries Original Language  Swedish Runtime  59m Homepage  - Genres Drama Keywords No keywords have been added. Content Score 64 We're so close, yet so far. Top Contributors VA 38 Viktor Andersson  View Edit History Popularity Trend  Login to edit  URL By  signing up  for an account on TMDb, you can post directly to Twitter and Facebook. You need to be logged in to continue. Click  here  to login or  here  to sign up.    page_wrap opened in html_head  Join the Community The Basics About TMDb Contact Us Support Forums API Blog Get Involved  Contribution Bible 3rd Party Applications Add New Movie Add New TV Show Community Guidelines Leaderboard Forums Twitter Facebook Legal Terms of Use Privacy Policy Login Sign Up"}