{"link": "https://www.themoviedb.org/tv/76497?language=en", "title": "True Women", "resume": "A story of love, friendship, survival and triumph spanning five decades from the Texas Revolution through the Civil War, Reconstruction and beyond.", "rate": null, "genre": ["Drama"], "cast": ["Angelina Jolie", "Dana Delany", "Annabeth Gish", "Tina Majorino", "Rachael Leigh Cook"], "site_data": "html Apps Forums Leaderboard Contribute API Support Discover Movies TV Shows Movies Popular Top Rated Upcoming Now Playing TV Shows Popular Top Rated On TV Airing Today People Popular People Can't find a movie or TV show? Login to create it. en Login Sign Up  ID: 76497   Expand True Women   (1997) User Score  Play Trailer Overview A story of love, friendship, survival and triumph spanning five decades from the Texas Revolution through the Civil War, Reconstruction and beyond. Discussions   Reviews Videos   Images   Changes Report Share Discussions General  0 Content Issues  0 Images Backdrops  1 Posters  9 Videos Trailers  1 Teasers  0 Clips  0 Featurettes  0 Opening Credits  0 Top Billed Cast Angelina Jolie Georgia Virginia Lawshe Woods Dana Delany Sarah McClure Annabeth Gish Euphemia Ashby (adult) Tina Majorino Young Euphemia Ashby Rachael Leigh Cook Georgia Lawshe (young) Full Cast & Crew Last Season Miniseries 1997 | 2 Episodes Season 1 of True Women premiered on May 18, 1997. View All Seasons Social Reviews  0 Discussions  0 Media Most Popular Videos  1 Backdrops  1 Posters  9 Recommendations   1997-05-11 20,000 Leagues Under the Sea 4.6    1996-04-28 The Beast 5.4    2005-09-17 Mysterious Island 5.0    1998-05-18 Creature 4.2    2000-02-27 The 10th Kingdom 7.5  Facts Status  Ended Network Certification  - Type  Miniseries Original Language  English Runtime  85m Homepage  - Genres Drama Keywords based on novel or book texas biography miniseries female protagonist civil rights american civil war emancipation woman director Content Score 93 Almost there... Top Contributors TB 60 TMDb Bot 20 Banana z 4 zach24 g 2 gits  View Edit History Popularity Trend  Login to edit  URL By  signing up  for an account on TMDb, you can post directly to Twitter and Facebook. You need to be logged in to continue. Click  here  to login or  here  to sign up.    page_wrap opened in html_head  Join the Community The Basics About TMDb Contact Us Support Forums API Blog Get Involved  Contribution Bible 3rd Party Applications Add New Movie Add New TV Show Community Guidelines Leaderboard Forums Twitter Facebook Legal Terms of Use Privacy Policy Login Sign Up", "character": ["Georgia Virginia Lawshe Woods", "Sarah McClure", "Euphemia Ashby (adult)", "Young Euphemia Ashby", "Georgia Lawshe (young)"]}