{"link": "https://www.themoviedb.org/tv/66434?language=en", "title": "Dear My Friends", "resume": "Depicts the realistic and enjoyable lives of older and younger people who become dear friends.", "rate": null, "genre": ["Comedy", "Drama", "Family"], "cast": ["Youn Yuh-jung", "Go Doo-shim", "Na Moon-hee", "Kim Hye-ja", "Ko Hyun-jung"], "site_data": "html Apps Forums Leaderboard Contribute API Support Discover Movies TV Shows Movies Popular Top Rated Upcoming Now Playing TV Shows Popular Top Rated On TV Airing Today People Popular People Can't find a movie or TV show? Login to create it. en Login Sign Up  ID: 66434   Expand Dear My Friends   (2016) User Score Overview Depicts the realistic and enjoyable lives of older and younger people who become dear friends. Discussions   Reviews Videos   Images   Changes Report Share Discussions General  0 Content Issues  0 Images Backdrops  2 Posters  11 Videos Trailers  0 Teasers  0 Clips  0 Featurettes  0 Opening Credits  0 Top Billed Cast Youn Yuh-jung Oh Choong-Nam Go Doo-shim Jang Nan-Hee Na Moon-hee Moon Jung-A Kim Hye-ja Jo Hee-Ja Ko Hyun-jung Park Wan Full Cast & Crew Last Season Season 1 2016 | 16 Episodes Season 1 of Dear My Friends premiered on May 13, 2016. View All Seasons Social Reviews  0 Discussions  0 Media Most Popular Videos  0 Backdrops  2 Posters  11 Recommendations We don't have enough data to suggest any TV shows based on Dear My Friends. You can help by rating TV shows you've seen. Facts Original Name  \ub514\uc5b4 \ub9c8\uc774 \ud504\ub80c\uc988 Status  Ended Network Certification  - Type  Scripted Original Language  Korean Runtime  60m Homepage   http://program.interest.me/tvn/dearmyfriends Genres Comedy Drama Family Keywords korea Content Score 86 Almost there... Top Contributors t 61 tmdb38202327 z 10 zurman1 M 5 Maria180493 j 3 jimy  View Edit History Popularity Trend  Login to edit  URL By  signing up  for an account on TMDb, you can post directly to Twitter and Facebook. You need to be logged in to continue. Click  here  to login or  here  to sign up.    page_wrap opened in html_head  Join the Community The Basics About TMDb Contact Us Support Forums API Blog Get Involved  Contribution Bible 3rd Party Applications Add New Movie Add New TV Show Community Guidelines Leaderboard Forums Twitter Facebook Legal Terms of Use Privacy Policy Login Sign Up", "character": ["Oh Choong-Nam", "Jang Nan-Hee", "Moon Jung-A", "Jo Hee-Ja", "Park Wan"]}