{"link": "https://www.themoviedb.org/tv/64122?language=en", "title": "The Shannara Chronicles", "resume": "A young Healer armed with an unpredictable magic guides a runaway Elf in her perilous quest to save the peoples of the Four Lands from an age-old Demon scourge.", "rate": 65, "genre": ["Action", "Adventure", "Sci-Fi", "Fantasy"], "cast": ["Austin Butler", "Ivana Baquero", "Manu Bennett", "Aaron Jakubenko", "Marcus Vanco"], "character": ["Wil Ohmsford", "Eretria", "Allanon", "Ander Elessedil", "Bandon"], "site_data": "html Apps Forums Leaderboard Contribute API Support Discover Movies TV Shows Movies Popular Top Rated Upcoming Now Playing TV Shows Popular Top Rated On TV Airing Today People Popular People Can't find a movie or TV show? Login to create it. en Login Sign Up  ID: 64122   Expand The Shannara Chronicles   (2016) User Score  Play Trailer Overview A young Healer armed with an unpredictable magic guides a runaway Elf in her perilous quest to save the peoples of the Four Lands from an age-old Demon scourge. Featured Crew Miles Millar Creator Alfred Gough Creator Discussions   Reviews Videos   Images   Changes Report Share Discussions General  10 Content Issues  0 Images Backdrops  12 Posters  15 Videos Trailers  1 Teasers  0 Clips  0 Featurettes  0 Opening Credits  1 Top Billed Cast Austin Butler Wil Ohmsford Ivana Baquero Eretria Manu Bennett Allanon Aaron Jakubenko Ander Elessedil Marcus Vanco Bandon Full Cast & Crew Current Season Season 2 2017 | 10 Episodes View All Seasons Social Reviews  0 Discussions  10 Subject Status Replies Last Reply A Will goes to hell,  series over!  Hahahaha! Open 1 by  write2topcat [RUS] s1e06: \"Pykon\" = \"\u041f\u0430\u0439\u043a\u043e\u043d\" Open 5 by  write2topcat I love this goofie show Open 3 by  write2topcat Go to Discussions Media Most Popular Videos  2 Backdrops  12 Posters  15 Recommendations   2016-01-14 Colony 6.8    2015-12-16 The Magicians 6.8    2015-06-19 Killjoys 6.7    2015-06-12 Dark Matter 6.3    2015-12-14 The Expanse 7.5    2014-12-07 The Librarians 6.4    2016-04-01 Wynonna Earp 6.3    2016-01-21 DC's Legends of Tomorrow 6.1  Facts Status  Cancelled Networks Certification TV-14 Meaning This program contains some material that many parents would find unsuitable for children under 14 years of age. Type  Scripted Original Language  English Runtime  45m Homepage   http://www.spike.com/shows/the-shannara-chronicles Genres Action & Adventure Sci-Fi & Fantasy Keywords future based on novel or book elves magic demon quest Content Score 100 Yes! Looking good! Top Contributors 115 Elizabeth Jennings 63 Banana 20 cmnunes 20 Maikkoum  View Edit History Popularity Trend  Login to edit  URL By  signing up  for an account on TMDb, you can post directly to Twitter and Facebook. You need to be logged in to continue. Click  here  to login or  here  to sign up.    page_wrap opened in html_head  Join the Community The Basics About TMDb Contact Us Support Forums API Blog Get Involved  Contribution Bible 3rd Party Applications Add New Movie Add New TV Show Community Guidelines Leaderboard Forums Twitter Facebook Legal Terms of Use Privacy Policy Login Sign Up"}