{"link": "https://www.themoviedb.org/tv/35209?language=en", "title": "The Pickwick Papers", "resume": "Mr Pickwick, Tupman, Winkle, Snodgrass and Sam Weller begin their travels through the England of stage-coaches and coaching inns.", "rate": 60, "genre": ["Drama", "Comedy"], "cast": ["Clive Swift", "Alan Parnaby", "Patrick Malahide", "Nigel Stock", "Jeremy Nicholas"], "character": ["Mr. Tupman", "Mr. Snodgrass", "Mr. Jingle", "Mr. Pickwick", "Mr. Winkle"], "site_data": "html Apps Forums Leaderboard Contribute API Support Discover Movies TV Shows Movies Popular Top Rated Upcoming Now Playing TV Shows Popular Top Rated On TV Airing Today People Popular People Can't find a movie or TV show? Login to create it. en Login Sign Up  ID: 35209   Expand The Pickwick Papers   (1985) User Score Overview Mr Pickwick, Tupman, Winkle, Snodgrass and Sam Weller begin their travels through the England of stage-coaches and coaching inns. Discussions   Reviews Videos   Images   Changes Report Share Discussions General  0 Content Issues  0 Images Backdrops  2 Posters  1 Videos Trailers  0 Teasers  0 Clips  0 Featurettes  0 Opening Credits  0 Top Billed Cast Clive Swift Mr. Tupman Alan Parnaby Mr. Snodgrass Patrick Malahide Mr. Jingle Nigel Stock Mr. Pickwick Jeremy Nicholas Mr. Winkle Full Cast & Crew Last Season Miniseries 1985 | 12 Episodes Season 1 of The Pickwick Papers premiered on January  5, 1985. View All Seasons Social Reviews  0 Discussions  0 Media Most Popular Videos  0 Backdrops  2 Posters  1 Recommendations We don't have enough data to suggest any TV shows based on The Pickwick Papers. You can help by rating TV shows you've seen. Facts Status  Ended Network Certification  - Type  Miniseries Original Language  English Runtime  30m Homepage   https://www.bbc.co.uk/programmes/p00tr4p6 Genres Drama Comedy Keywords No keywords have been added. Content Score 86 Almost there... Top Contributors 7 rudely_murray 5 Banana TB 1 TMDb Bot  View Edit History Popularity Trend  Login to edit  URL By  signing up  for an account on TMDb, you can post directly to Twitter and Facebook. You need to be logged in to continue. Click  here  to login or  here  to sign up.    page_wrap opened in html_head  Join the Community The Basics About TMDb Contact Us Support Forums API Blog Get Involved  Contribution Bible 3rd Party Applications Add New Movie Add New TV Show Community Guidelines Leaderboard Forums Twitter Facebook Legal Terms of Use Privacy Policy Login Sign Up"}