{"link": "https://www.themoviedb.org/tv/4177?language=en", "title": "Perry Mason", "resume": "The cases of master criminal defense attorney Perry Mason and his staff who handled the most difficult of cases in the aid of the innocent.", "rate": null, "genre": ["Mystery", "Drama", "Crime", "Family"], "cast": ["Raymond Burr", "Barbara Hale", "William Hopper", "William Talman", "Ray Collins"], "site_data": "html Apps Forums Leaderboard Contribute API Support Discover Movies TV Shows Movies Popular Top Rated Upcoming Now Playing TV Shows Popular Top Rated On TV Airing Today People Popular People Can't find a movie or TV show? Login to create it. en Login Sign Up  ID: 4177   Expand Perry Mason   (1957) User Score Overview The cases of master criminal defense attorney Perry Mason and his staff who handled the most difficult of cases in the aid of the innocent. Featured Crew Erle Stanley Gardner Creator Discussions   Reviews Videos   Images   Changes Report Share Discussions General  7 Content Issues  0 Images Backdrops  5 Posters  3 Videos Trailers  0 Teasers  0 Clips  0 Featurettes  0 Opening Credits  0 Top Billed Cast Raymond Burr Perry Mason Barbara Hale Della Street William Hopper Paul Drake William Talman Hamilton Burger Ray Collins Lt. Tragg Full Cast & Crew Last Season Season 9 1965 | 30 Episodes Season 9 of Perry Mason premiered on September 12, 1965. View All Seasons Social Reviews  0 Discussions  7 Subject Status Replies Last Reply Many actors in this series don't part their hair Open 4 by  lima-2 w New series? Open 3 by  lima-2 l The Case of the Murderous Mermaid Open 0 by lima-2\n      \n     Go to Discussions Media Most Popular Videos  0 Backdrops  5 Posters  3 Recommendations   1967-03-28 Ironside 6.8    1964-09-22 The Man from U.N.C.L.E. 7.2    1974-09-09 Rhoda 4.5    1970-09-16 McCloud 7.0    1974-03-27 The Rockford Files 7.2    1965-09-14 F Troop 6.4    1959-11-19 The Rocky and Bullwinkle Show 8.7    1963-09-29 My Favorite Martian 5.4  Facts Status  Ended Network Certification TV-PG Meaning This program contains material that parents may find unsuitable for younger children. Type  Scripted Original Language  English Runtime  60m Homepage  - Genres Mystery Drama Crime Family Keywords detective lawyer los angeles criminal defence lawyer Content Score 93 Almost there... Top Contributors 44 Nike 31 zoroman2008N 22 Steve 13 lineker  View Edit History Popularity Trend  Login to edit  URL By  signing up  for an account on TMDb, you can post directly to Twitter and Facebook. You need to be logged in to continue. Click  here  to login or  here  to sign up.    page_wrap opened in html_head  Join the Community The Basics About TMDb Contact Us Support Forums API Blog Get Involved  Contribution Bible 3rd Party Applications Add New Movie Add New TV Show Community Guidelines Leaderboard Forums Twitter Facebook Legal Terms of Use Privacy Policy Login Sign Up", "character": ["Perry Mason", "Della Street", "Paul Drake", "Hamilton Burger", "Lt. Tragg"]}