{"link": "https://www.themoviedb.org/tv/40835?language=en", "title": "Die Stra\u00dfen von Berlin", "resume": "Die Stra\u00dfen von Berlin is a German television series.", "rate": 0, "genre": ["Crime"], "cast": ["Martin Semmelrogge", "Dietrich Mattausch", "Guntbert Warns", "Nadeshda Brennicke", "Ingo Naujoks"], "character": ["Jockel Pietsch", "Dr. Maas", "Gilbert Mosch", "Tessa Norman", "Frank Karnowsky"], "site_data": "html Apps Forums Leaderboard Contribute API Support Discover Movies TV Shows Movies Popular Top Rated Upcoming Now Playing TV Shows Popular Top Rated On TV Airing Today People Popular People Can't find a movie or TV show? Login to create it. en Login Sign Up  ID: 40835   Expand Die Stra\u00dfen von Berlin   (1995) User Score Overview Die Stra\u00dfen von Berlin is a German television series. Discussions   Reviews Videos   Images   Changes Report Share Discussions General  0 Content Issues  0 Images Backdrops  1 Posters  1 Videos Trailers  0 Teasers  0 Clips  0 Featurettes  0 Opening Credits  0 Top Billed Cast Martin Semmelrogge Jockel Pietsch Dietrich Mattausch Dr. Maas Guntbert Warns Gilbert Mosch Nadeshda Brennicke Tessa Norman Ingo Naujoks Frank Karnowsky Full Cast & Crew Last Season Season 4 2000 | 4 Episodes Season 4 of Die Stra\u00dfen von Berlin premiered on August  3, 2000. View All Seasons Social Reviews  0 Discussions  0 Media Most Popular Videos  0 Backdrops  1 Posters  1 Recommendations We don't have enough data to suggest any TV shows based on Die Stra\u00dfen von Berlin. You can help by rating TV shows you've seen. Facts Status  Ended Network Certification  - Type  Scripted Original Language  German Runtime  90m Homepage  - Genres Crime Keywords No keywords have been added. Content Score 86 Almost there... Top Contributors S 50 Samara  View Edit History Popularity Trend  Login to edit  URL By  signing up  for an account on TMDb, you can post directly to Twitter and Facebook. You need to be logged in to continue. Click  here  to login or  here  to sign up.    page_wrap opened in html_head  Join the Community The Basics About TMDb Contact Us Support Forums API Blog Get Involved  Contribution Bible 3rd Party Applications Add New Movie Add New TV Show Community Guidelines Leaderboard Forums Twitter Facebook Legal Terms of Use Privacy Policy Login Sign Up"}