{"link": "https://www.themoviedb.org/tv/64696?language=en", "title": "There Is No Such Thing as a Bad Dog", "resume": "We don't have an overview translated in English. Help us expand our database by adding one.", "rate": null, "genre": ["Documentary", "Reality"], "cast": ["hyung wook kang"], "site_data": "html Apps Forums Leaderboard Contribute API Support Discover Movies TV Shows Movies Popular Top Rated Upcoming Now Playing TV Shows Popular Top Rated On TV Airing Today People Popular People Can't find a movie or TV show? Login to create it. en Login Sign Up  ID: 64696   Expand There Is No Such Thing as a Bad Dog   (2015) User Score Overview We don't have an overview translated in English. Help us expand our database by adding one. Featured Crew \uac15\ud615\uc6b1 Creator Discussions   Reviews Videos   Images   Changes Report Share Discussions General  0 Content Issues  0 Images Backdrops  1 Posters  2 Videos Trailers  0 Teasers  0 Clips  0 Featurettes  0 Opening Credits  0 Top Billed Cast hyung wook kang Himself Full Cast & Crew Last Season Season 2 2016 | 69 Episodes Season 2 of There Is No Such Thing as a Bad Dog premiered on September 23, 2016. View All Seasons Social Reviews  0 Discussions  0 Media Most Popular Videos  0 Backdrops  1 Posters  2 Recommendations We don't have enough data to suggest any TV shows based on There Is No Such Thing as a Bad Dog. You can help by rating TV shows you've seen. Facts Original Name  \uc138\uc0c1\uc5d0 \ub098\uc05c \uac1c\ub294 \uc5c6\ub2e4 Status  Returning Series Network EBS 1 Certification  - Type  Documentary Original Language  Korean Runtime  50m Homepage   http://home.ebs.co.kr/baddog/main Genres Documentary Reality Keywords No keywords have been added. Content Score 56 We're so close, yet so far. Top Contributors 37 Kyuhwan Kim a 5 adiyoung y 4 ydk928 2 thirstyhippo  View Edit History Popularity Trend  Login to edit  URL By  signing up  for an account on TMDb, you can post directly to Twitter and Facebook. You need to be logged in to continue. Click  here  to login or  here  to sign up.    page_wrap opened in html_head  Join the Community The Basics About TMDb Contact Us Support Forums API Blog Get Involved  Contribution Bible 3rd Party Applications Add New Movie Add New TV Show Community Guidelines Leaderboard Forums Twitter Facebook Legal Terms of Use Privacy Policy Login Sign Up", "character": ["Himself"]}