{"link": "https://www.themoviedb.org/tv/46005?language=en", "title": "\u0420\u0435\u0430\u043b\u044c\u043d\u044b\u0435 \u043f\u0430\u0446\u0430\u043d\u044b", "resume": "We don't have an overview translated in English. Help us expand our database by adding one.", "rate": 75, "genre": ["Comedy"], "cast": ["Oleg Vereshchagin"], "character": ["Oleg, manager of car showroom"], "site_data": "html Apps Forums Leaderboard Contribute API Support Discover Movies TV Shows Movies Popular Top Rated Upcoming Now Playing TV Shows Popular Top Rated On TV Airing Today People Popular People Can't find a movie or TV show? Login to create it. en Login Sign Up  ID: 46005   Expand \u0420\u0435\u0430\u043b\u044c\u043d\u044b\u0435 \u043f\u0430\u0446\u0430\u043d\u044b   (2010) User Score Overview We don't have an overview translated in English. Help us expand our database by adding one. Featured Crew Anton Zaitsev Creator Discussions   Reviews Videos   Images   Changes Report Share Discussions General  0 Content Issues  3 Images Backdrops  6 Posters  5 Videos Trailers  0 Teasers  0 Clips  0 Featurettes  0 Opening Credits  0 Top Billed Cast Oleg Vereshchagin Oleg, manager of car showroom Full Cast & Crew Current Season Season 6 2018 | 9 Episodes Season 6 of \u0420\u0435\u0430\u043b\u044c\u043d\u044b\u0435 \u043f\u0430\u0446\u0430\u043d\u044b premiered on March 12, 2018. View All Seasons Social Reviews  0 Discussions  3 Subject Status Replies Last Reply There are no discussions for \u0420\u0435\u0430\u043b\u044c\u043d\u044b\u0435 \u043f\u0430\u0446\u0430\u043d\u044b. Login to be first! Go to Discussions Media Most Popular Videos  0 Backdrops  6 Posters  5 Recommendations   2006-11-04 Our Russia 3.7    2014-04-07 P. E. Teacher 6.1    2012-10-22 The Kitchen 8.0    2010-03-29 Interny 5.7  Facts Status  Returning Series Network Certification 16+ Meaning Only teens the age of 16 or older can watch. Type  Scripted Original Language  Russian Runtime  25m Homepage  - Genres Comedy Keywords No keywords have been added. Content Score 56 We're so close, yet so far. Top Contributors D 12 David1886 9 janar z 3 zolenka 3 mercuriy_v  View Edit History Popularity Trend  Login to edit  URL By  signing up  for an account on TMDb, you can post directly to Twitter and Facebook. You need to be logged in to continue. Click  here  to login or  here  to sign up.    page_wrap opened in html_head  Join the Community The Basics About TMDb Contact Us Support Forums API Blog Get Involved  Contribution Bible 3rd Party Applications Add New Movie Add New TV Show Community Guidelines Leaderboard Forums Twitter Facebook Legal Terms of Use Privacy Policy Login Sign Up"}