{"link": "https://www.themoviedb.org/tv/70490?language=en", "title": "Time: The Kalief Browder Story", "resume": "The story of a teenager wrongfully charged with theft and jailed at Riker's Island prison for over 1,000 days.", "rate": 77, "genre": ["Documentary"], "cast": ["Donnell E. Smith", "Jay-Z", "Adriana DeMeo", "Josh Rhett Noble", "Andreas Pliatsikas"], "character": ["Kalief Browder", "Himself", "City Attorney", "Public Defender", "District Attorney"], "site_data": "html Apps Forums Leaderboard Contribute API Support Discover Movies TV Shows Movies Popular Top Rated Upcoming Now Playing TV Shows Popular Top Rated On TV Airing Today People Popular People Can't find a movie or TV show? Login to create it. en Login Sign Up  ID: 70490   Expand Time: The Kalief Browder Story   (2017) User Score Overview The story of a teenager wrongfully charged with theft and jailed at Riker's Island prison for over 1,000 days. Discussions   Reviews Videos   Images   Changes Report Share Discussions General  0 Content Issues  1 Images Backdrops  1 Posters  3 Videos Trailers  0 Teasers  0 Clips  0 Featurettes  0 Opening Credits  0 Top Billed Cast Donnell E. Smith Kalief Browder Jay-Z Himself Adriana DeMeo City Attorney Josh Rhett Noble Public Defender Andreas Pliatsikas District Attorney Full Cast & Crew Last Season Season 1 2017 | 6 Episodes Season 1 of Time: The Kalief Browder Story premiered on March  1, 2017. View All Seasons Social Reviews  0 Discussions  1 Subject Status Replies Last Reply There are no discussions for Time: The Kalief Browder Story. Login to be first! Go to Discussions Media Most Popular Videos  0 Backdrops  1 Posters  3 Recommendations We don't have enough data to suggest any TV shows based on Time: The Kalief Browder Story. You can help by rating TV shows you've seen. Facts Status  Ended Network Certification  - Type  Miniseries Original Language  English Runtime  - Homepage   http://www.spike.com/shows/time-the-kalief-browder-story Genres Documentary Keywords miniseries wrongful imprisonment Content Score 86 Almost there... Top Contributors TB 45 TMDb Bot 19 Elizabeth Jennings D 7 Derek.Jo.Lee88 3 Banana  View Edit History Popularity Trend  Login to edit  URL By  signing up  for an account on TMDb, you can post directly to Twitter and Facebook. You need to be logged in to continue. Click  here  to login or  here  to sign up.    page_wrap opened in html_head  Join the Community The Basics About TMDb Contact Us Support Forums API Blog Get Involved  Contribution Bible 3rd Party Applications Add New Movie Add New TV Show Community Guidelines Leaderboard Forums Twitter Facebook Legal Terms of Use Privacy Policy Login Sign Up"}