{"link": "https://www.themoviedb.org/tv/80258?language=en", "title": "Sex and Sensibility: The Allure of Art Nouveau", "resume": "How the Art Nouveau movement flourished in the burgeoning cities of Europe at the end of the 19th century.", "rate": 0, "genre": ["Documentary"], "cast": ["Stephen Smith"], "character": ["Himself - Presenter"], "site_data": "html Apps Forums Leaderboard Contribute API Support Discover Movies TV Shows Movies Popular Top Rated Upcoming Now Playing TV Shows Popular Top Rated On TV Airing Today People Popular People Can't find a movie or TV show? Login to create it. en Login Sign Up  ID: 80258   Expand Sex and Sensibility: The Allure of Art Nouveau   (2012) User Score Overview How the Art Nouveau movement flourished in the burgeoning cities of Europe at the end of the 19th century. Discussions   Reviews Videos   Images   Changes Report Share Discussions General  0 Content Issues  0 Images Backdrops  0 Posters  1 Videos Trailers  0 Teasers  0 Clips  0 Featurettes  0 Opening Credits  0 Top Billed Cast Stephen Smith Himself - Presenter Full Cast & Crew Last Season Season 1 2012 | 3 Episodes Season 1 of Sex and Sensibility: The Allure of Art Nouveau premiered on March 22, 2012. View All Seasons Social Reviews  0 Discussions  0 Media Most Popular Videos  0 Backdrops  0 Posters  1 Recommendations We don't have enough data to suggest any TV shows based on Sex and Sensibility: The Allure of Art Nouveau. You can help by rating TV shows you've seen. Facts Status  Ended Network Certification  - Type  Miniseries Original Language  English Runtime  60m Homepage   https://www.bbc.co.uk/programmes/b01dxw0y Genres Documentary Keywords art art nouveau Content Score 43 There's no 'I' in team... Top Contributors 19 Elizabeth Jennings 5 YRE2D  View Edit History Popularity Trend  Login to edit  URL By  signing up  for an account on TMDb, you can post directly to Twitter and Facebook. You need to be logged in to continue. Click  here  to login or  here  to sign up.    page_wrap opened in html_head  Join the Community The Basics About TMDb Contact Us Support Forums API Blog Get Involved  Contribution Bible 3rd Party Applications Add New Movie Add New TV Show Community Guidelines Leaderboard Forums Twitter Facebook Legal Terms of Use Privacy Policy Login Sign Up"}