{"link": "https://www.themoviedb.org/tv/4213?language=en", "title": "Once Upon a Time... The Explorers", "resume": "Il \u00e9tait une fois... les Explorateurs is a French animated TV series from 1996. Directed by Albert Barill\u00e9.", "rate": 78, "genre": ["Kids", "Animation", "Documentary", "Family"], "cast": ["Roger Carel", "Olivier Destrez", "H\u00e9l\u00e8ne Levesque", "Patrick Pr\u00e9jean", "Daniel Beretta"], "character": ["Maestro", "Pierrot", "Pierrette", "le Nabot", "le Gros, le Teigneux"], "site_data": "html Apps Forums Leaderboard Contribute API Support Discover Movies TV Shows Movies Popular Top Rated Upcoming Now Playing TV Shows Popular Top Rated On TV Airing Today People Popular People Can't find a movie or TV show? Login to create it. en Login Sign Up  ID: 4213   Expand Once Upon a Time... The Explorers   (1998) User Score Overview Il \u00e9tait une fois... les Explorateurs is a French animated TV series from 1996. Directed by Albert Barill\u00e9. Featured Crew Albert Barill\u00e9 Creator Discussions   Reviews Videos   Images   Changes Report Share Discussions General  0 Content Issues  0 Images Backdrops  3 Posters  9 Videos Trailers  0 Teasers  0 Clips  0 Featurettes  0 Opening Credits  0 Top Billed Cast Roger Carel Maestro Olivier Destrez Pierrot H\u00e9l\u00e8ne Levesque Pierrette Patrick Pr\u00e9jean le Nabot Daniel Beretta le Gros, le Teigneux Full Cast & Crew Last Season Season 1 1998 | 26 Episodes Season 1 of Once Upon a Time... The Explorers premiered on January 17, 1998. View All Seasons Social Reviews  0 Discussions  0 Media Most Popular Videos  0 Backdrops  3 Posters  9 Recommendations   1994-01-03 Once Upon a Time... The Discoverers 7.1    1992-03-13 Once Upon a Time... The Americas 8.6    1982-10-08 Once upon a time\u2026 Space 5.9    1979-03-24 Once Upon a Time... Man 8.2    1983-08-01 Around the World with Willy Fog 7.8    1987-06-17 Once Upon a Time... Life 8.0  Facts Original Name  Il \u00e9tait une fois... Les Explorateurs Status  Ended Network Certification  - Type  Scripted Original Language  French Runtime  26m Homepage  - Genres Kids Animation Documentary Family Keywords No keywords have been added. Content Score 93 Almost there... Top Contributors M 13 Manu m 10 mrpp d 7 dune2000 z 5 zurman1  View Edit History Popularity Trend  Login to edit  URL By  signing up  for an account on TMDb, you can post directly to Twitter and Facebook. You need to be logged in to continue. Click  here  to login or  here  to sign up.    page_wrap opened in html_head  Join the Community The Basics About TMDb Contact Us Support Forums API Blog Get Involved  Contribution Bible 3rd Party Applications Add New Movie Add New TV Show Community Guidelines Leaderboard Forums Twitter Facebook Legal Terms of Use Privacy Policy Login Sign Up"}