{"link": "https://www.themoviedb.org/tv/62995?language=en", "title": "Redwood Kings", "resume": "Fraternal twins Ron and John Daniels run their tree house and theming business, Daniel's Wood Land.", "rate": 0, "genre": ["Reality"], "cast": ["John Daniels", "Ron Daniels", "Andy Dauterman", "Ren Gomes", "Mark Sylvestre"], "character": ["Himself - Co-Owner", "Himself - Co-Owner", "Himself - Special Projects Manager", "Himself - Foreman", "Himself - VP of Production"], "site_data": "html Apps Forums Leaderboard Contribute API Support Discover Movies TV Shows Movies Popular Top Rated Upcoming Now Playing TV Shows Popular Top Rated On TV Airing Today People Popular People Can't find a movie or TV show? Login to create it. en Login Sign Up  ID: 62995   Expand Redwood Kings   (2013) User Score Overview Fraternal twins Ron and John Daniels run their tree house and theming business, Daniel's Wood Land. Discussions   Reviews Videos   Images   Changes Report Share Discussions General  0 Content Issues  0 Images Backdrops  1 Posters  1 Videos Trailers  0 Teasers  0 Clips  0 Featurettes  0 Opening Credits  0 Top Billed Cast John Daniels Himself - Co-Owner Ron Daniels Himself - Co-Owner Andy Dauterman Himself - Special Projects Manager Ren Gomes Himself - Foreman Mark Sylvestre Himself - VP of Production Full Cast & Crew Last Season Season 2 2015 | 9 Episodes Season 2 of Redwood Kings premiered on July 10, 2015. View All Seasons Social Reviews  0 Discussions  0 Media Most Popular Videos  0 Backdrops  1 Posters  1 Recommendations We don't have enough data to suggest any TV shows based on Redwood Kings. You can help by rating TV shows you've seen. Facts Status  Returning Series Network Certification TV-PG Meaning This program contains material that parents may find unsuitable for younger children. Type  Reality Original Language  English Runtime  43m Homepage   http://www.animalplanet.com/tv-shows/redwood-kings/ Genres Reality Keywords tree house Content Score 86 Almost there... Top Contributors 29 Elizabeth Jennings LC 7 Legit Corporation j 2 jeding TB 1 TMDb Bot  View Edit History Popularity Trend  Login to edit  URL By  signing up  for an account on TMDb, you can post directly to Twitter and Facebook. You need to be logged in to continue. Click  here  to login or  here  to sign up.    page_wrap opened in html_head  Join the Community The Basics About TMDb Contact Us Support Forums API Blog Get Involved  Contribution Bible 3rd Party Applications Add New Movie Add New TV Show Community Guidelines Leaderboard Forums Twitter Facebook Legal Terms of Use Privacy Policy Login Sign Up"}