{"link": "https://www.themoviedb.org/tv/32390?language=en", "title": "The Real Housewives of Beverly Hills", "resume": "A reality series that follows some of the most affluent women in the country as they enjoy the lavish lifestyle that only Beverly Hills can provide.", "rate": 65, "genre": ["Reality"], "cast": ["Camille Grammer", "Dorit Kemsley", "Erika Jayne", "Kyle Richards", "Lisa Rinna"], "character": ["Herself", "Herself", "Herself", "Herself", "Herself"], "site_data": "html Apps Forums Leaderboard Contribute API Support Discover Movies TV Shows Movies Popular Top Rated Upcoming Now Playing TV Shows Popular Top Rated On TV Airing Today People Popular People Can't find a movie or TV show? Login to create it. en Login Sign Up  ID: 32390   Expand The Real Housewives of Beverly Hills   (2010) User Score Overview A reality series that follows some of the most affluent women in the country as they enjoy the lavish lifestyle that only Beverly Hills can provide. Discussions   Reviews Videos   Images   Changes Report Share Discussions General  11 Content Issues  1 Images Backdrops  7 Posters  5 Videos Trailers  0 Teasers  0 Clips  0 Featurettes  0 Opening Credits  0 Top Billed Cast Camille Grammer Herself Dorit Kemsley Herself Erika Jayne Herself Kyle Richards Herself Lisa Rinna Herself Full Cast & Crew Current Season Season 8 2017 | 22 Episodes View All Seasons Social Reviews  0 Discussions  12 Subject Status Replies Last Reply $18,000 China Dinnerware Open 0 by Nubyan\n      \n     R U Freaking Kidding Me!? Open 5 by  Poetist Hooker Wives and Moms Open 0 by Nubyan\n      \n     Go to Discussions Media Most Popular Videos  0 Backdrops  7 Posters  5 Recommendations   2016-01-27 Little Women: Atlanta 4.8    2017-02-26 The Real Housewives of Sydney 4.0    2008-10-07 The Real Housewives of Atlanta 5.4    2008-03-04 The Real Housewives of New York City 5.0    2006-03-21 The Real Housewives of Orange County 5.1    2009-05-12 The Real Housewives of New Jersey 5.1    1986-09-29 Designing Women 7.3    2013-07-07 Vanderpump Rules 6.1  Facts Status  Returning Series Network Certification TV-14 Meaning This program contains some material that many parents would find unsuitable for children under 14 years of age. Type  Reality Original Language  English Runtime  60m Homepage   http://www.bravotv.com/the-real-housewives-of-beverly-hills Genres Reality Keywords housewife Content Score 86 Almost there... Top Contributors 63 Elizabeth Jennings s 49 stevenhunt 27 Miguel Alexas TB 12 TMDb Bot  View Edit History Popularity Trend  Login to edit  URL By  signing up  for an account on TMDb, you can post directly to Twitter and Facebook. You need to be logged in to continue. Click  here  to login or  here  to sign up.    page_wrap opened in html_head  Join the Community The Basics About TMDb Contact Us Support Forums API Blog Get Involved  Contribution Bible 3rd Party Applications Add New Movie Add New TV Show Community Guidelines Leaderboard Forums Twitter Facebook Legal Terms of Use Privacy Policy Login Sign Up"}