{"link": "https://www.themoviedb.org/tv/68048?language=en", "title": "La Voix Junior", "resume": "We don't have an overview translated in English. Help us expand our database by adding one.", "rate": null, "genre": ["Reality"], "cast": ["Charles Lafortune", "Marc Dupr\u00e9", "Marie-Mai", "Alex Nevsky", "Maripier Morin"], "site_data": "html Apps Forums Leaderboard Contribute API Support Discover Movies TV Shows Movies Popular Top Rated Upcoming Now Playing TV Shows Popular Top Rated On TV Airing Today People Popular People Can't find a movie or TV show? Login to create it. en Login Sign Up  ID: 68048   Expand La Voix Junior   (2016) User Score Overview We don't have an overview translated in English. Help us expand our database by adding one. Discussions   Reviews Videos   Images   Changes Report Share Discussions General  0 Content Issues  0 Images Backdrops  5 Posters  1 Videos Trailers  0 Teasers  0 Clips  0 Featurettes  0 Opening Credits  0 Top Billed Cast Charles Lafortune Himself - Host Marc Dupr\u00e9 Himself - Coach Marie-Mai Herself - Coach Alex Nevsky Himself - Coach Maripier Morin Herself - Co-Host Full Cast & Crew Last Season Season 2 2017 | 9 Episodes Season 2 of La Voix Junior premiered on September 23, 2017. View All Seasons Social Reviews  0 Discussions  0 Media Most Popular Videos  0 Backdrops  5 Posters  1 Recommendations We don't have enough data to suggest any TV shows based on La Voix Junior. You can help by rating TV shows you've seen. Facts Status  Returning Series Network Certification  - Type  Reality Original Language  French Runtime  22m, 87m Homepage   http://tva.canoe.ca/emissions/la-voix-junior/ Genres Reality Keywords children singing competition Content Score 86 Almost there... Top Contributors 62 Banana 3 razkoz a 3 arcaida TB 1 TMDb Bot  View Edit History Popularity Trend  Login to edit  URL By  signing up  for an account on TMDb, you can post directly to Twitter and Facebook. You need to be logged in to continue. Click  here  to login or  here  to sign up.    page_wrap opened in html_head  Join the Community The Basics About TMDb Contact Us Support Forums API Blog Get Involved  Contribution Bible 3rd Party Applications Add New Movie Add New TV Show Community Guidelines Leaderboard Forums Twitter Facebook Legal Terms of Use Privacy Policy Login Sign Up", "character": ["Himself - Host", "Himself - Coach", "Herself - Coach", "Himself - Coach", "Herself - Co-Host"]}