{"link": "https://www.themoviedb.org/tv/6167?language=en", "title": "The Andy Dick Show", "resume": "The Andy Dick Show is an American sketch comedy series that aired on MTV from February 2001 to May 2002. The series was created by and starred comedian Andy Dick.", "rate": 0, "genre": ["Comedy"], "cast": ["Stephen Root", "Jennifer Coolidge", "Andy Dick", "Suzanne Davis", "Jack Black"], "character": ["Nancy Bunting", "J.D"], "site_data": "html Apps Forums Leaderboard Contribute API Support Discover Movies TV Shows Movies Popular Top Rated Upcoming Now Playing TV Shows Popular Top Rated On TV Airing Today People Popular People Can't find a movie or TV show? Login to create it. en Login Sign Up  ID: 6167   Expand The Andy Dick Show   (2001) User Score Overview The Andy Dick Show is an American sketch comedy series that aired on MTV from February 2001 to May 2002. The series was created by and starred comedian Andy Dick. Discussions   Reviews Videos   Images   Changes Report Share Discussions General  0 Content Issues  0 Images Backdrops  1 Posters  1 Videos Trailers  0 Teasers  0 Clips  0 Featurettes  0 Opening Credits  0 Top Billed Cast Stephen Root Jennifer Coolidge Nancy Bunting Andy Dick Suzanne Davis Jack Black J.D Full Cast & Crew Last Season Season 3 2002 | 7 Episodes Season 3 of The Andy Dick Show premiered on April  5, 2002. View All Seasons Social Reviews  0 Discussions  0 Media Most Popular Videos  0 Backdrops  1 Posters  1 Recommendations We don't have enough data to suggest any TV shows based on The Andy Dick Show. You can help by rating TV shows you've seen. Facts Status  Ended Network Certification  - Type  Scripted Original Language  English Runtime  30m Homepage   http://www.mtv.com/onair/andydick Genres Comedy Keywords sketch comedy Content Score 86 Almost there... Top Contributors 4 Banana J 1 Jenn  View Edit History Popularity Trend  Login to edit  URL By  signing up  for an account on TMDb, you can post directly to Twitter and Facebook. You need to be logged in to continue. Click  here  to login or  here  to sign up.    page_wrap opened in html_head  Join the Community The Basics About TMDb Contact Us Support Forums API Blog Get Involved  Contribution Bible 3rd Party Applications Add New Movie Add New TV Show Community Guidelines Leaderboard Forums Twitter Facebook Legal Terms of Use Privacy Policy Login Sign Up"}