{"link": "https://www.themoviedb.org/tv/70784?language=en", "title": "Marvel's Rocket & Groot", "resume": "Before becoming Guardians of the Galaxy, Rocket and Groot were bounty hunters trying to get a ship.", "rate": null, "genre": ["Kids", "Animation"], "cast": ["Trevor Devall", "Kevin Michael Richardson"], "site_data": "html Apps Forums Leaderboard Contribute API Support Discover Movies TV Shows Movies Popular Top Rated Upcoming Now Playing TV Shows Popular Top Rated On TV Airing Today People Popular People Can't find a movie or TV show? Login to create it. en Login Sign Up  ID: 70784   Expand Marvel's Rocket & Groot   (2017) User Score Overview Before becoming Guardians of the Galaxy, Rocket and Groot were bounty hunters trying to get a ship. Discussions   Reviews Videos   Images   Changes Report Share Discussions General  0 Content Issues  1 Images Backdrops  1 Posters  1 Videos Trailers  0 Teasers  0 Clips  0 Featurettes  0 Opening Credits  0 Top Billed Cast Trevor Devall Rocket Raccoon (voice) Kevin Michael Richardson Groot (voice) Full Cast & Crew Last Season Season 1 2017 | 12 Episodes Season 1 of Marvel's Rocket & Groot premiered on March 14, 2017. View All Seasons Social Reviews  0 Discussions  1 Subject Status Replies Last Reply There are no discussions for Marvel's Rocket & Groot. Login to be first! Go to Discussions Media Most Popular Videos  0 Backdrops  1 Posters  1 Recommendations We don't have enough data to suggest any TV shows based on Marvel's Rocket & Groot. You can help by rating TV shows you've seen. Facts Status  Returning Series Network Certification  - Type  Scripted Original Language  English Runtime  2m Homepage   https://www.youtube.com/playlist?list=PLg6R6yXKSLYBUf6lW9SLlp_Qy_1soxXUI Genres Kids Animation Keywords No keywords have been added. Content Score 56 We're so close, yet so far. Top Contributors 14 Elizabeth Jennings N 5 Ney R 5 Rebecca t 3 tmdb62726470  View Edit History Popularity Trend  Login to edit  URL By  signing up  for an account on TMDb, you can post directly to Twitter and Facebook. You need to be logged in to continue. Click  here  to login or  here  to sign up.    page_wrap opened in html_head  Join the Community The Basics About TMDb Contact Us Support Forums API Blog Get Involved  Contribution Bible 3rd Party Applications Add New Movie Add New TV Show Community Guidelines Leaderboard Forums Twitter Facebook Legal Terms of Use Privacy Policy Login Sign Up", "character": ["Rocket Raccoon (voice)", "Groot (voice)"]}