{"link": "https://www.themoviedb.org/tv/75961?language=en", "title": "Marie Terezie", "resume": "We don't have an overview translated in English. Help us expand our database by adding one.", "rate": 0, "genre": ["Drama"], "cast": ["Marie-Luise Stockinger", "Dominik Warta", "B\u00e1lint Adorj\u00e1ni", "V\u00e1clav Baur", "Jan Buda\u0159"], "character": ["Maria Theresa of Habsburg", "Johann Christoph of Bartenstein", "Nikolaus I. Esterhazy", "Friedrich Wilhelm of Haugwitz", "Doctor Jean Babtiste Bassand"], "site_data": "html Apps Forums Leaderboard Contribute API Support Discover Movies TV Shows Movies Popular Top Rated Upcoming Now Playing TV Shows Popular Top Rated On TV Airing Today People Popular People Can't find a movie or TV show? Login to create it. en Login Sign Up  ID: 75961   Expand Marie Terezie   (2017) User Score Overview We don't have an overview translated in English. Help us expand our database by adding one. Featured Crew Robert Dornhelm Creator Discussions   Reviews Videos   Images   Changes Report Share Discussions General  0 Content Issues  0 Images Backdrops  2 Posters  1 Videos Trailers  0 Teasers  0 Clips  0 Featurettes  0 Opening Credits  0 Top Billed Cast Marie-Luise Stockinger Maria Theresa of Habsburg Dominik Warta Johann Christoph of Bartenstein B\u00e1lint Adorj\u00e1ni Nikolaus I. Esterhazy V\u00e1clav Baur Friedrich Wilhelm of Haugwitz Jan Buda\u0159 Doctor Jean Babtiste Bassand Full Cast & Crew Current Season Season 1 2017 | 2 Episodes Season 1 of Marie Terezie premiered on December 25, 2017. View All Seasons Social Reviews  0 Discussions  0 Media Most Popular Videos  0 Backdrops  2 Posters  1 Recommendations We don't have enough data to suggest any TV shows based on Marie Terezie. You can help by rating TV shows you've seen. Facts Status  Ended Networks Magyar Telev\u00edzi\u00f3 Certification 15 Meaning Content suitable for teens over 15 years. Type  Miniseries Original Language  Czech Runtime  200m Homepage  - Genres Drama Keywords empire Content Score 93 Almost there... Top Contributors 112 nextlooper42 C 7 Cityman p 6 pohoda 5 SuperMario  View Edit History Popularity Trend  Login to edit  URL By  signing up  for an account on TMDb, you can post directly to Twitter and Facebook. You need to be logged in to continue. Click  here  to login or  here  to sign up.    page_wrap opened in html_head  Join the Community The Basics About TMDb Contact Us Support Forums API Blog Get Involved  Contribution Bible 3rd Party Applications Add New Movie Add New TV Show Community Guidelines Leaderboard Forums Twitter Facebook Legal Terms of Use Privacy Policy Login Sign Up"}