{"link": "https://www.themoviedb.org/tv/65483?language=en", "title": "\u0421\u0438\u043d\u0434\u0440\u043e\u043c \u0434\u0440\u0430\u043a\u043e\u043d\u0430", "resume": "We don't have an overview translated in English. Help us expand our database by adding one.", "rate": 53, "genre": ["Reality", "Mystery", "Crime"], "cast": ["Dmitriy Mulyar", "Andrey Merzlikin", "Lev Borisov", "Ekaterina Klimova", "Leonid Bichevin"], "character": ["\u0410\u043d\u0430\u0442\u043e\u043b\u0438\u0439 \u0410\u0432\u0434\u0435\u0435\u0432", "\u0412\u043b\u0430\u0434\u0438\u043c\u0438\u0440 \u0422\u0435\u0440\u0435\u0445\u043e\u0432", "\u0412\u0438\u043a\u0442\u043e\u0440 \u0417\u0430\u0440\u0443\u0431\u0438\u043d", "\u0415\u0432\u0433\u0435\u043d\u0438\u044f \u0429\u0435\u0433\u043e\u043b\u0435\u0432\u0430", "\u0410\u043b\u0435\u043a\u0441\u0430\u043d\u0434\u0440 \u0412\u043e\u043b\u043a\u043e\u0432"], "site_data": "html Apps Forums Leaderboard Contribute API Support Discover Movies TV Shows Movies Popular Top Rated Upcoming Now Playing TV Shows Popular Top Rated On TV Airing Today People Popular People Can't find a movie or TV show? Login to create it. en Login Sign Up  ID: 65483   Expand \u0421\u0438\u043d\u0434\u0440\u043e\u043c \u0434\u0440\u0430\u043a\u043e\u043d\u0430   (2012) User Score Overview We don't have an overview translated in English. Help us expand our database by adding one. Featured Crew Yuri Smirnov Creator Discussions   Reviews Videos   Images   Changes Report Share Discussions General  0 Content Issues  0 Images Backdrops  1 Posters  1 Videos Trailers  0 Teasers  0 Clips  0 Featurettes  0 Opening Credits  0 Top Billed Cast Dmitriy Mulyar \u0410\u043d\u0430\u0442\u043e\u043b\u0438\u0439 \u0410\u0432\u0434\u0435\u0435\u0432 Andrey Merzlikin \u0412\u043b\u0430\u0434\u0438\u043c\u0438\u0440 \u0422\u0435\u0440\u0435\u0445\u043e\u0432 Lev Borisov \u0412\u0438\u043a\u0442\u043e\u0440 \u0417\u0430\u0440\u0443\u0431\u0438\u043d Ekaterina Klimova \u0415\u0432\u0433\u0435\u043d\u0438\u044f \u0429\u0435\u0433\u043e\u043b\u0435\u0432\u0430 Leonid Bichevin \u0410\u043b\u0435\u043a\u0441\u0430\u043d\u0434\u0440 \u0412\u043e\u043b\u043a\u043e\u0432 Full Cast & Crew Last Season Season 1 2012 | 12 Episodes Season 1 of \u0421\u0438\u043d\u0434\u0440\u043e\u043c \u0434\u0440\u0430\u043a\u043e\u043d\u0430 premiered on October 14, 2012. View All Seasons Social Reviews  0 Discussions  0 Media Most Popular Videos  0 Backdrops  1 Posters  1 Recommendations We don't have enough data to suggest any TV shows based on \u0421\u0438\u043d\u0434\u0440\u043e\u043c \u0434\u0440\u0430\u043a\u043e\u043d\u0430. You can help by rating TV shows you've seen. Facts Status  Ended Network Certification 16+ Meaning Only teens the age of 16 or older can watch. Type  Scripted Original Language  Russian Runtime  52m Homepage  - Genres Reality Mystery Crime Keywords detective based on true events Content Score 86 Almost there... Top Contributors 42 Nike 12 Zlogorek TB 7 TMDb Bot 6 Elizabeth Jennings  View Edit History Popularity Trend  Login to edit  URL By  signing up  for an account on TMDb, you can post directly to Twitter and Facebook. You need to be logged in to continue. Click  here  to login or  here  to sign up.    page_wrap opened in html_head  Join the Community The Basics About TMDb Contact Us Support Forums API Blog Get Involved  Contribution Bible 3rd Party Applications Add New Movie Add New TV Show Community Guidelines Leaderboard Forums Twitter Facebook Legal Terms of Use Privacy Policy Login Sign Up"}