{"link": "https://www.themoviedb.org/tv/17271?language=en", "title": "Trust Me", "resume": "The series revolves around Rothman, Greene, and Moore, a fictional advertising firm. The storylines center on the difficulties of securing accounts and the characters' personal lives.", "rate": null, "genre": ["Drama", "Comedy"], "cast": ["Eric McCormack", "Tom Cavanagh", "Griffin Dunne", "Sarah Clarke", "Geoffrey Arend"], "site_data": "html Apps Forums Leaderboard Contribute API Support Discover Movies TV Shows Movies Popular Top Rated Upcoming Now Playing TV Shows Popular Top Rated On TV Airing Today People Popular People Can't find a movie or TV show? Login to create it. en Login Sign Up  ID: 17271   Expand Trust Me   (2009) User Score Overview The series revolves around Rothman, Greene, and Moore, a fictional advertising firm. The storylines center on the difficulties of securing accounts and the characters' personal lives. Discussions   Reviews Videos   Images   Changes Report Share Discussions General  0 Content Issues  0 Images Backdrops  11 Posters  2 Videos Trailers  0 Teasers  0 Clips  0 Featurettes  0 Opening Credits  0 Top Billed Cast Eric McCormack Tom Cavanagh Griffin Dunne Sarah Clarke Geoffrey Arend Hector Culligan Full Cast & Crew Last Season (us) season 1 2009 | 13 Episodes Season 1 of Trust Me premiered on January 26, 2009. View All Seasons Social Reviews  0 Discussions  0 Media Most Popular Videos  0 Backdrops  11 Posters  2 Recommendations We don't have enough data to suggest any TV shows based on Trust Me. You can help by rating TV shows you've seen. Facts Status  Ended Network Certification  - Type  Scripted Original Language  English Runtime  60m Homepage   http://www.tnt.tv/series/trustme/ Genres Drama Comedy Keywords chicago workplace advertising agency Content Score 86 Almost there... Top Contributors n 7 newSami 7 Banana w 3 webmaster s 3 speedycars  View Edit History Popularity Trend  Login to edit  URL By  signing up  for an account on TMDb, you can post directly to Twitter and Facebook. You need to be logged in to continue. Click  here  to login or  here  to sign up.    page_wrap opened in html_head  Join the Community The Basics About TMDb Contact Us Support Forums API Blog Get Involved  Contribution Bible 3rd Party Applications Add New Movie Add New TV Show Community Guidelines Leaderboard Forums Twitter Facebook Legal Terms of Use Privacy Policy Login Sign Up", "character": ["Hector Culligan"]}