{"link": "https://www.themoviedb.org/tv/31388?language=en", "title": "Capadocia", "resume": "Capadocia is a Mexican HBO Latin America television series. It started on March 2, 2008 and its second season was planned for 2010.", "rate": null, "genre": ["Drama"], "cast": ["Ana de la Reguera", "Cecilia Su\u00e1rez", "Dolores Heredia", "Alejandro Camacho", "Juan Manuel Bernal"], "site_data": "html Apps Forums Leaderboard Contribute API Support Discover Movies TV Shows Movies Popular Top Rated Upcoming Now Playing TV Shows Popular Top Rated On TV Airing Today People Popular People Can't find a movie or TV show? Login to create it. en Login Sign Up  ID: 31388   Expand Capadocia   (2008) User Score Overview Capadocia is a Mexican HBO Latin America television series. It started on March 2, 2008 and its second season was planned for 2010. Featured Crew Argos Comunicaci\u00f3n Creator Discussions   Reviews Videos   Images   Changes Report Share Discussions General  0 Content Issues  0 Images Backdrops  5 Posters  4 Videos Trailers  0 Teasers  0 Clips  0 Featurettes  0 Opening Credits  0 Top Billed Cast Ana de la Reguera Lorena Guerra Cecilia Su\u00e1rez Dolores Heredia Alejandro Camacho Juan Manuel Bernal Full Cast & Crew Last Season Season 1 2008 | 13 Episodes Season 1 of Capadocia premiered on March  2, 2008. View All Seasons Social Reviews  0 Discussions  0 Media Most Popular Videos  0 Backdrops  5 Posters  4 Recommendations We don't have enough data to suggest any TV shows based on Capadocia. You can help by rating TV shows you've seen. Facts Status  Returning Series Network Certification  - Type  Scripted Original Language  English Runtime  - Homepage   http://www.capadocia.tv/ Genres Drama Keywords No keywords have been added. Content Score 93 Almost there... Top Contributors s 3 speedycars m 1 marcosab 1 Xenus  View Edit History Popularity Trend  Login to edit  URL By  signing up  for an account on TMDb, you can post directly to Twitter and Facebook. You need to be logged in to continue. Click  here  to login or  here  to sign up.    page_wrap opened in html_head  Join the Community The Basics About TMDb Contact Us Support Forums API Blog Get Involved  Contribution Bible 3rd Party Applications Add New Movie Add New TV Show Community Guidelines Leaderboard Forums Twitter Facebook Legal Terms of Use Privacy Policy Login Sign Up", "character": ["Lorena Guerra"]}