{"link": "https://www.themoviedb.org/tv/77781?language=en", "title": "Lanester", "resume": "We don't have an overview translated in English. Help us expand our database by adding one.", "rate": 0, "genre": ["Crime"], "cast": ["Emma de Caunes", "Richard Berry", "Hippolyte Girardot", "Agn\u00e8s Blanchot", "Isabelle Candelier"], "character": ["Gabrielle Stahl", "\u00c9ric Lanester", "Professeur Vincent Gerhardt", "Max Fabrega", "Docteur Jacynthe Bergeret"], "site_data": "html Apps Forums Leaderboard Contribute API Support Discover Movies TV Shows Movies Popular Top Rated Upcoming Now Playing TV Shows Popular Top Rated On TV Airing Today People Popular People Can't find a movie or TV show? Login to create it. en Login Sign Up  ID: 77781   Expand Lanester   (2014) User Score Overview We don't have an overview translated in English. Help us expand our database by adding one. Featured Crew Franck Mancuso Creator Discussions   Reviews Videos   Images   Changes Report Share Discussions General  0 Content Issues  0 Images Backdrops  1 Posters  1 Videos Trailers  0 Teasers  0 Clips  0 Featurettes  0 Opening Credits  0 Top Billed Cast Emma de Caunes Gabrielle Stahl Richard Berry \u00c9ric Lanester Hippolyte Girardot Professeur Vincent Gerhardt Agn\u00e8s Blanchot Max Fabrega Isabelle Candelier Docteur Jacynthe Bergeret Full Cast & Crew Last Season Season 1 2014 | 3 Episodes Season 1 of Lanester premiered on January 22, 2014. View All Seasons Social Reviews  0 Discussions  0 Media Most Popular Videos  0 Backdrops  1 Posters  1 Recommendations We don't have enough data to suggest any TV shows based on Lanester. You can help by rating TV shows you've seen. Facts Status  Returning Series Network Certification 10 Meaning Not recommended for children under 10. Not allowed in children's television series. Type  Scripted Original Language  French Runtime  100m Homepage   https://www.france.tv/france-2/lanester/ Genres Crime Keywords police Content Score 86 Almost there... Top Contributors m 35 michael47 b 12 benjaminspotern 2 Elizabeth Jennings  View Edit History Popularity Trend  Login to edit  URL By  signing up  for an account on TMDb, you can post directly to Twitter and Facebook. You need to be logged in to continue. Click  here  to login or  here  to sign up.    page_wrap opened in html_head  Join the Community The Basics About TMDb Contact Us Support Forums API Blog Get Involved  Contribution Bible 3rd Party Applications Add New Movie Add New TV Show Community Guidelines Leaderboard Forums Twitter Facebook Legal Terms of Use Privacy Policy Login Sign Up"}