{"link": "https://www.themoviedb.org/tv/6200?language=en", "title": "Cambridge Spies", "resume": "The tale of the most infamous double agents in British history.", "rate": 73, "genre": ["Drama"], "cast": ["Tom Hollander", "Samuel West", "Toby Stephens", "Stuart Laing", "Rupert Penry-Jones"], "character": ["Guy Burgess", "Anthony Blunt", "Kim Philby", "Jack Hewit", "Donald Maclean"], "site_data": "html Apps Forums Leaderboard Contribute API Support Discover Movies TV Shows Movies Popular Top Rated Upcoming Now Playing TV Shows Popular Top Rated On TV Airing Today People Popular People Can't find a movie or TV show? Login to create it. en Login Sign Up  ID: 6200   Expand Cambridge Spies   (2003) User Score Overview The tale of the most infamous double agents in British history. Discussions   Reviews Videos   Images   Changes Report Share Discussions General  0 Content Issues  0 Images Backdrops  1 Posters  4 Videos Trailers  0 Teasers  0 Clips  0 Featurettes  0 Opening Credits  0 Top Billed Cast Tom Hollander Guy Burgess Samuel West Anthony Blunt Toby Stephens Kim Philby Stuart Laing Jack Hewit Rupert Penry-Jones Donald Maclean Full Cast & Crew Last Season Miniseries 2003 | 4 Episodes Season 1 of Cambridge Spies premiered on May  8, 2003. View All Seasons Social Reviews  0 Discussions  0 Media Most Popular Videos  0 Backdrops  1 Posters  4 Recommendations We don't have enough data to suggest any TV shows based on Cambridge Spies. You can help by rating TV shows you've seen. Facts Status  Ended Network Certification  - Type  Miniseries Original Language  English Runtime  60m Homepage   http://www.bbc.co.uk/programmes/p00tcr7d Genres Drama Keywords spy miniseries 1930s soviet spy Content Score 86 Almost there... Top Contributors 14 rudely_murray 12 Banana TB 10 TMDb Bot s 5 speedycars  View Edit History Popularity Trend  Login to edit  URL By  signing up  for an account on TMDb, you can post directly to Twitter and Facebook. You need to be logged in to continue. Click  here  to login or  here  to sign up.    page_wrap opened in html_head  Join the Community The Basics About TMDb Contact Us Support Forums API Blog Get Involved  Contribution Bible 3rd Party Applications Add New Movie Add New TV Show Community Guidelines Leaderboard Forums Twitter Facebook Legal Terms of Use Privacy Policy Login Sign Up"}