{"link": "https://www.themoviedb.org/tv/40769?language=en", "title": "Die Hesselbachs", "resume": "Die Firma Hesselbach is a German television series.", "rate": null, "genre": ["Drama"], "cast": ["Wolf Schmidt", "Liesel Christ", "Lia W\u00f6hr", "Sophie Cossaeus", "Joachim Engel-Denis"], "site_data": "html Apps Forums Leaderboard Contribute API Support Discover Movies TV Shows Movies Popular Top Rated Upcoming Now Playing TV Shows Popular Top Rated On TV Airing Today People Popular People Can't find a movie or TV show? Login to create it. en Login Sign Up  ID: 40769   Expand Die Hesselbachs   (1960) User Score Overview Die Firma Hesselbach is a German television series. Featured Crew Lia W\u00f6hr Creator Discussions   Reviews Videos   Images   Changes Report Share Discussions General  0 Content Issues  0 Images Backdrops  0 Posters  1 Videos Trailers  0 Teasers  0 Clips  0 Featurettes  0 Opening Credits  0 Top Billed Cast Wolf Schmidt Karl 'Babba' Hesselbach Liesel Christ Marie 'Mamma' Hesselbach Lia W\u00f6hr Frau Siebenhals Sophie Cossaeus Frl. Lohmeier Joachim Engel-Denis Fred Lindner Full Cast & Crew Last Season Season 3 1966 | 9 Episodes Season 3 of Die Hesselbachs premiered on October 19, 1966. View All Seasons Social Reviews  0 Discussions  0 Media Most Popular Videos  0 Backdrops  0 Posters  1 Recommendations We don't have enough data to suggest any TV shows based on Die Hesselbachs. You can help by rating TV shows you've seen. Facts Status  Ended Network Certification  - Type  Scripted Original Language  German Runtime  45m Homepage  - Genres Drama Keywords No keywords have been added. Content Score 79 Pump it up! We're close now. Top Contributors S 47 Samara s 3 stesme  View Edit History Popularity Trend  Login to edit  URL By  signing up  for an account on TMDb, you can post directly to Twitter and Facebook. You need to be logged in to continue. Click  here  to login or  here  to sign up.    page_wrap opened in html_head  Join the Community The Basics About TMDb Contact Us Support Forums API Blog Get Involved  Contribution Bible 3rd Party Applications Add New Movie Add New TV Show Community Guidelines Leaderboard Forums Twitter Facebook Legal Terms of Use Privacy Policy Login Sign Up", "character": ["Karl 'Babba' Hesselbach", "Marie 'Mamma' Hesselbach", "Frau Siebenhals", "Frl. Lohmeier", "Fred Lindner"]}