{"link": "https://www.themoviedb.org/tv/66175?language=en", "title": "I Am the Ambassador", "resume": "Follows Rufus Gifford, the U.S. ambassador to Denmark and an advocate for LGBT rights, in his personal and professional life.", "rate": 70, "genre": ["Reality"], "cast": ["Rufus Gifford"], "character": ["Himself"], "site_data": "html Apps Forums Leaderboard Contribute API Support Discover Movies TV Shows Movies Popular Top Rated Upcoming Now Playing TV Shows Popular Top Rated On TV Airing Today People Popular People Can't find a movie or TV show? Login to create it. en Login Sign Up  ID: 66175   Expand I Am the Ambassador   (2014) User Score Overview Follows Rufus Gifford, the U.S. ambassador to Denmark and an advocate for LGBT rights, in his personal and professional life. Discussions   Reviews Videos   Images   Changes Report Share Discussions General  0 Content Issues  1 Images Backdrops  1 Posters  1 Videos Trailers  0 Teasers  0 Clips  0 Featurettes  0 Opening Credits  0 Top Billed Cast Rufus Gifford Himself Full Cast & Crew Last Season Season 2 2015 | 4 Episodes Season 2 of I Am the Ambassador premiered on October 16, 2015. View All Seasons Social Reviews  0 Discussions  1 Subject Status Replies Last Reply There are no discussions for I Am the Ambassador. Login to be first! Go to Discussions Media Most Popular Videos  0 Backdrops  1 Posters  1 Recommendations We don't have enough data to suggest any TV shows based on I Am the Ambassador. You can help by rating TV shows you've seen. Facts Original Name  Jeg er ambassad\u00f8ren fra Amerika Status  Returning Series Network Certification TV-14 Meaning This program contains some material that many parents would find unsuitable for children under 14 years of age. Type  Reality Original Language  Danish Runtime  28m Homepage  - Genres Reality Keywords lgbt Content Score 56 We're so close, yet so far. Top Contributors 24 Banana k 14 kotsku TB 2 TMDb Bot 2 mostern  View Edit History Popularity Trend  Login to edit  URL By  signing up  for an account on TMDb, you can post directly to Twitter and Facebook. You need to be logged in to continue. Click  here  to login or  here  to sign up.    page_wrap opened in html_head  Join the Community The Basics About TMDb Contact Us Support Forums API Blog Get Involved  Contribution Bible 3rd Party Applications Add New Movie Add New TV Show Community Guidelines Leaderboard Forums Twitter Facebook Legal Terms of Use Privacy Policy Login Sign Up"}