{"link": "https://www.themoviedb.org/tv/40841?language=en", "title": "Countdown \u2013 Die Jagd beginnt", "resume": "Countdown \u2013 Die Jagd beginnt is a German television series.", "rate": 0, "genre": ["Crime"], "cast": ["Sebastian Str\u00f6bel", "Chiara Schoras", "Oliver Stritzel", "Andreas Windhuis", "Anne Diemer"], "character": ["Kriminalhauptkommissar Jan Brenner", "Kriminaloberkommissarin Leonie Bongartz", "Kriminaldirektor Dr. Joachim Ritter", "Kriminaloberkommissar Klaus Frings", "Kriminalkommissarin Eva Mayerhofer"], "site_data": "html Apps Forums Leaderboard Contribute API Support Discover Movies TV Shows Movies Popular Top Rated Upcoming Now Playing TV Shows Popular Top Rated On TV Airing Today People Popular People Can't find a movie or TV show? Login to create it. en Login Sign Up  ID: 40841   Expand Countdown \u2013 Die Jagd beginnt   (2010) User Score Overview Countdown \u2013 Die Jagd beginnt is a German television series. Discussions   Reviews Videos   Images   Changes Report Share Discussions General  0 Content Issues  0 Images Backdrops  9 Posters  3 Videos Trailers  0 Teasers  0 Clips  0 Featurettes  0 Opening Credits  0 Top Billed Cast Sebastian Str\u00f6bel Kriminalhauptkommissar Jan Brenner Chiara Schoras Kriminaloberkommissarin Leonie Bongartz Oliver Stritzel Kriminaldirektor Dr. Joachim Ritter Andreas Windhuis Kriminaloberkommissar Klaus Frings Anne Diemer Kriminalkommissarin Eva Mayerhofer Full Cast & Crew Last Season Season 3 2012 | 8 Episodes Season 3 of Countdown \u2013 Die Jagd beginnt premiered on January 12, 2012. View All Seasons Social Reviews  0 Discussions  0 Media Most Popular Videos  0 Backdrops  9 Posters  3 Recommendations We don't have enough data to suggest any TV shows based on Countdown \u2013 Die Jagd beginnt. You can help by rating TV shows you've seen. Facts Status  Ended Network Certification  - Type  Scripted Original Language  German Runtime  45m Homepage  - Genres Crime Keywords No keywords have been added. Content Score 86 Almost there... Top Contributors S 30 Samara 4 karaa V 1 VintageSmoke  View Edit History Popularity Trend  Login to edit  URL By  signing up  for an account on TMDb, you can post directly to Twitter and Facebook. You need to be logged in to continue. Click  here  to login or  here  to sign up.    page_wrap opened in html_head  Join the Community The Basics About TMDb Contact Us Support Forums API Blog Get Involved  Contribution Bible 3rd Party Applications Add New Movie Add New TV Show Community Guidelines Leaderboard Forums Twitter Facebook Legal Terms of Use Privacy Policy Login Sign Up"}