{"link": "https://www.themoviedb.org/tv/77551?language=en", "title": "Meryem", "resume": "In the aftermath of an accident, a naive girl finds herself torn between an unscrupulous prosecutor, and a vindictive plaintiff.", "rate": 0, "genre": ["Drama"], "cast": ["Ay\u00e7a Ay\u015fin Turan", "U\u011fur Demirpehlivan", "Hakan \u0130l\u00e7in", "Zeynep Kumral", "Belma Mamati"], "character": ["Meryem", "G\u00fcl\u00fcmser", "Sargun Avukat", "Sevin\u00e7'in Annesi", "Mahpus"], "site_data": "html Apps Forums Leaderboard Contribute API Support Discover Movies TV Shows Movies Popular Top Rated Upcoming Now Playing TV Shows Popular Top Rated On TV Airing Today People Popular People Can't find a movie or TV show? Login to create it. en Login Sign Up  ID: 77551   Expand Meryem   (2018) User Score Overview In the aftermath of an accident, a naive girl finds herself torn between an unscrupulous prosecutor, and a vindictive plaintiff. Featured Crew Mustafa \u015eevki Do\u011fan Creator Bar\u0131\u015f Er\u00e7etin Creator Feride Kaytan Creator Discussions   Reviews Videos   Images   Changes Report Share Discussions General  0 Content Issues  0 Images Backdrops  1 Posters  1 Videos Trailers  0 Teasers  0 Clips  0 Featurettes  0 Opening Credits  0 Top Billed Cast Ay\u00e7a Ay\u015fin Turan Meryem U\u011fur Demirpehlivan G\u00fcl\u00fcmser Hakan \u0130l\u00e7in Sargun Avukat Zeynep Kumral Sevin\u00e7'in Annesi Belma Mamati Mahpus Full Cast & Crew Current Season Season 1 2018 | 30 Episodes Season 1 of Meryem premiered on March  1, 2018. View All Seasons Social Reviews  0 Discussions  0 Media Most Popular Videos  0 Backdrops  1 Posters  1 Recommendations We don't have enough data to suggest any TV shows based on Meryem. You can help by rating TV shows you've seen. Facts Status  Returning Series Network Certification  - Type  Scripted Original Language  Turkish Runtime  120m Homepage  - Genres Drama Keywords No keywords have been added. Content Score 93 Almost there... Top Contributors 48 moviefars  View Edit History Popularity Trend  Login to edit  URL By  signing up  for an account on TMDb, you can post directly to Twitter and Facebook. You need to be logged in to continue. Click  here  to login or  here  to sign up.    page_wrap opened in html_head  Join the Community The Basics About TMDb Contact Us Support Forums API Blog Get Involved  Contribution Bible 3rd Party Applications Add New Movie Add New TV Show Community Guidelines Leaderboard Forums Twitter Facebook Legal Terms of Use Privacy Policy Login Sign Up"}