{"link": "https://www.themoviedb.org/tv/76594?language=en", "title": "Papi Ricky", "resume": "The relationship between Ricky and his daughter will suffer when the girl's mother returns and wants her back.", "rate": 80, "genre": ["Comedy", "Drama", "Soap"], "cast": ["Jorge Zabaleta", "Bel\u00e9n Soto", "Tamara Acosta", "Mar\u00eda Elena Swett", "H\u00e9ctor Morales"], "character": ["Ricardo Montes", "Alicia Montes", "Colomba Chaparro", "Catalina 'Catrala' Rivera", "Gabriel 'Gabo' del R\u00edo"], "site_data": "html Apps Forums Leaderboard Contribute API Support Discover Movies TV Shows Movies Popular Top Rated Upcoming Now Playing TV Shows Popular Top Rated On TV Airing Today People Popular People Can't find a movie or TV show? Login to create it. en Login Sign Up  ID: 76594   Expand Papi Ricky   (2007) User Score Overview The relationship between Ricky and his daughter will suffer when the girl's mother returns and wants her back. Featured Crew Ver\u00f3nica Saquel Creator Discussions   Reviews Videos   Images   Changes Report Share Discussions General  0 Content Issues  0 Images Backdrops  1 Posters  2 Videos Trailers  0 Teasers  0 Clips  0 Featurettes  0 Opening Credits  1 Top Billed Cast Jorge Zabaleta Ricardo Montes Bel\u00e9n Soto Alicia Montes Tamara Acosta Colomba Chaparro Mar\u00eda Elena Swett Catalina 'Catrala' Rivera H\u00e9ctor Morales Gabriel 'Gabo' del R\u00edo Full Cast & Crew Last Season Season 1 2007 | 4 Episodes Season 1 of Papi Ricky premiered on December  3, 2007. View All Seasons Social Reviews  0 Discussions  0 Media Most Popular Videos  1 Backdrops  1 Posters  2 Recommendations We don't have enough data to suggest any TV shows based on Papi Ricky. You can help by rating TV shows you've seen. Facts Status  Ended Network Certification  - Type  Scripted Original Language  Spanish; Castilian Runtime  50m Homepage  - Genres Comedy Drama Soap Keywords father daughter relationship chilean Content Score 100 Yes! Looking good! Top Contributors 46 Mikedeth5 TB 5 TMDb Bot 1 Banana  View Edit History Popularity Trend  Login to edit  URL By  signing up  for an account on TMDb, you can post directly to Twitter and Facebook. You need to be logged in to continue. Click  here  to login or  here  to sign up.    page_wrap opened in html_head  Join the Community The Basics About TMDb Contact Us Support Forums API Blog Get Involved  Contribution Bible 3rd Party Applications Add New Movie Add New TV Show Community Guidelines Leaderboard Forums Twitter Facebook Legal Terms of Use Privacy Policy Login Sign Up"}