{"link": "https://www.themoviedb.org/tv/64839?language=en", "title": "Great Barrier Reef with David Attenborough", "resume": "Following his visit to the Great Barrier Reef in 1957, naturalist and broadcaster David Attenborough returns and uses the latest filming techniques to unlock the secrets of the natural wonder.", "rate": 46, "genre": ["Documentary"], "cast": ["David Attenborough"], "character": ["Himself - Presenter"], "site_data": "html Apps Forums Leaderboard Contribute API Support Discover Movies TV Shows Movies Popular Top Rated Upcoming Now Playing TV Shows Popular Top Rated On TV Airing Today People Popular People Can't find a movie or TV show? Login to create it. en Login Sign Up  ID: 64839   Expand Great Barrier Reef with David Attenborough   (2015) User Score  Play Trailer Overview Following his visit to the Great Barrier Reef in 1957, naturalist and broadcaster David Attenborough returns and uses the latest filming techniques to unlock the secrets of the natural wonder. Discussions   Reviews Videos   Images   Changes Report Share Discussions General  0 Content Issues  0 Images Backdrops  25 Posters  18 Videos Trailers  1 Teasers  0 Clips  0 Featurettes  0 Opening Credits  0 Top Billed Cast David Attenborough Himself - Presenter Full Cast & Crew Last Season Season 1 2015 | 3 Episodes Season 1 of Great Barrier Reef with David Attenborough premiered on December 30, 2015. View All Seasons Social Reviews  0 Discussions  0 Media Most Popular Videos  1 Backdrops  25 Posters  18 Recommendations We don't have enough data to suggest any TV shows based on Great Barrier Reef with David Attenborough. You can help by rating TV shows you've seen. Facts Status  Ended Network Certification  - Type  Miniseries Original Language  English Runtime  60m Homepage   http://www.bbc.co.uk/programmes/b06vbz1l Genres Documentary Keywords submarine whale climate change coral reef nature great barrier reef nature documentary Content Score 64 We're so close, yet so far. Top Contributors 45 Elizabeth Jennings TB 37 TMDb Bot s 7 sheva_vitali M 4 MAthePA  View Edit History Popularity Trend  Login to edit  URL By  signing up  for an account on TMDb, you can post directly to Twitter and Facebook. You need to be logged in to continue. Click  here  to login or  here  to sign up.    page_wrap opened in html_head  Join the Community The Basics About TMDb Contact Us Support Forums API Blog Get Involved  Contribution Bible 3rd Party Applications Add New Movie Add New TV Show Community Guidelines Leaderboard Forums Twitter Facebook Legal Terms of Use Privacy Policy Login Sign Up"}