{"link": "https://www.themoviedb.org/tv/76242?language=en", "title": "Return", "resume": "Choi Ja-Hye is a lawyer and Dokgo Young is a detective with a hot temper. They work together on a murder case where the suspects are children from the elite class.", "rate": 51, "genre": ["Mystery", "Drama"], "cast": ["Park Jin-Hee", "Ko Hyun-jung", "Lee Jin-wook", "Shin Sung-rok", "Bong Tae-gyu"], "character": ["Choi Ja-Hye (ep.15-34)", "Choi Ja-Hye (ep.1-14)", "Dokgo Young", "Oh Tae-Seok", "Kim Hak-Beom"], "site_data": "html Apps Forums Leaderboard Contribute API Support Discover Movies TV Shows Movies Popular Top Rated Upcoming Now Playing TV Shows Popular Top Rated On TV Airing Today People Popular People Can't find a movie or TV show? Login to create it. en Login Sign Up  ID: 76242   Expand Return   (2018) User Score Overview Choi Ja-Hye is a lawyer and Dokgo Young is a detective with a hot temper. They work together on a murder case where the suspects are children from the elite class. Discussions   Reviews Videos   Images   Changes Report Share Discussions General  0 Content Issues  0 Images Backdrops  1 Posters  2 Videos Trailers  0 Teasers  0 Clips  0 Featurettes  0 Opening Credits  0 Top Billed Cast Park Jin-Hee Choi Ja-Hye (ep.15-34) Ko Hyun-jung Choi Ja-Hye (ep.1-14) Lee Jin-wook Dokgo Young Shin Sung-rok Oh Tae-Seok Bong Tae-gyu Kim Hak-Beom Full Cast & Crew Current Season Season 1 2018 | 34 Episodes Season 1 of Return premiered on January 17, 2018. View All Seasons Social Reviews  0 Discussions  0 Media Most Popular Videos  0 Backdrops  1 Posters  2 Recommendations We don't have enough data to suggest any TV shows based on Return. You can help by rating TV shows you've seen. Facts Original Name  \ub9ac\ud134 Status  Ended Network Certification  - Type  Scripted Original Language  Korean Runtime  35m Homepage   http://programs.sbs.co.kr/drama/return/ Genres Mystery Drama Keywords thriller Content Score 86 Almost there... Top Contributors M 40 Maria180493 3 andermairena h 3 huestory k 1 kunamon  View Edit History Popularity Trend  Login to edit  URL By  signing up  for an account on TMDb, you can post directly to Twitter and Facebook. You need to be logged in to continue. Click  here  to login or  here  to sign up.    page_wrap opened in html_head  Join the Community The Basics About TMDb Contact Us Support Forums API Blog Get Involved  Contribution Bible 3rd Party Applications Add New Movie Add New TV Show Community Guidelines Leaderboard Forums Twitter Facebook Legal Terms of Use Privacy Policy Login Sign Up"}