{
  "link": "https://www.themoviedb.org/tv/73411?language=en",
  "title": "Maniac",
  "resume": "A darkly comedic series revolving around the fantasy worlds of two patients in a mental institute. Based on the 2014 Norwegian series of the same name.",
  "rate": "",
  "genre": [
    "Comedy"
  ],
  "cast": {
    "actor": [
      "Jonah Hill",
      "Emma Stone",
      "Justin Theroux"
    ]
  },
  "characters": {
    "characters": [
      "James Mantleray"
    ]
  },
  "site_data": "html Apps Forums Leaderboard Contribute API Support Discover Movies TV Shows Movies Popular Top Rated Upcoming Now Playing TV Shows Popular Top Rated On TV Airing Today People Popular People Can't find a movie or TV show? Login to create it. en Login Sign Up  ID: 73411   Expand Maniac   (2018) User Score Overview A darkly comedic series revolving around the fantasy worlds of two patients in a mental institute. Based on the 2014 Norwegian series of the same name. Featured Crew Cary Fukunaga Creator Discussions   Reviews Videos   Images   Changes Report Share Discussions General  0 Content Issues  0 Images Backdrops  0 Posters  1 Videos Trailers  0 Teasers  0 Clips  0 Featurettes  0 Opening Credits  0 Top Billed Cast Jonah Hill Emma Stone Justin Theroux James Mantleray Full Cast & Crew  Create Episode Social Reviews  0 Discussions  0 Media Most Popular Videos  0 Backdrops  0 Posters  1 Facts Status  In Production Network Certification  - Type  Scripted Original Language  English Runtime  - Homepage   https://www.netflix.com/title/80124522 Genres Comedy Keywords dark comedy psychiatric hospital Content Score 50 Still needs a little work. Top Contributors 21 auu 11 Elizabeth Jennings 4 Marso  View Edit History Popularity Trend  Login to edit  URL By  signing up  for an account on TMDb, you can post directly to Twitter and Facebook. You need to be logged in to continue. Click  here  to login or  here  to sign up.    page_wrap opened in html_head  Join the Community The Basics About TMDb Contact Us Support Forums API Blog Get Involved  Contribution Bible 3rd Party Applications Add New Movie Add New TV Show Community Guidelines Leaderboard Forums Twitter Facebook Legal Terms of Use Privacy Policy Login Sign Up"
}