{
  "link": "https://www.themoviedb.org/tv/80524?language=en",
  "title": "Kamenskaya - 5",
  "resume": "We don't have an overview translated in English. Help us expand our database by adding one.",
  "rate": "100.0",
  "genre": [
    "Action",
    "Adventure",
    "Mystery",
    "Drama",
    "Comedy",
    "Crime"
  ],
  "cast": [
    "Elena Yakovleva",
    "Andrey Ilin",
    "Sergey Nikonenko",
    "Stanislav Duzhnikov",
    "Natalya Shvets"
  ],
  "character": [
    "\u0410\u043d\u0430\u0441\u0442\u0430\u0441\u0438\u044f \u041f\u0430\u0432\u043b\u043e\u0432\u043d\u0430 \u041a\u0430\u043c\u0435\u043d\u0441\u043a\u0430\u044f (\u0433\u043b\u0430\u0432\u043d\u0430\u044f \u0440\u043e\u043b\u044c, \u043f\u043e\u0434\u043f\u043e\u043b\u043a\u043e\u0432\u043d\u0438\u043a \u043c\u0438\u043b\u0438\u0446\u0438\u0438)",
    "\u0410\u043b\u0435\u043a\u0441\u0435\u0439 \u0427\u0438\u0441\u0442\u044f\u043a\u043e\u0432 (\u0433\u043b\u0430\u0432\u043d\u0430\u044f \u0440\u043e\u043b\u044c, \u043c\u0443\u0436 \u041a\u0430\u043c\u0435\u043d\u0441\u043a\u043e\u0439)",
    "\u0412\u0438\u043a\u0442\u043e\u0440 \u0410\u043b\u0435\u043a\u0441\u0435\u0435\u0432\u0438\u0447 \u0413\u043e\u0440\u0434\u0435\u0435\u0432 (\u0433\u043b\u0430\u0432\u043d\u0430\u044f \u0440\u043e\u043b\u044c, \"\u041a\u043e\u043b\u043e\u0431\u043e\u043a\")",
    "\u041c\u0438\u0445\u0430\u0438\u043b \u0414\u043e\u0446\u0435\u043d\u043a\u043e (\u0433\u043b\u0430\u0432\u043d\u0430\u044f \u0440\u043e\u043b\u044c)",
    "\u0418\u0440\u0438\u043d\u0430 (\u0436\u0435\u043d\u0430 \u0414\u043e\u0446\u0435\u043d\u043a\u043e)"
  ],
  "site_data": "html Apps Forums Leaderboard Contribute API Support Discover Movies TV Shows Movies Popular Top Rated Upcoming Now Playing TV Shows Popular Top Rated On TV Airing Today People Popular People Can't find a movie or TV show? Login to create it. en Login Sign Up  ID: 80524   Expand Kamenskaya - 5   (2008) User Score Overview We don't have an overview translated in English. Help us expand our database by adding one. Discussions   Reviews Videos   Images   Changes Report Share Discussions General  0 Content Issues  0 Images Backdrops  5 Posters  1 Videos Trailers  0 Teasers  0 Clips  0 Featurettes  0 Opening Credits  0 Top Billed Cast Elena Yakovleva \u0410\u043d\u0430\u0441\u0442\u0430\u0441\u0438\u044f \u041f\u0430\u0432\u043b\u043e\u0432\u043d\u0430 \u041a\u0430\u043c\u0435\u043d\u0441\u043a\u0430\u044f (\u0433\u043b\u0430\u0432\u043d\u0430\u044f \u0440\u043e\u043b\u044c, \u043f\u043e\u0434\u043f\u043e\u043b\u043a\u043e\u0432\u043d\u0438\u043a \u043c\u0438\u043b\u0438\u0446\u0438\u0438) Andrey Ilin \u0410\u043b\u0435\u043a\u0441\u0435\u0439 \u0427\u0438\u0441\u0442\u044f\u043a\u043e\u0432 (\u0433\u043b\u0430\u0432\u043d\u0430\u044f \u0440\u043e\u043b\u044c, \u043c\u0443\u0436 \u041a\u0430\u043c\u0435\u043d\u0441\u043a\u043e\u0439) Sergey Nikonenko \u0412\u0438\u043a\u0442\u043e\u0440 \u0410\u043b\u0435\u043a\u0441\u0435\u0435\u0432\u0438\u0447 \u0413\u043e\u0440\u0434\u0435\u0435\u0432 (\u0433\u043b\u0430\u0432\u043d\u0430\u044f \u0440\u043e\u043b\u044c, \"\u041a\u043e\u043b\u043e\u0431\u043e\u043a\") Stanislav Duzhnikov \u041c\u0438\u0445\u0430\u0438\u043b \u0414\u043e\u0446\u0435\u043d\u043a\u043e (\u0433\u043b\u0430\u0432\u043d\u0430\u044f \u0440\u043e\u043b\u044c) Natalya Shvets \u0418\u0440\u0438\u043d\u0430 (\u0436\u0435\u043d\u0430 \u0414\u043e\u0446\u0435\u043d\u043a\u043e) Full Cast & Crew Last Season Season 1 2008 | 12 Episodes Season 1 of Kamenskaya - 5 premiered on November 16, 2008. View All Seasons Social Reviews  0 Discussions  0 Media Most Popular Videos  0 Backdrops  5 Posters  1 Recommendations   2005-12-09 \u041a\u0430\u043c\u0435\u043d\u0441\u043a\u0430\u044f - 4 10.0    2001-12-22 Black Raven 10.0    2003-09-29 \u041a\u0430\u043c\u0435\u043d\u0441\u043a\u0430\u044f - 3 10.0    2002-12-07 \u041a\u0430\u043c\u0435\u043d\u0441\u043a\u0430\u044f - 2 10.0  Facts Original Name  \u041a\u0430\u043c\u0435\u043d\u0441\u043a\u0430\u044f - 5 Status  Ended Network Certification 16+ Meaning Only teens the age of 16 or older can watch. Type  Scripted Original Language  Russian Runtime  43m Homepage  - Genres Action & Adventure Mystery Drama Comedy Crime Keywords based on novel or book russian novels russian woman Content Score 86 Almost there... Top Contributors n 42 navarro2018 7 Elena Sergeeva TB 2 TMDb Bot  View Edit History Popularity Trend  Login to edit  URL By  signing up  for an account on TMDb, you can post directly to Twitter and Facebook. You need to be logged in to continue. Click  here  to login or  here  to sign up.    page_wrap opened in html_head  Join the Community The Basics About TMDb Contact Us Support Forums API Blog Get Involved  Contribution Bible 3rd Party Applications Add New Movie Add New TV Show Community Guidelines Leaderboard Forums Twitter Facebook Legal Terms of Use Privacy Policy Login Sign Up"
}