{
  "link": "https://www.themoviedb.org/tv/2305?language=en",
  "title": "A Very Peculiar Practice",
  "resume": "A young and idealistic Doctor Stephen Daker arrives at Lowlands University to work at the Health Centre, but has to cope with an eccentric set of colleagues.",
  "rate": "100.0",
  "genre": [
    "Drama",
    "Comedy"
  ],
  "cast": [
    "David Troughton",
    "Barbara Flynn",
    "Peter Davison",
    "Graham Crowden",
    "Joanna Kanska"
  ],
  "character": [
    "Bob Buzzard",
    "Rose Marie",
    "Dr. Stephen Daker",
    "Jock McCannon",
    "Grete Grotowska"
  ],
  "site_data": "html Apps Forums Leaderboard Contribute API Support Discover Movies TV Shows Movies Popular Top Rated Upcoming Now Playing TV Shows Popular Top Rated On TV Airing Today People Popular People Can't find a movie or TV show? Login to create it. en Login Sign Up  ID: 2305   Expand A Very Peculiar Practice   (1986) User Score Overview A young and idealistic Doctor Stephen Daker arrives at Lowlands University to work at the Health Centre, but has to cope with an eccentric set of colleagues. Featured Crew Andrew Davies Creator Discussions   Reviews Videos   Images   Changes Report Share Discussions General  0 Content Issues  0 Images Backdrops  2 Posters  3 Videos Trailers  0 Teasers  0 Clips  0 Featurettes  0 Opening Credits  0 Top Billed Cast David Troughton Bob Buzzard Barbara Flynn Rose Marie Peter Davison Dr. Stephen Daker Graham Crowden Jock McCannon Joanna Kanska Grete Grotowska Full Cast & Crew Last Season Season 2 1988 | 7 Episodes Season 2 of A Very Peculiar Practice premiered on March  2, 1988. View All Seasons Social Reviews  0 Discussions  0 Media Most Popular Videos  0 Backdrops  2 Posters  3 Recommendations We don't have enough data to suggest any TV shows based on A Very Peculiar Practice. You can help by rating TV shows you've seen. Facts Status  Ended Network Certification  - Type  Scripted Original Language  English Runtime  50m Homepage  - Genres Drama Comedy Keywords professor college dark comedy surreal satire health student doctor british humour Content Score 93 Almost there... Top Contributors 16 Markxist O 9 Ozbourne R 5 Rebecca 3 Redouane  View Edit History Popularity Trend  Login to edit  URL By  signing up  for an account on TMDb, you can post directly to Twitter and Facebook. You need to be logged in to continue. Click  here  to login or  here  to sign up.    page_wrap opened in html_head  Join the Community The Basics About TMDb Contact Us Support Forums API Blog Get Involved  Contribution Bible 3rd Party Applications Add New Movie Add New TV Show Community Guidelines Leaderboard Forums Twitter Facebook Legal Terms of Use Privacy Policy Login Sign Up"
}