{
  "link": "https://www.themoviedb.org/tv/65223?language=en",
  "title": "Csak sz\u00ednh\u00e1z \u00e9s m\u00e1s semmi",
  "resume": "We don't have an overview translated in English. Help us expand our database by adding one.",
  "rate": "0.0",
  "genre": [
    "Drama",
    "Romance",
    "Comedy"
  ],
  "cast": [
    "Estilla Mikecz",
    "Mikl\u00f3s H. Vecsei",
    "Anna Udvarias",
    "Rita Alexics",
    "Tibor Feh\u00e9r"
  ],
  "character": [
    "Lili Tatai",
    "Peti M\u00f3kus",
    "Erzs\u00e9bet Torm\u00e1s",
    "Buksi, the prompter",
    "D\u00e1niel K\u00f6v\u00e1ry"
  ],
  "site_data": "html Apps Forums Leaderboard Contribute API Support Discover Movies TV Shows Movies Popular Top Rated Upcoming Now Playing TV Shows Popular Top Rated On TV Airing Today People Popular People Can't find a movie or TV show? Login to create it. en Login Sign Up  ID: 65223   Expand Csak sz\u00ednh\u00e1z \u00e9s m\u00e1s semmi   (2016) User Score Overview We don't have an overview translated in English. Help us expand our database by adding one. Featured Crew R\u00e9ka Divinyi Creator Krisztina Goda Creator Discussions   Reviews Videos   Images   Changes Report Share Discussions General  0 Content Issues  0 Images Backdrops  0 Posters  2 Videos Trailers  0 Teasers  0 Clips  0 Featurettes  0 Opening Credits  0 Top Billed Cast Estilla Mikecz Lili Tatai Mikl\u00f3s H. Vecsei Peti M\u00f3kus Anna Udvarias Erzs\u00e9bet Torm\u00e1s Rita Alexics Buksi, the prompter Tibor Feh\u00e9r D\u00e1niel K\u00f6v\u00e1ry Full Cast & Crew Current Season Season 3 2018 | 6 Episodes Season 3 of Csak sz\u00ednh\u00e1z \u00e9s m\u00e1s semmi premiered on March  3, 2018. View All Seasons Social Reviews  0 Discussions  0 Media Most Popular Videos  0 Backdrops  0 Posters  2 Recommendations We don't have enough data to suggest any TV shows based on Csak sz\u00ednh\u00e1z \u00e9s m\u00e1s semmi. You can help by rating TV shows you've seen. Facts Status  Returning Series Network Certification 12 Meaning translation missing: en-US.certifications.tv_series.HU.4.meaning Type  Scripted Original Language  Hungarian Runtime  52m Homepage  - Genres Drama Romance Comedy Keywords No keywords have been added. Content Score 71 Just a little bit more... Top Contributors k 36 kpeterr r 11 roli342 8 Elizabeth Jennings 4 tompi  View Edit History Popularity Trend  Login to edit  URL By  signing up  for an account on TMDb, you can post directly to Twitter and Facebook. You need to be logged in to continue. Click  here  to login or  here  to sign up.    page_wrap opened in html_head  Join the Community The Basics About TMDb Contact Us Support Forums API Blog Get Involved  Contribution Bible 3rd Party Applications Add New Movie Add New TV Show Community Guidelines Leaderboard Forums Twitter Facebook Legal Terms of Use Privacy Policy Login Sign Up"
}