{
  "link": "https://www.themoviedb.org/tv/61840?language=en",
  "title": "50 Ways To Kill Your Mammy",
  "resume": "Irish daredevil presenter Baz Ashmawy and his 71-year-old mother Nancy embark on the trip of a lifetime and attempt to complete every item on an extreme bucket list he has created for her.",
  "rate": "",
  "genre": [
    "Comedy"
  ],
  "cast": {
    "actor": [
      "Baz Ashmawy",
      "Nancy Ashmawy"
    ]
  },
  "characters": {
    "characters": [
      "Himself",
      "Herself"
    ]
  },
  "site_data": "html Apps Forums Leaderboard Contribute API Support Discover Movies TV Shows Movies Popular Top Rated Upcoming Now Playing TV Shows Popular Top Rated On TV Airing Today People Popular People Can't find a movie or TV show? Login to create it. en Login Sign Up  ID: 61840   Expand 50 Ways To Kill Your Mammy   (2014) User Score Overview Irish daredevil presenter Baz Ashmawy and his 71-year-old mother Nancy embark on the trip of a lifetime and attempt to complete every item on an extreme bucket list he has created for her. Discussions   Reviews Videos   Images   Changes Report Share Discussions General  0 Content Issues  0 Images Backdrops  5 Posters  1 Videos Trailers  0 Teasers  0 Clips  0 Featurettes  0 Opening Credits  0 Top Billed Cast Baz Ashmawy Himself Nancy Ashmawy Herself Full Cast & Crew Last Season Season 3 2016 | 6 Episodes Season 3 of 50 Ways To Kill Your Mammy premiered on September 26, 2016. View All Seasons Social Reviews  0 Discussions  0 Media Most Popular Videos  0 Backdrops  5 Posters  1 Recommendations We don't have enough data to suggest any TV shows based on 50 Ways To Kill Your Mammy. You can help by rating TV shows you've seen. Facts Status  Returning Series Network Certification  - Type  Reality Original Language  English Runtime  45m Homepage   http://www.sky.com/tv/show/50-ways-to-kill-your-mammy Genres Comedy Keywords grandparent grandchild relationship stunt elderly bucket list Content Score 56 We're so close, yet so far. Top Contributors 20 Elizabeth Jennings 7 MarkSweeney 7 Banana e 2 empud  View Edit History Popularity Trend  Login to edit  URL By  signing up  for an account on TMDb, you can post directly to Twitter and Facebook. You need to be logged in to continue. Click  here  to login or  here  to sign up.    page_wrap opened in html_head  Join the Community The Basics About TMDb Contact Us Support Forums API Blog Get Involved  Contribution Bible 3rd Party Applications Add New Movie Add New TV Show Community Guidelines Leaderboard Forums Twitter Facebook Legal Terms of Use Privacy Policy Login Sign Up"
}