{
  "link": "https://www.themoviedb.org/tv/1236?language=en",
  "title": "Life in Cold Blood",
  "resume": "David Attenborough reveals the surprising truth about the cold-blooded lives of reptiles and amphibians. These animals are as dramatic, as colourful and as tender as any other animals.",
  "rate": "",
  "genre": [
    "Documentary"
  ],
  "cast": {
    "actor": [
      "David Attenborough"
    ]
  },
  "characters": {
    "characters": [
      "Narrator"
    ]
  },
  "site_data": "html Apps Forums Leaderboard Contribute API Support Discover Movies TV Shows Movies Popular Top Rated Upcoming Now Playing TV Shows Popular Top Rated On TV Airing Today People Popular People Can't find a movie or TV show? Login to create it. en Login Sign Up  ID: 1236   Expand Life in Cold Blood   (2008) User Score Overview David Attenborough reveals the surprising truth about the cold-blooded lives of reptiles and amphibians. These animals are as dramatic, as colourful and as tender as any other animals. Featured Crew David Attenborough Creator Discussions   Reviews Videos   Images   Changes Report Share Discussions General  0 Content Issues  0 Images Backdrops  8 Posters  5 Videos Trailers  0 Teasers  0 Clips  0 Featurettes  0 Opening Credits  0 Top Billed Cast David Attenborough Narrator Full Cast & Crew Last Season Miniseries 2008 | 5 Episodes Season 1 of Life in Cold Blood premiered on February  4, 2008. View All Seasons Social Reviews  0 Discussions  0 Media Most Popular Videos  0 Backdrops  8 Posters  5 Recommendations   1990-10-04 The Trials of Life 9.5    2002-11-20 The Life of Mammals 9.1    1998-10-21 The Life of Birds 9.3    2009-02-11 Nature's Great Events 8.4    1993-11-18 Life in the Freezer 9.2    1984-01-19 The Living Planet 9.1    2005-11-23 Life in the Undergrowth 8.4    2011-02-09 Madagascar 8.8  Facts Status  Ended Network Certification  - Type  Miniseries Original Language  English Runtime  60m, 50m Homepage   http://www.bbc.co.uk/programmes/b008yvv2 Genres Documentary Keywords animal nature Content Score 64 We're so close, yet so far. Top Contributors TB 15 TMDb Bot 10 Aty 5 Banana R 4 Rebecca  View Edit History Popularity Trend  Login to edit  URL By  signing up  for an account on TMDb, you can post directly to Twitter and Facebook. You need to be logged in to continue. Click  here  to login or  here  to sign up.    page_wrap opened in html_head  Join the Community The Basics About TMDb Contact Us Support Forums API Blog Get Involved  Contribution Bible 3rd Party Applications Add New Movie Add New TV Show Community Guidelines Leaderboard Forums Twitter Facebook Legal Terms of Use Privacy Policy Login Sign Up"
}