{
  "link": "https://www.themoviedb.org/tv/71532?language=en",
  "title": "PLANTA 25",
  "resume": "We don't have an overview translated in English. Help us expand our database by adding one.",
  "rate": "0.0",
  "genre": [
    "Action",
    "Adventure",
    "Crime",
    "Drama",
    "Family"
  ],
  "cast": [
    "Oscar Ed\u00fa",
    "\u00c1lvaro Morte",
    "M\u00f3nica Rom\u00e1n",
    "Juli F\u00e1bregas",
    "Martin Czehmes"
  ],
  "character": [
    "Richard",
    "Ray",
    "Marisa Benito",
    "Carlos",
    "Gabor"
  ],
  "site_data": "html Apps Forums Leaderboard Contribute API Support Discover Movies TV Shows Movies Popular Top Rated Upcoming Now Playing TV Shows Popular Top Rated On TV Airing Today People Popular People Can't find a movie or TV show? Login to create it. en Login Sign Up  ID: 71532   Expand PLANTA 25   (2006) User Score Overview We don't have an overview translated in English. Help us expand our database by adding one. Featured Crew Jos\u00e9 Luis Moreno Creator Discussions   Reviews Videos   Images   Changes Report Share Discussions General  0 Content Issues  0 Images Backdrops  0 Posters  1 Videos Trailers  0 Teasers  0 Clips  0 Featurettes  0 Opening Credits  0 Top Billed Cast Oscar Ed\u00fa Richard \u00c1lvaro Morte Ray M\u00f3nica Rom\u00e1n Marisa Benito Juli F\u00e1bregas Carlos Martin Czehmes Gabor Full Cast & Crew Last Season Season 1 2006 | 1 Episode Season 1 of PLANTA 25 premiered on November 29, 2006. View All Seasons Social Reviews  0 Discussions  0 Media Most Popular Videos  0 Backdrops  0 Posters  1 Recommendations We don't have enough data to suggest any TV shows based on PLANTA 25. You can help by rating TV shows you've seen. Facts Status  Cancelled Networks - Certification  - Type  Scripted Original Language  Spanish; Castilian Runtime  60m Homepage   Noviembre 2006 Genres Action & Adventure Crime Drama Family Keywords No keywords have been added. Content Score 71 Just a little bit more... Top Contributors 34 fentynueve  View Edit History Popularity Trend  Login to edit  URL By  signing up  for an account on TMDb, you can post directly to Twitter and Facebook. You need to be logged in to continue. Click  here  to login or  here  to sign up.    page_wrap opened in html_head  Join the Community The Basics About TMDb Contact Us Support Forums API Blog Get Involved  Contribution Bible 3rd Party Applications Add New Movie Add New TV Show Community Guidelines Leaderboard Forums Twitter Facebook Legal Terms of Use Privacy Policy Login Sign Up"
}