{
  "link": "https://www.themoviedb.org/tv/63264?language=en",
  "title": "Piratas",
  "resume": "We don't have an overview translated in English. Help us expand our database by adding one.",
  "rate": "60.0",
  "genre": [
    "Action",
    "Adventure"
  ],
  "cast": [
    "\u00d3scar Jaenada",
    "Pilar Rubio",
    "Silvia Abascal",
    "Aitor Mazo",
    "Miguel Ortiz"
  ],
  "character": [
    "\u00c1lvaro Mondego",
    "Carmen Bocanegra",
    "Blanca D\u00edaz de Andrade",
    "Capit\u00e1n Bocanegra",
    "Esteban Y\u00e1\u00f1ez de Oliveira"
  ],
  "site_data": "html Apps Forums Leaderboard Contribute API Support Discover Movies TV Shows Movies Popular Top Rated Upcoming Now Playing TV Shows Popular Top Rated On TV Airing Today People Popular People Can't find a movie or TV show? Login to create it. en Login Sign Up  ID: 63264   Expand Piratas   (2011) User Score Overview We don't have an overview translated in English. Help us expand our database by adding one. Featured Crew Carlos Portela Creator Discussions   Reviews Videos   Images   Changes Report Share Discussions General  0 Content Issues  0 Images Backdrops  2 Posters  1 Videos Trailers  0 Teasers  0 Clips  0 Featurettes  0 Opening Credits  0 Top Billed Cast \u00d3scar Jaenada \u00c1lvaro Mondego Pilar Rubio Carmen Bocanegra Silvia Abascal Blanca D\u00edaz de Andrade Aitor Mazo Capit\u00e1n Bocanegra Miguel Ortiz Esteban Y\u00e1\u00f1ez de Oliveira Full Cast & Crew Last Season Season 1 2011 | 8 Episodes Season 1 of Piratas premiered on May  9, 2011. View All Seasons Social Reviews  0 Discussions  0 Media Most Popular Videos  0 Backdrops  2 Posters  1 Recommendations We don't have enough data to suggest any TV shows based on Piratas. You can help by rating TV shows you've seen. Facts Status  Ended Network Certification  - Type  Scripted Original Language  Spanish; Castilian Runtime  90m Homepage   http://www.telecinco.es/piratas/ Genres Action & Adventure Keywords treasure treasure map pirate lost treasure pirate captain pirate ship Content Score 86 Almost there... Top Contributors 34 prm96 z 5 zurman1 3 rtentser s 3 speedycars  View Edit History Popularity Trend  Login to edit  URL By  signing up  for an account on TMDb, you can post directly to Twitter and Facebook. You need to be logged in to continue. Click  here  to login or  here  to sign up.    page_wrap opened in html_head  Join the Community The Basics About TMDb Contact Us Support Forums API Blog Get Involved  Contribution Bible 3rd Party Applications Add New Movie Add New TV Show Community Guidelines Leaderboard Forums Twitter Facebook Legal Terms of Use Privacy Policy Login Sign Up"
}