{
  "link": "https://www.themoviedb.org/tv/73472?language=en",
  "title": "The Magic School Bus Rides Again",
  "resume": "Ms. Frizzle's sister takes her class on a slew of wild science adventures in this update of the beloved animated show.",
  "rate": "70.0",
  "genre": [
    "Kids",
    "Animation"
  ],
  "cast": [
    "Kate McKinnon",
    "Miles Koseleci-Vieira",
    "Lynsey Pham"
  ],
  "character": [
    "Ms. Frizzle (voice)"
  ],
  "site_data": "html Apps Forums Leaderboard Contribute API Support Discover Movies TV Shows Movies Popular Top Rated Upcoming Now Playing TV Shows Popular Top Rated On TV Airing Today People Popular People Can't find a movie or TV show? Login to create it. en Login Sign Up  ID: 73472   Expand The Magic School Bus Rides Again   (2017) User Score  Play Trailer Overview Ms. Frizzle's sister takes her class on a slew of wild science adventures in this update of the beloved animated show. Discussions   Reviews Videos   Images   Changes Report Share Discussions General  0 Content Issues  0 Images Backdrops  2 Posters  4 Videos Trailers  1 Teasers  0 Clips  0 Featurettes  0 Opening Credits  0 Top Billed Cast Kate McKinnon Ms. Frizzle (voice) Miles Koseleci-Vieira Lynsey Pham Full Cast & Crew Current Season Season 2 2018 | 13 Episodes View All Seasons Social Reviews  0 Discussions  0 Media Most Popular Videos  1 Backdrops  2 Posters  4 Recommendations   2012-06-02 Care Bears: Welcome to Care-a-Lot 5.0    2003-03-11 Strawberry Shortcake 5.0  Facts Status  Returning Series Network Certification TV-Y Meaning This program is designed to be appropriate for all children. Type  Scripted Original Language  English Runtime  25m Homepage   https://www.netflix.com/title/80108373 Genres Kids Animation Keywords educational science Content Score 64 We're so close, yet so far. Top Contributors 31 Elizabeth Jennings m 15 mikisoft Y 8 YJ b 5 bcna15  View Edit History Popularity Trend  Login to edit  URL By  signing up  for an account on TMDb, you can post directly to Twitter and Facebook. You need to be logged in to continue. Click  here  to login or  here  to sign up.    page_wrap opened in html_head  Join the Community The Basics About TMDb Contact Us Support Forums API Blog Get Involved  Contribution Bible 3rd Party Applications Add New Movie Add New TV Show Community Guidelines Leaderboard Forums Twitter Facebook Legal Terms of Use Privacy Policy Login Sign Up"
}