{
  "link": "https://www.themoviedb.org/tv/79771?language=en",
  "title": "The Great American Read",
  "resume": "A journey through America that introduces our list of the 100 best-loved books and explores the many ways in which these novels affect, reflect and connect us all.",
  "rate": "",
  "genre": [
    "Documentary"
  ],
  "cast": {
    "actor": [
      "Meredith Vieira"
    ]
  },
  "characters": {
    "characters": [
      "Herself - Host"
    ]
  },
  "site_data": "html Apps Forums Leaderboard Contribute API Support Discover Movies TV Shows Movies Popular Top Rated Upcoming Now Playing TV Shows Popular Top Rated On TV Airing Today People Popular People Can't find a movie or TV show? Login to create it. en Login Sign Up  ID: 79771   Expand The Great American Read   (2018) User Score  Play Trailer Overview A journey through America that introduces our list of the 100 best-loved books and explores the many ways in which these novels affect, reflect and connect us all. Discussions   Reviews Videos   Images   Changes Report Share Discussions General  0 Content Issues  0 Images Backdrops  4 Posters  3 Videos Trailers  1 Teasers  1 Clips  0 Featurettes  1 Opening Credits  0 Top Billed Cast Meredith Vieira Herself - Host Full Cast & Crew Current Season Season 1 2018 | 0 Episodes Season 1 of The Great American Read premiered on May 22, 2018. View All Seasons Social Reviews  0 Discussions  0 Media Most Popular Videos  3 Backdrops  4 Posters  3 Recommendations We don't have enough data to suggest any TV shows based on The Great American Read. You can help by rating TV shows you've seen. Facts Status  Returning Series Network Certification TV-PG Meaning This program contains material that parents may find unsuitable for younger children. Type  Documentary Original Language  English Runtime  - Homepage   http://www.pbs.org/show/great-american-read/ Genres Documentary Keywords literature Content Score 64 We're so close, yet so far. Top Contributors 31 Elizabeth Jennings  View Edit History Popularity Trend  Login to edit  URL By  signing up  for an account on TMDb, you can post directly to Twitter and Facebook. You need to be logged in to continue. Click  here  to login or  here  to sign up.    page_wrap opened in html_head  Join the Community The Basics About TMDb Contact Us Support Forums API Blog Get Involved  Contribution Bible 3rd Party Applications Add New Movie Add New TV Show Community Guidelines Leaderboard Forums Twitter Facebook Legal Terms of Use Privacy Policy Login Sign Up"
}