{
  "link": "https://www.themoviedb.org/tv/67214?language=en",
  "title": "I delitti del BarLume",
  "resume": "We don't have an overview translated in English. Help us expand our database by adding one.",
  "rate": "0.0",
  "genre": [
    "Comedy"
  ],
  "cast": [
    "Filippo Timi",
    "Alessandro Benvenuti",
    "Enrica Guidi",
    "Lucia Mascino",
    "Massimo Paganelli"
  ],
  "character": [
    "Massimo Viviani",
    "Emo Bandinelli",
    "Tiziana Guazzelli",
    "Vittoria Fusco",
    "Aldo Griffa"
  ],
  "site_data": "html Apps Forums Leaderboard Contribute API Support Discover Movies TV Shows Movies Popular Top Rated Upcoming Now Playing TV Shows Popular Top Rated On TV Airing Today People Popular People Can't find a movie or TV show? Login to create it. en Login Sign Up  ID: 67214   Expand I delitti del BarLume   (2013) User Score Overview We don't have an overview translated in English. Help us expand our database by adding one. Featured Crew Marco Malvaldi Creator Discussions   Reviews Videos   Images   Changes Report Share Discussions General  0 Content Issues  0 Images Backdrops  4 Posters  4 Videos Trailers  0 Teasers  0 Clips  0 Featurettes  0 Opening Credits  0 Top Billed Cast Filippo Timi Massimo Viviani Alessandro Benvenuti Emo Bandinelli Enrica Guidi Tiziana Guazzelli Lucia Mascino Vittoria Fusco Massimo Paganelli Aldo Griffa Full Cast & Crew Current Season Season 5 2018 | 2 Episodes Season 5 of I delitti del BarLume premiered on January  8, 2018. View All Seasons Social Reviews  0 Discussions  0 Media Most Popular Videos  0 Backdrops  4 Posters  4 Recommendations We don't have enough data to suggest any TV shows based on I delitti del BarLume. You can help by rating TV shows you've seen. Facts Status  In Production Network Certification  - Type  Scripted Original Language  Italian Runtime  - Homepage   http://cinema.sky.it/cinema/news/i_delitti_del_barlume.html Genres Comedy Keywords No keywords have been added. Content Score 86 Almost there... Top Contributors F 56 Frigor 7 12 7bst TB 2 TMDb Bot m 1 magico77  View Edit History Popularity Trend  Login to edit  URL By  signing up  for an account on TMDb, you can post directly to Twitter and Facebook. You need to be logged in to continue. Click  here  to login or  here  to sign up.    page_wrap opened in html_head  Join the Community The Basics About TMDb Contact Us Support Forums API Blog Get Involved  Contribution Bible 3rd Party Applications Add New Movie Add New TV Show Community Guidelines Leaderboard Forums Twitter Facebook Legal Terms of Use Privacy Policy Login Sign Up"
}