{
  "link": "https://www.themoviedb.org/tv/9265?language=en",
  "title": "79 Park Avenue",
  "resume": "A poor New York teenager of the mid-1930 is forced into prostitution despite sincere efforts to make a living and ultimately becomes the city's most famous madam.",
  "rate": "0.0",
  "genre": [
    "Drama"
  ],
  "cast": [
    "Michael Constantine",
    "Lloyd Haynes",
    "Scott Jacoby",
    "Peter Marshall",
    "Alex Rocco"
  ],
  "character": [
    "Ben Savitch",
    "John Stevens",
    "Paulie Fludjicki",
    "Brian Whitfield",
    "Frank Millerson"
  ],
  "site_data": "html Apps Forums Leaderboard Contribute API Support Discover Movies TV Shows Movies Popular Top Rated Upcoming Now Playing TV Shows Popular Top Rated On TV Airing Today People Popular People Can't find a movie or TV show? Login to create it. en Login Sign Up  ID: 9265   Expand 79 Park Avenue   (1977) User Score Overview A poor New York teenager of the mid-1930 is forced into prostitution despite sincere efforts to make a living and ultimately becomes the city's most famous madam. Discussions   Reviews Videos   Images   Changes Report Share Discussions General  0 Content Issues  0 Images Backdrops  0 Posters  1 Videos Trailers  0 Teasers  0 Clips  0 Featurettes  0 Opening Credits  0 Top Billed Cast Michael Constantine Ben Savitch Lloyd Haynes John Stevens Scott Jacoby Paulie Fludjicki Peter Marshall Brian Whitfield Alex Rocco Frank Millerson Full Cast & Crew Last Season Season 1 1977 | 3 Episodes Season 1 of 79 Park Avenue premiered on October 15, 1977. View All Seasons Social Reviews  0 Discussions  0 Media Most Popular Videos  0 Backdrops  0 Posters  1 Recommendations We don't have enough data to suggest any TV shows based on 79 Park Avenue. You can help by rating TV shows you've seen. Facts Status  Ended Network Certification  - Type  Miniseries Original Language  English Runtime  360m Homepage  - Genres Drama Keywords based on novel or book miniseries Content Score 71 Just a little bit more... Top Contributors TB 13 TMDb Bot R 13 Rebecca 4 Banana  View Edit History Popularity Trend  Login to edit  URL By  signing up  for an account on TMDb, you can post directly to Twitter and Facebook. You need to be logged in to continue. Click  here  to login or  here  to sign up.    page_wrap opened in html_head  Join the Community The Basics About TMDb Contact Us Support Forums API Blog Get Involved  Contribution Bible 3rd Party Applications Add New Movie Add New TV Show Community Guidelines Leaderboard Forums Twitter Facebook Legal Terms of Use Privacy Policy Login Sign Up"
}