{
  "link": "https://www.themoviedb.org/tv/3308?language=en",
  "title": "George Lopez",
  "resume": "George Lopez is an American sitcom starring comedian George Lopez. The show originally aired on ABC from March 27, 2002, to May 8, 2007.",
  "rate": "",
  "genre": [
    "Comedy"
  ],
  "cast": {
    "actor": [
      "George Lopez",
      "Masiela Lusha",
      "Constance Marie",
      "Belita Moreno",
      "Luis Armand Garcia"
    ]
  },
  "characters": {
    "characters": [
      "George Lopez",
      "Carmen Lopez",
      "Angie Lopez",
      "Benny Lopez",
      "Max Lopez"
    ]
  },
  "site_data": "html Apps Forums Leaderboard Contribute API Support Discover Movies TV Shows Movies Popular Top Rated Upcoming Now Playing TV Shows Popular Top Rated On TV Airing Today People Popular People Can't find a movie or TV show? Login to create it. en Login Sign Up  ID: 3308   Expand George Lopez   (2002) User Score Overview George Lopez is an American sitcom starring comedian George Lopez. The show originally aired on ABC from March 27, 2002, to May 8, 2007. Featured Crew Bruce Helford Creator George Lopez Creator Discussions   Reviews Videos   Images   Changes Report Share Discussions General  4 Content Issues  0 Images Backdrops  1 Posters  1 Videos Trailers  0 Teasers  0 Clips  0 Featurettes  0 Opening Credits  1 Top Billed Cast George Lopez George Lopez Masiela Lusha Carmen Lopez Constance Marie Angie Lopez Belita Moreno Benny Lopez Luis Armand Garcia Max Lopez Full Cast & Crew Last Season Season 6 2007 | 18 Episodes Season 6 of George Lopez premiered on January 24, 2007. View All Seasons Social Reviews  0 Discussions  4 Subject Status Replies Last Reply w Carmen: Happy Birthday Masiela Lusha! Open 0 by wonder2wonder\n      \n     w Angie: Happy Birthday Constance Marie! Open 0 by wonder2wonder\n      \n     S Jason Open 0 by Strannger18\n      \n     Go to Discussions Media Most Popular Videos  1 Backdrops  1 Posters  1 Recommendations   1994-04-01 Sister, Sister 5.9    1982-09-27 Square Pegs 7.3    2004-09-18 Super Robot Monkey Team Hyperforce Go! 5.2    2001-01-12 Lizzie McGuire 5.6    2001-02-03 Lloyd in Space 4.8    2003-04-12 All Grown Up! 4.7    1993-09-06 Adventures of Sonic the Hedgehog 4.9    1988-11-14 Murphy Brown 6.5  Facts Status  Ended Network Certification  - Type  Scripted Original Language  English Runtime  30m, 22m Homepage   http://www.nickatnite.com/shows/george-lopez/ Genres Comedy Keywords los angeles family mexican american sitcom actor family of color Content Score 100 Yes! Looking good! Top Contributors 9 Banana R 4 Rebecca TS 4 Tony S. J 2 Jenn  View Edit History Popularity Trend  Login to edit  URL By  signing up  for an account on TMDb, you can post directly to Twitter and Facebook. You need to be logged in to continue. Click  here  to login or  here  to sign up.    page_wrap opened in html_head  Join the Community The Basics About TMDb Contact Us Support Forums API Blog Get Involved  Contribution Bible 3rd Party Applications Add New Movie Add New TV Show Community Guidelines Leaderboard Forums Twitter Facebook Legal Terms of Use Privacy Policy Login Sign Up"
}