{
  "link": "https://www.themoviedb.org/tv/9553?language=en",
  "title": "Life in the Freezer",
  "resume": "Sir David Attenborough looks at the natural history of the Antarctic continent",
  "rate": "",
  "genre": [
    "Documentary"
  ],
  "cast": {
    "actor": [
      "David Attenborough"
    ]
  },
  "characters": {
    "characters": [
      "Presenter/Narrator"
    ]
  },
  "site_data": "html Apps Forums Leaderboard Contribute API Support Discover Movies TV Shows Movies Popular Top Rated Upcoming Now Playing TV Shows Popular Top Rated On TV Airing Today People Popular People Can't find a movie or TV show? Login to create it. en Login Sign Up  ID: 9553   Expand Life in the Freezer   (1993) User Score Overview Sir David Attenborough looks at the natural history of the Antarctic continent Discussions   Reviews Videos   Images   Changes Report Share Discussions General  0 Content Issues  0 Images Backdrops  3 Posters  1 Videos Trailers  0 Teasers  0 Clips  0 Featurettes  0 Opening Credits  0 Top Billed Cast David Attenborough Presenter/Narrator Full Cast & Crew Last Season Miniseries 1993 | 6 Episodes Season 1 of Life in the Freezer premiered on November 17, 1993. View All Seasons Social Reviews  0 Discussions  0 Media Most Popular Videos  0 Backdrops  3 Posters  1 Recommendations   1990-10-04 The Trials of Life 9.5    1984-01-19 The Living Planet 9.1    2002-11-20 The Life of Mammals 9.1    1979-01-16 Life on Earth 9.5    1998-10-21 The Life of Birds 9.3    2004-10-03 Himalaya with Michael Palin 7.9    2008-02-04 Life in Cold Blood 9.0    2011-02-09 Madagascar 8.8  Facts Status  Ended Network Certification  - Type  Miniseries Original Language  English Runtime  60m, 30m Homepage   http://www.bbc.co.uk/programmes/b007v5n2 Genres Documentary Keywords ice penguin antarctica nature nature documentary Content Score 56 We're so close, yet so far. Top Contributors TB 7 TMDb Bot a 4 alexcel 3 rudely_murray 3 Banana  View Edit History Popularity Trend  Login to edit  URL By  signing up  for an account on TMDb, you can post directly to Twitter and Facebook. You need to be logged in to continue. Click  here  to login or  here  to sign up.    page_wrap opened in html_head  Join the Community The Basics About TMDb Contact Us Support Forums API Blog Get Involved  Contribution Bible 3rd Party Applications Add New Movie Add New TV Show Community Guidelines Leaderboard Forums Twitter Facebook Legal Terms of Use Privacy Policy Login Sign Up"
}