{
  "link": "https://www.themoviedb.org/tv/6554?language=en",
  "title": "Murder in Suburbia",
  "resume": "Murder in Suburbia was a British detective drama that ran for two series in 2004 and 2005.",
  "rate": "80.0",
  "genre": [
    "Drama"
  ],
  "cast": [
    "Caroline Catz",
    "Lisa Faulkner",
    "Jeremy Sheffield"
  ],
  "character": [
    "DS Emma Scribbins"
  ],
  "site_data": "html Apps Forums Leaderboard Contribute API Support Discover Movies TV Shows Movies Popular Top Rated Upcoming Now Playing TV Shows Popular Top Rated On TV Airing Today People Popular People Can't find a movie or TV show? Login to create it. en Login Sign Up  ID: 6554   Expand Murder in Suburbia   (2004) User Score Overview Murder in Suburbia was a British detective drama that ran for two series in 2004 and 2005. Discussions   Reviews Videos   Images   Changes Report Share Discussions General  0 Content Issues  0 Images Backdrops  2 Posters  2 Videos Trailers  0 Teasers  0 Clips  0 Featurettes  0 Opening Credits  0 Top Billed Cast Caroline Catz Lisa Faulkner DS Emma Scribbins Jeremy Sheffield Full Cast & Crew Last Season Season 2 2005 | 6 Episodes Season 2 of Murder in Suburbia premiered on May 28, 2005. View All Seasons Social Reviews  0 Discussions  0 Media Most Popular Videos  0 Backdrops  2 Posters  2 Recommendations We don't have enough data to suggest any TV shows based on Murder in Suburbia. You can help by rating TV shows you've seen. Facts Status  Ended Network Certification  - Type  Scripted Original Language  English Runtime  50m Homepage  - Genres Drama Keywords No keywords have been added. Content Score 56 We're so close, yet so far. Top Contributors 3 Zlogorek 2 Steve r 2 rick555 2 kcdh  View Edit History Popularity Trend  Login to edit  URL By  signing up  for an account on TMDb, you can post directly to Twitter and Facebook. You need to be logged in to continue. Click  here  to login or  here  to sign up.    page_wrap opened in html_head  Join the Community The Basics About TMDb Contact Us Support Forums API Blog Get Involved  Contribution Bible 3rd Party Applications Add New Movie Add New TV Show Community Guidelines Leaderboard Forums Twitter Facebook Legal Terms of Use Privacy Policy Login Sign Up"
}