{
  "link": "https://www.themoviedb.org/tv/28326?language=en",
  "title": "Ninja Nonsense",
  "resume": "The story of the friendship between Kaede, an ordinary schoolgirl, and Shinobu, an enthusiastic but incompetent trainee female ninja.",
  "rate": "",
  "genre": [
    "Animation"
  ],
  "cast": {
    "actor": [
      "Tomokazu Seki",
      "Shinji Kawada",
      "Nana Mizuki",
      "Rio Natsuki",
      "Daisuke Ono"
    ]
  },
  "characters": {
    "characters": [
      "Sasuke",
      "Ninja 1",
      "Shinobu",
      "Kaede's Mom",
      "Ninja 2"
    ]
  },
  "site_data": "html Apps Forums Leaderboard Contribute API Support Discover Movies TV Shows Movies Popular Top Rated Upcoming Now Playing TV Shows Popular Top Rated On TV Airing Today People Popular People Can't find a movie or TV show? Login to create it. en Login Sign Up  ID: 28326   Expand Ninja Nonsense User Score Overview The story of the friendship between Kaede, an ordinary schoolgirl, and Shinobu, an enthusiastic but incompetent trainee female ninja. Discussions   Reviews Videos   Images   Changes Report Share Discussions General  0 Content Issues  0 Images Backdrops  3 Posters  4 Videos Trailers  0 Teasers  0 Clips  0 Featurettes  0 Opening Credits  0 Top Billed Cast Tomokazu Seki Sasuke Shinji Kawada Ninja 1 Nana Mizuki Shinobu Rio Natsuki Kaede's Mom Daisuke Ono Ninja 2 Full Cast & Crew Last Season Season 1 2004 | 12 Episodes Season 1 of Ninja Nonsense premiered on July  8, 2004. View All Seasons Social Reviews  0 Discussions  0 Media Most Popular Videos  0 Backdrops  3 Posters  4 Facts Status  Ended Networks - Certification  - Type  Scripted Original Language  English Runtime  25m Homepage  - Genres Animation Keywords No keywords have been added. Content Score 79 Pump it up! We're close now. Top Contributors 2 Banana 2 Xenus  View Edit History Popularity Trend  Login to edit  URL By  signing up  for an account on TMDb, you can post directly to Twitter and Facebook. You need to be logged in to continue. Click  here  to login or  here  to sign up.    page_wrap opened in html_head  Join the Community The Basics About TMDb Contact Us Support Forums API Blog Get Involved  Contribution Bible 3rd Party Applications Add New Movie Add New TV Show Community Guidelines Leaderboard Forums Twitter Facebook Legal Terms of Use Privacy Policy Login Sign Up"
}