{
  "link": "https://www.themoviedb.org/tv/16468?language=en",
  "title": "When the Levees Broke: A Requiem in Four Acts",
  "resume": "Spike Lee's award-winning documentary follows the events that preceded and followed Hurricane Katrina's catastrophic passage through New Orleans in 2005.",
  "rate": "",
  "genre": [
    "Documentary"
  ],
  "cast": {
    "actor": [
      "Darleen Asevedo",
      "Jay Asevedo",
      "Jay Asevedo",
      "Harry Belafonte"
    ]
  },
  "characters": {
    "characters": [
      "Herself",
      "Himself",
      "Herself",
      "Himself"
    ]
  },
  "site_data": "html Apps Forums Leaderboard Contribute API Support Discover Movies TV Shows Movies Popular Top Rated Upcoming Now Playing TV Shows Popular Top Rated On TV Airing Today People Popular People Can't find a movie or TV show? Login to create it. en Login Sign Up  ID: 16468   Expand When the Levees Broke: A Requiem in Four Acts   (2006) User Score Overview Spike Lee's award-winning documentary follows the events that preceded and followed Hurricane Katrina's catastrophic passage through New Orleans in 2005. Discussions   Reviews Videos   Images   Changes Report Share Discussions General  0 Content Issues  0 Images Backdrops  2 Posters  3 Videos Trailers  0 Teasers  0 Clips  0 Featurettes  0 Opening Credits  0 Top Billed Cast Darleen Asevedo Herself Jay Asevedo Himself Jay Asevedo Herself Harry Belafonte Himself Full Cast & Crew Last Season Season 1 2006 | 4 Episodes Season 1 of When the Levees Broke: A Requiem in Four Acts premiered on August 21, 2006. View All Seasons Social Reviews  0 Discussions  0 Media Most Popular Videos  0 Backdrops  2 Posters  3 Recommendations   Go Ask Alice 6.0    Fail Safe 5.6    2011-05-23 All Watched Over by Machines of Loving Grace 8.3    2004-10-20 The Power of Nightmares 8.2    2002-03-17 The Century of the Self 8.2    2007-03-11 The Trap: What Happened to Our Dream of Freedom 0.0    12 Angry Men 7.4    2000-10-15 Curb Your Enthusiasm 8.1  Facts Status  Ended Network Certification  - Type  Miniseries Original Language  English Runtime  60m Homepage   http://hbo.com/documentaries/when-the-levees-broke-a-requiem-in-four-acts Genres Documentary Keywords new orleans miniseries hurricane katrina Content Score 86 Almost there... Top Contributors 23 Banana TB 10 TMDb Bot R 1 Rebecca  View Edit History Popularity Trend  Login to edit  URL By  signing up  for an account on TMDb, you can post directly to Twitter and Facebook. You need to be logged in to continue. Click  here  to login or  here  to sign up.    page_wrap opened in html_head  Join the Community The Basics About TMDb Contact Us Support Forums API Blog Get Involved  Contribution Bible 3rd Party Applications Add New Movie Add New TV Show Community Guidelines Leaderboard Forums Twitter Facebook Legal Terms of Use Privacy Policy Login Sign Up"
}