{
  "link": "https://www.themoviedb.org/tv/79926?language=en",
  "title": "\u05d9\u05e9 \u05dc\u05d4 \u05d0\u05ea \u05d6\u05d4",
  "resume": "We don't have an overview translated in English. Help us expand our database by adding one.",
  "rate": "",
  "genre": [
    "Drama",
    "Comedy"
  ],
  "cast": {
    "actor": [
      "Niv Sultan",
      "Magi Azarzar",
      "Oz Zehavi",
      "Aki Avni"
    ]
  },
  "characters": {
    "characters": [
      "Natalie Levy",
      "Shiraz",
      "Lior",
      "Refael"
    ]
  },
  "site_data": "html Apps Forums Leaderboard Contribute API Support Discover Movies TV Shows Movies Popular Top Rated Upcoming Now Playing TV Shows Popular Top Rated On TV Airing Today People Popular People Can't find a movie or TV show? Login to create it. en Login Sign Up  ID: 79926   Expand \u05d9\u05e9 \u05dc\u05d4 \u05d0\u05ea \u05d6\u05d4   (2018) User Score Overview We don't have an overview translated in English. Help us expand our database by adding one. Discussions   Reviews Videos   Images   Changes Report Share Discussions General  0 Content Issues  0 Images Backdrops  4 Posters  1 Videos Trailers  0 Teasers  0 Clips  0 Featurettes  0 Opening Credits  0 Top Billed Cast Niv Sultan Natalie Levy Magi Azarzar Shiraz Oz Zehavi Lior Aki Avni Refael Full Cast & Crew Current Season Season 1 2018 | 12 Episodes Season 1 of \u05d9\u05e9 \u05dc\u05d4 \u05d0\u05ea \u05d6\u05d4 premiered on February 27, 2018. View All Seasons Social Reviews  0 Discussions  0 Media Most Popular Videos  0 Backdrops  4 Posters  1 Recommendations We don't have enough data to suggest any TV shows based on \u05d9\u05e9 \u05dc\u05d4 \u05d0\u05ea \u05d6\u05d4. You can help by rating TV shows you've seen. Facts Status  Returning Series Network Certification  - Type  Scripted Original Language  Hebrew Runtime  40m Homepage   https://www.mako.co.il/mako-vod-keshet/she-is-got-it Genres Drama Comedy Keywords No keywords have been added. Content Score 79 Pump it up! We're close now. Top Contributors AK 30 Avshalom Kor  View Edit History Popularity Trend  Login to edit  URL By  signing up  for an account on TMDb, you can post directly to Twitter and Facebook. You need to be logged in to continue. Click  here  to login or  here  to sign up.    page_wrap opened in html_head  Join the Community The Basics About TMDb Contact Us Support Forums API Blog Get Involved  Contribution Bible 3rd Party Applications Add New Movie Add New TV Show Community Guidelines Leaderboard Forums Twitter Facebook Legal Terms of Use Privacy Policy Login Sign Up"
}