{
  "link": "https://www.themoviedb.org/tv/38785?language=en",
  "title": "Beyond Scared Straight",
  "resume": "Observing programs for troubled teens in which inmates reveal the realities of prison life in the hope of deterring them from a life of crime.",
  "rate": "87.0",
  "genre": [
    "Reality",
    "Documentary"
  ],
  "cast": [
    "E.B. White"
  ],
  "character": [
    "erony"
  ],
  "site_data": "html Apps Forums Leaderboard Contribute API Support Discover Movies TV Shows Movies Popular Top Rated Upcoming Now Playing TV Shows Popular Top Rated On TV Airing Today People Popular People Can't find a movie or TV show? Login to create it. en Login Sign Up  ID: 38785   Expand Beyond Scared Straight   (2011) User Score Overview Observing programs for troubled teens in which inmates reveal the realities of prison life in the hope of deterring them from a life of crime. Discussions   Reviews Videos   Images   Changes Report Share Discussions General  0 Content Issues  0 Images Backdrops  1 Posters  3 Videos Trailers  0 Teasers  0 Clips  0 Featurettes  0 Opening Credits  0 Top Billed Cast E.B. White erony Full Cast & Crew Last Season Season 9 2015 | 12 Episodes Season 9 of Beyond Scared Straight premiered on June 25, 2015. View All Seasons Social Reviews  0 Discussions  0 Media Most Popular Videos  0 Backdrops  1 Posters  3 Recommendations We don't have enough data to suggest any TV shows based on Beyond Scared Straight. You can help by rating TV shows you've seen. Facts Status  Returning Series Network Certification TV-PG Meaning This program contains material that parents may find unsuitable for younger children. Type  Reality Original Language  English Runtime  60m Homepage   http://www.aetv.com/beyond-scared-straight Genres Reality Documentary Keywords No keywords have been added. Content Score 56 We're so close, yet so far. Top Contributors 17 Elizabeth Jennings z 8 zurman1 TB 6 TMDb Bot ea 5 elizabeth aden  View Edit History Popularity Trend  Login to edit  URL By  signing up  for an account on TMDb, you can post directly to Twitter and Facebook. You need to be logged in to continue. Click  here  to login or  here  to sign up.    page_wrap opened in html_head  Join the Community The Basics About TMDb Contact Us Support Forums API Blog Get Involved  Contribution Bible 3rd Party Applications Add New Movie Add New TV Show Community Guidelines Leaderboard Forums Twitter Facebook Legal Terms of Use Privacy Policy Login Sign Up"
}