{
  "link": "https://www.themoviedb.org/tv/73620?language=en",
  "title": "Crash Course Film Production",
  "resume": "A 15 part series on how movies are (generally) made and who does what job and when.",
  "rate": "80.0",
  "genre": [
    "Documentary"
  ],
  "cast": [
    "Lily Gladstone"
  ],
  "character": [
    "Herself - Host"
  ],
  "site_data": "html Apps Forums Leaderboard Contribute API Support Discover Movies TV Shows Movies Popular Top Rated Upcoming Now Playing TV Shows Popular Top Rated On TV Airing Today People Popular People Can't find a movie or TV show? Login to create it. en Login Sign Up  ID: 73620   Expand Crash Course Film Production   (2017) User Score  Play Trailer Overview A 15 part series on how movies are (generally) made and who does what job and when. Discussions   Reviews Videos   Images   Changes Report Share Discussions General  0 Content Issues  0 Images Backdrops  1 Posters  2 Videos Trailers  1 Teasers  0 Clips  0 Featurettes  0 Opening Credits  0 Top Billed Cast Lily Gladstone Herself - Host Full Cast & Crew Last Season Season 1 2017 | 15 Episodes Season 1 of Crash Course Film Production premiered on August 24, 2017. View All Seasons Social Reviews  0 Discussions  0 Media Most Popular Videos  1 Backdrops  1 Posters  2 Recommendations We don't have enough data to suggest any TV shows based on Crash Course Film Production. You can help by rating TV shows you've seen. Facts Status  Ended Network Certification  - Type  Scripted Original Language  English Runtime  10m Homepage  - Genres Documentary Keywords film production Content Score 64 We're so close, yet so far. Top Contributors 41 Gabriel W. Almeida 8 Elizabeth Jennings  View Edit History Popularity Trend  Login to edit  URL By  signing up  for an account on TMDb, you can post directly to Twitter and Facebook. You need to be logged in to continue. Click  here  to login or  here  to sign up.    page_wrap opened in html_head  Join the Community The Basics About TMDb Contact Us Support Forums API Blog Get Involved  Contribution Bible 3rd Party Applications Add New Movie Add New TV Show Community Guidelines Leaderboard Forums Twitter Facebook Legal Terms of Use Privacy Policy Login Sign Up"
}