{
  "link": "https://www.themoviedb.org/tv/39278?language=en",
  "title": "The Playboy Club",
  "resume": "It's the early '60s, and the legendary Playboy Club in Chicago is the door to all your fantasies... and the key is the most sought-after status symbol of its time.",
  "rate": "54.0",
  "genre": [
    "Drama"
  ],
  "cast": [
    "Jenna Dewan",
    "Wes Ramsey",
    "David Krumholtz",
    "Amber Heard",
    "Naturi Naughton"
  ],
  "character": [
    "Maureen",
    "Brenda"
  ],
  "site_data": "html Apps Forums Leaderboard Contribute API Support Discover Movies TV Shows Movies Popular Top Rated Upcoming Now Playing TV Shows Popular Top Rated On TV Airing Today People Popular People Can't find a movie or TV show? Login to create it. en Login Sign Up  ID: 39278   Expand The Playboy Club   (2011) User Score Overview It's the early '60s, and the legendary Playboy Club in Chicago is the door to all your fantasies... and the key is the most sought-after status symbol of its time. Featured Crew Chad Hodge Creator Discussions   Reviews Videos   Images   Changes Report Share Discussions General  0 Content Issues  0 Images Backdrops  4 Posters  5 Videos Trailers  0 Teasers  0 Clips  0 Featurettes  0 Opening Credits  0 Top Billed Cast Jenna Dewan Wes Ramsey David Krumholtz Amber Heard Maureen Naturi Naughton Brenda Full Cast & Crew Last Season Season 1 2011 | 6 Episodes Season 1 of The Playboy Club premiered on September 19, 2011. View All Seasons Social Reviews  0 Discussions  0 Media Most Popular Videos  0 Backdrops  4 Posters  5 Recommendations   2013-04-19 Hemlock Grove 6.4    2015-04-17 The Messengers 6.1    2016-03-07 Damien 6.5    2009-11-03 V 6.2    2015-06-30 Scream 6.3  Facts Status  Ended Network Certification  - Type  Scripted Original Language  English Runtime  45m Homepage   http://www.nbc.com/the-playboy-club Genres Drama Keywords chicago playboy period drama sex worker 1960s Content Score 93 Almost there... Top Contributors 10 Atanas 9 Banana 4 Elizabeth Jennings w 3 webmaster  View Edit History Popularity Trend  Login to edit  URL By  signing up  for an account on TMDb, you can post directly to Twitter and Facebook. You need to be logged in to continue. Click  here  to login or  here  to sign up.    page_wrap opened in html_head  Join the Community The Basics About TMDb Contact Us Support Forums API Blog Get Involved  Contribution Bible 3rd Party Applications Add New Movie Add New TV Show Community Guidelines Leaderboard Forums Twitter Facebook Legal Terms of Use Privacy Policy Login Sign Up"
}