{
  "link": "https://www.themoviedb.org/tv/69512?language=en",
  "title": "Presten",
  "resume": "Comedy series about comedian Bjarte Tj\u00f8stheim, who after a near-death experience decides to quit the popular radio show Radioresepsjonen and start a new and more meaningful life as a priest.",
  "rate": "",
  "genre": [
    "Comedy"
  ],
  "cast": {
    "actor": [
      "Bjarte Tj\u00f8stheim",
      "Tone Beate Mostraum",
      "Marika Enstad",
      "Christian Skolmen"
    ]
  },
  "characters": {
    "characters": [
      "Himself",
      "Kristin",
      "Margit",
      "Konrad"
    ]
  },
  "site_data": "html Apps Forums Leaderboard Contribute API Support Discover Movies TV Shows Movies Popular Top Rated Upcoming Now Playing TV Shows Popular Top Rated On TV Airing Today People Popular People Can't find a movie or TV show? Login to create it. en Login Sign Up  ID: 69512   Expand Presten   (2017) User Score Overview Comedy series about comedian Bjarte Tj\u00f8stheim, who after a near-death experience decides to quit the popular radio show Radioresepsjonen and start a new and more meaningful life as a priest. Featured Crew Vidar Josdal Creator Bjarte Tj\u00f8stheim Creator Discussions   Reviews Videos   Images   Changes Report Share Discussions General  0 Content Issues  0 Images Backdrops  3 Posters  1 Videos Trailers  0 Teasers  0 Clips  0 Featurettes  0 Opening Credits  0 Top Billed Cast Bjarte Tj\u00f8stheim Himself Tone Beate Mostraum Kristin Marika Enstad Margit Christian Skolmen Konrad Full Cast & Crew Current Season Season 2 2018 | 6 Episodes Season 2 of Presten premiered on March  2, 2018. View All Seasons Social Reviews  0 Discussions  0 Media Most Popular Videos  0 Backdrops  3 Posters  1 Recommendations We don't have enough data to suggest any TV shows based on Presten. You can help by rating TV shows you've seen. Facts Status  Returning Series Network Certification  - Type  Scripted Original Language  Norwegian Runtime  30m Homepage   https://tv.nrk.no/serie/presten Genres Comedy Keywords mockumentary priest Content Score 93 Almost there... Top Contributors 38 Bendik M 8 Mr_Democracy 6 Elizabeth Jennings i 4 imsdal  View Edit History Popularity Trend  Login to edit  URL By  signing up  for an account on TMDb, you can post directly to Twitter and Facebook. You need to be logged in to continue. Click  here  to login or  here  to sign up.    page_wrap opened in html_head  Join the Community The Basics About TMDb Contact Us Support Forums API Blog Get Involved  Contribution Bible 3rd Party Applications Add New Movie Add New TV Show Community Guidelines Leaderboard Forums Twitter Facebook Legal Terms of Use Privacy Policy Login Sign Up"
}