{
  "link": "https://www.themoviedb.org/tv/74575?language=en",
  "title": "Hvor er Thea",
  "resume": "We don't have an overview translated in English. Help us expand our database by adding one.",
  "rate": "0.0",
  "genre": [
    "Drama",
    "Crime"
  ],
  "cast": [
    "Iben Akerlie",
    "Ingrid Unnur Gi\u00e6ver",
    "Martin Lepper\u00f8d"
  ],
  "character": [
    "Liv Berg-Anker",
    "Thea Vinger",
    "Guttorm"
  ],
  "site_data": "html Apps Forums Leaderboard Contribute API Support Discover Movies TV Shows Movies Popular Top Rated Upcoming Now Playing TV Shows Popular Top Rated On TV Airing Today People Popular People Can't find a movie or TV show? Login to create it. en Login Sign Up  ID: 74575   Expand Hvor er Thea   (2017) User Score Overview We don't have an overview translated in English. Help us expand our database by adding one. Featured Crew Christopher Pahle Creator J\u00f8rn Berge Larsen Creator Discussions   Reviews Videos   Images   Changes Report Share Discussions General  0 Content Issues  0 Images Backdrops  3 Posters  2 Videos Trailers  0 Teasers  0 Clips  0 Featurettes  0 Opening Credits  0 Top Billed Cast Iben Akerlie Liv Berg-Anker Ingrid Unnur Gi\u00e6ver Thea Vinger Martin Lepper\u00f8d Guttorm Full Cast & Crew Current Season Season 1 2017 | 10 Episodes Season 1 of Hvor er Thea premiered on October  5, 2017. View All Seasons Social Reviews  0 Discussions  0 Media Most Popular Videos  0 Backdrops  3 Posters  2 Recommendations We don't have enough data to suggest any TV shows based on Hvor er Thea. You can help by rating TV shows you've seen. Facts Status  Returning Series Network Certification TV-PG Meaning This program contains material that parents may find unsuitable for younger children. Type  Scripted Original Language  Norwegian Runtime  22m Homepage   http://www.hvorerthea.no Genres Drama Crime Keywords suspense Content Score 64 We're so close, yet so far. Top Contributors M 27 Mr_Democracy s 23 sorasq 6 lineker TB 4 TMDb Bot  View Edit History Popularity Trend  Login to edit  URL By  signing up  for an account on TMDb, you can post directly to Twitter and Facebook. You need to be logged in to continue. Click  here  to login or  here  to sign up.    page_wrap opened in html_head  Join the Community The Basics About TMDb Contact Us Support Forums API Blog Get Involved  Contribution Bible 3rd Party Applications Add New Movie Add New TV Show Community Guidelines Leaderboard Forums Twitter Facebook Legal Terms of Use Privacy Policy Login Sign Up"
}