{
  "link": "https://www.themoviedb.org/tv/69221?language=en",
  "title": "Sur-Vie",
  "resume": "We don't have an overview translated in English. Help us expand our database by adding one.",
  "rate": "",
  "genre": [
    "Drama"
  ],
  "cast": {
    "actor": [
      "Mariloup Wolfe",
      "S\u00e9bastien Huberdeau",
      "Luc Picard",
      "Monia Chokri",
      "Anne-Marie Cadieux"
    ]
  },
  "characters": {
    "characters": [
      "Fr\u00e9d\u00e9rique Boileau",
      "Maxime Richer",
      "Charles Gris\u00e9",
      "V\u00e9ronique Dufaux",
      "Danielle Desnoyers"
    ]
  },
  "site_data": "html Apps Forums Leaderboard Contribute API Support Discover Movies TV Shows Movies Popular Top Rated Upcoming Now Playing TV Shows Popular Top Rated On TV Airing Today People Popular People Can't find a movie or TV show? Login to create it. en Login Sign Up  ID: 69221   Expand Sur-Vie   (2017) User Score Overview We don't have an overview translated in English. Help us expand our database by adding one. Discussions   Reviews Videos   Images   Changes Report Share Discussions General  0 Content Issues  0 Images Backdrops  1 Posters  1 Videos Trailers  0 Teasers  0 Clips  0 Featurettes  0 Opening Credits  0 Top Billed Cast Mariloup Wolfe Fr\u00e9d\u00e9rique Boileau S\u00e9bastien Huberdeau Maxime Richer Luc Picard Charles Gris\u00e9 Monia Chokri V\u00e9ronique Dufaux Anne-Marie Cadieux Danielle Desnoyers Full Cast & Crew Last Season Season 1 2017 | 6 Episodes Season 1 of Sur-Vie premiered on April  6, 2017. View All Seasons Social Reviews  0 Discussions  0 Media Most Popular Videos  0 Backdrops  1 Posters  1 Recommendations We don't have enough data to suggest any TV shows based on Sur-Vie. You can help by rating TV shows you've seen. Facts Status  Ended Network Certification 14+ Meaning Programming intended for viewers ages 14 and older. May contain strong violence and strong profanity, and depictions of sexual activity as long as they are within the context of a story. Type  Scripted Original Language  French Runtime  60m Homepage   http://survie.seriesplus.com Genres Drama Keywords television Content Score 79 Pump it up! We're close now. Top Contributors 44 Banana j 7 jondalar 4 Elizabeth Jennings 2 kingkong25  View Edit History Popularity Trend  Login to edit  URL By  signing up  for an account on TMDb, you can post directly to Twitter and Facebook. You need to be logged in to continue. Click  here  to login or  here  to sign up.    page_wrap opened in html_head  Join the Community The Basics About TMDb Contact Us Support Forums API Blog Get Involved  Contribution Bible 3rd Party Applications Add New Movie Add New TV Show Community Guidelines Leaderboard Forums Twitter Facebook Legal Terms of Use Privacy Policy Login Sign Up"
}