{
  "link": "https://www.themoviedb.org/tv/73777?language=en",
  "title": "Mar\u00eda de Todos los \u00c1ngeles",
  "resume": "We don't have an overview translated in English. Help us expand our database by adding one.",
  "rate": "0.0",
  "genre": [
    "Drama",
    "Comedy",
    "Family"
  ],
  "cast": [
    "Ariel Miramontes",
    "Alma Cero",
    "Evelio Arias",
    "Beng Zeng",
    "Mara Escalante"
  ],
  "character": [
    "Albertano",
    "Rosa Aurora",
    "Delfino",
    "El Chino",
    "Mar\u00eda de todos los \u00c1ngeles"
  ],
  "site_data": "html Apps Forums Leaderboard Contribute API Support Discover Movies TV Shows Movies Popular Top Rated Upcoming Now Playing TV Shows Popular Top Rated On TV Airing Today People Popular People Can't find a movie or TV show? Login to create it. en Login Sign Up  ID: 73777   Expand Mar\u00eda de Todos los \u00c1ngeles   (2009) User Score Overview We don't have an overview translated in English. Help us expand our database by adding one. Featured Crew Mara Escalante Creator Discussions   Reviews Videos   Images   Changes Report Share Discussions General  0 Content Issues  0 Images Backdrops  1 Posters  1 Videos Trailers  0 Teasers  0 Clips  0 Featurettes  0 Opening Credits  0 Top Billed Cast Ariel Miramontes Albertano Alma Cero Rosa Aurora Evelio Arias Delfino Beng Zeng El Chino Mara Escalante Mar\u00eda de todos los \u00c1ngeles Full Cast & Crew Last Season Season 2 2013 | 20 Episodes Season 2 of Mar\u00eda de Todos los \u00c1ngeles premiered on November 24, 2013. View All Seasons Social Reviews  0 Discussions  0 Media Most Popular Videos  0 Backdrops  1 Posters  1 Recommendations We don't have enough data to suggest any TV shows based on Mar\u00eda de Todos los \u00c1ngeles. You can help by rating TV shows you've seen. Facts Status  Returning Series Network Certification TV-PG Meaning This program contains material that parents may find unsuitable for younger children. Type  Scripted Original Language  Spanish; Castilian Runtime  22m Homepage   http://www.televisa.com/programas-tv/maria-de-todos-los-angeles/ Genres Drama Comedy Family Keywords No keywords have been added. Content Score 93 Almost there... Top Contributors J 42 Javier TB 1 TMDb Bot  View Edit History Popularity Trend  Login to edit  URL By  signing up  for an account on TMDb, you can post directly to Twitter and Facebook. You need to be logged in to continue. Click  here  to login or  here  to sign up.    page_wrap opened in html_head  Join the Community The Basics About TMDb Contact Us Support Forums API Blog Get Involved  Contribution Bible 3rd Party Applications Add New Movie Add New TV Show Community Guidelines Leaderboard Forums Twitter Facebook Legal Terms of Use Privacy Policy Login Sign Up"
}