{
  "link": "https://www.themoviedb.org/tv/67352?language=en",
  "title": "Million Dollar Extreme Presents: World Peace",
  "resume": "A super pure tragicomedy rosary of pious prayers bringing unity, joy, and excellent living to all.",
  "rate": "",
  "genre": [
    "Comedy"
  ],
  "cast": {
    "actor": [
      "Sam Hyde",
      "Charls Carrol",
      "Nick Rochefort",
      "Eric Hayden"
    ]
  },
  "characters": {
    "characters": [
      "Sam",
      "Charls",
      "Nick",
      "Eric"
    ]
  },
  "site_data": "html Apps Forums Leaderboard Contribute API Support Discover Movies TV Shows Movies Popular Top Rated Upcoming Now Playing TV Shows Popular Top Rated On TV Airing Today People Popular People Can't find a movie or TV show? Login to create it. en Login Sign Up  ID: 67352   Expand Million Dollar Extreme Presents: World Peace   (2016) User Score Overview A super pure tragicomedy rosary of pious prayers bringing unity, joy, and excellent living to all. Discussions   Reviews Videos   Images   Changes Report Share Discussions General  0 Content Issues  0 Images Backdrops  0 Posters  1 Videos Trailers  0 Teasers  1 Clips  0 Featurettes  0 Opening Credits  0 Top Billed Cast Sam Hyde Sam Charls Carrol Charls Nick Rochefort Nick Eric Hayden Eric Full Cast & Crew Last Season Season 1 2016 | 6 Episodes Season 1 of Million Dollar Extreme Presents: World Peace premiered on August  5, 2016. View All Seasons Social Reviews  0 Discussions  0 Media Most Popular Videos  1 Backdrops  0 Posters  1 Recommendations   2017-04-21 Bill Nye Saves the World 2.4    2016-09-22 Pitch 5.1    2003-09-19 Peep Show 8.2    2005-10-17 The Colbert Report 7.0    2005-08-04 It's Always Sunny in Philadelphia 8.2    2010-06-29 Louie 7.7    2014-06-01 Halt and Catch Fire 7.7    2013-11-17 Almost Human 7.0  Facts Status  Ended Network Certification TV-MA Meaning This program is specifically designed to be viewed by adults and therefore may be unsuitable for children under 17 Type  Scripted Original Language  English Runtime  11m, 15m Homepage   http://www.adultswim.com/videos/million-dollar-extreme-presents-world-peace Genres Comedy Keywords surreal satire absurdist abstract Content Score 79 Pump it up! We're close now. Top Contributors 22 HomegrownHero m 14 moviedbmailinator m 10 mikeleighisanokdirector 5 Elizabeth Jennings  View Edit History Popularity Trend  Login to edit  URL By  signing up  for an account on TMDb, you can post directly to Twitter and Facebook. You need to be logged in to continue. Click  here  to login or  here  to sign up.    page_wrap opened in html_head  Join the Community The Basics About TMDb Contact Us Support Forums API Blog Get Involved  Contribution Bible 3rd Party Applications Add New Movie Add New TV Show Community Guidelines Leaderboard Forums Twitter Facebook Legal Terms of Use Privacy Policy Login Sign Up"
}