{
  "link": "https://www.themoviedb.org/tv/24686?language=en",
  "title": "Snagglepuss",
  "resume": "We don't have an overview translated in English. Help us expand our database by adding one.",
  "rate": "",
  "genre": [
    "Kids",
    "Animation",
    "Comedy"
  ],
  "cast": {
    "actor": [
      "Don Messick",
      "Daws Butler"
    ]
  },
  "characters": {
    "characters": [
      "Major",
      "Le\u00e3o da Montanha"
    ]
  },
  "site_data": "html Apps Forums Leaderboard Contribute API Support Discover Movies TV Shows Movies Popular Top Rated Upcoming Now Playing TV Shows Popular Top Rated On TV Airing Today People Popular People Can't find a movie or TV show? Login to create it. en Login Sign Up  ID: 24686   Expand Snagglepuss   (1961) User Score Overview We don't have an overview translated in English. Help us expand our database by adding one. Featured Crew William Hanna Creator Joseph Barbera Creator Discussions   Reviews Videos   Images   Changes Report Share Discussions General  0 Content Issues  0 Images Backdrops  1 Posters  4 Videos Trailers  0 Teasers  0 Clips  0 Featurettes  0 Opening Credits  0 Top Billed Cast Don Messick Major Daws Butler Le\u00e3o da Montanha Full Cast & Crew Last Season Season 2 1961 | 14 Episodes Season 2 of Snagglepuss premiered on October 14, 1961. View All Seasons Social Reviews  0 Discussions  0 Media Most Popular Videos  0 Backdrops  1 Posters  4 Recommendations We don't have enough data to suggest any TV shows based on Snagglepuss. You can help by rating TV shows you've seen. Facts Status  Ended Networks Broadcast Syndication Certification TV-Y Meaning This program is designed to be appropriate for all children. Type  Scripted Original Language  English Runtime  7m Homepage  - Genres Kids Animation Comedy Keywords No keywords have been added. Content Score 56 We're so close, yet so far. Top Contributors 19 Robson Guedes Vieira R 8 Rebecca TB 7 TMDb Bot 5 minhus  View Edit History Popularity Trend  Login to edit  URL By  signing up  for an account on TMDb, you can post directly to Twitter and Facebook. You need to be logged in to continue. Click  here  to login or  here  to sign up.    page_wrap opened in html_head  Join the Community The Basics About TMDb Contact Us Support Forums API Blog Get Involved  Contribution Bible 3rd Party Applications Add New Movie Add New TV Show Community Guidelines Leaderboard Forums Twitter Facebook Legal Terms of Use Privacy Policy Login Sign Up"
}