{
  "link": "https://www.themoviedb.org/tv/28288?language=en",
  "title": "Big, Bigger, Biggest",
  "resume": "Big, Bigger, Biggest is a British documentary television series which began airing in 2008. A total 20 episodes have been produced across 3 seasons.",
  "rate": "80.0",
  "genre": [
    "Documentary"
  ],
  "cast": [
    "John Michie"
  ],
  "character": [
    "Narrator"
  ],
  "site_data": "html Apps Forums Leaderboard Contribute API Support Discover Movies TV Shows Movies Popular Top Rated Upcoming Now Playing TV Shows Popular Top Rated On TV Airing Today People Popular People Can't find a movie or TV show? Login to create it. en Login Sign Up  ID: 28288   Expand Big, Bigger, Biggest   (2008) User Score Overview Big, Bigger, Biggest is a British documentary television series which began airing in 2008. A total 20 episodes have been produced across 3 seasons. Discussions   Reviews Videos   Images   Changes Report Share Discussions General  0 Content Issues  0 Images Backdrops  4 Posters  2 Videos Trailers  0 Teasers  0 Clips  0 Featurettes  0 Opening Credits  0 Top Billed Cast John Michie Narrator Full Cast & Crew Last Season Season 3 2011 | 6 Episodes Season 3 of Big, Bigger, Biggest premiered on July  5, 2011. View All Seasons Social Reviews  0 Discussions  0 Media Most Popular Videos  0 Backdrops  4 Posters  2 Recommendations We don't have enough data to suggest any TV shows based on Big, Bigger, Biggest. You can help by rating TV shows you've seen. Facts Status  Ended Network Certification L Meaning Content is suitable for all audiences. Type  Documentary Original Language  English Runtime  45m Homepage   http://natgeotv.com.au/tv/big-bigger-biggest Genres Documentary Keywords No keywords have been added. Content Score 56 We're so close, yet so far. Top Contributors PA 30 Paulo Almeida 9 roger86 6 Aty a 2 asura766  View Edit History Popularity Trend  Login to edit  URL By  signing up  for an account on TMDb, you can post directly to Twitter and Facebook. You need to be logged in to continue. Click  here  to login or  here  to sign up.    page_wrap opened in html_head  Join the Community The Basics About TMDb Contact Us Support Forums API Blog Get Involved  Contribution Bible 3rd Party Applications Add New Movie Add New TV Show Community Guidelines Leaderboard Forums Twitter Facebook Legal Terms of Use Privacy Policy Login Sign Up"
}