{
  "link": "https://www.themoviedb.org/tv/10756?language=en",
  "title": "A Year in the Life",
  "resume": "Following the success of the miniseries, NBC launched a drama series the following the Gardner family.",
  "rate": "",
  "genre": [
    "Drama"
  ],
  "cast": {
    "actor": [
      "Richard Kiley",
      "Trey Ames",
      "Adam Arkin",
      "Jayne Atkinson",
      "David Oliver"
    ]
  },
  "characters": {
    "characters": [
      "Joe Gardner",
      "David Sisk",
      "Jim Eisenberg",
      "Lindley Gardner Eisenberg",
      "Sam Gardner"
    ]
  },
  "site_data": "html Apps Forums Leaderboard Contribute API Support Discover Movies TV Shows Movies Popular Top Rated Upcoming Now Playing TV Shows Popular Top Rated On TV Airing Today People Popular People Can't find a movie or TV show? Login to create it. en Login Sign Up  ID: 10756   Expand A Year in the Life   (1987) User Score Overview Following the success of the miniseries, NBC launched a drama series the following the Gardner family. Featured Crew Joshua Brand Creator John Falsey Creator Discussions   Reviews Videos   Images   Changes Report Share Discussions General  0 Content Issues  0 Images Backdrops  0 Posters  1 Videos Trailers  0 Teasers  0 Clips  0 Featurettes  0 Opening Credits  0 Top Billed Cast Richard Kiley Joe Gardner Trey Ames David Sisk Adam Arkin Jim Eisenberg Jayne Atkinson Lindley Gardner Eisenberg David Oliver Sam Gardner Full Cast & Crew Last Season Season 1 1987 | 22 Episodes Season 1 of A Year in the Life premiered on September 16, 1987. View All Seasons Social Reviews  0 Discussions  0 Media Most Popular Videos  0 Backdrops  0 Posters  1 Recommendations We don't have enough data to suggest any TV shows based on A Year in the Life. You can help by rating TV shows you've seen. Facts Status  Ended Network Certification NR Meaning No rating information Type  Scripted Original Language  English Runtime  60m Homepage  - Genres Drama Keywords wife husband relationship sibling relationship parent child relationship family Content Score 79 Pump it up! We're close now. Top Contributors 17 joel6 15 Banana 1 zevi R 1 Rebecca  View Edit History Popularity Trend  Login to edit  URL By  signing up  for an account on TMDb, you can post directly to Twitter and Facebook. You need to be logged in to continue. Click  here  to login or  here  to sign up.    page_wrap opened in html_head  Join the Community The Basics About TMDb Contact Us Support Forums API Blog Get Involved  Contribution Bible 3rd Party Applications Add New Movie Add New TV Show Community Guidelines Leaderboard Forums Twitter Facebook Legal Terms of Use Privacy Policy Login Sign Up"
}