{
  "link": "https://www.themoviedb.org/tv/6595?language=en",
  "title": "Sparkhouse",
  "resume": "The relationship between childhood sweethearts, a farmer's daughter and boy from a rich family, turns tumultuous in this modern interpretation of Wuthering Heights.",
  "rate": "",
  "genre": [
    "Drama"
  ],
  "cast": {
    "actor": [
      "Joseph McFadden",
      "Richard Armitage",
      "Alun Armstrong",
      "Sarah Smart",
      "Celia Imrie"
    ]
  },
  "characters": {
    "characters": [
      "Andrew Lawton",
      "John Standring",
      "Richard Bolton",
      "Carol Bolton",
      "Kate Lawton"
    ]
  },
  "site_data": "html Apps Forums Leaderboard Contribute API Support Discover Movies TV Shows Movies Popular Top Rated Upcoming Now Playing TV Shows Popular Top Rated On TV Airing Today People Popular People Can't find a movie or TV show? Login to create it. en Login Sign Up  ID: 6595   Expand Sparkhouse   (2002) User Score Overview The relationship between childhood sweethearts, a farmer's daughter and boy from a rich family, turns tumultuous in this modern interpretation of Wuthering Heights. Featured Crew Sally Wainwright Creator Discussions   Reviews Videos   Images   Changes Report Share Discussions General  0 Content Issues  0 Images Backdrops  2 Posters  3 Videos Trailers  0 Teasers  0 Clips  0 Featurettes  0 Opening Credits  0 Top Billed Cast Joseph McFadden Andrew Lawton Richard Armitage John Standring Alun Armstrong Richard Bolton Sarah Smart Carol Bolton Celia Imrie Kate Lawton Full Cast & Crew Last Season Season 1 2002 | 3 Episodes Season 1 of Sparkhouse premiered on September  1, 2002. View All Seasons Social Reviews  0 Discussions  0 Media Most Popular Videos  0 Backdrops  2 Posters  3 Recommendations We don't have enough data to suggest any TV shows based on Sparkhouse. You can help by rating TV shows you've seen. Facts Status  Ended Network Certification  - Type  Miniseries Original Language  English Runtime  60m Homepage  - Genres Drama Keywords farm based on novel or book miniseries woman director abuse Content Score 93 Almost there... Top Contributors TB 21 TMDb Bot F 19 Fiona R 6 Rebecca 6 Banana  View Edit History Popularity Trend  Login to edit  URL By  signing up  for an account on TMDb, you can post directly to Twitter and Facebook. You need to be logged in to continue. Click  here  to login or  here  to sign up.    page_wrap opened in html_head  Join the Community The Basics About TMDb Contact Us Support Forums API Blog Get Involved  Contribution Bible 3rd Party Applications Add New Movie Add New TV Show Community Guidelines Leaderboard Forums Twitter Facebook Legal Terms of Use Privacy Policy Login Sign Up"
}