{
  "link": "https://www.themoviedb.org/tv/16690?language=en",
  "title": "Mi Destino Eres T\u00fa",
  "resume": "Mi destino eres t\u00fa is a 2000 Mexican telenovela. It is a production of Carla Estrada and the protagonists were Lucero and Jorge Salinas.",
  "rate": "",
  "genre": [
    "Drama"
  ],
  "cast": {
    "actor": [
      "Lucero",
      "Jorge Salinas",
      "Jaime Camil",
      "Susana Zabaleta",
      "Julio Alem\u00e1n"
    ]
  },
  "characters": {
    "characters": [
      "Andrea San Vicente",
      "Eduardo Rivadeneira Del Encino",
      "Mauricio Rodr\u00edguez Calder\u00f3n",
      "Emma Pimentel de Rivadeneira",
      "Augusto Rodr\u00edguez Franco"
    ]
  },
  "site_data": "html Apps Forums Leaderboard Contribute API Support Discover Movies TV Shows Movies Popular Top Rated Upcoming Now Playing TV Shows Popular Top Rated On TV Airing Today People Popular People Can't find a movie or TV show? Login to create it. en Login Sign Up  ID: 16690   Expand Mi Destino Eres T\u00fa   (2000) User Score Overview Mi destino eres t\u00fa is a 2000 Mexican telenovela. It is a production of Carla Estrada and the protagonists were Lucero and Jorge Salinas. Featured Crew Jorge Lozano Soriano Creator Carmen Daniels Creator Discussions   Reviews Videos   Images   Changes Report Share Discussions General  0 Content Issues  0 Images Backdrops  0 Posters  1 Videos Trailers  0 Teasers  0 Clips  0 Featurettes  0 Opening Credits  0 Top Billed Cast Lucero Andrea San Vicente Jorge Salinas Eduardo Rivadeneira Del Encino Jaime Camil Mauricio Rodr\u00edguez Calder\u00f3n Susana Zabaleta Emma Pimentel de Rivadeneira Julio Alem\u00e1n Augusto Rodr\u00edguez Franco Full Cast & Crew Last Season Season 1 2000 | 1 Episode View All Seasons Social Reviews  0 Discussions  0 Media Most Popular Videos  0 Backdrops  0 Posters  1 Recommendations We don't have enough data to suggest any TV shows based on Mi Destino Eres T\u00fa. You can help by rating TV shows you've seen. Facts Status  Ended Network Certification  - Type  Scripted Original Language  English Runtime  60m, 45m Homepage  - Genres Drama Keywords No keywords have been added. Content Score 79 Pump it up! We're close now. Top Contributors s 13 shiff7  View Edit History Popularity Trend  Login to edit  URL By  signing up  for an account on TMDb, you can post directly to Twitter and Facebook. You need to be logged in to continue. Click  here  to login or  here  to sign up.    page_wrap opened in html_head  Join the Community The Basics About TMDb Contact Us Support Forums API Blog Get Involved  Contribution Bible 3rd Party Applications Add New Movie Add New TV Show Community Guidelines Leaderboard Forums Twitter Facebook Legal Terms of Use Privacy Policy Login Sign Up"
}