{
  "link": "https://www.themoviedb.org/tv/6305?language=en",
  "title": "Bleak House",
  "resume": "Bleak House is BBC television drama first broadcast in 1985. The serial was adapted by Arthur Hopcraft from Charles Dickens' novel Bleak House and it was the second adaptation by the BBC.",
  "rate": "73.0",
  "genre": [
    "Drama"
  ],
  "cast": [
    "Peter Vaughan",
    "Philip Franks",
    "Diana Rigg",
    "Denholm Elliott",
    "T. P. McKenna"
  ],
  "character": [
    "Tulkinghorn",
    "Lady Honoria Dedlock",
    "John Jarndyce"
  ],
  "site_data": "html Apps Forums Leaderboard Contribute API Support Discover Movies TV Shows Movies Popular Top Rated Upcoming Now Playing TV Shows Popular Top Rated On TV Airing Today People Popular People Can't find a movie or TV show? Login to create it. en Login Sign Up  ID: 6305   Expand Bleak House   (1985) User Score Overview Bleak House is BBC television drama first broadcast in 1985. The serial was adapted by Arthur Hopcraft from Charles Dickens' novel Bleak House and it was the second adaptation by the BBC. Discussions   Reviews Videos   Images   Changes Report Share Discussions General  0 Content Issues  0 Images Backdrops  2 Posters  2 Videos Trailers  0 Teasers  0 Clips  0 Featurettes  0 Opening Credits  0 Top Billed Cast Peter Vaughan Tulkinghorn Philip Franks Diana Rigg Lady Honoria Dedlock Denholm Elliott John Jarndyce T. P. McKenna Full Cast & Crew Last Season Miniseries 1985 | 8 Episodes Season 1 of Bleak House premiered on April 10, 1985. View All Seasons Social Reviews  0 Discussions  0 Media Most Popular Videos  0 Backdrops  2 Posters  2 Recommendations We don't have enough data to suggest any TV shows based on Bleak House. You can help by rating TV shows you've seen. Facts Status  Ended Network Certification  - Type  Miniseries Original Language  English Runtime  60m, 52m Homepage  - Genres Drama Keywords based on novel or book classic miniseries poverty period drama charles dickens grime Content Score 86 Almost there... Top Contributors TB 19 TMDb Bot R 17 Rebecca  View Edit History Popularity Trend  Login to edit  URL By  signing up  for an account on TMDb, you can post directly to Twitter and Facebook. You need to be logged in to continue. Click  here  to login or  here  to sign up.    page_wrap opened in html_head  Join the Community The Basics About TMDb Contact Us Support Forums API Blog Get Involved  Contribution Bible 3rd Party Applications Add New Movie Add New TV Show Community Guidelines Leaderboard Forums Twitter Facebook Legal Terms of Use Privacy Policy Login Sign Up"
}