{
  "link": "https://www.themoviedb.org/tv/62608?language=en",
  "title": "A Segunda Vez",
  "resume": "We don't have an overview translated in English. Help us expand our database by adding one.",
  "rate": "",
  "genre": [
    "Drama"
  ],
  "cast": {
    "actor": [
      "Marcos Palmeira",
      "Priscila Sol",
      "Nath\u00e1lia Rodrigues",
      "Let\u00edcia Persiles",
      "Fabr\u00edcio Belsoff"
    ]
  },
  "characters": {
    "characters": [
      "Raul",
      "Ariela",
      "Fabi",
      "Carla",
      "Luiz M\u00e1rio"
    ]
  },
  "site_data": "html Apps Forums Leaderboard Contribute API Support Discover Movies TV Shows Movies Popular Top Rated Upcoming Now Playing TV Shows Popular Top Rated On TV Airing Today People Popular People Can't find a movie or TV show? Login to create it. en Login Sign Up  ID: 62608   Expand A Segunda Vez   (2014) User Score Overview We don't have an overview translated in English. Help us expand our database by adding one. Featured Crew Marcelo Rubens Paiva Creator Discussions   Reviews Videos   Images   Changes Report Share Discussions General  0 Content Issues  0 Images Backdrops  2 Posters  1 Videos Trailers  0 Teasers  0 Clips  0 Featurettes  0 Opening Credits  0 Top Billed Cast Marcos Palmeira Raul Priscila Sol Ariela Nath\u00e1lia Rodrigues Fabi Let\u00edcia Persiles Carla Fabr\u00edcio Belsoff Luiz M\u00e1rio Full Cast & Crew Last Season Season 1 2014 | 15 Episodes Season 1 of A Segunda Vez premiered on August 11, 2014. View All Seasons Social Reviews  0 Discussions  0 Media Most Popular Videos  0 Backdrops  2 Posters  1 Recommendations We don't have enough data to suggest any TV shows based on A Segunda Vez. You can help by rating TV shows you've seen. Facts Status  Returning Series Network Certification 16 Meaning Content suitable for viewers over the age of 16. Type  Scripted Original Language  Portuguese Runtime  25m Homepage   http://multishow.globo.com/programas/a-segunda-vez/ Genres Drama Keywords No keywords have been added. Content Score 86 Almost there... Top Contributors 44 raphabarreiros CM 4 Cherche Moi  View Edit History Popularity Trend  Login to edit  URL By  signing up  for an account on TMDb, you can post directly to Twitter and Facebook. You need to be logged in to continue. Click  here  to login or  here  to sign up.    page_wrap opened in html_head  Join the Community The Basics About TMDb Contact Us Support Forums API Blog Get Involved  Contribution Bible 3rd Party Applications Add New Movie Add New TV Show Community Guidelines Leaderboard Forums Twitter Facebook Legal Terms of Use Privacy Policy Login Sign Up"
}