{
  "link": "https://www.themoviedb.org/tv/65977?language=en",
  "title": "Netflix Presents: The Characters",
  "resume": "No rules. No expectations. A half hour to make their mark. Eight different comedians each get an episode to show their skills in comedy.",
  "rate": "54.0",
  "genre": [
    "Comedy"
  ],
  "cast": [
    "John Early",
    "Lauren Lapkus",
    "Kate Berlant",
    "Tim Robinson",
    "Henry Zebrowski"
  ],
  "character": [
    "Himself",
    "Herself",
    "Herself",
    "Himself",
    "Himself"
  ],
  "site_data": "html Apps Forums Leaderboard Contribute API Support Discover Movies TV Shows Movies Popular Top Rated Upcoming Now Playing TV Shows Popular Top Rated On TV Airing Today People Popular People Can't find a movie or TV show? Login to create it. en Login Sign Up  ID: 65977   Expand Netflix Presents: The Characters   (2016) User Score  Play Trailer Overview No rules. No expectations. A half hour to make their mark. Eight different comedians each get an episode to show their skills in comedy. Discussions   Reviews Videos   Images   Changes Report Share Discussions General  0 Content Issues  0 Images Backdrops  1 Posters  1 Videos Trailers  1 Teasers  0 Clips  0 Featurettes  0 Opening Credits  0 Top Billed Cast John Early Himself Lauren Lapkus Herself Kate Berlant Herself Tim Robinson Himself Henry Zebrowski Himself Full Cast & Crew Last Season Season 1 2016 | 8 Episodes Season 1 of Netflix Presents: The Characters premiered on March 11, 2016. View All Seasons Social Reviews  0 Discussions  0 Media Most Popular Videos  1 Backdrops  1 Posters  1 Recommendations   2015-12-24 Dawn of the Croods 6.6    2011-02-08 Traffic Light 7.2    2016-11-07 The Sound of Your Heart 8.0    2015-06-12 Conspiracy 5.7    2015-12-01 Real Rob 5.8    2012-10-16 The Strange Calls 6.8    2017-03-10 Buddy Thunderstruck 8.0    2017-01-01 Beau S\u00e9jour 7.9  Facts Status  Returning Series Network Certification TV-MA Meaning This program is specifically designed to be viewed by adults and therefore may be unsuitable for children under 17 Type  Scripted Original Language  English Runtime  - Homepage  - Genres Comedy Keywords No keywords have been added. Content Score 93 Almost there... Top Contributors 15 Elizabeth Jennings VM 6 Vaishnav MK 4 sunnykhan TB 1 TMDb Bot  View Edit History Popularity Trend  Login to edit  URL By  signing up  for an account on TMDb, you can post directly to Twitter and Facebook. You need to be logged in to continue. Click  here  to login or  here  to sign up.    page_wrap opened in html_head  Join the Community The Basics About TMDb Contact Us Support Forums API Blog Get Involved  Contribution Bible 3rd Party Applications Add New Movie Add New TV Show Community Guidelines Leaderboard Forums Twitter Facebook Legal Terms of Use Privacy Policy Login Sign Up"
}