{
  "link": "https://www.themoviedb.org/tv/60282?language=en",
  "title": "Homeroom on the Beachside",
  "resume": "We don't have an overview translated in English. Help us expand our database by adding one.",
  "rate": "",
  "genre": [
    "Drama"
  ],
  "cast": {
    "actor": [
      "Michiko Kichise",
      "Keiko Kitagawa",
      "Yuji Oda",
      "Kie Kitano",
      "Masaki Okada"
    ]
  },
  "characters": {
    "characters": [
      "Haruka Mayama",
      "Wakaba Enokido",
      "Sakutaro Sakurai",
      "Riku Shirasaki",
      "Hiroki Negishi"
    ]
  },
  "site_data": "html Apps Forums Leaderboard Contribute API Support Discover Movies TV Shows Movies Popular Top Rated Upcoming Now Playing TV Shows Popular Top Rated On TV Airing Today People Popular People Can't find a movie or TV show? Login to create it. en Login Sign Up  ID: 60282   Expand Homeroom on the Beachside   (2008) User Score Overview We don't have an overview translated in English. Help us expand our database by adding one. Discussions   Reviews Videos   Images   Changes Report Share Discussions General  0 Content Issues  0 Images Backdrops  0 Posters  1 Videos Trailers  0 Teasers  0 Clips  0 Featurettes  0 Opening Credits  0 Top Billed Cast Michiko Kichise Haruka Mayama Keiko Kitagawa Wakaba Enokido Yuji Oda Sakutaro Sakurai Kie Kitano Riku Shirasaki Masaki Okada Hiroki Negishi Full Cast & Crew Last Season Season 1 2008 | 10 Episodes Season 1 of Homeroom on the Beachside premiered on July 21, 2008. View All Seasons Social Reviews  0 Discussions  0 Media Most Popular Videos  0 Backdrops  0 Posters  1 Recommendations We don't have enough data to suggest any TV shows based on Homeroom on the Beachside. You can help by rating TV shows you've seen. Facts Original Name  \u592a\u967d\u3068\u6d77\u306e\u6559\u5ba4T Status  Ended Networks - Certification  - Type  Scripted Original Language  Japanese Runtime  - Homepage  - Genres Drama Keywords No keywords have been added. Content Score 64 We're so close, yet so far. Top Contributors A 26 Aka75 s 3 sad_janus  View Edit History Popularity Trend  Login to edit  URL By  signing up  for an account on TMDb, you can post directly to Twitter and Facebook. You need to be logged in to continue. Click  here  to login or  here  to sign up.    page_wrap opened in html_head  Join the Community The Basics About TMDb Contact Us Support Forums API Blog Get Involved  Contribution Bible 3rd Party Applications Add New Movie Add New TV Show Community Guidelines Leaderboard Forums Twitter Facebook Legal Terms of Use Privacy Policy Login Sign Up"
}