{
  "link": "https://www.themoviedb.org/tv/4802?language=en",
  "title": "Plats bruts",
  "resume": "Plats bruts is a sitcom issued for TV3. The story talks about the life of Josep Lopez and David G\u00fcell. The show was co-produced by Kr\u00e0mpack, El Terrat and Televisi\u00f3 de Catalunya.",
  "rate": "0.0",
  "genre": [
    "Comedy"
  ],
  "cast": [
    "Jordi S\u00e1nchez",
    "Joel Joan",
    "M\u00f2nica Glaenzel",
    "Llu\u00eds Xavier Villanueva",
    "Merc\u00e8 Comes"
  ],
  "character": [
    "Josep L\u00f3pez",
    "David G\u00fcell",
    "Emma Cruscat de Palausabulla Belluvach Gonz\u00e0lez",
    "Ram\u00f3n Zamora",
    "Assumpci\u00f3"
  ],
  "site_data": "html Apps Forums Leaderboard Contribute API Support Discover Movies TV Shows Movies Popular Top Rated Upcoming Now Playing TV Shows Popular Top Rated On TV Airing Today People Popular People Can't find a movie or TV show? Login to create it. en Login Sign Up  ID: 4802   Expand Plats bruts   (1999) User Score Overview Plats bruts is a sitcom issued for TV3. The story talks about the life of Josep Lopez and David G\u00fcell. The show was co-produced by Kr\u00e0mpack, El Terrat and Televisi\u00f3 de Catalunya. Featured Crew Joel Joan Creator Discussions   Reviews Videos   Images   Changes Report Share Discussions General  0 Content Issues  0 Images Backdrops  2 Posters  3 Videos Trailers  0 Teasers  0 Clips  0 Featurettes  0 Opening Credits  0 Top Billed Cast Jordi S\u00e1nchez Josep L\u00f3pez Joel Joan David G\u00fcell M\u00f2nica Glaenzel Emma Cruscat de Palausabulla Belluvach Gonz\u00e0lez Llu\u00eds Xavier Villanueva Ram\u00f3n Zamora Merc\u00e8 Comes Assumpci\u00f3 Full Cast & Crew Last Season Season 6 2002 | 14 Episodes Season 6 of Plats bruts premiered on April 30, 2002. View All Seasons Social Reviews  0 Discussions  0 Media Most Popular Videos  0 Backdrops  2 Posters  3 Recommendations We don't have enough data to suggest any TV shows based on Plats bruts. You can help by rating TV shows you've seen. Facts Status  Ended Network Certification  - Type  Scripted Original Language  Catalan; Valencian Runtime  - Homepage  - Genres Comedy Keywords No keywords have been added. Content Score 93 Almost there... Top Contributors 18 prm96 r 4 rakrak123 z 4 zurman1 s 4 servia  View Edit History Popularity Trend  Login to edit  URL By  signing up  for an account on TMDb, you can post directly to Twitter and Facebook. You need to be logged in to continue. Click  here  to login or  here  to sign up.    page_wrap opened in html_head  Join the Community The Basics About TMDb Contact Us Support Forums API Blog Get Involved  Contribution Bible 3rd Party Applications Add New Movie Add New TV Show Community Guidelines Leaderboard Forums Twitter Facebook Legal Terms of Use Privacy Policy Login Sign Up"
}