{
  "link": "https://www.themoviedb.org/tv/62285?language=en",
  "title": "Marvel's The Defenders",
  "resume": "Daredevil, Jessica Jones, Luke Cage and Iron Fist join forces to take on common enemies as a sinister conspiracy threatens New York City.",
  "rate": "",
  "genre": [
    "Action",
    "Adventure",
    "Crime",
    "Sci-Fi",
    "Fantasy"
  ],
  "cast": {
    "actor": [
      "Charlie Cox",
      "Krysten Ritter",
      "Mike Colter",
      "Finn Jones",
      "\u00c9lodie Yung"
    ]
  },
  "characters": {
    "characters": [
      "Matt Murdock / Daredevil",
      "Jessica Jones",
      "Luke Cage",
      "Danny Rand",
      "Elektra Natchios / Elektra"
    ]
  },
  "site_data": "html Apps Forums Leaderboard Contribute API Support Discover Movies TV Shows Movies Popular Top Rated Upcoming Now Playing TV Shows Popular Top Rated On TV Airing Today People Popular People Can't find a movie or TV show? Login to create it. en Login Sign Up  ID: 62285   Expand Marvel's The Defenders   (2017) User Score Overview Daredevil, Jessica Jones, Luke Cage and Iron Fist join forces to take on common enemies as a sinister conspiracy threatens New York City. Featured Crew Douglas Petrie Creator Marco Ramirez Creator Discussions   Reviews Videos   Images   Changes Report Share Discussions General  18 Content Issues  1 Images Backdrops  12 Posters  18 Videos Trailers  0 Teasers  0 Clips  0 Featurettes  0 Opening Credits  0 Top Billed Cast Charlie Cox Matt Murdock / Daredevil Krysten Ritter Jessica Jones Mike Colter Luke Cage Finn Jones Danny Rand \u00c9lodie Yung Elektra Natchios / Elektra Full Cast & Crew Last Season Season 1 2017 | 8 Episodes Season 1 of Marvel's The Defenders premiered on August 18, 2017. View All Seasons Social Reviews  0 Discussions  19 Subject Status Replies Last Reply D The defenders Open 0 by Dumbo33\n      \n     Be prepared.  People are gonna hate this. Open 22 by  Horus Mazinga Rank the women of The Defenders Open 2 by  Mr. Moovee Go to Discussions Media Most Popular Videos  0 Backdrops  12 Posters  18 Recommendations   2017-03-17 Marvel's Iron Fist 6.1    2016-09-30 Marvel's Luke Cage 6.9    2017-11-17 Marvel's The Punisher 8.0    2015-11-20 Marvel's Jessica Jones 7.6    2015-04-10 Marvel's Daredevil 7.7    2017-10-02 The Gifted 7.0    2017-09-29 Marvel's Inhumans 5.6    2017-11-21 Marvel's Runaways 7.3  Facts Status  Ended Network Certification TV-MA Meaning This program is specifically designed to be viewed by adults and therefore may be unsuitable for children under 17 Type  Miniseries Original Language  English Runtime  55m, 50m Homepage   https://www.netflix.com/title/80002566 Genres Action & Adventure Crime Sci-Fi & Fantasy Keywords superhero based on comic superhero team marvel cinematic universe masked superhero Content Score 100 Yes! Looking good! Top Contributors 48 Jessica Drew 36 Elizabeth Jennings 25 Martin 20 Imzadi  View Edit History Popularity Trend  Login to edit  URL By  signing up  for an account on TMDb, you can post directly to Twitter and Facebook. You need to be logged in to continue. Click  here  to login or  here  to sign up.    page_wrap opened in html_head  Join the Community The Basics About TMDb Contact Us Support Forums API Blog Get Involved  Contribution Bible 3rd Party Applications Add New Movie Add New TV Show Community Guidelines Leaderboard Forums Twitter Facebook Legal Terms of Use Privacy Policy Login Sign Up"
}