{
  "link": "https://www.themoviedb.org/tv/9833?language=en",
  "title": "Working",
  "resume": "Working is an American situation comedy that aired on NBC from 1997 to 1999. The series was created and executive produced by Michael Davidoff and Bill Rosenthal.",
  "rate": "0.0",
  "genre": [
    "Comedy"
  ],
  "cast": [
    "Yvette Freeman",
    "Fred Savage",
    "Arden Myrin",
    "Debi Mazar",
    "Steve Hytner"
  ],
  "character": [
    "Matt Peyser",
    "Liz Tricoli"
  ],
  "site_data": "html Apps Forums Leaderboard Contribute API Support Discover Movies TV Shows Movies Popular Top Rated Upcoming Now Playing TV Shows Popular Top Rated On TV Airing Today People Popular People Can't find a movie or TV show? Login to create it. en Login Sign Up  ID: 9833   Expand Working   (1997) User Score Overview Working is an American situation comedy that aired on NBC from 1997 to 1999. The series was created and executive produced by Michael Davidoff and Bill Rosenthal. Discussions   Reviews Videos   Images   Changes Report Share Discussions General  0 Content Issues  0 Images Backdrops  0 Posters  1 Videos Trailers  0 Teasers  0 Clips  0 Featurettes  0 Opening Credits  0 Top Billed Cast Yvette Freeman Fred Savage Matt Peyser Arden Myrin Debi Mazar Liz Tricoli Steve Hytner Full Cast & Crew Last Season Season 2 1998 | 17 Episodes Season 2 of Working premiered on September 22, 1998. View All Seasons Social Reviews  0 Discussions  0 Media Most Popular Videos  0 Backdrops  0 Posters  1 Recommendations We don't have enough data to suggest any TV shows based on Working. You can help by rating TV shows you've seen. Facts Status  Ended Network Certification  - Type  Scripted Original Language  English Runtime  30m Homepage  - Genres Comedy Keywords office satire sitcom workplace comedy Content Score 71 Just a little bit more... Top Contributors 5 Banana C 1 CherryJones RB 1 Rookie B.  View Edit History Popularity Trend  Login to edit  URL By  signing up  for an account on TMDb, you can post directly to Twitter and Facebook. You need to be logged in to continue. Click  here  to login or  here  to sign up.    page_wrap opened in html_head  Join the Community The Basics About TMDb Contact Us Support Forums API Blog Get Involved  Contribution Bible 3rd Party Applications Add New Movie Add New TV Show Community Guidelines Leaderboard Forums Twitter Facebook Legal Terms of Use Privacy Policy Login Sign Up"
}