{
  "link": "https://www.themoviedb.org/tv/4327?language=en",
  "title": "Mr. Bean",
  "resume": "Mr Bean turns simple everyday tasks into chaotic situations and will leave you in stitches as he creates havoc wherever he goes.",
  "rate": "78.0",
  "genre": [
    "Comedy"
  ],
  "cast": [
    "Rowan Atkinson",
    "Matilda Ziegler",
    "Robin Driscoll",
    "Matthew Ashforde",
    "Roger Sloman"
  ],
  "character": [
    "Mr. Bean",
    "Irma Gobb",
    "Blind Man",
    "Hotel Porter",
    "The Blind Man"
  ],
  "site_data": "html Apps Forums Leaderboard Contribute API Support Discover Movies TV Shows Movies Popular Top Rated Upcoming Now Playing TV Shows Popular Top Rated On TV Airing Today People Popular People Can't find a movie or TV show? Login to create it. en Login Sign Up  ID: 4327   Expand Mr. Bean   (1990) User Score Overview Mr Bean turns simple everyday tasks into chaotic situations and will leave you in stitches as he creates havoc wherever he goes. Featured Crew Richard Curtis Creator Rowan Atkinson Creator Discussions   Reviews Videos   Images   Changes Report Share Discussions General  2 Content Issues  4 Images Backdrops  10 Posters  11 Videos Trailers  0 Teasers  0 Clips  0 Featurettes  0 Opening Credits  0 Top Billed Cast Rowan Atkinson Mr. Bean Matilda Ziegler Irma Gobb Robin Driscoll Blind Man Matthew Ashforde Hotel Porter Roger Sloman The Blind Man Full Cast & Crew Last Season Original Air Date Original Air Date Hulu (Digital) Season 1 1989 | 14 Episodes Season 1 of Mr. Bean premiered on December 31, 1989. View All Seasons Social Reviews  0 Discussions  6 Subject Status Replies Last Reply Favourite moments Open 1 by  AusFem His girlfriend Open 0 by lmao7\n      \n     Go to Discussions Media Most Popular Videos  0 Backdrops  10 Posters  11 Recommendations   1983-09-10 Inspector Gadget 6.6    1960-09-30 The Flintstones 7.0    1990-09-10 The Fresh Prince of Bel-Air 7.3    1986-09-22 ALF 6.9    1983-06-15 Blackadder 7.8    1987-09-10 Teenage Mutant Ninja Turtles 7.3    1976-09-18 The Muppet Show 7.8    1993-09-12 Lois & Clark: The New Adventures of Superman 6.6  Facts Status  Ended Network Certification TV-PG Meaning This program contains material that parents may find unsuitable for younger children. Type  Scripted Original Language  English Runtime  25m, 24m Homepage   http://www.mrbean.co.uk/ Genres Comedy Keywords london england creativity eccentric farce immaturity sitcom cunning socially awkward problem solving british humour Content Score 93 Almost there... Top Contributors M 20 Mec!as 18 Banana AK 8 Avshalom Kor I 8 ILiviu  View Edit History Popularity Trend  Login to edit  URL By  signing up  for an account on TMDb, you can post directly to Twitter and Facebook. You need to be logged in to continue. Click  here  to login or  here  to sign up.    page_wrap opened in html_head  Join the Community The Basics About TMDb Contact Us Support Forums API Blog Get Involved  Contribution Bible 3rd Party Applications Add New Movie Add New TV Show Community Guidelines Leaderboard Forums Twitter Facebook Legal Terms of Use Privacy Policy Login Sign Up"
}