{
  "link": "https://www.themoviedb.org/tv/71716?language=en",
  "title": "Reverie",
  "resume": "A former detective specializing in human behavior is brought in when the launch of an advanced virtual reality program has dangerous and unintended consequences.",
  "rate": "70.0",
  "genre": [
    "Sci-Fi",
    "Fantasy",
    "Drama"
  ],
  "cast": [
    "Sarah Shahi",
    "Dennis Haysbert",
    "Kathryn Morris",
    "Sendhil Ramamurthy",
    "Jessica Lu"
  ],
  "character": [
    "Mara",
    "Charlie Ventana",
    "Monica Shaw",
    "Paul Hammond",
    "Alexis Barrett"
  ],
  "site_data": "html Apps Forums Leaderboard Contribute API Support Discover Movies TV Shows Movies Popular Top Rated Upcoming Now Playing TV Shows Popular Top Rated On TV Airing Today People Popular People Can't find a movie or TV show? Login to create it. en Login Sign Up  ID: 71716   Expand Reverie   (2018) User Score  Play Trailer Overview A former detective specializing in human behavior is brought in when the launch of an advanced virtual reality program has dangerous and unintended consequences. Featured Crew Mickey Fisher Creator Discussions   Reviews Videos   Images   Changes Report Share Discussions General  1 Content Issues  0 Images Backdrops  2 Posters  2 Videos Trailers  1 Teasers  0 Clips  0 Featurettes  0 Opening Credits  0 Top Billed Cast Sarah Shahi Mara Dennis Haysbert Charlie Ventana Kathryn Morris Monica Shaw Sendhil Ramamurthy Paul Hammond Jessica Lu Alexis Barrett Full Cast & Crew Current Season Season 1 2018 | 6 Episodes Season 1 of Reverie premiered on May 30, 2018. View All Seasons Social Reviews  0 Discussions  1 Subject Status Replies Last Reply F Glad To See It On NBC's Schedule Open 8 by  bratface Go to Discussions Media Most Popular Videos  1 Backdrops  2 Posters  2 Recommendations   2016-10-13 Falling Water 6.6    2018-01-22 The Alienist 7.1    2018-04-02 The Crossing 7.8    2017-08-27 Strike 6.2    2018-03-29 Siren 7.3  Facts Status  Returning Series Network Certification TV-14 Meaning This program contains some material that many parents would find unsuitable for children under 14 years of age. Type  Scripted Original Language  English Runtime  42m Homepage   https://www.nbc.com/reverie Genres Sci-Fi & Fantasy Drama Keywords virtual reality technology detective Content Score 100 Yes! Looking good! Top Contributors 36 Warpath 9 Elizabeth Jennings 8 cishaocishao 7 Banana  View Edit History Popularity Trend  Login to edit  URL By  signing up  for an account on TMDb, you can post directly to Twitter and Facebook. You need to be logged in to continue. Click  here  to login or  here  to sign up.    page_wrap opened in html_head  Join the Community The Basics About TMDb Contact Us Support Forums API Blog Get Involved  Contribution Bible 3rd Party Applications Add New Movie Add New TV Show Community Guidelines Leaderboard Forums Twitter Facebook Legal Terms of Use Privacy Policy Login Sign Up"
}