{
  "link": "https://www.themoviedb.org/tv/34175?language=en",
  "title": "Onmy\u014d Taisenki",
  "resume": "Onmy\u014d Taisenki is a Japanese manga series scripted by Yoshihiko Tomizawa and illustrated by Hiroyuki Kaid\u014d. It was adapted into an anime series produced by Sunrise.",
  "rate": "",
  "genre": [
    "Animation"
  ],
  "cast": {
    "actor": [
      "Yukimasa Kishino",
      "Kenta Miyake",
      "Akeno Watanabe",
      "Jun Fukuyama",
      "Akemi Kanda"
    ]
  },
  "characters": {
    "characters": [
      "Soutarou Tachibana",
      "Byakko no Rangetsu",
      "Ikazuchi no Fusanoshin",
      "Riku Tachibana",
      "Nazuna"
    ]
  },
  "site_data": "html Apps Forums Leaderboard Contribute API Support Discover Movies TV Shows Movies Popular Top Rated Upcoming Now Playing TV Shows Popular Top Rated On TV Airing Today People Popular People Can't find a movie or TV show? Login to create it. en Login Sign Up  ID: 34175   Expand Onmy\u014d Taisenki   (2004) User Score Overview Onmy\u014d Taisenki is a Japanese manga series scripted by Yoshihiko Tomizawa and illustrated by Hiroyuki Kaid\u014d. It was adapted into an anime series produced by Sunrise. Discussions   Reviews Videos   Images   Changes Report Share Discussions General  0 Content Issues  0 Images Backdrops  1 Posters  1 Videos Trailers  0 Teasers  0 Clips  0 Featurettes  0 Opening Credits  0 Top Billed Cast Yukimasa Kishino Soutarou Tachibana Kenta Miyake Byakko no Rangetsu Akeno Watanabe Ikazuchi no Fusanoshin Jun Fukuyama Riku Tachibana Akemi Kanda Nazuna Full Cast & Crew Last Season Season 2 2005 | 26 Episodes Season 2 of Onmy\u014d Taisenki premiered on April  7, 2005. View All Seasons Social Reviews  0 Discussions  0 Media Most Popular Videos  0 Backdrops  1 Posters  1 Recommendations We don't have enough data to suggest any TV shows based on Onmy\u014d Taisenki. You can help by rating TV shows you've seen. Facts Status  Ended Network Certification  - Type  Scripted Original Language  English Runtime  30m Homepage  - Genres Animation Keywords No keywords have been added. Content Score 86 Almost there... Top Contributors m 3 magoozin  View Edit History Popularity Trend  Login to edit  URL By  signing up  for an account on TMDb, you can post directly to Twitter and Facebook. You need to be logged in to continue. Click  here  to login or  here  to sign up.    page_wrap opened in html_head  Join the Community The Basics About TMDb Contact Us Support Forums API Blog Get Involved  Contribution Bible 3rd Party Applications Add New Movie Add New TV Show Community Guidelines Leaderboard Forums Twitter Facebook Legal Terms of Use Privacy Policy Login Sign Up"
}