{
  "link": "https://www.themoviedb.org/tv/65438?language=en",
  "title": "Section de recherches",
  "resume": "We don't have an overview translated in English. Help us expand our database by adding one.",
  "rate": "",
  "genre": [
    "Crime"
  ],
  "cast": {
    "actor": [
      "Franck S\u00e9monin",
      "Xavier Deluc",
      "Chrystelle Labaude",
      "Manon Azem",
      "St\u00e9phane Soo Mongo"
    ]
  },
  "characters": {
    "characters": [
      "Lucas Auriol",
      "Martin Bernier",
      "Nadia Angeli",
      "Sara Casanova",
      "Alexandre Sainte-Rose"
    ]
  },
  "site_data": "html Apps Forums Leaderboard Contribute API Support Discover Movies TV Shows Movies Popular Top Rated Upcoming Now Playing TV Shows Popular Top Rated On TV Airing Today People Popular People Can't find a movie or TV show? Login to create it. en Login Sign Up  ID: 65438   Expand Section de recherches   (2006) User Score Overview We don't have an overview translated in English. Help us expand our database by adding one. Discussions   Reviews Videos   Images   Changes Report Share Discussions General  0 Content Issues  0 Images Backdrops  2 Posters  1 Videos Trailers  0 Teasers  0 Clips  0 Featurettes  0 Opening Credits  0 Top Billed Cast Franck S\u00e9monin Lucas Auriol Xavier Deluc Martin Bernier Chrystelle Labaude Nadia Angeli Manon Azem Sara Casanova St\u00e9phane Soo Mongo Alexandre Sainte-Rose Full Cast & Crew Last Season Season 11 2017 | 14 Episodes Season 11 of Section de recherches premiered on January  3, 2017. View All Seasons Social Reviews  0 Discussions  0 Media Most Popular Videos  0 Backdrops  2 Posters  1 Recommendations We don't have enough data to suggest any TV shows based on Section de recherches. You can help by rating TV shows you've seen. Facts Status  Returning Series Network Certification  - Type  Scripted Original Language  French Runtime  - Homepage   https://tf1.fr/hd1/section-de-recherches Genres Crime Keywords police Content Score 79 Pump it up! We're close now. Top Contributors 23 webmotril22 11 Banana D 5 DERBYDIGITAL c 5 cedylo  View Edit History Popularity Trend  Login to edit  URL By  signing up  for an account on TMDb, you can post directly to Twitter and Facebook. You need to be logged in to continue. Click  here  to login or  here  to sign up.    page_wrap opened in html_head  Join the Community The Basics About TMDb Contact Us Support Forums API Blog Get Involved  Contribution Bible 3rd Party Applications Add New Movie Add New TV Show Community Guidelines Leaderboard Forums Twitter Facebook Legal Terms of Use Privacy Policy Login Sign Up"
}