{
  "link": "https://www.themoviedb.org/tv/75166?language=en",
  "title": "Tommy in La La Land",
  "resume": "A three-part documentary series that follows Dutch journalist Tommy Parker as he travels to Los Angeles, finding out what impact the rapidly changing world has on Hollywood and vice versa.",
  "rate": "0.0",
  "genre": [
    "Documentary"
  ],
  "cast": [
    "Mike C. Manning",
    "Haaz Sleiman",
    "Grant Davis",
    "D.J. \"Shangela\" Pierce",
    "Miss Coco Peru"
  ],
  "character": [
    "Himself",
    "Himself",
    "Himself",
    "Himself",
    "Herself"
  ],
  "site_data": "html Apps Forums Leaderboard Contribute API Support Discover Movies TV Shows Movies Popular Top Rated Upcoming Now Playing TV Shows Popular Top Rated On TV Airing Today People Popular People Can't find a movie or TV show? Login to create it. en Login Sign Up  ID: 75166   Expand Tommy in La La Land   (2018) User Score Overview A three-part documentary series that follows Dutch journalist Tommy Parker as he travels to Los Angeles, finding out what impact the rapidly changing world has on Hollywood and vice versa. Featured Crew Tommy Parker Creator Discussions   Reviews Videos   Images   Changes Report Share Discussions General  0 Content Issues  1 Images Backdrops  2 Posters  3 Videos Trailers  0 Teasers  0 Clips  0 Featurettes  0 Opening Credits  0 Top Billed Cast Mike C. Manning Himself Haaz Sleiman Himself Grant Davis Himself D.J. \"Shangela\" Pierce Himself Miss Coco Peru Herself Full Cast & Crew Current Season Season 1 2018 | 0 Episodes Season 1 of Tommy in La La Land premiered on April 12, 2018. View All Seasons Social Reviews  0 Discussions  1 Subject Status Replies Last Reply There are no discussions for Tommy in La La Land. Login to be first! Go to Discussions Media Most Popular Videos  0 Backdrops  2 Posters  3 Recommendations We don't have enough data to suggest any TV shows based on Tommy in La La Land. You can help by rating TV shows you've seen. Facts Status  Returning Series Network Certification 16 Meaning Can be aired only from 10:00pm Uhr to 6:00am. Type  Documentary Original Language  English Runtime  45m Homepage  - Genres Documentary Keywords gay lgbt Content Score 93 Almost there... Top Contributors t 24 tmdb23828846 10 Elizabeth Jennings d 7 dani1984 4 Banana  View Edit History Popularity Trend  Login to edit  URL By  signing up  for an account on TMDb, you can post directly to Twitter and Facebook. You need to be logged in to continue. Click  here  to login or  here  to sign up.    page_wrap opened in html_head  Join the Community The Basics About TMDb Contact Us Support Forums API Blog Get Involved  Contribution Bible 3rd Party Applications Add New Movie Add New TV Show Community Guidelines Leaderboard Forums Twitter Facebook Legal Terms of Use Privacy Policy Login Sign Up"
}