{
  "link": "https://www.themoviedb.org/tv/77564?language=en",
  "title": "Kizlarim Icin",
  "resume": "We don't have an overview translated in English. Help us expand our database by adding one.",
  "rate": "",
  "genre": [
    "Drama"
  ],
  "cast": {
    "actor": [
      "Numan \u00c7ak\u0131r",
      "Hakan Yufkac\u0131gil",
      "Meltem G\u00fclen\u00e7",
      "Asl\u0131 \u0130\u00e7\u00f6z\u00fc",
      "Cansu F\u0131r\u0131nc\u0131"
    ]
  },
  "characters": {
    "characters": [
      "Z\u00fcbeyr",
      "Tayfun",
      "Fitnat",
      "Semiha",
      "\u00c7etin"
    ]
  },
  "site_data": "html Apps Forums Leaderboard Contribute API Support Discover Movies TV Shows Movies Popular Top Rated Upcoming Now Playing TV Shows Popular Top Rated On TV Airing Today People Popular People Can't find a movie or TV show? Login to create it. en Login Sign Up  ID: 77564   Expand Kizlarim Icin   (2017) User Score Overview We don't have an overview translated in English. Help us expand our database by adding one. Featured Crew Mesude Erarslan Creator Discussions   Reviews Videos   Images   Changes Report Share Discussions General  0 Content Issues  0 Images Backdrops  1 Posters  1 Videos Trailers  0 Teasers  0 Clips  0 Featurettes  0 Opening Credits  0 Top Billed Cast Numan \u00c7ak\u0131r Z\u00fcbeyr Hakan Yufkac\u0131gil Tayfun Meltem G\u00fclen\u00e7 Fitnat Asl\u0131 \u0130\u00e7\u00f6z\u00fc Semiha Cansu F\u0131r\u0131nc\u0131 \u00c7etin Full Cast & Crew Current Season Season 1 2017 | 13 Episodes Season 1 of Kizlarim Icin premiered on November 29, 2017. View All Seasons Social Reviews  0 Discussions  0 Media Most Popular Videos  0 Backdrops  1 Posters  1 Recommendations We don't have enough data to suggest any TV shows based on Kizlarim Icin. You can help by rating TV shows you've seen. Facts Original Name  K\u0131zlar\u0131m \u0130\u00e7in Status  Ended Network Certification  - Type  Scripted Original Language  Turkish Runtime  120m Homepage  - Genres Drama Keywords No keywords have been added. Content Score 86 Almost there... Top Contributors 35 moviefars  View Edit History Popularity Trend  Login to edit  URL By  signing up  for an account on TMDb, you can post directly to Twitter and Facebook. You need to be logged in to continue. Click  here  to login or  here  to sign up.    page_wrap opened in html_head  Join the Community The Basics About TMDb Contact Us Support Forums API Blog Get Involved  Contribution Bible 3rd Party Applications Add New Movie Add New TV Show Community Guidelines Leaderboard Forums Twitter Facebook Legal Terms of Use Privacy Policy Login Sign Up"
}