{
  "link": "https://www.themoviedb.org/tv/37971?language=en",
  "title": "Der Alte",
  "resume": "A police department, lead by an older, experienced detective solve crimes together.",
  "rate": "58.0",
  "genre": [
    "Crime"
  ],
  "cast": [
    "Siegfried Lowitz",
    "Michael Ande",
    "Markus B\u00f6ttcher",
    "Jan-Gregor Kremp"
  ],
  "character": [
    "Kommissar K\u00f6ster",
    "Gerd Heymann",
    "Kriminaloberkommissar Werner Riedmann",
    "Kriminalhauptkommissar Richard Voss"
  ],
  "site_data": "html Apps Forums Leaderboard Contribute API Support Discover Movies TV Shows Movies Popular Top Rated Upcoming Now Playing TV Shows Popular Top Rated On TV Airing Today People Popular People Can't find a movie or TV show? Login to create it. en Login Sign Up  ID: 37971   Expand Der Alte   (1977) User Score Overview A police department, lead by an older, experienced detective solve crimes together. Featured Crew Helmut Ringelmann Creator Discussions   Reviews Videos   Images   Changes Report Share Discussions General  0 Content Issues  0 Images Backdrops  3 Posters  2 Videos Trailers  0 Teasers  0 Clips  0 Featurettes  0 Opening Credits  0 Top Billed Cast Siegfried Lowitz Kommissar K\u00f6ster Michael Ande Gerd Heymann Markus B\u00f6ttcher Kriminaloberkommissar Werner Riedmann Jan-Gregor Kremp Kriminalhauptkommissar Richard Voss Full Cast & Crew Last Season Season 46 2017 | 8 Episodes Season 46 of Der Alte premiered on February 24, 2017. View All Seasons Social Reviews  0 Discussions  0 Media Most Popular Videos  0 Backdrops  3 Posters  2 Recommendations We don't have enough data to suggest any TV shows based on Der Alte. You can help by rating TV shows you've seen. Facts Status  Returning Series Network Certification N-7 Meaning Intended for viewers from 7 years old. Type  Scripted Original Language  German Runtime  60m Homepage  - Genres Crime Keywords No keywords have been added. Content Score 100 Yes! Looking good! Top Contributors S 463 Samara M 18 MrGrimes 4 tigriso1 s 3 stesme  View Edit History Popularity Trend  Login to edit  URL By  signing up  for an account on TMDb, you can post directly to Twitter and Facebook. You need to be logged in to continue. Click  here  to login or  here  to sign up.    page_wrap opened in html_head  Join the Community The Basics About TMDb Contact Us Support Forums API Blog Get Involved  Contribution Bible 3rd Party Applications Add New Movie Add New TV Show Community Guidelines Leaderboard Forums Twitter Facebook Legal Terms of Use Privacy Policy Login Sign Up"
}