{
  "link": "https://www.themoviedb.org/tv/74187?language=en",
  "title": "TsukiPro the Animation",
  "resume": "We don't have an overview translated in English. Help us expand our database by adding one.",
  "rate": "",
  "genre": [
    "Animation",
    "Comedy"
  ],
  "cast": {
    "actor": [
      "Junta Terashima",
      "Shunichi Toki",
      "Takuya Eguchi",
      "Toshiyuki Toyonaga",
      "Natsuki Hanae"
    ]
  },
  "characters": {
    "characters": [
      "Mamoru Fujimura",
      "Koki Eto",
      "Shiki Takamura",
      "Sora Oohara",
      "Rikka Sera"
    ]
  },
  "site_data": "html Apps Forums Leaderboard Contribute API Support Discover Movies TV Shows Movies Popular Top Rated Upcoming Now Playing TV Shows Popular Top Rated On TV Airing Today People Popular People Can't find a movie or TV show? Login to create it. en Login Sign Up  ID: 74187   Expand TsukiPro the Animation   (2017) User Score Overview We don't have an overview translated in English. Help us expand our database by adding one. Discussions   Reviews Videos   Images   Changes Report Share Discussions General  0 Content Issues  0 Images Backdrops  4 Posters  1 Videos Trailers  0 Teasers  0 Clips  0 Featurettes  0 Opening Credits  0 Top Billed Cast Junta Terashima Mamoru Fujimura Shunichi Toki Koki Eto Takuya Eguchi Shiki Takamura Toshiyuki Toyonaga Sora Oohara Natsuki Hanae Rikka Sera Full Cast & Crew Current Season Season 1 2017 | 13 Episodes Season 1 of TsukiPro the Animation premiered on October  4, 2017. View All Seasons Social Reviews  0 Discussions  0 Media Most Popular Videos  0 Backdrops  4 Posters  1 Recommendations We don't have enough data to suggest any TV shows based on TsukiPro the Animation. You can help by rating TV shows you've seen. Facts Original Name  TSUKIPRO THE ANIMATION Status  Returning Series Networks - Certification TV-PG Meaning This program contains material that parents may find unsuitable for younger children. Type  Scripted Original Language  Japanese Runtime  23m Homepage   http://tsukipro-anime.com/ Genres Animation Comedy Keywords music idol slice of life anime Content Score 86 Almost there... Top Contributors 32 Alex 19 sekaidown04 15 sp1ti D 13 Destr0y  View Edit History Popularity Trend  Login to edit  URL By  signing up  for an account on TMDb, you can post directly to Twitter and Facebook. You need to be logged in to continue. Click  here  to login or  here  to sign up.    page_wrap opened in html_head  Join the Community The Basics About TMDb Contact Us Support Forums API Blog Get Involved  Contribution Bible 3rd Party Applications Add New Movie Add New TV Show Community Guidelines Leaderboard Forums Twitter Facebook Legal Terms of Use Privacy Policy Login Sign Up"
}