{
  "link": "https://www.themoviedb.org/tv/78545?language=en",
  "title": "Seitentriebe",
  "resume": "We don't have an overview translated in English. Help us expand our database by adding one.",
  "rate": "",
  "genre": [
    "Comedy"
  ],
  "cast": {
    "actor": [
      "Vera Bommer",
      "Nicola Mastroberardino",
      "Wanda Wylowa",
      "Leonardo Nigro",
      "Sunnyi Melles"
    ]
  },
  "characters": {
    "characters": [
      "Nele",
      "Gianni",
      "Monika",
      "Heinz",
      "Clara"
    ]
  },
  "site_data": "html Apps Forums Leaderboard Contribute API Support Discover Movies TV Shows Movies Popular Top Rated Upcoming Now Playing TV Shows Popular Top Rated On TV Airing Today People Popular People Can't find a movie or TV show? Login to create it. en Login Sign Up  ID: 78545   Expand Seitentriebe   (2018) User Score Overview We don't have an overview translated in English. Help us expand our database by adding one. Featured Crew G\u00fczin Kar Creator Discussions   Reviews Videos   Images   Changes Report Share Discussions General  0 Content Issues  0 Images Backdrops  5 Posters  4 Videos Trailers  0 Teasers  0 Clips  0 Featurettes  0 Opening Credits  0 Top Billed Cast Vera Bommer Nele Nicola Mastroberardino Gianni Wanda Wylowa Monika Leonardo Nigro Heinz Sunnyi Melles Clara Full Cast & Crew Current Season Season 1 2018 | 8 Episodes Season 1 of Seitentriebe premiered on February 26, 2018. View All Seasons Social Reviews  0 Discussions  0 Media Most Popular Videos  0 Backdrops  5 Posters  4 Recommendations We don't have enough data to suggest any TV shows based on Seitentriebe. You can help by rating TV shows you've seen. Facts Status  Returning Series Network Certification 12 Meaning The broadcaster must take the decision about the air time by taking in consideration the impact on young children in the timeframe from 6:00am to 8:00pm. Type  Scripted Original Language  German Runtime  24m Homepage   https://www.srf.ch/sendungen/seitentriebe Genres Comedy Keywords No keywords have been added. Content Score 86 Almost there... Top Contributors LV 22 Les Videos 18 olikami  View Edit History Popularity Trend  Login to edit  URL By  signing up  for an account on TMDb, you can post directly to Twitter and Facebook. You need to be logged in to continue. Click  here  to login or  here  to sign up.    page_wrap opened in html_head  Join the Community The Basics About TMDb Contact Us Support Forums API Blog Get Involved  Contribution Bible 3rd Party Applications Add New Movie Add New TV Show Community Guidelines Leaderboard Forums Twitter Facebook Legal Terms of Use Privacy Policy Login Sign Up"
}