{
  "link": "https://www.themoviedb.org/tv/10672?language=en",
  "title": "Townies",
  "resume": "Townies is an American situation comedy that aired on ABC from September to December 1996. Created by Matthew Carlson, the series stars Molly Ringwald, Jenna Elfman, and Lauren Graham.",
  "rate": "0.0",
  "genre": [
    "Comedy"
  ],
  "cast": [
    "Lauren Graham",
    "Jenna Elfman",
    "Molly Ringwald",
    "Joseph D. Reitman",
    "Conchata Ferrell"
  ],
  "character": [
    "Denise Garibaldi Callahan",
    "Shannon Canotis",
    "Carrie Donovan",
    "Jesse",
    "Marge"
  ],
  "site_data": "html Apps Forums Leaderboard Contribute API Support Discover Movies TV Shows Movies Popular Top Rated Upcoming Now Playing TV Shows Popular Top Rated On TV Airing Today People Popular People Can't find a movie or TV show? Login to create it. en Login Sign Up  ID: 10672   Expand Townies   (1996) User Score Overview Townies is an American situation comedy that aired on ABC from September to December 1996. Created by Matthew Carlson, the series stars Molly Ringwald, Jenna Elfman, and Lauren Graham. Featured Crew Matthew Carlson Creator Discussions   Reviews Videos   Images   Changes Report Share Discussions General  0 Content Issues  0 Images Backdrops  1 Posters  1 Videos Trailers  0 Teasers  0 Clips  0 Featurettes  0 Opening Credits  0 Top Billed Cast Lauren Graham Denise Garibaldi Callahan Jenna Elfman Shannon Canotis Molly Ringwald Carrie Donovan Joseph D. Reitman Jesse Conchata Ferrell Marge Full Cast & Crew Last Season Season 1 1996 | 15 Episodes Season 1 of Townies premiered on September 18, 1996. View All Seasons Social Reviews  0 Discussions  0 Media Most Popular Videos  0 Backdrops  1 Posters  1 Recommendations We don't have enough data to suggest any TV shows based on Townies. You can help by rating TV shows you've seen. Facts Status  Ended Network Certification  - Type  Scripted Original Language  English Runtime  22m, 30m Homepage  - Genres Comedy Keywords restaurant sitcom Content Score 93 Almost there... Top Contributors 9 Banana C 1 CherryJones RB 1 Rookie B.  View Edit History Popularity Trend  Login to edit  URL By  signing up  for an account on TMDb, you can post directly to Twitter and Facebook. You need to be logged in to continue. Click  here  to login or  here  to sign up.    page_wrap opened in html_head  Join the Community The Basics About TMDb Contact Us Support Forums API Blog Get Involved  Contribution Bible 3rd Party Applications Add New Movie Add New TV Show Community Guidelines Leaderboard Forums Twitter Facebook Legal Terms of Use Privacy Policy Login Sign Up"
}