{
  "link": "https://www.themoviedb.org/tv/16033?language=en",
  "title": "Strawberry Shortcake",
  "resume": "Strawberry and her friends, including her sister, Apple Dumplin', and her pony, Honey Pie, embark on sweet-smelling adventures in Strawberryland.",
  "rate": "",
  "genre": [
    "Animation",
    "Kids"
  ],
  "cast": {
    "actor": [
      "Sarah Heinke",
      "Rachel Ware",
      "Anna Jordan",
      "Samantha Triba",
      "James Street"
    ]
  },
  "characters": {
    "characters": [
      "Strawberry Shortcake (voice)",
      "Angel Cake (voice)",
      "Custard (voice)",
      "Ginger Snap (voice)",
      "Huckleberry \"Huck\" Pie (voice)"
    ]
  },
  "site_data": "html Apps Forums Leaderboard Contribute API Support Discover Movies TV Shows Movies Popular Top Rated Upcoming Now Playing TV Shows Popular Top Rated On TV Airing Today People Popular People Can't find a movie or TV show? Login to create it. en Login Sign Up  ID: 16033   Expand Strawberry Shortcake   (2003) User Score Overview Strawberry and her friends, including her sister, Apple Dumplin', and her pony, Honey Pie, embark on sweet-smelling adventures in Strawberryland. Discussions   Reviews Videos   Images   Changes Report Share Discussions General  0 Content Issues  0 Images Backdrops  4 Posters  2 Videos Trailers  0 Teasers  0 Clips  0 Featurettes  0 Opening Credits  0 Top Billed Cast Sarah Heinke Strawberry Shortcake (voice) Rachel Ware Angel Cake (voice) Anna Jordan Custard (voice) Samantha Triba Ginger Snap (voice) James Street Huckleberry \"Huck\" Pie (voice) Full Cast & Crew Last Season Season 3 2006 | 10 Episodes Season 3 of Strawberry Shortcake premiered on February  7, 2006. View All Seasons Social Reviews  0 Discussions  0 Media Most Popular Videos  0 Backdrops  4 Posters  2 Recommendations   2012-06-02 Care Bears: Welcome to Care-a-Lot 5.0  Facts Status  Ended Network Certification TV-Y Meaning This program is designed to be appropriate for all children. Type  Scripted Original Language  English Runtime  45m, 22m Homepage  - Genres Animation Kids Keywords friendship little girl kids strawberry fruit Content Score 86 Almost there... Top Contributors 126 Marr \ud83c\uddf3\ud83c\uddf1 12 Banana s 3 speedycars 3 Maikkoum  View Edit History Popularity Trend  Login to edit  URL By  signing up  for an account on TMDb, you can post directly to Twitter and Facebook. You need to be logged in to continue. Click  here  to login or  here  to sign up.    page_wrap opened in html_head  Join the Community The Basics About TMDb Contact Us Support Forums API Blog Get Involved  Contribution Bible 3rd Party Applications Add New Movie Add New TV Show Community Guidelines Leaderboard Forums Twitter Facebook Legal Terms of Use Privacy Policy Login Sign Up"
}