{
  "link": "https://www.themoviedb.org/tv/9757?language=en",
  "title": "Goodnight, Beantown",
  "resume": "Matt Cassidy and Jennifer Barnes are reluctantly paired to anchor the news at a fictional TV station in Boston, Massachusetts, due to the sudden ratings drop.",
  "rate": "",
  "genre": [
    "Comedy"
  ],
  "cast": {
    "actor": [
      "Bill Bixby",
      "Stephanie Faracy",
      "G. W. Bailey",
      "Jim Staahl",
      "Tracey Gold"
    ]
  },
  "characters": {
    "characters": [
      "Matt Cassidy",
      "Valerie Wood",
      "Albert Addelson",
      "Frank Fletcher",
      "Susan Barnes"
    ]
  },
  "site_data": "html Apps Forums Leaderboard Contribute API Support Discover Movies TV Shows Movies Popular Top Rated Upcoming Now Playing TV Shows Popular Top Rated On TV Airing Today People Popular People Can't find a movie or TV show? Login to create it. en Login Sign Up  ID: 9757   Expand Goodnight, Beantown   (1983) User Score Overview Matt Cassidy and Jennifer Barnes are reluctantly paired to anchor the news at a fictional TV station in Boston, Massachusetts, due to the sudden ratings drop. Featured Crew AJ Carothers Creator Discussions   Reviews Videos   Images   Changes Report Share Discussions General  0 Content Issues  0 Images Backdrops  0 Posters  1 Videos Trailers  0 Teasers  0 Clips  0 Featurettes  0 Opening Credits  0 Top Billed Cast Bill Bixby Matt Cassidy Stephanie Faracy Valerie Wood G. W. Bailey Albert Addelson Jim Staahl Frank Fletcher Tracey Gold Susan Barnes Full Cast & Crew Last Season Season 2 1983 | 13 Episodes Season 2 of Goodnight, Beantown premiered on October  2, 1983. View All Seasons Social Reviews  0 Discussions  0 Media Most Popular Videos  0 Backdrops  0 Posters  1 Recommendations We don't have enough data to suggest any TV shows based on Goodnight, Beantown. You can help by rating TV shows you've seen. Facts Status  Ended Network Certification  - Type  Scripted Original Language  English Runtime  30m Homepage  - Genres Comedy Keywords boston television tv news sitcom tv news anchor Content Score 79 Pump it up! We're close now. Top Contributors 19 Banana 6 Elizabeth Jennings S 3 Samara BD 2 Bob Daredevil  View Edit History Popularity Trend  Login to edit  URL By  signing up  for an account on TMDb, you can post directly to Twitter and Facebook. You need to be logged in to continue. Click  here  to login or  here  to sign up.    page_wrap opened in html_head  Join the Community The Basics About TMDb Contact Us Support Forums API Blog Get Involved  Contribution Bible 3rd Party Applications Add New Movie Add New TV Show Community Guidelines Leaderboard Forums Twitter Facebook Legal Terms of Use Privacy Policy Login Sign Up"
}