{
  "link": "https://www.themoviedb.org/tv/4606?language=en",
  "title": "Garfield and Friends",
  "resume": "The animated stories of Garfield the cat, Odie the dog, their owner Jon and the trouble they get into. And also Orson the Pig and his adventures on a farm with his fellow farm animals.",
  "rate": "",
  "genre": [
    "Animation",
    "Comedy"
  ],
  "cast": {
    "actor": [
      "Howard Morris",
      "Frank Welker",
      "Lorenzo Music",
      "Thom Huge",
      "Julie Payne"
    ]
  },
  "characters": {
    "characters": [
      "Garfield",
      "Jon Arbuckle"
    ]
  },
  "site_data": "html Apps Forums Leaderboard Contribute API Support Discover Movies TV Shows Movies Popular Top Rated Upcoming Now Playing TV Shows Popular Top Rated On TV Airing Today People Popular People Can't find a movie or TV show? Login to create it. en Login Sign Up  ID: 4606   Expand Garfield and Friends   (1988) User Score Overview The animated stories of Garfield the cat, Odie the dog, their owner Jon and the trouble they get into. And also Orson the Pig and his adventures on a farm with his fellow farm animals. Featured Crew Jim Davis Creator Discussions   Reviews Videos   Images   Changes Report Share Discussions General  0 Content Issues  1 Images Backdrops  2 Posters  4 Videos Trailers  0 Teasers  0 Clips  0 Featurettes  0 Opening Credits  0 Top Billed Cast Howard Morris Frank Welker Lorenzo Music Garfield Thom Huge Jon Arbuckle Julie Payne Full Cast & Crew Last Season Season 7 1994 | 48 Episodes Season 7 of Garfield and Friends premiered on September 17, 1994. View All Seasons Social Reviews  0 Discussions  0 Media Most Popular Videos  0 Backdrops  2 Posters  4 Recommendations   1984-09-05 Heathcliff & the Catillac Cats 5.4    1983-09-10 Inspector Gadget 6.6    1960-09-30 The Flintstones 7.0    1960-11-14 Popeye the Sailor 5.8    1964-12-18 The Pink Panther Show 7.0    1961-09-27 Top Cat 6.9    1990-09-14 Tiny Toon Adventures 7.3    1987-09-10 Teenage Mutant Ninja Turtles 7.3  Facts Status  Ended Network Certification  - Type  Scripted Original Language  English Runtime  30m Homepage  - Genres Animation Comedy Keywords cartoon cat cartoon dog Content Score 93 Almost there... Top Contributors 23 Banana z 8 zurman1 m 8 mclassen A 6 Aranyfiam  View Edit History Popularity Trend  Login to edit  URL By  signing up  for an account on TMDb, you can post directly to Twitter and Facebook. You need to be logged in to continue. Click  here  to login or  here  to sign up.    page_wrap opened in html_head  Join the Community The Basics About TMDb Contact Us Support Forums API Blog Get Involved  Contribution Bible 3rd Party Applications Add New Movie Add New TV Show Community Guidelines Leaderboard Forums Twitter Facebook Legal Terms of Use Privacy Policy Login Sign Up"
}