{
  "link": "https://www.themoviedb.org/tv/73336?language=en",
  "title": "Maripier!",
  "resume": "We don't have an overview translated in English. Help us expand our database by adding one.",
  "rate": "",
  "genre": [
    "Talk"
  ],
  "cast": {
    "actor": [
      "Maripier Morin",
      "Martin Perizzolo"
    ]
  },
  "characters": {
    "characters": [
      "Elle-m\u00eame - Animatrice",
      "Lui-m\u00eame - Co-Animateur"
    ]
  },
  "site_data": "html Apps Forums Leaderboard Contribute API Support Discover Movies TV Shows Movies Popular Top Rated Upcoming Now Playing TV Shows Popular Top Rated On TV Airing Today People Popular People Can't find a movie or TV show? Login to create it. en Login Sign Up  ID: 73336   Expand Maripier!   (2016) User Score Overview We don't have an overview translated in English. Help us expand our database by adding one. Discussions   Reviews Videos   Images   Changes Report Share Discussions General  0 Content Issues  0 Images Backdrops  2 Posters  1 Videos Trailers  0 Teasers  0 Clips  0 Featurettes  0 Opening Credits  0 Top Billed Cast Maripier Morin Elle-m\u00eame - Animatrice Martin Perizzolo Lui-m\u00eame - Co-Animateur Full Cast & Crew Last Season Season 2 2017 | 24 Episodes Season 2 of Maripier! premiered on August 24, 2017. View All Seasons Social Reviews  0 Discussions  0 Media Most Popular Videos  0 Backdrops  2 Posters  1 Recommendations We don't have enough data to suggest any TV shows based on Maripier!. You can help by rating TV shows you've seen. Facts Status  Returning Series Network Certification G Meaning Suitable for general audiences. Programming suitable for the entire family with mild violence, and mild profanity and/or censored language. Type  Talk Show Original Language  French Runtime  30m Homepage   http://www.ztele.com/emissions/maripier Genres Talk Keywords talk show Content Score 50 Still needs a little work. Top Contributors 34 Banana 9 Guipat 6 warham28  View Edit History Popularity Trend  Login to edit  URL By  signing up  for an account on TMDb, you can post directly to Twitter and Facebook. You need to be logged in to continue. Click  here  to login or  here  to sign up.    page_wrap opened in html_head  Join the Community The Basics About TMDb Contact Us Support Forums API Blog Get Involved  Contribution Bible 3rd Party Applications Add New Movie Add New TV Show Community Guidelines Leaderboard Forums Twitter Facebook Legal Terms of Use Privacy Policy Login Sign Up"
}