{
  "link": "https://www.themoviedb.org/tv/26317?language=en",
  "title": "Dickens Of London",
  "resume": "A mini-series based on the life of Charles Dickens.",
  "rate": "",
  "genre": [
    "Drama"
  ],
  "cast": {
    "actor": [
      "Roy Dotrice",
      "Ben Kingsley",
      "Diana Coupland",
      "Karen Dotrice",
      "Patsy Kensit"
    ]
  },
  "characters": {
    "characters": [
      "Charles Dickens",
      "Dr. John Elliotson",
      "Mrs. Dickens",
      "Maria Beadnell",
      "Georgina Hogarth"
    ]
  },
  "site_data": "html Apps Forums Leaderboard Contribute API Support Discover Movies TV Shows Movies Popular Top Rated Upcoming Now Playing TV Shows Popular Top Rated On TV Airing Today People Popular People Can't find a movie or TV show? Login to create it. en Login Sign Up  ID: 26317   Expand Dickens Of London   (1976) User Score Overview A mini-series based on the life of Charles Dickens. Discussions   Reviews Videos   Images   Changes Report Share Discussions General  0 Content Issues  0 Images Backdrops  1 Posters  1 Videos Trailers  0 Teasers  0 Clips  0 Featurettes  0 Opening Credits  0 Top Billed Cast Roy Dotrice Charles Dickens Ben Kingsley Dr. John Elliotson Diana Coupland Mrs. Dickens Karen Dotrice Maria Beadnell Patsy Kensit Georgina Hogarth Full Cast & Crew Last Season Season 1 1976 | 13 Episodes Season 1 of Dickens Of London premiered on September 28, 1976. View All Seasons Social Reviews  0 Discussions  0 Media Most Popular Videos  0 Backdrops  1 Posters  1 Recommendations We don't have enough data to suggest any TV shows based on Dickens Of London. You can help by rating TV shows you've seen. Facts Status  Ended Network Certification  - Type  Scripted Original Language  English Runtime  60m Homepage  - Genres Drama Keywords No keywords have been added. Content Score 86 Almost there... Top Contributors c 21 clhitch  View Edit History Popularity Trend  Login to edit  URL By  signing up  for an account on TMDb, you can post directly to Twitter and Facebook. You need to be logged in to continue. Click  here  to login or  here  to sign up.    page_wrap opened in html_head  Join the Community The Basics About TMDb Contact Us Support Forums API Blog Get Involved  Contribution Bible 3rd Party Applications Add New Movie Add New TV Show Community Guidelines Leaderboard Forums Twitter Facebook Legal Terms of Use Privacy Policy Login Sign Up"
}