{
  "link": "https://www.themoviedb.org/tv/72787?language=en",
  "title": "Patrick Melrose",
  "resume": "A critical and often humorous look at the upper class, tracking the protagonist\u2019s harrowing odyssey from a deeply traumatic childhood through adult substance abuse and, ultimately, toward recovery.",
  "rate": "85.0",
  "genre": [
    "Comedy",
    "Drama"
  ],
  "cast": [
    "Benedict Cumberbatch",
    "Jennifer Jason Leigh",
    "Hugo Weaving",
    "Anna Madeley",
    "Sebastian Maltz"
  ],
  "character": [
    "Patrick Melrose",
    "Eleanor Melrose",
    "David Melrose",
    "Mary",
    "Young Patrick Melrose"
  ],
  "site_data": "html Apps Forums Leaderboard Contribute API Support Discover Movies TV Shows Movies Popular Top Rated Upcoming Now Playing TV Shows Popular Top Rated On TV Airing Today People Popular People Can't find a movie or TV show? Login to create it. en Login Sign Up  ID: 72787   Expand Patrick Melrose   (2018) User Score  Play Trailer Overview A critical and often humorous look at the upper class, tracking the protagonist\u2019s harrowing odyssey from a deeply traumatic childhood through adult substance abuse and, ultimately, toward recovery. Featured Crew David Nicholls Creator Discussions   Reviews Videos   Images   Changes Report Share Discussions General  0 Content Issues  1 Images Backdrops  7 Posters  5 Videos Trailers  1 Teasers  0 Clips  1 Featurettes  0 Opening Credits  0 Top Billed Cast Benedict Cumberbatch Patrick Melrose Jennifer Jason Leigh Eleanor Melrose Hugo Weaving David Melrose Anna Madeley Mary Sebastian Maltz Young Patrick Melrose Full Cast & Crew Current Season Season 1 2018 | 5 Episodes Season 1 of Patrick Melrose premiered on May 12, 2018. View All Seasons Social Reviews  0 Discussions  1 Subject Status Replies Last Reply There are no discussions for Patrick Melrose. Login to be first! Go to Discussions Media Most Popular Videos  2 Backdrops  7 Posters  5 Recommendations   2015-04-20 Safe House 6.3    2012-02-27 Danger 5 7.7    2018-04-05 Deep State 6.4    2017-01-25 Mary Kills People 7.5    2018-04-08 Killing Eve 8.7    2016-01-21 Baskets 7.2    2016-01-22 Stan Lee's Lucky Man 7.3    2014-09-21 The Code 7.4  Facts Status  Ended Networks Certification TV-MA Meaning This program is specifically designed to be viewed by adults and therefore may be unsuitable for children under 17 Type  Miniseries Original Language  English Runtime  60m Homepage   http://www.sho.com/patrick-melrose Genres Comedy Drama Keywords based on novel or book miniseries Content Score 100 Yes! Looking good! Top Contributors 59 Elizabeth Jennings 16 Sergiojamon 14 Marr \ud83c\uddf3\ud83c\uddf1 12 EveDemocracy  View Edit History Popularity Trend  Login to edit  URL By  signing up  for an account on TMDb, you can post directly to Twitter and Facebook. You need to be logged in to continue. Click  here  to login or  here  to sign up.    page_wrap opened in html_head  Join the Community The Basics About TMDb Contact Us Support Forums API Blog Get Involved  Contribution Bible 3rd Party Applications Add New Movie Add New TV Show Community Guidelines Leaderboard Forums Twitter Facebook Legal Terms of Use Privacy Policy Login Sign Up"
}