{
  "link": "https://www.themoviedb.org/tv/331?language=en",
  "title": "America's Next Top Model",
  "resume": "Aspiring models compete for a chance to break into the business with a panel of judges critiquing their progress throughout the competition.",
  "rate": "46.0",
  "genre": [
    "Reality"
  ],
  "cast": [
    "Tyra Banks",
    "Drew Elliott",
    "Law Roach",
    "Ashley Graham"
  ],
  "character": [
    "Herself - Host",
    "Himself - Judge",
    "Himself - Judge",
    "Herself - Judge"
  ],
  "site_data": "html Apps Forums Leaderboard Contribute API Support Discover Movies TV Shows Movies Popular Top Rated Upcoming Now Playing TV Shows Popular Top Rated On TV Airing Today People Popular People Can't find a movie or TV show? Login to create it. en Login Sign Up  ID: 331   Expand America's Next Top Model   (2003) User Score  Play Trailer Overview Aspiring models compete for a chance to break into the business with a panel of judges critiquing their progress throughout the competition. Featured Crew Tyra Banks Creator Discussions   Reviews Videos   Images   Changes Report Share Discussions General  3 Content Issues  0 Images Backdrops  22 Posters  10 Videos Trailers  1 Teasers  0 Clips  0 Featurettes  0 Opening Credits  0 Top Billed Cast Tyra Banks Herself - Host Drew Elliott Himself - Judge Law Roach Himself - Judge Ashley Graham Herself - Judge Full Cast & Crew Current Season Season 24 2018 | 15 Episodes View All Seasons Social Reviews  0 Discussions  3 Subject Status Replies Last Reply Come to the ANTM board Open 8 by  Poetist Just a little tension Open 8 by  Poetist Live a day in the life of Rita Open 1 by  Ivy Templeton Go to Discussions Media Most Popular Videos  1 Backdrops  22 Posters  10 Recommendations   2004-12-01 Project Runway 5.0    2008-12-03 Man v. Food 6.7    2002-06-11 American Idol 4.4    2005-05-30 Hell's Kitchen 6.3    2012-01-05 Project Runway All Stars 7.4    2006-08-07 Gene Simmons Family Jewels 4.4    2004-10-19 The Biggest Loser 4.6    1995-05-28 Dr. Katz, Professional Therapist 7.6  Facts Status  Returning Series Network Certification  - Type  Reality Original Language  English Runtime  42m Homepage   http://www.vh1.com/shows/americas-next-top-model Genres Reality Keywords model modeling Content Score 100 Yes! Looking good! Top Contributors 104 Elizabeth Jennings m 10 m1nty 4 Medianoche z 4 zurman1  View Edit History Popularity Trend  Login to edit  URL By  signing up  for an account on TMDb, you can post directly to Twitter and Facebook. You need to be logged in to continue. Click  here  to login or  here  to sign up.    page_wrap opened in html_head  Join the Community The Basics About TMDb Contact Us Support Forums API Blog Get Involved  Contribution Bible 3rd Party Applications Add New Movie Add New TV Show Community Guidelines Leaderboard Forums Twitter Facebook Legal Terms of Use Privacy Policy Login Sign Up"
}