{
  "link": "https://www.themoviedb.org/tv/61313?language=en",
  "title": "Deux hommes en or",
  "resume": "We don't have an overview translated in English. Help us expand our database by adding one.",
  "rate": "",
  "genre": [
    "News",
    "Talk"
  ],
  "cast": {
    "actor": [
      "Patrick Lagac\u00e9",
      "Pierre-Yves Lord"
    ]
  },
  "characters": {
    "characters": [
      "Himself - Host",
      "Himself - Host"
    ]
  },
  "site_data": "html Apps Forums Leaderboard Contribute API Support Discover Movies TV Shows Movies Popular Top Rated Upcoming Now Playing TV Shows Popular Top Rated On TV Airing Today People Popular People Can't find a movie or TV show? Login to create it. en Login Sign Up  ID: 61313   Expand Deux hommes en or   (2013) User Score Overview We don't have an overview translated in English. Help us expand our database by adding one. Featured Crew Patrick Lagac\u00e9 Creator Pierre-Louis Laberge Creator Discussions   Reviews Videos   Images   Changes Report Share Discussions General  0 Content Issues  0 Images Backdrops  3 Posters  1 Videos Trailers  0 Teasers  0 Clips  0 Featurettes  0 Opening Credits  0 Top Billed Cast Patrick Lagac\u00e9 Himself - Host Pierre-Yves Lord Himself - Host Full Cast & Crew Last Season Season 5 2017 | 13 Episodes Season 5 of Deux hommes en or premiered on September 15, 2017. View All Seasons Social Reviews  0 Discussions  0 Media Most Popular Videos  0 Backdrops  3 Posters  1 Recommendations We don't have enough data to suggest any TV shows based on Deux hommes en or. You can help by rating TV shows you've seen. Facts Status  Returning Series Network Certification G Meaning Suitable for general audiences. Programming suitable for the entire family with mild violence, and mild profanity and/or censored language. Type  News Original Language  French Runtime  60m Homepage   http://deuxhommesenor.telequebec.tv/ Genres News Talk Keywords talk show Content Score 56 We're so close, yet so far. Top Contributors 40 Guipat x 8 xNRJx 6 Elizabeth Jennings m 2 marcdede  View Edit History Popularity Trend  Login to edit  URL By  signing up  for an account on TMDb, you can post directly to Twitter and Facebook. You need to be logged in to continue. Click  here  to login or  here  to sign up.    page_wrap opened in html_head  Join the Community The Basics About TMDb Contact Us Support Forums API Blog Get Involved  Contribution Bible 3rd Party Applications Add New Movie Add New TV Show Community Guidelines Leaderboard Forums Twitter Facebook Legal Terms of Use Privacy Policy Login Sign Up"
}