{
  "link": "https://www.themoviedb.org/tv/65190?language=en",
  "title": "Le clan",
  "resume": "Yannick Moreau is a reformed criminal who rebuilt his life in Quebec living with a new identity under the witness protection program. Will the past catch up with him?",
  "rate": "",
  "genre": [
    "Drama"
  ],
  "cast": {
    "actor": [
      "S\u00e9bastien Ricard",
      "Beno\u00eet Gouin",
      "Karine Lagueux",
      "Germain Houde",
      "Denise Bouchard"
    ]
  },
  "characters": {
    "characters": [
      "Jean-Fran\u00e7ois Gagnon",
      "Thomas Chamberland",
      "Brigitte Bonin",
      "R\u00e9jean Marcil",
      "Carole Moreau"
    ]
  },
  "site_data": "html Apps Forums Leaderboard Contribute API Support Discover Movies TV Shows Movies Popular Top Rated Upcoming Now Playing TV Shows Popular Top Rated On TV Airing Today People Popular People Can't find a movie or TV show? Login to create it. en Login Sign Up  ID: 65190   Expand Le clan   (2015) User Score Overview Yannick Moreau is a reformed criminal who rebuilt his life in Quebec living with a new identity under the witness protection program. Will the past catch up with him? Discussions   Reviews Videos   Images   Changes Report Share Discussions General  0 Content Issues  0 Images Backdrops  6 Posters  3 Videos Trailers  0 Teasers  0 Clips  0 Featurettes  0 Opening Credits  0 Top Billed Cast S\u00e9bastien Ricard Jean-Fran\u00e7ois Gagnon Beno\u00eet Gouin Thomas Chamberland Karine Lagueux Brigitte Bonin Germain Houde R\u00e9jean Marcil Denise Bouchard Carole Moreau Full Cast & Crew Last Season Season 2 2016 | 6 Episodes Season 2 of Le clan premiered on March 16, 2016. View All Seasons Social Reviews  0 Discussions  0 Media Most Popular Videos  0 Backdrops  6 Posters  3 Recommendations We don't have enough data to suggest any TV shows based on Le clan. You can help by rating TV shows you've seen. Facts Status  Cancelled Network Certification  - Type  Scripted Original Language  French Runtime  43m Homepage   http://leclan.radio-canada.ca/ Genres Drama Keywords small town canada witness protection rural setting crime family Content Score 86 Almost there... Top Contributors 59 Banana YG 2 Yves Guy  View Edit History Popularity Trend  Login to edit  URL By  signing up  for an account on TMDb, you can post directly to Twitter and Facebook. You need to be logged in to continue. Click  here  to login or  here  to sign up.    page_wrap opened in html_head  Join the Community The Basics About TMDb Contact Us Support Forums API Blog Get Involved  Contribution Bible 3rd Party Applications Add New Movie Add New TV Show Community Guidelines Leaderboard Forums Twitter Facebook Legal Terms of Use Privacy Policy Login Sign Up"
}