{
  "link": "https://www.themoviedb.org/tv/65472?language=en",
  "title": "\u041a\u0430\u043a \u044f \u0441\u0442\u0430\u043b \u0440\u0443\u0441\u0441\u043a\u0438\u043c",
  "resume": "We don't have an overview translated in English. Help us expand our database by adding one.",
  "rate": "",
  "genre": [
    "Comedy",
    "Drama"
  ],
  "cast": {
    "actor": [
      "Mateusz Damiecki",
      "Svetlana Ivanova",
      "Yuri Vasilyev"
    ]
  },
  "characters": {
    "characters": [
      "Aleks Uilson",
      "Anna Bystrova",
      "Anatoliy Platonov"
    ]
  },
  "site_data": "html Apps Forums Leaderboard Contribute API Support Discover Movies TV Shows Movies Popular Top Rated Upcoming Now Playing TV Shows Popular Top Rated On TV Airing Today People Popular People Can't find a movie or TV show? Login to create it. en Login Sign Up  ID: 65472   Expand \u041a\u0430\u043a \u044f \u0441\u0442\u0430\u043b \u0440\u0443\u0441\u0441\u043a\u0438\u043c   (2015) User Score Overview We don't have an overview translated in English. Help us expand our database by adding one. Featured Crew Konstantin Statskiy Creator Discussions   Reviews Videos   Images   Changes Report Share Discussions General  0 Content Issues  0 Images Backdrops  1 Posters  1 Videos Trailers  0 Teasers  0 Clips  0 Featurettes  0 Opening Credits  0 Top Billed Cast Mateusz Damiecki Aleks Uilson Svetlana Ivanova Anna Bystrova Yuri Vasilyev Anatoliy Platonov Full Cast & Crew Last Season Season 1 2015 | 20 Episodes Season 1 of \u041a\u0430\u043a \u044f \u0441\u0442\u0430\u043b \u0440\u0443\u0441\u0441\u043a\u0438\u043c premiered on November  2, 2015. View All Seasons Social Reviews  0 Discussions  0 Media Most Popular Videos  0 Backdrops  1 Posters  1 Recommendations We don't have enough data to suggest any TV shows based on \u041a\u0430\u043a \u044f \u0441\u0442\u0430\u043b \u0440\u0443\u0441\u0441\u043a\u0438\u043c. You can help by rating TV shows you've seen. Facts Status  Returning Series Network Certification 16+ Meaning Only teens the age of 16 or older can watch. Type  Scripted Original Language  Russian Runtime  24m Homepage   http://ctc.ru/projects/serials/kak-ya-stal-russkim/ Genres Comedy Drama Keywords No keywords have been added. Content Score 64 We're so close, yet so far. Top Contributors v 33 vking \u0414\u0414 19 \u0414\u0430\u043d\u0438\u043b \u0414\u0430\u043d\u0438\u043b\u043e\u0432 7 george674834080 5 Chronos1121  View Edit History Popularity Trend  Login to edit  URL By  signing up  for an account on TMDb, you can post directly to Twitter and Facebook. You need to be logged in to continue. Click  here  to login or  here  to sign up.    page_wrap opened in html_head  Join the Community The Basics About TMDb Contact Us Support Forums API Blog Get Involved  Contribution Bible 3rd Party Applications Add New Movie Add New TV Show Community Guidelines Leaderboard Forums Twitter Facebook Legal Terms of Use Privacy Policy Login Sign Up"
}