{
  "link": "https://www.themoviedb.org/tv/39179?language=en",
  "title": "Sweet Surrender",
  "resume": "Sweet Surrender is an American television sitcom that aired for one season on NBC from April 18, 1987 to July 8, 1987.",
  "rate": "",
  "genre": [
    "Comedy"
  ],
  "cast": {
    "actor": [
      "Mark Blum",
      "Dana Delany",
      "Marjorie Lord",
      "Christopher Rich",
      "David Doyle"
    ]
  },
  "characters": {
    "characters": [
      "Georgia Holden"
    ]
  },
  "site_data": "html Apps Forums Leaderboard Contribute API Support Discover Movies TV Shows Movies Popular Top Rated Upcoming Now Playing TV Shows Popular Top Rated On TV Airing Today People Popular People Can't find a movie or TV show? Login to create it. en Login Sign Up  ID: 39179   Expand Sweet Surrender   (1987) User Score Overview Sweet Surrender is an American television sitcom that aired for one season on NBC from April 18, 1987 to July 8, 1987. Discussions   Reviews Videos   Images   Changes Report Share Discussions General  0 Content Issues  0 Images Backdrops  0 Posters  1 Videos Trailers  0 Teasers  0 Clips  0 Featurettes  0 Opening Credits  0 Top Billed Cast Mark Blum Dana Delany Georgia Holden Marjorie Lord Christopher Rich David Doyle Full Cast & Crew Last Season Season 1 1987 | 6 Episodes Season 1 of Sweet Surrender premiered on April 18, 1987. View All Seasons Social Reviews  0 Discussions  0 Media Most Popular Videos  0 Backdrops  0 Posters  1 Recommendations We don't have enough data to suggest any TV shows based on Sweet Surrender. You can help by rating TV shows you've seen. Facts Status  Ended Network Certification  - Type  Scripted Original Language  English Runtime  30m Homepage  - Genres Comedy Keywords family sitcom Content Score 71 Just a little bit more... Top Contributors 6 Banana 3 t0by  View Edit History Popularity Trend  Login to edit  URL By  signing up  for an account on TMDb, you can post directly to Twitter and Facebook. You need to be logged in to continue. Click  here  to login or  here  to sign up.    page_wrap opened in html_head  Join the Community The Basics About TMDb Contact Us Support Forums API Blog Get Involved  Contribution Bible 3rd Party Applications Add New Movie Add New TV Show Community Guidelines Leaderboard Forums Twitter Facebook Legal Terms of Use Privacy Policy Login Sign Up"
}