{
  "link": "https://www.themoviedb.org/tv/24074?language=en",
  "title": "Boy Dominic",
  "resume": "The adventures of a 12-year-old boy's struggles in Victorian Yorkshire, after his father, Captain Charles Bulman, is lost, presumed drowned off the coast of Africa.",
  "rate": "80.0",
  "genre": [
    "Family"
  ],
  "cast": [
    "Brian Blessed",
    "Mary Morris",
    "Maxine Audley",
    "Richard Todd",
    "Julian Glover"
  ],
  "character": [
    "William Woodcock",
    "Lady Bulman",
    "Lady Charlotte",
    "Capt. Richard Bulman",
    "Jackson"
  ],
  "site_data": "html Apps Forums Leaderboard Contribute API Support Discover Movies TV Shows Movies Popular Top Rated Upcoming Now Playing TV Shows Popular Top Rated On TV Airing Today People Popular People Can't find a movie or TV show? Login to create it. en Login Sign Up  ID: 24074   Expand Boy Dominic   (1974) User Score Overview The adventures of a 12-year-old boy's struggles in Victorian Yorkshire, after his father, Captain Charles Bulman, is lost, presumed drowned off the coast of Africa. Discussions   Reviews Videos   Images   Changes Report Share Discussions General  0 Content Issues  0 Images Backdrops  0 Posters  1 Videos Trailers  0 Teasers  0 Clips  0 Featurettes  0 Opening Credits  0 Top Billed Cast Brian Blessed William Woodcock Mary Morris Lady Bulman Maxine Audley Lady Charlotte Richard Todd Capt. Richard Bulman Julian Glover Jackson Full Cast & Crew Last Season Season 1 1974 | 13 Episodes Season 1 of Boy Dominic premiered on March 24, 1974. View All Seasons Social Reviews  0 Discussions  0 Media Most Popular Videos  0 Backdrops  0 Posters  1 Recommendations We don't have enough data to suggest any TV shows based on Boy Dominic. You can help by rating TV shows you've seen. Facts Status  Ended Network Certification  - Type  Scripted Original Language  English Runtime  30m Homepage  - Genres Family Keywords children Content Score 71 Just a little bit more... Top Contributors 21 tatergator  View Edit History Popularity Trend  Login to edit  URL By  signing up  for an account on TMDb, you can post directly to Twitter and Facebook. You need to be logged in to continue. Click  here  to login or  here  to sign up.    page_wrap opened in html_head  Join the Community The Basics About TMDb Contact Us Support Forums API Blog Get Involved  Contribution Bible 3rd Party Applications Add New Movie Add New TV Show Community Guidelines Leaderboard Forums Twitter Facebook Legal Terms of Use Privacy Policy Login Sign Up"
}