{
  "link": "https://www.themoviedb.org/tv/966?language=en",
  "title": "Hollyoaks",
  "resume": "The daily soap that follows the loves, lives and misdemeanours of a group of people living in the Chester village of Hollyoaks where anything could, and frequently does, happen...",
  "rate": "37.0",
  "genre": [
    "Comedy",
    "Drama",
    "Soap"
  ],
  "cast": [
    "Nick Pickard",
    "Amanda Clapham",
    "Ashley Slanina-Davies",
    "Tamara Wall",
    "Alex Fletcher"
  ],
  "character": [
    "Tony Hutchinson",
    "Holly Cunningham",
    "Amy Barnes/Amy Knight",
    "Grace Black",
    "Diane O'Connor/Diane Drinkwell/Diane Hutchinson"
  ],
  "site_data": "html Apps Forums Leaderboard Contribute API Support Discover Movies TV Shows Movies Popular Top Rated Upcoming Now Playing TV Shows Popular Top Rated On TV Airing Today People Popular People Can't find a movie or TV show? Login to create it. en Login Sign Up  ID: 966   Expand Hollyoaks   (1995) User Score Overview The daily soap that follows the loves, lives and misdemeanours of a group of people living in the Chester village of Hollyoaks where anything could, and frequently does, happen... Featured Crew Phil Redmond Creator Discussions   Reviews Videos   Images   Changes Report Share Discussions General  9 Content Issues  0 Images Backdrops  3 Posters  2 Videos Trailers  0 Teasers  0 Clips  0 Featurettes  0 Opening Credits  1 Top Billed Cast Nick Pickard Tony Hutchinson Amanda Clapham Holly Cunningham Ashley Slanina-Davies Amy Barnes/Amy Knight Tamara Wall Grace Black Alex Fletcher Diane O'Connor/Diane Drinkwell/Diane Hutchinson Full Cast & Crew Last Season Season 23 2017 | 3 Episodes Season 23 of Hollyoaks premiered on January  2, 2017. View All Seasons Social Reviews  0 Discussions  9 Subject Status Replies Last Reply N What episode comes after the Indecent Behaviour Open 0 by Nephlim14\n      \n     U Why is Nancy wearing a wig? Open 0 by UrielF\n      \n     U Zoe AT LAST Open 0 by UrielF\n      \n     Go to Discussions Media Most Popular Videos  1 Backdrops  3 Posters  2 Recommendations   1995-08-12 Soccer AM 5.0    A Question of Sport 6.5    Soccer Saturday 6.5    1999-11-08 My Parents Are Aliens 6.0    1984-02-26 Spitting Image 7.8    2005-07-04 The Jeremy Kyle Show 6.3    1985-03-18 Neighbours 5.4    1988-01-17 Home and Away 4.1  Facts Status  Returning Series Network Certification TV-14 Meaning This program contains some material that many parents would find unsuitable for children under 14 years of age. Type  Scripted Original Language  English Runtime  30m Homepage   http://www.channel4.com/programmes/hollyoaks Genres Comedy Drama Soap Keywords england pub family relationships teenage girl teenage boy soap opera drunkenness teen drama Content Score 100 Yes! Looking good! Top Contributors L 95 Leah 37 Elizabeth Jennings w 28 wonder2wonder 20 Banana  View Edit History Popularity Trend  Login to edit  URL By  signing up  for an account on TMDb, you can post directly to Twitter and Facebook. You need to be logged in to continue. Click  here  to login or  here  to sign up.    page_wrap opened in html_head  Join the Community The Basics About TMDb Contact Us Support Forums API Blog Get Involved  Contribution Bible 3rd Party Applications Add New Movie Add New TV Show Community Guidelines Leaderboard Forums Twitter Facebook Legal Terms of Use Privacy Policy Login Sign Up"
}