{
  "link": "https://www.themoviedb.org/tv/46891?language=en",
  "title": "Bad Samaritans",
  "resume": "Bad Samaritans is an American comedy series produced by Walt Becker, Kelly Hayes, and Ross Putman. It premiered on Netflix on March 31, 2013.",
  "rate": "",
  "genre": [
    "Comedy"
  ],
  "cast": {
    "actor": [
      "Brian Kubach",
      "Julianna Guill",
      "Alice Hunter",
      "Robert LaSardo",
      "Tommy Snider"
    ]
  },
  "characters": {
    "characters": [
      "Jake Gibson",
      "Drew Finnegan",
      "Trainy",
      "Doug",
      "Hagerty"
    ]
  },
  "site_data": "html Apps Forums Leaderboard Contribute API Support Discover Movies TV Shows Movies Popular Top Rated Upcoming Now Playing TV Shows Popular Top Rated On TV Airing Today People Popular People Can't find a movie or TV show? Login to create it. en Login Sign Up  ID: 46891   Expand Bad Samaritans   (2013) User Score  Play Trailer Overview Bad Samaritans is an American comedy series produced by Walt Becker, Kelly Hayes, and Ross Putman. It premiered on Netflix on March 31, 2013. Discussions   Reviews Videos   Images   Changes Report Share Discussions General  0 Content Issues  0 Images Backdrops  1 Posters  1 Videos Trailers  1 Teasers  0 Clips  0 Featurettes  0 Opening Credits  0 Top Billed Cast Brian Kubach Jake Gibson Julianna Guill Drew Finnegan Alice Hunter Trainy Robert LaSardo Doug Tommy Snider Hagerty Full Cast & Crew Last Season Season 1 2013 | 3 Episodes Season 1 of Bad Samaritans premiered on March 31, 2013. View All Seasons Social Reviews  0 Discussions  0 Media Most Popular Videos  1 Backdrops  1 Posters  1 Recommendations We don't have enough data to suggest any TV shows based on Bad Samaritans. You can help by rating TV shows you've seen. Facts Status  Ended Network Certification  - Type  Scripted Original Language  English Runtime  30m Homepage  - Genres Comedy Keywords community service Content Score 93 Almost there... Top Contributors 18 Banana TB 1 TMDb Bot z 1 zaBut  View Edit History Popularity Trend  Login to edit  URL By  signing up  for an account on TMDb, you can post directly to Twitter and Facebook. You need to be logged in to continue. Click  here  to login or  here  to sign up.    page_wrap opened in html_head  Join the Community The Basics About TMDb Contact Us Support Forums API Blog Get Involved  Contribution Bible 3rd Party Applications Add New Movie Add New TV Show Community Guidelines Leaderboard Forums Twitter Facebook Legal Terms of Use Privacy Policy Login Sign Up"
}