{
  "link": "https://www.themoviedb.org/tv/52776?language=en",
  "title": "Wiman Ma Prao",
  "resume": "Nice story about a magnate and his daughter.",
  "rate": "",
  "genre": [
    "Soap",
    "Drama"
  ],
  "cast": {
    "actor": [
      "Thunwa Suriyajak",
      "Thikumporn Rittapinun",
      "Sanya Kunakorn",
      "Tawan Jarujinda",
      "Asanai Tientong"
    ]
  },
  "characters": {
    "characters": [
      "\u0e2a\u0e37\u0e1a\u0e2a\u0e32\u0e22",
      "\u0e08\u0e38\u0e25\u0e25\u0e32",
      "\u0e2d\u0e32\u0e01\u0e4b\u0e07 (\u0e40\u0e08\u0e49\u0e32\u0e2a\u0e31\u0e27)",
      "\u0e41\u0e2a\u0e1a",
      "\u0e17\u0e23\u0e07\u0e40\u0e14\u0e0a"
    ]
  },
  "site_data": "html Apps Forums Leaderboard Contribute API Support Discover Movies TV Shows Movies Popular Top Rated Upcoming Now Playing TV Shows Popular Top Rated On TV Airing Today People Popular People Can't find a movie or TV show? Login to create it. en Login Sign Up  ID: 52776   Expand Wiman Ma Prao   (2013) User Score  Play Trailer Overview Nice story about a magnate and his daughter. Featured Crew \u0e41\u0e01\u0e49\u0e27\u0e40\u0e01\u0e49\u0e32 Creator Discussions   Reviews Videos   Images   Changes Report Share Discussions General  0 Content Issues  0 Images Backdrops  3 Posters  1 Videos Trailers  1 Teasers  0 Clips  0 Featurettes  0 Opening Credits  0 Top Billed Cast Thunwa Suriyajak \u0e2a\u0e37\u0e1a\u0e2a\u0e32\u0e22 Thikumporn Rittapinun \u0e08\u0e38\u0e25\u0e25\u0e32 Sanya Kunakorn \u0e2d\u0e32\u0e01\u0e4b\u0e07 (\u0e40\u0e08\u0e49\u0e32\u0e2a\u0e31\u0e27) Tawan Jarujinda \u0e41\u0e2a\u0e1a Asanai Tientong \u0e17\u0e23\u0e07\u0e40\u0e14\u0e0a Full Cast & Crew Last Season Season 1 2013 | 17 Episodes Season 1 of Wiman Ma Prao premiered on November 12, 2013. View All Seasons Social Reviews  0 Discussions  0 Media Most Popular Videos  1 Backdrops  3 Posters  1 Recommendations We don't have enough data to suggest any TV shows based on Wiman Ma Prao. You can help by rating TV shows you've seen. Facts Original Name  \u0e27\u0e34\u0e21\u0e32\u0e19\u0e21\u0e30\u0e1e\u0e23\u0e49\u0e32\u0e27 Status  Ended Network Certification PG Meaning Parental guidance is recommended for young viewers; PG-rated content may air at any time on digital-only channels, otherwise, it should only be broadcast between 8:30 a.m. and 4:00 p.m. and between 7:00 p.m. and 6:00 a.m. on weekdays, and between 10:00 a.m. and 6:00 a.m. on weekends. Type  Scripted Original Language  English Runtime  99m Homepage  - Genres Soap Drama Keywords thai lakorn Content Score 100 Yes! Looking good! Top Contributors 35 Crip TB 2 TMDb Bot 1 Elizabeth Jennings  View Edit History Popularity Trend  Login to edit  URL By  signing up  for an account on TMDb, you can post directly to Twitter and Facebook. You need to be logged in to continue. Click  here  to login or  here  to sign up.    page_wrap opened in html_head  Join the Community The Basics About TMDb Contact Us Support Forums API Blog Get Involved  Contribution Bible 3rd Party Applications Add New Movie Add New TV Show Community Guidelines Leaderboard Forums Twitter Facebook Legal Terms of Use Privacy Policy Login Sign Up"
}