{
  "link": "https://www.themoviedb.org/tv/65896?language=en",
  "title": "Sedwitz",
  "resume": "We don't have an overview translated in English. Help us expand our database by adding one.",
  "rate": "",
  "genre": [
    "Comedy"
  ],
  "cast": {
    "actor": [
      "Matthias Jentsch",
      "Kevin Wilke",
      "Eva M\u00e4hl",
      "Natalie H\u00fcnig",
      "Edith R\u00fccker"
    ]
  },
  "characters": {
    "characters": [
      "Feldwebel Ingo Schnaider",
      "Gefreiter Drik Stordel",
      "Debbie Haueisen",
      "Kerstin Pietzsch",
      "Kathleen Pietzsch"
    ]
  },
  "site_data": "html Apps Forums Leaderboard Contribute API Support Discover Movies TV Shows Movies Popular Top Rated Upcoming Now Playing TV Shows Popular Top Rated On TV Airing Today People Popular People Can't find a movie or TV show? Login to create it. en Login Sign Up  ID: 65896   Expand Sedwitz   (2015) User Score Overview We don't have an overview translated in English. Help us expand our database by adding one. Featured Crew Paul Harather Creator Stefan Schwarz Creator Discussions   Reviews Videos   Images   Changes Report Share Discussions General  0 Content Issues  0 Images Backdrops  0 Posters  1 Videos Trailers  0 Teasers  0 Clips  0 Featurettes  0 Opening Credits  0 Top Billed Cast Matthias Jentsch Feldwebel Ingo Schnaider Kevin Wilke Gefreiter Drik Stordel Eva M\u00e4hl Debbie Haueisen Natalie H\u00fcnig Kerstin Pietzsch Edith R\u00fccker Kathleen Pietzsch Full Cast & Crew Last Season Season 1 2015 | 6 Episodes Season 1 of Sedwitz premiered on September  3, 2015. View All Seasons Social Reviews  0 Discussions  0 Media Most Popular Videos  0 Backdrops  0 Posters  1 Recommendations   2008-01-07 Mord mit Aussicht 7.3    2011-12-23 Crime Scene Cleaner 7.8    2015-06-17 Deutschland 83 7.7  Facts Status  Ended Network Certification  - Type  Scripted Original Language  German Runtime  30m Homepage  - Genres Comedy Keywords germany eastern germany west germany Content Score 71 Just a little bit more... Top Contributors 40 Hollul 8 megaflo S 4 Samara 4 Marr \ud83c\uddf3\ud83c\uddf1  View Edit History Popularity Trend  Login to edit  URL By  signing up  for an account on TMDb, you can post directly to Twitter and Facebook. You need to be logged in to continue. Click  here  to login or  here  to sign up.    page_wrap opened in html_head  Join the Community The Basics About TMDb Contact Us Support Forums API Blog Get Involved  Contribution Bible 3rd Party Applications Add New Movie Add New TV Show Community Guidelines Leaderboard Forums Twitter Facebook Legal Terms of Use Privacy Policy Login Sign Up"
}