{
  "link": "https://www.themoviedb.org/tv/69156?language=en",
  "title": "Game Development Girls",
  "resume": "A drama based on a webtoon which depicts and builds a connection through the story of young women who work at a mobile game company.",
  "rate": "",
  "genre": [
    "Comedy"
  ],
  "cast": {
    "actor": [
      "Irene",
      "Lee Min-ji",
      "Lee Ji-Yeon",
      "Jang Dong-Yoon",
      "Lee Joo-young"
    ]
  },
  "characters": {
    "characters": [
      "Ah Reum",
      "Maci Mel",
      "Yeo Gi-Hye",
      "Gom Gae-Bal",
      "Joo Yeong"
    ]
  },
  "site_data": "html Apps Forums Leaderboard Contribute API Support Discover Movies TV Shows Movies Popular Top Rated Upcoming Now Playing TV Shows Popular Top Rated On TV Airing Today People Popular People Can't find a movie or TV show? Login to create it. en Login Sign Up  ID: 69156   Expand Game Development Girls   (2016) User Score Overview A drama based on a webtoon which depicts and builds a connection through the story of young women who work at a mobile game company. Discussions   Reviews Videos   Images   Changes Report Share Discussions General  0 Content Issues  0 Images Backdrops  1 Posters  1 Videos Trailers  0 Teasers  0 Clips  0 Featurettes  0 Opening Credits  0 Top Billed Cast Irene Ah Reum Lee Min-ji Maci Mel Lee Ji-Yeon Yeo Gi-Hye Jang Dong-Yoon Gom Gae-Bal Lee Joo-young Joo Yeong Full Cast & Crew Last Season Season 1 2016 | 11 Episodes Season 1 of Game Development Girls premiered on July 25, 2016. View All Seasons Social Reviews  0 Discussions  0 Media Most Popular Videos  0 Backdrops  1 Posters  1 Recommendations We don't have enough data to suggest any TV shows based on Game Development Girls. You can help by rating TV shows you've seen. Facts Original Name  \uac8c\uc784\ud68c\uc0ac \uc5ec\uc9c1\uc6d0\ub4e4 Status  Ended Network Certification  - Type  Scripted Original Language  Korean Runtime  9m Homepage  - Genres Comedy Keywords romance korea Content Score 86 Almost there... Top Contributors n 32 nubie M 6 Maria180493 3 Elizabeth Jennings d 1 daphie  View Edit History Popularity Trend  Login to edit  URL By  signing up  for an account on TMDb, you can post directly to Twitter and Facebook. You need to be logged in to continue. Click  here  to login or  here  to sign up.    page_wrap opened in html_head  Join the Community The Basics About TMDb Contact Us Support Forums API Blog Get Involved  Contribution Bible 3rd Party Applications Add New Movie Add New TV Show Community Guidelines Leaderboard Forums Twitter Facebook Legal Terms of Use Privacy Policy Login Sign Up"
}