{
  "link": "https://www.themoviedb.org/tv/77308?language=en",
  "title": "De Infiltrant",
  "resume": "We don't have an overview translated in English. Help us expand our database by adding one.",
  "rate": "",
  "genre": [
    "Crime",
    "Action",
    "Adventure"
  ],
  "cast": {
    "actor": [
      "Geert Van Rampelberg",
      "Dirk Roofthooft",
      "Natali Broods",
      "Peter van den Begin",
      "Wouter Hendrickx"
    ]
  },
  "characters": {
    "characters": [
      "Danny Desmedt",
      "Freddy Bernaerts",
      "Karen Hofman",
      "Marc Potvin",
      "Lars Devuyst"
    ]
  },
  "site_data": "html Apps Forums Leaderboard Contribute API Support Discover Movies TV Shows Movies Popular Top Rated Upcoming Now Playing TV Shows Popular Top Rated On TV Airing Today People Popular People Can't find a movie or TV show? Login to create it. en Login Sign Up  ID: 77308   Expand De Infiltrant   (2018) User Score Overview We don't have an overview translated in English. Help us expand our database by adding one. Discussions   Reviews Videos   Images   Changes Report Share Discussions General  0 Content Issues  0 Images Backdrops  2 Posters  1 Videos Trailers  0 Teasers  0 Clips  0 Featurettes  0 Opening Credits  0 Top Billed Cast Geert Van Rampelberg Danny Desmedt Dirk Roofthooft Freddy Bernaerts Natali Broods Karen Hofman Peter van den Begin Marc Potvin Wouter Hendrickx Lars Devuyst Full Cast & Crew Current Season Season 1 2018 | 5 Episodes Season 1 of De Infiltrant premiered on February  5, 2018. View All Seasons Social Reviews  0 Discussions  0 Media Most Popular Videos  0 Backdrops  2 Posters  1 Recommendations We don't have enough data to suggest any TV shows based on De Infiltrant. You can help by rating TV shows you've seen. Facts Status  Returning Series Network Certification  - Type  Scripted Original Language  Dutch; Flemish Runtime  - Homepage   https://vtm.be/de-infiltrant Genres Crime Action & Adventure Keywords No keywords have been added. Content Score 86 Almost there... Top Contributors 16 Elizabeth Jennings 10 Nero-J 3 Angel_Arrow TB 1 TMDb Bot  View Edit History Popularity Trend  Login to edit  URL By  signing up  for an account on TMDb, you can post directly to Twitter and Facebook. You need to be logged in to continue. Click  here  to login or  here  to sign up.    page_wrap opened in html_head  Join the Community The Basics About TMDb Contact Us Support Forums API Blog Get Involved  Contribution Bible 3rd Party Applications Add New Movie Add New TV Show Community Guidelines Leaderboard Forums Twitter Facebook Legal Terms of Use Privacy Policy Login Sign Up"
}