{
  "link": "https://www.themoviedb.org/tv/25793?language=en",
  "title": "Servants",
  "resume": "Bold and irreverent drama following the fortunes of a group of servants in an 1850s English country house.",
  "rate": "",
  "genre": [
    "Drama"
  ],
  "cast": {
    "actor": [
      "Christopher Fulford",
      "Orla Brady",
      "Joe Absolom",
      "Felicity Jones",
      "Kenny Doughty"
    ]
  },
  "characters": {
    "characters": [
      "Jarvis",
      "Flora Ryan",
      "George Cosmo",
      "Grace May",
      "William Forrest"
    ]
  },
  "site_data": "html Apps Forums Leaderboard Contribute API Support Discover Movies TV Shows Movies Popular Top Rated Upcoming Now Playing TV Shows Popular Top Rated On TV Airing Today People Popular People Can't find a movie or TV show? Login to create it. en Login Sign Up  ID: 25793   Expand Servants   (2003) User Score Overview Bold and irreverent drama following the fortunes of a group of servants in an 1850s English country house. Featured Crew Lucy Gannon Creator Tim Whitby Creator Discussions   Reviews Videos   Images   Changes Report Share Discussions General  0 Content Issues  0 Images Backdrops  0 Posters  1 Videos Trailers  0 Teasers  0 Clips  0 Featurettes  0 Opening Credits  0 Top Billed Cast Christopher Fulford Jarvis Orla Brady Flora Ryan Joe Absolom George Cosmo Felicity Jones Grace May Kenny Doughty William Forrest Full Cast & Crew Last Season Season 1 2003 | 6 Episodes Season 1 of Servants premiered on April 10, 2003. View All Seasons Social Reviews  0 Discussions  0 Media Most Popular Videos  0 Backdrops  0 Posters  1 Recommendations We don't have enough data to suggest any TV shows based on Servants. You can help by rating TV shows you've seen. Facts Status  Ended Network Certification  - Type  Scripted Original Language  English Runtime  50m Homepage   http://www.bbc.co.uk/drama/servants/ Genres Drama Keywords period drama costume drama Content Score 79 Pump it up! We're close now. Top Contributors 21 Sven-Erik Andersen c 7 clipper314 CM 4 Cherche Moi 2 Elizabeth Jennings  View Edit History Popularity Trend  Login to edit  URL By  signing up  for an account on TMDb, you can post directly to Twitter and Facebook. You need to be logged in to continue. Click  here  to login or  here  to sign up.    page_wrap opened in html_head  Join the Community The Basics About TMDb Contact Us Support Forums API Blog Get Involved  Contribution Bible 3rd Party Applications Add New Movie Add New TV Show Community Guidelines Leaderboard Forums Twitter Facebook Legal Terms of Use Privacy Policy Login Sign Up"
}