{
  "link": "https://www.themoviedb.org/tv/63154?language=en",
  "title": "No Goal",
  "resume": "We don't have an overview translated in English. Help us expand our database by adding one.",
  "rate": "90.0",
  "genre": [
    "Comedy",
    "Sci-Fi",
    "Fantasy"
  ],
  "cast": [
    "Jean-Guy Ruff",
    "Bruno Carette",
    "Alain Chabat",
    "Chantal Lauby",
    "Alexandre Pottier"
  ],
  "character": [
    "le Mercenaire",
    "Zeitoun",
    "le capitaine Lamar",
    "Panty",
    "Syntaxerror"
  ],
  "site_data": "html Apps Forums Leaderboard Contribute API Support Discover Movies TV Shows Movies Popular Top Rated Upcoming Now Playing TV Shows Popular Top Rated On TV Airing Today People Popular People Can't find a movie or TV show? Login to create it. en Login Sign Up  ID: 63154   Expand No Goal   (1987) User Score Overview We don't have an overview translated in English. Help us expand our database by adding one. Featured Crew Alain Chabat Creator Dominique Farrugia Creator Chantal Lauby Creator Discussions   Reviews Videos   Images   Changes Report Share Discussions General  0 Content Issues  0 Images Backdrops  0 Posters  1 Videos Trailers  0 Teasers  0 Clips  0 Featurettes  0 Opening Credits  0 Top Billed Cast Jean-Guy Ruff le Mercenaire Bruno Carette Zeitoun Alain Chabat le capitaine Lamar Chantal Lauby Panty Alexandre Pottier Syntaxerror Full Cast & Crew Last Season Season 1 1987 | 43 Episodes Season 1 of No Goal premiered on February  2, 1987. View All Seasons Social Reviews  0 Discussions  0 Media Most Popular Videos  0 Backdrops  0 Posters  1 Recommendations We don't have enough data to suggest any TV shows based on No Goal. You can help by rating TV shows you've seen. Facts Original Name  Objectif nul Status  Ended Network Certification 18 Meaning Not recommended for persons under 18. Allowed between midnight and 5 a.m. and only in some channels, access to these programs is locked by a personal password. Type  Scripted Original Language  French Runtime  8m, 6m, 7m Homepage  - Genres Comedy Sci-Fi & Fantasy Keywords No keywords have been added. Content Score 71 Just a little bit more... Top Contributors 28 kwagi_movie D 26 Decaliax 5 Elizabeth Jennings  View Edit History Popularity Trend  Login to edit  URL By  signing up  for an account on TMDb, you can post directly to Twitter and Facebook. You need to be logged in to continue. Click  here  to login or  here  to sign up.    page_wrap opened in html_head  Join the Community The Basics About TMDb Contact Us Support Forums API Blog Get Involved  Contribution Bible 3rd Party Applications Add New Movie Add New TV Show Community Guidelines Leaderboard Forums Twitter Facebook Legal Terms of Use Privacy Policy Login Sign Up"
}