{
  "link": "https://www.themoviedb.org/tv/76660?language=en",
  "title": "En natt",
  "resume": "Romantic series about two people that meet at a blind date.",
  "rate": "",
  "genre": [
    "Drama"
  ],
  "cast": {
    "actor": [
      "Anders Baasmo Christiansen",
      "MyAnna Buring"
    ]
  },
  "characters": {
    "characters": [
      "Jonas",
      "Elizabeth"
    ]
  },
  "site_data": "html Apps Forums Leaderboard Contribute API Support Discover Movies TV Shows Movies Popular Top Rated Upcoming Now Playing TV Shows Popular Top Rated On TV Airing Today People Popular People Can't find a movie or TV show? Login to create it. en Login Sign Up  ID: 76660   Expand En natt   (2018) User Score Overview Romantic series about two people that meet at a blind date. Featured Crew \u00d8ystein Karlsen Creator Kristopher Schau Creator Discussions   Reviews Videos   Images   Changes Report Share Discussions General  0 Content Issues  0 Images Backdrops  1 Posters  1 Videos Trailers  0 Teasers  0 Clips  0 Featurettes  0 Opening Credits  0 Top Billed Cast Anders Baasmo Christiansen Jonas MyAnna Buring Elizabeth Full Cast & Crew Current Season Season 1 2018 | 10 Episodes Season 1 of En natt premiered on February  2, 2018. View All Seasons Social Reviews  0 Discussions  0 Media Most Popular Videos  0 Backdrops  1 Posters  1 Recommendations We don't have enough data to suggest any TV shows based on En natt. You can help by rating TV shows you've seen. Facts Status  Returning Series Network Certification  - Type  Scripted Original Language  Norwegian Runtime  30m Homepage  - Genres Drama Keywords romance Content Score 64 We're so close, yet so far. Top Contributors 35 Bendik 1 prostapostei  View Edit History Popularity Trend  Login to edit  URL By  signing up  for an account on TMDb, you can post directly to Twitter and Facebook. You need to be logged in to continue. Click  here  to login or  here  to sign up.    page_wrap opened in html_head  Join the Community The Basics About TMDb Contact Us Support Forums API Blog Get Involved  Contribution Bible 3rd Party Applications Add New Movie Add New TV Show Community Guidelines Leaderboard Forums Twitter Facebook Legal Terms of Use Privacy Policy Login Sign Up"
}