{
  "link": "https://www.themoviedb.org/tv/72067?language=en",
  "title": "Signature",
  "resume": "We don't have an overview translated in English. Help us expand our database by adding one.",
  "rate": "75.0",
  "genre": [
    "Action",
    "Adventure"
  ],
  "cast": [
    "Denis Mounien",
    "Yaelle Legallais",
    "Patrick Gourdial",
    "Swan Demarsan",
    "T\u00e9o Gigan"
  ],
  "character": [
    "p\u00eacheur 1",
    "Caro",
    "p\u00eacheur 2",
    "St\u00e9phane",
    "Denis"
  ],
  "site_data": "html Apps Forums Leaderboard Contribute API Support Discover Movies TV Shows Movies Popular Top Rated Upcoming Now Playing TV Shows Popular Top Rated On TV Airing Today People Popular People Can't find a movie or TV show? Login to create it. en Login Sign Up  ID: 72067   Expand Signature   (2011) User Score Overview We don't have an overview translated in English. Help us expand our database by adding one. Featured Crew Herv\u00e9 Hadmar Creator Marc Herpoux Creator Discussions   Reviews Videos   Images   Changes Report Share Discussions General  0 Content Issues  0 Images Backdrops  1 Posters  1 Videos Trailers  0 Teasers  0 Clips  0 Featurettes  0 Opening Credits  0 Top Billed Cast Denis Mounien p\u00eacheur 1 Yaelle Legallais Caro Patrick Gourdial p\u00eacheur 2 Swan Demarsan St\u00e9phane T\u00e9o Gigan Denis Full Cast & Crew Last Season Season 1 2011 | 6 Episodes Season 1 of Signature premiered on April 22, 2011. View All Seasons Social Reviews  0 Discussions  0 Media Most Popular Videos  0 Backdrops  1 Posters  1 Recommendations We don't have enough data to suggest any TV shows based on Signature. You can help by rating TV shows you've seen. Facts Status  Ended Network Certification  - Type  Scripted Original Language  French Runtime  52m Homepage  - Genres Action & Adventure Keywords thriller Content Score 86 Almost there... Top Contributors t 25 tmdb18595655 F 9 FannyRU 3 karaa 2 Elizabeth Jennings  View Edit History Popularity Trend  Login to edit  URL By  signing up  for an account on TMDb, you can post directly to Twitter and Facebook. You need to be logged in to continue. Click  here  to login or  here  to sign up.    page_wrap opened in html_head  Join the Community The Basics About TMDb Contact Us Support Forums API Blog Get Involved  Contribution Bible 3rd Party Applications Add New Movie Add New TV Show Community Guidelines Leaderboard Forums Twitter Facebook Legal Terms of Use Privacy Policy Login Sign Up"
}