{
  "link": "https://www.themoviedb.org/tv/60736?language=en",
  "title": "Caf\u00e9 Wernicke",
  "resume": "We don't have an overview translated in English. Help us expand our database by adding one.",
  "rate": "",
  "genre": [
    "Drama"
  ],
  "cast": {
    "actor": [
      "Peer Schmidt",
      "Almut Eggert",
      "Ursula Heyer",
      "Harald Juhnke",
      "Johanna von Koczian"
    ]
  },
  "characters": {
    "characters": [
      "Franz Lampe",
      "Marie Lampe",
      "Dolly",
      "Bruno Matschinski",
      "Ingeborg Gruner"
    ]
  },
  "site_data": "html Apps Forums Leaderboard Contribute API Support Discover Movies TV Shows Movies Popular Top Rated Upcoming Now Playing TV Shows Popular Top Rated On TV Airing Today People Popular People Can't find a movie or TV show? Login to create it. en Login Sign Up  ID: 60736   Expand Caf\u00e9 Wernicke   (1980) User Score Overview We don't have an overview translated in English. Help us expand our database by adding one. Featured Crew Axel Schmidt Creator Discussions   Reviews Videos   Images   Changes Report Share Discussions General  0 Content Issues  0 Images Backdrops  1 Posters  1 Videos Trailers  0 Teasers  0 Clips  0 Featurettes  0 Opening Credits  0 Top Billed Cast Peer Schmidt Franz Lampe Almut Eggert Marie Lampe Ursula Heyer Dolly Harald Juhnke Bruno Matschinski Johanna von Koczian Ingeborg Gruner Full Cast & Crew Last Season Season 1 1980 | 20 Episodes Season 1 of Caf\u00e9 Wernicke premiered on December  2, 1980. View All Seasons Social Reviews  0 Discussions  0 Media Most Popular Videos  0 Backdrops  1 Posters  1 Recommendations We don't have enough data to suggest any TV shows based on Caf\u00e9 Wernicke. You can help by rating TV shows you've seen. Facts Status  Ended Network Certification  - Type  Scripted Original Language  German Runtime  25m Homepage  - Genres Drama Keywords berlin family history Content Score 86 Almost there... Top Contributors S 28 Samara L 5 Lemmy_6  View Edit History Popularity Trend  Login to edit  URL By  signing up  for an account on TMDb, you can post directly to Twitter and Facebook. You need to be logged in to continue. Click  here  to login or  here  to sign up.    page_wrap opened in html_head  Join the Community The Basics About TMDb Contact Us Support Forums API Blog Get Involved  Contribution Bible 3rd Party Applications Add New Movie Add New TV Show Community Guidelines Leaderboard Forums Twitter Facebook Legal Terms of Use Privacy Policy Login Sign Up"
}