{
  "link": "https://www.themoviedb.org/tv/78451?language=en",
  "title": "Prithvi Vallabh",
  "resume": "The story follows the life journey of two kings: Prithvi Vallabh, king of Avantipur, a kind and peaceful man, and Tailap, the neighboring king, who is very cruel.",
  "rate": "60.0",
  "genre": [
    "Family",
    "Drama"
  ],
  "cast": [
    "Shalini Kapoor",
    "Gurdip Kohli",
    "Ashish Sharma",
    "Sonarika Bhadoria",
    "Jitin Gulati"
  ],
  "character": [
    "Rajmata",
    "Ujjwala",
    "Prithvi Vallabh",
    "Mrinalvati",
    "King Tailap"
  ],
  "site_data": "html Apps Forums Leaderboard Contribute API Support Discover Movies TV Shows Movies Popular Top Rated Upcoming Now Playing TV Shows Popular Top Rated On TV Airing Today People Popular People Can't find a movie or TV show? Login to create it. en Login Sign Up  ID: 78451   Expand Prithvi Vallabh   (2018) User Score  Play Trailer Overview The story follows the life journey of two kings: Prithvi Vallabh, king of Avantipur, a kind and peaceful man, and Tailap, the neighboring king, who is very cruel. Featured Crew Arvind Singh Creator Discussions   Reviews Videos   Images   Changes Report Share Discussions General  0 Content Issues  0 Images Backdrops  1 Posters  1 Videos Trailers  1 Teasers  0 Clips  0 Featurettes  0 Opening Credits  0 Top Billed Cast Shalini Kapoor Rajmata Gurdip Kohli Ujjwala Ashish Sharma Prithvi Vallabh Sonarika Bhadoria Mrinalvati Jitin Gulati King Tailap Full Cast & Crew Current Season Season 1 2018 | 19 Episodes Season 1 of Prithvi Vallabh premiered on January 20, 2018. View All Seasons Social Reviews  0 Discussions  0 Media Most Popular Videos  1 Backdrops  1 Posters  1 Recommendations We don't have enough data to suggest any TV shows based on Prithvi Vallabh. You can help by rating TV shows you've seen. Facts Original Name  \u092a\u0943\u0925\u094d\u0935\u0940 \u0935\u0932\u094d\u0932\u092d Status  Returning Series Network Certification TV-PG Meaning This program contains material that parents may find unsuitable for younger children. Type  Scripted Original Language  Hindi Runtime  45m Homepage   https://www.youtube.com/watch?v=v1aHl8Om3Ts Genres Family Drama Keywords war kingdom romance king Content Score 100 Yes! Looking good! Top Contributors 39 TopKek  View Edit History Popularity Trend  Login to edit  URL By  signing up  for an account on TMDb, you can post directly to Twitter and Facebook. You need to be logged in to continue. Click  here  to login or  here  to sign up.    page_wrap opened in html_head  Join the Community The Basics About TMDb Contact Us Support Forums API Blog Get Involved  Contribution Bible 3rd Party Applications Add New Movie Add New TV Show Community Guidelines Leaderboard Forums Twitter Facebook Legal Terms of Use Privacy Policy Login Sign Up"
}