{
  "link": "https://www.themoviedb.org/tv/64587?language=en",
  "title": "Die Piefke Saga",
  "resume": "We don't have an overview translated in English. Help us expand our database by adding one.",
  "rate": "90.0",
  "genre": [
    "Comedy"
  ],
  "cast": [
    "Dietrich Mattausch",
    "Brigitte Grothum",
    "Ferdinand Dux",
    "Kurt Weinzierl",
    "Veronika Faber"
  ],
  "character": [
    "Karl-Friedrich Sattmann",
    "Else Sattmann",
    "Heinrich Sattmann",
    "Franz Wechselberger",
    "Christel Wechselberger"
  ],
  "site_data": "html Apps Forums Leaderboard Contribute API Support Discover Movies TV Shows Movies Popular Top Rated Upcoming Now Playing TV Shows Popular Top Rated On TV Airing Today People Popular People Can't find a movie or TV show? Login to create it. en Login Sign Up  ID: 64587   Expand Die Piefke Saga   (1990) User Score Overview We don't have an overview translated in English. Help us expand our database by adding one. Discussions   Reviews Videos   Images   Changes Report Share Discussions General  0 Content Issues  1 Images Backdrops  1 Posters  1 Videos Trailers  0 Teasers  0 Clips  0 Featurettes  0 Opening Credits  0 Top Billed Cast Dietrich Mattausch Karl-Friedrich Sattmann Brigitte Grothum Else Sattmann Ferdinand Dux Heinrich Sattmann Kurt Weinzierl Franz Wechselberger Veronika Faber Christel Wechselberger Full Cast & Crew Last Season Season 1 1990 | 4 Episodes Season 1 of Die Piefke Saga premiered on January 31, 1990. View All Seasons Social Reviews  0 Discussions  1 Subject Status Replies Last Reply There are no discussions for Die Piefke Saga. Login to be first! Go to Discussions Media Most Popular Videos  0 Backdrops  1 Posters  1 Recommendations We don't have enough data to suggest any TV shows based on Die Piefke Saga. You can help by rating TV shows you've seen. Facts Status  Ended Networks Certification  - Type  Scripted Original Language  German Runtime  - Homepage  - Genres Comedy Keywords No keywords have been added. Content Score 79 Pump it up! We're close now. Top Contributors S 25 Samara t 7 teefix k 4 kreidei TB 2 TMDb Bot  View Edit History Popularity Trend  Login to edit  URL By  signing up  for an account on TMDb, you can post directly to Twitter and Facebook. You need to be logged in to continue. Click  here  to login or  here  to sign up.    page_wrap opened in html_head  Join the Community The Basics About TMDb Contact Us Support Forums API Blog Get Involved  Contribution Bible 3rd Party Applications Add New Movie Add New TV Show Community Guidelines Leaderboard Forums Twitter Facebook Legal Terms of Use Privacy Policy Login Sign Up"
}