{
  "link": "https://www.themoviedb.org/tv/61158?language=en",
  "title": "The Three Musketeers",
  "resume": "Set in the Joseon Dynasty period, this drama series follows the Crown Prince Sohyeon, his warriors Heo Seung-Po and An Min-Seo, and a Park Dal-Hyang who is preparing for his military examination.",
  "rate": "90.0",
  "genre": [
    "Action",
    "Adventure"
  ],
  "cast": [
    "Jung Yong-hwa",
    "Lee Jin-wook",
    "Yang Dong-geun",
    "Jung Hae-in",
    "Seo Hyun-Jin"
  ],
  "character": [
    "Park Dal-Hyang",
    "Crown Prince Sohyeon",
    "Heo Seung-Po",
    "An Min-Seo",
    "Yoon-Seo"
  ],
  "site_data": "html Apps Forums Leaderboard Contribute API Support Discover Movies TV Shows Movies Popular Top Rated Upcoming Now Playing TV Shows Popular Top Rated On TV Airing Today People Popular People Can't find a movie or TV show? Login to create it. en Login Sign Up  ID: 61158   Expand The Three Musketeers   (2014) User Score  Play Trailer Overview Set in the Joseon Dynasty period, this drama series follows the Crown Prince Sohyeon, his warriors Heo Seung-Po and An Min-Seo, and a Park Dal-Hyang who is preparing for his military examination. Featured Crew Kim Byung-Soo Creator Discussions   Reviews Videos   Images   Changes Report Share Discussions General  0 Content Issues  0 Images Backdrops  3 Posters  9 Videos Trailers  1 Teasers  0 Clips  0 Featurettes  0 Opening Credits  0 Top Billed Cast Jung Yong-hwa Park Dal-Hyang Lee Jin-wook Crown Prince Sohyeon Yang Dong-geun Heo Seung-Po Jung Hae-in An Min-Seo Seo Hyun-Jin Yoon-Seo Full Cast & Crew Last Season Season 1 2014 | 12 Episodes Season 1 of The Three Musketeers premiered on August 17, 2014. View All Seasons Social Reviews  0 Discussions  0 Media Most Popular Videos  1 Backdrops  3 Posters  9 Recommendations We don't have enough data to suggest any TV shows based on The Three Musketeers. You can help by rating TV shows you've seen. Facts Original Name  \uc0bc\ucd1d\uc0ac Status  Ended Network Certification  - Type  Scripted Original Language  Korean Runtime  70m Homepage   http://program.interest.me/tvn/3musketeers/ Genres Action & Adventure Keywords korea Content Score 100 Yes! Looking good! Top Contributors M 63 Maria180493 6 part-mozi f 5 fassy7 CM 4 Cherche Moi  View Edit History Popularity Trend  Login to edit  URL By  signing up  for an account on TMDb, you can post directly to Twitter and Facebook. You need to be logged in to continue. Click  here  to login or  here  to sign up.    page_wrap opened in html_head  Join the Community The Basics About TMDb Contact Us Support Forums API Blog Get Involved  Contribution Bible 3rd Party Applications Add New Movie Add New TV Show Community Guidelines Leaderboard Forums Twitter Facebook Legal Terms of Use Privacy Policy Login Sign Up"
}