{
  "link": "https://www.themoviedb.org/tv/41082?language=en",
  "title": "Jakob und Adele",
  "resume": "Jakob und Adele is a German television series.",
  "rate": "",
  "genre": [
    "Drama",
    "Family",
    "Comedy"
  ],
  "cast": {
    "actor": [
      "Carl-Heinz Schroth",
      "Brigitte Horney",
      "J\u00fcrgen Thormann",
      "Almut Eggert"
    ]
  },
  "characters": {
    "characters": [
      "Jakob Biedermann",
      "Adele Schliemann",
      "Rudolf Kellner",
      "Lisbeth Kellner"
    ]
  },
  "site_data": "html Apps Forums Leaderboard Contribute API Support Discover Movies TV Shows Movies Popular Top Rated Upcoming Now Playing TV Shows Popular Top Rated On TV Airing Today People Popular People Can't find a movie or TV show? Login to create it. en Login Sign Up  ID: 41082   Expand Jakob und Adele   (1982) User Score Overview Jakob und Adele is a German television series. Featured Crew Herbert Reinecker Creator Discussions   Reviews Videos   Images   Changes Report Share Discussions General  0 Content Issues  0 Images Backdrops  1 Posters  1 Videos Trailers  0 Teasers  0 Clips  0 Featurettes  0 Opening Credits  0 Top Billed Cast Carl-Heinz Schroth Jakob Biedermann Brigitte Horney Adele Schliemann J\u00fcrgen Thormann Rudolf Kellner Almut Eggert Lisbeth Kellner Full Cast & Crew Last Season Season 1 1982 | 11 Episodes Season 1 of Jakob und Adele premiered on December 30, 1982. View All Seasons Social Reviews  0 Discussions  0 Media Most Popular Videos  0 Backdrops  1 Posters  1 Recommendations We don't have enough data to suggest any TV shows based on Jakob und Adele. You can help by rating TV shows you've seen. Facts Status  Ended Network Certification 6 Meaning Can be aired at any time. Type  Scripted Original Language  German Runtime  45m Homepage  - Genres Drama Family Comedy Keywords family Content Score 93 Almost there... Top Contributors S 31 Samara S 12 SunHomeMovie TB 2 TMDb Bot  View Edit History Popularity Trend  Login to edit  URL By  signing up  for an account on TMDb, you can post directly to Twitter and Facebook. You need to be logged in to continue. Click  here  to login or  here  to sign up.    page_wrap opened in html_head  Join the Community The Basics About TMDb Contact Us Support Forums API Blog Get Involved  Contribution Bible 3rd Party Applications Add New Movie Add New TV Show Community Guidelines Leaderboard Forums Twitter Facebook Legal Terms of Use Privacy Policy Login Sign Up"
}