{
  "link": "https://www.themoviedb.org/tv/40665?language=en",
  "title": "Anna",
  "resume": "Anna is a German television series.",
  "rate": "49.0",
  "genre": [
    "Drama",
    "Family"
  ],
  "cast": [
    "Silvia Seidel",
    "Ilse Neubauer",
    "Eberhard Feik",
    "Patrick Bach",
    "Despina Pajanou"
  ],
  "character": [
    "Anna",
    "Ute Pelzer",
    "Stefan Pelzer",
    "Rainer Hellwig",
    "Christina \u201eTina\u201c Berger"
  ],
  "site_data": "html Apps Forums Leaderboard Contribute API Support Discover Movies TV Shows Movies Popular Top Rated Upcoming Now Playing TV Shows Popular Top Rated On TV Airing Today People Popular People Can't find a movie or TV show? Login to create it. en Login Sign Up  ID: 40665   Expand Anna   (1987) User Score Overview Anna is a German television series. Featured Crew Justus Pfaue Creator Discussions   Reviews Videos   Images   Changes Report Share Discussions General  0 Content Issues  0 Images Backdrops  1 Posters  2 Videos Trailers  0 Teasers  0 Clips  0 Featurettes  0 Opening Credits  0 Top Billed Cast Silvia Seidel Anna Ilse Neubauer Ute Pelzer Eberhard Feik Stefan Pelzer Patrick Bach Rainer Hellwig Despina Pajanou Christina \u201eTina\u201c Berger Full Cast & Crew Last Season Season 1 1987 | 6 Episodes Season 1 of Anna premiered on December 25, 1987. View All Seasons Social Reviews  0 Discussions  0 Media Most Popular Videos  0 Backdrops  1 Posters  2 Recommendations We don't have enough data to suggest any TV shows based on Anna. You can help by rating TV shows you've seen. Facts Status  Ended Networks - Certification 6 Meaning Can be aired at any time. Type  Scripted Original Language  German Runtime  360m Homepage  - Genres Drama Family Keywords ballet dancer Content Score 93 Almost there... Top Contributors S 16 Suedschwede S 15 Samara 5 Marcus TB 2 TMDb Bot  View Edit History Popularity Trend  Login to edit  URL By  signing up  for an account on TMDb, you can post directly to Twitter and Facebook. You need to be logged in to continue. Click  here  to login or  here  to sign up.    page_wrap opened in html_head  Join the Community The Basics About TMDb Contact Us Support Forums API Blog Get Involved  Contribution Bible 3rd Party Applications Add New Movie Add New TV Show Community Guidelines Leaderboard Forums Twitter Facebook Legal Terms of Use Privacy Policy Login Sign Up"
}