{
  "link": "https://www.themoviedb.org/tv/66258?language=en",
  "title": "Billy Connolly's Tracks Across America",
  "resume": "Billy Connolly takes to the rails for a six thousand mile trip through the backyard of America.",
  "rate": "78.0",
  "genre": [
    "Documentary"
  ],
  "cast": [
    "Billy Connolly"
  ],
  "character": [
    "Hinself - Host"
  ],
  "site_data": "html Apps Forums Leaderboard Contribute API Support Discover Movies TV Shows Movies Popular Top Rated Upcoming Now Playing TV Shows Popular Top Rated On TV Airing Today People Popular People Can't find a movie or TV show? Login to create it. en Login Sign Up  ID: 66258   Expand Billy Connolly's Tracks Across America   (2016) User Score Overview Billy Connolly takes to the rails for a six thousand mile trip through the backyard of America. Discussions   Reviews Videos   Images   Changes Report Share Discussions General  0 Content Issues  0 Images Backdrops  3 Posters  1 Videos Trailers  0 Teasers  0 Clips  0 Featurettes  0 Opening Credits  0 Top Billed Cast Billy Connolly Hinself - Host Full Cast & Crew Last Season Season 1 2016 | 3 Episodes Season 1 of Billy Connolly's Tracks Across America premiered on April  1, 2016. View All Seasons Social Reviews  0 Discussions  0 Media Most Popular Videos  0 Backdrops  3 Posters  1 Recommendations We don't have enough data to suggest any TV shows based on Billy Connolly's Tracks Across America. You can help by rating TV shows you've seen. Facts Status  Returning Series Network Certification  - Type  Scripted Original Language  English Runtime  47m Homepage  - Genres Documentary Keywords music documentary travel rail trip Content Score 56 We're so close, yet so far. Top Contributors 26 CouchTater R 4 Rebecca 4 Elizabeth Jennings  View Edit History Popularity Trend  Login to edit  URL By  signing up  for an account on TMDb, you can post directly to Twitter and Facebook. You need to be logged in to continue. Click  here  to login or  here  to sign up.    page_wrap opened in html_head  Join the Community The Basics About TMDb Contact Us Support Forums API Blog Get Involved  Contribution Bible 3rd Party Applications Add New Movie Add New TV Show Community Guidelines Leaderboard Forums Twitter Facebook Legal Terms of Use Privacy Policy Login Sign Up"
}