{
  "link": "https://www.themoviedb.org/tv/68080?language=en",
  "title": "Izetta: The Last Witch",
  "resume": "We don't have an overview translated in English. Help us expand our database by adding one.",
  "rate": "",
  "genre": [
    "Action",
    "Adventure",
    "Animation",
    "Drama"
  ],
  "cast": {
    "actor": [
      "Saori Hayami",
      "Himika Akaneya"
    ]
  },
  "characters": {
    "characters": [
      "Ortfin\u00e9 Fredericka von Eylstadt (\u30d5\u30a3\u30fc\u30cd)",
      "Izetta (\u30a4\u30bc\u30c3\u30bf)"
    ]
  },
  "site_data": "html Apps Forums Leaderboard Contribute API Support Discover Movies TV Shows Movies Popular Top Rated Upcoming Now Playing TV Shows Popular Top Rated On TV Airing Today People Popular People Can't find a movie or TV show? Login to create it. en Login Sign Up  ID: 68080   Expand Izetta: The Last Witch   (2016) User Score  Play Trailer Overview We don't have an overview translated in English. Help us expand our database by adding one. Featured Crew Masaya Fujimori Creator Hiroyuki Yoshino Creator Discussions   Reviews Videos   Images   Changes Report Share Discussions General  0 Content Issues  0 Images Backdrops  1 Posters  2 Videos Trailers  1 Teasers  0 Clips  0 Featurettes  0 Opening Credits  0 Top Billed Cast Saori Hayami Ortfin\u00e9 Fredericka von Eylstadt (\u30d5\u30a3\u30fc\u30cd) Himika Akaneya Izetta (\u30a4\u30bc\u30c3\u30bf) Full Cast & Crew Last Season Season 1 2016 | 12 Episodes Season 1 of Izetta: The Last Witch premiered on October  1, 2016. View All Seasons Social Reviews  0 Discussions  0 Media Most Popular Videos  1 Backdrops  1 Posters  2 Recommendations   2016-07-01 The Morose Mononokean 8.0    2016-07-08 Alderamin on the Sky 7.4    2016-04-07 Bungo Stray Dogs 7.3  Facts Original Name  \u7d42\u672b\u306e\u30a4\u30bc\u30c3\u30bf Izetta, Die Letzte Hexe Status  In Production Networks - Certification  - Type  Scripted Original Language  Japanese Runtime  25m Homepage   http://izetta.jp/ Genres Action & Adventure Animation Drama Keywords No keywords have been added. Content Score 64 We're so close, yet so far. Top Contributors 10 karaa z 8 zurman1 7 iliass guendouz 6 Jenazad  View Edit History Popularity Trend  Login to edit  URL By  signing up  for an account on TMDb, you can post directly to Twitter and Facebook. You need to be logged in to continue. Click  here  to login or  here  to sign up.    page_wrap opened in html_head  Join the Community The Basics About TMDb Contact Us Support Forums API Blog Get Involved  Contribution Bible 3rd Party Applications Add New Movie Add New TV Show Community Guidelines Leaderboard Forums Twitter Facebook Legal Terms of Use Privacy Policy Login Sign Up"
}