{
  "link": "https://www.themoviedb.org/tv/61640?language=en",
  "title": "X-Ray and Vav",
  "resume": "Dimwits Ray and Gavin become superheroes X-Ray and Vav!",
  "rate": "",
  "genre": [
    "Action",
    "Adventure",
    "Animation",
    "Comedy"
  ],
  "cast": {
    "actor": [
      "Ray Narvaez Jr.",
      "Gavin Free"
    ]
  },
  "characters": {
    "characters": [
      "Ray / X-Ray",
      "Gavin / Vav"
    ]
  },
  "site_data": "html Apps Forums Leaderboard Contribute API Support Discover Movies TV Shows Movies Popular Top Rated Upcoming Now Playing TV Shows Popular Top Rated On TV Airing Today People Popular People Can't find a movie or TV show? Login to create it. en Login Sign Up  ID: 61640   Expand X-Ray and Vav   (2014) User Score  Play Trailer Overview Dimwits Ray and Gavin become superheroes X-Ray and Vav! Featured Crew Jordan Cwierz Creator Lindsay Jones Creator Discussions   Reviews Videos   Images   Changes Report Share Discussions General  0 Content Issues  0 Images Backdrops  1 Posters  1 Videos Trailers  2 Teasers  0 Clips  0 Featurettes  0 Opening Credits  1 Top Billed Cast Ray Narvaez Jr. Ray / X-Ray Gavin Free Gavin / Vav Full Cast & Crew Last Season Season 2 2015 | 10 Episodes View All Seasons Social Reviews  0 Discussions  0 Media Most Popular Videos  3 Backdrops  1 Posters  1 Recommendations   2013-07-18 RWBY 9.1  Facts Status  Ended Network Certification  - Type  Scripted Original Language  English Runtime  - Homepage   http://roosterteeth.com/archive/?sid=XandV Genres Action & Adventure Animation Comedy Keywords superhero cartoon Content Score 71 Just a little bit more... Top Contributors J 35 Jake_F 12 Elizabeth Jennings CM 7 Cherche Moi K 7 KingCalifornia  View Edit History Popularity Trend  Login to edit  URL By  signing up  for an account on TMDb, you can post directly to Twitter and Facebook. You need to be logged in to continue. Click  here  to login or  here  to sign up.    page_wrap opened in html_head  Join the Community The Basics About TMDb Contact Us Support Forums API Blog Get Involved  Contribution Bible 3rd Party Applications Add New Movie Add New TV Show Community Guidelines Leaderboard Forums Twitter Facebook Legal Terms of Use Privacy Policy Login Sign Up"
}