{
  "link": "https://www.themoviedb.org/tv/39797?language=en",
  "title": "Torchwood: Web of Lies",
  "resume": "A ten episode companion series with events taking place during the Torchwood: Miracle Day series.",
  "rate": "35.0",
  "genre": [
    "Sci-Fi",
    "Fantasy"
  ],
  "cast": [
    "Eve Myles"
  ],
  "character": [
    "Gwen Cooper"
  ],
  "site_data": "html Apps Forums Leaderboard Contribute API Support Discover Movies TV Shows Movies Popular Top Rated Upcoming Now Playing TV Shows Popular Top Rated On TV Airing Today People Popular People Can't find a movie or TV show? Login to create it. en Login Sign Up  ID: 39797   Expand Torchwood: Web of Lies User Score Overview A ten episode companion series with events taking place during the Torchwood: Miracle Day series. Discussions   Reviews Videos   Images   Changes Report Share Discussions General  0 Content Issues  0 Images Backdrops  0 Posters  1 Videos Trailers  0 Teasers  0 Clips  0 Featurettes  0 Opening Credits  0 Top Billed Cast Eve Myles Gwen Cooper Full Cast & Crew  Create Episode Social Reviews  0 Discussions  0 Media Most Popular Videos  0 Backdrops  0 Posters  1 Facts Status  Ended Networks - Certification  - Type  Scripted Original Language  English Runtime  - Homepage  - Genres Sci-Fi & Fantasy Keywords doctor who Content Score 36 There's no 'I' in team... Top Contributors 5 rgeaston T 4 Tradtrollet 3 Zlogorek  View Edit History Popularity Trend  Login to edit  URL By  signing up  for an account on TMDb, you can post directly to Twitter and Facebook. You need to be logged in to continue. Click  here  to login or  here  to sign up.    page_wrap opened in html_head  Join the Community The Basics About TMDb Contact Us Support Forums API Blog Get Involved  Contribution Bible 3rd Party Applications Add New Movie Add New TV Show Community Guidelines Leaderboard Forums Twitter Facebook Legal Terms of Use Privacy Policy Login Sign Up"
}