{
  "link": "https://www.themoviedb.org/tv/56012?language=en",
  "title": "The Star Circles the Moon",
  "resume": "A story about a woman who wants a child and is looking for the best candidate for her unborn child.",
  "rate": "80.0",
  "genre": [
    "Soap",
    "Drama"
  ],
  "cast": [
    "Atichart Chumnanont",
    "Janie Tienphosuwan",
    "Prang Kannarun",
    "Karoon Sosothikul",
    "Atthama Chiwanitxhaphan"
  ],
  "character": [
    "Khun Chai Jan (Mom Ratchawong Jantarapanu Noparat)",
    "Prakai Dao",
    "Khun Ying Nim",
    "Pongjan Pipithimonkon",
    "Lin"
  ],
  "site_data": "html Apps Forums Leaderboard Contribute API Support Discover Movies TV Shows Movies Popular Top Rated Upcoming Now Playing TV Shows Popular Top Rated On TV Airing Today People Popular People Can't find a movie or TV show? Login to create it. en Login Sign Up  ID: 56012   Expand The Star Circles the Moon   (2013) User Score  Play Trailer Overview A story about a woman who wants a child and is looking for the best candidate for her unborn child.  Discussions   Reviews Videos   Images   Changes Report Share Discussions General  0 Content Issues  0 Images Backdrops  6 Posters  3 Videos Trailers  1 Teasers  0 Clips  0 Featurettes  0 Opening Credits  0 Top Billed Cast Atichart Chumnanont Khun Chai Jan (Mom Ratchawong Jantarapanu Noparat) Janie Tienphosuwan Prakai Dao Prang Kannarun Khun Ying Nim Karoon Sosothikul Pongjan Pipithimonkon Atthama Chiwanitxhaphan Lin Full Cast & Crew Last Season Season 1 2013 | 11 Episodes View All Seasons Social Reviews  0 Discussions  0 Media Most Popular Videos  1 Backdrops  6 Posters  3 Recommendations We don't have enough data to suggest any TV shows based on The Star Circles the Moon. You can help by rating TV shows you've seen. Facts Original Name  Dao Kaew Duen Status  Ended Network Certification PG Meaning Parental guidance is recommended for young viewers; PG-rated content may air at any time on digital-only channels, otherwise, it should only be broadcast between 8:30 a.m. and 4:00 p.m. and between 7:00 p.m. and 6:00 a.m. on weekdays, and between 10:00 a.m. and 6:00 a.m. on weekends. Type  Scripted Original Language  English Runtime  107m Homepage  - Genres Soap Drama Keywords thai lakorn Content Score 93 Almost there... Top Contributors 42 Crip 4 mariilakorn97 2 Elizabeth Jennings TB 2 TMDb Bot  View Edit History Popularity Trend  Login to edit  URL By  signing up  for an account on TMDb, you can post directly to Twitter and Facebook. You need to be logged in to continue. Click  here  to login or  here  to sign up.    page_wrap opened in html_head  Join the Community The Basics About TMDb Contact Us Support Forums API Blog Get Involved  Contribution Bible 3rd Party Applications Add New Movie Add New TV Show Community Guidelines Leaderboard Forums Twitter Facebook Legal Terms of Use Privacy Policy Login Sign Up"
}