{
  "link": "https://www.themoviedb.org/tv/67248?language=en",
  "title": "Destin\u00e9es",
  "resume": "Destin\u00e9es revolves around clinique Jouvence, a cosmetics and health clinic offering a variety of treatments ranging from massage to cosmetic surgery.",
  "rate": "0.0",
  "genre": [
    "Soap",
    "Drama"
  ],
  "cast": [
    "Patrice Godin",
    "Julie McClemens ",
    "Sandrine Poirier-Allard",
    "Pierre-Paul Alain",
    "Louis Champagne"
  ],
  "character": [
    "Bernard Morel",
    "Juliette Asselin",
    "Roxanne Miljours",
    "Alexis Provencher",
    "Nelson Laberge"
  ],
  "site_data": "html Apps Forums Leaderboard Contribute API Support Discover Movies TV Shows Movies Popular Top Rated Upcoming Now Playing TV Shows Popular Top Rated On TV Airing Today People Popular People Can't find a movie or TV show? Login to create it. en Login Sign Up  ID: 67248   Expand Destin\u00e9es   (2007) User Score Overview Destin\u00e9es revolves around clinique Jouvence, a cosmetics and health clinic offering a variety of treatments ranging from massage to cosmetic surgery. Discussions   Reviews Videos   Images   Changes Report Share Discussions General  0 Content Issues  0 Images Backdrops  2 Posters  1 Videos Trailers  0 Teasers  0 Clips  0 Featurettes  0 Opening Credits  0 Top Billed Cast Patrice Godin Bernard Morel Julie McClemens  Juliette Asselin Sandrine Poirier-Allard Roxanne Miljours Pierre-Paul Alain Alexis Provencher Louis Champagne Nelson Laberge Full Cast & Crew Last Season Season 7 2013 | 26 Episodes Season 7 of Destin\u00e9es premiered on September 10, 2013. View All Seasons Social Reviews  0 Discussions  0 Media Most Popular Videos  0 Backdrops  2 Posters  1 Recommendations We don't have enough data to suggest any TV shows based on Destin\u00e9es. You can help by rating TV shows you've seen. Facts Status  Ended Network Certification G Meaning Suitable for general audiences. Programming suitable for the entire family with mild violence, and mild profanity and/or censored language. Type  Scripted Original Language  French Runtime  45m Homepage   http://tva.canoe.ca/emissions/destinees Genres Soap Drama Keywords quebec plastic surgery doctor plastic surgeon t\u00e9l\u00e9roman Content Score 86 Almost there... Top Contributors 125 Banana  View Edit History Popularity Trend  Login to edit  URL By  signing up  for an account on TMDb, you can post directly to Twitter and Facebook. You need to be logged in to continue. Click  here  to login or  here  to sign up.    page_wrap opened in html_head  Join the Community The Basics About TMDb Contact Us Support Forums API Blog Get Involved  Contribution Bible 3rd Party Applications Add New Movie Add New TV Show Community Guidelines Leaderboard Forums Twitter Facebook Legal Terms of Use Privacy Policy Login Sign Up"
}