{
  "link": "https://www.themoviedb.org/tv/15539?language=en",
  "title": "Notorious Woman",
  "resume": "The incredible life of novelist George Sand is explored with a particular focus on her romance with the famed musician Fr\u00e9d\u00e9ric Chopin.",
  "rate": "",
  "genre": [
    "Drama"
  ],
  "cast": {
    "actor": [
      "Rosemary Harris",
      "Jeremy Irons",
      "George Chakiris",
      "Alan Howard",
      "Sin\u00e9ad Cusack"
    ]
  },
  "characters": {
    "characters": [
      "George Sand",
      "Franz Liszt",
      "Fr\u00e9d\u00e9ric Chopin",
      "Prosper Merim\u00e9e",
      "Marie Dorval"
    ]
  },
  "site_data": "html Apps Forums Leaderboard Contribute API Support Discover Movies TV Shows Movies Popular Top Rated Upcoming Now Playing TV Shows Popular Top Rated On TV Airing Today People Popular People Can't find a movie or TV show? Login to create it. en Login Sign Up  ID: 15539   Expand Notorious Woman   (1974) User Score Overview The incredible life of novelist George Sand is explored with a particular focus on her romance with the famed musician Fr\u00e9d\u00e9ric Chopin. Discussions   Reviews Videos   Images   Changes Report Share Discussions General  0 Content Issues  0 Images Backdrops  0 Posters  2 Videos Trailers  0 Teasers  0 Clips  0 Featurettes  0 Opening Credits  0 Top Billed Cast Rosemary Harris George Sand Jeremy Irons Franz Liszt George Chakiris Fr\u00e9d\u00e9ric Chopin Alan Howard Prosper Merim\u00e9e Sin\u00e9ad Cusack Marie Dorval Full Cast & Crew Last Season Miniseries 1974 | 7 Episodes Season 1 of Notorious Woman premiered on November  3, 1974. View All Seasons Social Reviews  0 Discussions  0 Media Most Popular Videos  0 Backdrops  0 Posters  2 Recommendations We don't have enough data to suggest any TV shows based on Notorious Woman. You can help by rating TV shows you've seen. Facts Status  Ended Network Certification  - Type  Miniseries Original Language  English Runtime  60m Homepage   http://www.bbc.co.uk/programmes/p032vxhs Genres Drama Keywords miniseries fr\u00e9d\u00e9ric chopin george sand Content Score 71 Just a little bit more... Top Contributors 15 midnightmark R 13 Rebecca TB 5 TMDb Bot r 1 racci  View Edit History Popularity Trend  Login to edit  URL By  signing up  for an account on TMDb, you can post directly to Twitter and Facebook. You need to be logged in to continue. Click  here  to login or  here  to sign up.    page_wrap opened in html_head  Join the Community The Basics About TMDb Contact Us Support Forums API Blog Get Involved  Contribution Bible 3rd Party Applications Add New Movie Add New TV Show Community Guidelines Leaderboard Forums Twitter Facebook Legal Terms of Use Privacy Policy Login Sign Up"
}