{
  "link": "https://www.themoviedb.org/tv/41184?language=en",
  "title": "Tour de Ruhr",
  "resume": "Tour de Ruhr is a German television film.",
  "rate": "90.0",
  "genre": [
    "Drama"
  ],
  "cast": [
    "Henry van Lyck",
    "Marie-Luise Marjan",
    "Eckhard Heise",
    "Elfi Eschke",
    "Ralf Richter"
  ],
  "character": [
    "Karlheinz Stratmann",
    "Lisbett Stratmann",
    "Harald Schl\u00fcmer",
    "Ines",
    "W\u00f6lfchen"
  ],
  "site_data": "html Apps Forums Leaderboard Contribute API Support Discover Movies TV Shows Movies Popular Top Rated Upcoming Now Playing TV Shows Popular Top Rated On TV Airing Today People Popular People Can't find a movie or TV show? Login to create it. en Login Sign Up  ID: 41184   Expand Tour de Ruhr   (1981) User Score Overview Tour de Ruhr is a German television film. Featured Crew Elke Heidenreich Creator Reinhard Schwabenitzky Creator Discussions   Reviews Videos   Images   Changes Report Share Discussions General  0 Content Issues  0 Images Backdrops  0 Posters  1 Videos Trailers  0 Teasers  0 Clips  0 Featurettes  0 Opening Credits  0 Top Billed Cast Henry van Lyck Karlheinz Stratmann Marie-Luise Marjan Lisbett Stratmann Eckhard Heise Harald Schl\u00fcmer Elfi Eschke Ines Ralf Richter W\u00f6lfchen Full Cast & Crew Last Season Season 1 1981 | 6 Episodes Season 1 of Tour de Ruhr premiered on March 27, 1981. View All Seasons Social Reviews  0 Discussions  0 Media Most Popular Videos  0 Backdrops  0 Posters  1 Recommendations We don't have enough data to suggest any TV shows based on Tour de Ruhr. You can help by rating TV shows you've seen. Facts Status  Ended Network Certification  - Type  Scripted Original Language  German Runtime  - Homepage  - Genres Drama Keywords No keywords have been added. Content Score 79 Pump it up! We're close now. Top Contributors R 22 Roken S 15 Samara M 3 Mec!as  View Edit History Popularity Trend  Login to edit  URL By  signing up  for an account on TMDb, you can post directly to Twitter and Facebook. You need to be logged in to continue. Click  here  to login or  here  to sign up.    page_wrap opened in html_head  Join the Community The Basics About TMDb Contact Us Support Forums API Blog Get Involved  Contribution Bible 3rd Party Applications Add New Movie Add New TV Show Community Guidelines Leaderboard Forums Twitter Facebook Legal Terms of Use Privacy Policy Login Sign Up"
}