{
  "link": "https://www.themoviedb.org/tv/46546?language=en",
  "title": "Triple",
  "resume": "We don't have an overview translated in English. Help us expand our database by adding one.",
  "rate": "0.0",
  "genre": [
    "Drama",
    "Comedy"
  ],
  "cast": [
    "Yoon Kye-sang",
    "Lee Ha-Na",
    "Min Hyo-rin",
    "Lee Jung-jae",
    "Lee Sun-kyun"
  ],
  "character": [
    "Jang Hyun-tae",
    "Choi Soo-in",
    "Lee Ha-ru",
    "Shin Hwal",
    "Jo Hae-yoon"
  ],
  "site_data": "html Apps Forums Leaderboard Contribute API Support Discover Movies TV Shows Movies Popular Top Rated Upcoming Now Playing TV Shows Popular Top Rated On TV Airing Today People Popular People Can't find a movie or TV show? Login to create it. en Login Sign Up  ID: 46546   Expand Triple   (2009) User Score Overview We don't have an overview translated in English. Help us expand our database by adding one. Featured Crew Lee Yoon-jeong Creator Discussions   Reviews Videos   Images   Changes Report Share Discussions General  0 Content Issues  0 Images Backdrops  1 Posters  3 Videos Trailers  0 Teasers  0 Clips  0 Featurettes  0 Opening Credits  0 Top Billed Cast Yoon Kye-sang Jang Hyun-tae Lee Ha-Na Choi Soo-in Min Hyo-rin Lee Ha-ru Lee Jung-jae Shin Hwal Lee Sun-kyun Jo Hae-yoon Full Cast & Crew Last Season Season 1 2009 | 16 Episodes Season 1 of Triple premiered on June 11, 2009. View All Seasons Social Reviews  0 Discussions  0 Media Most Popular Videos  0 Backdrops  1 Posters  3 Recommendations We don't have enough data to suggest any TV shows based on Triple. You can help by rating TV shows you've seen. Facts Status  Ended Network Certification  - Type  Scripted Original Language  Korean Runtime  - Homepage  - Genres Drama Comedy Keywords No keywords have been added. Content Score 86 Almost there... Top Contributors N 9 Nightowl.Kr t 7 tmdb38202327 5 part-mozi 5 sansalayne  View Edit History Popularity Trend  Login to edit  URL By  signing up  for an account on TMDb, you can post directly to Twitter and Facebook. You need to be logged in to continue. Click  here  to login or  here  to sign up.    page_wrap opened in html_head  Join the Community The Basics About TMDb Contact Us Support Forums API Blog Get Involved  Contribution Bible 3rd Party Applications Add New Movie Add New TV Show Community Guidelines Leaderboard Forums Twitter Facebook Legal Terms of Use Privacy Policy Login Sign Up"
}