{
  "link": "https://www.themoviedb.org/tv/79788?language=en",
  "title": "Watchmen",
  "resume": "Television series based on the comic-book 'Watchmen', which was published by DC Comics in 1986 - 1987.",
  "rate": "0.0",
  "genre": [
    "Crime",
    "Drama"
  ],
  "cast": [
    "Tim Blake Nelson",
    "Jeremy Irons",
    "Don Johnson",
    "Yahya Abdul-Mateen II",
    "Sara Vickers"
  ],
  "character": [
    "Walter Kovacs / Rorschach",
    "Adrian Veidt / Ozymandias"
  ],
  "site_data": "html Apps Forums Leaderboard Contribute API Support Discover Movies TV Shows Movies Popular Top Rated Upcoming Now Playing TV Shows Popular Top Rated On TV Airing Today People Popular People Can't find a movie or TV show? Login to create it. en Login Sign Up  ID: 79788   Expand Watchmen User Score Overview Television series based on the comic-book 'Watchmen', which was published by DC Comics in 1986 - 1987. Featured Crew Damon Lindelof Creator Discussions   Reviews Videos   Images   Changes Report Share Discussions General  0 Content Issues  0 Images Backdrops  0 Posters  1 Videos Trailers  0 Teasers  0 Clips  0 Featurettes  0 Opening Credits  0 Top Billed Cast Tim Blake Nelson Walter Kovacs / Rorschach Jeremy Irons Adrian Veidt / Ozymandias Don Johnson Yahya Abdul-Mateen II Sara Vickers Full Cast & Crew Last Season Season 1 \u2014 | 0 Episodes We don't have an overview translated in English. Help us expand our database by adding one. View All Seasons Social Reviews  0 Discussions  0 Media Most Popular Videos  0 Backdrops  0 Posters  1 Facts Status  In Production Network Certification  - Type  Miniseries Original Language  English Runtime  - Homepage  - Genres Crime Drama Keywords based on graphic novel Content Score 71 Just a little bit more... Top Contributors 35 Mikedeth5 s 2 suineg  View Edit History Popularity Trend  Login to edit  URL By  signing up  for an account on TMDb, you can post directly to Twitter and Facebook. You need to be logged in to continue. Click  here  to login or  here  to sign up.    page_wrap opened in html_head  Join the Community The Basics About TMDb Contact Us Support Forums API Blog Get Involved  Contribution Bible 3rd Party Applications Add New Movie Add New TV Show Community Guidelines Leaderboard Forums Twitter Facebook Legal Terms of Use Privacy Policy Login Sign Up"
}