{
  "link": "https://www.themoviedb.org/tv/5639?language=en",
  "title": "Pushing Daisies",
  "resume": "A pie-maker, with the power to bring dead people back to life, solves murder mysteries with his alive-again childhood sweetheart, a cynical private investigator, and a lovesick waitress.",
  "rate": "",
  "genre": [
    "Comedy",
    "Drama",
    "Sci-Fi",
    "Fantasy",
    "Crime"
  ],
  "cast": {
    "actor": [
      "Lee Pace",
      "Anna Friel",
      "Chi McBride",
      "Kristin Chenoweth",
      "Swoosie Kurtz"
    ]
  },
  "characters": {
    "characters": [
      "Ned",
      "Charlotte Charles",
      "Emerson Cod",
      "Olive Snook",
      "Lily Charles"
    ]
  },
  "site_data": "html Apps Forums Leaderboard Contribute API Support Discover Movies TV Shows Movies Popular Top Rated Upcoming Now Playing TV Shows Popular Top Rated On TV Airing Today People Popular People Can't find a movie or TV show? Login to create it. en Login Sign Up  ID: 5639   Expand Pushing Daisies   (2007) User Score  Play Trailer Overview A pie-maker, with the power to bring dead people back to life, solves murder mysteries with his alive-again childhood sweetheart, a cynical private investigator, and a lovesick waitress. Featured Crew Bryan Fuller Creator Discussions   Reviews Videos   Images   Changes Report Share Discussions General  0 Content Issues  0 Images Backdrops  43 Posters  6 Videos Trailers  1 Teasers  2 Clips  4 Featurettes  0 Opening Credits  0 Top Billed Cast Lee Pace Ned Anna Friel Charlotte Charles Chi McBride Emerson Cod Kristin Chenoweth Olive Snook Swoosie Kurtz Lily Charles Full Cast & Crew Last Season Season 2 2008 | 13 Episodes Season 2 of Pushing Daisies premiered on October  1, 2008. View All Seasons Social Reviews  0 Discussions  0 Media Most Popular Videos  7 Backdrops  43 Posters  6 Recommendations   2003-06-27 Dead Like Me 7.8    2009-03-18 Better Off Ted 7.7    2004-03-12 Wonderfalls 7.8    2007-09-25 Reaper 7.0    2006-10-11 30 Rock 7.1    2009-09-20 Bored to Death 7.4    2009-02-13 Dollhouse 7.2    2009-06-28 Hung 6.2  Facts Status  Ended Network Certification PG Meaning Parental guidance. Moderate violence and moderate profanity is allowed, as is brief nudity and sexual references if important to the context of the story. Type  Scripted Original Language  English Runtime  42m Homepage   http://abc.go.com/primetime/pushingdaisies/index Genres Comedy Drama Sci-Fi & Fantasy Crime Keywords reanimation murder investigation resuscitation power rekindled romance Content Score 100 Yes! Looking good! Top Contributors M 21 MAthePA 15 Elizabeth Jennings TB 12 TMDb Bot A 11 Alexlfm  View Edit History Popularity Trend  Login to edit  URL By  signing up  for an account on TMDb, you can post directly to Twitter and Facebook. You need to be logged in to continue. Click  here  to login or  here  to sign up.    page_wrap opened in html_head  Join the Community The Basics About TMDb Contact Us Support Forums API Blog Get Involved  Contribution Bible 3rd Party Applications Add New Movie Add New TV Show Community Guidelines Leaderboard Forums Twitter Facebook Legal Terms of Use Privacy Policy Login Sign Up"
}