{
  "link": "https://www.themoviedb.org/tv/70531?language=en",
  "title": "Family Business",
  "resume": "Family business. Can little children train a grown-up? How much time do you need to put five kids to bed? Can you make a business out of your family?",
  "rate": "60.0",
  "genre": [
    "Comedy",
    "Family"
  ],
  "cast": [
    "Vladimir Yaglych",
    "Anna Starshenbaum",
    "Sergey Pokhodaev",
    "Yuri Tarasov",
    "Mikhail Bogdasarov"
  ],
  "character": [
    "Ilya Ponomarev",
    "Lidya Petrova",
    "Tolya",
    "Nikolaj Stepanovich",
    "Kazim Akavovich"
  ],
  "site_data": "html Apps Forums Leaderboard Contribute API Support Discover Movies TV Shows Movies Popular Top Rated Upcoming Now Playing TV Shows Popular Top Rated On TV Airing Today People Popular People Can't find a movie or TV show? Login to create it. en Login Sign Up  ID: 70531   Expand Family Business   (2014) User Score Overview Family business. Can little children train a grown-up? How much time do you need to put five kids to bed? Can you make a business out of your family? Discussions   Reviews Videos   Images   Changes Report Share Discussions General  0 Content Issues  0 Images Backdrops  0 Posters  1 Videos Trailers  0 Teasers  0 Clips  0 Featurettes  0 Opening Credits  0 Top Billed Cast Vladimir Yaglych Ilya Ponomarev Anna Starshenbaum Lidya Petrova Sergey Pokhodaev Tolya Yuri Tarasov Nikolaj Stepanovich Mikhail Bogdasarov Kazim Akavovich Full Cast & Crew Last Season Family Business Season 2 2015 | 20 Episodes Season 2 of Family Business premiered on October 12, 2015. View All Seasons Social Reviews  0 Discussions  0 Media Most Popular Videos  0 Backdrops  0 Posters  1 Recommendations We don't have enough data to suggest any TV shows based on Family Business. You can help by rating TV shows you've seen. Facts Original Name  \u0421\u0435\u043c\u0435\u0439\u043d\u044b\u0439 \u0431\u0438\u0437\u043d\u0435\u0441 Status  Ended Network Certification  - Type  Scripted Original Language  Russian Runtime  24m Homepage   http://ctc.ru/projects/serials/semeynyy-biznes/ Genres Comedy Family Keywords No keywords have been added. Content Score 71 Just a little bit more... Top Contributors 30 velpi 3 mrtextortexel  View Edit History Popularity Trend  Login to edit  URL By  signing up  for an account on TMDb, you can post directly to Twitter and Facebook. You need to be logged in to continue. Click  here  to login or  here  to sign up.    page_wrap opened in html_head  Join the Community The Basics About TMDb Contact Us Support Forums API Blog Get Involved  Contribution Bible 3rd Party Applications Add New Movie Add New TV Show Community Guidelines Leaderboard Forums Twitter Facebook Legal Terms of Use Privacy Policy Login Sign Up"
}