{
  "link": "https://www.themoviedb.org/tv/62849?language=en",
  "title": "Munka\u00fcgyek",
  "resume": "We don't have an overview translated in English. Help us expand our database by adding one.",
  "rate": "88.0",
  "genre": [
    "Comedy"
  ],
  "cast": [
    "Moln\u00e1r Piroska",
    "Mucsi Zolt\u00e1n",
    "Ferenc Elek",
    "Lehel Kov\u00e1cs",
    "Fodor Annam\u00e1ria"
  ],
  "character": [
    "Elvira",
    "J\u00e1nos",
    "Albert",
    "Karesz",
    "Timi"
  ],
  "site_data": "html Apps Forums Leaderboard Contribute API Support Discover Movies TV Shows Movies Popular Top Rated Upcoming Now Playing TV Shows Popular Top Rated On TV Airing Today People Popular People Can't find a movie or TV show? Login to create it. en Login Sign Up  ID: 62849   Expand Munka\u00fcgyek   (2012) User Score Overview We don't have an overview translated in English. Help us expand our database by adding one. Discussions   Reviews Videos   Images   Changes Report Share Discussions General  0 Content Issues  0 Images Backdrops  5 Posters  2 Videos Trailers  0 Teasers  0 Clips  0 Featurettes  0 Opening Credits  0 Top Billed Cast Moln\u00e1r Piroska Elvira Mucsi Zolt\u00e1n J\u00e1nos Ferenc Elek Albert Lehel Kov\u00e1cs Karesz Fodor Annam\u00e1ria Timi Full Cast & Crew Last Season Season 6 2016 | 24 Episodes Season 6 of Munka\u00fcgyek premiered on September 29, 2016. View All Seasons Social Reviews  0 Discussions  0 Media Most Popular Videos  0 Backdrops  5 Posters  2 Recommendations We don't have enough data to suggest any TV shows based on Munka\u00fcgyek. You can help by rating TV shows you've seen. Facts Status  Returning Series Network Certification  - Type  Scripted Original Language  Hungarian Runtime  - Homepage  - Genres Comedy Keywords hungary Content Score 79 Pump it up! We're close now. Top Contributors E 19 Endi_75 k 15 kisgab88 M 12 MLCHome m 7 moxi  View Edit History Popularity Trend  Login to edit  URL By  signing up  for an account on TMDb, you can post directly to Twitter and Facebook. You need to be logged in to continue. Click  here  to login or  here  to sign up.    page_wrap opened in html_head  Join the Community The Basics About TMDb Contact Us Support Forums API Blog Get Involved  Contribution Bible 3rd Party Applications Add New Movie Add New TV Show Community Guidelines Leaderboard Forums Twitter Facebook Legal Terms of Use Privacy Policy Login Sign Up"
}