{
  "link": "https://www.themoviedb.org/tv/65445?language=en",
  "title": "The Nightmare Worlds of H.G. Wells",
  "resume": "Ray Winstone heads a cast of acclaimed actors in four H. G. Wells stories",
  "rate": "",
  "genre": [
    "Drama",
    "Sci-Fi",
    "Fantasy"
  ],
  "cast": {
    "actor": [
      "Ray Winstone"
    ]
  },
  "characters": {
    "characters": [
      "H.G. Wells"
    ]
  },
  "site_data": "html Apps Forums Leaderboard Contribute API Support Discover Movies TV Shows Movies Popular Top Rated Upcoming Now Playing TV Shows Popular Top Rated On TV Airing Today People Popular People Can't find a movie or TV show? Login to create it. en Login Sign Up  ID: 65445   Expand The Nightmare Worlds of H.G. Wells   (2016) User Score  Play Trailer Overview Ray Winstone heads a cast of acclaimed actors in four H. G. Wells stories Discussions   Reviews Videos   Images   Changes Report Share Discussions General  0 Content Issues  0 Images Backdrops  1 Posters  1 Videos Trailers  1 Teasers  0 Clips  0 Featurettes  0 Opening Credits  0 Top Billed Cast Ray Winstone H.G. Wells Full Cast & Crew Last Season Season 1 2016 | 4 Episodes Season 1 of The Nightmare Worlds of H.G. Wells premiered on January 28, 2016. View All Seasons Social Reviews  0 Discussions  0 Media Most Popular Videos  1 Backdrops  1 Posters  1 Recommendations We don't have enough data to suggest any TV shows based on The Nightmare Worlds of H.G. Wells. You can help by rating TV shows you've seen. Facts Status  Returning Series Network Certification  - Type  Scripted Original Language  English Runtime  30m Homepage   https://www.sky.com/watch/channel/sky-arts/the-nightmare-worlds-of-hg-wells Genres Drama Sci-Fi & Fantasy Keywords based on novel or book time travel anthology miniseries Content Score 64 We're so close, yet so far. Top Contributors R 23 Rebecca 11 Elizabeth Jennings 5 Steve 3 Banana  View Edit History Popularity Trend  Login to edit  URL By  signing up  for an account on TMDb, you can post directly to Twitter and Facebook. You need to be logged in to continue. Click  here  to login or  here  to sign up.    page_wrap opened in html_head  Join the Community The Basics About TMDb Contact Us Support Forums API Blog Get Involved  Contribution Bible 3rd Party Applications Add New Movie Add New TV Show Community Guidelines Leaderboard Forums Twitter Facebook Legal Terms of Use Privacy Policy Login Sign Up"
}