{
  "link": "https://www.themoviedb.org/tv/75132?language=en",
  "title": "L'Art du crime",
  "resume": "We don't have an overview translated in English. Help us expand our database by adding one.",
  "rate": "0.0",
  "genre": [
    "Crime"
  ],
  "cast": [
    "\u00c9l\u00e9onore Gosset-Bernheim",
    "Nicolas Gob",
    "Philippe Duclos"
  ],
  "character": [
    "Florence Chassagne",
    "Antoine Verlay",
    "Pierre Chassagne"
  ],
  "site_data": "html Apps Forums Leaderboard Contribute API Support Discover Movies TV Shows Movies Popular Top Rated Upcoming Now Playing TV Shows Popular Top Rated On TV Airing Today People Popular People Can't find a movie or TV show? Login to create it. en Login Sign Up  ID: 75132   Expand L'Art du crime   (2017) User Score Overview We don't have an overview translated in English. Help us expand our database by adding one. Discussions   Reviews Videos   Images   Changes Report Share Discussions General  0 Content Issues  0 Images Backdrops  1 Posters  1 Videos Trailers  0 Teasers  0 Clips  0 Featurettes  0 Opening Credits  0 Top Billed Cast \u00c9l\u00e9onore Gosset-Bernheim Florence Chassagne Nicolas Gob Antoine Verlay Philippe Duclos Pierre Chassagne Full Cast & Crew Current Season Season 1 2017 | 6 Episodes Season 1 of L'Art du crime premiered on November 17, 2017. View All Seasons Social Reviews  0 Discussions  0 Media Most Popular Videos  0 Backdrops  1 Posters  1 Recommendations We don't have enough data to suggest any TV shows based on L'Art du crime. You can help by rating TV shows you've seen. Facts Status  Returning Series Networks - Certification  - Type  Scripted Original Language  French Runtime  - Homepage  - Genres Crime Keywords No keywords have been added. Content Score 50 Still needs a little work. Top Contributors 7 karaa P 5 Przemek B 3 BelDave69 1 enams90  View Edit History Popularity Trend  Login to edit  URL By  signing up  for an account on TMDb, you can post directly to Twitter and Facebook. You need to be logged in to continue. Click  here  to login or  here  to sign up.    page_wrap opened in html_head  Join the Community The Basics About TMDb Contact Us Support Forums API Blog Get Involved  Contribution Bible 3rd Party Applications Add New Movie Add New TV Show Community Guidelines Leaderboard Forums Twitter Facebook Legal Terms of Use Privacy Policy Login Sign Up"
}