{
  "link": "https://www.themoviedb.org/tv/66282?language=en",
  "title": "Berlin Station",
  "resume": "A contemporary spy series that follows Daniel Miller, an undercover agent at the CIA station in Berlin, Germany.",
  "rate": "",
  "genre": [
    "Action",
    "Adventure"
  ],
  "cast": {
    "actor": [
      "Richard Armitage",
      "Rhys Ifans",
      "Richard Jenkins",
      "Michelle Forbes",
      "Leland Orser"
    ]
  },
  "characters": {
    "characters": [
      "Daniel Miller",
      "Hector DeJean",
      "Steven Frost",
      "Valerie Edwards",
      "Robert Kirsch"
    ]
  },
  "site_data": "html Apps Forums Leaderboard Contribute API Support Discover Movies TV Shows Movies Popular Top Rated Upcoming Now Playing TV Shows Popular Top Rated On TV Airing Today People Popular People Can't find a movie or TV show? Login to create it. en Login Sign Up  ID: 66282   Expand Berlin Station   (2016) User Score  Play Trailer Overview A contemporary spy series that follows Daniel Miller, an undercover agent at the CIA station in Berlin, Germany. Featured Crew Olen Steinhauer Creator Discussions   Reviews Videos   Images   Changes Report Share Discussions General  0 Content Issues  1 Images Backdrops  8 Posters  5 Videos Trailers  1 Teasers  1 Clips  0 Featurettes  0 Opening Credits  0 Top Billed Cast Richard Armitage Daniel Miller Rhys Ifans Hector DeJean Richard Jenkins Steven Frost Michelle Forbes Valerie Edwards Leland Orser Robert Kirsch Full Cast & Crew Current Season Season 2 2017 | 9 Episodes View All Seasons Social Reviews  0 Discussions  1 Subject Status Replies Last Reply There are no discussions for Berlin Station. Login to be first! Go to Discussions Media Most Popular Videos  2 Backdrops  8 Posters  5 Recommendations   2017-09-26 Law & Order True Crime 5.8    2016-10-19 Chance 7.3    2017-10-01 Wisdom of the Crowd 7.1    2017-01-25 Cardinal 6.9    2016-12-07 Shut Eye 6.3    2017-02-02 Training Day 6.2    2017-09-27 SEAL Team 6.6    2017-10-03 The Mayor 6.7  Facts Status  Returning Series Network Certification TV-MA Meaning This program is specifically designed to be viewed by adults and therefore may be unsuitable for children under 17 Type  Scripted Original Language  English Runtime  60m Homepage   http://www.epix.com/series/berlin-station Genres Action & Adventure Keywords berlin cia spy clandestine whistleblower Content Score 100 Yes! Looking good! Top Contributors 85 Elizabeth Jennings S 30 Samara a 10 adambakir92 9 Maretoh  View Edit History Popularity Trend  Login to edit  URL By  signing up  for an account on TMDb, you can post directly to Twitter and Facebook. You need to be logged in to continue. Click  here  to login or  here  to sign up.    page_wrap opened in html_head  Join the Community The Basics About TMDb Contact Us Support Forums API Blog Get Involved  Contribution Bible 3rd Party Applications Add New Movie Add New TV Show Community Guidelines Leaderboard Forums Twitter Facebook Legal Terms of Use Privacy Policy Login Sign Up"
}