{
  "link": "https://www.themoviedb.org/tv/41261?language=en",
  "title": "Der Kommissar und das Meer",
  "resume": "Der Kommissar und das Meer is a German television series.",
  "rate": "",
  "genre": [
    "Crime"
  ],
  "cast": {
    "actor": [
      "Walter Sittler",
      "S\u00f3lveig Arnarsd\u00f3ttir",
      "Paprika Steen",
      "Inger Nilsson"
    ]
  },
  "characters": {
    "characters": [
      "Kommissar Robert Anders",
      "Karin Jacobsson",
      "Line Anders",
      "Pathologin Ewa"
    ]
  },
  "site_data": "html Apps Forums Leaderboard Contribute API Support Discover Movies TV Shows Movies Popular Top Rated Upcoming Now Playing TV Shows Popular Top Rated On TV Airing Today People Popular People Can't find a movie or TV show? Login to create it. en Login Sign Up  ID: 41261   Expand Der Kommissar und das Meer   (2007) User Score Overview Der Kommissar und das Meer is a German television series. Featured Crew Henriette Pieper Creator Discussions   Reviews Videos   Images   Changes Report Share Discussions General  0 Content Issues  0 Images Backdrops  2 Posters  1 Videos Trailers  0 Teasers  0 Clips  0 Featurettes  0 Opening Credits  0 Top Billed Cast Walter Sittler Kommissar Robert Anders S\u00f3lveig Arnarsd\u00f3ttir Karin Jacobsson Paprika Steen Line Anders Inger Nilsson Pathologin Ewa Full Cast & Crew Last Season Season 1 2007 | 24 Episodes Season 1 of Der Kommissar und das Meer premiered on December 21, 2007. View All Seasons Social Reviews  0 Discussions  0 Media Most Popular Videos  0 Backdrops  2 Posters  1 Recommendations We don't have enough data to suggest any TV shows based on Der Kommissar und das Meer. You can help by rating TV shows you've seen. Facts Status  Returning Series Network Certification  - Type  Scripted Original Language  German Runtime  90m Homepage  - Genres Crime Keywords No keywords have been added. Content Score 93 Almost there... Top Contributors S 39 Samara T 11 Tigrecito z 4 zurman1 p 3 pgranado  View Edit History Popularity Trend  Login to edit  URL By  signing up  for an account on TMDb, you can post directly to Twitter and Facebook. You need to be logged in to continue. Click  here  to login or  here  to sign up.    page_wrap opened in html_head  Join the Community The Basics About TMDb Contact Us Support Forums API Blog Get Involved  Contribution Bible 3rd Party Applications Add New Movie Add New TV Show Community Guidelines Leaderboard Forums Twitter Facebook Legal Terms of Use Privacy Policy Login Sign Up"
}