{
  "link": "https://www.themoviedb.org/tv/4319?language=en",
  "title": "Love Generation",
  "resume": "Love Generation is a drama that aired on Fuji TV. It first aired in Japan from October 13, 1997 to December 22, 1997 every Monday. It enjoyed a very high rating of 30.8% and features music by Cagnet.",
  "rate": "",
  "genre": [
    "Drama"
  ],
  "cast": {
    "actor": [
      "Takako Matsu",
      "Takuya Kimura",
      "Tomoka Kurotani",
      "Hisashi Igawa",
      "Katsuhisa Namase"
    ]
  },
  "characters": {
    "characters": [
      "Teppei Katagiri"
    ]
  },
  "site_data": "html Apps Forums Leaderboard Contribute API Support Discover Movies TV Shows Movies Popular Top Rated Upcoming Now Playing TV Shows Popular Top Rated On TV Airing Today People Popular People Can't find a movie or TV show? Login to create it. en Login Sign Up  ID: 4319   Expand Love Generation   (1997) User Score Overview Love Generation is a drama that aired on Fuji TV. It first aired in Japan from October 13, 1997 to December 22, 1997 every Monday. It enjoyed a very high rating of 30.8% and features music by Cagnet. Discussions   Reviews Videos   Images   Changes Report Share Discussions General  0 Content Issues  0 Images Backdrops  2 Posters  1 Videos Trailers  0 Teasers  0 Clips  0 Featurettes  0 Opening Credits  0 Top Billed Cast Takako Matsu Takuya Kimura Teppei Katagiri Tomoka Kurotani Hisashi Igawa Katsuhisa Namase Full Cast & Crew Last Season Season 1 1997 | 11 Episodes Season 1 of Love Generation premiered on October 13, 1997. View All Seasons Social Reviews  0 Discussions  0 Media Most Popular Videos  0 Backdrops  2 Posters  1 Recommendations We don't have enough data to suggest any TV shows based on Love Generation. You can help by rating TV shows you've seen. Facts Original Name  \u30e9\u30d6\u30b8\u30a7\u30cd\u30ec\u30fc\u30b7\u30e7\u30f3 Status  Ended Network Certification  - Type  Scripted Original Language  Japanese Runtime  60m Homepage  - Genres Drama Keywords No keywords have been added. Content Score 86 Almost there... Top Contributors A 6 Aka75 t 4 taxigps c 3 ctchim j 1 jeroen1981  View Edit History Popularity Trend  Login to edit  URL By  signing up  for an account on TMDb, you can post directly to Twitter and Facebook. You need to be logged in to continue. Click  here  to login or  here  to sign up.    page_wrap opened in html_head  Join the Community The Basics About TMDb Contact Us Support Forums API Blog Get Involved  Contribution Bible 3rd Party Applications Add New Movie Add New TV Show Community Guidelines Leaderboard Forums Twitter Facebook Legal Terms of Use Privacy Policy Login Sign Up"
}