{
  "link": "https://www.themoviedb.org/tv/72747?language=en",
  "title": "The Launch",
  "resume": "A six-part talent series where unknown artists are paired with original songs. Premiering in 2018.",
  "rate": "0.0",
  "genre": [
    "Reality"
  ],
  "cast": [
    "Ryan Tedder",
    "Fergie"
  ],
  "character": [
    "Mentor",
    "Mentor"
  ],
  "site_data": "html Apps Forums Leaderboard Contribute API Support Discover Movies TV Shows Movies Popular Top Rated Upcoming Now Playing TV Shows Popular Top Rated On TV Airing Today People Popular People Can't find a movie or TV show? Login to create it. en Login Sign Up  ID: 72747   Expand The Launch   (2018) User Score  Play Trailer Overview A six-part talent series where unknown artists are paired with original songs. Premiering in 2018. Featured Crew Scott Borchetta Creator Discussions   Reviews Videos   Images   Changes Report Share Discussions General  0 Content Issues  0 Images Backdrops  0 Posters  1 Videos Trailers  1 Teasers  0 Clips  0 Featurettes  0 Opening Credits  0 Top Billed Cast Ryan Tedder Mentor Fergie Mentor Full Cast & Crew Next Season Season 1 2018 | 1 Episode Season 1 of The Launch is set to premiere on December 31, 2018. View All Seasons Social Reviews  0 Discussions  0 Media Most Popular Videos  1 Backdrops  0 Posters  1 Facts Status  In Production Network Certification  - Type  Reality Original Language  English Runtime  40m Homepage   http://www.ctv.ca/TheLaunch Genres Reality Keywords No keywords have been added. Content Score 56 We're so close, yet so far. Top Contributors t 20 tmdb42368388 3 tigru89 1 Elizabeth Jennings TB 1 TMDb Bot  View Edit History Popularity Trend  Login to edit  URL By  signing up  for an account on TMDb, you can post directly to Twitter and Facebook. You need to be logged in to continue. Click  here  to login or  here  to sign up.    page_wrap opened in html_head  Join the Community The Basics About TMDb Contact Us Support Forums API Blog Get Involved  Contribution Bible 3rd Party Applications Add New Movie Add New TV Show Community Guidelines Leaderboard Forums Twitter Facebook Legal Terms of Use Privacy Policy Login Sign Up"
}