{
  "link": "https://www.themoviedb.org/tv/33267?language=en",
  "title": "The Silence",
  "resume": "Drama about a deaf girl who witnesses the audacious murder of a policewoman.",
  "rate": "68.0",
  "genre": [
    "Crime",
    "Drama"
  ],
  "cast": [
    "Hugh Bonneville",
    "Dervla Kirwan",
    "Gina McKee",
    "Rebecca Oldfield",
    "Harry Ferrier"
  ],
  "character": [
    "Maggie"
  ],
  "site_data": "html Apps Forums Leaderboard Contribute API Support Discover Movies TV Shows Movies Popular Top Rated Upcoming Now Playing TV Shows Popular Top Rated On TV Airing Today People Popular People Can't find a movie or TV show? Login to create it. en Login Sign Up  ID: 33267   Expand The Silence   (2010) User Score Overview Drama about a deaf girl who witnesses the audacious murder of a policewoman. Discussions   Reviews Videos   Images   Changes Report Share Discussions General  0 Content Issues  0 Images Backdrops  2 Posters  2 Videos Trailers  0 Teasers  0 Clips  0 Featurettes  0 Opening Credits  0 Top Billed Cast Hugh Bonneville Dervla Kirwan Maggie Gina McKee Rebecca Oldfield Harry Ferrier Full Cast & Crew Last Season Season 1 2010 | 4 Episodes Season 1 of The Silence premiered on July 12, 2010. View All Seasons Social Reviews  0 Discussions  0 Media Most Popular Videos  0 Backdrops  2 Posters  2 Recommendations   2004-07-19 The Grid 7.0    2013-09-05 The Guilty 7.0    2016-06-08 Power Monkeys 7.0    2011-06-06 Injustice 7.3    2006-01-01 In Justice 6.8    2011-02-03 Marchlands 7.4    2013-02-27 Lightfields 7.5    2015-04-15 The Delivery Man 6.5  Facts Status  Ended Network Certification  - Type  Miniseries Original Language  English Runtime  60m Homepage   http://www.bbc.co.uk/programmes/b00t3y2w Genres Crime Drama Keywords miniseries deaf woman director Content Score 86 Almost there... Top Contributors t 23 tmdb48730457 TB 14 TMDb Bot R 8 Rebecca w 3 webmaster  View Edit History Popularity Trend  Login to edit  URL By  signing up  for an account on TMDb, you can post directly to Twitter and Facebook. You need to be logged in to continue. Click  here  to login or  here  to sign up.    page_wrap opened in html_head  Join the Community The Basics About TMDb Contact Us Support Forums API Blog Get Involved  Contribution Bible 3rd Party Applications Add New Movie Add New TV Show Community Guidelines Leaderboard Forums Twitter Facebook Legal Terms of Use Privacy Policy Login Sign Up"
}