{
  "link": "https://www.themoviedb.org/tv/64176?language=en",
  "title": "The Woman Who Married Three Times",
  "resume": "A story about a woman and her two adult daughters. Older sister Oh Hyun-soo is a pet products designer, while younger sister Oh Eun-soo gets remarried after a failed marriage.",
  "rate": "",
  "genre": [
    "Drama",
    "Family",
    "Romance"
  ],
  "cast": {
    "actor": [
      "Lee Ji-ah",
      "Uhm Ji-won",
      "Song Chang-eui",
      "Ha Seok-jin",
      "Seo Young-hee"
    ]
  },
  "characters": {
    "characters": [
      "Oh Eun-soo",
      "Oh Hyun-soo",
      "Jung Tae-won",
      "Kim Joon-goo",
      "Park Joo-ha"
    ]
  },
  "site_data": "html Apps Forums Leaderboard Contribute API Support Discover Movies TV Shows Movies Popular Top Rated Upcoming Now Playing TV Shows Popular Top Rated On TV Airing Today People Popular People Can't find a movie or TV show? Login to create it. en Login Sign Up  ID: 64176   Expand The Woman Who Married Three Times   (2013) User Score Overview A story about a woman and her two adult daughters. Older sister Oh Hyun-soo is a pet products designer, while younger sister Oh Eun-soo gets remarried after a failed marriage. Discussions   Reviews Videos   Images   Changes Report Share Discussions General  0 Content Issues  0 Images Backdrops  0 Posters  1 Videos Trailers  0 Teasers  0 Clips  0 Featurettes  0 Opening Credits  0 Top Billed Cast Lee Ji-ah Oh Eun-soo Uhm Ji-won Oh Hyun-soo Song Chang-eui Jung Tae-won Ha Seok-jin Kim Joon-goo Seo Young-hee Park Joo-ha Full Cast & Crew Last Season Season 1 2013 | 40 Episodes Season 1 of The Woman Who Married Three Times premiered on November  9, 2013. View All Seasons Social Reviews  0 Discussions  0 Media Most Popular Videos  0 Backdrops  0 Posters  1 Recommendations We don't have enough data to suggest any TV shows based on The Woman Who Married Three Times. You can help by rating TV shows you've seen. Facts Original Name  \uc138\ubc88 \uacb0\ud63c\ud558\ub294 \uc5ec\uc790 Status  Ended Network Certification  - Type  Scripted Original Language  Korean Runtime  60m Homepage   http://tv.sbs.co.kr/3marriage Genres Drama Family Romance Keywords korea Content Score 71 Just a little bit more... Top Contributors t 48 tmdb38202327 M 1 Maria180493 V 1 Violsa t 1 tmdb983464  View Edit History Popularity Trend  Login to edit  URL By  signing up  for an account on TMDb, you can post directly to Twitter and Facebook. You need to be logged in to continue. Click  here  to login or  here  to sign up.    page_wrap opened in html_head  Join the Community The Basics About TMDb Contact Us Support Forums API Blog Get Involved  Contribution Bible 3rd Party Applications Add New Movie Add New TV Show Community Guidelines Leaderboard Forums Twitter Facebook Legal Terms of Use Privacy Policy Login Sign Up"
}