{
  "link": "https://www.themoviedb.org/tv/3763?language=en",
  "title": "Dinosaurs",
  "resume": "Dinosaurs follows the life of a family of dinosaurs, living in a modern world. They have TV's, fridges, microwaves, and every modern convenience.",
  "rate": "",
  "genre": [
    "Sci-Fi",
    "Fantasy",
    "Comedy"
  ],
  "cast": {
    "actor": [
      "Sally Struthers",
      "Stuart Pankin",
      "Jessica Walter",
      "Kevin Clash",
      "Jason Willinger"
    ]
  },
  "characters": {
    "characters": [
      "Charlene Sinclair (voice)",
      "Earl Sinclair (voice)",
      "Fran Sinclair (voice)",
      "Baby Sinclair (voice)",
      "Robbie Sinclair (voice)"
    ]
  },
  "site_data": "html Apps Forums Leaderboard Contribute API Support Discover Movies TV Shows Movies Popular Top Rated Upcoming Now Playing TV Shows Popular Top Rated On TV Airing Today People Popular People Can't find a movie or TV show? Login to create it. en Login Sign Up  ID: 3763   Expand Dinosaurs   (1991) User Score Overview Dinosaurs follows the life of a family of dinosaurs, living in a modern world. They have TV's, fridges, microwaves, and every modern convenience. Featured Crew Bob Young Creator Michael Jacobs Creator Jim Henson Creator Discussions   Reviews Videos   Images   Changes Report Share Discussions General  1 Content Issues  2 Images Backdrops  6 Posters  11 Videos Trailers  0 Teasers  0 Clips  0 Featurettes  0 Opening Credits  0 Top Billed Cast Sally Struthers Charlene Sinclair (voice) Stuart Pankin Earl Sinclair (voice) Jessica Walter Fran Sinclair (voice) Kevin Clash Baby Sinclair (voice) Jason Willinger Robbie Sinclair (voice) Full Cast & Crew Last Season Season 4 1994 | 14 Episodes Season 4 of Dinosaurs premiered on June  1, 1994. View All Seasons Social Reviews  0 Discussions  3 Subject Status Replies Last Reply S I'm the baby gotta love me music video Open 0 by Strannger18\n      \n     Go to Discussions Media Most Popular Videos  0 Backdrops  6 Posters  11 Recommendations   1962-09-23 The Jetsons 6.6    1993-09-13 Animaniacs 7.6    1987-09-18 DuckTales 7.6    1995-09-09 Pinky and the Brain 7.7    1990-09-14 Tiny Toon Adventures 7.3    1988-09-17 Garfield and Friends 6.6    1991-09-08 Darkwing Duck 7.3    1960-09-30 The Flintstones 7.0  Facts Status  Ended Network Certification 6 Meaning Can be aired at any time. Type  Scripted Original Language  English Runtime  23m Homepage  - Genres Sci-Fi & Fantasy Comedy Keywords dinosaur management training Content Score 93 Almost there... Top Contributors 30 Banana KH 10 Kuno Herrmann E 10 Elliottday 9 Elizabeth Jennings  View Edit History Popularity Trend  Login to edit  URL By  signing up  for an account on TMDb, you can post directly to Twitter and Facebook. You need to be logged in to continue. Click  here  to login or  here  to sign up.    page_wrap opened in html_head  Join the Community The Basics About TMDb Contact Us Support Forums API Blog Get Involved  Contribution Bible 3rd Party Applications Add New Movie Add New TV Show Community Guidelines Leaderboard Forums Twitter Facebook Legal Terms of Use Privacy Policy Login Sign Up"
}