{
  "link": "https://www.themoviedb.org/tv/63218?language=en",
  "title": "Body Invaders",
  "resume": "We don't have an overview translated in English. Help us expand our database by adding one.",
  "rate": "",
  "genre": [
    "Documentary"
  ],
  "cast": {
    "actor": [
      "Gary Beadle"
    ]
  },
  "characters": {
    "characters": [
      "Narrator"
    ]
  },
  "site_data": "html Apps Forums Leaderboard Contribute API Support Discover Movies TV Shows Movies Popular Top Rated Upcoming Now Playing TV Shows Popular Top Rated On TV Airing Today People Popular People Can't find a movie or TV show? Login to create it. en Login Sign Up  ID: 63218   Expand Body Invaders   (2012) User Score Overview We don't have an overview translated in English. Help us expand our database by adding one. Featured Crew Bernie Schaeffer Creator Discussions   Reviews Videos   Images   Changes Report Share Discussions General  0 Content Issues  0 Images Backdrops  1 Posters  1 Videos Trailers  0 Teasers  0 Clips  0 Featurettes  0 Opening Credits  0 Top Billed Cast Gary Beadle Narrator Full Cast & Crew Last Season Season 1 2012 | 6 Episodes Season 1 of Body Invaders premiered on September 23, 2012. View All Seasons Social Reviews  0 Discussions  0 Media Most Popular Videos  0 Backdrops  1 Posters  1 Recommendations We don't have enough data to suggest any TV shows based on Body Invaders. You can help by rating TV shows you've seen. Facts Status  Ended Network Certification TV-14 Meaning This program contains some material that many parents would find unsuitable for children under 14 years of age. Type  Documentary Original Language  English Runtime  45m Homepage   http://www.discoveryuk.com/web/body-invaders/ Genres Documentary Keywords medicine injury Content Score 64 We're so close, yet so far. Top Contributors 47 Apollo 9 Elizabeth Jennings 2 Banana TB 1 TMDb Bot  View Edit History Popularity Trend  Login to edit  URL By  signing up  for an account on TMDb, you can post directly to Twitter and Facebook. You need to be logged in to continue. Click  here  to login or  here  to sign up.    page_wrap opened in html_head  Join the Community The Basics About TMDb Contact Us Support Forums API Blog Get Involved  Contribution Bible 3rd Party Applications Add New Movie Add New TV Show Community Guidelines Leaderboard Forums Twitter Facebook Legal Terms of Use Privacy Policy Login Sign Up"
}