{
  "link": "https://www.themoviedb.org/tv/76529?language=en",
  "title": "Die Insel\u00e4rztin",
  "resume": "We don't have an overview translated in English. Help us expand our database by adding one.",
  "rate": "",
  "genre": [
    "Drama",
    "Family"
  ],
  "cast": {
    "actor": [
      "Anja Knauer",
      "Helmut Zierl",
      "Tobias Licht",
      "Dennenesch Zoud\u00e9",
      "Tyron Ricketts"
    ]
  },
  "characters": {
    "characters": [
      "Dr. Filipa Wagner",
      "Hoteldirektor Kulovits",
      "Dr. Daniel Bucher",
      "Emi",
      "Mike"
    ]
  },
  "site_data": "html Apps Forums Leaderboard Contribute API Support Discover Movies TV Shows Movies Popular Top Rated Upcoming Now Playing TV Shows Popular Top Rated On TV Airing Today People Popular People Can't find a movie or TV show? Login to create it. en Login Sign Up  ID: 76529   Expand Die Insel\u00e4rztin   (2018) User Score Overview We don't have an overview translated in English. Help us expand our database by adding one. Discussions   Reviews Videos   Images   Changes Report Share Discussions General  0 Content Issues  0 Images Backdrops  3 Posters  1 Videos Trailers  0 Teasers  0 Clips  0 Featurettes  0 Opening Credits  0 Top Billed Cast Anja Knauer Dr. Filipa Wagner Helmut Zierl Hoteldirektor Kulovits Tobias Licht Dr. Daniel Bucher Dennenesch Zoud\u00e9 Emi Tyron Ricketts Mike Full Cast & Crew Current Season Season 1 2018 | 2 Episodes Season 1 of Die Insel\u00e4rztin premiered on January 19, 2018. View All Seasons Social Reviews  0 Discussions  0 Media Most Popular Videos  0 Backdrops  3 Posters  1 Recommendations We don't have enough data to suggest any TV shows based on Die Insel\u00e4rztin. You can help by rating TV shows you've seen. Facts Status  Returning Series Network Certification  - Type  Scripted Original Language  German Runtime  90m Homepage  - Genres Drama Family Keywords gender ideals Content Score 79 Pump it up! We're close now. Top Contributors L 35 Lemmy_6 o 5 orhan_y\u00fcm\u00fccly T 2 Ticktock  View Edit History Popularity Trend  Login to edit  URL By  signing up  for an account on TMDb, you can post directly to Twitter and Facebook. You need to be logged in to continue. Click  here  to login or  here  to sign up.    page_wrap opened in html_head  Join the Community The Basics About TMDb Contact Us Support Forums API Blog Get Involved  Contribution Bible 3rd Party Applications Add New Movie Add New TV Show Community Guidelines Leaderboard Forums Twitter Facebook Legal Terms of Use Privacy Policy Login Sign Up"
}