{
  "link": "https://www.themoviedb.org/tv/44277?language=en",
  "title": "Amazing Detective Di Renjie",
  "resume": "We don't have an overview translated in English. Help us expand our database by adding one.",
  "rate": "",
  "genre": [
    "Drama"
  ],
  "cast": {
    "actor": [
      "Diana Pang",
      "Jiang Xin",
      "\u5f20\u5b50\u5065",
      "Guanhua Liang"
    ]
  },
  "characters": {
    "characters": [
      "Li Qingxia",
      "Ying Yu",
      "\u674e\u5143\u82b3",
      "\u72c4\u4ec1\u6770"
    ]
  },
  "site_data": "html Apps Forums Leaderboard Contribute API Support Discover Movies TV Shows Movies Popular Top Rated Upcoming Now Playing TV Shows Popular Top Rated On TV Airing Today People Popular People Can't find a movie or TV show? Login to create it. en Login Sign Up  ID: 44277   Expand Amazing Detective Di Renjie(2004)   (2004) User Score Overview We don't have an overview translated in English. Help us expand our database by adding one. Featured Crew Qian Yanqiu Creator Discussions   Reviews Videos   Images   Changes Report Share Discussions General  0 Content Issues  0 Images Backdrops  4 Posters  5 Videos Trailers  0 Teasers  0 Clips  0 Featurettes  0 Opening Credits  0 Top Billed Cast Diana Pang Li Qingxia Jiang Xin Ying Yu \u5f20\u5b50\u5065 \u674e\u5143\u82b3 Guanhua Liang \u72c4\u4ec1\u6770 Full Cast & Crew Last Season 4 2017 | 3 Episodes View All Seasons Social Reviews  0 Discussions  0 Media Most Popular Videos  0 Backdrops  4 Posters  5 Recommendations We don't have enough data to suggest any TV shows based on Amazing Detective Di Renjie(2004). You can help by rating TV shows you've seen. Facts Original Name  \u795e\u63a2\u72c4\u4ec1\u6770 Status  Ended Networks - Certification  - Type  Scripted Original Language  Chinese Runtime  45m Homepage   http://tv.sohu.com/s2011/sddrj/ Genres Drama Keywords No keywords have been added. Content Score 86 Almost there... Top Contributors i 36 imanybye@sina.com h 16 hejianneng V 16 Vince  View Edit History Popularity Trend  Login to edit  URL By  signing up  for an account on TMDb, you can post directly to Twitter and Facebook. You need to be logged in to continue. Click  here  to login or  here  to sign up.    page_wrap opened in html_head  Join the Community The Basics About TMDb Contact Us Support Forums API Blog Get Involved  Contribution Bible 3rd Party Applications Add New Movie Add New TV Show Community Guidelines Leaderboard Forums Twitter Facebook Legal Terms of Use Privacy Policy Login Sign Up"
}