{
  "link": "https://www.themoviedb.org/tv/42899?language=en",
  "title": "Die Schatzinsel",
  "resume": "We don't have an overview translated in English. Help us expand our database by adding one.",
  "rate": "",
  "genre": [
    "Action",
    "Adventure"
  ],
  "cast": {
    "actor": [
      "Michael Ande",
      "Ivor Dean",
      "Jacques Monod",
      "Georges Riquier",
      "Jacques Dacqmine"
    ]
  },
  "characters": {
    "characters": [
      "Jim Hawkins",
      "Long John Silver",
      "Kapit\u00e4n Alexander Smollet",
      "Dr. David Livesey",
      "Squire John Trelawney"
    ]
  },
  "site_data": "html Apps Forums Leaderboard Contribute API Support Discover Movies TV Shows Movies Popular Top Rated Upcoming Now Playing TV Shows Popular Top Rated On TV Airing Today People Popular People Can't find a movie or TV show? Login to create it. en Login Sign Up  ID: 42899   Expand Die Schatzinsel   (1966) User Score Overview We don't have an overview translated in English. Help us expand our database by adding one. Featured Crew Robert Louis Stevenson Creator Discussions   Reviews Videos   Images   Changes Report Share Discussions General  0 Content Issues  0 Images Backdrops  7 Posters  4 Videos Trailers  0 Teasers  0 Clips  0 Featurettes  0 Opening Credits  0 Top Billed Cast Michael Ande Jim Hawkins Ivor Dean Long John Silver Jacques Monod Kapit\u00e4n Alexander Smollet Georges Riquier Dr. David Livesey Jacques Dacqmine Squire John Trelawney Full Cast & Crew Last Season Miniseries 1966 | 4 Episodes Season 1 of Die Schatzinsel premiered on January  1, 1966. View All Seasons Social Reviews  0 Discussions  0 Media Most Popular Videos  0 Backdrops  7 Posters  4 Recommendations   1971-12-05 Der Seewolf 5.6    1974-11-24 Two Years Vacation 5.7  Facts Status  Ended Networks Certification 12 Meaning The broadcaster must take the decision about the air time by taking in consideration the impact on young children in the timeframe from 6:00am to 8:00pm. Type  Miniseries Original Language  German Runtime  85m Homepage  - Genres Action & Adventure Keywords treasure adventure miniseries Content Score 86 Almost there... Top Contributors W 30 Waldkatze TB 17 TMDb Bot R 8 Rebecca 7 luftikus009  View Edit History Popularity Trend  Login to edit  URL By  signing up  for an account on TMDb, you can post directly to Twitter and Facebook. You need to be logged in to continue. Click  here  to login or  here  to sign up.    page_wrap opened in html_head  Join the Community The Basics About TMDb Contact Us Support Forums API Blog Get Involved  Contribution Bible 3rd Party Applications Add New Movie Add New TV Show Community Guidelines Leaderboard Forums Twitter Facebook Legal Terms of Use Privacy Policy Login Sign Up"
}