{
  "link": "https://www.themoviedb.org/tv/76920?language=en",
  "title": "\u0413\u043e\u0441\u0442\u0438\u043d\u0438\u0446\u0430 \u00ab\u0420\u043e\u0441\u0441\u0438\u044f\u00bb",
  "resume": "We don't have an overview translated in English. Help us expand our database by adding one.",
  "rate": "",
  "genre": [
    "Mystery",
    "Drama"
  ],
  "cast": {
    "actor": [
      "Ekaterina Vilkova",
      "Pavel Trubiner",
      "Ivan Bosilj\u010di\u0107",
      "Evgeniy Pronin",
      "Anatoliy Goryachev"
    ]
  },
  "characters": {
    "characters": [
      "\u041a\u0441\u0435\u043d\u0438\u044f \u0411\u0430\u0441\u043a\u0430\u043a\u043e\u0432\u0430",
      "\u0411\u043e\u0440\u0438\u0441 \u042d\u0434\u0443\u0430\u0440\u0434\u043e\u0432\u0438\u0447 \u0411\u0435\u0440\u0437\u0438\u043d",
      "\u041c\u0430\u043d\u0443\u044d\u043b\u044c \u0421\u0430\u043d\u0442\u043e\u0441",
      "\u0410\u043b\u0435\u043a\u0441\u0435\u0439 \u0420\u0430\u043a\u0438\u0442\u0438\u043d",
      "\u0410\u043d\u0434\u0440\u0435\u0439 \u0414\u043e\u0440\u043c\u0438\u0434\u043e\u043d\u0442\u043e\u0432\u0438\u0447 \u0425\u0430\u0437\u043e\u0432"
    ]
  },
  "site_data": "html Apps Forums Leaderboard Contribute API Support Discover Movies TV Shows Movies Popular Top Rated Upcoming Now Playing TV Shows Popular Top Rated On TV Airing Today People Popular People Can't find a movie or TV show? Login to create it. en Login Sign Up  ID: 76920   Expand \u0413\u043e\u0441\u0442\u0438\u043d\u0438\u0446\u0430 \u00ab\u0420\u043e\u0441\u0441\u0438\u044f\u00bb   (2017) User Score Overview We don't have an overview translated in English. Help us expand our database by adding one. Featured Crew \u0414\u043c\u0438\u0442\u0440\u0438\u0439 \u041c\u0438\u0440\u043e\u043f\u043e\u043b\u044c\u0441\u043a\u0438\u0439 Creator Andrey Korobov Creator Discussions   Reviews Videos   Images   Changes Report Share Discussions General  0 Content Issues  0 Images Backdrops  0 Posters  1 Videos Trailers  0 Teasers  0 Clips  0 Featurettes  0 Opening Credits  0 Top Billed Cast Ekaterina Vilkova \u041a\u0441\u0435\u043d\u0438\u044f \u0411\u0430\u0441\u043a\u0430\u043a\u043e\u0432\u0430 Pavel Trubiner \u0411\u043e\u0440\u0438\u0441 \u042d\u0434\u0443\u0430\u0440\u0434\u043e\u0432\u0438\u0447 \u0411\u0435\u0440\u0437\u0438\u043d Ivan Bosilj\u010di\u0107 \u041c\u0430\u043d\u0443\u044d\u043b\u044c \u0421\u0430\u043d\u0442\u043e\u0441 Evgeniy Pronin \u0410\u043b\u0435\u043a\u0441\u0435\u0439 \u0420\u0430\u043a\u0438\u0442\u0438\u043d Anatoliy Goryachev \u0410\u043d\u0434\u0440\u0435\u0439 \u0414\u043e\u0440\u043c\u0438\u0434\u043e\u043d\u0442\u043e\u0432\u0438\u0447 \u0425\u0430\u0437\u043e\u0432 Full Cast & Crew Current Season Season 1 2017 | 12 Episodes Season 1 of \u0413\u043e\u0441\u0442\u0438\u043d\u0438\u0446\u0430 \u00ab\u0420\u043e\u0441\u0441\u0438\u044f\u00bb premiered on October 16, 2017. View All Seasons Social Reviews  0 Discussions  0 Media Most Popular Videos  0 Backdrops  0 Posters  1 Recommendations We don't have enough data to suggest any TV shows based on \u0413\u043e\u0441\u0442\u0438\u043d\u0438\u0446\u0430 \u00ab\u0420\u043e\u0441\u0441\u0438\u044f\u00bb. You can help by rating TV shows you've seen. Facts Status  Returning Series Networks - Certification  - Type  Scripted Original Language  Russian Runtime  - Homepage  - Genres Mystery Drama Keywords No keywords have been added. Content Score 71 Just a little bit more... Top Contributors T 20 TimScorp s 3 speedycars 2 mrtextortexel  View Edit History Popularity Trend  Login to edit  URL By  signing up  for an account on TMDb, you can post directly to Twitter and Facebook. You need to be logged in to continue. Click  here  to login or  here  to sign up.    page_wrap opened in html_head  Join the Community The Basics About TMDb Contact Us Support Forums API Blog Get Involved  Contribution Bible 3rd Party Applications Add New Movie Add New TV Show Community Guidelines Leaderboard Forums Twitter Facebook Legal Terms of Use Privacy Policy Login Sign Up"
}