{
  "link": "https://www.themoviedb.org/tv/3868?language=en",
  "title": "The Lost Room",
  "resume": "A detective investigates a mysterious motel room, which acts as a portal to an alternate universe.",
  "rate": "78.0",
  "genre": [
    "Mystery",
    "Sci-Fi",
    "Fantasy"
  ],
  "cast": [
    "Peter Krause",
    "Julianna Margulies",
    "Kevin Pollak",
    "Elle Fanning",
    "Roger Bart"
  ],
  "character": [
    "Detective Joe Miller",
    "Jennifer Bloom",
    "Karl Kreutzfeld",
    "Anna Miller",
    "Howard 'The Weasel' Montague"
  ],
  "site_data": "html Apps Forums Leaderboard Contribute API Support Discover Movies TV Shows Movies Popular Top Rated Upcoming Now Playing TV Shows Popular Top Rated On TV Airing Today People Popular People Can't find a movie or TV show? Login to create it. en Login Sign Up  ID: 3868   Expand The Lost Room   (2006) User Score  Play Trailer Overview A detective investigates a mysterious motel room, which acts as a portal to an alternate universe. Featured Crew Christopher Leone Creator Discussions   Reviews Videos   Images   Changes Report Share Discussions General  0 Content Issues  3 Images Backdrops  16 Posters  10 Videos Trailers  4 Teasers  0 Clips  0 Featurettes  0 Opening Credits  0 Top Billed Cast Peter Krause Detective Joe Miller Julianna Margulies Jennifer Bloom Kevin Pollak Karl Kreutzfeld Elle Fanning Anna Miller Roger Bart Howard 'The Weasel' Montague Full Cast & Crew Last Season Season 1 2006 | 3 Episodes Season 1 of The Lost Room premiered on December 11, 2006. View All Seasons Social Reviews  0 Discussions  3 Subject Status Replies Last Reply There are no discussions for The Lost Room. Login to be first! Go to Discussions Media Most Popular Videos  4 Backdrops  16 Posters  10 Recommendations   2004-07-11 The 4400 6.9    2009-09-24 FlashForward 6.9    2006-09-20 Jericho 7.5    2005-09-19 Invasion 6.9    2010-06-07 Persons Unknown 6.4    2007-01-21 The Dresden Files 6.7    2002-12-02 Taken 7.4    2003-06-27 Dead Like Me 7.8  Facts Status  Ended Network Certification TV-PG Meaning This program contains material that parents may find unsuitable for younger children. Type  Miniseries Original Language  English Runtime  60m Homepage  - Genres Mystery Sci-Fi & Fantasy Keywords hotel room teleportation time travel alternate dimension miniseries missing child special powers Content Score 100 Yes! Looking good! Top Contributors 41 Banana TB 24 TMDb Bot f 7 fatal3 I 7 ILiviu  View Edit History Popularity Trend  Login to edit  URL By  signing up  for an account on TMDb, you can post directly to Twitter and Facebook. You need to be logged in to continue. Click  here  to login or  here  to sign up.    page_wrap opened in html_head  Join the Community The Basics About TMDb Contact Us Support Forums API Blog Get Involved  Contribution Bible 3rd Party Applications Add New Movie Add New TV Show Community Guidelines Leaderboard Forums Twitter Facebook Legal Terms of Use Privacy Policy Login Sign Up"
}