{
  "link": "https://www.themoviedb.org/tv/66404?language=en",
  "title": "\u0414\u0438\u0432\u0435\u0440\u0441\u0430\u043d\u0442 2: \u041a\u043e\u043d\u0435\u0446 \u0432\u043e\u0439\u043d\u044b",
  "resume": "We don't have an overview translated in English. Help us expand our database by adding one.",
  "rate": "70.0",
  "genre": [
    "Action",
    "Adventure",
    "War",
    "Politics"
  ],
  "cast": [
    "Vadim Tsallati"
  ],
  "character": [
    "Daur"
  ],
  "site_data": "html Apps Forums Leaderboard Contribute API Support Discover Movies TV Shows Movies Popular Top Rated Upcoming Now Playing TV Shows Popular Top Rated On TV Airing Today People Popular People Can't find a movie or TV show? Login to create it. en Login Sign Up  ID: 66404   Expand \u0414\u0438\u0432\u0435\u0440\u0441\u0430\u043d\u0442 2: \u041a\u043e\u043d\u0435\u0446 \u0432\u043e\u0439\u043d\u044b   (2007) User Score Overview We don't have an overview translated in English. Help us expand our database by adding one. Featured Crew Vladimir Valutskiy Creator Andrey Zhitkov Creator Discussions   Reviews Videos   Images   Changes Report Share Discussions General  0 Content Issues  0 Images Backdrops  0 Posters  1 Videos Trailers  0 Teasers  0 Clips  0 Featurettes  0 Opening Credits  0 Top Billed Cast Vadim Tsallati Daur Full Cast & Crew Last Season Season 1 2007 | 10 Episodes Season 1 of \u0414\u0438\u0432\u0435\u0440\u0441\u0430\u043d\u0442 2: \u041a\u043e\u043d\u0435\u0446 \u0432\u043e\u0439\u043d\u044b premiered on November 14, 2007. View All Seasons Social Reviews  0 Discussions  0 Media Most Popular Videos  0 Backdrops  0 Posters  1 Recommendations We don't have enough data to suggest any TV shows based on \u0414\u0438\u0432\u0435\u0440\u0441\u0430\u043d\u0442 2: \u041a\u043e\u043d\u0435\u0446 \u0432\u043e\u0439\u043d\u044b. You can help by rating TV shows you've seen. Facts Status  Ended Network Certification 16+ Meaning Only teens the age of 16 or older can watch. Type  Scripted Original Language  Russian Runtime  50m Homepage   http://www.1tv.ru/movies/statyi/hudozhestvennyy-film-diversant-konec-voyny Genres Action & Adventure War & Politics Keywords war saboteur great patriotic war Content Score 43 There's no 'I' in team... Top Contributors 28 Apollo 11 StrannikM 6 Gangstein 3 Elizabeth Jennings  View Edit History Popularity Trend  Login to edit  URL By  signing up  for an account on TMDb, you can post directly to Twitter and Facebook. You need to be logged in to continue. Click  here  to login or  here  to sign up.    page_wrap opened in html_head  Join the Community The Basics About TMDb Contact Us Support Forums API Blog Get Involved  Contribution Bible 3rd Party Applications Add New Movie Add New TV Show Community Guidelines Leaderboard Forums Twitter Facebook Legal Terms of Use Privacy Policy Login Sign Up"
}