{
  "link": "https://www.themoviedb.org/tv/75642?language=en",
  "title": "Stand by Me",
  "resume": "We don't have an overview translated in English. Help us expand our database by adding one.",
  "rate": "",
  "genre": [
    "Drama"
  ],
  "cast": {
    "actor": [
      "\u674e\u82e5\u5609",
      "\u6b66\u96e8\u6cfd",
      "\u5f90\u6653\u7490",
      "\u5e9e\u701a\u8fb0",
      "\u4e8e\u7fd4"
    ]
  },
  "characters": {
    "characters": [
      "\u6797\u6d1b\u96ea",
      "\u8def\u6865\u5ddd",
      "\u949f\u767d",
      "\u8096\u6d77\u6d0b",
      "\u4efb\u9038\u5e06"
    ]
  },
  "site_data": "html Apps Forums Leaderboard Contribute API Support Discover Movies TV Shows Movies Popular Top Rated Upcoming Now Playing TV Shows Popular Top Rated On TV Airing Today People Popular People Can't find a movie or TV show? Login to create it. en Login Sign Up  ID: 75642   Expand Stand by Me   (2016) User Score Overview We don't have an overview translated in English. Help us expand our database by adding one. Discussions   Reviews Videos   Images   Changes Report Share Discussions General  0 Content Issues  0 Images Backdrops  0 Posters  1 Videos Trailers  0 Teasers  0 Clips  0 Featurettes  0 Opening Credits  0 Top Billed Cast \u674e\u82e5\u5609 \u6797\u6d1b\u96ea \u6b66\u96e8\u6cfd \u8def\u6865\u5ddd \u5f90\u6653\u7490 \u949f\u767d \u5e9e\u701a\u8fb0 \u8096\u6d77\u6d0b \u4e8e\u7fd4 \u4efb\u9038\u5e06 Full Cast & Crew Current Season Season 2 2017 | 4 Episodes Season 2 of Stand by Me premiered on November 30, 2017. View All Seasons Social Reviews  0 Discussions  0 Media Most Popular Videos  0 Backdrops  0 Posters  1 Recommendations We don't have enough data to suggest any TV shows based on Stand by Me. You can help by rating TV shows you've seen. Facts Status  Ended Networks - Certification  - Type  Scripted Original Language  Chinese Runtime  - Homepage  - Genres Drama Keywords No keywords have been added. Content Score 64 We're so close, yet so far. Top Contributors t 20 terencedang 11 zhenhai  View Edit History Popularity Trend  Login to edit  URL By  signing up  for an account on TMDb, you can post directly to Twitter and Facebook. You need to be logged in to continue. Click  here  to login or  here  to sign up.    page_wrap opened in html_head  Join the Community The Basics About TMDb Contact Us Support Forums API Blog Get Involved  Contribution Bible 3rd Party Applications Add New Movie Add New TV Show Community Guidelines Leaderboard Forums Twitter Facebook Legal Terms of Use Privacy Policy Login Sign Up"
}