{
  "link": "https://www.themoviedb.org/tv/18745?language=en",
  "title": "Tales of the City",
  "resume": "Miniseries based on the first of the Tales of the City series of novels by Armistead Maupin.",
  "rate": "",
  "genre": [
    "Drama",
    "Comedy"
  ],
  "cast": {
    "actor": [
      "Barbara Garrick",
      "Paul Hopkins",
      "Olympia Dukakis",
      "Laura Linney",
      "Donald Moffat"
    ]
  },
  "characters": {
    "characters": [
      "Anna Madrigal",
      "Mary Ann Singleton"
    ]
  },
  "site_data": "html Apps Forums Leaderboard Contribute API Support Discover Movies TV Shows Movies Popular Top Rated Upcoming Now Playing TV Shows Popular Top Rated On TV Airing Today People Popular People Can't find a movie or TV show? Login to create it. en Login Sign Up  ID: 18745   Expand Tales of the City   (1993) User Score Overview Miniseries based on the first of the Tales of the City series of novels by Armistead Maupin. Discussions   Reviews Videos   Images   Changes Report Share Discussions General  0 Content Issues  0 Images Backdrops  1 Posters  1 Videos Trailers  0 Teasers  0 Clips  0 Featurettes  0 Opening Credits  0 Top Billed Cast Barbara Garrick Paul Hopkins Olympia Dukakis Anna Madrigal Laura Linney Mary Ann Singleton Donald Moffat Full Cast & Crew Last Season Season 1 1994 | 5 Episodes Season 1 of Tales of the City premiered on January  9, 1994. View All Seasons Social Reviews  0 Discussions  0 Media Most Popular Videos  0 Backdrops  1 Posters  1 Recommendations We don't have enough data to suggest any TV shows based on Tales of the City. You can help by rating TV shows you've seen. Facts Status  Ended Network Certification  - Type  Miniseries Original Language  English Runtime  60m Homepage  - Genres Drama Comedy Keywords san francisco Content Score 86 Almost there... Top Contributors 22 Banana 7 lineker 2 jedgarau 1 Elizabeth Jennings  View Edit History Popularity Trend  Login to edit  URL By  signing up  for an account on TMDb, you can post directly to Twitter and Facebook. You need to be logged in to continue. Click  here  to login or  here  to sign up.    page_wrap opened in html_head  Join the Community The Basics About TMDb Contact Us Support Forums API Blog Get Involved  Contribution Bible 3rd Party Applications Add New Movie Add New TV Show Community Guidelines Leaderboard Forums Twitter Facebook Legal Terms of Use Privacy Policy Login Sign Up"
}