{
  "link": "https://www.themoviedb.org/tv/68761?language=en",
  "title": "In Plain Sight",
  "resume": "Based on the true story of Lanarkshire detective William Muncie\u2019s quest to bring to justice notorious Scottish killer Peter Manuel.",
  "rate": "",
  "genre": [
    "Crime",
    "Drama"
  ],
  "cast": {
    "actor": [
      "Martin Compston",
      "Douglas Henshall",
      "Joanne\tThompson",
      "Jack Greenlees",
      "Shauna Macdonald"
    ]
  },
  "characters": {
    "characters": [
      "Peter Manuel",
      "William\tMuncie",
      "Iris\tLaird",
      "McLeod",
      "Agnes Muncie"
    ]
  },
  "site_data": "html Apps Forums Leaderboard Contribute API Support Discover Movies TV Shows Movies Popular Top Rated Upcoming Now Playing TV Shows Popular Top Rated On TV Airing Today People Popular People Can't find a movie or TV show? Login to create it. en Login Sign Up  ID: 68761   Expand In Plain Sight   (2016) User Score  Play Trailer Overview Based on the true story of Lanarkshire detective William Muncie\u2019s quest to bring to justice notorious Scottish killer Peter Manuel. Discussions   Reviews Videos   Images   Changes Report Share Discussions General  0 Content Issues  0 Images Backdrops  6 Posters  2 Videos Trailers  1 Teasers  0 Clips  0 Featurettes  0 Opening Credits  0 Top Billed Cast Martin Compston Peter Manuel Douglas Henshall William\tMuncie Joanne\tThompson Iris\tLaird Jack Greenlees McLeod Shauna Macdonald Agnes Muncie Full Cast & Crew Last Season Season 1 2016 | 3 Episodes Season 1 of In Plain Sight premiered on December  7, 2016. View All Seasons Social Reviews  0 Discussions  0 Media Most Popular Videos  1 Backdrops  6 Posters  2 Recommendations We don't have enough data to suggest any TV shows based on In Plain Sight. You can help by rating TV shows you've seen. Facts Status  Ended Network Certification  - Type  Miniseries Original Language  English Runtime  60m Homepage   http://www.itv.com/hub/in-plain-sight/2a4528a0001 Genres Crime Drama Keywords scotland serial killer miniseries police detective true crime Content Score 93 Almost there... Top Contributors 27 Banana TB 16 TMDb Bot p 14 plumpro 6 Elizabeth Jennings  View Edit History Popularity Trend  Login to edit  URL By  signing up  for an account on TMDb, you can post directly to Twitter and Facebook. You need to be logged in to continue. Click  here  to login or  here  to sign up.    page_wrap opened in html_head  Join the Community The Basics About TMDb Contact Us Support Forums API Blog Get Involved  Contribution Bible 3rd Party Applications Add New Movie Add New TV Show Community Guidelines Leaderboard Forums Twitter Facebook Legal Terms of Use Privacy Policy Login Sign Up"
}