{
  "link": "https://www.themoviedb.org/tv/42425?language=en",
  "title": "Asura Cryin'",
  "resume": "We don't have an overview translated in English. Help us expand our database by adding one.",
  "rate": "70.0",
  "genre": [
    "Action",
    "Adventure",
    "Animation",
    "Sci-Fi",
    "Fantasy"
  ],
  "cast": [
    "Miyu Irino",
    "Haruka Tomatsu",
    "Ai Nonaka",
    "Aki Toyosaki",
    "Hiro Shimono"
  ],
  "character": [
    "Tomoharu Natsume",
    "Misao Minakam",
    "Kanade Takatsuki",
    "An Oohara",
    "Takuma Higuchi"
  ],
  "site_data": "html Apps Forums Leaderboard Contribute API Support Discover Movies TV Shows Movies Popular Top Rated Upcoming Now Playing TV Shows Popular Top Rated On TV Airing Today People Popular People Can't find a movie or TV show? Login to create it. en Login Sign Up  ID: 42425   Expand Asura Cryin'   (2009) User Score Overview We don't have an overview translated in English. Help us expand our database by adding one. Discussions   Reviews Videos   Images   Changes Report Share Discussions General  0 Content Issues  1 Images Backdrops  7 Posters  3 Videos Trailers  0 Teasers  0 Clips  0 Featurettes  0 Opening Credits  0 Top Billed Cast Miyu Irino Tomoharu Natsume Haruka Tomatsu Misao Minakam Ai Nonaka Kanade Takatsuki Aki Toyosaki An Oohara Hiro Shimono Takuma Higuchi Full Cast & Crew Last Season Season 2 2009 | 13 Episodes Season 2 of Asura Cryin' premiered on October  1, 2009. View All Seasons Social Reviews  0 Discussions  1 Subject Status Replies Last Reply There are no discussions for Asura Cryin'. Login to be first! Go to Discussions Media Most Popular Videos  0 Backdrops  7 Posters  3 Recommendations We don't have enough data to suggest any TV shows based on Asura Cryin'. You can help by rating TV shows you've seen. Facts Status  Ended Network Certification  - Type  Scripted Original Language  Japanese Runtime  25m Homepage   http://www.starchild.co.jp/special/asura/ Genres Action & Adventure Animation Sci-Fi & Fantasy Keywords anime Content Score 79 Pump it up! We're close now. Top Contributors 11 CrewMdk p 8 psy4trik 4 SWFT f 3 franfac  View Edit History Popularity Trend  Login to edit  URL By  signing up  for an account on TMDb, you can post directly to Twitter and Facebook. You need to be logged in to continue. Click  here  to login or  here  to sign up.    page_wrap opened in html_head  Join the Community The Basics About TMDb Contact Us Support Forums API Blog Get Involved  Contribution Bible 3rd Party Applications Add New Movie Add New TV Show Community Guidelines Leaderboard Forums Twitter Facebook Legal Terms of Use Privacy Policy Login Sign Up"
}