{
  "link": "https://www.themoviedb.org/tv/63410?language=en",
  "title": "\u0422\u0430\u0439\u0433\u0430. \u041a\u0443\u0440\u0441 \u0432\u044b\u0436\u0438\u0432\u0430\u043d\u0438\u044f",
  "resume": "We don't have an overview translated in English. Help us expand our database by adding one.",
  "rate": "10.0",
  "genre": [
    "Action",
    "Adventure"
  ],
  "cast": [
    "Kirill Pletnev",
    "Boris Galkin"
  ],
  "character": [
    "\u0410\u043b\u0435\u043a\u0441\u0435\u0439",
    "\u0421\u0435\u0440\u0433\u0435\u0439 \u041f\u0435\u0442\u0440\u043e\u0432\u0438\u0447"
  ],
  "site_data": "html Apps Forums Leaderboard Contribute API Support Discover Movies TV Shows Movies Popular Top Rated Upcoming Now Playing TV Shows Popular Top Rated On TV Airing Today People Popular People Can't find a movie or TV show? Login to create it. en Login Sign Up  ID: 63410   Expand \u0422\u0430\u0439\u0433\u0430. \u041a\u0443\u0440\u0441 \u0432\u044b\u0436\u0438\u0432\u0430\u043d\u0438\u044f   (2002) User Score Overview We don't have an overview translated in English. Help us expand our database by adding one. Featured Crew \u0410\u043b\u0435\u043a\u0441\u0430\u043d\u0434\u0440 \u0410\u0440\u0430\u0432\u0438\u043d Creator \u0418\u0433\u043e\u0440\u044c \u041f\u043e\u0440\u0443\u0431\u043b\u0435\u0432 Creator Discussions   Reviews Videos   Images   Changes Report Share Discussions General  0 Content Issues  0 Images Backdrops  1 Posters  1 Videos Trailers  0 Teasers  0 Clips  0 Featurettes  0 Opening Credits  0 Top Billed Cast Kirill Pletnev \u0410\u043b\u0435\u043a\u0441\u0435\u0439 Boris Galkin \u0421\u0435\u0440\u0433\u0435\u0439 \u041f\u0435\u0442\u0440\u043e\u0432\u0438\u0447 Full Cast & Crew Last Season Season 1 2002 | 12 Episodes Season 1 of \u0422\u0430\u0439\u0433\u0430. \u041a\u0443\u0440\u0441 \u0432\u044b\u0436\u0438\u0432\u0430\u043d\u0438\u044f premiered on October 21, 2002. View All Seasons Social Reviews  0 Discussions  0 Media Most Popular Videos  0 Backdrops  1 Posters  1 Recommendations We don't have enough data to suggest any TV shows based on \u0422\u0430\u0439\u0433\u0430. \u041a\u0443\u0440\u0441 \u0432\u044b\u0436\u0438\u0432\u0430\u043d\u0438\u044f. You can help by rating TV shows you've seen. Facts Status  Ended Network Certification 16+ Meaning Only teens the age of 16 or older can watch. Type  Scripted Original Language  Russian Runtime  45m Homepage  - Genres Action & Adventure Keywords survival taiga Content Score 56 We're so close, yet so far. Top Contributors 44 Apollo 10 Elizabeth Jennings 2 Banana TB 2 TMDb Bot  View Edit History Popularity Trend  Login to edit  URL By  signing up  for an account on TMDb, you can post directly to Twitter and Facebook. You need to be logged in to continue. Click  here  to login or  here  to sign up.    page_wrap opened in html_head  Join the Community The Basics About TMDb Contact Us Support Forums API Blog Get Involved  Contribution Bible 3rd Party Applications Add New Movie Add New TV Show Community Guidelines Leaderboard Forums Twitter Facebook Legal Terms of Use Privacy Policy Login Sign Up"
}