{
  "link": "https://www.themoviedb.org/tv/65680?language=en",
  "title": "Not Safe with Nikki Glaser",
  "resume": "Not Safe with Nikki Glaser blends interviews, experiments, and discussions about subjects revolving around sex, relationships, and the stuff nobody wants to talk about.",
  "rate": "",
  "genre": [
    "Comedy",
    "Talk"
  ],
  "cast": {
    "actor": [
      "Nikki Glaser"
    ]
  },
  "characters": {
    "characters": [
      "Herself"
    ]
  },
  "site_data": "html Apps Forums Leaderboard Contribute API Support Discover Movies TV Shows Movies Popular Top Rated Upcoming Now Playing TV Shows Popular Top Rated On TV Airing Today People Popular People Can't find a movie or TV show? Login to create it. en Login Sign Up  ID: 65680   Expand Not Safe with Nikki Glaser   (2016) User Score  Play Trailer Overview Not Safe with Nikki Glaser blends interviews, experiments, and discussions about subjects revolving around sex, relationships, and the stuff nobody wants to talk about. Featured Crew Nikki Glaser Creator Discussions   Reviews Videos   Images   Changes Report Share Discussions General  0 Content Issues  0 Images Backdrops  3 Posters  1 Videos Trailers  2 Teasers  0 Clips  0 Featurettes  0 Opening Credits  0 Top Billed Cast Nikki Glaser Herself Full Cast & Crew Last Season Season 1 2016 | 20 Episodes Season 1 of Not Safe with Nikki Glaser premiered on February  9, 2016. View All Seasons Social Reviews  0 Discussions  0 Media Most Popular Videos  2 Backdrops  3 Posters  1 Recommendations We don't have enough data to suggest any TV shows based on Not Safe with Nikki Glaser. You can help by rating TV shows you've seen. Facts Status  Returning Series Network Certification  - Type  Scripted Original Language  English Runtime  21m Homepage   http://www.cc.com/shows/not-safe-with-nikki-glaser Genres Comedy Talk Keywords No keywords have been added. Content Score 71 Just a little bit more... Top Contributors 28 sp1ti 2 joeynotjoe TB 2 TMDb Bot t 1 tonsfeldt1979  View Edit History Popularity Trend  Login to edit  URL By  signing up  for an account on TMDb, you can post directly to Twitter and Facebook. You need to be logged in to continue. Click  here  to login or  here  to sign up.    page_wrap opened in html_head  Join the Community The Basics About TMDb Contact Us Support Forums API Blog Get Involved  Contribution Bible 3rd Party Applications Add New Movie Add New TV Show Community Guidelines Leaderboard Forums Twitter Facebook Legal Terms of Use Privacy Policy Login Sign Up"
}