{
  "link": "https://www.themoviedb.org/tv/69586?language=en",
  "title": "Vivat Be\u0148ovsk\u00fd!",
  "resume": "We don't have an overview translated in English. Help us expand our database by adding one.",
  "rate": "0.0",
  "genre": [
    "Drama"
  ],
  "cast": [
    "Jozef Adamovi\u010d ",
    "J\u00e1cint Juh\u00e1sz",
    "Em\u00edlia V\u00e1\u0161\u00e1ryov\u00e1",
    "Ivan Mistr\u00edk",
    "Leopold Haverl"
  ],
  "character": [
    "M\u00f3ric Be\u0148ovsk\u00fd",
    "Tom\u00e1\u0161 Omachel",
    "Zuzana Hansk\u00e1",
    "Wyndblath",
    "Tom\u00e1\u0161 Omachel (voice)"
  ],
  "site_data": "html Apps Forums Leaderboard Contribute API Support Discover Movies TV Shows Movies Popular Top Rated Upcoming Now Playing TV Shows Popular Top Rated On TV Airing Today People Popular People Can't find a movie or TV show? Login to create it. en Login Sign Up  ID: 69586   Expand Vivat Be\u0148ovsk\u00fd!   (1975) User Score Overview We don't have an overview translated in English. Help us expand our database by adding one. Featured Crew Igor Ciel Creator Discussions   Reviews Videos   Images   Changes Report Share Discussions General  0 Content Issues  0 Images Backdrops  0 Posters  1 Videos Trailers  0 Teasers  0 Clips  0 Featurettes  0 Opening Credits  0 Top Billed Cast Jozef Adamovi\u010d  M\u00f3ric Be\u0148ovsk\u00fd J\u00e1cint Juh\u00e1sz Tom\u00e1\u0161 Omachel Em\u00edlia V\u00e1\u0161\u00e1ryov\u00e1 Zuzana Hansk\u00e1 Ivan Mistr\u00edk Wyndblath Leopold Haverl Tom\u00e1\u0161 Omachel (voice) Full Cast & Crew Last Season Season 1 1975 | 7 Episodes Season 1 of Vivat Be\u0148ovsk\u00fd! premiered on January  1, 1975. View All Seasons Social Reviews  0 Discussions  0 Media Most Popular Videos  0 Backdrops  0 Posters  1 Recommendations We don't have enough data to suggest any TV shows based on Vivat Be\u0148ovsk\u00fd!. You can help by rating TV shows you've seen. Facts Status  Ended Networks Slovensk\u00e1 telev\u00edzia Magyar Telev\u00edzi\u00f3 Certification  - Type  Scripted Original Language  Slovak Runtime  85m Homepage  - Genres Drama Keywords madagascar historical adventurer Content Score 79 Pump it up! We're close now. Top Contributors S 44 Sidh TB 1 TMDb Bot  View Edit History Popularity Trend  Login to edit  URL By  signing up  for an account on TMDb, you can post directly to Twitter and Facebook. You need to be logged in to continue. Click  here  to login or  here  to sign up.    page_wrap opened in html_head  Join the Community The Basics About TMDb Contact Us Support Forums API Blog Get Involved  Contribution Bible 3rd Party Applications Add New Movie Add New TV Show Community Guidelines Leaderboard Forums Twitter Facebook Legal Terms of Use Privacy Policy Login Sign Up"
}