{
  "link": "https://www.themoviedb.org/tv/36742?language=en",
  "title": "Hello My Teacher",
  "resume": "We don't have an overview translated in English. Help us expand our database by adding one.",
  "rate": "",
  "genre": [
    "Drama"
  ],
  "cast": {
    "actor": [
      "Gong Hyo-jin",
      "Gong Yoo",
      "Dae-hyun Kim",
      "Choi Yeo-jin",
      "Seo Jun-young"
    ]
  },
  "characters": {
    "characters": [
      "Na Bo Ri",
      "Park Tae In",
      "Ji Hyeon-Woo",
      "Nam Jaem-Ma",
      "Park Jae-in"
    ]
  },
  "site_data": "html Apps Forums Leaderboard Contribute API Support Discover Movies TV Shows Movies Popular Top Rated Upcoming Now Playing TV Shows Popular Top Rated On TV Airing Today People Popular People Can't find a movie or TV show? Login to create it. en Login Sign Up  ID: 36742   Expand Hello My Teacher   (2005) User Score Overview We don't have an overview translated in English. Help us expand our database by adding one. Discussions   Reviews Videos   Images   Changes Report Share Discussions General  0 Content Issues  0 Images Backdrops  6 Posters  4 Videos Trailers  0 Teasers  0 Clips  0 Featurettes  0 Opening Credits  0 Top Billed Cast Gong Hyo-jin Na Bo Ri Gong Yoo Park Tae In Dae-hyun Kim Ji Hyeon-Woo Choi Yeo-jin Nam Jaem-Ma Seo Jun-young Park Jae-in Full Cast & Crew Last Season Season 1 2005 | 16 Episodes Season 1 of Hello My Teacher premiered on April 13, 2005. View All Seasons Social Reviews  0 Discussions  0 Media Most Popular Videos  0 Backdrops  6 Posters  4 Recommendations We don't have enough data to suggest any TV shows based on Hello My Teacher. You can help by rating TV shows you've seen. Facts Original Name  \uac74\ube75 \uc120\uc0dd\uacfc \ubcc4\uc0ac\ud0d5 Status  Ended Network Certification  - Type  Scripted Original Language  Korean Runtime  - Homepage   http://tv.sbs.co.kr/teacher/ Genres Drama Keywords school teacher student relationship Content Score 79 Pump it up! We're close now. Top Contributors N 32 Nightowl.Kr 9 Elizabeth Jennings 8 thirstyhippo z 5 zurman1  View Edit History Popularity Trend  Login to edit  URL By  signing up  for an account on TMDb, you can post directly to Twitter and Facebook. You need to be logged in to continue. Click  here  to login or  here  to sign up.    page_wrap opened in html_head  Join the Community The Basics About TMDb Contact Us Support Forums API Blog Get Involved  Contribution Bible 3rd Party Applications Add New Movie Add New TV Show Community Guidelines Leaderboard Forums Twitter Facebook Legal Terms of Use Privacy Policy Login Sign Up"
}