{
  "link": "https://www.themoviedb.org/tv/21381?language=en",
  "title": "Unknown Chaplin",
  "resume": "A documentary series examining the film making methods and techniques of Charles Chaplin. Featuring previously unseen footage from Chaplin's private film archive.",
  "rate": "80.0",
  "genre": [
    "Documentary"
  ],
  "cast": [
    "Charlie Chaplin",
    "Edna Purviance",
    "Albert Austin",
    "John Rand",
    "Harry Crocker"
  ],
  "character": [
    "Himself & in Out-Takes",
    "Herself & In Out-Takes",
    "Himself & In Out-Takes",
    "Himself & In Out-Takes",
    "Himself & In Out-Takes"
  ],
  "site_data": "html Apps Forums Leaderboard Contribute API Support Discover Movies TV Shows Movies Popular Top Rated Upcoming Now Playing TV Shows Popular Top Rated On TV Airing Today People Popular People Can't find a movie or TV show? Login to create it. en Login Sign Up  ID: 21381   Expand Unknown Chaplin   (1983) User Score Overview A documentary series examining the film making methods and techniques of Charles Chaplin. Featuring previously unseen footage from Chaplin's private film archive. Discussions   Reviews Videos   Images   Changes Report Share Discussions General  0 Content Issues  0 Images Backdrops  1 Posters  2 Videos Trailers  0 Teasers  0 Clips  0 Featurettes  0 Opening Credits  0 Top Billed Cast Charlie Chaplin Himself & in Out-Takes Edna Purviance Herself & In Out-Takes Albert Austin Himself & In Out-Takes John Rand Himself & In Out-Takes Harry Crocker Himself & In Out-Takes Full Cast & Crew Last Season Miniseries 1983 | 3 Episodes Season 1 of Unknown Chaplin premiered on January  5, 1983. View All Seasons Social Reviews  0 Discussions  0 Media Most Popular Videos  0 Backdrops  1 Posters  2 Recommendations We don't have enough data to suggest any TV shows based on Unknown Chaplin. You can help by rating TV shows you've seen. Facts Status  Ended Network Certification  - Type  Miniseries Original Language  English Runtime  180m Homepage  - Genres Documentary Keywords movie business history filmmaker miniseries filmmaking charlie chaplin lost footage Content Score 86 Almost there... Top Contributors TB 23 TMDb Bot R 13 Rebecca 1 bryguy2fly  View Edit History Popularity Trend  Login to edit  URL By  signing up  for an account on TMDb, you can post directly to Twitter and Facebook. You need to be logged in to continue. Click  here  to login or  here  to sign up.    page_wrap opened in html_head  Join the Community The Basics About TMDb Contact Us Support Forums API Blog Get Involved  Contribution Bible 3rd Party Applications Add New Movie Add New TV Show Community Guidelines Leaderboard Forums Twitter Facebook Legal Terms of Use Privacy Policy Login Sign Up"
}