{
  "link": "https://www.themoviedb.org/tv/851?language=en",
  "title": "Full Circle with Michael Palin",
  "resume": "Michael Palin travels to 18 countries around the rim of the Pacific Ocean.",
  "rate": "",
  "genre": [
    "Documentary"
  ],
  "cast": {
    "actor": [
      "Michael Palin",
      "Rob Hehnlin"
    ]
  },
  "characters": {
    "characters": [
      "Himself",
      "Himself - Gold Miner"
    ]
  },
  "site_data": "html Apps Forums Leaderboard Contribute API Support Discover Movies TV Shows Movies Popular Top Rated Upcoming Now Playing TV Shows Popular Top Rated On TV Airing Today People Popular People Can't find a movie or TV show? Login to create it. en Login Sign Up  ID: 851   Expand Full Circle with Michael Palin   (1997) User Score Overview Michael Palin travels to 18 countries around the rim of the Pacific Ocean. Discussions   Reviews Videos   Images   Changes Report Share Discussions General  0 Content Issues  0 Images Backdrops  3 Posters  4 Videos Trailers  0 Teasers  0 Clips  0 Featurettes  0 Opening Credits  0 Top Billed Cast Michael Palin Himself Rob Hehnlin Himself - Gold Miner Full Cast & Crew Last Season Miniseries 1997 | 10 Episodes Season 1 of Full Circle with Michael Palin premiered on August 30, 1997. View All Seasons Social Reviews  0 Discussions  0 Media Most Popular Videos  0 Backdrops  3 Posters  4 Recommendations   1992-10-21 Pole to Pole 8.3    2007-09-16 Michael Palin's New Europe 6.8    2002-10-13 Sahara with Michael Palin 6.9    2004-10-03 Himalaya with Michael Palin 7.9    1989-10-11 Michael Palin: Around the World in 80 Days 8.2    2002-01-02 Shackleton 6.3  Facts Status  Ended Network Certification  - Type  Miniseries Original Language  English Runtime  50m Homepage   http://www.bbc.co.uk/programmes/p00tcl80 Genres Documentary Keywords travel Content Score 56 We're so close, yet so far. Top Contributors TB 8 TMDb Bot 6 Banana a 4 alexcel s 3 speedycars  View Edit History Popularity Trend  Login to edit  URL By  signing up  for an account on TMDb, you can post directly to Twitter and Facebook. You need to be logged in to continue. Click  here  to login or  here  to sign up.    page_wrap opened in html_head  Join the Community The Basics About TMDb Contact Us Support Forums API Blog Get Involved  Contribution Bible 3rd Party Applications Add New Movie Add New TV Show Community Guidelines Leaderboard Forums Twitter Facebook Legal Terms of Use Privacy Policy Login Sign Up"
}