{
  "link": "https://www.themoviedb.org/tv/69850?language=en",
  "title": "My Runway",
  "resume": "An egotistic top male model and a pretty model wannabe are forced to live each other's lives until they figure out a way to undo their body switch.",
  "rate": "",
  "genre": [
    "Drama"
  ],
  "cast": {
    "actor": [
      "Park Ji-yeon",
      "Kang Dong-ho",
      "Jo Hye Ryung",
      "Yang Hak Jin",
      "Ahn Bo-hyun"
    ]
  },
  "characters": {
    "characters": [
      "Han Seo Yeon",
      "Na Jin Wook",
      "Park Na Rae",
      "Chun Shik",
      "Wang Rim"
    ]
  },
  "site_data": "html Apps Forums Leaderboard Contribute API Support Discover Movies TV Shows Movies Popular Top Rated Upcoming Now Playing TV Shows Popular Top Rated On TV Airing Today People Popular People Can't find a movie or TV show? Login to create it. en Login Sign Up  ID: 69850   Expand My Runway   (2016) User Score Overview An egotistic top male model and a pretty model wannabe are forced to live each other's lives until they figure out a way to undo their body switch. Discussions   Reviews Videos   Images   Changes Report Share Discussions General  0 Content Issues  0 Images Backdrops  1 Posters  1 Videos Trailers  0 Teasers  0 Clips  0 Featurettes  0 Opening Credits  0 Top Billed Cast Park Ji-yeon Han Seo Yeon Kang Dong-ho Na Jin Wook Jo Hye Ryung Park Na Rae Yang Hak Jin Chun Shik Ahn Bo-hyun Wang Rim Full Cast & Crew Last Season Season 1 2016 | 6 Episodes View All Seasons Social Reviews  0 Discussions  0 Media Most Popular Videos  0 Backdrops  1 Posters  1 Recommendations We don't have enough data to suggest any TV shows based on My Runway. You can help by rating TV shows you've seen. Facts Original Name  \ub9c8\uc774 \ub7f0\uc6e8\uc774 Status  Ended Network Certification  - Type  Scripted Original Language  Korean Runtime  - Homepage  - Genres Drama Keywords body-swap romantic drama Content Score 86 Almost there... Top Contributors M 24 Monumma 3 Elizabeth Jennings 1 giannisrig  View Edit History Popularity Trend  Login to edit  URL By  signing up  for an account on TMDb, you can post directly to Twitter and Facebook. You need to be logged in to continue. Click  here  to login or  here  to sign up.    page_wrap opened in html_head  Join the Community The Basics About TMDb Contact Us Support Forums API Blog Get Involved  Contribution Bible 3rd Party Applications Add New Movie Add New TV Show Community Guidelines Leaderboard Forums Twitter Facebook Legal Terms of Use Privacy Policy Login Sign Up"
}