{
  "link": "https://www.themoviedb.org/tv/61346?language=en",
  "title": "The Wonder of Animals",
  "resume": "Chris Packham uses groundbreaking science and brand-new behaviour to delve deep beneath the skin and discover the unique features that have made certain animal groups successful.",
  "rate": "",
  "genre": [
    "Documentary"
  ],
  "cast": {
    "actor": [
      "Chris Packham"
    ]
  },
  "characters": {
    "characters": [
      "Himself - Presenter"
    ]
  },
  "site_data": "html Apps Forums Leaderboard Contribute API Support Discover Movies TV Shows Movies Popular Top Rated Upcoming Now Playing TV Shows Popular Top Rated On TV Airing Today People Popular People Can't find a movie or TV show? Login to create it. en Login Sign Up  ID: 61346   Expand The Wonder of Animals   (2014) User Score Overview Chris Packham uses groundbreaking science and brand-new behaviour to delve deep beneath the skin and discover the unique features that have made certain animal groups successful. Discussions   Reviews Videos   Images   Changes Report Share Discussions General  0 Content Issues  0 Images Backdrops  3 Posters  3 Videos Trailers  0 Teasers  0 Clips  0 Featurettes  0 Opening Credits  0 Top Billed Cast Chris Packham Himself - Presenter Full Cast & Crew Last Season Season 1 2014 | 12 Episodes Season 1 of The Wonder of Animals premiered on August 13, 2014. View All Seasons Social Reviews  0 Discussions  0 Media Most Popular Videos  0 Backdrops  3 Posters  3 Recommendations We don't have enough data to suggest any TV shows based on The Wonder of Animals. You can help by rating TV shows you've seen. Facts Status  Ended Network Certification  - Type  Documentary Original Language  English Runtime  30m Homepage   http://www.bbc.co.uk/programmes/b04dq51x Genres Documentary Keywords animal nature Content Score 56 We're so close, yet so far. Top Contributors 25 Elizabeth Jennings 5 .maxx 4 Banana T 3 TylonHH  View Edit History Popularity Trend  Login to edit  URL By  signing up  for an account on TMDb, you can post directly to Twitter and Facebook. You need to be logged in to continue. Click  here  to login or  here  to sign up.    page_wrap opened in html_head  Join the Community The Basics About TMDb Contact Us Support Forums API Blog Get Involved  Contribution Bible 3rd Party Applications Add New Movie Add New TV Show Community Guidelines Leaderboard Forums Twitter Facebook Legal Terms of Use Privacy Policy Login Sign Up"
}