{
  "link": "https://www.themoviedb.org/tv/74101?language=en",
  "title": "C'est juste de la TV",
  "resume": "We don't have an overview translated in English. Help us expand our database by adding one.",
  "rate": "100.0",
  "genre": [
    "Talk"
  ],
  "cast": [
    "Th\u00e9r\u00e8se Parisien",
    "Nathalie Petrowski",
    "Dave-\u00c9ric Ouellet",
    "Anne-Marie Withenshaw"
  ],
  "character": [
    "Herself",
    "Herself",
    "Himself",
    "Herself - Host"
  ],
  "site_data": "html Apps Forums Leaderboard Contribute API Support Discover Movies TV Shows Movies Popular Top Rated Upcoming Now Playing TV Shows Popular Top Rated On TV Airing Today People Popular People Can't find a movie or TV show? Login to create it. en Login Sign Up  ID: 74101   Expand C'est juste de la TV   (2007) User Score Overview We don't have an overview translated in English. Help us expand our database by adding one. Discussions   Reviews Videos   Images   Changes Report Share Discussions General  0 Content Issues  0 Images Backdrops  1 Posters  1 Videos Trailers  0 Teasers  0 Clips  0 Featurettes  0 Opening Credits  0 Top Billed Cast Th\u00e9r\u00e8se Parisien Herself Nathalie Petrowski Herself Dave-\u00c9ric Ouellet Himself Anne-Marie Withenshaw Herself - Host Full Cast & Crew Last Season Season 11 2017 | 10 Episodes Season 11 of C'est juste de la TV premiered on September 22, 2017. View All Seasons Social Reviews  0 Discussions  0 Media Most Popular Videos  0 Backdrops  1 Posters  1 Recommendations We don't have enough data to suggest any TV shows based on C'est juste de la TV. You can help by rating TV shows you've seen. Facts Status  Returning Series Network Certification G Meaning Suitable for general audiences. Programming suitable for the entire family with mild violence, and mild profanity and/or censored language. Type  Talk Show Original Language  French Runtime  60m Homepage   http://cestjustedelatv.artv.ca/ Genres Talk Keywords television Content Score 79 Pump it up! We're close now. Top Contributors j 50 joethebeef 6 Elizabeth Jennings 4 Banana  View Edit History Popularity Trend  Login to edit  URL By  signing up  for an account on TMDb, you can post directly to Twitter and Facebook. You need to be logged in to continue. Click  here  to login or  here  to sign up.    page_wrap opened in html_head  Join the Community The Basics About TMDb Contact Us Support Forums API Blog Get Involved  Contribution Bible 3rd Party Applications Add New Movie Add New TV Show Community Guidelines Leaderboard Forums Twitter Facebook Legal Terms of Use Privacy Policy Login Sign Up"
}