{
  "link": "https://www.themoviedb.org/tv/1278?language=en",
  "title": "Tribe",
  "resume": "Documentary series following former British Royal Marine Bruce Parry as he visits a number of remote tribes around the world, spending a month living and interacting with each society.",
  "rate": "80.0",
  "genre": [
    "Documentary"
  ],
  "cast": [
    "Bruce Parry"
  ],
  "character": [
    "Himself"
  ],
  "site_data": "html Apps Forums Leaderboard Contribute API Support Discover Movies TV Shows Movies Popular Top Rated Upcoming Now Playing TV Shows Popular Top Rated On TV Airing Today People Popular People Can't find a movie or TV show? Login to create it. en Login Sign Up  ID: 1278   Expand Tribe   (2005) User Score Overview Documentary series following former British Royal Marine Bruce Parry as he visits a number of remote tribes around the world, spending a month living and interacting with each society. Discussions   Reviews Videos   Images   Changes Report Share Discussions General  0 Content Issues  0 Images Backdrops  2 Posters  1 Videos Trailers  0 Teasers  0 Clips  0 Featurettes  0 Opening Credits  0 Top Billed Cast Bruce Parry Himself Full Cast & Crew Last Season Season 3 2007 | 6 Episodes Season 3 of Tribe premiered on August 21, 2007. View All Seasons Social Reviews  0 Discussions  0 Media Most Popular Videos  0 Backdrops  2 Posters  1 Recommendations We don't have enough data to suggest any TV shows based on Tribe. You can help by rating TV shows you've seen. Facts Status  Ended Network Certification  - Type  Scripted Original Language  English Runtime  60m Homepage   https://www.bbc.co.uk/programmes/b007ly82 Genres Documentary Keywords No keywords have been added. Content Score 56 We're so close, yet so far. Top Contributors R 7 Rebecca s 7 shane.d.jackson  View Edit History Popularity Trend  Login to edit  URL By  signing up  for an account on TMDb, you can post directly to Twitter and Facebook. You need to be logged in to continue. Click  here  to login or  here  to sign up.    page_wrap opened in html_head  Join the Community The Basics About TMDb Contact Us Support Forums API Blog Get Involved  Contribution Bible 3rd Party Applications Add New Movie Add New TV Show Community Guidelines Leaderboard Forums Twitter Facebook Legal Terms of Use Privacy Policy Login Sign Up"
}