{
  "link": "https://www.themoviedb.org/tv/26996?language=en",
  "title": "Vrouwenvleugel",
  "resume": "We don't have an overview translated in English. Help us expand our database by adding one.",
  "rate": "",
  "genre": [
    "Drama"
  ],
  "cast": {
    "actor": [
      "Isa Hoes",
      "John Jones",
      "Luk van Mello",
      "Ella Snoep",
      "Bea Meulman"
    ]
  },
  "characters": {
    "characters": [
      "Liesbeth Vrijman",
      "Jantje Kruimel",
      "Teun Metz"
    ]
  },
  "site_data": "html Apps Forums Leaderboard Contribute API Support Discover Movies TV Shows Movies Popular Top Rated Upcoming Now Playing TV Shows Popular Top Rated On TV Airing Today People Popular People Can't find a movie or TV show? Login to create it. en Login Sign Up  ID: 26996   Expand Vrouwenvleugel   (1993) User Score Overview We don't have an overview translated in English. Help us expand our database by adding one. Discussions   Reviews Videos   Images   Changes Report Share Discussions General  0 Content Issues  0 Images Backdrops  1 Posters  1 Videos Trailers  0 Teasers  0 Clips  0 Featurettes  0 Opening Credits  0 Top Billed Cast Isa Hoes Liesbeth Vrijman John Jones Luk van Mello Ella Snoep Jantje Kruimel Bea Meulman Teun Metz Full Cast & Crew Last Season Season 3 1995 | 22 Episodes Season 3 of Vrouwenvleugel premiered on January  6, 1995. View All Seasons Social Reviews  0 Discussions  0 Media Most Popular Videos  0 Backdrops  1 Posters  1 Recommendations We don't have enough data to suggest any TV shows based on Vrouwenvleugel. You can help by rating TV shows you've seen. Facts Status  Ended Networks - Certification  - Type  Scripted Original Language  Dutch; Flemish Runtime  50m Homepage  - Genres Drama Keywords No keywords have been added. Content Score 79 Pump it up! We're close now. Top Contributors 9 Gizmo  View Edit History Popularity Trend  Login to edit  URL By  signing up  for an account on TMDb, you can post directly to Twitter and Facebook. You need to be logged in to continue. Click  here  to login or  here  to sign up.    page_wrap opened in html_head  Join the Community The Basics About TMDb Contact Us Support Forums API Blog Get Involved  Contribution Bible 3rd Party Applications Add New Movie Add New TV Show Community Guidelines Leaderboard Forums Twitter Facebook Legal Terms of Use Privacy Policy Login Sign Up"
}