{
  "link": "https://www.themoviedb.org/tv/69174?language=en",
  "title": "Terry Crews Saves Christmas",
  "resume": "Actor and former NFL star, Terry Crews, surprises families at Christmas time by providing them with some last-minute help during the holidays.",
  "rate": "",
  "genre": [
    "Family"
  ],
  "cast": {
    "actor": [
      "Terry Crews"
    ]
  },
  "characters": {
    "characters": [
      "Himself"
    ]
  },
  "site_data": "html Apps Forums Leaderboard Contribute API Support Discover Movies TV Shows Movies Popular Top Rated Upcoming Now Playing TV Shows Popular Top Rated On TV Airing Today People Popular People Can't find a movie or TV show? Login to create it. en Login Sign Up  ID: 69174   Expand Terry Crews Saves Christmas   (2016) User Score  Play Trailer Overview Actor and former NFL star, Terry Crews, surprises families at Christmas time by providing them with some last-minute help during the holidays. Featured Crew Tim Warren Creator Discussions   Reviews Videos   Images   Changes Report Share Discussions General  0 Content Issues  0 Images Backdrops  1 Posters  1 Videos Trailers  1 Teasers  0 Clips  0 Featurettes  0 Opening Credits  0 Top Billed Cast Terry Crews Himself Full Cast & Crew Last Season Season 1 2016 | 5 Episodes Season 1 of Terry Crews Saves Christmas premiered on December 22, 2016. View All Seasons Social Reviews  0 Discussions  0 Media Most Popular Videos  1 Backdrops  1 Posters  1 Recommendations We don't have enough data to suggest any TV shows based on Terry Crews Saves Christmas. You can help by rating TV shows you've seen. Facts Status  Returning Series Network Certification  - Type  Scripted Original Language  English Runtime  42m Homepage   http://www.cwtv.com/shows/terry-crews-saves-christmas Genres Family Keywords saving christmas christmas Content Score 71 Just a little bit more... Top Contributors 19 Capa 9 Elizabeth Jennings j 5 jakatarub L 1 Lansi  View Edit History Popularity Trend  Login to edit  URL By  signing up  for an account on TMDb, you can post directly to Twitter and Facebook. You need to be logged in to continue. Click  here  to login or  here  to sign up.    page_wrap opened in html_head  Join the Community The Basics About TMDb Contact Us Support Forums API Blog Get Involved  Contribution Bible 3rd Party Applications Add New Movie Add New TV Show Community Guidelines Leaderboard Forums Twitter Facebook Legal Terms of Use Privacy Policy Login Sign Up"
}