{
  "link": "https://www.themoviedb.org/tv/36523?language=en",
  "title": "Binb\u014d Shimai Monogatari",
  "resume": "Binb\u014d Shimai Monogatari is a manga series by Izumi Kazuto. It has been adapted into an anime series by Toei Animation and was aired in Japan from June 2006 until September 2006.",
  "rate": "",
  "genre": [
    "Animation"
  ],
  "cast": {
    "actor": [
      "Akiko Hiramatsu",
      "Tomoko Kaneda",
      "Mugihito",
      "Maaya Sakamoto",
      "Etsuko Kozakura"
    ]
  },
  "characters": {
    "characters": [
      "Ranko Saegusa",
      "Asu Yamada",
      "Genz\u014d Hayashi",
      "Ky\u014d Yamada",
      "Ginko Echigoya"
    ]
  },
  "site_data": "html Apps Forums Leaderboard Contribute API Support Discover Movies TV Shows Movies Popular Top Rated Upcoming Now Playing TV Shows Popular Top Rated On TV Airing Today People Popular People Can't find a movie or TV show? Login to create it. en Login Sign Up  ID: 36523   Expand Binb\u014d Shimai Monogatari   (2006) User Score Overview Binb\u014d Shimai Monogatari is a manga series by Izumi Kazuto. It has been adapted into an anime series by Toei Animation and was aired in Japan from June 2006 until September 2006. Discussions   Reviews Videos   Images   Changes Report Share Discussions General  0 Content Issues  0 Images Backdrops  1 Posters  2 Videos Trailers  0 Teasers  0 Clips  0 Featurettes  0 Opening Credits  0 Top Billed Cast Akiko Hiramatsu Ranko Saegusa Tomoko Kaneda Asu Yamada Mugihito Genz\u014d Hayashi Maaya Sakamoto Ky\u014d Yamada Etsuko Kozakura Ginko Echigoya Full Cast & Crew Last Season Binbou shimai monogatari season 1 2006 | 10 Episodes Season 1 of Binb\u014d Shimai Monogatari premiered on June 29, 2006. View All Seasons Social Reviews  0 Discussions  0 Media Most Popular Videos  0 Backdrops  1 Posters  2 Recommendations We don't have enough data to suggest any TV shows based on Binb\u014d Shimai Monogatari. You can help by rating TV shows you've seen. Facts Status  Ended Network Certification  - Type  Scripted Original Language  English Runtime  30m Homepage  - Genres Animation Keywords watercolour style Content Score 86 Almost there... Top Contributors 3 Marr \ud83c\uddf3\ud83c\uddf1 2 Zlogorek 1 seboseboss  View Edit History Popularity Trend  Login to edit  URL By  signing up  for an account on TMDb, you can post directly to Twitter and Facebook. You need to be logged in to continue. Click  here  to login or  here  to sign up.    page_wrap opened in html_head  Join the Community The Basics About TMDb Contact Us Support Forums API Blog Get Involved  Contribution Bible 3rd Party Applications Add New Movie Add New TV Show Community Guidelines Leaderboard Forums Twitter Facebook Legal Terms of Use Privacy Policy Login Sign Up"
}