{
  "link": "https://www.themoviedb.org/tv/8724?language=en",
  "title": "Frozen Planet",
  "resume": "David Attenborough travels to the end of the earth, taking viewers on an extraordinary journey across the polar regions of our planet.",
  "rate": "83.0",
  "genre": [
    "Documentary"
  ],
  "cast": [
    "David Attenborough"
  ],
  "character": [
    "Narrator"
  ],
  "site_data": "html Apps Forums Leaderboard Contribute API Support Discover Movies TV Shows Movies Popular Top Rated Upcoming Now Playing TV Shows Popular Top Rated On TV Airing Today People Popular People Can't find a movie or TV show? Login to create it. en Login Sign Up  ID: 8724   Expand Frozen Planet   (2011) User Score  Play Trailer Overview David Attenborough travels to the end of the earth, taking viewers on an extraordinary journey across the polar regions of our planet. Discussions   Reviews Videos   Images   Changes Report Share Discussions General  0 Content Issues  1 Images Backdrops  14 Posters  17 Videos Trailers  1 Teasers  0 Clips  0 Featurettes  0 Opening Credits  0 Top Billed Cast David Attenborough Narrator Full Cast & Crew Last Season Miniseries 2011 | 7 Episodes Season 1 of Frozen Planet premiered on October 26, 2011. View All Seasons Social Reviews  0 Discussions  1 Subject Status Replies Last Reply There are no discussions for Frozen Planet. Login to be first! Go to Discussions Media Most Popular Videos  1 Backdrops  14 Posters  17 Recommendations   2001-09-12 The Blue Planet 8.4    2009-10-11 Life 8.3    1998-10-21 The Life of Birds 9.3    2011-01-13 Human Planet 8.2    2006-03-05 Planet Earth 8.5    2002-11-20 The Life of Mammals 9.1    2005-11-23 Life in the Undergrowth 8.4    2011-02-09 Madagascar 8.8  Facts Status  Ended Network Certification TV-PG Meaning This program contains material that parents may find unsuitable for younger children. Type  Miniseries Original Language  English Runtime  60m Homepage   http://www.bbc.co.uk/programmes/b00mfl7n Genres Documentary Keywords cold winter arctic miniseries antarctica animal nature nature documentary Content Score 64 We're so close, yet so far. Top Contributors 88 sporktork 72 lineker TB 24 TMDb Bot 16 thedarer  View Edit History Popularity Trend  Login to edit  URL By  signing up  for an account on TMDb, you can post directly to Twitter and Facebook. You need to be logged in to continue. Click  here  to login or  here  to sign up.    page_wrap opened in html_head  Join the Community The Basics About TMDb Contact Us Support Forums API Blog Get Involved  Contribution Bible 3rd Party Applications Add New Movie Add New TV Show Community Guidelines Leaderboard Forums Twitter Facebook Legal Terms of Use Privacy Policy Login Sign Up"
}