{
  "link": "https://www.themoviedb.org/tv/67642?language=en",
  "title": "Swedish Dicks",
  "resume": "Two unlicensed Swedish private investigators try to make a living in Los Angeles.",
  "rate": "",
  "genre": [
    "Comedy",
    "Crime"
  ],
  "cast": {
    "actor": [
      "Peter Stormare",
      "Johan Glans",
      "Vivian Bang",
      "Felisha Cooper",
      "Keanu Reeves"
    ]
  },
  "characters": {
    "characters": [
      "Ingmar",
      "Axel",
      "Sun",
      "Sarah",
      "Rex"
    ]
  },
  "site_data": "html Apps Forums Leaderboard Contribute API Support Discover Movies TV Shows Movies Popular Top Rated Upcoming Now Playing TV Shows Popular Top Rated On TV Airing Today People Popular People Can't find a movie or TV show? Login to create it. en Login Sign Up  ID: 67642   Expand Swedish Dicks   (2016) User Score  Play Trailer Overview Two unlicensed Swedish private investigators try to make a living in Los Angeles. Featured Crew Andrew Lowery Creator Peter Settman Creator Discussions   Reviews Videos   Images   Changes Report Share Discussions General  0 Content Issues  0 Images Backdrops  8 Posters  4 Videos Trailers  1 Teasers  0 Clips  0 Featurettes  0 Opening Credits  0 Top Billed Cast Peter Stormare Ingmar Johan Glans Axel Vivian Bang Sun Felisha Cooper Sarah Keanu Reeves Rex Full Cast & Crew Current Season Season 2 2017 | 10 Episodes Season 2 of Swedish Dicks premiered on December 25, 2017. View All Seasons Social Reviews  0 Discussions  0 Media Most Popular Videos  1 Backdrops  8 Posters  4 Recommendations We don't have enough data to suggest any TV shows based on Swedish Dicks. You can help by rating TV shows you've seen. Facts Status  Returning Series Network Certification TV-PG Meaning This program contains material that parents may find unsuitable for younger children. Type  Scripted Original Language  English Runtime  25m Homepage   https://viaplay.se/serier/swedish-dicks Genres Comedy Crime Keywords private investigator crime investigation Content Score 100 Yes! Looking good! Top Contributors 33 Bendik S 23 Swanemar 13 Elizabeth Jennings VA 6 Viktor Andersson  View Edit History Popularity Trend  Login to edit  URL By  signing up  for an account on TMDb, you can post directly to Twitter and Facebook. You need to be logged in to continue. Click  here  to login or  here  to sign up.    page_wrap opened in html_head  Join the Community The Basics About TMDb Contact Us Support Forums API Blog Get Involved  Contribution Bible 3rd Party Applications Add New Movie Add New TV Show Community Guidelines Leaderboard Forums Twitter Facebook Legal Terms of Use Privacy Policy Login Sign Up"
}