{
  "link": "https://www.themoviedb.org/tv/37363?language=en",
  "title": "Braquo",
  "resume": "A group of police officers in Paris use violence and intimidation to solve crimes.",
  "rate": "",
  "genre": [
    "Action",
    "Adventure",
    "Drama"
  ],
  "cast": {
    "actor": [
      "Jean-Hugues Anglade",
      "Joseph Malerba",
      "Karole Rocher",
      "Alain Figlarz",
      "Geoffroy Thiebaut"
    ]
  },
  "characters": {
    "characters": [
      "Eddy Caplan",
      "Walter Morlighem",
      "Roxane Delgado",
      "Serge Lemoine",
      "Roland Vogel"
    ]
  },
  "site_data": "html Apps Forums Leaderboard Contribute API Support Discover Movies TV Shows Movies Popular Top Rated Upcoming Now Playing TV Shows Popular Top Rated On TV Airing Today People Popular People Can't find a movie or TV show? Login to create it. en Login Sign Up  ID: 37363   Expand Braquo   (2009) User Score  Play Trailer Overview A group of police officers in Paris use violence and intimidation to solve crimes. Featured Crew Olivier Marchal Creator Discussions   Reviews Videos   Images   Changes Report Share Discussions General  1 Content Issues  0 Images Backdrops  6 Posters  5 Videos Trailers  1 Teasers  0 Clips  0 Featurettes  0 Opening Credits  0 Top Billed Cast Jean-Hugues Anglade Eddy Caplan Joseph Malerba Walter Morlighem Karole Rocher Roxane Delgado Alain Figlarz Serge Lemoine Geoffroy Thiebaut Roland Vogel Full Cast & Crew Last Season Season 4 2016 | 8 Episodes Season 4 of Braquo premiered on September 12, 2016. View All Seasons Social Reviews  0 Discussions  1 Subject Status Replies Last Reply b ANYONE ELSE LOVE IT??? Open 0 by bathsheeba\n      \n     Go to Discussions Media Most Popular Videos  1 Backdrops  6 Posters  5 Recommendations   2002-10-27 Cam\u00e9ra Caf\u00e9 6.8    2005-12-13 Spiral 8.2    2011-09-20 Unforgettable 6.1    2012-11-26 The Returned 7.3    1993-04-21 Walker, Texas Ranger 5.0  Facts Status  Ended Network Certification 12 Meaning Not recommended for children under 12. Not allowed air before 10:00 p.m. Some channels and programs are subject to exception. Type  Scripted Original Language  French Runtime  50m Homepage   http://www.canalplus.fr/series/pid3971-braquo.html Genres Action & Adventure Drama Keywords police Content Score 100 Yes! Looking good! Top Contributors PG 22 Pep GZ F 13 Florent GC 10 Guillaume COSTA M 8 Manu  View Edit History Popularity Trend  Login to edit  URL By  signing up  for an account on TMDb, you can post directly to Twitter and Facebook. You need to be logged in to continue. Click  here  to login or  here  to sign up.    page_wrap opened in html_head  Join the Community The Basics About TMDb Contact Us Support Forums API Blog Get Involved  Contribution Bible 3rd Party Applications Add New Movie Add New TV Show Community Guidelines Leaderboard Forums Twitter Facebook Legal Terms of Use Privacy Policy Login Sign Up"
}