{
  "link": "https://www.themoviedb.org/tv/61835?language=en",
  "title": "Noob",
  "resume": "We don't have an overview translated in English. Help us expand our database by adding one.",
  "rate": "78.0",
  "genre": [
    "Sci-Fi",
    "Fantasy"
  ],
  "cast": [
    "Jonathan Fourcade",
    "Julien Guellerin",
    "Fr\u00e9d\u00e9ric Zolfanelli",
    "Anne-Laure Jarnet"
  ],
  "character": [
    "Arth\u00e9on / Stanislas Ch\u00e2telain",
    "Omega Zell / Morgan Lavande",
    "Sparadrap / Kevin Lepape",
    "Gaea / Gabrielle Jolivet"
  ],
  "site_data": "html Apps Forums Leaderboard Contribute API Support Discover Movies TV Shows Movies Popular Top Rated Upcoming Now Playing TV Shows Popular Top Rated On TV Airing Today People Popular People Can't find a movie or TV show? Login to create it. en Login Sign Up  ID: 61835   Expand Noob   (2008) User Score Overview We don't have an overview translated in English. Help us expand our database by adding one. Featured Crew Fabien Fournier Creator Discussions   Reviews Videos   Images   Changes Report Share Discussions General  0 Content Issues  0 Images Backdrops  4 Posters  8 Videos Trailers  0 Teasers  0 Clips  0 Featurettes  0 Opening Credits  0 Top Billed Cast Jonathan Fourcade Arth\u00e9on / Stanislas Ch\u00e2telain Julien Guellerin Omega Zell / Morgan Lavande Fr\u00e9d\u00e9ric Zolfanelli Sparadrap / Kevin Lepape Anne-Laure Jarnet Gaea / Gabrielle Jolivet Full Cast & Crew Last Season Season 9 2016 | 10 Episodes Season 9 of Noob premiered on October 14, 2016. View All Seasons Social Reviews  0 Discussions  0 Media Most Popular Videos  0 Backdrops  4 Posters  8 Recommendations We don't have enough data to suggest any TV shows based on Noob. You can help by rating TV shows you've seen. Facts Status  Returning Series Network Certification  - Type  Scripted Original Language  French Runtime  10m Homepage   http://noob-tv.com Genres Sci-Fi & Fantasy Keywords video game Content Score 86 Almost there... Top Contributors S 23 SyKael S 16 Smels h 16 herlock60 t 13 tmdb84253387  View Edit History Popularity Trend  Login to edit  URL By  signing up  for an account on TMDb, you can post directly to Twitter and Facebook. You need to be logged in to continue. Click  here  to login or  here  to sign up.    page_wrap opened in html_head  Join the Community The Basics About TMDb Contact Us Support Forums API Blog Get Involved  Contribution Bible 3rd Party Applications Add New Movie Add New TV Show Community Guidelines Leaderboard Forums Twitter Facebook Legal Terms of Use Privacy Policy Login Sign Up"
}