{
  "link": "https://www.themoviedb.org/tv/63509?language=en",
  "title": "The Grinder",
  "resume": "Television lawyer Dean Sanderson moves back to his small home town after his hit series, \"The Grinder,\" is canceled thinking his time on TV qualifies him to run his family's law firm.",
  "rate": "69.0",
  "genre": [
    "Comedy"
  ],
  "cast": [
    "Rob Lowe",
    "Fred Savage",
    "Mary Elizabeth Ellis",
    "William Devane",
    "Hana Hayes"
  ],
  "character": [
    "Dean Sanderson",
    "Stewart Sanderson",
    "Debbie Sanderson",
    "Dean Sanderson Sr.",
    "Lizzie Sanderson"
  ],
  "site_data": "html Apps Forums Leaderboard Contribute API Support Discover Movies TV Shows Movies Popular Top Rated Upcoming Now Playing TV Shows Popular Top Rated On TV Airing Today People Popular People Can't find a movie or TV show? Login to create it. en Login Sign Up  ID: 63509   Expand The Grinder   (2015) User Score  Play Trailer Overview Television lawyer Dean Sanderson moves back to his small home town after his hit series, \"The Grinder,\" is canceled thinking his time on TV qualifies him to run his family's law firm. Featured Crew Andrew Mogel Creator Jarrad Paul Creator Discussions   Reviews Videos   Images   Changes Report Share Discussions General  0 Content Issues  0 Images Backdrops  3 Posters  3 Videos Trailers  1 Teasers  0 Clips  0 Featurettes  0 Opening Credits  0 Top Billed Cast Rob Lowe Dean Sanderson Fred Savage Stewart Sanderson Mary Elizabeth Ellis Debbie Sanderson William Devane Dean Sanderson Sr. Hana Hayes Lizzie Sanderson Full Cast & Crew Last Season Season 1 2015 | 22 Episodes Season 1 of The Grinder premiered on September 29, 2015. View All Seasons Social Reviews  0 Discussions  0 Media Most Popular Videos  1 Backdrops  3 Posters  3 Recommendations   2016-03-15 Crowded 6.4    2006-01-01 In Justice 6.8    2011-06-05 Case Histories 8.2    2016-08-02 Borderline 7.1    2014-10-28 Benched 5.6    2015-03-25 Big Time in Hollywood, Fl 5.7    2015-01-13 Cockroaches 6.0    2015-04-15 The Delivery Man 6.5  Facts Status  Cancelled Network Certification TV-14 Meaning This program contains some material that many parents would find unsuitable for children under 14 years of age. Type  Scripted Original Language  English Runtime  21m Homepage   http://www.fox.com/the-grinder Genres Comedy Keywords family business  lawyer family law firm sitcom Content Score 100 Yes! Looking good! Top Contributors 57 Elizabeth Jennings 7 Banana z 4 zurman1 4 Bendik  View Edit History Popularity Trend  Login to edit  URL By  signing up  for an account on TMDb, you can post directly to Twitter and Facebook. You need to be logged in to continue. Click  here  to login or  here  to sign up.    page_wrap opened in html_head  Join the Community The Basics About TMDb Contact Us Support Forums API Blog Get Involved  Contribution Bible 3rd Party Applications Add New Movie Add New TV Show Community Guidelines Leaderboard Forums Twitter Facebook Legal Terms of Use Privacy Policy Login Sign Up"
}