{
  "link": "https://www.themoviedb.org/tv/78678?language=en",
  "title": "La Verdad",
  "resume": "We don't have an overview translated in English. Help us expand our database by adding one.",
  "rate": "80.0",
  "genre": [
    "Mystery"
  ],
  "cast": [
    "Lydia Bosch",
    "Jon Kortajarena",
    "Elena Rivera",
    "Gin\u00e9s Garc\u00eda Mill\u00e1n"
  ],
  "character": [
    "Lidia McMah\u00f3n",
    "Marcos Egu\u00eda",
    "Paula Garc\u00eda McMah\u00f3n",
    "Fernando Garc\u00eda"
  ],
  "site_data": "html Apps Forums Leaderboard Contribute API Support Discover Movies TV Shows Movies Popular Top Rated Upcoming Now Playing TV Shows Popular Top Rated On TV Airing Today People Popular People Can't find a movie or TV show? Login to create it. en Login Sign Up  ID: 78678   Expand La Verdad   (2018) User Score Overview We don't have an overview translated in English. Help us expand our database by adding one. Featured Crew Aitor Gabilondo Creator C\u00e9sar Ben\u00edtez Creator Discussions   Reviews Videos   Images   Changes Report Share Discussions General  0 Content Issues  0 Images Backdrops  1 Posters  1 Videos Trailers  0 Teasers  0 Clips  0 Featurettes  0 Opening Credits  0 Top Billed Cast Lydia Bosch Lidia McMah\u00f3n Jon Kortajarena Marcos Egu\u00eda Elena Rivera Paula Garc\u00eda McMah\u00f3n Gin\u00e9s Garc\u00eda Mill\u00e1n Fernando Garc\u00eda Full Cast & Crew Current Season Season 1 2018 | 16 Episodes Season 1 of La Verdad premiered on May 21, 2018. View All Seasons Social Reviews  0 Discussions  0 Media Most Popular Videos  0 Backdrops  1 Posters  1 Recommendations We don't have enough data to suggest any TV shows based on La Verdad. You can help by rating TV shows you've seen. Facts Status  In Production Network Certification  - Type  Scripted Original Language  Spanish; Castilian Runtime  75m Homepage   http://www.telecinco.es/laverdad/ Genres Mystery Keywords No keywords have been added. Content Score 86 Almost there... Top Contributors 24 LasSeries 9 Elizabeth Jennings L 4 Lnkstrmng 2 Bealua  View Edit History Popularity Trend  Login to edit  URL By  signing up  for an account on TMDb, you can post directly to Twitter and Facebook. You need to be logged in to continue. Click  here  to login or  here  to sign up.    page_wrap opened in html_head  Join the Community The Basics About TMDb Contact Us Support Forums API Blog Get Involved  Contribution Bible 3rd Party Applications Add New Movie Add New TV Show Community Guidelines Leaderboard Forums Twitter Facebook Legal Terms of Use Privacy Policy Login Sign Up"
}