{
  "link": "https://www.themoviedb.org/tv/28680?language=en",
  "title": "The King Dae Joyoung",
  "resume": "This 100-episode epic drama vividly depicts the life of King Dae Jo-yeong and other heroes of the Balhae Kingdom, which dates back 1300 years ago.",
  "rate": "",
  "genre": [
    "Drama"
  ],
  "cast": {
    "actor": [
      "Jeong Bo-seok",
      "Im Ho",
      "Lee Deok-hwa ",
      "Choi Soo-jong",
      "Kim Jin-tae"
    ]
  },
  "characters": {
    "characters": [
      "Lee Hae-go",
      "Yeon Nam-saeng",
      "Seol In-gwi",
      "Dae Jo-young",
      "Yeon Gae-so"
    ]
  },
  "site_data": "html Apps Forums Leaderboard Contribute API Support Discover Movies TV Shows Movies Popular Top Rated Upcoming Now Playing TV Shows Popular Top Rated On TV Airing Today People Popular People Can't find a movie or TV show? Login to create it. en Login Sign Up  ID: 28680   Expand The King Dae Joyoung   (2006) User Score Overview This 100-episode epic drama vividly depicts the life of King Dae Jo-yeong and other heroes of the Balhae Kingdom, which dates back 1300 years ago. Featured Crew Jang Young-Cheol Creator Discussions   Reviews Videos   Images   Changes Report Share Discussions General  0 Content Issues  0 Images Backdrops  1 Posters  1 Videos Trailers  0 Teasers  1 Clips  0 Featurettes  0 Opening Credits  0 Top Billed Cast Jeong Bo-seok Lee Hae-go Im Ho Yeon Nam-saeng Lee Deok-hwa  Seol In-gwi Choi Soo-jong Dae Jo-young Kim Jin-tae Yeon Gae-so Full Cast & Crew Last Season Season 1 2006 | 100 Episodes Season 1 of The King Dae Joyoung premiered on September 16, 2006. View All Seasons Social Reviews  0 Discussions  0 Media Most Popular Videos  1 Backdrops  1 Posters  1 Recommendations We don't have enough data to suggest any TV shows based on The King Dae Joyoung. You can help by rating TV shows you've seen. Facts Original Name  \ub300\uc870\uc601 Status  Ended Network Certification  - Type  Scripted Original Language  Korean Runtime  50m Homepage   http://www.kbs.co.kr/drama/daejoyoung/ Genres Drama Keywords historical ancient kingdom Content Score 100 Yes! Looking good! Top Contributors t 25 tmdb983464 21 animerika TB 1 TMDb Bot  View Edit History Popularity Trend  Login to edit  URL By  signing up  for an account on TMDb, you can post directly to Twitter and Facebook. You need to be logged in to continue. Click  here  to login or  here  to sign up.    page_wrap opened in html_head  Join the Community The Basics About TMDb Contact Us Support Forums API Blog Get Involved  Contribution Bible 3rd Party Applications Add New Movie Add New TV Show Community Guidelines Leaderboard Forums Twitter Facebook Legal Terms of Use Privacy Policy Login Sign Up"
}