{
  "link": "https://www.themoviedb.org/tv/68052?language=en",
  "title": "Freakish",
  "resume": "A group of students trapped in a high school must fight for survival when predatory mutant freaks take over after a meltdown at the local chemical plant.",
  "rate": "58.0",
  "genre": [
    "Sci-Fi",
    "Fantasy"
  ],
  "cast": [
    "Meghan Rienks",
    "Leo Howard",
    "Liza Koshy",
    "Adam Hicks",
    "Tyler Chase"
  ],
  "character": [
    "Zoe Parker",
    "Grover Jones",
    "Violet Adams",
    "Diesel",
    "Barrett McIntyre"
  ],
  "site_data": "html Apps Forums Leaderboard Contribute API Support Discover Movies TV Shows Movies Popular Top Rated Upcoming Now Playing TV Shows Popular Top Rated On TV Airing Today People Popular People Can't find a movie or TV show? Login to create it. en Login Sign Up  ID: 68052   Expand Freakish   (2016) User Score  Play Trailer Overview A group of students trapped in a high school must fight for survival when predatory mutant freaks take over after a meltdown at the local chemical plant. Featured Crew Beth Szymkowski Creator Discussions   Reviews Videos   Images   Changes Report Share Discussions General  1 Content Issues  0 Images Backdrops  3 Posters  3 Videos Trailers  1 Teasers  0 Clips  0 Featurettes  0 Opening Credits  0 Top Billed Cast Meghan Rienks Zoe Parker Leo Howard Grover Jones Liza Koshy Violet Adams Adam Hicks Diesel Tyler Chase Barrett McIntyre Full Cast & Crew Current Season Season 2 2017 | 10 Episodes View All Seasons Social Reviews  0 Discussions  1 Subject Status Replies Last Reply Whiny teenage bullshiat Open 0 by drjekel_mrhyde\n      \n     Go to Discussions Media Most Popular Videos  1 Backdrops  3 Posters  3 Recommendations   2017-09-26 Law & Order True Crime 6.1    2014-10-05 Mulaney 2.4    2016-10-31 Stan Against Evil 6.7    2016-10-11 Channel Zero 6.6    2005-10-28 Masters of Horror 6.9    2016-10-03 Conviction 6.3    2015-04-17 The Messengers 6.1    2016-03-04 Slasher 6.0  Facts Status  Returning Series Network Certification  - Type  Scripted Original Language  English Runtime  22m Homepage   http://www.hulu.com/freakish Genres Sci-Fi & Fantasy Keywords mutant teenager trapped chemical plant Content Score 100 Yes! Looking good! Top Contributors p 10 plumpro b 9 birdreina d 7 dizimad 7 Elizabeth Jennings  View Edit History Popularity Trend  Login to edit  URL By  signing up  for an account on TMDb, you can post directly to Twitter and Facebook. You need to be logged in to continue. Click  here  to login or  here  to sign up.    page_wrap opened in html_head  Join the Community The Basics About TMDb Contact Us Support Forums API Blog Get Involved  Contribution Bible 3rd Party Applications Add New Movie Add New TV Show Community Guidelines Leaderboard Forums Twitter Facebook Legal Terms of Use Privacy Policy Login Sign Up"
}