{
  "link": "https://www.themoviedb.org/tv/79013?language=en",
  "title": "Innocent",
  "resume": "David Collins fights to rebuild his shattered life, when, after spending seven years in a high-security prison, his conviction for the murder of his wife is overturned.",
  "rate": "",
  "genre": [
    "Mystery",
    "Crime",
    "Drama"
  ],
  "cast": {
    "actor": [
      "Lee Ingleby",
      "Hermione Norris"
    ]
  },
  "characters": {
    "characters": [
      "David Collins",
      "Alice Moffatt"
    ]
  },
  "site_data": "html Apps Forums Leaderboard Contribute API Support Discover Movies TV Shows Movies Popular Top Rated Upcoming Now Playing TV Shows Popular Top Rated On TV Airing Today People Popular People Can't find a movie or TV show? Login to create it. en Login Sign Up  ID: 79013   Expand Innocent   (2018) User Score  Play Trailer Overview David Collins fights to rebuild his shattered life, when, after spending seven years in a high-security prison, his conviction for the murder of his wife is overturned. Featured Crew Chris Lang Creator Matthew Arlidge Creator Discussions   Reviews Videos   Images   Changes Report Share Discussions General  1 Content Issues  0 Images Backdrops  1 Posters  3 Videos Trailers  1 Teasers  0 Clips  0 Featurettes  0 Opening Credits  0 Top Billed Cast Lee Ingleby David Collins Hermione Norris Alice Moffatt Full Cast & Crew Current Season Season 1 2018 | 4 Episodes Season 1 of Innocent premiered on May 14, 2018. View All Seasons Social Reviews  0 Discussions  1 Subject Status Replies Last Reply SB Seven years in jail with no conviction? Open 0 by Strange Bedfellows\n      \n     Go to Discussions Media Most Popular Videos  1 Backdrops  1 Posters  3 Recommendations   2018-01-22 The Alienist 7.1    2014-10-12 The Affair 6.5  Facts Status  Returning Series Network Certification 12 Meaning Films classified 12A and video works classified 12 contain material that is not generally suitable for children aged under 12. Type  Miniseries Original Language  English Runtime  45m Homepage  - Genres Mystery Crime Drama Keywords No keywords have been added. Content Score 71 Just a little bit more... Top Contributors s 13 syfygirl R 8 Rebecca 7 Elizabeth Jennings D 4 Destr0y  View Edit History Popularity Trend  Login to edit  URL By  signing up  for an account on TMDb, you can post directly to Twitter and Facebook. You need to be logged in to continue. Click  here  to login or  here  to sign up.    page_wrap opened in html_head  Join the Community The Basics About TMDb Contact Us Support Forums API Blog Get Involved  Contribution Bible 3rd Party Applications Add New Movie Add New TV Show Community Guidelines Leaderboard Forums Twitter Facebook Legal Terms of Use Privacy Policy Login Sign Up"
}