{
  "link": "https://www.themoviedb.org/tv/58938?language=en",
  "title": "Docventures",
  "resume": "Documents about the surrounding world and Interesting conversation with experts about documentary subjects. Your hosts: Riku Rantala and Tunna Milonoff. Welcome to the journey!",
  "rate": "90.0",
  "genre": [
    "Documentary"
  ],
  "cast": [
    "Riku Rantala",
    "Tuomas Milonoff"
  ],
  "character": [
    "Host",
    "Host"
  ],
  "site_data": "html Apps Forums Leaderboard Contribute API Support Discover Movies TV Shows Movies Popular Top Rated Upcoming Now Playing TV Shows Popular Top Rated On TV Airing Today People Popular People Can't find a movie or TV show? Login to create it. en Login Sign Up  ID: 58938   Expand Docventures   (2013) User Score Overview Documents about the surrounding world and Interesting conversation with experts about documentary subjects. Your hosts: Riku Rantala and Tunna Milonoff. Welcome to the journey! Discussions   Reviews Videos   Images   Changes Report Share Discussions General  0 Content Issues  0 Images Backdrops  3 Posters  1 Videos Trailers  0 Teasers  0 Clips  0 Featurettes  0 Opening Credits  0 Top Billed Cast Riku Rantala Host Tuomas Milonoff Host Full Cast & Crew Last Season Season 4 2016 | 2 Episodes View All Seasons Social Reviews  0 Discussions  0 Media Most Popular Videos  0 Backdrops  3 Posters  1 Recommendations We don't have enough data to suggest any TV shows based on Docventures. You can help by rating TV shows you've seen. Facts Status  Returning Series Network Certification  - Type  Scripted Original Language  Finnish Runtime  58m Homepage   http://yle.fi/aihe/docventures Genres Documentary Keywords No keywords have been added. Content Score 56 We're so close, yet so far. Top Contributors 47 Patrik Selin 2 aniemia JK 1 Josep K. Prangkie  View Edit History Popularity Trend  Login to edit  URL By  signing up  for an account on TMDb, you can post directly to Twitter and Facebook. You need to be logged in to continue. Click  here  to login or  here  to sign up.    page_wrap opened in html_head  Join the Community The Basics About TMDb Contact Us Support Forums API Blog Get Involved  Contribution Bible 3rd Party Applications Add New Movie Add New TV Show Community Guidelines Leaderboard Forums Twitter Facebook Legal Terms of Use Privacy Policy Login Sign Up"
}