{
  "link": "https://www.themoviedb.org/tv/68302?language=en",
  "title": "Crazyhead",
  "resume": "Amy and Raquel attempt to navigate their way through the choppy waters of their early twenties whilst simultaneously kicking the ass of some seriously gnarly demons. What could possibly go wrong?",
  "rate": "",
  "genre": [
    "Comedy"
  ],
  "cast": {
    "actor": [
      "Cara Theobold",
      "Susan Wokoma",
      "Arinz\u00e9 Kene",
      "Lewis Reeves",
      "Riann Steele"
    ]
  },
  "characters": {
    "characters": [
      "Amy",
      "Raquel",
      "Tyler",
      "Jake",
      "Suzanne"
    ]
  },
  "site_data": "html Apps Forums Leaderboard Contribute API Support Discover Movies TV Shows Movies Popular Top Rated Upcoming Now Playing TV Shows Popular Top Rated On TV Airing Today People Popular People Can't find a movie or TV show? Login to create it. en Login Sign Up  ID: 68302   Expand Crazyhead   (2016) User Score  Play Trailer Overview Amy and Raquel attempt to navigate their way through the choppy waters of their early twenties whilst simultaneously kicking the ass of some seriously gnarly demons. What could possibly go wrong? Featured Crew Howard Overman Creator Discussions   Reviews Videos   Images   Changes Report Share Discussions General  1 Content Issues  0 Images Backdrops  3 Posters  2 Videos Trailers  1 Teasers  0 Clips  0 Featurettes  0 Opening Credits  0 Top Billed Cast Cara Theobold Amy Susan Wokoma Raquel Arinz\u00e9 Kene Tyler Lewis Reeves Jake Riann Steele Suzanne Full Cast & Crew Last Season Season 1 2016 | 6 Episodes Season 1 of Crazyhead premiered on October 19, 2016. View All Seasons Social Reviews  0 Discussions  1 Subject Status Replies Last Reply Series 1 ending (spoilers) Open 0 by MirrorMask\n      \n     Go to Discussions Media Most Popular Videos  1 Backdrops  3 Posters  2 Recommendations   2012-10-29 Wizards vs Aliens 6.7    2014-10-06 Strange Empire 6.2    2015-09-02 Atelier 7.2    2002-08-07 La familia P. Luche 6.8    2016-06-02 Hibana: Spark 7.8    2013-05-03 Maron 6.9    2017-12-22 The Toys That Made Us 7.5    2014-09-30 Happyland 3.3  Facts Status  Returning Series Network Certification  - Type  Scripted Original Language  English Runtime  43m Homepage   http://www.channel4.com/programmes/crazyhead Genres Comedy Keywords No keywords have been added. Content Score 100 Yes! Looking good! Top Contributors 14 Elizabeth Jennings s 7 sindirahardian 7 Warpath s 4 sheva_vitali  View Edit History Popularity Trend  Login to edit  URL By  signing up  for an account on TMDb, you can post directly to Twitter and Facebook. You need to be logged in to continue. Click  here  to login or  here  to sign up.    page_wrap opened in html_head  Join the Community The Basics About TMDb Contact Us Support Forums API Blog Get Involved  Contribution Bible 3rd Party Applications Add New Movie Add New TV Show Community Guidelines Leaderboard Forums Twitter Facebook Legal Terms of Use Privacy Policy Login Sign Up"
}