{
  "link": "https://www.themoviedb.org/tv/68739?language=en",
  "title": "Game Two",
  "resume": "We don't have an overview translated in English. Help us expand our database by adding one.",
  "rate": "90.0",
  "genre": [
    "Documentary",
    "Comedy"
  ],
  "cast": [
    "Ingo Me\u00df",
    "Etienne Gard\u00e9",
    "Nils Bomhoff",
    "Daniel Budiman",
    "Simon Kr\u00e4tschmer"
  ],
  "character": [
    "Offvoice",
    "Himself / Host",
    "Himself / Host",
    "Himself / Host",
    "Himself /Host"
  ],
  "site_data": "html Apps Forums Leaderboard Contribute API Support Discover Movies TV Shows Movies Popular Top Rated Upcoming Now Playing TV Shows Popular Top Rated On TV Airing Today People Popular People Can't find a movie or TV show? Login to create it. en Login Sign Up  ID: 68739   Expand Game Two   (2016) User Score Overview We don't have an overview translated in English. Help us expand our database by adding one. Featured Crew Simon Kr\u00e4tschmer Creator Daniel Budiman Creator Discussions   Reviews Videos   Images   Changes Report Share Discussions General  0 Content Issues  0 Images Backdrops  1 Posters  1 Videos Trailers  0 Teasers  0 Clips  0 Featurettes  0 Opening Credits  0 Top Billed Cast Ingo Me\u00df Offvoice Etienne Gard\u00e9 Himself / Host Nils Bomhoff Himself / Host Daniel Budiman Himself / Host Simon Kr\u00e4tschmer Himself /Host Full Cast & Crew Current Season Season 4 2018 | 1 Episode Season 4 of Game Two premiered on January 12, 2018. View All Seasons Social Reviews  0 Discussions  0 Media Most Popular Videos  0 Backdrops  1 Posters  1 Recommendations We don't have enough data to suggest any TV shows based on Game Two. You can help by rating TV shows you've seen. Facts Status  In Production Network Certification 12 Meaning The broadcaster must take the decision about the air time by taking in consideration the impact on young children in the timeframe from 6:00am to 8:00pm. Type  Talk Show Original Language  German Runtime  45m, 30m Homepage   https://www.youtube.com/channel/UCFBapHA35loZ3KZwT_z3BsQ Genres Documentary Comedy Keywords video game games Content Score 93 Almost there... Top Contributors 83 tobim91 5 Elizabeth Jennings TB 1 TMDb Bot k 1 kingmarv  View Edit History Popularity Trend  Login to edit  URL By  signing up  for an account on TMDb, you can post directly to Twitter and Facebook. You need to be logged in to continue. Click  here  to login or  here  to sign up.    page_wrap opened in html_head  Join the Community The Basics About TMDb Contact Us Support Forums API Blog Get Involved  Contribution Bible 3rd Party Applications Add New Movie Add New TV Show Community Guidelines Leaderboard Forums Twitter Facebook Legal Terms of Use Privacy Policy Login Sign Up"
}