{
  "link": "https://www.themoviedb.org/tv/33847?language=en",
  "title": "The Talk",
  "resume": "A panel of well-known news and entertainment personalities discussing current events, pop culture, contemporary issues, family, celebrity and the trending topics of the day.",
  "rate": "50.0",
  "genre": [
    "Talk"
  ],
  "cast": [
    "Julie Chen",
    "Sharon Osbourne",
    "Sara Gilbert"
  ],
  "character": [
    "Herself - Co-Hostess",
    "Herself - Host",
    "Herself - Co-Hostess"
  ],
  "site_data": "html Apps Forums Leaderboard Contribute API Support Discover Movies TV Shows Movies Popular Top Rated Upcoming Now Playing TV Shows Popular Top Rated On TV Airing Today People Popular People Can't find a movie or TV show? Login to create it. en Login Sign Up  ID: 33847   Expand The Talk   (2010) User Score Overview A panel of well-known news and entertainment personalities discussing current events, pop culture, contemporary issues, family, celebrity and the trending topics of the day. Featured Crew Sara Gilbert Creator Discussions   Reviews Videos   Images   Changes Report Share Discussions General  2 Content Issues  0 Images Backdrops  2 Posters  1 Videos Trailers  0 Teasers  0 Clips  0 Featurettes  0 Opening Credits  0 Top Billed Cast Julie Chen Herself - Co-Hostess Sharon Osbourne Herself - Host Sara Gilbert Herself - Co-Hostess Full Cast & Crew Last Season Season 6 2015 | 64 Episodes Season 6 of The Talk premiered on September 14, 2015. View All Seasons Social Reviews  0 Discussions  2 Subject Status Replies Last Reply \"Our Prayers were Answered\" Open 9 by  rmcrae The Cher question, If I Could Turn Back Time? Open 1 by  rmcrae Go to Discussions Media Most Popular Videos  0 Backdrops  2 Posters  1 Recommendations We don't have enough data to suggest any TV shows based on The Talk. You can help by rating TV shows you've seen. Facts Status  Returning Series Network Certification  - Type  Talk Show Original Language  English Runtime  60m Homepage   http://www.cbs.com/shows/the_talk/ Genres Talk Keywords talk show interview celebrity parenthood motherhood Content Score 64 We're so close, yet so far. Top Contributors R 20 Rebecca 5 Elizabeth Jennings TB 3 TMDb Bot 3 Banana  View Edit History Popularity Trend  Login to edit  URL By  signing up  for an account on TMDb, you can post directly to Twitter and Facebook. You need to be logged in to continue. Click  here  to login or  here  to sign up.    page_wrap opened in html_head  Join the Community The Basics About TMDb Contact Us Support Forums API Blog Get Involved  Contribution Bible 3rd Party Applications Add New Movie Add New TV Show Community Guidelines Leaderboard Forums Twitter Facebook Legal Terms of Use Privacy Policy Login Sign Up"
}