{
  "link": "https://www.themoviedb.org/tv/23027?language=en",
  "title": "Sherlock Holmes",
  "resume": "Sherlock Holmes is a series of Sherlock Holmes adaptations produced by British television company BBC between 1965 and 1968. This was the second screen adaption of Sherlock Holmes for BBC Television.",
  "rate": "",
  "genre": [
    "Mystery",
    "Crime",
    "Drama"
  ],
  "cast": {
    "actor": [
      "Peter Cushing",
      "Nigel Stock"
    ]
  },
  "characters": {
    "characters": [
      "Sherlock Holmes",
      "Dr. Watson"
    ]
  },
  "site_data": "html Apps Forums Leaderboard Contribute API Support Discover Movies TV Shows Movies Popular Top Rated Upcoming Now Playing TV Shows Popular Top Rated On TV Airing Today People Popular People Can't find a movie or TV show? Login to create it. en Login Sign Up  ID: 23027   Expand Sherlock Holmes   (1965) User Score Overview Sherlock Holmes is a series of Sherlock Holmes adaptations produced by British television company BBC between 1965 and 1968. This was the second screen adaption of Sherlock Holmes for BBC Television. Discussions   Reviews Videos   Images   Changes Report Share Discussions General  0 Content Issues  0 Images Backdrops  2 Posters  1 Videos Trailers  0 Teasers  0 Clips  0 Featurettes  0 Opening Credits  0 Top Billed Cast Peter Cushing Sherlock Holmes Nigel Stock Dr. Watson Full Cast & Crew Last Season Series 2 1968 | 16 Episodes Season 2 of Sherlock Holmes premiered on September  9, 1968. View All Seasons Social Reviews  0 Discussions  0 Media Most Popular Videos  0 Backdrops  2 Posters  1 Recommendations   1976-10-03 Quincy, M.E. 7.0  Facts Status  Ended Network Certification  - Type  Scripted Original Language  English Runtime  50m Homepage  - Genres Mystery Crime Drama Keywords sherlock holmes Content Score 56 We're so close, yet so far. Top Contributors 8 Steve R 6 Rebecca V 1 VMKOZAK  View Edit History Popularity Trend  Login to edit  URL By  signing up  for an account on TMDb, you can post directly to Twitter and Facebook. You need to be logged in to continue. Click  here  to login or  here  to sign up.    page_wrap opened in html_head  Join the Community The Basics About TMDb Contact Us Support Forums API Blog Get Involved  Contribution Bible 3rd Party Applications Add New Movie Add New TV Show Community Guidelines Leaderboard Forums Twitter Facebook Legal Terms of Use Privacy Policy Login Sign Up"
}