{
  "link": "https://www.themoviedb.org/tv/40050?language=en",
  "title": "Daniel Tiger's Neighborhood",
  "resume": "The life of 4-year-old Daniel Tiger and his friends as they learn fun and practical strategies and skills necessary for growing and learning.",
  "rate": "68.0",
  "genre": [
    "Animation",
    "Family",
    "Kids"
  ],
  "cast": [
    "Amariah Faulkner",
    "Addison Holley",
    "Heather Bambrick"
  ],
  "character": [
    "Katerina Kittycat (voice)",
    "Miss Elaina (voice)",
    "Mom Tiger (voice)"
  ],
  "site_data": "html Apps Forums Leaderboard Contribute API Support Discover Movies TV Shows Movies Popular Top Rated Upcoming Now Playing TV Shows Popular Top Rated On TV Airing Today People Popular People Can't find a movie or TV show? Login to create it. en Login Sign Up  ID: 40050   Expand Daniel Tiger's Neighborhood   (2012) User Score Overview The life of 4-year-old Daniel Tiger and his friends as they learn fun and practical strategies and skills necessary for growing and learning. Featured Crew Angela Santomero Creator Discussions   Reviews Videos   Images   Changes Report Share Discussions General  0 Content Issues  5 Images Backdrops  4 Posters  1 Videos Trailers  0 Teasers  0 Clips  0 Featurettes  0 Opening Credits  0 Top Billed Cast Amariah Faulkner Katerina Kittycat (voice) Addison Holley Miss Elaina (voice) Heather Bambrick Mom Tiger (voice) Full Cast & Crew Last Season Original Air Date Original Air Date DVDs (DVD) Amazon Order (Digital) Season 3 2016 | 44 Episodes Season 3 of Daniel Tiger's Neighborhood premiered on September  5, 2016. View All Seasons Social Reviews  0 Discussions  5 Subject Status Replies Last Reply There are no discussions for Daniel Tiger's Neighborhood. Login to be first! Go to Discussions Media Most Popular Videos  0 Backdrops  4 Posters  1 Recommendations We don't have enough data to suggest any TV shows based on Daniel Tiger's Neighborhood. You can help by rating TV shows you've seen. Facts Status  Returning Series Networks Certification TV-G Meaning Most parents would find this program suitable for all ages. Type  Scripted Original Language  English Runtime  28m Homepage   http://www.pbs.org/parents/daniel/ Genres Animation Family Kids Keywords tiger educational kids pre-school Content Score 64 We're so close, yet so far. Top Contributors 77 Banana d 16 dwkodi15 10 Elizabeth Jennings 9 Kris Ekman  View Edit History Popularity Trend  Login to edit  URL By  signing up  for an account on TMDb, you can post directly to Twitter and Facebook. You need to be logged in to continue. Click  here  to login or  here  to sign up.    page_wrap opened in html_head  Join the Community The Basics About TMDb Contact Us Support Forums API Blog Get Involved  Contribution Bible 3rd Party Applications Add New Movie Add New TV Show Community Guidelines Leaderboard Forums Twitter Facebook Legal Terms of Use Privacy Policy Login Sign Up"
}