{
  "link": "https://www.themoviedb.org/tv/69877?language=en",
  "title": "Madiba",
  "resume": "A dramatization of Nelson Mandela's struggle to overturn apartheid in South Africa.",
  "rate": "82.0",
  "genre": [
    "Drama"
  ],
  "cast": [
    "Laurence Fishburne",
    "Orlando Jones",
    "David Harewood",
    "Michael Nyqvist",
    "Terry Pheto"
  ],
  "character": [
    "Nelson Mandela",
    "Oliver Tambo",
    "Walter Sisulu",
    "H.F. Verwoerd",
    "Winnie Mandela"
  ],
  "site_data": "html Apps Forums Leaderboard Contribute API Support Discover Movies TV Shows Movies Popular Top Rated Upcoming Now Playing TV Shows Popular Top Rated On TV Airing Today People Popular People Can't find a movie or TV show? Login to create it. en Login Sign Up  ID: 69877   Expand Madiba   (2017) User Score  Play Trailer Overview A dramatization of Nelson Mandela's struggle to overturn apartheid in South Africa. Featured Crew Kevin Hooks Creator Discussions   Reviews Videos   Images   Changes Report Share Discussions General  0 Content Issues  0 Images Backdrops  3 Posters  1 Videos Trailers  1 Teasers  0 Clips  0 Featurettes  0 Opening Credits  0 Top Billed Cast Laurence Fishburne Nelson Mandela Orlando Jones Oliver Tambo David Harewood Walter Sisulu Michael Nyqvist H.F. Verwoerd Terry Pheto Winnie Mandela Full Cast & Crew Last Season Season 1 2017 | 3 Episodes Season 1 of Madiba premiered on February  1, 2017. View All Seasons Social Reviews  0 Discussions  0 Media Most Popular Videos  1 Backdrops  3 Posters  1 Recommendations We don't have enough data to suggest any TV shows based on Madiba. You can help by rating TV shows you've seen. Facts Status  Ended Network Certification TV-PG Meaning This program contains material that parents may find unsuitable for younger children. Type  Miniseries Original Language  English Runtime  80m Homepage   http://www.bet.com/shows/madiba.html Genres Drama Keywords south africa nelson mandela miniseries Content Score 100 Yes! Looking good! Top Contributors 26 Banana D 7 Derek.Jo.Lee88 M 3 Manu 3 Perilin  View Edit History Popularity Trend  Login to edit  URL By  signing up  for an account on TMDb, you can post directly to Twitter and Facebook. You need to be logged in to continue. Click  here  to login or  here  to sign up.    page_wrap opened in html_head  Join the Community The Basics About TMDb Contact Us Support Forums API Blog Get Involved  Contribution Bible 3rd Party Applications Add New Movie Add New TV Show Community Guidelines Leaderboard Forums Twitter Facebook Legal Terms of Use Privacy Policy Login Sign Up"
}