{
  "link": "https://www.themoviedb.org/tv/65836?language=en",
  "title": "The Aliens",
  "resume": "Nearly 40 years ago aliens crash-landed in the UK. They look like us, but are forced to live in a ghetto. Border control officer Lewis falls in love with one.",
  "rate": "",
  "genre": [
    "Comedy",
    "Drama",
    "Sci-Fi",
    "Fantasy"
  ],
  "cast": {
    "actor": [
      "Michael Socha",
      "Michaela Coel",
      "Jim Howick"
    ]
  },
  "characters": {
    "characters": [
      "Lewis",
      "Lilyhot",
      "Dominic"
    ]
  },
  "site_data": "html Apps Forums Leaderboard Contribute API Support Discover Movies TV Shows Movies Popular Top Rated Upcoming Now Playing TV Shows Popular Top Rated On TV Airing Today People Popular People Can't find a movie or TV show? Login to create it. en Login Sign Up  ID: 65836   Expand The Aliens   (2016) User Score Overview Nearly 40 years ago aliens crash-landed in the UK. They look like us, but are forced to live in a ghetto. Border control officer Lewis falls in love with one. Featured Crew Fintan Ryan Creator Discussions   Reviews Videos   Images   Changes Report Share Discussions General  0 Content Issues  0 Images Backdrops  4 Posters  3 Videos Trailers  0 Teasers  0 Clips  0 Featurettes  0 Opening Credits  0 Top Billed Cast Michael Socha Lewis Michaela Coel Lilyhot Jim Howick Dominic Full Cast & Crew Last Season Season 1 2016 | 6 Episodes Season 1 of The Aliens premiered on March  8, 2016. View All Seasons Social Reviews  0 Discussions  0 Media Most Popular Videos  0 Backdrops  4 Posters  3 Recommendations   2013-03-03 Red Widow 4.9    2008-02-07 Ashes to Ashes 7.9    2016-03-15 Crowded 6.4    2012-08-12 Animal Practice 4.7    2011-09-21 The Fades 7.0    2015-01-04 Galavant 6.9    2016-03-07 Damien 6.5    2005-09-19 Invasion 6.9  Facts Status  Cancelled Network Certification 15 Meaning No-one under 15 is allowed to see a 15 film at the cinema or buy/rent a 15 rated video. 15 rated works are not suitable for children under 15 years of age. Type  Scripted Original Language  English Runtime  45m Homepage   http://www.channel4.com/programmes/the-aliens Genres Comedy Drama Sci-Fi & Fantasy Keywords england dystopia alien drugs criminal xenophobia border control Content Score 71 Just a little bit more... Top Contributors 30 Banana z 24 zyck 20 Elizabeth Jennings 11 lol32lol  View Edit History Popularity Trend  Login to edit  URL By  signing up  for an account on TMDb, you can post directly to Twitter and Facebook. You need to be logged in to continue. Click  here  to login or  here  to sign up.    page_wrap opened in html_head  Join the Community The Basics About TMDb Contact Us Support Forums API Blog Get Involved  Contribution Bible 3rd Party Applications Add New Movie Add New TV Show Community Guidelines Leaderboard Forums Twitter Facebook Legal Terms of Use Privacy Policy Login Sign Up"
}