{
  "link": "https://www.themoviedb.org/tv/67795?language=en",
  "title": "Rapl",
  "resume": "We don't have an overview translated in English. Help us expand our database by adding one.",
  "rate": "",
  "genre": [
    "Drama",
    "Crime"
  ],
  "cast": {
    "actor": [
      "Hynek \u010cerm\u00e1k",
      "Alexej Py\u0161ko",
      "Luk\u00e1\u0161 P\u0159\u00edkazk\u00fd",
      "Lucie \u017d\u00e1\u010dkov\u00e1",
      "Jan Dolansk\u00fd"
    ]
  },
  "characters": {
    "characters": [
      "major Kune\u0161",
      "podplukovn\u00edk Rohan",
      "nadporu\u010d\u00edk Lup\u00ednek",
      "poru\u010d\u00edk Slepi\u010dkov\u00e1",
      "kapit\u00e1n Gregor"
    ]
  },
  "site_data": "html Apps Forums Leaderboard Contribute API Support Discover Movies TV Shows Movies Popular Top Rated Upcoming Now Playing TV Shows Popular Top Rated On TV Airing Today People Popular People Can't find a movie or TV show? Login to create it. en Login Sign Up  ID: 67795   Expand Rapl   (2016) User Score Overview We don't have an overview translated in English. Help us expand our database by adding one. Featured Crew Jan Pachl Creator Discussions   Reviews Videos   Images   Changes Report Share Discussions General  0 Content Issues  0 Images Backdrops  3 Posters  1 Videos Trailers  0 Teasers  0 Clips  0 Featurettes  0 Opening Credits  0 Top Billed Cast Hynek \u010cerm\u00e1k major Kune\u0161 Alexej Py\u0161ko podplukovn\u00edk Rohan Luk\u00e1\u0161 P\u0159\u00edkazk\u00fd nadporu\u010d\u00edk Lup\u00ednek Lucie \u017d\u00e1\u010dkov\u00e1 poru\u010d\u00edk Slepi\u010dkov\u00e1 Jan Dolansk\u00fd kapit\u00e1n Gregor Full Cast & Crew Last Season Season 1 2016 | 13 Episodes Season 1 of Rapl premiered on August 29, 2016. View All Seasons Social Reviews  0 Discussions  0 Media Most Popular Videos  0 Backdrops  3 Posters  1 Recommendations We don't have enough data to suggest any TV shows based on Rapl. You can help by rating TV shows you've seen. Facts Status  Returning Series Network Certification  - Type  Scripted Original Language  Czech Runtime  60m Homepage   http://www.ceskatelevize.cz/porady/10936283306-rapl/ Genres Drama Crime Keywords No keywords have been added. Content Score 93 Almost there... Top Contributors b 45 benq 5 1 5lucina5 j 1 jonesirenej  View Edit History Popularity Trend  Login to edit  URL By  signing up  for an account on TMDb, you can post directly to Twitter and Facebook. You need to be logged in to continue. Click  here  to login or  here  to sign up.    page_wrap opened in html_head  Join the Community The Basics About TMDb Contact Us Support Forums API Blog Get Involved  Contribution Bible 3rd Party Applications Add New Movie Add New TV Show Community Guidelines Leaderboard Forums Twitter Facebook Legal Terms of Use Privacy Policy Login Sign Up"
}