{
  "link": "https://www.themoviedb.org/tv/68882?language=en",
  "title": "Love is Drop By Drop",
  "resume": "Eun Bang Wool falls in love with Park Woo Hyuk who received a heart transplant from her ex-boyfriend.",
  "rate": "",
  "genre": [
    "Family",
    "Drama"
  ],
  "cast": {
    "actor": [
      "Wang Ji-hye",
      "Kang Eun-Tak",
      "Gong Hyun-joo",
      "Kim Min-Soo",
      "Kang Dong-ho"
    ]
  },
  "characters": {
    "characters": [
      "Eun Bang Wool",
      "Park Woo Hyuk",
      "Han Chae Rin",
      "Kang Sang Chul",
      "Yoon Dong Jun"
    ]
  },
  "site_data": "html Apps Forums Leaderboard Contribute API Support Discover Movies TV Shows Movies Popular Top Rated Upcoming Now Playing TV Shows Popular Top Rated On TV Airing Today People Popular People Can't find a movie or TV show? Login to create it. en Login Sign Up  ID: 68882   Expand Love is Drop By Drop   (2016) User Score Overview Eun Bang Wool falls in love with Park Woo Hyuk who received a heart transplant from her ex-boyfriend. Discussions   Reviews Videos   Images   Changes Report Share Discussions General  0 Content Issues  0 Images Backdrops  2 Posters  1 Videos Trailers  0 Teasers  0 Clips  0 Featurettes  0 Opening Credits  0 Top Billed Cast Wang Ji-hye Eun Bang Wool Kang Eun-Tak Park Woo Hyuk Gong Hyun-joo Han Chae Rin Kim Min-Soo Kang Sang Chul Kang Dong-ho Yoon Dong Jun Full Cast & Crew Last Season Season 1 2016 | 120 Episodes Season 1 of Love is Drop By Drop premiered on November 28, 2016. View All Seasons Social Reviews  0 Discussions  0 Media Most Popular Videos  0 Backdrops  2 Posters  1 Recommendations We don't have enough data to suggest any TV shows based on Love is Drop By Drop. You can help by rating TV shows you've seen. Facts Original Name  \uc0ac\ub791\uc740 \ubc29\uc6b8\ubc29\uc6b8 Status  Ended Network Certification  - Type  Scripted Original Language  Korean Runtime  35m Homepage   http://tv.sbs.co.kr/bangwool Genres Family Drama Keywords romance korea Content Score 86 Almost there... Top Contributors M 24 Maria180493 10 mp4soju L 3 LucileMusique n 2 nubie  View Edit History Popularity Trend  Login to edit  URL By  signing up  for an account on TMDb, you can post directly to Twitter and Facebook. You need to be logged in to continue. Click  here  to login or  here  to sign up.    page_wrap opened in html_head  Join the Community The Basics About TMDb Contact Us Support Forums API Blog Get Involved  Contribution Bible 3rd Party Applications Add New Movie Add New TV Show Community Guidelines Leaderboard Forums Twitter Facebook Legal Terms of Use Privacy Policy Login Sign Up"
}