{
  "link": "https://www.themoviedb.org/tv/65016?language=en",
  "title": "Descendants: Wicked World",
  "resume": "Descendants: Wicked World is an animated series based upon and following the Disney Channel Original Movie Descendants.",
  "rate": "",
  "genre": [
    "Animation",
    "Comedy",
    "Family"
  ],
  "cast": {
    "actor": [
      "Dove Cameron",
      "Sarah Jeffery",
      "Sofia Carson",
      "China Anne McClain",
      "Mitchell Hope"
    ]
  },
  "characters": {
    "characters": [
      "Mal (voice)",
      "Princess Audrey (voice)",
      "Evie / Evil Queen (voice)",
      "Freddie (voice)",
      "King Ben / Ben"
    ]
  },
  "site_data": "html Apps Forums Leaderboard Contribute API Support Discover Movies TV Shows Movies Popular Top Rated Upcoming Now Playing TV Shows Popular Top Rated On TV Airing Today People Popular People Can't find a movie or TV show? Login to create it. en Login Sign Up  ID: 65016   Expand Descendants: Wicked World   (2015) User Score Overview Descendants: Wicked World is an animated series based upon and following the Disney Channel Original Movie Descendants. Discussions   Reviews Videos   Images   Changes Report Share Discussions General  0 Content Issues  0 Images Backdrops  0 Posters  1 Videos Trailers  0 Teasers  0 Clips  0 Featurettes  0 Opening Credits  0 Top Billed Cast Dove Cameron Mal (voice) Sarah Jeffery Princess Audrey (voice) Sofia Carson Evie / Evil Queen (voice) China Anne McClain Freddie (voice) Mitchell Hope King Ben / Ben Full Cast & Crew Last Season Season 2 2016 | 15 Episodes Season 2 of Descendants: Wicked World premiered on October 21, 2016. View All Seasons Social Reviews  0 Discussions  0 Media Most Popular Videos  0 Backdrops  0 Posters  1 Recommendations We don't have enough data to suggest any TV shows based on Descendants: Wicked World. You can help by rating TV shows you've seen. Facts Status  Returning Series Network Certification  - Type  Scripted Original Language  English Runtime  2m Homepage   http://disneychannel.disney.com/descendants Genres Animation Comedy Family Keywords animation based on movie short episodes Content Score 71 Just a little bit more... Top Contributors R 38 Rebecca 8 Marr \ud83c\uddf3\ud83c\uddf1 S 5 Skyfall2012 4 Michael  View Edit History Popularity Trend  Login to edit  URL By  signing up  for an account on TMDb, you can post directly to Twitter and Facebook. You need to be logged in to continue. Click  here  to login or  here  to sign up.    page_wrap opened in html_head  Join the Community The Basics About TMDb Contact Us Support Forums API Blog Get Involved  Contribution Bible 3rd Party Applications Add New Movie Add New TV Show Community Guidelines Leaderboard Forums Twitter Facebook Legal Terms of Use Privacy Policy Login Sign Up"
}