{
  "link": "https://www.themoviedb.org/tv/62621?language=en",
  "title": "Familie Kruys",
  "resume": "Three different, but related families face trials and tribulations in their own uniquely comedic ways.",
  "rate": "0.0",
  "genre": [
    "Comedy"
  ],
  "cast": [
    "Hans Dagelet",
    "Elise Schaap",
    "Frederik Brom",
    "Rop Verheijen",
    "Linda de Mol"
  ],
  "character": [
    "Thomas Kruys",
    "Ruxandra Kruys-Iliescu",
    "Morten Wijdeveld",
    "Kirk Kruys",
    "Bette Kruys"
  ],
  "site_data": "html Apps Forums Leaderboard Contribute API Support Discover Movies TV Shows Movies Popular Top Rated Upcoming Now Playing TV Shows Popular Top Rated On TV Airing Today People Popular People Can't find a movie or TV show? Login to create it. en Login Sign Up  ID: 62621   Expand Familie Kruys   (2015) User Score Overview Three different, but related families face trials and tribulations in their own uniquely comedic ways. Featured Crew Linda de Mol Creator Discussions   Reviews Videos   Images   Changes Report Share Discussions General  0 Content Issues  0 Images Backdrops  2 Posters  2 Videos Trailers  0 Teasers  0 Clips  0 Featurettes  0 Opening Credits  0 Top Billed Cast Hans Dagelet Thomas Kruys Elise Schaap Ruxandra Kruys-Iliescu Frederik Brom Morten Wijdeveld Rop Verheijen Kirk Kruys Linda de Mol Bette Kruys Full Cast & Crew Last Season Season 3 2017 | 8 Episodes Season 3 of Familie Kruys premiered on March 12, 2017. View All Seasons Social Reviews  0 Discussions  0 Media Most Popular Videos  0 Backdrops  2 Posters  2 Recommendations We don't have enough data to suggest any TV shows based on Familie Kruys. You can help by rating TV shows you've seen. Facts Status  Returning Series Network Certification  - Type  Scripted Original Language  Dutch; Flemish Runtime  40m Homepage   http://www.rtl.nl/familie-kruys Genres Comedy Keywords No keywords have been added. Content Score 93 Almost there... Top Contributors BH 17 Barkruk Henkie 15 Elizabeth Jennings a 13 andre.meulemans 4 sissing  View Edit History Popularity Trend  Login to edit  URL By  signing up  for an account on TMDb, you can post directly to Twitter and Facebook. You need to be logged in to continue. Click  here  to login or  here  to sign up.    page_wrap opened in html_head  Join the Community The Basics About TMDb Contact Us Support Forums API Blog Get Involved  Contribution Bible 3rd Party Applications Add New Movie Add New TV Show Community Guidelines Leaderboard Forums Twitter Facebook Legal Terms of Use Privacy Policy Login Sign Up"
}