{
  "link": "https://www.themoviedb.org/tv/80164?language=en",
  "title": "Kalbimin Sultani",
  "resume": "Mahmud brings Anna to his palace to teach his children French. The Russian ambassador also sends him there with the pressure to 'spy on his country'.",
  "rate": "0.0",
  "genre": [
    "Comedy"
  ],
  "cast": [
    "Taner Rumeli",
    "Ali Ersan Duru",
    "Aleksandra Nikiforova",
    "Gizem Denizci",
    "It\u0131r Esen"
  ],
  "character": [
    "Musa A\u011fa",
    "Mahmut",
    "Anna",
    "Saliha",
    "Ay\u015fe Sine Perver Sultan"
  ],
  "site_data": "html Apps Forums Leaderboard Contribute API Support Discover Movies TV Shows Movies Popular Top Rated Upcoming Now Playing TV Shows Popular Top Rated On TV Airing Today People Popular People Can't find a movie or TV show? Login to create it. en Login Sign Up  ID: 80164   Expand Kalbimin Sultani   (2018) User Score Overview Mahmud brings Anna to his palace to teach his children French. The Russian ambassador also sends him there with the pressure to 'spy on his country'. Featured Crew Kerem \u00c7ak\u0131ro\u011flu Creator Discussions   Reviews Videos   Images   Changes Report Share Discussions General  0 Content Issues  0 Images Backdrops  1 Posters  1 Videos Trailers  0 Teasers  0 Clips  0 Featurettes  0 Opening Credits  0 Top Billed Cast Taner Rumeli Musa A\u011fa Ali Ersan Duru Mahmut Aleksandra Nikiforova Anna Gizem Denizci Saliha It\u0131r Esen Ay\u015fe Sine Perver Sultan Full Cast & Crew Current Season Season 1 2018 | 0 Episodes Season 1 of Kalbimin Sultani premiered on June 14, 2018. View All Seasons Social Reviews  0 Discussions  0 Media Most Popular Videos  0 Backdrops  1 Posters  1 Recommendations We don't have enough data to suggest any TV shows based on Kalbimin Sultani. You can help by rating TV shows you've seen. Facts Original Name  Kalbimin Sultan\u0131 Status  Returning Series Network Certification  - Type  Scripted Original Language  Turkish Runtime  120m Homepage  - Genres Comedy Keywords No keywords have been added. Content Score 93 Almost there... Top Contributors 29 mfteam  View Edit History Popularity Trend  Login to edit  URL By  signing up  for an account on TMDb, you can post directly to Twitter and Facebook. You need to be logged in to continue. Click  here  to login or  here  to sign up.    page_wrap opened in html_head  Join the Community The Basics About TMDb Contact Us Support Forums API Blog Get Involved  Contribution Bible 3rd Party Applications Add New Movie Add New TV Show Community Guidelines Leaderboard Forums Twitter Facebook Legal Terms of Use Privacy Policy Login Sign Up"
}