{
  "link": "https://www.themoviedb.org/tv/46976?language=en",
  "title": "Hitler: The Rise of Evil",
  "resume": "This biopic profiles history's most spectacular madman, tracing his journey from humble roots to complete mastery of Germany.",
  "rate": "66.0",
  "genre": [
    "Drama",
    "War",
    "Politics"
  ],
  "cast": [
    "Zoe Telford",
    "Justin Salinger",
    "James Babson",
    "Terence Harvey",
    "Jena Malone"
  ],
  "character": [
    "Eva Braun",
    "Dr. Joseph Goebbels",
    "Rudolf Hess",
    "Gustav von Kahr",
    "Geli Raubal"
  ],
  "site_data": "html Apps Forums Leaderboard Contribute API Support Discover Movies TV Shows Movies Popular Top Rated Upcoming Now Playing TV Shows Popular Top Rated On TV Airing Today People Popular People Can't find a movie or TV show? Login to create it. en Login Sign Up  ID: 46976   Expand Hitler: The Rise of Evil   (2003) User Score  Play Trailer Overview This biopic profiles history's most spectacular madman, tracing his journey from humble roots to complete mastery of Germany. Featured Crew John Ryan Creator Ed Gernon Creator Peter Sussman Creator Discussions   Reviews Videos   Images   Changes Report Share Discussions General  0 Content Issues  1 Images Backdrops  7 Posters  12 Videos Trailers  1 Teasers  0 Clips  0 Featurettes  0 Opening Credits  0 Top Billed Cast Zoe Telford Eva Braun Justin Salinger Dr. Joseph Goebbels James Babson Rudolf Hess Terence Harvey Gustav von Kahr Jena Malone Geli Raubal Full Cast & Crew Last Season Season 1 2003 | 2 Episodes Season 1 of Hitler: The Rise of Evil premiered on May 18, 2003. View All Seasons Social Reviews  0 Discussions  1 Subject Status Replies Last Reply There are no discussions for Hitler: The Rise of Evil. Login to be first! Go to Discussions Media Most Popular Videos  1 Backdrops  7 Posters  12 Recommendations   1987-04-06 Biography 7.5    Ewoks: The Battle for Endor 5.1    2005-07-04 The Jeremy Kyle Show 6.3    2005-09-24 Afterlife 7.1    1990-09-10 The Fresh Prince of Bel-Air 7.3    1983-01-10 Fraggle Rock 7.7    1979-03-24 Tales of the Unexpected 6.8    1973-02-15 Some Mothers Do 'Ave 'Em 7.8  Facts Status  Ended Network Certification 12 Meaning The broadcaster must take the decision about the air time by taking in consideration the impact on young children in the timeframe from 6:00am to 8:00pm. Type  Miniseries Original Language  English Runtime  88m Homepage  - Genres Drama War & Politics Keywords nazi world war ii biography hitler Content Score 100 Yes! Looking good! Top Contributors TB 22 TMDb Bot 20 Marr \ud83c\uddf3\ud83c\uddf1 s 10 symo78 WB 9 Wagner B. Azevedo  View Edit History Popularity Trend  Login to edit  URL By  signing up  for an account on TMDb, you can post directly to Twitter and Facebook. You need to be logged in to continue. Click  here  to login or  here  to sign up.    page_wrap opened in html_head  Join the Community The Basics About TMDb Contact Us Support Forums API Blog Get Involved  Contribution Bible 3rd Party Applications Add New Movie Add New TV Show Community Guidelines Leaderboard Forums Twitter Facebook Legal Terms of Use Privacy Policy Login Sign Up"
}