{
  "link": "https://www.themoviedb.org/tv/40753?language=en",
  "title": "Die Rettungsflieger",
  "resume": "Die Rettungsflieger is a German television series.",
  "rate": "",
  "genre": [
    "Drama"
  ],
  "cast": {
    "actor": [
      "Oliver H\u00f6rner",
      "Nicolas K\u00f6nig",
      "Marlene Marlow",
      "Patrick Wolff"
    ]
  },
  "characters": {
    "characters": [
      "Hauptfeldwebel Jan Wollcke",
      "Hauptmann Jens Blank",
      "Oberstabsarzt Dr. Sabine Petersen",
      "Oberfeldwebel Jonny von Storkow"
    ]
  },
  "site_data": "html Apps Forums Leaderboard Contribute API Support Discover Movies TV Shows Movies Popular Top Rated Upcoming Now Playing TV Shows Popular Top Rated On TV Airing Today People Popular People Can't find a movie or TV show? Login to create it. en Login Sign Up  ID: 40753   Expand Die Rettungsflieger   (1997) User Score Overview Die Rettungsflieger is a German television series. Discussions   Reviews Videos   Images   Changes Report Share Discussions General  0 Content Issues  0 Images Backdrops  1 Posters  1 Videos Trailers  0 Teasers  0 Clips  0 Featurettes  0 Opening Credits  0 Top Billed Cast Oliver H\u00f6rner Hauptfeldwebel Jan Wollcke Nicolas K\u00f6nig Hauptmann Jens Blank Marlene Marlow Oberstabsarzt Dr. Sabine Petersen Patrick Wolff Oberfeldwebel Jonny von Storkow Full Cast & Crew Last Season Season 11 2007 | 13 Episodes Season 11 of Die Rettungsflieger premiered on April 11, 2007. View All Seasons Social Reviews  0 Discussions  0 Media Most Popular Videos  0 Backdrops  1 Posters  1 Recommendations We don't have enough data to suggest any TV shows based on Die Rettungsflieger. You can help by rating TV shows you've seen. Facts Status  Ended Network Certification  - Type  Scripted Original Language  German Runtime  45m Homepage  - Genres Drama Keywords No keywords have been added. Content Score 86 Almost there... Top Contributors S 182 Samara c 2 castacasta 1 lineker  View Edit History Popularity Trend  Login to edit  URL By  signing up  for an account on TMDb, you can post directly to Twitter and Facebook. You need to be logged in to continue. Click  here  to login or  here  to sign up.    page_wrap opened in html_head  Join the Community The Basics About TMDb Contact Us Support Forums API Blog Get Involved  Contribution Bible 3rd Party Applications Add New Movie Add New TV Show Community Guidelines Leaderboard Forums Twitter Facebook Legal Terms of Use Privacy Policy Login Sign Up"
}