{
  "link": "https://www.themoviedb.org/tv/76542?language=en",
  "title": "Jet Sosyete",
  "resume": "The story of a middle class family jumps in the high society unexpected.",
  "rate": "",
  "genre": [
    "Comedy"
  ],
  "cast": {
    "actor": [
      "Caglar Corumlu",
      "Derya Karada\u015f",
      "Cengiz Bozkurt",
      "G\u00fclse Birsel",
      "Sarp Apak"
    ]
  },
  "characters": {
    "characters": [
      "Ya\u015far Y\u00fcksel",
      "Safiye Y\u00fcksel",
      "Cengiz \u00d6zpamuk",
      "Gizem \u00d6zpamuk",
      "Ozan \u00d6zpamuk"
    ]
  },
  "site_data": "html Apps Forums Leaderboard Contribute API Support Discover Movies TV Shows Movies Popular Top Rated Upcoming Now Playing TV Shows Popular Top Rated On TV Airing Today People Popular People Can't find a movie or TV show? Login to create it. en Login Sign Up  ID: 76542   Expand Jet Sosyete   (2018) User Score Overview The story of a middle class family jumps in the high society unexpected. Featured Crew G\u00fclse Birsel Creator Discussions   Reviews Videos   Images   Changes Report Share Discussions General  0 Content Issues  0 Images Backdrops  3 Posters  2 Videos Trailers  0 Teasers  0 Clips  0 Featurettes  0 Opening Credits  0 Top Billed Cast Caglar Corumlu Ya\u015far Y\u00fcksel Derya Karada\u015f Safiye Y\u00fcksel Cengiz Bozkurt Cengiz \u00d6zpamuk G\u00fclse Birsel Gizem \u00d6zpamuk Sarp Apak Ozan \u00d6zpamuk Full Cast & Crew Current Season Season 1 2018 | 15 Episodes View All Seasons Social Reviews  0 Discussions  0 Media Most Popular Videos  0 Backdrops  3 Posters  2 Recommendations We don't have enough data to suggest any TV shows based on Jet Sosyete. You can help by rating TV shows you've seen. Facts Status  Returning Series Network Certification  - Type  Scripted Original Language  Turkish Runtime  110m Homepage   https://www.startv.com.tr/dizi/jet-sosyete Genres Comedy Keywords No keywords have been added. Content Score 100 Yes! Looking good! Top Contributors 83 purplelammashta 9 sinefil 3 areels 3 Elizabeth Jennings  View Edit History Popularity Trend  Login to edit  URL By  signing up  for an account on TMDb, you can post directly to Twitter and Facebook. You need to be logged in to continue. Click  here  to login or  here  to sign up.    page_wrap opened in html_head  Join the Community The Basics About TMDb Contact Us Support Forums API Blog Get Involved  Contribution Bible 3rd Party Applications Add New Movie Add New TV Show Community Guidelines Leaderboard Forums Twitter Facebook Legal Terms of Use Privacy Policy Login Sign Up"
}