{
  "link": "https://www.themoviedb.org/tv/64368?language=en",
  "title": "Sherlock Holmes",
  "resume": "A Russian crime drama series, based on the Sherlock Holmes detective stories by Sir Arthur Conan Doyle.",
  "rate": "73.0",
  "genre": [
    "Crime",
    "Adventure",
    "Thriller",
    "Action",
    "Adventure"
  ],
  "cast": [
    "Igor Petrenko",
    "Andrei Panin",
    "Mikhail Boyarskiy",
    "Ingeborga Dapk\u016bnait\u0117"
  ],
  "character": [
    "\u0428\u0435\u0440\u043b\u043e\u043a \u0425\u043e\u043b\u043c\u0441",
    "\u0434\u043e\u043a\u0442\u043e\u0440 \u0412\u0430\u0442\u0441\u043e\u043d",
    "\u0418\u043d\u0441\u043f\u0435\u043a\u0442\u043e\u0440 \u041b\u0435\u0441\u0442\u0440\u0435\u0439\u0434",
    "\u043c\u0438\u0441\u0441\u0438\u0441 \u0425\u0430\u0434\u0441\u043e\u043d"
  ],
  "site_data": "html Apps Forums Leaderboard Contribute API Support Discover Movies TV Shows Movies Popular Top Rated Upcoming Now Playing TV Shows Popular Top Rated On TV Airing Today People Popular People Can't find a movie or TV show? Login to create it. en Login Sign Up  ID: 64368   Expand Sherlock Holmes   (2013) User Score Overview A Russian crime drama series, based on the Sherlock Holmes detective stories by Sir Arthur Conan Doyle. Featured Crew Andrei Kavun Creator Arthur Conan Doyle Creator Discussions   Reviews Videos   Images   Changes Report Share Discussions General  0 Content Issues  0 Images Backdrops  1 Posters  2 Videos Trailers  0 Teasers  0 Clips  0 Featurettes  0 Opening Credits  0 Top Billed Cast Igor Petrenko \u0428\u0435\u0440\u043b\u043e\u043a \u0425\u043e\u043b\u043c\u0441 Andrei Panin \u0434\u043e\u043a\u0442\u043e\u0440 \u0412\u0430\u0442\u0441\u043e\u043d Mikhail Boyarskiy \u0418\u043d\u0441\u043f\u0435\u043a\u0442\u043e\u0440 \u041b\u0435\u0441\u0442\u0440\u0435\u0439\u0434 Ingeborga Dapk\u016bnait\u0117 \u043c\u0438\u0441\u0441\u0438\u0441 \u0425\u0430\u0434\u0441\u043e\u043d Full Cast & Crew Last Season Season 1 2013 | 16 Episodes Season 1 of Sherlock Holmes premiered on November 18, 2013. View All Seasons Social Reviews  0 Discussions  0 Media Most Popular Videos  0 Backdrops  1 Posters  2 Recommendations We don't have enough data to suggest any TV shows based on Sherlock Holmes. You can help by rating TV shows you've seen. Facts Original Name  \u0428\u0435\u0440\u043b\u043e\u043a \u0425\u043e\u043b\u043c\u0441 Status  Ended Network Certification  - Type  Scripted Original Language  Russian Runtime  50m Homepage  - Genres Crime Adventure Thriller Action & Adventure Keywords No keywords have been added. Content Score 93 Almost there... Top Contributors S 23 Sergey n 12 navarro2018 z 10 zurman1 7 Elizabeth Jennings  View Edit History Popularity Trend  Login to edit  URL By  signing up  for an account on TMDb, you can post directly to Twitter and Facebook. You need to be logged in to continue. Click  here  to login or  here  to sign up.    page_wrap opened in html_head  Join the Community The Basics About TMDb Contact Us Support Forums API Blog Get Involved  Contribution Bible 3rd Party Applications Add New Movie Add New TV Show Community Guidelines Leaderboard Forums Twitter Facebook Legal Terms of Use Privacy Policy Login Sign Up"
}