{
  "link": "https://www.themoviedb.org/tv/71624?language=en",
  "title": "Fallet",
  "resume": "British and Swedish police join forces to solve a case.",
  "rate": "",
  "genre": [
    "Drama",
    "Crime",
    "Comedy"
  ],
  "cast": {
    "actor": [
      "Adam Godley",
      "Lisa Henni",
      "Lia Boysen",
      "Bj\u00f6rn Granath",
      "Erik Madsen"
    ]
  },
  "characters": {
    "characters": [
      "Tom Brown",
      "Sophie Borg",
      "Kristina von Borg",
      "Arne Arnesen",
      "Colin Smith"
    ]
  },
  "site_data": "html Apps Forums Leaderboard Contribute API Support Discover Movies TV Shows Movies Popular Top Rated Upcoming Now Playing TV Shows Popular Top Rated On TV Airing Today People Popular People Can't find a movie or TV show? Login to create it. en Login Sign Up  ID: 71624   Expand Fallet   (2017) User Score  Play Trailer Overview British and Swedish police join forces to solve a case. Discussions   Reviews Videos   Images   Changes Report Share Discussions General  0 Content Issues  0 Images Backdrops  1 Posters  1 Videos Trailers  1 Teasers  0 Clips  0 Featurettes  0 Opening Credits  0 Top Billed Cast Adam Godley Tom Brown Lisa Henni Sophie Borg Lia Boysen Kristina von Borg Bj\u00f6rn Granath Arne Arnesen Erik Madsen Colin Smith Full Cast & Crew Last Season Season 1 2017 | 8 Episodes Season 1 of Fallet premiered on April  7, 2017. View All Seasons Social Reviews  0 Discussions  0 Media Most Popular Videos  1 Backdrops  1 Posters  1 Recommendations We don't have enough data to suggest any TV shows based on Fallet. You can help by rating TV shows you've seen. Facts Status  Returning Series Network Certification  - Type  Scripted Original Language  Swedish Runtime  28m Homepage   https://www.svt.se/fallet/ Genres Drama Crime Comedy Keywords No keywords have been added. Content Score 93 Almost there... Top Contributors m 32 mirrokka 12 Elizabeth Jennings a 2 atom100 TB 2 TMDb Bot  View Edit History Popularity Trend  Login to edit  URL By  signing up  for an account on TMDb, you can post directly to Twitter and Facebook. You need to be logged in to continue. Click  here  to login or  here  to sign up.    page_wrap opened in html_head  Join the Community The Basics About TMDb Contact Us Support Forums API Blog Get Involved  Contribution Bible 3rd Party Applications Add New Movie Add New TV Show Community Guidelines Leaderboard Forums Twitter Facebook Legal Terms of Use Privacy Policy Login Sign Up"
}