{
  "link": "https://www.themoviedb.org/tv/67004?language=en",
  "title": "Cyberwar",
  "resume": "Ben Makuch travels the world to meet with hackers, government officials, and dissidents to investigate the ecosystem of cyberwarfare.",
  "rate": "74.0",
  "genre": [
    "Documentary"
  ],
  "cast": [
    "Ben Makuch"
  ],
  "character": [
    "Himself"
  ],
  "site_data": "html Apps Forums Leaderboard Contribute API Support Discover Movies TV Shows Movies Popular Top Rated Upcoming Now Playing TV Shows Popular Top Rated On TV Airing Today People Popular People Can't find a movie or TV show? Login to create it. en Login Sign Up  ID: 67004   Expand Cyberwar   (2016) User Score  Play Trailer Overview Ben Makuch travels the world to meet with hackers, government officials, and dissidents to investigate the ecosystem of cyberwarfare. Discussions   Reviews Videos   Images   Changes Report Share Discussions General  1 Content Issues  0 Images Backdrops  4 Posters  3 Videos Trailers  1 Teasers  0 Clips  0 Featurettes  0 Opening Credits  0 Top Billed Cast Ben Makuch Himself Full Cast & Crew Last Season Season 2 2017 | 8 Episodes Season 2 of Cyberwar premiered on October  3, 2017. View All Seasons Social Reviews  0 Discussions  1 Subject Status Replies Last Reply Fascinating look at cyberhacking Open 0 by PT 100\n      \n     Go to Discussions Media Most Popular Videos  1 Backdrops  4 Posters  3 Recommendations   2016-10-13 Falling Water 6.6    2017-12-10 Counterpart 7.2    2014-04-15 Fargo 8.2  Facts Status  Returning Series Network Certification TV-14 Meaning This program contains some material that many parents would find unsuitable for children under 14 years of age. Type  Documentary Original Language  English Runtime  24m Homepage   https://www.viceland.com/en_us/show/cyberwar Genres Documentary Keywords internet culture cyber terrorism Content Score 64 We're so close, yet so far. Top Contributors 46 Elizabeth Jennings mj 6 mistreis jhon G 2 Gon\u00e7alo TB 1 TMDb Bot  View Edit History Popularity Trend  Login to edit  URL By  signing up  for an account on TMDb, you can post directly to Twitter and Facebook. You need to be logged in to continue. Click  here  to login or  here  to sign up.    page_wrap opened in html_head  Join the Community The Basics About TMDb Contact Us Support Forums API Blog Get Involved  Contribution Bible 3rd Party Applications Add New Movie Add New TV Show Community Guidelines Leaderboard Forums Twitter Facebook Legal Terms of Use Privacy Policy Login Sign Up"
}