{
  "link": "https://www.themoviedb.org/tv/74321?language=en",
  "title": "Will & Grace",
  "resume": "That\u2019s right, honey! A decade after their unforgettable eight-season run, comedy\u2019s most fabulous foursome is back.",
  "rate": "78.0",
  "genre": [
    "Comedy"
  ],
  "cast": [
    "Eric McCormack",
    "Debra Messing",
    "Sean Hayes",
    "Megan Mullally"
  ],
  "character": [
    "Will Truman",
    "Grace Adler",
    "Jack McFarland",
    "Karen Walker"
  ],
  "site_data": "html Apps Forums Leaderboard Contribute API Support Discover Movies TV Shows Movies Popular Top Rated Upcoming Now Playing TV Shows Popular Top Rated On TV Airing Today People Popular People Can't find a movie or TV show? Login to create it. en Login Sign Up  ID: 74321   Expand Will & Grace   (2017) User Score  Play Trailer Overview That\u2019s right, honey! A decade after their unforgettable eight-season run, comedy\u2019s most fabulous foursome is back. Featured Crew Max Mutchnick Creator David Kohan Creator Discussions   Reviews Videos   Images   Changes Report Share Discussions General  5 Content Issues  3 Images Backdrops  7 Posters  2 Videos Trailers  1 Teasers  0 Clips  0 Featurettes  0 Opening Credits  0 Top Billed Cast Eric McCormack Will Truman Debra Messing Grace Adler Sean Hayes Jack McFarland Megan Mullally Karen Walker Full Cast & Crew Last Season Season 1 2017 | 16 Episodes Season 1 of Will & Grace premiered on September 28, 2017. View All Seasons Social Reviews  0 Discussions  8 Subject Status Replies Last Reply b Jack Open 3 by  Patty Oct 12th episode - No political humor!  YEY!!!!! Open 0 by censorshipsucks06\n      \n     Could it be more forced and political? Open 5 by  censorshipsucks06 Go to Discussions Media Most Popular Videos  1 Backdrops  7 Posters  2 Recommendations   2017-09-25 Young Sheldon 6.9    2016-02-08 Full Frontal with Samantha Bee 6.7    1998-09-21 Will & Grace 6.5    2004-10-03 Boston Legal 7.6    2011-10-11 Last Man Standing 6.9    2016-02-26 Fuller House 5.6    2016-10-03 Timeless 7.0  Facts Status  Returning Series Network Certification TV-14 Meaning This program contains some material that many parents would find unsuitable for children under 14 years of age. Type  Scripted Original Language  English Runtime  22m Homepage   https://nbc.com/will-and-grace Genres Comedy Keywords new york sequel gay man lgbt sitcom Content Score 100 Yes! Looking good! Top Contributors 42 Banana t 10 thermo6 8 Elizabeth Jennings b 5 basher  View Edit History Popularity Trend  Login to edit  URL By  signing up  for an account on TMDb, you can post directly to Twitter and Facebook. You need to be logged in to continue. Click  here  to login or  here  to sign up.    page_wrap opened in html_head  Join the Community The Basics About TMDb Contact Us Support Forums API Blog Get Involved  Contribution Bible 3rd Party Applications Add New Movie Add New TV Show Community Guidelines Leaderboard Forums Twitter Facebook Legal Terms of Use Privacy Policy Login Sign Up"
}