{
  "link": "https://www.themoviedb.org/tv/38232?language=en",
  "title": "Jean-Claude Van Damme: Behind Closed Doors",
  "resume": "Jean-Claude Van Damme: Behind Closed Doors is a 2011 British reality show featuring action star Jean-Claude Van Damme and was being shown on ITV4 in the United Kingdom.",
  "rate": "",
  "genre": [
    "Documentary",
    "Drama"
  ],
  "cast": {
    "actor": [
      "Jean-Claude Van Damme",
      "Bianca Bree",
      "Kris Van Damme",
      "Gladys Portugues",
      "Jason Flemyng"
    ]
  },
  "characters": {
    "characters": [
      "Narrator"
    ]
  },
  "site_data": "html Apps Forums Leaderboard Contribute API Support Discover Movies TV Shows Movies Popular Top Rated Upcoming Now Playing TV Shows Popular Top Rated On TV Airing Today People Popular People Can't find a movie or TV show? Login to create it. en Login Sign Up  ID: 38232   Expand Jean-Claude Van Damme: Behind Closed Doors   (2011) User Score Overview Jean-Claude Van Damme: Behind Closed Doors is a 2011 British reality show featuring action star Jean-Claude Van Damme and was being shown on ITV4 in the United Kingdom. Featured Crew Jared Wright Creator Discussions   Reviews Videos   Images   Changes Report Share Discussions General  0 Content Issues  0 Images Backdrops  5 Posters  2 Videos Trailers  0 Teasers  0 Clips  0 Featurettes  0 Opening Credits  0 Top Billed Cast Jean-Claude Van Damme Bianca Bree Kris Van Damme Gladys Portugues Jason Flemyng Narrator Full Cast & Crew Last Season Season 1 2011 | 8 Episodes Season 1 of Jean-Claude Van Damme: Behind Closed Doors premiered on March 22, 2011. View All Seasons Social Reviews  0 Discussions  0 Media Most Popular Videos  0 Backdrops  5 Posters  2 Recommendations We don't have enough data to suggest any TV shows based on Jean-Claude Van Damme: Behind Closed Doors. You can help by rating TV shows you've seen. Facts Status  Ended Network Certification  - Type  Scripted Original Language  English Runtime  60m Homepage   http://www.itv.com/vandamme/ Genres Documentary Drama Keywords No keywords have been added. Content Score 93 Almost there... Top Contributors 15 Jack Duiz s 2 speedycars t 1 thermo6  View Edit History Popularity Trend  Login to edit  URL By  signing up  for an account on TMDb, you can post directly to Twitter and Facebook. You need to be logged in to continue. Click  here  to login or  here  to sign up.    page_wrap opened in html_head  Join the Community The Basics About TMDb Contact Us Support Forums API Blog Get Involved  Contribution Bible 3rd Party Applications Add New Movie Add New TV Show Community Guidelines Leaderboard Forums Twitter Facebook Legal Terms of Use Privacy Policy Login Sign Up"
}