{
  "link": "https://www.themoviedb.org/tv/16072?language=en",
  "title": "Attila",
  "resume": "Attila was an American TV miniseries set during the waning days of the Western Roman Empire, in particular during the invasions of the Huns in Europe.",
  "rate": "66.0",
  "genre": [
    "Drama"
  ],
  "cast": [
    "Gerard Butler",
    "Powers Boothe",
    "Simmone Jade Mackinnon",
    "Reg Rogers",
    "Alice Krige"
  ],
  "character": [
    "Attila the Hun",
    "Flavius Aetius",
    "N'Kara / Ildico",
    "Valentinian",
    "Placida"
  ],
  "site_data": "html Apps Forums Leaderboard Contribute API Support Discover Movies TV Shows Movies Popular Top Rated Upcoming Now Playing TV Shows Popular Top Rated On TV Airing Today People Popular People Can't find a movie or TV show? Login to create it. en Login Sign Up  ID: 16072   Expand Attila   (2001) User Score  Play Trailer Overview Attila was an American TV miniseries set during the waning days of the Western Roman Empire, in particular during the invasions of the Huns in Europe. Discussions   Reviews Videos   Images   Changes Report Share Discussions General  1 Content Issues  2 Images Backdrops  4 Posters  6 Videos Trailers  1 Teasers  0 Clips  0 Featurettes  0 Opening Credits  0 Top Billed Cast Gerard Butler Attila the Hun Powers Boothe Flavius Aetius Simmone Jade Mackinnon N'Kara / Ildico Reg Rogers Valentinian Alice Krige Placida Full Cast & Crew Last Season Season 1 2001 | 2 Episodes Season 1 of Attila premiered on January 30, 2001. View All Seasons Social Reviews  0 Discussions  3 Subject Status Replies Last Reply Great actor Open 0 by tavares1970\n      \n     Go to Discussions Media Most Popular Videos  1 Backdrops  4 Posters  6 Recommendations   1999-05-25 Cleopatra 5.8    1979-01-16 Life on Earth 9.5    2000-04-30 Arabian Nights 6.8    1997-05-17 The Odyssey 6.3    2009-07-12 Meteor 5.0    2011-06-29 Necessary Roughness 6.6    1997-05-11 The Last Don 5.9    1999-01-05 Total Recall 2070 5.8  Facts Status  Ended Network Certification  - Type  Miniseries Original Language  English Runtime  - Homepage  - Genres Drama Keywords army general roman battlefield attila huns blood king battle barbarian violence death sword and sandal hun conqueror Content Score 93 Almost there... Top Contributors TB 116 TMDb Bot R 4 Rebecca w 3 webmaster 2 Banana  View Edit History Popularity Trend  Login to edit  URL By  signing up  for an account on TMDb, you can post directly to Twitter and Facebook. You need to be logged in to continue. Click  here  to login or  here  to sign up.    page_wrap opened in html_head  Join the Community The Basics About TMDb Contact Us Support Forums API Blog Get Involved  Contribution Bible 3rd Party Applications Add New Movie Add New TV Show Community Guidelines Leaderboard Forums Twitter Facebook Legal Terms of Use Privacy Policy Login Sign Up"
}