{
  "link": "https://www.themoviedb.org/tv/68013?language=en",
  "title": "Wanderlust",
  "resume": "Polish-Flemish philosopher Alicja Gescinska interviews national and international personalities with diverse philosophical and religious backgrounds.",
  "rate": "",
  "genre": [
    "Documentary"
  ],
  "cast": {
    "actor": [
      "Alicja Gescinska"
    ]
  },
  "characters": {
    "characters": [
      "Herself - Host"
    ]
  },
  "site_data": "html Apps Forums Leaderboard Contribute API Support Discover Movies TV Shows Movies Popular Top Rated Upcoming Now Playing TV Shows Popular Top Rated On TV Airing Today People Popular People Can't find a movie or TV show? Login to create it. en Login Sign Up  ID: 68013   Expand Wanderlust   (2016) User Score Overview Polish-Flemish philosopher Alicja Gescinska interviews national and international personalities with diverse philosophical and religious backgrounds. Discussions   Reviews Videos   Images   Changes Report Share Discussions General  0 Content Issues  0 Images Backdrops  6 Posters  3 Videos Trailers  0 Teasers  0 Clips  0 Featurettes  0 Opening Credits  0 Top Billed Cast Alicja Gescinska Herself - Host Full Cast & Crew Last Season Season 2 2017 | 10 Episodes Season 2 of Wanderlust premiered on September  3, 2017. View All Seasons Social Reviews  0 Discussions  0 Media Most Popular Videos  0 Backdrops  6 Posters  3 Recommendations We don't have enough data to suggest any TV shows based on Wanderlust. You can help by rating TV shows you've seen. Facts Status  Returning Series Network Certification  - Type  Documentary Original Language  Dutch; Flemish Runtime  45m Homepage   https://www.canvas.be/wanderlust Genres Documentary Keywords philosophy religion culture philosopher human interest Content Score 64 We're so close, yet so far. Top Contributors 47 Elizabeth Jennings 11 kareldr TB 1 TMDb Bot  View Edit History Popularity Trend  Login to edit  URL By  signing up  for an account on TMDb, you can post directly to Twitter and Facebook. You need to be logged in to continue. Click  here  to login or  here  to sign up.    page_wrap opened in html_head  Join the Community The Basics About TMDb Contact Us Support Forums API Blog Get Involved  Contribution Bible 3rd Party Applications Add New Movie Add New TV Show Community Guidelines Leaderboard Forums Twitter Facebook Legal Terms of Use Privacy Policy Login Sign Up"
}