{
  "link": "https://www.themoviedb.org/tv/5052?language=en",
  "title": "Sooty & Co.",
  "resume": "Second incarnation of the childrens puppet show, picking up almost directly where \"The Sooty show\" left off Sooty, Sweep, Soo and little cousin Scampi continue their adventures with Matthew.",
  "rate": "68.0",
  "genre": [
    "Kids",
    "Comedy"
  ],
  "cast": [
    "Matthew Corbett",
    "Liana Bridges",
    "Richard Cadell",
    "Brenda Longman"
  ],
  "character": [
    "Himself",
    "Herself",
    "Himself",
    "Soo (voice) / Mo"
  ],
  "site_data": "html Apps Forums Leaderboard Contribute API Support Discover Movies TV Shows Movies Popular Top Rated Upcoming Now Playing TV Shows Popular Top Rated On TV Airing Today People Popular People Can't find a movie or TV show? Login to create it. en Login Sign Up  ID: 5052   Expand Sooty & Co.   (1993) User Score Overview Second incarnation of the childrens puppet show, picking up almost directly where \"The Sooty show\" left off Sooty, Sweep, Soo and little cousin Scampi continue their adventures with Matthew. Featured Crew Matthew Corbett Creator Discussions   Reviews Videos   Images   Changes Report Share Discussions General  0 Content Issues  1 Images Backdrops  0 Posters  2 Videos Trailers  0 Teasers  0 Clips  0 Featurettes  0 Opening Credits  0 Top Billed Cast Matthew Corbett Himself Liana Bridges Herself Richard Cadell Himself Brenda Longman Soo (voice) / Mo Full Cast & Crew Last Season Season 6 1997 | 15 Episodes Season 6 of Sooty & Co. premiered on September  7, 1997. View All Seasons Social Reviews  0 Discussions  1 Subject Status Replies Last Reply There are no discussions for Sooty & Co.. Login to be first! Go to Discussions Media Most Popular Videos  0 Backdrops  0 Posters  2 Recommendations   1976-01-05 Paddington Bear 7.7    1982-11-01 SuperTed 6.8    1990-02-15 The Crystal Maze 7.2    1990-01-04 One Foot in the Grave 7.5  Facts Status  Ended Network Certification U Meaning The U symbol stands for Universal. A U film should be suitable for audiences aged four years and over. Type  Scripted Original Language  English Runtime  20m Homepage  - Genres Kids Comedy Keywords puppet misadventure shop owner Content Score 79 Pump it up! We're close now. Top Contributors N 71 Notamymerrick TB 2 TMDb Bot R 1 Rebecca  View Edit History Popularity Trend  Login to edit  URL By  signing up  for an account on TMDb, you can post directly to Twitter and Facebook. You need to be logged in to continue. Click  here  to login or  here  to sign up.    page_wrap opened in html_head  Join the Community The Basics About TMDb Contact Us Support Forums API Blog Get Involved  Contribution Bible 3rd Party Applications Add New Movie Add New TV Show Community Guidelines Leaderboard Forums Twitter Facebook Legal Terms of Use Privacy Policy Login Sign Up"
}