{
  "link": "https://www.themoviedb.org/tv/40616?language=en",
  "title": "Nikola",
  "resume": "Nikola is a German television sitcom that premiered on September 12, 1997 on RTL Television.",
  "rate": "",
  "genre": [
    "Comedy"
  ],
  "cast": {
    "actor": [
      "Mariele Millowitsch",
      "Walter Sittler",
      "Oliver Reinhard",
      "Friederike Grasshoff",
      "Kerstin Thielemann"
    ]
  },
  "characters": {
    "characters": [
      "Nikola Vollendorf",
      "Dr. Robert Schmidt",
      "Tim Schenk",
      "Stephanie Vollendorf",
      "Dr. Charlotte Borstel"
    ]
  },
  "site_data": "html Apps Forums Leaderboard Contribute API Support Discover Movies TV Shows Movies Popular Top Rated Upcoming Now Playing TV Shows Popular Top Rated On TV Airing Today People Popular People Can't find a movie or TV show? Login to create it. en Login Sign Up  ID: 40616   Expand Nikola   (1997) User Score Overview Nikola is a German television sitcom that premiered on September 12, 1997 on RTL Television. Featured Crew Karen Wengrod Creator Discussions   Reviews Videos   Images   Changes Report Share Discussions General  0 Content Issues  0 Images Backdrops  6 Posters  1 Videos Trailers  0 Teasers  0 Clips  0 Featurettes  0 Opening Credits  0 Top Billed Cast Mariele Millowitsch Nikola Vollendorf Walter Sittler Dr. Robert Schmidt Oliver Reinhard Tim Schenk Friederike Grasshoff Stephanie Vollendorf Kerstin Thielemann Dr. Charlotte Borstel Full Cast & Crew Last Season Season 9 2005 | 12 Episodes Season 9 of Nikola premiered on September 16, 2005. View All Seasons Social Reviews  0 Discussions  0 Media Most Popular Videos  0 Backdrops  6 Posters  1 Recommendations We don't have enough data to suggest any TV shows based on Nikola. You can help by rating TV shows you've seen. Facts Status  Ended Network Certification  - Type  Scripted Original Language  German Runtime  25m Homepage  - Genres Comedy Keywords No keywords have been added. Content Score 93 Almost there... Top Contributors S 29 Samara 1 lineker  View Edit History Popularity Trend  Login to edit  URL By  signing up  for an account on TMDb, you can post directly to Twitter and Facebook. You need to be logged in to continue. Click  here  to login or  here  to sign up.    page_wrap opened in html_head  Join the Community The Basics About TMDb Contact Us Support Forums API Blog Get Involved  Contribution Bible 3rd Party Applications Add New Movie Add New TV Show Community Guidelines Leaderboard Forums Twitter Facebook Legal Terms of Use Privacy Policy Login Sign Up"
}