{
  "link": "https://www.themoviedb.org/tv/74095?language=en",
  "title": "Juni Taisen: Zodiac War",
  "resume": "We don't have an overview translated in English. Help us expand our database by adding one.",
  "rate": "",
  "genre": [
    "Action",
    "Adventure",
    "Animation"
  ],
  "cast": {
    "actor": [
      "Shun Horie",
      "Nobuhiko Okamoto",
      "Youko Hikasa",
      "Ayane Sakura",
      "Saori Hayami"
    ]
  },
  "characters": {
    "characters": [
      "Nezumi",
      "Usagi",
      "Inounoshishi",
      "Niwatori",
      "Shuryuu"
    ]
  },
  "site_data": "html Apps Forums Leaderboard Contribute API Support Discover Movies TV Shows Movies Popular Top Rated Upcoming Now Playing TV Shows Popular Top Rated On TV Airing Today People Popular People Can't find a movie or TV show? Login to create it. en Login Sign Up  ID: 74095   Expand Juni Taisen: Zodiac War   (2017) User Score Overview We don't have an overview translated in English. Help us expand our database by adding one. Featured Crew Naoto Hosoda Creator Discussions   Reviews Videos   Images   Changes Report Share Discussions General  0 Content Issues  1 Images Backdrops  2 Posters  1 Videos Trailers  0 Teasers  0 Clips  0 Featurettes  0 Opening Credits  0 Top Billed Cast Shun Horie Nezumi Nobuhiko Okamoto Usagi Youko Hikasa Inounoshishi Ayane Sakura Niwatori Saori Hayami Shuryuu Full Cast & Crew Current Season Season 1 2017 | 12 Episodes Season 1 of Juni Taisen: Zodiac War premiered on October  2, 2017. View All Seasons Social Reviews  0 Discussions  1 Subject Status Replies Last Reply There are no discussions for Juni Taisen: Zodiac War. Login to be first! Go to Discussions Media Most Popular Videos  0 Backdrops  2 Posters  1 Recommendations   2017-10-12 Last Hero Inuyashiki 7.4  Facts Original Name  \u5341\u4e8c\u5927\u6226 Status  Returning Series Networks - Certification TV-14 Meaning This program contains some material that many parents would find unsuitable for children under 14 years of age. Type  Scripted Original Language  Japanese Runtime  24m Homepage   http://12taisen.com/ Genres Action & Adventure Animation Keywords fantasy supernatural mythology anime survival game Content Score 93 Almost there... Top Contributors 16 Alex 12 sp1ti D 11 Destr0y M 7 Migi  View Edit History Popularity Trend  Login to edit  URL By  signing up  for an account on TMDb, you can post directly to Twitter and Facebook. You need to be logged in to continue. Click  here  to login or  here  to sign up.    page_wrap opened in html_head  Join the Community The Basics About TMDb Contact Us Support Forums API Blog Get Involved  Contribution Bible 3rd Party Applications Add New Movie Add New TV Show Community Guidelines Leaderboard Forums Twitter Facebook Legal Terms of Use Privacy Policy Login Sign Up"
}