{
  "link": "https://www.themoviedb.org/tv/7289?language=en",
  "title": "The Gruen Transfer",
  "resume": "Advertising: how it works, and how it works on us. Decode and defuse the commercial messages that swirl through our lives, with the help of a panel of ad industry experts.",
  "rate": "",
  "genre": [
    "Comedy"
  ],
  "cast": {
    "actor": [
      "Wil Anderson",
      "Russel Howcroft",
      "Todd Sampson"
    ]
  },
  "characters": {
    "characters": [
      "Himself - Host",
      "Himself - Panellist",
      "Himself - Panellist"
    ]
  },
  "site_data": "html Apps Forums Leaderboard Contribute API Support Discover Movies TV Shows Movies Popular Top Rated Upcoming Now Playing TV Shows Popular Top Rated On TV Airing Today People Popular People Can't find a movie or TV show? Login to create it. en Login Sign Up  ID: 7289   Expand The Gruen Transfer   (2008) User Score Overview Advertising: how it works, and how it works on us. Decode and defuse the commercial messages that swirl through our lives, with the help of a panel of ad industry experts. Featured Crew Andrew Denton Creator Discussions   Reviews Videos   Images   Changes Report Share Discussions General  0 Content Issues  7 Images Backdrops  4 Posters  1 Videos Trailers  0 Teasers  0 Clips  0 Featurettes  0 Opening Credits  0 Top Billed Cast Wil Anderson Himself - Host Russel Howcroft Himself - Panellist Todd Sampson Himself - Panellist Full Cast & Crew Last Season Season 4 2011 | 8 Episodes Season 4 of The Gruen Transfer premiered on August  3, 2011. View All Seasons Social Reviews  0 Discussions  7 Subject Status Replies Last Reply There are no discussions for The Gruen Transfer. Login to be first! Go to Discussions Media Most Popular Videos  0 Backdrops  4 Posters  1 Recommendations We don't have enough data to suggest any TV shows based on The Gruen Transfer. You can help by rating TV shows you've seen. Facts Status  Ended Network Certification  - Type  Talk Show Original Language  English Runtime  45m, 30m Homepage   http://www.abc.net.au/tv/gruentransfer/ Genres Comedy Keywords marketing advertising Content Score 64 We're so close, yet so far. Top Contributors 39 Luke 34 Banana 9 Matthew Sanders 5 United600  View Edit History Popularity Trend  Login to edit  URL By  signing up  for an account on TMDb, you can post directly to Twitter and Facebook. You need to be logged in to continue. Click  here  to login or  here  to sign up.    page_wrap opened in html_head  Join the Community The Basics About TMDb Contact Us Support Forums API Blog Get Involved  Contribution Bible 3rd Party Applications Add New Movie Add New TV Show Community Guidelines Leaderboard Forums Twitter Facebook Legal Terms of Use Privacy Policy Login Sign Up"
}