{
  "link": "https://www.themoviedb.org/tv/66093?language=en",
  "title": "Unfiltered with Renee Young",
  "resume": "WWE announcer Renee Young interviews WWE Superstars and other pop-culture celebrities, covering just about everything, except what they are famous for.",
  "rate": "",
  "genre": [
    "Talk"
  ],
  "cast": {
    "actor": [
      "Renee Paquette"
    ]
  },
  "characters": {
    "characters": [
      "Renee Young"
    ]
  },
  "site_data": "html Apps Forums Leaderboard Contribute API Support Discover Movies TV Shows Movies Popular Top Rated Upcoming Now Playing TV Shows Popular Top Rated On TV Airing Today People Popular People Can't find a movie or TV show? Login to create it. en Login Sign Up  ID: 66093   Expand Unfiltered with Renee Young   (2015) User Score Overview WWE announcer Renee Young interviews WWE Superstars and other pop-culture celebrities, covering just about everything, except what they are famous for. Discussions   Reviews Videos   Images   Changes Report Share Discussions General  0 Content Issues  0 Images Backdrops  1 Posters  1 Videos Trailers  0 Teasers  0 Clips  0 Featurettes  0 Opening Credits  0 Top Billed Cast Renee Paquette Renee Young Full Cast & Crew Last Season Season 2 2016 | 9 Episodes Season 2 of Unfiltered with Renee Young premiered on June  9, 2016. View All Seasons Social Reviews  0 Discussions  0 Media Most Popular Videos  0 Backdrops  1 Posters  1 Recommendations We don't have enough data to suggest any TV shows based on Unfiltered with Renee Young. You can help by rating TV shows you've seen. Facts Status  Cancelled Network Certification TV-PG Meaning This program contains material that parents may find unsuitable for younger children. Type  Talk Show Original Language  English Runtime  20m Homepage  - Genres Talk Keywords talk show wrestling interview Content Score 56 We're so close, yet so far. Top Contributors 24 Rug l 10 lexbomb o 1 ostadler 1 Elizabeth Jennings  View Edit History Popularity Trend  Login to edit  URL By  signing up  for an account on TMDb, you can post directly to Twitter and Facebook. You need to be logged in to continue. Click  here  to login or  here  to sign up.    page_wrap opened in html_head  Join the Community The Basics About TMDb Contact Us Support Forums API Blog Get Involved  Contribution Bible 3rd Party Applications Add New Movie Add New TV Show Community Guidelines Leaderboard Forums Twitter Facebook Legal Terms of Use Privacy Policy Login Sign Up"
}