{
  "link": "https://www.themoviedb.org/tv/23325?language=en",
  "title": "Unser Charly",
  "resume": "Unser Charly is a German television series.",
  "rate": "0.0",
  "genre": [
    "Comedy",
    "Family",
    "Drama"
  ],
  "cast": [
    "Regina Lemnitz",
    "Ralf Lindermann",
    "Brigitte B\u00f6ttrich",
    "Aurelio Malfa",
    "Saskia Valencia"
  ],
  "character": [
    "Charlotte Roesner-Lombardi",
    "Dr. Max Henning",
    "Frau Hoppe",
    "Rodolfo Lombardi",
    "Maren Waldner"
  ],
  "site_data": "html Apps Forums Leaderboard Contribute API Support Discover Movies TV Shows Movies Popular Top Rated Upcoming Now Playing TV Shows Popular Top Rated On TV Airing Today People Popular People Can't find a movie or TV show? Login to create it. en Login Sign Up  ID: 23325   Expand Unser Charly   (1995) User Score Overview Unser Charly is a German television series. Featured Crew Stefan Kuhlmann Creator Discussions   Reviews Videos   Images   Changes Report Share Discussions General  0 Content Issues  0 Images Backdrops  1 Posters  1 Videos Trailers  0 Teasers  0 Clips  0 Featurettes  0 Opening Credits  0 Top Billed Cast Regina Lemnitz Charlotte Roesner-Lombardi Ralf Lindermann Dr. Max Henning Brigitte B\u00f6ttrich Frau Hoppe Aurelio Malfa Rodolfo Lombardi Saskia Valencia Maren Waldner Full Cast & Crew Last Season Season 16 2012 | 21 Episodes Season 16 of Unser Charly premiered on January  7, 2012. View All Seasons Social Reviews  0 Discussions  0 Media Most Popular Videos  0 Backdrops  1 Posters  1 Recommendations We don't have enough data to suggest any TV shows based on Unser Charly. You can help by rating TV shows you've seen. Facts Status  Ended Network Certification  - Type  Scripted Original Language  German Runtime  50m Homepage  - Genres Comedy Family Drama Keywords No keywords have been added. Content Score 93 Almost there... Top Contributors S 58 Samara w 3 waterhorse 2 Zlogorek TB 2 TMDb Bot  View Edit History Popularity Trend  Login to edit  URL By  signing up  for an account on TMDb, you can post directly to Twitter and Facebook. You need to be logged in to continue. Click  here  to login or  here  to sign up.    page_wrap opened in html_head  Join the Community The Basics About TMDb Contact Us Support Forums API Blog Get Involved  Contribution Bible 3rd Party Applications Add New Movie Add New TV Show Community Guidelines Leaderboard Forums Twitter Facebook Legal Terms of Use Privacy Policy Login Sign Up"
}