{
  "link": "https://www.themoviedb.org/tv/64065?language=en",
  "title": "Asian Provocateur",
  "resume": "Comedian Romesh Ranganathan is sent by his mother on a ramshackle odyssey around his parents' homeland of Sri Lanka in an attempt to connect him with his roots.",
  "rate": "75.0",
  "genre": [
    "Documentary",
    "Comedy"
  ],
  "cast": [
    "Romesh Ranganathan"
  ],
  "character": [
    "Himself - Presenter"
  ],
  "site_data": "html Apps Forums Leaderboard Contribute API Support Discover Movies TV Shows Movies Popular Top Rated Upcoming Now Playing TV Shows Popular Top Rated On TV Airing Today People Popular People Can't find a movie or TV show? Login to create it. en Login Sign Up  ID: 64065   Expand Asian Provocateur   (2015) User Score Overview Comedian Romesh Ranganathan is sent by his mother on a ramshackle odyssey around his parents' homeland of Sri Lanka in an attempt to connect him with his roots. Discussions   Reviews Videos   Images   Changes Report Share Discussions General  0 Content Issues  0 Images Backdrops  3 Posters  1 Videos Trailers  0 Teasers  0 Clips  0 Featurettes  0 Opening Credits  0 Top Billed Cast Romesh Ranganathan Himself - Presenter Full Cast & Crew Last Season Mum's American Dream 2016 | 4 Episodes View All Seasons Social Reviews  0 Discussions  0 Media Most Popular Videos  0 Backdrops  3 Posters  1 Recommendations We don't have enough data to suggest any TV shows based on Asian Provocateur. You can help by rating TV shows you've seen. Facts Status  Returning Series Network Certification 15 Meaning No-one under 15 is allowed to see a 15 film at the cinema or buy/rent a 15 rated video. 15 rated works are not suitable for children under 15 years of age. Type  Documentary Original Language  English Runtime  30m Homepage   http://www.bbc.co.uk/programmes/b07zyh6k Genres Documentary Comedy Keywords sri lanka travel south asian Content Score 56 We're so close, yet so far. Top Contributors 27 Elizabeth Jennings 7 Banana z 4 zurman1 P 2 Pedro4sa  View Edit History Popularity Trend  Login to edit  URL By  signing up  for an account on TMDb, you can post directly to Twitter and Facebook. You need to be logged in to continue. Click  here  to login or  here  to sign up.    page_wrap opened in html_head  Join the Community The Basics About TMDb Contact Us Support Forums API Blog Get Involved  Contribution Bible 3rd Party Applications Add New Movie Add New TV Show Community Guidelines Leaderboard Forums Twitter Facebook Legal Terms of Use Privacy Policy Login Sign Up"
}