{
  "link": "https://www.themoviedb.org/tv/11667?language=en",
  "title": "Petrocelli",
  "resume": "Petrocelli is an American legal drama which ran for two seasons on NBC from September 11, 1974 to March 31, 1976.",
  "rate": "",
  "genre": [
    "Drama"
  ],
  "cast": {
    "actor": [
      "Barry Newman",
      "Susan Howard Chrane",
      "Albert Salmi",
      "David Huddleston"
    ]
  },
  "characters": {
    "characters": [
      "Anthony J. Petrocelli",
      "Maggie Petrocelli",
      "Pete Ritter",
      "Lieutenant Ponce"
    ]
  },
  "site_data": "html Apps Forums Leaderboard Contribute API Support Discover Movies TV Shows Movies Popular Top Rated Upcoming Now Playing TV Shows Popular Top Rated On TV Airing Today People Popular People Can't find a movie or TV show? Login to create it. en Login Sign Up  ID: 11667   Expand Petrocelli   (1974) User Score Overview Petrocelli is an American legal drama which ran for two seasons on NBC from September 11, 1974 to March 31, 1976. Featured Crew Sidney J. Furie Creator Discussions   Reviews Videos   Images   Changes Report Share Discussions General  0 Content Issues  0 Images Backdrops  2 Posters  2 Videos Trailers  0 Teasers  0 Clips  0 Featurettes  0 Opening Credits  0 Top Billed Cast Barry Newman Anthony J. Petrocelli Susan Howard Chrane Maggie Petrocelli Albert Salmi Pete Ritter David Huddleston Lieutenant Ponce Full Cast & Crew Last Season Season 2 1975 | 23 Episodes Season 2 of Petrocelli premiered on September 10, 1975. View All Seasons Social Reviews  0 Discussions  0 Media Most Popular Videos  0 Backdrops  2 Posters  2 Recommendations   1985-01-31 Night Heat 7.3    1977-01-30 The Hardy Boys / Nancy Drew Mysteries 6.7    1957-10-10 Zorro 8.4  Facts Status  Ended Network Certification  - Type  Scripted Original Language  English Runtime  60m, 48m Homepage  - Genres Drama Keywords small town italian american lawyer simpler life Content Score 93 Almost there... Top Contributors 16 Banana 3 lineker 3 Zlogorek DK 2 Dapper Kraken  View Edit History Popularity Trend  Login to edit  URL By  signing up  for an account on TMDb, you can post directly to Twitter and Facebook. You need to be logged in to continue. Click  here  to login or  here  to sign up.    page_wrap opened in html_head  Join the Community The Basics About TMDb Contact Us Support Forums API Blog Get Involved  Contribution Bible 3rd Party Applications Add New Movie Add New TV Show Community Guidelines Leaderboard Forums Twitter Facebook Legal Terms of Use Privacy Policy Login Sign Up"
}