{
  "link": "https://www.themoviedb.org/tv/55165?language=en",
  "title": "\u0421\u043b\u0435\u0434\u0441\u0442\u0432\u0438\u0435 \u0432\u0435\u043b\u0438...",
  "resume": "We don't have an overview translated in English. Help us expand our database by adding one.",
  "rate": "",
  "genre": [
    "Mystery",
    "Documentary"
  ],
  "cast": {
    "actor": [
      "Leonid Kanevskiy"
    ]
  },
  "characters": {
    "characters": [
      "Leonid Kanevskiy"
    ]
  },
  "site_data": "html Apps Forums Leaderboard Contribute API Support Discover Movies TV Shows Movies Popular Top Rated Upcoming Now Playing TV Shows Popular Top Rated On TV Airing Today People Popular People Can't find a movie or TV show? Login to create it. en Login Sign Up  ID: 55165   Expand \u0421\u043b\u0435\u0434\u0441\u0442\u0432\u0438\u0435 \u0432\u0435\u043b\u0438...   (2006) User Score Overview We don't have an overview translated in English. Help us expand our database by adding one. Featured Crew Mikhail Bobrovnik Creator Igor Kholodkov Creator Leonid Kanevskiy Creator Discussions   Reviews Videos   Images   Changes Report Share Discussions General  0 Content Issues  1 Images Backdrops  0 Posters  1 Videos Trailers  0 Teasers  0 Clips  0 Featurettes  0 Opening Credits  0 Top Billed Cast Leonid Kanevskiy Leonid Kanevskiy Full Cast & Crew Last Season Season 8 2012 | 34 Episodes Season 8 of \u0421\u043b\u0435\u0434\u0441\u0442\u0432\u0438\u0435 \u0432\u0435\u043b\u0438... premiered on September  1, 2012. View All Seasons Social Reviews  0 Discussions  1 Subject Status Replies Last Reply There are no discussions for \u0421\u043b\u0435\u0434\u0441\u0442\u0432\u0438\u0435 \u0432\u0435\u043b\u0438.... Login to be first! Go to Discussions Media Most Popular Videos  0 Backdrops  0 Posters  1 Recommendations We don't have enough data to suggest any TV shows based on \u0421\u043b\u0435\u0434\u0441\u0442\u0432\u0438\u0435 \u0432\u0435\u043b\u0438.... You can help by rating TV shows you've seen. Facts Status  Returning Series Network Certification 16+ Meaning Only teens the age of 16 or older can watch. Type  Scripted Original Language  Russian Runtime  40m Homepage   http://www.ntv.ru/peredacha/sledstvie/ Genres Mystery Documentary Keywords crime Content Score 43 There's no 'I' in team... Top Contributors 56 Apollo Z 11 Zhuk72 1 Banana  View Edit History Popularity Trend  Login to edit  URL By  signing up  for an account on TMDb, you can post directly to Twitter and Facebook. You need to be logged in to continue. Click  here  to login or  here  to sign up.    page_wrap opened in html_head  Join the Community The Basics About TMDb Contact Us Support Forums API Blog Get Involved  Contribution Bible 3rd Party Applications Add New Movie Add New TV Show Community Guidelines Leaderboard Forums Twitter Facebook Legal Terms of Use Privacy Policy Login Sign Up"
}