{
  "link": "https://www.themoviedb.org/tv/5580?language=en",
  "title": "The Man Show",
  "resume": "The Man Show is an American comedy television show on Comedy Central. It was created in 1999 by its two original co-hosts, Jimmy Kimmel and Adam Carolla, and their executive producer Daniel Kellison.",
  "rate": "",
  "genre": [
    "Comedy"
  ],
  "cast": {
    "actor": [
      "Joe Rogan",
      "Adam Carolla",
      "Bill Foster",
      "Aaron Hamill",
      "Cindy Crawford"
    ]
  },
  "characters": {
    "characters": [
      "host"
    ]
  },
  "site_data": "html Apps Forums Leaderboard Contribute API Support Discover Movies TV Shows Movies Popular Top Rated Upcoming Now Playing TV Shows Popular Top Rated On TV Airing Today People Popular People Can't find a movie or TV show? Login to create it. en Login Sign Up  ID: 5580   Expand The Man Show   (1999) User Score Overview The Man Show is an American comedy television show on Comedy Central. It was created in 1999 by its two original co-hosts, Jimmy Kimmel and Adam Carolla, and their executive producer Daniel Kellison. Discussions   Reviews Videos   Images   Changes Report Share Discussions General  0 Content Issues  0 Images Backdrops  2 Posters  2 Videos Trailers  0 Teasers  0 Clips  0 Featurettes  0 Opening Credits  0 Top Billed Cast Joe Rogan Adam Carolla host Bill Foster Aaron Hamill Cindy Crawford Full Cast & Crew Last Season Season 6 2004 | 11 Episodes Season 6 of The Man Show premiered on May  2, 2004. View All Seasons Social Reviews  0 Discussions  0 Media Most Popular Videos  0 Backdrops  2 Posters  2 Recommendations   1991-02-25 The Pirates of Dark Water 6.8    2000-01-17 Jack of All Trades 7.7    2006-09-18 Studio 60 on the Sunset Strip 7.4    2010-08-16 Hardcore Pawn 4.2    2011-01-20 Fairly Legal 5.8    1997-11-28 Tenacious D 6.9    1999-01-10 The PJs 7.4    2009-06-01 The Tonight Show with Conan O'Brien 7.8  Facts Status  Ended Network Certification  - Type  Scripted Original Language  English Runtime  30m, 22m Homepage   http://web.archive.org/web/*/http://www.themanshow.com/ Genres Comedy Keywords No keywords have been added. Content Score 86 Almost there... Top Contributors s 3 speedycars  View Edit History Popularity Trend  Login to edit  URL By  signing up  for an account on TMDb, you can post directly to Twitter and Facebook. You need to be logged in to continue. Click  here  to login or  here  to sign up.    page_wrap opened in html_head  Join the Community The Basics About TMDb Contact Us Support Forums API Blog Get Involved  Contribution Bible 3rd Party Applications Add New Movie Add New TV Show Community Guidelines Leaderboard Forums Twitter Facebook Legal Terms of Use Privacy Policy Login Sign Up"
}