{
  "link": "https://www.themoviedb.org/tv/2562?language=en",
  "title": "How the West Was Won",
  "resume": "The Macahans, a family from Virginia headed by Zeb Macahan, travel across the country to pioneer a new land and a new home in the American West.",
  "rate": "80.0",
  "genre": [
    "Western",
    "Drama"
  ],
  "cast": [
    "James Arness",
    "Fionnula Flanagan",
    "Eva Marie Saint",
    "William Conrad"
  ],
  "character": [
    "Zeb Macahan",
    "Molly Culhane",
    "Kate",
    "The voice"
  ],
  "site_data": "html Apps Forums Leaderboard Contribute API Support Discover Movies TV Shows Movies Popular Top Rated Upcoming Now Playing TV Shows Popular Top Rated On TV Airing Today People Popular People Can't find a movie or TV show? Login to create it. en Login Sign Up  ID: 2562   Expand How the West Was Won   (1976) User Score Overview The Macahans, a family from Virginia headed by Zeb Macahan, travel across the country to pioneer a new land and a new home in the American West. Discussions   Reviews Videos   Images   Changes Report Share Discussions General  0 Content Issues  0 Images Backdrops  5 Posters  3 Videos Trailers  0 Teasers  0 Clips  0 Featurettes  0 Opening Credits  0 Top Billed Cast James Arness Zeb Macahan Fionnula Flanagan Molly Culhane Eva Marie Saint Kate William Conrad The voice Full Cast & Crew Last Season Season 3 1979 | 10 Episodes Season 3 of How the West Was Won premiered on January 15, 1979. View All Seasons Social Reviews  0 Discussions  0 Media Most Popular Videos  0 Backdrops  5 Posters  3 Recommendations We don't have enough data to suggest any TV shows based on How the West Was Won. You can help by rating TV shows you've seen. Facts Status  Ended Network Certification  - Type  Scripted Original Language  English Runtime  60m Homepage  - Genres Western Drama Keywords No keywords have been added. Content Score 86 Almost there... Top Contributors 8 lineker 8 Elizabeth Jennings B 7 Badrock z 5 zurman1  View Edit History Popularity Trend  Login to edit  URL By  signing up  for an account on TMDb, you can post directly to Twitter and Facebook. You need to be logged in to continue. Click  here  to login or  here  to sign up.    page_wrap opened in html_head  Join the Community The Basics About TMDb Contact Us Support Forums API Blog Get Involved  Contribution Bible 3rd Party Applications Add New Movie Add New TV Show Community Guidelines Leaderboard Forums Twitter Facebook Legal Terms of Use Privacy Policy Login Sign Up"
}