{
  "link": "https://www.themoviedb.org/tv/61576?language=en",
  "title": "Mongeville",
  "resume": "We don't have an overview translated in English. Help us expand our database by adding one.",
  "rate": "",
  "genre": [
    "Crime"
  ],
  "cast": {
    "actor": [
      "Francis Perrin",
      "Pierre Aussedat",
      "Ga\u00eblle Bona",
      "Jean Philippe Lachaud"
    ]
  },
  "characters": {
    "characters": [
      "Antoine Mongeville",
      "Commissaire Briare",
      "Valentine Duteil",
      "Lieutenant St\u00e9phane"
    ]
  },
  "site_data": "html Apps Forums Leaderboard Contribute API Support Discover Movies TV Shows Movies Popular Top Rated Upcoming Now Playing TV Shows Popular Top Rated On TV Airing Today People Popular People Can't find a movie or TV show? Login to create it. en Login Sign Up  ID: 61576   Expand Mongeville   (2013) User Score Overview We don't have an overview translated in English. Help us expand our database by adding one. Featured Crew Jacques Santamaria Creator Discussions   Reviews Videos   Images   Changes Report Share Discussions General  0 Content Issues  4 Images Backdrops  2 Posters  1 Videos Trailers  0 Teasers  0 Clips  0 Featurettes  0 Opening Credits  0 Top Billed Cast Francis Perrin Antoine Mongeville Pierre Aussedat Commissaire Briare Ga\u00eblle Bona Valentine Duteil Jean Philippe Lachaud Lieutenant St\u00e9phane Full Cast & Crew Current Season Season 5 2017 | 5 Episodes Season 5 of Mongeville premiered on November 25, 2017. View All Seasons Social Reviews  0 Discussions  4 Subject Status Replies Last Reply There are no discussions for Mongeville. Login to be first! Go to Discussions Media Most Popular Videos  0 Backdrops  2 Posters  1 Recommendations We don't have enough data to suggest any TV shows based on Mongeville. You can help by rating TV shows you've seen. Facts Status  Returning Series Network Certification  - Type  Scripted Original Language  French Runtime  90m Homepage   https://www.france.tv/france-3/mongeville/ Genres Crime Keywords france bordeaux Content Score 86 Almost there... Top Contributors M 45 Manu m 19 michael47 3 Elizabeth Jennings 5 3 5lucina5  View Edit History Popularity Trend  Login to edit  URL By  signing up  for an account on TMDb, you can post directly to Twitter and Facebook. You need to be logged in to continue. Click  here  to login or  here  to sign up.    page_wrap opened in html_head  Join the Community The Basics About TMDb Contact Us Support Forums API Blog Get Involved  Contribution Bible 3rd Party Applications Add New Movie Add New TV Show Community Guidelines Leaderboard Forums Twitter Facebook Legal Terms of Use Privacy Policy Login Sign Up"
}