{
  "link": "https://www.themoviedb.org/tv/74127?language=en",
  "title": "Superhigh",
  "resume": "They got weed. They got powers.",
  "rate": "20.0",
  "genre": [
    "Comedy"
  ],
  "cast": [
    "Sarah McDaniel",
    "Francis Cronin",
    "Matt Ryan King",
    "Michael James Lazar",
    "Trent Walker"
  ],
  "character": [
    "Faith",
    "Adrian",
    "Snapper",
    "Shelter Guard",
    "Robber"
  ],
  "site_data": "html Apps Forums Leaderboard Contribute API Support Discover Movies TV Shows Movies Popular Top Rated Upcoming Now Playing TV Shows Popular Top Rated On TV Airing Today People Popular People Can't find a movie or TV show? Login to create it. en Login Sign Up  ID: 74127   Expand Superhigh   (2017) User Score  Play Trailer Overview They got weed. They got powers. Featured Crew Edouard Pluvieux Creator Discussions   Reviews Videos   Images   Changes Report Share Discussions General  0 Content Issues  0 Images Backdrops  0 Posters  1 Videos Trailers  1 Teasers  2 Clips  0 Featurettes  0 Opening Credits  0 Top Billed Cast Sarah McDaniel Faith Francis Cronin Adrian Matt Ryan King Snapper Michael James Lazar Shelter Guard Trent Walker Robber Full Cast & Crew Last Season Season 1 2017 | 5 Episodes Season 1 of Superhigh premiered on September 25, 2017. View All Seasons Social Reviews  0 Discussions  0 Media Most Popular Videos  3 Backdrops  0 Posters  1 Recommendations We don't have enough data to suggest any TV shows based on Superhigh. You can help by rating TV shows you've seen. Facts Status  Returning Series Networks Certification  - Type  Scripted Original Language  English Runtime  10m Homepage  - Genres Comedy Keywords No keywords have been added. Content Score 86 Almost there... Top Contributors M 30 Manu 5 Elizabeth Jennings 5 Steve TB 3 TMDb Bot  View Edit History Popularity Trend  Login to edit  URL By  signing up  for an account on TMDb, you can post directly to Twitter and Facebook. You need to be logged in to continue. Click  here  to login or  here  to sign up.    page_wrap opened in html_head  Join the Community The Basics About TMDb Contact Us Support Forums API Blog Get Involved  Contribution Bible 3rd Party Applications Add New Movie Add New TV Show Community Guidelines Leaderboard Forums Twitter Facebook Legal Terms of Use Privacy Policy Login Sign Up"
}