{
  "link": "https://www.themoviedb.org/tv/39354?language=en",
  "title": "Up All Night",
  "resume": "An irreverent look at parenthood through the point of view of an acerbic working mother, along with her stay-at-home husband and opinionated parents.",
  "rate": "62.0",
  "genre": [
    "Comedy"
  ],
  "cast": [
    "Christina Applegate",
    "Will Arnett",
    "Maya Rudolph",
    "Nick Cannon",
    "Jennifer Hall"
  ],
  "character": [
    "Reagan Brinkley",
    "Chris",
    "Ava"
  ],
  "site_data": "html Apps Forums Leaderboard Contribute API Support Discover Movies TV Shows Movies Popular Top Rated Upcoming Now Playing TV Shows Popular Top Rated On TV Airing Today People Popular People Can't find a movie or TV show? Login to create it. en Login Sign Up  ID: 39354   Expand Up All Night   (2011) User Score  Play Trailer Overview An irreverent look at parenthood through the point of view of an acerbic working mother, along with her stay-at-home husband and opinionated parents. Featured Crew Emily Spivey Creator Lorne Michaels Creator Discussions   Reviews Videos   Images   Changes Report Share Discussions General  0 Content Issues  0 Images Backdrops  10 Posters  6 Videos Trailers  1 Teasers  0 Clips  0 Featurettes  0 Opening Credits  0 Top Billed Cast Christina Applegate Reagan Brinkley Will Arnett Chris Maya Rudolph Ava Nick Cannon Jennifer Hall Full Cast & Crew Last Season Season 2 2012 | 11 Episodes Season 2 of Up All Night premiered on September 20, 2012. View All Seasons Social Reviews  0 Discussions  0 Media Most Popular Videos  1 Backdrops  10 Posters  6 Recommendations   2011-09-22 Whitney 3.8    2012-08-12 Animal Practice 4.7    2012-08-08 Go On 6.2    2010-09-28 No Ordinary Family 6.1    2010-08-16 The Big C 7.1    2011-04-13 Happy Endings 7.3    2010-09-23 Outsourced 6.7    2014-01-23 Rake 5.4  Facts Status  Ended Network Certification  - Type  Scripted Original Language  English Runtime  22m Homepage   http://www.nbc.com/up-all-night/ Genres Comedy Keywords baby talk show stay-at-home dad sitcom Content Score 100 Yes! Looking good! Top Contributors 10 Banana 6 Travis Bell k 5 krystyan s 4 speedycars  View Edit History Popularity Trend  Login to edit  URL By  signing up  for an account on TMDb, you can post directly to Twitter and Facebook. You need to be logged in to continue. Click  here  to login or  here  to sign up.    page_wrap opened in html_head  Join the Community The Basics About TMDb Contact Us Support Forums API Blog Get Involved  Contribution Bible 3rd Party Applications Add New Movie Add New TV Show Community Guidelines Leaderboard Forums Twitter Facebook Legal Terms of Use Privacy Policy Login Sign Up"
}