{
  "link": "https://www.themoviedb.org/tv/57261?language=en",
  "title": "The Politician's Husband",
  "resume": "A drama about the shifting power in a marriage when the personal and political collide.",
  "rate": "67.0",
  "genre": [
    "Drama",
    "War",
    "Politics"
  ],
  "cast": [
    "Emily Watson",
    "David Tennant",
    "Ed Stoppard",
    "Roger Allam",
    "Oscar Kennedy"
  ],
  "character": [
    "Freya Gardner",
    "Aiden Hoynes",
    "Bruce Babbish",
    "Marcus Brock",
    "Noah Hoynes"
  ],
  "site_data": "html Apps Forums Leaderboard Contribute API Support Discover Movies TV Shows Movies Popular Top Rated Upcoming Now Playing TV Shows Popular Top Rated On TV Airing Today People Popular People Can't find a movie or TV show? Login to create it. en Login Sign Up  ID: 57261   Expand The Politician's Husband   (2013) User Score  Play Trailer Overview A drama about the shifting power in a marriage when the personal and political collide. Featured Crew Paula Milne Creator Discussions   Reviews Videos   Images   Changes Report Share Discussions General  0 Content Issues  0 Images Backdrops  2 Posters  3 Videos Trailers  1 Teasers  0 Clips  0 Featurettes  0 Opening Credits  0 Top Billed Cast Emily Watson Freya Gardner David Tennant Aiden Hoynes Ed Stoppard Bruce Babbish Roger Allam Marcus Brock Oscar Kennedy Noah Hoynes Full Cast & Crew Last Season Season 1 2013 | 3 Episodes Season 1 of The Politician's Husband premiered on April 25, 2013. View All Seasons Social Reviews  0 Discussions  0 Media Most Popular Videos  1 Backdrops  2 Posters  3 Recommendations   2014-12-29 Mapp and Lucia 6.3    2010-10-10 Single Father 7.4    2004-11-11 Blackpool 7.8    2005-03-23 Casanova 7.3    2014-01-09 Spies of Warsaw 7.2    2013-10-29 The Escape Artist 7.0    2012-12-06 A Young Doctor's Notebook 6.8    2012-12-27 Restless 6.4  Facts Status  Ended Network Certification 15 Meaning No-one under 15 is allowed to see a 15 film at the cinema or buy/rent a 15 rated video. 15 rated works are not suitable for children under 15 years of age. Type  Miniseries Original Language  English Runtime  57m Homepage   http://www.bbc.co.uk/programmes/p00yfm4l Genres Drama War & Politics Keywords jealousy wife husband relationship england politics politician betrayal miniseries family power politics british politics betrayal by friend power play Content Score 100 Yes! Looking good! Top Contributors 56 Marr \ud83c\uddf3\ud83c\uddf1 TB 13 TMDb Bot 11 Elizabeth Jennings 11 Banana  View Edit History Popularity Trend  Login to edit  URL By  signing up  for an account on TMDb, you can post directly to Twitter and Facebook. You need to be logged in to continue. Click  here  to login or  here  to sign up.    page_wrap opened in html_head  Join the Community The Basics About TMDb Contact Us Support Forums API Blog Get Involved  Contribution Bible 3rd Party Applications Add New Movie Add New TV Show Community Guidelines Leaderboard Forums Twitter Facebook Legal Terms of Use Privacy Policy Login Sign Up"
}