{
  "link": "https://www.themoviedb.org/tv/41199?language=en",
  "title": "Eine wie keine",
  "resume": "Eine wie keine is a German television series.",
  "rate": "60.0",
  "genre": [
    "Drama",
    "Soap"
  ],
  "cast": [
    "Marie Zielcke",
    "Arne Stephan",
    "Mirjam Heimann",
    "Alexander T\u00fcrk",
    "Philipp Romann"
  ],
  "character": [
    "Manuela Berlett",
    "Mark Braun",
    "Lindi Kurowski",
    "Daniel \u201eDani\u201c Berlett",
    "Philip Sachs"
  ],
  "site_data": "html Apps Forums Leaderboard Contribute API Support Discover Movies TV Shows Movies Popular Top Rated Upcoming Now Playing TV Shows Popular Top Rated On TV Airing Today People Popular People Can't find a movie or TV show? Login to create it. en Login Sign Up  ID: 41199   Expand Eine wie keine   (2009) User Score Overview Eine wie keine is a German television series. Discussions   Reviews Videos   Images   Changes Report Share Discussions General  0 Content Issues  0 Images Backdrops  0 Posters  1 Videos Trailers  0 Teasers  0 Clips  0 Featurettes  0 Opening Credits  0 Top Billed Cast Marie Zielcke Manuela Berlett Arne Stephan Mark Braun Mirjam Heimann Lindi Kurowski Alexander T\u00fcrk Daniel \u201eDani\u201c Berlett Philipp Romann Philip Sachs Full Cast & Crew Last Season Season 1 2009 | 212 Episodes Season 1 of Eine wie keine premiered on November 16, 2009. View All Seasons Social Reviews  0 Discussions  0 Media Most Popular Videos  0 Backdrops  0 Posters  1 Recommendations We don't have enough data to suggest any TV shows based on Eine wie keine. You can help by rating TV shows you've seen. Facts Status  Ended Network Certification 6 Meaning Can be aired at any time. Type  Scripted Original Language  German Runtime  20m Homepage   https://www.sat1.de/tv/eine-wie-keine Genres Drama Soap Keywords hotel mother family soap opera Content Score 71 Just a little bit more... Top Contributors S 31 Samara 19 Simon  View Edit History Popularity Trend  Login to edit  URL By  signing up  for an account on TMDb, you can post directly to Twitter and Facebook. You need to be logged in to continue. Click  here  to login or  here  to sign up.    page_wrap opened in html_head  Join the Community The Basics About TMDb Contact Us Support Forums API Blog Get Involved  Contribution Bible 3rd Party Applications Add New Movie Add New TV Show Community Guidelines Leaderboard Forums Twitter Facebook Legal Terms of Use Privacy Policy Login Sign Up"
}