{
  "link": "https://www.themoviedb.org/tv/32806?language=en",
  "title": "Off the Map",
  "resume": "La Ciudad de las Estrellas, a tiny town in the South American jungle, is home to an understaffed, understocked medical clinic where three idealistic doctors come looking for change.",
  "rate": "",
  "genre": [
    "Drama"
  ],
  "cast": {
    "actor": [
      "Enrique Murciano",
      "Caroline Dhavernas",
      "Martin Henderson",
      "Jason George",
      "Mamie Gummer"
    ]
  },
  "characters": {
    "characters": [
      "Dr. Mina Minard"
    ]
  },
  "site_data": "html Apps Forums Leaderboard Contribute API Support Discover Movies TV Shows Movies Popular Top Rated Upcoming Now Playing TV Shows Popular Top Rated On TV Airing Today People Popular People Can't find a movie or TV show? Login to create it. en Login Sign Up  ID: 32806   Expand Off the Map   (2011) User Score Overview La Ciudad de las Estrellas, a tiny town in the South American jungle, is home to an understaffed, understocked medical clinic where three idealistic doctors come looking for change. Featured Crew Jenna Bans Creator Discussions   Reviews Videos   Images   Changes Report Share Discussions General  0 Content Issues  0 Images Backdrops  4 Posters  3 Videos Trailers  0 Teasers  0 Clips  0 Featurettes  0 Opening Credits  0 Top Billed Cast Enrique Murciano Caroline Dhavernas Martin Henderson Jason George Mamie Gummer Dr. Mina Minard Full Cast & Crew Last Season Season 1 2011 | 13 Episodes Season 1 of Off the Map premiered on January 12, 2011. View All Seasons Social Reviews  0 Discussions  0 Media Most Popular Videos  0 Backdrops  4 Posters  3 Recommendations   2012-10-16 Emily Owens, M.D 5.7    2012-03-21 Bent 6.5    2007-07-09 Greek 6.3    2012-01-12 The Finder 7.6    2010-06-24 Rookie Blue 7.0    2010-09-21 Raising Hope 6.9    2011-06-23 Wilfred 7.0    2011-07-11 Alphas 6.5  Facts Status  Cancelled Network Certification TV-14 Meaning This program contains some material that many parents would find unsuitable for children under 14 years of age. Type  Scripted Original Language  English Runtime  45m Homepage   http://abc.go.com/shows/off-the-map Genres Drama Keywords doctor south america medical drama Content Score 93 Almost there... Top Contributors 20 Banana s 3 speedycars B 2 BLH T 1 Ticktock  View Edit History Popularity Trend  Login to edit  URL By  signing up  for an account on TMDb, you can post directly to Twitter and Facebook. You need to be logged in to continue. Click  here  to login or  here  to sign up.    page_wrap opened in html_head  Join the Community The Basics About TMDb Contact Us Support Forums API Blog Get Involved  Contribution Bible 3rd Party Applications Add New Movie Add New TV Show Community Guidelines Leaderboard Forums Twitter Facebook Legal Terms of Use Privacy Policy Login Sign Up"
}