{
  "link": "https://www.themoviedb.org/tv/71572?language=en",
  "title": "\u0411\u0440\u0430\u0442\u0430\u043d\u044b",
  "resume": "We don't have an overview translated in English. Help us expand our database by adding one.",
  "rate": "",
  "genre": [
    "Crime"
  ],
  "cast": {
    "actor": [
      "Natalya Korennaya",
      "Ravshana Kurkova",
      "Nikita Panfilov",
      "Boris Klyuev",
      "Mikhail Bogdasarov"
    ]
  },
  "characters": {
    "characters": [
      "\u0418\u0440\u0438\u043d\u0430",
      "\u0410\u043b\u0438\u0441\u0430",
      "\u0410\u043b\u0435\u043a\u0441\u0435\u0439 \u0428\u043c\u0435\u043b\u0435\u0432, \u00ab\u0428\u043c\u0435\u043b\u044c\u00bb",
      "\u0412\u0438\u043a\u0442\u043e\u0440 \u0421\u0442\u0435\u043f\u0430\u043d\u043e\u0432\u0438\u0447 \u0426\u0430\u0440\u0451\u0432, \u00ab\u0426\u0430\u0440\u044c\u00bb",
      "\u0415\u0432\u0433\u0435\u043d\u0438\u0439"
    ]
  },
  "site_data": "html Apps Forums Leaderboard Contribute API Support Discover Movies TV Shows Movies Popular Top Rated Upcoming Now Playing TV Shows Popular Top Rated On TV Airing Today People Popular People Can't find a movie or TV show? Login to create it. en Login Sign Up  ID: 71572   Expand \u0411\u0440\u0430\u0442\u0430\u043d\u044b   (2009) User Score Overview We don't have an overview translated in English. Help us expand our database by adding one. Featured Crew \u0412\u044f\u0447\u0435\u0441\u043b\u0430\u0432 \u0413\u0430\u043d\u0438\u0447 Creator \u0421\u0435\u0440\u0433\u0435\u0439 \u0414\u0437\u044e\u0431\u0430 Creator \u0410\u0440\u0442\u0435\u043c \u041a\u0438\u0440\u0441\u0430\u043d\u043e\u0432 Creator Aleksandr Mokhov Creator Discussions   Reviews Videos   Images   Changes Report Share Discussions General  0 Content Issues  0 Images Backdrops  1 Posters  1 Videos Trailers  0 Teasers  0 Clips  0 Featurettes  0 Opening Credits  0 Top Billed Cast Natalya Korennaya \u0418\u0440\u0438\u043d\u0430 Ravshana Kurkova \u0410\u043b\u0438\u0441\u0430 Nikita Panfilov \u0410\u043b\u0435\u043a\u0441\u0435\u0439 \u0428\u043c\u0435\u043b\u0435\u0432, \u00ab\u0428\u043c\u0435\u043b\u044c\u00bb Boris Klyuev \u0412\u0438\u043a\u0442\u043e\u0440 \u0421\u0442\u0435\u043f\u0430\u043d\u043e\u0432\u0438\u0447 \u0426\u0430\u0440\u0451\u0432, \u00ab\u0426\u0430\u0440\u044c\u00bb Mikhail Bogdasarov \u0415\u0432\u0433\u0435\u043d\u0438\u0439 Full Cast & Crew Last Season Season 4 2014 | 32 Episodes Season 4 of \u0411\u0440\u0430\u0442\u0430\u043d\u044b premiered on April 14, 2014. View All Seasons Social Reviews  0 Discussions  0 Media Most Popular Videos  0 Backdrops  1 Posters  1 Recommendations We don't have enough data to suggest any TV shows based on \u0411\u0440\u0430\u0442\u0430\u043d\u044b. You can help by rating TV shows you've seen. Facts Status  Ended Networks - Certification  - Type  Scripted Original Language  Russian Runtime  - Homepage  - Genres Crime Keywords No keywords have been added. Content Score 86 Almost there... Top Contributors m 53 maltsev.v.v n 2 navarro2018  View Edit History Popularity Trend  Login to edit  URL By  signing up  for an account on TMDb, you can post directly to Twitter and Facebook. You need to be logged in to continue. Click  here  to login or  here  to sign up.    page_wrap opened in html_head  Join the Community The Basics About TMDb Contact Us Support Forums API Blog Get Involved  Contribution Bible 3rd Party Applications Add New Movie Add New TV Show Community Guidelines Leaderboard Forums Twitter Facebook Legal Terms of Use Privacy Policy Login Sign Up"
}