{
  "link": "https://www.themoviedb.org/tv/10641?language=en",
  "title": "Cracker",
  "resume": "Crime drama based on the UK TV series about Gerry \"Fitz\" Fitzgerald, a brilliant but troubled criminal psychologist working alongside the Los Angeles police department.",
  "rate": "60.0",
  "genre": [
    "Crime",
    "Drama"
  ],
  "cast": [
    "Robert Pastorelli",
    "Carolyn McCormick",
    "Robert Wisdom",
    "Josh Hartnett",
    "R. Lee Ermey"
  ],
  "character": [
    "Gerry 'Fitz' Fitzgerald",
    "Judith Fitzgerald",
    "Detective Danny Watlington",
    "Michael Fitzgerald",
    "Lieutenant Fry"
  ],
  "site_data": "html Apps Forums Leaderboard Contribute API Support Discover Movies TV Shows Movies Popular Top Rated Upcoming Now Playing TV Shows Popular Top Rated On TV Airing Today People Popular People Can't find a movie or TV show? Login to create it. en Login Sign Up  ID: 10641   Expand Cracker   (1997) User Score Overview Crime drama based on the UK TV series about Gerry \"Fitz\" Fitzgerald, a brilliant but troubled criminal psychologist working alongside the Los Angeles police department. Featured Crew Jimmy McGovern Creator Discussions   Reviews Videos   Images   Changes Report Share Discussions General  0 Content Issues  0 Images Backdrops  3 Posters  1 Videos Trailers  0 Teasers  0 Clips  0 Featurettes  0 Opening Credits  0 Top Billed Cast Robert Pastorelli Gerry 'Fitz' Fitzgerald Carolyn McCormick Judith Fitzgerald Robert Wisdom Detective Danny Watlington Josh Hartnett Michael Fitzgerald R. Lee Ermey Lieutenant Fry Full Cast & Crew Last Season Season 1 1997 | 16 Episodes Season 1 of Cracker premiered on September 18, 1997. View All Seasons Social Reviews  0 Discussions  0 Media Most Popular Videos  0 Backdrops  3 Posters  1 Recommendations We don't have enough data to suggest any TV shows based on Cracker. You can help by rating TV shows you've seen. Facts Status  Ended Network Certification  - Type  Scripted Original Language  English Runtime  60m Homepage  - Genres Crime Drama Keywords self-destruction remake psychologist los angeles people reader criminal consultant Content Score 93 Almost there... Top Contributors 25 Banana O 2 Ozbourne 2 lineker n 1 nixskits  View Edit History Popularity Trend  Login to edit  URL By  signing up  for an account on TMDb, you can post directly to Twitter and Facebook. You need to be logged in to continue. Click  here  to login or  here  to sign up.    page_wrap opened in html_head  Join the Community The Basics About TMDb Contact Us Support Forums API Blog Get Involved  Contribution Bible 3rd Party Applications Add New Movie Add New TV Show Community Guidelines Leaderboard Forums Twitter Facebook Legal Terms of Use Privacy Policy Login Sign Up"
}