{
  "link": "https://www.themoviedb.org/tv/74253?language=en",
  "title": "The Last Post",
  "resume": "Drama series set in the mid-sixties, in which a unit of Royal Military Police officers and their families deal with the challenges of politics, love and war in British-controlled Aden.",
  "rate": "",
  "genre": [
    "Drama",
    "War",
    "Politics"
  ],
  "cast": {
    "actor": [
      "Jessie Buckley",
      "Stephen Campbell Moore",
      "Amanda Drew",
      "Ben Miles",
      "Jeremy Neumark Jones"
    ]
  },
  "characters": {
    "characters": [
      "Honor Martin",
      "Lieutenant Ed Laithwaite",
      "Mary Markham",
      "Major Harry Markham",
      "Captain Joe Martin"
    ]
  },
  "site_data": "html Apps Forums Leaderboard Contribute API Support Discover Movies TV Shows Movies Popular Top Rated Upcoming Now Playing TV Shows Popular Top Rated On TV Airing Today People Popular People Can't find a movie or TV show? Login to create it. en Login Sign Up  ID: 74253   Expand The Last Post   (2017) User Score  Play Trailer Overview Drama series set in the mid-sixties, in which a unit of Royal Military Police officers and their families deal with the challenges of politics, love and war in British-controlled Aden. Featured Crew Peter Moffat Creator Discussions   Reviews Videos   Images   Changes Report Share Discussions General  0 Content Issues  0 Images Backdrops  2 Posters  4 Videos Trailers  1 Teasers  0 Clips  0 Featurettes  0 Opening Credits  0 Top Billed Cast Jessie Buckley Honor Martin Stephen Campbell Moore Lieutenant Ed Laithwaite Amanda Drew Mary Markham Ben Miles Major Harry Markham Jeremy Neumark Jones Captain Joe Martin Full Cast & Crew Last Season Season 1 2017 | 6 Episodes Season 1 of The Last Post premiered on October  1, 2017. View All Seasons Social Reviews  0 Discussions  0 Media Most Popular Videos  1 Backdrops  2 Posters  4 Recommendations   2017-10-21 Gunpowder 6.8    2010-05-05 Strike Back 7.3  Facts Status  Returning Series Network Certification  - Type  Scripted Original Language  English Runtime  59m Homepage   http://www.bbc.co.uk/programmes/b097tsyf Genres Drama War & Politics Keywords army period drama 1960s Content Score 100 Yes! Looking good! Top Contributors 38 Elizabeth Jennings n 5 ntiadit9 G 5 Gon\u00e7alo O 3 Ozbourne  View Edit History Popularity Trend  Login to edit  URL By  signing up  for an account on TMDb, you can post directly to Twitter and Facebook. You need to be logged in to continue. Click  here  to login or  here  to sign up.    page_wrap opened in html_head  Join the Community The Basics About TMDb Contact Us Support Forums API Blog Get Involved  Contribution Bible 3rd Party Applications Add New Movie Add New TV Show Community Guidelines Leaderboard Forums Twitter Facebook Legal Terms of Use Privacy Policy Login Sign Up"
}