{
  "link": "https://www.themoviedb.org/tv/68095?language=en",
  "title": "Medical Examiner Dr. Qin",
  "resume": "Medical examiner Qin Ming, together with his assistant and a police detective, solves crimes with his expertise.",
  "rate": "0.0",
  "genre": [
    "Crime"
  ],
  "cast": [
    "Zhang Ruoyun",
    "Jiao Junyan",
    "Li Xian",
    "Qu Jingjing"
  ],
  "character": [
    "Qin Ming",
    "Da Bao",
    "Lin Tao",
    "Chi Zi"
  ],
  "site_data": "html Apps Forums Leaderboard Contribute API Support Discover Movies TV Shows Movies Popular Top Rated Upcoming Now Playing TV Shows Popular Top Rated On TV Airing Today People Popular People Can't find a movie or TV show? Login to create it. en Login Sign Up  ID: 68095   Expand Medical Examiner Dr. Qin   (2016) User Score Overview Medical examiner Qin Ming, together with his assistant and a police detective, solves crimes with his expertise. Featured Crew Xu Ang Creator Discussions   Reviews Videos   Images   Changes Report Share Discussions General  0 Content Issues  0 Images Backdrops  1 Posters  6 Videos Trailers  0 Teasers  0 Clips  0 Featurettes  0 Opening Credits  0 Top Billed Cast Zhang Ruoyun Qin Ming Jiao Junyan Da Bao Li Xian Lin Tao Qu Jingjing Chi Zi Full Cast & Crew Last Season Season 1 2016 | 20 Episodes Season 1 of Medical Examiner Dr. Qin premiered on October 13, 2016. View All Seasons Social Reviews  0 Discussions  0 Media Most Popular Videos  0 Backdrops  1 Posters  6 Recommendations We don't have enough data to suggest any TV shows based on Medical Examiner Dr. Qin. You can help by rating TV shows you've seen. Facts Original Name  \u6cd5\u533b\u79e6\u660e Status  Ended Network Sohu Certification  - Type  Scripted Original Language  Chinese Runtime  35m Homepage  - Genres Crime Keywords china police medical examiner Content Score 93 Almost there... Top Contributors M 39 Maria180493 z 12 zhw410 w 3 woogoldsgreat  View Edit History Popularity Trend  Login to edit  URL By  signing up  for an account on TMDb, you can post directly to Twitter and Facebook. You need to be logged in to continue. Click  here  to login or  here  to sign up.    page_wrap opened in html_head  Join the Community The Basics About TMDb Contact Us Support Forums API Blog Get Involved  Contribution Bible 3rd Party Applications Add New Movie Add New TV Show Community Guidelines Leaderboard Forums Twitter Facebook Legal Terms of Use Privacy Policy Login Sign Up"
}