{
  "link": "https://www.themoviedb.org/tv/9323?language=en",
  "title": "The Jacksons: An American Dream",
  "resume": "The history of the Jackson family and the early and successful years of the Motown group The Jackson 5.",
  "rate": "",
  "genre": [
    "Drama"
  ],
  "cast": {
    "actor": [
      "Billy Dee Williams",
      "Lawrence Hilton-Jacobs",
      "Vanessa Williams",
      "Margaret Avery",
      "Holly Robinson Peete"
    ]
  },
  "characters": {
    "characters": [
      "Berry Gordy",
      "Joseph Jackson",
      "Suzanne de Passe",
      "Martha Scruse",
      "Diana Ross"
    ]
  },
  "site_data": "html Apps Forums Leaderboard Contribute API Support Discover Movies TV Shows Movies Popular Top Rated Upcoming Now Playing TV Shows Popular Top Rated On TV Airing Today People Popular People Can't find a movie or TV show? Login to create it. en Login Sign Up  ID: 9323   Expand The Jacksons: An American Dream   (1992) User Score Overview The history of the Jackson family and the early and successful years of the Motown group The Jackson 5. Featured Crew Jermaine Jackson Creator Discussions   Reviews Videos   Images   Changes Report Share Discussions General  0 Content Issues  1 Images Backdrops  1 Posters  5 Videos Trailers  0 Teasers  0 Clips  0 Featurettes  0 Opening Credits  0 Top Billed Cast Billy Dee Williams Berry Gordy Lawrence Hilton-Jacobs Joseph Jackson Vanessa Williams Suzanne de Passe Margaret Avery Martha Scruse Holly Robinson Peete Diana Ross Full Cast & Crew Last Season Season 1 1992 | 2 Episodes Season 1 of The Jacksons: An American Dream premiered on November 14, 1992. View All Seasons Social Reviews  0 Discussions  1 Subject Status Replies Last Reply There are no discussions for The Jacksons: An American Dream. Login to be first! Go to Discussions Media Most Popular Videos  0 Backdrops  1 Posters  5 Recommendations   1998-11-01 The Temptations 7.2  Facts Status  Ended Network Certification  - Type  Miniseries Original Language  English Runtime  300m Homepage  - Genres Drama Keywords music based on a true story miniseries black family woman director Content Score 93 Almost there... Top Contributors TB 21 TMDb Bot z 15 zurman1 12 Banana 9 Cyberdom  View Edit History Popularity Trend  Login to edit  URL By  signing up  for an account on TMDb, you can post directly to Twitter and Facebook. You need to be logged in to continue. Click  here  to login or  here  to sign up.    page_wrap opened in html_head  Join the Community The Basics About TMDb Contact Us Support Forums API Blog Get Involved  Contribution Bible 3rd Party Applications Add New Movie Add New TV Show Community Guidelines Leaderboard Forums Twitter Facebook Legal Terms of Use Privacy Policy Login Sign Up"
}