{
  "link": "https://www.themoviedb.org/tv/55006?language=en",
  "title": "The Flowers of Evil",
  "resume": "We don't have an overview translated in English. Help us expand our database by adding one.",
  "rate": "84.0",
  "genre": [
    "Animation",
    "Drama"
  ],
  "cast": [
    "Shinichiro Ueda",
    "Mariya Ise",
    "Youko Hikasa",
    "Shinya Hamazoe"
  ],
  "character": [
    "Takao Kasuga",
    "Sawa Nakamura",
    "Nanako Saeki",
    "Ken Kojima"
  ],
  "site_data": "html Apps Forums Leaderboard Contribute API Support Discover Movies TV Shows Movies Popular Top Rated Upcoming Now Playing TV Shows Popular Top Rated On TV Airing Today People Popular People Can't find a movie or TV show? Login to create it. en Login Sign Up  ID: 55006   Expand The Flowers of Evil   (2013) User Score Overview We don't have an overview translated in English. Help us expand our database by adding one. Featured Crew Hiroshi Nagahama Creator Discussions   Reviews Videos   Images   Changes Report Share Discussions General  0 Content Issues  0 Images Backdrops  5 Posters  2 Videos Trailers  0 Teasers  0 Clips  0 Featurettes  0 Opening Credits  0 Top Billed Cast Shinichiro Ueda Takao Kasuga Mariya Ise Sawa Nakamura Youko Hikasa Nanako Saeki Shinya Hamazoe Ken Kojima Full Cast & Crew Last Season Season 1 2013 | 13 Episodes Season 1 of The Flowers of Evil premiered on April  5, 2013. View All Seasons Social Reviews  0 Discussions  0 Media Most Popular Videos  0 Backdrops  5 Posters  2 Recommendations   2004-02-03 Paranoia Agent 7.8    1998-07-06 Serial Experiments Lain 8.2    2011-04-06 Steins;Gate 8.2  Facts Original Name  Aku no Hana Status  Ended Network Certification TV-MA Meaning This program is specifically designed to be viewed by adults and therefore may be unsuitable for children under 17 Type  Scripted Original Language  Japanese Runtime  25m Homepage   http://akunohana-anime.jp Genres Animation Drama Keywords psychopath psychology rotoscoping psychological thriller evil psychotic psychological psycho psycho-sexual japanese high school Content Score 93 Almost there... Top Contributors 39 Micael Lopes H 18 Hide 6 Chainsawkitten 3 seboseboss  View Edit History Popularity Trend  Login to edit  URL By  signing up  for an account on TMDb, you can post directly to Twitter and Facebook. You need to be logged in to continue. Click  here  to login or  here  to sign up.    page_wrap opened in html_head  Join the Community The Basics About TMDb Contact Us Support Forums API Blog Get Involved  Contribution Bible 3rd Party Applications Add New Movie Add New TV Show Community Guidelines Leaderboard Forums Twitter Facebook Legal Terms of Use Privacy Policy Login Sign Up"
}