{
  "link": "https://www.themoviedb.org/tv/7449?language=en",
  "title": "Raw",
  "resume": "The lives and loves of the young staff who work in a successful Dublin restaurant and the intense friendships and bitter rivalries that blossom in the heat of the kitchen.",
  "rate": "80.0",
  "genre": [
    "Drama"
  ],
  "cast": [
    "Charlene McKenna",
    "Damon Gameau",
    "Aisling O'Sullivan",
    "Kelly Gough",
    "Keith McErlean"
  ],
  "character": [
    "Jojo Harte",
    "Geoff Mitchell",
    "Fiona Kelly",
    "Kate Kelly",
    "Shane Harte"
  ],
  "site_data": "html Apps Forums Leaderboard Contribute API Support Discover Movies TV Shows Movies Popular Top Rated Upcoming Now Playing TV Shows Popular Top Rated On TV Airing Today People Popular People Can't find a movie or TV show? Login to create it. en Login Sign Up  ID: 7449   Expand Raw   (2008) User Score Overview The lives and loves of the young staff who work in a successful Dublin restaurant and the intense friendships and bitter rivalries that blossom in the heat of the kitchen. Featured Crew Lisa McGee Creator Discussions   Reviews Videos   Images   Changes Report Share Discussions General  0 Content Issues  1 Images Backdrops  11 Posters  1 Videos Trailers  0 Teasers  0 Clips  0 Featurettes  0 Opening Credits  0 Top Billed Cast Charlene McKenna Jojo Harte Damon Gameau Geoff Mitchell Aisling O'Sullivan Fiona Kelly Kelly Gough Kate Kelly Keith McErlean Shane Harte Full Cast & Crew Last Season Season 5 2013 | 6 Episodes Season 5 of Raw premiered on January  6, 2013. View All Seasons Social Reviews  0 Discussions  1 Subject Status Replies Last Reply There are no discussions for Raw. Login to be first! Go to Discussions Media Most Popular Videos  0 Backdrops  11 Posters  1 Recommendations We don't have enough data to suggest any TV shows based on Raw. You can help by rating TV shows you've seen. Facts Status  Cancelled Network Certification 18 Meaning Films rated 18 are for adults. No-one under 18 is allowed to see an 18 film at the cinema or buy / rent an 18 rated video. No 18 rated works are suitable for children. Type  Scripted Original Language  English Runtime  60m Homepage   http://www.rte.ie/tv/raw/ Genres Drama Keywords restaurant dublin Content Score 93 Almost there... Top Contributors 71 United600 16 Marr \ud83c\uddf3\ud83c\uddf1 12 Banana s 3 speedycars  View Edit History Popularity Trend  Login to edit  URL By  signing up  for an account on TMDb, you can post directly to Twitter and Facebook. You need to be logged in to continue. Click  here  to login or  here  to sign up.    page_wrap opened in html_head  Join the Community The Basics About TMDb Contact Us Support Forums API Blog Get Involved  Contribution Bible 3rd Party Applications Add New Movie Add New TV Show Community Guidelines Leaderboard Forums Twitter Facebook Legal Terms of Use Privacy Policy Login Sign Up"
}