{
  "link": "https://www.themoviedb.org/tv/62163?language=en",
  "title": "80's",
  "resume": "We don't have an overview translated in English. Help us expand our database by adding one.",
  "rate": "0.0",
  "genre": [
    "Comedy"
  ],
  "cast": [
    "Alexandr Yakin",
    "Natalya Zemtsova",
    "Aleksandr Polovtsev",
    "Mariya Aronova",
    "Dmitriy Belotserkovskiy"
  ],
  "character": [
    "\u0412\u0430\u043d\u044f",
    "\u0418\u043d\u0433\u0430 \u0411\u043e\u0440\u043e\u0434\u0438\u043d\u0430",
    "Gena, Vanya's father",
    "Lyuda, Vanya's mother",
    "Sergey Yakovlev"
  ],
  "site_data": "html Apps Forums Leaderboard Contribute API Support Discover Movies TV Shows Movies Popular Top Rated Upcoming Now Playing TV Shows Popular Top Rated On TV Airing Today People Popular People Can't find a movie or TV show? Login to create it. en Login Sign Up  ID: 62163   Expand 80's   (2012) User Score Overview We don't have an overview translated in English. Help us expand our database by adding one. Discussions   Reviews Videos   Images   Changes Report Share Discussions General  0 Content Issues  0 Images Backdrops  2 Posters  1 Videos Trailers  0 Teasers  0 Clips  0 Featurettes  0 Opening Credits  0 Top Billed Cast Alexandr Yakin \u0412\u0430\u043d\u044f Natalya Zemtsova \u0418\u043d\u0433\u0430 \u0411\u043e\u0440\u043e\u0434\u0438\u043d\u0430 Aleksandr Polovtsev Gena, Vanya's father Mariya Aronova Lyuda, Vanya's mother Dmitriy Belotserkovskiy Sergey Yakovlev Full Cast & Crew Last Season Season 6 2016 | 13 Episodes Season 6 of 80's premiered on August  1, 2016. View All Seasons Social Reviews  0 Discussions  0 Media Most Popular Videos  0 Backdrops  2 Posters  1 Recommendations We don't have enough data to suggest any TV shows based on 80's. You can help by rating TV shows you've seen. Facts Original Name  \u0412\u043e\u0441\u044c\u043c\u0438\u0434\u0435\u0441\u044f\u0442\u044b\u0435 Status  Ended Network Certification 16+ Meaning Only teens the age of 16 or older can watch. Type  Scripted Original Language  Russian Runtime  25m Homepage   http://ctc.ru/rus/projects/serials/vosmidesyatye/ Genres Comedy Keywords No keywords have been added. Content Score 79 Pump it up! We're close now. Top Contributors G 55 G_Keeper 6 mrtextortexel 6 West@ m 4 maltsev.v.v  View Edit History Popularity Trend  Login to edit  URL By  signing up  for an account on TMDb, you can post directly to Twitter and Facebook. You need to be logged in to continue. Click  here  to login or  here  to sign up.    page_wrap opened in html_head  Join the Community The Basics About TMDb Contact Us Support Forums API Blog Get Involved  Contribution Bible 3rd Party Applications Add New Movie Add New TV Show Community Guidelines Leaderboard Forums Twitter Facebook Legal Terms of Use Privacy Policy Login Sign Up"
}