{
  "link": "https://www.themoviedb.org/tv/70749?language=en",
  "title": "Murder with Friends",
  "resume": "In Murder With Friends, Grace Baldridge invites guests to talk about some of history's most notorious murderers.",
  "rate": "100.0",
  "genre": [
    "Crime",
    "Documentary",
    "Talk"
  ],
  "cast": [
    "Grace Baldridge"
  ],
  "character": [
    "Host"
  ],
  "site_data": "html Apps Forums Leaderboard Contribute API Support Discover Movies TV Shows Movies Popular Top Rated Upcoming Now Playing TV Shows Popular Top Rated On TV Airing Today People Popular People Can't find a movie or TV show? Login to create it. en Login Sign Up  ID: 70749   Expand Murder with Friends   (2016) User Score  Play Trailer Overview In Murder With Friends, Grace Baldridge invites guests to talk about some of history's most notorious murderers. Featured Crew Grace Baldridge Creator Amir Nikoui Creator Discussions   Reviews Videos   Images   Changes Report Share Discussions General  0 Content Issues  0 Images Backdrops  0 Posters  1 Videos Trailers  1 Teasers  1 Clips  0 Featurettes  1 Opening Credits  0 Top Billed Cast Grace Baldridge Host Full Cast & Crew Current Season Season 2 2017 | 64 Episodes Season 2 of Murder with Friends premiered on October 11, 2017. View All Seasons Social Reviews  0 Discussions  0 Media Most Popular Videos  3 Backdrops  0 Posters  1 Recommendations We don't have enough data to suggest any TV shows based on Murder with Friends. You can help by rating TV shows you've seen. Facts Status  Returning Series Network Certification TV-MA Meaning This program is specifically designed to be viewed by adults and therefore may be unsuitable for children under 17 Type  Scripted Original Language  English Runtime  20m Homepage   https://tytnetwork.com/category/murder-with-friends/ Genres Crime Documentary Talk Keywords assassination talk show cult discussion murder murderer massacre death youtube youtuber Content Score 56 We're so close, yet so far. Top Contributors 65 wmorgan23 TB 4 TMDb Bot  View Edit History Popularity Trend  Login to edit  URL By  signing up  for an account on TMDb, you can post directly to Twitter and Facebook. You need to be logged in to continue. Click  here  to login or  here  to sign up.    page_wrap opened in html_head  Join the Community The Basics About TMDb Contact Us Support Forums API Blog Get Involved  Contribution Bible 3rd Party Applications Add New Movie Add New TV Show Community Guidelines Leaderboard Forums Twitter Facebook Legal Terms of Use Privacy Policy Login Sign Up"
}