{
  "link": "https://www.themoviedb.org/tv/56817?language=en",
  "title": "Moone Boy",
  "resume": "Martin Moone is a young boy who relies on the help of his imaginary friend Sean to deal with the quandaries of life in a wacky small-town Irish family in the 1980's.",
  "rate": "",
  "genre": [
    "Comedy"
  ],
  "cast": {
    "actor": [
      "Chris O'Dowd",
      "David Rawle",
      "Deirdre O'Kane",
      "Clare Monnelly",
      "Sarah White"
    ]
  },
  "characters": {
    "characters": [
      "Sean Murphy",
      "Martin Moone",
      "Debra Moone",
      "Fidelma Moone",
      "Sinead Moone"
    ]
  },
  "site_data": "html Apps Forums Leaderboard Contribute API Support Discover Movies TV Shows Movies Popular Top Rated Upcoming Now Playing TV Shows Popular Top Rated On TV Airing Today People Popular People Can't find a movie or TV show? Login to create it. en Login Sign Up  ID: 56817   Expand Moone Boy   (2012) User Score Overview Martin Moone is a young boy who relies on the help of his imaginary friend Sean to deal with the quandaries of life in a wacky small-town Irish family in the 1980's. Featured Crew Chris O'Dowd Creator Discussions   Reviews Videos   Images   Changes Report Share Discussions General  0 Content Issues  0 Images Backdrops  2 Posters  1 Videos Trailers  0 Teasers  0 Clips  0 Featurettes  0 Opening Credits  0 Top Billed Cast Chris O'Dowd Sean Murphy David Rawle Martin Moone Deirdre O'Kane Debra Moone Clare Monnelly Fidelma Moone Sarah White Sinead Moone Full Cast & Crew Last Season Series 3 2015 | 6 Episodes Season 3 of Moone Boy premiered on March  2, 2015. View All Seasons Social Reviews  0 Discussions  0 Media Most Popular Videos  0 Backdrops  2 Posters  1 Recommendations   2015-08-12 Kevin from Work 5.2    2010-12-25 Come Fly With Me 6.6    2011-10-14 Spy 7.6    2013-05-12 Family Tree 6.2    2010-08-15 Vexed 7.2    2011-02-09 Mr. Sunshine 6.4    2015-03-17 One Big Happy 6.0    2013-10-20 Toast of London 6.8  Facts Status  Returning Series Network Certification TV-14 Meaning This program contains some material that many parents would find unsuitable for children under 14 years of age. Type  Scripted Original Language  English Runtime  22m Homepage   http://www.sky.com/tv/show/moone-boy Genres Comedy Keywords No keywords have been added. Content Score 93 Almost there... Top Contributors 32 Elizabeth Jennings 8 lineker m 3 morrison w 3 webmaster  View Edit History Popularity Trend  Login to edit  URL By  signing up  for an account on TMDb, you can post directly to Twitter and Facebook. You need to be logged in to continue. Click  here  to login or  here  to sign up.    page_wrap opened in html_head  Join the Community The Basics About TMDb Contact Us Support Forums API Blog Get Involved  Contribution Bible 3rd Party Applications Add New Movie Add New TV Show Community Guidelines Leaderboard Forums Twitter Facebook Legal Terms of Use Privacy Policy Login Sign Up"
}