{
  "link": "https://www.themoviedb.org/tv/75161?language=en",
  "title": "Magic Funhouse",
  "resume": "A series that peeks behind the curtain of a public access children's TV show to reveal the offensive lives of the cast and crew when the cameras are off.",
  "rate": "",
  "genre": [
    "Comedy"
  ],
  "cast": {
    "actor": [
      "Brandon Rogers",
      "Jess Weaver",
      "Elise Christian",
      "Alex Diehl",
      "TJ Smith"
    ]
  },
  "characters": {
    "characters": [
      "Arlo",
      "Dave",
      "Sacha",
      "Jimmy",
      "Cliff"
    ]
  },
  "site_data": "html Apps Forums Leaderboard Contribute API Support Discover Movies TV Shows Movies Popular Top Rated Upcoming Now Playing TV Shows Popular Top Rated On TV Airing Today People Popular People Can't find a movie or TV show? Login to create it. en Login Sign Up  ID: 75161   Expand Magic Funhouse   (2016) User Score  Play Trailer Overview A series that peeks behind the curtain of a public access children's TV show to reveal the offensive lives of the cast and crew when the cameras are off. Featured Crew Brandon Rogers Creator Discussions   Reviews Videos   Images   Changes Report Share Discussions General  0 Content Issues  0 Images Backdrops  1 Posters  1 Videos Trailers  2 Teasers  0 Clips  0 Featurettes  0 Opening Credits  0 Top Billed Cast Brandon Rogers Arlo Jess Weaver Dave Elise Christian Sacha Alex Diehl Jimmy TJ Smith Cliff Full Cast & Crew Last Season Season 2 2017 | 7 Episodes Season 2 of Magic Funhouse premiered on August 24, 2017. View All Seasons Social Reviews  0 Discussions  0 Media Most Popular Videos  2 Backdrops  1 Posters  1 Recommendations We don't have enough data to suggest any TV shows based on Magic Funhouse. You can help by rating TV shows you've seen. Facts Status  Returning Series Network Certification  - Type  Scripted Original Language  English Runtime  - Homepage  - Genres Comedy Keywords No keywords have been added. Content Score 100 Yes! Looking good! Top Contributors 30 mthakati TB 2 TMDb Bot  View Edit History Popularity Trend  Login to edit  URL By  signing up  for an account on TMDb, you can post directly to Twitter and Facebook. You need to be logged in to continue. Click  here  to login or  here  to sign up.    page_wrap opened in html_head  Join the Community The Basics About TMDb Contact Us Support Forums API Blog Get Involved  Contribution Bible 3rd Party Applications Add New Movie Add New TV Show Community Guidelines Leaderboard Forums Twitter Facebook Legal Terms of Use Privacy Policy Login Sign Up"
}