{
  "link": "https://www.themoviedb.org/tv/60632?language=en",
  "title": "The Color of Passion",
  "resume": "'The Color of Passion' is a Mexican telenovela produced by Roberto Gom\u00e9z Fern\u00e1ndez for Televisa.",
  "rate": "80.0",
  "genre": [
    "Drama"
  ],
  "cast": [
    "Esmeralda Pimentel",
    "Erick El\u00edas",
    "Claudia Ram\u00edrez",
    "Ren\u00e9 Strickler",
    "Eugenia Cauduro"
  ],
  "character": [
    "Luc\u00eda Gaxiola Murillo",
    "Marcelo Escalante",
    "Rebeca Murillo de Gaxiola",
    "Alonso Gaxiola",
    "Magdalena Murillo"
  ],
  "site_data": "html Apps Forums Leaderboard Contribute API Support Discover Movies TV Shows Movies Popular Top Rated Upcoming Now Playing TV Shows Popular Top Rated On TV Airing Today People Popular People Can't find a movie or TV show? Login to create it. en Login Sign Up  ID: 60632   Expand The Color of Passion   (2014) User Score Overview 'The Color of Passion' is a Mexican telenovela produced by Roberto Gom\u00e9z Fern\u00e1ndez for Televisa. Featured Crew Cuauht\u00e9moc Blanco Creator Mar\u00eda del Carmen Pe\u00f1a Creator Discussions   Reviews Videos   Images   Changes Report Share Discussions General  0 Content Issues  0 Images Backdrops  2 Posters  2 Videos Trailers  0 Teasers  0 Clips  0 Featurettes  0 Opening Credits  0 Top Billed Cast Esmeralda Pimentel Luc\u00eda Gaxiola Murillo Erick El\u00edas Marcelo Escalante Claudia Ram\u00edrez Rebeca Murillo de Gaxiola Ren\u00e9 Strickler Alonso Gaxiola Eugenia Cauduro Magdalena Murillo Full Cast & Crew Last Season Season 1 2014 | 12 Episodes Season 1 of The Color of Passion premiered on March 17, 2014. View All Seasons Social Reviews  0 Discussions  0 Media Most Popular Videos  0 Backdrops  2 Posters  2 Recommendations We don't have enough data to suggest any TV shows based on The Color of Passion. You can help by rating TV shows you've seen. Facts Original Name  El color de la pasi\u00f3n: Directo al coraz\u00f3n Status  Ended Network Certification  - Type  Scripted Original Language  English Runtime  45m Homepage   http://www.televisa.com/telenovelas/el-color-de-la-pasion/ Genres Drama Keywords telenovela Content Score 93 Almost there... Top Contributors s 138 shiff7 V 2 Vaine  View Edit History Popularity Trend  Login to edit  URL By  signing up  for an account on TMDb, you can post directly to Twitter and Facebook. You need to be logged in to continue. Click  here  to login or  here  to sign up.    page_wrap opened in html_head  Join the Community The Basics About TMDb Contact Us Support Forums API Blog Get Involved  Contribution Bible 3rd Party Applications Add New Movie Add New TV Show Community Guidelines Leaderboard Forums Twitter Facebook Legal Terms of Use Privacy Policy Login Sign Up"
}