{
  "link": "https://www.themoviedb.org/tv/68754?language=en",
  "title": "Marche \u00e0 l'ombre",
  "resume": "We don't have an overview translated in English. Help us expand our database by adding one.",
  "rate": "",
  "genre": [
    "Crime",
    "Drama"
  ],
  "cast": {
    "actor": [
      "Laurence Leboeuf",
      "Catherine Brunet",
      "\u00c9ric Robidoux",
      "\u00c8ve Duranceau",
      "Sylvain Marcel "
    ]
  },
  "characters": {
    "characters": [
      "Rachel Marchand",
      "Audrey Cardin",
      "Tom Favreau",
      "Tania Lessard",
      "Gilbert"
    ]
  },
  "site_data": "html Apps Forums Leaderboard Contribute API Support Discover Movies TV Shows Movies Popular Top Rated Upcoming Now Playing TV Shows Popular Top Rated On TV Airing Today People Popular People Can't find a movie or TV show? Login to create it. en Login Sign Up  ID: 68754   Expand Marche \u00e0 l'ombre   (2015) User Score Overview We don't have an overview translated in English. Help us expand our database by adding one. Featured Crew Ian Lauzon Creator Ludovic Huot Creator Discussions   Reviews Videos   Images   Changes Report Share Discussions General  0 Content Issues  1 Images Backdrops  0 Posters  4 Videos Trailers  0 Teasers  0 Clips  0 Featurettes  0 Opening Credits  0 Top Billed Cast Laurence Leboeuf Rachel Marchand Catherine Brunet Audrey Cardin \u00c9ric Robidoux Tom Favreau \u00c8ve Duranceau Tania Lessard Sylvain Marcel  Gilbert Full Cast & Crew Current Season Season 3 2017 | 6 Episodes Season 3 of Marche \u00e0 l'ombre premiered on October 12, 2017. View All Seasons Social Reviews  0 Discussions  1 Subject Status Replies Last Reply There are no discussions for Marche \u00e0 l'ombre. Login to be first! Go to Discussions Media Most Popular Videos  0 Backdrops  0 Posters  4 Recommendations We don't have enough data to suggest any TV shows based on Marche \u00e0 l'ombre. You can help by rating TV shows you've seen. Facts Status  Returning Series Network Certification  - Type  Scripted Original Language  French Runtime  50m Homepage   http://marchealombre.superecran.com/ Genres Crime Drama Keywords No keywords have been added. Content Score 71 Just a little bit more... Top Contributors b 14 bounty 11 Guipat 9 Lewis 8 Xordok  View Edit History Popularity Trend  Login to edit  URL By  signing up  for an account on TMDb, you can post directly to Twitter and Facebook. You need to be logged in to continue. Click  here  to login or  here  to sign up.    page_wrap opened in html_head  Join the Community The Basics About TMDb Contact Us Support Forums API Blog Get Involved  Contribution Bible 3rd Party Applications Add New Movie Add New TV Show Community Guidelines Leaderboard Forums Twitter Facebook Legal Terms of Use Privacy Policy Login Sign Up"
}