{
  "link": "https://www.themoviedb.org/tv/73933?language=en",
  "title": "Bizim Hikaye",
  "resume": "Adaptation of the world famous series \"Shameless\"",
  "rate": "0.0",
  "genre": [
    "Comedy",
    "Drama"
  ],
  "cast": [
    "Hazal Kaya",
    "Burak Deniz",
    "Reha \u00d6zcan",
    "Nesrin Cavadzade",
    "Ya\u011f\u0131zcan Konyal\u0131"
  ],
  "character": [
    "Filiz",
    "Bar\u0131\u015f",
    "Fikri",
    "T\u00fclay",
    "Rahmet"
  ],
  "site_data": "html Apps Forums Leaderboard Contribute API Support Discover Movies TV Shows Movies Popular Top Rated Upcoming Now Playing TV Shows Popular Top Rated On TV Airing Today People Popular People Can't find a movie or TV show? Login to create it. en Login Sign Up  ID: 73933   Expand Bizim Hikaye   (2017) User Score Overview Adaptation of the world famous series \"Shameless\" Featured Crew Serdar G\u00f6zelekli Creator Discussions   Reviews Videos   Images   Changes Report Share Discussions General  0 Content Issues  1 Images Backdrops  1 Posters  1 Videos Trailers  0 Teasers  0 Clips  0 Featurettes  0 Opening Credits  0 Top Billed Cast Hazal Kaya Filiz Burak Deniz Bar\u0131\u015f Reha \u00d6zcan Fikri Nesrin Cavadzade T\u00fclay Ya\u011f\u0131zcan Konyal\u0131 Rahmet Full Cast & Crew Last Season Season 1 2017 | 33 Episodes Season 1 of Bizim Hikaye premiered on September 14, 2017. View All Seasons Social Reviews  0 Discussions  1 Subject Status Replies Last Reply There are no discussions for Bizim Hikaye. Login to be first! Go to Discussions Media Most Popular Videos  0 Backdrops  1 Posters  1 Recommendations We don't have enough data to suggest any TV shows based on Bizim Hikaye. You can help by rating TV shows you've seen. Facts Status  Returning Series Network Certification  - Type  Scripted Original Language  Turkish Runtime  120m Homepage  - Genres Comedy Drama Keywords No keywords have been added. Content Score 93 Almost there... Top Contributors 22 moviefars 12 tago1987 5 irvincandia z 2 zerox  View Edit History Popularity Trend  Login to edit  URL By  signing up  for an account on TMDb, you can post directly to Twitter and Facebook. You need to be logged in to continue. Click  here  to login or  here  to sign up.    page_wrap opened in html_head  Join the Community The Basics About TMDb Contact Us Support Forums API Blog Get Involved  Contribution Bible 3rd Party Applications Add New Movie Add New TV Show Community Guidelines Leaderboard Forums Twitter Facebook Legal Terms of Use Privacy Policy Login Sign Up"
}