{
  "link": "https://www.themoviedb.org/tv/69760?language=en",
  "title": "The New Edition Story",
  "resume": "Follow the story of R&B pioneers Michael Bivins, Ricky Bell, Ronnie Devoe, Bobby Brown, Ralph Tresvant and Johnny Gill as they navigate fame from their native Boston to Hollywood and beyond.",
  "rate": "",
  "genre": [
    "Drama"
  ],
  "cast": {
    "actor": [
      "Wood Harris",
      "Krystal M. Harris",
      "Woody McClain",
      "Caleb McLaughlin",
      "Myles Truitt"
    ]
  },
  "characters": {
    "characters": [
      "Brooke Payne",
      "Zena Tresvant",
      "Bobby Brown",
      "Young Ricky Bell",
      "Young Ronnie DeVoe"
    ]
  },
  "site_data": "html Apps Forums Leaderboard Contribute API Support Discover Movies TV Shows Movies Popular Top Rated Upcoming Now Playing TV Shows Popular Top Rated On TV Airing Today People Popular People Can't find a movie or TV show? Login to create it. en Login Sign Up  ID: 69760   Expand The New Edition Story   (2017) User Score  Play Trailer Overview Follow the story of R&B pioneers Michael Bivins, Ricky Bell, Ronnie Devoe, Bobby Brown, Ralph Tresvant and Johnny Gill as they navigate fame from their native Boston to Hollywood and beyond. Discussions   Reviews Videos   Images   Changes Report Share Discussions General  0 Content Issues  1 Images Backdrops  3 Posters  4 Videos Trailers  1 Teasers  0 Clips  0 Featurettes  0 Opening Credits  0 Top Billed Cast Wood Harris Brooke Payne Krystal M. Harris Zena Tresvant Woody McClain Bobby Brown Caleb McLaughlin Young Ricky Bell Myles Truitt Young Ronnie DeVoe Full Cast & Crew Last Season Season 1 2017 | 3 Episodes Season 1 of The New Edition Story premiered on January 24, 2017. View All Seasons Social Reviews  1 Discussions  1 j A review by jackson980 Written by  jackson980  on January 25, 2017 From their humble beginnings in Boston to their chart topping super status - The New Edition Story chronicles the storied journey of one of America's most beloved boy bands. Read All Reviews Media Most Popular Videos  1 Backdrops  3 Posters  4 Recommendations We don't have enough data to suggest any TV shows based on The New Edition Story. You can help by rating TV shows you've seen. Facts Status  Ended Network Certification  - Type  Miniseries Original Language  English Runtime  - Homepage   http://www.bet.com/shows/the-new-edition-story.html Genres Drama Keywords biography miniseries Content Score 93 Almost there... Top Contributors TB 17 TMDb Bot D 16 Danny 12 Banana D 4 Derek.Jo.Lee88  View Edit History Popularity Trend  Login to edit  URL By  signing up  for an account on TMDb, you can post directly to Twitter and Facebook. You need to be logged in to continue. Click  here  to login or  here  to sign up.    page_wrap opened in html_head  Join the Community The Basics About TMDb Contact Us Support Forums API Blog Get Involved  Contribution Bible 3rd Party Applications Add New Movie Add New TV Show Community Guidelines Leaderboard Forums Twitter Facebook Legal Terms of Use Privacy Policy Login Sign Up"
}