{
  "link": "https://www.themoviedb.org/tv/20777?language=en",
  "title": "Stolberg",
  "resume": "Stolberg is a German detective television series, starring chief inspector Martin Stolberg. The series is more serious and less flashy than other contemporary German detective series.",
  "rate": "0.0",
  "genre": [
    "Crime"
  ],
  "cast": [
    "Rudolf Kowalski",
    "Eva Scheurer",
    "Victoria Mayer",
    "Annett Renneberg",
    "Wanja Mues"
  ],
  "character": [
    "Kriminalhauptkommissar Martin Stolberg",
    "Dr. Hannah Voskort",
    "Kriminaloberkommissarin Sofia Lechner",
    "Kriminaloberkommissarin Catharina Brandt",
    "Kriminaloberkommissar Nico Schreiber"
  ],
  "site_data": "html Apps Forums Leaderboard Contribute API Support Discover Movies TV Shows Movies Popular Top Rated Upcoming Now Playing TV Shows Popular Top Rated On TV Airing Today People Popular People Can't find a movie or TV show? Login to create it. en Login Sign Up  ID: 20777   Expand Stolberg   (2006) User Score Overview Stolberg is a German detective television series, starring chief inspector Martin Stolberg. The series is more serious and less flashy than other contemporary German detective series. Discussions   Reviews Videos   Images   Changes Report Share Discussions General  0 Content Issues  0 Images Backdrops  1 Posters  1 Videos Trailers  0 Teasers  0 Clips  0 Featurettes  0 Opening Credits  0 Top Billed Cast Rudolf Kowalski Kriminalhauptkommissar Martin Stolberg Eva Scheurer Dr. Hannah Voskort Victoria Mayer Kriminaloberkommissarin Sofia Lechner Annett Renneberg Kriminaloberkommissarin Catharina Brandt Wanja Mues Kriminaloberkommissar Nico Schreiber Full Cast & Crew Last Season Season 12 2013 | 4 Episodes Season 12 of Stolberg premiered on January 12, 2013. View All Seasons Social Reviews  0 Discussions  0 Media Most Popular Videos  0 Backdrops  1 Posters  1 Recommendations We don't have enough data to suggest any TV shows based on Stolberg. You can help by rating TV shows you've seen. Facts Status  Ended Network Certification  - Type  Scripted Original Language  German Runtime  60m Homepage   http://stolberg.zdf.de/kommissar-stolberg/kommissar-stolberg-5989920.html Genres Crime Keywords police inspector Content Score 86 Almost there... Top Contributors S 114 Samara N 2 N0b1eman  View Edit History Popularity Trend  Login to edit  URL By  signing up  for an account on TMDb, you can post directly to Twitter and Facebook. You need to be logged in to continue. Click  here  to login or  here  to sign up.    page_wrap opened in html_head  Join the Community The Basics About TMDb Contact Us Support Forums API Blog Get Involved  Contribution Bible 3rd Party Applications Add New Movie Add New TV Show Community Guidelines Leaderboard Forums Twitter Facebook Legal Terms of Use Privacy Policy Login Sign Up"
}