{
  "link": "https://www.themoviedb.org/tv/29974?language=en",
  "title": "Vrienden voor het Leven",
  "resume": "Comedy about a young couple who lives together and tries to be a modern family.",
  "rate": "77.0",
  "genre": [
    "Comedy"
  ],
  "cast": [
    "Peter Lusse",
    "Mary-Lou van Steenis"
  ],
  "character": [
    "Eddie",
    "Ellen"
  ],
  "site_data": "html Apps Forums Leaderboard Contribute API Support Discover Movies TV Shows Movies Popular Top Rated Upcoming Now Playing TV Shows Popular Top Rated On TV Airing Today People Popular People Can't find a movie or TV show? Login to create it. en Login Sign Up  ID: 29974   Expand Vrienden voor het Leven   (1991) User Score Overview Comedy about a young couple who lives together and tries to be a modern family. Featured Crew Joop van den Ende Creator Discussions   Reviews Videos   Images   Changes Report Share Discussions General  0 Content Issues  0 Images Backdrops  1 Posters  1 Videos Trailers  0 Teasers  0 Clips  0 Featurettes  0 Opening Credits  0 Top Billed Cast Peter Lusse Eddie Mary-Lou van Steenis Ellen Full Cast & Crew Last Season Season 5 \u2014 | 13 Episodes We don't have an overview translated in English. Help us expand our database by adding one. View All Seasons Social Reviews  0 Discussions  0 Media Most Popular Videos  0 Backdrops  1 Posters  1 Recommendations   2016-02-26 Fuller House 5.6  Facts Status  Ended Network Certification  - Type  Scripted Original Language  Dutch; Flemish Runtime  30m Homepage  - Genres Comedy Keywords No keywords have been added. Content Score 64 We're so close, yet so far. Top Contributors m 15 mis3v 5 Hollander_1908 2 Roy  View Edit History Popularity Trend  Login to edit  URL By  signing up  for an account on TMDb, you can post directly to Twitter and Facebook. You need to be logged in to continue. Click  here  to login or  here  to sign up.    page_wrap opened in html_head  Join the Community The Basics About TMDb Contact Us Support Forums API Blog Get Involved  Contribution Bible 3rd Party Applications Add New Movie Add New TV Show Community Guidelines Leaderboard Forums Twitter Facebook Legal Terms of Use Privacy Policy Login Sign Up"
}