{
  "link": "https://www.themoviedb.org/tv/66518?language=en",
  "title": "Coupled",
  "resume": "Coupled follows 12 single, smart and young professional women looking for love who will meet face-to-face with eligible single men against the beautiful backdrop of the Caribbean islands.",
  "rate": "",
  "genre": [
    "Reality"
  ],
  "cast": {
    "actor": [
      "Terrence Jenkins"
    ]
  },
  "characters": {
    "characters": [
      "Host"
    ]
  },
  "site_data": "html Apps Forums Leaderboard Contribute API Support Discover Movies TV Shows Movies Popular Top Rated Upcoming Now Playing TV Shows Popular Top Rated On TV Airing Today People Popular People Can't find a movie or TV show? Login to create it. en Login Sign Up  ID: 66518   Expand Coupled   (2016) User Score Overview Coupled follows 12 single, smart and young professional women looking for love who will meet face-to-face with eligible single men against the beautiful backdrop of the Caribbean islands. Featured Crew Mark Burnett Creator Discussions   Reviews Videos   Images   Changes Report Share Discussions General  0 Content Issues  0 Images Backdrops  2 Posters  1 Videos Trailers  0 Teasers  0 Clips  0 Featurettes  0 Opening Credits  0 Top Billed Cast Terrence Jenkins Host Full Cast & Crew Last Season Season 1 2016 | 11 Episodes Season 1 of Coupled premiered on May 17, 2016. View All Seasons Social Reviews  0 Discussions  0 Media Most Popular Videos  0 Backdrops  2 Posters  1 Recommendations We don't have enough data to suggest any TV shows based on Coupled. You can help by rating TV shows you've seen. Facts Status  Returning Series Network Certification TV-14 Meaning This program contains some material that many parents would find unsuitable for children under 14 years of age. Type  Reality Original Language  English Runtime  44m Homepage   http://www.fox.com/coupled Genres Reality Keywords dating show Content Score 64 We're so close, yet so far. Top Contributors 19 Banana 11 Elizabeth Jennings a 4 agus-rheiza C 4 Carulux  View Edit History Popularity Trend  Login to edit  URL By  signing up  for an account on TMDb, you can post directly to Twitter and Facebook. You need to be logged in to continue. Click  here  to login or  here  to sign up.    page_wrap opened in html_head  Join the Community The Basics About TMDb Contact Us Support Forums API Blog Get Involved  Contribution Bible 3rd Party Applications Add New Movie Add New TV Show Community Guidelines Leaderboard Forums Twitter Facebook Legal Terms of Use Privacy Policy Login Sign Up"
}