{
  "link": "https://www.themoviedb.org/tv/5402?language=en",
  "title": "Once Upon a Time... The Discoverers",
  "resume": "Il \u00e9tait une fois... les D\u00e9couvreurs was a French animated TV series from 1994. Directed by Albert Barill\u00e9.",
  "rate": "",
  "genre": [
    "Kids",
    "Documentary",
    "Animation",
    "Family"
  ],
  "cast": {
    "actor": [
      "Josef Meinrad",
      "Roger Carel"
    ]
  },
  "characters": {
    "characters": [
      "Narrateur"
    ]
  },
  "site_data": "html Apps Forums Leaderboard Contribute API Support Discover Movies TV Shows Movies Popular Top Rated Upcoming Now Playing TV Shows Popular Top Rated On TV Airing Today People Popular People Can't find a movie or TV show? Login to create it. en Login Sign Up  ID: 5402   Expand Once Upon a Time... The Discoverers   (1994) User Score Overview Il \u00e9tait une fois... les D\u00e9couvreurs was a French animated TV series from 1994. Directed by Albert Barill\u00e9. Featured Crew Albert Barill\u00e9 Creator Discussions   Reviews Videos   Images   Changes Report Share Discussions General  0 Content Issues  6 Images Backdrops  2 Posters  8 Videos Trailers  0 Teasers  0 Clips  1 Featurettes  0 Opening Credits  0 Top Billed Cast Josef Meinrad Roger Carel Narrateur Full Cast & Crew Last Season Season 7 \u2014 | 5 Episodes We don't have an overview translated in English. Help us expand our database by adding one. View All Seasons Social Reviews  0 Discussions  6 Subject Status Replies Last Reply There are no discussions for Once Upon a Time... The Discoverers. Login to be first! Go to Discussions Media Most Popular Videos  1 Backdrops  2 Posters  8 Recommendations   1998-01-17 Once Upon a Time... The Explorers 7.8    1992-03-13 Once Upon a Time... The Americas 8.6    1982-10-08 Once upon a time\u2026 Space 5.9    1979-03-24 Once Upon a Time... Man 8.2    1987-06-17 Once Upon a Time... Life 8.0  Facts Original Name  Il \u00e9tait une fois... les d\u00e9couvreurs Status  Returning Series Network Certification  - Type  Scripted Original Language  French Runtime  26m Homepage  - Genres Kids Documentary Animation Family Keywords No keywords have been added. Content Score 71 Just a little bit more... Top Contributors K 26 Karlosd3 M 8 Manu d 7 dune2000 m 7 mrpp  View Edit History Popularity Trend  Login to edit  URL By  signing up  for an account on TMDb, you can post directly to Twitter and Facebook. You need to be logged in to continue. Click  here  to login or  here  to sign up.    page_wrap opened in html_head  Join the Community The Basics About TMDb Contact Us Support Forums API Blog Get Involved  Contribution Bible 3rd Party Applications Add New Movie Add New TV Show Community Guidelines Leaderboard Forums Twitter Facebook Legal Terms of Use Privacy Policy Login Sign Up"
}