{
  "link": "https://www.themoviedb.org/tv/43237?language=en",
  "title": "The Lizzie Bennet Diaries",
  "resume": "We don't have an overview translated in English. Help us expand our database by adding one.",
  "rate": "",
  "genre": [
    "Comedy"
  ],
  "cast": {
    "actor": [
      "Christopher Sean",
      "Wes Aderhold",
      "Laura Spencer",
      "Ashley Clements",
      "Julia Cho"
    ]
  },
  "characters": {
    "characters": [
      "Bing Lee",
      "George Wickham",
      "Jane Bennet",
      "Lizzie Bennet",
      "Charlotte Lu"
    ]
  },
  "site_data": "html Apps Forums Leaderboard Contribute API Support Discover Movies TV Shows Movies Popular Top Rated Upcoming Now Playing TV Shows Popular Top Rated On TV Airing Today People Popular People Can't find a movie or TV show? Login to create it. en Login Sign Up  ID: 43237   Expand The Lizzie Bennet Diaries   (2012) User Score Overview We don't have an overview translated in English. Help us expand our database by adding one. Discussions   Reviews Videos   Images   Changes Report Share Discussions General  0 Content Issues  0 Images Backdrops  1 Posters  1 Videos Trailers  0 Teasers  0 Clips  0 Featurettes  0 Opening Credits  0 Top Billed Cast Christopher Sean Bing Lee Wes Aderhold George Wickham Laura Spencer Jane Bennet Ashley Clements Lizzie Bennet Julia Cho Charlotte Lu Full Cast & Crew Last Season Season 1 2012 | 100 Episodes Season 1 of The Lizzie Bennet Diaries premiered on April  9, 2012. View All Seasons Social Reviews  0 Discussions  0 Media Most Popular Videos  0 Backdrops  1 Posters  1 Recommendations We don't have enough data to suggest any TV shows based on The Lizzie Bennet Diaries. You can help by rating TV shows you've seen. Facts Status  Ended Network Certification  - Type  Scripted Original Language  English Runtime  5m Homepage  - Genres Comedy Keywords No keywords have been added. Content Score 79 Pump it up! We're close now. Top Contributors 11 thamond R 2 Rebecca 1 Damien Haynes s 1 skyela95  View Edit History Popularity Trend  Login to edit  URL By  signing up  for an account on TMDb, you can post directly to Twitter and Facebook. You need to be logged in to continue. Click  here  to login or  here  to sign up.    page_wrap opened in html_head  Join the Community The Basics About TMDb Contact Us Support Forums API Blog Get Involved  Contribution Bible 3rd Party Applications Add New Movie Add New TV Show Community Guidelines Leaderboard Forums Twitter Facebook Legal Terms of Use Privacy Policy Login Sign Up"
}