{
  "link": "https://www.themoviedb.org/tv/70181?language=en",
  "title": "Animal Nation With Anthony Anderson",
  "resume": "A celebration of animals and the people who love them featuring viral videos, celebrity interviews, discussions of animal behavior, and comedian correspondents report from the field.",
  "rate": "0.0",
  "genre": [
    "Talk"
  ],
  "cast": [
    "Anthony Anderson"
  ],
  "character": [
    "Himself"
  ],
  "site_data": "html Apps Forums Leaderboard Contribute API Support Discover Movies TV Shows Movies Popular Top Rated Upcoming Now Playing TV Shows Popular Top Rated On TV Airing Today People Popular People Can't find a movie or TV show? Login to create it. en Login Sign Up  ID: 70181   Expand Animal Nation With Anthony Anderson   (2017) User Score Overview A celebration of animals and the people who love them featuring viral videos, celebrity interviews, discussions of animal behavior, and comedian correspondents report from the field. Discussions   Reviews Videos   Images   Changes Report Share Discussions General  0 Content Issues  0 Images Backdrops  1 Posters  2 Videos Trailers  0 Teasers  0 Clips  1 Featurettes  0 Opening Credits  0 Top Billed Cast Anthony Anderson Himself Full Cast & Crew Last Season Season 1 2017 | 9 Episodes Season 1 of Animal Nation With Anthony Anderson premiered on February 10, 2017. View All Seasons Social Reviews  0 Discussions  0 Media Most Popular Videos  1 Backdrops  1 Posters  2 Recommendations We don't have enough data to suggest any TV shows based on Animal Nation With Anthony Anderson. You can help by rating TV shows you've seen. Facts Status  Returning Series Network Certification  - Type  Talk Show Original Language  English Runtime  - Homepage   http://www.animalplanet.com/tv-shows/animal-nation-with-anthony-anderson/ Genres Talk Keywords No keywords have been added. Content Score 64 We're so close, yet so far. Top Contributors 28 Elizabeth Jennings a 5 alyashaq09 TB 1 TMDb Bot - 1 -Alexander-  View Edit History Popularity Trend  Login to edit  URL By  signing up  for an account on TMDb, you can post directly to Twitter and Facebook. You need to be logged in to continue. Click  here  to login or  here  to sign up.    page_wrap opened in html_head  Join the Community The Basics About TMDb Contact Us Support Forums API Blog Get Involved  Contribution Bible 3rd Party Applications Add New Movie Add New TV Show Community Guidelines Leaderboard Forums Twitter Facebook Legal Terms of Use Privacy Policy Login Sign Up"
}