{
  "link": "https://www.themoviedb.org/tv/67804?language=en",
  "title": "Motherland",
  "resume": "Sitcom about navigating the trials and traumas of middle-class motherhood, looking at the competitive and unromantic side of parenting.",
  "rate": "",
  "genre": [
    "Comedy"
  ],
  "cast": {
    "actor": [
      "Anna Maxwell Martin",
      "Diane Morgan",
      "Paul Ready",
      "Lucy Punch",
      "Philippa Dunne"
    ]
  },
  "characters": {
    "characters": [
      "Julia",
      "Liz",
      "Kevin",
      "Amanda",
      "Anne"
    ]
  },
  "site_data": "html Apps Forums Leaderboard Contribute API Support Discover Movies TV Shows Movies Popular Top Rated Upcoming Now Playing TV Shows Popular Top Rated On TV Airing Today People Popular People Can't find a movie or TV show? Login to create it. en Login Sign Up  ID: 67804   Expand Motherland   (2017) User Score  Play Trailer Overview Sitcom about navigating the trials and traumas of middle-class motherhood, looking at the competitive and unromantic side of parenting. Featured Crew Caroline Dunphy Creator Discussions   Reviews Videos   Images   Changes Report Share Discussions General  0 Content Issues  0 Images Backdrops  4 Posters  2 Videos Trailers  1 Teasers  0 Clips  0 Featurettes  0 Opening Credits  0 Top Billed Cast Anna Maxwell Martin Julia Diane Morgan Liz Paul Ready Kevin Lucy Punch Amanda Philippa Dunne Anne Full Cast & Crew Current Season Season 1 2017 | 7 Episodes Season 1 of Motherland premiered on November  7, 2017. View All Seasons Social Reviews  0 Discussions  0 Media Most Popular Videos  1 Backdrops  4 Posters  2 Recommendations We don't have enough data to suggest any TV shows based on Motherland. You can help by rating TV shows you've seen. Facts Status  Pilot Network Certification  - Type  Scripted Original Language  English Runtime  29m Homepage   http://www.bbc.co.uk/programmes/b07v3wrn Genres Comedy Keywords middle class parenting motherhood Content Score 100 Yes! Looking good! Top Contributors 54 CouchTater 18 Markxist 7 Elizabeth Jennings 4 peajay18  View Edit History Popularity Trend  Login to edit  URL By  signing up  for an account on TMDb, you can post directly to Twitter and Facebook. You need to be logged in to continue. Click  here  to login or  here  to sign up.    page_wrap opened in html_head  Join the Community The Basics About TMDb Contact Us Support Forums API Blog Get Involved  Contribution Bible 3rd Party Applications Add New Movie Add New TV Show Community Guidelines Leaderboard Forums Twitter Facebook Legal Terms of Use Privacy Policy Login Sign Up"
}