{
  "link": "https://www.themoviedb.org/tv/79066?language=en",
  "title": "Vne Igry",
  "resume": "We don't have an overview translated in English. Help us expand our database by adding one.",
  "rate": "0.0",
  "genre": [
    "Drama",
    "Comedy"
  ],
  "cast": [
    "Nikolay Kalinychev",
    "Rostislav Bershauer",
    "Nikita Pavlenko",
    "Anna Taratorkina"
  ],
  "character": [
    "Denis Rybalchenko",
    "Phil",
    "Sasha",
    "Olga"
  ],
  "site_data": "html Apps Forums Leaderboard Contribute API Support Discover Movies TV Shows Movies Popular Top Rated Upcoming Now Playing TV Shows Popular Top Rated On TV Airing Today People Popular People Can't find a movie or TV show? Login to create it. en Login Sign Up  ID: 79066   Expand Vne Igry   (2018) User Score Overview We don't have an overview translated in English. Help us expand our database by adding one. Featured Crew Viktor Shamirov Creator Discussions   Reviews Videos   Images   Changes Report Share Discussions General  0 Content Issues  0 Images Backdrops  1 Posters  1 Videos Trailers  0 Teasers  0 Clips  0 Featurettes  0 Opening Credits  0 Top Billed Cast Nikolay Kalinychev Denis Rybalchenko Rostislav Bershauer Phil Nikita Pavlenko Sasha Anna Taratorkina Olga Full Cast & Crew Current Season Season 1 2018 | 12 Episodes Season 1 of Vne Igry premiered on April 25, 2018. View All Seasons Social Reviews  0 Discussions  0 Media Most Popular Videos  0 Backdrops  1 Posters  1 Recommendations We don't have enough data to suggest any TV shows based on Vne Igry. You can help by rating TV shows you've seen. Facts Original Name  \u0412\u043d\u0435 \u0438\u0433\u0440\u044b Status  Returning Series Network Certification 18+ Meaning Restricted to People 18 or Older. Type  Scripted Original Language  Russian Runtime  24m Homepage   https://start.ru/series/vne-igry Genres Drama Comedy Keywords No keywords have been added. Content Score 93 Almost there... Top Contributors 43 nawa 6 janar 1 Elizabeth Jennings  View Edit History Popularity Trend  Login to edit  URL By  signing up  for an account on TMDb, you can post directly to Twitter and Facebook. You need to be logged in to continue. Click  here  to login or  here  to sign up.    page_wrap opened in html_head  Join the Community The Basics About TMDb Contact Us Support Forums API Blog Get Involved  Contribution Bible 3rd Party Applications Add New Movie Add New TV Show Community Guidelines Leaderboard Forums Twitter Facebook Legal Terms of Use Privacy Policy Login Sign Up"
}