{
  "link": "https://www.themoviedb.org/tv/72500?language=en",
  "title": "Action Heroine Cheer Fruits",
  "resume": "We don't have an overview translated in English. Help us expand our database by adding one.",
  "rate": "87.0",
  "genre": [
    "Animation",
    "Comedy"
  ],
  "cast": [
    "Yuuki Hirose",
    "Mao Ichimichi",
    "Miku Itou",
    "Rie Murakawa",
    "Erii Yamazaki"
  ],
  "character": [
    "Mana Midorikawa",
    "Misaki Shirogane",
    "An Akagi",
    "Roko Kuroki",
    "Mikan Kise"
  ],
  "site_data": "html Apps Forums Leaderboard Contribute API Support Discover Movies TV Shows Movies Popular Top Rated Upcoming Now Playing TV Shows Popular Top Rated On TV Airing Today People Popular People Can't find a movie or TV show? Login to create it. en Login Sign Up  ID: 72500   Expand Action Heroine Cheer Fruits   (2017) User Score Overview We don't have an overview translated in English. Help us expand our database by adding one. Featured Crew Keizo Kusakawa Creator Discussions   Reviews Videos   Images   Changes Report Share Discussions General  0 Content Issues  1 Images Backdrops  1 Posters  3 Videos Trailers  0 Teasers  0 Clips  0 Featurettes  0 Opening Credits  0 Top Billed Cast Yuuki Hirose Mana Midorikawa Mao Ichimichi Misaki Shirogane Miku Itou An Akagi Rie Murakawa Roko Kuroki Erii Yamazaki Mikan Kise Full Cast & Crew Last Season Season 1 2017 | 12 Episodes Season 1 of Action Heroine Cheer Fruits premiered on July 15, 2017. View All Seasons Social Reviews  0 Discussions  1 Subject Status Replies Last Reply There are no discussions for Action Heroine Cheer Fruits. Login to be first! Go to Discussions Media Most Popular Videos  0 Backdrops  1 Posters  3 Recommendations We don't have enough data to suggest any TV shows based on Action Heroine Cheer Fruits. You can help by rating TV shows you've seen. Facts Original Name  \u30a2\u30af\u30b7\u30e7\u30f3\u30d2\u30ed\u30a4\u30f3 \u30c1\u30a2\u30d5\u30eb\u30fc\u30c4 Status  Ended Network Certification  - Type  Scripted Original Language  Japanese Runtime  25m Homepage   http://www.tbs.co.jp/anime/cfru/ Genres Animation Comedy Keywords slice of life anime Content Score 93 Almost there... Top Contributors 36 Despair-Paradise 18 sp1ti 5 digr33n W 5 Wingman  View Edit History Popularity Trend  Login to edit  URL By  signing up  for an account on TMDb, you can post directly to Twitter and Facebook. You need to be logged in to continue. Click  here  to login or  here  to sign up.    page_wrap opened in html_head  Join the Community The Basics About TMDb Contact Us Support Forums API Blog Get Involved  Contribution Bible 3rd Party Applications Add New Movie Add New TV Show Community Guidelines Leaderboard Forums Twitter Facebook Legal Terms of Use Privacy Policy Login Sign Up"
}