{
  "link": "https://www.themoviedb.org/tv/65663?language=en",
  "title": "Zapeando",
  "resume": "We don't have an overview translated in English. Help us expand our database by adding one.",
  "rate": "100.0",
  "genre": [
    "Comedy"
  ],
  "cast": [
    "Frank Blanco",
    "Santi Avenda\u00f1o",
    "Javi Soto",
    "Joselu Cremades",
    "Marco Pe\u00f1alver"
  ],
  "character": [
    "Himself - Host",
    "Himself",
    "Javi Dalton",
    "Joselu Dalton",
    "Marco Dalton"
  ],
  "site_data": "html Apps Forums Leaderboard Contribute API Support Discover Movies TV Shows Movies Popular Top Rated Upcoming Now Playing TV Shows Popular Top Rated On TV Airing Today People Popular People Can't find a movie or TV show? Login to create it. en Login Sign Up  ID: 65663   Expand Zapeando   (2013) User Score Overview We don't have an overview translated in English. Help us expand our database by adding one. Discussions   Reviews Videos   Images   Changes Report Share Discussions General  0 Content Issues  0 Images Backdrops  0 Posters  1 Videos Trailers  0 Teasers  0 Clips  0 Featurettes  0 Opening Credits  0 Top Billed Cast Frank Blanco Himself - Host Santi Avenda\u00f1o Himself Javi Soto Javi Dalton Joselu Cremades Joselu Dalton Marco Pe\u00f1alver Marco Dalton Full Cast & Crew Last Season Season 3 2015 | 9 Episodes Season 3 of Zapeando premiered on February 10, 2015. View All Seasons Social Reviews  0 Discussions  0 Media Most Popular Videos  0 Backdrops  0 Posters  1 Recommendations We don't have enough data to suggest any TV shows based on Zapeando. You can help by rating TV shows you've seen. Facts Status  In Production Network Certification  - Type  Talk Show Original Language  Spanish; Castilian Runtime  95m Homepage   http://www.lasexta.com/programas/zapeando/ Genres Comedy Keywords No keywords have been added. Content Score 64 We're so close, yet so far. Top Contributors N 50 NoemiTalavera z 12 zurman1 8 Elizabeth Jennings  View Edit History Popularity Trend  Login to edit  URL By  signing up  for an account on TMDb, you can post directly to Twitter and Facebook. You need to be logged in to continue. Click  here  to login or  here  to sign up.    page_wrap opened in html_head  Join the Community The Basics About TMDb Contact Us Support Forums API Blog Get Involved  Contribution Bible 3rd Party Applications Add New Movie Add New TV Show Community Guidelines Leaderboard Forums Twitter Facebook Legal Terms of Use Privacy Policy Login Sign Up"
}