{
  "link": "https://www.themoviedb.org/tv/75956?language=en",
  "title": "The Kite",
  "resume": "We don't have an overview translated in English. Help us expand our database by adding one.",
  "rate": "",
  "genre": [
    "Mystery",
    "Drama"
  ],
  "cast": {
    "actor": [
      "Liu Yunlong",
      "Luo Haiqiong",
      "Li Xiaoran",
      "Qi Huan"
    ]
  },
  "characters": {
    "characters": [
      "Zheng Yaoxian",
      "Han Bing",
      "Lin Tao",
      "Yan E"
    ]
  },
  "site_data": "html Apps Forums Leaderboard Contribute API Support Discover Movies TV Shows Movies Popular Top Rated Upcoming Now Playing TV Shows Popular Top Rated On TV Airing Today People Popular People Can't find a movie or TV show? Login to create it. en Login Sign Up  ID: 75956   Expand The Kite   (2017) User Score Overview We don't have an overview translated in English. Help us expand our database by adding one. Featured Crew Liu Yunlong Creator Discussions   Reviews Videos   Images   Changes Report Share Discussions General  0 Content Issues  0 Images Backdrops  3 Posters  2 Videos Trailers  0 Teasers  0 Clips  0 Featurettes  0 Opening Credits  0 Top Billed Cast Liu Yunlong Zheng Yaoxian Luo Haiqiong Han Bing Li Xiaoran Lin Tao Qi Huan Yan E Full Cast & Crew Current Season Season 1 2017 | 51 Episodes Season 1 of The Kite premiered on December 17, 2017. View All Seasons Social Reviews  0 Discussions  0 Media Most Popular Videos  0 Backdrops  3 Posters  2 Recommendations We don't have enough data to suggest any TV shows based on The Kite. You can help by rating TV shows you've seen. Facts Original Name  \u98ce\u7b5d Status  Ended Networks - Certification  - Type  Scripted Original Language  Chinese Runtime  - Homepage  - Genres Mystery Drama Keywords No keywords have been added. Content Score 86 Almost there... Top Contributors 24 \u5c11\u6656 x 21 xuhaosly 6 janar 4 thirstyhippo  View Edit History Popularity Trend  Login to edit  URL By  signing up  for an account on TMDb, you can post directly to Twitter and Facebook. You need to be logged in to continue. Click  here  to login or  here  to sign up.    page_wrap opened in html_head  Join the Community The Basics About TMDb Contact Us Support Forums API Blog Get Involved  Contribution Bible 3rd Party Applications Add New Movie Add New TV Show Community Guidelines Leaderboard Forums Twitter Facebook Legal Terms of Use Privacy Policy Login Sign Up"
}