{
  "link": "https://www.themoviedb.org/tv/71728?language=en",
  "title": "Young Sheldon",
  "resume": "The early life of child genius Sheldon Cooper, later seen in The Big Bang Theory.",
  "rate": "",
  "genre": [
    "Comedy"
  ],
  "cast": {
    "actor": [
      "Iain Armitage",
      "Zoe Perry",
      "Lance Barber",
      "Montana Jordan",
      "Raegan Revord"
    ]
  },
  "characters": {
    "characters": [
      "Sheldon Cooper",
      "Mary Cooper",
      "George Cooper Sr.",
      "George Cooper Jr.",
      "Missy Cooper"
    ]
  },
  "site_data": "html Apps Forums Leaderboard Contribute API Support Discover Movies TV Shows Movies Popular Top Rated Upcoming Now Playing TV Shows Popular Top Rated On TV Airing Today People Popular People Can't find a movie or TV show? Login to create it. en Login Sign Up  ID: 71728   Expand Young Sheldon   (2017) User Score  Play Trailer Overview The early life of child genius Sheldon Cooper, later seen in The Big Bang Theory. Featured Crew Chuck Lorre Creator Steven Molaro Creator Discussions   Reviews Videos   Images   Changes Report Share Discussions General  11 Content Issues  1 Images Backdrops  7 Posters  11 Videos Trailers  1 Teasers  0 Clips  0 Featurettes  0 Opening Credits  0 Top Billed Cast Iain Armitage Sheldon Cooper Zoe Perry Mary Cooper Lance Barber George Cooper Sr. Montana Jordan George Cooper Jr. Raegan Revord Missy Cooper Full Cast & Crew Last Season Season 1 2017 | 22 Episodes Season 1 of Young Sheldon premiered on September 24, 2017. View All Seasons Social Reviews  0 Discussions  13 Subject Status Replies Last Reply I'm curious ... Open 2 by  Bob Peters 61 t Annie Potts Open 2 by  Bob Peters 61 Is this cancelled yet? Open 8 by  Bloodshot77 Go to Discussions Media Most Popular Videos  1 Backdrops  7 Posters  11 Recommendations   2017-10-01 Ghosted 6.2    2017-09-25 The Brave 6.6    2017-10-01 Wisdom of the Crowd 7.1    2017-11-02 S.W.A.T. 6.6    2017-09-25 The Good Doctor 7.9    2017-09-27 SEAL Team 6.6    2016-09-20 Bull 6.6    2017-10-02 The Gifted 7.0  Facts Status  Returning Series Network Certification TV-PG Meaning This program contains material that parents may find unsuitable for younger children. Type  Scripted Original Language  English Runtime  22m Homepage   http://www.cbs.com/shows/young-sheldon/ Genres Comedy Keywords prequel kid genius Content Score 100 Yes! Looking good! Top Contributors 39 Warpath 19 BlackDelivery a 14 adambakir92 12 Banana  View Edit History Popularity Trend  Login to edit  URL By  signing up  for an account on TMDb, you can post directly to Twitter and Facebook. You need to be logged in to continue. Click  here  to login or  here  to sign up.    page_wrap opened in html_head  Join the Community The Basics About TMDb Contact Us Support Forums API Blog Get Involved  Contribution Bible 3rd Party Applications Add New Movie Add New TV Show Community Guidelines Leaderboard Forums Twitter Facebook Legal Terms of Use Privacy Policy Login Sign Up"
}