{
  "link": "https://www.themoviedb.org/tv/11230?language=en",
  "title": "My Mother the Car",
  "resume": "The story of the relationship between a man and his mother, the latter having been reincarnated as a 1928 Porter automobile.",
  "rate": "",
  "genre": [
    "Comedy",
    "Sci-Fi",
    "Fantasy"
  ],
  "cast": {
    "actor": [
      "Ann Sothern",
      "Cindy Eilbacher",
      "Jerry Van Dyke",
      "Maggie Pierce"
    ]
  },
  "characters": {
    "characters": [
      "Gladys Crabtree",
      "Cindy Crabtree",
      "Dave Crabtree",
      "Barbara Crabtree"
    ]
  },
  "site_data": "html Apps Forums Leaderboard Contribute API Support Discover Movies TV Shows Movies Popular Top Rated Upcoming Now Playing TV Shows Popular Top Rated On TV Airing Today People Popular People Can't find a movie or TV show? Login to create it. en Login Sign Up  ID: 11230   Expand My Mother the Car   (1965) User Score Overview The story of the relationship between a man and his mother, the latter having been reincarnated as a 1928 Porter automobile. Featured Crew Allan Burns Creator Chris Hayward Creator Discussions   Reviews Videos   Images   Changes Report Share Discussions General  0 Content Issues  0 Images Backdrops  1 Posters  1 Videos Trailers  0 Teasers  0 Clips  0 Featurettes  0 Opening Credits  0 Top Billed Cast Ann Sothern Gladys Crabtree Cindy Eilbacher Cindy Crabtree Jerry Van Dyke Dave Crabtree Maggie Pierce Barbara Crabtree Full Cast & Crew Last Season Season 1 1965 | 30 Episodes Season 1 of My Mother the Car premiered on September 14, 1965. View All Seasons Social Reviews  0 Discussions  0 Media Most Popular Videos  0 Backdrops  1 Posters  1 Recommendations We don't have enough data to suggest any TV shows based on My Mother the Car. You can help by rating TV shows you've seen. Facts Status  Ended Network Certification  - Type  Scripted Original Language  English Runtime  30m Homepage  - Genres Comedy Sci-Fi & Fantasy Keywords parent child relationship reincarnation car sitcom Content Score 93 Almost there... Top Contributors 22 Banana 2 Steve 2 rtentser 1 Elizabeth Jennings  View Edit History Popularity Trend  Login to edit  URL By  signing up  for an account on TMDb, you can post directly to Twitter and Facebook. You need to be logged in to continue. Click  here  to login or  here  to sign up.    page_wrap opened in html_head  Join the Community The Basics About TMDb Contact Us Support Forums API Blog Get Involved  Contribution Bible 3rd Party Applications Add New Movie Add New TV Show Community Guidelines Leaderboard Forums Twitter Facebook Legal Terms of Use Privacy Policy Login Sign Up"
}