{
  "link": "https://www.themoviedb.org/tv/25126?language=en",
  "title": "Fallen",
  "resume": "Fallen is a 2006 ABC Family mini-series starring Paul Wesley as Aaron Corbett, an high school student who begins exhibiting strange abilities on his 18th birthday.",
  "rate": "",
  "genre": [
    "Drama",
    "Action",
    "Adventure"
  ],
  "cast": {
    "actor": [
      "Paul Wesley",
      "Rick Worthy",
      "Hal Ozsan",
      "Will Yun Lee"
    ]
  },
  "characters": {
    "characters": [
      "Aaron Corbett"
    ]
  },
  "site_data": "html Apps Forums Leaderboard Contribute API Support Discover Movies TV Shows Movies Popular Top Rated Upcoming Now Playing TV Shows Popular Top Rated On TV Airing Today People Popular People Can't find a movie or TV show? Login to create it. en Login Sign Up  ID: 25126   Expand Fallen   (2006) User Score Overview Fallen is a 2006 ABC Family mini-series starring Paul Wesley as Aaron Corbett, an high school student who begins exhibiting strange abilities on his 18th birthday. Discussions   Reviews Videos   Images   Changes Report Share Discussions General  0 Content Issues  0 Images Backdrops  2 Posters  3 Videos Trailers  0 Teasers  0 Clips  0 Featurettes  0 Opening Credits  0 Top Billed Cast Paul Wesley Aaron Corbett Rick Worthy Hal Ozsan Will Yun Lee Full Cast & Crew Last Season Season 1 2007 | 3 Episodes Season 1 of Fallen premiered on August  4, 2007. View All Seasons Social Reviews  0 Discussions  0 Media Most Popular Videos  0 Backdrops  2 Posters  3 Recommendations   2009-03-03 The Listener 5.3    2002-09-20 John Doe 7.5    2010-06-07 Persons Unknown 6.4  Facts Status  Ended Network Certification  - Type  Scripted Original Language  English Runtime  247m Homepage  - Genres Drama Action & Adventure Keywords angel miniseries supernatural teen based on young adult novel Content Score 86 Almost there... Top Contributors 15 Banana 10 galani PV 4 Paullo Vieira w 3 webmaster  View Edit History Popularity Trend  Login to edit  URL By  signing up  for an account on TMDb, you can post directly to Twitter and Facebook. You need to be logged in to continue. Click  here  to login or  here  to sign up.    page_wrap opened in html_head  Join the Community The Basics About TMDb Contact Us Support Forums API Blog Get Involved  Contribution Bible 3rd Party Applications Add New Movie Add New TV Show Community Guidelines Leaderboard Forums Twitter Facebook Legal Terms of Use Privacy Policy Login Sign Up"
}