{
  "link": "https://www.themoviedb.org/tv/65291?language=en",
  "title": "Stuck in the Middle",
  "resume": "Harley is an engineering whiz who uses her inventions to navigate life as the middle child in a large family of seven kids.",
  "rate": "67.0",
  "genre": [
    "Comedy",
    "Family"
  ],
  "cast": [
    "Jenna Ortega",
    "Ronni Hawk",
    "Isaak Presley",
    "Ariana Greenblatt",
    "Kayla Maisonet"
  ],
  "character": [
    "Harley Diaz",
    "Rachel Diaz",
    "Ethan Diaz",
    "Daphne Diaz",
    "Georgie Diaz"
  ],
  "site_data": "html Apps Forums Leaderboard Contribute API Support Discover Movies TV Shows Movies Popular Top Rated Upcoming Now Playing TV Shows Popular Top Rated On TV Airing Today People Popular People Can't find a movie or TV show? Login to create it. en Login Sign Up  ID: 65291   Expand Stuck in the Middle   (2016) User Score  Play Trailer Overview Harley is an engineering whiz who uses her inventions to navigate life as the middle child in a large family of seven kids. Discussions   Reviews Videos   Images   Changes Report Share Discussions General  12 Content Issues  0 Images Backdrops  2 Posters  2 Videos Trailers  1 Teasers  0 Clips  0 Featurettes  0 Opening Credits  0 Top Billed Cast Jenna Ortega Harley Diaz Ronni Hawk Rachel Diaz Isaak Presley Ethan Diaz Ariana Greenblatt Daphne Diaz Kayla Maisonet Georgie Diaz Full Cast & Crew Current Season Season 3 2017 | 16 Episodes Season 3 of Stuck in the Middle premiered on December  8, 2017. View All Seasons Social Reviews  0 Discussions  12 Subject Status Replies Last Reply p Stuck in the Middle - Season 3 Episode Titles and Airdates Open 15 by  acontributor w Mean mom Open 0 by wonder2wonder\n      \n     p Season 3 is the last season Open 1 by  Taylorfirst1 Go to Discussions Media Most Popular Videos  1 Backdrops  2 Posters  2 Recommendations   2015-06-26 Best Friends Whenever 6.1    2012-10-12 Dog With a Blog 5.3    2015-09-12 Game Shakers 6.4    2013-07-19 Liv and Maddie 6.1    2013-10-14 The Thundermans 8.2    2011-12-02 Austin & Ally 5.8    2016-06-24 Bizaardvark 5.0    2011-09-30 Jessie 6.3  Facts Status  Returning Series Network Certification TV-G Meaning Most parents would find this program suitable for all ages. Type  Scripted Original Language  English Runtime  30m Homepage   https://watchdisneychannel.go.com/stuck-in-the-middle Genres Comedy Family Keywords big family teenager family sitcom family of color Content Score 93 Almost there... Top Contributors 15 Elizabeth Jennings 14 koagoatboy 14 Banana w 14 wonder2wonder  View Edit History Popularity Trend  Login to edit  URL By  signing up  for an account on TMDb, you can post directly to Twitter and Facebook. You need to be logged in to continue. Click  here  to login or  here  to sign up.    page_wrap opened in html_head  Join the Community The Basics About TMDb Contact Us Support Forums API Blog Get Involved  Contribution Bible 3rd Party Applications Add New Movie Add New TV Show Community Guidelines Leaderboard Forums Twitter Facebook Legal Terms of Use Privacy Policy Login Sign Up"
}