{
  "link": "https://www.themoviedb.org/tv/57031?language=en",
  "title": "Manhattan Love Story",
  "resume": "The unfiltered internal monologues of a young man and a young woman are exposed as they begin a new relationship together.",
  "rate": "62.0",
  "genre": [
    "Comedy"
  ],
  "cast": [
    "Analeigh Tipton",
    "Jake McDorman",
    "Nicolas Wright",
    "Jade Catta-Preta",
    "Chloe Wepper"
  ],
  "character": [
    "Dana",
    "Peter",
    "David",
    "Amy",
    "Chloe"
  ],
  "site_data": "html Apps Forums Leaderboard Contribute API Support Discover Movies TV Shows Movies Popular Top Rated Upcoming Now Playing TV Shows Popular Top Rated On TV Airing Today People Popular People Can't find a movie or TV show? Login to create it. en Login Sign Up  ID: 57031   Expand Manhattan Love Story   (2014) User Score Overview The unfiltered internal monologues of a young man and a young woman are exposed as they begin a new relationship together. Featured Crew Jeff Lowell Creator Discussions   Reviews Videos   Images   Changes Report Share Discussions General  0 Content Issues  0 Images Backdrops  3 Posters  1 Videos Trailers  0 Teasers  0 Clips  0 Featurettes  0 Opening Credits  0 Top Billed Cast Analeigh Tipton Dana Jake McDorman Peter Nicolas Wright David Jade Catta-Preta Amy Chloe Wepper Chloe Full Cast & Crew Last Season Season 1 2014 | 11 Episodes Season 1 of Manhattan Love Story premiered on September 30, 2014. View All Seasons Social Reviews  0 Discussions  0 Media Most Popular Videos  0 Backdrops  3 Posters  1 Recommendations   2014-02-23 Growing Up Fisher 5.9    2017-03-30 Hindsight 6.5    2014-04-09 Deadbeat 6.2    2016-11-15 Sweet/Vicious 7.0    2012-09-11 The New Normal 5.2    2012-09-12 Guys with Kids 5.5    2013-11-14 Ground Floor 6.1    2014-10-02 A to Z 5.7  Facts Status  Cancelled Network Certification TV-PG Meaning This program contains material that parents may find unsuitable for younger children. Type  Scripted Original Language  English Runtime  30m Homepage   http://abc.go.com/shows/manhattan-love-story Genres Comedy Keywords dating sitcom Content Score 93 Almost there... Top Contributors 24 Elizabeth Jennings 10 Banana b 6 bonjour1992 5 Sean Tu  View Edit History Popularity Trend  Login to edit  URL By  signing up  for an account on TMDb, you can post directly to Twitter and Facebook. You need to be logged in to continue. Click  here  to login or  here  to sign up.    page_wrap opened in html_head  Join the Community The Basics About TMDb Contact Us Support Forums API Blog Get Involved  Contribution Bible 3rd Party Applications Add New Movie Add New TV Show Community Guidelines Leaderboard Forums Twitter Facebook Legal Terms of Use Privacy Policy Login Sign Up"
}