{
  "link": "https://www.themoviedb.org/tv/46106?language=en",
  "title": "\u041f\u044f\u0442\u043d\u0438\u0446\u043a\u0438\u0439",
  "resume": "We don't have an overview translated in English. Help us expand our database by adding one.",
  "rate": "",
  "genre": [
    "Drama",
    "Action",
    "Adventure"
  ],
  "cast": {
    "actor": [
      "Viktoriya Tarasova",
      "Vladislav Kotlyarsky",
      "Dmitriy Mazurov",
      "Sergei Guryev"
    ]
  },
  "characters": {
    "characters": [
      "\u0418\u0440\u0438\u043d\u0430 \u0421\u0435\u0440\u0433\u0435\u0435\u0432\u043d\u0430 \u0417\u0438\u043c\u0438\u043d\u0430",
      "\u0421\u0442\u0430\u0441 \u041a\u0430\u0440\u043f\u043e\u0432",
      "\u041f\u0430\u0432\u0435\u043b \u0422\u043a\u0430\u0447\u0435\u0432",
      "\u0414\u043c\u0438\u0442\u0440\u0438\u0439 \u0424\u043e\u043c\u0438\u043d"
    ]
  },
  "site_data": "html Apps Forums Leaderboard Contribute API Support Discover Movies TV Shows Movies Popular Top Rated Upcoming Now Playing TV Shows Popular Top Rated On TV Airing Today People Popular People Can't find a movie or TV show? Login to create it. en Login Sign Up  ID: 46106   Expand \u041f\u044f\u0442\u043d\u0438\u0446\u043a\u0438\u0439   (2011) User Score Overview We don't have an overview translated in English. Help us expand our database by adding one. Featured Crew \u0418\u043b\u044c\u044f \u041a\u0443\u043b\u0438\u043a\u043e\u0432 Creator Discussions   Reviews Videos   Images   Changes Report Share Discussions General  0 Content Issues  0 Images Backdrops  1 Posters  4 Videos Trailers  0 Teasers  0 Clips  0 Featurettes  0 Opening Credits  0 Top Billed Cast Viktoriya Tarasova \u0418\u0440\u0438\u043d\u0430 \u0421\u0435\u0440\u0433\u0435\u0435\u0432\u043d\u0430 \u0417\u0438\u043c\u0438\u043d\u0430 Vladislav Kotlyarsky \u0421\u0442\u0430\u0441 \u041a\u0430\u0440\u043f\u043e\u0432 Dmitriy Mazurov \u041f\u0430\u0432\u0435\u043b \u0422\u043a\u0430\u0447\u0435\u0432 Sergei Guryev \u0414\u043c\u0438\u0442\u0440\u0438\u0439 \u0424\u043e\u043c\u0438\u043d Full Cast & Crew Last Season Season 4 2015 | 32 Episodes Season 4 of \u041f\u044f\u0442\u043d\u0438\u0446\u043a\u0438\u0439 premiered on November 23, 2015. View All Seasons Social Reviews  0 Discussions  0 Media Most Popular Videos  0 Backdrops  1 Posters  4 Recommendations We don't have enough data to suggest any TV shows based on \u041f\u044f\u0442\u043d\u0438\u0446\u043a\u0438\u0439. You can help by rating TV shows you've seen. Facts Status  Returning Series Network Certification  - Type  Scripted Original Language  Russian Runtime  45m Homepage  - Genres Drama Action & Adventure Keywords No keywords have been added. Content Score 86 Almost there... Top Contributors c 20 coho TB 2 TMDb Bot  View Edit History Popularity Trend  Login to edit  URL By  signing up  for an account on TMDb, you can post directly to Twitter and Facebook. You need to be logged in to continue. Click  here  to login or  here  to sign up.    page_wrap opened in html_head  Join the Community The Basics About TMDb Contact Us Support Forums API Blog Get Involved  Contribution Bible 3rd Party Applications Add New Movie Add New TV Show Community Guidelines Leaderboard Forums Twitter Facebook Legal Terms of Use Privacy Policy Login Sign Up"
}