{
  "link": "https://www.themoviedb.org/tv/79789?language=en",
  "title": "Maman a tort",
  "resume": "We don't have an overview translated in English. Help us expand our database by adding one.",
  "rate": "",
  "genre": [
    "Drama"
  ],
  "cast": {
    "actor": [
      "Gil Alma",
      "Anne Charrier",
      "Pascal Elb\u00e9",
      "Sophie Quinton",
      "Camille Lou"
    ]
  },
  "characters": {
    "characters": [
      "Jib\u00e9",
      "Marianne Aurais",
      "Papy",
      "Amanda",
      "Angie"
    ]
  },
  "site_data": "html Apps Forums Leaderboard Contribute API Support Discover Movies TV Shows Movies Popular Top Rated Upcoming Now Playing TV Shows Popular Top Rated On TV Airing Today People Popular People Can't find a movie or TV show? Login to create it. en Login Sign Up  ID: 79789   Expand Maman a tort   (2018) User Score Overview We don't have an overview translated in English. Help us expand our database by adding one. Featured Crew Fran\u00e7ois Velle Creator V\u00e9ronique Lecharpy Creator Discussions   Reviews Videos   Images   Changes Report Share Discussions General  0 Content Issues  0 Images Backdrops  1 Posters  1 Videos Trailers  0 Teasers  0 Clips  0 Featurettes  0 Opening Credits  0 Top Billed Cast Gil Alma Jib\u00e9 Anne Charrier Marianne Aurais Pascal Elb\u00e9 Papy Sophie Quinton Amanda Camille Lou Angie Full Cast & Crew Current Season Season 1 2018 | 6 Episodes Season 1 of Maman a tort premiered on May 23, 2018. View All Seasons Social Reviews  0 Discussions  0 Media Most Popular Videos  0 Backdrops  1 Posters  1 Recommendations We don't have enough data to suggest any TV shows based on Maman a tort. You can help by rating TV shows you've seen. Facts Status  Returning Series Network Certification NR Meaning No rating information. Type  Scripted Original Language  French Runtime  52m Homepage   https://www.francetelevisions.fr/maman-a-tort Genres Drama Keywords No keywords have been added. Content Score 93 Almost there... Top Contributors m 25 matthieugoua 7 Elizabeth Jennings D 3 Destr0y  View Edit History Popularity Trend  Login to edit  URL By  signing up  for an account on TMDb, you can post directly to Twitter and Facebook. You need to be logged in to continue. Click  here  to login or  here  to sign up.    page_wrap opened in html_head  Join the Community The Basics About TMDb Contact Us Support Forums API Blog Get Involved  Contribution Bible 3rd Party Applications Add New Movie Add New TV Show Community Guidelines Leaderboard Forums Twitter Facebook Legal Terms of Use Privacy Policy Login Sign Up"
}