{
  "link": "https://www.themoviedb.org/tv/72742?language=en",
  "title": "Bad Blood",
  "resume": "A dramatization of the life and death of Montreal mob boss Vito Rizzuto.",
  "rate": "",
  "genre": [
    "Crime",
    "Drama"
  ],
  "cast": {
    "actor": [
      "Anthony LaPaglia",
      "Kim Coates",
      "Paul Sorvino",
      "Enrico Colantoni",
      "Brett Donahue"
    ]
  },
  "characters": {
    "characters": [
      "Victor 'Vito' Rizzuto",
      "Declan Gardiner",
      "Nico Rizzuto Sr",
      "Bruno Bonsignori",
      "Nico Rizzuto Jr."
    ]
  },
  "site_data": "html Apps Forums Leaderboard Contribute API Support Discover Movies TV Shows Movies Popular Top Rated Upcoming Now Playing TV Shows Popular Top Rated On TV Airing Today People Popular People Can't find a movie or TV show? Login to create it. en Login Sign Up  ID: 72742   Expand Bad Blood   (2017) User Score  Play Trailer Overview A dramatization of the life and death of Montreal mob boss Vito Rizzuto. Discussions   Reviews Videos   Images   Changes Report Share Discussions General  0 Content Issues  0 Images Backdrops  1 Posters  3 Videos Trailers  1 Teasers  0 Clips  0 Featurettes  0 Opening Credits  0 Top Billed Cast Anthony LaPaglia Victor 'Vito' Rizzuto Kim Coates Declan Gardiner Paul Sorvino Nico Rizzuto Sr Enrico Colantoni Bruno Bonsignori Brett Donahue Nico Rizzuto Jr. Full Cast & Crew Last Season Season 1 2017 | 6 Episodes Season 1 of Bad Blood premiered on September 21, 2017. View All Seasons Social Reviews  0 Discussions  0 Media Most Popular Videos  1 Backdrops  1 Posters  3 Recommendations   2016-01-07 Shades of Blue 6.2    2016-09-21 Lethal Weapon 7.3  Facts Status  Returning Series Network Certification 14+ Meaning Programming intended for viewers ages 14 and older. May contain strong violence and strong profanity, and depictions of sexual activity as long as they are within the context of a story. Type  Miniseries Original Language  English Runtime  40m Homepage   https://www.citytv.com/toronto/shows/bad-blood/ Genres Crime Drama Keywords based on novel or book crime sicilian mafia Content Score 93 Almost there... Top Contributors t 36 tmdb42368388 27 Elizabeth Jennings 15 Guipat 5 Lewis  View Edit History Popularity Trend  Login to edit  URL By  signing up  for an account on TMDb, you can post directly to Twitter and Facebook. You need to be logged in to continue. Click  here  to login or  here  to sign up.    page_wrap opened in html_head  Join the Community The Basics About TMDb Contact Us Support Forums API Blog Get Involved  Contribution Bible 3rd Party Applications Add New Movie Add New TV Show Community Guidelines Leaderboard Forums Twitter Facebook Legal Terms of Use Privacy Policy Login Sign Up"
}