{
  "link": "https://www.themoviedb.org/tv/27942?language=en",
  "title": "Lime-Colored History of War",
  "resume": "We don't have an overview translated in English. Help us expand our database by adding one.",
  "rate": "",
  "genre": [
    "Action",
    "Adventure",
    "Animation"
  ],
  "cast": {
    "actor": [
      "Tsubasa Otomiya",
      "Asako Dodo",
      "Kaoru Sasajima",
      "Sayaka Aoki",
      "Ai Shimizu"
    ]
  },
  "characters": {
    "characters": [
      "Sarasa Honda",
      "Sumi Ichidzjodzi",
      "Kato Asa",
      "Fukushima Keanu",
      "Sanada Momen"
    ]
  },
  "site_data": "html Apps Forums Leaderboard Contribute API Support Discover Movies TV Shows Movies Popular Top Rated Upcoming Now Playing TV Shows Popular Top Rated On TV Airing Today People Popular People Can't find a movie or TV show? Login to create it. en Login Sign Up  ID: 27942   Expand Lime-Colored History of War   (2003) User Score Overview We don't have an overview translated in English. Help us expand our database by adding one. Featured Crew Satoru Akahori Creator Discussions   Reviews Videos   Images   Changes Report Share Discussions General  0 Content Issues  0 Images Backdrops  3 Posters  2 Videos Trailers  0 Teasers  0 Clips  0 Featurettes  0 Opening Credits  0 Top Billed Cast Tsubasa Otomiya Sarasa Honda Asako Dodo Sumi Ichidzjodzi Kaoru Sasajima Kato Asa Sayaka Aoki Fukushima Keanu Ai Shimizu Sanada Momen Full Cast & Crew Last Season Lime-colored history of war season 2 2005 | 13 Episodes Season 2 of Lime-Colored History of War premiered on January  5, 2005. View All Seasons Social Reviews  0 Discussions  0 Media Most Popular Videos  0 Backdrops  3 Posters  2 Recommendations We don't have enough data to suggest any TV shows based on Lime-Colored History of War. You can help by rating TV shows you've seen. Facts Original Name  \u3089\u3044\u3080\u3044\u308d\u6226\u5947\u8b5a Status  Ended Networks - Certification  - Type  Scripted Original Language  Japanese Runtime  25m Homepage  - Genres Action & Adventure Animation Keywords No keywords have been added. Content Score 86 Almost there... Top Contributors 17 BrerFox  View Edit History Popularity Trend  Login to edit  URL By  signing up  for an account on TMDb, you can post directly to Twitter and Facebook. You need to be logged in to continue. Click  here  to login or  here  to sign up.    page_wrap opened in html_head  Join the Community The Basics About TMDb Contact Us Support Forums API Blog Get Involved  Contribution Bible 3rd Party Applications Add New Movie Add New TV Show Community Guidelines Leaderboard Forums Twitter Facebook Legal Terms of Use Privacy Policy Login Sign Up"
}