{
  "link": "https://www.themoviedb.org/tv/695?language=en",
  "title": "Round the Twist",
  "resume": "Round the Twist is a Logie Award-winning Australian children's television series about three children and their father who live in a lighthouse and become involved in many bizarre magical adventures.",
  "rate": "80.0",
  "genre": [
    "Comedy"
  ],
  "cast": [
    "Brook Sykes",
    "Rian McLean",
    "Mathew Waters",
    "Ebonnie Masini",
    "Andrew S. Gilbert"
  ],
  "character": [
    "James Gribble",
    "Pete Twist",
    "Bronson Twist",
    "Linda Twist",
    "Tony Twist"
  ],
  "site_data": "html Apps Forums Leaderboard Contribute API Support Discover Movies TV Shows Movies Popular Top Rated Upcoming Now Playing TV Shows Popular Top Rated On TV Airing Today People Popular People Can't find a movie or TV show? Login to create it. en Login Sign Up  ID: 695   Expand Round the Twist   (1989) User Score Overview Round the Twist is a Logie Award-winning Australian children's television series about three children and their father who live in a lighthouse and become involved in many bizarre magical adventures. Featured Crew Paul Jennings Creator Discussions   Reviews Videos   Images   Changes Report Share Discussions General  1 Content Issues  0 Images Backdrops  2 Posters  4 Videos Trailers  0 Teasers  0 Clips  0 Featurettes  0 Opening Credits  0 Top Billed Cast Brook Sykes James Gribble Rian McLean Pete Twist Mathew Waters Bronson Twist Ebonnie Masini Linda Twist Andrew S. Gilbert Tony Twist Full Cast & Crew Last Season Season 4 2001 | 13 Episodes Season 4 of Round the Twist premiered on January 31, 2001. View All Seasons Social Reviews  0 Discussions  1 Subject Status Replies Last Reply w Have you ever, ever felt like this... Open 4 by  roundthetwist Go to Discussions Media Most Popular Videos  0 Backdrops  2 Posters  4 Recommendations   1964-09-20 The Porky Pig Show 4.7  Facts Status  Ended Network Certification  - Type  Scripted Original Language  English Runtime  25m Homepage   http://www.roundthetwist.com/splash_gribbs/splash_gribbs.htm Genres Comedy Keywords No keywords have been added. Content Score 93 Almost there... Top Contributors 49 Rug T 2 TwelveVacancies 2 lineker 2 Murnau  View Edit History Popularity Trend  Login to edit  URL By  signing up  for an account on TMDb, you can post directly to Twitter and Facebook. You need to be logged in to continue. Click  here  to login or  here  to sign up.    page_wrap opened in html_head  Join the Community The Basics About TMDb Contact Us Support Forums API Blog Get Involved  Contribution Bible 3rd Party Applications Add New Movie Add New TV Show Community Guidelines Leaderboard Forums Twitter Facebook Legal Terms of Use Privacy Policy Login Sign Up"
}