{
  "link": "https://www.themoviedb.org/tv/46648?language=en",
  "title": "True Detective",
  "resume": "An American anthology police detective series utilizing multiple timelines in which investigations seem to unearth personal and professional secrets of those involved, both within or outside the law.",
  "rate": "",
  "genre": [
    "Drama"
  ],
  "cast": {
    "actor": [
      "Mahershala Ali",
      "Stephen Dorff",
      "Carmen Ejogo",
      "Scoot McNairy",
      "Ray Fisher"
    ]
  },
  "characters": {
    "characters": [
      "Wayne Hays",
      "Roland West",
      "Amelia Reardon",
      "Tom",
      "Freddy Burns"
    ]
  },
  "site_data": "html Apps Forums Leaderboard Contribute API Support Discover Movies TV Shows Movies Popular Top Rated Upcoming Now Playing TV Shows Popular Top Rated On TV Airing Today People Popular People Can't find a movie or TV show? Login to create it. en Login Sign Up  ID: 46648   Expand True Detective   (2014) User Score  Play Trailer Overview An American anthology police detective series utilizing multiple timelines in which investigations seem to unearth personal and professional secrets of those involved, both within or outside the law. Featured Crew Nic Pizzolatto Creator Discussions   Reviews Videos   Images   Changes Report Share Discussions General  7 Content Issues  2 Images Backdrops  40 Posters  34 Videos Trailers  1 Teasers  0 Clips  0 Featurettes  0 Opening Credits  1 Top Billed Cast Mahershala Ali Wayne Hays Stephen Dorff Roland West Carmen Ejogo Amelia Reardon Scoot McNairy Tom Ray Fisher Freddy Burns Full Cast & Crew Last Season Season 2 2015 | 8 Episodes View All Seasons Social Reviews  2 Discussions  9 A review by the_blueeyes  10.0 Written by  the_blueeyes  on February 21, 2017 Im writing this review solely on the first season. I never finished the second one as i write this. I can easily say that Season 1 of this show was absolutely stunning. Some of the finest TV Crime hours of my life. We have Woody Harrelson and Matthew McConaughey in some of their best roles of their career. Especially the latter of them. McConaughey made the talk of the town with his role as the smart, and deeply intellect detective Cole and to be honest, i have rarely seen a role played out so well by an actor in years. He absolutely grabs you in and keeps you there for the entire show. I...  read the rest. Read All Reviews Media Most Popular Videos  2 Backdrops  40 Posters  34 Recommendations   2014-04-15 Fargo 8.2    2013-02-01 House of Cards 8.2    2006-10-01 Dexter 8.0    2013-04-04 Hannibal 7.7    2010-07-25 Sherlock 8.3    2002-06-02 The Wire 8.4    2004-09-22 Lost 7.8    2015-02-08 Better Call Saul 8.1  Facts Status  Returning Series Network Certification TV-MA Meaning This program is specifically designed to be viewed by adults and therefore may be unsuitable for children under 17 Type  Scripted Original Language  English Runtime  60m Homepage   http://www.hbo.com/true-detective Genres Drama Keywords investigation anthology serial killer police detective Content Score 100 Yes! Looking good! Top Contributors 185 Elizabeth Jennings 95 Diercksmeier 52 Apollo 45 Travis Bell  View Edit History Popularity Trend  Login to edit  URL By  signing up  for an account on TMDb, you can post directly to Twitter and Facebook. You need to be logged in to continue. Click  here  to login or  here  to sign up.    page_wrap opened in html_head  Join the Community The Basics About TMDb Contact Us Support Forums API Blog Get Involved  Contribution Bible 3rd Party Applications Add New Movie Add New TV Show Community Guidelines Leaderboard Forums Twitter Facebook Legal Terms of Use Privacy Policy Login Sign Up"
}