{
  "link": "https://www.themoviedb.org/tv/11216?language=en",
  "title": "Once a Thief",
  "resume": "Once a Thief is a 1997 Canadian television show inspired by the 1996 film of the same name.",
  "rate": "60.0",
  "genre": [
    "Action",
    "Adventure",
    "Drama"
  ],
  "cast": [
    "Victoria Pratt",
    "Nicholas Lea",
    "Jennifer Dale",
    "Ivan Sergei",
    "Sandrine Holt"
  ],
  "character": [
    "Jackie Janczyk"
  ],
  "site_data": "html Apps Forums Leaderboard Contribute API Support Discover Movies TV Shows Movies Popular Top Rated Upcoming Now Playing TV Shows Popular Top Rated On TV Airing Today People Popular People Can't find a movie or TV show? Login to create it. en Login Sign Up  ID: 11216   Expand Once a Thief   (1996) User Score Overview Once a Thief is a 1997 Canadian television show inspired by the 1996 film of the same name. Featured Crew John Woo Creator Discussions   Reviews Videos   Images   Changes Report Share Discussions General  0 Content Issues  0 Images Backdrops  1 Posters  1 Videos Trailers  0 Teasers  0 Clips  0 Featurettes  0 Opening Credits  0 Top Billed Cast Victoria Pratt Jackie Janczyk Nicholas Lea Jennifer Dale Ivan Sergei Sandrine Holt Full Cast & Crew Last Season Season 1 1996 | 24 Episodes Season 1 of Once a Thief premiered on September 29, 1996. View All Seasons Social Reviews  0 Discussions  0 Media Most Popular Videos  0 Backdrops  1 Posters  1 Recommendations We don't have enough data to suggest any TV shows based on Once a Thief. You can help by rating TV shows you've seen. Facts Status  Ended Network Certification  - Type  Scripted Original Language  English Runtime  60m Homepage  - Genres Action & Adventure Drama Keywords canada secret government organization orphan Content Score 93 Almost there... Top Contributors 10 Banana z 10 zurman1 S 5 Shady12 s 3 speedycars  View Edit History Popularity Trend  Login to edit  URL By  signing up  for an account on TMDb, you can post directly to Twitter and Facebook. You need to be logged in to continue. Click  here  to login or  here  to sign up.    page_wrap opened in html_head  Join the Community The Basics About TMDb Contact Us Support Forums API Blog Get Involved  Contribution Bible 3rd Party Applications Add New Movie Add New TV Show Community Guidelines Leaderboard Forums Twitter Facebook Legal Terms of Use Privacy Policy Login Sign Up"
}