{
  "link": "https://www.themoviedb.org/tv/67357?language=en",
  "title": "Charlemagne",
  "resume": "We don't have an overview translated in English. Help us expand our database by adding one.",
  "rate": "0.0",
  "genre": [
    "Documentary"
  ],
  "cast": [
    "Erich Altenkopf",
    "Alexander W\u00fcst",
    "Peter Matic",
    "Regina Fritsch",
    "Alma Hasun"
  ],
  "character": [
    "Widukind",
    "Charlemagne",
    "Einhard",
    "Bertrada",
    "Hildegard"
  ],
  "site_data": "html Apps Forums Leaderboard Contribute API Support Discover Movies TV Shows Movies Popular Top Rated Upcoming Now Playing TV Shows Popular Top Rated On TV Airing Today People Popular People Can't find a movie or TV show? Login to create it. en Login Sign Up  ID: 67357   Expand Charlemagne   (2013) User Score Overview We don't have an overview translated in English. Help us expand our database by adding one. Discussions   Reviews Videos   Images   Changes Report Share Discussions General  0 Content Issues  1 Images Backdrops  1 Posters  5 Videos Trailers  0 Teasers  0 Clips  0 Featurettes  0 Opening Credits  0 Top Billed Cast Erich Altenkopf Widukind Alexander W\u00fcst Charlemagne Peter Matic Einhard Regina Fritsch Bertrada Alma Hasun Hildegard Full Cast & Crew Last Season Season 1 2013 | 3 Episodes Season 1 of Charlemagne premiered on April 20, 2013. View All Seasons Social Reviews  0 Discussions  1 Subject Status Replies Last Reply There are no discussions for Charlemagne. Login to be first! Go to Discussions Media Most Popular Videos  0 Backdrops  1 Posters  5 Recommendations We don't have enough data to suggest any TV shows based on Charlemagne. You can help by rating TV shows you've seen. Facts Original Name  Karl der Gro\u00dfe Status  Ended Networks - Certification  - Type  Miniseries Original Language  German Runtime  51m Homepage   https://www.globalscreen.de/content/show/108528 Genres Documentary Keywords biography charlemagne  history middle ages Content Score 79 Pump it up! We're close now. Top Contributors 42 waaw t 26 thyron TB 4 TMDb Bot 4 Jazzmind  View Edit History Popularity Trend  Login to edit  URL By  signing up  for an account on TMDb, you can post directly to Twitter and Facebook. You need to be logged in to continue. Click  here  to login or  here  to sign up.    page_wrap opened in html_head  Join the Community The Basics About TMDb Contact Us Support Forums API Blog Get Involved  Contribution Bible 3rd Party Applications Add New Movie Add New TV Show Community Guidelines Leaderboard Forums Twitter Facebook Legal Terms of Use Privacy Policy Login Sign Up"
}