{
  "link": "https://www.themoviedb.org/tv/9787?language=en",
  "title": "The Powers That Be",
  "resume": "The Powers That Be is an American television sitcom created by David Crane and Marta Kauffman that aired briefly on NBC from 1992 to 1993. Norman Lear served as executive producer for the show.",
  "rate": "0.0",
  "genre": [
    "Comedy"
  ],
  "cast": [
    "Elizabeth Berridge",
    "John Forsythe",
    "David Hyde Pierce",
    "Peter MacNicol",
    "Robin Bartlett"
  ],
  "character": [
    "Theodore Van Horne"
  ],
  "site_data": "html Apps Forums Leaderboard Contribute API Support Discover Movies TV Shows Movies Popular Top Rated Upcoming Now Playing TV Shows Popular Top Rated On TV Airing Today People Popular People Can't find a movie or TV show? Login to create it. en Login Sign Up  ID: 9787   Expand The Powers That Be   (1992) User Score Overview The Powers That Be is an American television sitcom created by David Crane and Marta Kauffman that aired briefly on NBC from 1992 to 1993. Norman Lear served as executive producer for the show. Featured Crew Marta Kauffman Creator David Crane Creator Discussions   Reviews Videos   Images   Changes Report Share Discussions General  0 Content Issues  0 Images Backdrops  0 Posters  1 Videos Trailers  0 Teasers  0 Clips  0 Featurettes  0 Opening Credits  0 Top Billed Cast Elizabeth Berridge John Forsythe David Hyde Pierce Theodore Van Horne Peter MacNicol Robin Bartlett Full Cast & Crew Last Season Season 2 1992 | 13 Episodes Season 2 of The Powers That Be premiered on November  7, 1992. View All Seasons Social Reviews  0 Discussions  0 Media Most Popular Videos  0 Backdrops  0 Posters  1 Recommendations We don't have enough data to suggest any TV shows based on The Powers That Be. You can help by rating TV shows you've seen. Facts Status  Ended Network Certification  - Type  Scripted Original Language  English Runtime  30m, 24m Homepage  - Genres Comedy Keywords washington d.c. politics u.s. senator sitcom usa politics Content Score 79 Pump it up! We're close now. Top Contributors 15 Banana  View Edit History Popularity Trend  Login to edit  URL By  signing up  for an account on TMDb, you can post directly to Twitter and Facebook. You need to be logged in to continue. Click  here  to login or  here  to sign up.    page_wrap opened in html_head  Join the Community The Basics About TMDb Contact Us Support Forums API Blog Get Involved  Contribution Bible 3rd Party Applications Add New Movie Add New TV Show Community Guidelines Leaderboard Forums Twitter Facebook Legal Terms of Use Privacy Policy Login Sign Up"
}