{
  "link": "https://www.themoviedb.org/tv/62438?language=en",
  "title": "Vive cantando",
  "resume": "We don't have an overview translated in English. Help us expand our database by adding one.",
  "rate": "",
  "genre": [
    "Comedy"
  ],
  "cast": {
    "actor": [
      "Mar\u00eda Castro",
      "Jos\u00e9 Luis Garc\u00eda P\u00e9rez",
      "Gorka Otxoa",
      "Mariola Fuentes",
      "Javier Cifri\u00e1n"
    ]
  },
  "characters": {
    "characters": [
      "Mar\u00eda Trinidad \"Trini\" Almagro L\u00f3pez",
      "Juan Jos\u00e9 \"Juanjo\" P\u00e9rez",
      "C\u00e9sar Campillo Garc\u00eda",
      "Candela",
      "Mariano Ben\u00edtez"
    ]
  },
  "site_data": "html Apps Forums Leaderboard Contribute API Support Discover Movies TV Shows Movies Popular Top Rated Upcoming Now Playing TV Shows Popular Top Rated On TV Airing Today People Popular People Can't find a movie or TV show? Login to create it. en Login Sign Up  ID: 62438   Expand Vive cantando   (2013) User Score Overview We don't have an overview translated in English. Help us expand our database by adding one. Discussions   Reviews Videos   Images   Changes Report Share Discussions General  0 Content Issues  0 Images Backdrops  11 Posters  2 Videos Trailers  0 Teasers  0 Clips  0 Featurettes  0 Opening Credits  0 Top Billed Cast Mar\u00eda Castro Mar\u00eda Trinidad \"Trini\" Almagro L\u00f3pez Jos\u00e9 Luis Garc\u00eda P\u00e9rez Juan Jos\u00e9 \"Juanjo\" P\u00e9rez Gorka Otxoa C\u00e9sar Campillo Garc\u00eda Mariola Fuentes Candela Javier Cifri\u00e1n Mariano Ben\u00edtez Full Cast & Crew Last Season Season 2 2014 | 10 Episodes Season 2 of Vive cantando premiered on September  2, 2014. View All Seasons Social Reviews  0 Discussions  0 Media Most Popular Videos  0 Backdrops  11 Posters  2 Recommendations We don't have enough data to suggest any TV shows based on Vive cantando. You can help by rating TV shows you've seen. Facts Status  Ended Networks - Certification  - Type  Scripted Original Language  Spanish; Castilian Runtime  75m Homepage   http://www.antena3.com/series/vive-cantando/ Genres Comedy Keywords karaoke singing neighborhood Content Score 79 Pump it up! We're close now. Top Contributors 54 prm96 N 5 NoemiTalavera CM 4 Cherche Moi p 1 pepeman  View Edit History Popularity Trend  Login to edit  URL By  signing up  for an account on TMDb, you can post directly to Twitter and Facebook. You need to be logged in to continue. Click  here  to login or  here  to sign up.    page_wrap opened in html_head  Join the Community The Basics About TMDb Contact Us Support Forums API Blog Get Involved  Contribution Bible 3rd Party Applications Add New Movie Add New TV Show Community Guidelines Leaderboard Forums Twitter Facebook Legal Terms of Use Privacy Policy Login Sign Up"
}