{
  "link": "https://www.themoviedb.org/tv/61599?language=en",
  "title": "The Librarians",
  "resume": "A group of librarians set off on adventures in an effort to save mysterious, ancient artifacts. Based on the series of \"The Librarian\" movies.",
  "rate": "66.0",
  "genre": [
    "Action",
    "Adventure"
  ],
  "cast": [
    "Rebecca Romijn",
    "Noah Wyle",
    "John Larroquette",
    "Christian Kane",
    "John Harlan Kim"
  ],
  "character": [
    "Eve Baird",
    "Flynn Carsen",
    "Jenkins",
    "Jake Stone",
    "Ezekiel Jones"
  ],
  "site_data": "html Apps Forums Leaderboard Contribute API Support Discover Movies TV Shows Movies Popular Top Rated Upcoming Now Playing TV Shows Popular Top Rated On TV Airing Today People Popular People Can't find a movie or TV show? Login to create it. en Login Sign Up  ID: 61599   Expand The Librarians   (2014) User Score  Play Trailer Overview A group of librarians set off on adventures in an effort to save mysterious, ancient artifacts. Based on the series of \"The Librarian\" movies. Featured Crew John Rogers Creator Discussions   Reviews Videos   Images   Changes Report Share Discussions General  6 Content Issues  2 Images Backdrops  6 Posters  11 Videos Trailers  1 Teasers  0 Clips  0 Featurettes  0 Opening Credits  0 Top Billed Cast Rebecca Romijn Eve Baird Noah Wyle Flynn Carsen John Larroquette Jenkins Christian Kane Jake Stone John Harlan Kim Ezekiel Jones Full Cast & Crew Current Season Season 4 2017 | 12 Episodes Season 4 of The Librarians premiered on December 13, 2017. View All Seasons Social Reviews  0 Discussions  8 Subject Status Replies Last Reply The Librarians Season 4 Premieres Dec 13th! Open 7 by  Taylorfirst1 w Eve: Happy Birthday Rebecca Romijn! Open 0 by wonder2wonder\n      \n     w Jake: Happy Birthday Christian Kane! Open 0 by wonder2wonder\n      \n     Go to Discussions Media Most Popular Videos  1 Backdrops  6 Posters  11 Recommendations   2009-07-07 Warehouse 13 7.2    2013-04-15 Defiance 6.2    2010-07-09 Haven 7.0    2014-09-22 Scorpion 6.7    2012-05-27 Continuum 7.1    2006-07-18 Eureka 7.4    2015-06-02 Stitchers 6.3    2015-01-06 Marvel's Agent Carter 7.5  Facts Status  Cancelled Network Certification TV-14 Meaning This program contains some material that many parents would find unsuitable for children under 14 years of age. Type  Scripted Original Language  English Runtime  43m, 60m Homepage   http://www.tntdrama.com/shows/the-librarians.html Genres Action & Adventure Keywords good vs evil library magic treasure hunt artifact archaeologist belief librarian fringe science knowledge Content Score 100 Yes! Looking good! Top Contributors 28 Elizabeth Jennings 21 CouchTater 15 muku555 11 david8s95  View Edit History Popularity Trend  Login to edit  URL By  signing up  for an account on TMDb, you can post directly to Twitter and Facebook. You need to be logged in to continue. Click  here  to login or  here  to sign up.    page_wrap opened in html_head  Join the Community The Basics About TMDb Contact Us Support Forums API Blog Get Involved  Contribution Bible 3rd Party Applications Add New Movie Add New TV Show Community Guidelines Leaderboard Forums Twitter Facebook Legal Terms of Use Privacy Policy Login Sign Up"
}