{
  "link": "https://www.themoviedb.org/tv/41755?language=en",
  "title": "Noi siamo angeli",
  "resume": "Italian television series.",
  "rate": "",
  "genre": [
    "Comedy",
    "Action",
    "Adventure"
  ],
  "cast": {
    "actor": [
      "Bud Spencer",
      "Philip Michael Thomas",
      "Marianna Mora",
      "Kabir Bedi",
      "Alfie Wise"
    ]
  },
  "characters": {
    "characters": [
      "Padre Orso, Bob Russel",
      "Padre Zack, Joe Thomas",
      "Lupita",
      "Napoleon",
      "John McQuade"
    ]
  },
  "site_data": "html Apps Forums Leaderboard Contribute API Support Discover Movies TV Shows Movies Popular Top Rated Upcoming Now Playing TV Shows Popular Top Rated On TV Airing Today People Popular People Can't find a movie or TV show? Login to create it. en Login Sign Up  ID: 41755   Expand Noi siamo angeli   (1997) User Score Overview Italian television series. Featured Crew Bud Spencer Creator Giuseppe Pedersoli Creator Discussions   Reviews Videos   Images   Changes Report Share Discussions General  0 Content Issues  0 Images Backdrops  4 Posters  9 Videos Trailers  0 Teasers  0 Clips  0 Featurettes  0 Opening Credits  0 Top Billed Cast Bud Spencer Padre Orso, Bob Russel Philip Michael Thomas Padre Zack, Joe Thomas Marianna Mora Lupita Kabir Bedi Napoleon Alfie Wise John McQuade Full Cast & Crew Last Season Season 1 1997 | 6 Episodes Season 1 of Noi siamo angeli premiered on February  9, 1997. View All Seasons Social Reviews  0 Discussions  0 Media Most Popular Videos  0 Backdrops  4 Posters  9 Recommendations We don't have enough data to suggest any TV shows based on Noi siamo angeli. You can help by rating TV shows you've seen. Facts Status  Ended Network Certification 12 Meaning The broadcaster must take the decision about the air time by taking in consideration the impact on young children in the timeframe from 6:00am to 8:00pm. Type  Scripted Original Language  Italian Runtime  - Homepage  - Genres Comedy Action & Adventure Keywords escaped prisoner Content Score 93 Almost there... Top Contributors 34 Erwin D. Glockner V 15 VLPhoenix 9 Banana RH 3 Ren\u00e9 Hasenbein  View Edit History Popularity Trend  Login to edit  URL By  signing up  for an account on TMDb, you can post directly to Twitter and Facebook. You need to be logged in to continue. Click  here  to login or  here  to sign up.    page_wrap opened in html_head  Join the Community The Basics About TMDb Contact Us Support Forums API Blog Get Involved  Contribution Bible 3rd Party Applications Add New Movie Add New TV Show Community Guidelines Leaderboard Forums Twitter Facebook Legal Terms of Use Privacy Policy Login Sign Up"
}