{
  "link": "https://www.themoviedb.org/tv/69847?language=en",
  "title": "Let It Shine",
  "resume": "Mel Giedroyc and Graham Norton present the talent search to find five performers to play the members of a fictional boyband in a new nationwide touring musical inspired by Take That.",
  "rate": "",
  "genre": [
    "Reality"
  ],
  "cast": {
    "actor": [
      "Gary Barlow",
      "Dannii Minogue",
      "Graham Norton",
      "Martin Kemp",
      "Mel Giedroyc"
    ]
  },
  "characters": {
    "characters": [
      "Judge",
      "Judge",
      "Presenter",
      "Judge",
      "Presenter"
    ]
  },
  "site_data": "html Apps Forums Leaderboard Contribute API Support Discover Movies TV Shows Movies Popular Top Rated Upcoming Now Playing TV Shows Popular Top Rated On TV Airing Today People Popular People Can't find a movie or TV show? Login to create it. en Login Sign Up  ID: 69847   Expand Let It Shine   (2017) User Score  Play Trailer Overview Mel Giedroyc and Graham Norton present the talent search to find five performers to play the members of a fictional boyband in a new nationwide touring musical inspired by Take That. Featured Crew Gary Barlow Creator Discussions   Reviews Videos   Images   Changes Report Share Discussions General  0 Content Issues  0 Images Backdrops  2 Posters  1 Videos Trailers  1 Teasers  0 Clips  0 Featurettes  0 Opening Credits  0 Top Billed Cast Gary Barlow Judge Dannii Minogue Judge Graham Norton Presenter Martin Kemp Judge Mel Giedroyc Presenter Full Cast & Crew Last Season Season 1 2017 | 5 Episodes View All Seasons Social Reviews  0 Discussions  0 Media Most Popular Videos  1 Backdrops  2 Posters  1 Recommendations We don't have enough data to suggest any TV shows based on Let It Shine. You can help by rating TV shows you've seen. Facts Status  In Production Network Certification U Meaning The U symbol stands for Universal. A U film should be suitable for audiences aged four years and over. Type  Reality Original Language  English Runtime  80m Homepage   http://www.bbc.co.uk/programmes/p04cm25y Genres Reality Keywords music competition Content Score 100 Yes! Looking good! Top Contributors 39 Unknown 4 Elizabeth Jennings TB 1 TMDb Bot 1 szab  View Edit History Popularity Trend  Login to edit  URL By  signing up  for an account on TMDb, you can post directly to Twitter and Facebook. You need to be logged in to continue. Click  here  to login or  here  to sign up.    page_wrap opened in html_head  Join the Community The Basics About TMDb Contact Us Support Forums API Blog Get Involved  Contribution Bible 3rd Party Applications Add New Movie Add New TV Show Community Guidelines Leaderboard Forums Twitter Facebook Legal Terms of Use Privacy Policy Login Sign Up"
}