{
  "link": "https://www.themoviedb.org/tv/61260?language=en",
  "title": "Velvet",
  "resume": "In 1950s Spain, the heir to a fashion house romances a beautiful seamstress who works for the company, despite the objections of his family.",
  "rate": "",
  "genre": [
    "Drama"
  ],
  "cast": {
    "actor": [
      "Paula Echevarr\u00eda",
      "Miguel \u00c1ngel Silvestre",
      "Aitana S\u00e1nchez-Gij\u00f3n",
      "Manuela Velasco",
      "Marta Hazas"
    ]
  },
  "characters": {
    "characters": [
      "Ana Rivera",
      "Alberto M\u00e1rquez",
      "Blanca Soto",
      "Cristina Otegui",
      "Clara Montesinos"
    ]
  },
  "site_data": "html Apps Forums Leaderboard Contribute API Support Discover Movies TV Shows Movies Popular Top Rated Upcoming Now Playing TV Shows Popular Top Rated On TV Airing Today People Popular People Can't find a movie or TV show? Login to create it. en Login Sign Up  ID: 61260   Expand Velvet   (2014) User Score Overview In 1950s Spain, the heir to a fashion house romances a beautiful seamstress who works for the company, despite the objections of his family. Featured Crew Ram\u00f3n Campos Creator Gema R. Neira Creator Discussions   Reviews Videos   Images   Changes Report Share Discussions General  0 Content Issues  2 Images Backdrops  8 Posters  5 Videos Trailers  0 Teasers  0 Clips  0 Featurettes  0 Opening Credits  0 Top Billed Cast Paula Echevarr\u00eda Ana Rivera Miguel \u00c1ngel Silvestre Alberto M\u00e1rquez Aitana S\u00e1nchez-Gij\u00f3n Blanca Soto Manuela Velasco Cristina Otegui Marta Hazas Clara Montesinos Full Cast & Crew Last Season Season 4 2016 | 11 Episodes Season 4 of Velvet premiered on October  5, 2016. View All Seasons Social Reviews  0 Discussions  2 Subject Status Replies Last Reply There are no discussions for Velvet. Login to be first! Go to Discussions Media Most Popular Videos  0 Backdrops  8 Posters  5 Recommendations   2011-05-10 Grand Hotel 7.4    2003-07-06 Pasi\u00f3n de gavilanes 5.6    2011-03-07 Crematorio 7.7    2010-06-08 Pretty Little Liars 6.2    2015-10-26 Supergirl 5.7    2005-09-13 Supernatural 7.2  Facts Status  Returning Series Network Certification  - Type  Scripted Original Language  Spanish; Castilian Runtime  90m Homepage   http://www.antena3.com/series/velvet/ Genres Drama Keywords spain gallery clothing gallery owner europe dressmaker fashion designer love wealth fashion fashion design impossible love seamstress 1950s Content Score 93 Almost there... Top Contributors 86 prm96 25 Elizabeth Jennings 16 SaberA 7 david8s95  View Edit History Popularity Trend  Login to edit  URL By  signing up  for an account on TMDb, you can post directly to Twitter and Facebook. You need to be logged in to continue. Click  here  to login or  here  to sign up.    page_wrap opened in html_head  Join the Community The Basics About TMDb Contact Us Support Forums API Blog Get Involved  Contribution Bible 3rd Party Applications Add New Movie Add New TV Show Community Guidelines Leaderboard Forums Twitter Facebook Legal Terms of Use Privacy Policy Login Sign Up"
}