{
  "link": "https://www.themoviedb.org/tv/61940?language=en",
  "title": "The Casual Vacancy",
  "resume": "The citizens of the small British town of Pagford fight for the spot on the parish council after Barry Fairbrother dies.",
  "rate": "60.0",
  "genre": [
    "Drama"
  ],
  "cast": [
    "Michael Gambon",
    "Keeley Hawes",
    "Rufus Jones",
    "Rory Kinnear",
    "Julia McKenzie"
  ],
  "character": [
    "Howard Mollison",
    "Samantha Mollison",
    "Miles Mollison",
    "Barry Fairbrother",
    "Shirley Mollison"
  ],
  "site_data": "html Apps Forums Leaderboard Contribute API Support Discover Movies TV Shows Movies Popular Top Rated Upcoming Now Playing TV Shows Popular Top Rated On TV Airing Today People Popular People Can't find a movie or TV show? Login to create it. en Login Sign Up  ID: 61940   Expand The Casual Vacancy   (2015) User Score  Play Trailer Overview The citizens of the small British town of Pagford fight for the spot on the parish council after Barry Fairbrother dies. Featured Crew J.K. Rowling Creator Discussions   Reviews Videos   Images   Changes Report Share Discussions General  0 Content Issues  0 Images Backdrops  2 Posters  5 Videos Trailers  1 Teasers  0 Clips  1 Featurettes  0 Opening Credits  0 Top Billed Cast Michael Gambon Howard Mollison Keeley Hawes Samantha Mollison Rufus Jones Miles Mollison Rory Kinnear Barry Fairbrother Julia McKenzie Shirley Mollison Full Cast & Crew Last Season Season 1 2015 | 3 Episodes View All Seasons Social Reviews  0 Discussions  0 Media Most Popular Videos  2 Backdrops  2 Posters  5 Recommendations We don't have enough data to suggest any TV shows based on The Casual Vacancy. You can help by rating TV shows you've seen. Facts Status  Ended Network Certification 15 Meaning No-one under 15 is allowed to see a 15 film at the cinema or buy/rent a 15 rated video. 15 rated works are not suitable for children under 15 years of age. Type  Miniseries Original Language  English Runtime  60m Homepage   http://www.bbc.co.uk/programmes/p02h1mb6 Genres Drama Keywords small town based on novel or book england british miniseries Content Score 100 Yes! Looking good! Top Contributors 25 Elizabeth Jennings 8 efeka 8 Banana 7 Steve  View Edit History Popularity Trend  Login to edit  URL By  signing up  for an account on TMDb, you can post directly to Twitter and Facebook. You need to be logged in to continue. Click  here  to login or  here  to sign up.    page_wrap opened in html_head  Join the Community The Basics About TMDb Contact Us Support Forums API Blog Get Involved  Contribution Bible 3rd Party Applications Add New Movie Add New TV Show Community Guidelines Leaderboard Forums Twitter Facebook Legal Terms of Use Privacy Policy Login Sign Up"
}